{
  "agent_name": "Agent6_FAQ",
  "model": "google/gemini-2.5-flash-preview-09-2025",
  "timestamp": "20251005_165127",
  "image_count": 0,
  "temperature": 0.2,
  "system_prompt": "# 角色定位\n\n你是**李师傅**，一位拥有20年安全管理经验的高级安全工程师。\n\n## 教育背景\n\n- **学历**：安全工程专业本科\n- **职业资格**：注册安全工程师、高级安全评价师\n- **专业培训**：\n  - 机械制造安全管理\n  - 职业健康与安全管理体系（ISO 45001）\n  - 事故调查与分析\n  - 应急预案编制与演练\n\n## 职业背景\n\n- **工作经历**：20年机械制造企业安全管理经验，参与过大型装备制造、钢结构加工等项目\n- **专业领域**：\n  - 机械加工安全（车、铣、刨、磨、钻等）\n  - 焊接作业安全（电焊、气焊、氩弧焊等）\n  - 起重吊装安全（行车、叉车、吊索具等）\n  - 高空作业安全（脚手架、安全带、防坠落等）\n  - 个人防护用品管理（安全帽、防护眼镜、手套、安全鞋等）\n\n## 知识结构（详细）\n\n### 1. 机械伤害风险\n- **夹伤/挤伤**：手指、手臂被运动部件夹住\n- **切割伤**：锋利边缘、毛刺、切削工具\n- **碰撞伤**：头部碰撞、身体碰撞\n- **坠落伤**：零件坠落、工具坠落、人员坠落\n\n### 2. 焊接作业风险\n- **电击伤**：焊机漏电、接地不良\n- **弧光伤**：电弧紫外线灼伤眼睛和皮肤\n- **烫伤**：高温熔池、焊渣飞溅\n- **火灾爆炸**：易燃物引燃、气瓶泄漏\n- **有毒气体**：焊接烟尘、一氧化碳中毒\n\n### 3. 起重吊装风险\n- **吊物坠落**：吊索具断裂、捆绑不牢\n- **吊物摆动**：碰撞人员、设备\n- **超载**：超过起重机额定载荷\n- **指挥失误**：信号不清、违章指挥\n\n### 4. 高空作业风险\n- **人员坠落**：未系安全带、脚手架不牢\n- **物体打击**：工具、零件从高处坠落\n- **脚手架坍塌**：搭设不规范、超载\n\n### 5. 个人防护用品\n- **头部防护**：安全帽（防止碰撞、坠物打击）\n- **眼部防护**：防护眼镜、焊接面罩（防止飞溅、弧光）\n- **手部防护**：防护手套（防止切割、烫伤、化学品）\n- **足部防护**：安全鞋（防砸、防刺穿、防滑）\n- **呼吸防护**：防尘口罩、防毒面具（防止粉尘、有毒气体）\n\n### 6. 应急处理\n- **机械伤害**：立即停机、呼救、止血、固定、送医\n- **电击伤**：切断电源、心肺复苏、送医\n- **烫伤**：冷水冲洗、覆盖无菌纱布、送医\n- **火灾**：使用灭火器、疏散人员、报警\n\n## 任务步骤（Chain of Thought）\n\n你的任务是**为每个装配步骤添加安全警告**（如果该步骤有安全风险）。请按照以下5个步骤思考：\n\n### 步骤1：识别风险步骤\n- 分析每个装配步骤的操作内容\n- 判断是否涉及高风险作业（焊接、吊装、高空、重物搬运等）\n- 识别潜在的伤害类型（机械伤害、电击、烫伤、坠落等）\n\n### 步骤2：分析风险源\n- 确定风险的来源（设备、工具、材料、环境、人员操作等）\n- 评估风险的严重程度（轻微、中等、严重、致命）\n- 考虑风险的发生概率\n\n### 步骤3：制定预防措施\n- 针对每个风险源，制定具体的预防措施\n- 强调个人防护用品的使用\n- 强调安全操作规程的遵守\n\n### 步骤4：添加安全警告\n- 为每个有风险的步骤添加safety_warnings字段\n- 每条警告要简洁明了，说明具体的风险和预防措施\n- 使用工人能看懂的语言\n\n### 步骤5：验证完整性\n- 检查所有高风险步骤是否都添加了安全警告\n- 检查安全警告是否具体、可操作\n- 检查是否遗漏了任何潜在风险\n\n## 核心原则\n\n1. **步骤级嵌入**：为每个有风险的步骤添加safety_warnings字段，而不是单独列出安全警告\n2. **工人友好**：使用通俗语言，避免专业术语\n3. **具体可操作**：说明具体的风险和预防措施，而不是泛泛而谈\n4. **不重复显示**：安全警告只在下方\"安全\"标签页中统一显示，不在当前步骤详情中重复显示\n\n## 输出格式\n\n严格按照以下JSON格式输出（返回增强后的装配步骤）：\n\n```json\n{\n  \"enhanced_steps\": [\n    {\n      \"step_number\": 1,\n      \"title\": \"点焊定位\",\n      \"parts_used\": [...],\n      \"tools_required\": [...],\n      \"operation\": \"操作说明\",\n      \"quality_check\": \"质量检查\",\n      \"estimated_time_minutes\": 10,\n      \"welding\": {\n        \"required\": true,\n        \"welding_type\": \"点焊\",\n        \"welding_method\": \"CO2气保焊\",\n        ...\n      },\n      \"safety_warnings\": [\n        \"佩戴焊接面罩和防护手套，防止弧光灼伤眼睛和皮肤\",\n        \"确保工件夹紧牢固，防止点焊时位移造成伤害\",\n        \"焊接区域周围3米内不得有易燃物，配备灭火器\",\n        \"焊机必须接地良好，防止漏电触电\"\n      ]\n    },\n    {\n      \"step_number\": 2,\n      \"title\": \"螺栓连接\",\n      \"parts_used\": [...],\n      \"operation\": \"操作说明\",\n      \"quality_check\": \"质量检查\",\n      \"estimated_time_minutes\": 15,\n      \"safety_warnings\": [\n        \"佩戴安全帽和防护眼镜，防止零件坠落和飞溅\",\n        \"使用扭力扳手时注意力度，防止扳手滑脱伤人\"\n      ]\n    },\n    {\n      \"step_number\": 3,\n      \"title\": \"简单装配\",\n      \"parts_used\": [...],\n      \"operation\": \"操作说明\",\n      \"quality_check\": \"质量检查\",\n      \"estimated_time_minutes\": 5\n      // ⚠️ 如果没有明显安全风险，不添加safety_warnings字段\n    }\n  ]\n}\n```\n\n**⚠️ 关键要求**：\n\n1. **步骤级嵌入**：\n   - 为每个有风险的步骤添加`safety_warnings`字段\n   - 没有明显风险的步骤不添加`safety_warnings`字段\n   - 保持原有步骤的所有字段不变\n\n2. **安全警告要具体**：\n   - ✅ 说\"佩戴焊接面罩和防护手套，防止弧光灼伤眼睛和皮肤\"\n   - ❌ 不说\"注意安全\"\n   - ✅ 说\"焊接区域周围3米内不得有易燃物，配备灭火器\"\n   - ❌ 不说\"注意防火\"\n\n3. **使用通俗语言**：\n   - 工人能看懂的语言\n   - 避免专业术语和英文缩写\n\n4. **警告要全面**：\n   - 涵盖个人防护、设备安全、环境安全、操作安全\n   - 每条警告说明具体的风险和预防措施\n\n## 重要提醒\n\n- **只输出JSON，不要输出其他内容**\n- **保持原有字段不变**：不要修改或删除原有的字段（包括welding字段）\n- **警告要简洁明了**：每条警告一句话，说明风险和预防措施\n- **不要过度警告**：只针对有明显风险的步骤添加警告\n",
  "user_query": "请为以下装配步骤添加安全警告（如果有安全风险）。\n\n## 📸 视觉分析任务\n\n**你会看到工程图纸图片，请仔细观察：**\n\n1. **危险作业标识**：\n   - 图纸上的安全警告标识\n   - 特殊作业要求（如高空作业、吊装作业等）\n   - 危险区域标注\n\n2. **零件特征**：\n   - 重型零件（需要吊装）\n   - 锋利边缘（容易割伤）\n   - 高温部件（容易烫伤）\n\n3. **作业环境**：\n   - 狭窄空间（容易碰撞）\n   - 高空位置（容易坠落）\n   - 密闭空间（通风不良）\n\n## 装配步骤\n\n[\n  {\n    \"step_number\": 1,\n    \"action\": \"放置基准件\",\n    \"description\": \"使用行车将图纸上标注为1号的方形板-机加（01.01.01.11511）吊装至焊接工作台上，作为装配基准件。确保板面水平。\",\n    \"position_description\": \"工作台中央，板面水平放置\",\n    \"parts_used\": [\n      {\n        \"bom_seq\": \"1\",\n        \"bom_name\": \"方形板-机加 1\",\n        \"quantity\": 1,\n        \"drawing_number\": \"1\",\n        \"node_name\": [\n          \"NAUO1\"\n        ],\n        \"bom_code\": \"01.01.01.11511\"\n      }\n    ],\n    \"tools\": [\n      \"行车\",\n      \"吊具\",\n      \"水平仪\"\n    ],\n    \"warnings\": [\n      \"方形板较重（15.79kg），吊装时注意安全，确保吊具牢固。\",\n      \"基准件必须放置平稳，确保后续焊接精度。\"\n    ]\n  },\n  {\n    \"step_number\": 2,\n    \"action\": \"安装上连接板\",\n    \"description\": \"将图纸上标注为2号的上连接板（01.01.01.11512）放置在1号方形板的上方，按照图纸尺寸（如436mm、471mm）进行定位。先进行点焊固定。\",\n    \"position_description\": \"安装在1号方形板的顶部边缘，确保连接板的孔位方向与图纸一致。\",\n    \"parts_used\": [\n      {\n        \"bom_seq\": \"2\",\n        \"bom_name\": \"上连接板 2\",\n        \"quantity\": 2,\n        \"drawing_number\": \"2\",\n        \"node_name\": [\n          \"NAUO3\",\n          \"NAUO2\"\n        ],\n        \"bom_code\": \"01.01.01.11512\"\n      }\n    ],\n    \"tools\": [\n      \"卷尺\",\n      \"角尺\",\n      \"点焊机\"\n    ],\n    \"warnings\": [\n      \"上连接板（2号）的两个零件必须对称安装，确保孔位对齐。\",\n      \"点焊时注意焊接电流，防止烧穿。\"\n    ],\n    \"welding\": {\n      \"required\": true,\n      \"welding_type\": \"角焊（定位焊）\",\n      \"welding_method\": \"CO2气保焊\",\n      \"weld_size\": \"点焊长度10-15mm，焊脚高度3mm\",\n      \"welding_position\": \"零件1（方形板）与零件2（上连接板）的连接处，平焊\",\n      \"quality_requirements\": \"点焊牢固，定位准确，焊点无裂纹，点焊位置应避开后续满焊区域的起始点。\",\n      \"safety_notes\": \"佩戴焊接面罩和防护手套，确保工作区域通风良好，防止烟尘吸入。\"\n    }\n  },\n  {\n    \"step_number\": 3,\n    \"action\": \"安装侧连接板\",\n    \"description\": \"将图纸上标注为3号的侧连接板（01.01.01.11513）分别安装在1号方形板的两侧，与2号上连接板形成直角结构。根据图纸尺寸进行定位，并进行点焊固定。\",\n    \"position_description\": \"安装在1号方形板的左右两侧边缘。\",\n    \"parts_used\": [\n      {\n        \"bom_seq\": \"3\",\n        \"bom_name\": \"侧连接板 2\",\n        \"quantity\": 2,\n        \"drawing_number\": \"3\",\n        \"node_name\": [\n          \"NAUO5\",\n          \"NAUO4\"\n        ],\n        \"bom_code\": \"01.01.01.11513\"\n      }\n    ],\n    \"tools\": [\n      \"卷尺\",\n      \"角尺\",\n      \"点焊机\"\n    ],\n    \"warnings\": [\n      \"侧连接板（3号）是主要承重件，定位时必须保证与1号板的垂直度，误差小于1mm/m。\"\n    ],\n    \"welding\": {\n      \"required\": true,\n      \"welding_type\": \"角焊（定位焊）\",\n      \"welding_method\": \"CO2气保焊\",\n      \"weld_size\": \"点焊长度10-15mm，焊脚高度3mm\",\n      \"welding_position\": \"零件1（方形板）与零件3（侧连接板）的连接处，平焊/横焊\",\n      \"quality_requirements\": \"点焊位置对称分布，确保结构稳定，点焊后检查垂直度。\",\n      \"safety_notes\": \"点焊前清理连接处的油污和锈蚀，防止产生气孔。注意防止电弧灼伤皮肤。\"\n    }\n  },\n  {\n    \"step_number\": 4,\n    \"action\": \"安装折弯板\",\n    \"description\": \"将图纸上标注为4号的折弯板（01.01.01.11514）安装在主体结构的底部，位于两个3号侧连接板之间。对齐孔位后进行点焊固定。\",\n    \"position_description\": \"安装在1号方形板的底部，连接两个3号侧连接板。\",\n    \"parts_used\": [\n      {\n        \"bom_seq\": \"4\",\n        \"bom_name\": \"折弯板 1\",\n        \"quantity\": 1,\n        \"drawing_number\": \"4\",\n        \"node_name\": [\n          \"NAUO6\"\n        ],\n        \"bom_code\": \"01.01.01.11514\"\n      }\n    ],\n    \"tools\": [\n      \"卷尺\",\n      \"点焊机\"\n    ],\n    \"warnings\": [\n      \"折弯板（4号）的安装位置需确保与侧连接板的底部边缘平齐。\"\n    ],\n    \"welding\": {\n      \"required\": true,\n      \"welding_type\": \"角焊（定位焊）\",\n      \"welding_method\": \"CO2气保焊\",\n      \"weld_size\": \"点焊长度10mm，焊脚高度3mm\",\n      \"welding_position\": \"零件3（侧连接板）与零件4（折弯板）的连接处，平焊\",\n      \"quality_requirements\": \"点焊牢固，确保折弯板与侧连接板的相对位置准确。\",\n      \"safety_notes\": \"检查焊机接地线连接可靠，防止触电事故。\"\n    }\n  },\n  {\n    \"step_number\": 5,\n    \"action\": \"安装油缸固定板\",\n    \"description\": \"将图纸上标注为5号的油缸固定板（01.01.01.11515）安装在3号侧连接板的内侧，靠近底部位置。根据图纸上的孔位和尺寸（如294mm、485mm）进行精确对位，并进行点焊固定。\",\n    \"position_description\": \"安装在两个3号侧连接板的内侧，每侧安装两块，共四块。\",\n    \"parts_used\": [\n      {\n        \"bom_seq\": \"5\",\n        \"bom_name\": \"油缸固定板 4\",\n        \"quantity\": 4,\n        \"drawing_number\": \"5\",\n        \"node_name\": [\n          \"NAUO17\",\n          \"NAUO16\",\n          \"NAUO8\",\n          \"NAUO7\"\n        ],\n        \"bom_code\": \"01.01.01.11515\"\n      }\n    ],\n    \"tools\": [\n      \"卷尺\",\n      \"游标卡尺\",\n      \"点焊机\"\n    ],\n    \"warnings\": [\n      \"油缸固定板（5号）的孔位是关键尺寸，必须保证与侧连接板上的孔位同轴度，确保后续油缸安装顺畅。\"\n    ],\n    \"welding\": {\n      \"required\": true,\n      \"welding_type\": \"角焊（定位焊）\",\n      \"welding_method\": \"CO2气保焊\",\n      \"weld_size\": \"点焊长度10mm，焊脚高度3mm\",\n      \"welding_position\": \"零件3（侧连接板）与零件5（油缸固定板）的连接处，立焊/横焊\",\n      \"quality_requirements\": \"定位焊后，再次检查油缸固定板的孔位尺寸和同轴度，确保精度。\",\n      \"safety_notes\": \"由于是内侧焊接，操作空间较小，注意焊枪角度，防止烫伤。\"\n    }\n  },\n  {\n    \"step_number\": 6,\n    \"action\": \"安装加强板\",\n    \"description\": \"将图纸上标注为6号的加强板（01.01.01.11516）安装在2号上连接板和3号侧连接板的连接处，用于加强结构强度。根据图纸尺寸进行定位，并进行点焊固定。\",\n    \"position_description\": \"安装在主体结构的上部内侧，连接2号板和3号板。\",\n    \"parts_used\": [\n      {\n        \"bom_seq\": \"6\",\n        \"bom_name\": \"加强板 4\",\n        \"quantity\": 4,\n        \"drawing_number\": \"6\",\n        \"node_name\": [\n          \"NAUO12\",\n          \"NAUO11\",\n          \"NAUO10\",\n          \"NAUO9\"\n        ],\n        \"bom_code\": \"01.01.01.11516\"\n      }\n    ],\n    \"tools\": [\n      \"卷尺\",\n      \"点焊机\"\n    ],\n    \"warnings\": [\n      \"加强板（6号）的安装位置应避开后续的满焊区域，确保焊缝连续性。\"\n    ],\n    \"welding\": {\n      \"required\": true,\n      \"welding_type\": \"角焊（定位焊）\",\n      \"welding_method\": \"CO2气保焊\",\n      \"weld_size\": \"点焊长度10mm，焊脚高度3mm\",\n      \"welding_position\": \"零件2（上连接板）与零件3（侧连接板）与零件6（加强板）的连接处，平焊/横焊\",\n      \"quality_requirements\": \"点焊牢固，确保加强板紧贴两个连接板，无间隙。\",\n      \"safety_notes\": \"注意加强板的定位焊点要小，避免应力集中。\"\n    }\n  },\n  {\n    \"step_number\": 7,\n    \"action\": \"安装角钢\",\n    \"description\": \"将图纸上标注为7号的角钢-机加（01.01.04.0592）安装在2号上连接板的顶部，用于支撑和连接。根据图纸尺寸进行定位，并进行点焊固定。\",\n    \"position_description\": \"安装在2号上连接板的顶部，靠近中心位置。\",\n    \"parts_used\": [\n      {\n        \"bom_seq\": \"7\",\n        \"bom_name\": \"角钢-机加 1\",\n        \"quantity\": 1,\n        \"drawing_number\": \"7\",\n        \"node_name\": [\n          \"NAUO13\"\n        ],\n        \"bom_code\": \"01.01.04.0592\"\n      }\n    ],\n    \"tools\": [\n      \"卷尺\",\n      \"点焊机\"\n    ],\n    \"warnings\": [\n      \"角钢（7号）的安装方向必须正确，确保其平面与2号板的平面垂直。\"\n    ],\n    \"welding\": {\n      \"required\": true,\n      \"welding_type\": \"角焊（定位焊）\",\n      \"welding_method\": \"CO2气保焊\",\n      \"weld_size\": \"点焊长度10mm，焊脚高度3mm\",\n      \"welding_position\": \"零件2（上连接板）与零件7（角钢）的连接处，平焊\",\n      \"quality_requirements\": \"定位焊后检查角钢的垂直度，确保支撑作用。\",\n      \"safety_notes\": \"角钢较小，点焊时注意控制电流，防止烧穿薄板。\"\n    }\n  },\n  {\n    \"step_number\": 8,\n    \"action\": \"安装轴套（上部）\",\n    \"description\": \"将图纸上标注为8号的轴套（01.01.02.1221）安装在2号上连接板的顶部孔位上。轴套需与孔位配合紧密，并进行点焊固定。\",\n    \"position_description\": \"安装在2号上连接板顶部的两个孔位上。\",\n    \"parts_used\": [\n      {\n        \"bom_seq\": \"8\",\n        \"bom_name\": \"轴套 1\",\n        \"quantity\": 1,\n        \"drawing_number\": \"8\",\n        \"node_name\": [\n          \"NAUO14\"\n        ],\n        \"bom_code\": \"01.01.02.1221\"\n      }\n    ],\n    \"tools\": [\n      \"点焊机\",\n      \"锤子（橡胶）\"\n    ],\n    \"warnings\": [\n      \"轴套（8号）安装后，其端面应与2号板的表面平齐或略微凸出（根据图纸要求）。\"\n    ],\n    \"welding\": {\n      \"required\": true,\n      \"welding_type\": \"角焊（定位焊）\",\n      \"welding_method\": \"CO2气保焊\",\n      \"weld_size\": \"点焊3-4点，焊脚高度3mm\",\n      \"welding_position\": \"零件2（上连接板）与零件8（轴套）的连接处，平焊\",\n      \"quality_requirements\": \"轴套定位焊后，检查轴套的垂直度，确保轴线与板面垂直。点焊不能影响轴套内孔精度。\",\n      \"safety_notes\": \"轴套是精密零件，点焊时要轻，避免热变形。焊接时注意保护轴套内孔，防止飞溅物进入。\"\n    }\n  },\n  {\n    \"step_number\": 9,\n    \"action\": \"安装后座轴套（下部）\",\n    \"description\": \"将图纸上标注为9号的后座轴套（01.02.02.0490）和10号的后座轴套（01.01.02.0337）分别安装在3号侧连接板的下部孔位上。轴套需与孔位配合紧密，并进行点焊固定。\",\n    \"position_description\": \"安装在3号侧连接板下部的两个孔位上。\",\n    \"parts_used\": [\n      {\n        \"bom_seq\": \"9\",\n        \"bom_name\": \"后座轴套 1\",\n        \"quantity\": 1,\n        \"drawing_number\": \"9\",\n        \"node_name\": [\n          \"NAUO15\"\n        ],\n        \"bom_code\": \"01.02.02.0490\"\n      },\n      {\n        \"bom_seq\": \"10\",\n        \"bom_name\": \"后座轴套 1\",\n        \"quantity\": 1,\n        \"drawing_number\": \"10\",\n        \"node_name\": [\n          \"NAUO18\"\n        ],\n        \"bom_code\": \"01.01.02.0337\"\n      }\n    ],\n    \"tools\": [\n      \"点焊机\",\n      \"锤子（橡胶）\"\n    ],\n    \"warnings\": [\n      \"轴套（9号和10号）安装后，必须保证其轴线与图纸要求的轴线同轴度，确保后续销轴的顺利安装。注意区分9号和10号轴套的安装位置。\"\n    ],\n    \"welding\": {\n      \"required\": true,\n      \"welding_type\": \"角焊（定位焊）\",\n      \"welding_method\": \"CO2气保焊\",\n      \"weld_size\": \"点焊3-4点，焊脚高度3mm\",\n      \"welding_position\": \"零件3（侧连接板）与零件9/10（后座轴套）的连接处，横焊/立焊\",\n      \"quality_requirements\": \"定位焊后，使用专用工装或卡尺检查轴套的同轴度，确保精度要求。轴套端面应与板面齐平。\",\n      \"safety_notes\": \"轴套焊接时，应使用小电流快速点焊，减少热量输入，防止轴套变形。注意区分9号和10号轴套的尺寸和位置。\"\n    }\n  },\n  {\n    \"step_number\": 10,\n    \"action\": \"满焊所有零件\",\n    \"description\": \"检查所有零件的点焊位置和尺寸无误后，按照'先内后外，先短后长，分散对称'的原则，对所有连接面进行满焊。焊缝尺寸和要求参照图纸技术要求。\",\n    \"position_description\": \"所有连接面\",\n    \"parts_used\": [],\n    \"tools\": [\n      \"CO2焊机\",\n      \"焊钳\",\n      \"焊渣锤\"\n    ],\n    \"warnings\": [\n      \"焊接过程中注意控制热输入，防止结构变形。焊接完成后，清除所有焊渣和飞溅物。\",\n      \"轴套（8、9、10号）的焊接必须保证焊缝均匀，且不能影响轴套内孔的精度。\"\n    ],\n    \"welding\": {\n      \"required\": true,\n      \"welding_type\": \"角焊/对接焊（满焊）\",\n      \"welding_method\": \"CO2气保焊（主要）/手工电弧焊（难达区域）\",\n      \"weld_size\": \"焊脚高度6mm（根据图纸标注），焊缝连续饱满\",\n      \"welding_position\": \"所有连接面，包括平焊、横焊、立焊、仰焊\",\n      \"quality_requirements\": \"焊缝外观成型良好，无气孔、夹渣、裂纹、未熔合等缺陷。焊后进行外观检查，关键承重焊缝（如零件1与3的连接）可能需要进行超声波或磁粉检测。\",\n      \"safety_notes\": \"满焊时热量大，必须穿戴全套防护服、面罩和手套。确保工作台周围无易燃物，并配备灭火器。焊接完成后，对轴套等精密部位进行冷却保护，防止热变形。\"\n    }\n  }\n]\n\n## 要求\n\n请按照以下5个步骤思考，为装配步骤添加安全警告：\n\n### 步骤1：识别风险步骤\n- 分析每个装配步骤的操作内容\n- 判断是否涉及高风险作业：\n  * **焊接作业**：电击、弧光、烫伤、火灾\n  * **吊装作业**：吊物坠落、碰撞、超载\n  * **高空作业**：人员坠落、物体打击\n  * **重物搬运**：砸伤、扭伤、夹伤\n  * **机械加工**：切割伤、夹伤、碰撞\n\n### 步骤2：分析风险源\n- 确定风险的来源（设备、工具、材料、环境、人员操作等）\n- 评估风险的严重程度（轻微、中等、严重、致命）\n- 考虑风险的发生概率\n\n### 步骤3：制定预防措施\n- 针对每个风险源，制定具体的预防措施\n- 强调个人防护用品的使用：\n  * **焊接**：焊接面罩、防护手套、防护服\n  * **吊装**：安全帽、安全鞋、手套\n  * **高空**：安全带、安全帽、防滑鞋\n  * **机械**：防护眼镜、手套、安全鞋\n\n### 步骤4：添加安全警告\n- 为每个有风险的步骤添加safety_warnings字段\n- 每条警告要简洁明了，说明具体的风险和预防措施\n- 使用工人能看懂的语言\n\n### 步骤5：验证完整性\n- 检查所有高风险步骤是否都添加了安全警告\n- 检查安全警告是否具体、可操作\n- 检查是否遗漏了任何潜在风险\n\n## ⚠️ 强制自检清单（生成后必须逐项检查）\n\n**在输出JSON之前，你必须完成以下验证：**\n\n1. **风险步骤识别验证**：\n   - [ ] 所有涉及焊接、吊装、高空、重物搬运的步骤都添加了safety_warnings字段\n   - [ ] 没有明显风险的步骤没有添加safety_warnings字段\n\n2. **安全警告完整性验证**：\n   - [ ] 每个safety_warnings字段都是字符串数组\n   - [ ] 每条警告都说明了具体的风险和预防措施\n   - [ ] 涵盖了个人防护、设备安全、环境安全、操作安全\n\n3. **语言通俗性验证**：\n   - [ ] 使用工人能看懂的语言\n   - [ ] 避免专业术语和英文缩写\n   - [ ] 每条警告简洁明了（一句话）\n\n4. **原有字段保持验证**：\n   - [ ] 原有步骤的所有字段都保持不变（包括welding字段）\n   - [ ] 没有修改或删除任何原有字段\n\n**如果自检发现任何问题，必须重新生成！**\n\n现在开始为装配步骤添加安全警告！\n",
  "raw_response": "```json\n{\n  \"enhanced_steps\": [\n    {\n      \"step_number\": 1,\n      \"action\": \"放置基准件\",\n      \"description\": \"使用行车将图纸上标注为1号的方形板-机加（01.01.01.11511）吊装至焊接工作台上，作为装配基准件。确保板面水平。\",\n      \"position_description\": \"工作台中央，板面水平放置\",\n      \"parts_used\": [\n        {\n          \"bom_seq\": \"1\",\n          \"bom_name\": \"方形板-机加 1\",\n          \"quantity\": 1,\n          \"drawing_number\": \"1\",\n          \"node_name\": [\n            \"NAUO1\"\n          ],\n          \"bom_code\": \"01.01.01.11511\"\n        }\n      ],\n      \"tools\": [\n        \"行车\",\n        \"吊具\",\n        \"水平仪\"\n      ],\n      \"warnings\": [\n        \"方形板较重（15.79kg），吊装时注意安全，确保吊具牢固。\",\n        \"基准件必须放置平稳，确保后续焊接精度。\"\n      ],\n      \"safety_warnings\": [\n        \"吊装前检查行车和吊索具是否完好，严禁超载吊装\",\n        \"吊装重物时，人员必须佩戴安全帽和防护手套，避免被吊物碰撞或砸伤\",\n        \"吊物下方严禁站人，指挥人员必须使用规范手势，确保信号清晰\"\n      ]\n    },\n    {\n      \"step_number\": 2,\n      \"action\": \"安装上连接板\",\n      \"description\": \"将图纸上标注为2号的上连接板（01.01.01.11512）放置在1号方形板的上方，按照图纸尺寸（如436mm、471mm）进行定位。先进行点焊固定。\",\n      \"position_description\": \"安装在1号方形板的顶部边缘，确保连接板的孔位方向与图纸一致。\",\n      \"parts_used\": [\n        {\n          \"bom_seq\": \"2\",\n          \"bom_name\": \"上连接板 2\",\n          \"quantity\": 2,\n          \"drawing_number\": \"2\",\n          \"node_name\": [\n            \"NAUO3\",\n            \"NAUO2\"\n          ],\n          \"bom_code\": \"01.01.01.11512\"\n        }\n      ],\n      \"tools\": [\n        \"卷尺\",\n        \"角尺\",\n        \"点焊机\"\n      ],\n      \"warnings\": [\n        \"上连接板（2号）的两个零件必须对称安装，确保孔位对齐。\",\n        \"点焊时注意焊接电流，防止烧穿。\"\n      ],\n      \"welding\": {\n        \"required\": true,\n        \"welding_type\": \"角焊（定位焊）\",\n        \"welding_method\": \"CO2气保焊\",\n        \"weld_size\": \"点焊长度10-15mm，焊脚高度3mm\",\n        \"welding_position\": \"零件1（方形板）与零件2（上连接板）的连接处，平焊\",\n        \"quality_requirements\": \"点焊牢固，定位准确，焊点无裂纹，点焊位置应避开后续满焊区域的起始点。\",\n        \"safety_notes\": \"佩戴焊接面罩和防护手套，确保工作区域通风良好，防止烟尘吸入。\"\n      },\n      \"safety_warnings\": [\n        \"进行点焊作业时，必须佩戴焊接面罩、防护手套和防护服，防止弧光灼伤和烫伤\",\n        \"确保焊机接地良好，电缆绝缘完好，防止触电事故\",\n        \"点焊区域必须清理干净，周围不得有易燃易爆物品，并配备灭火器\"\n      ]\n    },\n    {\n      \"step_number\": 3,\n      \"action\": \"安装侧连接板\",\n      \"description\": \"将图纸上标注为3号的侧连接板（01.01.01.11513）分别安装在1号方形板的两侧，与2号上连接板形成直角结构。根据图纸尺寸进行定位，并进行点焊固定。\",\n      \"position_description\": \"安装在1号方形板的左右两侧边缘。\",\n      \"parts_used\": [\n        {\n          \"bom_seq\": \"3\",\n          \"bom_name\": \"侧连接板 2\",\n          \"quantity\": 2,\n          \"drawing_number\": \"3\",\n          \"node_name\": [\n            \"NAUO5\",\n            \"NAUO4\"\n          ],\n          \"bom_code\": \"01.01.01.11513\"\n        }\n      ],\n      \"tools\": [\n        \"卷尺\",\n        \"角尺\",\n        \"点焊机\"\n      ],\n      \"warnings\": [\n        \"侧连接板（3号）是主要承重件，定位时必须保证与1号板的垂直度，误差小于1mm/m。\"\n      ],\n      \"welding\": {\n        \"required\": true,\n        \"welding_type\": \"角焊（定位焊）\",\n        \"welding_method\": \"CO2气保焊\",\n        \"weld_size\": \"点焊长度10-15mm，焊脚高度3mm\",\n        \"welding_position\": \"零件1（方形板）与零件3（侧连接板）的连接处，平焊/横焊\",\n        \"quality_requirements\": \"点焊位置对称分布，确保结构稳定，点焊后检查垂直度。\",\n        \"safety_notes\": \"点焊前清理连接处的油污和锈蚀，防止产生气孔。注意防止电弧灼伤皮肤。\"\n      },\n      \"safety_warnings\": [\n        \"点焊时注意防止焊渣飞溅，佩戴防护眼镜和面罩\",\n        \"操作点焊机时，确保身体不接触带电部位，防止触电\",\n        \"侧连接板边缘可能锋利，搬运和定位时应佩戴防护手套，防止割伤\"\n      ]\n    },\n    {\n      \"step_number\": 4,\n      \"action\": \"安装折弯板\",\n      \"description\": \"将图纸上标注为4号的折弯板（01.01.01.11514）安装在主体结构的底部，位于两个3号侧连接板之间。对齐孔位后进行点焊固定。\",\n      \"position_description\": \"安装在1号方形板的底部，连接两个3号侧连接板。\",\n      \"parts_used\": [\n        {\n          \"bom_seq\": \"4\",\n          \"bom_name\": \"折弯板 1\",\n          \"quantity\": 1,\n          \"drawing_number\": \"4\",\n          \"node_name\": [\n            \"NAUO6\"\n          ],\n          \"bom_code\": \"01.01.01.11514\"\n        }\n      ],\n      \"tools\": [\n        \"卷尺\",\n        \"点焊机\"\n      ],\n      \"warnings\": [\n        \"折弯板（4号）的安装位置需确保与侧连接板的底部边缘平齐。\"\n      ],\n      \"welding\": {\n        \"required\": true,\n        \"welding_type\": \"角焊（定位焊）\",\n        \"welding_method\": \"CO2气保焊\",\n        \"weld_size\": \"点焊长度10mm，焊脚高度3mm\",\n        \"welding_position\": \"零件3（侧连接板）与零件4（折弯板）的连接处，平焊\",\n        \"quality_requirements\": \"点焊牢固，确保折弯板与侧连接板的相对位置准确。\",\n        \"safety_notes\": \"检查焊机接地线连接可靠，防止触电事故。\"\n      },\n      \"safety_warnings\": [\n        \"折弯板边缘可能锋利，搬运时务必佩戴防割手套\",\n        \"点焊时注意控制焊接烟尘，确保局部排风设施正常运行\",\n        \"检查焊机接地线连接可靠，防止漏电触电\"\n      ]\n    },\n    {\n      \"step_number\": 5,\n      \"action\": \"安装油缸固定板\",\n      \"description\": \"将图纸上标注为5号的油缸固定板（01.01.01.11515）安装在3号侧连接板的内侧，靠近底部位置。根据图纸上的孔位和尺寸（如294mm、485mm）进行精确对位，并进行点焊固定。\",\n      \"position_description\": \"安装在两个3号侧连接板的内侧，每侧安装两块，共四块。\",\n      \"parts_used\": [\n        {\n          \"bom_seq\": \"5\",\n          \"bom_name\": \"油缸固定板 4\",\n          \"quantity\": 4,\n          \"drawing_number\": \"5\",\n          \"node_name\": [\n            \"NAUO17\",\n            \"NAUO16\",\n            \"NAUO8\",\n            \"NAUO7\"\n          ],\n          \"bom_code\": \"01.01.01.11515\"\n        }\n      ],\n      \"tools\": [\n        \"卷尺\",\n        \"游标卡尺\",\n        \"点焊机\"\n      ],\n      \"warnings\": [\n        \"油缸固定板（5号）的孔位是关键尺寸，必须保证与侧连接板上的孔位同轴度，确保后续油缸安装顺畅。\"\n      ],\n      \"welding\": {\n        \"required\": true,\n        \"welding_type\": \"角焊（定位焊）\",\n        \"welding_method\": \"CO2气保焊\",\n        \"weld_size\": \"点焊长度10mm，焊脚高度3mm\",\n        \"welding_position\": \"零件3（侧连接板）与零件5（油缸固定板）的连接处，立焊/横焊\",\n        \"quality_requirements\": \"定位焊后，再次检查油缸固定板的孔位尺寸和同轴度，确保精度。\",\n        \"safety_notes\": \"由于是内侧焊接，操作空间较小，注意焊枪角度，防止烫伤。\"\n      },\n      \"safety_warnings\": [\n        \"在结构内侧进行焊接时，操作空间狭小，注意身体姿势，防止焊枪或高温部件烫伤身体\",\n        \"确保通风良好，防止焊接烟尘在狭小空间内聚集，造成窒息或中毒\",\n        \"佩戴防护眼镜，防止焊渣飞溅到眼睛\"\n      ]\n    },\n    {\n      \"step_number\": 6,\n      \"action\": \"安装加强板\",\n      \"description\": \"将图纸上标注为6号的加强板（01.01.01.11516）安装在2号上连接板和3号侧连接板的连接处，用于加强结构强度。根据图纸尺寸进行定位，并进行点焊固定。\",\n      \"position_description\": \"安装在主体结构的上部内侧，连接2号板和3号板。\",\n      \"parts_used\": [\n        {\n          \"bom_seq\": \"6\",\n          \"bom_name\": \"加强板 4\",\n          \"quantity\": 4,\n          \"drawing_number\": \"6\",\n          \"node_name\": [\n            \"NAUO12\",\n            \"NAUO11\",\n            \"NAUO10\",\n            \"NAUO9\"\n          ],\n          \"bom_code\": \"01.01.01.11516\"\n        }\n      ],\n      \"tools\": [\n        \"卷尺\",\n        \"点焊机\"\n      ],\n      \"warnings\": [\n        \"加强板（6号）的安装位置应避开后续的满焊区域，确保焊缝连续性。\"\n      ],\n      \"welding\": {\n        \"required\": true,\n        \"welding_type\": \"角焊（定位焊）\",\n        \"welding_method\": \"CO2气保焊\",\n        \"weld_size\": \"点焊长度10mm，焊脚高度3mm\",\n        \"welding_position\": \"零件2（上连接板）与零件3（侧连接板）与零件6（加强板）的连接处，平焊/横焊\",\n        \"quality_requirements\": \"点焊牢固，确保加强板紧贴两个连接板，无间隙。\",\n        \"safety_notes\": \"注意加强板的定位焊点要小，避免应力集中。\"\n      },\n      \"safety_warnings\": [\n        \"加强板边缘可能锋利，操作时佩戴防割手套，防止割伤\",\n        \"点焊时注意控制电流，防止因热量过大导致板材变形或烧穿\"\n      ]\n    },\n    {\n      \"step_number\": 7,\n      \"action\": \"安装角钢\",\n      \"description\": \"将图纸上标注为7号的角钢-机加（01.01.04.0592）安装在2号上连接板的顶部，用于支撑和连接。根据图纸尺寸进行定位，并进行点焊固定。\",\n      \"position_description\": \"安装在2号上连接板的顶部，靠近中心位置。\",\n      \"parts_used\": [\n        {\n          \"bom_seq\": \"7\",\n          \"bom_name\": \"角钢-机加 1\",\n          \"quantity\": 1,\n          \"drawing_number\": \"7\",\n          \"node_name\": [\n            \"NAUO13\"\n          ],\n          \"bom_code\": \"01.01.04.0592\"\n        }\n      ],\n      \"tools\": [\n        \"卷尺\",\n        \"点焊机\"\n      ],\n      \"warnings\": [\n        \"角钢（7号）的安装方向必须正确，确保其平面与2号板的平面垂直。\"\n      ],\n      \"welding\": {\n        \"required\": true,\n        \"welding_type\": \"角焊（定位焊）\",\n        \"welding_method\": \"CO2气保焊\",\n        \"weld_size\": \"点焊长度10mm，焊脚高度3mm\",\n        \"welding_position\": \"零件2（上连接板）与零件7（角钢）的连接处，平焊\",\n        \"quality_requirements\": \"定位焊后检查角钢的垂直度，确保支撑作用。\",\n        \"safety_notes\": \"角钢较小，点焊时注意控制电流，防止烧穿薄板。\"\n      },\n      \"safety_warnings\": [\n        \"角钢零件较小，定位时注意夹紧，防止点焊时飞出伤人\",\n        \"点焊时使用小电流，防止烧穿角钢薄壁或造成大面积热变形\"\n      ]\n    },\n    {\n      \"step_number\": 8,\n      \"action\": \"安装轴套（上部）\",\n      \"description\": \"将图纸上标注为8号的轴套（01.01.02.1221）安装在2号上连接板的顶部孔位上。轴套需与孔位配合紧密，并进行点焊固定。\",\n      \"position_description\": \"安装在2号上连接板顶部的两个孔位上。\",\n      \"parts_used\": [\n        {\n          \"bom_seq\": \"8\",\n          \"bom_name\": \"轴套 1\",\n          \"quantity\": 1,\n          \"drawing_number\": \"8\",\n          \"node_name\": [\n            \"NAUO14\"\n          ],\n          \"bom_code\": \"01.01.02.1221\"\n        }\n      ],\n      \"tools\": [\n        \"点焊机\",\n        \"锤子（橡胶）\"\n      ],\n      \"warnings\": [\n        \"轴套（8号）安装后，其端面应与2号板的表面平齐或略微凸出（根据图纸要求）。\"\n      ],\n      \"welding\": {\n        \"required\": true,\n        \"welding_type\": \"角焊（定位焊）\",\n        \"welding_method\": \"CO2气保焊\",\n        \"weld_size\": \"点焊3-4点，焊脚高度3mm\",\n        \"welding_position\": \"零件2（上连接板）与零件8（轴套）的连接处，平焊\",\n        \"quality_requirements\": \"轴套定位焊后，检查轴套的垂直度，确保轴线与板面垂直。点焊不能影响轴套内孔精度。\",\n        \"safety_notes\": \"轴套是精密零件，点焊时要轻，避免热变形。焊接时注意保护轴套内孔，防止飞溅物进入。\"\n      },\n      \"safety_warnings\": [\n        \"轴套是精密零件，点焊时必须使用小电流，防止热变形导致内孔精度丧失\",\n        \"焊接时应使用挡板或塞子保护轴套内孔，防止焊渣飞溅进入，影响后续装配\",\n        \"使用橡胶锤敲击轴套时，注意力度，防止反弹伤手\"\n      ]\n    },\n    {\n      \"step_number\": 9,\n      \"action\": \"安装后座轴套（下部）\",\n      \"description\": \"将图纸上标注为9号的后座轴套（01.02.02.0490）和10号的后座轴套（01.01.02.0337）分别安装在3号侧连接板的下部孔位上。轴套需与孔位配合紧密，并进行点焊固定。\",\n      \"position_description\": \"安装在3号侧连接板下部的两个孔位上。\",\n      \"parts_used\": [\n        {\n          \"bom_seq\": \"9\",\n          \"bom_name\": \"后座轴套 1\",\n          \"quantity\": 1,\n          \"drawing_number\": \"9\",\n          \"node_name\": [\n            \"NAUO15\"\n          ],\n          \"bom_code\": \"01.02.02.0490\"\n        },\n        {\n          \"bom_seq\": \"10\",\n          \"bom_name\": \"后座轴套 1\",\n          \"quantity\": 1,\n          \"drawing_number\": \"10\",\n          \"node_name\": [\n            \"NAUO18\"\n          ],\n          \"bom_code\": \"01.01.02.0337\"\n        }\n      ],\n      \"tools\": [\n        \"点焊机\",\n        \"锤子（橡胶）\"\n      ],\n      \"warnings\": [\n        \"轴套（9号和10号）安装后，必须保证其轴线与图纸要求的轴线同轴度，确保后续销轴的顺利安装。注意区分9号和10号轴套的安装位置。\"\n      ],\n      \"welding\": {\n        \"required\": true,\n        \"welding_type\": \"角焊（定位焊）\",\n        \"welding_method\": \"CO2气保焊\",\n        \"weld_size\": \"点焊3-4点，焊脚高度3mm\",\n        \"welding_position\": \"零件3（侧连接板）与零件9/10（后座轴套）的连接处，横焊/立焊\",\n        \"quality_requirements\": \"定位焊后，使用专用工装或卡尺检查轴套的同轴度，确保精度要求。轴套端面应与板面齐平。\",\n        \"safety_notes\": \"轴套焊接时，应使用小电流快速点焊，减少热量输入，防止轴套变形。注意区分9号和10号轴套的尺寸和位置。\"\n      },\n      \"safety_warnings\": [\n        \"轴套定位焊时，必须使用小电流和快速点焊，防止热变形影响轴套内孔精度\",\n        \"焊接完成后，轴套温度较高，严禁徒手触摸，防止烫伤\",\n        \"在结构下部进行焊接，注意焊渣和高温金属滴落，佩戴安全鞋和防护服\"\n      ]\n    },\n    {\n      \"step_number\": 10,\n      \"action\": \"满焊所有零件\",\n      \"description\": \"检查所有零件的点焊位置和尺寸无误后，按照'先内后外，先短后长，分散对称'的原则，对所有连接面进行满焊。焊缝尺寸和要求参照图纸技术要求。\",\n      \"position_description\": \"所有连接面\",\n      \"parts_used\": [],\n      \"tools\": [\n        \"CO2焊机\",\n        \"焊钳\",\n        \"焊渣锤\"\n      ],\n      \"warnings\": [\n        \"焊接过程中注意控制热输入，防止结构变形。焊接完成后，清除所有焊渣和飞溅物。\",\n        \"轴套（8、9、10号）的焊接必须保证焊缝均匀，且不能影响轴套内孔的精度。\"\n      ],\n      \"welding\": {\n        \"required\": true,\n        \"welding_type\": \"角焊/对接焊（满焊）\",\n        \"welding_method\": \"CO2气保焊（主要）/手工电弧焊（难达区域）\",\n        \"weld_size\": \"焊脚高度6mm（根据图纸标注），焊缝连续饱满\",\n        \"welding_position\": \"所有连接面，包括平焊、横焊、立焊、仰焊\",\n        \"quality_requirements\": \"焊缝外观成型良好，无气孔、夹渣、裂纹、未熔合等缺陷。焊后进行外观检查，关键承重焊缝（如零件1与3的连接）可能需要进行超声波或磁粉检测。\",\n        \"safety_notes\": \"满焊时热量大，必须穿戴全套防护服、面罩和手套。确保工作台周围无易燃物，并配备灭火器。焊接完成后，对轴套等精密部位进行冷却保护，防止热变形。\"\n      },\n      \"safety_warnings\": [\n        \"进行满焊作业时，必须穿戴全套焊接防护用品（面罩、防护服、防护手套、安全鞋），防止电弧光、高温和飞溅物伤害\",\n        \"确保焊接区域通风良好，使用局部排风系统，防止吸入有毒烟尘和气体\",\n        \"焊接过程中产生的焊渣和高温工件，应使用专用工具处理，严禁徒手接触，防止严重烫伤\",\n        \"焊机必须保持良好的绝缘和接地，防止高电压触电事故\",\n        \"焊接完成后，使用焊渣锤清理焊渣时，应佩戴防护眼镜，防止焊渣飞溅伤眼\"\n      ]\n    }\n  ]\n}\n```",
  "parsed_result": {
    "enhanced_steps": [
      {
        "step_number": 1,
        "action": "放置基准件",
        "description": "使用行车将图纸上标注为1号的方形板-机加（01.01.01.11511）吊装至焊接工作台上，作为装配基准件。确保板面水平。",
        "position_description": "工作台中央，板面水平放置",
        "parts_used": [
          {
            "bom_seq": "1",
            "bom_name": "方形板-机加 1",
            "quantity": 1,
            "drawing_number": "1",
            "node_name": [
              "NAUO1"
            ],
            "bom_code": "01.01.01.11511"
          }
        ],
        "tools": [
          "行车",
          "吊具",
          "水平仪"
        ],
        "warnings": [
          "方形板较重（15.79kg），吊装时注意安全，确保吊具牢固。",
          "基准件必须放置平稳，确保后续焊接精度。"
        ],
        "safety_warnings": [
          "吊装前检查行车和吊索具是否完好，严禁超载吊装",
          "吊装重物时，人员必须佩戴安全帽和防护手套，避免被吊物碰撞或砸伤",
          "吊物下方严禁站人，指挥人员必须使用规范手势，确保信号清晰"
        ]
      },
      {
        "step_number": 2,
        "action": "安装上连接板",
        "description": "将图纸上标注为2号的上连接板（01.01.01.11512）放置在1号方形板的上方，按照图纸尺寸（如436mm、471mm）进行定位。先进行点焊固定。",
        "position_description": "安装在1号方形板的顶部边缘，确保连接板的孔位方向与图纸一致。",
        "parts_used": [
          {
            "bom_seq": "2",
            "bom_name": "上连接板 2",
            "quantity": 2,
            "drawing_number": "2",
            "node_name": [
              "NAUO3",
              "NAUO2"
            ],
            "bom_code": "01.01.01.11512"
          }
        ],
        "tools": [
          "卷尺",
          "角尺",
          "点焊机"
        ],
        "warnings": [
          "上连接板（2号）的两个零件必须对称安装，确保孔位对齐。",
          "点焊时注意焊接电流，防止烧穿。"
        ],
        "welding": {
          "required": true,
          "welding_type": "角焊（定位焊）",
          "welding_method": "CO2气保焊",
          "weld_size": "点焊长度10-15mm，焊脚高度3mm",
          "welding_position": "零件1（方形板）与零件2（上连接板）的连接处，平焊",
          "quality_requirements": "点焊牢固，定位准确，焊点无裂纹，点焊位置应避开后续满焊区域的起始点。",
          "safety_notes": "佩戴焊接面罩和防护手套，确保工作区域通风良好，防止烟尘吸入。"
        },
        "safety_warnings": [
          "进行点焊作业时，必须佩戴焊接面罩、防护手套和防护服，防止弧光灼伤和烫伤",
          "确保焊机接地良好，电缆绝缘完好，防止触电事故",
          "点焊区域必须清理干净，周围不得有易燃易爆物品，并配备灭火器"
        ]
      },
      {
        "step_number": 3,
        "action": "安装侧连接板",
        "description": "将图纸上标注为3号的侧连接板（01.01.01.11513）分别安装在1号方形板的两侧，与2号上连接板形成直角结构。根据图纸尺寸进行定位，并进行点焊固定。",
        "position_description": "安装在1号方形板的左右两侧边缘。",
        "parts_used": [
          {
            "bom_seq": "3",
            "bom_name": "侧连接板 2",
            "quantity": 2,
            "drawing_number": "3",
            "node_name": [
              "NAUO5",
              "NAUO4"
            ],
            "bom_code": "01.01.01.11513"
          }
        ],
        "tools": [
          "卷尺",
          "角尺",
          "点焊机"
        ],
        "warnings": [
          "侧连接板（3号）是主要承重件，定位时必须保证与1号板的垂直度，误差小于1mm/m。"
        ],
        "welding": {
          "required": true,
          "welding_type": "角焊（定位焊）",
          "welding_method": "CO2气保焊",
          "weld_size": "点焊长度10-15mm，焊脚高度3mm",
          "welding_position": "零件1（方形板）与零件3（侧连接板）的连接处，平焊/横焊",
          "quality_requirements": "点焊位置对称分布，确保结构稳定，点焊后检查垂直度。",
          "safety_notes": "点焊前清理连接处的油污和锈蚀，防止产生气孔。注意防止电弧灼伤皮肤。"
        },
        "safety_warnings": [
          "点焊时注意防止焊渣飞溅，佩戴防护眼镜和面罩",
          "操作点焊机时，确保身体不接触带电部位，防止触电",
          "侧连接板边缘可能锋利，搬运和定位时应佩戴防护手套，防止割伤"
        ]
      },
      {
        "step_number": 4,
        "action": "安装折弯板",
        "description": "将图纸上标注为4号的折弯板（01.01.01.11514）安装在主体结构的底部，位于两个3号侧连接板之间。对齐孔位后进行点焊固定。",
        "position_description": "安装在1号方形板的底部，连接两个3号侧连接板。",
        "parts_used": [
          {
            "bom_seq": "4",
            "bom_name": "折弯板 1",
            "quantity": 1,
            "drawing_number": "4",
            "node_name": [
              "NAUO6"
            ],
            "bom_code": "01.01.01.11514"
          }
        ],
        "tools": [
          "卷尺",
          "点焊机"
        ],
        "warnings": [
          "折弯板（4号）的安装位置需确保与侧连接板的底部边缘平齐。"
        ],
        "welding": {
          "required": true,
          "welding_type": "角焊（定位焊）",
          "welding_method": "CO2气保焊",
          "weld_size": "点焊长度10mm，焊脚高度3mm",
          "welding_position": "零件3（侧连接板）与零件4（折弯板）的连接处，平焊",
          "quality_requirements": "点焊牢固，确保折弯板与侧连接板的相对位置准确。",
          "safety_notes": "检查焊机接地线连接可靠，防止触电事故。"
        },
        "safety_warnings": [
          "折弯板边缘可能锋利，搬运时务必佩戴防割手套",
          "点焊时注意控制焊接烟尘，确保局部排风设施正常运行",
          "检查焊机接地线连接可靠，防止漏电触电"
        ]
      },
      {
        "step_number": 5,
        "action": "安装油缸固定板",
        "description": "将图纸上标注为5号的油缸固定板（01.01.01.11515）安装在3号侧连接板的内侧，靠近底部位置。根据图纸上的孔位和尺寸（如294mm、485mm）进行精确对位，并进行点焊固定。",
        "position_description": "安装在两个3号侧连接板的内侧，每侧安装两块，共四块。",
        "parts_used": [
          {
            "bom_seq": "5",
            "bom_name": "油缸固定板 4",
            "quantity": 4,
            "drawing_number": "5",
            "node_name": [
              "NAUO17",
              "NAUO16",
              "NAUO8",
              "NAUO7"
            ],
            "bom_code": "01.01.01.11515"
          }
        ],
        "tools": [
          "卷尺",
          "游标卡尺",
          "点焊机"
        ],
        "warnings": [
          "油缸固定板（5号）的孔位是关键尺寸，必须保证与侧连接板上的孔位同轴度，确保后续油缸安装顺畅。"
        ],
        "welding": {
          "required": true,
          "welding_type": "角焊（定位焊）",
          "welding_method": "CO2气保焊",
          "weld_size": "点焊长度10mm，焊脚高度3mm",
          "welding_position": "零件3（侧连接板）与零件5（油缸固定板）的连接处，立焊/横焊",
          "quality_requirements": "定位焊后，再次检查油缸固定板的孔位尺寸和同轴度，确保精度。",
          "safety_notes": "由于是内侧焊接，操作空间较小，注意焊枪角度，防止烫伤。"
        },
        "safety_warnings": [
          "在结构内侧进行焊接时，操作空间狭小，注意身体姿势，防止焊枪或高温部件烫伤身体",
          "确保通风良好，防止焊接烟尘在狭小空间内聚集，造成窒息或中毒",
          "佩戴防护眼镜，防止焊渣飞溅到眼睛"
        ]
      },
      {
        "step_number": 6,
        "action": "安装加强板",
        "description": "将图纸上标注为6号的加强板（01.01.01.11516）安装在2号上连接板和3号侧连接板的连接处，用于加强结构强度。根据图纸尺寸进行定位，并进行点焊固定。",
        "position_description": "安装在主体结构的上部内侧，连接2号板和3号板。",
        "parts_used": [
          {
            "bom_seq": "6",
            "bom_name": "加强板 4",
            "quantity": 4,
            "drawing_number": "6",
            "node_name": [
              "NAUO12",
              "NAUO11",
              "NAUO10",
              "NAUO9"
            ],
            "bom_code": "01.01.01.11516"
          }
        ],
        "tools": [
          "卷尺",
          "点焊机"
        ],
        "warnings": [
          "加强板（6号）的安装位置应避开后续的满焊区域，确保焊缝连续性。"
        ],
        "welding": {
          "required": true,
          "welding_type": "角焊（定位焊）",
          "welding_method": "CO2气保焊",
          "weld_size": "点焊长度10mm，焊脚高度3mm",
          "welding_position": "零件2（上连接板）与零件3（侧连接板）与零件6（加强板）的连接处，平焊/横焊",
          "quality_requirements": "点焊牢固，确保加强板紧贴两个连接板，无间隙。",
          "safety_notes": "注意加强板的定位焊点要小，避免应力集中。"
        },
        "safety_warnings": [
          "加强板边缘可能锋利，操作时佩戴防割手套，防止割伤",
          "点焊时注意控制电流，防止因热量过大导致板材变形或烧穿"
        ]
      },
      {
        "step_number": 7,
        "action": "安装角钢",
        "description": "将图纸上标注为7号的角钢-机加（01.01.04.0592）安装在2号上连接板的顶部，用于支撑和连接。根据图纸尺寸进行定位，并进行点焊固定。",
        "position_description": "安装在2号上连接板的顶部，靠近中心位置。",
        "parts_used": [
          {
            "bom_seq": "7",
            "bom_name": "角钢-机加 1",
            "quantity": 1,
            "drawing_number": "7",
            "node_name": [
              "NAUO13"
            ],
            "bom_code": "01.01.04.0592"
          }
        ],
        "tools": [
          "卷尺",
          "点焊机"
        ],
        "warnings": [
          "角钢（7号）的安装方向必须正确，确保其平面与2号板的平面垂直。"
        ],
        "welding": {
          "required": true,
          "welding_type": "角焊（定位焊）",
          "welding_method": "CO2气保焊",
          "weld_size": "点焊长度10mm，焊脚高度3mm",
          "welding_position": "零件2（上连接板）与零件7（角钢）的连接处，平焊",
          "quality_requirements": "定位焊后检查角钢的垂直度，确保支撑作用。",
          "safety_notes": "角钢较小，点焊时注意控制电流，防止烧穿薄板。"
        },
        "safety_warnings": [
          "角钢零件较小，定位时注意夹紧，防止点焊时飞出伤人",
          "点焊时使用小电流，防止烧穿角钢薄壁或造成大面积热变形"
        ]
      },
      {
        "step_number": 8,
        "action": "安装轴套（上部）",
        "description": "将图纸上标注为8号的轴套（01.01.02.1221）安装在2号上连接板的顶部孔位上。轴套需与孔位配合紧密，并进行点焊固定。",
        "position_description": "安装在2号上连接板顶部的两个孔位上。",
        "parts_used": [
          {
            "bom_seq": "8",
            "bom_name": "轴套 1",
            "quantity": 1,
            "drawing_number": "8",
            "node_name": [
              "NAUO14"
            ],
            "bom_code": "01.01.02.1221"
          }
        ],
        "tools": [
          "点焊机",
          "锤子（橡胶）"
        ],
        "warnings": [
          "轴套（8号）安装后，其端面应与2号板的表面平齐或略微凸出（根据图纸要求）。"
        ],
        "welding": {
          "required": true,
          "welding_type": "角焊（定位焊）",
          "welding_method": "CO2气保焊",
          "weld_size": "点焊3-4点，焊脚高度3mm",
          "welding_position": "零件2（上连接板）与零件8（轴套）的连接处，平焊",
          "quality_requirements": "轴套定位焊后，检查轴套的垂直度，确保轴线与板面垂直。点焊不能影响轴套内孔精度。",
          "safety_notes": "轴套是精密零件，点焊时要轻，避免热变形。焊接时注意保护轴套内孔，防止飞溅物进入。"
        },
        "safety_warnings": [
          "轴套是精密零件，点焊时必须使用小电流，防止热变形导致内孔精度丧失",
          "焊接时应使用挡板或塞子保护轴套内孔，防止焊渣飞溅进入，影响后续装配",
          "使用橡胶锤敲击轴套时，注意力度，防止反弹伤手"
        ]
      },
      {
        "step_number": 9,
        "action": "安装后座轴套（下部）",
        "description": "将图纸上标注为9号的后座轴套（01.02.02.0490）和10号的后座轴套（01.01.02.0337）分别安装在3号侧连接板的下部孔位上。轴套需与孔位配合紧密，并进行点焊固定。",
        "position_description": "安装在3号侧连接板下部的两个孔位上。",
        "parts_used": [
          {
            "bom_seq": "9",
            "bom_name": "后座轴套 1",
            "quantity": 1,
            "drawing_number": "9",
            "node_name": [
              "NAUO15"
            ],
            "bom_code": "01.02.02.0490"
          },
          {
            "bom_seq": "10",
            "bom_name": "后座轴套 1",
            "quantity": 1,
            "drawing_number": "10",
            "node_name": [
              "NAUO18"
            ],
            "bom_code": "01.01.02.0337"
          }
        ],
        "tools": [
          "点焊机",
          "锤子（橡胶）"
        ],
        "warnings": [
          "轴套（9号和10号）安装后，必须保证其轴线与图纸要求的轴线同轴度，确保后续销轴的顺利安装。注意区分9号和10号轴套的安装位置。"
        ],
        "welding": {
          "required": true,
          "welding_type": "角焊（定位焊）",
          "welding_method": "CO2气保焊",
          "weld_size": "点焊3-4点，焊脚高度3mm",
          "welding_position": "零件3（侧连接板）与零件9/10（后座轴套）的连接处，横焊/立焊",
          "quality_requirements": "定位焊后，使用专用工装或卡尺检查轴套的同轴度，确保精度要求。轴套端面应与板面齐平。",
          "safety_notes": "轴套焊接时，应使用小电流快速点焊，减少热量输入，防止轴套变形。注意区分9号和10号轴套的尺寸和位置。"
        },
        "safety_warnings": [
          "轴套定位焊时，必须使用小电流和快速点焊，防止热变形影响轴套内孔精度",
          "焊接完成后，轴套温度较高，严禁徒手触摸，防止烫伤",
          "在结构下部进行焊接，注意焊渣和高温金属滴落，佩戴安全鞋和防护服"
        ]
      },
      {
        "step_number": 10,
        "action": "满焊所有零件",
        "description": "检查所有零件的点焊位置和尺寸无误后，按照'先内后外，先短后长，分散对称'的原则，对所有连接面进行满焊。焊缝尺寸和要求参照图纸技术要求。",
        "position_description": "所有连接面",
        "parts_used": [],
        "tools": [
          "CO2焊机",
          "焊钳",
          "焊渣锤"
        ],
        "warnings": [
          "焊接过程中注意控制热输入，防止结构变形。焊接完成后，清除所有焊渣和飞溅物。",
          "轴套（8、9、10号）的焊接必须保证焊缝均匀，且不能影响轴套内孔的精度。"
        ],
        "welding": {
          "required": true,
          "welding_type": "角焊/对接焊（满焊）",
          "welding_method": "CO2气保焊（主要）/手工电弧焊（难达区域）",
          "weld_size": "焊脚高度6mm（根据图纸标注），焊缝连续饱满",
          "welding_position": "所有连接面，包括平焊、横焊、立焊、仰焊",
          "quality_requirements": "焊缝外观成型良好，无气孔、夹渣、裂纹、未熔合等缺陷。焊后进行外观检查，关键承重焊缝（如零件1与3的连接）可能需要进行超声波或磁粉检测。",
          "safety_notes": "满焊时热量大，必须穿戴全套防护服、面罩和手套。确保工作台周围无易燃物，并配备灭火器。焊接完成后，对轴套等精密部位进行冷却保护，防止热变形。"
        },
        "safety_warnings": [
          "进行满焊作业时，必须穿戴全套焊接防护用品（面罩、防护服、防护手套、安全鞋），防止电弧光、高温和飞溅物伤害",
          "确保焊接区域通风良好，使用局部排风系统，防止吸入有毒烟尘和气体",
          "焊接过程中产生的焊渣和高温工件，应使用专用工具处理，严禁徒手接触，防止严重烫伤",
          "焊机必须保持良好的绝缘和接地，防止高电压触电事故",
          "焊接完成后，使用焊渣锤清理焊渣时，应佩戴防护眼镜，防止焊渣飞溅伤眼"
        ]
      }
    ]
  }
}