{
  "agent_name": "Agent6_FAQ",
  "model": "google/gemini-2.5-flash-preview-09-2025",
  "timestamp": "20251005_165105",
  "image_count": 0,
  "temperature": 0.2,
  "system_prompt": "# 角色定位\n\n你是**李师傅**，一位拥有20年安全管理经验的高级安全工程师。\n\n## 教育背景\n\n- **学历**：安全工程专业本科\n- **职业资格**：注册安全工程师、高级安全评价师\n- **专业培训**：\n  - 机械制造安全管理\n  - 职业健康与安全管理体系（ISO 45001）\n  - 事故调查与分析\n  - 应急预案编制与演练\n\n## 职业背景\n\n- **工作经历**：20年机械制造企业安全管理经验，参与过大型装备制造、钢结构加工等项目\n- **专业领域**：\n  - 机械加工安全（车、铣、刨、磨、钻等）\n  - 焊接作业安全（电焊、气焊、氩弧焊等）\n  - 起重吊装安全（行车、叉车、吊索具等）\n  - 高空作业安全（脚手架、安全带、防坠落等）\n  - 个人防护用品管理（安全帽、防护眼镜、手套、安全鞋等）\n\n## 知识结构（详细）\n\n### 1. 机械伤害风险\n- **夹伤/挤伤**：手指、手臂被运动部件夹住\n- **切割伤**：锋利边缘、毛刺、切削工具\n- **碰撞伤**：头部碰撞、身体碰撞\n- **坠落伤**：零件坠落、工具坠落、人员坠落\n\n### 2. 焊接作业风险\n- **电击伤**：焊机漏电、接地不良\n- **弧光伤**：电弧紫外线灼伤眼睛和皮肤\n- **烫伤**：高温熔池、焊渣飞溅\n- **火灾爆炸**：易燃物引燃、气瓶泄漏\n- **有毒气体**：焊接烟尘、一氧化碳中毒\n\n### 3. 起重吊装风险\n- **吊物坠落**：吊索具断裂、捆绑不牢\n- **吊物摆动**：碰撞人员、设备\n- **超载**：超过起重机额定载荷\n- **指挥失误**：信号不清、违章指挥\n\n### 4. 高空作业风险\n- **人员坠落**：未系安全带、脚手架不牢\n- **物体打击**：工具、零件从高处坠落\n- **脚手架坍塌**：搭设不规范、超载\n\n### 5. 个人防护用品\n- **头部防护**：安全帽（防止碰撞、坠物打击）\n- **眼部防护**：防护眼镜、焊接面罩（防止飞溅、弧光）\n- **手部防护**：防护手套（防止切割、烫伤、化学品）\n- **足部防护**：安全鞋（防砸、防刺穿、防滑）\n- **呼吸防护**：防尘口罩、防毒面具（防止粉尘、有毒气体）\n\n### 6. 应急处理\n- **机械伤害**：立即停机、呼救、止血、固定、送医\n- **电击伤**：切断电源、心肺复苏、送医\n- **烫伤**：冷水冲洗、覆盖无菌纱布、送医\n- **火灾**：使用灭火器、疏散人员、报警\n\n## 任务步骤（Chain of Thought）\n\n你的任务是**为每个装配步骤添加安全警告**（如果该步骤有安全风险）。请按照以下5个步骤思考：\n\n### 步骤1：识别风险步骤\n- 分析每个装配步骤的操作内容\n- 判断是否涉及高风险作业（焊接、吊装、高空、重物搬运等）\n- 识别潜在的伤害类型（机械伤害、电击、烫伤、坠落等）\n\n### 步骤2：分析风险源\n- 确定风险的来源（设备、工具、材料、环境、人员操作等）\n- 评估风险的严重程度（轻微、中等、严重、致命）\n- 考虑风险的发生概率\n\n### 步骤3：制定预防措施\n- 针对每个风险源，制定具体的预防措施\n- 强调个人防护用品的使用\n- 强调安全操作规程的遵守\n\n### 步骤4：添加安全警告\n- 为每个有风险的步骤添加safety_warnings字段\n- 每条警告要简洁明了，说明具体的风险和预防措施\n- 使用工人能看懂的语言\n\n### 步骤5：验证完整性\n- 检查所有高风险步骤是否都添加了安全警告\n- 检查安全警告是否具体、可操作\n- 检查是否遗漏了任何潜在风险\n\n## 核心原则\n\n1. **步骤级嵌入**：为每个有风险的步骤添加safety_warnings字段，而不是单独列出安全警告\n2. **工人友好**：使用通俗语言，避免专业术语\n3. **具体可操作**：说明具体的风险和预防措施，而不是泛泛而谈\n4. **不重复显示**：安全警告只在下方\"安全\"标签页中统一显示，不在当前步骤详情中重复显示\n\n## 输出格式\n\n严格按照以下JSON格式输出（返回增强后的装配步骤）：\n\n```json\n{\n  \"enhanced_steps\": [\n    {\n      \"step_number\": 1,\n      \"title\": \"点焊定位\",\n      \"parts_used\": [...],\n      \"tools_required\": [...],\n      \"operation\": \"操作说明\",\n      \"quality_check\": \"质量检查\",\n      \"estimated_time_minutes\": 10,\n      \"welding\": {\n        \"required\": true,\n        \"welding_type\": \"点焊\",\n        \"welding_method\": \"CO2气保焊\",\n        ...\n      },\n      \"safety_warnings\": [\n        \"佩戴焊接面罩和防护手套，防止弧光灼伤眼睛和皮肤\",\n        \"确保工件夹紧牢固，防止点焊时位移造成伤害\",\n        \"焊接区域周围3米内不得有易燃物，配备灭火器\",\n        \"焊机必须接地良好，防止漏电触电\"\n      ]\n    },\n    {\n      \"step_number\": 2,\n      \"title\": \"螺栓连接\",\n      \"parts_used\": [...],\n      \"operation\": \"操作说明\",\n      \"quality_check\": \"质量检查\",\n      \"estimated_time_minutes\": 15,\n      \"safety_warnings\": [\n        \"佩戴安全帽和防护眼镜，防止零件坠落和飞溅\",\n        \"使用扭力扳手时注意力度，防止扳手滑脱伤人\"\n      ]\n    },\n    {\n      \"step_number\": 3,\n      \"title\": \"简单装配\",\n      \"parts_used\": [...],\n      \"operation\": \"操作说明\",\n      \"quality_check\": \"质量检查\",\n      \"estimated_time_minutes\": 5\n      // ⚠️ 如果没有明显安全风险，不添加safety_warnings字段\n    }\n  ]\n}\n```\n\n**⚠️ 关键要求**：\n\n1. **步骤级嵌入**：\n   - 为每个有风险的步骤添加`safety_warnings`字段\n   - 没有明显风险的步骤不添加`safety_warnings`字段\n   - 保持原有步骤的所有字段不变\n\n2. **安全警告要具体**：\n   - ✅ 说\"佩戴焊接面罩和防护手套，防止弧光灼伤眼睛和皮肤\"\n   - ❌ 不说\"注意安全\"\n   - ✅ 说\"焊接区域周围3米内不得有易燃物，配备灭火器\"\n   - ❌ 不说\"注意防火\"\n\n3. **使用通俗语言**：\n   - 工人能看懂的语言\n   - 避免专业术语和英文缩写\n\n4. **警告要全面**：\n   - 涵盖个人防护、设备安全、环境安全、操作安全\n   - 每条警告说明具体的风险和预防措施\n\n## 重要提醒\n\n- **只输出JSON，不要输出其他内容**\n- **保持原有字段不变**：不要修改或删除原有的字段（包括welding字段）\n- **警告要简洁明了**：每条警告一句话，说明风险和预防措施\n- **不要过度警告**：只针对有明显风险的步骤添加警告\n",
  "user_query": "请为以下装配步骤添加安全警告（如果有安全风险）。\n\n## 📸 视觉分析任务\n\n**你会看到工程图纸图片，请仔细观察：**\n\n1. **危险作业标识**：\n   - 图纸上的安全警告标识\n   - 特殊作业要求（如高空作业、吊装作业等）\n   - 危险区域标注\n\n2. **零件特征**：\n   - 重型零件（需要吊装）\n   - 锋利边缘（容易割伤）\n   - 高温部件（容易烫伤）\n\n3. **作业环境**：\n   - 狭窄空间（容易碰撞）\n   - 高空位置（容易坠落）\n   - 密闭空间（通风不良）\n\n## 装配步骤\n\n[\n  {\n    \"step_number\": 1,\n    \"action\": \"放置基准件\",\n    \"description\": \"使用行车将②号连接板（21.36kg）吊装到装配胎具上，作为整个组件的基准件。确保连接板放置平稳，并使用夹具初步固定。\",\n    \"position_description\": \"连接板平放在工作台上，长边方向与装配胎具对齐。\",\n    \"parts_used\": [\n      {\n        \"bom_seq\": \"2\",\n        \"bom_name\": \"连接板 1\",\n        \"quantity\": 1,\n        \"drawing_number\": \"2\",\n        \"node_name\": [\n          \"NAUO2\"\n        ],\n        \"bom_code\": \"01.01.01.11509\"\n      }\n    ],\n    \"tools\": [\n      \"行车\",\n      \"吊具\",\n      \"装配胎具\",\n      \"夹具\"\n    ],\n    \"warnings\": [\n      \"连接板较重，吊装时注意安全，确保吊具牢固。\",\n      \"放置时注意保护连接板表面，避免划伤。\"\n    ]\n  },\n  {\n    \"step_number\": 2,\n    \"action\": \"安装底部矩形管\",\n    \"description\": \"将①号矩形管（14.56kg）放置在②号连接板的底部边缘，使其长边与连接板的长边对齐。使用点焊初步固定，确保位置准确。\",\n    \"position_description\": \"①号矩形管位于②号连接板的底部，沿连接板的长度方向。\",\n    \"parts_used\": [\n      {\n        \"bom_seq\": \"1\",\n        \"bom_name\": \"矩形管 1\",\n        \"quantity\": 1,\n        \"drawing_number\": \"1\",\n        \"node_name\": [\n          \"NAUO1\"\n        ],\n        \"bom_code\": \"01.01.03.2718\"\n      }\n    ],\n    \"tools\": [\n      \"焊机\",\n      \"卷尺\",\n      \"角尺\"\n    ],\n    \"warnings\": [\n      \"点焊时注意焊接电流和电压，防止烧穿。\",\n      \"确保矩形管与连接板的相对位置符合图纸尺寸要求。\"\n    ],\n    \"welding\": {\n      \"required\": true,\n      \"welding_type\": \"角焊（定位焊）\",\n      \"welding_method\": \"CO2气保焊\",\n      \"weld_size\": \"点焊长度10-15mm，焊脚高度约3mm\",\n      \"welding_position\": \"零件①矩形管与零件②连接板的连接处，平焊\",\n      \"quality_requirements\": \"点焊牢固，位置准确，无虚焊、漏焊，点焊后清理焊渣。\",\n      \"safety_notes\": \"佩戴焊接面罩、防护手套和防护服。确保工作区域通风良好，防止烟尘吸入。\"\n    }\n  },\n  {\n    \"step_number\": 3,\n    \"action\": \"安装侧面矩形管（长）\",\n    \"description\": \"将⑧号矩形管（12.61kg）放置在②号连接板的侧面，与①号矩形管形成一个矩形框架。⑧号矩形管的端面应与①号矩形管的端面齐平。使用点焊固定。\",\n    \"position_description\": \"⑧号矩形管位于②号连接板的侧面，垂直于①号矩形管。\",\n    \"parts_used\": [\n      {\n        \"bom_seq\": \"8\",\n        \"bom_name\": \"矩形管 1\",\n        \"quantity\": 1,\n        \"drawing_number\": \"8\",\n        \"node_name\": [\n          \"NAUO13\"\n        ],\n        \"bom_code\": \"01.01.03.2720\"\n      }\n    ],\n    \"tools\": [\n      \"焊机\",\n      \"卷尺\",\n      \"水平仪\"\n    ],\n    \"warnings\": [\n      \"检查⑧号矩形管与②号连接板的垂直度，确保后续装配精度。\"\n    ],\n    \"welding\": {\n      \"required\": true,\n      \"welding_type\": \"角焊（定位焊）\",\n      \"welding_method\": \"CO2气保焊\",\n      \"weld_size\": \"点焊长度10-15mm，焊脚高度约3mm\",\n      \"welding_position\": \"零件⑧矩形管与零件②连接板的连接处，平焊/横焊\",\n      \"quality_requirements\": \"点焊位置应均匀分布，确保框架几何尺寸准确，焊点无裂纹。\",\n      \"safety_notes\": \"注意焊机接地良好，避免触电。点焊完成后，用角尺检查垂直度。\"\n    }\n  },\n  {\n    \"step_number\": 4,\n    \"action\": \"安装侧面矩形管（短）\",\n    \"description\": \"将⑥号矩形管（4.36kg）放置在②号连接板的另一侧，与①号矩形管和⑧号矩形管形成封闭框架。⑥号矩形管的端面应与①号矩形管和⑧号矩形管的端面齐平。使用点焊固定。\",\n    \"position_description\": \"⑥号矩形管位于②号连接板的另一侧，与⑧号矩形管平行。\",\n    \"parts_used\": [\n      {\n        \"bom_seq\": \"6\",\n        \"bom_name\": \"矩形管 2\",\n        \"quantity\": 2,\n        \"drawing_number\": \"6\",\n        \"node_name\": [\n          \"NAUO10\",\n          \"NAUO9\"\n        ],\n        \"bom_code\": \"01.01.03.2719\"\n      }\n    ],\n    \"tools\": [\n      \"焊机\",\n      \"卷尺\",\n      \"角尺\"\n    ],\n    \"warnings\": [\n      \"确保矩形管框架的对角线尺寸一致，防止框架扭曲变形。\"\n    ],\n    \"welding\": {\n      \"required\": true,\n      \"welding_type\": \"角焊（定位焊）\",\n      \"welding_method\": \"CO2气保焊\",\n      \"weld_size\": \"点焊长度10-15mm，焊脚高度约3mm\",\n      \"welding_position\": \"零件⑥矩形管与零件②连接板的连接处，平焊/横焊\",\n      \"quality_requirements\": \"点焊后检查框架的对角线尺寸偏差，确保在允许范围内。\",\n      \"safety_notes\": \"清理焊接区域的油污和锈蚀，防止产生气孔。注意高温烫伤。\"\n    }\n  },\n  {\n    \"step_number\": 5,\n    \"action\": \"安装挂件虚拟组件\",\n    \"description\": \"将④号右挂件虚拟组件和⑤号左挂件虚拟组件分别放置在矩形管框架的两端。挂件的安装面应与矩形管的侧面贴合，并确保挂件的孔位方向正确。使用点焊初步固定。\",\n    \"position_description\": \"④号右挂件安装在矩形管框架的右端，⑤号左挂件安装在矩形管框架的左端。\",\n    \"parts_used\": [\n      {\n        \"bom_seq\": \"4\",\n        \"bom_name\": \"右挂件虚拟组件 1\",\n        \"quantity\": 1,\n        \"drawing_number\": \"4\",\n        \"node_name\": [\n          \"NAUO18\",\n          \"NAUO20\",\n          \"NAUO19\"\n        ],\n        \"bom_code\": \"01.05.0018\"\n      },\n      {\n        \"bom_seq\": \"5\",\n        \"bom_name\": \"左挂件虚拟组件 1\",\n        \"quantity\": 1,\n        \"drawing_number\": \"5\",\n        \"node_name\": [\n          \"NAUO17\",\n          \"NAUO16\",\n          \"NAUO21\"\n        ],\n        \"bom_code\": \"01.05.0019\"\n      }\n    ],\n    \"tools\": [\n      \"焊机\",\n      \"卡尺\"\n    ],\n    \"warnings\": [\n      \"挂件的安装位置是关键尺寸，必须严格按照图纸要求定位，确保挂件的中心距和高度符合要求。\"\n    ],\n    \"welding\": {\n      \"required\": true,\n      \"welding_type\": \"角焊（定位焊）\",\n      \"welding_method\": \"CO2气保焊\",\n      \"weld_size\": \"点焊长度10-15mm，焊脚高度约3mm\",\n      \"welding_position\": \"零件④/⑤挂件与矩形管框架的连接处，平焊/横焊\",\n      \"quality_requirements\": \"定位焊后，使用卡尺或专用量具检查挂件的中心距和相对高度，确保精度。\",\n      \"safety_notes\": \"挂件定位焊时，注意保持姿势稳定，防止焊花飞溅到眼睛或皮肤。使用合格的防护面罩。\"\n    }\n  },\n  {\n    \"step_number\": 6,\n    \"action\": \"安装方形板\",\n    \"description\": \"将③号方形板-机加（共4块）分别放置在矩形管框架的四个角部，用于加强连接。方形板应紧贴矩形管和连接板的交接处。使用点焊固定。\",\n    \"position_description\": \"③号方形板安装在矩形管框架的四个角部，位于连接板的上方。\",\n    \"parts_used\": [\n      {\n        \"bom_seq\": \"3\",\n        \"bom_name\": \"方形板-机加 4\",\n        \"quantity\": 4,\n        \"drawing_number\": \"3\",\n        \"node_name\": [\n          \"NAUO6\",\n          \"NAUO5\",\n          \"NAUO4\",\n          \"NAUO3\"\n        ],\n        \"bom_code\": \"01.01.01.6589\"\n      }\n    ],\n    \"tools\": [\n      \"焊机\",\n      \"夹具\"\n    ],\n    \"warnings\": [\n      \"方形板的定位应确保不影响后续零件的安装，且焊缝应均匀。\"\n    ],\n    \"welding\": {\n      \"required\": true,\n      \"welding_type\": \"角焊（定位焊）\",\n      \"welding_method\": \"CO2气保焊\",\n      \"weld_size\": \"点焊长度10mm，焊脚高度约3mm\",\n      \"welding_position\": \"零件③方形板与矩形管/连接板的连接处，平焊/横焊\",\n      \"quality_requirements\": \"方形板与主体结构应紧密贴合，点焊位置应避开后续满焊的起始点。\",\n      \"safety_notes\": \"确保焊机电缆无破损，避免短路。焊接时注意周围环境，防止火灾。\"\n    }\n  },\n  {\n    \"step_number\": 7,\n    \"action\": \"安装封板\",\n    \"description\": \"将⑦号封板（共2块）安装在矩形管框架的内部，用于封闭结构。封板应与矩形管的内壁贴合。使用点焊固定。\",\n    \"position_description\": \"⑦号封板安装在矩形管框架内部，垂直于②号连接板。\",\n    \"parts_used\": [\n      {\n        \"bom_seq\": \"7\",\n        \"bom_name\": \"封板 2\",\n        \"quantity\": 2,\n        \"drawing_number\": \"7\",\n        \"node_name\": [\n          \"NAUO12\",\n          \"NAUO11\"\n        ],\n        \"bom_code\": \"01.01.01.16608\"\n      }\n    ],\n    \"tools\": [\n      \"焊机\",\n      \"卷尺\"\n    ],\n    \"warnings\": [\n      \"封板安装后，检查其平面度，避免因焊接应力导致变形。\"\n    ],\n    \"welding\": {\n      \"required\": true,\n      \"welding_type\": \"角焊（定位焊）\",\n      \"welding_method\": \"CO2气保焊\",\n      \"weld_size\": \"点焊长度10mm，焊脚高度约3mm\",\n      \"welding_position\": \"零件⑦封板与矩形管内壁的连接处，立焊/横焊\",\n      \"quality_requirements\": \"封板定位焊后，检查其与矩形管内壁的间隙，确保后续满焊质量。\",\n      \"safety_notes\": \"在狭小空间内进行点焊时，确保有足够的通风，防止有害气体聚集。\"\n    }\n  },\n  {\n    \"step_number\": 8,\n    \"action\": \"安装加强筋\",\n    \"description\": \"将⑨号加强筋（共2块）安装在组件的顶部，用于增强整体刚度。加强筋应与矩形管和连接板的相应位置贴合。使用点焊固定。\",\n    \"position_description\": \"⑨号加强筋安装在组件的顶部，位于矩形管框架的上方。\",\n    \"parts_used\": [\n      {\n        \"bom_seq\": \"9\",\n        \"bom_name\": \"加强筋 2\",\n        \"quantity\": 2,\n        \"drawing_number\": \"9\",\n        \"node_name\": [\n          \"NAUO15\",\n          \"NAUO14\"\n        ],\n        \"bom_code\": \"01.01.01.17678\"\n      }\n    ],\n    \"tools\": [\n      \"焊机\",\n      \"夹具\"\n    ],\n    \"warnings\": [\n      \"加强筋的安装位置应确保对称，并检查与主体结构的贴合度。\"\n    ],\n    \"welding\": {\n      \"required\": true,\n      \"welding_type\": \"角焊（定位焊）\",\n      \"welding_method\": \"CO2气保焊\",\n      \"weld_size\": \"点焊长度10mm，焊脚高度约3mm\",\n      \"welding_position\": \"零件⑨加强筋与矩形管/连接板的连接处，平焊\",\n      \"quality_requirements\": \"加强筋定位焊后，检查其对称性和垂直度，确保结构强度。\",\n      \"safety_notes\": \"使用夹具固定加强筋，防止焊接过程中零件移动。注意焊枪角度，确保熔深。\"\n    }\n  },\n  {\n    \"step_number\": 9,\n    \"action\": \"满焊与校正\",\n    \"description\": \"对所有已点焊的零件连接处进行满焊。焊接顺序应遵循对称、分散原则，以减少焊接应力集中和变形。焊接完成后，对组件进行整体校正，确保关键尺寸和形位公差符合图纸要求。\",\n    \"position_description\": \"对所有零件的连接焊缝进行满焊。\",\n    \"parts_used\": [],\n    \"tools\": [\n      \"焊机\",\n      \"焊钳\",\n      \"校正平台\",\n      \"液压校正设备\"\n    ],\n    \"warnings\": [\n      \"焊接过程中注意通风和防火安全。\",\n      \"满焊后立即进行校正，趁热校正效果更佳，但需注意安全。\"\n    ],\n    \"welding\": {\n      \"required\": true,\n      \"welding_type\": \"角焊/对接焊（满焊）\",\n      \"welding_method\": \"CO2气保焊\",\n      \"weld_size\": \"未注焊缝焊脚高度按图纸要求，通常为板厚较薄零件的厚度（如6mm或8mm）\",\n      \"welding_position\": \"所有零件连接处，涉及平焊、横焊、立焊\",\n      \"quality_requirements\": \"焊缝必须连续、饱满，焊波均匀，无气孔、夹渣、裂纹、未熔合等缺陷。焊后清理焊渣和飞溅物，并进行外观检查。\",\n      \"safety_notes\": \"进行大面积焊接时，必须佩戴全套防护装备。注意控制焊接热输入，防止结构过热变形。焊接完成后，对焊缝进行冷却处理，避免快速冷却导致裂纹。\"\n    }\n  }\n]\n\n## 要求\n\n请按照以下5个步骤思考，为装配步骤添加安全警告：\n\n### 步骤1：识别风险步骤\n- 分析每个装配步骤的操作内容\n- 判断是否涉及高风险作业：\n  * **焊接作业**：电击、弧光、烫伤、火灾\n  * **吊装作业**：吊物坠落、碰撞、超载\n  * **高空作业**：人员坠落、物体打击\n  * **重物搬运**：砸伤、扭伤、夹伤\n  * **机械加工**：切割伤、夹伤、碰撞\n\n### 步骤2：分析风险源\n- 确定风险的来源（设备、工具、材料、环境、人员操作等）\n- 评估风险的严重程度（轻微、中等、严重、致命）\n- 考虑风险的发生概率\n\n### 步骤3：制定预防措施\n- 针对每个风险源，制定具体的预防措施\n- 强调个人防护用品的使用：\n  * **焊接**：焊接面罩、防护手套、防护服\n  * **吊装**：安全帽、安全鞋、手套\n  * **高空**：安全带、安全帽、防滑鞋\n  * **机械**：防护眼镜、手套、安全鞋\n\n### 步骤4：添加安全警告\n- 为每个有风险的步骤添加safety_warnings字段\n- 每条警告要简洁明了，说明具体的风险和预防措施\n- 使用工人能看懂的语言\n\n### 步骤5：验证完整性\n- 检查所有高风险步骤是否都添加了安全警告\n- 检查安全警告是否具体、可操作\n- 检查是否遗漏了任何潜在风险\n\n## ⚠️ 强制自检清单（生成后必须逐项检查）\n\n**在输出JSON之前，你必须完成以下验证：**\n\n1. **风险步骤识别验证**：\n   - [ ] 所有涉及焊接、吊装、高空、重物搬运的步骤都添加了safety_warnings字段\n   - [ ] 没有明显风险的步骤没有添加safety_warnings字段\n\n2. **安全警告完整性验证**：\n   - [ ] 每个safety_warnings字段都是字符串数组\n   - [ ] 每条警告都说明了具体的风险和预防措施\n   - [ ] 涵盖了个人防护、设备安全、环境安全、操作安全\n\n3. **语言通俗性验证**：\n   - [ ] 使用工人能看懂的语言\n   - [ ] 避免专业术语和英文缩写\n   - [ ] 每条警告简洁明了（一句话）\n\n4. **原有字段保持验证**：\n   - [ ] 原有步骤的所有字段都保持不变（包括welding字段）\n   - [ ] 没有修改或删除任何原有字段\n\n**如果自检发现任何问题，必须重新生成！**\n\n现在开始为装配步骤添加安全警告！\n",
  "raw_response": "```json\n{\n  \"enhanced_steps\": [\n    {\n      \"step_number\": 1,\n      \"action\": \"放置基准件\",\n      \"description\": \"使用行车将②号连接板（21.36kg）吊装到装配胎具上，作为整个组件的基准件。确保连接板放置平稳，并使用夹具初步固定。\",\n      \"position_description\": \"连接板平放在工作台上，长边方向与装配胎具对齐。\",\n      \"parts_used\": [\n        {\n          \"bom_seq\": \"2\",\n          \"bom_name\": \"连接板 1\",\n          \"quantity\": 1,\n          \"drawing_number\": \"2\",\n          \"node_name\": [\n            \"NAUO2\"\n          ],\n          \"bom_code\": \"01.01.01.11509\"\n        }\n      ],\n      \"tools\": [\n        \"行车\",\n        \"吊具\",\n        \"装配胎具\",\n        \"夹具\"\n      ],\n      \"warnings\": [\n        \"连接板较重，吊装时注意安全，确保吊具牢固。\",\n        \"放置时注意保护连接板表面，避免划伤。\"\n      ],\n      \"safety_warnings\": [\n        \"吊装前检查行车和吊具是否完好，防止重物坠落伤人。\",\n        \"吊装区域必须设置警戒线，非作业人员不得进入。\",\n        \"指挥人员必须使用统一规范的手势或口令，确保吊装平稳。\",\n        \"操作人员必须佩戴安全帽和防砸安全鞋，防止物体打击。\"\n      ]\n    },\n    {\n      \"step_number\": 2,\n      \"action\": \"安装底部矩形管\",\n      \"description\": \"将①号矩形管（14.56kg）放置在②号连接板的底部边缘，使其长边与连接板的长边对齐。使用点焊初步固定，确保位置准确。\",\n      \"position_description\": \"①号矩形管位于②号连接板的底部，沿连接板的长度方向。\",\n      \"parts_used\": [\n        {\n          \"bom_seq\": \"1\",\n          \"bom_name\": \"矩形管 1\",\n          \"quantity\": 1,\n          \"drawing_number\": \"1\",\n          \"node_name\": [\n            \"NAUO1\"\n          ],\n          \"bom_code\": \"01.01.03.2718\"\n        }\n      ],\n      \"tools\": [\n        \"焊机\",\n        \"卷尺\",\n        \"角尺\"\n      ],\n      \"warnings\": [\n        \"点焊时注意焊接电流和电压，防止烧穿。\",\n        \"确保矩形管与连接板的相对位置符合图纸尺寸要求。\"\n      ],\n      \"welding\": {\n        \"required\": true,\n        \"welding_type\": \"角焊（定位焊）\",\n        \"welding_method\": \"CO2气保焊\",\n        \"weld_size\": \"点焊长度10-15mm，焊脚高度约3mm\",\n        \"welding_position\": \"零件①矩形管与零件②连接板的连接处，平焊\",\n        \"quality_requirements\": \"点焊牢固，位置准确，无虚焊、漏焊，点焊后清理焊渣。\",\n        \"safety_notes\": \"佩戴焊接面罩、防护手套和防护服。确保工作区域通风良好，防止烟尘吸入。\"\n      },\n      \"safety_warnings\": [\n        \"佩戴焊接面罩、防护手套和防护服，防止弧光灼伤和高温烫伤。\",\n        \"确保焊机接地良好，电缆无破损，防止触电事故。\",\n        \"焊接区域必须保持通风，防止焊接烟尘和有害气体中毒。\",\n        \"点焊后清理焊渣时，佩戴防护眼镜，防止飞溅物伤眼。\"\n      ]\n    },\n    {\n      \"step_number\": 3,\n      \"action\": \"安装侧面矩形管（长）\",\n      \"description\": \"将⑧号矩形管（12.61kg）放置在②号连接板的侧面，与①号矩形管形成一个矩形框架。⑧号矩形管的端面应与①号矩形管的端面齐平。使用点焊固定。\",\n      \"position_description\": \"⑧号矩形管位于②号连接板的侧面，垂直于①号矩形管。\",\n      \"parts_used\": [\n        {\n          \"bom_seq\": \"8\",\n          \"bom_name\": \"矩形管 1\",\n          \"quantity\": 1,\n          \"drawing_number\": \"8\",\n          \"node_name\": [\n            \"NAUO13\"\n          ],\n          \"bom_code\": \"01.01.03.2720\"\n        }\n      ],\n      \"tools\": [\n        \"焊机\",\n        \"卷尺\",\n        \"水平仪\"\n      ],\n      \"warnings\": [\n        \"检查⑧号矩形管与②号连接板的垂直度，确保后续装配精度。\"\n      ],\n      \"welding\": {\n        \"required\": true,\n        \"welding_type\": \"角焊（定位焊）\",\n        \"welding_method\": \"CO2气保焊\",\n        \"weld_size\": \"点焊长度10-15mm，焊脚高度约3mm\",\n        \"welding_position\": \"零件⑧矩形管与零件②连接板的连接处，平焊/横焊\",\n        \"quality_requirements\": \"点焊位置应均匀分布，确保框架几何尺寸准确，焊点无裂纹。\",\n        \"safety_notes\": \"注意焊机接地良好，避免触电。点焊完成后，用角尺检查垂直度。\"\n      },\n      \"safety_warnings\": [\n        \"佩戴焊接面罩和防护手套，防止电弧光和焊渣飞溅。\",\n        \"确保焊机电源线和地线连接可靠，防止触电。\",\n        \"搬运矩形管时，注意其边缘可能锋利，佩戴防割手套，防止割伤。\",\n        \"点焊时注意周围环境，清除易燃物，防止火灾。\"\n      ]\n    },\n    {\n      \"step_number\": 4,\n      \"action\": \"安装侧面矩形管（短）\",\n      \"description\": \"将⑥号矩形管（4.36kg）放置在②号连接板的另一侧，与①号矩形管和⑧号矩形管形成封闭框架。⑥号矩形管的端面应与①号矩形管和⑧号矩形管的端面齐平。使用点焊固定。\",\n      \"position_description\": \"⑥号矩形管位于②号连接板的另一侧，与⑧号矩形管平行。\",\n      \"parts_used\": [\n        {\n          \"bom_seq\": \"6\",\n          \"bom_name\": \"矩形管 2\",\n          \"quantity\": 2,\n          \"drawing_number\": \"6\",\n          \"node_name\": [\n            \"NAUO10\",\n            \"NAUO9\"\n          ],\n          \"bom_code\": \"01.01.03.2719\"\n        }\n      ],\n      \"tools\": [\n        \"焊机\",\n        \"卷尺\",\n        \"角尺\"\n      ],\n      \"warnings\": [\n        \"确保矩形管框架的对角线尺寸一致，防止框架扭曲变形。\"\n      ],\n      \"welding\": {\n        \"required\": true,\n        \"welding_type\": \"角焊（定位焊）\",\n        \"welding_method\": \"CO2气保焊\",\n        \"weld_size\": \"点焊长度10-15mm，焊脚高度约3mm\",\n        \"welding_position\": \"零件⑥矩形管与零件②连接板的连接处，平焊/横焊\",\n        \"quality_requirements\": \"点焊后检查框架的对角线尺寸偏差，确保在允许范围内。\",\n        \"safety_notes\": \"清理焊接区域的油污和锈蚀，防止产生气孔。注意高温烫伤。\"\n      },\n      \"safety_warnings\": [\n        \"清理焊接区域时，佩戴防护眼镜和手套，防止铁屑和油污伤眼、伤手。\",\n        \"点焊完成后，不要直接用手触摸焊点和周围金属，防止高温烫伤。\",\n        \"确保工作台稳固，防止框架在点焊过程中倾倒或移动造成挤压伤害。\"\n      ]\n    },\n    {\n      \"step_number\": 5,\n      \"action\": \"安装挂件虚拟组件\",\n      \"description\": \"将④号右挂件虚拟组件和⑤号左挂件虚拟组件分别放置在矩形管框架的两端。挂件的安装面应与矩形管的侧面贴合，并确保挂件的孔位方向正确。使用点焊初步固定。\",\n      \"position_description\": \"④号右挂件安装在矩形管框架的右端，⑤号左挂件安装在矩形管框架的左端。\",\n      \"parts_used\": [\n        {\n          \"bom_seq\": \"4\",\n          \"bom_name\": \"右挂件虚拟组件 1\",\n          \"quantity\": 1,\n          \"drawing_number\": \"4\",\n          \"node_name\": [\n            \"NAUO18\",\n            \"NAUO20\",\n            \"NAUO19\"\n          ],\n          \"bom_code\": \"01.05.0018\"\n        },\n        {\n          \"bom_seq\": \"5\",\n          \"bom_name\": \"左挂件虚拟组件 1\",\n          \"quantity\": 1,\n          \"drawing_number\": \"5\",\n          \"node_name\": [\n            \"NAUO17\",\n            \"NAUO16\",\n            \"NAUO21\"\n          ],\n          \"bom_code\": \"01.05.0019\"\n        }\n      ],\n      \"tools\": [\n        \"焊机\",\n        \"卡尺\"\n      ],\n      \"warnings\": [\n        \"挂件的安装位置是关键尺寸，必须严格按照图纸要求定位，确保挂件的中心距和高度符合要求。\"\n      ],\n      \"welding\": {\n        \"required\": true,\n        \"welding_type\": \"角焊（定位焊）\",\n        \"welding_method\": \"CO2气保焊\",\n        \"weld_size\": \"点焊长度10-15mm，焊脚高度约3mm\",\n        \"welding_position\": \"零件④/⑤挂件与矩形管框架的连接处，平焊/横焊\",\n        \"quality_requirements\": \"定位焊后，使用卡尺或专用量具检查挂件的中心距和相对高度，确保精度。\",\n        \"safety_notes\": \"挂件定位焊时，注意保持姿势稳定，防止焊花飞溅到眼睛或皮肤。使用合格的防护面罩。\"\n      },\n      \"safety_warnings\": [\n        \"定位挂件时使用夹具固定，防止零件意外滑落或移动造成砸伤。\",\n        \"焊接时注意姿势，避免长时间弯腰或扭曲身体造成肌肉劳损。\",\n        \"确保焊枪和焊钳绝缘良好，防止手部触电。\"\n      ]\n    },\n    {\n      \"step_number\": 6,\n      \"action\": \"安装方形板\",\n      \"description\": \"将③号方形板-机加（共4块）分别放置在矩形管框架的四个角部，用于加强连接。方形板应紧贴矩形管和连接板的交接处。使用点焊固定。\",\n      \"position_description\": \"③号方形板安装在矩形管框架的四个角部，位于连接板的上方。\",\n      \"parts_used\": [\n        {\n          \"bom_seq\": \"3\",\n          \"bom_name\": \"方形板-机加 4\",\n          \"quantity\": 4,\n          \"drawing_number\": \"3\",\n          \"node_name\": [\n            \"NAUO6\",\n            \"NAUO5\",\n            \"NAUO4\",\n            \"NAUO3\"\n          ],\n          \"bom_code\": \"01.01.01.6589\"\n        }\n      ],\n      \"tools\": [\n        \"焊机\",\n        \"夹具\"\n      ],\n      \"warnings\": [\n        \"方形板的定位应确保不影响后续零件的安装，且焊缝应均匀。\"\n      ],\n      \"welding\": {\n        \"required\": true,\n        \"welding_type\": \"角焊（定位焊）\",\n        \"welding_method\": \"CO2气保焊\",\n        \"weld_size\": \"点焊长度10mm，焊脚高度约3mm\",\n        \"welding_position\": \"零件③方形板与矩形管/连接板的连接处，平焊/横焊\",\n        \"quality_requirements\": \"方形板与主体结构应紧密贴合，点焊位置应避开后续满焊的起始点。\",\n        \"safety_notes\": \"确保焊机电缆无破损，避免短路。焊接时注意周围环境，防止火灾。\"\n      },\n      \"safety_warnings\": [\n        \"方形板边缘可能锋利，搬运时必须佩戴防割手套，防止割伤。\",\n        \"使用夹具固定零件时，注意手指位置，防止被夹具或零件挤伤。\",\n        \"焊接作业时，确保灭火器材（如灭火器、消防沙）触手可及。\"\n      ]\n    },\n    {\n      \"step_number\": 7,\n      \"action\": \"安装封板\",\n      \"description\": \"将⑦号封板（共2块）安装在矩形管框架的内部，用于封闭结构。封板应与矩形管的内壁贴合。使用点焊固定。\",\n      \"position_description\": \"⑦号封板安装在矩形管框架内部，垂直于②号连接板。\",\n      \"parts_used\": [\n        {\n          \"bom_seq\": \"7\",\n          \"bom_name\": \"封板 2\",\n          \"quantity\": 2,\n          \"drawing_number\": \"7\",\n          \"node_name\": [\n            \"NAUO12\",\n            \"NAUO11\"\n          ],\n          \"bom_code\": \"01.01.01.16608\"\n        }\n      ],\n      \"tools\": [\n        \"焊机\",\n        \"卷尺\"\n      ],\n      \"warnings\": [\n        \"封板安装后，检查其平面度，避免因焊接应力导致变形。\"\n      ],\n      \"welding\": {\n        \"required\": true,\n        \"welding_type\": \"角焊（定位焊）\",\n        \"welding_method\": \"CO2气保焊\",\n        \"weld_size\": \"点焊长度10mm，焊脚高度约3mm\",\n        \"welding_position\": \"零件⑦封板与矩形管内壁的连接处，立焊/横焊\",\n        \"quality_requirements\": \"封板定位焊后，检查其与矩形管内壁的间隙，确保后续满焊质量。\",\n        \"safety_notes\": \"在狭小空间内进行点焊时，确保有足够的通风，防止有害气体聚集。\"\n      },\n      \"safety_warnings\": [\n        \"在框架内部进行焊接时，必须确保局部排风设施正常运行，防止烟尘浓度过高。\",\n        \"注意操作空间，防止身体或焊枪意外接触高温焊点造成烫伤。\",\n        \"使用绝缘良好的工具和垫板，防止在金属框架内操作时发生短路或触电。\"\n      ]\n    },\n    {\n      \"step_number\": 8,\n      \"action\": \"安装加强筋\",\n      \"description\": \"将⑨号加强筋（共2块）安装在组件的顶部，用于增强整体刚度。加强筋应与矩形管和连接板的相应位置贴合。使用点焊固定。\",\n      \"position_description\": \"⑨号加强筋安装在组件的顶部，位于矩形管框架的上方。\",\n      \"parts_used\": [\n        {\n          \"bom_seq\": \"9\",\n          \"bom_name\": \"加强筋 2\",\n          \"quantity\": 2,\n          \"drawing_number\": \"9\",\n          \"node_name\": [\n            \"NAUO15\",\n            \"NAUO14\"\n          ],\n          \"bom_code\": \"01.01.01.17678\"\n        }\n      ],\n      \"tools\": [\n        \"焊机\",\n        \"夹具\"\n      ],\n      \"warnings\": [\n        \"加强筋的安装位置应确保对称，并检查与主体结构的贴合度。\"\n      ],\n      \"welding\": {\n        \"required\": true,\n        \"welding_type\": \"角焊（定位焊）\",\n        \"welding_method\": \"CO2气保焊\",\n        \"weld_size\": \"点焊长度10mm，焊脚高度约3mm\",\n        \"welding_position\": \"零件⑨加强筋与矩形管/连接板的连接处，平焊\",\n        \"quality_requirements\": \"加强筋定位焊后，检查其对称性和垂直度，确保结构强度。\",\n        \"safety_notes\": \"使用夹具固定加强筋，防止焊接过程中零件移动。注意焊枪角度，确保熔深。\"\n      },\n      \"safety_warnings\": [\n        \"使用夹具固定加强筋时，确保夹紧力适中，防止零件弹出伤人。\",\n        \"焊接时，确保身体部位远离电弧光和飞溅物，避免皮肤灼伤。\",\n        \"检查工作区域地面是否平整干燥，防止因潮湿导致触电风险增加。\"\n      ]\n    },\n    {\n      \"step_number\": 9,\n      \"action\": \"满焊与校正\",\n      \"description\": \"对所有已点焊的零件连接处进行满焊。焊接顺序应遵循对称、分散原则，以减少焊接应力集中和变形。焊接完成后，对组件进行整体校正，确保关键尺寸和形位公差符合图纸要求。\",\n      \"position_description\": \"对所有零件的连接焊缝进行满焊。\",\n      \"parts_used\": [],\n      \"tools\": [\n        \"焊机\",\n        \"焊钳\",\n        \"校正平台\",\n        \"液压校正设备\"\n      ],\n      \"warnings\": [\n        \"焊接过程中注意通风和防火安全。\",\n        \"满焊后立即进行校正，趁热校正效果更佳，但需注意安全。\"\n      ],\n      \"welding\": {\n        \"required\": true,\n        \"welding_type\": \"角焊/对接焊（满焊）\",\n        \"welding_method\": \"CO2气保焊\",\n        \"weld_size\": \"未注焊缝焊脚高度按图纸要求，通常为板厚较薄零件的厚度（如6mm或8mm）\",\n        \"welding_position\": \"所有零件连接处，涉及平焊、横焊、立焊\",\n        \"quality_requirements\": \"焊缝必须连续、饱满，焊波均匀，无气孔、夹渣、裂纹、未熔合等缺陷。焊后清理焊渣和飞溅物，并进行外观检查。\",\n        \"safety_notes\": \"进行大面积焊接时，必须佩戴全套防护装备。注意控制焊接热输入，防止结构过热变形。焊接完成后，对焊缝进行冷却处理，避免快速冷却导致裂纹。\"\n      },\n      \"safety_warnings\": [\n        \"进行满焊时，必须佩戴全套焊接防护用品（面罩、手套、防护服），防止大面积灼伤。\",\n        \"确保焊接区域周围10米范围内无易燃易爆物品，并安排专人进行动火监护。\",\n        \"使用液压校正设备时，必须由专业人员操作，防止高压油管爆裂或结构突然变形伤人。\",\n        \"焊后清理焊渣和飞溅物时，使用专用工具，并佩戴防护眼镜，防止飞溅物伤眼。\",\n        \"校正后的结构温度较高，搬运或触摸时必须佩戴隔热手套，防止高温烫伤。\"\n      ]\n    }\n  ]\n}\n```",
  "parsed_result": {
    "enhanced_steps": [
      {
        "step_number": 1,
        "action": "放置基准件",
        "description": "使用行车将②号连接板（21.36kg）吊装到装配胎具上，作为整个组件的基准件。确保连接板放置平稳，并使用夹具初步固定。",
        "position_description": "连接板平放在工作台上，长边方向与装配胎具对齐。",
        "parts_used": [
          {
            "bom_seq": "2",
            "bom_name": "连接板 1",
            "quantity": 1,
            "drawing_number": "2",
            "node_name": [
              "NAUO2"
            ],
            "bom_code": "01.01.01.11509"
          }
        ],
        "tools": [
          "行车",
          "吊具",
          "装配胎具",
          "夹具"
        ],
        "warnings": [
          "连接板较重，吊装时注意安全，确保吊具牢固。",
          "放置时注意保护连接板表面，避免划伤。"
        ],
        "safety_warnings": [
          "吊装前检查行车和吊具是否完好，防止重物坠落伤人。",
          "吊装区域必须设置警戒线，非作业人员不得进入。",
          "指挥人员必须使用统一规范的手势或口令，确保吊装平稳。",
          "操作人员必须佩戴安全帽和防砸安全鞋，防止物体打击。"
        ]
      },
      {
        "step_number": 2,
        "action": "安装底部矩形管",
        "description": "将①号矩形管（14.56kg）放置在②号连接板的底部边缘，使其长边与连接板的长边对齐。使用点焊初步固定，确保位置准确。",
        "position_description": "①号矩形管位于②号连接板的底部，沿连接板的长度方向。",
        "parts_used": [
          {
            "bom_seq": "1",
            "bom_name": "矩形管 1",
            "quantity": 1,
            "drawing_number": "1",
            "node_name": [
              "NAUO1"
            ],
            "bom_code": "01.01.03.2718"
          }
        ],
        "tools": [
          "焊机",
          "卷尺",
          "角尺"
        ],
        "warnings": [
          "点焊时注意焊接电流和电压，防止烧穿。",
          "确保矩形管与连接板的相对位置符合图纸尺寸要求。"
        ],
        "welding": {
          "required": true,
          "welding_type": "角焊（定位焊）",
          "welding_method": "CO2气保焊",
          "weld_size": "点焊长度10-15mm，焊脚高度约3mm",
          "welding_position": "零件①矩形管与零件②连接板的连接处，平焊",
          "quality_requirements": "点焊牢固，位置准确，无虚焊、漏焊，点焊后清理焊渣。",
          "safety_notes": "佩戴焊接面罩、防护手套和防护服。确保工作区域通风良好，防止烟尘吸入。"
        },
        "safety_warnings": [
          "佩戴焊接面罩、防护手套和防护服，防止弧光灼伤和高温烫伤。",
          "确保焊机接地良好，电缆无破损，防止触电事故。",
          "焊接区域必须保持通风，防止焊接烟尘和有害气体中毒。",
          "点焊后清理焊渣时，佩戴防护眼镜，防止飞溅物伤眼。"
        ]
      },
      {
        "step_number": 3,
        "action": "安装侧面矩形管（长）",
        "description": "将⑧号矩形管（12.61kg）放置在②号连接板的侧面，与①号矩形管形成一个矩形框架。⑧号矩形管的端面应与①号矩形管的端面齐平。使用点焊固定。",
        "position_description": "⑧号矩形管位于②号连接板的侧面，垂直于①号矩形管。",
        "parts_used": [
          {
            "bom_seq": "8",
            "bom_name": "矩形管 1",
            "quantity": 1,
            "drawing_number": "8",
            "node_name": [
              "NAUO13"
            ],
            "bom_code": "01.01.03.2720"
          }
        ],
        "tools": [
          "焊机",
          "卷尺",
          "水平仪"
        ],
        "warnings": [
          "检查⑧号矩形管与②号连接板的垂直度，确保后续装配精度。"
        ],
        "welding": {
          "required": true,
          "welding_type": "角焊（定位焊）",
          "welding_method": "CO2气保焊",
          "weld_size": "点焊长度10-15mm，焊脚高度约3mm",
          "welding_position": "零件⑧矩形管与零件②连接板的连接处，平焊/横焊",
          "quality_requirements": "点焊位置应均匀分布，确保框架几何尺寸准确，焊点无裂纹。",
          "safety_notes": "注意焊机接地良好，避免触电。点焊完成后，用角尺检查垂直度。"
        },
        "safety_warnings": [
          "佩戴焊接面罩和防护手套，防止电弧光和焊渣飞溅。",
          "确保焊机电源线和地线连接可靠，防止触电。",
          "搬运矩形管时，注意其边缘可能锋利，佩戴防割手套，防止割伤。",
          "点焊时注意周围环境，清除易燃物，防止火灾。"
        ]
      },
      {
        "step_number": 4,
        "action": "安装侧面矩形管（短）",
        "description": "将⑥号矩形管（4.36kg）放置在②号连接板的另一侧，与①号矩形管和⑧号矩形管形成封闭框架。⑥号矩形管的端面应与①号矩形管和⑧号矩形管的端面齐平。使用点焊固定。",
        "position_description": "⑥号矩形管位于②号连接板的另一侧，与⑧号矩形管平行。",
        "parts_used": [
          {
            "bom_seq": "6",
            "bom_name": "矩形管 2",
            "quantity": 2,
            "drawing_number": "6",
            "node_name": [
              "NAUO10",
              "NAUO9"
            ],
            "bom_code": "01.01.03.2719"
          }
        ],
        "tools": [
          "焊机",
          "卷尺",
          "角尺"
        ],
        "warnings": [
          "确保矩形管框架的对角线尺寸一致，防止框架扭曲变形。"
        ],
        "welding": {
          "required": true,
          "welding_type": "角焊（定位焊）",
          "welding_method": "CO2气保焊",
          "weld_size": "点焊长度10-15mm，焊脚高度约3mm",
          "welding_position": "零件⑥矩形管与零件②连接板的连接处，平焊/横焊",
          "quality_requirements": "点焊后检查框架的对角线尺寸偏差，确保在允许范围内。",
          "safety_notes": "清理焊接区域的油污和锈蚀，防止产生气孔。注意高温烫伤。"
        },
        "safety_warnings": [
          "清理焊接区域时，佩戴防护眼镜和手套，防止铁屑和油污伤眼、伤手。",
          "点焊完成后，不要直接用手触摸焊点和周围金属，防止高温烫伤。",
          "确保工作台稳固，防止框架在点焊过程中倾倒或移动造成挤压伤害。"
        ]
      },
      {
        "step_number": 5,
        "action": "安装挂件虚拟组件",
        "description": "将④号右挂件虚拟组件和⑤号左挂件虚拟组件分别放置在矩形管框架的两端。挂件的安装面应与矩形管的侧面贴合，并确保挂件的孔位方向正确。使用点焊初步固定。",
        "position_description": "④号右挂件安装在矩形管框架的右端，⑤号左挂件安装在矩形管框架的左端。",
        "parts_used": [
          {
            "bom_seq": "4",
            "bom_name": "右挂件虚拟组件 1",
            "quantity": 1,
            "drawing_number": "4",
            "node_name": [
              "NAUO18",
              "NAUO20",
              "NAUO19"
            ],
            "bom_code": "01.05.0018"
          },
          {
            "bom_seq": "5",
            "bom_name": "左挂件虚拟组件 1",
            "quantity": 1,
            "drawing_number": "5",
            "node_name": [
              "NAUO17",
              "NAUO16",
              "NAUO21"
            ],
            "bom_code": "01.05.0019"
          }
        ],
        "tools": [
          "焊机",
          "卡尺"
        ],
        "warnings": [
          "挂件的安装位置是关键尺寸，必须严格按照图纸要求定位，确保挂件的中心距和高度符合要求。"
        ],
        "welding": {
          "required": true,
          "welding_type": "角焊（定位焊）",
          "welding_method": "CO2气保焊",
          "weld_size": "点焊长度10-15mm，焊脚高度约3mm",
          "welding_position": "零件④/⑤挂件与矩形管框架的连接处，平焊/横焊",
          "quality_requirements": "定位焊后，使用卡尺或专用量具检查挂件的中心距和相对高度，确保精度。",
          "safety_notes": "挂件定位焊时，注意保持姿势稳定，防止焊花飞溅到眼睛或皮肤。使用合格的防护面罩。"
        },
        "safety_warnings": [
          "定位挂件时使用夹具固定，防止零件意外滑落或移动造成砸伤。",
          "焊接时注意姿势，避免长时间弯腰或扭曲身体造成肌肉劳损。",
          "确保焊枪和焊钳绝缘良好，防止手部触电。"
        ]
      },
      {
        "step_number": 6,
        "action": "安装方形板",
        "description": "将③号方形板-机加（共4块）分别放置在矩形管框架的四个角部，用于加强连接。方形板应紧贴矩形管和连接板的交接处。使用点焊固定。",
        "position_description": "③号方形板安装在矩形管框架的四个角部，位于连接板的上方。",
        "parts_used": [
          {
            "bom_seq": "3",
            "bom_name": "方形板-机加 4",
            "quantity": 4,
            "drawing_number": "3",
            "node_name": [
              "NAUO6",
              "NAUO5",
              "NAUO4",
              "NAUO3"
            ],
            "bom_code": "01.01.01.6589"
          }
        ],
        "tools": [
          "焊机",
          "夹具"
        ],
        "warnings": [
          "方形板的定位应确保不影响后续零件的安装，且焊缝应均匀。"
        ],
        "welding": {
          "required": true,
          "welding_type": "角焊（定位焊）",
          "welding_method": "CO2气保焊",
          "weld_size": "点焊长度10mm，焊脚高度约3mm",
          "welding_position": "零件③方形板与矩形管/连接板的连接处，平焊/横焊",
          "quality_requirements": "方形板与主体结构应紧密贴合，点焊位置应避开后续满焊的起始点。",
          "safety_notes": "确保焊机电缆无破损，避免短路。焊接时注意周围环境，防止火灾。"
        },
        "safety_warnings": [
          "方形板边缘可能锋利，搬运时必须佩戴防割手套，防止割伤。",
          "使用夹具固定零件时，注意手指位置，防止被夹具或零件挤伤。",
          "焊接作业时，确保灭火器材（如灭火器、消防沙）触手可及。"
        ]
      },
      {
        "step_number": 7,
        "action": "安装封板",
        "description": "将⑦号封板（共2块）安装在矩形管框架的内部，用于封闭结构。封板应与矩形管的内壁贴合。使用点焊固定。",
        "position_description": "⑦号封板安装在矩形管框架内部，垂直于②号连接板。",
        "parts_used": [
          {
            "bom_seq": "7",
            "bom_name": "封板 2",
            "quantity": 2,
            "drawing_number": "7",
            "node_name": [
              "NAUO12",
              "NAUO11"
            ],
            "bom_code": "01.01.01.16608"
          }
        ],
        "tools": [
          "焊机",
          "卷尺"
        ],
        "warnings": [
          "封板安装后，检查其平面度，避免因焊接应力导致变形。"
        ],
        "welding": {
          "required": true,
          "welding_type": "角焊（定位焊）",
          "welding_method": "CO2气保焊",
          "weld_size": "点焊长度10mm，焊脚高度约3mm",
          "welding_position": "零件⑦封板与矩形管内壁的连接处，立焊/横焊",
          "quality_requirements": "封板定位焊后，检查其与矩形管内壁的间隙，确保后续满焊质量。",
          "safety_notes": "在狭小空间内进行点焊时，确保有足够的通风，防止有害气体聚集。"
        },
        "safety_warnings": [
          "在框架内部进行焊接时，必须确保局部排风设施正常运行，防止烟尘浓度过高。",
          "注意操作空间，防止身体或焊枪意外接触高温焊点造成烫伤。",
          "使用绝缘良好的工具和垫板，防止在金属框架内操作时发生短路或触电。"
        ]
      },
      {
        "step_number": 8,
        "action": "安装加强筋",
        "description": "将⑨号加强筋（共2块）安装在组件的顶部，用于增强整体刚度。加强筋应与矩形管和连接板的相应位置贴合。使用点焊固定。",
        "position_description": "⑨号加强筋安装在组件的顶部，位于矩形管框架的上方。",
        "parts_used": [
          {
            "bom_seq": "9",
            "bom_name": "加强筋 2",
            "quantity": 2,
            "drawing_number": "9",
            "node_name": [
              "NAUO15",
              "NAUO14"
            ],
            "bom_code": "01.01.01.17678"
          }
        ],
        "tools": [
          "焊机",
          "夹具"
        ],
        "warnings": [
          "加强筋的安装位置应确保对称，并检查与主体结构的贴合度。"
        ],
        "welding": {
          "required": true,
          "welding_type": "角焊（定位焊）",
          "welding_method": "CO2气保焊",
          "weld_size": "点焊长度10mm，焊脚高度约3mm",
          "welding_position": "零件⑨加强筋与矩形管/连接板的连接处，平焊",
          "quality_requirements": "加强筋定位焊后，检查其对称性和垂直度，确保结构强度。",
          "safety_notes": "使用夹具固定加强筋，防止焊接过程中零件移动。注意焊枪角度，确保熔深。"
        },
        "safety_warnings": [
          "使用夹具固定加强筋时，确保夹紧力适中，防止零件弹出伤人。",
          "焊接时，确保身体部位远离电弧光和飞溅物，避免皮肤灼伤。",
          "检查工作区域地面是否平整干燥，防止因潮湿导致触电风险增加。"
        ]
      },
      {
        "step_number": 9,
        "action": "满焊与校正",
        "description": "对所有已点焊的零件连接处进行满焊。焊接顺序应遵循对称、分散原则，以减少焊接应力集中和变形。焊接完成后，对组件进行整体校正，确保关键尺寸和形位公差符合图纸要求。",
        "position_description": "对所有零件的连接焊缝进行满焊。",
        "parts_used": [],
        "tools": [
          "焊机",
          "焊钳",
          "校正平台",
          "液压校正设备"
        ],
        "warnings": [
          "焊接过程中注意通风和防火安全。",
          "满焊后立即进行校正，趁热校正效果更佳，但需注意安全。"
        ],
        "welding": {
          "required": true,
          "welding_type": "角焊/对接焊（满焊）",
          "welding_method": "CO2气保焊",
          "weld_size": "未注焊缝焊脚高度按图纸要求，通常为板厚较薄零件的厚度（如6mm或8mm）",
          "welding_position": "所有零件连接处，涉及平焊、横焊、立焊",
          "quality_requirements": "焊缝必须连续、饱满，焊波均匀，无气孔、夹渣、裂纹、未熔合等缺陷。焊后清理焊渣和飞溅物，并进行外观检查。",
          "safety_notes": "进行大面积焊接时，必须佩戴全套防护装备。注意控制焊接热输入，防止结构过热变形。焊接完成后，对焊缝进行冷却处理，避免快速冷却导致裂纹。"
        },
        "safety_warnings": [
          "进行满焊时，必须佩戴全套焊接防护用品（面罩、手套、防护服），防止大面积灼伤。",
          "确保焊接区域周围10米范围内无易燃易爆物品，并安排专人进行动火监护。",
          "使用液压校正设备时，必须由专业人员操作，防止高压油管爆裂或结构突然变形伤人。",
          "焊后清理焊渣和飞溅物时，使用专用工具，并佩戴防护眼镜，防止飞溅物伤眼。",
          "校正后的结构温度较高，搬运或触摸时必须佩戴隔热手套，防止高温烫伤。"
        ]
      }
    ]
  }
}