{
  "agent_name": "Agent6_FAQ",
  "model": "google/gemini-2.5-flash-preview-09-2025",
  "timestamp": "20251004_225445",
  "image_count": 0,
  "temperature": 0.2,
  "system_prompt": "你是安全工程师李师傅，拥有20年安全管理经验。\n\n你的任务：为每个装配步骤添加安全警告（如果该步骤有安全风险）。\n\n## 核心原则\n\n1. **安全第一**：识别所有潜在的安全风险\n2. **嵌入警告**：为有风险的步骤添加safety_warnings字段\n3. **工人友好**：使用通俗语言，避免专业术语\n\n## 输出格式\n\n严格按照以下JSON格式输出（返回增强后的装配步骤）：\n\n```json\n{\n  \"enhanced_steps\": [\n    {\n      \"step_number\": 1,\n      \"title\": \"步骤标题\",\n      \"parts_used\": [...],\n      \"tools_required\": [...],\n      \"operation\": \"操作说明\",\n      \"quality_check\": \"质量检查\",\n      \"estimated_time_minutes\": 10,\n      \"welding\": {...},\n      \"safety_warnings\": [\n        \"佩戴安全帽和防护眼镜\",\n        \"确保工件固定牢固\",\n        \"注意防止烫伤\"\n      ]\n    }\n  ]\n}\n```\n\n**⚠️ 重要**：\n- 如果步骤没有安全风险，不要添加safety_warnings字段\n- 如果步骤有安全风险，safety_warnings必须是字符串数组\n- 保持原有步骤的所有字段不变，只添加safety_warnings字段\n\n## 重要提醒\n\n- **只输出JSON，不要输出其他内容**\n- **安全警告要具体**：说明具体的风险和预防措施\n- **使用通俗语言**：工人能看懂的语言\n",
  "user_query": "请为以下装配步骤添加安全警告（如果有安全风险）。\n\n## 装配步骤\n\n[\n  {\n    \"step_number\": 1,\n    \"title\": \"安装主体矩形管框架\",\n    \"action\": \"拼装定位\",\n    \"description\": \"将图纸上标注为②的连接板（01.01.01.11509）平稳放置在拼装平台上作为基准件。将图纸上标注为①的矩形管（01.01.03.2718）和标注为⑧的矩形管（01.01.03.2720）分别定位在连接板②的两侧，确保它们与连接板②的端面和底部对齐。\",\n    \"position_description\": \"矩形管①和⑧分别位于连接板②的两侧，形成框架的左右立柱。\",\n    \"parts_used\": [\n      {\n        \"bom_code\": \"01.01.01.11509\",\n        \"bom_name\": \"连接板\",\n        \"quantity\": 1,\n        \"drawing_number\": \"②\",\n        \"mesh_id\": [\n          \"mesh_018\"\n        ]\n      },\n      {\n        \"bom_code\": \"01.01.03.2718\",\n        \"bom_name\": \"矩形管 1\",\n        \"quantity\": 1,\n        \"drawing_number\": \"①\"\n      },\n      {\n        \"bom_code\": \"01.01.03.2720\",\n        \"bom_name\": \"矩形管 1\",\n        \"quantity\": 1,\n        \"drawing_number\": \"⑧\",\n        \"mesh_id\": [\n          \"mesh_003\",\n          \"mesh_006\",\n          \"mesh_007\",\n          \"mesh_019\"\n        ]\n      }\n    ],\n    \"tools\": [\n      \"拼装平台\",\n      \"角尺\",\n      \"磁力夹具\"\n    ],\n    \"warnings\": [\n      \"确保矩形管与连接板的垂直度，使用磁力夹具临时固定，防止移动。\"\n    ],\n    \"welding\": {\n      \"required\": true,\n      \"welding_type\": \"角焊\",\n      \"welding_method\": \"CO2气保焊（或根据图纸要求）\",\n      \"weld_size\": \"点焊，焊点长度约10mm，焊脚高度4mm\",\n      \"welding_position\": \"矩形管①和⑧与连接板②的接触面（四角点焊）\",\n      \"quality_requirements\": \"点焊牢固，用于临时固定，保证后续焊接前结构不位移。\",\n      \"safety_notes\": \"佩戴焊接面罩和手套，确保工作区域通风良好，防止火灾。\"\n    }\n  },\n  {\n    \"step_number\": 2,\n    \"title\": \"安装中间矩形管\",\n    \"action\": \"拼装定位\",\n    \"description\": \"取出图纸上标注为⑥的矩形管（01.01.03.2719，数量2个）。将这两个矩形管⑥分别定位在步骤1安装的矩形管①和⑧之间，根据图纸尺寸（如970mm、1120mm等）确定其精确位置。\",\n    \"position_description\": \"矩形管⑥位于矩形管①和⑧之间，作为内部支撑。\",\n    \"parts_used\": [\n      {\n        \"bom_code\": \"01.01.03.2719\",\n        \"bom_name\": \"矩形管 2\",\n        \"quantity\": 2,\n        \"drawing_number\": \"⑥\"\n      }\n    ],\n    \"tools\": [\n      \"卷尺\",\n      \"角尺\",\n      \"定位销\"\n    ],\n    \"warnings\": [\n      \"确保矩形管⑥与①和⑧的端面贴合紧密，尺寸定位准确。\"\n    ],\n    \"welding\": {\n      \"required\": true,\n      \"welding_type\": \"角焊\",\n      \"welding_method\": \"CO2气保焊\",\n      \"weld_size\": \"点焊，焊点长度约10mm，焊脚高度4mm\",\n      \"welding_position\": \"矩形管⑥与矩形管①和⑧的连接端面（每端点焊2点）\",\n      \"quality_requirements\": \"点焊牢固，用于临时固定，保证尺寸精度。\",\n      \"safety_notes\": \"注意焊接时产生的烟尘，使用局部排风设备，避免吸入有害气体。\"\n    }\n  },\n  {\n    \"step_number\": 3,\n    \"title\": \"安装封板和加强筋\",\n    \"action\": \"拼装定位\",\n    \"description\": \"取出图纸上标注为⑦的封板（01.01.01.16608，数量2个）。将封板⑦定位并拼装到框架的上方和下方（或前后侧，根据图示）。同时，将图纸上标注为⑨的加强筋（01.01.01.17678，数量2个）定位在框架的指定加强位置（通常在连接板②与矩形管的连接处）。\",\n    \"position_description\": \"封板⑦覆盖在框架结构上，加强筋⑨安装在结构连接处。\",\n    \"parts_used\": [\n      {\n        \"bom_code\": \"01.01.01.16608\",\n        \"bom_name\": \"封板 2\",\n        \"quantity\": 2,\n        \"drawing_number\": \"⑦\",\n        \"mesh_id\": [\n          \"mesh_004\"\n        ]\n      },\n      {\n        \"bom_code\": \"01.01.01.17678\",\n        \"bom_name\": \"加强筋 2\",\n        \"quantity\": 2,\n        \"drawing_number\": \"⑨\",\n        \"mesh_id\": [\n          \"mesh_001\"\n        ]\n      }\n    ],\n    \"tools\": [\n      \"磁力夹具\"\n    ],\n    \"warnings\": [\n      \"封板⑦的边缘应与框架边缘对齐，加强筋⑨应紧贴连接面。\"\n    ],\n    \"welding\": {\n      \"required\": true,\n      \"welding_type\": \"角焊\",\n      \"welding_method\": \"CO2气保焊\",\n      \"weld_size\": \"点焊，焊点长度约10mm，焊脚高度4mm\",\n      \"welding_position\": \"封板⑦与矩形管的接触边缘；加强筋⑨与连接板②和矩形管的接触面\",\n      \"quality_requirements\": \"点焊牢固，保证零件在最终焊接前不移位。\",\n      \"safety_notes\": \"注意板材较薄，点焊时控制热输入，防止烧穿或变形。\"\n    }\n  },\n  {\n    \"step_number\": 4,\n    \"title\": \"安装挂件和方形板\",\n    \"action\": \"拼装定位\",\n    \"description\": \"取出图纸上标注为④的右挂件虚拟组件（01.05.0018）和标注为⑤的左挂件虚拟组件（01.05.0019），将它们分别定位在框架的两端，确保挂件的安装方向正确。同时，将图纸上标注为③的方形板（01.01.01.6589，数量4个）定位在框架的指定安装孔位上。\",\n    \"position_description\": \"挂件④和⑤安装在框架的两端，方形板③安装在框架的侧面或底部。\",\n    \"parts_used\": [\n      {\n        \"bom_code\": \"01.05.0018\",\n        \"bom_name\": \"右挂件虚拟组件 1\",\n        \"quantity\": 1,\n        \"drawing_number\": \"④\",\n        \"mesh_id\": [\n          \"mesh_010\"\n        ]\n      },\n      {\n        \"bom_code\": \"01.05.0019\",\n        \"bom_name\": \"左挂件虚拟组件 1\",\n        \"quantity\": 1,\n        \"drawing_number\": \"⑤\",\n        \"mesh_id\": [\n          \"mesh_009\"\n        ]\n      },\n      {\n        \"bom_code\": \"01.01.01.6589\",\n        \"bom_name\": \"方形板-机加 4\",\n        \"quantity\": 4,\n        \"drawing_number\": \"③\",\n        \"mesh_id\": [\n          \"mesh_014\"\n        ]\n      }\n    ],\n    \"tools\": [\n      \"定位夹具\"\n    ],\n    \"warnings\": [\n      \"挂件组件的定位必须精确，确保后续功能正常。方形板③需与安装面贴合。\"\n    ],\n    \"welding\": {\n      \"required\": true,\n      \"welding_type\": \"角焊\",\n      \"welding_method\": \"CO2气保焊\",\n      \"weld_size\": \"点焊，焊点长度约10mm，焊脚高度4mm\",\n      \"welding_position\": \"挂件④和⑤与矩形管的连接处；方形板③与框架的连接边缘\",\n      \"quality_requirements\": \"挂件定位精度要求高，点焊时需复核尺寸。\",\n      \"safety_notes\": \"挂件组件可能较重，操作时注意防砸伤，焊接前确保夹具夹紧。\"\n    }\n  },\n  {\n    \"step_number\": 5,\n    \"title\": \"焊接与校正\",\n    \"action\": \"焊接与校正\",\n    \"description\": \"在所有零件（①、②、③、④、⑤、⑥、⑦、⑧、⑨）定位完成后，按照图纸上的焊接符号和技术要求（如焊缝大小、位置）进行全面焊接（工艺代码08.01）。焊接完成后，进行焊渣清理，并对组件进行校正（工艺代码08.05），确保整体尺寸和形位公差符合要求。\",\n    \"position_description\": \"对所有零件的连接处进行焊接。\",\n    \"parts_used\": [],\n    \"tools\": [\n      \"焊机\",\n      \"焊枪\",\n      \"焊条/焊丝\",\n      \"角磨机\",\n      \"校正平台\",\n      \"水平仪\"\n    ],\n    \"warnings\": [\n      \"焊接时注意选择合适的电流和电压，确保焊缝牢固，无虚焊、漏焊。校正时注意保护组件表面，避免损伤。\"\n    ],\n    \"welding\": {\n      \"required\": true,\n      \"welding_type\": \"角焊/塞焊（根据图纸）\",\n      \"welding_method\": \"CO2气保焊\",\n      \"weld_size\": \"焊脚高度6mm（或根据图纸标注的焊缝符号）\",\n      \"welding_position\": \"所有零件的连接面，进行连续焊或间断焊\",\n      \"quality_requirements\": \"焊缝必须饱满、均匀，无气孔、夹渣、裂纹等缺陷。焊后清理焊渣和飞溅，并进行外观检查。\",\n      \"safety_notes\": \"进行连续焊接时，注意控制焊接顺序，减少热变形。焊接工作结束后，必须清理现场，确保电源切断，并检查是否有火种残留。\"\n    }\n  }\n]\n\n## 要求\n\n1. **识别风险步骤**：判断哪些步骤有安全风险（吊装、焊接、高空作业、重物搬运等）\n2. **添加安全警告**：为有风险的步骤添加safety_warnings字段\n3. **保持原有字段**：不要修改或删除原有的字段（step_number、title、welding等）\n4. **使用通俗语言**：工人能看懂的语言\n5. **警告要具体**：说明具体的风险和预防措施\n\n## 自检清单\n\n- [ ] 所有有风险的步骤都添加了safety_warnings字段\n- [ ] safety_warnings是字符串数组，每条警告简洁明了\n- [ ] 原有步骤的所有字段都保持不变\n- [ ] 没有风险的步骤没有添加safety_warnings字段\n\n现在开始为装配步骤添加安全警告！\n",
  "raw_response": "```json\n{\n  \"enhanced_steps\": [\n    {\n      \"step_number\": 1,\n      \"title\": \"安装主体矩形管框架\",\n      \"action\": \"拼装定位\",\n      \"description\": \"将图纸上标注为②的连接板（01.01.01.11509）平稳放置在拼装平台上作为基准件。将图纸上标注为①的矩形管（01.01.03.2718）和标注为⑧的矩形管（01.01.03.2720）分别定位在连接板②的两侧，确保它们与连接板②的端面和底部对齐。\",\n      \"position_description\": \"矩形管①和⑧分别位于连接板②的两侧，形成框架的左右立柱。\",\n      \"parts_used\": [\n        {\n          \"bom_code\": \"01.01.01.11509\",\n          \"bom_name\": \"连接板\",\n          \"quantity\": 1,\n          \"drawing_number\": \"②\",\n          \"mesh_id\": [\n            \"mesh_018\"\n          ]\n        },\n        {\n          \"bom_code\": \"01.01.03.2718\",\n          \"bom_name\": \"矩形管 1\",\n          \"quantity\": 1,\n          \"drawing_number\": \"①\"\n        },\n        {\n          \"bom_code\": \"01.01.03.2720\",\n          \"bom_name\": \"矩形管 1\",\n          \"quantity\": 1,\n          \"drawing_number\": \"⑧\",\n          \"mesh_id\": [\n            \"mesh_003\",\n            \"mesh_006\",\n            \"mesh_007\",\n            \"mesh_019\"\n          ]\n        }\n      ],\n      \"tools\": [\n        \"拼装平台\",\n        \"角尺\",\n        \"磁力夹具\"\n      ],\n      \"warnings\": [\n        \"确保矩形管与连接板的垂直度，使用磁力夹具临时固定，防止移动。\"\n      ],\n      \"welding\": {\n        \"required\": true,\n        \"welding_type\": \"角焊\",\n        \"welding_method\": \"CO2气保焊（或根据图纸要求）\",\n        \"weld_size\": \"点焊，焊点长度约10mm，焊脚高度4mm\",\n        \"welding_position\": \"矩形管①和⑧与连接板②的接触面（四角点焊）\",\n        \"quality_requirements\": \"点焊牢固，用于临时固定，保证后续焊接前结构不位移。\",\n        \"safety_notes\": \"佩戴焊接面罩和手套，确保工作区域通风良好，防止火灾。\"\n      },\n      \"safety_warnings\": [\n        \"搬运较重的矩形管时，请使用合适的吊具或两人协作，防止扭伤或砸伤脚。\",\n        \"进行点焊操作时，必须佩戴好焊接防护用品（面罩、手套、防护服），防止电弧光伤害眼睛和皮肤。\",\n        \"确保工作区域通风良好，避免吸入焊接烟尘。\"\n      ]\n    },\n    {\n      \"step_number\": 2,\n      \"title\": \"安装中间矩形管\",\n      \"action\": \"拼装定位\",\n      \"description\": \"取出图纸上标注为⑥的矩形管（01.01.03.2719，数量2个）。将这两个矩形管⑥分别定位在步骤1安装的矩形管①和⑧之间，根据图纸尺寸（如970mm、1120mm等）确定其精确位置。\",\n      \"position_description\": \"矩形管⑥位于矩形管①和⑧之间，作为内部支撑。\",\n      \"parts_used\": [\n        {\n          \"bom_code\": \"01.01.03.2719\",\n          \"bom_name\": \"矩形管 2\",\n          \"quantity\": 2,\n          \"drawing_number\": \"⑥\"\n        }\n      ],\n      \"tools\": [\n        \"卷尺\",\n        \"角尺\",\n        \"定位销\"\n      ],\n      \"warnings\": [\n        \"确保矩形管⑥与①和⑧的端面贴合紧密，尺寸定位准确。\"\n      ],\n      \"welding\": {\n        \"required\": true,\n        \"welding_type\": \"角焊\",\n        \"welding_method\": \"CO2气保焊\",\n        \"weld_size\": \"点焊，焊点长度约10mm，焊脚高度4mm\",\n        \"welding_position\": \"矩形管⑥与矩形管①和⑧的连接端面（每端点焊2点）\",\n        \"quality_requirements\": \"点焊牢固，用于临时固定，保证尺寸精度。\",\n        \"safety_notes\": \"注意焊接时产生的烟尘，使用局部排风设备，避免吸入有害气体。\"\n      },\n      \"safety_warnings\": [\n        \"进行点焊操作时，必须佩戴好焊接防护用品，防止电弧光和飞溅物伤害。\",\n        \"使用定位销和夹具时，确保夹紧力适中，防止零件弹出伤人。\"\n      ]\n    },\n    {\n      \"step_number\": 3,\n      \"title\": \"安装封板和加强筋\",\n      \"action\": \"拼装定位\",\n      \"description\": \"取出图纸上标注为⑦的封板（01.01.01.16608，数量2个）。将封板⑦定位并拼装到框架的上方和下方（或前后侧，根据图示）。同时，将图纸上标注为⑨的加强筋（01.01.01.17678，数量2个）定位在框架的指定加强位置（通常在连接板②与矩形管的连接处）。\",\n      \"position_description\": \"封板⑦覆盖在框架结构上，加强筋⑨安装在结构连接处。\",\n      \"parts_used\": [\n        {\n          \"bom_code\": \"01.01.01.16608\",\n          \"bom_name\": \"封板 2\",\n          \"quantity\": 2,\n          \"drawing_number\": \"⑦\",\n          \"mesh_id\": [\n            \"mesh_004\"\n          ]\n        },\n        {\n          \"bom_code\": \"01.01.01.17678\",\n          \"bom_name\": \"加强筋 2\",\n          \"quantity\": 2,\n          \"drawing_number\": \"⑨\",\n          \"mesh_id\": [\n            \"mesh_001\"\n          ]\n        }\n      ],\n      \"tools\": [\n        \"磁力夹具\"\n      ],\n      \"warnings\": [\n        \"封板⑦的边缘应与框架边缘对齐，加强筋⑨应紧贴连接面。\"\n      ],\n      \"welding\": {\n        \"required\": true,\n        \"welding_type\": \"角焊\",\n        \"welding_method\": \"CO2气保焊\",\n        \"weld_size\": \"点焊，焊点长度约10mm，焊脚高度4mm\",\n        \"welding_position\": \"封板⑦与矩形管的接触边缘；加强筋⑨与连接板②和矩形管的接触面\",\n        \"quality_requirements\": \"点焊牢固，保证零件在最终焊接前不移位。\",\n        \"safety_notes\": \"注意板材较薄，点焊时控制热输入，防止烧穿或变形。\"\n      },\n      \"safety_warnings\": [\n        \"薄板边缘可能锋利，操作时请佩戴防割手套，防止划伤。\",\n        \"点焊时注意控制电流，避免因烧穿薄板造成烫伤或损坏工件。\"\n      ]\n    },\n    {\n      \"step_number\": 4,\n      \"title\": \"安装挂件和方形板\",\n      \"action\": \"拼装定位\",\n      \"description\": \"取出图纸上标注为④的右挂件虚拟组件（01.05.0018）和标注为⑤的左挂件虚拟组件（01.05.0019），将它们分别定位在框架的两端，确保挂件的安装方向正确。同时，将图纸上标注为③的方形板（01.01.01.6589，数量4个）定位在框架的指定安装孔位上。\",\n      \"position_description\": \"挂件④和⑤安装在框架的两端，方形板③安装在框架的侧面或底部。\",\n      \"parts_used\": [\n        {\n          \"bom_code\": \"01.05.0018\",\n          \"bom_name\": \"右挂件虚拟组件 1\",\n          \"quantity\": 1,\n          \"drawing_number\": \"④\",\n          \"mesh_id\": [\n            \"mesh_010\"\n          ]\n        },\n        {\n          \"bom_code\": \"01.05.0019\",\n          \"bom_name\": \"左挂件虚拟组件 1\",\n          \"quantity\": 1,\n          \"drawing_number\": \"⑤\",\n          \"mesh_id\": [\n            \"mesh_009\"\n          ]\n        },\n        {\n          \"bom_code\": \"01.01.01.6589\",\n          \"bom_name\": \"方形板-机加 4\",\n          \"quantity\": 4,\n          \"drawing_number\": \"③\",\n          \"mesh_id\": [\n            \"mesh_014\"\n          ]\n        }\n      ],\n      \"tools\": [\n        \"定位夹具\"\n      ],\n      \"warnings\": [\n        \"挂件组件的定位必须精确，确保后续功能正常。方形板③需与安装面贴合。\"\n      ],\n      \"welding\": {\n        \"required\": true,\n        \"welding_type\": \"角焊\",\n        \"welding_method\": \"CO2气保焊\",\n        \"weld_size\": \"点焊，焊点长度约10mm，焊脚高度4mm\",\n        \"welding_position\": \"挂件④和⑤与矩形管的连接处；方形板③与框架的连接边缘\",\n        \"quality_requirements\": \"挂件定位精度要求高，点焊时需复核尺寸。\",\n        \"safety_notes\": \"挂件组件可能较重，操作时注意防砸伤，焊接前确保夹具夹紧。\"\n      },\n      \"safety_warnings\": [\n        \"挂件组件（④和⑤）可能较重，搬运和定位时要小心，防止组件滑落或砸伤手脚。\",\n        \"使用定位夹具时，确保夹具牢固可靠，防止焊接过程中组件移位或弹出。\"\n      ]\n    },\n    {\n      \"step_number\": 5,\n      \"title\": \"焊接与校正\",\n      \"action\": \"焊接与校正\",\n      \"description\": \"在所有零件（①、②、③、④、⑤、⑥、⑦、⑧、⑨）定位完成后，按照图纸上的焊接符号和技术要求（如焊缝大小、位置）进行全面焊接（工艺代码08.01）。焊接完成后，进行焊渣清理，并对组件进行校正（工艺代码08.05），确保整体尺寸和形位公差符合要求。\",\n      \"position_description\": \"对所有零件的连接处进行焊接。\",\n      \"parts_used\": [],\n      \"tools\": [\n        \"焊机\",\n        \"焊枪\",\n        \"焊条/焊丝\",\n        \"角磨机\",\n        \"校正平台\",\n        \"水平仪\"\n      ],\n      \"warnings\": [\n        \"焊接时注意选择合适的电流和电压，确保焊缝牢固，无虚焊、漏焊。校正时注意保护组件表面，避免损伤。\"\n      ],\n      \"welding\": {\n        \"required\": true,\n        \"welding_type\": \"角焊/塞焊（根据图纸）\",\n        \"welding_method\": \"CO2气保焊\",\n        \"weld_size\": \"焊脚高度6mm（或根据图纸标注的焊缝符号）\",\n        \"welding_position\": \"所有零件的连接面，进行连续焊或间断焊\",\n        \"quality_requirements\": \"焊缝必须饱满、均匀，无气孔、夹渣、裂纹等缺陷。焊后清理焊渣和飞溅，并进行外观检查。\",\n        \"safety_notes\": \"进行连续焊接时，注意控制焊接顺序，减少热变形。焊接工作结束后，必须清理现场，确保电源切断，并检查是否有火种残留。\"\n      },\n      \"safety_warnings\": [\n        \"进行全面焊接时，必须严格遵守焊接安全规范：佩戴全套防护用品（面罩、手套、阻燃服）。\",\n        \"确保焊接区域有足够的通风或排烟设备，防止有害气体中毒。\",\n        \"使用角磨机清理焊渣和飞溅时，必须佩戴防护眼镜和耳塞，防止飞溅物伤眼和噪音损伤听力。\",\n        \"焊接完成后，工件温度很高，处理或校正时必须佩戴隔热手套，防止烫伤。\",\n        \"检查灭火器材是否可用，防止焊接火花引发火灾。\"\n      ]\n    }\n  ]\n}\n```",
  "parsed_result": {
    "enhanced_steps": [
      {
        "step_number": 1,
        "title": "安装主体矩形管框架",
        "action": "拼装定位",
        "description": "将图纸上标注为②的连接板（01.01.01.11509）平稳放置在拼装平台上作为基准件。将图纸上标注为①的矩形管（01.01.03.2718）和标注为⑧的矩形管（01.01.03.2720）分别定位在连接板②的两侧，确保它们与连接板②的端面和底部对齐。",
        "position_description": "矩形管①和⑧分别位于连接板②的两侧，形成框架的左右立柱。",
        "parts_used": [
          {
            "bom_code": "01.01.01.11509",
            "bom_name": "连接板",
            "quantity": 1,
            "drawing_number": "②",
            "mesh_id": [
              "mesh_018"
            ]
          },
          {
            "bom_code": "01.01.03.2718",
            "bom_name": "矩形管 1",
            "quantity": 1,
            "drawing_number": "①"
          },
          {
            "bom_code": "01.01.03.2720",
            "bom_name": "矩形管 1",
            "quantity": 1,
            "drawing_number": "⑧",
            "mesh_id": [
              "mesh_003",
              "mesh_006",
              "mesh_007",
              "mesh_019"
            ]
          }
        ],
        "tools": [
          "拼装平台",
          "角尺",
          "磁力夹具"
        ],
        "warnings": [
          "确保矩形管与连接板的垂直度，使用磁力夹具临时固定，防止移动。"
        ],
        "welding": {
          "required": true,
          "welding_type": "角焊",
          "welding_method": "CO2气保焊（或根据图纸要求）",
          "weld_size": "点焊，焊点长度约10mm，焊脚高度4mm",
          "welding_position": "矩形管①和⑧与连接板②的接触面（四角点焊）",
          "quality_requirements": "点焊牢固，用于临时固定，保证后续焊接前结构不位移。",
          "safety_notes": "佩戴焊接面罩和手套，确保工作区域通风良好，防止火灾。"
        },
        "safety_warnings": [
          "搬运较重的矩形管时，请使用合适的吊具或两人协作，防止扭伤或砸伤脚。",
          "进行点焊操作时，必须佩戴好焊接防护用品（面罩、手套、防护服），防止电弧光伤害眼睛和皮肤。",
          "确保工作区域通风良好，避免吸入焊接烟尘。"
        ]
      },
      {
        "step_number": 2,
        "title": "安装中间矩形管",
        "action": "拼装定位",
        "description": "取出图纸上标注为⑥的矩形管（01.01.03.2719，数量2个）。将这两个矩形管⑥分别定位在步骤1安装的矩形管①和⑧之间，根据图纸尺寸（如970mm、1120mm等）确定其精确位置。",
        "position_description": "矩形管⑥位于矩形管①和⑧之间，作为内部支撑。",
        "parts_used": [
          {
            "bom_code": "01.01.03.2719",
            "bom_name": "矩形管 2",
            "quantity": 2,
            "drawing_number": "⑥"
          }
        ],
        "tools": [
          "卷尺",
          "角尺",
          "定位销"
        ],
        "warnings": [
          "确保矩形管⑥与①和⑧的端面贴合紧密，尺寸定位准确。"
        ],
        "welding": {
          "required": true,
          "welding_type": "角焊",
          "welding_method": "CO2气保焊",
          "weld_size": "点焊，焊点长度约10mm，焊脚高度4mm",
          "welding_position": "矩形管⑥与矩形管①和⑧的连接端面（每端点焊2点）",
          "quality_requirements": "点焊牢固，用于临时固定，保证尺寸精度。",
          "safety_notes": "注意焊接时产生的烟尘，使用局部排风设备，避免吸入有害气体。"
        },
        "safety_warnings": [
          "进行点焊操作时，必须佩戴好焊接防护用品，防止电弧光和飞溅物伤害。",
          "使用定位销和夹具时，确保夹紧力适中，防止零件弹出伤人。"
        ]
      },
      {
        "step_number": 3,
        "title": "安装封板和加强筋",
        "action": "拼装定位",
        "description": "取出图纸上标注为⑦的封板（01.01.01.16608，数量2个）。将封板⑦定位并拼装到框架的上方和下方（或前后侧，根据图示）。同时，将图纸上标注为⑨的加强筋（01.01.01.17678，数量2个）定位在框架的指定加强位置（通常在连接板②与矩形管的连接处）。",
        "position_description": "封板⑦覆盖在框架结构上，加强筋⑨安装在结构连接处。",
        "parts_used": [
          {
            "bom_code": "01.01.01.16608",
            "bom_name": "封板 2",
            "quantity": 2,
            "drawing_number": "⑦",
            "mesh_id": [
              "mesh_004"
            ]
          },
          {
            "bom_code": "01.01.01.17678",
            "bom_name": "加强筋 2",
            "quantity": 2,
            "drawing_number": "⑨",
            "mesh_id": [
              "mesh_001"
            ]
          }
        ],
        "tools": [
          "磁力夹具"
        ],
        "warnings": [
          "封板⑦的边缘应与框架边缘对齐，加强筋⑨应紧贴连接面。"
        ],
        "welding": {
          "required": true,
          "welding_type": "角焊",
          "welding_method": "CO2气保焊",
          "weld_size": "点焊，焊点长度约10mm，焊脚高度4mm",
          "welding_position": "封板⑦与矩形管的接触边缘；加强筋⑨与连接板②和矩形管的接触面",
          "quality_requirements": "点焊牢固，保证零件在最终焊接前不移位。",
          "safety_notes": "注意板材较薄，点焊时控制热输入，防止烧穿或变形。"
        },
        "safety_warnings": [
          "薄板边缘可能锋利，操作时请佩戴防割手套，防止划伤。",
          "点焊时注意控制电流，避免因烧穿薄板造成烫伤或损坏工件。"
        ]
      },
      {
        "step_number": 4,
        "title": "安装挂件和方形板",
        "action": "拼装定位",
        "description": "取出图纸上标注为④的右挂件虚拟组件（01.05.0018）和标注为⑤的左挂件虚拟组件（01.05.0019），将它们分别定位在框架的两端，确保挂件的安装方向正确。同时，将图纸上标注为③的方形板（01.01.01.6589，数量4个）定位在框架的指定安装孔位上。",
        "position_description": "挂件④和⑤安装在框架的两端，方形板③安装在框架的侧面或底部。",
        "parts_used": [
          {
            "bom_code": "01.05.0018",
            "bom_name": "右挂件虚拟组件 1",
            "quantity": 1,
            "drawing_number": "④",
            "mesh_id": [
              "mesh_010"
            ]
          },
          {
            "bom_code": "01.05.0019",
            "bom_name": "左挂件虚拟组件 1",
            "quantity": 1,
            "drawing_number": "⑤",
            "mesh_id": [
              "mesh_009"
            ]
          },
          {
            "bom_code": "01.01.01.6589",
            "bom_name": "方形板-机加 4",
            "quantity": 4,
            "drawing_number": "③",
            "mesh_id": [
              "mesh_014"
            ]
          }
        ],
        "tools": [
          "定位夹具"
        ],
        "warnings": [
          "挂件组件的定位必须精确，确保后续功能正常。方形板③需与安装面贴合。"
        ],
        "welding": {
          "required": true,
          "welding_type": "角焊",
          "welding_method": "CO2气保焊",
          "weld_size": "点焊，焊点长度约10mm，焊脚高度4mm",
          "welding_position": "挂件④和⑤与矩形管的连接处；方形板③与框架的连接边缘",
          "quality_requirements": "挂件定位精度要求高，点焊时需复核尺寸。",
          "safety_notes": "挂件组件可能较重，操作时注意防砸伤，焊接前确保夹具夹紧。"
        },
        "safety_warnings": [
          "挂件组件（④和⑤）可能较重，搬运和定位时要小心，防止组件滑落或砸伤手脚。",
          "使用定位夹具时，确保夹具牢固可靠，防止焊接过程中组件移位或弹出。"
        ]
      },
      {
        "step_number": 5,
        "title": "焊接与校正",
        "action": "焊接与校正",
        "description": "在所有零件（①、②、③、④、⑤、⑥、⑦、⑧、⑨）定位完成后，按照图纸上的焊接符号和技术要求（如焊缝大小、位置）进行全面焊接（工艺代码08.01）。焊接完成后，进行焊渣清理，并对组件进行校正（工艺代码08.05），确保整体尺寸和形位公差符合要求。",
        "position_description": "对所有零件的连接处进行焊接。",
        "parts_used": [],
        "tools": [
          "焊机",
          "焊枪",
          "焊条/焊丝",
          "角磨机",
          "校正平台",
          "水平仪"
        ],
        "warnings": [
          "焊接时注意选择合适的电流和电压，确保焊缝牢固，无虚焊、漏焊。校正时注意保护组件表面，避免损伤。"
        ],
        "welding": {
          "required": true,
          "welding_type": "角焊/塞焊（根据图纸）",
          "welding_method": "CO2气保焊",
          "weld_size": "焊脚高度6mm（或根据图纸标注的焊缝符号）",
          "welding_position": "所有零件的连接面，进行连续焊或间断焊",
          "quality_requirements": "焊缝必须饱满、均匀，无气孔、夹渣、裂纹等缺陷。焊后清理焊渣和飞溅，并进行外观检查。",
          "safety_notes": "进行连续焊接时，注意控制焊接顺序，减少热变形。焊接工作结束后，必须清理现场，确保电源切断，并检查是否有火种残留。"
        },
        "safety_warnings": [
          "进行全面焊接时，必须严格遵守焊接安全规范：佩戴全套防护用品（面罩、手套、阻燃服）。",
          "确保焊接区域有足够的通风或排烟设备，防止有害气体中毒。",
          "使用角磨机清理焊渣和飞溅时，必须佩戴防护眼镜和耳塞，防止飞溅物伤眼和噪音损伤听力。",
          "焊接完成后，工件温度很高，处理或校正时必须佩戴隔热手套，防止烫伤。",
          "检查灭火器材是否可用，防止焊接火花引发火灾。"
        ]
      }
    ]
  }
}