{
  "agent_name": "Agent6_FAQ",
  "model": "google/gemini-2.5-flash-preview-09-2025",
  "timestamp": "20251005_160038",
  "image_count": 0,
  "temperature": 0.2,
  "system_prompt": "# 角色定位\n\n你是**李师傅**，一位拥有20年安全管理经验的高级安全工程师。\n\n## 教育背景\n\n- **学历**：安全工程专业本科\n- **职业资格**：注册安全工程师、高级安全评价师\n- **专业培训**：\n  - 机械制造安全管理\n  - 职业健康与安全管理体系（ISO 45001）\n  - 事故调查与分析\n  - 应急预案编制与演练\n\n## 职业背景\n\n- **工作经历**：20年机械制造企业安全管理经验，参与过大型装备制造、钢结构加工等项目\n- **专业领域**：\n  - 机械加工安全（车、铣、刨、磨、钻等）\n  - 焊接作业安全（电焊、气焊、氩弧焊等）\n  - 起重吊装安全（行车、叉车、吊索具等）\n  - 高空作业安全（脚手架、安全带、防坠落等）\n  - 个人防护用品管理（安全帽、防护眼镜、手套、安全鞋等）\n\n## 知识结构（详细）\n\n### 1. 机械伤害风险\n- **夹伤/挤伤**：手指、手臂被运动部件夹住\n- **切割伤**：锋利边缘、毛刺、切削工具\n- **碰撞伤**：头部碰撞、身体碰撞\n- **坠落伤**：零件坠落、工具坠落、人员坠落\n\n### 2. 焊接作业风险\n- **电击伤**：焊机漏电、接地不良\n- **弧光伤**：电弧紫外线灼伤眼睛和皮肤\n- **烫伤**：高温熔池、焊渣飞溅\n- **火灾爆炸**：易燃物引燃、气瓶泄漏\n- **有毒气体**：焊接烟尘、一氧化碳中毒\n\n### 3. 起重吊装风险\n- **吊物坠落**：吊索具断裂、捆绑不牢\n- **吊物摆动**：碰撞人员、设备\n- **超载**：超过起重机额定载荷\n- **指挥失误**：信号不清、违章指挥\n\n### 4. 高空作业风险\n- **人员坠落**：未系安全带、脚手架不牢\n- **物体打击**：工具、零件从高处坠落\n- **脚手架坍塌**：搭设不规范、超载\n\n### 5. 个人防护用品\n- **头部防护**：安全帽（防止碰撞、坠物打击）\n- **眼部防护**：防护眼镜、焊接面罩（防止飞溅、弧光）\n- **手部防护**：防护手套（防止切割、烫伤、化学品）\n- **足部防护**：安全鞋（防砸、防刺穿、防滑）\n- **呼吸防护**：防尘口罩、防毒面具（防止粉尘、有毒气体）\n\n### 6. 应急处理\n- **机械伤害**：立即停机、呼救、止血、固定、送医\n- **电击伤**：切断电源、心肺复苏、送医\n- **烫伤**：冷水冲洗、覆盖无菌纱布、送医\n- **火灾**：使用灭火器、疏散人员、报警\n\n## 任务步骤（Chain of Thought）\n\n你的任务是**为每个装配步骤添加安全警告**（如果该步骤有安全风险）。请按照以下5个步骤思考：\n\n### 步骤1：识别风险步骤\n- 分析每个装配步骤的操作内容\n- 判断是否涉及高风险作业（焊接、吊装、高空、重物搬运等）\n- 识别潜在的伤害类型（机械伤害、电击、烫伤、坠落等）\n\n### 步骤2：分析风险源\n- 确定风险的来源（设备、工具、材料、环境、人员操作等）\n- 评估风险的严重程度（轻微、中等、严重、致命）\n- 考虑风险的发生概率\n\n### 步骤3：制定预防措施\n- 针对每个风险源，制定具体的预防措施\n- 强调个人防护用品的使用\n- 强调安全操作规程的遵守\n\n### 步骤4：添加安全警告\n- 为每个有风险的步骤添加safety_warnings字段\n- 每条警告要简洁明了，说明具体的风险和预防措施\n- 使用工人能看懂的语言\n\n### 步骤5：验证完整性\n- 检查所有高风险步骤是否都添加了安全警告\n- 检查安全警告是否具体、可操作\n- 检查是否遗漏了任何潜在风险\n\n## 核心原则\n\n1. **步骤级嵌入**：为每个有风险的步骤添加safety_warnings字段，而不是单独列出安全警告\n2. **工人友好**：使用通俗语言，避免专业术语\n3. **具体可操作**：说明具体的风险和预防措施，而不是泛泛而谈\n4. **不重复显示**：安全警告只在下方\"安全\"标签页中统一显示，不在当前步骤详情中重复显示\n\n## 输出格式\n\n严格按照以下JSON格式输出（返回增强后的装配步骤）：\n\n```json\n{\n  \"enhanced_steps\": [\n    {\n      \"step_number\": 1,\n      \"title\": \"点焊定位\",\n      \"parts_used\": [...],\n      \"tools_required\": [...],\n      \"operation\": \"操作说明\",\n      \"quality_check\": \"质量检查\",\n      \"estimated_time_minutes\": 10,\n      \"welding\": {\n        \"required\": true,\n        \"welding_type\": \"点焊\",\n        \"welding_method\": \"CO2气保焊\",\n        ...\n      },\n      \"safety_warnings\": [\n        \"佩戴焊接面罩和防护手套，防止弧光灼伤眼睛和皮肤\",\n        \"确保工件夹紧牢固，防止点焊时位移造成伤害\",\n        \"焊接区域周围3米内不得有易燃物，配备灭火器\",\n        \"焊机必须接地良好，防止漏电触电\"\n      ]\n    },\n    {\n      \"step_number\": 2,\n      \"title\": \"螺栓连接\",\n      \"parts_used\": [...],\n      \"operation\": \"操作说明\",\n      \"quality_check\": \"质量检查\",\n      \"estimated_time_minutes\": 15,\n      \"safety_warnings\": [\n        \"佩戴安全帽和防护眼镜，防止零件坠落和飞溅\",\n        \"使用扭力扳手时注意力度，防止扳手滑脱伤人\"\n      ]\n    },\n    {\n      \"step_number\": 3,\n      \"title\": \"简单装配\",\n      \"parts_used\": [...],\n      \"operation\": \"操作说明\",\n      \"quality_check\": \"质量检查\",\n      \"estimated_time_minutes\": 5\n      // ⚠️ 如果没有明显安全风险，不添加safety_warnings字段\n    }\n  ]\n}\n```\n\n**⚠️ 关键要求**：\n\n1. **步骤级嵌入**：\n   - 为每个有风险的步骤添加`safety_warnings`字段\n   - 没有明显风险的步骤不添加`safety_warnings`字段\n   - 保持原有步骤的所有字段不变\n\n2. **安全警告要具体**：\n   - ✅ 说\"佩戴焊接面罩和防护手套，防止弧光灼伤眼睛和皮肤\"\n   - ❌ 不说\"注意安全\"\n   - ✅ 说\"焊接区域周围3米内不得有易燃物，配备灭火器\"\n   - ❌ 不说\"注意防火\"\n\n3. **使用通俗语言**：\n   - 工人能看懂的语言\n   - 避免专业术语和英文缩写\n\n4. **警告要全面**：\n   - 涵盖个人防护、设备安全、环境安全、操作安全\n   - 每条警告说明具体的风险和预防措施\n\n## 重要提醒\n\n- **只输出JSON，不要输出其他内容**\n- **保持原有字段不变**：不要修改或删除原有的字段（包括welding字段）\n- **警告要简洁明了**：每条警告一句话，说明风险和预防措施\n- **不要过度警告**：只针对有明显风险的步骤添加警告\n",
  "user_query": "请为以下装配步骤添加安全警告（如果有安全风险）。\n\n## 📸 视觉分析任务\n\n**你会看到工程图纸图片，请仔细观察：**\n\n1. **危险作业标识**：\n   - 图纸上的安全警告标识\n   - 特殊作业要求（如高空作业、吊装作业等）\n   - 危险区域标注\n\n2. **零件特征**：\n   - 重型零件（需要吊装）\n   - 锋利边缘（容易割伤）\n   - 高温部件（容易烫伤）\n\n3. **作业环境**：\n   - 狭窄空间（容易碰撞）\n   - 高空位置（容易坠落）\n   - 密闭空间（通风不良）\n\n## 装配步骤\n\n[\n  {\n    \"step_number\": 1,\n    \"action\": \"放置基准件\",\n    \"description\": \"将图纸上标注为②的连接板（01.01.01.11509）平稳放置在焊接工装台上，作为装配基准。确保连接板表面清洁，无油污和锈蚀。\",\n    \"position_description\": \"连接板平放于工装台，定位销对准工装孔。\",\n    \"parts_used\": [\n      {\n        \"bom_seq\": \"2\",\n        \"bom_name\": \"连接板\",\n        \"quantity\": 1,\n        \"drawing_number\": \"2\"\n      }\n    ],\n    \"tools\": [\n      \"行车/吊具\",\n      \"焊接工装台\",\n      \"水平仪\"\n    ],\n    \"warnings\": [\n      \"连接板较重（21.36kg），吊装时注意安全，确保吊具牢固。\",\n      \"定位时注意连接板的方向性。\"\n    ]\n  },\n  {\n    \"step_number\": 2,\n    \"action\": \"安装底部矩形管\",\n    \"description\": \"将图纸上标注为①的矩形管（01.01.03.2718）放置在②号连接板的底部边缘，并进行点焊固定。矩形管的长度方向应与连接板的长边对齐。\",\n    \"position_description\": \"矩形管①位于连接板②的底部，沿长边方向。\",\n    \"parts_used\": [\n      {\n        \"bom_seq\": \"1\",\n        \"bom_name\": \"矩形管\",\n        \"quantity\": 1,\n        \"drawing_number\": \"1\"\n      }\n    ],\n    \"tools\": [\n      \"焊机（CO2/MAG）\",\n      \"角尺\",\n      \"点焊夹具\"\n    ],\n    \"warnings\": [\n      \"点焊前确保矩形管与连接板的接触面紧密贴合。\",\n      \"点焊位置应均匀分布，防止焊接变形。\"\n    ],\n    \"welding\": {\n      \"required\": true,\n      \"welding_type\": \"角焊（定位焊）\",\n      \"welding_method\": \"CO2气保焊\",\n      \"weld_size\": \"点焊长度10-15mm，焊脚高度4mm\",\n      \"welding_position\": \"矩形管①与连接板②的连接处，平焊\",\n      \"quality_requirements\": \"点焊牢固，焊点均匀分布，无明显气孔或裂纹，确保定位准确。\",\n      \"safety_notes\": \"佩戴焊接面罩、防护手套和防护服。确保工作区域通风良好，防止烟尘吸入。\"\n    }\n  },\n  {\n    \"step_number\": 3,\n    \"action\": \"安装侧面矩形管\",\n    \"description\": \"将图纸上标注为⑥的矩形管（01.01.03.2719，共2件）分别放置在②号连接板的两侧，垂直于连接板，并进行点焊固定。注意矩形管的开口方向应朝外。\",\n    \"position_description\": \"矩形管⑥位于连接板②的两侧，垂直安装。\",\n    \"parts_used\": [\n      {\n        \"bom_seq\": \"6\",\n        \"bom_name\": \"矩形管\",\n        \"quantity\": 2,\n        \"drawing_number\": \"6\"\n      }\n    ],\n    \"tools\": [\n      \"焊机（CO2/MAG）\",\n      \"垂直夹具\",\n      \"角尺\"\n    ],\n    \"warnings\": [\n      \"使用角尺检查矩形管⑥与连接板②的垂直度，确保90度。\",\n      \"点焊时注意保持两根矩形管⑥的相对位置对称。\"\n    ],\n    \"welding\": {\n      \"required\": true,\n      \"welding_type\": \"角焊（定位焊）\",\n      \"welding_method\": \"CO2气保焊\",\n      \"weld_size\": \"点焊长度10-15mm，焊脚高度4mm\",\n      \"welding_position\": \"矩形管⑥与连接板②的连接处，平焊/横焊\",\n      \"quality_requirements\": \"点焊牢固，焊点均匀分布，确保垂直度公差在允许范围内。\",\n      \"safety_notes\": \"检查焊机接地线连接可靠，防止触电。点焊后立即清理焊渣，避免烫伤。\"\n    }\n  },\n  {\n    \"step_number\": 4,\n    \"action\": \"安装顶部矩形管\",\n    \"description\": \"将图纸上标注为⑧的矩形管（01.01.03.2720，共1件）放置在两侧矩形管⑥的顶端，形成框架的顶部横梁，并进行点焊固定。\",\n    \"position_description\": \"矩形管⑧位于矩形管⑥的顶部，与连接板②平行。\",\n    \"parts_used\": [\n      {\n        \"bom_seq\": \"8\",\n        \"bom_name\": \"矩形管\",\n        \"quantity\": 1,\n        \"drawing_number\": \"8\"\n      }\n    ],\n    \"tools\": [\n      \"焊机（CO2/MAG）\",\n      \"卷尺\"\n    ],\n    \"warnings\": [\n      \"检查矩形管⑧与两侧矩形管⑥的搭接尺寸，确保符合图纸要求。\",\n      \"点焊后检查框架的对角线尺寸，确保框架方正。\"\n    ],\n    \"welding\": {\n      \"required\": true,\n      \"welding_type\": \"角焊（定位焊）\",\n      \"welding_method\": \"CO2气保焊\",\n      \"weld_size\": \"点焊长度10-15mm，焊脚高度4mm\",\n      \"welding_position\": \"矩形管⑧与矩形管⑥的连接处，平焊\",\n      \"quality_requirements\": \"点焊牢固，确保框架几何尺寸准确，特别是对角线尺寸。\",\n      \"safety_notes\": \"高处作业时注意防坠落。确保焊枪电缆无破损，避免短路。\"\n    }\n  },\n  {\n    \"step_number\": 5,\n    \"action\": \"安装挂件虚拟组件\",\n    \"description\": \"将图纸上标注为④的右挂件虚拟组件（01.05.0018）和⑤的左挂件虚拟组件（01.05.0019）分别安装在矩形管⑥的两端，并进行点焊固定。注意区分左右挂件。\",\n    \"position_description\": \"右挂件④和左挂件⑤分别安装在两侧矩形管⑥的端部。\",\n    \"parts_used\": [\n      {\n        \"bom_seq\": \"4\",\n        \"bom_name\": \"右挂件虚拟组件\",\n        \"quantity\": 1,\n        \"drawing_number\": \"4\"\n      },\n      {\n        \"bom_seq\": \"5\",\n        \"bom_name\": \"左挂件虚拟组件\",\n        \"quantity\": 1,\n        \"drawing_number\": \"5\"\n      }\n    ],\n    \"tools\": [\n      \"焊机（CO2/MAG）\",\n      \"定位销\"\n    ],\n    \"warnings\": [\n      \"挂件的安装位置是关键尺寸，必须使用定位销或专用夹具确保定位准确。\",\n      \"检查挂件的安装角度，确保与图纸要求一致。\"\n    ],\n    \"welding\": {\n      \"required\": true,\n      \"welding_type\": \"角焊（定位焊）\",\n      \"welding_method\": \"CO2气保焊\",\n      \"weld_size\": \"点焊长度10-15mm，焊脚高度4mm\",\n      \"welding_position\": \"挂件④/⑤与矩形管⑥的连接处，横焊/立焊\",\n      \"quality_requirements\": \"定位焊点小而均匀，不影响后续满焊质量。确保挂件的轴线位置准确。\",\n      \"safety_notes\": \"由于挂件形状复杂，点焊时注意调整姿势，避免长时间弯腰或仰头操作。\"\n    }\n  },\n  {\n    \"step_number\": 6,\n    \"action\": \"安装封板\",\n    \"description\": \"将图纸上标注为⑦的封板（01.01.01.16608，共2件）安装在框架内部，覆盖矩形管⑥和⑧形成的开口区域，并进行点焊固定。\",\n    \"position_description\": \"封板⑦位于框架内部，与矩形管⑥和⑧的内侧边缘贴合。\",\n    \"parts_used\": [\n      {\n        \"bom_seq\": \"7\",\n        \"bom_name\": \"封板\",\n        \"quantity\": 2,\n        \"drawing_number\": \"7\"\n      }\n    ],\n    \"tools\": [\n      \"焊机（CO2/MAG）\",\n      \"压紧夹具\"\n    ],\n    \"warnings\": [\n      \"封板安装时需确保与周围结构平齐，避免凸出或凹陷。\",\n      \"点焊时注意焊缝均匀，防止板材变形。\"\n    ],\n    \"welding\": {\n      \"required\": true,\n      \"welding_type\": \"角焊（定位焊）\",\n      \"welding_method\": \"CO2气保焊\",\n      \"weld_size\": \"点焊长度10mm，焊脚高度3mm\",\n      \"welding_position\": \"封板⑦与矩形管⑥/⑧的连接处，平焊/横焊\",\n      \"quality_requirements\": \"点焊间距均匀（约150-200mm一个点），确保封板与框架贴合紧密。\",\n      \"safety_notes\": \"清理封板边缘的油漆或氧化皮，防止焊接时产生大量烟雾和气孔。\"\n    }\n  },\n  {\n    \"step_number\": 7,\n    \"action\": \"安装加强筋\",\n    \"description\": \"将图纸上标注为⑨的加强筋（01.01.01.17678，共2件）安装在框架内部，用于支撑封板⑦和矩形管⑧。加强筋应沿对角线方向放置，并进行点焊固定。\",\n    \"position_description\": \"加强筋⑨位于框架内部，呈斜向支撑。\",\n    \"parts_used\": [\n      {\n        \"bom_seq\": \"9\",\n        \"bom_name\": \"加强筋\",\n        \"quantity\": 2,\n        \"drawing_number\": \"9\"\n      }\n    ],\n    \"tools\": [\n      \"焊机（CO2/MAG）\",\n      \"角尺\"\n    ],\n    \"warnings\": [\n      \"加强筋的安装位置和角度应严格按照图纸要求，确保支撑作用。\",\n      \"点焊牢固，防止在后续满焊过程中移位。\"\n    ],\n    \"welding\": {\n      \"required\": true,\n      \"welding_type\": \"角焊（定位焊）\",\n      \"welding_method\": \"CO2气保焊\",\n      \"weld_size\": \"点焊长度15mm，焊脚高度4mm\",\n      \"welding_position\": \"加强筋⑨与封板⑦和矩形管⑧的连接处，立焊/横焊\",\n      \"quality_requirements\": \"加强筋定位准确，焊点应位于加强筋两端，确保支撑稳定。\",\n      \"safety_notes\": \"注意加强筋的边缘可能锋利，操作时佩戴防护手套，避免割伤。\"\n    }\n  },\n  {\n    \"step_number\": 8,\n    \"action\": \"安装方形板\",\n    \"description\": \"将图纸上标注为③的方形板-机加（01.01.01.6589，共4件）安装在连接板②的四个角上，并进行点焊固定。方形板用于后续的连接定位。\",\n    \"position_description\": \"方形板③安装在连接板②的四个角部。\",\n    \"parts_used\": [\n      {\n        \"bom_seq\": \"3\",\n        \"bom_name\": \"方形板-机加\",\n        \"quantity\": 4,\n        \"drawing_number\": \"3\"\n      }\n    ],\n    \"tools\": [\n      \"焊机（CO2/MAG）\",\n      \"游标卡尺\"\n    ],\n    \"warnings\": [\n      \"方形板的定位精度要求较高，需使用游标卡尺检查其相对位置和间距。\",\n      \"确保方形板的机加工面朝向正确。\"\n    ],\n    \"welding\": {\n      \"required\": true,\n      \"welding_type\": \"角焊（定位焊）\",\n      \"welding_method\": \"CO2气保焊\",\n      \"weld_size\": \"点焊长度10mm，焊脚高度3mm\",\n      \"welding_position\": \"方形板③与连接板②的连接处，平焊\",\n      \"quality_requirements\": \"定位焊点应远离机加工孔，确保定位精度，焊点牢固。\",\n      \"safety_notes\": \"由于方形板较小，点焊时注意防止烫伤手指。使用夹具固定，避免手持焊接。\"\n    }\n  },\n  {\n    \"step_number\": 9,\n    \"action\": \"满焊主体结构\",\n    \"description\": \"对所有已点焊的零件（①、③、④、⑤、⑥、⑦、⑧、⑨）与基准件②之间的连接处进行满焊。焊接顺序应遵循对称、分散的原则，以减少焊接变形。\",\n    \"position_description\": \"所有结构连接处。\",\n    \"parts_used\": [],\n    \"tools\": [\n      \"焊机（CO2/MAG）\",\n      \"焊钳\",\n      \"清渣工具\"\n    ],\n    \"warnings\": [\n      \"严格按照技术要求进行焊接，确保焊缝饱满、无虚焊、漏焊。\",\n      \"焊接过程中注意控制热输入，防止组件变形。必要时使用反变形措施。\"\n    ],\n    \"welding\": {\n      \"required\": true,\n      \"welding_type\": \"角焊/对接焊（满焊）\",\n      \"welding_method\": \"CO2气保焊\",\n      \"weld_size\": \"焊脚高度6mm（未标注焊缝按图纸技术要求），连续焊\",\n      \"welding_position\": \"所有零件连接处，涉及平焊、横焊、立焊\",\n      \"quality_requirements\": \"焊缝外观成型良好，焊波均匀，焊缝高度和宽度符合要求。焊后进行外观检查，确保无气孔、夹渣、裂纹、未熔合等缺陷。\",\n      \"safety_notes\": \"进行大面积满焊时，必须确保通风系统全开。注意焊机负载和持续率，避免设备过热。焊接完成后，对高温部件进行警示，防止他人误触烫伤。\"\n    }\n  },\n  {\n    \"step_number\": 10,\n    \"action\": \"焊后清理与校正\",\n    \"description\": \"焊接完成后，清除所有焊渣和飞溅物。使用角磨机对锐边、锐角、尖角进行倒钝处理。检查组件的整体尺寸和形位公差，对超差部分进行校正。\",\n    \"position_description\": \"整个组件。\",\n    \"parts_used\": [],\n    \"tools\": [\n      \"角磨机\",\n      \"钢丝刷\",\n      \"卷尺\",\n      \"校正平台\"\n    ],\n    \"warnings\": [\n      \"倒钝处理应光滑，避免残留尖锐边缘。\",\n      \"校正时力度要均匀，避免产生新的变形或损伤。\"\n    ]\n  }\n]\n\n## 要求\n\n请按照以下5个步骤思考，为装配步骤添加安全警告：\n\n### 步骤1：识别风险步骤\n- 分析每个装配步骤的操作内容\n- 判断是否涉及高风险作业：\n  * **焊接作业**：电击、弧光、烫伤、火灾\n  * **吊装作业**：吊物坠落、碰撞、超载\n  * **高空作业**：人员坠落、物体打击\n  * **重物搬运**：砸伤、扭伤、夹伤\n  * **机械加工**：切割伤、夹伤、碰撞\n\n### 步骤2：分析风险源\n- 确定风险的来源（设备、工具、材料、环境、人员操作等）\n- 评估风险的严重程度（轻微、中等、严重、致命）\n- 考虑风险的发生概率\n\n### 步骤3：制定预防措施\n- 针对每个风险源，制定具体的预防措施\n- 强调个人防护用品的使用：\n  * **焊接**：焊接面罩、防护手套、防护服\n  * **吊装**：安全帽、安全鞋、手套\n  * **高空**：安全带、安全帽、防滑鞋\n  * **机械**：防护眼镜、手套、安全鞋\n\n### 步骤4：添加安全警告\n- 为每个有风险的步骤添加safety_warnings字段\n- 每条警告要简洁明了，说明具体的风险和预防措施\n- 使用工人能看懂的语言\n\n### 步骤5：验证完整性\n- 检查所有高风险步骤是否都添加了安全警告\n- 检查安全警告是否具体、可操作\n- 检查是否遗漏了任何潜在风险\n\n## ⚠️ 强制自检清单（生成后必须逐项检查）\n\n**在输出JSON之前，你必须完成以下验证：**\n\n1. **风险步骤识别验证**：\n   - [ ] 所有涉及焊接、吊装、高空、重物搬运的步骤都添加了safety_warnings字段\n   - [ ] 没有明显风险的步骤没有添加safety_warnings字段\n\n2. **安全警告完整性验证**：\n   - [ ] 每个safety_warnings字段都是字符串数组\n   - [ ] 每条警告都说明了具体的风险和预防措施\n   - [ ] 涵盖了个人防护、设备安全、环境安全、操作安全\n\n3. **语言通俗性验证**：\n   - [ ] 使用工人能看懂的语言\n   - [ ] 避免专业术语和英文缩写\n   - [ ] 每条警告简洁明了（一句话）\n\n4. **原有字段保持验证**：\n   - [ ] 原有步骤的所有字段都保持不变（包括welding字段）\n   - [ ] 没有修改或删除任何原有字段\n\n**如果自检发现任何问题，必须重新生成！**\n\n现在开始为装配步骤添加安全警告！\n",
  "raw_response": "```json\n{\n  \"enhanced_steps\": [\n    {\n      \"step_number\": 1,\n      \"action\": \"放置基准件\",\n      \"description\": \"将图纸上标注为②的连接板（01.01.01.11509）平稳放置在焊接工装台上，作为装配基准。确保连接板表面清洁，无油污和锈蚀。\",\n      \"position_description\": \"连接板平放于工装台，定位销对准工装孔。\",\n      \"parts_used\": [\n        {\n          \"bom_seq\": \"2\",\n          \"bom_name\": \"连接板\",\n          \"quantity\": 1,\n          \"drawing_number\": \"2\"\n        }\n      ],\n      \"tools\": [\n        \"行车/吊具\",\n        \"焊接工装台\",\n        \"水平仪\"\n      ],\n      \"warnings\": [\n        \"连接板较重（21.36kg），吊装时注意安全，确保吊具牢固。\",\n        \"定位时注意连接板的方向性。\"\n      ],\n      \"safety_warnings\": [\n        \"操作行车吊装时，必须佩戴安全帽和防护手套，防止物体打击和夹伤。\",\n        \"吊装前检查吊索具是否完好，捆绑必须牢固，防止连接板坠落伤人。\",\n        \"连接板边缘可能锋利，搬运和定位时注意佩戴防护手套，防止割伤。\"\n      ]\n    },\n    {\n      \"step_number\": 2,\n      \"action\": \"安装底部矩形管\",\n      \"description\": \"将图纸上标注为①的矩形管（01.01.03.2718）放置在②号连接板的底部边缘，并进行点焊固定。矩形管的长度方向应与连接板的长边对齐。\",\n      \"position_description\": \"矩形管①位于连接板②的底部，沿长边方向。\",\n      \"parts_used\": [\n        {\n          \"bom_seq\": \"1\",\n          \"bom_name\": \"矩形管\",\n          \"quantity\": 1,\n          \"drawing_number\": \"1\"\n        }\n      ],\n      \"tools\": [\n        \"焊机（CO2/MAG）\",\n        \"角尺\",\n        \"点焊夹具\"\n      ],\n      \"warnings\": [\n        \"点焊前确保矩形管与连接板的接触面紧密贴合。\",\n        \"点焊位置应均匀分布，防止焊接变形。\"\n      ],\n      \"welding\": {\n        \"required\": true,\n        \"welding_type\": \"角焊（定位焊）\",\n        \"welding_method\": \"CO2气保焊\",\n        \"weld_size\": \"点焊长度10-15mm，焊脚高度4mm\",\n        \"welding_position\": \"矩形管①与连接板②的连接处，平焊\",\n        \"quality_requirements\": \"点焊牢固，焊点均匀分布，无明显气孔或裂纹，确保定位准确。\",\n        \"safety_notes\": \"佩戴焊接面罩、防护手套和防护服。确保工作区域通风良好，防止烟尘吸入。\"\n      },\n      \"safety_warnings\": [\n        \"进行点焊作业时，必须佩戴焊接面罩、防护手套和防护服，防止弧光灼伤和烫伤。\",\n        \"确保焊接区域通风良好，开启抽风设备，防止吸入有害烟尘。\",\n        \"检查焊机电缆和接地线是否完好，防止漏电触电。\",\n        \"点焊时注意飞溅，周围不得有易燃易爆物品。\"\n      ]\n    },\n    {\n      \"step_number\": 3,\n      \"action\": \"安装侧面矩形管\",\n      \"description\": \"将图纸上标注为⑥的矩形管（01.01.03.2719，共2件）分别放置在②号连接板的两侧，垂直于连接板，并进行点焊固定。注意矩形管的开口方向应朝外。\",\n      \"position_description\": \"矩形管⑥位于连接板②的两侧，垂直安装。\",\n      \"parts_used\": [\n        {\n          \"bom_seq\": \"6\",\n          \"bom_name\": \"矩形管\",\n          \"quantity\": 2,\n          \"drawing_number\": \"6\"\n        }\n      ],\n      \"tools\": [\n        \"焊机（CO2/MAG）\",\n        \"垂直夹具\",\n        \"角尺\"\n      ],\n      \"warnings\": [\n        \"使用角尺检查矩形管⑥与连接板②的垂直度，确保90度。\",\n        \"点焊时注意保持两根矩形管⑥的相对位置对称。\"\n      ],\n      \"welding\": {\n        \"required\": true,\n        \"welding_type\": \"角焊（定位焊）\",\n        \"welding_method\": \"CO2气保焊\",\n        \"weld_size\": \"点焊长度10-15mm，焊脚高度4mm\",\n        \"welding_position\": \"矩形管⑥与连接板②的连接处，平焊/横焊\",\n        \"quality_requirements\": \"点焊牢固，焊点均匀分布，确保垂直度公差在允许范围内。\",\n        \"safety_notes\": \"检查焊机接地线连接可靠，防止触电。点焊后立即清理焊渣，避免烫伤。\"\n      },\n      \"safety_warnings\": [\n        \"点焊作业时，必须佩戴焊接面罩和防护手套，防止弧光和烫伤。\",\n        \"使用夹具固定矩形管，避免手扶操作，防止夹伤或烫伤。\",\n        \"点焊后清理焊渣时，佩戴防护眼镜，防止焊渣飞溅伤眼。\"\n      ]\n    },\n    {\n      \"step_number\": 4,\n      \"action\": \"安装顶部矩形管\",\n      \"description\": \"将图纸上标注为⑧的矩形管（01.01.03.2720，共1件）放置在两侧矩形管⑥的顶端，形成框架的顶部横梁，并进行点焊固定。\",\n      \"position_description\": \"矩形管⑧位于矩形管⑥的顶部，与连接板②平行。\",\n      \"parts_used\": [\n        {\n          \"bom_seq\": \"8\",\n          \"bom_name\": \"矩形管\",\n          \"quantity\": 1,\n          \"drawing_number\": \"8\"\n        }\n      ],\n      \"tools\": [\n        \"焊机（CO2/MAG）\",\n        \"卷尺\"\n      ],\n      \"warnings\": [\n        \"检查矩形管⑧与两侧矩形管⑥的搭接尺寸，确保符合图纸要求。\",\n        \"点焊后检查框架的对角线尺寸，确保框架方正。\"\n      ],\n      \"welding\": {\n        \"required\": true,\n        \"welding_type\": \"角焊（定位焊）\",\n        \"welding_method\": \"CO2气保焊\",\n        \"weld_size\": \"点焊长度10-15mm，焊脚高度4mm\",\n        \"welding_position\": \"矩形管⑧与矩形管⑥的连接处，平焊\",\n        \"quality_requirements\": \"点焊牢固，确保框架几何尺寸准确，特别是对角线尺寸。\",\n        \"safety_notes\": \"高处作业时注意防坠落。确保焊枪电缆无破损，避免短路。\"\n      },\n      \"safety_warnings\": [\n        \"由于操作高度增加，应使用稳固的梯子或平台，并确保站稳，防止高处坠落。\",\n        \"点焊时佩戴焊接面罩和防护手套，防止弧光和烫伤。\",\n        \"确保焊枪电缆无破损，避免短路或电击危险。\"\n      ]\n    },\n    {\n      \"step_number\": 5,\n      \"action\": \"安装挂件虚拟组件\",\n      \"description\": \"将图纸上标注为④的右挂件虚拟组件（01.05.0018）和⑤的左挂件虚拟组件（01.05.0019）分别安装在矩形管⑥的两端，并进行点焊固定。注意区分左右挂件。\",\n      \"position_description\": \"右挂件④和左挂件⑤分别安装在两侧矩形管⑥的端部。\",\n      \"parts_used\": [\n        {\n          \"bom_seq\": \"4\",\n          \"bom_name\": \"右挂件虚拟组件\",\n          \"quantity\": 1,\n          \"drawing_number\": \"4\"\n        },\n        {\n          \"bom_seq\": \"5\",\n          \"bom_name\": \"左挂件虚拟组件\",\n          \"quantity\": 1,\n          \"drawing_number\": \"5\"\n        }\n      ],\n      \"tools\": [\n        \"焊机（CO2/MAG）\",\n        \"定位销\"\n      ],\n      \"warnings\": [\n        \"挂件的安装位置是关键尺寸，必须使用定位销或专用夹具确保定位准确。\",\n        \"检查挂件的安装角度，确保与图纸要求一致。\"\n      ],\n      \"welding\": {\n        \"required\": true,\n        \"welding_type\": \"角焊（定位焊）\",\n        \"welding_method\": \"CO2气保焊\",\n        \"weld_size\": \"点焊长度10-15mm，焊脚高度4mm\",\n        \"welding_position\": \"挂件④/⑤与矩形管⑥的连接处，横焊/立焊\",\n        \"quality_requirements\": \"定位焊点小而均匀，不影响后续满焊质量。确保挂件的轴线位置准确。\",\n        \"safety_notes\": \"由于挂件形状复杂，点焊时注意调整姿势，避免长时间弯腰或仰头操作。\"\n      },\n      \"safety_warnings\": [\n        \"点焊时必须佩戴焊接面罩和防护手套，防止弧光和烫伤。\",\n        \"使用夹具固定挂件，避免手持，防止因零件移动造成烫伤或定位错误。\",\n        \"注意调整操作姿势，避免长时间保持不舒适的体位，防止肌肉拉伤。\"\n      ]\n    },\n    {\n      \"step_number\": 6,\n      \"action\": \"安装封板\",\n      \"description\": \"将图纸上标注为⑦的封板（01.01.01.16608，共2件）安装在框架内部，覆盖矩形管⑥和⑧形成的开口区域，并进行点焊固定。\",\n      \"position_description\": \"封板⑦位于框架内部，与矩形管⑥和⑧的内侧边缘贴合。\",\n      \"parts_used\": [\n        {\n          \"bom_seq\": \"7\",\n          \"bom_name\": \"封板\",\n          \"quantity\": 2,\n          \"drawing_number\": \"7\"\n        }\n      ],\n      \"tools\": [\n        \"焊机（CO2/MAG）\",\n        \"压紧夹具\"\n      ],\n      \"warnings\": [\n        \"封板安装时需确保与周围结构平齐，避免凸出或凹陷。\",\n        \"点焊时注意焊缝均匀，防止板材变形。\"\n      ],\n      \"welding\": {\n        \"required\": true,\n        \"welding_type\": \"角焊（定位焊）\",\n        \"welding_method\": \"CO2气保焊\",\n        \"weld_size\": \"点焊长度10mm，焊脚高度3mm\",\n        \"welding_position\": \"封板⑦与矩形管⑥/⑧的连接处，平焊/横焊\",\n        \"quality_requirements\": \"点焊间距均匀（约150-200mm一个点），确保封板与框架贴合紧密。\",\n        \"safety_notes\": \"清理封板边缘的油漆或氧化皮，防止焊接时产生大量烟雾和气孔。\"\n      },\n      \"safety_warnings\": [\n        \"点焊时佩戴焊接面罩和防护手套，防止弧光和烫伤。\",\n        \"如果封板边缘有毛刺或尖锐部分，操作时必须佩戴防护手套，防止割伤。\",\n        \"清理封板表面时，确保通风良好，避免吸入粉尘或有害气体。\"\n      ]\n    },\n    {\n      \"step_number\": 7,\n      \"action\": \"安装加强筋\",\n      \"description\": \"将图纸上标注为⑨的加强筋（01.01.01.17678，共2件）安装在框架内部，用于支撑封板⑦和矩形管⑧。加强筋应沿对角线方向放置，并进行点焊固定。\",\n      \"position_description\": \"加强筋⑨位于框架内部，呈斜向支撑。\",\n      \"parts_used\": [\n        {\n          \"bom_seq\": \"9\",\n          \"bom_name\": \"加强筋\",\n          \"quantity\": 2,\n          \"drawing_number\": \"9\"\n        }\n      ],\n      \"tools\": [\n        \"焊机（CO2/MAG）\",\n        \"角尺\"\n      ],\n      \"warnings\": [\n        \"加强筋的安装位置和角度应严格按照图纸要求，确保支撑作用。\",\n        \"点焊牢固，防止在后续满焊过程中移位。\"\n      ],\n      \"welding\": {\n        \"required\": true,\n        \"welding_type\": \"角焊（定位焊）\",\n        \"welding_method\": \"CO2气保焊\",\n        \"weld_size\": \"点焊长度15mm，焊脚高度4mm\",\n        \"welding_position\": \"加强筋⑨与封板⑦和矩形管⑧的连接处，立焊/横焊\",\n        \"quality_requirements\": \"加强筋定位准确，焊点应位于加强筋两端，确保支撑稳定。\",\n        \"safety_notes\": \"注意加强筋的边缘可能锋利，操作时佩戴防护手套，避免割伤。\"\n      },\n      \"safety_warnings\": [\n        \"加强筋边缘可能锋利，搬运和定位时必须佩戴防割手套，防止割伤。\",\n        \"点焊时佩戴焊接面罩和防护手套，防止弧光和烫伤。\",\n        \"在框架内部操作时，注意头部和身体，防止碰撞到结构件造成伤害。\"\n      ]\n    },\n    {\n      \"step_number\": 8,\n      \"action\": \"安装方形板\",\n      \"description\": \"将图纸上标注为③的方形板-机加（01.01.01.6589，共4件）安装在连接板②的四个角上，并进行点焊固定。方形板用于后续的连接定位。\",\n      \"position_description\": \"方形板③安装在连接板②的四个角部。\",\n      \"parts_used\": [\n        {\n          \"bom_seq\": \"3\",\n          \"bom_name\": \"方形板-机加\",\n          \"quantity\": 4,\n          \"drawing_number\": \"3\"\n        }\n      ],\n      \"tools\": [\n        \"焊机（CO2/MAG）\",\n        \"游标卡尺\"\n      ],\n      \"warnings\": [\n        \"方形板的定位精度要求较高，需使用游标卡尺检查其相对位置和间距。\",\n        \"确保方形板的机加工面朝向正确。\"\n      ],\n      \"welding\": {\n        \"required\": true,\n        \"welding_type\": \"角焊（定位焊）\",\n        \"welding_method\": \"CO2气保焊\",\n        \"weld_size\": \"点焊长度10mm，焊脚高度3mm\",\n        \"welding_position\": \"方形板③与连接板②的连接处，平焊\",\n        \"quality_requirements\": \"定位焊点应远离机加工孔，确保定位精度，焊点牢固。\",\n        \"safety_notes\": \"由于方形板较小，点焊时注意防止烫伤手指。使用夹具固定，避免手持焊接。\"\n      },\n      \"safety_warnings\": [\n        \"由于方形板尺寸较小，点焊时必须使用夹具固定，严禁手持焊接，防止烫伤手指。\",\n        \"佩戴焊接面罩和防护手套，防止弧光和飞溅物烫伤。\",\n        \"机加工件边缘可能锋利，搬运时佩戴防护手套，防止割伤。\"\n      ]\n    },\n    {\n      \"step_number\": 9,\n      \"action\": \"满焊主体结构\",\n      \"description\": \"对所有已点焊的零件（①、③、④、⑤、⑥、⑦、⑧、⑨）与基准件②之间的连接处进行满焊。焊接顺序应遵循对称、分散的原则，以减少焊接变形。\",\n      \"position_description\": \"所有结构连接处。\",\n      \"parts_used\": [],\n      \"tools\": [\n        \"焊机（CO2/MAG）\",\n        \"焊钳\",\n        \"清渣工具\"\n      ],\n      \"warnings\": [\n        \"严格按照技术要求进行焊接，确保焊缝饱满、无虚焊、漏焊。\",\n        \"焊接过程中注意控制热输入，防止组件变形。必要时使用反变形措施。\"\n      ],\n      \"welding\": {\n        \"required\": true,\n        \"welding_type\": \"角焊/对接焊（满焊）\",\n        \"welding_method\": \"CO2气保焊\",\n        \"weld_size\": \"焊脚高度6mm（未标注焊缝按图纸技术要求），连续焊\",\n        \"welding_position\": \"所有零件连接处，涉及平焊、横焊、立焊\",\n        \"quality_requirements\": \"焊缝外观成型良好，焊波均匀，焊缝高度和宽度符合要求。焊后进行外观检查，确保无气孔、夹渣、裂纹、未熔合等缺陷。\",\n        \"safety_notes\": \"进行大面积满焊时，必须确保通风系统全开。注意焊机负载和持续率，避免设备过热。焊接完成后，对高温部件进行警示，防止他人误触烫伤。\"\n      },\n      \"safety_warnings\": [\n        \"进行满焊作业时，必须全程佩戴焊接面罩、防护手套和防护服，防止长时间弧光暴露和高温烫伤。\",\n        \"确保工作区域通风系统全开，防止焊接烟尘浓度过高导致中毒。\",\n        \"注意焊机持续率，避免设备过热引发故障或火灾。\",\n        \"焊接完成后，组件温度很高，应设置警示标识，严禁徒手触摸，防止严重烫伤。\"\n      ]\n    },\n    {\n      \"step_number\": 10,\n      \"action\": \"焊后清理与校正\",\n      \"description\": \"焊接完成后，清除所有焊渣和飞溅物。使用角磨机对锐边、锐角、尖角进行倒钝处理。检查组件的整体尺寸和形位公差，对超差部分进行校正。\",\n      \"position_description\": \"整个组件。\",\n      \"parts_used\": [],\n      \"tools\": [\n        \"角磨机\",\n        \"钢丝刷\",\n        \"卷尺\",\n        \"校正平台\"\n      ],\n      \"warnings\": [\n        \"倒钝处理应光滑，避免残留尖锐边缘。\",\n        \"校正时力度要均匀，避免产生新的变形或损伤。\"\n      ],\n      \"safety_warnings\": [\n        \"使用角磨机时，必须佩戴防护眼镜和面罩，防止砂轮碎裂或金属飞溅伤眼。\",\n        \"操作角磨机时，双手握紧，站稳，防止反弹失控造成机械伤害。\",\n        \"清理焊渣和飞溅物时，佩戴防护手套，防止割伤或扎伤。\",\n        \"校正作业时，注意周围人员安全，防止校正工具或重物掉落伤人。\"\n      ]\n    }\n  ]\n}\n```",
  "parsed_result": {
    "enhanced_steps": [
      {
        "step_number": 1,
        "action": "放置基准件",
        "description": "将图纸上标注为②的连接板（01.01.01.11509）平稳放置在焊接工装台上，作为装配基准。确保连接板表面清洁，无油污和锈蚀。",
        "position_description": "连接板平放于工装台，定位销对准工装孔。",
        "parts_used": [
          {
            "bom_seq": "2",
            "bom_name": "连接板",
            "quantity": 1,
            "drawing_number": "2"
          }
        ],
        "tools": [
          "行车/吊具",
          "焊接工装台",
          "水平仪"
        ],
        "warnings": [
          "连接板较重（21.36kg），吊装时注意安全，确保吊具牢固。",
          "定位时注意连接板的方向性。"
        ],
        "safety_warnings": [
          "操作行车吊装时，必须佩戴安全帽和防护手套，防止物体打击和夹伤。",
          "吊装前检查吊索具是否完好，捆绑必须牢固，防止连接板坠落伤人。",
          "连接板边缘可能锋利，搬运和定位时注意佩戴防护手套，防止割伤。"
        ]
      },
      {
        "step_number": 2,
        "action": "安装底部矩形管",
        "description": "将图纸上标注为①的矩形管（01.01.03.2718）放置在②号连接板的底部边缘，并进行点焊固定。矩形管的长度方向应与连接板的长边对齐。",
        "position_description": "矩形管①位于连接板②的底部，沿长边方向。",
        "parts_used": [
          {
            "bom_seq": "1",
            "bom_name": "矩形管",
            "quantity": 1,
            "drawing_number": "1"
          }
        ],
        "tools": [
          "焊机（CO2/MAG）",
          "角尺",
          "点焊夹具"
        ],
        "warnings": [
          "点焊前确保矩形管与连接板的接触面紧密贴合。",
          "点焊位置应均匀分布，防止焊接变形。"
        ],
        "welding": {
          "required": true,
          "welding_type": "角焊（定位焊）",
          "welding_method": "CO2气保焊",
          "weld_size": "点焊长度10-15mm，焊脚高度4mm",
          "welding_position": "矩形管①与连接板②的连接处，平焊",
          "quality_requirements": "点焊牢固，焊点均匀分布，无明显气孔或裂纹，确保定位准确。",
          "safety_notes": "佩戴焊接面罩、防护手套和防护服。确保工作区域通风良好，防止烟尘吸入。"
        },
        "safety_warnings": [
          "进行点焊作业时，必须佩戴焊接面罩、防护手套和防护服，防止弧光灼伤和烫伤。",
          "确保焊接区域通风良好，开启抽风设备，防止吸入有害烟尘。",
          "检查焊机电缆和接地线是否完好，防止漏电触电。",
          "点焊时注意飞溅，周围不得有易燃易爆物品。"
        ]
      },
      {
        "step_number": 3,
        "action": "安装侧面矩形管",
        "description": "将图纸上标注为⑥的矩形管（01.01.03.2719，共2件）分别放置在②号连接板的两侧，垂直于连接板，并进行点焊固定。注意矩形管的开口方向应朝外。",
        "position_description": "矩形管⑥位于连接板②的两侧，垂直安装。",
        "parts_used": [
          {
            "bom_seq": "6",
            "bom_name": "矩形管",
            "quantity": 2,
            "drawing_number": "6"
          }
        ],
        "tools": [
          "焊机（CO2/MAG）",
          "垂直夹具",
          "角尺"
        ],
        "warnings": [
          "使用角尺检查矩形管⑥与连接板②的垂直度，确保90度。",
          "点焊时注意保持两根矩形管⑥的相对位置对称。"
        ],
        "welding": {
          "required": true,
          "welding_type": "角焊（定位焊）",
          "welding_method": "CO2气保焊",
          "weld_size": "点焊长度10-15mm，焊脚高度4mm",
          "welding_position": "矩形管⑥与连接板②的连接处，平焊/横焊",
          "quality_requirements": "点焊牢固，焊点均匀分布，确保垂直度公差在允许范围内。",
          "safety_notes": "检查焊机接地线连接可靠，防止触电。点焊后立即清理焊渣，避免烫伤。"
        },
        "safety_warnings": [
          "点焊作业时，必须佩戴焊接面罩和防护手套，防止弧光和烫伤。",
          "使用夹具固定矩形管，避免手扶操作，防止夹伤或烫伤。",
          "点焊后清理焊渣时，佩戴防护眼镜，防止焊渣飞溅伤眼。"
        ]
      },
      {
        "step_number": 4,
        "action": "安装顶部矩形管",
        "description": "将图纸上标注为⑧的矩形管（01.01.03.2720，共1件）放置在两侧矩形管⑥的顶端，形成框架的顶部横梁，并进行点焊固定。",
        "position_description": "矩形管⑧位于矩形管⑥的顶部，与连接板②平行。",
        "parts_used": [
          {
            "bom_seq": "8",
            "bom_name": "矩形管",
            "quantity": 1,
            "drawing_number": "8"
          }
        ],
        "tools": [
          "焊机（CO2/MAG）",
          "卷尺"
        ],
        "warnings": [
          "检查矩形管⑧与两侧矩形管⑥的搭接尺寸，确保符合图纸要求。",
          "点焊后检查框架的对角线尺寸，确保框架方正。"
        ],
        "welding": {
          "required": true,
          "welding_type": "角焊（定位焊）",
          "welding_method": "CO2气保焊",
          "weld_size": "点焊长度10-15mm，焊脚高度4mm",
          "welding_position": "矩形管⑧与矩形管⑥的连接处，平焊",
          "quality_requirements": "点焊牢固，确保框架几何尺寸准确，特别是对角线尺寸。",
          "safety_notes": "高处作业时注意防坠落。确保焊枪电缆无破损，避免短路。"
        },
        "safety_warnings": [
          "由于操作高度增加，应使用稳固的梯子或平台，并确保站稳，防止高处坠落。",
          "点焊时佩戴焊接面罩和防护手套，防止弧光和烫伤。",
          "确保焊枪电缆无破损，避免短路或电击危险。"
        ]
      },
      {
        "step_number": 5,
        "action": "安装挂件虚拟组件",
        "description": "将图纸上标注为④的右挂件虚拟组件（01.05.0018）和⑤的左挂件虚拟组件（01.05.0019）分别安装在矩形管⑥的两端，并进行点焊固定。注意区分左右挂件。",
        "position_description": "右挂件④和左挂件⑤分别安装在两侧矩形管⑥的端部。",
        "parts_used": [
          {
            "bom_seq": "4",
            "bom_name": "右挂件虚拟组件",
            "quantity": 1,
            "drawing_number": "4"
          },
          {
            "bom_seq": "5",
            "bom_name": "左挂件虚拟组件",
            "quantity": 1,
            "drawing_number": "5"
          }
        ],
        "tools": [
          "焊机（CO2/MAG）",
          "定位销"
        ],
        "warnings": [
          "挂件的安装位置是关键尺寸，必须使用定位销或专用夹具确保定位准确。",
          "检查挂件的安装角度，确保与图纸要求一致。"
        ],
        "welding": {
          "required": true,
          "welding_type": "角焊（定位焊）",
          "welding_method": "CO2气保焊",
          "weld_size": "点焊长度10-15mm，焊脚高度4mm",
          "welding_position": "挂件④/⑤与矩形管⑥的连接处，横焊/立焊",
          "quality_requirements": "定位焊点小而均匀，不影响后续满焊质量。确保挂件的轴线位置准确。",
          "safety_notes": "由于挂件形状复杂，点焊时注意调整姿势，避免长时间弯腰或仰头操作。"
        },
        "safety_warnings": [
          "点焊时必须佩戴焊接面罩和防护手套，防止弧光和烫伤。",
          "使用夹具固定挂件，避免手持，防止因零件移动造成烫伤或定位错误。",
          "注意调整操作姿势，避免长时间保持不舒适的体位，防止肌肉拉伤。"
        ]
      },
      {
        "step_number": 6,
        "action": "安装封板",
        "description": "将图纸上标注为⑦的封板（01.01.01.16608，共2件）安装在框架内部，覆盖矩形管⑥和⑧形成的开口区域，并进行点焊固定。",
        "position_description": "封板⑦位于框架内部，与矩形管⑥和⑧的内侧边缘贴合。",
        "parts_used": [
          {
            "bom_seq": "7",
            "bom_name": "封板",
            "quantity": 2,
            "drawing_number": "7"
          }
        ],
        "tools": [
          "焊机（CO2/MAG）",
          "压紧夹具"
        ],
        "warnings": [
          "封板安装时需确保与周围结构平齐，避免凸出或凹陷。",
          "点焊时注意焊缝均匀，防止板材变形。"
        ],
        "welding": {
          "required": true,
          "welding_type": "角焊（定位焊）",
          "welding_method": "CO2气保焊",
          "weld_size": "点焊长度10mm，焊脚高度3mm",
          "welding_position": "封板⑦与矩形管⑥/⑧的连接处，平焊/横焊",
          "quality_requirements": "点焊间距均匀（约150-200mm一个点），确保封板与框架贴合紧密。",
          "safety_notes": "清理封板边缘的油漆或氧化皮，防止焊接时产生大量烟雾和气孔。"
        },
        "safety_warnings": [
          "点焊时佩戴焊接面罩和防护手套，防止弧光和烫伤。",
          "如果封板边缘有毛刺或尖锐部分，操作时必须佩戴防护手套，防止割伤。",
          "清理封板表面时，确保通风良好，避免吸入粉尘或有害气体。"
        ]
      },
      {
        "step_number": 7,
        "action": "安装加强筋",
        "description": "将图纸上标注为⑨的加强筋（01.01.01.17678，共2件）安装在框架内部，用于支撑封板⑦和矩形管⑧。加强筋应沿对角线方向放置，并进行点焊固定。",
        "position_description": "加强筋⑨位于框架内部，呈斜向支撑。",
        "parts_used": [
          {
            "bom_seq": "9",
            "bom_name": "加强筋",
            "quantity": 2,
            "drawing_number": "9"
          }
        ],
        "tools": [
          "焊机（CO2/MAG）",
          "角尺"
        ],
        "warnings": [
          "加强筋的安装位置和角度应严格按照图纸要求，确保支撑作用。",
          "点焊牢固，防止在后续满焊过程中移位。"
        ],
        "welding": {
          "required": true,
          "welding_type": "角焊（定位焊）",
          "welding_method": "CO2气保焊",
          "weld_size": "点焊长度15mm，焊脚高度4mm",
          "welding_position": "加强筋⑨与封板⑦和矩形管⑧的连接处，立焊/横焊",
          "quality_requirements": "加强筋定位准确，焊点应位于加强筋两端，确保支撑稳定。",
          "safety_notes": "注意加强筋的边缘可能锋利，操作时佩戴防护手套，避免割伤。"
        },
        "safety_warnings": [
          "加强筋边缘可能锋利，搬运和定位时必须佩戴防割手套，防止割伤。",
          "点焊时佩戴焊接面罩和防护手套，防止弧光和烫伤。",
          "在框架内部操作时，注意头部和身体，防止碰撞到结构件造成伤害。"
        ]
      },
      {
        "step_number": 8,
        "action": "安装方形板",
        "description": "将图纸上标注为③的方形板-机加（01.01.01.6589，共4件）安装在连接板②的四个角上，并进行点焊固定。方形板用于后续的连接定位。",
        "position_description": "方形板③安装在连接板②的四个角部。",
        "parts_used": [
          {
            "bom_seq": "3",
            "bom_name": "方形板-机加",
            "quantity": 4,
            "drawing_number": "3"
          }
        ],
        "tools": [
          "焊机（CO2/MAG）",
          "游标卡尺"
        ],
        "warnings": [
          "方形板的定位精度要求较高，需使用游标卡尺检查其相对位置和间距。",
          "确保方形板的机加工面朝向正确。"
        ],
        "welding": {
          "required": true,
          "welding_type": "角焊（定位焊）",
          "welding_method": "CO2气保焊",
          "weld_size": "点焊长度10mm，焊脚高度3mm",
          "welding_position": "方形板③与连接板②的连接处，平焊",
          "quality_requirements": "定位焊点应远离机加工孔，确保定位精度，焊点牢固。",
          "safety_notes": "由于方形板较小，点焊时注意防止烫伤手指。使用夹具固定，避免手持焊接。"
        },
        "safety_warnings": [
          "由于方形板尺寸较小，点焊时必须使用夹具固定，严禁手持焊接，防止烫伤手指。",
          "佩戴焊接面罩和防护手套，防止弧光和飞溅物烫伤。",
          "机加工件边缘可能锋利，搬运时佩戴防护手套，防止割伤。"
        ]
      },
      {
        "step_number": 9,
        "action": "满焊主体结构",
        "description": "对所有已点焊的零件（①、③、④、⑤、⑥、⑦、⑧、⑨）与基准件②之间的连接处进行满焊。焊接顺序应遵循对称、分散的原则，以减少焊接变形。",
        "position_description": "所有结构连接处。",
        "parts_used": [],
        "tools": [
          "焊机（CO2/MAG）",
          "焊钳",
          "清渣工具"
        ],
        "warnings": [
          "严格按照技术要求进行焊接，确保焊缝饱满、无虚焊、漏焊。",
          "焊接过程中注意控制热输入，防止组件变形。必要时使用反变形措施。"
        ],
        "welding": {
          "required": true,
          "welding_type": "角焊/对接焊（满焊）",
          "welding_method": "CO2气保焊",
          "weld_size": "焊脚高度6mm（未标注焊缝按图纸技术要求），连续焊",
          "welding_position": "所有零件连接处，涉及平焊、横焊、立焊",
          "quality_requirements": "焊缝外观成型良好，焊波均匀，焊缝高度和宽度符合要求。焊后进行外观检查，确保无气孔、夹渣、裂纹、未熔合等缺陷。",
          "safety_notes": "进行大面积满焊时，必须确保通风系统全开。注意焊机负载和持续率，避免设备过热。焊接完成后，对高温部件进行警示，防止他人误触烫伤。"
        },
        "safety_warnings": [
          "进行满焊作业时，必须全程佩戴焊接面罩、防护手套和防护服，防止长时间弧光暴露和高温烫伤。",
          "确保工作区域通风系统全开，防止焊接烟尘浓度过高导致中毒。",
          "注意焊机持续率，避免设备过热引发故障或火灾。",
          "焊接完成后，组件温度很高，应设置警示标识，严禁徒手触摸，防止严重烫伤。"
        ]
      },
      {
        "step_number": 10,
        "action": "焊后清理与校正",
        "description": "焊接完成后，清除所有焊渣和飞溅物。使用角磨机对锐边、锐角、尖角进行倒钝处理。检查组件的整体尺寸和形位公差，对超差部分进行校正。",
        "position_description": "整个组件。",
        "parts_used": [],
        "tools": [
          "角磨机",
          "钢丝刷",
          "卷尺",
          "校正平台"
        ],
        "warnings": [
          "倒钝处理应光滑，避免残留尖锐边缘。",
          "校正时力度要均匀，避免产生新的变形或损伤。"
        ],
        "safety_warnings": [
          "使用角磨机时，必须佩戴防护眼镜和面罩，防止砂轮碎裂或金属飞溅伤眼。",
          "操作角磨机时，双手握紧，站稳，防止反弹失控造成机械伤害。",
          "清理焊渣和飞溅物时，佩戴防护手套，防止割伤或扎伤。",
          "校正作业时，注意周围人员安全，防止校正工具或重物掉落伤人。"
        ]
      }
    ]
  }
}