{
  "agent_name": "Agent6_FAQ",
  "model": "google/gemini-2.5-flash-preview-09-2025",
  "timestamp": "20251005_160057",
  "image_count": 0,
  "temperature": 0.2,
  "system_prompt": "# 角色定位\n\n你是**李师傅**，一位拥有20年安全管理经验的高级安全工程师。\n\n## 教育背景\n\n- **学历**：安全工程专业本科\n- **职业资格**：注册安全工程师、高级安全评价师\n- **专业培训**：\n  - 机械制造安全管理\n  - 职业健康与安全管理体系（ISO 45001）\n  - 事故调查与分析\n  - 应急预案编制与演练\n\n## 职业背景\n\n- **工作经历**：20年机械制造企业安全管理经验，参与过大型装备制造、钢结构加工等项目\n- **专业领域**：\n  - 机械加工安全（车、铣、刨、磨、钻等）\n  - 焊接作业安全（电焊、气焊、氩弧焊等）\n  - 起重吊装安全（行车、叉车、吊索具等）\n  - 高空作业安全（脚手架、安全带、防坠落等）\n  - 个人防护用品管理（安全帽、防护眼镜、手套、安全鞋等）\n\n## 知识结构（详细）\n\n### 1. 机械伤害风险\n- **夹伤/挤伤**：手指、手臂被运动部件夹住\n- **切割伤**：锋利边缘、毛刺、切削工具\n- **碰撞伤**：头部碰撞、身体碰撞\n- **坠落伤**：零件坠落、工具坠落、人员坠落\n\n### 2. 焊接作业风险\n- **电击伤**：焊机漏电、接地不良\n- **弧光伤**：电弧紫外线灼伤眼睛和皮肤\n- **烫伤**：高温熔池、焊渣飞溅\n- **火灾爆炸**：易燃物引燃、气瓶泄漏\n- **有毒气体**：焊接烟尘、一氧化碳中毒\n\n### 3. 起重吊装风险\n- **吊物坠落**：吊索具断裂、捆绑不牢\n- **吊物摆动**：碰撞人员、设备\n- **超载**：超过起重机额定载荷\n- **指挥失误**：信号不清、违章指挥\n\n### 4. 高空作业风险\n- **人员坠落**：未系安全带、脚手架不牢\n- **物体打击**：工具、零件从高处坠落\n- **脚手架坍塌**：搭设不规范、超载\n\n### 5. 个人防护用品\n- **头部防护**：安全帽（防止碰撞、坠物打击）\n- **眼部防护**：防护眼镜、焊接面罩（防止飞溅、弧光）\n- **手部防护**：防护手套（防止切割、烫伤、化学品）\n- **足部防护**：安全鞋（防砸、防刺穿、防滑）\n- **呼吸防护**：防尘口罩、防毒面具（防止粉尘、有毒气体）\n\n### 6. 应急处理\n- **机械伤害**：立即停机、呼救、止血、固定、送医\n- **电击伤**：切断电源、心肺复苏、送医\n- **烫伤**：冷水冲洗、覆盖无菌纱布、送医\n- **火灾**：使用灭火器、疏散人员、报警\n\n## 任务步骤（Chain of Thought）\n\n你的任务是**为每个装配步骤添加安全警告**（如果该步骤有安全风险）。请按照以下5个步骤思考：\n\n### 步骤1：识别风险步骤\n- 分析每个装配步骤的操作内容\n- 判断是否涉及高风险作业（焊接、吊装、高空、重物搬运等）\n- 识别潜在的伤害类型（机械伤害、电击、烫伤、坠落等）\n\n### 步骤2：分析风险源\n- 确定风险的来源（设备、工具、材料、环境、人员操作等）\n- 评估风险的严重程度（轻微、中等、严重、致命）\n- 考虑风险的发生概率\n\n### 步骤3：制定预防措施\n- 针对每个风险源，制定具体的预防措施\n- 强调个人防护用品的使用\n- 强调安全操作规程的遵守\n\n### 步骤4：添加安全警告\n- 为每个有风险的步骤添加safety_warnings字段\n- 每条警告要简洁明了，说明具体的风险和预防措施\n- 使用工人能看懂的语言\n\n### 步骤5：验证完整性\n- 检查所有高风险步骤是否都添加了安全警告\n- 检查安全警告是否具体、可操作\n- 检查是否遗漏了任何潜在风险\n\n## 核心原则\n\n1. **步骤级嵌入**：为每个有风险的步骤添加safety_warnings字段，而不是单独列出安全警告\n2. **工人友好**：使用通俗语言，避免专业术语\n3. **具体可操作**：说明具体的风险和预防措施，而不是泛泛而谈\n4. **不重复显示**：安全警告只在下方\"安全\"标签页中统一显示，不在当前步骤详情中重复显示\n\n## 输出格式\n\n严格按照以下JSON格式输出（返回增强后的装配步骤）：\n\n```json\n{\n  \"enhanced_steps\": [\n    {\n      \"step_number\": 1,\n      \"title\": \"点焊定位\",\n      \"parts_used\": [...],\n      \"tools_required\": [...],\n      \"operation\": \"操作说明\",\n      \"quality_check\": \"质量检查\",\n      \"estimated_time_minutes\": 10,\n      \"welding\": {\n        \"required\": true,\n        \"welding_type\": \"点焊\",\n        \"welding_method\": \"CO2气保焊\",\n        ...\n      },\n      \"safety_warnings\": [\n        \"佩戴焊接面罩和防护手套，防止弧光灼伤眼睛和皮肤\",\n        \"确保工件夹紧牢固，防止点焊时位移造成伤害\",\n        \"焊接区域周围3米内不得有易燃物，配备灭火器\",\n        \"焊机必须接地良好，防止漏电触电\"\n      ]\n    },\n    {\n      \"step_number\": 2,\n      \"title\": \"螺栓连接\",\n      \"parts_used\": [...],\n      \"operation\": \"操作说明\",\n      \"quality_check\": \"质量检查\",\n      \"estimated_time_minutes\": 15,\n      \"safety_warnings\": [\n        \"佩戴安全帽和防护眼镜，防止零件坠落和飞溅\",\n        \"使用扭力扳手时注意力度，防止扳手滑脱伤人\"\n      ]\n    },\n    {\n      \"step_number\": 3,\n      \"title\": \"简单装配\",\n      \"parts_used\": [...],\n      \"operation\": \"操作说明\",\n      \"quality_check\": \"质量检查\",\n      \"estimated_time_minutes\": 5\n      // ⚠️ 如果没有明显安全风险，不添加safety_warnings字段\n    }\n  ]\n}\n```\n\n**⚠️ 关键要求**：\n\n1. **步骤级嵌入**：\n   - 为每个有风险的步骤添加`safety_warnings`字段\n   - 没有明显风险的步骤不添加`safety_warnings`字段\n   - 保持原有步骤的所有字段不变\n\n2. **安全警告要具体**：\n   - ✅ 说\"佩戴焊接面罩和防护手套，防止弧光灼伤眼睛和皮肤\"\n   - ❌ 不说\"注意安全\"\n   - ✅ 说\"焊接区域周围3米内不得有易燃物，配备灭火器\"\n   - ❌ 不说\"注意防火\"\n\n3. **使用通俗语言**：\n   - 工人能看懂的语言\n   - 避免专业术语和英文缩写\n\n4. **警告要全面**：\n   - 涵盖个人防护、设备安全、环境安全、操作安全\n   - 每条警告说明具体的风险和预防措施\n\n## 重要提醒\n\n- **只输出JSON，不要输出其他内容**\n- **保持原有字段不变**：不要修改或删除原有的字段（包括welding字段）\n- **警告要简洁明了**：每条警告一句话，说明风险和预防措施\n- **不要过度警告**：只针对有明显风险的步骤添加警告\n",
  "user_query": "请为以下装配步骤添加安全警告（如果有安全风险）。\n\n## 📸 视觉分析任务\n\n**你会看到工程图纸图片，请仔细观察：**\n\n1. **危险作业标识**：\n   - 图纸上的安全警告标识\n   - 特殊作业要求（如高空作业、吊装作业等）\n   - 危险区域标注\n\n2. **零件特征**：\n   - 重型零件（需要吊装）\n   - 锋利边缘（容易割伤）\n   - 高温部件（容易烫伤）\n\n3. **作业环境**：\n   - 狭窄空间（容易碰撞）\n   - 高空位置（容易坠落）\n   - 密闭空间（通风不良）\n\n## 装配步骤\n\n[\n  {\n    \"step_number\": 1,\n    \"action\": \"放置基准件\",\n    \"description\": \"将图纸上标注为1号的方形板-机加（01.01.01.11511）平稳放置在装配工作台上，作为整个组件的装配基准。\",\n    \"position_description\": \"工作台中央，水平放置\",\n    \"parts_used\": [\n      {\n        \"bom_seq\": \"1\",\n        \"bom_name\": \"方形板-机加 1\",\n        \"quantity\": 1,\n        \"drawing_number\": \"1\"\n      }\n    ],\n    \"tools\": [\n      \"行车\",\n      \"吊具\",\n      \"水平仪\"\n    ],\n    \"warnings\": [\n      \"确保方形板放置平稳，避免倾斜。\"\n    ]\n  },\n  {\n    \"step_number\": 2,\n    \"action\": \"安装上连接板\",\n    \"description\": \"将图纸上标注为2号的上连接板（01.01.01.11512）对称放置在1号方形板的上方，确保上连接板的底部边缘与方形板的顶部边缘对齐。进行点焊定位。\",\n    \"position_description\": \"在1号方形板的顶部，居中放置\",\n    \"parts_used\": [\n      {\n        \"bom_seq\": \"2\",\n        \"bom_name\": \"上连接板 2\",\n        \"quantity\": 2,\n        \"drawing_number\": \"2\"\n      }\n    ],\n    \"tools\": [\n      \"焊机\",\n      \"角尺\",\n      \"卷尺\"\n    ],\n    \"warnings\": [\n      \"点焊前必须检查两块上连接板的间距和垂直度，确保对称。\"\n    ],\n    \"welding\": {\n      \"required\": true,\n      \"welding_type\": \"角焊（定位焊）\",\n      \"welding_method\": \"CO2气保焊\",\n      \"weld_size\": \"点焊，焊点长度约10mm\",\n      \"welding_position\": \"零件1（方形板）与零件2（上连接板）的连接处，平焊\",\n      \"quality_requirements\": \"焊点牢固，能承受后续装配应力，焊点高度约3mm\",\n      \"safety_notes\": \"佩戴焊接面罩和防护手套，确保通风良好。点焊电流不宜过大，防止烧穿。\"\n    }\n  },\n  {\n    \"step_number\": 3,\n    \"action\": \"安装侧连接板\",\n    \"description\": \"将图纸上标注为3号的侧连接板（01.01.01.11513）对称放置在1号方形板的两侧，并与2号上连接板的侧面贴合。进行点焊定位。\",\n    \"position_description\": \"在1号方形板的两侧，与2号上连接板形成一个U型结构\",\n    \"parts_used\": [\n      {\n        \"bom_seq\": \"3\",\n        \"bom_name\": \"侧连接板 2\",\n        \"quantity\": 2,\n        \"drawing_number\": \"3\"\n      }\n    ],\n    \"tools\": [\n      \"焊机\",\n      \"角尺\"\n    ],\n    \"warnings\": [\n      \"侧连接板必须与方形板和上连接板保持90度垂直，确保焊接面贴合。\"\n    ],\n    \"welding\": {\n      \"required\": true,\n      \"welding_type\": \"角焊（定位焊）\",\n      \"welding_method\": \"CO2气保焊\",\n      \"weld_size\": \"点焊，焊点长度约10mm\",\n      \"welding_position\": \"零件1与零件3，以及零件2与零件3的连接处，主要为平焊和横焊\",\n      \"quality_requirements\": \"确保零件垂直度，焊点位置均匀分布，防止装配变形\",\n      \"safety_notes\": \"使用卡具固定零件，防止定位焊时零件移动。注意焊烟防护。\"\n    }\n  },\n  {\n    \"step_number\": 4,\n    \"action\": \"安装折弯板\",\n    \"description\": \"将图纸上标注为4号的折弯板（01.01.01.11514）放置在1号方形板的后部，并与两侧的3号侧连接板焊接。进行点焊定位。\",\n    \"position_description\": \"在1号方形板的后侧，连接两块3号侧连接板\",\n    \"parts_used\": [\n      {\n        \"bom_seq\": \"4\",\n        \"bom_name\": \"折弯板 1\",\n        \"quantity\": 1,\n        \"drawing_number\": \"4\"\n      }\n    ],\n    \"tools\": [\n      \"焊机\",\n      \"卡具\"\n    ],\n    \"warnings\": [\n      \"折弯板的定位必须准确，确保其与侧连接板的连接强度。\"\n    ],\n    \"welding\": {\n      \"required\": true,\n      \"welding_type\": \"角焊（定位焊）\",\n      \"welding_method\": \"CO2气保焊\",\n      \"weld_size\": \"点焊，焊点长度约10mm\",\n      \"welding_position\": \"零件4（折弯板）与零件1（方形板）和零件3（侧连接板）的连接处，主要为平焊\",\n      \"quality_requirements\": \"折弯板与侧连接板的连接面必须紧密贴合，定位焊后检查尺寸\",\n      \"safety_notes\": \"折弯板边缘可能锋利，操作时佩戴防护手套。确保焊机接地良好。\"\n    }\n  },\n  {\n    \"step_number\": 5,\n    \"action\": \"安装油缸固定板和加强板（上部）\",\n    \"description\": \"将图纸上标注为5号的油缸固定板（01.01.01.11515）和6号的加强板（01.01.01.11516）焊接到2号上连接板的内侧。油缸固定板位于上连接板的内侧，加强板位于油缸固定板的下方，两者需对齐并焊接牢固。\",\n    \"position_description\": \"在2号上连接板的内侧，靠近顶部\",\n    \"parts_used\": [\n      {\n        \"bom_seq\": \"5\",\n        \"bom_name\": \"油缸固定板 4\",\n        \"quantity\": 4,\n        \"drawing_number\": \"5\"\n      },\n      {\n        \"bom_seq\": \"6\",\n        \"bom_name\": \"加强板 4\",\n        \"quantity\": 4,\n        \"drawing_number\": \"6\"\n      }\n    ],\n    \"tools\": [\n      \"焊机\",\n      \"定位夹具\"\n    ],\n    \"warnings\": [\n      \"油缸固定板的孔位必须与图纸要求对齐，确保后续油缸安装顺利。\"\n    ],\n    \"welding\": {\n      \"required\": true,\n      \"welding_type\": \"角焊（定位焊）\",\n      \"welding_method\": \"CO2气保焊\",\n      \"weld_size\": \"点焊，焊点长度约10mm\",\n      \"welding_position\": \"零件5和零件6与零件2（上连接板）的连接处，主要为平焊和横焊\",\n      \"quality_requirements\": \"油缸固定板（5号）的定位精度要求高，必须使用定位夹具保证孔位尺寸和垂直度\",\n      \"safety_notes\": \"由于是在结构内部焊接，操作空间可能受限，注意防止烫伤和电弧光伤害。\"\n    }\n  },\n  {\n    \"step_number\": 6,\n    \"action\": \"安装角钢\",\n    \"description\": \"将图纸上标注为7号的角钢-机加（01.01.04.0592）焊接到2号上连接板的顶部，位于两块上连接板之间。确保角钢与上连接板的顶部边缘齐平。\",\n    \"position_description\": \"在两块2号上连接板的顶部中间位置\",\n    \"parts_used\": [\n      {\n        \"bom_seq\": \"7\",\n        \"bom_name\": \"角钢-机加 1\",\n        \"quantity\": 1,\n        \"drawing_number\": \"7\"\n      }\n    ],\n    \"tools\": [\n      \"焊机\",\n      \"角尺\"\n    ],\n    \"warnings\": [\n      \"角钢的焊接位置和角度必须准确，确保其作为连接基准的精度。\"\n    ],\n    \"welding\": {\n      \"required\": true,\n      \"welding_type\": \"角焊（定位焊）\",\n      \"welding_method\": \"CO2气保焊\",\n      \"weld_size\": \"点焊，焊点长度约10mm\",\n      \"welding_position\": \"零件7（角钢）与零件2（上连接板）的连接处，平焊\",\n      \"quality_requirements\": \"角钢顶部必须与上连接板顶部齐平，定位焊后检查水平度\",\n      \"safety_notes\": \"角钢较重，定位时注意防砸。焊接前清理角钢表面的油污和锈蚀。\"\n    }\n  },\n  {\n    \"step_number\": 7,\n    \"action\": \"安装轴套（上部）\",\n    \"description\": \"将图纸上标注为8号的轴套（01.01.02.1221）焊接到2号上连接板的顶部两侧，位于角钢的两侧。轴套需与上连接板的孔位同心。\",\n    \"position_description\": \"在2号上连接板的顶部，靠近外侧\",\n    \"parts_used\": [\n      {\n        \"bom_seq\": \"8\",\n        \"bom_name\": \"轴套 1\",\n        \"quantity\": 1,\n        \"drawing_number\": \"8\"\n      }\n    ],\n    \"tools\": [\n      \"焊机\",\n      \"同心度量具\"\n    ],\n    \"warnings\": [\n      \"轴套的焊接必须保证其轴线与上连接板的孔位同心，并确保焊接牢固。\"\n    ],\n    \"welding\": {\n      \"required\": true,\n      \"welding_type\": \"角焊（定位焊）\",\n      \"welding_method\": \"CO2气保焊\",\n      \"weld_size\": \"点焊，焊点长度约10mm\",\n      \"welding_position\": \"零件8（轴套）与零件2（上连接板）的连接处，环形角焊，平焊\",\n      \"quality_requirements\": \"必须使用专用工装或心轴定位，确保轴套轴线与上连接板孔位同心，定位焊后进行同心度检查\",\n      \"safety_notes\": \"轴套是机加工件，焊接时注意控制热输入，防止轴套变形影响后续配合精度。\"\n    }\n  },\n  {\n    \"step_number\": 8,\n    \"action\": \"安装后座轴套（下部）\",\n    \"description\": \"将图纸上标注为9号的后座轴套（01.02.02.0490）和10号的后座轴套（01.01.02.0337）分别焊接到3号侧连接板的下部。9号轴套位于侧连接板的左侧，10号轴套位于侧连接板的右侧。注意图纸上标注的'需与转动轴及左右铲雪板组件配合焊接保证同轴度'的要求。\",\n    \"position_description\": \"在3号侧连接板的下部，靠近折弯板\",\n    \"parts_used\": [\n      {\n        \"bom_seq\": \"9\",\n        \"bom_name\": \"后座轴套 1\",\n        \"quantity\": 1,\n        \"drawing_number\": \"9\"\n      },\n      {\n        \"bom_seq\": \"10\",\n        \"bom_name\": \"后座轴套 1\",\n        \"quantity\": 1,\n        \"drawing_number\": \"10\"\n      }\n    ],\n    \"tools\": [\n      \"焊机\",\n      \"同轴度检测工具\",\n      \"专用工装\"\n    ],\n    \"warnings\": [\n      \"这是关键工序，必须使用专用工装夹具保证9号和10号轴套的同轴度，误差必须符合图纸要求。\"\n    ],\n    \"welding\": {\n      \"required\": true,\n      \"welding_type\": \"角焊（定位焊）\",\n      \"welding_method\": \"CO2气保焊\",\n      \"weld_size\": \"点焊，焊点长度约10mm\",\n      \"welding_position\": \"零件9和零件10（轴套）与零件3（侧连接板）的连接处，环形角焊，平焊或横焊\",\n      \"quality_requirements\": \"必须使用专用工装或长心轴穿过两个轴套进行定位，确保9号和10号轴套的同轴度在0.2mm以内（根据图纸要求）。定位焊后，工装不能拆除，等待满焊。\",\n      \"safety_notes\": \"轴套定位精度要求极高，焊接时应避免应力集中导致轴套移位。焊接前对轴套内孔进行保护，防止焊渣飞溅。\"\n    }\n  },\n  {\n    \"step_number\": 9,\n    \"action\": \"满焊所有结构件\",\n    \"description\": \"对所有已点焊定位的结构件（2号、3号、4号、5号、6号、7号、8号、9号、10号）与1号方形板及相互之间的连接焊缝进行满焊。焊缝尺寸和质量必须符合图纸技术要求。\",\n    \"position_description\": \"所有连接面\",\n    \"parts_used\": [],\n    \"tools\": [\n      \"焊机\",\n      \"焊条/焊丝\",\n      \"焊缝量规\"\n    ],\n    \"warnings\": [\n      \"焊接过程中注意控制热变形，必要时采用对称、分段焊接。焊后必须清理焊渣和飞溅物。\"\n    ],\n    \"welding\": {\n      \"required\": true,\n      \"welding_type\": \"角焊/对接焊（满焊）\",\n      \"welding_method\": \"CO2气保焊（主要）或手工电弧焊（难达部位）\",\n      \"weld_size\": \"焊脚高度5mm或6mm（具体尺寸参照图纸标注），焊缝连续\",\n      \"welding_position\": \"所有结构件连接处，涉及平焊、横焊、立焊\",\n      \"quality_requirements\": \"焊缝外观成型良好，焊缝饱满、连续，无咬边、气孔、夹渣、裂纹等缺陷。轴套（8、9、10号）焊缝需进行100%外观检查，关键承力焊缝可能需要进行磁粉检测（MT）或超声波检测（UT）。\",\n      \"safety_notes\": \"满焊时热输入量大，注意控制焊接区域温度，防止结构件整体变形。必须穿戴全套防护服、面罩和手套。焊接完成后，对焊渣和飞溅物进行彻底清理，并检查焊机电缆绝缘情况。\"\n    }\n  }\n]\n\n## 要求\n\n请按照以下5个步骤思考，为装配步骤添加安全警告：\n\n### 步骤1：识别风险步骤\n- 分析每个装配步骤的操作内容\n- 判断是否涉及高风险作业：\n  * **焊接作业**：电击、弧光、烫伤、火灾\n  * **吊装作业**：吊物坠落、碰撞、超载\n  * **高空作业**：人员坠落、物体打击\n  * **重物搬运**：砸伤、扭伤、夹伤\n  * **机械加工**：切割伤、夹伤、碰撞\n\n### 步骤2：分析风险源\n- 确定风险的来源（设备、工具、材料、环境、人员操作等）\n- 评估风险的严重程度（轻微、中等、严重、致命）\n- 考虑风险的发生概率\n\n### 步骤3：制定预防措施\n- 针对每个风险源，制定具体的预防措施\n- 强调个人防护用品的使用：\n  * **焊接**：焊接面罩、防护手套、防护服\n  * **吊装**：安全帽、安全鞋、手套\n  * **高空**：安全带、安全帽、防滑鞋\n  * **机械**：防护眼镜、手套、安全鞋\n\n### 步骤4：添加安全警告\n- 为每个有风险的步骤添加safety_warnings字段\n- 每条警告要简洁明了，说明具体的风险和预防措施\n- 使用工人能看懂的语言\n\n### 步骤5：验证完整性\n- 检查所有高风险步骤是否都添加了安全警告\n- 检查安全警告是否具体、可操作\n- 检查是否遗漏了任何潜在风险\n\n## ⚠️ 强制自检清单（生成后必须逐项检查）\n\n**在输出JSON之前，你必须完成以下验证：**\n\n1. **风险步骤识别验证**：\n   - [ ] 所有涉及焊接、吊装、高空、重物搬运的步骤都添加了safety_warnings字段\n   - [ ] 没有明显风险的步骤没有添加safety_warnings字段\n\n2. **安全警告完整性验证**：\n   - [ ] 每个safety_warnings字段都是字符串数组\n   - [ ] 每条警告都说明了具体的风险和预防措施\n   - [ ] 涵盖了个人防护、设备安全、环境安全、操作安全\n\n3. **语言通俗性验证**：\n   - [ ] 使用工人能看懂的语言\n   - [ ] 避免专业术语和英文缩写\n   - [ ] 每条警告简洁明了（一句话）\n\n4. **原有字段保持验证**：\n   - [ ] 原有步骤的所有字段都保持不变（包括welding字段）\n   - [ ] 没有修改或删除任何原有字段\n\n**如果自检发现任何问题，必须重新生成！**\n\n现在开始为装配步骤添加安全警告！\n",
  "raw_response": "```json\n{\n  \"enhanced_steps\": [\n    {\n      \"step_number\": 1,\n      \"action\": \"放置基准件\",\n      \"description\": \"将图纸上标注为1号的方形板-机加（01.01.01.11511）平稳放置在装配工作台上，作为整个组件的装配基准。\",\n      \"position_description\": \"工作台中央，水平放置\",\n      \"parts_used\": [\n        {\n          \"bom_seq\": \"1\",\n          \"bom_name\": \"方形板-机加 1\",\n          \"quantity\": 1,\n          \"drawing_number\": \"1\"\n        }\n      ],\n      \"tools\": [\n        \"行车\",\n        \"吊具\",\n        \"水平仪\"\n      ],\n      \"warnings\": [\n        \"确保方形板放置平稳，避免倾斜。\"\n      ],\n      \"safety_warnings\": [\n        \"操作行车和吊具时，必须佩戴安全帽和安全鞋\",\n        \"吊装前检查吊索具是否完好，捆绑是否牢固，防止重物坠落\",\n        \"重物下降时，身体远离下方，防止挤伤或砸伤\",\n        \"指挥信号必须清晰，吊装过程中严禁人员在吊物下方停留\"\n      ]\n    },\n    {\n      \"step_number\": 2,\n      \"action\": \"安装上连接板\",\n      \"description\": \"将图纸上标注为2号的上连接板（01.01.01.11512）对称放置在1号方形板的上方，确保上连接板的底部边缘与方形板的顶部边缘对齐。进行点焊定位。\",\n      \"position_description\": \"在1号方形板的顶部，居中放置\",\n      \"parts_used\": [\n        {\n          \"bom_seq\": \"2\",\n          \"bom_name\": \"上连接板 2\",\n          \"quantity\": 2,\n          \"drawing_number\": \"2\"\n        }\n      ],\n      \"tools\": [\n        \"焊机\",\n        \"角尺\",\n        \"卷尺\"\n      ],\n      \"warnings\": [\n        \"点焊前必须检查两块上连接板的间距和垂直度，确保对称。\"\n      ],\n      \"welding\": {\n        \"required\": true,\n        \"welding_type\": \"角焊（定位焊）\",\n        \"welding_method\": \"CO2气保焊\",\n        \"weld_size\": \"点焊，焊点长度约10mm\",\n        \"welding_position\": \"零件1（方形板）与零件2（上连接板）的连接处，平焊\",\n        \"quality_requirements\": \"焊点牢固，能承受后续装配应力，焊点高度约3mm\",\n        \"safety_notes\": \"佩戴焊接面罩和防护手套，确保通风良好。点焊电流不宜过大，防止烧穿。\"\n      },\n      \"safety_warnings\": [\n        \"必须佩戴焊接面罩、防护手套和防护服，防止弧光灼伤和烫伤\",\n        \"确保焊机接地良好，电缆绝缘完好，防止触电\",\n        \"焊接区域必须通风良好，防止吸入有害烟尘\",\n        \"使用卡具或夹具固定零件，防止定位焊时零件移动伤人\"\n      ]\n    },\n    {\n      \"step_number\": 3,\n      \"action\": \"安装侧连接板\",\n      \"description\": \"将图纸上标注为3号的侧连接板（01.01.01.11513）对称放置在1号方形板的两侧，并与2号上连接板的侧面贴合。进行点焊定位。\",\n      \"position_description\": \"在1号方形板的两侧，与2号上连接板形成一个U型结构\",\n      \"parts_used\": [\n        {\n          \"bom_seq\": \"3\",\n          \"bom_name\": \"侧连接板 2\",\n          \"quantity\": 2,\n          \"drawing_number\": \"3\"\n        }\n      ],\n      \"tools\": [\n        \"焊机\",\n        \"角尺\"\n      ],\n      \"warnings\": [\n        \"侧连接板必须与方形板和上连接板保持90度垂直，确保焊接面贴合。\"\n      ],\n      \"welding\": {\n        \"required\": true,\n        \"welding_type\": \"角焊（定位焊）\",\n        \"welding_method\": \"CO2气保焊\",\n        \"weld_size\": \"点焊，焊点长度约10mm\",\n        \"welding_position\": \"零件1与零件3，以及零件2与零件3的连接处，主要为平焊和横焊\",\n        \"quality_requirements\": \"确保零件垂直度，焊点位置均匀分布，防止装配变形\",\n        \"safety_notes\": \"使用卡具固定零件，防止定位焊时零件移动。注意焊烟防护。\"\n      },\n      \"safety_warnings\": [\n        \"佩戴焊接面罩、防护手套和防护服，防止电弧光和高温焊渣伤害\",\n        \"操作前检查焊机和电缆，确保无破损漏电风险\",\n        \"零件边缘可能锋利，搬运和定位时佩戴防割手套，防止割伤\"\n      ]\n    },\n    {\n      \"step_number\": 4,\n      \"action\": \"安装折弯板\",\n      \"description\": \"将图纸上标注为4号的折弯板（01.01.01.11514）放置在1号方形板的后部，并与两侧的3号侧连接板焊接。进行点焊定位。\",\n      \"position_description\": \"在1号方形板的后侧，连接两块3号侧连接板\",\n      \"parts_used\": [\n        {\n          \"bom_seq\": \"4\",\n          \"bom_name\": \"折弯板 1\",\n          \"quantity\": 1,\n          \"drawing_number\": \"4\"\n        }\n      ],\n      \"tools\": [\n        \"焊机\",\n        \"卡具\"\n      ],\n      \"warnings\": [\n        \"折弯板的定位必须准确，确保其与侧连接板的连接强度。\"\n      ],\n      \"welding\": {\n        \"required\": true,\n        \"welding_type\": \"角焊（定位焊）\",\n        \"welding_method\": \"CO2气保焊\",\n        \"weld_size\": \"点焊，焊点长度约10mm\",\n        \"welding_position\": \"零件4（折弯板）与零件1（方形板）和零件3（侧连接板）的连接处，主要为平焊\",\n        \"quality_requirements\": \"折弯板与侧连接板的连接面必须紧密贴合，定位焊后检查尺寸\",\n        \"safety_notes\": \"折弯板边缘可能锋利，操作时佩戴防护手套。确保焊机接地良好。\"\n      },\n      \"safety_warnings\": [\n        \"折弯板边缘锋利，搬运和定位时必须佩戴防割手套，防止割伤\",\n        \"进行点焊时，佩戴全套焊接防护用品，防止弧光和飞溅物伤害\",\n        \"确保工作区域无易燃物，防止焊接火花引燃\"\n      ]\n    },\n    {\n      \"step_number\": 5,\n      \"action\": \"安装油缸固定板和加强板（上部）\",\n      \"description\": \"将图纸上标注为5号的油缸固定板（01.01.01.11515）和6号的加强板（01.01.01.11516）焊接到2号上连接板的内侧。油缸固定板位于上连接板的内侧，加强板位于油缸固定板的下方，两者需对齐并焊接牢固。\",\n      \"position_description\": \"在2号上连接板的内侧，靠近顶部\",\n      \"parts_used\": [\n        {\n          \"bom_seq\": \"5\",\n          \"bom_name\": \"油缸固定板 4\",\n          \"quantity\": 4,\n          \"drawing_number\": \"5\"\n        },\n        {\n          \"bom_seq\": \"6\",\n          \"bom_name\": \"加强板 4\",\n          \"quantity\": 4,\n          \"drawing_number\": \"6\"\n        }\n      ],\n      \"tools\": [\n        \"焊机\",\n        \"定位夹具\"\n      ],\n      \"warnings\": [\n        \"油缸固定板的孔位必须与图纸要求对齐，确保后续油缸安装顺利。\"\n      ],\n      \"welding\": {\n        \"required\": true,\n        \"welding_type\": \"角焊（定位焊）\",\n        \"welding_method\": \"CO2气保焊\",\n        \"weld_size\": \"点焊，焊点长度约10mm\",\n        \"welding_position\": \"零件5和零件6与零件2（上连接板）的连接处，主要为平焊和横焊\",\n        \"quality_requirements\": \"油缸固定板（5号）的定位精度要求高，必须使用定位夹具保证孔位尺寸和垂直度\",\n        \"safety_notes\": \"由于是在结构内部焊接，操作空间可能受限，注意防止烫伤和电弧光伤害。\"\n      },\n      \"safety_warnings\": [\n        \"在结构内部焊接时，操作空间狭窄，注意身体姿势，防止扭伤\",\n        \"必须使用局部排风或通风设备，确保焊接烟尘及时排出\",\n        \"防止焊枪或身体接触高温金属表面，造成烫伤\",\n        \"佩戴防护眼镜和面罩，防止飞溅的焊渣进入眼睛\"\n      ]\n    },\n    {\n      \"step_number\": 6,\n      \"action\": \"安装角钢\",\n      \"description\": \"将图纸上标注为7号的角钢-机加（01.01.04.0592）焊接到2号上连接板的顶部，位于两块上连接板之间。确保角钢与上连接板的顶部边缘齐平。\",\n      \"position_description\": \"在两块2号上连接板的顶部中间位置\",\n      \"parts_used\": [\n        {\n          \"bom_seq\": \"7\",\n          \"bom_name\": \"角钢-机加 1\",\n          \"quantity\": 1,\n          \"drawing_number\": \"7\"\n        }\n      ],\n      \"tools\": [\n        \"焊机\",\n        \"角尺\"\n      ],\n      \"warnings\": [\n        \"角钢的焊接位置和角度必须准确，确保其作为连接基准的精度。\"\n      ],\n      \"welding\": {\n        \"required\": true,\n        \"welding_type\": \"角焊（定位焊）\",\n        \"welding_method\": \"CO2气保焊\",\n        \"weld_size\": \"点焊，焊点长度约10mm\",\n        \"welding_position\": \"零件7（角钢）与零件2（上连接板）的连接处，平焊\",\n        \"quality_requirements\": \"角钢顶部必须与上连接板顶部齐平，定位焊后检查水平度\",\n        \"safety_notes\": \"角钢较重，定位时注意防砸。焊接前清理角钢表面的油污和锈蚀。\"\n      },\n      \"safety_warnings\": [\n        \"角钢可能较重，搬运和定位时注意使用辅助工具或两人操作，防止砸伤或扭伤\",\n        \"定位焊接时，使用夹具固定角钢，防止其突然移动造成伤害\",\n        \"焊接前必须彻底清理角钢表面的油污和锈蚀，防止焊接时产生有毒烟雾\"\n      ]\n    },\n    {\n      \"step_number\": 7,\n      \"action\": \"安装轴套（上部）\",\n      \"description\": \"将图纸上标注为8号的轴套（01.01.02.1221）焊接到2号上连接板的顶部两侧，位于角钢的两侧。轴套需与上连接板的孔位同心。\",\n      \"position_description\": \"在2号上连接板的顶部，靠近外侧\",\n      \"parts_used\": [\n        {\n          \"bom_seq\": \"8\",\n          \"bom_name\": \"轴套 1\",\n          \"quantity\": 1,\n          \"drawing_number\": \"8\"\n        }\n      ],\n      \"tools\": [\n        \"焊机\",\n        \"同心度量具\"\n      ],\n      \"warnings\": [\n        \"轴套的焊接必须保证其轴线与上连接板的孔位同心，并确保焊接牢固。\"\n      ],\n      \"welding\": {\n        \"required\": true,\n        \"welding_type\": \"角焊（定位焊）\",\n        \"welding_method\": \"CO2气保焊\",\n        \"weld_size\": \"点焊，焊点长度约10mm\",\n        \"welding_position\": \"零件8（轴套）与零件2（上连接板）的连接处，环形角焊，平焊\",\n        \"quality_requirements\": \"必须使用专用工装或心轴定位，确保轴套轴线与上连接板孔位同心，定位焊后进行同心度检查\",\n        \"safety_notes\": \"轴套是机加工件，焊接时注意控制热输入，防止轴套变形影响后续配合精度。\"\n      },\n      \"safety_warnings\": [\n        \"轴套是精密机加工件，搬运时轻拿轻放，防止砸伤手指\",\n        \"焊接时控制热输入，防止轴套因受热变形或飞溅物进入内孔\",\n        \"使用专用工装定位时，确保工装夹紧可靠，防止轴套在焊接过程中松动\"\n      ]\n    },\n    {\n      \"step_number\": 8,\n      \"action\": \"安装后座轴套（下部）\",\n      \"description\": \"将图纸上标注为9号的后座轴套（01.02.02.0490）和10号的后座轴套（01.01.02.0337）分别焊接到3号侧连接板的下部。9号轴套位于侧连接板的左侧，10号轴套位于侧连接板的右侧。注意图纸上标注的'需与转动轴及左右铲雪板组件配合焊接保证同轴度'的要求。\",\n      \"position_description\": \"在3号侧连接板的下部，靠近折弯板\",\n      \"parts_used\": [\n        {\n          \"bom_seq\": \"9\",\n          \"bom_name\": \"后座轴套 1\",\n          \"quantity\": 1,\n          \"drawing_number\": \"9\"\n        },\n        {\n          \"bom_seq\": \"10\",\n          \"bom_name\": \"后座轴套 1\",\n          \"quantity\": 1,\n          \"drawing_number\": \"10\"\n        }\n      ],\n      \"tools\": [\n        \"焊机\",\n        \"同轴度检测工具\",\n        \"专用工装\"\n      ],\n      \"warnings\": [\n        \"这是关键工序，必须使用专用工装夹具保证9号和10号轴套的同轴度，误差必须符合图纸要求。\"\n      ],\n      \"welding\": {\n        \"required\": true,\n        \"welding_type\": \"角焊（定位焊）\",\n        \"welding_method\": \"CO2气保焊\",\n        \"weld_size\": \"点焊，焊点长度约10mm\",\n        \"welding_position\": \"零件9和零件10（轴套）与零件3（侧连接板）的连接处，环形角焊，平焊或横焊\",\n        \"quality_requirements\": \"必须使用专用工装或长心轴穿过两个轴套进行定位，确保9号和10号轴套的同轴度在0.2mm以内（根据图纸要求）。定位焊后，工装不能拆除，等待满焊。\",\n        \"safety_notes\": \"轴套定位精度要求极高，焊接时应避免应力集中导致轴套移位。焊接前对轴套内孔进行保护，防止焊渣飞溅。\"\n      },\n      \"safety_warnings\": [\n        \"必须使用专用工装或心轴定位，防止轴套在焊接过程中移位或变形\",\n        \"焊接时注意保护轴套内孔，防止焊渣飞溅进入，影响后续配合\",\n        \"由于操作位置较低，注意防止身体碰撞到周围结构件的锋利边缘\"\n      ]\n    },\n    {\n      \"step_number\": 9,\n      \"action\": \"满焊所有结构件\",\n      \"description\": \"对所有已点焊定位的结构件（2号、3号、4号、5号、6号、7号、8号、9号、10号）与1号方形板及相互之间的连接焊缝进行满焊。焊缝尺寸和质量必须符合图纸技术要求。\",\n      \"position_description\": \"所有连接面\",\n      \"parts_used\": [],\n      \"tools\": [\n        \"焊机\",\n        \"焊条/焊丝\",\n        \"焊缝量规\"\n      ],\n      \"warnings\": [\n        \"焊接过程中注意控制热变形，必要时采用对称、分段焊接。焊后必须清理焊渣和飞溅物。\"\n      ],\n      \"welding\": {\n        \"required\": true,\n        \"welding_type\": \"角焊/对接焊（满焊）\",\n        \"welding_method\": \"CO2气保焊（主要）或手工电弧焊（难达部位）\",\n        \"weld_size\": \"焊脚高度5mm或6mm（具体尺寸参照图纸标注），焊缝连续\",\n        \"welding_position\": \"所有结构件连接处，涉及平焊、横焊、立焊\",\n        \"quality_requirements\": \"焊缝外观成型良好，焊缝饱满、连续，无咬边、气孔、夹渣、裂纹等缺陷。轴套（8、9、10号）焊缝需进行100%外观检查，关键承力焊缝可能需要进行磁粉检测（MT）或超声波检测（UT）。\",\n        \"safety_notes\": \"满焊时热输入量大，注意控制焊接区域温度，防止结构件整体变形。必须穿戴全套防护服、面罩和手套。焊接完成后，对焊渣和飞溅物进行彻底清理，并检查焊机电缆绝缘情况。\"\n      },\n      \"safety_warnings\": [\n        \"满焊时必须穿戴全套阻燃防护服、焊接面罩和防护手套，防止大面积烫伤和弧光伤害\",\n        \"确保工作场所通风系统全开，防止烟尘浓度过高导致中毒\",\n        \"焊接完成后，工件温度极高，设置警示标识，防止人员误触烫伤\",\n        \"清理焊渣时，必须佩戴防护眼镜，防止焊渣飞溅伤眼\",\n        \"检查所有焊机电缆和气瓶管路，防止漏电或漏气引发火灾爆炸\"\n      ]\n    }\n  ]\n}\n```",
  "parsed_result": {
    "enhanced_steps": [
      {
        "step_number": 1,
        "action": "放置基准件",
        "description": "将图纸上标注为1号的方形板-机加（01.01.01.11511）平稳放置在装配工作台上，作为整个组件的装配基准。",
        "position_description": "工作台中央，水平放置",
        "parts_used": [
          {
            "bom_seq": "1",
            "bom_name": "方形板-机加 1",
            "quantity": 1,
            "drawing_number": "1"
          }
        ],
        "tools": [
          "行车",
          "吊具",
          "水平仪"
        ],
        "warnings": [
          "确保方形板放置平稳，避免倾斜。"
        ],
        "safety_warnings": [
          "操作行车和吊具时，必须佩戴安全帽和安全鞋",
          "吊装前检查吊索具是否完好，捆绑是否牢固，防止重物坠落",
          "重物下降时，身体远离下方，防止挤伤或砸伤",
          "指挥信号必须清晰，吊装过程中严禁人员在吊物下方停留"
        ]
      },
      {
        "step_number": 2,
        "action": "安装上连接板",
        "description": "将图纸上标注为2号的上连接板（01.01.01.11512）对称放置在1号方形板的上方，确保上连接板的底部边缘与方形板的顶部边缘对齐。进行点焊定位。",
        "position_description": "在1号方形板的顶部，居中放置",
        "parts_used": [
          {
            "bom_seq": "2",
            "bom_name": "上连接板 2",
            "quantity": 2,
            "drawing_number": "2"
          }
        ],
        "tools": [
          "焊机",
          "角尺",
          "卷尺"
        ],
        "warnings": [
          "点焊前必须检查两块上连接板的间距和垂直度，确保对称。"
        ],
        "welding": {
          "required": true,
          "welding_type": "角焊（定位焊）",
          "welding_method": "CO2气保焊",
          "weld_size": "点焊，焊点长度约10mm",
          "welding_position": "零件1（方形板）与零件2（上连接板）的连接处，平焊",
          "quality_requirements": "焊点牢固，能承受后续装配应力，焊点高度约3mm",
          "safety_notes": "佩戴焊接面罩和防护手套，确保通风良好。点焊电流不宜过大，防止烧穿。"
        },
        "safety_warnings": [
          "必须佩戴焊接面罩、防护手套和防护服，防止弧光灼伤和烫伤",
          "确保焊机接地良好，电缆绝缘完好，防止触电",
          "焊接区域必须通风良好，防止吸入有害烟尘",
          "使用卡具或夹具固定零件，防止定位焊时零件移动伤人"
        ]
      },
      {
        "step_number": 3,
        "action": "安装侧连接板",
        "description": "将图纸上标注为3号的侧连接板（01.01.01.11513）对称放置在1号方形板的两侧，并与2号上连接板的侧面贴合。进行点焊定位。",
        "position_description": "在1号方形板的两侧，与2号上连接板形成一个U型结构",
        "parts_used": [
          {
            "bom_seq": "3",
            "bom_name": "侧连接板 2",
            "quantity": 2,
            "drawing_number": "3"
          }
        ],
        "tools": [
          "焊机",
          "角尺"
        ],
        "warnings": [
          "侧连接板必须与方形板和上连接板保持90度垂直，确保焊接面贴合。"
        ],
        "welding": {
          "required": true,
          "welding_type": "角焊（定位焊）",
          "welding_method": "CO2气保焊",
          "weld_size": "点焊，焊点长度约10mm",
          "welding_position": "零件1与零件3，以及零件2与零件3的连接处，主要为平焊和横焊",
          "quality_requirements": "确保零件垂直度，焊点位置均匀分布，防止装配变形",
          "safety_notes": "使用卡具固定零件，防止定位焊时零件移动。注意焊烟防护。"
        },
        "safety_warnings": [
          "佩戴焊接面罩、防护手套和防护服，防止电弧光和高温焊渣伤害",
          "操作前检查焊机和电缆，确保无破损漏电风险",
          "零件边缘可能锋利，搬运和定位时佩戴防割手套，防止割伤"
        ]
      },
      {
        "step_number": 4,
        "action": "安装折弯板",
        "description": "将图纸上标注为4号的折弯板（01.01.01.11514）放置在1号方形板的后部，并与两侧的3号侧连接板焊接。进行点焊定位。",
        "position_description": "在1号方形板的后侧，连接两块3号侧连接板",
        "parts_used": [
          {
            "bom_seq": "4",
            "bom_name": "折弯板 1",
            "quantity": 1,
            "drawing_number": "4"
          }
        ],
        "tools": [
          "焊机",
          "卡具"
        ],
        "warnings": [
          "折弯板的定位必须准确，确保其与侧连接板的连接强度。"
        ],
        "welding": {
          "required": true,
          "welding_type": "角焊（定位焊）",
          "welding_method": "CO2气保焊",
          "weld_size": "点焊，焊点长度约10mm",
          "welding_position": "零件4（折弯板）与零件1（方形板）和零件3（侧连接板）的连接处，主要为平焊",
          "quality_requirements": "折弯板与侧连接板的连接面必须紧密贴合，定位焊后检查尺寸",
          "safety_notes": "折弯板边缘可能锋利，操作时佩戴防护手套。确保焊机接地良好。"
        },
        "safety_warnings": [
          "折弯板边缘锋利，搬运和定位时必须佩戴防割手套，防止割伤",
          "进行点焊时，佩戴全套焊接防护用品，防止弧光和飞溅物伤害",
          "确保工作区域无易燃物，防止焊接火花引燃"
        ]
      },
      {
        "step_number": 5,
        "action": "安装油缸固定板和加强板（上部）",
        "description": "将图纸上标注为5号的油缸固定板（01.01.01.11515）和6号的加强板（01.01.01.11516）焊接到2号上连接板的内侧。油缸固定板位于上连接板的内侧，加强板位于油缸固定板的下方，两者需对齐并焊接牢固。",
        "position_description": "在2号上连接板的内侧，靠近顶部",
        "parts_used": [
          {
            "bom_seq": "5",
            "bom_name": "油缸固定板 4",
            "quantity": 4,
            "drawing_number": "5"
          },
          {
            "bom_seq": "6",
            "bom_name": "加强板 4",
            "quantity": 4,
            "drawing_number": "6"
          }
        ],
        "tools": [
          "焊机",
          "定位夹具"
        ],
        "warnings": [
          "油缸固定板的孔位必须与图纸要求对齐，确保后续油缸安装顺利。"
        ],
        "welding": {
          "required": true,
          "welding_type": "角焊（定位焊）",
          "welding_method": "CO2气保焊",
          "weld_size": "点焊，焊点长度约10mm",
          "welding_position": "零件5和零件6与零件2（上连接板）的连接处，主要为平焊和横焊",
          "quality_requirements": "油缸固定板（5号）的定位精度要求高，必须使用定位夹具保证孔位尺寸和垂直度",
          "safety_notes": "由于是在结构内部焊接，操作空间可能受限，注意防止烫伤和电弧光伤害。"
        },
        "safety_warnings": [
          "在结构内部焊接时，操作空间狭窄，注意身体姿势，防止扭伤",
          "必须使用局部排风或通风设备，确保焊接烟尘及时排出",
          "防止焊枪或身体接触高温金属表面，造成烫伤",
          "佩戴防护眼镜和面罩，防止飞溅的焊渣进入眼睛"
        ]
      },
      {
        "step_number": 6,
        "action": "安装角钢",
        "description": "将图纸上标注为7号的角钢-机加（01.01.04.0592）焊接到2号上连接板的顶部，位于两块上连接板之间。确保角钢与上连接板的顶部边缘齐平。",
        "position_description": "在两块2号上连接板的顶部中间位置",
        "parts_used": [
          {
            "bom_seq": "7",
            "bom_name": "角钢-机加 1",
            "quantity": 1,
            "drawing_number": "7"
          }
        ],
        "tools": [
          "焊机",
          "角尺"
        ],
        "warnings": [
          "角钢的焊接位置和角度必须准确，确保其作为连接基准的精度。"
        ],
        "welding": {
          "required": true,
          "welding_type": "角焊（定位焊）",
          "welding_method": "CO2气保焊",
          "weld_size": "点焊，焊点长度约10mm",
          "welding_position": "零件7（角钢）与零件2（上连接板）的连接处，平焊",
          "quality_requirements": "角钢顶部必须与上连接板顶部齐平，定位焊后检查水平度",
          "safety_notes": "角钢较重，定位时注意防砸。焊接前清理角钢表面的油污和锈蚀。"
        },
        "safety_warnings": [
          "角钢可能较重，搬运和定位时注意使用辅助工具或两人操作，防止砸伤或扭伤",
          "定位焊接时，使用夹具固定角钢，防止其突然移动造成伤害",
          "焊接前必须彻底清理角钢表面的油污和锈蚀，防止焊接时产生有毒烟雾"
        ]
      },
      {
        "step_number": 7,
        "action": "安装轴套（上部）",
        "description": "将图纸上标注为8号的轴套（01.01.02.1221）焊接到2号上连接板的顶部两侧，位于角钢的两侧。轴套需与上连接板的孔位同心。",
        "position_description": "在2号上连接板的顶部，靠近外侧",
        "parts_used": [
          {
            "bom_seq": "8",
            "bom_name": "轴套 1",
            "quantity": 1,
            "drawing_number": "8"
          }
        ],
        "tools": [
          "焊机",
          "同心度量具"
        ],
        "warnings": [
          "轴套的焊接必须保证其轴线与上连接板的孔位同心，并确保焊接牢固。"
        ],
        "welding": {
          "required": true,
          "welding_type": "角焊（定位焊）",
          "welding_method": "CO2气保焊",
          "weld_size": "点焊，焊点长度约10mm",
          "welding_position": "零件8（轴套）与零件2（上连接板）的连接处，环形角焊，平焊",
          "quality_requirements": "必须使用专用工装或心轴定位，确保轴套轴线与上连接板孔位同心，定位焊后进行同心度检查",
          "safety_notes": "轴套是机加工件，焊接时注意控制热输入，防止轴套变形影响后续配合精度。"
        },
        "safety_warnings": [
          "轴套是精密机加工件，搬运时轻拿轻放，防止砸伤手指",
          "焊接时控制热输入，防止轴套因受热变形或飞溅物进入内孔",
          "使用专用工装定位时，确保工装夹紧可靠，防止轴套在焊接过程中松动"
        ]
      },
      {
        "step_number": 8,
        "action": "安装后座轴套（下部）",
        "description": "将图纸上标注为9号的后座轴套（01.02.02.0490）和10号的后座轴套（01.01.02.0337）分别焊接到3号侧连接板的下部。9号轴套位于侧连接板的左侧，10号轴套位于侧连接板的右侧。注意图纸上标注的'需与转动轴及左右铲雪板组件配合焊接保证同轴度'的要求。",
        "position_description": "在3号侧连接板的下部，靠近折弯板",
        "parts_used": [
          {
            "bom_seq": "9",
            "bom_name": "后座轴套 1",
            "quantity": 1,
            "drawing_number": "9"
          },
          {
            "bom_seq": "10",
            "bom_name": "后座轴套 1",
            "quantity": 1,
            "drawing_number": "10"
          }
        ],
        "tools": [
          "焊机",
          "同轴度检测工具",
          "专用工装"
        ],
        "warnings": [
          "这是关键工序，必须使用专用工装夹具保证9号和10号轴套的同轴度，误差必须符合图纸要求。"
        ],
        "welding": {
          "required": true,
          "welding_type": "角焊（定位焊）",
          "welding_method": "CO2气保焊",
          "weld_size": "点焊，焊点长度约10mm",
          "welding_position": "零件9和零件10（轴套）与零件3（侧连接板）的连接处，环形角焊，平焊或横焊",
          "quality_requirements": "必须使用专用工装或长心轴穿过两个轴套进行定位，确保9号和10号轴套的同轴度在0.2mm以内（根据图纸要求）。定位焊后，工装不能拆除，等待满焊。",
          "safety_notes": "轴套定位精度要求极高，焊接时应避免应力集中导致轴套移位。焊接前对轴套内孔进行保护，防止焊渣飞溅。"
        },
        "safety_warnings": [
          "必须使用专用工装或心轴定位，防止轴套在焊接过程中移位或变形",
          "焊接时注意保护轴套内孔，防止焊渣飞溅进入，影响后续配合",
          "由于操作位置较低，注意防止身体碰撞到周围结构件的锋利边缘"
        ]
      },
      {
        "step_number": 9,
        "action": "满焊所有结构件",
        "description": "对所有已点焊定位的结构件（2号、3号、4号、5号、6号、7号、8号、9号、10号）与1号方形板及相互之间的连接焊缝进行满焊。焊缝尺寸和质量必须符合图纸技术要求。",
        "position_description": "所有连接面",
        "parts_used": [],
        "tools": [
          "焊机",
          "焊条/焊丝",
          "焊缝量规"
        ],
        "warnings": [
          "焊接过程中注意控制热变形，必要时采用对称、分段焊接。焊后必须清理焊渣和飞溅物。"
        ],
        "welding": {
          "required": true,
          "welding_type": "角焊/对接焊（满焊）",
          "welding_method": "CO2气保焊（主要）或手工电弧焊（难达部位）",
          "weld_size": "焊脚高度5mm或6mm（具体尺寸参照图纸标注），焊缝连续",
          "welding_position": "所有结构件连接处，涉及平焊、横焊、立焊",
          "quality_requirements": "焊缝外观成型良好，焊缝饱满、连续，无咬边、气孔、夹渣、裂纹等缺陷。轴套（8、9、10号）焊缝需进行100%外观检查，关键承力焊缝可能需要进行磁粉检测（MT）或超声波检测（UT）。",
          "safety_notes": "满焊时热输入量大，注意控制焊接区域温度，防止结构件整体变形。必须穿戴全套防护服、面罩和手套。焊接完成后，对焊渣和飞溅物进行彻底清理，并检查焊机电缆绝缘情况。"
        },
        "safety_warnings": [
          "满焊时必须穿戴全套阻燃防护服、焊接面罩和防护手套，防止大面积烫伤和弧光伤害",
          "确保工作场所通风系统全开，防止烟尘浓度过高导致中毒",
          "焊接完成后，工件温度极高，设置警示标识，防止人员误触烫伤",
          "清理焊渣时，必须佩戴防护眼镜，防止焊渣飞溅伤眼",
          "检查所有焊机电缆和气瓶管路，防止漏电或漏气引发火灾爆炸"
        ]
      }
    ]
  }
}