{
  "agent_name": "Agent6_FAQ",
  "model": "google/gemini-2.5-flash-preview-09-2025",
  "timestamp": "20251005_161918",
  "image_count": 0,
  "temperature": 0.2,
  "system_prompt": "# 角色定位\n\n你是**李师傅**，一位拥有20年安全管理经验的高级安全工程师。\n\n## 教育背景\n\n- **学历**：安全工程专业本科\n- **职业资格**：注册安全工程师、高级安全评价师\n- **专业培训**：\n  - 机械制造安全管理\n  - 职业健康与安全管理体系（ISO 45001）\n  - 事故调查与分析\n  - 应急预案编制与演练\n\n## 职业背景\n\n- **工作经历**：20年机械制造企业安全管理经验，参与过大型装备制造、钢结构加工等项目\n- **专业领域**：\n  - 机械加工安全（车、铣、刨、磨、钻等）\n  - 焊接作业安全（电焊、气焊、氩弧焊等）\n  - 起重吊装安全（行车、叉车、吊索具等）\n  - 高空作业安全（脚手架、安全带、防坠落等）\n  - 个人防护用品管理（安全帽、防护眼镜、手套、安全鞋等）\n\n## 知识结构（详细）\n\n### 1. 机械伤害风险\n- **夹伤/挤伤**：手指、手臂被运动部件夹住\n- **切割伤**：锋利边缘、毛刺、切削工具\n- **碰撞伤**：头部碰撞、身体碰撞\n- **坠落伤**：零件坠落、工具坠落、人员坠落\n\n### 2. 焊接作业风险\n- **电击伤**：焊机漏电、接地不良\n- **弧光伤**：电弧紫外线灼伤眼睛和皮肤\n- **烫伤**：高温熔池、焊渣飞溅\n- **火灾爆炸**：易燃物引燃、气瓶泄漏\n- **有毒气体**：焊接烟尘、一氧化碳中毒\n\n### 3. 起重吊装风险\n- **吊物坠落**：吊索具断裂、捆绑不牢\n- **吊物摆动**：碰撞人员、设备\n- **超载**：超过起重机额定载荷\n- **指挥失误**：信号不清、违章指挥\n\n### 4. 高空作业风险\n- **人员坠落**：未系安全带、脚手架不牢\n- **物体打击**：工具、零件从高处坠落\n- **脚手架坍塌**：搭设不规范、超载\n\n### 5. 个人防护用品\n- **头部防护**：安全帽（防止碰撞、坠物打击）\n- **眼部防护**：防护眼镜、焊接面罩（防止飞溅、弧光）\n- **手部防护**：防护手套（防止切割、烫伤、化学品）\n- **足部防护**：安全鞋（防砸、防刺穿、防滑）\n- **呼吸防护**：防尘口罩、防毒面具（防止粉尘、有毒气体）\n\n### 6. 应急处理\n- **机械伤害**：立即停机、呼救、止血、固定、送医\n- **电击伤**：切断电源、心肺复苏、送医\n- **烫伤**：冷水冲洗、覆盖无菌纱布、送医\n- **火灾**：使用灭火器、疏散人员、报警\n\n## 任务步骤（Chain of Thought）\n\n你的任务是**为每个装配步骤添加安全警告**（如果该步骤有安全风险）。请按照以下5个步骤思考：\n\n### 步骤1：识别风险步骤\n- 分析每个装配步骤的操作内容\n- 判断是否涉及高风险作业（焊接、吊装、高空、重物搬运等）\n- 识别潜在的伤害类型（机械伤害、电击、烫伤、坠落等）\n\n### 步骤2：分析风险源\n- 确定风险的来源（设备、工具、材料、环境、人员操作等）\n- 评估风险的严重程度（轻微、中等、严重、致命）\n- 考虑风险的发生概率\n\n### 步骤3：制定预防措施\n- 针对每个风险源，制定具体的预防措施\n- 强调个人防护用品的使用\n- 强调安全操作规程的遵守\n\n### 步骤4：添加安全警告\n- 为每个有风险的步骤添加safety_warnings字段\n- 每条警告要简洁明了，说明具体的风险和预防措施\n- 使用工人能看懂的语言\n\n### 步骤5：验证完整性\n- 检查所有高风险步骤是否都添加了安全警告\n- 检查安全警告是否具体、可操作\n- 检查是否遗漏了任何潜在风险\n\n## 核心原则\n\n1. **步骤级嵌入**：为每个有风险的步骤添加safety_warnings字段，而不是单独列出安全警告\n2. **工人友好**：使用通俗语言，避免专业术语\n3. **具体可操作**：说明具体的风险和预防措施，而不是泛泛而谈\n4. **不重复显示**：安全警告只在下方\"安全\"标签页中统一显示，不在当前步骤详情中重复显示\n\n## 输出格式\n\n严格按照以下JSON格式输出（返回增强后的装配步骤）：\n\n```json\n{\n  \"enhanced_steps\": [\n    {\n      \"step_number\": 1,\n      \"title\": \"点焊定位\",\n      \"parts_used\": [...],\n      \"tools_required\": [...],\n      \"operation\": \"操作说明\",\n      \"quality_check\": \"质量检查\",\n      \"estimated_time_minutes\": 10,\n      \"welding\": {\n        \"required\": true,\n        \"welding_type\": \"点焊\",\n        \"welding_method\": \"CO2气保焊\",\n        ...\n      },\n      \"safety_warnings\": [\n        \"佩戴焊接面罩和防护手套，防止弧光灼伤眼睛和皮肤\",\n        \"确保工件夹紧牢固，防止点焊时位移造成伤害\",\n        \"焊接区域周围3米内不得有易燃物，配备灭火器\",\n        \"焊机必须接地良好，防止漏电触电\"\n      ]\n    },\n    {\n      \"step_number\": 2,\n      \"title\": \"螺栓连接\",\n      \"parts_used\": [...],\n      \"operation\": \"操作说明\",\n      \"quality_check\": \"质量检查\",\n      \"estimated_time_minutes\": 15,\n      \"safety_warnings\": [\n        \"佩戴安全帽和防护眼镜，防止零件坠落和飞溅\",\n        \"使用扭力扳手时注意力度，防止扳手滑脱伤人\"\n      ]\n    },\n    {\n      \"step_number\": 3,\n      \"title\": \"简单装配\",\n      \"parts_used\": [...],\n      \"operation\": \"操作说明\",\n      \"quality_check\": \"质量检查\",\n      \"estimated_time_minutes\": 5\n      // ⚠️ 如果没有明显安全风险，不添加safety_warnings字段\n    }\n  ]\n}\n```\n\n**⚠️ 关键要求**：\n\n1. **步骤级嵌入**：\n   - 为每个有风险的步骤添加`safety_warnings`字段\n   - 没有明显风险的步骤不添加`safety_warnings`字段\n   - 保持原有步骤的所有字段不变\n\n2. **安全警告要具体**：\n   - ✅ 说\"佩戴焊接面罩和防护手套，防止弧光灼伤眼睛和皮肤\"\n   - ❌ 不说\"注意安全\"\n   - ✅ 说\"焊接区域周围3米内不得有易燃物，配备灭火器\"\n   - ❌ 不说\"注意防火\"\n\n3. **使用通俗语言**：\n   - 工人能看懂的语言\n   - 避免专业术语和英文缩写\n\n4. **警告要全面**：\n   - 涵盖个人防护、设备安全、环境安全、操作安全\n   - 每条警告说明具体的风险和预防措施\n\n## 重要提醒\n\n- **只输出JSON，不要输出其他内容**\n- **保持原有字段不变**：不要修改或删除原有的字段（包括welding字段）\n- **警告要简洁明了**：每条警告一句话，说明风险和预防措施\n- **不要过度警告**：只针对有明显风险的步骤添加警告\n",
  "user_query": "请为以下装配步骤添加安全警告（如果有安全风险）。\n\n## 📸 视觉分析任务\n\n**你会看到工程图纸图片，请仔细观察：**\n\n1. **危险作业标识**：\n   - 图纸上的安全警告标识\n   - 特殊作业要求（如高空作业、吊装作业等）\n   - 危险区域标注\n\n2. **零件特征**：\n   - 重型零件（需要吊装）\n   - 锋利边缘（容易割伤）\n   - 高温部件（容易烫伤）\n\n3. **作业环境**：\n   - 狭窄空间（容易碰撞）\n   - 高空位置（容易坠落）\n   - 密闭空间（通风不良）\n\n## 装配步骤\n\n[\n  {\n    \"step_number\": 1,\n    \"action\": \"放置基准件\",\n    \"description\": \"使用行车或吊具将②号连接板（01.01.01.11509）吊运至装配工位，平稳放置在工装夹具上作为装配基准。\",\n    \"position_description\": \"平放在工装夹具上，确保连接板的安装面朝上。\",\n    \"parts_used\": [\n      {\n        \"bom_seq\": \"2\",\n        \"bom_name\": \"连接板 1\",\n        \"quantity\": 1,\n        \"drawing_number\": \"2\",\n        \"node_name\": [\n          \"NAUO2\"\n        ],\n        \"bom_code\": \"01.01.01.11509\"\n      }\n    ],\n    \"tools\": [\n      \"行车/吊具\",\n      \"工装夹具\",\n      \"水平仪\"\n    ],\n    \"warnings\": [\n      \"连接板较重（21.36kg），吊装时注意安全，确保吊具牢固。\",\n      \"放置时避免磕碰，保护安装面。\"\n    ]\n  },\n  {\n    \"step_number\": 2,\n    \"action\": \"安装底部矩形管\",\n    \"description\": \"将①号矩形管（01.01.03.2718）放置在②号连接板的底部边缘，按照图纸所示位置进行定位。该矩形管位于连接板的下方，沿长度方向居中。\",\n    \"position_description\": \"位于②号连接板的底部边缘，与连接板的侧面齐平。\",\n    \"parts_used\": [\n      {\n        \"bom_seq\": \"1\",\n        \"bom_name\": \"矩形管 1\",\n        \"quantity\": 1,\n        \"drawing_number\": \"1\",\n        \"node_name\": [\n          \"NAUO1\"\n        ],\n        \"bom_code\": \"01.01.03.2718\"\n      }\n    ],\n    \"tools\": [\n      \"卷尺\",\n      \"角尺\",\n      \"点焊机\"\n    ],\n    \"warnings\": [\n      \"定位必须准确，确保矩形管与连接板的垂直度。\",\n      \"先点焊固定，待所有主要结构件定位完成后再进行满焊。\"\n    ],\n    \"welding\": {\n      \"required\": true,\n      \"welding_type\": \"角焊（定位焊）\",\n      \"welding_method\": \"CO2气保焊\",\n      \"weld_size\": \"点焊长度10-15mm，焊脚高度4mm\",\n      \"welding_position\": \"零件①矩形管与零件②连接板的接触面，平焊为主\",\n      \"quality_requirements\": \"点焊牢固，定位准确，焊点无裂纹、气孔\",\n      \"safety_notes\": \"点焊时注意佩戴防护面罩和手套，确保焊机接地良好，周围无易燃物\"\n    }\n  },\n  {\n    \"step_number\": 3,\n    \"action\": \"安装上部矩形管\",\n    \"description\": \"将⑧号矩形管（01.01.03.2720）和⑥号矩形管（01.01.03.2719）安装在②号连接板的上方。⑧号矩形管位于连接板的中间位置，⑥号矩形管位于连接板的两侧。\",\n    \"position_description\": \"⑧号矩形管位于连接板上方中间，⑥号矩形管位于连接板上方两侧，均与连接板垂直。\",\n    \"parts_used\": [\n      {\n        \"bom_seq\": \"8\",\n        \"bom_name\": \"矩形管 1\",\n        \"quantity\": 1,\n        \"drawing_number\": \"8\",\n        \"node_name\": [\n          \"NAUO13\"\n        ],\n        \"bom_code\": \"01.01.03.2720\"\n      },\n      {\n        \"bom_seq\": \"6\",\n        \"bom_name\": \"矩形管 2\",\n        \"quantity\": 2,\n        \"drawing_number\": \"6\",\n        \"node_name\": [\n          \"NAUO10\",\n          \"NAUO9\"\n        ],\n        \"bom_code\": \"01.01.03.2719\"\n      }\n    ],\n    \"tools\": [\n      \"工装靠模\",\n      \"点焊机\",\n      \"水平仪\"\n    ],\n    \"warnings\": [\n      \"使用靠模确保三根矩形管（⑧和两个⑥）与②号连接板的垂直度和平行度。\",\n      \"点焊牢固，防止后续操作中移位。\"\n    ],\n    \"welding\": {\n      \"required\": true,\n      \"welding_type\": \"角焊（定位焊）\",\n      \"welding_method\": \"CO2气保焊\",\n      \"weld_size\": \"点焊长度10-15mm，焊脚高度4mm\",\n      \"welding_position\": \"零件⑥、⑧矩形管与零件②连接板的接触面，平焊\",\n      \"quality_requirements\": \"定位焊点应均匀分布，确保结构件垂直度误差小于1mm\",\n      \"safety_notes\": \"点焊时注意保持身体稳定，避免电弧光灼伤皮肤和眼睛，确保工作区域通风\"\n    }\n  },\n  {\n    \"step_number\": 4,\n    \"action\": \"安装挂件虚拟组件\",\n    \"description\": \"将⑤号左挂件虚拟组件（01.05.0019）和④号右挂件虚拟组件（01.05.0018）分别安装在两侧的⑥号矩形管上。挂件的安装方向和角度必须与图纸所示一致。\",\n    \"position_description\": \"⑤号挂件安装在左侧⑥号矩形管的端部，④号挂件安装在右侧⑥号矩形管的端部。\",\n    \"parts_used\": [\n      {\n        \"bom_seq\": \"5\",\n        \"bom_name\": \"左挂件虚拟组件 1\",\n        \"quantity\": 1,\n        \"drawing_number\": \"5\",\n        \"node_name\": [\n          \"NAUO18\",\n          \"NAUO17\",\n          \"NAUO16\"\n        ],\n        \"bom_code\": \"01.05.0019\"\n      },\n      {\n        \"bom_seq\": \"4\",\n        \"bom_name\": \"右挂件虚拟组件 1\",\n        \"quantity\": 1,\n        \"drawing_number\": \"4\",\n        \"node_name\": [\n          \"NAUO21\",\n          \"NAUO20\",\n          \"NAUO19\"\n        ],\n        \"bom_code\": \"01.05.0018\"\n      }\n    ],\n    \"tools\": [\n      \"点焊机\",\n      \"角度尺\"\n    ],\n    \"warnings\": [\n      \"挂件的安装角度是关键尺寸，必须使用角度尺或专用靠模进行定位。\",\n      \"挂件与矩形管的接触面应紧密贴合。\"\n    ],\n    \"welding\": {\n      \"required\": true,\n      \"welding_type\": \"角焊（定位焊）\",\n      \"welding_method\": \"CO2气保焊\",\n      \"weld_size\": \"点焊长度10mm，焊脚高度4mm\",\n      \"welding_position\": \"零件④、⑤挂件与零件⑥矩形管的连接处，可能涉及横焊或立焊\",\n      \"quality_requirements\": \"定位焊点应能承受后续操作的应力，确保挂件角度定位准确\",\n      \"safety_notes\": \"由于挂件形状复杂，焊接时注意姿势，防止焊渣飞溅，确保灭火器材在手边\"\n    }\n  },\n  {\n    \"step_number\": 5,\n    \"action\": \"安装加强筋\",\n    \"description\": \"将⑨号加强筋（01.01.01.17678）安装在两侧的⑥号矩形管与②号连接板之间，起到支撑作用。加强筋应与矩形管和连接板的内侧面贴合。\",\n    \"position_description\": \"加强筋位于两侧⑥号矩形管的内侧，呈斜角支撑。\",\n    \"parts_used\": [\n      {\n        \"bom_seq\": \"9\",\n        \"bom_name\": \"加强筋 2\",\n        \"quantity\": 2,\n        \"drawing_number\": \"9\",\n        \"node_name\": [\n          \"NAUO15\",\n          \"NAUO14\"\n        ],\n        \"bom_code\": \"01.01.01.17678\"\n      }\n    ],\n    \"tools\": [\n      \"点焊机\"\n    ],\n    \"warnings\": [\n      \"加强筋的安装位置应确保不干涉其他零件，并保证焊缝长度符合技术要求。\"\n    ],\n    \"welding\": {\n      \"required\": true,\n      \"welding_type\": \"角焊（定位焊）\",\n      \"welding_method\": \"CO2气保焊\",\n      \"weld_size\": \"点焊长度10mm，焊脚高度4mm\",\n      \"welding_position\": \"零件⑨加强筋与零件②连接板和零件⑥矩形管的连接处，可能涉及立焊\",\n      \"quality_requirements\": \"加强筋定位焊后应紧密贴合，无间隙\",\n      \"safety_notes\": \"焊接加强筋时，注意狭小空间内的通风，防止烟雾聚集\"\n    }\n  },\n  {\n    \"step_number\": 6,\n    \"action\": \"安装封板\",\n    \"description\": \"将⑦号封板（01.01.01.16608）安装在组件的两侧，用于封闭矩形管之间的空间。\",\n    \"position_description\": \"封板安装在组件的左右两侧，覆盖在矩形管的侧面。\",\n    \"parts_used\": [\n      {\n        \"bom_seq\": \"7\",\n        \"bom_name\": \"封板 2\",\n        \"quantity\": 2,\n        \"drawing_number\": \"7\",\n        \"node_name\": [\n          \"NAUO12\",\n          \"NAUO11\"\n        ],\n        \"bom_code\": \"01.01.01.16608\"\n      }\n    ],\n    \"tools\": [\n      \"点焊机\"\n    ],\n    \"warnings\": [\n      \"封板边缘应与主体结构对齐，确保外观平整。\"\n    ],\n    \"welding\": {\n      \"required\": true,\n      \"welding_type\": \"角焊（定位焊）\",\n      \"welding_method\": \"CO2气保焊\",\n      \"weld_size\": \"点焊长度10mm，焊脚高度3mm\",\n      \"welding_position\": \"零件⑦封板与周围矩形管和连接板的边缘，横焊或立焊\",\n      \"quality_requirements\": \"封板定位后应与主体结构齐平，无明显错位\",\n      \"safety_notes\": \"封板较薄，点焊时注意控制电流，避免烧穿，保持焊枪角度稳定\"\n    }\n  },\n  {\n    \"step_number\": 7,\n    \"action\": \"安装方形板\",\n    \"description\": \"将③号方形板-机加（01.01.01.6589）安装在②号连接板的四个预留孔位上。方形板用于后续的连接或支撑。\",\n    \"position_description\": \"方形板安装在②号连接板的四个角部，通过焊接固定。\",\n    \"parts_used\": [\n      {\n        \"bom_seq\": \"3\",\n        \"bom_name\": \"方形板-机加 4\",\n        \"quantity\": 4,\n        \"drawing_number\": \"3\",\n        \"node_name\": [\n          \"NAUO6\",\n          \"NAUO5\",\n          \"NAUO4\",\n          \"NAUO3\"\n        ],\n        \"bom_code\": \"01.01.01.6589\"\n      }\n    ],\n    \"tools\": [\n      \"点焊机\",\n      \"卡尺\"\n    ],\n    \"warnings\": [\n      \"方形板的定位精度要求较高，安装前需核对孔位尺寸。\",\n      \"确保方形板的机加工面朝向正确。\"\n    ],\n    \"welding\": {\n      \"required\": true,\n      \"welding_type\": \"角焊（定位焊）\",\n      \"welding_method\": \"CO2气保焊\",\n      \"weld_size\": \"点焊长度10mm，焊脚高度4mm\",\n      \"welding_position\": \"零件③方形板与零件②连接板的接触面，平焊\",\n      \"quality_requirements\": \"方形板定位后，其中心孔位置偏差应在允许范围内\",\n      \"safety_notes\": \"方形板较小，定位焊时注意夹紧，防止移动，避免烫伤\"\n    }\n  },\n  {\n    \"step_number\": 8,\n    \"action\": \"满焊与清渣\",\n    \"description\": \"按照图纸上的焊接符号和技术要求，对所有已点焊固定的零件进行满焊。焊接顺序应遵循对称、分散的原则，以减少焊接变形。\",\n    \"position_description\": \"对所有零件的连接处进行满焊。\",\n    \"parts_used\": [],\n    \"tools\": [\n      \"焊机（CO2/电弧焊）\",\n      \"焊钳\",\n      \"焊渣锤\",\n      \"钢丝刷\"\n    ],\n    \"warnings\": [\n      \"严格控制焊接电流和电压，确保焊缝牢固、无虚焊、无漏焊。\",\n      \"焊接完成后，立即进行焊渣清理，并检查焊缝外观质量。\"\n    ],\n    \"welding\": {\n      \"required\": true,\n      \"welding_type\": \"角焊、部分对接焊\",\n      \"welding_method\": \"CO2气保焊（推荐）或手工电弧焊\",\n      \"weld_size\": \"焊脚高度通常为板厚较薄一侧的0.7倍，图纸未标注处按6mm执行\",\n      \"welding_position\": \"所有结构件连接处，涉及平焊、横焊、立焊、仰焊\",\n      \"quality_requirements\": \"焊缝必须连续、饱满，外观平整，无咬边、气孔、夹渣、裂纹等缺陷。重要焊缝（如挂件连接处）需进行无损检测（如磁粉或超声波）\",\n      \"safety_notes\": \"满焊时产生大量烟雾，必须开启强力通风设备。穿戴全套防护服、面罩和手套。注意控制焊接变形，采用分段、跳焊或对称焊接顺序，防止结构件扭曲\"\n    }\n  }\n]\n\n## 要求\n\n请按照以下5个步骤思考，为装配步骤添加安全警告：\n\n### 步骤1：识别风险步骤\n- 分析每个装配步骤的操作内容\n- 判断是否涉及高风险作业：\n  * **焊接作业**：电击、弧光、烫伤、火灾\n  * **吊装作业**：吊物坠落、碰撞、超载\n  * **高空作业**：人员坠落、物体打击\n  * **重物搬运**：砸伤、扭伤、夹伤\n  * **机械加工**：切割伤、夹伤、碰撞\n\n### 步骤2：分析风险源\n- 确定风险的来源（设备、工具、材料、环境、人员操作等）\n- 评估风险的严重程度（轻微、中等、严重、致命）\n- 考虑风险的发生概率\n\n### 步骤3：制定预防措施\n- 针对每个风险源，制定具体的预防措施\n- 强调个人防护用品的使用：\n  * **焊接**：焊接面罩、防护手套、防护服\n  * **吊装**：安全帽、安全鞋、手套\n  * **高空**：安全带、安全帽、防滑鞋\n  * **机械**：防护眼镜、手套、安全鞋\n\n### 步骤4：添加安全警告\n- 为每个有风险的步骤添加safety_warnings字段\n- 每条警告要简洁明了，说明具体的风险和预防措施\n- 使用工人能看懂的语言\n\n### 步骤5：验证完整性\n- 检查所有高风险步骤是否都添加了安全警告\n- 检查安全警告是否具体、可操作\n- 检查是否遗漏了任何潜在风险\n\n## ⚠️ 强制自检清单（生成后必须逐项检查）\n\n**在输出JSON之前，你必须完成以下验证：**\n\n1. **风险步骤识别验证**：\n   - [ ] 所有涉及焊接、吊装、高空、重物搬运的步骤都添加了safety_warnings字段\n   - [ ] 没有明显风险的步骤没有添加safety_warnings字段\n\n2. **安全警告完整性验证**：\n   - [ ] 每个safety_warnings字段都是字符串数组\n   - [ ] 每条警告都说明了具体的风险和预防措施\n   - [ ] 涵盖了个人防护、设备安全、环境安全、操作安全\n\n3. **语言通俗性验证**：\n   - [ ] 使用工人能看懂的语言\n   - [ ] 避免专业术语和英文缩写\n   - [ ] 每条警告简洁明了（一句话）\n\n4. **原有字段保持验证**：\n   - [ ] 原有步骤的所有字段都保持不变（包括welding字段）\n   - [ ] 没有修改或删除任何原有字段\n\n**如果自检发现任何问题，必须重新生成！**\n\n现在开始为装配步骤添加安全警告！\n",
  "raw_response": "```json\n{\n  \"enhanced_steps\": [\n    {\n      \"step_number\": 1,\n      \"action\": \"放置基准件\",\n      \"description\": \"使用行车或吊具将②号连接板（01.01.01.11509）吊运至装配工位，平稳放置在工装夹具上作为装配基准。\",\n      \"position_description\": \"平放在工装夹具上，确保连接板的安装面朝上。\",\n      \"parts_used\": [\n        {\n          \"bom_seq\": \"2\",\n          \"bom_name\": \"连接板 1\",\n          \"quantity\": 1,\n          \"drawing_number\": \"2\",\n          \"node_name\": [\n            \"NAUO2\"\n          ],\n          \"bom_code\": \"01.01.01.11509\"\n        }\n      ],\n      \"tools\": [\n        \"行车/吊具\",\n        \"工装夹具\",\n        \"水平仪\"\n      ],\n      \"warnings\": [\n        \"连接板较重（21.36kg），吊装时注意安全，确保吊具牢固。\",\n        \"放置时避免磕碰，保护安装面。\"\n      ],\n      \"safety_warnings\": [\n        \"佩戴安全帽和防护手套，防止重物坠落和夹伤\",\n        \"吊装前检查吊索具是否完好，捆绑必须牢固，防止吊物坠落\",\n        \"吊运过程中，吊物下方严禁站人，指挥信号必须清晰准确\"\n      ]\n    },\n    {\n      \"step_number\": 2,\n      \"action\": \"安装底部矩形管\",\n      \"description\": \"将①号矩形管（01.01.03.2718）放置在②号连接板的底部边缘，按照图纸所示位置进行定位。该矩形管位于连接板的下方，沿长度方向居中。\",\n      \"position_description\": \"位于②号连接板的底部边缘，与连接板的侧面齐平。\",\n      \"parts_used\": [\n        {\n          \"bom_seq\": \"1\",\n          \"bom_name\": \"矩形管 1\",\n          \"quantity\": 1,\n          \"drawing_number\": \"1\",\n          \"node_name\": [\n            \"NAUO1\"\n          ],\n          \"bom_code\": \"01.01.03.2718\"\n        }\n      ],\n      \"tools\": [\n        \"卷尺\",\n        \"角尺\",\n        \"点焊机\"\n      ],\n      \"warnings\": [\n        \"定位必须准确，确保矩形管与连接板的垂直度。\",\n        \"先点焊固定，待所有主要结构件定位完成后再进行满焊。\"\n      ],\n      \"welding\": {\n        \"required\": true,\n        \"welding_type\": \"角焊（定位焊）\",\n        \"welding_method\": \"CO2气保焊\",\n        \"weld_size\": \"点焊长度10-15mm，焊脚高度4mm\",\n        \"welding_position\": \"零件①矩形管与零件②连接板的接触面，平焊为主\",\n        \"quality_requirements\": \"点焊牢固，定位准确，焊点无裂纹、气孔\",\n        \"safety_notes\": \"点焊时注意佩戴防护面罩和手套，确保焊机接地良好，周围无易燃物\"\n      },\n      \"safety_warnings\": [\n        \"佩戴焊接面罩、防护手套和防护服，防止电弧光灼伤和焊渣烫伤\",\n        \"确保焊机外壳接地良好，防止触电事故\",\n        \"点焊区域必须清理干净，周围3米内不得有易燃易爆物品\"\n      ]\n    },\n    {\n      \"step_number\": 3,\n      \"action\": \"安装上部矩形管\",\n      \"description\": \"将⑧号矩形管（01.01.03.2720）和⑥号矩形管（01.01.03.2719）安装在②号连接板的上方。⑧号矩形管位于连接板的中间位置，⑥号矩形管位于连接板的两侧。\",\n      \"position_description\": \"⑧号矩形管位于连接板上方中间，⑥号矩形管位于连接板上方两侧，均与连接板垂直。\",\n      \"parts_used\": [\n        {\n          \"bom_seq\": \"8\",\n          \"bom_name\": \"矩形管 1\",\n          \"quantity\": 1,\n          \"drawing_number\": \"8\",\n          \"node_name\": [\n            \"NAUO13\"\n          ],\n          \"bom_code\": \"01.01.03.2720\"\n        },\n        {\n          \"bom_seq\": \"6\",\n          \"bom_name\": \"矩形管 2\",\n          \"quantity\": 2,\n          \"drawing_number\": \"6\",\n          \"node_name\": [\n            \"NAUO10\",\n            \"NAUO9\"\n          ],\n          \"bom_code\": \"01.01.03.2719\"\n        }\n      ],\n      \"tools\": [\n        \"工装靠模\",\n        \"点焊机\",\n        \"水平仪\"\n      ],\n      \"warnings\": [\n        \"使用靠模确保三根矩形管（⑧和两个⑥）与②号连接板的垂直度和平行度。\",\n        \"点焊牢固，防止后续操作中移位。\"\n      ],\n      \"welding\": {\n        \"required\": true,\n        \"welding_type\": \"角焊（定位焊）\",\n        \"welding_method\": \"CO2气保焊\",\n        \"weld_size\": \"点焊长度10-15mm，焊脚高度4mm\",\n        \"welding_position\": \"零件⑥、⑧矩形管与零件②连接板的接触面，平焊\",\n        \"quality_requirements\": \"定位焊点应均匀分布，确保结构件垂直度误差小于1mm\",\n        \"safety_notes\": \"点焊时注意保持身体稳定，避免电弧光灼伤皮肤和眼睛，确保工作区域通风\"\n      },\n      \"safety_warnings\": [\n        \"佩戴焊接面罩、防护手套，防止弧光灼伤和焊渣飞溅\",\n        \"确保工作区域通风良好，防止焊接烟尘危害健康\",\n        \"使用靠模定位时，注意防止手被夹伤或挤伤\"\n      ]\n    },\n    {\n      \"step_number\": 4,\n      \"action\": \"安装挂件虚拟组件\",\n      \"description\": \"将⑤号左挂件虚拟组件（01.05.0019）和④号右挂件虚拟组件（01.05.0018）分别安装在两侧的⑥号矩形管上。挂件的安装方向和角度必须与图纸所示一致。\",\n      \"position_description\": \"⑤号挂件安装在左侧⑥号矩形管的端部，④号挂件安装在右侧⑥号矩形管的端部。\",\n      \"parts_used\": [\n        {\n          \"bom_seq\": \"5\",\n          \"bom_name\": \"左挂件虚拟组件 1\",\n          \"quantity\": 1,\n          \"drawing_number\": \"5\",\n          \"node_name\": [\n            \"NAUO18\",\n            \"NAUO17\",\n            \"NAUO16\"\n          ],\n          \"bom_code\": \"01.05.0019\"\n        },\n        {\n          \"bom_seq\": \"4\",\n          \"bom_name\": \"右挂件虚拟组件 1\",\n          \"quantity\": 1,\n          \"drawing_number\": \"4\",\n          \"node_name\": [\n            \"NAUO21\",\n            \"NAUO20\",\n            \"NAUO19\"\n          ],\n          \"bom_code\": \"01.05.0018\"\n        }\n      ],\n      \"tools\": [\n        \"点焊机\",\n        \"角度尺\"\n      ],\n      \"warnings\": [\n        \"挂件的安装角度是关键尺寸，必须使用角度尺或专用靠模进行定位。\",\n        \"挂件与矩形管的接触面应紧密贴合。\"\n      ],\n      \"welding\": {\n        \"required\": true,\n        \"welding_type\": \"角焊（定位焊）\",\n        \"welding_method\": \"CO2气保焊\",\n        \"weld_size\": \"点焊长度10mm，焊脚高度4mm\",\n        \"welding_position\": \"零件④、⑤挂件与零件⑥矩形管的连接处，可能涉及横焊或立焊\",\n        \"quality_requirements\": \"定位焊点应能承受后续操作的应力，确保挂件角度定位准确\",\n        \"safety_notes\": \"由于挂件形状复杂，焊接时注意姿势，防止焊渣飞溅，确保灭火器材在手边\"\n      },\n      \"safety_warnings\": [\n        \"佩戴焊接面罩和防护手套，防止电弧光和高温焊渣伤害\",\n        \"由于涉及横焊或立焊，注意焊渣飞溅方向，保护身体其他部位\",\n        \"确保挂件定位牢固，防止在点焊过程中因重力或外力移动\"\n      ]\n    },\n    {\n      \"step_number\": 5,\n      \"action\": \"安装加强筋\",\n      \"description\": \"将⑨号加强筋（01.01.01.17678）安装在两侧的⑥号矩形管与②号连接板之间，起到支撑作用。加强筋应与矩形管和连接板的内侧面贴合。\",\n      \"position_description\": \"加强筋位于两侧⑥号矩形管的内侧，呈斜角支撑。\",\n      \"parts_used\": [\n        {\n          \"bom_seq\": \"9\",\n          \"bom_name\": \"加强筋 2\",\n          \"quantity\": 2,\n          \"drawing_number\": \"9\",\n          \"node_name\": [\n            \"NAUO15\",\n            \"NAUO14\"\n          ],\n          \"bom_code\": \"01.01.01.17678\"\n        }\n      ],\n      \"tools\": [\n        \"点焊机\"\n      ],\n      \"warnings\": [\n        \"加强筋的安装位置应确保不干涉其他零件，并保证焊缝长度符合技术要求。\"\n      ],\n      \"welding\": {\n        \"required\": true,\n        \"welding_type\": \"角焊（定位焊）\",\n        \"welding_method\": \"CO2气保焊\",\n        \"weld_size\": \"点焊长度10mm，焊脚高度4mm\",\n        \"welding_position\": \"零件⑨加强筋与零件②连接板和零件⑥矩形管的连接处，可能涉及立焊\",\n        \"quality_requirements\": \"加强筋定位焊后应紧密贴合，无间隙\",\n        \"safety_notes\": \"焊接加强筋时，注意狭小空间内的通风，防止烟雾聚集\"\n      },\n      \"safety_warnings\": [\n        \"佩戴防护眼镜和手套，加强筋边缘可能锋利，防止割伤\",\n        \"在狭小空间进行立焊时，注意保持身体平衡，防止烫伤\",\n        \"确保局部通风良好，防止焊接烟雾在内部聚集\"\n      ]\n    },\n    {\n      \"step_number\": 6,\n      \"action\": \"安装封板\",\n      \"description\": \"将⑦号封板（01.01.01.16608）安装在组件的两侧，用于封闭矩形管之间的空间。\",\n      \"position_description\": \"封板安装在组件的左右两侧，覆盖在矩形管的侧面。\",\n      \"parts_used\": [\n        {\n          \"bom_seq\": \"7\",\n          \"bom_name\": \"封板 2\",\n          \"quantity\": 2,\n          \"drawing_number\": \"7\",\n          \"node_name\": [\n            \"NAUO12\",\n            \"NAUO11\"\n          ],\n          \"bom_code\": \"01.01.01.16608\"\n        }\n      ],\n      \"tools\": [\n        \"点焊机\"\n      ],\n      \"warnings\": [\n        \"封板边缘应与主体结构对齐，确保外观平整。\"\n      ],\n      \"welding\": {\n        \"required\": true,\n        \"welding_type\": \"角焊（定位焊）\",\n        \"welding_method\": \"CO2气保焊\",\n        \"weld_size\": \"点焊长度10mm，焊脚高度3mm\",\n        \"welding_position\": \"零件⑦封板与周围矩形管和连接板的边缘，横焊或立焊\",\n        \"quality_requirements\": \"封板定位后应与主体结构齐平，无明显错位\",\n        \"safety_notes\": \"封板较薄，点焊时注意控制电流，避免烧穿，保持焊枪角度稳定\"\n      },\n      \"safety_warnings\": [\n        \"佩戴防护手套，封板边缘可能锋利，防止切割伤\",\n        \"点焊时注意控制焊接电流，防止烧穿薄板，造成烫伤或火花飞溅\"\n      ]\n    },\n    {\n      \"step_number\": 7,\n      \"action\": \"安装方形板\",\n      \"description\": \"将③号方形板-机加（01.01.01.6589）安装在②号连接板的四个预留孔位上。方形板用于后续的连接或支撑。\",\n      \"position_description\": \"方形板安装在②号连接板的四个角部，通过焊接固定。\",\n      \"parts_used\": [\n        {\n          \"bom_seq\": \"3\",\n          \"bom_name\": \"方形板-机加 4\",\n          \"quantity\": 4,\n          \"drawing_number\": \"3\",\n          \"node_name\": [\n            \"NAUO6\",\n            \"NAUO5\",\n            \"NAUO4\",\n            \"NAUO3\"\n          ],\n          \"bom_code\": \"01.01.01.6589\"\n        }\n      ],\n      \"tools\": [\n        \"点焊机\",\n        \"卡尺\"\n      ],\n      \"warnings\": [\n        \"方形板的定位精度要求较高，安装前需核对孔位尺寸。\",\n        \"确保方形板的机加工面朝向正确。\"\n      ],\n      \"welding\": {\n        \"required\": true,\n        \"welding_type\": \"角焊（定位焊）\",\n        \"welding_method\": \"CO2气保焊\",\n        \"weld_size\": \"点焊长度10mm，焊脚高度4mm\",\n        \"welding_position\": \"零件③方形板与零件②连接板的接触面，平焊\",\n        \"quality_requirements\": \"方形板定位后，其中心孔位置偏差应在允许范围内\",\n        \"safety_notes\": \"方形板较小，定位焊时注意夹紧，防止移动，避免烫伤\"\n      },\n      \"safety_warnings\": [\n        \"佩戴防护眼镜和手套，防止焊接飞溅物伤害\",\n        \"方形板较小，定位时需使用夹具夹紧，防止焊接时移动或烫伤手指\"\n      ]\n    },\n    {\n      \"step_number\": 8,\n      \"action\": \"满焊与清渣\",\n      \"description\": \"按照图纸上的焊接符号和技术要求，对所有已点焊固定的零件进行满焊。焊接顺序应遵循对称、分散的原则，以减少焊接变形。\",\n      \"position_description\": \"对所有零件的连接处进行满焊。\",\n      \"parts_used\": [],\n      \"tools\": [\n        \"焊机（CO2/电弧焊）\",\n        \"焊钳\",\n        \"焊渣锤\",\n        \"钢丝刷\"\n      ],\n      \"warnings\": [\n        \"严格控制焊接电流和电压，确保焊缝牢固、无虚焊、无漏焊。\",\n        \"焊接完成后，立即进行焊渣清理，并检查焊缝外观质量。\"\n      ],\n      \"welding\": {\n        \"required\": true,\n        \"welding_type\": \"角焊、部分对接焊\",\n        \"welding_method\": \"CO2气保焊（推荐）或手工电弧焊\",\n        \"weld_size\": \"焊脚高度通常为板厚较薄一侧的0.7倍，图纸未标注处按6mm执行\",\n        \"welding_position\": \"所有结构件连接处，涉及平焊、横焊、立焊、仰焊\",\n        \"quality_requirements\": \"焊缝必须连续、饱满，外观平整，无咬边、气孔、夹渣、裂纹等缺陷。重要焊缝（如挂件连接处）需进行无损检测（如磁粉或超声波）\",\n        \"safety_notes\": \"满焊时产生大量烟雾，必须开启强力通风设备。穿戴全套防护服、面罩和手套。注意控制焊接变形，采用分段、跳焊或对称焊接顺序，防止结构件扭曲\"\n      },\n      \"safety_warnings\": [\n        \"必须穿戴全套焊接防护用品（面罩、防护服、手套、安全鞋），防止电弧光、高温和飞溅物伤害\",\n        \"开启强力通风设备，确保工作区域空气流通，防止吸入有毒烟尘\",\n        \"清理焊渣时，佩戴防护眼镜，使用焊渣锤时注意周围人员，防止焊渣飞溅伤人\",\n        \"检查焊机电缆和气管，确保绝缘良好，防止漏电或气体泄漏\"\n      ]\n    }\n  ]\n}\n```",
  "parsed_result": {
    "enhanced_steps": [
      {
        "step_number": 1,
        "action": "放置基准件",
        "description": "使用行车或吊具将②号连接板（01.01.01.11509）吊运至装配工位，平稳放置在工装夹具上作为装配基准。",
        "position_description": "平放在工装夹具上，确保连接板的安装面朝上。",
        "parts_used": [
          {
            "bom_seq": "2",
            "bom_name": "连接板 1",
            "quantity": 1,
            "drawing_number": "2",
            "node_name": [
              "NAUO2"
            ],
            "bom_code": "01.01.01.11509"
          }
        ],
        "tools": [
          "行车/吊具",
          "工装夹具",
          "水平仪"
        ],
        "warnings": [
          "连接板较重（21.36kg），吊装时注意安全，确保吊具牢固。",
          "放置时避免磕碰，保护安装面。"
        ],
        "safety_warnings": [
          "佩戴安全帽和防护手套，防止重物坠落和夹伤",
          "吊装前检查吊索具是否完好，捆绑必须牢固，防止吊物坠落",
          "吊运过程中，吊物下方严禁站人，指挥信号必须清晰准确"
        ]
      },
      {
        "step_number": 2,
        "action": "安装底部矩形管",
        "description": "将①号矩形管（01.01.03.2718）放置在②号连接板的底部边缘，按照图纸所示位置进行定位。该矩形管位于连接板的下方，沿长度方向居中。",
        "position_description": "位于②号连接板的底部边缘，与连接板的侧面齐平。",
        "parts_used": [
          {
            "bom_seq": "1",
            "bom_name": "矩形管 1",
            "quantity": 1,
            "drawing_number": "1",
            "node_name": [
              "NAUO1"
            ],
            "bom_code": "01.01.03.2718"
          }
        ],
        "tools": [
          "卷尺",
          "角尺",
          "点焊机"
        ],
        "warnings": [
          "定位必须准确，确保矩形管与连接板的垂直度。",
          "先点焊固定，待所有主要结构件定位完成后再进行满焊。"
        ],
        "welding": {
          "required": true,
          "welding_type": "角焊（定位焊）",
          "welding_method": "CO2气保焊",
          "weld_size": "点焊长度10-15mm，焊脚高度4mm",
          "welding_position": "零件①矩形管与零件②连接板的接触面，平焊为主",
          "quality_requirements": "点焊牢固，定位准确，焊点无裂纹、气孔",
          "safety_notes": "点焊时注意佩戴防护面罩和手套，确保焊机接地良好，周围无易燃物"
        },
        "safety_warnings": [
          "佩戴焊接面罩、防护手套和防护服，防止电弧光灼伤和焊渣烫伤",
          "确保焊机外壳接地良好，防止触电事故",
          "点焊区域必须清理干净，周围3米内不得有易燃易爆物品"
        ]
      },
      {
        "step_number": 3,
        "action": "安装上部矩形管",
        "description": "将⑧号矩形管（01.01.03.2720）和⑥号矩形管（01.01.03.2719）安装在②号连接板的上方。⑧号矩形管位于连接板的中间位置，⑥号矩形管位于连接板的两侧。",
        "position_description": "⑧号矩形管位于连接板上方中间，⑥号矩形管位于连接板上方两侧，均与连接板垂直。",
        "parts_used": [
          {
            "bom_seq": "8",
            "bom_name": "矩形管 1",
            "quantity": 1,
            "drawing_number": "8",
            "node_name": [
              "NAUO13"
            ],
            "bom_code": "01.01.03.2720"
          },
          {
            "bom_seq": "6",
            "bom_name": "矩形管 2",
            "quantity": 2,
            "drawing_number": "6",
            "node_name": [
              "NAUO10",
              "NAUO9"
            ],
            "bom_code": "01.01.03.2719"
          }
        ],
        "tools": [
          "工装靠模",
          "点焊机",
          "水平仪"
        ],
        "warnings": [
          "使用靠模确保三根矩形管（⑧和两个⑥）与②号连接板的垂直度和平行度。",
          "点焊牢固，防止后续操作中移位。"
        ],
        "welding": {
          "required": true,
          "welding_type": "角焊（定位焊）",
          "welding_method": "CO2气保焊",
          "weld_size": "点焊长度10-15mm，焊脚高度4mm",
          "welding_position": "零件⑥、⑧矩形管与零件②连接板的接触面，平焊",
          "quality_requirements": "定位焊点应均匀分布，确保结构件垂直度误差小于1mm",
          "safety_notes": "点焊时注意保持身体稳定，避免电弧光灼伤皮肤和眼睛，确保工作区域通风"
        },
        "safety_warnings": [
          "佩戴焊接面罩、防护手套，防止弧光灼伤和焊渣飞溅",
          "确保工作区域通风良好，防止焊接烟尘危害健康",
          "使用靠模定位时，注意防止手被夹伤或挤伤"
        ]
      },
      {
        "step_number": 4,
        "action": "安装挂件虚拟组件",
        "description": "将⑤号左挂件虚拟组件（01.05.0019）和④号右挂件虚拟组件（01.05.0018）分别安装在两侧的⑥号矩形管上。挂件的安装方向和角度必须与图纸所示一致。",
        "position_description": "⑤号挂件安装在左侧⑥号矩形管的端部，④号挂件安装在右侧⑥号矩形管的端部。",
        "parts_used": [
          {
            "bom_seq": "5",
            "bom_name": "左挂件虚拟组件 1",
            "quantity": 1,
            "drawing_number": "5",
            "node_name": [
              "NAUO18",
              "NAUO17",
              "NAUO16"
            ],
            "bom_code": "01.05.0019"
          },
          {
            "bom_seq": "4",
            "bom_name": "右挂件虚拟组件 1",
            "quantity": 1,
            "drawing_number": "4",
            "node_name": [
              "NAUO21",
              "NAUO20",
              "NAUO19"
            ],
            "bom_code": "01.05.0018"
          }
        ],
        "tools": [
          "点焊机",
          "角度尺"
        ],
        "warnings": [
          "挂件的安装角度是关键尺寸，必须使用角度尺或专用靠模进行定位。",
          "挂件与矩形管的接触面应紧密贴合。"
        ],
        "welding": {
          "required": true,
          "welding_type": "角焊（定位焊）",
          "welding_method": "CO2气保焊",
          "weld_size": "点焊长度10mm，焊脚高度4mm",
          "welding_position": "零件④、⑤挂件与零件⑥矩形管的连接处，可能涉及横焊或立焊",
          "quality_requirements": "定位焊点应能承受后续操作的应力，确保挂件角度定位准确",
          "safety_notes": "由于挂件形状复杂，焊接时注意姿势，防止焊渣飞溅，确保灭火器材在手边"
        },
        "safety_warnings": [
          "佩戴焊接面罩和防护手套，防止电弧光和高温焊渣伤害",
          "由于涉及横焊或立焊，注意焊渣飞溅方向，保护身体其他部位",
          "确保挂件定位牢固，防止在点焊过程中因重力或外力移动"
        ]
      },
      {
        "step_number": 5,
        "action": "安装加强筋",
        "description": "将⑨号加强筋（01.01.01.17678）安装在两侧的⑥号矩形管与②号连接板之间，起到支撑作用。加强筋应与矩形管和连接板的内侧面贴合。",
        "position_description": "加强筋位于两侧⑥号矩形管的内侧，呈斜角支撑。",
        "parts_used": [
          {
            "bom_seq": "9",
            "bom_name": "加强筋 2",
            "quantity": 2,
            "drawing_number": "9",
            "node_name": [
              "NAUO15",
              "NAUO14"
            ],
            "bom_code": "01.01.01.17678"
          }
        ],
        "tools": [
          "点焊机"
        ],
        "warnings": [
          "加强筋的安装位置应确保不干涉其他零件，并保证焊缝长度符合技术要求。"
        ],
        "welding": {
          "required": true,
          "welding_type": "角焊（定位焊）",
          "welding_method": "CO2气保焊",
          "weld_size": "点焊长度10mm，焊脚高度4mm",
          "welding_position": "零件⑨加强筋与零件②连接板和零件⑥矩形管的连接处，可能涉及立焊",
          "quality_requirements": "加强筋定位焊后应紧密贴合，无间隙",
          "safety_notes": "焊接加强筋时，注意狭小空间内的通风，防止烟雾聚集"
        },
        "safety_warnings": [
          "佩戴防护眼镜和手套，加强筋边缘可能锋利，防止割伤",
          "在狭小空间进行立焊时，注意保持身体平衡，防止烫伤",
          "确保局部通风良好，防止焊接烟雾在内部聚集"
        ]
      },
      {
        "step_number": 6,
        "action": "安装封板",
        "description": "将⑦号封板（01.01.01.16608）安装在组件的两侧，用于封闭矩形管之间的空间。",
        "position_description": "封板安装在组件的左右两侧，覆盖在矩形管的侧面。",
        "parts_used": [
          {
            "bom_seq": "7",
            "bom_name": "封板 2",
            "quantity": 2,
            "drawing_number": "7",
            "node_name": [
              "NAUO12",
              "NAUO11"
            ],
            "bom_code": "01.01.01.16608"
          }
        ],
        "tools": [
          "点焊机"
        ],
        "warnings": [
          "封板边缘应与主体结构对齐，确保外观平整。"
        ],
        "welding": {
          "required": true,
          "welding_type": "角焊（定位焊）",
          "welding_method": "CO2气保焊",
          "weld_size": "点焊长度10mm，焊脚高度3mm",
          "welding_position": "零件⑦封板与周围矩形管和连接板的边缘，横焊或立焊",
          "quality_requirements": "封板定位后应与主体结构齐平，无明显错位",
          "safety_notes": "封板较薄，点焊时注意控制电流，避免烧穿，保持焊枪角度稳定"
        },
        "safety_warnings": [
          "佩戴防护手套，封板边缘可能锋利，防止切割伤",
          "点焊时注意控制焊接电流，防止烧穿薄板，造成烫伤或火花飞溅"
        ]
      },
      {
        "step_number": 7,
        "action": "安装方形板",
        "description": "将③号方形板-机加（01.01.01.6589）安装在②号连接板的四个预留孔位上。方形板用于后续的连接或支撑。",
        "position_description": "方形板安装在②号连接板的四个角部，通过焊接固定。",
        "parts_used": [
          {
            "bom_seq": "3",
            "bom_name": "方形板-机加 4",
            "quantity": 4,
            "drawing_number": "3",
            "node_name": [
              "NAUO6",
              "NAUO5",
              "NAUO4",
              "NAUO3"
            ],
            "bom_code": "01.01.01.6589"
          }
        ],
        "tools": [
          "点焊机",
          "卡尺"
        ],
        "warnings": [
          "方形板的定位精度要求较高，安装前需核对孔位尺寸。",
          "确保方形板的机加工面朝向正确。"
        ],
        "welding": {
          "required": true,
          "welding_type": "角焊（定位焊）",
          "welding_method": "CO2气保焊",
          "weld_size": "点焊长度10mm，焊脚高度4mm",
          "welding_position": "零件③方形板与零件②连接板的接触面，平焊",
          "quality_requirements": "方形板定位后，其中心孔位置偏差应在允许范围内",
          "safety_notes": "方形板较小，定位焊时注意夹紧，防止移动，避免烫伤"
        },
        "safety_warnings": [
          "佩戴防护眼镜和手套，防止焊接飞溅物伤害",
          "方形板较小，定位时需使用夹具夹紧，防止焊接时移动或烫伤手指"
        ]
      },
      {
        "step_number": 8,
        "action": "满焊与清渣",
        "description": "按照图纸上的焊接符号和技术要求，对所有已点焊固定的零件进行满焊。焊接顺序应遵循对称、分散的原则，以减少焊接变形。",
        "position_description": "对所有零件的连接处进行满焊。",
        "parts_used": [],
        "tools": [
          "焊机（CO2/电弧焊）",
          "焊钳",
          "焊渣锤",
          "钢丝刷"
        ],
        "warnings": [
          "严格控制焊接电流和电压，确保焊缝牢固、无虚焊、无漏焊。",
          "焊接完成后，立即进行焊渣清理，并检查焊缝外观质量。"
        ],
        "welding": {
          "required": true,
          "welding_type": "角焊、部分对接焊",
          "welding_method": "CO2气保焊（推荐）或手工电弧焊",
          "weld_size": "焊脚高度通常为板厚较薄一侧的0.7倍，图纸未标注处按6mm执行",
          "welding_position": "所有结构件连接处，涉及平焊、横焊、立焊、仰焊",
          "quality_requirements": "焊缝必须连续、饱满，外观平整，无咬边、气孔、夹渣、裂纹等缺陷。重要焊缝（如挂件连接处）需进行无损检测（如磁粉或超声波）",
          "safety_notes": "满焊时产生大量烟雾，必须开启强力通风设备。穿戴全套防护服、面罩和手套。注意控制焊接变形，采用分段、跳焊或对称焊接顺序，防止结构件扭曲"
        },
        "safety_warnings": [
          "必须穿戴全套焊接防护用品（面罩、防护服、手套、安全鞋），防止电弧光、高温和飞溅物伤害",
          "开启强力通风设备，确保工作区域空气流通，防止吸入有毒烟尘",
          "清理焊渣时，佩戴防护眼镜，使用焊渣锤时注意周围人员，防止焊渣飞溅伤人",
          "检查焊机电缆和气管，确保绝缘良好，防止漏电或气体泄漏"
        ]
      }
    ]
  }
}