{
  "agent_name": "Agent6_FAQ",
  "model": "openai/gpt-4.1",
  "timestamp": "20251005_131110",
  "image_count": 0,
  "temperature": 0.2,
  "system_prompt": "# 角色定位\n\n你是**李师傅**，一位拥有20年安全管理经验的高级安全工程师。\n\n## 教育背景\n\n- **学历**：安全工程专业本科\n- **职业资格**：注册安全工程师、高级安全评价师\n- **专业培训**：\n  - 机械制造安全管理\n  - 职业健康与安全管理体系（ISO 45001）\n  - 事故调查与分析\n  - 应急预案编制与演练\n\n## 职业背景\n\n- **工作经历**：20年机械制造企业安全管理经验，参与过大型装备制造、钢结构加工等项目\n- **专业领域**：\n  - 机械加工安全（车、铣、刨、磨、钻等）\n  - 焊接作业安全（电焊、气焊、氩弧焊等）\n  - 起重吊装安全（行车、叉车、吊索具等）\n  - 高空作业安全（脚手架、安全带、防坠落等）\n  - 个人防护用品管理（安全帽、防护眼镜、手套、安全鞋等）\n\n## 知识结构（详细）\n\n### 1. 机械伤害风险\n- **夹伤/挤伤**：手指、手臂被运动部件夹住\n- **切割伤**：锋利边缘、毛刺、切削工具\n- **碰撞伤**：头部碰撞、身体碰撞\n- **坠落伤**：零件坠落、工具坠落、人员坠落\n\n### 2. 焊接作业风险\n- **电击伤**：焊机漏电、接地不良\n- **弧光伤**：电弧紫外线灼伤眼睛和皮肤\n- **烫伤**：高温熔池、焊渣飞溅\n- **火灾爆炸**：易燃物引燃、气瓶泄漏\n- **有毒气体**：焊接烟尘、一氧化碳中毒\n\n### 3. 起重吊装风险\n- **吊物坠落**：吊索具断裂、捆绑不牢\n- **吊物摆动**：碰撞人员、设备\n- **超载**：超过起重机额定载荷\n- **指挥失误**：信号不清、违章指挥\n\n### 4. 高空作业风险\n- **人员坠落**：未系安全带、脚手架不牢\n- **物体打击**：工具、零件从高处坠落\n- **脚手架坍塌**：搭设不规范、超载\n\n### 5. 个人防护用品\n- **头部防护**：安全帽（防止碰撞、坠物打击）\n- **眼部防护**：防护眼镜、焊接面罩（防止飞溅、弧光）\n- **手部防护**：防护手套（防止切割、烫伤、化学品）\n- **足部防护**：安全鞋（防砸、防刺穿、防滑）\n- **呼吸防护**：防尘口罩、防毒面具（防止粉尘、有毒气体）\n\n### 6. 应急处理\n- **机械伤害**：立即停机、呼救、止血、固定、送医\n- **电击伤**：切断电源、心肺复苏、送医\n- **烫伤**：冷水冲洗、覆盖无菌纱布、送医\n- **火灾**：使用灭火器、疏散人员、报警\n\n## 任务步骤（Chain of Thought）\n\n你的任务是**为每个装配步骤添加安全警告**（如果该步骤有安全风险）。请按照以下5个步骤思考：\n\n### 步骤1：识别风险步骤\n- 分析每个装配步骤的操作内容\n- 判断是否涉及高风险作业（焊接、吊装、高空、重物搬运等）\n- 识别潜在的伤害类型（机械伤害、电击、烫伤、坠落等）\n\n### 步骤2：分析风险源\n- 确定风险的来源（设备、工具、材料、环境、人员操作等）\n- 评估风险的严重程度（轻微、中等、严重、致命）\n- 考虑风险的发生概率\n\n### 步骤3：制定预防措施\n- 针对每个风险源，制定具体的预防措施\n- 强调个人防护用品的使用\n- 强调安全操作规程的遵守\n\n### 步骤4：添加安全警告\n- 为每个有风险的步骤添加safety_warnings字段\n- 每条警告要简洁明了，说明具体的风险和预防措施\n- 使用工人能看懂的语言\n\n### 步骤5：验证完整性\n- 检查所有高风险步骤是否都添加了安全警告\n- 检查安全警告是否具体、可操作\n- 检查是否遗漏了任何潜在风险\n\n## 核心原则\n\n1. **步骤级嵌入**：为每个有风险的步骤添加safety_warnings字段，而不是单独列出安全警告\n2. **工人友好**：使用通俗语言，避免专业术语\n3. **具体可操作**：说明具体的风险和预防措施，而不是泛泛而谈\n4. **不重复显示**：安全警告只在下方\"安全\"标签页中统一显示，不在当前步骤详情中重复显示\n\n## 输出格式\n\n严格按照以下JSON格式输出（返回增强后的装配步骤）：\n\n```json\n{\n  \"enhanced_steps\": [\n    {\n      \"step_number\": 1,\n      \"title\": \"点焊定位\",\n      \"parts_used\": [...],\n      \"tools_required\": [...],\n      \"operation\": \"操作说明\",\n      \"quality_check\": \"质量检查\",\n      \"estimated_time_minutes\": 10,\n      \"welding\": {\n        \"required\": true,\n        \"welding_type\": \"点焊\",\n        \"welding_method\": \"CO2气保焊\",\n        ...\n      },\n      \"safety_warnings\": [\n        \"佩戴焊接面罩和防护手套，防止弧光灼伤眼睛和皮肤\",\n        \"确保工件夹紧牢固，防止点焊时位移造成伤害\",\n        \"焊接区域周围3米内不得有易燃物，配备灭火器\",\n        \"焊机必须接地良好，防止漏电触电\"\n      ]\n    },\n    {\n      \"step_number\": 2,\n      \"title\": \"螺栓连接\",\n      \"parts_used\": [...],\n      \"operation\": \"操作说明\",\n      \"quality_check\": \"质量检查\",\n      \"estimated_time_minutes\": 15,\n      \"safety_warnings\": [\n        \"佩戴安全帽和防护眼镜，防止零件坠落和飞溅\",\n        \"使用扭力扳手时注意力度，防止扳手滑脱伤人\"\n      ]\n    },\n    {\n      \"step_number\": 3,\n      \"title\": \"简单装配\",\n      \"parts_used\": [...],\n      \"operation\": \"操作说明\",\n      \"quality_check\": \"质量检查\",\n      \"estimated_time_minutes\": 5\n      // ⚠️ 如果没有明显安全风险，不添加safety_warnings字段\n    }\n  ]\n}\n```\n\n**⚠️ 关键要求**：\n\n1. **步骤级嵌入**：\n   - 为每个有风险的步骤添加`safety_warnings`字段\n   - 没有明显风险的步骤不添加`safety_warnings`字段\n   - 保持原有步骤的所有字段不变\n\n2. **安全警告要具体**：\n   - ✅ 说\"佩戴焊接面罩和防护手套，防止弧光灼伤眼睛和皮肤\"\n   - ❌ 不说\"注意安全\"\n   - ✅ 说\"焊接区域周围3米内不得有易燃物，配备灭火器\"\n   - ❌ 不说\"注意防火\"\n\n3. **使用通俗语言**：\n   - 工人能看懂的语言\n   - 避免专业术语和英文缩写\n\n4. **警告要全面**：\n   - 涵盖个人防护、设备安全、环境安全、操作安全\n   - 每条警告说明具体的风险和预防措施\n\n## 重要提醒\n\n- **只输出JSON，不要输出其他内容**\n- **保持原有字段不变**：不要修改或删除原有的字段（包括welding字段）\n- **警告要简洁明了**：每条警告一句话，说明风险和预防措施\n- **不要过度警告**：只针对有明显风险的步骤添加警告\n",
  "user_query": "请为以下装配步骤添加安全警告（如果有安全风险）。\n\n## 📸 视觉分析任务\n\n**你会看到工程图纸图片，请仔细观察：**\n\n1. **危险作业标识**：\n   - 图纸上的安全警告标识\n   - 特殊作业要求（如高空作业、吊装作业等）\n   - 危险区域标注\n\n2. **零件特征**：\n   - 重型零件（需要吊装）\n   - 锋利边缘（容易割伤）\n   - 高温部件（容易烫伤）\n\n3. **作业环境**：\n   - 狭窄空间（容易碰撞）\n   - 高空位置（容易坠落）\n   - 密闭空间（通风不良）\n\n## 装配步骤\n\n[\n  {\n    \"step_number\": 1,\n    \"action\": \"放置基准件\",\n    \"description\": \"将图纸上标注为1的左铲板（BOM序号：1）平放在装配平台上，作为整个装配的基准件，注意板面朝上，便于后续焊接。\",\n    \"position_description\": \"左铲板为最底层基准件，其他零件均安装在其上或两侧。\",\n    \"parts_used\": [\n      {\n        \"bom_seq\": \"1\",\n        \"bom_name\": \"左铲板\",\n        \"quantity\": 1,\n        \"drawing_number\": \"1\",\n        \"mesh_id\": [\n          \"mesh_026\"\n        ],\n        \"bom_code\": \"01.01.01.18598\"\n      }\n    ],\n    \"tools\": [\n      \"行车\",\n      \"吊带\",\n      \"水平仪\"\n    ],\n    \"warnings\": [\n      \"吊装时注意人员安全\",\n      \"确保左铲板放置水平\"\n    ]\n  },\n  {\n    \"step_number\": 2,\n    \"action\": \"焊接后加强板\",\n    \"description\": \"将图纸上标注为3的后加强板（BOM序号：3）贴合在1号左铲板的后侧定位槽内，点焊定位后满焊固定。\",\n    \"position_description\": \"后加强板在左铲板的后侧，与板体后缘对齐。\",\n    \"parts_used\": [\n      {\n        \"bom_seq\": \"3\",\n        \"bom_name\": \"后加强板\",\n        \"quantity\": 1,\n        \"drawing_number\": \"3\",\n        \"mesh_id\": [\n          \"mesh_024\"\n        ],\n        \"bom_code\": \"01.01.01.11519\"\n      }\n    ],\n    \"tools\": [\n      \"CO2焊机\",\n      \"焊条\",\n      \"夹具\"\n    ],\n    \"warnings\": [\n      \"焊接时注意防护\",\n      \"点焊后检查位置再满焊\"\n    ],\n    \"welding\": {\n      \"required\": true,\n      \"welding_type\": \"角焊\",\n      \"welding_method\": \"CO2气保焊\",\n      \"weld_size\": \"焊缝高度6mm，长度按图纸要求\",\n      \"welding_position\": \"后加强板与左铲板后侧连接处，主要为平焊和立焊\",\n      \"quality_requirements\": \"焊缝饱满、连续，无气孔、夹渣、裂纹，焊后清理飞溅，外观整齐\",\n      \"safety_notes\": \"佩戴焊接面罩和防护手套，确保通风良好，周围无易燃物，焊机接地可靠\"\n    }\n  },\n  {\n    \"step_number\": 3,\n    \"action\": \"焊接前加强板\",\n    \"description\": \"将图纸上标注为4的前加强板（BOM序号：4）放置在1号左铲板的前侧定位槽内，点焊定位后满焊固定。\",\n    \"position_description\": \"前加强板在左铲板的前侧，与板体前缘对齐。\",\n    \"parts_used\": [\n      {\n        \"bom_seq\": \"4\",\n        \"bom_name\": \"前加强板\",\n        \"quantity\": 1,\n        \"drawing_number\": \"4\",\n        \"mesh_id\": [\n          \"mesh_023\"\n        ],\n        \"bom_code\": \"01.01.01.18600\"\n      }\n    ],\n    \"tools\": [\n      \"CO2焊机\",\n      \"焊条\",\n      \"夹具\"\n    ],\n    \"warnings\": [\n      \"焊接时注意防护\",\n      \"点焊后检查位置再满焊\"\n    ],\n    \"welding\": {\n      \"required\": true,\n      \"welding_type\": \"角焊\",\n      \"welding_method\": \"CO2气保焊\",\n      \"weld_size\": \"焊缝高度6mm，长度按图纸要求\",\n      \"welding_position\": \"前加强板与左铲板前侧连接处，主要为平焊和立焊\",\n      \"quality_requirements\": \"焊缝饱满、连续，无气孔、夹渣、裂纹，焊后清理飞溅，外观整齐\",\n      \"safety_notes\": \"佩戴焊接面罩和防护手套，确保通风良好，周围无易燃物，焊机接地可靠\"\n    }\n  },\n  {\n    \"step_number\": 4,\n    \"action\": \"焊接底部连接板\",\n    \"description\": \"将图纸上标注为6的底部连接板（BOM序号：5）依次放置在1号左铲板底部的6个安装位置，点焊定位后满焊固定。\",\n    \"position_description\": \"底部连接板均匀分布在左铲板底部，沿长度方向排列。\",\n    \"parts_used\": [\n      {\n        \"bom_seq\": \"5\",\n        \"bom_name\": \"底部连接板\",\n        \"quantity\": 6,\n        \"drawing_number\": \"6\",\n        \"mesh_id\": [\n          \"mesh_012\",\n          \"mesh_013\",\n          \"mesh_014\",\n          \"mesh_015\",\n          \"mesh_021\",\n          \"mesh_022\"\n        ],\n        \"bom_code\": \"01.01.01.11521\"\n      }\n    ],\n    \"tools\": [\n      \"CO2焊机\",\n      \"焊条\",\n      \"夹具\",\n      \"卷尺\"\n    ],\n    \"warnings\": [\n      \"注意板间间距一致\",\n      \"焊接时防止变形\"\n    ],\n    \"welding\": {\n      \"required\": true,\n      \"welding_type\": \"角焊\",\n      \"welding_method\": \"CO2气保焊\",\n      \"weld_size\": \"焊缝高度6mm，长度按图纸要求\",\n      \"welding_position\": \"底部连接板与左铲板底部连接处，主要为平焊\",\n      \"quality_requirements\": \"焊缝饱满、连续，无气孔、夹渣、裂纹，焊后清理飞溅，外观整齐，注意防止焊接变形\",\n      \"safety_notes\": \"佩戴焊接面罩和防护手套，确保通风良好，焊接区域无杂物，焊机接地可靠\"\n    }\n  },\n  {\n    \"step_number\": 5,\n    \"action\": \"焊接前弹簧固定板\",\n    \"description\": \"将图纸上标注为7的前弹簧固定板（BOM序号：7）放置在1号左铲板前部指定位置，点焊定位后满焊固定。\",\n    \"position_description\": \"前弹簧固定板位于左铲板前部中间位置。\",\n    \"parts_used\": [\n      {\n        \"bom_seq\": \"7\",\n        \"bom_name\": \"前弹簧固定板\",\n        \"quantity\": 1,\n        \"drawing_number\": \"7\",\n        \"mesh_id\": [\n          \"mesh_018\"\n        ],\n        \"bom_code\": \"01.01.01.11523\"\n      }\n    ],\n    \"tools\": [\n      \"CO2焊机\",\n      \"焊条\",\n      \"夹具\"\n    ],\n    \"warnings\": [\n      \"焊接时注意防护\",\n      \"定位准确\"\n    ],\n    \"welding\": {\n      \"required\": true,\n      \"welding_type\": \"角焊\",\n      \"welding_method\": \"CO2气保焊\",\n      \"weld_size\": \"焊缝高度6mm，长度按图纸要求\",\n      \"welding_position\": \"前弹簧固定板与左铲板前部连接处，主要为平焊\",\n      \"quality_requirements\": \"焊缝饱满、连续，无气孔、夹渣、裂纹，焊后清理飞溅，外观整齐\",\n      \"safety_notes\": \"佩戴焊接面罩和防护手套，确保通风良好，焊机接地可靠\"\n    }\n  },\n  {\n    \"step_number\": 6,\n    \"action\": \"焊接后弹簧固定板\",\n    \"description\": \"将图纸上标注为8的后弹簧固定板（BOM序号：8）分别放置在1号左铲板后部两侧指定位置，点焊定位后满焊固定。\",\n    \"position_description\": \"后弹簧固定板分布在左铲板后部两侧。\",\n    \"parts_used\": [\n      {\n        \"bom_seq\": \"8\",\n        \"bom_name\": \"后弹簧固定板\",\n        \"quantity\": 2,\n        \"drawing_number\": \"8\",\n        \"mesh_id\": [\n          \"mesh_016\",\n          \"mesh_017\"\n        ],\n        \"bom_code\": \"01.01.01.11524\"\n      }\n    ],\n    \"tools\": [\n      \"CO2焊机\",\n      \"焊条\",\n      \"夹具\"\n    ],\n    \"warnings\": [\n      \"两块板位置对称\",\n      \"焊接时注意防护\"\n    ],\n    \"welding\": {\n      \"required\": true,\n      \"welding_type\": \"角焊\",\n      \"welding_method\": \"CO2气保焊\",\n      \"weld_size\": \"焊缝高度6mm，长度按图纸要求\",\n      \"welding_position\": \"后弹簧固定板与左铲板后部两侧连接处，主要为平焊和立焊\",\n      \"quality_requirements\": \"焊缝饱满、连续，无气孔、夹渣、裂纹，焊后清理飞溅，外观整齐\",\n      \"safety_notes\": \"佩戴焊接面罩和防护手套，确保通风良好，焊机接地可靠\"\n    }\n  },\n  {\n    \"step_number\": 7,\n    \"action\": \"焊接支撑固定板\",\n    \"description\": \"将图纸上标注为9的支撑固定板（BOM序号：9）放置在1号左铲板中部指定位置，点焊定位后满焊固定。\",\n    \"position_description\": \"支撑固定板位于左铲板中部偏下位置。\",\n    \"parts_used\": [\n      {\n        \"bom_seq\": \"9\",\n        \"bom_name\": \"支撑固定板\",\n        \"quantity\": 1,\n        \"drawing_number\": \"9\",\n        \"mesh_id\": [\n          \"mesh_011\"\n        ],\n        \"bom_code\": \"01.01.01.11525\"\n      }\n    ],\n    \"tools\": [\n      \"CO2焊机\",\n      \"焊条\",\n      \"夹具\"\n    ],\n    \"warnings\": [\n      \"焊接时注意防护\",\n      \"定位准确\"\n    ],\n    \"welding\": {\n      \"required\": true,\n      \"welding_type\": \"角焊\",\n      \"welding_method\": \"CO2气保焊\",\n      \"weld_size\": \"焊缝高度6mm，长度按图纸要求\",\n      \"welding_position\": \"支撑固定板与左铲板中部连接处，主要为平焊\",\n      \"quality_requirements\": \"焊缝饱满、连续，无气孔、夹渣、裂纹，焊后清理飞溅，外观整齐\",\n      \"safety_notes\": \"佩戴焊接面罩和防护手套，确保通风良好，焊机接地可靠\"\n    }\n  },\n  {\n    \"step_number\": 8,\n    \"action\": \"焊接轴套加强板\",\n    \"description\": \"将图纸上标注为10的轴套加强板（BOM序号：10）分别放置在1号左铲板两端轴套安装位置，点焊定位后满焊固定。\",\n    \"position_description\": \"轴套加强板位于左铲板两端，作为轴套的加强支撑。\",\n    \"parts_used\": [\n      {\n        \"bom_seq\": \"10\",\n        \"bom_name\": \"轴套加强板\",\n        \"quantity\": 2,\n        \"drawing_number\": \"10\",\n        \"mesh_id\": [\n          \"mesh_009\",\n          \"mesh_010\"\n        ],\n        \"bom_code\": \"01.01.01.11526\"\n      }\n    ],\n    \"tools\": [\n      \"CO2焊机\",\n      \"焊条\",\n      \"夹具\"\n    ],\n    \"warnings\": [\n      \"两块板位置对称\",\n      \"焊接时注意防护\"\n    ],\n    \"welding\": {\n      \"required\": true,\n      \"welding_type\": \"角焊\",\n      \"welding_method\": \"CO2气保焊\",\n      \"weld_size\": \"焊缝高度6mm，长度按图纸要求\",\n      \"welding_position\": \"轴套加强板与左铲板两端连接处，主要为平焊和立焊\",\n      \"quality_requirements\": \"焊缝饱满、连续，无气孔、夹渣、裂纹，焊后清理飞溅，外观整齐\",\n      \"safety_notes\": \"佩戴焊接面罩和防护手套，确保通风良好，焊机接地可靠\"\n    }\n  },\n  {\n    \"step_number\": 9,\n    \"action\": \"焊接反光片安装板\",\n    \"description\": \"将图纸上标注为11的反光片安装板（BOM序号：11）放置在1号左铲板上部指定位置，点焊定位后满焊固定。\",\n    \"position_description\": \"反光片安装板位于左铲板上部偏右位置。\",\n    \"parts_used\": [\n      {\n        \"bom_seq\": \"11\",\n        \"bom_name\": \"反光片安装板\",\n        \"quantity\": 1,\n        \"drawing_number\": \"11\",\n        \"mesh_id\": [\n          \"mesh_008\"\n        ],\n        \"bom_code\": \"01.01.01.11527\"\n      }\n    ],\n    \"tools\": [\n      \"CO2焊机\",\n      \"焊条\",\n      \"夹具\"\n    ],\n    \"warnings\": [\n      \"焊接时注意防护\",\n      \"定位准确\"\n    ],\n    \"welding\": {\n      \"required\": true,\n      \"welding_type\": \"角焊\",\n      \"welding_method\": \"CO2气保焊\",\n      \"weld_size\": \"焊缝高度6mm，长度按图纸要求\",\n      \"welding_position\": \"反光片安装板与左铲板上部连接处，主要为平焊\",\n      \"quality_requirements\": \"焊缝饱满、连续，无气孔、夹渣、裂纹，焊后清理飞溅，外观整齐\",\n      \"safety_notes\": \"佩戴焊接面罩和防护手套，确保通风良好，焊机接地可靠\"\n    }\n  },\n  {\n    \"step_number\": 10,\n    \"action\": \"焊接轴套\",\n    \"description\": \"将图纸上标注为12的轴套（BOM序号：12）分别插入左铲板两端轴孔内，调整同轴度后点焊定位，再满焊固定。\",\n    \"position_description\": \"轴套分别位于左铲板两端，与轴孔同轴。\",\n    \"parts_used\": [\n      {\n        \"bom_seq\": \"12\",\n        \"bom_name\": \"轴套\",\n        \"quantity\": 2,\n        \"drawing_number\": \"12\"\n      }\n    ],\n    \"tools\": [\n      \"CO2焊机\",\n      \"焊条\",\n      \"千分尺\",\n      \"夹具\"\n    ],\n    \"warnings\": [\n      \"保证轴套同轴度\",\n      \"焊接时防止变形\"\n    ],\n    \"welding\": {\n      \"required\": true,\n      \"welding_type\": \"角焊\",\n      \"welding_method\": \"CO2气保焊\",\n      \"weld_size\": \"焊缝高度不超过轴套，按图纸4处焊接\",\n      \"welding_position\": \"轴套与左铲板两端轴孔连接处，主要为平焊和立焊\",\n      \"quality_requirements\": \"焊缝饱满、连续，无气孔、夹渣、裂纹，保证轴套同轴度，焊后清理飞溅\",\n      \"safety_notes\": \"佩戴焊接面罩和防护手套，确保通风良好，焊接时注意防止轴套变形，焊机接地可靠\"\n    }\n  },\n  {\n    \"step_number\": 11,\n    \"action\": \"焊接方形板-机加\",\n    \"description\": \"将图纸上标注为2的方形板-机加（BOM序号：2）放置在左铲板底部中间指定位置，点焊定位后满焊固定。\",\n    \"position_description\": \"方形板-机加位于左铲板底部中间。\",\n    \"parts_used\": [\n      {\n        \"bom_seq\": \"2\",\n        \"bom_name\": \"方形板-机加\",\n        \"quantity\": 1,\n        \"drawing_number\": \"2\",\n        \"mesh_id\": [\n          \"mesh_025\"\n        ],\n        \"bom_code\": \"01.01.01.18599\"\n      }\n    ],\n    \"tools\": [\n      \"CO2焊机\",\n      \"焊条\",\n      \"夹具\"\n    ],\n    \"warnings\": [\n      \"焊接时注意防护\",\n      \"定位准确\"\n    ],\n    \"welding\": {\n      \"required\": true,\n      \"welding_type\": \"角焊\",\n      \"welding_method\": \"CO2气保焊\",\n      \"weld_size\": \"焊缝高度6mm，长度按图纸要求\",\n      \"welding_position\": \"方形板-机加与左铲板底部中间连接处，主要为平焊\",\n      \"quality_requirements\": \"焊缝饱满、连续，无气孔、夹渣、裂纹，焊后清理飞溅，外观整齐\",\n      \"safety_notes\": \"佩戴焊接面罩和防护手套，确保通风良好，焊机接地可靠\"\n    }\n  },\n  {\n    \"step_number\": 12,\n    \"action\": \"焊接方形板1\",\n    \"description\": \"将图纸上标注为13的方形板1（BOM序号：13）放置在左铲板上部指定位置，点焊定位后满焊固定。\",\n    \"position_description\": \"方形板1位于左铲板上部靠近前侧。\",\n    \"parts_used\": [\n      {\n        \"bom_seq\": \"13\",\n        \"bom_name\": \"方形板 1\",\n        \"quantity\": 1,\n        \"drawing_number\": \"13\"\n      }\n    ],\n    \"tools\": [\n      \"CO2焊机\",\n      \"焊条\",\n      \"夹具\"\n    ],\n    \"warnings\": [\n      \"焊接时注意防护\",\n      \"定位准确\"\n    ],\n    \"welding\": {\n      \"required\": true,\n      \"welding_type\": \"角焊\",\n      \"welding_method\": \"CO2气保焊\",\n      \"weld_size\": \"焊缝高度6mm，长度按图纸要求\",\n      \"welding_position\": \"方形板1与左铲板上部靠前侧连接处，主要为平焊\",\n      \"quality_requirements\": \"焊缝饱满、连续，无气孔、夹渣、裂纹，焊后清理飞溅，外观整齐\",\n      \"safety_notes\": \"佩戴焊接面罩和防护手套，确保通风良好，焊机接地可靠\"\n    }\n  },\n  {\n    \"step_number\": 13,\n    \"action\": \"焊接方形板3\",\n    \"description\": \"将图纸上标注为14的方形板3（BOM序号：14）依次放置在左铲板上部剩余3个指定位置，点焊定位后满焊固定。\",\n    \"position_description\": \"方形板3均匀分布在左铲板上部。\",\n    \"parts_used\": [\n      {\n        \"bom_seq\": \"14\",\n        \"bom_name\": \"方形板 3\",\n        \"quantity\": 3,\n        \"drawing_number\": \"14\",\n        \"mesh_id\": [\n          \"mesh_003\",\n          \"mesh_004\",\n          \"mesh_005\"\n        ],\n        \"bom_code\": \"01.01.01.11529\"\n      }\n    ],\n    \"tools\": [\n      \"CO2焊机\",\n      \"焊条\",\n      \"夹具\"\n    ],\n    \"warnings\": [\n      \"焊接时注意防护\",\n      \"位置均匀\"\n    ],\n    \"welding\": {\n      \"required\": true,\n      \"welding_type\": \"角焊\",\n      \"welding_method\": \"CO2气保焊\",\n      \"weld_size\": \"焊缝高度6mm，长度按图纸要求\",\n      \"welding_position\": \"方形板3与左铲板上部连接处，主要为平焊\",\n      \"quality_requirements\": \"焊缝饱满、连续，无气孔、夹渣、裂纹，焊后清理飞溅，外观整齐\",\n      \"safety_notes\": \"佩戴焊接面罩和防护手套，确保通风良好，焊机接地可靠\"\n    }\n  },\n  {\n    \"step_number\": 14,\n    \"action\": \"焊接左铲雪板加强板\",\n    \"description\": \"将图纸上标注为15的左铲雪板加强板（BOM序号：15）分别放置在左铲板两侧加强位置，点焊定位后满焊固定。\",\n    \"position_description\": \"左铲雪板加强板位于左铲板两侧边缘。\",\n    \"parts_used\": [\n      {\n        \"bom_seq\": \"15\",\n        \"bom_name\": \"左铲雪板加强板 2\",\n        \"quantity\": 2,\n        \"drawing_number\": \"15\",\n        \"mesh_id\": [\n          \"mesh_001\",\n          \"mesh_002\"\n        ],\n        \"bom_code\": \"01.02.01.4983\"\n      }\n    ],\n    \"tools\": [\n      \"CO2焊机\",\n      \"焊条\",\n      \"夹具\"\n    ],\n    \"warnings\": [\n      \"两块板位置对称\",\n      \"焊接时注意防护\"\n    ],\n    \"welding\": {\n      \"required\": true,\n      \"welding_type\": \"角焊\",\n      \"welding_method\": \"CO2气保焊\",\n      \"weld_size\": \"焊缝高度6mm，长度按图纸要求\",\n      \"welding_position\": \"左铲雪板加强板与左铲板两侧边缘连接处，主要为立焊和部分平焊\",\n      \"quality_requirements\": \"焊缝饱满、连续，无气孔、夹渣、裂纹，焊后清理飞溅，外观整齐\",\n      \"safety_notes\": \"佩戴焊接面罩和防护手套，确保通风良好，焊机接地可靠\"\n    }\n  }\n]\n\n## 要求\n\n请按照以下5个步骤思考，为装配步骤添加安全警告：\n\n### 步骤1：识别风险步骤\n- 分析每个装配步骤的操作内容\n- 判断是否涉及高风险作业：\n  * **焊接作业**：电击、弧光、烫伤、火灾\n  * **吊装作业**：吊物坠落、碰撞、超载\n  * **高空作业**：人员坠落、物体打击\n  * **重物搬运**：砸伤、扭伤、夹伤\n  * **机械加工**：切割伤、夹伤、碰撞\n\n### 步骤2：分析风险源\n- 确定风险的来源（设备、工具、材料、环境、人员操作等）\n- 评估风险的严重程度（轻微、中等、严重、致命）\n- 考虑风险的发生概率\n\n### 步骤3：制定预防措施\n- 针对每个风险源，制定具体的预防措施\n- 强调个人防护用品的使用：\n  * **焊接**：焊接面罩、防护手套、防护服\n  * **吊装**：安全帽、安全鞋、手套\n  * **高空**：安全带、安全帽、防滑鞋\n  * **机械**：防护眼镜、手套、安全鞋\n\n### 步骤4：添加安全警告\n- 为每个有风险的步骤添加safety_warnings字段\n- 每条警告要简洁明了，说明具体的风险和预防措施\n- 使用工人能看懂的语言\n\n### 步骤5：验证完整性\n- 检查所有高风险步骤是否都添加了安全警告\n- 检查安全警告是否具体、可操作\n- 检查是否遗漏了任何潜在风险\n\n## ⚠️ 强制自检清单（生成后必须逐项检查）\n\n**在输出JSON之前，你必须完成以下验证：**\n\n1. **风险步骤识别验证**：\n   - [ ] 所有涉及焊接、吊装、高空、重物搬运的步骤都添加了safety_warnings字段\n   - [ ] 没有明显风险的步骤没有添加safety_warnings字段\n\n2. **安全警告完整性验证**：\n   - [ ] 每个safety_warnings字段都是字符串数组\n   - [ ] 每条警告都说明了具体的风险和预防措施\n   - [ ] 涵盖了个人防护、设备安全、环境安全、操作安全\n\n3. **语言通俗性验证**：\n   - [ ] 使用工人能看懂的语言\n   - [ ] 避免专业术语和英文缩写\n   - [ ] 每条警告简洁明了（一句话）\n\n4. **原有字段保持验证**：\n   - [ ] 原有步骤的所有字段都保持不变（包括welding字段）\n   - [ ] 没有修改或删除任何原有字段\n\n**如果自检发现任何问题，必须重新生成！**\n\n现在开始为装配步骤添加安全警告！\n",
  "raw_response": "```json\n{\n  \"enhanced_steps\": [\n    {\n      \"step_number\": 1,\n      \"action\": \"放置基准件\",\n      \"description\": \"将图纸上标注为1的左铲板（BOM序号：1）平放在装配平台上，作为整个装配的基准件，注意板面朝上，便于后续焊接。\",\n      \"position_description\": \"左铲板为最底层基准件，其他零件均安装在其上或两侧。\",\n      \"parts_used\": [\n        {\n          \"bom_seq\": \"1\",\n          \"bom_name\": \"左铲板\",\n          \"quantity\": 1,\n          \"drawing_number\": \"1\",\n          \"mesh_id\": [\n            \"mesh_026\"\n          ],\n          \"bom_code\": \"01.01.01.18598\"\n        }\n      ],\n      \"tools\": [\n        \"行车\",\n        \"吊带\",\n        \"水平仪\"\n      ],\n      \"warnings\": [\n        \"吊装时注意人员安全\",\n        \"确保左铲板放置水平\"\n      ],\n      \"safety_warnings\": [\n        \"吊装左铲板时，必须佩戴安全帽和安全鞋，防止吊物坠落砸伤\",\n        \"吊带和行车使用前要检查完好，严禁超载吊装\",\n        \"吊装过程中严禁站在吊物下方，防止意外坠落伤人\",\n        \"放置时注意手指不要夹在重物和平台之间，防止夹伤\"\n      ]\n    },\n    {\n      \"step_number\": 2,\n      \"action\": \"焊接后加强板\",\n      \"description\": \"将图纸上标注为3的后加强板（BOM序号：3）贴合在1号左铲板的后侧定位槽内，点焊定位后满焊固定。\",\n      \"position_description\": \"后加强板在左铲板的后侧，与板体后缘对齐。\",\n      \"parts_used\": [\n        {\n          \"bom_seq\": \"3\",\n          \"bom_name\": \"后加强板\",\n          \"quantity\": 1,\n          \"drawing_number\": \"3\",\n          \"mesh_id\": [\n            \"mesh_024\"\n          ],\n          \"bom_code\": \"01.01.01.11519\"\n        }\n      ],\n      \"tools\": [\n        \"CO2焊机\",\n        \"焊条\",\n        \"夹具\"\n      ],\n      \"warnings\": [\n        \"焊接时注意防护\",\n        \"点焊后检查位置再满焊\"\n      ],\n      \"welding\": {\n        \"required\": true,\n        \"welding_type\": \"角焊\",\n        \"welding_method\": \"CO2气保焊\",\n        \"weld_size\": \"焊缝高度6mm，长度按图纸要求\",\n        \"welding_position\": \"后加强板与左铲板后侧连接处，主要为平焊和立焊\",\n        \"quality_requirements\": \"焊缝饱满、连续，无气孔、夹渣、裂纹，焊后清理飞溅，外观整齐\",\n        \"safety_notes\": \"佩戴焊接面罩和防护手套，确保通风良好，周围无易燃物，焊机接地可靠\"\n      },\n      \"safety_warnings\": [\n        \"焊接时必须佩戴焊接面罩和防护手套，防止弧光灼伤和烫伤\",\n        \"焊接区域3米内不得有易燃物，现场配备灭火器\",\n        \"焊机要接地良好，防止漏电触电\",\n        \"焊接时注意通风，防止吸入有害烟尘\"\n      ]\n    },\n    {\n      \"step_number\": 3,\n      \"action\": \"焊接前加强板\",\n      \"description\": \"将图纸上标注为4的前加强板（BOM序号：4）放置在1号左铲板的前侧定位槽内，点焊定位后满焊固定。\",\n      \"position_description\": \"前加强板在左铲板的前侧，与板体前缘对齐。\",\n      \"parts_used\": [\n        {\n          \"bom_seq\": \"4\",\n          \"bom_name\": \"前加强板\",\n          \"quantity\": 1,\n          \"drawing_number\": \"4\",\n          \"mesh_id\": [\n            \"mesh_023\"\n          ],\n          \"bom_code\": \"01.01.01.18600\"\n        }\n      ],\n      \"tools\": [\n        \"CO2焊机\",\n        \"焊条\",\n        \"夹具\"\n      ],\n      \"warnings\": [\n        \"焊接时注意防护\",\n        \"点焊后检查位置再满焊\"\n      ],\n      \"welding\": {\n        \"required\": true,\n        \"welding_type\": \"角焊\",\n        \"welding_method\": \"CO2气保焊\",\n        \"weld_size\": \"焊缝高度6mm，长度按图纸要求\",\n        \"welding_position\": \"前加强板与左铲板前侧连接处，主要为平焊和立焊\",\n        \"quality_requirements\": \"焊缝饱满、连续，无气孔、夹渣、裂纹，焊后清理飞溅，外观整齐\",\n        \"safety_notes\": \"佩戴焊接面罩和防护手套，确保通风良好，周围无易燃物，焊机接地可靠\"\n      },\n      \"safety_warnings\": [\n        \"焊接时必须佩戴焊接面罩和防护手套，防止弧光灼伤和烫伤\",\n        \"焊接区域3米内不得有易燃物，现场配备灭火器\",\n        \"焊机要接地良好，防止漏电触电\",\n        \"焊接时注意通风，防止吸入有害烟尘\"\n      ]\n    },\n    {\n      \"step_number\": 4,\n      \"action\": \"焊接底部连接板\",\n      \"description\": \"将图纸上标注为6的底部连接板（BOM序号：5）依次放置在1号左铲板底部的6个安装位置，点焊定位后满焊固定。\",\n      \"position_description\": \"底部连接板均匀分布在左铲板底部，沿长度方向排列。\",\n      \"parts_used\": [\n        {\n          \"bom_seq\": \"5\",\n          \"bom_name\": \"底部连接板\",\n          \"quantity\": 6,\n          \"drawing_number\": \"6\",\n          \"mesh_id\": [\n            \"mesh_012\",\n            \"mesh_013\",\n            \"mesh_014\",\n            \"mesh_015\",\n            \"mesh_021\",\n            \"mesh_022\"\n          ],\n          \"bom_code\": \"01.01.01.11521\"\n        }\n      ],\n      \"tools\": [\n        \"CO2焊机\",\n        \"焊条\",\n        \"夹具\",\n        \"卷尺\"\n      ],\n      \"warnings\": [\n        \"注意板间间距一致\",\n        \"焊接时防止变形\"\n      ],\n      \"welding\": {\n        \"required\": true,\n        \"welding_type\": \"角焊\",\n        \"welding_method\": \"CO2气保焊\",\n        \"weld_size\": \"焊缝高度6mm，长度按图纸要求\",\n        \"welding_position\": \"底部连接板与左铲板底部连接处，主要为平焊\",\n        \"quality_requirements\": \"焊缝饱满、连续，无气孔、夹渣、裂纹，焊后清理飞溅，外观整齐，注意防止焊接变形\",\n        \"safety_notes\": \"佩戴焊接面罩和防护手套，确保通风良好，焊接区域无杂物，焊机接地可靠\"\n      },\n      \"safety_warnings\": [\n        \"焊接时必须佩戴焊接面罩和防护手套，防止弧光灼伤和烫伤\",\n        \"焊接区域3米内不得有易燃物，现场配备灭火器\",\n        \"焊机要接地良好，防止漏电触电\",\n        \"焊接时注意通风，防止吸入有害烟尘\"\n      ]\n    },\n    {\n      \"step_number\": 5,\n      \"action\": \"焊接前弹簧固定板\",\n      \"description\": \"将图纸上标注为7的前弹簧固定板（BOM序号：7）放置在1号左铲板前部指定位置，点焊定位后满焊固定。\",\n      \"position_description\": \"前弹簧固定板位于左铲板前部中间位置。\",\n      \"parts_used\": [\n        {\n          \"bom_seq\": \"7\",\n          \"bom_name\": \"前弹簧固定板\",\n          \"quantity\": 1,\n          \"drawing_number\": \"7\",\n          \"mesh_id\": [\n            \"mesh_018\"\n          ],\n          \"bom_code\": \"01.01.01.11523\"\n        }\n      ],\n      \"tools\": [\n        \"CO2焊机\",\n        \"焊条\",\n        \"夹具\"\n      ],\n      \"warnings\": [\n        \"焊接时注意防护\",\n        \"定位准确\"\n      ],\n      \"welding\": {\n        \"required\": true,\n        \"welding_type\": \"角焊\",\n        \"welding_method\": \"CO2气保焊\",\n        \"weld_size\": \"焊缝高度6mm，长度按图纸要求\",\n        \"welding_position\": \"前弹簧固定板与左铲板前部连接处，主要为平焊\",\n        \"quality_requirements\": \"焊缝饱满、连续，无气孔、夹渣、裂纹，焊后清理飞溅，外观整齐\",\n        \"safety_notes\": \"佩戴焊接面罩和防护手套，确保通风良好，焊机接地可靠\"\n      },\n      \"safety_warnings\": [\n        \"焊接时必须佩戴焊接面罩和防护手套，防止弧光灼伤和烫伤\",\n        \"焊接区域3米内不得有易燃物，现场配备灭火器\",\n        \"焊机要接地良好，防止漏电触电\",\n        \"焊接时注意通风，防止吸入有害烟尘\"\n      ]\n    },\n    {\n      \"step_number\": 6,\n      \"action\": \"焊接后弹簧固定板\",\n      \"description\": \"将图纸上标注为8的后弹簧固定板（BOM序号：8）分别放置在1号左铲板后部两侧指定位置，点焊定位后满焊固定。\",\n      \"position_description\": \"后弹簧固定板分布在左铲板后部两侧。\",\n      \"parts_used\": [\n        {\n          \"bom_seq\": \"8\",\n          \"bom_name\": \"后弹簧固定板\",\n          \"quantity\": 2,\n          \"drawing_number\": \"8\",\n          \"mesh_id\": [\n            \"mesh_016\",\n            \"mesh_017\"\n          ],\n          \"bom_code\": \"01.01.01.11524\"\n        }\n      ],\n      \"tools\": [\n        \"CO2焊机\",\n        \"焊条\",\n        \"夹具\"\n      ],\n      \"warnings\": [\n        \"两块板位置对称\",\n        \"焊接时注意防护\"\n      ],\n      \"welding\": {\n        \"required\": true,\n        \"welding_type\": \"角焊\",\n        \"welding_method\": \"CO2气保焊\",\n        \"weld_size\": \"焊缝高度6mm，长度按图纸要求\",\n        \"welding_position\": \"后弹簧固定板与左铲板后部两侧连接处，主要为平焊和立焊\",\n        \"quality_requirements\": \"焊缝饱满、连续，无气孔、夹渣、裂纹，焊后清理飞溅，外观整齐\",\n        \"safety_notes\": \"佩戴焊接面罩和防护手套，确保通风良好，焊机接地可靠\"\n      },\n      \"safety_warnings\": [\n        \"焊接时必须佩戴焊接面罩和防护手套，防止弧光灼伤和烫伤\",\n        \"焊接区域3米内不得有易燃物，现场配备灭火器\",\n        \"焊机要接地良好，防止漏电触电\",\n        \"焊接时注意通风，防止吸入有害烟尘\"\n      ]\n    },\n    {\n      \"step_number\": 7,\n      \"action\": \"焊接支撑固定板\",\n      \"description\": \"将图纸上标注为9的支撑固定板（BOM序号：9）放置在1号左铲板中部指定位置，点焊定位后满焊固定。\",\n      \"position_description\": \"支撑固定板位于左铲板中部偏下位置。\",\n      \"parts_used\": [\n        {\n          \"bom_seq\": \"9\",\n          \"bom_name\": \"支撑固定板\",\n          \"quantity\": 1,\n          \"drawing_number\": \"9\",\n          \"mesh_id\": [\n            \"mesh_011\"\n          ],\n          \"bom_code\": \"01.01.01.11525\"\n        }\n      ],\n      \"tools\": [\n        \"CO2焊机\",\n        \"焊条\",\n        \"夹具\"\n      ],\n      \"warnings\": [\n        \"焊接时注意防护\",\n        \"定位准确\"\n      ],\n      \"welding\": {\n        \"required\": true,\n        \"welding_type\": \"角焊\",\n        \"welding_method\": \"CO2气保焊\",\n        \"weld_size\": \"焊缝高度6mm，长度按图纸要求\",\n        \"welding_position\": \"支撑固定板与左铲板中部连接处，主要为平焊\",\n        \"quality_requirements\": \"焊缝饱满、连续，无气孔、夹渣、裂纹，焊后清理飞溅，外观整齐\",\n        \"safety_notes\": \"佩戴焊接面罩和防护手套，确保通风良好，焊机接地可靠\"\n      },\n      \"safety_warnings\": [\n        \"焊接时必须佩戴焊接面罩和防护手套，防止弧光灼伤和烫伤\",\n        \"焊接区域3米内不得有易燃物，现场配备灭火器\",\n        \"焊机要接地良好，防止漏电触电\",\n        \"焊接时注意通风，防止吸入有害烟尘\"\n      ]\n    },\n    {\n      \"step_number\": 8,\n      \"action\": \"焊接轴套加强板\",\n      \"description\": \"将图纸上标注为10的轴套加强板（BOM序号：10）分别放置在1号左铲板两端轴套安装位置，点焊定位后满焊固定。\",\n      \"position_description\": \"轴套加强板位于左铲板两端，作为轴套的加强支撑。\",\n      \"parts_used\": [\n        {\n          \"bom_seq\": \"10\",\n          \"bom_name\": \"轴套加强板\",\n          \"quantity\": 2,\n          \"drawing_number\": \"10\",\n          \"mesh_id\": [\n            \"mesh_009\",\n            \"mesh_010\"\n          ],\n          \"bom_code\": \"01.01.01.11526\"\n        }\n      ],\n      \"tools\": [\n        \"CO2焊机\",\n        \"焊条\",\n        \"夹具\"\n      ],\n      \"warnings\": [\n        \"两块板位置对称\",\n        \"焊接时注意防护\"\n      ],\n      \"welding\": {\n        \"required\": true,\n        \"welding_type\": \"角焊\",\n        \"welding_method\": \"CO2气保焊\",\n        \"weld_size\": \"焊缝高度6mm，长度按图纸要求\",\n        \"welding_position\": \"轴套加强板与左铲板两端连接处，主要为平焊和立焊\",\n        \"quality_requirements\": \"焊缝饱满、连续，无气孔、夹渣、裂纹，焊后清理飞溅，外观整齐\",\n        \"safety_notes\": \"佩戴焊接面罩和防护手套，确保通风良好，焊机接地可靠\"\n      },\n      \"safety_warnings\": [\n        \"焊接时必须佩戴焊接面罩和防护手套，防止弧光灼伤和烫伤\",\n        \"焊接区域3米内不得有易燃物，现场配备灭火器\",\n        \"焊机要接地良好，防止漏电触电\",\n        \"焊接时注意通风，防止吸入有害烟尘\"\n      ]\n    },\n    {\n      \"step_number\": 9,\n      \"action\": \"焊接反光片安装板\",\n      \"description\": \"将图纸上标注为11的反光片安装板（BOM序号：11）放置在1号左铲板上部指定位置，点焊定位后满焊固定。\",\n      \"position_description\": \"反光片安装板位于左铲板上部偏右位置。\",\n      \"parts_used\": [\n        {\n          \"bom_seq\": \"11\",\n          \"bom_name\": \"反光片安装板\",\n          \"quantity\": 1,\n          \"drawing_number\": \"11\",\n          \"mesh_id\": [\n            \"mesh_008\"\n          ],\n          \"bom_code\": \"01.01.01.11527\"\n        }\n      ],\n      \"tools\": [\n        \"CO2焊机\",\n        \"焊条\",\n        \"夹具\"\n      ],\n      \"warnings\": [\n        \"焊接时注意防护\",\n        \"定位准确\"\n      ],\n      \"welding\": {\n        \"required\": true,\n        \"welding_type\": \"角焊\",\n        \"welding_method\": \"CO2气保焊\",\n        \"weld_size\": \"焊缝高度6mm，长度按图纸要求\",\n        \"welding_position\": \"反光片安装板与左铲板上部连接处，主要为平焊\",\n        \"quality_requirements\": \"焊缝饱满、连续，无气孔、夹渣、裂纹，焊后清理飞溅，外观整齐\",\n        \"safety_notes\": \"佩戴焊接面罩和防护手套，确保通风良好，焊机接地可靠\"\n      },\n      \"safety_warnings\": [\n        \"焊接时必须佩戴焊接面罩和防护手套，防止弧光灼伤和烫伤\",\n        \"焊接区域3米内不得有易燃物，现场配备灭火器\",\n        \"焊机要接地良好，防止漏电触电\",\n        \"焊接时注意通风，防止吸入有害烟尘\"\n      ]\n    },\n    {\n      \"step_number\": 10,\n      \"action\": \"焊接轴套\",\n      \"description\": \"将图纸上标注为12的轴套（BOM序号：12）分别插入左铲板两端轴孔内，调整同轴度后点焊定位，再满焊固定。\",\n      \"position_description\": \"轴套分别位于左铲板两端，与轴孔同轴。\",\n      \"parts_used\": [\n        {\n          \"bom_seq\": \"12\",\n          \"bom_name\": \"轴套\",\n          \"quantity\": 2,\n          \"drawing_number\": \"12\"\n        }\n      ],\n      \"tools\": [\n        \"CO2焊机\",\n        \"焊条\",\n        \"千分尺\",\n        \"夹具\"\n      ],\n      \"warnings\": [\n        \"保证轴套同轴度\",\n        \"焊接时防止变形\"\n      ],\n      \"welding\": {\n        \"required\": true,\n        \"welding_type\": \"角焊\",\n        \"welding_method\": \"CO2气保焊\",\n        \"weld_size\": \"焊缝高度不超过轴套，按图纸4处焊接\",\n        \"welding_position\": \"轴套与左铲板两端轴孔连接处，主要为平焊和立焊\",\n        \"quality_requirements\": \"焊缝饱满、连续，无气孔、夹渣、裂纹，保证轴套同轴度，焊后清理飞溅\",\n        \"safety_notes\": \"佩戴焊接面罩和防护手套，确保通风良好，焊接时注意防止轴套变形，焊机接地可靠\"\n      },\n      \"safety_warnings\": [\n        \"焊接时必须佩戴焊接面罩和防护手套，防止弧光灼伤和烫伤\",\n        \"焊接区域3米内不得有易燃物，现场配备灭火器\",\n        \"焊机要接地良好，防止漏电触电\",\n        \"焊接时注意通风，防止吸入有害烟尘\"\n      ]\n    },\n    {\n      \"step_number\": 11,\n      \"action\": \"焊接方形板-机加\",\n      \"description\": \"将图纸上标注为2的方形板-机加（BOM序号：2）放置在左铲板底部中间指定位置，点焊定位后满焊固定。\",\n      \"position_description\": \"方形板-机加位于左铲板底部中间。\",\n      \"parts_used\": [\n        {\n          \"bom_seq\": \"2\",\n          \"bom_name\": \"方形板-机加\",\n          \"quantity\": 1,\n          \"drawing_number\": \"2\",\n          \"mesh_id\": [\n            \"mesh_025\"\n          ],\n          \"bom_code\": \"01.01.01.18599\"\n        }\n      ],\n      \"tools\": [\n        \"CO2焊机\",\n        \"焊条\",\n        \"夹具\"\n      ],\n      \"warnings\": [\n        \"焊接时注意防护\",\n        \"定位准确\"\n      ],\n      \"welding\": {\n        \"required\": true,\n        \"welding_type\": \"角焊\",\n        \"welding_method\": \"CO2气保焊\",\n        \"weld_size\": \"焊缝高度6mm，长度按图纸要求\",\n        \"welding_position\": \"方形板-机加与左铲板底部中间连接处，主要为平焊\",\n        \"quality_requirements\": \"焊缝饱满、连续，无气孔、夹渣、裂纹，焊后清理飞溅，外观整齐\",\n        \"safety_notes\": \"佩戴焊接面罩和防护手套，确保通风良好，焊机接地可靠\"\n      },\n      \"safety_warnings\": [\n        \"焊接时必须佩戴焊接面罩和防护手套，防止弧光灼伤和烫伤\",\n        \"焊接区域3米内不得有易燃物，现场配备灭火器\",\n        \"焊机要接地良好，防止漏电触电\",\n        \"焊接时注意通风，防止吸入有害烟尘\"\n      ]\n    },\n    {\n      \"step_number\": 12,\n      \"action\": \"焊接方形板1\",\n      \"description\": \"将图纸上标注为13的方形板1（BOM序号：13）放置在左铲板上部指定位置，点焊定位后满焊固定。\",\n      \"position_description\": \"方形板1位于左铲板上部靠近前侧。\",\n      \"parts_used\": [\n        {\n          \"bom_seq\": \"13\",\n          \"bom_name\": \"方形板 1\",\n          \"quantity\": 1,\n          \"drawing_number\": \"13\"\n        }\n      ],\n      \"tools\": [\n        \"CO2焊机\",\n        \"焊条\",\n        \"夹具\"\n      ],\n      \"warnings\": [\n        \"焊接时注意防护\",\n        \"定位准确\"\n      ],\n      \"welding\": {\n        \"required\": true,\n        \"welding_type\": \"角焊\",\n        \"welding_method\": \"CO2气保焊\",\n        \"weld_size\": \"焊缝高度6mm，长度按图纸要求\",\n        \"welding_position\": \"方形板1与左铲板上部靠前侧连接处，主要为平焊\",\n        \"quality_requirements\": \"焊缝饱满、连续，无气孔、夹渣、裂纹，焊后清理飞溅，外观整齐\",\n        \"safety_notes\": \"佩戴焊接面罩和防护手套，确保通风良好，焊机接地可靠\"\n      },\n      \"safety_warnings\": [\n        \"焊接时必须佩戴焊接面罩和防护手套，防止弧光灼伤和烫伤\",\n        \"焊接区域3米内不得有易燃物，现场配备灭火器\",\n        \"焊机要接地良好，防止漏电触电\",\n        \"焊接时注意通风，防止吸入有害烟尘\"\n      ]\n    },\n    {\n      \"step_number\": 13,\n      \"action\": \"焊接方形板3\",\n      \"description\": \"将图纸上标注为14的方形板3（BOM序号：14）依次放置在左铲板上部剩余3个指定位置，点焊定位后满焊固定。\",\n      \"position_description\": \"方形板3均匀分布在左铲板上部。\",\n      \"parts_used\": [\n        {\n          \"bom_seq\": \"14\",\n          \"bom_name\": \"方形板 3\",\n          \"quantity\": 3,\n          \"drawing_number\": \"14\",\n          \"mesh_id\": [\n            \"mesh_003\",\n            \"mesh_004\",\n            \"mesh_005\"\n          ],\n          \"bom_code\": \"01.01.01.11529\"\n        }\n      ],\n      \"tools\": [\n        \"CO2焊机\",\n        \"焊条\",\n        \"夹具\"\n      ],\n      \"warnings\": [\n        \"焊接时注意防护\",\n        \"位置均匀\"\n      ],\n      \"welding\": {\n        \"required\": true,\n        \"welding_type\": \"角焊\",\n        \"welding_method\": \"CO2气保焊\",\n        \"weld_size\": \"焊缝高度6mm，长度按图纸要求\",\n        \"welding_position\": \"方形板3与左铲板上部连接处，主要为平焊\",\n        \"quality_requirements\": \"焊缝饱满、连续，无气孔、夹渣、裂纹，焊后清理飞溅，外观整齐\",\n        \"safety_notes\": \"佩戴焊接面罩和防护手套，确保通风良好，焊机接地可靠\"\n      },\n      \"safety_warnings\": [\n        \"焊接时必须佩戴焊接面罩和防护手套，防止弧光灼伤和烫伤\",\n        \"焊接区域3米内不得有易燃物，现场配备灭火器\",\n        \"焊机要接地良好，防止漏电触电\",\n        \"焊接时注意通风，防止吸入有害烟尘\"\n      ]\n    },\n    {\n      \"step_number\": 14,\n      \"action\": \"焊接左铲雪板加强板\",\n      \"description\": \"将图纸上标注为15的左铲雪板加强板（BOM序号：15）分别放置在左铲板两侧加强位置，点焊定位后满焊固定。\",\n      \"position_description\": \"左铲雪板加强板位于左铲板两侧边缘。\",\n      \"parts_used\": [\n        {\n          \"bom_seq\": \"15\",\n          \"bom_name\": \"左铲雪板加强板 2\",\n          \"quantity\": 2,\n          \"drawing_number\": \"15\",\n          \"mesh_id\": [\n            \"mesh_001\",\n            \"mesh_002\"\n          ],\n          \"bom_code\": \"01.02.01.4983\"\n        }\n      ],\n      \"tools\": [\n        \"CO2焊机\",\n        \"焊条\",\n        \"夹具\"\n      ],\n      \"warnings\": [\n        \"两块板位置对称\",\n        \"焊接时注意防护\"\n      ],\n      \"welding\": {\n        \"required\": true,\n        \"welding_type\": \"角焊\",\n        \"welding_method\": \"CO2气保焊\",\n        \"weld_size\": \"焊缝高度6mm，长度按图纸要求\",\n        \"welding_position\": \"左铲雪板加强板与左铲板两侧边缘连接处，主要为立焊和部分平焊\",\n        \"quality_requirements\": \"焊缝饱满、连续，无气孔、夹渣、裂纹，焊后清理飞溅，外观整齐\",\n        \"safety_notes\": \"佩戴焊接面罩和防护手套，确保通风良好，焊机接地可靠\"\n      },\n      \"safety_warnings\": [\n        \"焊接时必须佩戴焊接面罩和防护手套，防止弧光灼伤和烫伤\",\n        \"焊接区域3米内不得有易燃物，现场配备灭火器\",\n        \"焊机要接地良好，防止漏电触电\",\n        \"焊接时注意通风，防止吸入有害烟尘\"\n      ]\n    }\n  ]\n}\n```",
  "parsed_result": {
    "enhanced_steps": [
      {
        "step_number": 1,
        "action": "放置基准件",
        "description": "将图纸上标注为1的左铲板（BOM序号：1）平放在装配平台上，作为整个装配的基准件，注意板面朝上，便于后续焊接。",
        "position_description": "左铲板为最底层基准件，其他零件均安装在其上或两侧。",
        "parts_used": [
          {
            "bom_seq": "1",
            "bom_name": "左铲板",
            "quantity": 1,
            "drawing_number": "1",
            "mesh_id": [
              "mesh_026"
            ],
            "bom_code": "01.01.01.18598"
          }
        ],
        "tools": [
          "行车",
          "吊带",
          "水平仪"
        ],
        "warnings": [
          "吊装时注意人员安全",
          "确保左铲板放置水平"
        ],
        "safety_warnings": [
          "吊装左铲板时，必须佩戴安全帽和安全鞋，防止吊物坠落砸伤",
          "吊带和行车使用前要检查完好，严禁超载吊装",
          "吊装过程中严禁站在吊物下方，防止意外坠落伤人",
          "放置时注意手指不要夹在重物和平台之间，防止夹伤"
        ]
      },
      {
        "step_number": 2,
        "action": "焊接后加强板",
        "description": "将图纸上标注为3的后加强板（BOM序号：3）贴合在1号左铲板的后侧定位槽内，点焊定位后满焊固定。",
        "position_description": "后加强板在左铲板的后侧，与板体后缘对齐。",
        "parts_used": [
          {
            "bom_seq": "3",
            "bom_name": "后加强板",
            "quantity": 1,
            "drawing_number": "3",
            "mesh_id": [
              "mesh_024"
            ],
            "bom_code": "01.01.01.11519"
          }
        ],
        "tools": [
          "CO2焊机",
          "焊条",
          "夹具"
        ],
        "warnings": [
          "焊接时注意防护",
          "点焊后检查位置再满焊"
        ],
        "welding": {
          "required": true,
          "welding_type": "角焊",
          "welding_method": "CO2气保焊",
          "weld_size": "焊缝高度6mm，长度按图纸要求",
          "welding_position": "后加强板与左铲板后侧连接处，主要为平焊和立焊",
          "quality_requirements": "焊缝饱满、连续，无气孔、夹渣、裂纹，焊后清理飞溅，外观整齐",
          "safety_notes": "佩戴焊接面罩和防护手套，确保通风良好，周围无易燃物，焊机接地可靠"
        },
        "safety_warnings": [
          "焊接时必须佩戴焊接面罩和防护手套，防止弧光灼伤和烫伤",
          "焊接区域3米内不得有易燃物，现场配备灭火器",
          "焊机要接地良好，防止漏电触电",
          "焊接时注意通风，防止吸入有害烟尘"
        ]
      },
      {
        "step_number": 3,
        "action": "焊接前加强板",
        "description": "将图纸上标注为4的前加强板（BOM序号：4）放置在1号左铲板的前侧定位槽内，点焊定位后满焊固定。",
        "position_description": "前加强板在左铲板的前侧，与板体前缘对齐。",
        "parts_used": [
          {
            "bom_seq": "4",
            "bom_name": "前加强板",
            "quantity": 1,
            "drawing_number": "4",
            "mesh_id": [
              "mesh_023"
            ],
            "bom_code": "01.01.01.18600"
          }
        ],
        "tools": [
          "CO2焊机",
          "焊条",
          "夹具"
        ],
        "warnings": [
          "焊接时注意防护",
          "点焊后检查位置再满焊"
        ],
        "welding": {
          "required": true,
          "welding_type": "角焊",
          "welding_method": "CO2气保焊",
          "weld_size": "焊缝高度6mm，长度按图纸要求",
          "welding_position": "前加强板与左铲板前侧连接处，主要为平焊和立焊",
          "quality_requirements": "焊缝饱满、连续，无气孔、夹渣、裂纹，焊后清理飞溅，外观整齐",
          "safety_notes": "佩戴焊接面罩和防护手套，确保通风良好，周围无易燃物，焊机接地可靠"
        },
        "safety_warnings": [
          "焊接时必须佩戴焊接面罩和防护手套，防止弧光灼伤和烫伤",
          "焊接区域3米内不得有易燃物，现场配备灭火器",
          "焊机要接地良好，防止漏电触电",
          "焊接时注意通风，防止吸入有害烟尘"
        ]
      },
      {
        "step_number": 4,
        "action": "焊接底部连接板",
        "description": "将图纸上标注为6的底部连接板（BOM序号：5）依次放置在1号左铲板底部的6个安装位置，点焊定位后满焊固定。",
        "position_description": "底部连接板均匀分布在左铲板底部，沿长度方向排列。",
        "parts_used": [
          {
            "bom_seq": "5",
            "bom_name": "底部连接板",
            "quantity": 6,
            "drawing_number": "6",
            "mesh_id": [
              "mesh_012",
              "mesh_013",
              "mesh_014",
              "mesh_015",
              "mesh_021",
              "mesh_022"
            ],
            "bom_code": "01.01.01.11521"
          }
        ],
        "tools": [
          "CO2焊机",
          "焊条",
          "夹具",
          "卷尺"
        ],
        "warnings": [
          "注意板间间距一致",
          "焊接时防止变形"
        ],
        "welding": {
          "required": true,
          "welding_type": "角焊",
          "welding_method": "CO2气保焊",
          "weld_size": "焊缝高度6mm，长度按图纸要求",
          "welding_position": "底部连接板与左铲板底部连接处，主要为平焊",
          "quality_requirements": "焊缝饱满、连续，无气孔、夹渣、裂纹，焊后清理飞溅，外观整齐，注意防止焊接变形",
          "safety_notes": "佩戴焊接面罩和防护手套，确保通风良好，焊接区域无杂物，焊机接地可靠"
        },
        "safety_warnings": [
          "焊接时必须佩戴焊接面罩和防护手套，防止弧光灼伤和烫伤",
          "焊接区域3米内不得有易燃物，现场配备灭火器",
          "焊机要接地良好，防止漏电触电",
          "焊接时注意通风，防止吸入有害烟尘"
        ]
      },
      {
        "step_number": 5,
        "action": "焊接前弹簧固定板",
        "description": "将图纸上标注为7的前弹簧固定板（BOM序号：7）放置在1号左铲板前部指定位置，点焊定位后满焊固定。",
        "position_description": "前弹簧固定板位于左铲板前部中间位置。",
        "parts_used": [
          {
            "bom_seq": "7",
            "bom_name": "前弹簧固定板",
            "quantity": 1,
            "drawing_number": "7",
            "mesh_id": [
              "mesh_018"
            ],
            "bom_code": "01.01.01.11523"
          }
        ],
        "tools": [
          "CO2焊机",
          "焊条",
          "夹具"
        ],
        "warnings": [
          "焊接时注意防护",
          "定位准确"
        ],
        "welding": {
          "required": true,
          "welding_type": "角焊",
          "welding_method": "CO2气保焊",
          "weld_size": "焊缝高度6mm，长度按图纸要求",
          "welding_position": "前弹簧固定板与左铲板前部连接处，主要为平焊",
          "quality_requirements": "焊缝饱满、连续，无气孔、夹渣、裂纹，焊后清理飞溅，外观整齐",
          "safety_notes": "佩戴焊接面罩和防护手套，确保通风良好，焊机接地可靠"
        },
        "safety_warnings": [
          "焊接时必须佩戴焊接面罩和防护手套，防止弧光灼伤和烫伤",
          "焊接区域3米内不得有易燃物，现场配备灭火器",
          "焊机要接地良好，防止漏电触电",
          "焊接时注意通风，防止吸入有害烟尘"
        ]
      },
      {
        "step_number": 6,
        "action": "焊接后弹簧固定板",
        "description": "将图纸上标注为8的后弹簧固定板（BOM序号：8）分别放置在1号左铲板后部两侧指定位置，点焊定位后满焊固定。",
        "position_description": "后弹簧固定板分布在左铲板后部两侧。",
        "parts_used": [
          {
            "bom_seq": "8",
            "bom_name": "后弹簧固定板",
            "quantity": 2,
            "drawing_number": "8",
            "mesh_id": [
              "mesh_016",
              "mesh_017"
            ],
            "bom_code": "01.01.01.11524"
          }
        ],
        "tools": [
          "CO2焊机",
          "焊条",
          "夹具"
        ],
        "warnings": [
          "两块板位置对称",
          "焊接时注意防护"
        ],
        "welding": {
          "required": true,
          "welding_type": "角焊",
          "welding_method": "CO2气保焊",
          "weld_size": "焊缝高度6mm，长度按图纸要求",
          "welding_position": "后弹簧固定板与左铲板后部两侧连接处，主要为平焊和立焊",
          "quality_requirements": "焊缝饱满、连续，无气孔、夹渣、裂纹，焊后清理飞溅，外观整齐",
          "safety_notes": "佩戴焊接面罩和防护手套，确保通风良好，焊机接地可靠"
        },
        "safety_warnings": [
          "焊接时必须佩戴焊接面罩和防护手套，防止弧光灼伤和烫伤",
          "焊接区域3米内不得有易燃物，现场配备灭火器",
          "焊机要接地良好，防止漏电触电",
          "焊接时注意通风，防止吸入有害烟尘"
        ]
      },
      {
        "step_number": 7,
        "action": "焊接支撑固定板",
        "description": "将图纸上标注为9的支撑固定板（BOM序号：9）放置在1号左铲板中部指定位置，点焊定位后满焊固定。",
        "position_description": "支撑固定板位于左铲板中部偏下位置。",
        "parts_used": [
          {
            "bom_seq": "9",
            "bom_name": "支撑固定板",
            "quantity": 1,
            "drawing_number": "9",
            "mesh_id": [
              "mesh_011"
            ],
            "bom_code": "01.01.01.11525"
          }
        ],
        "tools": [
          "CO2焊机",
          "焊条",
          "夹具"
        ],
        "warnings": [
          "焊接时注意防护",
          "定位准确"
        ],
        "welding": {
          "required": true,
          "welding_type": "角焊",
          "welding_method": "CO2气保焊",
          "weld_size": "焊缝高度6mm，长度按图纸要求",
          "welding_position": "支撑固定板与左铲板中部连接处，主要为平焊",
          "quality_requirements": "焊缝饱满、连续，无气孔、夹渣、裂纹，焊后清理飞溅，外观整齐",
          "safety_notes": "佩戴焊接面罩和防护手套，确保通风良好，焊机接地可靠"
        },
        "safety_warnings": [
          "焊接时必须佩戴焊接面罩和防护手套，防止弧光灼伤和烫伤",
          "焊接区域3米内不得有易燃物，现场配备灭火器",
          "焊机要接地良好，防止漏电触电",
          "焊接时注意通风，防止吸入有害烟尘"
        ]
      },
      {
        "step_number": 8,
        "action": "焊接轴套加强板",
        "description": "将图纸上标注为10的轴套加强板（BOM序号：10）分别放置在1号左铲板两端轴套安装位置，点焊定位后满焊固定。",
        "position_description": "轴套加强板位于左铲板两端，作为轴套的加强支撑。",
        "parts_used": [
          {
            "bom_seq": "10",
            "bom_name": "轴套加强板",
            "quantity": 2,
            "drawing_number": "10",
            "mesh_id": [
              "mesh_009",
              "mesh_010"
            ],
            "bom_code": "01.01.01.11526"
          }
        ],
        "tools": [
          "CO2焊机",
          "焊条",
          "夹具"
        ],
        "warnings": [
          "两块板位置对称",
          "焊接时注意防护"
        ],
        "welding": {
          "required": true,
          "welding_type": "角焊",
          "welding_method": "CO2气保焊",
          "weld_size": "焊缝高度6mm，长度按图纸要求",
          "welding_position": "轴套加强板与左铲板两端连接处，主要为平焊和立焊",
          "quality_requirements": "焊缝饱满、连续，无气孔、夹渣、裂纹，焊后清理飞溅，外观整齐",
          "safety_notes": "佩戴焊接面罩和防护手套，确保通风良好，焊机接地可靠"
        },
        "safety_warnings": [
          "焊接时必须佩戴焊接面罩和防护手套，防止弧光灼伤和烫伤",
          "焊接区域3米内不得有易燃物，现场配备灭火器",
          "焊机要接地良好，防止漏电触电",
          "焊接时注意通风，防止吸入有害烟尘"
        ]
      },
      {
        "step_number": 9,
        "action": "焊接反光片安装板",
        "description": "将图纸上标注为11的反光片安装板（BOM序号：11）放置在1号左铲板上部指定位置，点焊定位后满焊固定。",
        "position_description": "反光片安装板位于左铲板上部偏右位置。",
        "parts_used": [
          {
            "bom_seq": "11",
            "bom_name": "反光片安装板",
            "quantity": 1,
            "drawing_number": "11",
            "mesh_id": [
              "mesh_008"
            ],
            "bom_code": "01.01.01.11527"
          }
        ],
        "tools": [
          "CO2焊机",
          "焊条",
          "夹具"
        ],
        "warnings": [
          "焊接时注意防护",
          "定位准确"
        ],
        "welding": {
          "required": true,
          "welding_type": "角焊",
          "welding_method": "CO2气保焊",
          "weld_size": "焊缝高度6mm，长度按图纸要求",
          "welding_position": "反光片安装板与左铲板上部连接处，主要为平焊",
          "quality_requirements": "焊缝饱满、连续，无气孔、夹渣、裂纹，焊后清理飞溅，外观整齐",
          "safety_notes": "佩戴焊接面罩和防护手套，确保通风良好，焊机接地可靠"
        },
        "safety_warnings": [
          "焊接时必须佩戴焊接面罩和防护手套，防止弧光灼伤和烫伤",
          "焊接区域3米内不得有易燃物，现场配备灭火器",
          "焊机要接地良好，防止漏电触电",
          "焊接时注意通风，防止吸入有害烟尘"
        ]
      },
      {
        "step_number": 10,
        "action": "焊接轴套",
        "description": "将图纸上标注为12的轴套（BOM序号：12）分别插入左铲板两端轴孔内，调整同轴度后点焊定位，再满焊固定。",
        "position_description": "轴套分别位于左铲板两端，与轴孔同轴。",
        "parts_used": [
          {
            "bom_seq": "12",
            "bom_name": "轴套",
            "quantity": 2,
            "drawing_number": "12"
          }
        ],
        "tools": [
          "CO2焊机",
          "焊条",
          "千分尺",
          "夹具"
        ],
        "warnings": [
          "保证轴套同轴度",
          "焊接时防止变形"
        ],
        "welding": {
          "required": true,
          "welding_type": "角焊",
          "welding_method": "CO2气保焊",
          "weld_size": "焊缝高度不超过轴套，按图纸4处焊接",
          "welding_position": "轴套与左铲板两端轴孔连接处，主要为平焊和立焊",
          "quality_requirements": "焊缝饱满、连续，无气孔、夹渣、裂纹，保证轴套同轴度，焊后清理飞溅",
          "safety_notes": "佩戴焊接面罩和防护手套，确保通风良好，焊接时注意防止轴套变形，焊机接地可靠"
        },
        "safety_warnings": [
          "焊接时必须佩戴焊接面罩和防护手套，防止弧光灼伤和烫伤",
          "焊接区域3米内不得有易燃物，现场配备灭火器",
          "焊机要接地良好，防止漏电触电",
          "焊接时注意通风，防止吸入有害烟尘"
        ]
      },
      {
        "step_number": 11,
        "action": "焊接方形板-机加",
        "description": "将图纸上标注为2的方形板-机加（BOM序号：2）放置在左铲板底部中间指定位置，点焊定位后满焊固定。",
        "position_description": "方形板-机加位于左铲板底部中间。",
        "parts_used": [
          {
            "bom_seq": "2",
            "bom_name": "方形板-机加",
            "quantity": 1,
            "drawing_number": "2",
            "mesh_id": [
              "mesh_025"
            ],
            "bom_code": "01.01.01.18599"
          }
        ],
        "tools": [
          "CO2焊机",
          "焊条",
          "夹具"
        ],
        "warnings": [
          "焊接时注意防护",
          "定位准确"
        ],
        "welding": {
          "required": true,
          "welding_type": "角焊",
          "welding_method": "CO2气保焊",
          "weld_size": "焊缝高度6mm，长度按图纸要求",
          "welding_position": "方形板-机加与左铲板底部中间连接处，主要为平焊",
          "quality_requirements": "焊缝饱满、连续，无气孔、夹渣、裂纹，焊后清理飞溅，外观整齐",
          "safety_notes": "佩戴焊接面罩和防护手套，确保通风良好，焊机接地可靠"
        },
        "safety_warnings": [
          "焊接时必须佩戴焊接面罩和防护手套，防止弧光灼伤和烫伤",
          "焊接区域3米内不得有易燃物，现场配备灭火器",
          "焊机要接地良好，防止漏电触电",
          "焊接时注意通风，防止吸入有害烟尘"
        ]
      },
      {
        "step_number": 12,
        "action": "焊接方形板1",
        "description": "将图纸上标注为13的方形板1（BOM序号：13）放置在左铲板上部指定位置，点焊定位后满焊固定。",
        "position_description": "方形板1位于左铲板上部靠近前侧。",
        "parts_used": [
          {
            "bom_seq": "13",
            "bom_name": "方形板 1",
            "quantity": 1,
            "drawing_number": "13"
          }
        ],
        "tools": [
          "CO2焊机",
          "焊条",
          "夹具"
        ],
        "warnings": [
          "焊接时注意防护",
          "定位准确"
        ],
        "welding": {
          "required": true,
          "welding_type": "角焊",
          "welding_method": "CO2气保焊",
          "weld_size": "焊缝高度6mm，长度按图纸要求",
          "welding_position": "方形板1与左铲板上部靠前侧连接处，主要为平焊",
          "quality_requirements": "焊缝饱满、连续，无气孔、夹渣、裂纹，焊后清理飞溅，外观整齐",
          "safety_notes": "佩戴焊接面罩和防护手套，确保通风良好，焊机接地可靠"
        },
        "safety_warnings": [
          "焊接时必须佩戴焊接面罩和防护手套，防止弧光灼伤和烫伤",
          "焊接区域3米内不得有易燃物，现场配备灭火器",
          "焊机要接地良好，防止漏电触电",
          "焊接时注意通风，防止吸入有害烟尘"
        ]
      },
      {
        "step_number": 13,
        "action": "焊接方形板3",
        "description": "将图纸上标注为14的方形板3（BOM序号：14）依次放置在左铲板上部剩余3个指定位置，点焊定位后满焊固定。",
        "position_description": "方形板3均匀分布在左铲板上部。",
        "parts_used": [
          {
            "bom_seq": "14",
            "bom_name": "方形板 3",
            "quantity": 3,
            "drawing_number": "14",
            "mesh_id": [
              "mesh_003",
              "mesh_004",
              "mesh_005"
            ],
            "bom_code": "01.01.01.11529"
          }
        ],
        "tools": [
          "CO2焊机",
          "焊条",
          "夹具"
        ],
        "warnings": [
          "焊接时注意防护",
          "位置均匀"
        ],
        "welding": {
          "required": true,
          "welding_type": "角焊",
          "welding_method": "CO2气保焊",
          "weld_size": "焊缝高度6mm，长度按图纸要求",
          "welding_position": "方形板3与左铲板上部连接处，主要为平焊",
          "quality_requirements": "焊缝饱满、连续，无气孔、夹渣、裂纹，焊后清理飞溅，外观整齐",
          "safety_notes": "佩戴焊接面罩和防护手套，确保通风良好，焊机接地可靠"
        },
        "safety_warnings": [
          "焊接时必须佩戴焊接面罩和防护手套，防止弧光灼伤和烫伤",
          "焊接区域3米内不得有易燃物，现场配备灭火器",
          "焊机要接地良好，防止漏电触电",
          "焊接时注意通风，防止吸入有害烟尘"
        ]
      },
      {
        "step_number": 14,
        "action": "焊接左铲雪板加强板",
        "description": "将图纸上标注为15的左铲雪板加强板（BOM序号：15）分别放置在左铲板两侧加强位置，点焊定位后满焊固定。",
        "position_description": "左铲雪板加强板位于左铲板两侧边缘。",
        "parts_used": [
          {
            "bom_seq": "15",
            "bom_name": "左铲雪板加强板 2",
            "quantity": 2,
            "drawing_number": "15",
            "mesh_id": [
              "mesh_001",
              "mesh_002"
            ],
            "bom_code": "01.02.01.4983"
          }
        ],
        "tools": [
          "CO2焊机",
          "焊条",
          "夹具"
        ],
        "warnings": [
          "两块板位置对称",
          "焊接时注意防护"
        ],
        "welding": {
          "required": true,
          "welding_type": "角焊",
          "welding_method": "CO2气保焊",
          "weld_size": "焊缝高度6mm，长度按图纸要求",
          "welding_position": "左铲雪板加强板与左铲板两侧边缘连接处，主要为立焊和部分平焊",
          "quality_requirements": "焊缝饱满、连续，无气孔、夹渣、裂纹，焊后清理飞溅，外观整齐",
          "safety_notes": "佩戴焊接面罩和防护手套，确保通风良好，焊机接地可靠"
        },
        "safety_warnings": [
          "焊接时必须佩戴焊接面罩和防护手套，防止弧光灼伤和烫伤",
          "焊接区域3米内不得有易燃物，现场配备灭火器",
          "焊机要接地良好，防止漏电触电",
          "焊接时注意通风，防止吸入有害烟尘"
        ]
      }
    ]
  }
}