{
  "agent_name": "Agent6_FAQ",
  "model": "google/gemini-2.5-flash-preview-09-2025",
  "timestamp": "20251005_140444",
  "image_count": 0,
  "temperature": 0.2,
  "system_prompt": "# 角色定位\n\n你是**李师傅**，一位拥有20年安全管理经验的高级安全工程师。\n\n## 教育背景\n\n- **学历**：安全工程专业本科\n- **职业资格**：注册安全工程师、高级安全评价师\n- **专业培训**：\n  - 机械制造安全管理\n  - 职业健康与安全管理体系（ISO 45001）\n  - 事故调查与分析\n  - 应急预案编制与演练\n\n## 职业背景\n\n- **工作经历**：20年机械制造企业安全管理经验，参与过大型装备制造、钢结构加工等项目\n- **专业领域**：\n  - 机械加工安全（车、铣、刨、磨、钻等）\n  - 焊接作业安全（电焊、气焊、氩弧焊等）\n  - 起重吊装安全（行车、叉车、吊索具等）\n  - 高空作业安全（脚手架、安全带、防坠落等）\n  - 个人防护用品管理（安全帽、防护眼镜、手套、安全鞋等）\n\n## 知识结构（详细）\n\n### 1. 机械伤害风险\n- **夹伤/挤伤**：手指、手臂被运动部件夹住\n- **切割伤**：锋利边缘、毛刺、切削工具\n- **碰撞伤**：头部碰撞、身体碰撞\n- **坠落伤**：零件坠落、工具坠落、人员坠落\n\n### 2. 焊接作业风险\n- **电击伤**：焊机漏电、接地不良\n- **弧光伤**：电弧紫外线灼伤眼睛和皮肤\n- **烫伤**：高温熔池、焊渣飞溅\n- **火灾爆炸**：易燃物引燃、气瓶泄漏\n- **有毒气体**：焊接烟尘、一氧化碳中毒\n\n### 3. 起重吊装风险\n- **吊物坠落**：吊索具断裂、捆绑不牢\n- **吊物摆动**：碰撞人员、设备\n- **超载**：超过起重机额定载荷\n- **指挥失误**：信号不清、违章指挥\n\n### 4. 高空作业风险\n- **人员坠落**：未系安全带、脚手架不牢\n- **物体打击**：工具、零件从高处坠落\n- **脚手架坍塌**：搭设不规范、超载\n\n### 5. 个人防护用品\n- **头部防护**：安全帽（防止碰撞、坠物打击）\n- **眼部防护**：防护眼镜、焊接面罩（防止飞溅、弧光）\n- **手部防护**：防护手套（防止切割、烫伤、化学品）\n- **足部防护**：安全鞋（防砸、防刺穿、防滑）\n- **呼吸防护**：防尘口罩、防毒面具（防止粉尘、有毒气体）\n\n### 6. 应急处理\n- **机械伤害**：立即停机、呼救、止血、固定、送医\n- **电击伤**：切断电源、心肺复苏、送医\n- **烫伤**：冷水冲洗、覆盖无菌纱布、送医\n- **火灾**：使用灭火器、疏散人员、报警\n\n## 任务步骤（Chain of Thought）\n\n你的任务是**为每个装配步骤添加安全警告**（如果该步骤有安全风险）。请按照以下5个步骤思考：\n\n### 步骤1：识别风险步骤\n- 分析每个装配步骤的操作内容\n- 判断是否涉及高风险作业（焊接、吊装、高空、重物搬运等）\n- 识别潜在的伤害类型（机械伤害、电击、烫伤、坠落等）\n\n### 步骤2：分析风险源\n- 确定风险的来源（设备、工具、材料、环境、人员操作等）\n- 评估风险的严重程度（轻微、中等、严重、致命）\n- 考虑风险的发生概率\n\n### 步骤3：制定预防措施\n- 针对每个风险源，制定具体的预防措施\n- 强调个人防护用品的使用\n- 强调安全操作规程的遵守\n\n### 步骤4：添加安全警告\n- 为每个有风险的步骤添加safety_warnings字段\n- 每条警告要简洁明了，说明具体的风险和预防措施\n- 使用工人能看懂的语言\n\n### 步骤5：验证完整性\n- 检查所有高风险步骤是否都添加了安全警告\n- 检查安全警告是否具体、可操作\n- 检查是否遗漏了任何潜在风险\n\n## 核心原则\n\n1. **步骤级嵌入**：为每个有风险的步骤添加safety_warnings字段，而不是单独列出安全警告\n2. **工人友好**：使用通俗语言，避免专业术语\n3. **具体可操作**：说明具体的风险和预防措施，而不是泛泛而谈\n4. **不重复显示**：安全警告只在下方\"安全\"标签页中统一显示，不在当前步骤详情中重复显示\n\n## 输出格式\n\n严格按照以下JSON格式输出（返回增强后的装配步骤）：\n\n```json\n{\n  \"enhanced_steps\": [\n    {\n      \"step_number\": 1,\n      \"title\": \"点焊定位\",\n      \"parts_used\": [...],\n      \"tools_required\": [...],\n      \"operation\": \"操作说明\",\n      \"quality_check\": \"质量检查\",\n      \"estimated_time_minutes\": 10,\n      \"welding\": {\n        \"required\": true,\n        \"welding_type\": \"点焊\",\n        \"welding_method\": \"CO2气保焊\",\n        ...\n      },\n      \"safety_warnings\": [\n        \"佩戴焊接面罩和防护手套，防止弧光灼伤眼睛和皮肤\",\n        \"确保工件夹紧牢固，防止点焊时位移造成伤害\",\n        \"焊接区域周围3米内不得有易燃物，配备灭火器\",\n        \"焊机必须接地良好，防止漏电触电\"\n      ]\n    },\n    {\n      \"step_number\": 2,\n      \"title\": \"螺栓连接\",\n      \"parts_used\": [...],\n      \"operation\": \"操作说明\",\n      \"quality_check\": \"质量检查\",\n      \"estimated_time_minutes\": 15,\n      \"safety_warnings\": [\n        \"佩戴安全帽和防护眼镜，防止零件坠落和飞溅\",\n        \"使用扭力扳手时注意力度，防止扳手滑脱伤人\"\n      ]\n    },\n    {\n      \"step_number\": 3,\n      \"title\": \"简单装配\",\n      \"parts_used\": [...],\n      \"operation\": \"操作说明\",\n      \"quality_check\": \"质量检查\",\n      \"estimated_time_minutes\": 5\n      // ⚠️ 如果没有明显安全风险，不添加safety_warnings字段\n    }\n  ]\n}\n```\n\n**⚠️ 关键要求**：\n\n1. **步骤级嵌入**：\n   - 为每个有风险的步骤添加`safety_warnings`字段\n   - 没有明显风险的步骤不添加`safety_warnings`字段\n   - 保持原有步骤的所有字段不变\n\n2. **安全警告要具体**：\n   - ✅ 说\"佩戴焊接面罩和防护手套，防止弧光灼伤眼睛和皮肤\"\n   - ❌ 不说\"注意安全\"\n   - ✅ 说\"焊接区域周围3米内不得有易燃物，配备灭火器\"\n   - ❌ 不说\"注意防火\"\n\n3. **使用通俗语言**：\n   - 工人能看懂的语言\n   - 避免专业术语和英文缩写\n\n4. **警告要全面**：\n   - 涵盖个人防护、设备安全、环境安全、操作安全\n   - 每条警告说明具体的风险和预防措施\n\n## 重要提醒\n\n- **只输出JSON，不要输出其他内容**\n- **保持原有字段不变**：不要修改或删除原有的字段（包括welding字段）\n- **警告要简洁明了**：每条警告一句话，说明风险和预防措施\n- **不要过度警告**：只针对有明显风险的步骤添加警告\n",
  "user_query": "请为以下装配步骤添加安全警告（如果有安全风险）。\n\n## 📸 视觉分析任务\n\n**你会看到工程图纸图片，请仔细观察：**\n\n1. **危险作业标识**：\n   - 图纸上的安全警告标识\n   - 特殊作业要求（如高空作业、吊装作业等）\n   - 危险区域标注\n\n2. **零件特征**：\n   - 重型零件（需要吊装）\n   - 锋利边缘（容易割伤）\n   - 高温部件（容易烫伤）\n\n3. **作业环境**：\n   - 狭窄空间（容易碰撞）\n   - 高空位置（容易坠落）\n   - 密闭空间（通风不良）\n\n## 装配步骤\n\n[\n  {\n    \"step_number\": 1,\n    \"action\": \"放置基准件\",\n    \"description\": \"将图纸上标注为1的方形板-机加（01.01.01.11511）平稳放置在装配工作台上，作为整个组件的装配基准。\",\n    \"position_description\": \"平放于工作台，确保水平。\",\n    \"parts_used\": [\n      {\n        \"bom_seq\": \"1\",\n        \"bom_name\": \"方形板-机加 1\",\n        \"quantity\": 1,\n        \"drawing_number\": \"1\",\n        \"mesh_id\": [\n          \"mesh_018\"\n        ],\n        \"bom_code\": \"01.01.01.11511\"\n      }\n    ],\n    \"tools\": [\n      \"行车\",\n      \"吊具\",\n      \"水平仪\"\n    ],\n    \"warnings\": [\n      \"注意吊装安全，防止零件跌落或倾倒。\"\n    ]\n  },\n  {\n    \"step_number\": 2,\n    \"action\": \"安装上连接板\",\n    \"description\": \"将图纸上标注为2的上连接板（01.01.01.11512）焊接到1号方形板的上边缘。注意上连接板的数量为2件，分别焊接到方形板的左右两侧上边缘。\",\n    \"position_description\": \"焊接到1号方形板的左右两侧上边缘，确保与方形板垂直。\",\n    \"parts_used\": [\n      {\n        \"bom_seq\": \"2\",\n        \"bom_name\": \"上连接板 2\",\n        \"quantity\": 2,\n        \"drawing_number\": \"2\",\n        \"mesh_id\": [\n          \"mesh_016\",\n          \"mesh_017\"\n        ],\n        \"bom_code\": \"01.01.01.11512\"\n      }\n    ],\n    \"tools\": [\n      \"焊机\",\n      \"角尺\",\n      \"磁力夹具\"\n    ],\n    \"warnings\": [\n      \"焊接前需点焊定位，确保两块上连接板的相对位置和垂直度符合图纸要求。\"\n    ],\n    \"welding\": {\n      \"required\": true,\n      \"welding_type\": \"角焊\",\n      \"welding_method\": \"CO2气保焊（MAG）\",\n      \"weld_size\": \"焊脚高度5mm（图纸标注）\",\n      \"welding_position\": \"零件1（方形板）与零件2（上连接板）的连接处，平焊\",\n      \"quality_requirements\": \"焊缝连续、饱满，外观平整，不允许有气孔、夹渣、裂纹等缺陷。焊后进行外观检查。\",\n      \"safety_notes\": \"佩戴焊接面罩、防护手套和防护服。确保工作区域通风良好，远离易燃易爆物品。检查焊机接地线是否牢固。\"\n    }\n  },\n  {\n    \"step_number\": 3,\n    \"action\": \"安装侧连接板\",\n    \"description\": \"将图纸上标注为3的侧连接板（01.01.01.11513）焊接到1号方形板的侧面。侧连接板数量为2件，分别焊接到方形板的左右两侧。\",\n    \"position_description\": \"焊接到1号方形板的左右两侧，与2号上连接板形成一个U型结构。\",\n    \"parts_used\": [\n      {\n        \"bom_seq\": \"3\",\n        \"bom_name\": \"侧连接板 2\",\n        \"quantity\": 2,\n        \"drawing_number\": \"3\",\n        \"mesh_id\": [\n          \"mesh_014\",\n          \"mesh_015\"\n        ],\n        \"bom_code\": \"01.01.01.11513\"\n      }\n    ],\n    \"tools\": [\n      \"焊机\",\n      \"角尺\"\n    ],\n    \"warnings\": [\n      \"侧连接板与上连接板的焊缝应连续饱满，确保结构强度。\"\n    ],\n    \"welding\": {\n      \"required\": true,\n      \"welding_type\": \"角焊\",\n      \"welding_method\": \"CO2气保焊（MAG）\",\n      \"weld_size\": \"焊脚高度5mm（图纸标注）\",\n      \"welding_position\": \"零件1（方形板）与零件3（侧连接板）的连接处，以及零件2与零件3的连接处。主要为平焊和横焊。\",\n      \"quality_requirements\": \"焊缝连续，焊脚尺寸符合要求。注意控制焊接变形，采用分段、对称焊接顺序。焊后进行外观检查。\",\n      \"safety_notes\": \"焊接时注意防止火花飞溅，特别是对周围的电缆和设备。保持身体干燥，避免触电。\"\n    }\n  },\n  {\n    \"step_number\": 4,\n    \"action\": \"安装折弯板\",\n    \"description\": \"将图纸上标注为4的折弯板（01.01.01.11514）焊接到主体结构上。根据图纸，折弯板位于主体结构的顶部中央位置。\",\n    \"position_description\": \"焊接到2号上连接板和3号侧连接板围成的顶部区域，位于中央。\",\n    \"parts_used\": [\n      {\n        \"bom_seq\": \"4\",\n        \"bom_name\": \"折弯板 1\",\n        \"quantity\": 1,\n        \"drawing_number\": \"4\",\n        \"mesh_id\": [\n          \"mesh_013\"\n        ],\n        \"bom_code\": \"01.01.01.11514\"\n      }\n    ],\n    \"tools\": [\n      \"焊机\"\n    ],\n    \"warnings\": [\n      \"折弯板的定位应准确，确保其孔位与后续安装的零件对齐。\"\n    ],\n    \"welding\": {\n      \"required\": true,\n      \"welding_type\": \"角焊\",\n      \"welding_method\": \"CO2气保焊（MAG）\",\n      \"weld_size\": \"焊脚高度5mm（图纸标注）\",\n      \"welding_position\": \"零件4（折弯板）与零件2和零件3的连接处，主要为平焊。\",\n      \"quality_requirements\": \"焊缝连续，定位准确。焊缝表面应光滑，过渡圆滑，不允许有咬边现象。\",\n      \"safety_notes\": \"高处作业时，确保站稳，防止坠落。焊接过程中，注意焊烟的排放，使用局部排风设备。\"\n    }\n  },\n  {\n    \"step_number\": 5,\n    \"action\": \"安装油缸固定板\",\n    \"description\": \"将图纸上标注为5的油缸固定板（01.01.01.11515）焊接到3号侧连接板的外侧。油缸固定板数量为4件，每侧侧连接板上焊接2件。\",\n    \"position_description\": \"焊接到左右两侧的3号侧连接板上，注意其安装方向和孔位朝向，需与图纸所示一致。\",\n    \"parts_used\": [\n      {\n        \"bom_seq\": \"5\",\n        \"bom_name\": \"油缸固定板 4\",\n        \"quantity\": 4,\n        \"drawing_number\": \"5\",\n        \"mesh_id\": [\n          \"mesh_002\",\n          \"mesh_003\",\n          \"mesh_011\",\n          \"mesh_012\"\n        ],\n        \"bom_code\": \"01.01.01.11515\"\n      }\n    ],\n    \"tools\": [\n      \"焊机\",\n      \"卡尺\"\n    ],\n    \"warnings\": [\n      \"油缸固定板的相对位置精度要求较高，需使用卡尺或专用工装定位。\"\n    ],\n    \"welding\": {\n      \"required\": true,\n      \"welding_type\": \"角焊\",\n      \"welding_method\": \"CO2气保焊（MAG）\",\n      \"weld_size\": \"焊脚高度5mm（图纸标注）\",\n      \"welding_position\": \"零件5（油缸固定板）与零件3（侧连接板）的连接处，主要为立焊和横焊。\",\n      \"quality_requirements\": \"焊缝连续，焊脚尺寸均匀。由于精度要求高，焊接后需检查孔位中心距和垂直度。焊缝不允许有未熔合、未焊透。\",\n      \"safety_notes\": \"立焊和横焊时，注意控制熔池温度，防止焊渣烫伤。焊接前确保定位工装夹紧可靠。\"\n    }\n  },\n  {\n    \"step_number\": 6,\n    \"action\": \"安装加强板\",\n    \"description\": \"将图纸上标注为6的加强板（01.01.01.11516）焊接到主体结构上。加强板数量为4件，用于增强侧连接板的刚性。\",\n    \"position_description\": \"根据图纸，加强板焊接在3号侧连接板的内侧或外侧，靠近油缸固定板的位置。\",\n    \"parts_used\": [\n      {\n        \"bom_seq\": \"6\",\n        \"bom_name\": \"加强板 4\",\n        \"quantity\": 4,\n        \"drawing_number\": \"6\",\n        \"mesh_id\": [\n          \"mesh_007\",\n          \"mesh_008\",\n          \"mesh_009\",\n          \"mesh_010\"\n        ],\n        \"bom_code\": \"01.01.01.11516\"\n      }\n    ],\n    \"tools\": [\n      \"焊机\"\n    ],\n    \"warnings\": [\n      \"加强板的焊缝应连续，避免虚焊。\"\n    ],\n    \"welding\": {\n      \"required\": true,\n      \"welding_type\": \"角焊\",\n      \"welding_method\": \"CO2气保焊（MAG）\",\n      \"weld_size\": \"焊脚高度5mm（图纸标注）\",\n      \"welding_position\": \"零件6（加强板）与零件3（侧连接板）的连接处，主要为平焊和立焊。\",\n      \"quality_requirements\": \"焊缝连续，焊脚尺寸均匀。加强板主要用于承载，焊缝必须保证强度，焊后进行外观检查。\",\n      \"safety_notes\": \"焊接加强板时，注意结构内部空间狭小，防止电弧光灼伤皮肤。确保焊枪和电缆绝缘良好。\"\n    }\n  },\n  {\n    \"step_number\": 7,\n    \"action\": \"安装角钢\",\n    \"description\": \"将图纸上标注为7的角钢-机加（01.01.04.0592）焊接到主体结构上。角钢数量为1件。\",\n    \"position_description\": \"角钢位于主体结构顶部，靠近折弯板4的位置，用于连接和支撑。\",\n    \"parts_used\": [\n      {\n        \"bom_seq\": \"7\",\n        \"bom_name\": \"角钢-机加 1\",\n        \"quantity\": 1,\n        \"drawing_number\": \"7\",\n        \"mesh_id\": [\n          \"mesh_006\"\n        ],\n        \"bom_code\": \"01.01.04.0592\"\n      }\n    ],\n    \"tools\": [\n      \"焊机\"\n    ],\n    \"warnings\": [\n      \"角钢的焊接位置和角度需严格按照图纸尺寸进行。\"\n    ],\n    \"welding\": {\n      \"required\": true,\n      \"welding_type\": \"角焊\",\n      \"welding_method\": \"CO2气保焊（MAG）\",\n      \"weld_size\": \"焊脚高度5mm（图纸标注）\",\n      \"welding_position\": \"零件7（角钢）与零件2（上连接板）和零件4（折弯板）的连接处，主要为平焊。\",\n      \"quality_requirements\": \"焊缝连续，定位准确。焊缝外观要求高，需打磨平整（如果图纸有要求）。\",\n      \"safety_notes\": \"焊接前清理角钢表面的油污和锈蚀，防止产生气孔。注意焊枪角度，确保焊透。\"\n    }\n  },\n  {\n    \"step_number\": 8,\n    \"action\": \"安装轴套（大）\",\n    \"description\": \"将图纸上标注为8的轴套（01.01.02.1221）焊接到主体结构上。轴套数量为1件。\",\n    \"position_description\": \"轴套8位于主体结构的一侧，靠近顶部，用于销轴连接。\",\n    \"parts_used\": [\n      {\n        \"bom_seq\": \"8\",\n        \"bom_name\": \"轴套 1\",\n        \"quantity\": 1,\n        \"drawing_number\": \"8\"\n      }\n    ],\n    \"tools\": [\n      \"焊机\",\n      \"定位工装\"\n    ],\n    \"warnings\": [\n      \"轴套的轴线方向必须与图纸要求平行或垂直，使用定位工装确保精度。\"\n    ],\n    \"welding\": {\n      \"required\": true,\n      \"welding_type\": \"角焊/环焊\",\n      \"welding_method\": \"手工电弧焊（SMAW）或CO2气保焊（MAG）\",\n      \"weld_size\": \"焊脚高度5mm，环形连续焊缝\",\n      \"welding_position\": \"零件8（轴套）与侧连接板的连接处，主要为横焊或立焊。\",\n      \"quality_requirements\": \"焊缝必须连续，全焊透。轴套焊接后，需严格检查其轴线与基准面的平行度/垂直度。焊后可能需要进行无损检测（如磁粉检测）。\",\n      \"safety_notes\": \"轴套焊接时，由于零件较厚，可能需要预热，防止产生裂纹。使用定位工装时，注意防止工装被电弧烧伤。\"\n    }\n  },\n  {\n    \"step_number\": 9,\n    \"action\": \"安装后座轴套（小）\",\n    \"description\": \"将图纸上标注为9的后座轴套（01.02.02.0490）焊接到主体结构上。轴套数量为1件。\",\n    \"position_description\": \"轴套9位于主体结构的另一侧，与轴套8相对，用于销轴连接。\",\n    \"parts_used\": [\n      {\n        \"bom_seq\": \"9\",\n        \"bom_name\": \"后座轴套 1\",\n        \"quantity\": 1,\n        \"drawing_number\": \"9\",\n        \"mesh_id\": [\n          \"mesh_004\"\n        ],\n        \"bom_code\": \"01.02.02.0490\"\n      }\n    ],\n    \"tools\": [\n      \"焊机\",\n      \"定位工装\"\n    ],\n    \"warnings\": [\n      \"轴套9的轴线必须与轴套8的轴线保持同轴度，确保后续装配顺畅。\"\n    ],\n    \"welding\": {\n      \"required\": true,\n      \"welding_type\": \"角焊/环焊\",\n      \"welding_method\": \"手工电弧焊（SMAW）或CO2气保焊（MAG）\",\n      \"weld_size\": \"焊脚高度5mm，环形连续焊缝\",\n      \"welding_position\": \"零件9（后座轴套）与侧连接板的连接处，主要为横焊或立焊。\",\n      \"quality_requirements\": \"焊缝必须连续，全焊透。关键在于同轴度控制，焊接时应使用专用工装固定，并采用跳焊或对称焊接，减少热变形。\",\n      \"safety_notes\": \"焊接前检查轴套孔内是否有防飞溅涂层或保护塞，防止焊渣进入孔内。注意控制焊接电流，避免烧穿薄壁区域。\"\n    }\n  },\n  {\n    \"step_number\": 10,\n    \"action\": \"安装后座轴套（大）\",\n    \"description\": \"将图纸上标注为10的后座轴套（01.01.02.0337）焊接到主体结构上。轴套数量为1件。\",\n    \"position_description\": \"轴套10位于主体结构底部，用于连接。\",\n    \"parts_used\": [\n      {\n        \"bom_seq\": \"10\",\n        \"bom_name\": \"后座轴套 1\",\n        \"quantity\": 1,\n        \"drawing_number\": \"10\",\n        \"mesh_id\": [\n          \"mesh_001\"\n        ],\n        \"bom_code\": \"01.01.02.0337\"\n      }\n    ],\n    \"tools\": [\n      \"焊机\"\n    ],\n    \"warnings\": [\n      \"轴套10的焊接位置需确保其与基准面垂直。\"\n    ],\n    \"welding\": {\n      \"required\": true,\n      \"welding_type\": \"角焊/环焊\",\n      \"welding_method\": \"手工电弧焊（SMAW）或CO2气保焊（MAG）\",\n      \"weld_size\": \"焊脚高度5mm，环形连续焊缝\",\n      \"welding_position\": \"零件10（后座轴套）与零件1（方形板）的连接处，主要为平焊。\",\n      \"quality_requirements\": \"焊缝必须连续，全焊透。焊接后需检查轴套的垂直度。焊缝表面不允许有裂纹，焊后应清理焊渣。\",\n      \"safety_notes\": \"由于轴套位于底部，操作时需注意姿势，避免长时间弯腰操作。确保焊机电缆远离地面水渍，防止短路。\"\n    }\n  }\n]\n\n## 要求\n\n请按照以下5个步骤思考，为装配步骤添加安全警告：\n\n### 步骤1：识别风险步骤\n- 分析每个装配步骤的操作内容\n- 判断是否涉及高风险作业：\n  * **焊接作业**：电击、弧光、烫伤、火灾\n  * **吊装作业**：吊物坠落、碰撞、超载\n  * **高空作业**：人员坠落、物体打击\n  * **重物搬运**：砸伤、扭伤、夹伤\n  * **机械加工**：切割伤、夹伤、碰撞\n\n### 步骤2：分析风险源\n- 确定风险的来源（设备、工具、材料、环境、人员操作等）\n- 评估风险的严重程度（轻微、中等、严重、致命）\n- 考虑风险的发生概率\n\n### 步骤3：制定预防措施\n- 针对每个风险源，制定具体的预防措施\n- 强调个人防护用品的使用：\n  * **焊接**：焊接面罩、防护手套、防护服\n  * **吊装**：安全帽、安全鞋、手套\n  * **高空**：安全带、安全帽、防滑鞋\n  * **机械**：防护眼镜、手套、安全鞋\n\n### 步骤4：添加安全警告\n- 为每个有风险的步骤添加safety_warnings字段\n- 每条警告要简洁明了，说明具体的风险和预防措施\n- 使用工人能看懂的语言\n\n### 步骤5：验证完整性\n- 检查所有高风险步骤是否都添加了安全警告\n- 检查安全警告是否具体、可操作\n- 检查是否遗漏了任何潜在风险\n\n## ⚠️ 强制自检清单（生成后必须逐项检查）\n\n**在输出JSON之前，你必须完成以下验证：**\n\n1. **风险步骤识别验证**：\n   - [ ] 所有涉及焊接、吊装、高空、重物搬运的步骤都添加了safety_warnings字段\n   - [ ] 没有明显风险的步骤没有添加safety_warnings字段\n\n2. **安全警告完整性验证**：\n   - [ ] 每个safety_warnings字段都是字符串数组\n   - [ ] 每条警告都说明了具体的风险和预防措施\n   - [ ] 涵盖了个人防护、设备安全、环境安全、操作安全\n\n3. **语言通俗性验证**：\n   - [ ] 使用工人能看懂的语言\n   - [ ] 避免专业术语和英文缩写\n   - [ ] 每条警告简洁明了（一句话）\n\n4. **原有字段保持验证**：\n   - [ ] 原有步骤的所有字段都保持不变（包括welding字段）\n   - [ ] 没有修改或删除任何原有字段\n\n**如果自检发现任何问题，必须重新生成！**\n\n现在开始为装配步骤添加安全警告！\n",
  "raw_response": "```json\n{\n  \"enhanced_steps\": [\n    {\n      \"step_number\": 1,\n      \"action\": \"放置基准件\",\n      \"description\": \"将图纸上标注为1的方形板-机加（01.01.01.11511）平稳放置在装配工作台上，作为整个组件的装配基准。\",\n      \"position_description\": \"平放于工作台，确保水平。\",\n      \"parts_used\": [\n        {\n          \"bom_seq\": \"1\",\n          \"bom_name\": \"方形板-机加 1\",\n          \"quantity\": 1,\n          \"drawing_number\": \"1\",\n          \"mesh_id\": [\n            \"mesh_018\"\n          ],\n          \"bom_code\": \"01.01.01.11511\"\n        }\n      ],\n      \"tools\": [\n        \"行车\",\n        \"吊具\",\n        \"水平仪\"\n      ],\n      \"warnings\": [\n        \"注意吊装安全，防止零件跌落或倾倒。\"\n      ],\n      \"safety_warnings\": [\n        \"佩戴安全帽和防护手套，防止重物坠落和割伤\",\n        \"吊装前检查吊索具是否完好，捆绑是否牢固，防止吊物坠落\",\n        \"指挥人员必须使用标准手势，吊物下方严禁站人\",\n        \"零件边缘可能锋利，搬运时注意防割伤\"\n      ]\n    },\n    {\n      \"step_number\": 2,\n      \"action\": \"安装上连接板\",\n      \"description\": \"将图纸上标注为2的上连接板（01.01.01.11512）焊接到1号方形板的上边缘。注意上连接板的数量为2件，分别焊接到方形板的左右两侧上边缘。\",\n      \"position_description\": \"焊接到1号方形板的左右两侧上边缘，确保与方形板垂直。\",\n      \"parts_used\": [\n        {\n          \"bom_seq\": \"2\",\n          \"bom_name\": \"上连接板 2\",\n          \"quantity\": 2,\n          \"drawing_number\": \"2\",\n          \"mesh_id\": [\n            \"mesh_016\",\n            \"mesh_017\"\n          ],\n          \"bom_code\": \"01.01.01.11512\"\n        }\n      ],\n      \"tools\": [\n        \"焊机\",\n        \"角尺\",\n        \"磁力夹具\"\n      ],\n      \"warnings\": [\n        \"焊接前需点焊定位，确保两块上连接板的相对位置和垂直度符合图纸要求。\"\n      ],\n      \"welding\": {\n        \"required\": true,\n        \"welding_type\": \"角焊\",\n        \"welding_method\": \"CO2气保焊（MAG）\",\n        \"weld_size\": \"焊脚高度5mm（图纸标注）\",\n        \"welding_position\": \"零件1（方形板）与零件2（上连接板）的连接处，平焊\",\n        \"quality_requirements\": \"焊缝连续、饱满，外观平整，不允许有气孔、夹渣、裂纹等缺陷。焊后进行外观检查。\",\n        \"safety_notes\": \"佩戴焊接面罩、防护手套和防护服。确保工作区域通风良好，远离易燃易爆物品。检查焊机接地线是否牢固。\"\n      },\n      \"safety_warnings\": [\n        \"佩戴焊接面罩、防护手套和防护服，防止弧光灼伤和高温烫伤\",\n        \"确保焊机接地线连接可靠，防止触电事故\",\n        \"焊接区域必须通风良好，防止吸入有毒烟尘\",\n        \"清理焊接区域的易燃物，防止焊渣飞溅引起火灾\"\n      ]\n    },\n    {\n      \"step_number\": 3,\n      \"action\": \"安装侧连接板\",\n      \"description\": \"将图纸上标注为3的侧连接板（01.01.01.11513）焊接到1号方形板的侧面。侧连接板数量为2件，分别焊接到方形板的左右两侧。\",\n      \"position_description\": \"焊接到1号方形板的左右两侧，与2号上连接板形成一个U型结构。\",\n      \"parts_used\": [\n        {\n          \"bom_seq\": \"3\",\n          \"bom_name\": \"侧连接板 2\",\n          \"quantity\": 2,\n          \"drawing_number\": \"3\",\n          \"mesh_id\": [\n            \"mesh_014\",\n            \"mesh_015\"\n          ],\n          \"bom_code\": \"01.01.01.11513\"\n        }\n      ],\n      \"tools\": [\n        \"焊机\",\n        \"角尺\"\n      ],\n      \"warnings\": [\n        \"侧连接板与上连接板的焊缝应连续饱满，确保结构强度。\"\n      ],\n      \"welding\": {\n        \"required\": true,\n        \"welding_type\": \"角焊\",\n        \"welding_method\": \"CO2气保焊（MAG）\",\n        \"weld_size\": \"焊脚高度5mm（图纸标注）\",\n        \"welding_position\": \"零件1（方形板）与零件3（侧连接板）的连接处，以及零件2与零件3的连接处。主要为平焊和横焊。\",\n        \"quality_requirements\": \"焊缝连续，焊脚尺寸符合要求。注意控制焊接变形，采用分段、对称焊接顺序。焊后进行外观检查。\",\n        \"safety_notes\": \"焊接时注意防止火花飞溅，特别是对周围的电缆和设备。保持身体干燥，避免触电。\"\n      },\n      \"safety_warnings\": [\n        \"佩戴焊接面罩和防护手套，防止弧光灼伤和焊渣飞溅烫伤\",\n        \"检查焊机电缆绝缘层是否完好，防止漏电触电\",\n        \"焊接时注意防止火花飞溅到周围的电缆或易燃物上\",\n        \"使用磁力夹具固定工件时，确保夹紧可靠，防止工件倾倒\"\n      ]\n    },\n    {\n      \"step_number\": 4,\n      \"action\": \"安装折弯板\",\n      \"description\": \"将图纸上标注为4的折弯板（01.01.01.11514）焊接到主体结构上。根据图纸，折弯板位于主体结构的顶部中央位置。\",\n      \"position_description\": \"焊接到2号上连接板和3号侧连接板围成的顶部区域，位于中央。\",\n      \"parts_used\": [\n        {\n          \"bom_seq\": \"4\",\n          \"bom_name\": \"折弯板 1\",\n          \"quantity\": 1,\n          \"drawing_number\": \"4\",\n          \"mesh_id\": [\n            \"mesh_013\"\n          ],\n          \"bom_code\": \"01.01.01.11514\"\n        }\n      ],\n      \"tools\": [\n        \"焊机\"\n      ],\n      \"warnings\": [\n        \"折弯板的定位应准确，确保其孔位与后续安装的零件对齐。\"\n      ],\n      \"welding\": {\n        \"required\": true,\n        \"welding_type\": \"角焊\",\n        \"welding_method\": \"CO2气保焊（MAG）\",\n        \"weld_size\": \"焊脚高度5mm（图纸标注）\",\n        \"welding_position\": \"零件4（折弯板）与零件2和零件3的连接处，主要为平焊。\",\n        \"quality_requirements\": \"焊缝连续，定位准确。焊缝表面应光滑，过渡圆滑，不允许有咬边现象。\",\n        \"safety_notes\": \"高处作业时，确保站稳，防止坠落。焊接过程中，注意焊烟的排放，使用局部排风设备。\"\n      },\n      \"safety_warnings\": [\n        \"佩戴焊接面罩和防护手套，防止弧光灼伤\",\n        \"如果需要在高处（超过2米）焊接，必须系好安全带，并确保脚下站稳\",\n        \"使用局部排风设备或通风系统，确保焊烟及时排出，防止中毒\",\n        \"焊接完成后，清理焊渣时佩戴防护眼镜，防止飞溅伤眼\"\n      ]\n    },\n    {\n      \"step_number\": 5,\n      \"action\": \"安装油缸固定板\",\n      \"description\": \"将图纸上标注为5的油缸固定板（01.01.01.11515）焊接到3号侧连接板的外侧。油缸固定板数量为4件，每侧侧连接板上焊接2件。\",\n      \"position_description\": \"焊接到左右两侧的3号侧连接板上，注意其安装方向和孔位朝向，需与图纸所示一致。\",\n      \"parts_used\": [\n        {\n          \"bom_seq\": \"5\",\n          \"bom_name\": \"油缸固定板 4\",\n          \"quantity\": 4,\n          \"drawing_number\": \"5\",\n          \"mesh_id\": [\n            \"mesh_002\",\n            \"mesh_003\",\n            \"mesh_011\",\n            \"mesh_012\"\n          ],\n          \"bom_code\": \"01.01.01.11515\"\n        }\n      ],\n      \"tools\": [\n        \"焊机\",\n        \"卡尺\"\n      ],\n      \"warnings\": [\n        \"油缸固定板的相对位置精度要求较高，需使用卡尺或专用工装定位。\"\n      ],\n      \"welding\": {\n        \"required\": true,\n        \"welding_type\": \"角焊\",\n        \"welding_method\": \"CO2气保焊（MAG）\",\n        \"weld_size\": \"焊脚高度5mm（图纸标注）\",\n        \"welding_position\": \"零件5（油缸固定板）与零件3（侧连接板）的连接处，主要为立焊和横焊。\",\n        \"quality_requirements\": \"焊缝连续，焊脚尺寸均匀。由于精度要求高，焊接后需检查孔位中心距和垂直度。焊缝不允许有未熔合、未焊透。\",\n        \"safety_notes\": \"立焊和横焊时，注意控制熔池温度，防止焊渣烫伤。焊接前确保定位工装夹紧可靠。\"\n      },\n      \"safety_warnings\": [\n        \"佩戴焊接面罩和防护手套，防止焊渣飞溅烫伤\",\n        \"进行立焊和横焊时，注意调整姿势，防止焊渣沿手臂或身体流下造成烫伤\",\n        \"确保定位工装夹紧可靠，防止工件在焊接过程中松动或位移\",\n        \"工作区域地面保持干燥，防止触电\"\n      ]\n    },\n    {\n      \"step_number\": 6,\n      \"action\": \"安装加强板\",\n      \"description\": \"将图纸上标注为6的加强板（01.01.01.11516）焊接到主体结构上。加强板数量为4件，用于增强侧连接板的刚性。\",\n      \"position_description\": \"根据图纸，加强板焊接在3号侧连接板的内侧或外侧，靠近油缸固定板的位置。\",\n      \"parts_used\": [\n        {\n          \"bom_seq\": \"6\",\n          \"bom_name\": \"加强板 4\",\n          \"quantity\": 4,\n          \"drawing_number\": \"6\",\n          \"mesh_id\": [\n            \"mesh_007\",\n            \"mesh_008\",\n            \"mesh_009\",\n            \"mesh_010\"\n          ],\n          \"bom_code\": \"01.01.01.11516\"\n        }\n      ],\n      \"tools\": [\n        \"焊机\"\n      ],\n      \"warnings\": [\n        \"加强板的焊缝应连续，避免虚焊。\"\n      ],\n      \"welding\": {\n        \"required\": true,\n        \"welding_type\": \"角焊\",\n        \"welding_method\": \"CO2气保焊（MAG）\",\n        \"weld_size\": \"焊脚高度5mm（图纸标注）\",\n        \"welding_position\": \"零件6（加强板）与零件3（侧连接板）的连接处，主要为平焊和立焊。\",\n        \"quality_requirements\": \"焊缝连续，焊脚尺寸均匀。加强板主要用于承载，焊缝必须保证强度，焊后进行外观检查。\",\n        \"safety_notes\": \"焊接加强板时，注意结构内部空间狭小，防止电弧光灼伤皮肤。确保焊枪和电缆绝缘良好。\"\n      },\n      \"safety_warnings\": [\n        \"佩戴焊接面罩和防护手套，防止弧光灼伤和烫伤\",\n        \"在狭小空间焊接时，注意保持身体与带电部件的安全距离，防止触电\",\n        \"确保焊枪和电缆绝缘良好，避免在金属结构上拖拽造成破损\",\n        \"如果需要进入结构内部操作，必须确保有两人以上监护，并保持通风\"\n      ]\n    },\n    {\n      \"step_number\": 7,\n      \"action\": \"安装角钢\",\n      \"description\": \"将图纸上标注为7的角钢-机加（01.01.04.0592）焊接到主体结构上。角钢数量为1件.\",\n      \"position_description\": \"角钢位于主体结构顶部，靠近折弯板4的位置，用于连接和支撑。\",\n      \"parts_used\": [\n        {\n          \"bom_seq\": \"7\",\n          \"bom_name\": \"角钢-机加 1\",\n          \"quantity\": 1,\n          \"drawing_number\": \"7\",\n          \"mesh_id\": [\n            \"mesh_006\"\n          ],\n          \"bom_code\": \"01.01.04.0592\"\n        }\n      ],\n      \"tools\": [\n        \"焊机\"\n      ],\n      \"warnings\": [\n        \"角钢的焊接位置和角度需严格按照图纸尺寸进行。\"\n      ],\n      \"welding\": {\n        \"required\": true,\n        \"welding_type\": \"角焊\",\n        \"welding_method\": \"CO2气保焊（MAG）\",\n        \"weld_size\": \"焊脚高度5mm（图纸标注）\",\n        \"welding_position\": \"零件7（角钢）与零件2（上连接板）和零件4（折弯板）的连接处，主要为平焊。\",\n        \"quality_requirements\": \"焊缝连续，定位准确。焊缝外观要求高，需打磨平整（如果图纸有要求）。\",\n        \"safety_notes\": \"焊接前清理角钢表面的油污和锈蚀，防止产生气孔。注意焊枪角度，确保焊透。\"\n      },\n      \"safety_warnings\": [\n        \"佩戴焊接面罩和防护手套，防止弧光灼伤\",\n        \"焊接前必须清理角钢表面的油污、锈蚀和水渍，防止焊接时产生有毒气体或爆炸\",\n        \"如果需要打磨焊缝，必须佩戴防护眼镜和防尘口罩，防止粉尘吸入和飞溅伤眼\"\n      ]\n    },\n    {\n      \"step_number\": 8,\n      \"action\": \"安装轴套（大）\",\n      \"description\": \"将图纸上标注为8的轴套（01.01.02.1221）焊接到主体结构上。轴套数量为1件。\",\n      \"position_description\": \"轴套8位于主体结构的一侧，靠近顶部，用于销轴连接。\",\n      \"parts_used\": [\n        {\n          \"bom_seq\": \"8\",\n          \"bom_name\": \"轴套 1\",\n          \"quantity\": 1,\n          \"drawing_number\": \"8\"\n        }\n      ],\n      \"tools\": [\n        \"焊机\",\n        \"定位工装\"\n      ],\n      \"warnings\": [\n        \"轴套的轴线方向必须与图纸要求平行或垂直，使用定位工装确保精度。\"\n      ],\n      \"welding\": {\n        \"required\": true,\n        \"welding_type\": \"角焊/环焊\",\n        \"welding_method\": \"手工电弧焊（SMAW）或CO2气保焊（MAG）\",\n        \"weld_size\": \"焊脚高度5mm，环形连续焊缝\",\n        \"welding_position\": \"零件8（轴套）与侧连接板的连接处，主要为横焊或立焊。\",\n        \"quality_requirements\": \"焊缝必须连续，全焊透。轴套焊接后，需严格检查其轴线与基准面的平行度/垂直度。焊后可能需要进行无损检测（如磁粉检测）。\",\n        \"safety_notes\": \"轴套焊接时，由于零件较厚，可能需要预热，防止产生裂纹。使用定位工装时，注意防止工装被电弧烧伤。\"\n      },\n      \"safety_warnings\": [\n        \"佩戴焊接面罩和防护手套，防止弧光灼伤\",\n        \"如果需要预热，注意高温烫伤风险，佩戴隔热手套\",\n        \"使用定位工装时，确保工装与焊件之间绝缘良好，防止工装被电弧烧伤或损坏\",\n        \"手工电弧焊时，注意更换焊条时戴好手套，防止烫伤\"\n      ]\n    },\n    {\n      \"step_number\": 9,\n      \"action\": \"安装后座轴套（小）\",\n      \"description\": \"将图纸上标注为9的后座轴套（01.02.02.0490）焊接到主体结构上。轴套数量为1件。\",\n      \"position_description\": \"轴套9位于主体结构的另一侧，与轴套8相对，用于销轴连接。\",\n      \"parts_used\": [\n        {\n          \"bom_seq\": \"9\",\n          \"bom_name\": \"后座轴套 1\",\n          \"quantity\": 1,\n          \"drawing_number\": \"9\",\n          \"mesh_id\": [\n            \"mesh_004\"\n          ],\n          \"bom_code\": \"01.02.02.0490\"\n        }\n      ],\n      \"tools\": [\n        \"焊机\",\n        \"定位工装\"\n      ],\n      \"warnings\": [\n        \"轴套9的轴线必须与轴套8的轴线保持同轴度，确保后续装配顺畅。\"\n      ],\n      \"welding\": {\n        \"required\": true,\n        \"welding_type\": \"角焊/环焊\",\n        \"welding_method\": \"手工电弧焊（SMAW）或CO2气保焊（MAG）\",\n        \"weld_size\": \"焊脚高度5mm，环形连续焊缝\",\n        \"welding_position\": \"零件9（后座轴套）与侧连接板的连接处，主要为横焊或立焊。\",\n        \"quality_requirements\": \"焊缝必须连续，全焊透。关键在于同轴度控制，焊接时应使用专用工装固定，并采用跳焊或对称焊接，减少热变形。\",\n        \"safety_notes\": \"焊接前检查轴套孔内是否有防飞溅涂层或保护塞，防止焊渣进入孔内。注意控制焊接电流，避免烧穿薄壁区域。\"\n      },\n      \"safety_warnings\": [\n        \"佩戴焊接面罩和防护手套，防止弧光灼伤\",\n        \"焊接前必须在轴套孔内放置保护塞，防止焊渣飞溅进入孔内，影响后续装配\",\n        \"注意控制焊接电流和时间，防止烧穿轴套薄壁，造成结构损坏\",\n        \"焊接完成后，清理焊渣时注意高温，防止烫伤\"\n      ]\n    },\n    {\n      \"step_number\": 10,\n      \"action\": \"安装后座轴套（大）\",\n      \"description\": \"将图纸上标注为10的后座轴套（01.01.02.0337）焊接到主体结构上。轴套数量为1件。\",\n      \"position_description\": \"轴套10位于主体结构底部，用于连接。\",\n      \"parts_used\": [\n        {\n          \"bom_seq\": \"10\",\n          \"bom_name\": \"后座轴套 1\",\n          \"quantity\": 1,\n          \"drawing_number\": \"10\",\n          \"mesh_id\": [\n            \"mesh_001\"\n          ],\n          \"bom_code\": \"01.01.02.0337\"\n        }\n      ],\n      \"tools\": [\n        \"焊机\"\n      ],\n      \"warnings\": [\n        \"轴套10的焊接位置需确保其与基准面垂直。\"\n      ],\n      \"welding\": {\n        \"required\": true,\n        \"welding_type\": \"角焊/环焊\",\n        \"welding_method\": \"手工电弧焊（SMAW）或CO2气保焊（MAG）\",\n        \"weld_size\": \"焊脚高度5mm，环形连续焊缝\",\n        \"welding_position\": \"零件10（后座轴套）与零件1（方形板）的连接处，主要为平焊。\",\n        \"quality_requirements\": \"焊缝必须连续，全焊透。焊接后需检查轴套的垂直度。焊缝表面不允许有裂纹，焊后应清理焊渣。\",\n        \"safety_notes\": \"由于轴套位于底部，操作时需注意姿势，避免长时间弯腰操作。确保焊机电缆远离地面水渍，防止短路。\"\n      },\n      \"safety_warnings\": [\n        \"佩戴焊接面罩和防护手套，防止弧光灼伤\",\n        \"操作时注意保持正确的焊接姿势，避免长时间弯腰或扭曲身体造成肌肉劳损\",\n        \"确保焊机电缆和焊把线远离地面水渍和潮湿区域，防止短路和触电\",\n        \"焊接完成后，清理焊渣时佩戴防护眼镜，防止飞溅伤眼\"\n      ]\n    }\n  ]\n}\n```",
  "parsed_result": {
    "enhanced_steps": [
      {
        "step_number": 1,
        "action": "放置基准件",
        "description": "将图纸上标注为1的方形板-机加（01.01.01.11511）平稳放置在装配工作台上，作为整个组件的装配基准。",
        "position_description": "平放于工作台，确保水平。",
        "parts_used": [
          {
            "bom_seq": "1",
            "bom_name": "方形板-机加 1",
            "quantity": 1,
            "drawing_number": "1",
            "mesh_id": [
              "mesh_018"
            ],
            "bom_code": "01.01.01.11511"
          }
        ],
        "tools": [
          "行车",
          "吊具",
          "水平仪"
        ],
        "warnings": [
          "注意吊装安全，防止零件跌落或倾倒。"
        ],
        "safety_warnings": [
          "佩戴安全帽和防护手套，防止重物坠落和割伤",
          "吊装前检查吊索具是否完好，捆绑是否牢固，防止吊物坠落",
          "指挥人员必须使用标准手势，吊物下方严禁站人",
          "零件边缘可能锋利，搬运时注意防割伤"
        ]
      },
      {
        "step_number": 2,
        "action": "安装上连接板",
        "description": "将图纸上标注为2的上连接板（01.01.01.11512）焊接到1号方形板的上边缘。注意上连接板的数量为2件，分别焊接到方形板的左右两侧上边缘。",
        "position_description": "焊接到1号方形板的左右两侧上边缘，确保与方形板垂直。",
        "parts_used": [
          {
            "bom_seq": "2",
            "bom_name": "上连接板 2",
            "quantity": 2,
            "drawing_number": "2",
            "mesh_id": [
              "mesh_016",
              "mesh_017"
            ],
            "bom_code": "01.01.01.11512"
          }
        ],
        "tools": [
          "焊机",
          "角尺",
          "磁力夹具"
        ],
        "warnings": [
          "焊接前需点焊定位，确保两块上连接板的相对位置和垂直度符合图纸要求。"
        ],
        "welding": {
          "required": true,
          "welding_type": "角焊",
          "welding_method": "CO2气保焊（MAG）",
          "weld_size": "焊脚高度5mm（图纸标注）",
          "welding_position": "零件1（方形板）与零件2（上连接板）的连接处，平焊",
          "quality_requirements": "焊缝连续、饱满，外观平整，不允许有气孔、夹渣、裂纹等缺陷。焊后进行外观检查。",
          "safety_notes": "佩戴焊接面罩、防护手套和防护服。确保工作区域通风良好，远离易燃易爆物品。检查焊机接地线是否牢固。"
        },
        "safety_warnings": [
          "佩戴焊接面罩、防护手套和防护服，防止弧光灼伤和高温烫伤",
          "确保焊机接地线连接可靠，防止触电事故",
          "焊接区域必须通风良好，防止吸入有毒烟尘",
          "清理焊接区域的易燃物，防止焊渣飞溅引起火灾"
        ]
      },
      {
        "step_number": 3,
        "action": "安装侧连接板",
        "description": "将图纸上标注为3的侧连接板（01.01.01.11513）焊接到1号方形板的侧面。侧连接板数量为2件，分别焊接到方形板的左右两侧。",
        "position_description": "焊接到1号方形板的左右两侧，与2号上连接板形成一个U型结构。",
        "parts_used": [
          {
            "bom_seq": "3",
            "bom_name": "侧连接板 2",
            "quantity": 2,
            "drawing_number": "3",
            "mesh_id": [
              "mesh_014",
              "mesh_015"
            ],
            "bom_code": "01.01.01.11513"
          }
        ],
        "tools": [
          "焊机",
          "角尺"
        ],
        "warnings": [
          "侧连接板与上连接板的焊缝应连续饱满，确保结构强度。"
        ],
        "welding": {
          "required": true,
          "welding_type": "角焊",
          "welding_method": "CO2气保焊（MAG）",
          "weld_size": "焊脚高度5mm（图纸标注）",
          "welding_position": "零件1（方形板）与零件3（侧连接板）的连接处，以及零件2与零件3的连接处。主要为平焊和横焊。",
          "quality_requirements": "焊缝连续，焊脚尺寸符合要求。注意控制焊接变形，采用分段、对称焊接顺序。焊后进行外观检查。",
          "safety_notes": "焊接时注意防止火花飞溅，特别是对周围的电缆和设备。保持身体干燥，避免触电。"
        },
        "safety_warnings": [
          "佩戴焊接面罩和防护手套，防止弧光灼伤和焊渣飞溅烫伤",
          "检查焊机电缆绝缘层是否完好，防止漏电触电",
          "焊接时注意防止火花飞溅到周围的电缆或易燃物上",
          "使用磁力夹具固定工件时，确保夹紧可靠，防止工件倾倒"
        ]
      },
      {
        "step_number": 4,
        "action": "安装折弯板",
        "description": "将图纸上标注为4的折弯板（01.01.01.11514）焊接到主体结构上。根据图纸，折弯板位于主体结构的顶部中央位置。",
        "position_description": "焊接到2号上连接板和3号侧连接板围成的顶部区域，位于中央。",
        "parts_used": [
          {
            "bom_seq": "4",
            "bom_name": "折弯板 1",
            "quantity": 1,
            "drawing_number": "4",
            "mesh_id": [
              "mesh_013"
            ],
            "bom_code": "01.01.01.11514"
          }
        ],
        "tools": [
          "焊机"
        ],
        "warnings": [
          "折弯板的定位应准确，确保其孔位与后续安装的零件对齐。"
        ],
        "welding": {
          "required": true,
          "welding_type": "角焊",
          "welding_method": "CO2气保焊（MAG）",
          "weld_size": "焊脚高度5mm（图纸标注）",
          "welding_position": "零件4（折弯板）与零件2和零件3的连接处，主要为平焊。",
          "quality_requirements": "焊缝连续，定位准确。焊缝表面应光滑，过渡圆滑，不允许有咬边现象。",
          "safety_notes": "高处作业时，确保站稳，防止坠落。焊接过程中，注意焊烟的排放，使用局部排风设备。"
        },
        "safety_warnings": [
          "佩戴焊接面罩和防护手套，防止弧光灼伤",
          "如果需要在高处（超过2米）焊接，必须系好安全带，并确保脚下站稳",
          "使用局部排风设备或通风系统，确保焊烟及时排出，防止中毒",
          "焊接完成后，清理焊渣时佩戴防护眼镜，防止飞溅伤眼"
        ]
      },
      {
        "step_number": 5,
        "action": "安装油缸固定板",
        "description": "将图纸上标注为5的油缸固定板（01.01.01.11515）焊接到3号侧连接板的外侧。油缸固定板数量为4件，每侧侧连接板上焊接2件。",
        "position_description": "焊接到左右两侧的3号侧连接板上，注意其安装方向和孔位朝向，需与图纸所示一致。",
        "parts_used": [
          {
            "bom_seq": "5",
            "bom_name": "油缸固定板 4",
            "quantity": 4,
            "drawing_number": "5",
            "mesh_id": [
              "mesh_002",
              "mesh_003",
              "mesh_011",
              "mesh_012"
            ],
            "bom_code": "01.01.01.11515"
          }
        ],
        "tools": [
          "焊机",
          "卡尺"
        ],
        "warnings": [
          "油缸固定板的相对位置精度要求较高，需使用卡尺或专用工装定位。"
        ],
        "welding": {
          "required": true,
          "welding_type": "角焊",
          "welding_method": "CO2气保焊（MAG）",
          "weld_size": "焊脚高度5mm（图纸标注）",
          "welding_position": "零件5（油缸固定板）与零件3（侧连接板）的连接处，主要为立焊和横焊。",
          "quality_requirements": "焊缝连续，焊脚尺寸均匀。由于精度要求高，焊接后需检查孔位中心距和垂直度。焊缝不允许有未熔合、未焊透。",
          "safety_notes": "立焊和横焊时，注意控制熔池温度，防止焊渣烫伤。焊接前确保定位工装夹紧可靠。"
        },
        "safety_warnings": [
          "佩戴焊接面罩和防护手套，防止焊渣飞溅烫伤",
          "进行立焊和横焊时，注意调整姿势，防止焊渣沿手臂或身体流下造成烫伤",
          "确保定位工装夹紧可靠，防止工件在焊接过程中松动或位移",
          "工作区域地面保持干燥，防止触电"
        ]
      },
      {
        "step_number": 6,
        "action": "安装加强板",
        "description": "将图纸上标注为6的加强板（01.01.01.11516）焊接到主体结构上。加强板数量为4件，用于增强侧连接板的刚性。",
        "position_description": "根据图纸，加强板焊接在3号侧连接板的内侧或外侧，靠近油缸固定板的位置。",
        "parts_used": [
          {
            "bom_seq": "6",
            "bom_name": "加强板 4",
            "quantity": 4,
            "drawing_number": "6",
            "mesh_id": [
              "mesh_007",
              "mesh_008",
              "mesh_009",
              "mesh_010"
            ],
            "bom_code": "01.01.01.11516"
          }
        ],
        "tools": [
          "焊机"
        ],
        "warnings": [
          "加强板的焊缝应连续，避免虚焊。"
        ],
        "welding": {
          "required": true,
          "welding_type": "角焊",
          "welding_method": "CO2气保焊（MAG）",
          "weld_size": "焊脚高度5mm（图纸标注）",
          "welding_position": "零件6（加强板）与零件3（侧连接板）的连接处，主要为平焊和立焊。",
          "quality_requirements": "焊缝连续，焊脚尺寸均匀。加强板主要用于承载，焊缝必须保证强度，焊后进行外观检查。",
          "safety_notes": "焊接加强板时，注意结构内部空间狭小，防止电弧光灼伤皮肤。确保焊枪和电缆绝缘良好。"
        },
        "safety_warnings": [
          "佩戴焊接面罩和防护手套，防止弧光灼伤和烫伤",
          "在狭小空间焊接时，注意保持身体与带电部件的安全距离，防止触电",
          "确保焊枪和电缆绝缘良好，避免在金属结构上拖拽造成破损",
          "如果需要进入结构内部操作，必须确保有两人以上监护，并保持通风"
        ]
      },
      {
        "step_number": 7,
        "action": "安装角钢",
        "description": "将图纸上标注为7的角钢-机加（01.01.04.0592）焊接到主体结构上。角钢数量为1件.",
        "position_description": "角钢位于主体结构顶部，靠近折弯板4的位置，用于连接和支撑。",
        "parts_used": [
          {
            "bom_seq": "7",
            "bom_name": "角钢-机加 1",
            "quantity": 1,
            "drawing_number": "7",
            "mesh_id": [
              "mesh_006"
            ],
            "bom_code": "01.01.04.0592"
          }
        ],
        "tools": [
          "焊机"
        ],
        "warnings": [
          "角钢的焊接位置和角度需严格按照图纸尺寸进行。"
        ],
        "welding": {
          "required": true,
          "welding_type": "角焊",
          "welding_method": "CO2气保焊（MAG）",
          "weld_size": "焊脚高度5mm（图纸标注）",
          "welding_position": "零件7（角钢）与零件2（上连接板）和零件4（折弯板）的连接处，主要为平焊。",
          "quality_requirements": "焊缝连续，定位准确。焊缝外观要求高，需打磨平整（如果图纸有要求）。",
          "safety_notes": "焊接前清理角钢表面的油污和锈蚀，防止产生气孔。注意焊枪角度，确保焊透。"
        },
        "safety_warnings": [
          "佩戴焊接面罩和防护手套，防止弧光灼伤",
          "焊接前必须清理角钢表面的油污、锈蚀和水渍，防止焊接时产生有毒气体或爆炸",
          "如果需要打磨焊缝，必须佩戴防护眼镜和防尘口罩，防止粉尘吸入和飞溅伤眼"
        ]
      },
      {
        "step_number": 8,
        "action": "安装轴套（大）",
        "description": "将图纸上标注为8的轴套（01.01.02.1221）焊接到主体结构上。轴套数量为1件。",
        "position_description": "轴套8位于主体结构的一侧，靠近顶部，用于销轴连接。",
        "parts_used": [
          {
            "bom_seq": "8",
            "bom_name": "轴套 1",
            "quantity": 1,
            "drawing_number": "8"
          }
        ],
        "tools": [
          "焊机",
          "定位工装"
        ],
        "warnings": [
          "轴套的轴线方向必须与图纸要求平行或垂直，使用定位工装确保精度。"
        ],
        "welding": {
          "required": true,
          "welding_type": "角焊/环焊",
          "welding_method": "手工电弧焊（SMAW）或CO2气保焊（MAG）",
          "weld_size": "焊脚高度5mm，环形连续焊缝",
          "welding_position": "零件8（轴套）与侧连接板的连接处，主要为横焊或立焊。",
          "quality_requirements": "焊缝必须连续，全焊透。轴套焊接后，需严格检查其轴线与基准面的平行度/垂直度。焊后可能需要进行无损检测（如磁粉检测）。",
          "safety_notes": "轴套焊接时，由于零件较厚，可能需要预热，防止产生裂纹。使用定位工装时，注意防止工装被电弧烧伤。"
        },
        "safety_warnings": [
          "佩戴焊接面罩和防护手套，防止弧光灼伤",
          "如果需要预热，注意高温烫伤风险，佩戴隔热手套",
          "使用定位工装时，确保工装与焊件之间绝缘良好，防止工装被电弧烧伤或损坏",
          "手工电弧焊时，注意更换焊条时戴好手套，防止烫伤"
        ]
      },
      {
        "step_number": 9,
        "action": "安装后座轴套（小）",
        "description": "将图纸上标注为9的后座轴套（01.02.02.0490）焊接到主体结构上。轴套数量为1件。",
        "position_description": "轴套9位于主体结构的另一侧，与轴套8相对，用于销轴连接。",
        "parts_used": [
          {
            "bom_seq": "9",
            "bom_name": "后座轴套 1",
            "quantity": 1,
            "drawing_number": "9",
            "mesh_id": [
              "mesh_004"
            ],
            "bom_code": "01.02.02.0490"
          }
        ],
        "tools": [
          "焊机",
          "定位工装"
        ],
        "warnings": [
          "轴套9的轴线必须与轴套8的轴线保持同轴度，确保后续装配顺畅。"
        ],
        "welding": {
          "required": true,
          "welding_type": "角焊/环焊",
          "welding_method": "手工电弧焊（SMAW）或CO2气保焊（MAG）",
          "weld_size": "焊脚高度5mm，环形连续焊缝",
          "welding_position": "零件9（后座轴套）与侧连接板的连接处，主要为横焊或立焊。",
          "quality_requirements": "焊缝必须连续，全焊透。关键在于同轴度控制，焊接时应使用专用工装固定，并采用跳焊或对称焊接，减少热变形。",
          "safety_notes": "焊接前检查轴套孔内是否有防飞溅涂层或保护塞，防止焊渣进入孔内。注意控制焊接电流，避免烧穿薄壁区域。"
        },
        "safety_warnings": [
          "佩戴焊接面罩和防护手套，防止弧光灼伤",
          "焊接前必须在轴套孔内放置保护塞，防止焊渣飞溅进入孔内，影响后续装配",
          "注意控制焊接电流和时间，防止烧穿轴套薄壁，造成结构损坏",
          "焊接完成后，清理焊渣时注意高温，防止烫伤"
        ]
      },
      {
        "step_number": 10,
        "action": "安装后座轴套（大）",
        "description": "将图纸上标注为10的后座轴套（01.01.02.0337）焊接到主体结构上。轴套数量为1件。",
        "position_description": "轴套10位于主体结构底部，用于连接。",
        "parts_used": [
          {
            "bom_seq": "10",
            "bom_name": "后座轴套 1",
            "quantity": 1,
            "drawing_number": "10",
            "mesh_id": [
              "mesh_001"
            ],
            "bom_code": "01.01.02.0337"
          }
        ],
        "tools": [
          "焊机"
        ],
        "warnings": [
          "轴套10的焊接位置需确保其与基准面垂直。"
        ],
        "welding": {
          "required": true,
          "welding_type": "角焊/环焊",
          "welding_method": "手工电弧焊（SMAW）或CO2气保焊（MAG）",
          "weld_size": "焊脚高度5mm，环形连续焊缝",
          "welding_position": "零件10（后座轴套）与零件1（方形板）的连接处，主要为平焊。",
          "quality_requirements": "焊缝必须连续，全焊透。焊接后需检查轴套的垂直度。焊缝表面不允许有裂纹，焊后应清理焊渣。",
          "safety_notes": "由于轴套位于底部，操作时需注意姿势，避免长时间弯腰操作。确保焊机电缆远离地面水渍，防止短路。"
        },
        "safety_warnings": [
          "佩戴焊接面罩和防护手套，防止弧光灼伤",
          "操作时注意保持正确的焊接姿势，避免长时间弯腰或扭曲身体造成肌肉劳损",
          "确保焊机电缆和焊把线远离地面水渍和潮湿区域，防止短路和触电",
          "焊接完成后，清理焊渣时佩戴防护眼镜，防止飞溅伤眼"
        ]
      }
    ]
  }
}