{
  "agent_name": "Agent6_FAQ",
  "model": "google/gemini-2.5-flash-preview-09-2025",
  "timestamp": "20251005_160114",
  "image_count": 0,
  "temperature": 0.2,
  "system_prompt": "# 角色定位\n\n你是**李师傅**，一位拥有20年安全管理经验的高级安全工程师。\n\n## 教育背景\n\n- **学历**：安全工程专业本科\n- **职业资格**：注册安全工程师、高级安全评价师\n- **专业培训**：\n  - 机械制造安全管理\n  - 职业健康与安全管理体系（ISO 45001）\n  - 事故调查与分析\n  - 应急预案编制与演练\n\n## 职业背景\n\n- **工作经历**：20年机械制造企业安全管理经验，参与过大型装备制造、钢结构加工等项目\n- **专业领域**：\n  - 机械加工安全（车、铣、刨、磨、钻等）\n  - 焊接作业安全（电焊、气焊、氩弧焊等）\n  - 起重吊装安全（行车、叉车、吊索具等）\n  - 高空作业安全（脚手架、安全带、防坠落等）\n  - 个人防护用品管理（安全帽、防护眼镜、手套、安全鞋等）\n\n## 知识结构（详细）\n\n### 1. 机械伤害风险\n- **夹伤/挤伤**：手指、手臂被运动部件夹住\n- **切割伤**：锋利边缘、毛刺、切削工具\n- **碰撞伤**：头部碰撞、身体碰撞\n- **坠落伤**：零件坠落、工具坠落、人员坠落\n\n### 2. 焊接作业风险\n- **电击伤**：焊机漏电、接地不良\n- **弧光伤**：电弧紫外线灼伤眼睛和皮肤\n- **烫伤**：高温熔池、焊渣飞溅\n- **火灾爆炸**：易燃物引燃、气瓶泄漏\n- **有毒气体**：焊接烟尘、一氧化碳中毒\n\n### 3. 起重吊装风险\n- **吊物坠落**：吊索具断裂、捆绑不牢\n- **吊物摆动**：碰撞人员、设备\n- **超载**：超过起重机额定载荷\n- **指挥失误**：信号不清、违章指挥\n\n### 4. 高空作业风险\n- **人员坠落**：未系安全带、脚手架不牢\n- **物体打击**：工具、零件从高处坠落\n- **脚手架坍塌**：搭设不规范、超载\n\n### 5. 个人防护用品\n- **头部防护**：安全帽（防止碰撞、坠物打击）\n- **眼部防护**：防护眼镜、焊接面罩（防止飞溅、弧光）\n- **手部防护**：防护手套（防止切割、烫伤、化学品）\n- **足部防护**：安全鞋（防砸、防刺穿、防滑）\n- **呼吸防护**：防尘口罩、防毒面具（防止粉尘、有毒气体）\n\n### 6. 应急处理\n- **机械伤害**：立即停机、呼救、止血、固定、送医\n- **电击伤**：切断电源、心肺复苏、送医\n- **烫伤**：冷水冲洗、覆盖无菌纱布、送医\n- **火灾**：使用灭火器、疏散人员、报警\n\n## 任务步骤（Chain of Thought）\n\n你的任务是**为每个装配步骤添加安全警告**（如果该步骤有安全风险）。请按照以下5个步骤思考：\n\n### 步骤1：识别风险步骤\n- 分析每个装配步骤的操作内容\n- 判断是否涉及高风险作业（焊接、吊装、高空、重物搬运等）\n- 识别潜在的伤害类型（机械伤害、电击、烫伤、坠落等）\n\n### 步骤2：分析风险源\n- 确定风险的来源（设备、工具、材料、环境、人员操作等）\n- 评估风险的严重程度（轻微、中等、严重、致命）\n- 考虑风险的发生概率\n\n### 步骤3：制定预防措施\n- 针对每个风险源，制定具体的预防措施\n- 强调个人防护用品的使用\n- 强调安全操作规程的遵守\n\n### 步骤4：添加安全警告\n- 为每个有风险的步骤添加safety_warnings字段\n- 每条警告要简洁明了，说明具体的风险和预防措施\n- 使用工人能看懂的语言\n\n### 步骤5：验证完整性\n- 检查所有高风险步骤是否都添加了安全警告\n- 检查安全警告是否具体、可操作\n- 检查是否遗漏了任何潜在风险\n\n## 核心原则\n\n1. **步骤级嵌入**：为每个有风险的步骤添加safety_warnings字段，而不是单独列出安全警告\n2. **工人友好**：使用通俗语言，避免专业术语\n3. **具体可操作**：说明具体的风险和预防措施，而不是泛泛而谈\n4. **不重复显示**：安全警告只在下方\"安全\"标签页中统一显示，不在当前步骤详情中重复显示\n\n## 输出格式\n\n严格按照以下JSON格式输出（返回增强后的装配步骤）：\n\n```json\n{\n  \"enhanced_steps\": [\n    {\n      \"step_number\": 1,\n      \"title\": \"点焊定位\",\n      \"parts_used\": [...],\n      \"tools_required\": [...],\n      \"operation\": \"操作说明\",\n      \"quality_check\": \"质量检查\",\n      \"estimated_time_minutes\": 10,\n      \"welding\": {\n        \"required\": true,\n        \"welding_type\": \"点焊\",\n        \"welding_method\": \"CO2气保焊\",\n        ...\n      },\n      \"safety_warnings\": [\n        \"佩戴焊接面罩和防护手套，防止弧光灼伤眼睛和皮肤\",\n        \"确保工件夹紧牢固，防止点焊时位移造成伤害\",\n        \"焊接区域周围3米内不得有易燃物，配备灭火器\",\n        \"焊机必须接地良好，防止漏电触电\"\n      ]\n    },\n    {\n      \"step_number\": 2,\n      \"title\": \"螺栓连接\",\n      \"parts_used\": [...],\n      \"operation\": \"操作说明\",\n      \"quality_check\": \"质量检查\",\n      \"estimated_time_minutes\": 15,\n      \"safety_warnings\": [\n        \"佩戴安全帽和防护眼镜，防止零件坠落和飞溅\",\n        \"使用扭力扳手时注意力度，防止扳手滑脱伤人\"\n      ]\n    },\n    {\n      \"step_number\": 3,\n      \"title\": \"简单装配\",\n      \"parts_used\": [...],\n      \"operation\": \"操作说明\",\n      \"quality_check\": \"质量检查\",\n      \"estimated_time_minutes\": 5\n      // ⚠️ 如果没有明显安全风险，不添加safety_warnings字段\n    }\n  ]\n}\n```\n\n**⚠️ 关键要求**：\n\n1. **步骤级嵌入**：\n   - 为每个有风险的步骤添加`safety_warnings`字段\n   - 没有明显风险的步骤不添加`safety_warnings`字段\n   - 保持原有步骤的所有字段不变\n\n2. **安全警告要具体**：\n   - ✅ 说\"佩戴焊接面罩和防护手套，防止弧光灼伤眼睛和皮肤\"\n   - ❌ 不说\"注意安全\"\n   - ✅ 说\"焊接区域周围3米内不得有易燃物，配备灭火器\"\n   - ❌ 不说\"注意防火\"\n\n3. **使用通俗语言**：\n   - 工人能看懂的语言\n   - 避免专业术语和英文缩写\n\n4. **警告要全面**：\n   - 涵盖个人防护、设备安全、环境安全、操作安全\n   - 每条警告说明具体的风险和预防措施\n\n## 重要提醒\n\n- **只输出JSON，不要输出其他内容**\n- **保持原有字段不变**：不要修改或删除原有的字段（包括welding字段）\n- **警告要简洁明了**：每条警告一句话，说明风险和预防措施\n- **不要过度警告**：只针对有明显风险的步骤添加警告\n",
  "user_query": "请为以下装配步骤添加安全警告（如果有安全风险）。\n\n## 📸 视觉分析任务\n\n**你会看到工程图纸图片，请仔细观察：**\n\n1. **危险作业标识**：\n   - 图纸上的安全警告标识\n   - 特殊作业要求（如高空作业、吊装作业等）\n   - 危险区域标注\n\n2. **零件特征**：\n   - 重型零件（需要吊装）\n   - 锋利边缘（容易割伤）\n   - 高温部件（容易烫伤）\n\n3. **作业环境**：\n   - 狭窄空间（容易碰撞）\n   - 高空位置（容易坠落）\n   - 密闭空间（通风不良）\n\n## 装配步骤\n\n[\n  {\n    \"step_number\": 1,\n    \"action\": \"放置基准件\",\n    \"description\": \"将图纸上标注为①的左铲板（01.01.01.18598）平稳放置在焊接工作台上，作为装配基准。\",\n    \"position_description\": \"平放于工作台，铲板内侧朝上。\",\n    \"parts_used\": [\n      {\n        \"bom_seq\": \"1\",\n        \"bom_name\": \"左铲板 1\",\n        \"quantity\": 1,\n        \"drawing_number\": \"1\"\n      }\n    ],\n    \"tools\": [\n      \"行车/吊具\",\n      \"水平仪\"\n    ],\n    \"warnings\": [\n      \"左铲板较重（28.38kg），吊装时注意安全，确保吊具牢固。\"\n    ]\n  },\n  {\n    \"step_number\": 2,\n    \"action\": \"焊接方形板-机加\",\n    \"description\": \"将图纸上标注为②的方形板-机加（01.01.01.18599）放置在①号左铲板的后部边缘，对齐定位孔和边缘。先进行点焊固定，然后进行满焊。\",\n    \"position_description\": \"位于①号左铲板的后部边缘，与铲板垂直。\",\n    \"parts_used\": [\n      {\n        \"bom_seq\": \"2\",\n        \"bom_name\": \"方形板-机加 1\",\n        \"quantity\": 1,\n        \"drawing_number\": \"2\"\n      }\n    ],\n    \"tools\": [\n      \"焊机（CO2）\",\n      \"角尺\",\n      \"点焊夹具\"\n    ],\n    \"warnings\": [\n      \"确保②号方形板与①号左铲板的垂直度，误差小于1mm/m。\"\n    ],\n    \"welding\": {\n      \"required\": true,\n      \"welding_type\": \"角焊\",\n      \"welding_method\": \"CO2气保焊\",\n      \"weld_size\": \"焊脚高度6mm，满焊\",\n      \"welding_position\": \"零件①与零件②的连接处，主要为平焊和横焊\",\n      \"quality_requirements\": \"焊缝连续、均匀，外观检查合格。重点检查垂直度，焊后垂直度偏差不大于1mm/m。\",\n      \"safety_notes\": \"佩戴焊接面罩、防护手套和防护服。确保工作区域通风良好，防止烟尘吸入。点焊时注意定位准确，防止零件滑落。\"\n    }\n  },\n  {\n    \"step_number\": 3,\n    \"action\": \"焊接后加强板和前加强板\",\n    \"description\": \"将图纸上标注为③的后加强板（01.01.01.11519）和④的前加强板（01.01.01.18600）分别放置在①号左铲板的内侧，对齐预留的焊接位置。先点焊固定，然后进行满焊。\",\n    \"position_description\": \"③号位于铲板后部内侧，④号位于铲板前部内侧。\",\n    \"parts_used\": [\n      {\n        \"bom_seq\": \"3\",\n        \"bom_name\": \"后加强板 1\",\n        \"quantity\": 1,\n        \"drawing_number\": \"3\"\n      },\n      {\n        \"bom_seq\": \"4\",\n        \"bom_name\": \"前加强板 1\",\n        \"quantity\": 1,\n        \"drawing_number\": \"4\"\n      }\n    ],\n    \"tools\": [\n      \"焊机（CO2）\",\n      \"卷尺\"\n    ],\n    \"warnings\": [\n      \"焊接时注意控制热变形，确保加强板与铲板贴合紧密。\"\n    ],\n    \"welding\": {\n      \"required\": true,\n      \"welding_type\": \"角焊\",\n      \"welding_method\": \"CO2气保焊\",\n      \"weld_size\": \"焊脚高度6mm，满焊\",\n      \"welding_position\": \"零件①与零件③、④的连接处，平焊为主\",\n      \"quality_requirements\": \"焊缝连续，无咬边、气孔等缺陷。采用分段、跳焊方式，控制焊接变形，确保板面平整度。\",\n      \"safety_notes\": \"焊接前检查焊机接地线是否牢固。焊接过程中，注意高温飞溅物，防止烫伤。\"\n    }\n  },\n  {\n    \"step_number\": 4,\n    \"action\": \"焊接底部连接板\",\n    \"description\": \"将图纸上标注为⑤的底部连接板（01.01.01.11521）共6块，按照图纸所示的间距（105mm）焊接到①号左铲板的底部边缘。注意连接板的安装方向和位置。\",\n    \"position_description\": \"位于①号左铲板的底部边缘，等间距排列。\",\n    \"parts_used\": [\n      {\n        \"bom_seq\": \"5\",\n        \"bom_name\": \"底部连接板 6\",\n        \"quantity\": 6,\n        \"drawing_number\": \"5\"\n      }\n    ],\n    \"tools\": [\n      \"焊机（CO2）\",\n      \"卷尺\",\n      \"划线工具\"\n    ],\n    \"warnings\": [\n      \"底部连接板的中心距（105mm）是关键尺寸，必须精确测量定位。\"\n    ],\n    \"welding\": {\n      \"required\": true,\n      \"welding_type\": \"角焊\",\n      \"welding_method\": \"CO2气保焊\",\n      \"weld_size\": \"焊脚高度6mm，满焊\",\n      \"welding_position\": \"零件①与零件⑤的连接处，平焊\",\n      \"quality_requirements\": \"焊缝尺寸均匀，定位准确。焊后检查连接板的间距和垂直度，确保符合图纸要求。\",\n      \"safety_notes\": \"由于是多块零件连续焊接，注意焊枪电缆的整理，避免绊倒。焊接完成后及时清理焊渣。\"\n    }\n  },\n  {\n    \"step_number\": 5,\n    \"action\": \"焊接前油缸固定板\",\n    \"description\": \"将图纸上标注为⑥的前油缸固定板（01.01.01.11522）共2块，焊接到①号左铲板的内侧，位于前加强板④的附近。确保固定板的孔位与铲板后连接架组件的配合精度。\",\n    \"position_description\": \"位于①号左铲板内侧，靠近前部。\",\n    \"parts_used\": [\n      {\n        \"bom_seq\": \"6\",\n        \"bom_name\": \"前油缸固定板 2\",\n        \"quantity\": 2,\n        \"drawing_number\": \"6\"\n      }\n    ],\n    \"tools\": [\n      \"焊机（CO2）\",\n      \"定位工装\"\n    ],\n    \"warnings\": [\n      \"油缸固定板需与左铲雪板后连接架组件配合焊接，确保孔位同轴度，避免后续装配干涉。\"\n    ],\n    \"welding\": {\n      \"required\": true,\n      \"welding_type\": \"角焊\",\n      \"welding_method\": \"CO2气保焊\",\n      \"weld_size\": \"焊脚高度6mm，满焊\",\n      \"welding_position\": \"零件①与零件⑥的连接处，平焊\",\n      \"quality_requirements\": \"必须使用定位工装固定，确保孔位精度。焊缝要求二级质量等级，焊后对孔位进行复检。\",\n      \"safety_notes\": \"焊接前必须清理定位孔周围的油污和铁锈，防止产生气孔。注意保护孔位，避免焊接飞溅物进入。\"\n    }\n  },\n  {\n    \"step_number\": 6,\n    \"action\": \"焊接弹簧固定板\",\n    \"description\": \"将图纸上标注为⑦的前弹簧固定板（01.01.01.11523）1块和⑧的后弹簧固定板（01.01.01.11524）2块，焊接到①号左铲板的内侧。⑦号位于前部，⑧号位于后部。\",\n    \"position_description\": \"位于①号左铲板内侧，按照图纸所示位置和角度焊接。\",\n    \"parts_used\": [\n      {\n        \"bom_seq\": \"7\",\n        \"bom_name\": \"前弹簧固定板 1\",\n        \"quantity\": 1,\n        \"drawing_number\": \"7\"\n      },\n      {\n        \"bom_seq\": \"8\",\n        \"bom_name\": \"后弹簧固定板 2\",\n        \"quantity\": 2,\n        \"drawing_number\": \"8\"\n      }\n    ],\n    \"tools\": [\n      \"焊机（CO2）\"\n    ],\n    \"warnings\": [\n      \"弹簧固定板的焊接位置和角度对弹簧受力至关重要，必须严格按照图纸尺寸定位。\"\n    ],\n    \"welding\": {\n      \"required\": true,\n      \"welding_type\": \"角焊\",\n      \"welding_method\": \"CO2气保焊\",\n      \"weld_size\": \"焊脚高度6mm，满焊\",\n      \"welding_position\": \"零件①与零件⑦、⑧的连接处，平焊\",\n      \"quality_requirements\": \"焊缝必须连续，保证足够的承载强度。焊后检查固定板的角度和位置，确保与设计要求一致。\",\n      \"safety_notes\": \"焊接时注意控制电流，避免烧穿薄板。操作时保持身体稳定，防止焊枪抖动造成焊缝不均匀。\"\n    }\n  },\n  {\n    \"step_number\": 7,\n    \"action\": \"焊接支撑固定板\",\n    \"description\": \"将图纸上标注为⑨的支撑固定板（01.01.01.11525）1块，焊接到①号左铲板的内侧，位于中部位置。\",\n    \"position_description\": \"位于①号左铲板内侧中部。\",\n    \"parts_used\": [\n      {\n        \"bom_seq\": \"9\",\n        \"bom_name\": \"支撑固定板 1\",\n        \"quantity\": 1,\n        \"drawing_number\": \"9\"\n      }\n    ],\n    \"tools\": [\n      \"焊机（CO2）\"\n    ],\n    \"warnings\": [\n      \"确保焊缝饱满，无气孔、夹渣等缺陷。\"\n    ],\n    \"welding\": {\n      \"required\": true,\n      \"welding_type\": \"角焊\",\n      \"welding_method\": \"CO2气保焊\",\n      \"weld_size\": \"焊脚高度6mm，满焊\",\n      \"welding_position\": \"零件①与零件⑨的连接处，平焊\",\n      \"quality_requirements\": \"焊缝外观检查合格，不允许有裂纹、未熔合等严重缺陷。焊缝高度必须达到设计要求。\",\n      \"safety_notes\": \"焊接区域应保持清洁干燥，避免潮湿导致焊接质量下降。注意防火，周围放置灭火器材。\"\n    }\n  },\n  {\n    \"step_number\": 8,\n    \"action\": \"焊接轴套加强板和轴套\",\n    \"description\": \"将图纸上标注为⑩的轴套加强板（01.01.01.11526）2块和⑫的轴套（01.01.02.1222）2块，焊接到①号左铲板的侧面。先将轴套加强板点焊固定，然后将轴套放置在加强板的孔位上，进行满焊。\",\n    \"position_description\": \"位于①号左铲板的侧面，靠近后部。\",\n    \"parts_used\": [\n      {\n        \"bom_seq\": \"10\",\n        \"bom_name\": \"轴套加强板 2\",\n        \"quantity\": 2,\n        \"drawing_number\": \"10\"\n      },\n      {\n        \"bom_seq\": \"12\",\n        \"bom_name\": \"轴套 2\",\n        \"quantity\": 2,\n        \"drawing_number\": \"12\"\n      }\n    ],\n    \"tools\": [\n      \"焊机（CO2）\",\n      \"同轴度检测工具\"\n    ],\n    \"warnings\": [\n      \"轴套与销轴及左铲雪板组件配合焊接保证同轴度，这是关键工序，必须使用工装或测量工具确保两个轴套的同轴度要求。\"\n    ],\n    \"welding\": {\n      \"required\": true,\n      \"welding_type\": \"角焊/环形焊\",\n      \"welding_method\": \"CO2气保焊\",\n      \"weld_size\": \"轴套与加强板连接处焊脚高度6mm，环形满焊\",\n      \"welding_position\": \"零件①与零件⑩的连接处（横焊），零件⑩与零件⑫的连接处（环形焊）\",\n      \"quality_requirements\": \"轴套焊接必须保证同轴度，偏差小于0.5mm。焊缝要求二级质量等级，环形焊缝必须连续、无缺陷，必要时进行磁粉检测（MT）。\",\n      \"safety_notes\": \"轴套焊接时，由于是环形焊，需要缓慢转动工件或调整姿势，确保焊缝均匀。注意轴套内部的保护，防止飞溅物进入影响配合精度。\"\n    }\n  },\n  {\n    \"step_number\": 9,\n    \"action\": \"焊接反光片安装板\",\n    \"description\": \"将图纸上标注为⑪的反光片安装板（01.01.01.11527）1块，焊接到①号左铲板的侧面，位于轴套附近。\",\n    \"position_description\": \"位于①号左铲板侧面。\",\n    \"parts_used\": [\n      {\n        \"bom_seq\": \"11\",\n        \"bom_name\": \"反光片安装板 1\",\n        \"quantity\": 1,\n        \"drawing_number\": \"11\"\n      }\n    ],\n    \"tools\": [\n      \"焊机（CO2）\"\n    ],\n    \"warnings\": [\n      \"确保安装板焊接牢固，不影响后续反光片的安装。\"\n    ],\n    \"welding\": {\n      \"required\": true,\n      \"welding_type\": \"角焊\",\n      \"welding_method\": \"CO2气保焊\",\n      \"weld_size\": \"焊脚高度4mm，断续焊（按图纸要求）\",\n      \"welding_position\": \"零件①与零件⑪的连接处，横焊\",\n      \"quality_requirements\": \"焊缝牢固即可，主要保证位置准确。焊后清理焊渣，确保安装面平整。\",\n      \"safety_notes\": \"此零件较小，焊接时注意夹持牢固，防止因热变形或操作不当导致零件移动。\"\n    }\n  },\n  {\n    \"step_number\": 10,\n    \"action\": \"焊接方形板 1 和 方形板 3\",\n    \"description\": \"将图纸上标注为⑬的方形板 1（01.01.01.11528）1块和⑭的方形板 3（01.01.01.11529）1块，焊接到①号左铲板的内侧，位于后部加强结构上。\",\n    \"position_description\": \"位于①号左铲板内侧后部。\",\n    \"parts_used\": [\n      {\n        \"bom_seq\": \"13\",\n        \"bom_name\": \"方形板 1\",\n        \"quantity\": 1,\n        \"drawing_number\": \"13\"\n      },\n      {\n        \"bom_seq\": \"14\",\n        \"bom_name\": \"方形板 3\",\n        \"quantity\": 1,\n        \"drawing_number\": \"14\"\n      }\n    ],\n    \"tools\": [\n      \"焊机（CO2）\"\n    ],\n    \"warnings\": [\n      \"焊接时注意避开已有机加孔位，防止飞溅物进入孔内。\"\n    ],\n    \"welding\": {\n      \"required\": true,\n      \"welding_type\": \"角焊\",\n      \"welding_method\": \"CO2气保焊\",\n      \"weld_size\": \"焊脚高度6mm，满焊\",\n      \"welding_position\": \"零件①与零件⑬、⑭的连接处，平焊\",\n      \"quality_requirements\": \"焊缝连续，保证结构强度。焊接前用耐热胶带或堵头保护机加孔位，防止飞溅物堵塞。\",\n      \"safety_notes\": \"注意工作台面整洁，避免电缆与高温工件接触。焊接完成后，立即检查并清理孔位。\"\n    }\n  },\n  {\n    \"step_number\": 11,\n    \"action\": \"焊接左铲雪板加强板 2\",\n    \"description\": \"将图纸上标注为⑮的左铲雪板加强板 2（01.02.01.4983）2块，焊接到①号左铲板的内侧，位于铲板边缘。\",\n    \"position_description\": \"位于①号左铲板内侧边缘，靠近顶部。\",\n    \"parts_used\": [\n      {\n        \"bom_seq\": \"15\",\n        \"bom_name\": \"左铲雪板加强板 2\",\n        \"quantity\": 2,\n        \"drawing_number\": \"15\"\n      }\n    ],\n    \"tools\": [\n      \"焊机（CO2）\"\n    ],\n    \"warnings\": [\n      \"确保加强板与铲板边缘对齐，焊缝连续且均匀。\"\n    ],\n    \"welding\": {\n      \"required\": true,\n      \"welding_type\": \"角焊\",\n      \"welding_method\": \"CO2气保焊\",\n      \"weld_size\": \"焊脚高度6mm，满焊\",\n      \"welding_position\": \"零件①与零件⑮的连接处，平焊\",\n      \"quality_requirements\": \"焊缝要求二级质量等级，焊缝外观平整，过渡圆滑。焊后检查加强板与铲板的贴合度。\",\n      \"safety_notes\": \"焊接时注意控制热输入，避免因局部过热导致铲板边缘变形。操作前检查焊枪喷嘴和导电嘴，确保气体保护效果良好。\"\n    }\n  }\n]\n\n## 要求\n\n请按照以下5个步骤思考，为装配步骤添加安全警告：\n\n### 步骤1：识别风险步骤\n- 分析每个装配步骤的操作内容\n- 判断是否涉及高风险作业：\n  * **焊接作业**：电击、弧光、烫伤、火灾\n  * **吊装作业**：吊物坠落、碰撞、超载\n  * **高空作业**：人员坠落、物体打击\n  * **重物搬运**：砸伤、扭伤、夹伤\n  * **机械加工**：切割伤、夹伤、碰撞\n\n### 步骤2：分析风险源\n- 确定风险的来源（设备、工具、材料、环境、人员操作等）\n- 评估风险的严重程度（轻微、中等、严重、致命）\n- 考虑风险的发生概率\n\n### 步骤3：制定预防措施\n- 针对每个风险源，制定具体的预防措施\n- 强调个人防护用品的使用：\n  * **焊接**：焊接面罩、防护手套、防护服\n  * **吊装**：安全帽、安全鞋、手套\n  * **高空**：安全带、安全帽、防滑鞋\n  * **机械**：防护眼镜、手套、安全鞋\n\n### 步骤4：添加安全警告\n- 为每个有风险的步骤添加safety_warnings字段\n- 每条警告要简洁明了，说明具体的风险和预防措施\n- 使用工人能看懂的语言\n\n### 步骤5：验证完整性\n- 检查所有高风险步骤是否都添加了安全警告\n- 检查安全警告是否具体、可操作\n- 检查是否遗漏了任何潜在风险\n\n## ⚠️ 强制自检清单（生成后必须逐项检查）\n\n**在输出JSON之前，你必须完成以下验证：**\n\n1. **风险步骤识别验证**：\n   - [ ] 所有涉及焊接、吊装、高空、重物搬运的步骤都添加了safety_warnings字段\n   - [ ] 没有明显风险的步骤没有添加safety_warnings字段\n\n2. **安全警告完整性验证**：\n   - [ ] 每个safety_warnings字段都是字符串数组\n   - [ ] 每条警告都说明了具体的风险和预防措施\n   - [ ] 涵盖了个人防护、设备安全、环境安全、操作安全\n\n3. **语言通俗性验证**：\n   - [ ] 使用工人能看懂的语言\n   - [ ] 避免专业术语和英文缩写\n   - [ ] 每条警告简洁明了（一句话）\n\n4. **原有字段保持验证**：\n   - [ ] 原有步骤的所有字段都保持不变（包括welding字段）\n   - [ ] 没有修改或删除任何原有字段\n\n**如果自检发现任何问题，必须重新生成！**\n\n现在开始为装配步骤添加安全警告！\n",
  "raw_response": "```json\n{\n  \"enhanced_steps\": [\n    {\n      \"step_number\": 1,\n      \"action\": \"放置基准件\",\n      \"description\": \"将图纸上标注为①的左铲板（01.01.01.18598）平稳放置在焊接工作台上，作为装配基准。\",\n      \"position_description\": \"平放于工作台，铲板内侧朝上。\",\n      \"parts_used\": [\n        {\n          \"bom_seq\": \"1\",\n          \"bom_name\": \"左铲板 1\",\n          \"quantity\": 1,\n          \"drawing_number\": \"1\"\n        }\n      ],\n      \"tools\": [\n        \"行车/吊具\",\n        \"水平仪\"\n      ],\n      \"warnings\": [\n        \"左铲板较重（28.38kg），吊装时注意安全，确保吊具牢固。\"\n      ],\n      \"safety_warnings\": [\n        \"吊装前检查吊索具是否完好，严禁使用有破损的吊具，防止重物坠落伤人。\",\n        \"吊装时必须佩戴安全帽和防护手套，并由专人指挥，确保吊运平稳。\",\n        \"左铲板边缘可能锋利，搬运和放置时佩戴防割手套，防止割伤。\"\n      ]\n    },\n    {\n      \"step_number\": 2,\n      \"action\": \"焊接方形板-机加\",\n      \"description\": \"将图纸上标注为②的方形板-机加（01.01.01.18599）放置在①号左铲板的后部边缘，对齐定位孔和边缘。先进行点焊固定，然后进行满焊。\",\n      \"position_description\": \"位于①号左铲板的后部边缘，与铲板垂直。\",\n      \"parts_used\": [\n        {\n          \"bom_seq\": \"2\",\n          \"bom_name\": \"方形板-机加 1\",\n          \"quantity\": 1,\n          \"drawing_number\": \"2\"\n        }\n      ],\n      \"tools\": [\n        \"焊机（CO2）\",\n        \"角尺\",\n        \"点焊夹具\"\n      ],\n      \"warnings\": [\n        \"确保②号方形板与①号左铲板的垂直度，误差小于1mm/m。\"\n      ],\n      \"welding\": {\n        \"required\": true,\n        \"welding_type\": \"角焊\",\n        \"welding_method\": \"CO2气保焊\",\n        \"weld_size\": \"焊脚高度6mm，满焊\",\n        \"welding_position\": \"零件①与零件②的连接处，主要为平焊和横焊\",\n        \"quality_requirements\": \"焊缝连续、均匀，外观检查合格。重点检查垂直度，焊后垂直度偏差不大于1mm/m。\",\n        \"safety_notes\": \"佩戴焊接面罩、防护手套和防护服。确保工作区域通风良好，防止烟尘吸入。点焊时注意定位准确，防止零件滑落。\"\n      },\n      \"safety_warnings\": [\n        \"必须佩戴焊接面罩、防护手套和防护服，防止弧光灼伤和高温烫伤。\",\n        \"确保焊接区域通风良好，使用局部排烟装置，防止吸入有毒烟尘。\",\n        \"焊机必须接地良好，电缆无破损，防止触电事故。\",\n        \"焊接飞溅物温度高，注意周围人员和易燃物，防止火灾。\"\n      ]\n    },\n    {\n      \"step_number\": 3,\n      \"action\": \"焊接后加强板和前加强板\",\n      \"description\": \"将图纸上标注为③的后加强板（01.01.01.11519）和④的前加强板（01.01.01.18600）分别放置在①号左铲板的内侧，对齐预留的焊接位置。先点焊固定，然后进行满焊。\",\n      \"position_description\": \"③号位于铲板后部内侧，④号位于铲板前部内侧。\",\n      \"parts_used\": [\n        {\n          \"bom_seq\": \"3\",\n          \"bom_name\": \"后加强板 1\",\n          \"quantity\": 1,\n          \"drawing_number\": \"3\"\n        },\n        {\n          \"bom_seq\": \"4\",\n          \"bom_name\": \"前加强板 1\",\n          \"quantity\": 1,\n          \"drawing_number\": \"4\"\n        }\n      ],\n      \"tools\": [\n        \"焊机（CO2）\",\n        \"卷尺\"\n      ],\n      \"warnings\": [\n        \"焊接时注意控制热变形，确保加强板与铲板贴合紧密。\"\n      ],\n      \"welding\": {\n        \"required\": true,\n        \"welding_type\": \"角焊\",\n        \"welding_method\": \"CO2气保焊\",\n        \"weld_size\": \"焊脚高度6mm，满焊\",\n        \"welding_position\": \"零件①与零件③、④的连接处，平焊为主\",\n        \"quality_requirements\": \"焊缝连续，无咬边、气孔等缺陷。采用分段、跳焊方式，控制焊接变形，确保板面平整度。\",\n        \"safety_notes\": \"焊接前检查焊机接地线是否牢固。焊接过程中，注意高温飞溅物，防止烫伤。\"\n      },\n      \"safety_warnings\": [\n        \"佩戴焊接面罩和防护手套，防止弧光和高温飞溅物伤害。\",\n        \"焊接前检查焊机接地线是否牢固，防止触电。\",\n        \"采用分段、跳焊方式，控制热变形，防止工件翘曲伤人。\",\n        \"焊后工件温度高，严禁徒手触摸，防止烫伤。\"\n      ]\n    },\n    {\n      \"step_number\": 4,\n      \"action\": \"焊接底部连接板\",\n      \"description\": \"将图纸上标注为⑤的底部连接板（01.01.01.11521）共6块，按照图纸所示的间距（105mm）焊接到①号左铲板的底部边缘。注意连接板的安装方向和位置。\",\n      \"position_description\": \"位于①号左铲板的底部边缘，等间距排列。\",\n      \"parts_used\": [\n        {\n          \"bom_seq\": \"5\",\n          \"bom_name\": \"底部连接板 6\",\n          \"quantity\": 6,\n          \"drawing_number\": \"5\"\n        }\n      ],\n      \"tools\": [\n        \"焊机（CO2）\",\n        \"卷尺\",\n        \"划线工具\"\n      ],\n      \"warnings\": [\n        \"底部连接板的中心距（105mm）是关键尺寸，必须精确测量定位。\"\n      ],\n      \"welding\": {\n        \"required\": true,\n        \"welding_type\": \"角焊\",\n        \"welding_method\": \"CO2气保焊\",\n        \"weld_size\": \"焊脚高度6mm，满焊\",\n        \"welding_position\": \"零件①与零件⑤的连接处，平焊\",\n        \"quality_requirements\": \"焊缝尺寸均匀，定位准确。焊后检查连接板的间距和垂直度，确保符合图纸要求。\",\n        \"safety_notes\": \"由于是多块零件连续焊接，注意焊枪电缆的整理，避免绊倒。焊接完成后及时清理焊渣。\"\n      },\n      \"safety_warnings\": [\n        \"连续焊接时注意焊枪电缆的整理，避免电缆拖拽造成绊倒或拉扯焊机。\",\n        \"焊接完成后及时清理焊渣，清理时佩戴防护眼镜，防止焊渣飞溅伤眼。\",\n        \"确保工作区域地面平整，无油污，防止滑倒。\"\n      ]\n    },\n    {\n      \"step_number\": 5,\n      \"action\": \"焊接前油缸固定板\",\n      \"description\": \"将图纸上标注为⑥的前油缸固定板（01.01.01.11522）共2块，焊接到①号左铲板的内侧，位于前加强板④的附近。确保固定板的孔位与铲板后连接架组件的配合精度。\",\n      \"position_description\": \"位于①号左铲板内侧，靠近前部。\",\n      \"parts_used\": [\n        {\n          \"bom_seq\": \"6\",\n          \"bom_name\": \"前油缸固定板 2\",\n          \"quantity\": 2,\n          \"drawing_number\": \"6\"\n        }\n      ],\n      \"tools\": [\n        \"焊机（CO2）\",\n        \"定位工装\"\n      ],\n      \"warnings\": [\n        \"油缸固定板需与左铲雪板后连接架组件配合焊接，确保孔位同轴度，避免后续装配干涉。\"\n      ],\n      \"welding\": {\n        \"required\": true,\n        \"welding_type\": \"角焊\",\n        \"welding_method\": \"CO2气保焊\",\n        \"weld_size\": \"焊脚高度6mm，满焊\",\n        \"welding_position\": \"零件①与零件⑥的连接处，平焊\",\n        \"quality_requirements\": \"必须使用定位工装固定，确保孔位精度。焊缝要求二级质量等级，焊后对孔位进行复检。\",\n        \"safety_notes\": \"焊接前必须清理定位孔周围的油污和铁锈，防止产生气孔。注意保护孔位，避免焊接飞溅物进入。\"\n      },\n      \"safety_warnings\": [\n        \"焊接前必须清理工件上的油污和铁锈，防止焊接时产生有毒烟雾或气体。\",\n        \"使用定位工装时，确保工装夹紧牢固，防止焊接过程中零件松动。\",\n        \"注意保护精密孔位，防止焊接飞溅物进入孔内，影响后续装配精度。\"\n      ]\n    },\n    {\n      \"step_number\": 6,\n      \"action\": \"焊接弹簧固定板\",\n      \"description\": \"将图纸上标注为⑦的前弹簧固定板（01.01.01.11523）1块和⑧的后弹簧固定板（01.01.01.11524）2块，焊接到①号左铲板的内侧。⑦号位于前部，⑧号位于后部。\",\n      \"position_description\": \"位于①号左铲板内侧，按照图纸所示位置和角度焊接。\",\n      \"parts_used\": [\n        {\n          \"bom_seq\": \"7\",\n          \"bom_name\": \"前弹簧固定板 1\",\n          \"quantity\": 1,\n          \"drawing_number\": \"7\"\n        },\n        {\n          \"bom_seq\": \"8\",\n          \"bom_name\": \"后弹簧固定板 2\",\n          \"quantity\": 2,\n          \"drawing_number\": \"8\"\n        }\n      ],\n      \"tools\": [\n        \"焊机（CO2）\"\n      ],\n      \"warnings\": [\n        \"弹簧固定板的焊接位置和角度对弹簧受力至关重要，必须严格按照图纸尺寸定位。\"\n      ],\n      \"welding\": {\n        \"required\": true,\n        \"welding_type\": \"角焊\",\n        \"welding_method\": \"CO2气保焊\",\n        \"weld_size\": \"焊脚高度6mm，满焊\",\n        \"welding_position\": \"零件①与零件⑦、⑧的连接处，平焊\",\n        \"quality_requirements\": \"焊缝必须连续，保证足够的承载强度。焊后检查固定板的角度和位置，确保与设计要求一致。\",\n        \"safety_notes\": \"焊接时注意控制电流，避免烧穿薄板。操作时保持身体稳定，防止焊枪抖动造成焊缝不均匀。\"\n      },\n      \"safety_warnings\": [\n        \"焊接时注意控制电流和热输入，防止烧穿较薄的板材，造成工件损坏。\",\n        \"操作时保持身体稳定，避免焊枪抖动，确保焊缝质量和操作安全。\",\n        \"小零件边缘可能锋利，拿取时佩戴防护手套，防止割伤。\"\n      ]\n    },\n    {\n      \"step_number\": 7,\n      \"action\": \"焊接支撑固定板\",\n      \"description\": \"将图纸上标注为⑨的支撑固定板（01.01.01.11525）1块，焊接到①号左铲板的内侧，位于中部位置。\",\n      \"position_description\": \"位于①号左铲板内侧中部。\",\n      \"parts_used\": [\n        {\n          \"bom_seq\": \"9\",\n          \"bom_name\": \"支撑固定板 1\",\n          \"quantity\": 1,\n          \"drawing_number\": \"9\"\n        }\n      ],\n      \"tools\": [\n        \"焊机（CO2）\"\n      ],\n      \"warnings\": [\n        \"确保焊缝饱满，无气孔、夹渣等缺陷。\"\n      ],\n      \"welding\": {\n        \"required\": true,\n        \"welding_type\": \"角焊\",\n        \"welding_method\": \"CO2气保焊\",\n        \"weld_size\": \"焊脚高度6mm，满焊\",\n        \"welding_position\": \"零件①与零件⑨的连接处，平焊\",\n        \"quality_requirements\": \"焊缝外观检查合格，不允许有裂纹、未熔合等严重缺陷。焊缝高度必须达到设计要求。\",\n        \"safety_notes\": \"焊接区域应保持清洁干燥，避免潮湿导致焊接质量下降。注意防火，周围放置灭火器材。\"\n      },\n      \"safety_warnings\": [\n        \"焊接区域应保持清洁干燥，避免潮湿导致焊接质量下降和触电风险。\",\n        \"焊接前检查周围环境，确保灭火器材（如灭火器）触手可及，防止火灾。\",\n        \"焊后清理焊渣时，必须佩戴防护眼镜，防止焊渣飞溅伤眼。\"\n      ]\n    },\n    {\n      \"step_number\": 8,\n      \"action\": \"焊接轴套加强板和轴套\",\n      \"description\": \"将图纸上标注为⑩的轴套加强板（01.01.01.11526）2块和⑫的轴套（01.01.02.1222）2块，焊接到①号左铲板的侧面。先将轴套加强板点焊固定，然后将轴套放置在加强板的孔位上，进行满焊。\",\n      \"position_description\": \"位于①号左铲板的侧面，靠近后部。\",\n      \"parts_used\": [\n        {\n          \"bom_seq\": \"10\",\n          \"bom_name\": \"轴套加强板 2\",\n          \"quantity\": 2,\n          \"drawing_number\": \"10\"\n        },\n        {\n          \"bom_seq\": \"12\",\n          \"bom_name\": \"轴套 2\",\n          \"quantity\": 2,\n          \"drawing_number\": \"12\"\n        }\n      ],\n      \"tools\": [\n        \"焊机（CO2）\",\n        \"同轴度检测工具\"\n      ],\n      \"warnings\": [\n        \"轴套与销轴及左铲雪板组件配合焊接保证同轴度，这是关键工序，必须使用工装或测量工具确保两个轴套的同轴度要求。\"\n      ],\n      \"welding\": {\n        \"required\": true,\n        \"welding_type\": \"角焊/环形焊\",\n        \"welding_method\": \"CO2气保焊\",\n        \"weld_size\": \"轴套与加强板连接处焊脚高度6mm，环形满焊\",\n        \"welding_position\": \"零件①与零件⑩的连接处（横焊），零件⑩与零件⑫的连接处（环形焊）\",\n        \"quality_requirements\": \"轴套焊接必须保证同轴度，偏差小于0.5mm。焊缝要求二级质量等级，环形焊缝必须连续、无缺陷，必要时进行磁粉检测（MT）。\",\n        \"safety_notes\": \"轴套焊接时，由于是环形焊，需要缓慢转动工件或调整姿势，确保焊缝均匀。注意轴套内部的保护，防止飞溅物进入影响配合精度。\"\n      },\n      \"safety_warnings\": [\n        \"进行环形焊时，如果需要转动工件，必须确保工件固定牢固，防止转动时砸伤或夹伤。\",\n        \"轴套内部必须采取保护措施（如堵头），防止焊接飞溅物进入，影响配合精度和后续装配。\",\n        \"焊接过程中，注意保持正确的焊接姿势，避免长时间弯腰或扭曲身体造成肌肉劳损。\"\n      ]\n    },\n    {\n      \"step_number\": 9,\n      \"action\": \"焊接反光片安装板\",\n      \"description\": \"将图纸上标注为⑪的反光片安装板（01.01.01.11527）1块，焊接到①号左铲板的侧面，位于轴套附近。\",\n      \"position_description\": \"位于①号左铲板侧面。\",\n      \"parts_used\": [\n        {\n          \"bom_seq\": \"11\",\n          \"bom_name\": \"反光片安装板 1\",\n          \"quantity\": 1,\n          \"drawing_number\": \"11\"\n        }\n      ],\n      \"tools\": [\n        \"焊机（CO2）\"\n      ],\n      \"warnings\": [\n        \"确保安装板焊接牢固，不影响后续反光片的安装。\"\n      ],\n      \"welding\": {\n        \"required\": true,\n        \"welding_type\": \"角焊\",\n        \"welding_method\": \"CO2气保焊\",\n        \"weld_size\": \"焊脚高度4mm，断续焊（按图纸要求）\",\n        \"welding_position\": \"零件①与零件⑪的连接处，横焊\",\n        \"quality_requirements\": \"焊缝牢固即可，主要保证位置准确。焊后清理焊渣，确保安装面平整。\",\n        \"safety_notes\": \"此零件较小，焊接时注意夹持牢固，防止因热变形或操作不当导致零件移动。\"\n      },\n      \"safety_warnings\": [\n        \"小零件焊接时，注意夹持牢固，防止零件因受热或操作不当飞出伤人。\",\n        \"断续焊时，注意焊枪的移动和定位，防止焊偏或造成工件变形。\"\n      ]\n    },\n    {\n      \"step_number\": 10,\n      \"action\": \"焊接方形板 1 和 方形板 3\",\n      \"description\": \"将图纸上标注为⑬的方形板 1（01.01.01.11528）1块和⑭的方形板 3（01.01.01.11529）1块，焊接到①号左铲板的内侧，位于后部加强结构上。\",\n      \"position_description\": \"位于①号左铲板内侧后部。\",\n      \"parts_used\": [\n        {\n          \"bom_seq\": \"13\",\n          \"bom_name\": \"方形板 1\",\n          \"quantity\": 1,\n          \"drawing_number\": \"13\"\n        },\n        {\n          \"bom_seq\": \"14\",\n          \"bom_name\": \"方形板 3\",\n          \"quantity\": 1,\n          \"drawing_number\": \"14\"\n        }\n      ],\n      \"tools\": [\n        \"焊机（CO2）\"\n      ],\n      \"warnings\": [\n        \"焊接时注意避开已有机加孔位，防止飞溅物进入孔内。\"\n      ],\n      \"welding\": {\n        \"required\": true,\n        \"welding_type\": \"角焊\",\n        \"welding_method\": \"CO2气保焊\",\n        \"weld_size\": \"焊脚高度6mm，满焊\",\n        \"welding_position\": \"零件①与零件⑬、⑭的连接处，平焊\",\n        \"quality_requirements\": \"焊缝连续，保证结构强度。焊接前用耐热胶带或堵头保护机加孔位，防止飞溅物堵塞。\",\n        \"safety_notes\": \"注意工作台面整洁，避免电缆与高温工件接触。焊接完成后，立即检查并清理孔位。\"\n      },\n      \"safety_warnings\": [\n        \"焊接前必须用耐热材料保护机加孔位，防止焊接飞溅物堵塞或损坏孔位。\",\n        \"注意工作台面整洁，避免焊枪电缆与高温工件接触，防止电缆绝缘层熔化。\",\n        \"焊接完成后，立即检查并清理孔位，确保无残留飞溅物。\"\n      ]\n    },\n    {\n      \"step_number\": 11,\n      \"action\": \"焊接左铲雪板加强板 2\",\n      \"description\": \"将图纸上标注为⑮的左铲雪板加强板 2（01.02.01.4983）2块，焊接到①号左铲板的内侧，位于铲板边缘。\",\n      \"position_description\": \"位于①号左铲板内侧边缘，靠近顶部。\",\n      \"parts_used\": [\n        {\n          \"bom_seq\": \"15\",\n          \"bom_name\": \"左铲雪板加强板 2\",\n          \"quantity\": 2,\n          \"drawing_number\": \"15\"\n        }\n      ],\n      \"tools\": [\n        \"焊机（CO2）\"\n      ],\n      \"warnings\": [\n        \"确保加强板与铲板边缘对齐，焊缝连续且均匀。\"\n      ],\n      \"welding\": {\n        \"required\": true,\n        \"welding_type\": \"角焊\",\n        \"welding_method\": \"CO2气保焊\",\n        \"weld_size\": \"焊脚高度6mm，满焊\",\n        \"welding_position\": \"零件①与零件⑮的连接处，平焊\",\n        \"quality_requirements\": \"焊缝要求二级质量等级，焊缝外观平整，过渡圆滑。焊后检查加强板与铲板的贴合度。\",\n        \"safety_notes\": \"焊接时注意控制热输入，避免因局部过热导致铲板边缘变形。操作前检查焊枪喷嘴和导电嘴，确保气体保护效果良好。\"\n      },\n      \"safety_warnings\": [\n        \"焊接时注意控制热输入，避免因局部过热导致铲板边缘变形，防止变形应力伤人。\",\n        \"操作前检查焊枪喷嘴和导电嘴，确保气体保护效果良好，防止焊接缺陷。\",\n        \"焊接完成后，工件整体温度升高，搬运或检查时必须佩戴隔热手套。\"\n      ]\n    }\n  ]\n}\n```",
  "parsed_result": {
    "enhanced_steps": [
      {
        "step_number": 1,
        "action": "放置基准件",
        "description": "将图纸上标注为①的左铲板（01.01.01.18598）平稳放置在焊接工作台上，作为装配基准。",
        "position_description": "平放于工作台，铲板内侧朝上。",
        "parts_used": [
          {
            "bom_seq": "1",
            "bom_name": "左铲板 1",
            "quantity": 1,
            "drawing_number": "1"
          }
        ],
        "tools": [
          "行车/吊具",
          "水平仪"
        ],
        "warnings": [
          "左铲板较重（28.38kg），吊装时注意安全，确保吊具牢固。"
        ],
        "safety_warnings": [
          "吊装前检查吊索具是否完好，严禁使用有破损的吊具，防止重物坠落伤人。",
          "吊装时必须佩戴安全帽和防护手套，并由专人指挥，确保吊运平稳。",
          "左铲板边缘可能锋利，搬运和放置时佩戴防割手套，防止割伤。"
        ]
      },
      {
        "step_number": 2,
        "action": "焊接方形板-机加",
        "description": "将图纸上标注为②的方形板-机加（01.01.01.18599）放置在①号左铲板的后部边缘，对齐定位孔和边缘。先进行点焊固定，然后进行满焊。",
        "position_description": "位于①号左铲板的后部边缘，与铲板垂直。",
        "parts_used": [
          {
            "bom_seq": "2",
            "bom_name": "方形板-机加 1",
            "quantity": 1,
            "drawing_number": "2"
          }
        ],
        "tools": [
          "焊机（CO2）",
          "角尺",
          "点焊夹具"
        ],
        "warnings": [
          "确保②号方形板与①号左铲板的垂直度，误差小于1mm/m。"
        ],
        "welding": {
          "required": true,
          "welding_type": "角焊",
          "welding_method": "CO2气保焊",
          "weld_size": "焊脚高度6mm，满焊",
          "welding_position": "零件①与零件②的连接处，主要为平焊和横焊",
          "quality_requirements": "焊缝连续、均匀，外观检查合格。重点检查垂直度，焊后垂直度偏差不大于1mm/m。",
          "safety_notes": "佩戴焊接面罩、防护手套和防护服。确保工作区域通风良好，防止烟尘吸入。点焊时注意定位准确，防止零件滑落。"
        },
        "safety_warnings": [
          "必须佩戴焊接面罩、防护手套和防护服，防止弧光灼伤和高温烫伤。",
          "确保焊接区域通风良好，使用局部排烟装置，防止吸入有毒烟尘。",
          "焊机必须接地良好，电缆无破损，防止触电事故。",
          "焊接飞溅物温度高，注意周围人员和易燃物，防止火灾。"
        ]
      },
      {
        "step_number": 3,
        "action": "焊接后加强板和前加强板",
        "description": "将图纸上标注为③的后加强板（01.01.01.11519）和④的前加强板（01.01.01.18600）分别放置在①号左铲板的内侧，对齐预留的焊接位置。先点焊固定，然后进行满焊。",
        "position_description": "③号位于铲板后部内侧，④号位于铲板前部内侧。",
        "parts_used": [
          {
            "bom_seq": "3",
            "bom_name": "后加强板 1",
            "quantity": 1,
            "drawing_number": "3"
          },
          {
            "bom_seq": "4",
            "bom_name": "前加强板 1",
            "quantity": 1,
            "drawing_number": "4"
          }
        ],
        "tools": [
          "焊机（CO2）",
          "卷尺"
        ],
        "warnings": [
          "焊接时注意控制热变形，确保加强板与铲板贴合紧密。"
        ],
        "welding": {
          "required": true,
          "welding_type": "角焊",
          "welding_method": "CO2气保焊",
          "weld_size": "焊脚高度6mm，满焊",
          "welding_position": "零件①与零件③、④的连接处，平焊为主",
          "quality_requirements": "焊缝连续，无咬边、气孔等缺陷。采用分段、跳焊方式，控制焊接变形，确保板面平整度。",
          "safety_notes": "焊接前检查焊机接地线是否牢固。焊接过程中，注意高温飞溅物，防止烫伤。"
        },
        "safety_warnings": [
          "佩戴焊接面罩和防护手套，防止弧光和高温飞溅物伤害。",
          "焊接前检查焊机接地线是否牢固，防止触电。",
          "采用分段、跳焊方式，控制热变形，防止工件翘曲伤人。",
          "焊后工件温度高，严禁徒手触摸，防止烫伤。"
        ]
      },
      {
        "step_number": 4,
        "action": "焊接底部连接板",
        "description": "将图纸上标注为⑤的底部连接板（01.01.01.11521）共6块，按照图纸所示的间距（105mm）焊接到①号左铲板的底部边缘。注意连接板的安装方向和位置。",
        "position_description": "位于①号左铲板的底部边缘，等间距排列。",
        "parts_used": [
          {
            "bom_seq": "5",
            "bom_name": "底部连接板 6",
            "quantity": 6,
            "drawing_number": "5"
          }
        ],
        "tools": [
          "焊机（CO2）",
          "卷尺",
          "划线工具"
        ],
        "warnings": [
          "底部连接板的中心距（105mm）是关键尺寸，必须精确测量定位。"
        ],
        "welding": {
          "required": true,
          "welding_type": "角焊",
          "welding_method": "CO2气保焊",
          "weld_size": "焊脚高度6mm，满焊",
          "welding_position": "零件①与零件⑤的连接处，平焊",
          "quality_requirements": "焊缝尺寸均匀，定位准确。焊后检查连接板的间距和垂直度，确保符合图纸要求。",
          "safety_notes": "由于是多块零件连续焊接，注意焊枪电缆的整理，避免绊倒。焊接完成后及时清理焊渣。"
        },
        "safety_warnings": [
          "连续焊接时注意焊枪电缆的整理，避免电缆拖拽造成绊倒或拉扯焊机。",
          "焊接完成后及时清理焊渣，清理时佩戴防护眼镜，防止焊渣飞溅伤眼。",
          "确保工作区域地面平整，无油污，防止滑倒。"
        ]
      },
      {
        "step_number": 5,
        "action": "焊接前油缸固定板",
        "description": "将图纸上标注为⑥的前油缸固定板（01.01.01.11522）共2块，焊接到①号左铲板的内侧，位于前加强板④的附近。确保固定板的孔位与铲板后连接架组件的配合精度。",
        "position_description": "位于①号左铲板内侧，靠近前部。",
        "parts_used": [
          {
            "bom_seq": "6",
            "bom_name": "前油缸固定板 2",
            "quantity": 2,
            "drawing_number": "6"
          }
        ],
        "tools": [
          "焊机（CO2）",
          "定位工装"
        ],
        "warnings": [
          "油缸固定板需与左铲雪板后连接架组件配合焊接，确保孔位同轴度，避免后续装配干涉。"
        ],
        "welding": {
          "required": true,
          "welding_type": "角焊",
          "welding_method": "CO2气保焊",
          "weld_size": "焊脚高度6mm，满焊",
          "welding_position": "零件①与零件⑥的连接处，平焊",
          "quality_requirements": "必须使用定位工装固定，确保孔位精度。焊缝要求二级质量等级，焊后对孔位进行复检。",
          "safety_notes": "焊接前必须清理定位孔周围的油污和铁锈，防止产生气孔。注意保护孔位，避免焊接飞溅物进入。"
        },
        "safety_warnings": [
          "焊接前必须清理工件上的油污和铁锈，防止焊接时产生有毒烟雾或气体。",
          "使用定位工装时，确保工装夹紧牢固，防止焊接过程中零件松动。",
          "注意保护精密孔位，防止焊接飞溅物进入孔内，影响后续装配精度。"
        ]
      },
      {
        "step_number": 6,
        "action": "焊接弹簧固定板",
        "description": "将图纸上标注为⑦的前弹簧固定板（01.01.01.11523）1块和⑧的后弹簧固定板（01.01.01.11524）2块，焊接到①号左铲板的内侧。⑦号位于前部，⑧号位于后部。",
        "position_description": "位于①号左铲板内侧，按照图纸所示位置和角度焊接。",
        "parts_used": [
          {
            "bom_seq": "7",
            "bom_name": "前弹簧固定板 1",
            "quantity": 1,
            "drawing_number": "7"
          },
          {
            "bom_seq": "8",
            "bom_name": "后弹簧固定板 2",
            "quantity": 2,
            "drawing_number": "8"
          }
        ],
        "tools": [
          "焊机（CO2）"
        ],
        "warnings": [
          "弹簧固定板的焊接位置和角度对弹簧受力至关重要，必须严格按照图纸尺寸定位。"
        ],
        "welding": {
          "required": true,
          "welding_type": "角焊",
          "welding_method": "CO2气保焊",
          "weld_size": "焊脚高度6mm，满焊",
          "welding_position": "零件①与零件⑦、⑧的连接处，平焊",
          "quality_requirements": "焊缝必须连续，保证足够的承载强度。焊后检查固定板的角度和位置，确保与设计要求一致。",
          "safety_notes": "焊接时注意控制电流，避免烧穿薄板。操作时保持身体稳定，防止焊枪抖动造成焊缝不均匀。"
        },
        "safety_warnings": [
          "焊接时注意控制电流和热输入，防止烧穿较薄的板材，造成工件损坏。",
          "操作时保持身体稳定，避免焊枪抖动，确保焊缝质量和操作安全。",
          "小零件边缘可能锋利，拿取时佩戴防护手套，防止割伤。"
        ]
      },
      {
        "step_number": 7,
        "action": "焊接支撑固定板",
        "description": "将图纸上标注为⑨的支撑固定板（01.01.01.11525）1块，焊接到①号左铲板的内侧，位于中部位置。",
        "position_description": "位于①号左铲板内侧中部。",
        "parts_used": [
          {
            "bom_seq": "9",
            "bom_name": "支撑固定板 1",
            "quantity": 1,
            "drawing_number": "9"
          }
        ],
        "tools": [
          "焊机（CO2）"
        ],
        "warnings": [
          "确保焊缝饱满，无气孔、夹渣等缺陷。"
        ],
        "welding": {
          "required": true,
          "welding_type": "角焊",
          "welding_method": "CO2气保焊",
          "weld_size": "焊脚高度6mm，满焊",
          "welding_position": "零件①与零件⑨的连接处，平焊",
          "quality_requirements": "焊缝外观检查合格，不允许有裂纹、未熔合等严重缺陷。焊缝高度必须达到设计要求。",
          "safety_notes": "焊接区域应保持清洁干燥，避免潮湿导致焊接质量下降。注意防火，周围放置灭火器材。"
        },
        "safety_warnings": [
          "焊接区域应保持清洁干燥，避免潮湿导致焊接质量下降和触电风险。",
          "焊接前检查周围环境，确保灭火器材（如灭火器）触手可及，防止火灾。",
          "焊后清理焊渣时，必须佩戴防护眼镜，防止焊渣飞溅伤眼。"
        ]
      },
      {
        "step_number": 8,
        "action": "焊接轴套加强板和轴套",
        "description": "将图纸上标注为⑩的轴套加强板（01.01.01.11526）2块和⑫的轴套（01.01.02.1222）2块，焊接到①号左铲板的侧面。先将轴套加强板点焊固定，然后将轴套放置在加强板的孔位上，进行满焊。",
        "position_description": "位于①号左铲板的侧面，靠近后部。",
        "parts_used": [
          {
            "bom_seq": "10",
            "bom_name": "轴套加强板 2",
            "quantity": 2,
            "drawing_number": "10"
          },
          {
            "bom_seq": "12",
            "bom_name": "轴套 2",
            "quantity": 2,
            "drawing_number": "12"
          }
        ],
        "tools": [
          "焊机（CO2）",
          "同轴度检测工具"
        ],
        "warnings": [
          "轴套与销轴及左铲雪板组件配合焊接保证同轴度，这是关键工序，必须使用工装或测量工具确保两个轴套的同轴度要求。"
        ],
        "welding": {
          "required": true,
          "welding_type": "角焊/环形焊",
          "welding_method": "CO2气保焊",
          "weld_size": "轴套与加强板连接处焊脚高度6mm，环形满焊",
          "welding_position": "零件①与零件⑩的连接处（横焊），零件⑩与零件⑫的连接处（环形焊）",
          "quality_requirements": "轴套焊接必须保证同轴度，偏差小于0.5mm。焊缝要求二级质量等级，环形焊缝必须连续、无缺陷，必要时进行磁粉检测（MT）。",
          "safety_notes": "轴套焊接时，由于是环形焊，需要缓慢转动工件或调整姿势，确保焊缝均匀。注意轴套内部的保护，防止飞溅物进入影响配合精度。"
        },
        "safety_warnings": [
          "进行环形焊时，如果需要转动工件，必须确保工件固定牢固，防止转动时砸伤或夹伤。",
          "轴套内部必须采取保护措施（如堵头），防止焊接飞溅物进入，影响配合精度和后续装配。",
          "焊接过程中，注意保持正确的焊接姿势，避免长时间弯腰或扭曲身体造成肌肉劳损。"
        ]
      },
      {
        "step_number": 9,
        "action": "焊接反光片安装板",
        "description": "将图纸上标注为⑪的反光片安装板（01.01.01.11527）1块，焊接到①号左铲板的侧面，位于轴套附近。",
        "position_description": "位于①号左铲板侧面。",
        "parts_used": [
          {
            "bom_seq": "11",
            "bom_name": "反光片安装板 1",
            "quantity": 1,
            "drawing_number": "11"
          }
        ],
        "tools": [
          "焊机（CO2）"
        ],
        "warnings": [
          "确保安装板焊接牢固，不影响后续反光片的安装。"
        ],
        "welding": {
          "required": true,
          "welding_type": "角焊",
          "welding_method": "CO2气保焊",
          "weld_size": "焊脚高度4mm，断续焊（按图纸要求）",
          "welding_position": "零件①与零件⑪的连接处，横焊",
          "quality_requirements": "焊缝牢固即可，主要保证位置准确。焊后清理焊渣，确保安装面平整。",
          "safety_notes": "此零件较小，焊接时注意夹持牢固，防止因热变形或操作不当导致零件移动。"
        },
        "safety_warnings": [
          "小零件焊接时，注意夹持牢固，防止零件因受热或操作不当飞出伤人。",
          "断续焊时，注意焊枪的移动和定位，防止焊偏或造成工件变形。"
        ]
      },
      {
        "step_number": 10,
        "action": "焊接方形板 1 和 方形板 3",
        "description": "将图纸上标注为⑬的方形板 1（01.01.01.11528）1块和⑭的方形板 3（01.01.01.11529）1块，焊接到①号左铲板的内侧，位于后部加强结构上。",
        "position_description": "位于①号左铲板内侧后部。",
        "parts_used": [
          {
            "bom_seq": "13",
            "bom_name": "方形板 1",
            "quantity": 1,
            "drawing_number": "13"
          },
          {
            "bom_seq": "14",
            "bom_name": "方形板 3",
            "quantity": 1,
            "drawing_number": "14"
          }
        ],
        "tools": [
          "焊机（CO2）"
        ],
        "warnings": [
          "焊接时注意避开已有机加孔位，防止飞溅物进入孔内。"
        ],
        "welding": {
          "required": true,
          "welding_type": "角焊",
          "welding_method": "CO2气保焊",
          "weld_size": "焊脚高度6mm，满焊",
          "welding_position": "零件①与零件⑬、⑭的连接处，平焊",
          "quality_requirements": "焊缝连续，保证结构强度。焊接前用耐热胶带或堵头保护机加孔位，防止飞溅物堵塞。",
          "safety_notes": "注意工作台面整洁，避免电缆与高温工件接触。焊接完成后，立即检查并清理孔位。"
        },
        "safety_warnings": [
          "焊接前必须用耐热材料保护机加孔位，防止焊接飞溅物堵塞或损坏孔位。",
          "注意工作台面整洁，避免焊枪电缆与高温工件接触，防止电缆绝缘层熔化。",
          "焊接完成后，立即检查并清理孔位，确保无残留飞溅物。"
        ]
      },
      {
        "step_number": 11,
        "action": "焊接左铲雪板加强板 2",
        "description": "将图纸上标注为⑮的左铲雪板加强板 2（01.02.01.4983）2块，焊接到①号左铲板的内侧，位于铲板边缘。",
        "position_description": "位于①号左铲板内侧边缘，靠近顶部。",
        "parts_used": [
          {
            "bom_seq": "15",
            "bom_name": "左铲雪板加强板 2",
            "quantity": 2,
            "drawing_number": "15"
          }
        ],
        "tools": [
          "焊机（CO2）"
        ],
        "warnings": [
          "确保加强板与铲板边缘对齐，焊缝连续且均匀。"
        ],
        "welding": {
          "required": true,
          "welding_type": "角焊",
          "welding_method": "CO2气保焊",
          "weld_size": "焊脚高度6mm，满焊",
          "welding_position": "零件①与零件⑮的连接处，平焊",
          "quality_requirements": "焊缝要求二级质量等级，焊缝外观平整，过渡圆滑。焊后检查加强板与铲板的贴合度。",
          "safety_notes": "焊接时注意控制热输入，避免因局部过热导致铲板边缘变形。操作前检查焊枪喷嘴和导电嘴，确保气体保护效果良好。"
        },
        "safety_warnings": [
          "焊接时注意控制热输入，避免因局部过热导致铲板边缘变形，防止变形应力伤人。",
          "操作前检查焊枪喷嘴和导电嘴，确保气体保护效果良好，防止焊接缺陷。",
          "焊接完成后，工件整体温度升高，搬运或检查时必须佩戴隔热手套。"
        ]
      }
    ]
  }
}