{
  "agent_name": "Agent6_FAQ",
  "model": "google/gemini-2.5-flash-preview-09-2025",
  "timestamp": "20251005_140512",
  "image_count": 0,
  "temperature": 0.2,
  "system_prompt": "# 角色定位\n\n你是**李师傅**，一位拥有20年安全管理经验的高级安全工程师。\n\n## 教育背景\n\n- **学历**：安全工程专业本科\n- **职业资格**：注册安全工程师、高级安全评价师\n- **专业培训**：\n  - 机械制造安全管理\n  - 职业健康与安全管理体系（ISO 45001）\n  - 事故调查与分析\n  - 应急预案编制与演练\n\n## 职业背景\n\n- **工作经历**：20年机械制造企业安全管理经验，参与过大型装备制造、钢结构加工等项目\n- **专业领域**：\n  - 机械加工安全（车、铣、刨、磨、钻等）\n  - 焊接作业安全（电焊、气焊、氩弧焊等）\n  - 起重吊装安全（行车、叉车、吊索具等）\n  - 高空作业安全（脚手架、安全带、防坠落等）\n  - 个人防护用品管理（安全帽、防护眼镜、手套、安全鞋等）\n\n## 知识结构（详细）\n\n### 1. 机械伤害风险\n- **夹伤/挤伤**：手指、手臂被运动部件夹住\n- **切割伤**：锋利边缘、毛刺、切削工具\n- **碰撞伤**：头部碰撞、身体碰撞\n- **坠落伤**：零件坠落、工具坠落、人员坠落\n\n### 2. 焊接作业风险\n- **电击伤**：焊机漏电、接地不良\n- **弧光伤**：电弧紫外线灼伤眼睛和皮肤\n- **烫伤**：高温熔池、焊渣飞溅\n- **火灾爆炸**：易燃物引燃、气瓶泄漏\n- **有毒气体**：焊接烟尘、一氧化碳中毒\n\n### 3. 起重吊装风险\n- **吊物坠落**：吊索具断裂、捆绑不牢\n- **吊物摆动**：碰撞人员、设备\n- **超载**：超过起重机额定载荷\n- **指挥失误**：信号不清、违章指挥\n\n### 4. 高空作业风险\n- **人员坠落**：未系安全带、脚手架不牢\n- **物体打击**：工具、零件从高处坠落\n- **脚手架坍塌**：搭设不规范、超载\n\n### 5. 个人防护用品\n- **头部防护**：安全帽（防止碰撞、坠物打击）\n- **眼部防护**：防护眼镜、焊接面罩（防止飞溅、弧光）\n- **手部防护**：防护手套（防止切割、烫伤、化学品）\n- **足部防护**：安全鞋（防砸、防刺穿、防滑）\n- **呼吸防护**：防尘口罩、防毒面具（防止粉尘、有毒气体）\n\n### 6. 应急处理\n- **机械伤害**：立即停机、呼救、止血、固定、送医\n- **电击伤**：切断电源、心肺复苏、送医\n- **烫伤**：冷水冲洗、覆盖无菌纱布、送医\n- **火灾**：使用灭火器、疏散人员、报警\n\n## 任务步骤（Chain of Thought）\n\n你的任务是**为每个装配步骤添加安全警告**（如果该步骤有安全风险）。请按照以下5个步骤思考：\n\n### 步骤1：识别风险步骤\n- 分析每个装配步骤的操作内容\n- 判断是否涉及高风险作业（焊接、吊装、高空、重物搬运等）\n- 识别潜在的伤害类型（机械伤害、电击、烫伤、坠落等）\n\n### 步骤2：分析风险源\n- 确定风险的来源（设备、工具、材料、环境、人员操作等）\n- 评估风险的严重程度（轻微、中等、严重、致命）\n- 考虑风险的发生概率\n\n### 步骤3：制定预防措施\n- 针对每个风险源，制定具体的预防措施\n- 强调个人防护用品的使用\n- 强调安全操作规程的遵守\n\n### 步骤4：添加安全警告\n- 为每个有风险的步骤添加safety_warnings字段\n- 每条警告要简洁明了，说明具体的风险和预防措施\n- 使用工人能看懂的语言\n\n### 步骤5：验证完整性\n- 检查所有高风险步骤是否都添加了安全警告\n- 检查安全警告是否具体、可操作\n- 检查是否遗漏了任何潜在风险\n\n## 核心原则\n\n1. **步骤级嵌入**：为每个有风险的步骤添加safety_warnings字段，而不是单独列出安全警告\n2. **工人友好**：使用通俗语言，避免专业术语\n3. **具体可操作**：说明具体的风险和预防措施，而不是泛泛而谈\n4. **不重复显示**：安全警告只在下方\"安全\"标签页中统一显示，不在当前步骤详情中重复显示\n\n## 输出格式\n\n严格按照以下JSON格式输出（返回增强后的装配步骤）：\n\n```json\n{\n  \"enhanced_steps\": [\n    {\n      \"step_number\": 1,\n      \"title\": \"点焊定位\",\n      \"parts_used\": [...],\n      \"tools_required\": [...],\n      \"operation\": \"操作说明\",\n      \"quality_check\": \"质量检查\",\n      \"estimated_time_minutes\": 10,\n      \"welding\": {\n        \"required\": true,\n        \"welding_type\": \"点焊\",\n        \"welding_method\": \"CO2气保焊\",\n        ...\n      },\n      \"safety_warnings\": [\n        \"佩戴焊接面罩和防护手套，防止弧光灼伤眼睛和皮肤\",\n        \"确保工件夹紧牢固，防止点焊时位移造成伤害\",\n        \"焊接区域周围3米内不得有易燃物，配备灭火器\",\n        \"焊机必须接地良好，防止漏电触电\"\n      ]\n    },\n    {\n      \"step_number\": 2,\n      \"title\": \"螺栓连接\",\n      \"parts_used\": [...],\n      \"operation\": \"操作说明\",\n      \"quality_check\": \"质量检查\",\n      \"estimated_time_minutes\": 15,\n      \"safety_warnings\": [\n        \"佩戴安全帽和防护眼镜，防止零件坠落和飞溅\",\n        \"使用扭力扳手时注意力度，防止扳手滑脱伤人\"\n      ]\n    },\n    {\n      \"step_number\": 3,\n      \"title\": \"简单装配\",\n      \"parts_used\": [...],\n      \"operation\": \"操作说明\",\n      \"quality_check\": \"质量检查\",\n      \"estimated_time_minutes\": 5\n      // ⚠️ 如果没有明显安全风险，不添加safety_warnings字段\n    }\n  ]\n}\n```\n\n**⚠️ 关键要求**：\n\n1. **步骤级嵌入**：\n   - 为每个有风险的步骤添加`safety_warnings`字段\n   - 没有明显风险的步骤不添加`safety_warnings`字段\n   - 保持原有步骤的所有字段不变\n\n2. **安全警告要具体**：\n   - ✅ 说\"佩戴焊接面罩和防护手套，防止弧光灼伤眼睛和皮肤\"\n   - ❌ 不说\"注意安全\"\n   - ✅ 说\"焊接区域周围3米内不得有易燃物，配备灭火器\"\n   - ❌ 不说\"注意防火\"\n\n3. **使用通俗语言**：\n   - 工人能看懂的语言\n   - 避免专业术语和英文缩写\n\n4. **警告要全面**：\n   - 涵盖个人防护、设备安全、环境安全、操作安全\n   - 每条警告说明具体的风险和预防措施\n\n## 重要提醒\n\n- **只输出JSON，不要输出其他内容**\n- **保持原有字段不变**：不要修改或删除原有的字段（包括welding字段）\n- **警告要简洁明了**：每条警告一句话，说明风险和预防措施\n- **不要过度警告**：只针对有明显风险的步骤添加警告\n",
  "user_query": "请为以下装配步骤添加安全警告（如果有安全风险）。\n\n## 📸 视觉分析任务\n\n**你会看到工程图纸图片，请仔细观察：**\n\n1. **危险作业标识**：\n   - 图纸上的安全警告标识\n   - 特殊作业要求（如高空作业、吊装作业等）\n   - 危险区域标注\n\n2. **零件特征**：\n   - 重型零件（需要吊装）\n   - 锋利边缘（容易割伤）\n   - 高温部件（容易烫伤）\n\n3. **作业环境**：\n   - 狭窄空间（容易碰撞）\n   - 高空位置（容易坠落）\n   - 密闭空间（通风不良）\n\n## 装配步骤\n\n[\n  {\n    \"step_number\": 1,\n    \"action\": \"放置基准件\",\n    \"description\": \"将图纸上标注为1的左铲板（01.01.01.18598）平稳放置在装配工作台上，作为装配基准。\",\n    \"position_description\": \"平放于工作台，内侧（有安装孔的一面）朝上。\",\n    \"parts_used\": [\n      {\n        \"bom_seq\": \"1\",\n        \"bom_name\": \"左铲板 1\",\n        \"quantity\": 1,\n        \"drawing_number\": \"1\",\n        \"mesh_id\": [\n          \"mesh_026\"\n        ],\n        \"bom_code\": \"01.01.01.18598\"\n      }\n    ],\n    \"tools\": [\n      \"行车\",\n      \"吊具\"\n    ],\n    \"warnings\": [\n      \"铲板较重，吊装时注意平衡，防止倾倒。\"\n    ]\n  },\n  {\n    \"step_number\": 2,\n    \"action\": \"焊接方形板-机加\",\n    \"description\": \"将图纸上标注为2的方形板-机加（01.01.01.18599）放置在1号左铲板的后侧（图纸左侧），对齐定位孔后进行点焊固定。注意，该板件为机加件，需确保定位准确。\",\n    \"position_description\": \"在1号左铲板的后侧边缘，与铲板垂直。\",\n    \"parts_used\": [\n      {\n        \"bom_seq\": \"2\",\n        \"bom_name\": \"方形板-机加 1\",\n        \"quantity\": 1,\n        \"drawing_number\": \"2\",\n        \"mesh_id\": [\n          \"mesh_025\"\n        ],\n        \"bom_code\": \"01.01.01.18599\"\n      }\n    ],\n    \"tools\": [\n      \"焊机\",\n      \"角尺\",\n      \"夹具\"\n    ],\n    \"warnings\": [\n      \"焊接前检查定位孔是否对齐，确保方形板与铲板的垂直度。\"\n    ],\n    \"welding\": {\n      \"required\": true,\n      \"welding_type\": \"角焊（定位焊）\",\n      \"welding_method\": \"CO2气保焊\",\n      \"weld_size\": \"点焊，焊点长度10mm，焊脚高度4mm\",\n      \"welding_position\": \"零件①（左铲板）与零件②（方形板-机加）的连接面，平焊\",\n      \"quality_requirements\": \"点焊牢固，保证零件定位准确，垂直度误差小于1mm\",\n      \"safety_notes\": \"佩戴焊接面罩和防护手套，确保工作区域通风良好，防止火花飞溅。\"\n    }\n  },\n  {\n    \"step_number\": 3,\n    \"action\": \"焊接后加强板和前加强板\",\n    \"description\": \"将图纸上标注为3的后加强板（01.01.01.11519）和4的前加强板（01.01.01.18600）分别放置在1号左铲板的内侧，对齐预留的焊接位置后进行点焊固定。\",\n    \"position_description\": \"3号后加强板位于铲板内侧靠后位置；4号前加强板位于铲板内侧靠前位置。\",\n    \"parts_used\": [\n      {\n        \"bom_seq\": \"3\",\n        \"bom_name\": \"后加强板 1\",\n        \"quantity\": 1,\n        \"drawing_number\": \"3\",\n        \"mesh_id\": [\n          \"mesh_024\"\n        ],\n        \"bom_code\": \"01.01.01.11519\"\n      },\n      {\n        \"bom_seq\": \"4\",\n        \"bom_name\": \"前加强板 1\",\n        \"quantity\": 1,\n        \"drawing_number\": \"4\",\n        \"mesh_id\": [\n          \"mesh_023\"\n        ],\n        \"bom_code\": \"01.01.01.18600\"\n      }\n    ],\n    \"tools\": [\n      \"焊机\",\n      \"卷尺\"\n    ],\n    \"warnings\": [\n      \"确保两块加强板与铲板的贴合度，避免虚焊。\"\n    ],\n    \"welding\": {\n      \"required\": true,\n      \"welding_type\": \"角焊（定位焊）\",\n      \"welding_method\": \"CO2气保焊\",\n      \"weld_size\": \"点焊，焊点长度10mm，焊脚高度4mm\",\n      \"welding_position\": \"零件①与零件③、零件④的连接面，平焊\",\n      \"quality_requirements\": \"点焊位置均匀分布，保证加强板与铲板紧密贴合，无间隙。\",\n      \"safety_notes\": \"注意焊机接地良好，避免触电。焊接时保持姿势稳定，防止烫伤。\"\n    }\n  },\n  {\n    \"step_number\": 4,\n    \"action\": \"焊接底部连接板\",\n    \"description\": \"将图纸上标注为5的底部连接板（01.01.01.11521）共6块，按照图纸所示位置，均匀焊接到1号左铲板的底部边缘。注意连接板的间距和方向。\",\n    \"position_description\": \"位于1号左铲板的底部边缘，共6个安装位。\",\n    \"parts_used\": [\n      {\n        \"bom_seq\": \"5\",\n        \"bom_name\": \"底部连接板 6\",\n        \"quantity\": 6,\n        \"drawing_number\": \"5\",\n        \"mesh_id\": [\n          \"mesh_012\",\n          \"mesh_013\",\n          \"mesh_014\",\n          \"mesh_015\",\n          \"mesh_021\",\n          \"mesh_022\"\n        ],\n        \"bom_code\": \"01.01.01.11521\"\n      }\n    ],\n    \"tools\": [\n      \"焊机\",\n      \"卡尺\",\n      \"定位夹具\"\n    ],\n    \"warnings\": [\n      \"底部连接板的焊接位置精度要求较高，需确保其安装面在同一平面内。\"\n    ],\n    \"welding\": {\n      \"required\": true,\n      \"welding_type\": \"角焊（定位焊）\",\n      \"welding_method\": \"CO2气保焊\",\n      \"weld_size\": \"点焊，焊点长度10mm，焊脚高度5mm\",\n      \"welding_position\": \"零件①（左铲板）与零件⑤（底部连接板）的连接处，平焊或横焊（取决于铲板放置角度）\",\n      \"quality_requirements\": \"使用定位夹具确保连接板安装面共面性，点焊牢固，防止后续满焊时移位。\",\n      \"safety_notes\": \"由于零件数量多，注意焊接顺序，避免局部热量集中导致铲板变形。穿戴好防护服。\"\n    }\n  },\n  {\n    \"step_number\": 5,\n    \"action\": \"焊接前油缸固定板\",\n    \"description\": \"将图纸上标注为6的前油缸固定板（01.01.01.11522）共2块，焊接到4号前加强板和1号左铲板的连接区域。注意固定板的安装方向，确保油缸销轴孔位朝向正确。\",\n    \"position_description\": \"位于4号前加强板附近，靠近铲板内侧。\",\n    \"parts_used\": [\n      {\n        \"bom_seq\": \"6\",\n        \"bom_name\": \"前油缸固定板 2\",\n        \"quantity\": 2,\n        \"drawing_number\": \"6\",\n        \"mesh_id\": [\n          \"mesh_019\",\n          \"mesh_020\"\n        ],\n        \"bom_code\": \"01.01.01.11522\"\n      }\n    ],\n    \"tools\": [\n      \"焊机\",\n      \"定位销\"\n    ],\n    \"warnings\": [\n      \"油缸固定板的孔位中心距需严格控制，以保证后续油缸安装顺畅。\"\n    ],\n    \"welding\": {\n      \"required\": true,\n      \"welding_type\": \"角焊（定位焊）\",\n      \"welding_method\": \"CO2气保焊\",\n      \"weld_size\": \"点焊，焊点长度15mm，焊脚高度6mm\",\n      \"welding_position\": \"零件⑥（前油缸固定板）与零件①和零件④的连接处，平焊\",\n      \"quality_requirements\": \"使用定位销或工装确保两个固定板的孔位中心距和垂直度符合图纸要求。点焊要均匀，防止应力集中。\",\n      \"safety_notes\": \"油缸固定板是受力关键部位，点焊时要保证焊点质量。注意防止焊接烟尘吸入，开启排风设备。\"\n    }\n  },\n  {\n    \"step_number\": 6,\n    \"action\": \"焊接前弹簧固定板\",\n    \"description\": \"将图纸上标注为7的前弹簧固定板（01.01.01.11523）1块，焊接到1号左铲板的内侧中部区域。\",\n    \"position_description\": \"位于铲板内侧中部，靠近4号前加强板。\",\n    \"parts_used\": [\n      {\n        \"bom_seq\": \"7\",\n        \"bom_name\": \"前弹簧固定板 1\",\n        \"quantity\": 1,\n        \"drawing_number\": \"7\",\n        \"mesh_id\": [\n          \"mesh_018\"\n        ],\n        \"bom_code\": \"01.01.01.11523\"\n      }\n    ],\n    \"tools\": [\n      \"焊机\"\n    ],\n    \"warnings\": [\n      \"确保弹簧固定板的焊接强度，该部位承受较大冲击力。\"\n    ],\n    \"welding\": {\n      \"required\": true,\n      \"welding_type\": \"角焊（定位焊）\",\n      \"welding_method\": \"CO2气保焊\",\n      \"weld_size\": \"点焊，焊点长度10mm，焊脚高度5mm\",\n      \"welding_position\": \"零件⑦（前弹簧固定板）与零件①（左铲板）的连接处，平焊\",\n      \"quality_requirements\": \"定位准确，确保固定板与铲板贴合紧密，点焊牢固。\",\n      \"safety_notes\": \"检查焊机电缆绝缘层是否完好，避免漏电。\"\n    }\n  },\n  {\n    \"step_number\": 7,\n    \"action\": \"焊接后弹簧固定板\",\n    \"description\": \"将图纸上标注为8的后弹簧固定板（01.01.01.11524）共2块，焊接到1号左铲板的内侧后部区域。\",\n    \"position_description\": \"位于铲板内侧后部，靠近3号后加强板。\",\n    \"parts_used\": [\n      {\n        \"bom_seq\": \"8\",\n        \"bom_name\": \"后弹簧固定板 2\",\n        \"quantity\": 2,\n        \"drawing_number\": \"8\",\n        \"mesh_id\": [\n          \"mesh_016\",\n          \"mesh_017\"\n        ],\n        \"bom_code\": \"01.01.01.11524\"\n      }\n    ],\n    \"tools\": [\n      \"焊机\"\n    ],\n    \"warnings\": [\n      \"两块后弹簧固定板需保持对称和水平。\"\n    ],\n    \"welding\": {\n      \"required\": true,\n      \"welding_type\": \"角焊（定位焊）\",\n      \"welding_method\": \"CO2气保焊\",\n      \"weld_size\": \"点焊，焊点长度10mm，焊脚高度5mm\",\n      \"welding_position\": \"零件⑧（后弹簧固定板）与零件①（左铲板）的连接处，平焊\",\n      \"quality_requirements\": \"使用卷尺或工装确保两块固定板的相对位置和水平度，点焊牢固。\",\n      \"safety_notes\": \"焊接前清理零件表面的油污和锈蚀，防止产生气孔。\"\n    }\n  },\n  {\n    \"step_number\": 8,\n    \"action\": \"焊接支撑固定板\",\n    \"description\": \"将图纸上标注为9的支撑固定板（01.01.01.11525）1块，焊接到1号左铲板的内侧，位于中部偏下位置。\",\n    \"position_description\": \"位于铲板内侧中部，用于支撑结构。\",\n    \"parts_used\": [\n      {\n        \"bom_seq\": \"9\",\n        \"bom_name\": \"支撑固定板 1\",\n        \"quantity\": 1,\n        \"drawing_number\": \"9\",\n        \"mesh_id\": [\n          \"mesh_011\"\n        ],\n        \"bom_code\": \"01.01.01.11525\"\n      }\n    ],\n    \"tools\": [\n      \"焊机\"\n    ],\n    \"warnings\": [\n      \"确保支撑固定板与铲板的垂直度。\"\n    ],\n    \"welding\": {\n      \"required\": true,\n      \"welding_type\": \"角焊（定位焊）\",\n      \"welding_method\": \"CO2气保焊\",\n      \"weld_size\": \"点焊，焊点长度10mm，焊脚高度5mm\",\n      \"welding_position\": \"零件⑨（支撑固定板）与零件①（左铲板）的连接处，平焊\",\n      \"quality_requirements\": \"使用角尺检查垂直度，点焊牢固，保证后续满焊时位置不变。\",\n      \"safety_notes\": \"焊接区域周围保持整洁，避免杂物引起火灾。\"\n    }\n  },\n  {\n    \"step_number\": 9,\n    \"action\": \"焊接轴套加强板\",\n    \"description\": \"将图纸上标注为10的轴套加强板（01.01.01.11526）共2块，焊接到1号左铲板的内侧，位于铲板的上下边缘，用于加强轴套安装区域。\",\n    \"position_description\": \"位于铲板内侧的上下边缘，靠近铲板的左右两侧。\",\n    \"parts_used\": [\n      {\n        \"bom_seq\": \"10\",\n        \"bom_name\": \"轴套加强板 2\",\n        \"quantity\": 2,\n        \"drawing_number\": \"10\",\n        \"mesh_id\": [\n          \"mesh_009\",\n          \"mesh_010\"\n        ],\n        \"bom_code\": \"01.01.01.11526\"\n      }\n    ],\n    \"tools\": [\n      \"焊机\"\n    ],\n    \"warnings\": [\n      \"轴套加强板的定位需精确，为后续轴套安装做准备。\"\n    ],\n    \"welding\": {\n      \"required\": true,\n      \"welding_type\": \"角焊（定位焊）\",\n      \"welding_method\": \"CO2气保焊\",\n      \"weld_size\": \"点焊，焊点长度10mm，焊脚高度5mm\",\n      \"welding_position\": \"零件⑩（轴套加强板）与零件①（左铲板）的连接处，平焊\",\n      \"quality_requirements\": \"确保加强板上的孔位与铲板上的孔位对齐，点焊牢固。\",\n      \"safety_notes\": \"注意焊接电流和电压的匹配，防止飞溅过多。\"\n    }\n  },\n  {\n    \"step_number\": 10,\n    \"action\": \"焊接反光片安装板\",\n    \"description\": \"将图纸上标注为11的反光片安装板（01.01.01.11527）1块，焊接到1号左铲板的后侧边缘，靠近2号方形板-机加的上方。\",\n    \"position_description\": \"位于铲板后侧边缘，用于安装反光片。\",\n    \"parts_used\": [\n      {\n        \"bom_seq\": \"11\",\n        \"bom_name\": \"反光片安装板 1\",\n        \"quantity\": 1,\n        \"drawing_number\": \"11\",\n        \"mesh_id\": [\n          \"mesh_008\"\n        ],\n        \"bom_code\": \"01.01.01.11527\"\n      }\n    ],\n    \"tools\": [\n      \"焊机\"\n    ],\n    \"warnings\": [\n      \"确保安装板的安装面平整，便于后续反光片安装。\"\n    ],\n    \"welding\": {\n      \"required\": true,\n      \"welding_type\": \"角焊（定位焊）\",\n      \"welding_method\": \"CO2气保焊\",\n      \"weld_size\": \"点焊，焊点长度8mm，焊脚高度4mm\",\n      \"welding_position\": \"零件⑪（反光片安装板）与零件①（左铲板）的连接处，平焊\",\n      \"quality_requirements\": \"定位准确，安装面平整，点焊牢固。\",\n      \"safety_notes\": \"该零件较小，点焊时注意控制热输入，防止烧穿。\"\n    }\n  },\n  {\n    \"step_number\": 11,\n    \"action\": \"焊接轴套\",\n    \"description\": \"将图纸上标注为12的轴套（01.01.02.1222）共2个，分别焊接到10号轴套加强板预留的孔位上。轴套需从外侧插入，与加强板和铲板焊接固定。注意轴套的端面与铲板端面配合要求。\",\n    \"position_description\": \"位于铲板上下边缘的轴套安装孔位。\",\n    \"parts_used\": [\n      {\n        \"bom_seq\": \"12\",\n        \"bom_name\": \"轴套 2\",\n        \"quantity\": 2,\n        \"drawing_number\": \"12\"\n      }\n    ],\n    \"tools\": [\n      \"焊机\",\n      \"定位工装\"\n    ],\n    \"warnings\": [\n      \"轴套与铲板的端面配合要求高，需确保轴套中心线与铲板垂直，且端面齐平或符合图纸要求。\"\n    ],\n    \"welding\": {\n      \"required\": true,\n      \"welding_type\": \"角焊/环形焊（定位焊）\",\n      \"welding_method\": \"CO2气保焊\",\n      \"weld_size\": \"点焊，焊点长度15mm，焊脚高度6mm\",\n      \"welding_position\": \"零件⑫（轴套）与零件①（左铲板）和零件⑩（轴套加强板）的连接处，平焊/横焊\",\n      \"quality_requirements\": \"使用定位工装确保轴套中心线垂直度。点焊时采用对称分布，防止轴套倾斜。\",\n      \"safety_notes\": \"轴套焊接时，注意防止焊渣溅入轴套内孔，影响后续装配。焊接后需检查轴套内孔是否变形。\"\n    }\n  },\n  {\n    \"step_number\": 12,\n    \"action\": \"焊接方形板 1\",\n    \"description\": \"将图纸上标注为13的方形板 1（01.01.01.11528）1块，焊接到1号左铲板的内侧，位于上部边缘。\",\n    \"position_description\": \"位于铲板内侧上边缘，靠近轴套区域。\",\n    \"parts_used\": [\n      {\n        \"bom_seq\": \"13\",\n        \"bom_name\": \"方形板 1\",\n        \"quantity\": 1,\n        \"drawing_number\": \"13\"\n      }\n    ],\n    \"tools\": [\n      \"焊机\"\n    ],\n    \"warnings\": [\n      \"确保焊接牢固，避免变形。\"\n    ],\n    \"welding\": {\n      \"required\": true,\n      \"welding_type\": \"角焊（定位焊）\",\n      \"welding_method\": \"CO2气保焊\",\n      \"weld_size\": \"点焊，焊点长度10mm，焊脚高度5mm\",\n      \"welding_position\": \"零件⑬（方形板 1）与零件①（左铲板）的连接处，平焊\",\n      \"quality_requirements\": \"定位准确，贴合紧密，点焊牢固。\",\n      \"safety_notes\": \"注意焊接时保持通风，避免有害气体聚集。\"\n    }\n  },\n  {\n    \"step_number\": 13,\n    \"action\": \"焊接方形板 3\",\n    \"description\": \"将图纸上标注为14的方形板 3（01.01.01.11529）1块，焊接到1号左铲板的内侧，位于中部区域。\",\n    \"position_description\": \"位于铲板内侧中部，靠近9号支撑固定板。\",\n    \"parts_used\": [\n      {\n        \"bom_seq\": \"14\",\n        \"bom_name\": \"方形板 3\",\n        \"quantity\": 1,\n        \"drawing_number\": \"14\",\n        \"mesh_id\": [\n          \"mesh_003\",\n          \"mesh_004\",\n          \"mesh_005\"\n        ],\n        \"bom_code\": \"01.01.01.11529\"\n      }\n    ],\n    \"tools\": [\n      \"焊机\"\n    ],\n    \"warnings\": [\n      \"检查焊接位置是否符合图纸要求。\"\n    ],\n    \"welding\": {\n      \"required\": true,\n      \"welding_type\": \"角焊（定位焊）\",\n      \"welding_method\": \"CO2气保焊\",\n      \"weld_size\": \"点焊，焊点长度10mm，焊脚高度5mm\",\n      \"welding_position\": \"零件⑭（方形板 3）与零件①（左铲板）的连接处，平焊\",\n      \"quality_requirements\": \"定位准确，点焊牢固。\",\n      \"safety_notes\": \"焊接过程中，注意检查焊枪喷嘴是否堵塞，确保保护气体稳定。\"\n    }\n  },\n  {\n    \"step_number\": 14,\n    \"action\": \"焊接左铲雪板加强板 2\",\n    \"description\": \"将图纸上标注为15的左铲雪板加强板 2（01.02.01.4983）2块，焊接到1号左铲板的内侧，位于铲板的左右两侧边缘。\",\n    \"position_description\": \"位于铲板内侧的左右两侧边缘，用于加强铲板的整体刚度。\",\n    \"parts_used\": [\n      {\n        \"bom_seq\": \"15\",\n        \"bom_name\": \"左铲雪板加强板 2\",\n        \"quantity\": 2,\n        \"drawing_number\": \"15\",\n        \"mesh_id\": [\n          \"mesh_001\",\n          \"mesh_002\"\n        ],\n        \"bom_code\": \"01.02.01.4983\"\n      }\n    ],\n    \"tools\": [\n      \"焊机\"\n    ],\n    \"warnings\": [\n      \"这是最后的主要焊接件，需进行满焊，确保焊缝质量和强度。\"\n    ],\n    \"welding\": {\n      \"required\": true,\n      \"welding_type\": \"角焊（定位焊）\",\n      \"welding_method\": \"CO2气保焊\",\n      \"weld_size\": \"点焊，焊点长度15mm，焊脚高度6mm\",\n      \"welding_position\": \"零件⑮（左铲雪板加强板 2）与零件①（左铲板）的连接处，平焊\",\n      \"quality_requirements\": \"定位准确，为后续满焊做准备。\",\n      \"safety_notes\": \"点焊完成后，检查所有零件是否都已定位，准备进行满焊。\"\n    }\n  },\n  {\n    \"step_number\": 15,\n    \"action\": \"满焊及清理\",\n    \"description\": \"对所有已点焊的零件进行满焊。焊接完成后，进行焊渣清理和打磨，确保所有焊缝符合技术要求。\",\n    \"position_description\": \"所有焊接部位。\",\n    \"parts_used\": [],\n    \"tools\": [\n      \"焊机\",\n      \"角磨机\",\n      \"钢丝刷\"\n    ],\n    \"warnings\": [\n      \"满焊时注意控制热变形，必要时采用对称焊接或分段焊接。清理焊渣时注意安全防护。\"\n    ],\n    \"welding\": {\n      \"required\": true,\n      \"welding_type\": \"角焊/环形焊（满焊）\",\n      \"welding_method\": \"CO2气保焊\",\n      \"weld_size\": \"焊脚高度6mm（图纸未标注尺寸按此执行），轴套环焊焊脚高度8mm\",\n      \"welding_position\": \"所有零件连接处，涉及平焊、横焊、立焊（如果需要翻转）\",\n      \"quality_requirements\": \"焊缝必须连续、饱满，焊缝表面均匀，不得有裂纹、未熔合、严重气孔和夹渣。焊后进行外观检查，关键受力部位（如油缸固定板、轴套）需进行磁粉或超声波检测。\",\n      \"safety_notes\": \"满焊热输入大，必须佩戴全套防护用品（面罩、手套、防护服）。采用分段、跳焊工艺控制变形。打磨清理时，佩戴护目镜，防止飞溅物伤眼。\"\n    }\n  }\n]\n\n## 要求\n\n请按照以下5个步骤思考，为装配步骤添加安全警告：\n\n### 步骤1：识别风险步骤\n- 分析每个装配步骤的操作内容\n- 判断是否涉及高风险作业：\n  * **焊接作业**：电击、弧光、烫伤、火灾\n  * **吊装作业**：吊物坠落、碰撞、超载\n  * **高空作业**：人员坠落、物体打击\n  * **重物搬运**：砸伤、扭伤、夹伤\n  * **机械加工**：切割伤、夹伤、碰撞\n\n### 步骤2：分析风险源\n- 确定风险的来源（设备、工具、材料、环境、人员操作等）\n- 评估风险的严重程度（轻微、中等、严重、致命）\n- 考虑风险的发生概率\n\n### 步骤3：制定预防措施\n- 针对每个风险源，制定具体的预防措施\n- 强调个人防护用品的使用：\n  * **焊接**：焊接面罩、防护手套、防护服\n  * **吊装**：安全帽、安全鞋、手套\n  * **高空**：安全带、安全帽、防滑鞋\n  * **机械**：防护眼镜、手套、安全鞋\n\n### 步骤4：添加安全警告\n- 为每个有风险的步骤添加safety_warnings字段\n- 每条警告要简洁明了，说明具体的风险和预防措施\n- 使用工人能看懂的语言\n\n### 步骤5：验证完整性\n- 检查所有高风险步骤是否都添加了安全警告\n- 检查安全警告是否具体、可操作\n- 检查是否遗漏了任何潜在风险\n\n## ⚠️ 强制自检清单（生成后必须逐项检查）\n\n**在输出JSON之前，你必须完成以下验证：**\n\n1. **风险步骤识别验证**：\n   - [ ] 所有涉及焊接、吊装、高空、重物搬运的步骤都添加了safety_warnings字段\n   - [ ] 没有明显风险的步骤没有添加safety_warnings字段\n\n2. **安全警告完整性验证**：\n   - [ ] 每个safety_warnings字段都是字符串数组\n   - [ ] 每条警告都说明了具体的风险和预防措施\n   - [ ] 涵盖了个人防护、设备安全、环境安全、操作安全\n\n3. **语言通俗性验证**：\n   - [ ] 使用工人能看懂的语言\n   - [ ] 避免专业术语和英文缩写\n   - [ ] 每条警告简洁明了（一句话）\n\n4. **原有字段保持验证**：\n   - [ ] 原有步骤的所有字段都保持不变（包括welding字段）\n   - [ ] 没有修改或删除任何原有字段\n\n**如果自检发现任何问题，必须重新生成！**\n\n现在开始为装配步骤添加安全警告！\n",
  "raw_response": "```json\n{\n  \"enhanced_steps\": [\n    {\n      \"step_number\": 1,\n      \"action\": \"放置基准件\",\n      \"description\": \"将图纸上标注为1的左铲板（01.01.01.18598）平稳放置在装配工作台上，作为装配基准。\",\n      \"position_description\": \"平放于工作台，内侧（有安装孔的一面）朝上。\",\n      \"parts_used\": [\n        {\n          \"bom_seq\": \"1\",\n          \"bom_name\": \"左铲板 1\",\n          \"quantity\": 1,\n          \"drawing_number\": \"1\",\n          \"mesh_id\": [\n            \"mesh_026\"\n          ],\n          \"bom_code\": \"01.01.01.18598\"\n        }\n      ],\n      \"tools\": [\n        \"行车\",\n        \"吊具\"\n      ],\n      \"warnings\": [\n        \"铲板较重，吊装时注意平衡，防止倾倒。\"\n      ],\n      \"safety_warnings\": [\n        \"吊装前检查吊索具是否完好，捆绑是否牢固，防止吊物坠落伤人\",\n        \"吊装区域内非作业人员必须撤离，防止吊物摆动碰撞\",\n        \"操作行车时，必须由持证人员指挥，确保信号清晰准确\",\n        \"佩戴安全帽和安全鞋，防止重物砸伤脚部和头部\"\n      ]\n    },\n    {\n      \"step_number\": 2,\n      \"action\": \"焊接方形板-机加\",\n      \"description\": \"将图纸上标注为2的方形板-机加（01.01.01.18599）放置在1号左铲板的后侧（图纸左侧），对齐定位孔后进行点焊固定。注意，该板件为机加件，需确保定位准确。\",\n      \"position_description\": \"在1号左铲板的后侧边缘，与铲板垂直。\",\n      \"parts_used\": [\n        {\n          \"bom_seq\": \"2\",\n          \"bom_name\": \"方形板-机加 1\",\n          \"quantity\": 1,\n          \"drawing_number\": \"2\",\n          \"mesh_id\": [\n            \"mesh_025\"\n          ],\n          \"bom_code\": \"01.01.01.18599\"\n        }\n      ],\n      \"tools\": [\n        \"焊机\",\n        \"角尺\",\n        \"夹具\"\n      ],\n      \"warnings\": [\n        \"焊接前检查定位孔是否对齐，确保方形板与铲板的垂直度。\"\n      ],\n      \"welding\": {\n        \"required\": true,\n        \"welding_type\": \"角焊（定位焊）\",\n        \"welding_method\": \"CO2气保焊\",\n        \"weld_size\": \"点焊，焊点长度10mm，焊脚高度4mm\",\n        \"welding_position\": \"零件①（左铲板）与零件②（方形板-机加）的连接面，平焊\",\n        \"quality_requirements\": \"点焊牢固，保证零件定位准确，垂直度误差小于1mm\",\n        \"safety_notes\": \"佩戴焊接面罩和防护手套，确保工作区域通风良好，防止火花飞溅。\"\n      },\n      \"safety_warnings\": [\n        \"必须佩戴焊接面罩和防护手套，防止弧光灼伤眼睛和皮肤\",\n        \"确保焊机接地良好，防止漏电触电\",\n        \"焊接区域周围3米内不得有易燃物，防止火灾\",\n        \"操作前检查工件是否夹紧牢固，防止焊接时位移\"\n      ]\n    },\n    {\n      \"step_number\": 3,\n      \"action\": \"焊接后加强板和前加强板\",\n      \"description\": \"将图纸上标注为3的后加强板（01.01.01.11519）和4的前加强板（01.01.01.18600）分别放置在1号左铲板的内侧，对齐预留的焊接位置后进行点焊固定。\",\n      \"position_description\": \"3号后加强板位于铲板内侧靠后位置；4号前加强板位于铲板内侧靠前位置。\",\n      \"parts_used\": [\n        {\n          \"bom_seq\": \"3\",\n          \"bom_name\": \"后加强板 1\",\n          \"quantity\": 1,\n          \"drawing_number\": \"3\",\n          \"mesh_id\": [\n            \"mesh_024\"\n          ],\n          \"bom_code\": \"01.01.01.11519\"\n        },\n        {\n          \"bom_seq\": \"4\",\n          \"bom_name\": \"前加强板 1\",\n          \"quantity\": 1,\n          \"drawing_number\": \"4\",\n          \"mesh_id\": [\n            \"mesh_023\"\n          ],\n          \"bom_code\": \"01.01.01.18600\"\n        }\n      ],\n      \"tools\": [\n        \"焊机\",\n        \"卷尺\"\n      ],\n      \"warnings\": [\n        \"确保两块加强板与铲板的贴合度，避免虚焊。\"\n      ],\n      \"welding\": {\n        \"required\": true,\n        \"welding_type\": \"角焊（定位焊）\",\n        \"welding_method\": \"CO2气保焊\",\n        \"weld_size\": \"点焊，焊点长度10mm，焊脚高度4mm\",\n        \"welding_position\": \"零件①与零件③、零件④的连接面，平焊\",\n        \"quality_requirements\": \"点焊位置均匀分布，保证加强板与铲板紧密贴合，无间隙。\",\n        \"safety_notes\": \"注意焊机接地良好，避免触电。焊接时保持姿势稳定，防止烫伤。\"\n      },\n      \"safety_warnings\": [\n        \"佩戴焊接面罩和防护手套，防止弧光和焊渣飞溅烫伤\",\n        \"确保工作区域通风良好，防止焊接烟尘吸入\",\n        \"检查焊机电缆绝缘层是否完好，防止漏电\"\n      ]\n    },\n    {\n      \"step_number\": 4,\n      \"action\": \"焊接底部连接板\",\n      \"description\": \"将图纸上标注为5的底部连接板（01.01.01.11521）共6块，按照图纸所示位置，均匀焊接到1号左铲板的底部边缘。注意连接板的间距和方向。\",\n      \"position_description\": \"位于1号左铲板的底部边缘，共6个安装位。\",\n      \"parts_used\": [\n        {\n          \"bom_seq\": \"5\",\n          \"bom_name\": \"底部连接板 6\",\n          \"quantity\": 6,\n          \"drawing_number\": \"5\",\n          \"mesh_id\": [\n            \"mesh_012\",\n            \"mesh_013\",\n            \"mesh_014\",\n            \"mesh_015\",\n            \"mesh_021\",\n            \"mesh_022\"\n          ],\n          \"bom_code\": \"01.01.01.11521\"\n        }\n      ],\n      \"tools\": [\n        \"焊机\",\n        \"卡尺\",\n        \"定位夹具\"\n      ],\n      \"warnings\": [\n        \"底部连接板的焊接位置精度要求较高，需确保其安装面在同一平面内。\"\n      ],\n      \"welding\": {\n        \"required\": true,\n        \"welding_type\": \"角焊（定位焊）\",\n        \"welding_method\": \"CO2气保焊\",\n        \"weld_size\": \"点焊，焊点长度10mm，焊脚高度5mm\",\n        \"welding_position\": \"零件①（左铲板）与零件⑤（底部连接板）的连接处，平焊或横焊（取决于铲板放置角度）\",\n        \"quality_requirements\": \"使用定位夹具确保连接板安装面共面性，点焊牢固，防止后续满焊时移位。\",\n        \"safety_notes\": \"由于零件数量多，注意焊接顺序，避免局部热量集中导致铲板变形。穿戴好防护服。\"\n      },\n      \"safety_warnings\": [\n        \"穿戴防护服和防护手套，防止高温焊渣烫伤身体\",\n        \"使用定位夹具时，注意夹紧力度，防止夹具弹开伤人\",\n        \"焊接多块零件时，注意控制热输入，防止工件变形或烫伤\"\n      ]\n    },\n    {\n      \"step_number\": 5,\n      \"action\": \"焊接前油缸固定板\",\n      \"description\": \"将图纸上标注为6的前油缸固定板（01.01.01.11522）共2块，焊接到4号前加强板和1号左铲板的连接区域。注意固定板的安装方向，确保油缸销轴孔位朝向正确。\",\n      \"position_description\": \"位于4号前加强板附近，靠近铲板内侧。\",\n      \"parts_used\": [\n        {\n          \"bom_seq\": \"6\",\n          \"bom_name\": \"前油缸固定板 2\",\n          \"quantity\": 2,\n          \"drawing_number\": \"6\",\n          \"mesh_id\": [\n            \"mesh_019\",\n            \"mesh_020\"\n          ],\n          \"bom_code\": \"01.01.01.11522\"\n        }\n      ],\n      \"tools\": [\n        \"焊机\",\n        \"定位销\"\n      ],\n      \"warnings\": [\n        \"油缸固定板的孔位中心距需严格控制，以保证后续油缸安装顺畅。\"\n      ],\n      \"welding\": {\n        \"required\": true,\n        \"welding_type\": \"角焊（定位焊）\",\n        \"welding_method\": \"CO2气保焊\",\n        \"weld_size\": \"点焊，焊点长度15mm，焊脚高度6mm\",\n        \"welding_position\": \"零件⑥（前油缸固定板）与零件①和零件④的连接处，平焊\",\n        \"quality_requirements\": \"使用定位销或工装确保两个固定板的孔位中心距和垂直度符合图纸要求。点焊要均匀，防止应力集中。\",\n        \"safety_notes\": \"油缸固定板是受力关键部位，点焊时要保证焊点质量。注意防止焊接烟尘吸入，开启排风设备。\"\n      },\n      \"safety_warnings\": [\n        \"油缸固定板是受力关键部位，焊接时要保证焊点质量，防止结构失效\",\n        \"开启排风设备或佩戴防尘口罩，防止吸入焊接烟尘\",\n        \"使用定位销时，注意防止定位销卡死或飞出伤人\"\n      ]\n    },\n    {\n      \"step_number\": 6,\n      \"action\": \"焊接前弹簧固定板\",\n      \"description\": \"将图纸上标注为7的前弹簧固定板（01.01.01.11523）1块，焊接到1号左铲板的内侧中部区域。\",\n      \"position_description\": \"位于铲板内侧中部，靠近4号前加强板。\",\n      \"parts_used\": [\n        {\n          \"bom_seq\": \"7\",\n          \"bom_name\": \"前弹簧固定板 1\",\n          \"quantity\": 1,\n          \"drawing_number\": \"7\",\n          \"mesh_id\": [\n            \"mesh_018\"\n          ],\n          \"bom_code\": \"01.01.01.11523\"\n        }\n      ],\n      \"tools\": [\n        \"焊机\"\n      ],\n      \"warnings\": [\n        \"确保弹簧固定板的焊接强度，该部位承受较大冲击力。\"\n      ],\n      \"welding\": {\n        \"required\": true,\n        \"welding_type\": \"角焊（定位焊）\",\n        \"welding_method\": \"CO2气保焊\",\n        \"weld_size\": \"点焊，焊点长度10mm，焊脚高度5mm\",\n        \"welding_position\": \"零件⑦（前弹簧固定板）与零件①（左铲板）的连接处，平焊\",\n        \"quality_requirements\": \"定位准确，确保固定板与铲板贴合紧密，点焊牢固。\",\n        \"safety_notes\": \"检查焊机电缆绝缘层是否完好，避免漏电。\"\n      },\n      \"safety_warnings\": [\n        \"检查焊机电缆绝缘层是否完好，避免漏电触电\",\n        \"焊接时注意周围环境，防止火花飞溅到易燃物上\"\n      ]\n    },\n    {\n      \"step_number\": 7,\n      \"action\": \"焊接后弹簧固定板\",\n      \"description\": \"将图纸上标注为8的后弹簧固定板（01.01.01.11524）共2块，焊接到1号左铲板的内侧后部区域。\",\n      \"position_description\": \"位于铲板内侧后部，靠近3号后加强板。\",\n      \"parts_used\": [\n        {\n          \"bom_seq\": \"8\",\n          \"bom_name\": \"后弹簧固定板 2\",\n          \"quantity\": 2,\n          \"drawing_number\": \"8\",\n          \"mesh_id\": [\n            \"mesh_016\",\n            \"mesh_017\"\n          ],\n          \"bom_code\": \"01.01.01.11524\"\n        }\n      ],\n      \"tools\": [\n        \"焊机\"\n      ],\n      \"warnings\": [\n        \"两块后弹簧固定板需保持对称和水平。\"\n      ],\n      \"welding\": {\n        \"required\": true,\n        \"welding_type\": \"角焊（定位焊）\",\n        \"welding_method\": \"CO2气保焊\",\n        \"weld_size\": \"点焊，焊点长度10mm，焊脚高度5mm\",\n        \"welding_position\": \"零件⑧（后弹簧固定板）与零件①（左铲板）的连接处，平焊\",\n        \"quality_requirements\": \"使用卷尺或工装确保两块固定板的相对位置和水平度，点焊牢固。\",\n        \"safety_notes\": \"焊接前清理零件表面的油污和锈蚀，防止产生气孔。\"\n      },\n      \"safety_warnings\": [\n        \"焊接前必须清理零件表面的油污和锈蚀，防止焊接时产生有毒烟雾\",\n        \"佩戴防护眼镜，防止清理时铁屑飞溅伤眼\"\n      ]\n    },\n    {\n      \"step_number\": 8,\n      \"action\": \"焊接支撑固定板\",\n      \"description\": \"将图纸上标注为9的支撑固定板（01.01.01.11525）1块，焊接到1号左铲板的内侧，位于中部偏下位置。\",\n      \"position_description\": \"位于铲板内侧中部，用于支撑结构。\",\n      \"parts_used\": [\n        {\n          \"bom_seq\": \"9\",\n          \"bom_name\": \"支撑固定板 1\",\n          \"quantity\": 1,\n          \"drawing_number\": \"9\",\n          \"mesh_id\": [\n            \"mesh_011\"\n          ],\n          \"bom_code\": \"01.01.01.11525\"\n        }\n      ],\n      \"tools\": [\n        \"焊机\"\n      ],\n      \"warnings\": [\n        \"确保支撑固定板与铲板的垂直度。\"\n      ],\n      \"welding\": {\n        \"required\": true,\n        \"welding_type\": \"角焊（定位焊）\",\n        \"welding_method\": \"CO2气保焊\",\n        \"weld_size\": \"点焊，焊点长度10mm，焊脚高度5mm\",\n        \"welding_position\": \"零件⑨（支撑固定板）与零件①（左铲板）的连接处，平焊\",\n        \"quality_requirements\": \"使用角尺检查垂直度，点焊牢固，保证后续满焊时位置不变。\",\n        \"safety_notes\": \"焊接区域周围保持整洁，避免杂物引起火灾。\"\n      },\n      \"safety_warnings\": [\n        \"焊接区域周围保持整洁，清除易燃物，防止焊渣引燃火灾\",\n        \"使用角尺检查垂直度时，注意板件边缘锋利，佩戴手套防止割伤\"\n      ]\n    },\n    {\n      \"step_number\": 9,\n      \"action\": \"焊接轴套加强板\",\n      \"description\": \"将图纸上标注为10的轴套加强板（01.01.01.11526）共2块，焊接到1号左铲板的内侧，位于铲板的上下边缘，用于加强轴套安装区域。\",\n      \"position_description\": \"位于铲板内侧的上下边缘，靠近铲板的左右两侧。\",\n      \"parts_used\": [\n        {\n          \"bom_seq\": \"10\",\n          \"bom_name\": \"轴套加强板 2\",\n          \"quantity\": 2,\n          \"drawing_number\": \"10\",\n          \"mesh_id\": [\n            \"mesh_009\",\n            \"mesh_010\"\n          ],\n          \"bom_code\": \"01.01.01.11526\"\n        }\n      ],\n      \"tools\": [\n        \"焊机\"\n      ],\n      \"warnings\": [\n        \"轴套加强板的定位需精确，为后续轴套安装做准备。\"\n      ],\n      \"welding\": {\n        \"required\": true,\n        \"welding_type\": \"角焊（定位焊）\",\n        \"welding_method\": \"CO2气保焊\",\n        \"weld_size\": \"点焊，焊点长度10mm，焊脚高度5mm\",\n        \"welding_position\": \"零件⑩（轴套加强板）与零件①（左铲板）的连接处，平焊\",\n        \"quality_requirements\": \"确保加强板上的孔位与铲板上的孔位对齐，点焊牢固。\",\n        \"safety_notes\": \"注意焊接电流和电压的匹配，防止飞溅过多。\"\n      },\n      \"safety_warnings\": [\n        \"调整焊接参数，防止飞溅过多烫伤皮肤或引起火灾\",\n        \"佩戴防护眼镜，防止焊接飞溅物伤眼\"\n      ]\n    },\n    {\n      \"step_number\": 10,\n      \"action\": \"焊接反光片安装板\",\n      \"description\": \"将图纸上标注为11的反光片安装板（01.01.01.11527）1块，焊接到1号左铲板的后侧边缘，靠近2号方形板-机加的上方。\",\n      \"position_description\": \"位于铲板后侧边缘，用于安装反光片。\",\n      \"parts_used\": [\n        {\n          \"bom_seq\": \"11\",\n          \"bom_name\": \"反光片安装板 1\",\n          \"quantity\": 1,\n          \"drawing_number\": \"11\",\n          \"mesh_id\": [\n            \"mesh_008\"\n          ],\n          \"bom_code\": \"01.01.01.11527\"\n        }\n      ],\n      \"tools\": [\n        \"焊机\"\n      ],\n      \"warnings\": [\n        \"确保安装板的安装面平整，便于后续反光片安装。\"\n      ],\n      \"welding\": {\n        \"required\": true,\n        \"welding_type\": \"角焊（定位焊）\",\n        \"welding_method\": \"CO2气保焊\",\n        \"weld_size\": \"点焊，焊点长度8mm，焊脚高度4mm\",\n        \"welding_position\": \"零件⑪（反光片安装板）与零件①（左铲板）的连接处，平焊\",\n        \"quality_requirements\": \"定位准确，安装面平整，点焊牢固。\",\n        \"safety_notes\": \"该零件较小，点焊时注意控制热输入，防止烧穿。\"\n      },\n      \"safety_warnings\": [\n        \"该零件较小，点焊时注意控制热输入，防止烧穿或烫伤\",\n        \"焊接完成后，不要立即用手触摸焊件，防止烫伤\"\n      ]\n    },\n    {\n      \"step_number\": 11,\n      \"action\": \"焊接轴套\",\n      \"description\": \"将图纸上标注为12的轴套（01.01.02.1222）共2个，分别焊接到10号轴套加强板预留的孔位上。轴套需从外侧插入，与加强板和铲板焊接固定。注意轴套的端面与铲板端面配合要求。\",\n      \"position_description\": \"位于铲板上下边缘的轴套安装孔位。\",\n      \"parts_used\": [\n        {\n          \"bom_seq\": \"12\",\n          \"bom_name\": \"轴套 2\",\n          \"quantity\": 2,\n          \"drawing_number\": \"12\"\n        }\n      ],\n      \"tools\": [\n        \"焊机\",\n        \"定位工装\"\n      ],\n      \"warnings\": [\n        \"轴套与铲板的端面配合要求高，需确保轴套中心线与铲板垂直，且端面齐平或符合图纸要求。\"\n      ],\n      \"welding\": {\n        \"required\": true,\n        \"welding_type\": \"角焊/环形焊（定位焊）\",\n        \"welding_method\": \"CO2气保焊\",\n        \"weld_size\": \"点焊，焊点长度15mm，焊脚高度6mm\",\n        \"welding_position\": \"零件⑫（轴套）与零件①（左铲板）和零件⑩（轴套加强板）的连接处，平焊/横焊\",\n        \"quality_requirements\": \"使用定位工装确保轴套中心线垂直度。点焊时采用对称分布，防止轴套倾斜。\",\n        \"safety_notes\": \"轴套焊接时，注意防止焊渣溅入轴套内孔，影响后续装配。焊接后需检查轴套内孔是否变形。\"\n      },\n      \"safety_warnings\": [\n        \"使用定位工装时，确保工装放置平稳，防止轴套倾倒砸伤\",\n        \"焊接时注意防止焊渣溅入轴套内孔，影响后续装配\",\n        \"轴套焊接热量集中，注意防止工件过热变形\"\n      ]\n    },\n    {\n      \"step_number\": 12,\n      \"action\": \"焊接方形板 1\",\n      \"description\": \"将图纸上标注为13的方形板 1（01.01.01.11528）1块，焊接到1号左铲板的内侧，位于上部边缘。\",\n      \"position_description\": \"位于铲板内侧上边缘，靠近轴套区域。\",\n      \"parts_used\": [\n        {\n          \"bom_seq\": \"13\",\n          \"bom_name\": \"方形板 1\",\n          \"quantity\": 1,\n          \"drawing_number\": \"13\"\n        }\n      ],\n      \"tools\": [\n        \"焊机\"\n      ],\n      \"warnings\": [\n        \"确保焊接牢固，避免变形。\"\n      ],\n      \"welding\": {\n        \"required\": true,\n        \"welding_type\": \"角焊（定位焊）\",\n        \"welding_method\": \"CO2气保焊\",\n        \"weld_size\": \"点焊，焊点长度10mm，焊脚高度5mm\",\n        \"welding_position\": \"零件⑬（方形板 1）与零件①（左铲板）的连接处，平焊\",\n        \"quality_requirements\": \"定位准确，贴合紧密，点焊牢固。\",\n        \"safety_notes\": \"注意焊接时保持通风，避免有害气体聚集。\"\n      },\n      \"safety_warnings\": [\n        \"确保工作区域通风良好，避免焊接有害气体聚集中毒\",\n        \"佩戴防护眼镜和手套，防止焊接飞溅物伤人\"\n      ]\n    },\n    {\n      \"step_number\": 13,\n      \"action\": \"焊接方形板 3\",\n      \"description\": \"将图纸上标注为14的方形板 3（01.01.01.11529）1块，焊接到1号左铲板的内侧，位于中部区域。\",\n      \"position_description\": \"位于铲板内侧中部，靠近9号支撑固定板。\",\n      \"parts_used\": [\n        {\n          \"bom_seq\": \"14\",\n          \"bom_name\": \"方形板 3\",\n          \"quantity\": 1,\n          \"drawing_number\": \"14\",\n          \"mesh_id\": [\n            \"mesh_003\",\n            \"mesh_004\",\n            \"mesh_005\"\n          ],\n          \"bom_code\": \"01.01.01.11529\"\n        }\n      ],\n      \"tools\": [\n        \"焊机\"\n      ],\n      \"warnings\": [\n        \"检查焊接位置是否符合图纸要求。\"\n      ],\n      \"welding\": {\n        \"required\": true,\n        \"welding_type\": \"角焊（定位焊）\",\n        \"welding_method\": \"CO2气保焊\",\n        \"weld_size\": \"点焊，焊点长度10mm，焊脚高度5mm\",\n        \"welding_position\": \"零件⑭（方形板 3）与零件①（左铲板）的连接处，平焊\",\n        \"quality_requirements\": \"定位准确，点焊牢固。\",\n        \"safety_notes\": \"焊接过程中，注意检查焊枪喷嘴是否堵塞，确保保护气体稳定。\"\n      },\n      \"safety_warnings\": [\n        \"注意检查焊枪喷嘴和气路，防止保护气体泄漏或堵塞，影响焊接质量和安全\"\n      ]\n    },\n    {\n      \"step_number\": 14,\n      \"action\": \"焊接左铲雪板加强板 2\",\n      \"description\": \"将图纸上标注为15的左铲雪板加强板 2（01.02.01.4983）2块，焊接到1号左铲板的内侧，位于铲板的左右两侧边缘。\",\n      \"position_description\": \"位于铲板内侧的左右两侧边缘，用于加强铲板的整体刚度。\",\n      \"parts_used\": [\n        {\n          \"bom_seq\": \"15\",\n          \"bom_name\": \"左铲雪板加强板 2\",\n          \"quantity\": 2,\n          \"drawing_number\": \"15\",\n          \"mesh_id\": [\n            \"mesh_001\",\n            \"mesh_002\"\n          ],\n          \"bom_code\": \"01.02.01.4983\"\n        }\n      ],\n      \"tools\": [\n        \"焊机\"\n      ],\n      \"warnings\": [\n        \"这是最后的主要焊接件，需进行满焊，确保焊缝质量和强度。\"\n      ],\n      \"welding\": {\n        \"required\": true,\n        \"welding_type\": \"角焊（定位焊）\",\n        \"welding_method\": \"CO2气保焊\",\n        \"weld_size\": \"点焊，焊点长度15mm，焊脚高度6mm\",\n        \"welding_position\": \"零件⑮（左铲雪板加强板 2）与零件①（左铲板）的连接处，平焊\",\n        \"quality_requirements\": \"定位准确，为后续满焊做准备。\",\n        \"safety_notes\": \"点焊完成后，检查所有零件是否都已定位，准备进行满焊。\"\n      },\n      \"safety_warnings\": [\n        \"点焊完成后，检查所有焊点是否牢固，防止满焊前零件松动移位\",\n        \"确保所有焊缝位置清理干净，为满焊做好准备\"\n      ]\n    },\n    {\n      \"step_number\": 15,\n      \"action\": \"满焊及清理\",\n      \"description\": \"对所有已点焊的零件进行满焊。焊接完成后，进行焊渣清理和打磨，确保所有焊缝符合技术要求。\",\n      \"position_description\": \"所有焊接部位。\",\n      \"parts_used\": [],\n      \"tools\": [\n        \"焊机\",\n        \"角磨机\",\n        \"钢丝刷\"\n      ],\n      \"warnings\": [\n        \"满焊时注意控制热变形，必要时采用对称焊接或分段焊接。清理焊渣时注意安全防护。\"\n      ],\n      \"welding\": {\n        \"required\": true,\n        \"welding_type\": \"角焊/环形焊（满焊）\",\n        \"welding_method\": \"CO2气保焊\",\n        \"weld_size\": \"焊脚高度6mm（图纸未标注尺寸按此执行），轴套环焊焊脚高度8mm\",\n        \"welding_position\": \"所有零件连接处，涉及平焊、横焊、立焊（如果需要翻转）\",\n        \"quality_requirements\": \"焊缝必须连续、饱满，焊缝表面均匀，不得有裂纹、未熔合、严重气孔和夹渣。焊后进行外观检查，关键受力部位（如油缸固定板、轴套）需进行磁粉或超声波检测。\",\n        \"safety_notes\": \"满焊热输入大，必须佩戴全套防护用品（面罩、手套、防护服）。采用分段、跳焊工艺控制变形。打磨清理时，佩戴护目镜，防止飞溅物伤眼。\"\n      },\n      \"safety_warnings\": [\n        \"满焊时必须佩戴全套防护用品（面罩、防护服、手套），防止大面积弧光和高温烫伤\",\n        \"使用角磨机清理焊缝时，必须佩戴防护眼镜和防尘口罩，防止金属飞屑和粉尘伤眼、吸入\",\n        \"角磨机操作时，注意站位和磨削方向，防止砂轮片破碎伤人\",\n        \"采用分段、跳焊工艺，控制热变形，防止工件翘曲\"\n      ]\n    }\n  ]\n}\n```",
  "parsed_result": {
    "enhanced_steps": [
      {
        "step_number": 1,
        "action": "放置基准件",
        "description": "将图纸上标注为1的左铲板（01.01.01.18598）平稳放置在装配工作台上，作为装配基准。",
        "position_description": "平放于工作台，内侧（有安装孔的一面）朝上。",
        "parts_used": [
          {
            "bom_seq": "1",
            "bom_name": "左铲板 1",
            "quantity": 1,
            "drawing_number": "1",
            "mesh_id": [
              "mesh_026"
            ],
            "bom_code": "01.01.01.18598"
          }
        ],
        "tools": [
          "行车",
          "吊具"
        ],
        "warnings": [
          "铲板较重，吊装时注意平衡，防止倾倒。"
        ],
        "safety_warnings": [
          "吊装前检查吊索具是否完好，捆绑是否牢固，防止吊物坠落伤人",
          "吊装区域内非作业人员必须撤离，防止吊物摆动碰撞",
          "操作行车时，必须由持证人员指挥，确保信号清晰准确",
          "佩戴安全帽和安全鞋，防止重物砸伤脚部和头部"
        ]
      },
      {
        "step_number": 2,
        "action": "焊接方形板-机加",
        "description": "将图纸上标注为2的方形板-机加（01.01.01.18599）放置在1号左铲板的后侧（图纸左侧），对齐定位孔后进行点焊固定。注意，该板件为机加件，需确保定位准确。",
        "position_description": "在1号左铲板的后侧边缘，与铲板垂直。",
        "parts_used": [
          {
            "bom_seq": "2",
            "bom_name": "方形板-机加 1",
            "quantity": 1,
            "drawing_number": "2",
            "mesh_id": [
              "mesh_025"
            ],
            "bom_code": "01.01.01.18599"
          }
        ],
        "tools": [
          "焊机",
          "角尺",
          "夹具"
        ],
        "warnings": [
          "焊接前检查定位孔是否对齐，确保方形板与铲板的垂直度。"
        ],
        "welding": {
          "required": true,
          "welding_type": "角焊（定位焊）",
          "welding_method": "CO2气保焊",
          "weld_size": "点焊，焊点长度10mm，焊脚高度4mm",
          "welding_position": "零件①（左铲板）与零件②（方形板-机加）的连接面，平焊",
          "quality_requirements": "点焊牢固，保证零件定位准确，垂直度误差小于1mm",
          "safety_notes": "佩戴焊接面罩和防护手套，确保工作区域通风良好，防止火花飞溅。"
        },
        "safety_warnings": [
          "必须佩戴焊接面罩和防护手套，防止弧光灼伤眼睛和皮肤",
          "确保焊机接地良好，防止漏电触电",
          "焊接区域周围3米内不得有易燃物，防止火灾",
          "操作前检查工件是否夹紧牢固，防止焊接时位移"
        ]
      },
      {
        "step_number": 3,
        "action": "焊接后加强板和前加强板",
        "description": "将图纸上标注为3的后加强板（01.01.01.11519）和4的前加强板（01.01.01.18600）分别放置在1号左铲板的内侧，对齐预留的焊接位置后进行点焊固定。",
        "position_description": "3号后加强板位于铲板内侧靠后位置；4号前加强板位于铲板内侧靠前位置。",
        "parts_used": [
          {
            "bom_seq": "3",
            "bom_name": "后加强板 1",
            "quantity": 1,
            "drawing_number": "3",
            "mesh_id": [
              "mesh_024"
            ],
            "bom_code": "01.01.01.11519"
          },
          {
            "bom_seq": "4",
            "bom_name": "前加强板 1",
            "quantity": 1,
            "drawing_number": "4",
            "mesh_id": [
              "mesh_023"
            ],
            "bom_code": "01.01.01.18600"
          }
        ],
        "tools": [
          "焊机",
          "卷尺"
        ],
        "warnings": [
          "确保两块加强板与铲板的贴合度，避免虚焊。"
        ],
        "welding": {
          "required": true,
          "welding_type": "角焊（定位焊）",
          "welding_method": "CO2气保焊",
          "weld_size": "点焊，焊点长度10mm，焊脚高度4mm",
          "welding_position": "零件①与零件③、零件④的连接面，平焊",
          "quality_requirements": "点焊位置均匀分布，保证加强板与铲板紧密贴合，无间隙。",
          "safety_notes": "注意焊机接地良好，避免触电。焊接时保持姿势稳定，防止烫伤。"
        },
        "safety_warnings": [
          "佩戴焊接面罩和防护手套，防止弧光和焊渣飞溅烫伤",
          "确保工作区域通风良好，防止焊接烟尘吸入",
          "检查焊机电缆绝缘层是否完好，防止漏电"
        ]
      },
      {
        "step_number": 4,
        "action": "焊接底部连接板",
        "description": "将图纸上标注为5的底部连接板（01.01.01.11521）共6块，按照图纸所示位置，均匀焊接到1号左铲板的底部边缘。注意连接板的间距和方向。",
        "position_description": "位于1号左铲板的底部边缘，共6个安装位。",
        "parts_used": [
          {
            "bom_seq": "5",
            "bom_name": "底部连接板 6",
            "quantity": 6,
            "drawing_number": "5",
            "mesh_id": [
              "mesh_012",
              "mesh_013",
              "mesh_014",
              "mesh_015",
              "mesh_021",
              "mesh_022"
            ],
            "bom_code": "01.01.01.11521"
          }
        ],
        "tools": [
          "焊机",
          "卡尺",
          "定位夹具"
        ],
        "warnings": [
          "底部连接板的焊接位置精度要求较高，需确保其安装面在同一平面内。"
        ],
        "welding": {
          "required": true,
          "welding_type": "角焊（定位焊）",
          "welding_method": "CO2气保焊",
          "weld_size": "点焊，焊点长度10mm，焊脚高度5mm",
          "welding_position": "零件①（左铲板）与零件⑤（底部连接板）的连接处，平焊或横焊（取决于铲板放置角度）",
          "quality_requirements": "使用定位夹具确保连接板安装面共面性，点焊牢固，防止后续满焊时移位。",
          "safety_notes": "由于零件数量多，注意焊接顺序，避免局部热量集中导致铲板变形。穿戴好防护服。"
        },
        "safety_warnings": [
          "穿戴防护服和防护手套，防止高温焊渣烫伤身体",
          "使用定位夹具时，注意夹紧力度，防止夹具弹开伤人",
          "焊接多块零件时，注意控制热输入，防止工件变形或烫伤"
        ]
      },
      {
        "step_number": 5,
        "action": "焊接前油缸固定板",
        "description": "将图纸上标注为6的前油缸固定板（01.01.01.11522）共2块，焊接到4号前加强板和1号左铲板的连接区域。注意固定板的安装方向，确保油缸销轴孔位朝向正确。",
        "position_description": "位于4号前加强板附近，靠近铲板内侧。",
        "parts_used": [
          {
            "bom_seq": "6",
            "bom_name": "前油缸固定板 2",
            "quantity": 2,
            "drawing_number": "6",
            "mesh_id": [
              "mesh_019",
              "mesh_020"
            ],
            "bom_code": "01.01.01.11522"
          }
        ],
        "tools": [
          "焊机",
          "定位销"
        ],
        "warnings": [
          "油缸固定板的孔位中心距需严格控制，以保证后续油缸安装顺畅。"
        ],
        "welding": {
          "required": true,
          "welding_type": "角焊（定位焊）",
          "welding_method": "CO2气保焊",
          "weld_size": "点焊，焊点长度15mm，焊脚高度6mm",
          "welding_position": "零件⑥（前油缸固定板）与零件①和零件④的连接处，平焊",
          "quality_requirements": "使用定位销或工装确保两个固定板的孔位中心距和垂直度符合图纸要求。点焊要均匀，防止应力集中。",
          "safety_notes": "油缸固定板是受力关键部位，点焊时要保证焊点质量。注意防止焊接烟尘吸入，开启排风设备。"
        },
        "safety_warnings": [
          "油缸固定板是受力关键部位，焊接时要保证焊点质量，防止结构失效",
          "开启排风设备或佩戴防尘口罩，防止吸入焊接烟尘",
          "使用定位销时，注意防止定位销卡死或飞出伤人"
        ]
      },
      {
        "step_number": 6,
        "action": "焊接前弹簧固定板",
        "description": "将图纸上标注为7的前弹簧固定板（01.01.01.11523）1块，焊接到1号左铲板的内侧中部区域。",
        "position_description": "位于铲板内侧中部，靠近4号前加强板。",
        "parts_used": [
          {
            "bom_seq": "7",
            "bom_name": "前弹簧固定板 1",
            "quantity": 1,
            "drawing_number": "7",
            "mesh_id": [
              "mesh_018"
            ],
            "bom_code": "01.01.01.11523"
          }
        ],
        "tools": [
          "焊机"
        ],
        "warnings": [
          "确保弹簧固定板的焊接强度，该部位承受较大冲击力。"
        ],
        "welding": {
          "required": true,
          "welding_type": "角焊（定位焊）",
          "welding_method": "CO2气保焊",
          "weld_size": "点焊，焊点长度10mm，焊脚高度5mm",
          "welding_position": "零件⑦（前弹簧固定板）与零件①（左铲板）的连接处，平焊",
          "quality_requirements": "定位准确，确保固定板与铲板贴合紧密，点焊牢固。",
          "safety_notes": "检查焊机电缆绝缘层是否完好，避免漏电。"
        },
        "safety_warnings": [
          "检查焊机电缆绝缘层是否完好，避免漏电触电",
          "焊接时注意周围环境，防止火花飞溅到易燃物上"
        ]
      },
      {
        "step_number": 7,
        "action": "焊接后弹簧固定板",
        "description": "将图纸上标注为8的后弹簧固定板（01.01.01.11524）共2块，焊接到1号左铲板的内侧后部区域。",
        "position_description": "位于铲板内侧后部，靠近3号后加强板。",
        "parts_used": [
          {
            "bom_seq": "8",
            "bom_name": "后弹簧固定板 2",
            "quantity": 2,
            "drawing_number": "8",
            "mesh_id": [
              "mesh_016",
              "mesh_017"
            ],
            "bom_code": "01.01.01.11524"
          }
        ],
        "tools": [
          "焊机"
        ],
        "warnings": [
          "两块后弹簧固定板需保持对称和水平。"
        ],
        "welding": {
          "required": true,
          "welding_type": "角焊（定位焊）",
          "welding_method": "CO2气保焊",
          "weld_size": "点焊，焊点长度10mm，焊脚高度5mm",
          "welding_position": "零件⑧（后弹簧固定板）与零件①（左铲板）的连接处，平焊",
          "quality_requirements": "使用卷尺或工装确保两块固定板的相对位置和水平度，点焊牢固。",
          "safety_notes": "焊接前清理零件表面的油污和锈蚀，防止产生气孔。"
        },
        "safety_warnings": [
          "焊接前必须清理零件表面的油污和锈蚀，防止焊接时产生有毒烟雾",
          "佩戴防护眼镜，防止清理时铁屑飞溅伤眼"
        ]
      },
      {
        "step_number": 8,
        "action": "焊接支撑固定板",
        "description": "将图纸上标注为9的支撑固定板（01.01.01.11525）1块，焊接到1号左铲板的内侧，位于中部偏下位置。",
        "position_description": "位于铲板内侧中部，用于支撑结构。",
        "parts_used": [
          {
            "bom_seq": "9",
            "bom_name": "支撑固定板 1",
            "quantity": 1,
            "drawing_number": "9",
            "mesh_id": [
              "mesh_011"
            ],
            "bom_code": "01.01.01.11525"
          }
        ],
        "tools": [
          "焊机"
        ],
        "warnings": [
          "确保支撑固定板与铲板的垂直度。"
        ],
        "welding": {
          "required": true,
          "welding_type": "角焊（定位焊）",
          "welding_method": "CO2气保焊",
          "weld_size": "点焊，焊点长度10mm，焊脚高度5mm",
          "welding_position": "零件⑨（支撑固定板）与零件①（左铲板）的连接处，平焊",
          "quality_requirements": "使用角尺检查垂直度，点焊牢固，保证后续满焊时位置不变。",
          "safety_notes": "焊接区域周围保持整洁，避免杂物引起火灾。"
        },
        "safety_warnings": [
          "焊接区域周围保持整洁，清除易燃物，防止焊渣引燃火灾",
          "使用角尺检查垂直度时，注意板件边缘锋利，佩戴手套防止割伤"
        ]
      },
      {
        "step_number": 9,
        "action": "焊接轴套加强板",
        "description": "将图纸上标注为10的轴套加强板（01.01.01.11526）共2块，焊接到1号左铲板的内侧，位于铲板的上下边缘，用于加强轴套安装区域。",
        "position_description": "位于铲板内侧的上下边缘，靠近铲板的左右两侧。",
        "parts_used": [
          {
            "bom_seq": "10",
            "bom_name": "轴套加强板 2",
            "quantity": 2,
            "drawing_number": "10",
            "mesh_id": [
              "mesh_009",
              "mesh_010"
            ],
            "bom_code": "01.01.01.11526"
          }
        ],
        "tools": [
          "焊机"
        ],
        "warnings": [
          "轴套加强板的定位需精确，为后续轴套安装做准备。"
        ],
        "welding": {
          "required": true,
          "welding_type": "角焊（定位焊）",
          "welding_method": "CO2气保焊",
          "weld_size": "点焊，焊点长度10mm，焊脚高度5mm",
          "welding_position": "零件⑩（轴套加强板）与零件①（左铲板）的连接处，平焊",
          "quality_requirements": "确保加强板上的孔位与铲板上的孔位对齐，点焊牢固。",
          "safety_notes": "注意焊接电流和电压的匹配，防止飞溅过多。"
        },
        "safety_warnings": [
          "调整焊接参数，防止飞溅过多烫伤皮肤或引起火灾",
          "佩戴防护眼镜，防止焊接飞溅物伤眼"
        ]
      },
      {
        "step_number": 10,
        "action": "焊接反光片安装板",
        "description": "将图纸上标注为11的反光片安装板（01.01.01.11527）1块，焊接到1号左铲板的后侧边缘，靠近2号方形板-机加的上方。",
        "position_description": "位于铲板后侧边缘，用于安装反光片。",
        "parts_used": [
          {
            "bom_seq": "11",
            "bom_name": "反光片安装板 1",
            "quantity": 1,
            "drawing_number": "11",
            "mesh_id": [
              "mesh_008"
            ],
            "bom_code": "01.01.01.11527"
          }
        ],
        "tools": [
          "焊机"
        ],
        "warnings": [
          "确保安装板的安装面平整，便于后续反光片安装。"
        ],
        "welding": {
          "required": true,
          "welding_type": "角焊（定位焊）",
          "welding_method": "CO2气保焊",
          "weld_size": "点焊，焊点长度8mm，焊脚高度4mm",
          "welding_position": "零件⑪（反光片安装板）与零件①（左铲板）的连接处，平焊",
          "quality_requirements": "定位准确，安装面平整，点焊牢固。",
          "safety_notes": "该零件较小，点焊时注意控制热输入，防止烧穿。"
        },
        "safety_warnings": [
          "该零件较小，点焊时注意控制热输入，防止烧穿或烫伤",
          "焊接完成后，不要立即用手触摸焊件，防止烫伤"
        ]
      },
      {
        "step_number": 11,
        "action": "焊接轴套",
        "description": "将图纸上标注为12的轴套（01.01.02.1222）共2个，分别焊接到10号轴套加强板预留的孔位上。轴套需从外侧插入，与加强板和铲板焊接固定。注意轴套的端面与铲板端面配合要求。",
        "position_description": "位于铲板上下边缘的轴套安装孔位。",
        "parts_used": [
          {
            "bom_seq": "12",
            "bom_name": "轴套 2",
            "quantity": 2,
            "drawing_number": "12"
          }
        ],
        "tools": [
          "焊机",
          "定位工装"
        ],
        "warnings": [
          "轴套与铲板的端面配合要求高，需确保轴套中心线与铲板垂直，且端面齐平或符合图纸要求。"
        ],
        "welding": {
          "required": true,
          "welding_type": "角焊/环形焊（定位焊）",
          "welding_method": "CO2气保焊",
          "weld_size": "点焊，焊点长度15mm，焊脚高度6mm",
          "welding_position": "零件⑫（轴套）与零件①（左铲板）和零件⑩（轴套加强板）的连接处，平焊/横焊",
          "quality_requirements": "使用定位工装确保轴套中心线垂直度。点焊时采用对称分布，防止轴套倾斜。",
          "safety_notes": "轴套焊接时，注意防止焊渣溅入轴套内孔，影响后续装配。焊接后需检查轴套内孔是否变形。"
        },
        "safety_warnings": [
          "使用定位工装时，确保工装放置平稳，防止轴套倾倒砸伤",
          "焊接时注意防止焊渣溅入轴套内孔，影响后续装配",
          "轴套焊接热量集中，注意防止工件过热变形"
        ]
      },
      {
        "step_number": 12,
        "action": "焊接方形板 1",
        "description": "将图纸上标注为13的方形板 1（01.01.01.11528）1块，焊接到1号左铲板的内侧，位于上部边缘。",
        "position_description": "位于铲板内侧上边缘，靠近轴套区域。",
        "parts_used": [
          {
            "bom_seq": "13",
            "bom_name": "方形板 1",
            "quantity": 1,
            "drawing_number": "13"
          }
        ],
        "tools": [
          "焊机"
        ],
        "warnings": [
          "确保焊接牢固，避免变形。"
        ],
        "welding": {
          "required": true,
          "welding_type": "角焊（定位焊）",
          "welding_method": "CO2气保焊",
          "weld_size": "点焊，焊点长度10mm，焊脚高度5mm",
          "welding_position": "零件⑬（方形板 1）与零件①（左铲板）的连接处，平焊",
          "quality_requirements": "定位准确，贴合紧密，点焊牢固。",
          "safety_notes": "注意焊接时保持通风，避免有害气体聚集。"
        },
        "safety_warnings": [
          "确保工作区域通风良好，避免焊接有害气体聚集中毒",
          "佩戴防护眼镜和手套，防止焊接飞溅物伤人"
        ]
      },
      {
        "step_number": 13,
        "action": "焊接方形板 3",
        "description": "将图纸上标注为14的方形板 3（01.01.01.11529）1块，焊接到1号左铲板的内侧，位于中部区域。",
        "position_description": "位于铲板内侧中部，靠近9号支撑固定板。",
        "parts_used": [
          {
            "bom_seq": "14",
            "bom_name": "方形板 3",
            "quantity": 1,
            "drawing_number": "14",
            "mesh_id": [
              "mesh_003",
              "mesh_004",
              "mesh_005"
            ],
            "bom_code": "01.01.01.11529"
          }
        ],
        "tools": [
          "焊机"
        ],
        "warnings": [
          "检查焊接位置是否符合图纸要求。"
        ],
        "welding": {
          "required": true,
          "welding_type": "角焊（定位焊）",
          "welding_method": "CO2气保焊",
          "weld_size": "点焊，焊点长度10mm，焊脚高度5mm",
          "welding_position": "零件⑭（方形板 3）与零件①（左铲板）的连接处，平焊",
          "quality_requirements": "定位准确，点焊牢固。",
          "safety_notes": "焊接过程中，注意检查焊枪喷嘴是否堵塞，确保保护气体稳定。"
        },
        "safety_warnings": [
          "注意检查焊枪喷嘴和气路，防止保护气体泄漏或堵塞，影响焊接质量和安全"
        ]
      },
      {
        "step_number": 14,
        "action": "焊接左铲雪板加强板 2",
        "description": "将图纸上标注为15的左铲雪板加强板 2（01.02.01.4983）2块，焊接到1号左铲板的内侧，位于铲板的左右两侧边缘。",
        "position_description": "位于铲板内侧的左右两侧边缘，用于加强铲板的整体刚度。",
        "parts_used": [
          {
            "bom_seq": "15",
            "bom_name": "左铲雪板加强板 2",
            "quantity": 2,
            "drawing_number": "15",
            "mesh_id": [
              "mesh_001",
              "mesh_002"
            ],
            "bom_code": "01.02.01.4983"
          }
        ],
        "tools": [
          "焊机"
        ],
        "warnings": [
          "这是最后的主要焊接件，需进行满焊，确保焊缝质量和强度。"
        ],
        "welding": {
          "required": true,
          "welding_type": "角焊（定位焊）",
          "welding_method": "CO2气保焊",
          "weld_size": "点焊，焊点长度15mm，焊脚高度6mm",
          "welding_position": "零件⑮（左铲雪板加强板 2）与零件①（左铲板）的连接处，平焊",
          "quality_requirements": "定位准确，为后续满焊做准备。",
          "safety_notes": "点焊完成后，检查所有零件是否都已定位，准备进行满焊。"
        },
        "safety_warnings": [
          "点焊完成后，检查所有焊点是否牢固，防止满焊前零件松动移位",
          "确保所有焊缝位置清理干净，为满焊做好准备"
        ]
      },
      {
        "step_number": 15,
        "action": "满焊及清理",
        "description": "对所有已点焊的零件进行满焊。焊接完成后，进行焊渣清理和打磨，确保所有焊缝符合技术要求。",
        "position_description": "所有焊接部位。",
        "parts_used": [],
        "tools": [
          "焊机",
          "角磨机",
          "钢丝刷"
        ],
        "warnings": [
          "满焊时注意控制热变形，必要时采用对称焊接或分段焊接。清理焊渣时注意安全防护。"
        ],
        "welding": {
          "required": true,
          "welding_type": "角焊/环形焊（满焊）",
          "welding_method": "CO2气保焊",
          "weld_size": "焊脚高度6mm（图纸未标注尺寸按此执行），轴套环焊焊脚高度8mm",
          "welding_position": "所有零件连接处，涉及平焊、横焊、立焊（如果需要翻转）",
          "quality_requirements": "焊缝必须连续、饱满，焊缝表面均匀，不得有裂纹、未熔合、严重气孔和夹渣。焊后进行外观检查，关键受力部位（如油缸固定板、轴套）需进行磁粉或超声波检测。",
          "safety_notes": "满焊热输入大，必须佩戴全套防护用品（面罩、手套、防护服）。采用分段、跳焊工艺控制变形。打磨清理时，佩戴护目镜，防止飞溅物伤眼。"
        },
        "safety_warnings": [
          "满焊时必须佩戴全套防护用品（面罩、防护服、手套），防止大面积弧光和高温烫伤",
          "使用角磨机清理焊缝时，必须佩戴防护眼镜和防尘口罩，防止金属飞屑和粉尘伤眼、吸入",
          "角磨机操作时，注意站位和磨削方向，防止砂轮片破碎伤人",
          "采用分段、跳焊工艺，控制热变形，防止工件翘曲"
        ]
      }
    ]
  }
}