{
  "agent_name": "Agent6_FAQ",
  "model": "google/gemini-2.5-flash-preview-09-2025",
  "timestamp": "20251005_020859",
  "image_count": 0,
  "temperature": 0.2,
  "system_prompt": "你是安全工程师李师傅，拥有20年安全管理经验。\n\n你的任务：为每个装配步骤添加安全警告（如果该步骤有安全风险）。\n\n## 核心原则\n\n1. **安全第一**：识别所有潜在的安全风险\n2. **嵌入警告**：为有风险的步骤添加safety_warnings字段\n3. **工人友好**：使用通俗语言，避免专业术语\n\n## 输出格式\n\n严格按照以下JSON格式输出（返回增强后的装配步骤）：\n\n```json\n{\n  \"enhanced_steps\": [\n    {\n      \"step_number\": 1,\n      \"title\": \"步骤标题\",\n      \"parts_used\": [...],\n      \"tools_required\": [...],\n      \"operation\": \"操作说明\",\n      \"quality_check\": \"质量检查\",\n      \"estimated_time_minutes\": 10,\n      \"welding\": {...},\n      \"safety_warnings\": [\n        \"佩戴安全帽和防护眼镜\",\n        \"确保工件固定牢固\",\n        \"注意防止烫伤\"\n      ]\n    }\n  ]\n}\n```\n\n**⚠️ 重要**：\n- 如果步骤没有安全风险，不要添加safety_warnings字段\n- 如果步骤有安全风险，safety_warnings必须是字符串数组\n- 保持原有步骤的所有字段不变，只添加safety_warnings字段\n\n## 重要提醒\n\n- **只输出JSON，不要输出其他内容**\n- **安全警告要具体**：说明具体的风险和预防措施\n- **使用通俗语言**：工人能看懂的语言\n",
  "user_query": "请为以下装配步骤添加安全警告（如果有安全风险）。\n\n## 装配步骤\n\n[\n  {\n    \"step_number\": 1,\n    \"action\": \"定位基准侧板\",\n    \"description\": \"将一块图纸编号为3的侧连接板（01.01.01.11513）平稳放置在焊接平台上作为基准件。确保板面水平，并清理所有待焊接区域。\",\n    \"position_description\": \"基准件平放于焊接平台。\",\n    \"parts_used\": [\n      {\n        \"bom_code\": \"01.01.01.11513\",\n        \"bom_name\": \"侧连接板 2\",\n        \"quantity\": 1,\n        \"drawing_number\": \"3\",\n        \"mesh_id\": [\n          \"mesh_014\",\n          \"mesh_015\"\n        ]\n      }\n    ],\n    \"tools\": [\n      \"焊接平台\",\n      \"角磨机（清理）\"\n    ],\n    \"warnings\": [\n      \"清理焊缝区域，确保无油污、锈迹。\"\n    ]\n  },\n  {\n    \"step_number\": 2,\n    \"action\": \"焊接方形板\",\n    \"description\": \"将图纸编号为1的方形板-机加（01.01.01.11511）放置在基准侧连接板（3）的指定位置，使用夹具临时固定。方形板的机加工面朝外。\",\n    \"position_description\": \"方形板（1）垂直焊接在侧连接板（3）的底部边缘。\",\n    \"parts_used\": [\n      {\n        \"bom_code\": \"01.01.01.11511\",\n        \"bom_name\": \"方形板-机加\",\n        \"quantity\": 1,\n        \"drawing_number\": \"1\",\n        \"mesh_id\": [\n          \"mesh_018\"\n        ]\n      }\n    ],\n    \"tools\": [\n      \"焊接夹具\",\n      \"焊机\"\n    ],\n    \"warnings\": [\n      \"点焊固定时，确保方形板与侧连接板的垂直度。\"\n    ],\n    \"welding\": {\n      \"required\": true,\n      \"welding_type\": \"角焊/点焊（临时固定）\",\n      \"welding_method\": \"CO2气保焊\",\n      \"weld_size\": \"点焊长度10-15mm，焊脚高度4mm\",\n      \"welding_position\": \"立角焊（方形板与侧连接板的连接处）\",\n      \"quality_requirements\": \"点焊牢固，保证方形板与侧板的垂直度（90°±0.5°）。\",\n      \"safety_notes\": \"点焊时注意飞溅，佩戴防护手套和面罩，确保工作区域通风良好。\"\n    }\n  },\n  {\n    \"step_number\": 3,\n    \"action\": \"安装另一侧板\",\n    \"description\": \"将另一块图纸编号为3的侧连接板（01.01.01.11513）安装在方形板（1）的另一侧，与第一块侧连接板平行。使用量具确保两块侧连接板的间距符合图纸尺寸要求（485mm）。\",\n    \"position_description\": \"第二块侧连接板（3）与第一块侧连接板（3）平行，通过方形板（1）连接。\",\n    \"parts_used\": [\n      {\n        \"bom_code\": \"01.01.01.11513\",\n        \"bom_name\": \"侧连接板 2\",\n        \"quantity\": 1,\n        \"drawing_number\": \"3\",\n        \"mesh_id\": [\n          \"mesh_014\",\n          \"mesh_015\"\n        ]\n      }\n    ],\n    \"tools\": [\n      \"焊接夹具\",\n      \"卷尺/卡尺\"\n    ],\n    \"warnings\": [\n      \"严格控制两块侧板的平行度和间距。\"\n    ],\n    \"welding\": {\n      \"required\": true,\n      \"welding_type\": \"角焊/点焊（临时固定）\",\n      \"welding_method\": \"CO2气保焊\",\n      \"weld_size\": \"点焊长度10-15mm，焊脚高度4mm\",\n      \"welding_position\": \"立角焊（方形板与第二块侧连接板的连接处）\",\n      \"quality_requirements\": \"点焊牢固，保证两块侧板的间距（485mm）和垂直度。\",\n      \"safety_notes\": \"焊接前检查夹具是否牢固，防止零件在焊接过程中移动或倾倒。\"\n    }\n  },\n  {\n    \"step_number\": 4,\n    \"action\": \"焊接上连接板\",\n    \"description\": \"将两块图纸编号为2的上连接板（01.01.01.11512）分别焊接在两侧连接板（3）的上部边缘，确保其与侧板垂直且位于指定高度。\",\n    \"position_description\": \"上连接板（2）位于两侧连接板（3）的顶部，横向连接。\",\n    \"parts_used\": [\n      {\n        \"bom_code\": \"01.01.01.11512\",\n        \"bom_name\": \"上连接板\",\n        \"quantity\": 2,\n        \"drawing_number\": \"2\",\n        \"mesh_id\": [\n          \"mesh_016\",\n          \"mesh_017\"\n        ]\n      }\n    ],\n    \"tools\": [\n      \"焊机\",\n      \"直角尺\"\n    ],\n    \"warnings\": [\n      \"上连接板的焊接位置必须精确，确保其与侧板的垂直度。\"\n    ],\n    \"welding\": {\n      \"required\": true,\n      \"welding_type\": \"角焊\",\n      \"welding_method\": \"CO2气保焊\",\n      \"weld_size\": \"焊脚高度6mm（根据图纸要求）\",\n      \"welding_position\": \"平角焊或横角焊（上连接板与侧连接板的连接处）\",\n      \"quality_requirements\": \"焊缝连续，无漏焊，保证上连接板与侧板的垂直度。\",\n      \"safety_notes\": \"焊接电流和电压要匹配板厚，避免烧穿或焊瘤。注意高温烫伤。\"\n    }\n  },\n  {\n    \"step_number\": 5,\n    \"action\": \"焊接折弯板\",\n    \"description\": \"将图纸编号为4的折弯板 1（01.01.01.11514）焊接在主体结构内部的指定位置，作为加强支撑。\",\n    \"position_description\": \"折弯板（4）位于主体框架内部，连接两侧板（3）。\",\n    \"parts_used\": [\n      {\n        \"bom_code\": \"01.01.01.11514\",\n        \"bom_name\": \"折弯板 1\",\n        \"quantity\": 1,\n        \"drawing_number\": \"4\",\n        \"mesh_id\": [\n          \"mesh_013\"\n        ]\n      }\n    ],\n    \"tools\": [\n      \"焊机\"\n    ],\n    \"warnings\": [\n      \"确保折弯板与侧板的贴合度，避免虚焊。\"\n    ],\n    \"welding\": {\n      \"required\": true,\n      \"welding_type\": \"角焊\",\n      \"welding_method\": \"CO2气保焊\",\n      \"weld_size\": \"焊脚高度5mm\",\n      \"welding_position\": \"立角焊（折弯板与两侧连接板的连接处）\",\n      \"quality_requirements\": \"焊缝均匀，保证折弯板与侧板紧密贴合，焊透率高。\",\n      \"safety_notes\": \"在结构内部焊接时，注意烟尘聚集，必须使用局部排风设备。\"\n    }\n  },\n  {\n    \"step_number\": 6,\n    \"action\": \"焊接油缸固定板\",\n    \"description\": \"将四块图纸编号为5的油缸固定板 4（01.01.01.11515）分别焊接在两侧连接板（3）的指定孔位周围。注意油缸固定板的方向和角度，确保孔位对齐。\",\n    \"position_description\": \"油缸固定板（5）对称分布在两侧连接板（3）上，用于连接油缸。\",\n    \"parts_used\": [\n      {\n        \"bom_code\": \"01.01.01.11515\",\n        \"bom_name\": \"油缸固定板 4\",\n        \"quantity\": 4,\n        \"drawing_number\": \"5\",\n        \"mesh_id\": [\n          \"mesh_002\",\n          \"mesh_003\",\n          \"mesh_011\",\n          \"mesh_012\"\n        ]\n      }\n    ],\n    \"tools\": [\n      \"焊机\",\n      \"定位销\"\n    ],\n    \"warnings\": [\n      \"使用定位销确保油缸固定板的安装孔与侧板上的孔同心。\"\n    ],\n    \"welding\": {\n      \"required\": true,\n      \"welding_type\": \"角焊\",\n      \"welding_method\": \"CO2气保焊\",\n      \"weld_size\": \"焊脚高度4mm\",\n      \"welding_position\": \"平焊或横焊（油缸固定板与侧连接板的连接处）\",\n      \"quality_requirements\": \"焊缝连续，无气孔、夹渣。焊接时要避开孔位，防止焊渣溅入孔内。\",\n      \"safety_notes\": \"焊接前必须使用定位销或螺栓固定，防止焊接热应力导致孔位偏差。\"\n    }\n  },\n  {\n    \"step_number\": 7,\n    \"action\": \"焊接加强板\",\n    \"description\": \"将四块图纸编号为6的加强板 4（01.01.01.11516）焊接在两侧连接板（3）的指定加强区域，以提高结构刚性。\",\n    \"position_description\": \"加强板（6）焊接在侧连接板（3）的内侧或外侧，靠近受力区域。\",\n    \"parts_used\": [\n      {\n        \"bom_code\": \"01.01.01.11516\",\n        \"bom_name\": \"加强板 4\",\n        \"quantity\": 4,\n        \"drawing_number\": \"6\",\n        \"mesh_id\": [\n          \"mesh_007\",\n          \"mesh_008\",\n          \"mesh_009\",\n          \"mesh_010\"\n        ]\n      }\n    ],\n    \"tools\": [\n      \"焊机\"\n    ],\n    \"warnings\": [\n      \"加强板的焊缝应饱满，符合图纸技术要求。\"\n    ],\n    \"welding\": {\n      \"required\": true,\n      \"welding_type\": \"角焊\",\n      \"welding_method\": \"CO2气保焊\",\n      \"weld_size\": \"焊脚高度5mm\",\n      \"welding_position\": \"平焊或立焊（加强板与侧连接板的连接处）\",\n      \"quality_requirements\": \"焊缝必须饱满、连续，确保结构强度。焊缝表面平整，过渡圆滑。\",\n      \"safety_notes\": \"加强板通常较厚，需要适当预热（如果材料要求），防止焊接裂纹。\"\n    }\n  },\n  {\n    \"step_number\": 8,\n    \"action\": \"焊接角钢\",\n    \"description\": \"将图纸编号为7的角钢-机加 1（01.01.04.0592）焊接在主体结构的指定位置，作为额外的支撑或连接点。\",\n    \"position_description\": \"角钢（7）位于主体结构上部或侧面，根据图纸定位。\",\n    \"parts_used\": [\n      {\n        \"bom_code\": \"01.01.04.0592\",\n        \"bom_name\": \"角钢-机加 1\",\n        \"quantity\": 1,\n        \"drawing_number\": \"7\",\n        \"mesh_id\": [\n          \"mesh_006\"\n        ]\n      }\n    ],\n    \"tools\": [\n      \"焊机\",\n      \"直角尺\"\n    ],\n    \"warnings\": [\n      \"确保角钢的机加工面朝向正确，且焊接牢固。\"\n    ],\n    \"welding\": {\n      \"required\": true,\n      \"welding_type\": \"角焊\",\n      \"welding_method\": \"CO2气保焊\",\n      \"weld_size\": \"焊脚高度6mm\",\n      \"welding_position\": \"平焊或横焊（角钢与侧连接板的连接处）\",\n      \"quality_requirements\": \"焊缝连续，保证角钢与侧板的垂直度，焊缝外观要求高。\",\n      \"safety_notes\": \"角钢定位要准确，使用直角尺反复确认，避免因焊接变形导致尺寸超差。\"\n    }\n  },\n  {\n    \"step_number\": 9,\n    \"action\": \"焊接后座轴套（8）\",\n    \"description\": \"将图纸编号为8的后座轴套 1（01.02.02.0490）插入到侧连接板（3）的指定孔位中，并进行焊接固定。注意轴套的伸出长度和同轴度要求。\",\n    \"position_description\": \"轴套（8）穿过侧连接板（3）的孔位，位于组件的后部。\",\n    \"parts_used\": [\n      {\n        \"bom_code\": \"01.02.02.0490\",\n        \"bom_name\": \"后座轴套 1\",\n        \"quantity\": 1,\n        \"drawing_number\": \"8\",\n        \"mesh_id\": [\n          \"mesh_004\"\n        ]\n      }\n    ],\n    \"tools\": [\n      \"焊机\",\n      \"同轴度检测工具\"\n    ],\n    \"warnings\": [\n      \"轴套与侧板的焊接需保证同轴度，避免变形。\"\n    ],\n    \"welding\": {\n      \"required\": true,\n      \"welding_type\": \"围焊（环形焊）\",\n      \"welding_method\": \"CO2气保焊\",\n      \"weld_size\": \"焊脚高度4mm，全周焊\",\n      \"welding_position\": \"平焊或仰焊（轴套与侧连接板的连接处）\",\n      \"quality_requirements\": \"焊缝必须全周连续，焊透，无气孔。焊接时要分段对称焊接，减少热量集中，控制轴套变形。\",\n      \"safety_notes\": \"焊接前在轴套内孔塞入防火材料或使用铜垫保护，防止焊渣溅入内孔，影响后续装配精度。\"\n    }\n  },\n  {\n    \"step_number\": 10,\n    \"action\": \"焊接轴套（9）\",\n    \"description\": \"将图纸编号为9的轴套 1（01.01.02.1221）插入到侧连接板（3）的指定孔位中，并进行焊接固定。注意轴套的伸出长度和同轴度要求。\",\n    \"position_description\": \"轴套（9）穿过侧连接板（3）的孔位，位于组件的下部。\",\n    \"parts_used\": [\n      {\n        \"bom_code\": \"01.01.02.1221\",\n        \"bom_name\": \"轴套 1\",\n        \"quantity\": 1,\n        \"drawing_number\": \"9\",\n        \"mesh_id\": [\n          \"mesh_005\"\n        ]\n      }\n    ],\n    \"tools\": [\n      \"焊机\",\n      \"同轴度检测工具\"\n    ],\n    \"warnings\": [\n      \"轴套焊接时，应避免焊渣进入轴套内孔。\"\n    ],\n    \"welding\": {\n      \"required\": true,\n      \"welding_type\": \"围焊（环形焊）\",\n      \"welding_method\": \"CO2气保焊\",\n      \"weld_size\": \"焊脚高度4mm，全周焊\",\n      \"welding_position\": \"平焊或仰焊（轴套与侧连接板的连接处）\",\n      \"quality_requirements\": \"焊缝必须全周连续，保证轴套的同轴度。焊接后立即检查内孔，确保无焊渣。\",\n      \"safety_notes\": \"焊接时要控制热输入，避免轴套因受热不均而产生椭圆变形。使用专用夹具辅助散热。\"\n    }\n  },\n  {\n    \"step_number\": 11,\n    \"action\": \"焊接后座轴套（10）\",\n    \"description\": \"将图纸编号为10的后座轴套 1（01.01.02.0337）插入到侧连接板（3）的指定孔位中，并进行焊接固定。注意轴套的伸出长度和同轴度要求。\",\n    \"position_description\": \"轴套（10）穿过侧连接板（3）的孔位，位于组件的后部上方。\",\n    \"parts_used\": [\n      {\n        \"bom_code\": \"01.01.02.0337\",\n        \"bom_name\": \"后座轴套 1\",\n        \"quantity\": 1,\n        \"drawing_number\": \"10\",\n        \"mesh_id\": [\n          \"mesh_001\"\n        ]\n      }\n    ],\n    \"tools\": [\n      \"焊机\",\n      \"同轴度检测工具\"\n    ],\n    \"warnings\": [\n      \"所有轴套焊接完成后，需进行整体冷却，防止热应力变形。\"\n    ],\n    \"welding\": {\n      \"required\": true,\n      \"welding_type\": \"围焊（环形焊）\",\n      \"welding_method\": \"CO2气保焊\",\n      \"weld_size\": \"焊脚高度4mm，全周焊\",\n      \"welding_position\": \"平焊或仰焊（轴套与侧连接板的连接处）\",\n      \"quality_requirements\": \"焊缝必须全周连续，保证轴套的同轴度。焊接完成后，需自然冷却，不可强制水冷。\",\n      \"safety_notes\": \"轴套焊接是关键步骤，必须由熟练焊工操作。焊接完成后，用同轴度检测工具进行复检。\"\n    }\n  },\n  {\n    \"step_number\": 12,\n    \"action\": \"最终焊接与清理\",\n    \"description\": \"对所有点焊部位进行最终满焊，焊缝要求符合图纸技术要求。焊接完成后，使用角磨机清理所有焊渣和飞溅物，并对尖锐边缘进行倒角处理。\",\n    \"position_description\": \"所有连接部位。\",\n    \"parts_used\": [],\n    \"tools\": [\n      \"焊机\",\n      \"角磨机\",\n      \"钢丝刷\"\n    ],\n    \"warnings\": [\n      \"焊缝应平整、均匀，无气孔、夹渣、裂纹等缺陷。\"\n    ],\n    \"welding\": {\n      \"required\": true,\n      \"welding_type\": \"满焊（所有连接处）\",\n      \"welding_method\": \"CO2气保焊\",\n      \"weld_size\": \"按图纸要求，通常为5-6mm焊脚高度\",\n      \"welding_position\": \"所有位置（平、横、立、仰）\",\n      \"quality_requirements\": \"焊缝外观等级达到二级标准，无裂纹、未焊透、咬边深度小于0.5mm。焊缝高度和宽度均匀。\",\n      \"safety_notes\": \"满焊工作量大，注意焊枪和电缆的绝缘保护。清理焊渣时，佩戴防护眼镜，防止飞溅物伤眼。\"\n    }\n  }\n]\n\n## 要求\n\n1. **识别风险步骤**：判断哪些步骤有安全风险（吊装、焊接、高空作业、重物搬运等）\n2. **添加安全警告**：为有风险的步骤添加safety_warnings字段\n3. **保持原有字段**：不要修改或删除原有的字段（step_number、title、welding等）\n4. **使用通俗语言**：工人能看懂的语言\n5. **警告要具体**：说明具体的风险和预防措施\n\n## 自检清单\n\n- [ ] 所有有风险的步骤都添加了safety_warnings字段\n- [ ] safety_warnings是字符串数组，每条警告简洁明了\n- [ ] 原有步骤的所有字段都保持不变\n- [ ] 没有风险的步骤没有添加safety_warnings字段\n\n现在开始为装配步骤添加安全警告！\n",
  "raw_response": "```json\n{\n  \"enhanced_steps\": [\n    {\n      \"step_number\": 1,\n      \"action\": \"定位基准侧板\",\n      \"description\": \"将一块图纸编号为3的侧连接板（01.01.01.11513）平稳放置在焊接平台上作为基准件。确保板面水平，并清理所有待焊接区域。\",\n      \"position_description\": \"基准件平放于焊接平台。\",\n      \"parts_used\": [\n        {\n          \"bom_code\": \"01.01.01.11513\",\n          \"bom_name\": \"侧连接板 2\",\n          \"quantity\": 1,\n          \"drawing_number\": \"3\",\n          \"mesh_id\": [\n            \"mesh_014\",\n            \"mesh_015\"\n          ]\n        }\n      ],\n      \"tools\": [\n        \"焊接平台\",\n        \"角磨机（清理）\"\n      ],\n      \"warnings\": [\n        \"清理焊缝区域，确保无油污、锈迹。\"\n      ],\n      \"safety_warnings\": [\n        \"搬运侧连接板时，注意板材边缘锋利，必须佩戴防割手套。\",\n        \"使用角磨机清理时，必须佩戴防护眼镜和耳塞，防止火花飞溅和噪音伤害。\"\n      ]\n    },\n    {\n      \"step_number\": 2,\n      \"action\": \"焊接方形板\",\n      \"description\": \"将图纸编号为1的方形板-机加（01.01.01.11511）放置在基准侧连接板（3）的指定位置，使用夹具临时固定。方形板的机加工面朝外。\",\n      \"position_description\": \"方形板（1）垂直焊接在侧连接板（3）的底部边缘。\",\n      \"parts_used\": [\n        {\n          \"bom_code\": \"01.01.01.11511\",\n          \"bom_name\": \"方形板-机加\",\n          \"quantity\": 1,\n          \"drawing_number\": \"1\",\n          \"mesh_id\": [\n            \"mesh_018\"\n          ]\n        }\n      ],\n      \"tools\": [\n        \"焊接夹具\",\n        \"焊机\"\n      ],\n      \"warnings\": [\n        \"点焊固定时，确保方形板与侧连接板的垂直度。\"\n      ],\n      \"welding\": {\n        \"required\": true,\n        \"welding_type\": \"角焊/点焊（临时固定）\",\n        \"welding_method\": \"CO2气保焊\",\n        \"weld_size\": \"点焊长度10-15mm，焊脚高度4mm\",\n        \"welding_position\": \"立角焊（方形板与侧连接板的连接处）\",\n        \"quality_requirements\": \"点焊牢固，保证方形板与侧板的垂直度（90°±0.5°）。\",\n        \"safety_notes\": \"点焊时注意飞溅，佩戴防护手套和面罩，确保工作区域通风良好。\"\n      },\n      \"safety_warnings\": [\n        \"进行点焊操作时，必须佩戴合格的焊接面罩、手套和防护服，防止弧光灼伤和高温烫伤。\",\n        \"确保焊接区域通风良好，避免吸入有害烟尘。\"\n      ]\n    },\n    {\n      \"step_number\": 3,\n      \"action\": \"安装另一侧板\",\n      \"description\": \"将另一块图纸编号为3的侧连接板（01.01.01.11513）安装在方形板（1）的另一侧，与第一块侧连接板平行。使用量具确保两块侧连接板的间距符合图纸尺寸要求（485mm）。\",\n      \"position_description\": \"第二块侧连接板（3）与第一块侧连接板（3）平行，通过方形板（1）连接。\",\n      \"parts_used\": [\n        {\n          \"bom_code\": \"01.01.01.11513\",\n          \"bom_name\": \"侧连接板 2\",\n          \"quantity\": 1,\n          \"drawing_number\": \"3\",\n          \"mesh_id\": [\n            \"mesh_014\",\n            \"mesh_015\"\n          ]\n        }\n      ],\n      \"tools\": [\n        \"焊接夹具\",\n        \"卷尺/卡尺\"\n      ],\n      \"warnings\": [\n        \"严格控制两块侧板的平行度和间距。\"\n      ],\n      \"welding\": {\n        \"required\": true,\n        \"welding_type\": \"角焊/点焊（临时固定）\",\n        \"welding_method\": \"CO2气保焊\",\n        \"weld_size\": \"点焊长度10-15mm，焊脚高度4mm\",\n        \"welding_position\": \"立角焊（方形板与第二块侧连接板的连接处）\",\n        \"quality_requirements\": \"点焊牢固，保证两块侧板的间距（485mm）和垂直度。\",\n        \"safety_notes\": \"焊接前检查夹具是否牢固，防止零件在焊接过程中移动或倾倒。\"\n      },\n      \"safety_warnings\": [\n        \"点焊前必须确认夹具夹紧到位，防止侧板因自重或焊接应力突然倾倒伤人。\",\n        \"焊接时注意高温飞溅物，避免灼伤皮肤。\"\n      ]\n    },\n    {\n      \"step_number\": 4,\n      \"action\": \"焊接上连接板\",\n      \"description\": \"将两块图纸编号为2的上连接板（01.01.01.11512）分别焊接在两侧连接板（3）的上部边缘，确保其与侧板垂直且位于指定高度。\",\n      \"position_description\": \"上连接板（2）位于两侧连接板（3）的顶部，横向连接。\",\n      \"parts_used\": [\n        {\n          \"bom_code\": \"01.01.01.11512\",\n          \"bom_name\": \"上连接板\",\n          \"quantity\": 2,\n          \"drawing_number\": \"2\",\n          \"mesh_id\": [\n            \"mesh_016\",\n            \"mesh_017\"\n          ]\n        }\n      ],\n      \"tools\": [\n        \"焊机\",\n        \"直角尺\"\n      ],\n      \"warnings\": [\n        \"上连接板的焊接位置必须精确，确保其与侧板的垂直度。\"\n      ],\n      \"welding\": {\n        \"required\": true,\n        \"welding_type\": \"角焊\",\n        \"welding_method\": \"CO2气保焊\",\n        \"weld_size\": \"焊脚高度6mm（根据图纸要求）\",\n        \"welding_position\": \"平角焊或横角焊（上连接板与侧连接板的连接处）\",\n        \"quality_requirements\": \"焊缝连续，无漏焊，保证上连接板与侧板的垂直度。\",\n        \"safety_notes\": \"焊接电流和电压要匹配板厚，避免烧穿或焊瘤。注意高温烫伤。\"\n      },\n      \"safety_warnings\": [\n        \"进行连续焊接时，注意焊枪过热，操作人员应轮换休息，防止疲劳操作。\",\n        \"焊接过程中产生的热量可能导致工件变形，操作时要戴隔热手套，避免直接接触高温金属。\"\n      ]\n    },\n    {\n      \"step_number\": 5,\n      \"action\": \"焊接折弯板\",\n      \"description\": \"将图纸编号为4的折弯板 1（01.01.01.11514）焊接在主体结构内部的指定位置，作为加强支撑。\",\n      \"position_description\": \"折弯板（4）位于主体框架内部，连接两侧板（3）。\",\n      \"parts_used\": [\n        {\n          \"bom_code\": \"01.01.01.11514\",\n          \"bom_name\": \"折弯板 1\",\n          \"quantity\": 1,\n          \"drawing_number\": \"4\",\n          \"mesh_id\": [\n            \"mesh_013\"\n          ]\n        }\n      ],\n      \"tools\": [\n        \"焊机\"\n      ],\n      \"warnings\": [\n        \"确保折弯板与侧板的贴合度，避免虚焊。\"\n      ],\n      \"welding\": {\n        \"required\": true,\n        \"welding_type\": \"角焊\",\n        \"welding_method\": \"CO2气保焊\",\n        \"weld_size\": \"焊脚高度5mm\",\n        \"welding_position\": \"立角焊（折弯板与两侧连接板的连接处）\",\n        \"quality_requirements\": \"焊缝均匀，保证折弯板与侧板紧密贴合，焊透率高。\",\n        \"safety_notes\": \"在结构内部焊接时，注意烟尘聚集，必须使用局部排风设备。\"\n      },\n      \"safety_warnings\": [\n        \"在结构内部进行焊接作业时，必须开启局部排风或通风设备，防止有害气体和烟尘中毒。\",\n        \"内部空间狭窄，操作时注意身体姿势，避免焊枪或身体接触带电部件。\"\n      ]\n    },\n    {\n      \"step_number\": 6,\n      \"action\": \"焊接油缸固定板\",\n      \"description\": \"将四块图纸编号为5的油缸固定板 4（01.01.01.11515）分别焊接在两侧连接板（3）的指定孔位周围。注意油缸固定板的方向和角度，确保孔位对齐。\",\n      \"position_description\": \"油缸固定板（5）对称分布在两侧连接板（3）上，用于连接油缸。\",\n      \"parts_used\": [\n        {\n          \"bom_code\": \"01.01.01.11515\",\n          \"bom_name\": \"油缸固定板 4\",\n          \"quantity\": 4,\n          \"drawing_number\": \"5\",\n          \"mesh_id\": [\n            \"mesh_002\",\n            \"mesh_003\",\n            \"mesh_011\",\n            \"mesh_012\"\n          ]\n        }\n      ],\n      \"tools\": [\n        \"焊机\",\n        \"定位销\"\n      ],\n      \"warnings\": [\n        \"使用定位销确保油缸固定板的安装孔与侧板上的孔同心。\"\n      ],\n      \"welding\": {\n        \"required\": true,\n        \"welding_type\": \"角焊\",\n        \"welding_method\": \"CO2气保焊\",\n        \"weld_size\": \"焊脚高度4mm\",\n        \"welding_position\": \"平焊或横焊（油缸固定板与侧连接板的连接处）\",\n        \"quality_requirements\": \"焊缝连续，无气孔、夹渣。焊接时要避开孔位，防止焊渣溅入孔内。\",\n        \"safety_notes\": \"焊接前必须使用定位销或螺栓固定，防止焊接热应力导致孔位偏差。\"\n      },\n      \"safety_warnings\": [\n        \"焊接定位板时，确保定位销或螺栓固定牢固，防止焊接过程中零件松动或脱落。\",\n        \"焊接时注意控制飞溅，避免焊渣溅入定位孔内，损坏孔位精度。\"\n      ]\n    },\n    {\n      \"step_number\": 7,\n      \"action\": \"焊接加强板\",\n      \"description\": \"将四块图纸编号为6的加强板 4（01.01.01.11516）焊接在两侧连接板（3）的指定加强区域，以提高结构刚性。\",\n      \"position_description\": \"加强板（6）焊接在侧连接板（3）的内侧或外侧，靠近受力区域。\",\n      \"parts_used\": [\n        {\n          \"bom_code\": \"01.01.01.11516\",\n          \"bom_name\": \"加强板 4\",\n          \"quantity\": 4,\n          \"drawing_number\": \"6\",\n          \"mesh_id\": [\n            \"mesh_007\",\n            \"mesh_008\",\n            \"mesh_009\",\n            \"mesh_010\"\n          ]\n        }\n      ],\n      \"tools\": [\n        \"焊机\"\n      ],\n      \"warnings\": [\n        \"加强板的焊缝应饱满，符合图纸技术要求。\"\n      ],\n      \"welding\": {\n        \"required\": true,\n        \"welding_type\": \"角焊\",\n        \"welding_method\": \"CO2气保焊\",\n        \"weld_size\": \"焊脚高度5mm\",\n        \"welding_position\": \"平焊或立焊（加强板与侧连接板的连接处）\",\n        \"quality_requirements\": \"焊缝必须饱满、连续，确保结构强度。焊缝表面平整，过渡圆滑。\",\n        \"safety_notes\": \"加强板通常较厚，需要适当预热（如果材料要求），防止焊接裂纹。\"\n      },\n      \"safety_warnings\": [\n        \"如果需要预热，必须使用专用加热设备，并佩戴隔热手套，防止低温烫伤或烧伤。\",\n        \"焊接较厚板材时，注意控制焊接速度，防止产生应力集中导致结构开裂。\"\n      ]\n    },\n    {\n      \"step_number\": 8,\n      \"action\": \"焊接角钢\",\n      \"description\": \"将图纸编号为7的角钢-机加 1（01.01.04.0592）焊接在主体结构的指定位置，作为额外的支撑或连接点。\",\n      \"position_description\": \"角钢（7）位于主体结构上部或侧面，根据图纸定位。\",\n      \"parts_used\": [\n        {\n          \"bom_code\": \"01.01.04.0592\",\n          \"bom_name\": \"角钢-机加 1\",\n          \"quantity\": 1,\n          \"drawing_number\": \"7\",\n          \"mesh_id\": [\n            \"mesh_006\"\n          ]\n        }\n      ],\n      \"tools\": [\n        \"焊机\",\n        \"直角尺\"\n      ],\n      \"warnings\": [\n        \"确保角钢的机加工面朝向正确，且焊接牢固。\"\n      ],\n      \"welding\": {\n        \"required\": true,\n        \"welding_type\": \"角焊\",\n        \"welding_method\": \"CO2气保焊\",\n        \"weld_size\": \"焊脚高度6mm\",\n        \"welding_position\": \"平焊或横焊（角钢与侧连接板的连接处）\",\n        \"quality_requirements\": \"焊缝连续，保证角钢与侧板的垂直度，焊缝外观要求高。\",\n        \"safety_notes\": \"角钢定位要准确，使用直角尺反复确认，避免因焊接变形导致尺寸超差。\"\n      },\n      \"safety_warnings\": [\n        \"焊接角钢时，注意工件可能因为热应力发生翘曲，必须使用重型夹具固定，防止夹具松动或工件弹起伤人。\"\n      ]\n    },\n    {\n      \"step_number\": 9,\n      \"action\": \"焊接后座轴套（8）\",\n      \"description\": \"将图纸编号为8的后座轴套 1（01.02.02.0490）插入到侧连接板（3）的指定孔位中，并进行焊接固定。注意轴套的伸出长度和同轴度要求。\",\n      \"position_description\": \"轴套（8）穿过侧连接板（3）的孔位，位于组件的后部。\",\n      \"parts_used\": [\n        {\n          \"bom_code\": \"01.02.02.0490\",\n          \"bom_name\": \"后座轴套 1\",\n          \"quantity\": 1,\n          \"drawing_number\": \"8\",\n          \"mesh_id\": [\n            \"mesh_004\"\n          ]\n        }\n      ],\n      \"tools\": [\n        \"焊机\",\n        \"同轴度检测工具\"\n      ],\n      \"warnings\": [\n        \"轴套与侧板的焊接需保证同轴度，避免变形。\"\n      ],\n      \"welding\": {\n        \"required\": true,\n        \"welding_type\": \"围焊（环形焊）\",\n        \"welding_method\": \"CO2气保焊\",\n        \"weld_size\": \"焊脚高度4mm，全周焊\",\n        \"welding_position\": \"平焊或仰焊（轴套与侧连接板的连接处）\",\n        \"quality_requirements\": \"焊缝必须全周连续，焊透，无气孔。焊接时要分段对称焊接，减少热量集中，控制轴套变形。\",\n        \"safety_notes\": \"焊接前在轴套内孔塞入防火材料或使用铜垫保护，防止焊渣溅入内孔，影响后续装配精度。\"\n      },\n      \"safety_warnings\": [\n        \"进行环形焊接时，必须分段、对称、快速焊接，防止轴套因受热不均而严重变形，导致报废。\",\n        \"仰焊操作时，注意熔渣和金属液滴下落，必须穿戴全套防护装备，包括防火帽和高帮鞋。\"\n      ]\n    },\n    {\n      \"step_number\": 10,\n      \"action\": \"焊接轴套（9）\",\n      \"description\": \"将图纸编号为9的轴套 1（01.01.02.1221）插入到侧连接板（3）的指定孔位中，并进行焊接固定。注意轴套的伸出长度和同轴度要求。\",\n      \"position_description\": \"轴套（9）穿过侧连接板（3）的孔位，位于组件的下部。\",\n      \"parts_used\": [\n        {\n          \"bom_code\": \"01.01.02.1221\",\n          \"bom_name\": \"轴套 1\",\n          \"quantity\": 1,\n          \"drawing_number\": \"9\",\n          \"mesh_id\": [\n            \"mesh_005\"\n          ]\n        }\n      ],\n      \"tools\": [\n        \"焊机\",\n        \"同轴度检测工具\"\n      ],\n      \"warnings\": [\n        \"轴套焊接时，应避免焊渣进入轴套内孔。\"\n      ],\n      \"welding\": {\n        \"required\": true,\n        \"welding_type\": \"围焊（环形焊）\",\n        \"welding_method\": \"CO2气保焊\",\n        \"weld_size\": \"焊脚高度4mm，全周焊\",\n        \"welding_position\": \"平焊或仰焊（轴套与侧连接板的连接处）\",\n        \"quality_requirements\": \"焊缝必须全周连续，保证轴套的同轴度。焊接后立即检查内孔，确保无焊渣。\",\n        \"safety_notes\": \"焊接时要控制热输入，避免轴套因受热不均而产生椭圆变形。使用专用夹具辅助散热。\"\n      },\n      \"safety_warnings\": [\n        \"焊接完成后，轴套温度极高，严禁徒手触摸，应使用专用工具或等待自然冷却。\",\n        \"如果使用水冷或风冷辅助散热，必须严格按照工艺要求操作，防止冷却不当导致轴套开裂。\"\n      ]\n    },\n    {\n      \"step_number\": 11,\n      \"action\": \"焊接后座轴套（10）\",\n      \"description\": \"将图纸编号为10的后座轴套 1（01.01.02.0337）插入到侧连接板（3）的指定孔位中，并进行焊接固定。注意轴套的伸出长度和同轴度要求。\",\n      \"position_description\": \"轴套（10）穿过侧连接板（3）的孔位，位于组件的后部上方。\",\n      \"parts_used\": [\n        {\n          \"bom_code\": \"01.01.02.0337\",\n          \"bom_name\": \"后座轴套 1\",\n          \"quantity\": 1,\n          \"drawing_number\": \"10\",\n          \"mesh_id\": [\n            \"mesh_001\"\n          ]\n        }\n      ],\n      \"tools\": [\n        \"焊机\",\n        \"同轴度检测工具\"\n      ],\n      \"warnings\": [\n        \"所有轴套焊接完成后，需进行整体冷却，防止热应力变形。\"\n      ],\n      \"welding\": {\n        \"required\": true,\n        \"welding_type\": \"围焊（环形焊）\",\n        \"welding_method\": \"CO2气保焊\",\n        \"weld_size\": \"焊脚高度4mm，全周焊\",\n        \"welding_position\": \"平焊或仰焊（轴套与侧连接板的连接处）\",\n        \"quality_requirements\": \"焊缝必须全周连续，保证轴套的同轴度。焊接完成后，需自然冷却，不可强制水冷。\",\n        \"safety_notes\": \"轴套焊接是关键步骤，必须由熟练焊工操作。焊接完成后，用同轴度检测工具进行复检。\"\n      },\n      \"safety_warnings\": [\n        \"焊接作业时，确保焊机接地良好，电缆无破损，防止触电事故。\",\n        \"焊接完成后，工件整体温度较高，应设置警示标志，提醒其他人员注意高温，避免烫伤。\"\n      ]\n    },\n    {\n      \"step_number\": 12,\n      \"action\": \"最终焊接与清理\",\n      \"description\": \"对所有点焊部位进行最终满焊，焊缝要求符合图纸技术要求。焊接完成后，使用角磨机清理所有焊渣和飞溅物，并对尖锐边缘进行倒角处理。\",\n      \"position_description\": \"所有连接部位。\",\n      \"parts_used\": [],\n      \"tools\": [\n        \"焊机\",\n        \"角磨机\",\n        \"钢丝刷\"\n      ],\n      \"warnings\": [\n        \"焊缝应平整、均匀，无气孔、夹渣、裂纹等缺陷。\"\n      ],\n      \"welding\": {\n        \"required\": true,\n        \"welding_type\": \"满焊（所有连接处）\",\n        \"welding_method\": \"CO2气保焊\",\n        \"weld_size\": \"按图纸要求，通常为5-6mm焊脚高度\",\n        \"welding_position\": \"所有位置（平、横、立、仰）\",\n        \"quality_requirements\": \"焊缝外观等级达到二级标准，无裂纹、未焊透、咬边深度小于0.5mm。焊缝高度和宽度均匀。\",\n        \"safety_notes\": \"满焊工作量大，注意焊枪和电缆的绝缘保护。清理焊渣时，佩戴防护眼镜，防止飞溅物伤眼。\"\n      },\n      \"safety_warnings\": [\n        \"使用角磨机清理焊渣和倒角时，必须佩戴全面罩、防护眼镜和防尘口罩，防止金属粉尘和飞溅物伤害。\",\n        \"清理工作完成后，应立即清理工作区域的焊渣和金属碎屑，防止滑倒或割伤。\",\n        \"检查所有尖锐边缘是否已倒钝，避免后续搬运和装配时割伤工人。\"\n      ]\n    }\n  ]\n}\n```",
  "parsed_result": {
    "enhanced_steps": [
      {
        "step_number": 1,
        "action": "定位基准侧板",
        "description": "将一块图纸编号为3的侧连接板（01.01.01.11513）平稳放置在焊接平台上作为基准件。确保板面水平，并清理所有待焊接区域。",
        "position_description": "基准件平放于焊接平台。",
        "parts_used": [
          {
            "bom_code": "01.01.01.11513",
            "bom_name": "侧连接板 2",
            "quantity": 1,
            "drawing_number": "3",
            "mesh_id": [
              "mesh_014",
              "mesh_015"
            ]
          }
        ],
        "tools": [
          "焊接平台",
          "角磨机（清理）"
        ],
        "warnings": [
          "清理焊缝区域，确保无油污、锈迹。"
        ],
        "safety_warnings": [
          "搬运侧连接板时，注意板材边缘锋利，必须佩戴防割手套。",
          "使用角磨机清理时，必须佩戴防护眼镜和耳塞，防止火花飞溅和噪音伤害。"
        ]
      },
      {
        "step_number": 2,
        "action": "焊接方形板",
        "description": "将图纸编号为1的方形板-机加（01.01.01.11511）放置在基准侧连接板（3）的指定位置，使用夹具临时固定。方形板的机加工面朝外。",
        "position_description": "方形板（1）垂直焊接在侧连接板（3）的底部边缘。",
        "parts_used": [
          {
            "bom_code": "01.01.01.11511",
            "bom_name": "方形板-机加",
            "quantity": 1,
            "drawing_number": "1",
            "mesh_id": [
              "mesh_018"
            ]
          }
        ],
        "tools": [
          "焊接夹具",
          "焊机"
        ],
        "warnings": [
          "点焊固定时，确保方形板与侧连接板的垂直度。"
        ],
        "welding": {
          "required": true,
          "welding_type": "角焊/点焊（临时固定）",
          "welding_method": "CO2气保焊",
          "weld_size": "点焊长度10-15mm，焊脚高度4mm",
          "welding_position": "立角焊（方形板与侧连接板的连接处）",
          "quality_requirements": "点焊牢固，保证方形板与侧板的垂直度（90°±0.5°）。",
          "safety_notes": "点焊时注意飞溅，佩戴防护手套和面罩，确保工作区域通风良好。"
        },
        "safety_warnings": [
          "进行点焊操作时，必须佩戴合格的焊接面罩、手套和防护服，防止弧光灼伤和高温烫伤。",
          "确保焊接区域通风良好，避免吸入有害烟尘。"
        ]
      },
      {
        "step_number": 3,
        "action": "安装另一侧板",
        "description": "将另一块图纸编号为3的侧连接板（01.01.01.11513）安装在方形板（1）的另一侧，与第一块侧连接板平行。使用量具确保两块侧连接板的间距符合图纸尺寸要求（485mm）。",
        "position_description": "第二块侧连接板（3）与第一块侧连接板（3）平行，通过方形板（1）连接。",
        "parts_used": [
          {
            "bom_code": "01.01.01.11513",
            "bom_name": "侧连接板 2",
            "quantity": 1,
            "drawing_number": "3",
            "mesh_id": [
              "mesh_014",
              "mesh_015"
            ]
          }
        ],
        "tools": [
          "焊接夹具",
          "卷尺/卡尺"
        ],
        "warnings": [
          "严格控制两块侧板的平行度和间距。"
        ],
        "welding": {
          "required": true,
          "welding_type": "角焊/点焊（临时固定）",
          "welding_method": "CO2气保焊",
          "weld_size": "点焊长度10-15mm，焊脚高度4mm",
          "welding_position": "立角焊（方形板与第二块侧连接板的连接处）",
          "quality_requirements": "点焊牢固，保证两块侧板的间距（485mm）和垂直度。",
          "safety_notes": "焊接前检查夹具是否牢固，防止零件在焊接过程中移动或倾倒。"
        },
        "safety_warnings": [
          "点焊前必须确认夹具夹紧到位，防止侧板因自重或焊接应力突然倾倒伤人。",
          "焊接时注意高温飞溅物，避免灼伤皮肤。"
        ]
      },
      {
        "step_number": 4,
        "action": "焊接上连接板",
        "description": "将两块图纸编号为2的上连接板（01.01.01.11512）分别焊接在两侧连接板（3）的上部边缘，确保其与侧板垂直且位于指定高度。",
        "position_description": "上连接板（2）位于两侧连接板（3）的顶部，横向连接。",
        "parts_used": [
          {
            "bom_code": "01.01.01.11512",
            "bom_name": "上连接板",
            "quantity": 2,
            "drawing_number": "2",
            "mesh_id": [
              "mesh_016",
              "mesh_017"
            ]
          }
        ],
        "tools": [
          "焊机",
          "直角尺"
        ],
        "warnings": [
          "上连接板的焊接位置必须精确，确保其与侧板的垂直度。"
        ],
        "welding": {
          "required": true,
          "welding_type": "角焊",
          "welding_method": "CO2气保焊",
          "weld_size": "焊脚高度6mm（根据图纸要求）",
          "welding_position": "平角焊或横角焊（上连接板与侧连接板的连接处）",
          "quality_requirements": "焊缝连续，无漏焊，保证上连接板与侧板的垂直度。",
          "safety_notes": "焊接电流和电压要匹配板厚，避免烧穿或焊瘤。注意高温烫伤。"
        },
        "safety_warnings": [
          "进行连续焊接时，注意焊枪过热，操作人员应轮换休息，防止疲劳操作。",
          "焊接过程中产生的热量可能导致工件变形，操作时要戴隔热手套，避免直接接触高温金属。"
        ]
      },
      {
        "step_number": 5,
        "action": "焊接折弯板",
        "description": "将图纸编号为4的折弯板 1（01.01.01.11514）焊接在主体结构内部的指定位置，作为加强支撑。",
        "position_description": "折弯板（4）位于主体框架内部，连接两侧板（3）。",
        "parts_used": [
          {
            "bom_code": "01.01.01.11514",
            "bom_name": "折弯板 1",
            "quantity": 1,
            "drawing_number": "4",
            "mesh_id": [
              "mesh_013"
            ]
          }
        ],
        "tools": [
          "焊机"
        ],
        "warnings": [
          "确保折弯板与侧板的贴合度，避免虚焊。"
        ],
        "welding": {
          "required": true,
          "welding_type": "角焊",
          "welding_method": "CO2气保焊",
          "weld_size": "焊脚高度5mm",
          "welding_position": "立角焊（折弯板与两侧连接板的连接处）",
          "quality_requirements": "焊缝均匀，保证折弯板与侧板紧密贴合，焊透率高。",
          "safety_notes": "在结构内部焊接时，注意烟尘聚集，必须使用局部排风设备。"
        },
        "safety_warnings": [
          "在结构内部进行焊接作业时，必须开启局部排风或通风设备，防止有害气体和烟尘中毒。",
          "内部空间狭窄，操作时注意身体姿势，避免焊枪或身体接触带电部件。"
        ]
      },
      {
        "step_number": 6,
        "action": "焊接油缸固定板",
        "description": "将四块图纸编号为5的油缸固定板 4（01.01.01.11515）分别焊接在两侧连接板（3）的指定孔位周围。注意油缸固定板的方向和角度，确保孔位对齐。",
        "position_description": "油缸固定板（5）对称分布在两侧连接板（3）上，用于连接油缸。",
        "parts_used": [
          {
            "bom_code": "01.01.01.11515",
            "bom_name": "油缸固定板 4",
            "quantity": 4,
            "drawing_number": "5",
            "mesh_id": [
              "mesh_002",
              "mesh_003",
              "mesh_011",
              "mesh_012"
            ]
          }
        ],
        "tools": [
          "焊机",
          "定位销"
        ],
        "warnings": [
          "使用定位销确保油缸固定板的安装孔与侧板上的孔同心。"
        ],
        "welding": {
          "required": true,
          "welding_type": "角焊",
          "welding_method": "CO2气保焊",
          "weld_size": "焊脚高度4mm",
          "welding_position": "平焊或横焊（油缸固定板与侧连接板的连接处）",
          "quality_requirements": "焊缝连续，无气孔、夹渣。焊接时要避开孔位，防止焊渣溅入孔内。",
          "safety_notes": "焊接前必须使用定位销或螺栓固定，防止焊接热应力导致孔位偏差。"
        },
        "safety_warnings": [
          "焊接定位板时，确保定位销或螺栓固定牢固，防止焊接过程中零件松动或脱落。",
          "焊接时注意控制飞溅，避免焊渣溅入定位孔内，损坏孔位精度。"
        ]
      },
      {
        "step_number": 7,
        "action": "焊接加强板",
        "description": "将四块图纸编号为6的加强板 4（01.01.01.11516）焊接在两侧连接板（3）的指定加强区域，以提高结构刚性。",
        "position_description": "加强板（6）焊接在侧连接板（3）的内侧或外侧，靠近受力区域。",
        "parts_used": [
          {
            "bom_code": "01.01.01.11516",
            "bom_name": "加强板 4",
            "quantity": 4,
            "drawing_number": "6",
            "mesh_id": [
              "mesh_007",
              "mesh_008",
              "mesh_009",
              "mesh_010"
            ]
          }
        ],
        "tools": [
          "焊机"
        ],
        "warnings": [
          "加强板的焊缝应饱满，符合图纸技术要求。"
        ],
        "welding": {
          "required": true,
          "welding_type": "角焊",
          "welding_method": "CO2气保焊",
          "weld_size": "焊脚高度5mm",
          "welding_position": "平焊或立焊（加强板与侧连接板的连接处）",
          "quality_requirements": "焊缝必须饱满、连续，确保结构强度。焊缝表面平整，过渡圆滑。",
          "safety_notes": "加强板通常较厚，需要适当预热（如果材料要求），防止焊接裂纹。"
        },
        "safety_warnings": [
          "如果需要预热，必须使用专用加热设备，并佩戴隔热手套，防止低温烫伤或烧伤。",
          "焊接较厚板材时，注意控制焊接速度，防止产生应力集中导致结构开裂。"
        ]
      },
      {
        "step_number": 8,
        "action": "焊接角钢",
        "description": "将图纸编号为7的角钢-机加 1（01.01.04.0592）焊接在主体结构的指定位置，作为额外的支撑或连接点。",
        "position_description": "角钢（7）位于主体结构上部或侧面，根据图纸定位。",
        "parts_used": [
          {
            "bom_code": "01.01.04.0592",
            "bom_name": "角钢-机加 1",
            "quantity": 1,
            "drawing_number": "7",
            "mesh_id": [
              "mesh_006"
            ]
          }
        ],
        "tools": [
          "焊机",
          "直角尺"
        ],
        "warnings": [
          "确保角钢的机加工面朝向正确，且焊接牢固。"
        ],
        "welding": {
          "required": true,
          "welding_type": "角焊",
          "welding_method": "CO2气保焊",
          "weld_size": "焊脚高度6mm",
          "welding_position": "平焊或横焊（角钢与侧连接板的连接处）",
          "quality_requirements": "焊缝连续，保证角钢与侧板的垂直度，焊缝外观要求高。",
          "safety_notes": "角钢定位要准确，使用直角尺反复确认，避免因焊接变形导致尺寸超差。"
        },
        "safety_warnings": [
          "焊接角钢时，注意工件可能因为热应力发生翘曲，必须使用重型夹具固定，防止夹具松动或工件弹起伤人。"
        ]
      },
      {
        "step_number": 9,
        "action": "焊接后座轴套（8）",
        "description": "将图纸编号为8的后座轴套 1（01.02.02.0490）插入到侧连接板（3）的指定孔位中，并进行焊接固定。注意轴套的伸出长度和同轴度要求。",
        "position_description": "轴套（8）穿过侧连接板（3）的孔位，位于组件的后部。",
        "parts_used": [
          {
            "bom_code": "01.02.02.0490",
            "bom_name": "后座轴套 1",
            "quantity": 1,
            "drawing_number": "8",
            "mesh_id": [
              "mesh_004"
            ]
          }
        ],
        "tools": [
          "焊机",
          "同轴度检测工具"
        ],
        "warnings": [
          "轴套与侧板的焊接需保证同轴度，避免变形。"
        ],
        "welding": {
          "required": true,
          "welding_type": "围焊（环形焊）",
          "welding_method": "CO2气保焊",
          "weld_size": "焊脚高度4mm，全周焊",
          "welding_position": "平焊或仰焊（轴套与侧连接板的连接处）",
          "quality_requirements": "焊缝必须全周连续，焊透，无气孔。焊接时要分段对称焊接，减少热量集中，控制轴套变形。",
          "safety_notes": "焊接前在轴套内孔塞入防火材料或使用铜垫保护，防止焊渣溅入内孔，影响后续装配精度。"
        },
        "safety_warnings": [
          "进行环形焊接时，必须分段、对称、快速焊接，防止轴套因受热不均而严重变形，导致报废。",
          "仰焊操作时，注意熔渣和金属液滴下落，必须穿戴全套防护装备，包括防火帽和高帮鞋。"
        ]
      },
      {
        "step_number": 10,
        "action": "焊接轴套（9）",
        "description": "将图纸编号为9的轴套 1（01.01.02.1221）插入到侧连接板（3）的指定孔位中，并进行焊接固定。注意轴套的伸出长度和同轴度要求。",
        "position_description": "轴套（9）穿过侧连接板（3）的孔位，位于组件的下部。",
        "parts_used": [
          {
            "bom_code": "01.01.02.1221",
            "bom_name": "轴套 1",
            "quantity": 1,
            "drawing_number": "9",
            "mesh_id": [
              "mesh_005"
            ]
          }
        ],
        "tools": [
          "焊机",
          "同轴度检测工具"
        ],
        "warnings": [
          "轴套焊接时，应避免焊渣进入轴套内孔。"
        ],
        "welding": {
          "required": true,
          "welding_type": "围焊（环形焊）",
          "welding_method": "CO2气保焊",
          "weld_size": "焊脚高度4mm，全周焊",
          "welding_position": "平焊或仰焊（轴套与侧连接板的连接处）",
          "quality_requirements": "焊缝必须全周连续，保证轴套的同轴度。焊接后立即检查内孔，确保无焊渣。",
          "safety_notes": "焊接时要控制热输入，避免轴套因受热不均而产生椭圆变形。使用专用夹具辅助散热。"
        },
        "safety_warnings": [
          "焊接完成后，轴套温度极高，严禁徒手触摸，应使用专用工具或等待自然冷却。",
          "如果使用水冷或风冷辅助散热，必须严格按照工艺要求操作，防止冷却不当导致轴套开裂。"
        ]
      },
      {
        "step_number": 11,
        "action": "焊接后座轴套（10）",
        "description": "将图纸编号为10的后座轴套 1（01.01.02.0337）插入到侧连接板（3）的指定孔位中，并进行焊接固定。注意轴套的伸出长度和同轴度要求。",
        "position_description": "轴套（10）穿过侧连接板（3）的孔位，位于组件的后部上方。",
        "parts_used": [
          {
            "bom_code": "01.01.02.0337",
            "bom_name": "后座轴套 1",
            "quantity": 1,
            "drawing_number": "10",
            "mesh_id": [
              "mesh_001"
            ]
          }
        ],
        "tools": [
          "焊机",
          "同轴度检测工具"
        ],
        "warnings": [
          "所有轴套焊接完成后，需进行整体冷却，防止热应力变形。"
        ],
        "welding": {
          "required": true,
          "welding_type": "围焊（环形焊）",
          "welding_method": "CO2气保焊",
          "weld_size": "焊脚高度4mm，全周焊",
          "welding_position": "平焊或仰焊（轴套与侧连接板的连接处）",
          "quality_requirements": "焊缝必须全周连续，保证轴套的同轴度。焊接完成后，需自然冷却，不可强制水冷。",
          "safety_notes": "轴套焊接是关键步骤，必须由熟练焊工操作。焊接完成后，用同轴度检测工具进行复检。"
        },
        "safety_warnings": [
          "焊接作业时，确保焊机接地良好，电缆无破损，防止触电事故。",
          "焊接完成后，工件整体温度较高，应设置警示标志，提醒其他人员注意高温，避免烫伤。"
        ]
      },
      {
        "step_number": 12,
        "action": "最终焊接与清理",
        "description": "对所有点焊部位进行最终满焊，焊缝要求符合图纸技术要求。焊接完成后，使用角磨机清理所有焊渣和飞溅物，并对尖锐边缘进行倒角处理。",
        "position_description": "所有连接部位。",
        "parts_used": [],
        "tools": [
          "焊机",
          "角磨机",
          "钢丝刷"
        ],
        "warnings": [
          "焊缝应平整、均匀，无气孔、夹渣、裂纹等缺陷。"
        ],
        "welding": {
          "required": true,
          "welding_type": "满焊（所有连接处）",
          "welding_method": "CO2气保焊",
          "weld_size": "按图纸要求，通常为5-6mm焊脚高度",
          "welding_position": "所有位置（平、横、立、仰）",
          "quality_requirements": "焊缝外观等级达到二级标准，无裂纹、未焊透、咬边深度小于0.5mm。焊缝高度和宽度均匀。",
          "safety_notes": "满焊工作量大，注意焊枪和电缆的绝缘保护。清理焊渣时，佩戴防护眼镜，防止飞溅物伤眼。"
        },
        "safety_warnings": [
          "使用角磨机清理焊渣和倒角时，必须佩戴全面罩、防护眼镜和防尘口罩，防止金属粉尘和飞溅物伤害。",
          "清理工作完成后，应立即清理工作区域的焊渣和金属碎屑，防止滑倒或割伤。",
          "检查所有尖锐边缘是否已倒钝，避免后续搬运和装配时割伤工人。"
        ]
      }
    ]
  }
}