{
  "agent_name": "Agent6_FAQ",
  "model": "google/gemini-2.5-flash-preview-09-2025",
  "timestamp": "20251003_212238",
  "image_count": 0,
  "temperature": 0.2,
  "system_prompt": "你是安全工程师李师傅，拥有20年安全管理经验。\n\n你的任务：为每个装配步骤添加安全警告（如果该步骤有安全风险）。\n\n## 核心原则\n\n1. **安全第一**：识别所有潜在的安全风险\n2. **嵌入警告**：为有风险的步骤添加safety_warnings字段\n3. **工人友好**：使用通俗语言，避免专业术语\n\n## 输出格式\n\n严格按照以下JSON格式输出（返回增强后的装配步骤）：\n\n```json\n{\n  \"enhanced_steps\": [\n    {\n      \"step_number\": 1,\n      \"title\": \"步骤标题\",\n      \"parts_used\": [...],\n      \"tools_required\": [...],\n      \"operation\": \"操作说明\",\n      \"quality_check\": \"质量检查\",\n      \"estimated_time_minutes\": 10,\n      \"welding\": {...},\n      \"safety_warnings\": [\n        \"佩戴安全帽和防护眼镜\",\n        \"确保工件固定牢固\",\n        \"注意防止烫伤\"\n      ]\n    }\n  ]\n}\n```\n\n**⚠️ 重要**：\n- 如果步骤没有安全风险，不要添加safety_warnings字段\n- 如果步骤有安全风险，safety_warnings必须是字符串数组\n- 保持原有步骤的所有字段不变，只添加safety_warnings字段\n\n## 重要提醒\n\n- **只输出JSON，不要输出其他内容**\n- **安全警告要具体**：说明具体的风险和预防措施\n- **使用通俗语言**：工人能看懂的语言\n",
  "user_query": "请为以下装配步骤添加安全警告（如果有安全风险）。\n\n## 装配步骤\n\n[\n  {\n    \"step_number\": 1,\n    \"title\": \"焊接左/右铲板与连接板\",\n    \"parts_used\": [\n      {\n        \"part_number\": \"1\",\n        \"description\": \"左铲板组件\",\n        \"quantity\": 1\n      },\n      {\n        \"part_number\": \"2\",\n        \"description\": \"右铲板组件\",\n        \"quantity\": 1\n      },\n      {\n        \"part_number\": \"3\",\n        \"description\": \"连接板\",\n        \"quantity\": 1\n      }\n    ],\n    \"tools_required\": [\n      \"焊接工装夹具\",\n      \"CO2焊机\",\n      \"角磨机\"\n    ],\n    \"operation\": \"将左铲板组件(1)和右铲板组件(2)放置在工装夹具上，确保角度和间隙符合图纸要求。将连接板(3)放置在两铲板的连接处，进行点焊定位，然后进行全焊。\",\n    \"quality_check\": \"检查连接板与铲板的连接是否牢固，焊缝外观是否平整，无明显缺陷。测量总宽度是否符合1900mm的要求。\",\n    \"estimated_time_minutes\": 45,\n    \"welding\": {\n      \"required\": true,\n      \"welding_type\": \"角焊/对接焊\",\n      \"welding_method\": \"CO2气保焊\",\n      \"weld_size\": \"焊脚高度6mm，连接板与铲板接触面全焊\",\n      \"welding_position\": \"平焊/横焊\",\n      \"quality_requirements\": \"焊缝必须连续、饱满，不允许有气孔、夹渣、裂纹等缺陷。焊后清理焊渣。\",\n      \"safety_notes\": \"佩戴自动变光焊接面罩和防护手套。确保工作区域通风良好，远离易燃物。\"\n    }\n  },\n  {\n    \"step_number\": 2,\n    \"title\": \"安装并焊接主支撑框架\",\n    \"parts_used\": [\n      {\n        \"part_number\": \"4\",\n        \"description\": \"主支撑框架\",\n        \"quantity\": 1\n      },\n      {\n        \"part_number\": \"5\",\n        \"description\": \"加强筋板\",\n        \"quantity\": 2\n      }\n    ],\n    \"tools_required\": [\n      \"吊装设备\",\n      \"CO2焊机\",\n      \"水平仪\"\n    ],\n    \"operation\": \"使用吊装设备将主支撑框架(4)吊装到已焊接好的铲板组件上，对准定位孔。先点焊固定，确保框架垂直度和平整度。然后将加强筋板(5)安装在指定位置，并进行全焊。\",\n    \"quality_check\": \"检查主支撑框架的垂直度，确保其与铲板平面垂直。检查加强筋板的焊缝是否牢固，焊缝高度是否达到要求。\",\n    \"estimated_time_minutes\": 60,\n    \"welding\": {\n      \"required\": true,\n      \"welding_type\": \"角焊\",\n      \"welding_method\": \"CO2气保焊\",\n      \"weld_size\": \"主框架与铲板连接处焊脚高度8mm；加强筋板焊脚高度6mm\",\n      \"welding_position\": \"平焊/立焊\",\n      \"quality_requirements\": \"主受力部位必须全焊透，焊缝过渡平滑，不允许有未焊透现象。焊后用角磨机修整飞溅。\",\n      \"safety_notes\": \"高空作业时，必须系好安全带。焊接前检查吊装索具是否安全可靠。注意防止火花飞溅到周围设备。\"\n    }\n  },\n  {\n    \"step_number\": 3,\n    \"title\": \"安装并焊接液压缸支座\",\n    \"parts_used\": [\n      {\n        \"part_number\": \"6\",\n        \"description\": \"左液压缸支座\",\n        \"quantity\": 1\n      },\n      {\n        \"part_number\": \"7\",\n        \"description\": \"右液压缸支座\",\n        \"quantity\": 1\n      }\n    ],\n    \"tools_required\": [\n      \"CO2焊机\",\n      \"卡尺\",\n      \"定位块\"\n    ],\n    \"operation\": \"根据图纸尺寸，将左液压缸支座(6)和右液压缸支座(7)分别定位在主支撑框架(4)的指定位置。使用定位块确保支座的中心距和角度准确无误。点焊定位后，进行环绕全焊。\",\n    \"quality_check\": \"检查两个支座的中心距是否准确（公差±1mm）。检查焊缝是否连续，无漏焊。\",\n    \"estimated_time_minutes\": 30,\n    \"welding\": {\n      \"required\": true,\n      \"welding_type\": \"角焊\",\n      \"welding_method\": \"CO2气保焊\",\n      \"weld_size\": \"焊脚高度5mm，支座底部和侧面环绕全焊\",\n      \"welding_position\": \"平焊/横焊\",\n      \"quality_requirements\": \"焊缝必须均匀，受力部位焊透率100%。焊缝表面不允许有咬边。\",\n      \"safety_notes\": \"焊接支座时，注意保持姿势稳定。焊接完成后，等待零件冷却后再进行下一步操作，防止烫伤。\"\n    }\n  },\n  {\n    \"step_number\": 4,\n    \"title\": \"安装铰接轴和轴套\",\n    \"parts_used\": [\n      {\n        \"part_number\": \"8\",\n        \"description\": \"铰接轴\",\n        \"quantity\": 1\n      },\n      {\n        \"part_number\": \"9\",\n        \"description\": \"轴套\",\n        \"quantity\": 2\n      },\n      {\n        \"part_number\": \"10\",\n        \"description\": \"轴承座\",\n        \"quantity\": 2\n      }\n    ],\n    \"tools_required\": [\n      \"润滑脂\",\n      \"锤子\",\n      \"螺栓扳手\"\n    ],\n    \"operation\": \"将轴套(9)压入轴承座(10)中。在铰接轴(8)上涂抹润滑脂，然后将铰接轴穿过主支撑框架和轴承座。使用螺栓和螺母（未列出）临时固定。\",\n    \"quality_check\": \"检查铰接轴转动是否灵活，无卡滞现象。\",\n    \"estimated_time_minutes\": 20\n  },\n  {\n    \"step_number\": 5,\n    \"title\": \"安装并固定液压缸\",\n    \"parts_used\": [\n      {\n        \"part_number\": \"11\",\n        \"description\": \"液压缸\",\n        \"quantity\": 2\n      },\n      {\n        \"part_number\": \"12\",\n        \"description\": \"销轴\",\n        \"quantity\": 4\n      },\n      {\n        \"part_number\": \"13\",\n        \"description\": \"开口销\",\n        \"quantity\": 4\n      }\n    ],\n    \"tools_required\": [\n      \"锤子\",\n      \"钳子\"\n    ],\n    \"operation\": \"将两个液压缸(11)分别安装在步骤3焊接的支座上，使用销轴(12)连接。在销轴的另一端插入开口销(13)并掰开，确保销轴不会脱落。\",\n    \"quality_check\": \"检查液压缸安装方向是否正确，销轴是否完全固定。\",\n    \"estimated_time_minutes\": 15\n  }\n]\n\n## 要求\n\n1. **识别风险步骤**：判断哪些步骤有安全风险（吊装、焊接、高空作业、重物搬运等）\n2. **添加安全警告**：为有风险的步骤添加safety_warnings字段\n3. **保持原有字段**：不要修改或删除原有的字段（step_number、title、welding等）\n4. **使用通俗语言**：工人能看懂的语言\n5. **警告要具体**：说明具体的风险和预防措施\n\n## 自检清单\n\n- [ ] 所有有风险的步骤都添加了safety_warnings字段\n- [ ] safety_warnings是字符串数组，每条警告简洁明了\n- [ ] 原有步骤的所有字段都保持不变\n- [ ] 没有风险的步骤没有添加safety_warnings字段\n\n现在开始为装配步骤添加安全警告！\n",
  "raw_response": "```json\n{\n  \"enhanced_steps\": [\n    {\n      \"step_number\": 1,\n      \"title\": \"焊接左/右铲板与连接板\",\n      \"parts_used\": [\n        {\n          \"part_number\": \"1\",\n          \"description\": \"左铲板组件\",\n          \"quantity\": 1\n        },\n        {\n          \"part_number\": \"2\",\n          \"description\": \"右铲板组件\",\n          \"quantity\": 1\n        },\n        {\n          \"part_number\": \"3\",\n          \"description\": \"连接板\",\n          \"quantity\": 1\n        }\n      ],\n      \"tools_required\": [\n        \"焊接工装夹具\",\n        \"CO2焊机\",\n        \"角磨机\"\n      ],\n      \"operation\": \"将左铲板组件(1)和右铲板组件(2)放置在工装夹具上，确保角度和间隙符合图纸要求。将连接板(3)放置在两铲板的连接处，进行点焊定位，然后进行全焊。\",\n      \"quality_check\": \"检查连接板与铲板的连接是否牢固，焊缝外观是否平整，无明显缺陷。测量总宽度是否符合1900mm的要求。\",\n      \"estimated_time_minutes\": 45,\n      \"welding\": {\n        \"required\": true,\n        \"welding_type\": \"角焊/对接焊\",\n        \"welding_method\": \"CO2气保焊\",\n        \"weld_size\": \"焊脚高度6mm，连接板与铲板接触面全焊\",\n        \"welding_position\": \"平焊/横焊\",\n        \"quality_requirements\": \"焊缝必须连续、饱满，不允许有气孔、夹渣、裂纹等缺陷。焊后清理焊渣。\",\n        \"safety_notes\": \"佩戴自动变光焊接面罩和防护手套。确保工作区域通风良好，远离易燃物。\"\n      },\n      \"safety_warnings\": [\n        \"进行焊接作业时，必须穿戴好全套防护用品（焊接面罩、手套、防火服）。\",\n        \"确保工作区域通风良好，防止吸入有害烟尘。\",\n        \"使用角磨机清理焊渣时，必须佩戴防护眼镜，防止飞溅物伤眼。\"\n      ]\n    },\n    {\n      \"step_number\": 2,\n      \"title\": \"安装并焊接主支撑框架\",\n      \"parts_used\": [\n        {\n          \"part_number\": \"4\",\n          \"description\": \"主支撑框架\",\n          \"quantity\": 1\n        },\n        {\n          \"part_number\": \"5\",\n          \"description\": \"加强筋板\",\n          \"quantity\": 2\n        }\n      ],\n      \"tools_required\": [\n        \"吊装设备\",\n        \"CO2焊机\",\n        \"水平仪\"\n      ],\n      \"operation\": \"使用吊装设备将主支撑框架(4)吊装到已焊接好的铲板组件上，对准定位孔。先点焊固定，确保框架垂直度和平整度。然后将加强筋板(5)安装在指定位置，并进行全焊。\",\n      \"quality_check\": \"检查主支撑框架的垂直度，确保其与铲板平面垂直。检查加强筋板的焊缝是否牢固，焊缝高度是否达到要求。\",\n      \"estimated_time_minutes\": 60,\n      \"welding\": {\n        \"required\": true,\n        \"welding_type\": \"角焊\",\n        \"welding_method\": \"CO2气保焊\",\n        \"weld_size\": \"主框架与铲板连接处焊脚高度8mm；加强筋板焊脚高度6mm\",\n        \"welding_position\": \"平焊/立焊\",\n        \"quality_requirements\": \"主受力部位必须全焊透，焊缝过渡平滑，不允许有未焊透现象。焊后用角磨机修整飞溅。\",\n        \"safety_notes\": \"高空作业时，必须系好安全带。焊接前检查吊装索具是否安全可靠。注意防止火花飞溅到周围设备。\"\n      },\n      \"safety_warnings\": [\n        \"吊装重物（主支撑框架）前，必须检查吊装设备和索具是否完好，严禁超载。\",\n        \"吊装过程中，人员必须远离重物下方，防止坠落伤人。\",\n        \"焊接作业时，注意防止火花飞溅，工作区域必须配备灭火器。\"\n      ]\n    },\n    {\n      \"step_number\": 3,\n      \"title\": \"安装并焊接液压缸支座\",\n      \"parts_used\": [\n        {\n          \"part_number\": \"6\",\n          \"description\": \"左液压缸支座\",\n          \"quantity\": 1\n        },\n        {\n          \"part_number\": \"7\",\n          \"description\": \"右液压缸支座\",\n          \"quantity\": 1\n        }\n      ],\n      \"tools_required\": [\n        \"CO2焊机\",\n        \"卡尺\",\n        \"定位块\"\n      ],\n      \"operation\": \"根据图纸尺寸，将左液压缸支座(6)和右液压缸支座(7)分别定位在主支撑框架(4)的指定位置。使用定位块确保支座的中心距和角度准确无误。点焊定位后，进行环绕全焊。\",\n      \"quality_check\": \"检查两个支座的中心距是否准确（公差±1mm）。检查焊缝是否连续，无漏焊。\",\n      \"estimated_time_minutes\": 30,\n      \"welding\": {\n        \"required\": true,\n        \"welding_type\": \"角焊\",\n        \"welding_method\": \"CO2气保焊\",\n        \"weld_size\": \"焊脚高度5mm，支座底部和侧面环绕全焊\",\n        \"welding_position\": \"平焊/横焊\",\n        \"quality_requirements\": \"焊缝必须均匀，受力部位焊透率100%。焊缝表面不允许有咬边。\",\n        \"safety_notes\": \"焊接支座时，注意保持姿势稳定。焊接完成后，等待零件冷却后再进行下一步操作，防止烫伤。\"\n      },\n      \"safety_warnings\": [\n        \"焊接时必须佩戴防护面罩和手套。\",\n        \"焊接完成后，零件温度很高，严禁用手直接触摸，防止烫伤。\",\n        \"清理焊渣时，注意保护眼睛和皮肤。\"\n      ]\n    },\n    {\n      \"step_number\": 4,\n      \"title\": \"安装铰接轴和轴套\",\n      \"parts_used\": [\n        {\n          \"part_number\": \"8\",\n          \"description\": \"铰接轴\",\n          \"quantity\": 1\n        },\n        {\n          \"part_number\": \"9\",\n          \"description\": \"轴套\",\n          \"quantity\": 2\n        },\n        {\n          \"part_number\": \"10\",\n          \"description\": \"轴承座\",\n          \"quantity\": 2\n        }\n      ],\n      \"tools_required\": [\n        \"润滑脂\",\n        \"锤子\",\n        \"螺栓扳手\"\n      ],\n      \"operation\": \"将轴套(9)压入轴承座(10)中。在铰接轴(8)上涂抹润滑脂，然后将铰接轴穿过主支撑框架和轴承座。使用螺栓和螺母（未列出）临时固定。\",\n      \"quality_check\": \"检查铰接轴转动是否灵活，无卡滞现象。\",\n      \"estimated_time_minutes\": 20,\n      \"safety_warnings\": [\n        \"使用锤子敲击时，必须戴好防护眼镜，防止金属碎屑飞溅。\",\n        \"使用扳手时，确保扳手尺寸匹配，防止滑脱伤手。\"\n      ]\n    },\n    {\n      \"step_number\": 5,\n      \"title\": \"安装并固定液压缸\",\n      \"parts_used\": [\n        {\n          \"part_number\": \"11\",\n          \"description\": \"液压缸\",\n          \"quantity\": 2\n        },\n        {\n          \"part_number\": \"12\",\n          \"description\": \"销轴\",\n          \"quantity\": 4\n        },\n        {\n          \"part_number\": \"13\",\n          \"description\": \"开口销\",\n          \"quantity\": 4\n        }\n      ],\n      \"tools_required\": [\n        \"锤子\",\n        \"钳子\"\n      ],\n      \"operation\": \"将两个液压缸(11)分别安装在步骤3焊接的支座上，使用销轴(12)连接。在销轴的另一端插入开口销(13)并掰开，确保销轴不会脱落。\",\n      \"quality_check\": \"检查液压缸安装方向是否正确，销轴是否完全固定。\",\n      \"estimated_time_minutes\": 15,\n      \"safety_warnings\": [\n        \"液压缸属于重物，搬运和安装时注意使用正确的姿势，必要时寻求帮助或使用辅助工具，防止扭伤或砸伤。\",\n        \"使用锤子敲击销轴时，注意周围人员，防止误伤。\"\n      ]\n    }\n  ]\n}\n```",
  "parsed_result": {
    "enhanced_steps": [
      {
        "step_number": 1,
        "title": "焊接左/右铲板与连接板",
        "parts_used": [
          {
            "part_number": "1",
            "description": "左铲板组件",
            "quantity": 1
          },
          {
            "part_number": "2",
            "description": "右铲板组件",
            "quantity": 1
          },
          {
            "part_number": "3",
            "description": "连接板",
            "quantity": 1
          }
        ],
        "tools_required": [
          "焊接工装夹具",
          "CO2焊机",
          "角磨机"
        ],
        "operation": "将左铲板组件(1)和右铲板组件(2)放置在工装夹具上，确保角度和间隙符合图纸要求。将连接板(3)放置在两铲板的连接处，进行点焊定位，然后进行全焊。",
        "quality_check": "检查连接板与铲板的连接是否牢固，焊缝外观是否平整，无明显缺陷。测量总宽度是否符合1900mm的要求。",
        "estimated_time_minutes": 45,
        "welding": {
          "required": true,
          "welding_type": "角焊/对接焊",
          "welding_method": "CO2气保焊",
          "weld_size": "焊脚高度6mm，连接板与铲板接触面全焊",
          "welding_position": "平焊/横焊",
          "quality_requirements": "焊缝必须连续、饱满，不允许有气孔、夹渣、裂纹等缺陷。焊后清理焊渣。",
          "safety_notes": "佩戴自动变光焊接面罩和防护手套。确保工作区域通风良好，远离易燃物。"
        },
        "safety_warnings": [
          "进行焊接作业时，必须穿戴好全套防护用品（焊接面罩、手套、防火服）。",
          "确保工作区域通风良好，防止吸入有害烟尘。",
          "使用角磨机清理焊渣时，必须佩戴防护眼镜，防止飞溅物伤眼。"
        ]
      },
      {
        "step_number": 2,
        "title": "安装并焊接主支撑框架",
        "parts_used": [
          {
            "part_number": "4",
            "description": "主支撑框架",
            "quantity": 1
          },
          {
            "part_number": "5",
            "description": "加强筋板",
            "quantity": 2
          }
        ],
        "tools_required": [
          "吊装设备",
          "CO2焊机",
          "水平仪"
        ],
        "operation": "使用吊装设备将主支撑框架(4)吊装到已焊接好的铲板组件上，对准定位孔。先点焊固定，确保框架垂直度和平整度。然后将加强筋板(5)安装在指定位置，并进行全焊。",
        "quality_check": "检查主支撑框架的垂直度，确保其与铲板平面垂直。检查加强筋板的焊缝是否牢固，焊缝高度是否达到要求。",
        "estimated_time_minutes": 60,
        "welding": {
          "required": true,
          "welding_type": "角焊",
          "welding_method": "CO2气保焊",
          "weld_size": "主框架与铲板连接处焊脚高度8mm；加强筋板焊脚高度6mm",
          "welding_position": "平焊/立焊",
          "quality_requirements": "主受力部位必须全焊透，焊缝过渡平滑，不允许有未焊透现象。焊后用角磨机修整飞溅。",
          "safety_notes": "高空作业时，必须系好安全带。焊接前检查吊装索具是否安全可靠。注意防止火花飞溅到周围设备。"
        },
        "safety_warnings": [
          "吊装重物（主支撑框架）前，必须检查吊装设备和索具是否完好，严禁超载。",
          "吊装过程中，人员必须远离重物下方，防止坠落伤人。",
          "焊接作业时，注意防止火花飞溅，工作区域必须配备灭火器。"
        ]
      },
      {
        "step_number": 3,
        "title": "安装并焊接液压缸支座",
        "parts_used": [
          {
            "part_number": "6",
            "description": "左液压缸支座",
            "quantity": 1
          },
          {
            "part_number": "7",
            "description": "右液压缸支座",
            "quantity": 1
          }
        ],
        "tools_required": [
          "CO2焊机",
          "卡尺",
          "定位块"
        ],
        "operation": "根据图纸尺寸，将左液压缸支座(6)和右液压缸支座(7)分别定位在主支撑框架(4)的指定位置。使用定位块确保支座的中心距和角度准确无误。点焊定位后，进行环绕全焊。",
        "quality_check": "检查两个支座的中心距是否准确（公差±1mm）。检查焊缝是否连续，无漏焊。",
        "estimated_time_minutes": 30,
        "welding": {
          "required": true,
          "welding_type": "角焊",
          "welding_method": "CO2气保焊",
          "weld_size": "焊脚高度5mm，支座底部和侧面环绕全焊",
          "welding_position": "平焊/横焊",
          "quality_requirements": "焊缝必须均匀，受力部位焊透率100%。焊缝表面不允许有咬边。",
          "safety_notes": "焊接支座时，注意保持姿势稳定。焊接完成后，等待零件冷却后再进行下一步操作，防止烫伤。"
        },
        "safety_warnings": [
          "焊接时必须佩戴防护面罩和手套。",
          "焊接完成后，零件温度很高，严禁用手直接触摸，防止烫伤。",
          "清理焊渣时，注意保护眼睛和皮肤。"
        ]
      },
      {
        "step_number": 4,
        "title": "安装铰接轴和轴套",
        "parts_used": [
          {
            "part_number": "8",
            "description": "铰接轴",
            "quantity": 1
          },
          {
            "part_number": "9",
            "description": "轴套",
            "quantity": 2
          },
          {
            "part_number": "10",
            "description": "轴承座",
            "quantity": 2
          }
        ],
        "tools_required": [
          "润滑脂",
          "锤子",
          "螺栓扳手"
        ],
        "operation": "将轴套(9)压入轴承座(10)中。在铰接轴(8)上涂抹润滑脂，然后将铰接轴穿过主支撑框架和轴承座。使用螺栓和螺母（未列出）临时固定。",
        "quality_check": "检查铰接轴转动是否灵活，无卡滞现象。",
        "estimated_time_minutes": 20,
        "safety_warnings": [
          "使用锤子敲击时，必须戴好防护眼镜，防止金属碎屑飞溅。",
          "使用扳手时，确保扳手尺寸匹配，防止滑脱伤手。"
        ]
      },
      {
        "step_number": 5,
        "title": "安装并固定液压缸",
        "parts_used": [
          {
            "part_number": "11",
            "description": "液压缸",
            "quantity": 2
          },
          {
            "part_number": "12",
            "description": "销轴",
            "quantity": 4
          },
          {
            "part_number": "13",
            "description": "开口销",
            "quantity": 4
          }
        ],
        "tools_required": [
          "锤子",
          "钳子"
        ],
        "operation": "将两个液压缸(11)分别安装在步骤3焊接的支座上，使用销轴(12)连接。在销轴的另一端插入开口销(13)并掰开，确保销轴不会脱落。",
        "quality_check": "检查液压缸安装方向是否正确，销轴是否完全固定。",
        "estimated_time_minutes": 15,
        "safety_warnings": [
          "液压缸属于重物，搬运和安装时注意使用正确的姿势，必要时寻求帮助或使用辅助工具，防止扭伤或砸伤。",
          "使用锤子敲击销轴时，注意周围人员，防止误伤。"
        ]
      }
    ]
  }
}