{
  "agent_name": "Agent6_FAQ",
  "model": "google/gemini-2.5-flash-preview-09-2025",
  "timestamp": "20251005_144853",
  "image_count": 0,
  "temperature": 0.2,
  "system_prompt": "# 角色定位\n\n你是**李师傅**，一位拥有20年安全管理经验的高级安全工程师。\n\n## 教育背景\n\n- **学历**：安全工程专业本科\n- **职业资格**：注册安全工程师、高级安全评价师\n- **专业培训**：\n  - 机械制造安全管理\n  - 职业健康与安全管理体系（ISO 45001）\n  - 事故调查与分析\n  - 应急预案编制与演练\n\n## 职业背景\n\n- **工作经历**：20年机械制造企业安全管理经验，参与过大型装备制造、钢结构加工等项目\n- **专业领域**：\n  - 机械加工安全（车、铣、刨、磨、钻等）\n  - 焊接作业安全（电焊、气焊、氩弧焊等）\n  - 起重吊装安全（行车、叉车、吊索具等）\n  - 高空作业安全（脚手架、安全带、防坠落等）\n  - 个人防护用品管理（安全帽、防护眼镜、手套、安全鞋等）\n\n## 知识结构（详细）\n\n### 1. 机械伤害风险\n- **夹伤/挤伤**：手指、手臂被运动部件夹住\n- **切割伤**：锋利边缘、毛刺、切削工具\n- **碰撞伤**：头部碰撞、身体碰撞\n- **坠落伤**：零件坠落、工具坠落、人员坠落\n\n### 2. 焊接作业风险\n- **电击伤**：焊机漏电、接地不良\n- **弧光伤**：电弧紫外线灼伤眼睛和皮肤\n- **烫伤**：高温熔池、焊渣飞溅\n- **火灾爆炸**：易燃物引燃、气瓶泄漏\n- **有毒气体**：焊接烟尘、一氧化碳中毒\n\n### 3. 起重吊装风险\n- **吊物坠落**：吊索具断裂、捆绑不牢\n- **吊物摆动**：碰撞人员、设备\n- **超载**：超过起重机额定载荷\n- **指挥失误**：信号不清、违章指挥\n\n### 4. 高空作业风险\n- **人员坠落**：未系安全带、脚手架不牢\n- **物体打击**：工具、零件从高处坠落\n- **脚手架坍塌**：搭设不规范、超载\n\n### 5. 个人防护用品\n- **头部防护**：安全帽（防止碰撞、坠物打击）\n- **眼部防护**：防护眼镜、焊接面罩（防止飞溅、弧光）\n- **手部防护**：防护手套（防止切割、烫伤、化学品）\n- **足部防护**：安全鞋（防砸、防刺穿、防滑）\n- **呼吸防护**：防尘口罩、防毒面具（防止粉尘、有毒气体）\n\n### 6. 应急处理\n- **机械伤害**：立即停机、呼救、止血、固定、送医\n- **电击伤**：切断电源、心肺复苏、送医\n- **烫伤**：冷水冲洗、覆盖无菌纱布、送医\n- **火灾**：使用灭火器、疏散人员、报警\n\n## 任务步骤（Chain of Thought）\n\n你的任务是**为每个装配步骤添加安全警告**（如果该步骤有安全风险）。请按照以下5个步骤思考：\n\n### 步骤1：识别风险步骤\n- 分析每个装配步骤的操作内容\n- 判断是否涉及高风险作业（焊接、吊装、高空、重物搬运等）\n- 识别潜在的伤害类型（机械伤害、电击、烫伤、坠落等）\n\n### 步骤2：分析风险源\n- 确定风险的来源（设备、工具、材料、环境、人员操作等）\n- 评估风险的严重程度（轻微、中等、严重、致命）\n- 考虑风险的发生概率\n\n### 步骤3：制定预防措施\n- 针对每个风险源，制定具体的预防措施\n- 强调个人防护用品的使用\n- 强调安全操作规程的遵守\n\n### 步骤4：添加安全警告\n- 为每个有风险的步骤添加safety_warnings字段\n- 每条警告要简洁明了，说明具体的风险和预防措施\n- 使用工人能看懂的语言\n\n### 步骤5：验证完整性\n- 检查所有高风险步骤是否都添加了安全警告\n- 检查安全警告是否具体、可操作\n- 检查是否遗漏了任何潜在风险\n\n## 核心原则\n\n1. **步骤级嵌入**：为每个有风险的步骤添加safety_warnings字段，而不是单独列出安全警告\n2. **工人友好**：使用通俗语言，避免专业术语\n3. **具体可操作**：说明具体的风险和预防措施，而不是泛泛而谈\n4. **不重复显示**：安全警告只在下方\"安全\"标签页中统一显示，不在当前步骤详情中重复显示\n\n## 输出格式\n\n严格按照以下JSON格式输出（返回增强后的装配步骤）：\n\n```json\n{\n  \"enhanced_steps\": [\n    {\n      \"step_number\": 1,\n      \"title\": \"点焊定位\",\n      \"parts_used\": [...],\n      \"tools_required\": [...],\n      \"operation\": \"操作说明\",\n      \"quality_check\": \"质量检查\",\n      \"estimated_time_minutes\": 10,\n      \"welding\": {\n        \"required\": true,\n        \"welding_type\": \"点焊\",\n        \"welding_method\": \"CO2气保焊\",\n        ...\n      },\n      \"safety_warnings\": [\n        \"佩戴焊接面罩和防护手套，防止弧光灼伤眼睛和皮肤\",\n        \"确保工件夹紧牢固，防止点焊时位移造成伤害\",\n        \"焊接区域周围3米内不得有易燃物，配备灭火器\",\n        \"焊机必须接地良好，防止漏电触电\"\n      ]\n    },\n    {\n      \"step_number\": 2,\n      \"title\": \"螺栓连接\",\n      \"parts_used\": [...],\n      \"operation\": \"操作说明\",\n      \"quality_check\": \"质量检查\",\n      \"estimated_time_minutes\": 15,\n      \"safety_warnings\": [\n        \"佩戴安全帽和防护眼镜，防止零件坠落和飞溅\",\n        \"使用扭力扳手时注意力度，防止扳手滑脱伤人\"\n      ]\n    },\n    {\n      \"step_number\": 3,\n      \"title\": \"简单装配\",\n      \"parts_used\": [...],\n      \"operation\": \"操作说明\",\n      \"quality_check\": \"质量检查\",\n      \"estimated_time_minutes\": 5\n      // ⚠️ 如果没有明显安全风险，不添加safety_warnings字段\n    }\n  ]\n}\n```\n\n**⚠️ 关键要求**：\n\n1. **步骤级嵌入**：\n   - 为每个有风险的步骤添加`safety_warnings`字段\n   - 没有明显风险的步骤不添加`safety_warnings`字段\n   - 保持原有步骤的所有字段不变\n\n2. **安全警告要具体**：\n   - ✅ 说\"佩戴焊接面罩和防护手套，防止弧光灼伤眼睛和皮肤\"\n   - ❌ 不说\"注意安全\"\n   - ✅ 说\"焊接区域周围3米内不得有易燃物，配备灭火器\"\n   - ❌ 不说\"注意防火\"\n\n3. **使用通俗语言**：\n   - 工人能看懂的语言\n   - 避免专业术语和英文缩写\n\n4. **警告要全面**：\n   - 涵盖个人防护、设备安全、环境安全、操作安全\n   - 每条警告说明具体的风险和预防措施\n\n## 重要提醒\n\n- **只输出JSON，不要输出其他内容**\n- **保持原有字段不变**：不要修改或删除原有的字段（包括welding字段）\n- **警告要简洁明了**：每条警告一句话，说明风险和预防措施\n- **不要过度警告**：只针对有明显风险的步骤添加警告\n",
  "user_query": "请为以下装配步骤添加安全警告（如果有安全风险）。\n\n## 📸 视觉分析任务\n\n**你会看到工程图纸图片，请仔细观察：**\n\n1. **危险作业标识**：\n   - 图纸上的安全警告标识\n   - 特殊作业要求（如高空作业、吊装作业等）\n   - 危险区域标注\n\n2. **零件特征**：\n   - 重型零件（需要吊装）\n   - 锋利边缘（容易割伤）\n   - 高温部件（容易烫伤）\n\n3. **作业环境**：\n   - 狭窄空间（容易碰撞）\n   - 高空位置（容易坠落）\n   - 密闭空间（通风不良）\n\n## 装配步骤\n\n[\n  {\n    \"step_number\": 1,\n    \"action\": \"放置基准件\",\n    \"description\": \"将图纸上标注为1的方形板-机加（01.01.01.11511）平稳放置在装配工作台上，作为整个组件的装配基准。\",\n    \"position_description\": \"工作台中央，确保水平。\",\n    \"parts_used\": [\n      {\n        \"bom_seq\": \"1\",\n        \"bom_name\": \"方形板-机加 1\",\n        \"quantity\": 1,\n        \"drawing_number\": \"1\",\n        \"node_name\": [\n          \"NAUO1\"\n        ],\n        \"bom_code\": \"01.01.01.11511\"\n      }\n    ],\n    \"tools\": [\n      \"行车（吊具）\",\n      \"水平仪\"\n    ],\n    \"warnings\": [\n      \"方形板较重（15.79kg），吊装时注意安全，确保吊具牢固。\",\n      \"基准件必须放置平稳，确保后续装配精度。\"\n    ],\n    \"estimated_time_minutes\": 5\n  },\n  {\n    \"step_number\": 2,\n    \"action\": \"安装上连接板\",\n    \"description\": \"将图纸上标注为2的上连接板（01.01.01.11512）放置在基准件（1）的顶部边缘，按照图纸尺寸和位置要求进行定位，并进行点焊固定。\",\n    \"position_description\": \"上连接板（2）位于方形板（1）的顶部边缘，注意方向和孔位对齐。\",\n    \"parts_used\": [\n      {\n        \"bom_seq\": \"2\",\n        \"bom_name\": \"上连接板 2\",\n        \"quantity\": 1,\n        \"drawing_number\": \"2\",\n        \"node_name\": [\n          \"NAUO3\",\n          \"NAUO2\"\n        ],\n        \"bom_code\": \"01.01.01.11512\"\n      }\n    ],\n    \"tools\": [\n      \"焊机\",\n      \"直角尺\",\n      \"卷尺\"\n    ],\n    \"warnings\": [\n      \"点焊前必须确保上连接板与方形板的垂直度符合要求。\",\n      \"点焊位置应避开后续满焊区域。\"\n    ],\n    \"estimated_time_minutes\": 10,\n    \"welding\": {\n      \"required\": true,\n      \"welding_type\": \"角焊（定位焊）\",\n      \"welding_method\": \"CO2气保焊\",\n      \"weld_size\": \"点焊，焊点长度约10mm\",\n      \"welding_position\": \"零件②（上连接板）与零件①（方形板）的连接处，平焊\",\n      \"quality_requirements\": \"焊点牢固，定位准确，确保垂直度。\",\n      \"safety_notes\": \"佩戴焊接面罩、防护手套和防护服。确保工作区域通风良好，防止烟尘吸入。\"\n    }\n  },\n  {\n    \"step_number\": 3,\n    \"action\": \"安装侧连接板\",\n    \"description\": \"将图纸上标注为3的侧连接板（01.01.01.11513）放置在基准件（1）的侧面边缘，并与已安装的上连接板（2）对齐，进行点焊固定。\",\n    \"position_description\": \"侧连接板（3）位于方形板（1）的侧面，与上连接板（2）形成直角。\",\n    \"parts_used\": [\n      {\n        \"bom_seq\": \"3\",\n        \"bom_name\": \"侧连接板 2\",\n        \"quantity\": 1,\n        \"drawing_number\": \"3\",\n        \"node_name\": [\n          \"NAUO5\",\n          \"NAUO4\"\n        ],\n        \"bom_code\": \"01.01.01.11513\"\n      }\n    ],\n    \"tools\": [\n      \"焊机\",\n      \"直角尺\",\n      \"卡尺\"\n    ],\n    \"warnings\": [\n      \"侧连接板较重（24.97kg），安装时注意支撑。\",\n      \"确保侧连接板与方形板、上连接板的相对位置精度。\"\n    ],\n    \"estimated_time_minutes\": 15,\n    \"welding\": {\n      \"required\": true,\n      \"welding_type\": \"角焊（定位焊）\",\n      \"welding_method\": \"CO2气保焊\",\n      \"weld_size\": \"点焊，焊点长度约10mm\",\n      \"welding_position\": \"零件③（侧连接板）与零件①（方形板）的连接处，横焊/平焊；零件③与零件②（上连接板）的连接处，角焊\",\n      \"quality_requirements\": \"使用直角尺检查垂直度，确保定位准确，焊点均匀分布。\",\n      \"safety_notes\": \"侧连接板较重，定位时需使用夹具固定。注意防止电缆绊倒，确保接地良好。\"\n    }\n  },\n  {\n    \"step_number\": 4,\n    \"action\": \"安装折弯板\",\n    \"description\": \"将图纸上标注为4的折弯板（01.01.01.11514）放置在侧连接板（3）的内侧顶部，按照图纸尺寸定位后进行点焊固定。\",\n    \"position_description\": \"折弯板（4）位于侧连接板（3）的内侧，靠近上连接板（2）。\",\n    \"parts_used\": [\n      {\n        \"bom_seq\": \"4\",\n        \"bom_name\": \"折弯板 1\",\n        \"quantity\": 1,\n        \"drawing_number\": \"4\",\n        \"node_name\": [\n          \"NAUO6\"\n        ],\n        \"bom_code\": \"01.01.01.11514\"\n      }\n    ],\n    \"tools\": [\n      \"焊机\",\n      \"卷尺\"\n    ],\n    \"warnings\": [\n      \"折弯板的定位精度直接影响后续轴套的安装，必须精确对齐。\",\n      \"点焊牢固，防止后续焊接过程中变形。\"\n    ],\n    \"estimated_time_minutes\": 10,\n    \"welding\": {\n      \"required\": true,\n      \"welding_type\": \"角焊（定位焊）\",\n      \"welding_method\": \"CO2气保焊\",\n      \"weld_size\": \"点焊，焊点长度约10mm\",\n      \"welding_position\": \"零件④（折弯板）与零件③（侧连接板）的连接处，平焊/横焊\",\n      \"quality_requirements\": \"确保折弯板与侧连接板贴合紧密，定位尺寸符合图纸要求。\",\n      \"safety_notes\": \"在狭小空间内操作时，注意焊枪角度，避免烫伤。检查焊机电缆绝缘是否完好。\"\n    }\n  },\n  {\n    \"step_number\": 5,\n    \"action\": \"安装油缸固定板\",\n    \"description\": \"将图纸上标注为5的油缸固定板（01.01.01.11515）安装在侧连接板（3）的指定位置，共4块，按照图纸上的孔位和间距要求进行点焊固定。\",\n    \"position_description\": \"油缸固定板（5）位于侧连接板（3）的外部，分上下两组，每组两块。\",\n    \"parts_used\": [\n      {\n        \"bom_seq\": \"5\",\n        \"bom_name\": \"油缸固定板 4\",\n        \"quantity\": 4,\n        \"drawing_number\": \"5\",\n        \"node_name\": [\n          \"NAUO17\",\n          \"NAUO16\",\n          \"NAUO8\",\n          \"NAUO7\"\n        ],\n        \"bom_code\": \"01.01.01.11515\"\n      }\n    ],\n    \"tools\": [\n      \"焊机\",\n      \"定位夹具\",\n      \"卷尺\"\n    ],\n    \"warnings\": [\n      \"油缸固定板的安装位置和间距必须严格按照图纸要求，使用定位夹具辅助。\",\n      \"注意油缸固定板的方向性。\"\n    ],\n    \"estimated_time_minutes\": 15,\n    \"welding\": {\n      \"required\": true,\n      \"welding_type\": \"角焊（定位焊）\",\n      \"welding_method\": \"CO2气保焊\",\n      \"weld_size\": \"点焊，焊点长度约10mm\",\n      \"welding_position\": \"零件⑤（油缸固定板）与零件③（侧连接板）的连接处，横焊\",\n      \"quality_requirements\": \"使用定位夹具确保四块板的相对位置精度，焊点牢固。\",\n      \"safety_notes\": \"定位焊时注意板材边缘锋利，佩戴防护手套。确保焊机参数设置正确，避免烧穿薄板。\"\n    }\n  },\n  {\n    \"step_number\": 6,\n    \"action\": \"安装加强板\",\n    \"description\": \"将图纸上标注为6的加强板（01.01.01.11516）安装在侧连接板（3）的指定位置，共4块，用于加强结构强度，进行点焊固定。\",\n    \"position_description\": \"加强板（6）位于侧连接板（3）的外部，靠近油缸固定板（5）。\",\n    \"parts_used\": [\n      {\n        \"bom_seq\": \"6\",\n        \"bom_name\": \"加强板 4\",\n        \"quantity\": 4,\n        \"drawing_number\": \"6\",\n        \"node_name\": [\n          \"NAUO12\",\n          \"NAUO11\",\n          \"NAUO10\",\n          \"NAUO9\"\n        ],\n        \"bom_code\": \"01.01.01.11516\"\n      }\n    ],\n    \"tools\": [\n      \"焊机\",\n      \"直角尺\"\n    ],\n    \"warnings\": [\n      \"加强板的安装应确保与侧连接板紧密贴合，无间隙。\",\n      \"点焊应均匀分布，防止应力集中。\"\n    ],\n    \"estimated_time_minutes\": 10,\n    \"welding\": {\n      \"required\": true,\n      \"welding_type\": \"角焊（定位焊）\",\n      \"welding_method\": \"CO2气保焊\",\n      \"weld_size\": \"点焊，焊点长度约10mm\",\n      \"welding_position\": \"零件⑥（加强板）与零件③（侧连接板）的连接处，横焊\",\n      \"quality_requirements\": \"确保加强板与侧连接板紧密贴合，定位焊点均匀分布，防止后续满焊时变形。\",\n      \"safety_notes\": \"点焊时注意控制热输入，避免板材局部过热变形。穿戴好防护用品。\"\n    }\n  },\n  {\n    \"step_number\": 7,\n    \"action\": \"安装角钢\",\n    \"description\": \"将图纸上标注为7的角钢-机加（01.01.04.0592）安装在主体结构的顶部，与上连接板（2）和侧连接板（3）连接处对齐，进行点焊固定。\",\n    \"position_description\": \"角钢（7）位于组件的顶部，用于连接和加强。\",\n    \"parts_used\": [\n      {\n        \"bom_seq\": \"7\",\n        \"bom_name\": \"角钢-机加 1\",\n        \"quantity\": 1,\n        \"drawing_number\": \"7\",\n        \"node_name\": [\n          \"NAUO13\"\n        ],\n        \"bom_code\": \"01.01.04.0592\"\n      }\n    ],\n    \"tools\": [\n      \"焊机\",\n      \"直角尺\"\n    ],\n    \"warnings\": [\n      \"角钢的安装位置必须精确，确保后续装配的平面度。\",\n      \"点焊应牢固，防止在后续操作中移位。\"\n    ],\n    \"estimated_time_minutes\": 10,\n    \"welding\": {\n      \"required\": true,\n      \"welding_type\": \"角焊（定位焊）\",\n      \"welding_method\": \"CO2气保焊\",\n      \"weld_size\": \"点焊，焊点长度约10mm\",\n      \"welding_position\": \"零件⑦（角钢）与零件②（上连接板）和零件③（侧连接板）的连接处，平焊/横焊\",\n      \"quality_requirements\": \"确保角钢与两块板材的接触面紧密，定位准确。\",\n      \"safety_notes\": \"角钢边缘可能锋利，操作时注意割伤。点焊后及时清理焊渣，防止飞溅伤人。\"\n    }\n  },\n  {\n    \"step_number\": 8,\n    \"action\": \"安装轴套（上部）\",\n    \"description\": \"将图纸上标注为8的轴套（01.01.02.1221）安装在侧连接板（3）上部的孔位中，确保轴套端面与侧连接板外表面齐平，进行点焊固定。\",\n    \"position_description\": \"轴套（8）位于侧连接板（3）上部的孔位。\",\n    \"parts_used\": [\n      {\n        \"bom_seq\": \"8\",\n        \"bom_name\": \"轴套 1\",\n        \"quantity\": 1,\n        \"drawing_number\": \"8\"\n      }\n    ],\n    \"tools\": [\n      \"焊机\",\n      \"游标卡尺\"\n    ],\n    \"warnings\": [\n      \"轴套的安装必须保证与侧连接板的垂直度，使用专用工装夹具定位。\",\n      \"轴套端面与板材齐平，不允许凸出或凹陷。\"\n    ],\n    \"estimated_time_minutes\": 10,\n    \"welding\": {\n      \"required\": true,\n      \"welding_type\": \"角焊（定位焊）\",\n      \"welding_method\": \"CO2气保焊/手工电弧焊\",\n      \"weld_size\": \"点焊，沿圆周均匀分布4个焊点\",\n      \"welding_position\": \"零件⑧（轴套）与零件③（侧连接板）的连接处，环形角焊，横焊/立焊\",\n      \"quality_requirements\": \"轴套端面与板材齐平，垂直度偏差小于0.5mm。焊点均匀，防止轴套移位。\",\n      \"safety_notes\": \"轴套焊接时，热量集中，注意控制电流，防止烧穿。使用夹具固定，确保同轴度。\"\n    }\n  },\n  {\n    \"step_number\": 9,\n    \"action\": \"安装后座轴套（下部）\",\n    \"description\": \"将图纸上标注为9的后座轴套（01.02.02.0490）安装在侧连接板（3）下部的孔位中，确保轴套端面与侧连接板外表面齐平，进行点焊固定。\",\n    \"position_description\": \"后座轴套（9）位于侧连接板（3）下部的孔位。\",\n    \"parts_used\": [\n      {\n        \"bom_seq\": \"9\",\n        \"bom_name\": \"后座轴套 1\",\n        \"quantity\": 1,\n        \"drawing_number\": \"9\",\n        \"node_name\": [\n          \"NAUO15\"\n        ],\n        \"bom_code\": \"01.02.02.0490\"\n      }\n    ],\n    \"tools\": [\n      \"焊机\",\n      \"游标卡尺\"\n    ],\n    \"warnings\": [\n      \"轴套的安装必须保证与侧连接板的垂直度，使用专用工装夹具定位。\",\n      \"轴套端面与板材齐平，不允许凸出或凹陷。\"\n    ],\n    \"estimated_time_minutes\": 10,\n    \"welding\": {\n      \"required\": true,\n      \"welding_type\": \"角焊（定位焊）\",\n      \"welding_method\": \"CO2气保焊/手工电弧焊\",\n      \"weld_size\": \"点焊，沿圆周均匀分布4个焊点\",\n      \"welding_position\": \"零件⑨（后座轴套）与零件③（侧连接板）的连接处，环形角焊，横焊/立焊\",\n      \"quality_requirements\": \"轴套端面与板材齐平，垂直度偏差小于0.5mm。焊点均匀，防止轴套移位。\",\n      \"safety_notes\": \"轴套焊接时，热量集中，注意控制电流，防止烧穿。使用夹具固定，确保同轴度。\"\n    }\n  },\n  {\n    \"step_number\": 10,\n    \"action\": \"安装后座轴套（折弯板）\",\n    \"description\": \"将图纸上标注为10的后座轴套（01.01.02.0337）安装在折弯板（4）上的孔位中，确保轴套端面与折弯板外表面齐平，进行点焊固定。\",\n    \"position_description\": \"后座轴套（10）位于折弯板（4）的孔位。\",\n    \"parts_used\": [\n      {\n        \"bom_seq\": \"10\",\n        \"bom_name\": \"后座轴套 1\",\n        \"quantity\": 1,\n        \"drawing_number\": \"10\",\n        \"node_name\": [\n          \"NAUO18\"\n        ],\n        \"bom_code\": \"01.01.02.0337\"\n      }\n    ],\n    \"tools\": [\n      \"焊机\",\n      \"游标卡尺\"\n    ],\n    \"warnings\": [\n      \"轴套的安装必须保证与折弯板的垂直度，使用专用工装夹具定位。\",\n      \"轴套端面与板材齐平，不允许凸出或凹陷。\"\n    ],\n    \"estimated_time_minutes\": 10,\n    \"welding\": {\n      \"required\": true,\n      \"welding_type\": \"角焊（定位焊）\",\n      \"welding_method\": \"CO2气保焊/手工电弧焊\",\n      \"weld_size\": \"点焊，沿圆周均匀分布4个焊点\",\n      \"welding_position\": \"零件⑩（后座轴套）与零件④（折弯板）的连接处，环形角焊，平焊\",\n      \"quality_requirements\": \"轴套端面与板材齐平，垂直度偏差小于0.5mm。焊点均匀，防止轴套移位。\",\n      \"safety_notes\": \"轴套焊接时，热量集中，注意控制电流，防止烧穿。使用夹具固定，确保同轴度。\"\n    }\n  },\n  {\n    \"step_number\": 11,\n    \"action\": \"主体结构满焊\",\n    \"description\": \"对所有已点焊固定的零件（2、3、4、5、6、7、8、9、10）与基准件（1）之间的连接处进行满焊。焊接应按照图纸技术要求进行，遵循对称、分段、短焊缝的原则，以减少焊接变形。\",\n    \"position_description\": \"所有板材和轴套的连接焊缝。\",\n    \"parts_used\": [],\n    \"tools\": [\n      \"焊机（CO2/电弧）\",\n      \"焊接夹具\",\n      \"除渣工具\"\n    ],\n    \"warnings\": [\n      \"严格控制焊接电流和速度，确保焊缝饱满、无气孔、无夹渣。\",\n      \"焊接过程中注意散热和变形控制，必要时使用反变形措施。\",\n      \"轴套与板材的焊接需保证同轴度要求。\"\n    ],\n    \"estimated_time_minutes\": 60,\n    \"welding\": {\n      \"required\": true,\n      \"welding_type\": \"角焊/环形角焊（满焊）\",\n      \"welding_method\": \"CO2气保焊（优先）或手工电弧焊\",\n      \"weld_size\": \"焊脚高度5mm（图纸标注），轴套周围为环形满焊\",\n      \"welding_position\": \"所有连接焊缝，涉及平焊、横焊、立焊\",\n      \"quality_requirements\": \"焊缝连续、饱满，焊脚尺寸符合5mm要求。焊缝表面光滑，无裂纹、未熔合、气孔等缺陷。轴套焊缝需保证同轴度。\",\n      \"safety_notes\": \"进行大面积焊接时，必须佩戴全套防护用品（面罩、手套、防护服）。确保工作区域防火，配备灭火器。采用分段、跳焊方式，控制热应力，防止结构变形和裂纹产生。\"\n    }\n  },\n  {\n    \"step_number\": 12,\n    \"action\": \"焊缝清理与检查\",\n    \"description\": \"对所有焊缝进行清理，去除焊渣和飞溅物。使用角磨机对焊缝进行修整，确保外观平整。\",\n    \"position_description\": \"所有焊缝区域。\",\n    \"parts_used\": [],\n    \"tools\": [\n      \"角磨机\",\n      \"钢丝刷\",\n      \"除渣锤\"\n    ],\n    \"warnings\": [\n      \"清理时注意保护零件表面，避免过度打磨。\",\n      \"检查焊缝是否符合技术要求，特别是轴套周围的焊缝质量。\"\n    ],\n    \"estimated_time_minutes\": 20\n  }\n]\n\n## 要求\n\n请按照以下5个步骤思考，为装配步骤添加安全警告：\n\n### 步骤1：识别风险步骤\n- 分析每个装配步骤的操作内容\n- 判断是否涉及高风险作业：\n  * **焊接作业**：电击、弧光、烫伤、火灾\n  * **吊装作业**：吊物坠落、碰撞、超载\n  * **高空作业**：人员坠落、物体打击\n  * **重物搬运**：砸伤、扭伤、夹伤\n  * **机械加工**：切割伤、夹伤、碰撞\n\n### 步骤2：分析风险源\n- 确定风险的来源（设备、工具、材料、环境、人员操作等）\n- 评估风险的严重程度（轻微、中等、严重、致命）\n- 考虑风险的发生概率\n\n### 步骤3：制定预防措施\n- 针对每个风险源，制定具体的预防措施\n- 强调个人防护用品的使用：\n  * **焊接**：焊接面罩、防护手套、防护服\n  * **吊装**：安全帽、安全鞋、手套\n  * **高空**：安全带、安全帽、防滑鞋\n  * **机械**：防护眼镜、手套、安全鞋\n\n### 步骤4：添加安全警告\n- 为每个有风险的步骤添加safety_warnings字段\n- 每条警告要简洁明了，说明具体的风险和预防措施\n- 使用工人能看懂的语言\n\n### 步骤5：验证完整性\n- 检查所有高风险步骤是否都添加了安全警告\n- 检查安全警告是否具体、可操作\n- 检查是否遗漏了任何潜在风险\n\n## ⚠️ 强制自检清单（生成后必须逐项检查）\n\n**在输出JSON之前，你必须完成以下验证：**\n\n1. **风险步骤识别验证**：\n   - [ ] 所有涉及焊接、吊装、高空、重物搬运的步骤都添加了safety_warnings字段\n   - [ ] 没有明显风险的步骤没有添加safety_warnings字段\n\n2. **安全警告完整性验证**：\n   - [ ] 每个safety_warnings字段都是字符串数组\n   - [ ] 每条警告都说明了具体的风险和预防措施\n   - [ ] 涵盖了个人防护、设备安全、环境安全、操作安全\n\n3. **语言通俗性验证**：\n   - [ ] 使用工人能看懂的语言\n   - [ ] 避免专业术语和英文缩写\n   - [ ] 每条警告简洁明了（一句话）\n\n4. **原有字段保持验证**：\n   - [ ] 原有步骤的所有字段都保持不变（包括welding字段）\n   - [ ] 没有修改或删除任何原有字段\n\n**如果自检发现任何问题，必须重新生成！**\n\n现在开始为装配步骤添加安全警告！\n",
  "raw_response": "```json\n{\n  \"enhanced_steps\": [\n    {\n      \"step_number\": 1,\n      \"action\": \"放置基准件\",\n      \"description\": \"将图纸上标注为1的方形板-机加（01.01.01.11511）平稳放置在装配工作台上，作为整个组件的装配基准。\",\n      \"position_description\": \"工作台中央，确保水平。\",\n      \"parts_used\": [\n        {\n          \"bom_seq\": \"1\",\n          \"bom_name\": \"方形板-机加 1\",\n          \"quantity\": 1,\n          \"drawing_number\": \"1\",\n          \"node_name\": [\n            \"NAUO1\"\n          ],\n          \"bom_code\": \"01.01.01.11511\"\n        }\n      ],\n      \"tools\": [\n        \"行车（吊具）\",\n        \"水平仪\"\n      ],\n      \"warnings\": [\n        \"方形板较重（15.79kg），吊装时注意安全，确保吊具牢固。\",\n        \"基准件必须放置平稳，确保后续装配精度。\"\n      ],\n      \"estimated_time_minutes\": 5,\n      \"safety_warnings\": [\n        \"佩戴安全帽和防护手套，防止重物坠落和夹伤\",\n        \"使用行车吊装时，必须由持证司索工指挥，确认吊索具完好\",\n        \"吊装前检查吊具是否捆绑牢固，防止吊物在空中摆动或坠落\"\n      ]\n    },\n    {\n      \"step_number\": 2,\n      \"action\": \"安装上连接板\",\n      \"description\": \"将图纸上标注为2的上连接板（01.01.01.11512）放置在基准件（1）的顶部边缘，按照图纸尺寸和位置要求进行定位，并进行点焊固定。\",\n      \"position_description\": \"上连接板（2）位于方形板（1）的顶部边缘，注意方向和孔位对齐。\",\n      \"parts_used\": [\n        {\n          \"bom_seq\": \"2\",\n          \"bom_name\": \"上连接板 2\",\n          \"quantity\": 1,\n          \"drawing_number\": \"2\",\n          \"node_name\": [\n            \"NAUO3\",\n            \"NAUO2\"\n          ],\n          \"bom_code\": \"01.01.01.11512\"\n        }\n      ],\n      \"tools\": [\n        \"焊机\",\n        \"直角尺\",\n        \"卷尺\"\n      ],\n      \"warnings\": [\n        \"点焊前必须确保上连接板与方形板的垂直度符合要求。\",\n        \"点焊位置应避开后续满焊区域。\"\n      ],\n      \"estimated_time_minutes\": 10,\n      \"welding\": {\n        \"required\": true,\n        \"welding_type\": \"角焊（定位焊）\",\n        \"welding_method\": \"CO2气保焊\",\n        \"weld_size\": \"点焊，焊点长度约10mm\",\n        \"welding_position\": \"零件②（上连接板）与零件①（方形板）的连接处，平焊\",\n        \"quality_requirements\": \"焊点牢固，定位准确，确保垂直度。\",\n        \"safety_notes\": \"佩戴焊接面罩、防护手套和防护服。确保工作区域通风良好，防止烟尘吸入。\"\n      },\n      \"safety_warnings\": [\n        \"佩戴焊接面罩、防护手套和防护服，防止弧光灼伤和烫伤\",\n        \"确保焊机接地良好，电缆绝缘完好，防止触电\",\n        \"焊接区域必须清理干净，周围3米内不得有易燃易爆物品\"\n      ]\n    },\n    {\n      \"step_number\": 3,\n      \"action\": \"安装侧连接板\",\n      \"description\": \"将图纸上标注为3的侧连接板（01.01.01.11513）放置在基准件（1）的侧面边缘，并与已安装的上连接板（2）对齐，进行点焊固定。\",\n      \"position_description\": \"侧连接板（3）位于方形板（1）的侧面，与上连接板（2）形成直角。\",\n      \"parts_used\": [\n        {\n          \"bom_seq\": \"3\",\n          \"bom_name\": \"侧连接板 2\",\n          \"quantity\": 1,\n          \"drawing_number\": \"3\",\n          \"node_name\": [\n            \"NAUO5\",\n            \"NAUO4\"\n          ],\n          \"bom_code\": \"01.01.01.11513\"\n        }\n      ],\n      \"tools\": [\n        \"焊机\",\n        \"直角尺\",\n        \"卡尺\"\n      ],\n      \"warnings\": [\n        \"侧连接板较重（24.97kg），安装时注意支撑。\",\n        \"确保侧连接板与方形板、上连接板的相对位置精度。\"\n      ],\n      \"estimated_time_minutes\": 15,\n      \"welding\": {\n        \"required\": true,\n        \"welding_type\": \"角焊（定位焊）\",\n        \"welding_method\": \"CO2气保焊\",\n        \"weld_size\": \"点焊，焊点长度约10mm\",\n        \"welding_position\": \"零件③（侧连接板）与零件①（方形板）的连接处，横焊/平焊；零件③与零件②（上连接板）的连接处，角焊\",\n        \"quality_requirements\": \"使用直角尺检查垂直度，确保定位准确，焊点均匀分布。\",\n        \"safety_notes\": \"侧连接板较重，定位时需使用夹具固定。注意防止电缆绊倒，确保接地良好。\"\n      },\n      \"safety_warnings\": [\n        \"侧连接板较重，搬运和定位时需两人配合或使用辅助工具，防止砸伤或扭伤\",\n        \"佩戴焊接面罩和防护手套，防止焊接飞溅物烫伤\",\n        \"使用夹具固定工件，防止定位焊时工件倾倒或位移\"\n      ]\n    },\n    {\n      \"step_number\": 4,\n      \"action\": \"安装折弯板\",\n      \"description\": \"将图纸上标注为4的折弯板（01.01.01.11514）放置在侧连接板（3）的内侧顶部，按照图纸尺寸定位后进行点焊固定。\",\n      \"position_description\": \"折弯板（4）位于侧连接板（3）的内侧，靠近上连接板（2）。\",\n      \"parts_used\": [\n        {\n          \"bom_seq\": \"4\",\n          \"bom_name\": \"折弯板 1\",\n          \"quantity\": 1,\n          \"drawing_number\": \"4\",\n          \"node_name\": [\n            \"NAUO6\"\n          ],\n          \"bom_code\": \"01.01.01.11514\"\n        }\n      ],\n      \"tools\": [\n        \"焊机\",\n        \"卷尺\"\n      ],\n      \"warnings\": [\n        \"折弯板的定位精度直接影响后续轴套的安装，必须精确对齐。\",\n        \"点焊牢固，防止后续焊接过程中变形。\"\n      ],\n      \"estimated_time_minutes\": 10,\n      \"welding\": {\n        \"required\": true,\n        \"welding_type\": \"角焊（定位焊）\",\n        \"welding_method\": \"CO2气保焊\",\n        \"weld_size\": \"点焊，焊点长度约10mm\",\n        \"welding_position\": \"零件④（折弯板）与零件③（侧连接板）的连接处，平焊/横焊\",\n        \"quality_requirements\": \"确保折弯板与侧连接板贴合紧密，定位尺寸符合图纸要求。\",\n        \"safety_notes\": \"在狭小空间内操作时，注意焊枪角度，避免烫伤。检查焊机电缆绝缘是否完好。\"\n      },\n      \"safety_warnings\": [\n        \"佩戴防护手套，折弯板边缘可能锋利，防止割伤\",\n        \"在结构内部进行焊接时，注意保持身体姿势稳定，避免焊枪或身体接触高温部件\",\n        \"确保通风良好，防止焊接烟尘在狭小空间内聚集\"\n      ]\n    },\n    {\n      \"step_number\": 5,\n      \"action\": \"安装油缸固定板\",\n      \"description\": \"将图纸上标注为5的油缸固定板（01.01.01.11515）安装在侧连接板（3）的指定位置，共4块，按照图纸上的孔位和间距要求进行点焊固定。\",\n      \"position_description\": \"油缸固定板（5）位于侧连接板（3）的外部，分上下两组，每组两块。\",\n      \"parts_used\": [\n        {\n          \"bom_seq\": \"5\",\n          \"bom_name\": \"油缸固定板 4\",\n          \"quantity\": 4,\n          \"drawing_number\": \"5\",\n          \"node_name\": [\n            \"NAUO17\",\n            \"NAUO16\",\n            \"NAUO8\",\n            \"NAUO7\"\n          ],\n          \"bom_code\": \"01.01.01.11515\"\n        }\n      ],\n      \"tools\": [\n        \"焊机\",\n        \"定位夹具\",\n        \"卷尺\"\n      ],\n      \"warnings\": [\n        \"油缸固定板的安装位置和间距必须严格按照图纸要求，使用定位夹具辅助。\",\n        \"注意油缸固定板的方向性。\"\n      ],\n      \"estimated_time_minutes\": 15,\n      \"welding\": {\n        \"required\": true,\n        \"welding_type\": \"角焊（定位焊）\",\n        \"welding_method\": \"CO2气保焊\",\n        \"weld_size\": \"点焊，焊点长度约10mm\",\n        \"welding_position\": \"零件⑤（油缸固定板）与零件③（侧连接板）的连接处，横焊\",\n        \"quality_requirements\": \"使用定位夹具确保四块板的相对位置精度，焊点牢固。\",\n        \"safety_notes\": \"定位焊时注意板材边缘锋利，佩戴防护手套。确保焊机参数设置正确，避免烧穿薄板。\"\n      },\n      \"safety_warnings\": [\n        \"佩戴防护手套，防止板材边缘割伤\",\n        \"使用定位夹具固定小零件，防止焊接时飞溅或移动\",\n        \"控制焊接电流，避免因热量过大导致板材变形或烧穿\"\n      ]\n    },\n    {\n      \"step_number\": 6,\n      \"action\": \"安装加强板\",\n      \"description\": \"将图纸上标注为6的加强板（01.01.01.11516）安装在侧连接板（3）的指定位置，共4块，用于加强结构强度，进行点焊固定。\",\n      \"position_description\": \"加强板（6）位于侧连接板（3）的外部，靠近油缸固定板（5）。\",\n      \"parts_used\": [\n        {\n          \"bom_seq\": \"6\",\n          \"bom_name\": \"加强板 4\",\n          \"quantity\": 4,\n          \"drawing_number\": \"6\",\n          \"node_name\": [\n            \"NAUO12\",\n            \"NAUO11\",\n            \"NAUO10\",\n            \"NAUO9\"\n          ],\n          \"bom_code\": \"01.01.01.11516\"\n        }\n      ],\n      \"tools\": [\n        \"焊机\",\n        \"直角尺\"\n      ],\n      \"warnings\": [\n        \"加强板的安装应确保与侧连接板紧密贴合，无间隙。\",\n        \"点焊应均匀分布，防止应力集中。\"\n      ],\n      \"estimated_time_minutes\": 10,\n      \"welding\": {\n        \"required\": true,\n        \"welding_type\": \"角焊（定位焊）\",\n        \"welding_method\": \"CO2气保焊\",\n        \"weld_size\": \"点焊，焊点长度约10mm\",\n        \"welding_position\": \"零件⑥（加强板）与零件③（侧连接板）的连接处，横焊\",\n        \"quality_requirements\": \"确保加强板与侧连接板紧密贴合，定位焊点均匀分布，防止后续满焊时变形。\",\n        \"safety_notes\": \"点焊时注意控制热输入，避免板材局部过热变形。穿戴好防护用品。\"\n      },\n      \"safety_warnings\": [\n        \"佩戴防护手套，防止搬运加强板时割伤\",\n        \"点焊时注意控制热输入，防止板材局部过热变形\",\n        \"确保所有防护用品（面罩、手套）穿戴到位\"\n      ]\n    },\n    {\n      \"step_number\": 7,\n      \"action\": \"安装角钢\",\n      \"description\": \"将图纸上标注为7的角钢-机加（01.01.04.0592）安装在主体结构的顶部，与上连接板（2）和侧连接板（3）连接处对齐，进行点焊固定。\",\n      \"position_description\": \"角钢（7）位于组件的顶部，用于连接和加强。\",\n      \"parts_used\": [\n        {\n          \"bom_seq\": \"7\",\n          \"bom_name\": \"角钢-机加 1\",\n          \"quantity\": 1,\n          \"drawing_number\": \"7\",\n          \"node_name\": [\n            \"NAUO13\"\n          ],\n          \"bom_code\": \"01.01.04.0592\"\n        }\n      ],\n      \"tools\": [\n        \"焊机\",\n        \"直角尺\"\n      ],\n      \"warnings\": [\n        \"角钢的安装位置必须精确，确保后续装配的平面度。\",\n        \"点焊应牢固，防止在后续操作中移位。\"\n      ],\n      \"estimated_time_minutes\": 10,\n      \"welding\": {\n        \"required\": true,\n        \"welding_type\": \"角焊（定位焊）\",\n        \"welding_method\": \"CO2气保焊\",\n        \"weld_size\": \"点焊，焊点长度约10mm\",\n        \"welding_position\": \"零件⑦（角钢）与零件②（上连接板）和零件③（侧连接板）的连接处，平焊/横焊\",\n        \"quality_requirements\": \"确保角钢与两块板材的接触面紧密，定位准确。\",\n        \"safety_notes\": \"角钢边缘可能锋利，操作时注意割伤。点焊后及时清理焊渣，防止飞溅伤人。\"\n      },\n      \"safety_warnings\": [\n        \"角钢边缘可能锋利，搬运和定位时必须佩戴防护手套，防止割伤\",\n        \"点焊后及时使用除渣锤清理焊渣，清理时佩戴防护眼镜，防止焊渣飞溅伤眼\"\n      ]\n    },\n    {\n      \"step_number\": 8,\n      \"action\": \"安装轴套（上部）\",\n      \"description\": \"将图纸上标注为8的轴套（01.01.02.1221）安装在侧连接板（3）上部的孔位中，确保轴套端面与侧连接板外表面齐平，进行点焊固定。\",\n      \"position_description\": \"轴套（8）位于侧连接板（3）上部的孔位。\",\n      \"parts_used\": [\n        {\n          \"bom_seq\": \"8\",\n          \"bom_name\": \"轴套 1\",\n          \"quantity\": 1,\n          \"drawing_number\": \"8\"\n        }\n      ],\n      \"tools\": [\n        \"焊机\",\n        \"游标卡尺\"\n      ],\n      \"warnings\": [\n        \"轴套的安装必须保证与侧连接板的垂直度，使用专用工装夹具定位。\",\n        \"轴套端面与板材齐平，不允许凸出或凹陷。\"\n      ],\n      \"estimated_time_minutes\": 10,\n      \"welding\": {\n        \"required\": true,\n        \"welding_type\": \"角焊（定位焊）\",\n        \"welding_method\": \"CO2气保焊/手工电弧焊\",\n        \"weld_size\": \"点焊，沿圆周均匀分布4个焊点\",\n        \"welding_position\": \"零件⑧（轴套）与零件③（侧连接板）的连接处，环形角焊，横焊/立焊\",\n        \"quality_requirements\": \"轴套端面与板材齐平，垂直度偏差小于0.5mm。焊点均匀，防止轴套移位。\",\n        \"safety_notes\": \"轴套焊接时，热量集中，注意控制电流，防止烧穿。使用夹具固定，确保同轴度。\"\n      },\n      \"safety_warnings\": [\n        \"使用专用夹具固定轴套，防止焊接时轴套倾斜或移位\",\n        \"轴套焊接时热量集中，注意控制焊接时间，防止烫伤\",\n        \"确保轴套与板材连接处无油污，防止焊接时产生有毒烟雾\"\n      ]\n    },\n    {\n      \"step_number\": 9,\n      \"action\": \"安装后座轴套（下部）\",\n      \"description\": \"将图纸上标注为9的后座轴套（01.02.02.0490）安装在侧连接板（3）下部的孔位中，确保轴套端面与侧连接板外表面齐平，进行点焊固定。\",\n      \"position_description\": \"后座轴套（9）位于侧连接板（3）下部的孔位。\",\n      \"parts_used\": [\n        {\n          \"bom_seq\": \"9\",\n          \"bom_name\": \"后座轴套 1\",\n          \"quantity\": 1,\n          \"drawing_number\": \"9\",\n          \"node_name\": [\n            \"NAUO15\"\n          ],\n          \"bom_code\": \"01.02.02.0490\"\n        }\n      ],\n      \"tools\": [\n        \"焊机\",\n        \"游标卡尺\"\n      ],\n      \"warnings\": [\n        \"轴套的安装必须保证与侧连接板的垂直度，使用专用工装夹具定位。\",\n        \"轴套端面与板材齐平，不允许凸出或凹陷。\"\n      ],\n      \"estimated_time_minutes\": 10,\n      \"welding\": {\n        \"required\": true,\n        \"welding_type\": \"角焊（定位焊）\",\n        \"welding_method\": \"CO2气保焊/手工电弧焊\",\n        \"weld_size\": \"点焊，沿圆周均匀分布4个焊点\",\n        \"welding_position\": \"零件⑨（后座轴套）与零件③（侧连接板）的连接处，环形角焊，横焊/立焊\",\n        \"quality_requirements\": \"轴套端面与板材齐平，垂直度偏差小于0.5mm。焊点均匀，防止轴套移位。\",\n        \"safety_notes\": \"轴套焊接时，热量集中，注意控制电流，防止烧穿。使用夹具固定，确保同轴度。\"\n      },\n      \"safety_warnings\": [\n        \"使用专用夹具固定轴套，防止焊接时轴套倾斜或移位\",\n        \"轴套焊接时热量集中，注意控制焊接时间，防止烫伤\",\n        \"确保轴套与板材连接处无油污，防止焊接时产生有毒烟雾\"\n      ]\n    },\n    {\n      \"step_number\": 10,\n      \"action\": \"安装后座轴套（折弯板）\",\n      \"description\": \"将图纸上标注为10的后座轴套（01.01.02.0337）安装在折弯板（4）上的孔位中，确保轴套端面与折弯板外表面齐平，进行点焊固定。\",\n      \"position_description\": \"后座轴套（10）位于折弯板（4）的孔位。\",\n      \"parts_used\": [\n        {\n          \"bom_seq\": \"10\",\n          \"bom_name\": \"后座轴套 1\",\n          \"quantity\": 1,\n          \"drawing_number\": \"10\",\n          \"node_name\": [\n            \"NAUO18\"\n          ],\n          \"bom_code\": \"01.01.02.0337\"\n        }\n      ],\n      \"tools\": [\n        \"焊机\",\n        \"游标卡尺\"\n      ],\n      \"warnings\": [\n        \"轴套的安装必须保证与折弯板的垂直度，使用专用工装夹具定位。\",\n        \"轴套端面与板材齐平，不允许凸出或凹陷。\"\n      ],\n      \"estimated_time_minutes\": 10,\n      \"welding\": {\n        \"required\": true,\n        \"welding_type\": \"角焊（定位焊）\",\n        \"welding_method\": \"CO2气保焊/手工电弧焊\",\n        \"weld_size\": \"点焊，沿圆周均匀分布4个焊点\",\n        \"welding_position\": \"零件⑩（后座轴套）与零件④（折弯板）的连接处，环形角焊，平焊\",\n        \"quality_requirements\": \"轴套端面与板材齐平，垂直度偏差小于0.5mm。焊点均匀，防止轴套移位。\",\n        \"safety_notes\": \"轴套焊接时，热量集中，注意控制电流，防止烧穿。使用夹具固定，确保同轴度。\"\n      },\n      \"safety_warnings\": [\n        \"使用专用夹具固定轴套，防止焊接时轴套倾斜或移位\",\n        \"轴套焊接时热量集中，注意控制焊接时间，防止烫伤\",\n        \"确保轴套与板材连接处无油污，防止焊接时产生有毒烟雾\"\n      ]\n    },\n    {\n      \"step_number\": 11,\n      \"action\": \"主体结构满焊\",\n      \"description\": \"对所有已点焊固定的零件（2、3、4、5、6、7、8、9、10）与基准件（1）之间的连接处进行满焊。焊接应按照图纸技术要求进行，遵循对称、分段、短焊缝的原则，以减少焊接变形。\",\n      \"position_description\": \"所有板材和轴套的连接焊缝。\",\n      \"parts_used\": [],\n      \"tools\": [\n        \"焊机（CO2/电弧）\",\n        \"焊接夹具\",\n        \"除渣工具\"\n      ],\n      \"warnings\": [\n        \"严格控制焊接电流和速度，确保焊缝饱满、无气孔、无夹渣。\",\n        \"焊接过程中注意散热和变形控制，必要时使用反变形措施。\",\n        \"轴套与板材的焊接需保证同轴度要求。\"\n      ],\n      \"estimated_time_minutes\": 60,\n      \"welding\": {\n        \"required\": true,\n        \"welding_type\": \"角焊/环形角焊（满焊）\",\n        \"welding_method\": \"CO2气保焊（优先）或手工电弧焊\",\n        \"weld_size\": \"焊脚高度5mm（图纸标注），轴套周围为环形满焊\",\n        \"welding_position\": \"所有连接焊缝，涉及平焊、横焊、立焊\",\n        \"quality_requirements\": \"焊缝连续、饱满，焊脚尺寸符合5mm要求。焊缝表面光滑，无裂纹、未熔合、气孔等缺陷。轴套焊缝需保证同轴度。\",\n        \"safety_notes\": \"进行大面积焊接时，必须佩戴全套防护用品（面罩、手套、防护服）。确保工作区域防火，配备灭火器。采用分段、跳焊方式，控制热应力，防止结构变形和裂纹产生。\"\n      },\n      \"safety_warnings\": [\n        \"必须佩戴全套焊接防护用品（面罩、手套、防护服），防止弧光、飞溅和高温烫伤\",\n        \"采用分段、跳焊方式，控制热应力，防止结构变形和裂纹产生\",\n        \"确保工作区域通风良好，使用局部排烟装置，防止吸入大量焊接烟尘\",\n        \"检查灭火器材是否可用，焊接过程中注意防火，远离易燃物\"\n      ]\n    },\n    {\n      \"step_number\": 12,\n      \"action\": \"焊缝清理与检查\",\n      \"description\": \"对所有焊缝进行清理，去除焊渣和飞溅物。使用角磨机对焊缝进行修整，确保外观平整。\",\n      \"position_description\": \"所有焊缝区域。\",\n      \"parts_used\": [],\n      \"tools\": [\n        \"角磨机\",\n        \"钢丝刷\",\n        \"除渣锤\"\n      ],\n      \"warnings\": [\n        \"清理时注意保护零件表面，避免过度打磨。\",\n        \"检查焊缝是否符合技术要求，特别是轴套周围的焊缝质量。\"\n      ],\n      \"estimated_time_minutes\": 20,\n      \"safety_warnings\": [\n        \"使用角磨机时，必须佩戴防护眼镜和面罩，防止砂轮碎裂和火花飞溅伤人\",\n        \"角磨机操作时必须双手握紧，站稳，防止反弹伤人\",\n        \"清理焊渣时，佩戴防护眼镜，防止焊渣飞溅伤眼\"\n      ]\n    }\n  ]\n}\n```",
  "parsed_result": {
    "enhanced_steps": [
      {
        "step_number": 1,
        "action": "放置基准件",
        "description": "将图纸上标注为1的方形板-机加（01.01.01.11511）平稳放置在装配工作台上，作为整个组件的装配基准。",
        "position_description": "工作台中央，确保水平。",
        "parts_used": [
          {
            "bom_seq": "1",
            "bom_name": "方形板-机加 1",
            "quantity": 1,
            "drawing_number": "1",
            "node_name": [
              "NAUO1"
            ],
            "bom_code": "01.01.01.11511"
          }
        ],
        "tools": [
          "行车（吊具）",
          "水平仪"
        ],
        "warnings": [
          "方形板较重（15.79kg），吊装时注意安全，确保吊具牢固。",
          "基准件必须放置平稳，确保后续装配精度。"
        ],
        "estimated_time_minutes": 5,
        "safety_warnings": [
          "佩戴安全帽和防护手套，防止重物坠落和夹伤",
          "使用行车吊装时，必须由持证司索工指挥，确认吊索具完好",
          "吊装前检查吊具是否捆绑牢固，防止吊物在空中摆动或坠落"
        ]
      },
      {
        "step_number": 2,
        "action": "安装上连接板",
        "description": "将图纸上标注为2的上连接板（01.01.01.11512）放置在基准件（1）的顶部边缘，按照图纸尺寸和位置要求进行定位，并进行点焊固定。",
        "position_description": "上连接板（2）位于方形板（1）的顶部边缘，注意方向和孔位对齐。",
        "parts_used": [
          {
            "bom_seq": "2",
            "bom_name": "上连接板 2",
            "quantity": 1,
            "drawing_number": "2",
            "node_name": [
              "NAUO3",
              "NAUO2"
            ],
            "bom_code": "01.01.01.11512"
          }
        ],
        "tools": [
          "焊机",
          "直角尺",
          "卷尺"
        ],
        "warnings": [
          "点焊前必须确保上连接板与方形板的垂直度符合要求。",
          "点焊位置应避开后续满焊区域。"
        ],
        "estimated_time_minutes": 10,
        "welding": {
          "required": true,
          "welding_type": "角焊（定位焊）",
          "welding_method": "CO2气保焊",
          "weld_size": "点焊，焊点长度约10mm",
          "welding_position": "零件②（上连接板）与零件①（方形板）的连接处，平焊",
          "quality_requirements": "焊点牢固，定位准确，确保垂直度。",
          "safety_notes": "佩戴焊接面罩、防护手套和防护服。确保工作区域通风良好，防止烟尘吸入。"
        },
        "safety_warnings": [
          "佩戴焊接面罩、防护手套和防护服，防止弧光灼伤和烫伤",
          "确保焊机接地良好，电缆绝缘完好，防止触电",
          "焊接区域必须清理干净，周围3米内不得有易燃易爆物品"
        ]
      },
      {
        "step_number": 3,
        "action": "安装侧连接板",
        "description": "将图纸上标注为3的侧连接板（01.01.01.11513）放置在基准件（1）的侧面边缘，并与已安装的上连接板（2）对齐，进行点焊固定。",
        "position_description": "侧连接板（3）位于方形板（1）的侧面，与上连接板（2）形成直角。",
        "parts_used": [
          {
            "bom_seq": "3",
            "bom_name": "侧连接板 2",
            "quantity": 1,
            "drawing_number": "3",
            "node_name": [
              "NAUO5",
              "NAUO4"
            ],
            "bom_code": "01.01.01.11513"
          }
        ],
        "tools": [
          "焊机",
          "直角尺",
          "卡尺"
        ],
        "warnings": [
          "侧连接板较重（24.97kg），安装时注意支撑。",
          "确保侧连接板与方形板、上连接板的相对位置精度。"
        ],
        "estimated_time_minutes": 15,
        "welding": {
          "required": true,
          "welding_type": "角焊（定位焊）",
          "welding_method": "CO2气保焊",
          "weld_size": "点焊，焊点长度约10mm",
          "welding_position": "零件③（侧连接板）与零件①（方形板）的连接处，横焊/平焊；零件③与零件②（上连接板）的连接处，角焊",
          "quality_requirements": "使用直角尺检查垂直度，确保定位准确，焊点均匀分布。",
          "safety_notes": "侧连接板较重，定位时需使用夹具固定。注意防止电缆绊倒，确保接地良好。"
        },
        "safety_warnings": [
          "侧连接板较重，搬运和定位时需两人配合或使用辅助工具，防止砸伤或扭伤",
          "佩戴焊接面罩和防护手套，防止焊接飞溅物烫伤",
          "使用夹具固定工件，防止定位焊时工件倾倒或位移"
        ]
      },
      {
        "step_number": 4,
        "action": "安装折弯板",
        "description": "将图纸上标注为4的折弯板（01.01.01.11514）放置在侧连接板（3）的内侧顶部，按照图纸尺寸定位后进行点焊固定。",
        "position_description": "折弯板（4）位于侧连接板（3）的内侧，靠近上连接板（2）。",
        "parts_used": [
          {
            "bom_seq": "4",
            "bom_name": "折弯板 1",
            "quantity": 1,
            "drawing_number": "4",
            "node_name": [
              "NAUO6"
            ],
            "bom_code": "01.01.01.11514"
          }
        ],
        "tools": [
          "焊机",
          "卷尺"
        ],
        "warnings": [
          "折弯板的定位精度直接影响后续轴套的安装，必须精确对齐。",
          "点焊牢固，防止后续焊接过程中变形。"
        ],
        "estimated_time_minutes": 10,
        "welding": {
          "required": true,
          "welding_type": "角焊（定位焊）",
          "welding_method": "CO2气保焊",
          "weld_size": "点焊，焊点长度约10mm",
          "welding_position": "零件④（折弯板）与零件③（侧连接板）的连接处，平焊/横焊",
          "quality_requirements": "确保折弯板与侧连接板贴合紧密，定位尺寸符合图纸要求。",
          "safety_notes": "在狭小空间内操作时，注意焊枪角度，避免烫伤。检查焊机电缆绝缘是否完好。"
        },
        "safety_warnings": [
          "佩戴防护手套，折弯板边缘可能锋利，防止割伤",
          "在结构内部进行焊接时，注意保持身体姿势稳定，避免焊枪或身体接触高温部件",
          "确保通风良好，防止焊接烟尘在狭小空间内聚集"
        ]
      },
      {
        "step_number": 5,
        "action": "安装油缸固定板",
        "description": "将图纸上标注为5的油缸固定板（01.01.01.11515）安装在侧连接板（3）的指定位置，共4块，按照图纸上的孔位和间距要求进行点焊固定。",
        "position_description": "油缸固定板（5）位于侧连接板（3）的外部，分上下两组，每组两块。",
        "parts_used": [
          {
            "bom_seq": "5",
            "bom_name": "油缸固定板 4",
            "quantity": 4,
            "drawing_number": "5",
            "node_name": [
              "NAUO17",
              "NAUO16",
              "NAUO8",
              "NAUO7"
            ],
            "bom_code": "01.01.01.11515"
          }
        ],
        "tools": [
          "焊机",
          "定位夹具",
          "卷尺"
        ],
        "warnings": [
          "油缸固定板的安装位置和间距必须严格按照图纸要求，使用定位夹具辅助。",
          "注意油缸固定板的方向性。"
        ],
        "estimated_time_minutes": 15,
        "welding": {
          "required": true,
          "welding_type": "角焊（定位焊）",
          "welding_method": "CO2气保焊",
          "weld_size": "点焊，焊点长度约10mm",
          "welding_position": "零件⑤（油缸固定板）与零件③（侧连接板）的连接处，横焊",
          "quality_requirements": "使用定位夹具确保四块板的相对位置精度，焊点牢固。",
          "safety_notes": "定位焊时注意板材边缘锋利，佩戴防护手套。确保焊机参数设置正确，避免烧穿薄板。"
        },
        "safety_warnings": [
          "佩戴防护手套，防止板材边缘割伤",
          "使用定位夹具固定小零件，防止焊接时飞溅或移动",
          "控制焊接电流，避免因热量过大导致板材变形或烧穿"
        ]
      },
      {
        "step_number": 6,
        "action": "安装加强板",
        "description": "将图纸上标注为6的加强板（01.01.01.11516）安装在侧连接板（3）的指定位置，共4块，用于加强结构强度，进行点焊固定。",
        "position_description": "加强板（6）位于侧连接板（3）的外部，靠近油缸固定板（5）。",
        "parts_used": [
          {
            "bom_seq": "6",
            "bom_name": "加强板 4",
            "quantity": 4,
            "drawing_number": "6",
            "node_name": [
              "NAUO12",
              "NAUO11",
              "NAUO10",
              "NAUO9"
            ],
            "bom_code": "01.01.01.11516"
          }
        ],
        "tools": [
          "焊机",
          "直角尺"
        ],
        "warnings": [
          "加强板的安装应确保与侧连接板紧密贴合，无间隙。",
          "点焊应均匀分布，防止应力集中。"
        ],
        "estimated_time_minutes": 10,
        "welding": {
          "required": true,
          "welding_type": "角焊（定位焊）",
          "welding_method": "CO2气保焊",
          "weld_size": "点焊，焊点长度约10mm",
          "welding_position": "零件⑥（加强板）与零件③（侧连接板）的连接处，横焊",
          "quality_requirements": "确保加强板与侧连接板紧密贴合，定位焊点均匀分布，防止后续满焊时变形。",
          "safety_notes": "点焊时注意控制热输入，避免板材局部过热变形。穿戴好防护用品。"
        },
        "safety_warnings": [
          "佩戴防护手套，防止搬运加强板时割伤",
          "点焊时注意控制热输入，防止板材局部过热变形",
          "确保所有防护用品（面罩、手套）穿戴到位"
        ]
      },
      {
        "step_number": 7,
        "action": "安装角钢",
        "description": "将图纸上标注为7的角钢-机加（01.01.04.0592）安装在主体结构的顶部，与上连接板（2）和侧连接板（3）连接处对齐，进行点焊固定。",
        "position_description": "角钢（7）位于组件的顶部，用于连接和加强。",
        "parts_used": [
          {
            "bom_seq": "7",
            "bom_name": "角钢-机加 1",
            "quantity": 1,
            "drawing_number": "7",
            "node_name": [
              "NAUO13"
            ],
            "bom_code": "01.01.04.0592"
          }
        ],
        "tools": [
          "焊机",
          "直角尺"
        ],
        "warnings": [
          "角钢的安装位置必须精确，确保后续装配的平面度。",
          "点焊应牢固，防止在后续操作中移位。"
        ],
        "estimated_time_minutes": 10,
        "welding": {
          "required": true,
          "welding_type": "角焊（定位焊）",
          "welding_method": "CO2气保焊",
          "weld_size": "点焊，焊点长度约10mm",
          "welding_position": "零件⑦（角钢）与零件②（上连接板）和零件③（侧连接板）的连接处，平焊/横焊",
          "quality_requirements": "确保角钢与两块板材的接触面紧密，定位准确。",
          "safety_notes": "角钢边缘可能锋利，操作时注意割伤。点焊后及时清理焊渣，防止飞溅伤人。"
        },
        "safety_warnings": [
          "角钢边缘可能锋利，搬运和定位时必须佩戴防护手套，防止割伤",
          "点焊后及时使用除渣锤清理焊渣，清理时佩戴防护眼镜，防止焊渣飞溅伤眼"
        ]
      },
      {
        "step_number": 8,
        "action": "安装轴套（上部）",
        "description": "将图纸上标注为8的轴套（01.01.02.1221）安装在侧连接板（3）上部的孔位中，确保轴套端面与侧连接板外表面齐平，进行点焊固定。",
        "position_description": "轴套（8）位于侧连接板（3）上部的孔位。",
        "parts_used": [
          {
            "bom_seq": "8",
            "bom_name": "轴套 1",
            "quantity": 1,
            "drawing_number": "8"
          }
        ],
        "tools": [
          "焊机",
          "游标卡尺"
        ],
        "warnings": [
          "轴套的安装必须保证与侧连接板的垂直度，使用专用工装夹具定位。",
          "轴套端面与板材齐平，不允许凸出或凹陷。"
        ],
        "estimated_time_minutes": 10,
        "welding": {
          "required": true,
          "welding_type": "角焊（定位焊）",
          "welding_method": "CO2气保焊/手工电弧焊",
          "weld_size": "点焊，沿圆周均匀分布4个焊点",
          "welding_position": "零件⑧（轴套）与零件③（侧连接板）的连接处，环形角焊，横焊/立焊",
          "quality_requirements": "轴套端面与板材齐平，垂直度偏差小于0.5mm。焊点均匀，防止轴套移位。",
          "safety_notes": "轴套焊接时，热量集中，注意控制电流，防止烧穿。使用夹具固定，确保同轴度。"
        },
        "safety_warnings": [
          "使用专用夹具固定轴套，防止焊接时轴套倾斜或移位",
          "轴套焊接时热量集中，注意控制焊接时间，防止烫伤",
          "确保轴套与板材连接处无油污，防止焊接时产生有毒烟雾"
        ]
      },
      {
        "step_number": 9,
        "action": "安装后座轴套（下部）",
        "description": "将图纸上标注为9的后座轴套（01.02.02.0490）安装在侧连接板（3）下部的孔位中，确保轴套端面与侧连接板外表面齐平，进行点焊固定。",
        "position_description": "后座轴套（9）位于侧连接板（3）下部的孔位。",
        "parts_used": [
          {
            "bom_seq": "9",
            "bom_name": "后座轴套 1",
            "quantity": 1,
            "drawing_number": "9",
            "node_name": [
              "NAUO15"
            ],
            "bom_code": "01.02.02.0490"
          }
        ],
        "tools": [
          "焊机",
          "游标卡尺"
        ],
        "warnings": [
          "轴套的安装必须保证与侧连接板的垂直度，使用专用工装夹具定位。",
          "轴套端面与板材齐平，不允许凸出或凹陷。"
        ],
        "estimated_time_minutes": 10,
        "welding": {
          "required": true,
          "welding_type": "角焊（定位焊）",
          "welding_method": "CO2气保焊/手工电弧焊",
          "weld_size": "点焊，沿圆周均匀分布4个焊点",
          "welding_position": "零件⑨（后座轴套）与零件③（侧连接板）的连接处，环形角焊，横焊/立焊",
          "quality_requirements": "轴套端面与板材齐平，垂直度偏差小于0.5mm。焊点均匀，防止轴套移位。",
          "safety_notes": "轴套焊接时，热量集中，注意控制电流，防止烧穿。使用夹具固定，确保同轴度。"
        },
        "safety_warnings": [
          "使用专用夹具固定轴套，防止焊接时轴套倾斜或移位",
          "轴套焊接时热量集中，注意控制焊接时间，防止烫伤",
          "确保轴套与板材连接处无油污，防止焊接时产生有毒烟雾"
        ]
      },
      {
        "step_number": 10,
        "action": "安装后座轴套（折弯板）",
        "description": "将图纸上标注为10的后座轴套（01.01.02.0337）安装在折弯板（4）上的孔位中，确保轴套端面与折弯板外表面齐平，进行点焊固定。",
        "position_description": "后座轴套（10）位于折弯板（4）的孔位。",
        "parts_used": [
          {
            "bom_seq": "10",
            "bom_name": "后座轴套 1",
            "quantity": 1,
            "drawing_number": "10",
            "node_name": [
              "NAUO18"
            ],
            "bom_code": "01.01.02.0337"
          }
        ],
        "tools": [
          "焊机",
          "游标卡尺"
        ],
        "warnings": [
          "轴套的安装必须保证与折弯板的垂直度，使用专用工装夹具定位。",
          "轴套端面与板材齐平，不允许凸出或凹陷。"
        ],
        "estimated_time_minutes": 10,
        "welding": {
          "required": true,
          "welding_type": "角焊（定位焊）",
          "welding_method": "CO2气保焊/手工电弧焊",
          "weld_size": "点焊，沿圆周均匀分布4个焊点",
          "welding_position": "零件⑩（后座轴套）与零件④（折弯板）的连接处，环形角焊，平焊",
          "quality_requirements": "轴套端面与板材齐平，垂直度偏差小于0.5mm。焊点均匀，防止轴套移位。",
          "safety_notes": "轴套焊接时，热量集中，注意控制电流，防止烧穿。使用夹具固定，确保同轴度。"
        },
        "safety_warnings": [
          "使用专用夹具固定轴套，防止焊接时轴套倾斜或移位",
          "轴套焊接时热量集中，注意控制焊接时间，防止烫伤",
          "确保轴套与板材连接处无油污，防止焊接时产生有毒烟雾"
        ]
      },
      {
        "step_number": 11,
        "action": "主体结构满焊",
        "description": "对所有已点焊固定的零件（2、3、4、5、6、7、8、9、10）与基准件（1）之间的连接处进行满焊。焊接应按照图纸技术要求进行，遵循对称、分段、短焊缝的原则，以减少焊接变形。",
        "position_description": "所有板材和轴套的连接焊缝。",
        "parts_used": [],
        "tools": [
          "焊机（CO2/电弧）",
          "焊接夹具",
          "除渣工具"
        ],
        "warnings": [
          "严格控制焊接电流和速度，确保焊缝饱满、无气孔、无夹渣。",
          "焊接过程中注意散热和变形控制，必要时使用反变形措施。",
          "轴套与板材的焊接需保证同轴度要求。"
        ],
        "estimated_time_minutes": 60,
        "welding": {
          "required": true,
          "welding_type": "角焊/环形角焊（满焊）",
          "welding_method": "CO2气保焊（优先）或手工电弧焊",
          "weld_size": "焊脚高度5mm（图纸标注），轴套周围为环形满焊",
          "welding_position": "所有连接焊缝，涉及平焊、横焊、立焊",
          "quality_requirements": "焊缝连续、饱满，焊脚尺寸符合5mm要求。焊缝表面光滑，无裂纹、未熔合、气孔等缺陷。轴套焊缝需保证同轴度。",
          "safety_notes": "进行大面积焊接时，必须佩戴全套防护用品（面罩、手套、防护服）。确保工作区域防火，配备灭火器。采用分段、跳焊方式，控制热应力，防止结构变形和裂纹产生。"
        },
        "safety_warnings": [
          "必须佩戴全套焊接防护用品（面罩、手套、防护服），防止弧光、飞溅和高温烫伤",
          "采用分段、跳焊方式，控制热应力，防止结构变形和裂纹产生",
          "确保工作区域通风良好，使用局部排烟装置，防止吸入大量焊接烟尘",
          "检查灭火器材是否可用，焊接过程中注意防火，远离易燃物"
        ]
      },
      {
        "step_number": 12,
        "action": "焊缝清理与检查",
        "description": "对所有焊缝进行清理，去除焊渣和飞溅物。使用角磨机对焊缝进行修整，确保外观平整。",
        "position_description": "所有焊缝区域。",
        "parts_used": [],
        "tools": [
          "角磨机",
          "钢丝刷",
          "除渣锤"
        ],
        "warnings": [
          "清理时注意保护零件表面，避免过度打磨。",
          "检查焊缝是否符合技术要求，特别是轴套周围的焊缝质量。"
        ],
        "estimated_time_minutes": 20,
        "safety_warnings": [
          "使用角磨机时，必须佩戴防护眼镜和面罩，防止砂轮碎裂和火花飞溅伤人",
          "角磨机操作时必须双手握紧，站稳，防止反弹伤人",
          "清理焊渣时，佩戴防护眼镜，防止焊渣飞溅伤眼"
        ]
      }
    ]
  }
}