{
  "agent_name": "Agent6_FAQ",
  "model": "google/gemini-2.5-flash-preview-09-2025",
  "timestamp": "20251005_005315",
  "image_count": 0,
  "temperature": 0.2,
  "system_prompt": "你是安全工程师李师傅，拥有20年安全管理经验。\n\n你的任务：为每个装配步骤添加安全警告（如果该步骤有安全风险）。\n\n## 核心原则\n\n1. **安全第一**：识别所有潜在的安全风险\n2. **嵌入警告**：为有风险的步骤添加safety_warnings字段\n3. **工人友好**：使用通俗语言，避免专业术语\n\n## 输出格式\n\n严格按照以下JSON格式输出（返回增强后的装配步骤）：\n\n```json\n{\n  \"enhanced_steps\": [\n    {\n      \"step_number\": 1,\n      \"title\": \"步骤标题\",\n      \"parts_used\": [...],\n      \"tools_required\": [...],\n      \"operation\": \"操作说明\",\n      \"quality_check\": \"质量检查\",\n      \"estimated_time_minutes\": 10,\n      \"welding\": {...},\n      \"safety_warnings\": [\n        \"佩戴安全帽和防护眼镜\",\n        \"确保工件固定牢固\",\n        \"注意防止烫伤\"\n      ]\n    }\n  ]\n}\n```\n\n**⚠️ 重要**：\n- 如果步骤没有安全风险，不要添加safety_warnings字段\n- 如果步骤有安全风险，safety_warnings必须是字符串数组\n- 保持原有步骤的所有字段不变，只添加safety_warnings字段\n\n## 重要提醒\n\n- **只输出JSON，不要输出其他内容**\n- **安全警告要具体**：说明具体的风险和预防措施\n- **使用通俗语言**：工人能看懂的语言\n",
  "user_query": "请为以下装配步骤添加安全警告（如果有安全风险）。\n\n## 装配步骤\n\n[\n  {\n    \"step_number\": 1,\n    \"action\": \"安装基准件\",\n    \"description\": \"将图纸上标注为2的连接板 1（01.01.01.11509）平放在焊接工装上作为基准件，确保定位准确。\",\n    \"position_description\": \"平放于工装台面，定位孔对齐工装销。\",\n    \"parts_used\": [\n      {\n        \"bom_code\": \"01.01.01.11509\",\n        \"bom_name\": \"连接板 1\",\n        \"quantity\": 1,\n        \"drawing_number\": \"2\",\n        \"mesh_id\": [\n          \"mesh_018\"\n        ]\n      }\n    ],\n    \"tools\": [\n      \"焊接工装\",\n      \"定位销\"\n    ],\n    \"warnings\": [\n      \"确保连接板定位准确，防止后续焊接变形。\"\n    ],\n    \"estimated_time_minutes\": 5\n  },\n  {\n    \"step_number\": 2,\n    \"action\": \"安装并点焊矩形管 1\",\n    \"description\": \"将图纸上标注为1的矩形管 1（01.01.03.2718）放置在连接板 2 的一侧，根据图纸尺寸（如1120mm长度方向）定位，并进行点焊固定。\",\n    \"position_description\": \"矩形管 1 位于连接板 2 的长边一侧。\",\n    \"parts_used\": [\n      {\n        \"bom_code\": \"01.01.03.2718\",\n        \"bom_name\": \"矩形管 1\",\n        \"quantity\": 1,\n        \"drawing_number\": \"1\"\n      }\n    ],\n    \"tools\": [\n      \"焊机\",\n      \"卡尺\",\n      \"直角尺\"\n    ],\n    \"warnings\": [\n      \"点焊位置要牢固，但不能影响后续满焊。\"\n    ],\n    \"estimated_time_minutes\": 10,\n    \"welding\": {\n      \"required\": true,\n      \"welding_type\": \"点焊（临时固定）\",\n      \"welding_method\": \"CO2气保焊\",\n      \"weld_size\": \"点焊长度10-15mm，共4点\",\n      \"welding_position\": \"矩形管 1 与连接板 2 的接触面\",\n      \"quality_requirements\": \"定位准确，焊点牢固，防止装配过程中移位。\",\n      \"safety_notes\": \"佩戴防护手套和面罩，注意防飞溅。\"\n    }\n  },\n  {\n    \"step_number\": 3,\n    \"action\": \"安装并点焊矩形管 2\",\n    \"description\": \"将图纸上标注为6的矩形管 2（01.01.03.2719）放置在连接板 2 的另一侧，与矩形管 1 对称，根据图纸尺寸（如335mm长度方向）定位，并进行点焊固定。\",\n    \"position_description\": \"矩形管 2 位于连接板 2 的另一长边一侧。\",\n    \"parts_used\": [\n      {\n        \"bom_code\": \"01.01.03.2719\",\n        \"bom_name\": \"矩形管 2\",\n        \"quantity\": 2,\n        \"drawing_number\": \"6\"\n      }\n    ],\n    \"tools\": [\n      \"焊机\",\n      \"卡尺\",\n      \"直角尺\"\n    ],\n    \"warnings\": [\n      \"注意矩形管 2 的数量是2个，需对称安装。\"\n    ],\n    \"estimated_time_minutes\": 15,\n    \"welding\": {\n      \"required\": true,\n      \"welding_type\": \"点焊（临时固定）\",\n      \"welding_method\": \"CO2气保焊\",\n      \"weld_size\": \"点焊长度10-15mm，每根管共4点\",\n      \"welding_position\": \"矩形管 6 与连接板 2 的接触面\",\n      \"quality_requirements\": \"确保两根矩形管 6 与矩形管 1 平行且对称。\",\n      \"safety_notes\": \"检查接地线是否牢固，防止触电。\"\n    }\n  },\n  {\n    \"step_number\": 4,\n    \"action\": \"安装并点焊矩形管 1 (970mm)\",\n    \"description\": \"将图纸上标注为8的矩形管 1（01.01.03.2720）放置在连接板 2 的中间位置，作为横向支撑，根据图纸尺寸（如970mm长度方向）定位，并进行点焊固定。\",\n    \"position_description\": \"矩形管 8 位于连接板 2 的中间，垂直于矩形管 1 和 6。\",\n    \"parts_used\": [\n      {\n        \"bom_code\": \"01.01.03.2720\",\n        \"bom_name\": \"矩形管 1\",\n        \"quantity\": 1,\n        \"drawing_number\": \"8\",\n        \"mesh_id\": [\n          \"mesh_003\",\n          \"mesh_006\",\n          \"mesh_007\",\n          \"mesh_019\"\n        ]\n      }\n    ],\n    \"tools\": [\n      \"焊机\",\n      \"卷尺\"\n    ],\n    \"warnings\": [\n      \"确保矩形管 8 与连接板 2 垂直，且与两侧矩形管平行。\"\n    ],\n    \"estimated_time_minutes\": 8,\n    \"welding\": {\n      \"required\": true,\n      \"welding_type\": \"点焊（临时固定）\",\n      \"welding_method\": \"CO2气保焊\",\n      \"weld_size\": \"点焊长度10-15mm，共4点\",\n      \"welding_position\": \"矩形管 8 与连接板 2 的接触面\",\n      \"quality_requirements\": \"检查垂直度，确保横向支撑到位。\",\n      \"safety_notes\": \"清理焊接区域的油污和杂物，防止产生有毒烟雾。\"\n    }\n  },\n  {\n    \"step_number\": 5,\n    \"action\": \"安装并点焊右挂件\",\n    \"description\": \"将图纸上标注为4的右挂件虚拟组件 1（01.05.0018）安装在矩形管 6 的一端，根据图纸尺寸定位，并进行点焊固定。\",\n    \"position_description\": \"右挂件 4 安装在矩形管 6 的右侧端部。\",\n    \"parts_used\": [\n      {\n        \"bom_code\": \"01.05.0018\",\n        \"bom_name\": \"右挂件虚拟组件 1\",\n        \"quantity\": 1,\n        \"drawing_number\": \"4\",\n        \"mesh_id\": [\n          \"mesh_008\",\n          \"mesh_011\"\n        ]\n      }\n    ],\n    \"tools\": [\n      \"焊机\",\n      \"定位夹具\"\n    ],\n    \"warnings\": [\n      \"挂件的安装方向和角度必须符合图纸要求，确保挂钩朝向正确。\"\n    ],\n    \"estimated_time_minutes\": 12,\n    \"welding\": {\n      \"required\": true,\n      \"welding_type\": \"点焊（临时固定）\",\n      \"welding_method\": \"CO2气保焊\",\n      \"weld_size\": \"点焊长度10mm，共2点\",\n      \"welding_position\": \"右挂件 4 与矩形管 6 的接触面\",\n      \"quality_requirements\": \"挂件定位准确，不能歪斜。\",\n      \"safety_notes\": \"使用夹具固定挂件，防止焊接时掉落或移位。\"\n    }\n  },\n  {\n    \"step_number\": 6,\n    \"action\": \"安装并点焊左挂件\",\n    \"description\": \"将图纸上标注为5的左挂件虚拟组件 1（01.05.0019）安装在矩形管 6 的另一端，与右挂件对称，根据图纸尺寸定位，并进行点焊固定。\",\n    \"position_description\": \"左挂件 5 安装在矩形管 6 的左侧端部。\",\n    \"parts_used\": [\n      {\n        \"bom_code\": \"01.05.0019\",\n        \"bom_name\": \"左挂件虚拟组件 1\",\n        \"quantity\": 1,\n        \"drawing_number\": \"5\",\n        \"mesh_id\": [\n          \"mesh_009\",\n          \"mesh_010\",\n          \"mesh_012\",\n          \"mesh_013\"\n        ]\n      }\n    ],\n    \"tools\": [\n      \"焊机\",\n      \"定位夹具\"\n    ],\n    \"warnings\": [\n      \"检查左右挂件的中心距是否符合图纸要求。\"\n    ],\n    \"estimated_time_minutes\": 12,\n    \"welding\": {\n      \"required\": true,\n      \"welding_type\": \"点焊（临时固定）\",\n      \"welding_method\": \"CO2气保焊\",\n      \"weld_size\": \"点焊长度10mm，共2点\",\n      \"welding_position\": \"左挂件 5 与矩形管 6 的接触面\",\n      \"quality_requirements\": \"确保左右挂件对称，中心距符合要求。\",\n      \"safety_notes\": \"焊接前检查工件是否稳定，防止倾倒。\"\n    }\n  },\n  {\n    \"step_number\": 7,\n    \"action\": \"安装并点焊方形板\",\n    \"description\": \"将图纸上标注为3的方形板-机加 4（01.01.01.6589）安装在矩形管 1 和 6 的端部，用于封堵和加强，根据图纸定位，并进行点焊固定。\",\n    \"position_description\": \"方形板 3 安装在矩形管 1 和 6 的四个端面。\",\n    \"parts_used\": [\n      {\n        \"bom_code\": \"01.01.01.6589\",\n        \"bom_name\": \"方形板-机加 4\",\n        \"quantity\": 4,\n        \"drawing_number\": \"3\",\n        \"mesh_id\": [\n          \"mesh_014\",\n          \"mesh_015\",\n          \"mesh_016\",\n          \"mesh_017\"\n        ]\n      }\n    ],\n    \"tools\": [\n      \"焊机\",\n      \"磁力夹\"\n    ],\n    \"warnings\": [\n      \"方形板需与矩形管端面齐平，确保焊接质量。\"\n    ],\n    \"estimated_time_minutes\": 15,\n    \"welding\": {\n      \"required\": true,\n      \"welding_type\": \"点焊（临时固定）\",\n      \"welding_method\": \"CO2气保焊\",\n      \"weld_size\": \"点焊长度10mm，每块板共4点\",\n      \"welding_position\": \"方形板 3 与矩形管端面的接触面\",\n      \"quality_requirements\": \"板面与管端面齐平，无错位。\",\n      \"safety_notes\": \"使用磁力夹固定，防止焊接时板材移动。\"\n    }\n  },\n  {\n    \"step_number\": 8,\n    \"action\": \"安装并点焊封板\",\n    \"description\": \"将图纸上标注为7的封板 2（01.01.01.16608）安装在组件的顶部，覆盖矩形管 1 和 6 之间的空间，根据图纸尺寸定位，并进行点焊固定。\",\n    \"position_description\": \"封板 7 位于组件的顶部，覆盖在矩形管 1 和 6 上方。\",\n    \"parts_used\": [\n      {\n        \"bom_code\": \"01.01.01.16608\",\n        \"bom_name\": \"封板 2\",\n        \"quantity\": 2,\n        \"drawing_number\": \"7\",\n        \"mesh_id\": [\n          \"mesh_004\",\n          \"mesh_005\"\n        ]\n      }\n    ],\n    \"tools\": [\n      \"焊机\",\n      \"压紧夹具\"\n    ],\n    \"warnings\": [\n      \"封板与矩形管的接触面必须紧密贴合，防止虚焊。\"\n    ],\n    \"estimated_time_minutes\": 10,\n    \"welding\": {\n      \"required\": true,\n      \"welding_type\": \"点焊（临时固定）\",\n      \"welding_method\": \"CO2气保焊\",\n      \"weld_size\": \"点焊长度10-15mm，每块板共4点\",\n      \"welding_position\": \"封板 7 与矩形管 1 和 6 的上表面\",\n      \"quality_requirements\": \"封板与矩形管贴合紧密，无缝隙。\",\n      \"safety_notes\": \"注意封板边缘可能锋利，操作时戴好手套。\"\n    }\n  },\n  {\n    \"step_number\": 9,\n    \"action\": \"安装并点焊加强筋\",\n    \"description\": \"将图纸上标注为9的加强筋 2（01.01.01.17678）安装在连接板 2 和矩形管 1/6 之间，用于结构加强，根据图纸定位，并进行点焊固定。\",\n    \"position_description\": \"加强筋 9 位于连接板 2 和矩形管 1/6 的内侧，呈斜角支撑。\",\n    \"parts_used\": [\n      {\n        \"bom_code\": \"01.01.01.17678\",\n        \"bom_name\": \"加强筋 2\",\n        \"quantity\": 2,\n        \"drawing_number\": \"9\",\n        \"mesh_id\": [\n          \"mesh_001\",\n          \"mesh_002\"\n        ]\n      }\n    ],\n    \"tools\": [\n      \"焊机\",\n      \"角度尺\"\n    ],\n    \"warnings\": [\n      \"加强筋的安装角度和位置必须准确，确保受力均匀。\"\n    ],\n    \"estimated_time_minutes\": 10,\n    \"welding\": {\n      \"required\": true,\n      \"welding_type\": \"点焊（临时固定）\",\n      \"welding_method\": \"CO2气保焊\",\n      \"weld_size\": \"点焊长度10mm，每根筋共4点\",\n      \"welding_position\": \"加强筋 9 与连接板 2 和矩形管 1/6 的接触边\",\n      \"quality_requirements\": \"加强筋与两零件贴合紧密，角度正确。\",\n      \"safety_notes\": \"由于加强筋位置较深，注意焊枪角度，避免烫伤。\"\n    }\n  },\n  {\n    \"step_number\": 10,\n    \"action\": \"满焊固定\",\n    \"description\": \"对所有已点焊的零件（矩形管 1、6、8，挂件 4、5，方形板 3，封板 7，加强筋 9）与连接板 2 的连接处进行满焊。焊接要求参照图纸技术要求1和2。\",\n    \"position_description\": \"所有连接面。\",\n    \"parts_used\": [],\n    \"tools\": [\n      \"焊机\",\n      \"焊条/焊丝\",\n      \"焊渣锤\"\n    ],\n    \"warnings\": [\n      \"注意焊接顺序，采用对称焊接，减少热变形。焊缝必须饱满、无虚焊、无漏焊。\"\n    ],\n    \"estimated_time_minutes\": 60,\n    \"welding\": {\n      \"required\": true,\n      \"welding_type\": \"角焊/满焊\",\n      \"welding_method\": \"CO2气保焊\",\n      \"weld_size\": \"焊脚高度6mm（或按图纸要求），所有连接边满焊\",\n      \"welding_position\": \"所有零件（1, 6, 8, 3, 4, 5, 7, 9）与连接板 2 的连接处\",\n      \"quality_requirements\": \"焊缝连续、均匀、饱满，无咬边、气孔、裂纹等缺陷。焊后清理焊渣。\",\n      \"safety_notes\": \"大面积焊接时，确保工作区域通风良好，防止烟尘中毒。注意控制热输入，防止工件严重变形。\"\n    }\n  },\n  {\n    \"step_number\": 11,\n    \"action\": \"焊后清理与校正\",\n    \"description\": \"清理所有焊渣和飞溅物。检查组件整体尺寸和平面度，如有变形，进行校正。\",\n    \"position_description\": \"整个组件。\",\n    \"parts_used\": [],\n    \"tools\": [\n      \"角磨机\",\n      \"钢丝刷\",\n      \"校正平台\",\n      \"大锤\"\n    ],\n    \"warnings\": [\n      \"校正时注意力度，避免二次损伤。锐边/尖角需倒钝处理。\"\n    ],\n    \"estimated_time_minutes\": 20\n  }\n]\n\n## 要求\n\n1. **识别风险步骤**：判断哪些步骤有安全风险（吊装、焊接、高空作业、重物搬运等）\n2. **添加安全警告**：为有风险的步骤添加safety_warnings字段\n3. **保持原有字段**：不要修改或删除原有的字段（step_number、title、welding等）\n4. **使用通俗语言**：工人能看懂的语言\n5. **警告要具体**：说明具体的风险和预防措施\n\n## 自检清单\n\n- [ ] 所有有风险的步骤都添加了safety_warnings字段\n- [ ] safety_warnings是字符串数组，每条警告简洁明了\n- [ ] 原有步骤的所有字段都保持不变\n- [ ] 没有风险的步骤没有添加safety_warnings字段\n\n现在开始为装配步骤添加安全警告！\n",
  "raw_response": "```json\n{\n  \"enhanced_steps\": [\n    {\n      \"step_number\": 1,\n      \"action\": \"安装基准件\",\n      \"description\": \"将图纸上标注为2的连接板 1（01.01.01.11509）平放在焊接工装上作为基准件，确保定位准确。\",\n      \"position_description\": \"平放于工装台面，定位孔对齐工装销。\",\n      \"parts_used\": [\n        {\n          \"bom_code\": \"01.01.01.11509\",\n          \"bom_name\": \"连接板 1\",\n          \"quantity\": 1,\n          \"drawing_number\": \"2\",\n          \"mesh_id\": [\n            \"mesh_018\"\n          ]\n        }\n      ],\n      \"tools\": [\n        \"焊接工装\",\n        \"定位销\"\n      ],\n      \"warnings\": [\n        \"确保连接板定位准确，防止后续焊接变形。\"\n      ],\n      \"estimated_time_minutes\": 5\n    },\n    {\n      \"step_number\": 2,\n      \"action\": \"安装并点焊矩形管 1\",\n      \"description\": \"将图纸上标注为1的矩形管 1（01.01.03.2718）放置在连接板 2 的一侧，根据图纸尺寸（如1120mm长度方向）定位，并进行点焊固定。\",\n      \"position_description\": \"矩形管 1 位于连接板 2 的长边一侧。\",\n      \"parts_used\": [\n        {\n          \"bom_code\": \"01.01.03.2718\",\n          \"bom_name\": \"矩形管 1\",\n          \"quantity\": 1,\n          \"drawing_number\": \"1\"\n        }\n      ],\n      \"tools\": [\n        \"焊机\",\n        \"卡尺\",\n        \"直角尺\"\n      ],\n      \"warnings\": [\n        \"点焊位置要牢固，但不能影响后续满焊。\"\n      ],\n      \"estimated_time_minutes\": 10,\n      \"welding\": {\n        \"required\": true,\n        \"welding_type\": \"点焊（临时固定）\",\n        \"welding_method\": \"CO2气保焊\",\n        \"weld_size\": \"点焊长度10-15mm，共4点\",\n        \"welding_position\": \"矩形管 1 与连接板 2 的接触面\",\n        \"quality_requirements\": \"定位准确，焊点牢固，防止装配过程中移位。\",\n        \"safety_notes\": \"佩戴防护手套和面罩，注意防飞溅。\"\n      },\n      \"safety_warnings\": [\n        \"进行点焊作业时，必须佩戴焊接面罩、防护手套和工作服，防止弧光伤眼和烫伤。\",\n        \"确保工作区域通风良好，避免吸入焊接烟尘。\",\n        \"检查焊机接地线是否连接可靠，防止触电。\"\n      ]\n    },\n    {\n      \"step_number\": 3,\n      \"action\": \"安装并点焊矩形管 2\",\n      \"description\": \"将图纸上标注为6的矩形管 2（01.01.03.2719）放置在连接板 2 的另一侧，与矩形管 1 对称，根据图纸尺寸（如335mm长度方向）定位，并进行点焊固定。\",\n      \"position_description\": \"矩形管 2 位于连接板 2 的另一长边一侧。\",\n      \"parts_used\": [\n        {\n          \"bom_code\": \"01.01.03.2719\",\n          \"bom_name\": \"矩形管 2\",\n          \"quantity\": 2,\n          \"drawing_number\": \"6\"\n        }\n      ],\n      \"tools\": [\n        \"焊机\",\n        \"卡尺\",\n        \"直角尺\"\n      ],\n      \"warnings\": [\n        \"注意矩形管 2 的数量是2个，需对称安装。\"\n      ],\n      \"estimated_time_minutes\": 15,\n      \"welding\": {\n        \"required\": true,\n        \"welding_type\": \"点焊（临时固定）\",\n        \"welding_method\": \"CO2气保焊\",\n        \"weld_size\": \"点焊长度10-15mm，每根管共4点\",\n        \"welding_position\": \"矩形管 6 与连接板 2 的接触面\",\n        \"quality_requirements\": \"确保两根矩形管 6 与矩形管 1 平行且对称。\",\n        \"safety_notes\": \"检查接地线是否牢固，防止触电。\"\n      },\n      \"safety_warnings\": [\n        \"焊接时注意周围环境，防止火花飞溅引燃周围物品。\",\n        \"佩戴好个人防护用品（焊接面罩、手套），避免弧光和高温伤害。\",\n        \"确认焊机电源线和气管无破损，避免漏电或漏气。\"\n      ]\n    },\n    {\n      \"step_number\": 4,\n      \"action\": \"安装并点焊矩形管 1 (970mm)\",\n      \"description\": \"将图纸上标注为8的矩形管 1（01.01.03.2720）放置在连接板 2 的中间位置，作为横向支撑，根据图纸尺寸（如970mm长度方向）定位，并进行点焊固定。\",\n      \"position_description\": \"矩形管 8 位于连接板 2 的中间，垂直于矩形管 1 和 6。\",\n      \"parts_used\": [\n        {\n          \"bom_code\": \"01.01.03.2720\",\n          \"bom_name\": \"矩形管 1\",\n          \"quantity\": 1,\n          \"drawing_number\": \"8\",\n          \"mesh_id\": [\n            \"mesh_003\",\n            \"mesh_006\",\n            \"mesh_007\",\n            \"mesh_019\"\n          ]\n        }\n      ],\n      \"tools\": [\n        \"焊机\",\n        \"卷尺\"\n      ],\n      \"warnings\": [\n        \"确保矩形管 8 与连接板 2 垂直，且与两侧矩形管平行。\"\n      ],\n      \"estimated_time_minutes\": 8,\n      \"welding\": {\n        \"required\": true,\n        \"welding_type\": \"点焊（临时固定）\",\n        \"welding_method\": \"CO2气保焊\",\n        \"weld_size\": \"点焊长度10-15mm，共4点\",\n        \"welding_position\": \"矩形管 8 与连接板 2 的接触面\",\n        \"quality_requirements\": \"检查垂直度，确保横向支撑到位。\",\n        \"safety_notes\": \"清理焊接区域的油污和杂物，防止产生有毒烟雾。\"\n      },\n      \"safety_warnings\": [\n        \"焊接前必须彻底清理工件表面的油污、锈迹和杂物，否则焊接时会产生大量有毒烟雾，影响健康。\",\n        \"保持身体与焊枪的安全距离，防止高温灼伤。\"\n      ]\n    },\n    {\n      \"step_number\": 5,\n      \"action\": \"安装并点焊右挂件\",\n      \"description\": \"将图纸上标注为4的右挂件虚拟组件 1（01.05.0018）安装在矩形管 6 的一端，根据图纸尺寸定位，并进行点焊固定。\",\n      \"position_description\": \"右挂件 4 安装在矩形管 6 的右侧端部。\",\n      \"parts_used\": [\n        {\n          \"bom_code\": \"01.05.0018\",\n          \"bom_name\": \"右挂件虚拟组件 1\",\n          \"quantity\": 1,\n          \"drawing_number\": \"4\",\n          \"mesh_id\": [\n            \"mesh_008\",\n            \"mesh_011\"\n          ]\n        }\n      ],\n      \"tools\": [\n        \"焊机\",\n        \"定位夹具\"\n      ],\n      \"warnings\": [\n        \"挂件的安装方向和角度必须符合图纸要求，确保挂钩朝向正确。\"\n      ],\n      \"estimated_time_minutes\": 12,\n      \"welding\": {\n        \"required\": true,\n        \"welding_type\": \"点焊（临时固定）\",\n        \"welding_method\": \"CO2气保焊\",\n        \"weld_size\": \"点焊长度10mm，共2点\",\n        \"welding_position\": \"右挂件 4 与矩形管 6 的接触面\",\n        \"quality_requirements\": \"挂件定位准确，不能歪斜。\",\n        \"safety_notes\": \"使用夹具固定挂件，防止焊接时掉落或移位。\"\n      },\n      \"safety_warnings\": [\n        \"使用夹具固定小型零件时，要确保夹紧力足够，防止零件在焊接过程中弹飞伤人。\",\n        \"焊接完成后，不要立即用手触摸工件，防止烫伤。\"\n      ]\n    },\n    {\n      \"step_number\": 6,\n      \"action\": \"安装并点焊左挂件\",\n      \"description\": \"将图纸上标注为5的左挂件虚拟组件 1（01.05.0019）安装在矩形管 6 的另一端，与右挂件对称，根据图纸尺寸定位，并进行点焊固定。\",\n      \"position_description\": \"左挂件 5 安装在矩形管 6 的左侧端部。\",\n      \"parts_used\": [\n        {\n          \"bom_code\": \"01.05.0019\",\n          \"bom_name\": \"左挂件虚拟组件 1\",\n          \"quantity\": 1,\n          \"drawing_number\": \"5\",\n          \"mesh_id\": [\n            \"mesh_009\",\n            \"mesh_010\",\n            \"mesh_012\",\n            \"mesh_013\"\n          ]\n        }\n      ],\n      \"tools\": [\n        \"焊机\",\n        \"定位夹具\"\n      ],\n      \"warnings\": [\n        \"检查左右挂件的中心距是否符合图纸要求。\"\n      ],\n      \"estimated_time_minutes\": 12,\n      \"welding\": {\n        \"required\": true,\n        \"welding_type\": \"点焊（临时固定）\",\n        \"welding_method\": \"CO2气保焊\",\n        \"weld_size\": \"点焊长度10mm，共2点\",\n        \"welding_position\": \"左挂件 5 与矩形管 6 的接触面\",\n        \"quality_requirements\": \"确保左右挂件对称，中心距符合要求。\",\n        \"safety_notes\": \"焊接前检查工件是否稳定，防止倾倒。\"\n      },\n      \"safety_warnings\": [\n        \"焊接前务必确认工件在工装上放置平稳，防止在操作过程中倾倒或滑落。\",\n        \"注意焊枪电缆和气管的走向，避免被绊倒或被高温工件烫伤。\"\n      ]\n    },\n    {\n      \"step_number\": 7,\n      \"action\": \"安装并点焊方形板\",\n      \"description\": \"将图纸上标注为3的方形板-机加 4（01.01.01.6589）安装在矩形管 1 和 6 的端部，用于封堵和加强，根据图纸定位，并进行点焊固定。\",\n      \"position_description\": \"方形板 3 安装在矩形管 1 和 6 的四个端面。\",\n      \"parts_used\": [\n        {\n          \"bom_code\": \"01.01.01.6589\",\n          \"bom_name\": \"方形板-机加 4\",\n          \"quantity\": 4,\n          \"drawing_number\": \"3\",\n          \"mesh_id\": [\n            \"mesh_014\",\n            \"mesh_015\",\n            \"mesh_016\",\n            \"mesh_017\"\n          ]\n        }\n      ],\n      \"tools\": [\n        \"焊机\",\n        \"磁力夹\"\n      ],\n      \"warnings\": [\n        \"方形板需与矩形管端面齐平，确保焊接质量。\"\n      ],\n      \"estimated_time_minutes\": 15,\n      \"welding\": {\n        \"required\": true,\n        \"welding_type\": \"点焊（临时固定）\",\n        \"welding_method\": \"CO2气保焊\",\n        \"weld_size\": \"点焊长度10mm，每块板共4点\",\n        \"welding_position\": \"方形板 3 与矩形管端面的接触面\",\n        \"quality_requirements\": \"板面与管端面齐平，无错位。\",\n        \"safety_notes\": \"使用磁力夹固定，防止焊接时板材移动。\"\n      },\n      \"safety_warnings\": [\n        \"使用磁力夹时，确保磁力夹牢固吸附，防止零件在焊接过程中脱落。\",\n        \"注意方形板边缘可能锋利，搬运和安装时请佩戴防割手套。\"\n      ]\n    },\n    {\n      \"step_number\": 8,\n      \"action\": \"安装并点焊封板\",\n      \"description\": \"将图纸上标注为7的封板 2（01.01.01.16608）安装在组件的顶部，覆盖矩形管 1 和 6 之间的空间，根据图纸尺寸定位，并进行点焊固定。\",\n      \"position_description\": \"封板 7 位于组件的顶部，覆盖在矩形管 1 和 6 上方。\",\n      \"parts_used\": [\n        {\n          \"bom_code\": \"01.01.01.16608\",\n          \"bom_name\": \"封板 2\",\n          \"quantity\": 2,\n          \"drawing_number\": \"7\",\n          \"mesh_id\": [\n            \"mesh_004\",\n            \"mesh_005\"\n          ]\n        }\n      ],\n      \"tools\": [\n        \"焊机\",\n        \"压紧夹具\"\n      ],\n      \"warnings\": [\n        \"封板与矩形管的接触面必须紧密贴合，防止虚焊。\"\n      ],\n      \"estimated_time_minutes\": 10,\n      \"welding\": {\n        \"required\": true,\n        \"welding_type\": \"点焊（临时固定）\",\n        \"welding_method\": \"CO2气保焊\",\n        \"weld_size\": \"点焊长度10-15mm，每块板共4点\",\n        \"welding_position\": \"封板 7 与矩形管 1 和 6 的上表面\",\n        \"quality_requirements\": \"封板与矩形管贴合紧密，无缝隙。\",\n        \"safety_notes\": \"注意封板边缘可能锋利，操作时戴好手套。\"\n      },\n      \"safety_warnings\": [\n        \"封板边缘可能存在毛刺或尖锐，操作时必须佩戴防割手套，防止划伤。\",\n        \"使用压紧夹具时，注意夹具的稳定性，防止工件在焊接时松动。\"\n      ]\n    },\n    {\n      \"step_number\": 9,\n      \"action\": \"安装并点焊加强筋\",\n      \"description\": \"将图纸上标注为9的加强筋 2（01.01.01.17678）安装在连接板 2 和矩形管 1/6 之间，用于结构加强，根据图纸定位，并进行点焊固定。\",\n      \"position_description\": \"加强筋 9 位于连接板 2 和矩形管 1/6 的内侧，呈斜角支撑。\",\n      \"parts_used\": [\n        {\n          \"bom_code\": \"01.01.01.17678\",\n          \"bom_name\": \"加强筋 2\",\n          \"quantity\": 2,\n          \"drawing_number\": \"9\",\n          \"mesh_id\": [\n            \"mesh_001\",\n            \"mesh_002\"\n          ]\n        }\n      ],\n      \"tools\": [\n        \"焊机\",\n        \"角度尺\"\n      ],\n      \"warnings\": [\n        \"加强筋的安装角度和位置必须准确，确保受力均匀。\"\n      ],\n      \"estimated_time_minutes\": 10,\n      \"welding\": {\n        \"required\": true,\n        \"welding_type\": \"点焊（临时固定）\",\n        \"welding_method\": \"CO2气保焊\",\n        \"weld_size\": \"点焊长度10mm，每根筋共4点\",\n        \"welding_position\": \"加强筋 9 与连接板 2 和矩形管 1/6 的接触边\",\n        \"quality_requirements\": \"加强筋与两零件贴合紧密，角度正确。\",\n        \"safety_notes\": \"由于加强筋位置较深，注意焊枪角度，避免烫伤。\"\n      },\n      \"safety_warnings\": [\n        \"在狭小空间内焊接时，要特别注意焊枪喷嘴的高温，防止烫伤手部或身体。\",\n        \"确保通风系统能有效排出内部焊接烟雾。\"\n      ]\n    },\n    {\n      \"step_number\": 10,\n      \"action\": \"满焊固定\",\n      \"description\": \"对所有已点焊的零件（矩形管 1、6、8，挂件 4、5，方形板 3，封板 7，加强筋 9）与连接板 2 的连接处进行满焊。焊接要求参照图纸技术要求1和2。\",\n      \"position_description\": \"所有连接面。\",\n      \"parts_used\": [],\n      \"tools\": [\n        \"焊机\",\n        \"焊条/焊丝\",\n        \"焊渣锤\"\n      ],\n      \"warnings\": [\n        \"注意焊接顺序，采用对称焊接，减少热变形。焊缝必须饱满、无虚焊、无漏焊。\"\n      ],\n      \"estimated_time_minutes\": 60,\n      \"welding\": {\n        \"required\": true,\n        \"welding_type\": \"角焊/满焊\",\n        \"welding_method\": \"CO2气保焊\",\n        \"weld_size\": \"焊脚高度6mm（或按图纸要求），所有连接边满焊\",\n        \"welding_position\": \"所有零件（1, 6, 8, 3, 4, 5, 7, 9）与连接板 2 的连接处\",\n        \"quality_requirements\": \"焊缝连续、均匀、饱满，无咬边、气孔、裂纹等缺陷。焊后清理焊渣。\",\n        \"safety_notes\": \"大面积焊接时，确保工作区域通风良好，防止烟尘中毒。注意控制热输入，防止工件严重变形。\"\n      },\n      \"safety_warnings\": [\n        \"进行长时间满焊作业时，必须佩戴专业的呼吸防护设备，防止吸入大量焊接烟尘。\",\n        \"注意控制焊接热量，防止工件因受热不均而发生严重变形，影响后续装配。\",\n        \"清理焊渣时，必须佩戴防护眼镜，防止焊渣飞溅伤眼。\"\n      ]\n    },\n    {\n      \"step_number\": 11,\n      \"action\": \"焊后清理与校正\",\n      \"description\": \"清理所有焊渣和飞溅物。检查组件整体尺寸和平面度，如有变形，进行校正。\",\n      \"position_description\": \"整个组件。\",\n      \"parts_used\": [],\n      \"tools\": [\n        \"角磨机\",\n        \"钢丝刷\",\n        \"校正平台\",\n        \"大锤\"\n      ],\n      \"warnings\": [\n        \"校正时注意力度，避免二次损伤。锐边/尖角需倒钝处理。\"\n      ],\n      \"estimated_time_minutes\": 20,\n      \"safety_warnings\": [\n        \"使用角磨机清理焊缝时，必须佩戴防护面罩和耳塞，防止火花飞溅和噪音伤害。\",\n        \"角磨机操作时要握紧，防止反弹伤人，并确保磨片安装牢固。\",\n        \"进行校正作业时，注意周围人员安全，防止大锤或校正工具误伤。\"\n      ]\n    }\n  ]\n}\n```",
  "parsed_result": {
    "enhanced_steps": [
      {
        "step_number": 1,
        "action": "安装基准件",
        "description": "将图纸上标注为2的连接板 1（01.01.01.11509）平放在焊接工装上作为基准件，确保定位准确。",
        "position_description": "平放于工装台面，定位孔对齐工装销。",
        "parts_used": [
          {
            "bom_code": "01.01.01.11509",
            "bom_name": "连接板 1",
            "quantity": 1,
            "drawing_number": "2",
            "mesh_id": [
              "mesh_018"
            ]
          }
        ],
        "tools": [
          "焊接工装",
          "定位销"
        ],
        "warnings": [
          "确保连接板定位准确，防止后续焊接变形。"
        ],
        "estimated_time_minutes": 5
      },
      {
        "step_number": 2,
        "action": "安装并点焊矩形管 1",
        "description": "将图纸上标注为1的矩形管 1（01.01.03.2718）放置在连接板 2 的一侧，根据图纸尺寸（如1120mm长度方向）定位，并进行点焊固定。",
        "position_description": "矩形管 1 位于连接板 2 的长边一侧。",
        "parts_used": [
          {
            "bom_code": "01.01.03.2718",
            "bom_name": "矩形管 1",
            "quantity": 1,
            "drawing_number": "1"
          }
        ],
        "tools": [
          "焊机",
          "卡尺",
          "直角尺"
        ],
        "warnings": [
          "点焊位置要牢固，但不能影响后续满焊。"
        ],
        "estimated_time_minutes": 10,
        "welding": {
          "required": true,
          "welding_type": "点焊（临时固定）",
          "welding_method": "CO2气保焊",
          "weld_size": "点焊长度10-15mm，共4点",
          "welding_position": "矩形管 1 与连接板 2 的接触面",
          "quality_requirements": "定位准确，焊点牢固，防止装配过程中移位。",
          "safety_notes": "佩戴防护手套和面罩，注意防飞溅。"
        },
        "safety_warnings": [
          "进行点焊作业时，必须佩戴焊接面罩、防护手套和工作服，防止弧光伤眼和烫伤。",
          "确保工作区域通风良好，避免吸入焊接烟尘。",
          "检查焊机接地线是否连接可靠，防止触电。"
        ]
      },
      {
        "step_number": 3,
        "action": "安装并点焊矩形管 2",
        "description": "将图纸上标注为6的矩形管 2（01.01.03.2719）放置在连接板 2 的另一侧，与矩形管 1 对称，根据图纸尺寸（如335mm长度方向）定位，并进行点焊固定。",
        "position_description": "矩形管 2 位于连接板 2 的另一长边一侧。",
        "parts_used": [
          {
            "bom_code": "01.01.03.2719",
            "bom_name": "矩形管 2",
            "quantity": 2,
            "drawing_number": "6"
          }
        ],
        "tools": [
          "焊机",
          "卡尺",
          "直角尺"
        ],
        "warnings": [
          "注意矩形管 2 的数量是2个，需对称安装。"
        ],
        "estimated_time_minutes": 15,
        "welding": {
          "required": true,
          "welding_type": "点焊（临时固定）",
          "welding_method": "CO2气保焊",
          "weld_size": "点焊长度10-15mm，每根管共4点",
          "welding_position": "矩形管 6 与连接板 2 的接触面",
          "quality_requirements": "确保两根矩形管 6 与矩形管 1 平行且对称。",
          "safety_notes": "检查接地线是否牢固，防止触电。"
        },
        "safety_warnings": [
          "焊接时注意周围环境，防止火花飞溅引燃周围物品。",
          "佩戴好个人防护用品（焊接面罩、手套），避免弧光和高温伤害。",
          "确认焊机电源线和气管无破损，避免漏电或漏气。"
        ]
      },
      {
        "step_number": 4,
        "action": "安装并点焊矩形管 1 (970mm)",
        "description": "将图纸上标注为8的矩形管 1（01.01.03.2720）放置在连接板 2 的中间位置，作为横向支撑，根据图纸尺寸（如970mm长度方向）定位，并进行点焊固定。",
        "position_description": "矩形管 8 位于连接板 2 的中间，垂直于矩形管 1 和 6。",
        "parts_used": [
          {
            "bom_code": "01.01.03.2720",
            "bom_name": "矩形管 1",
            "quantity": 1,
            "drawing_number": "8",
            "mesh_id": [
              "mesh_003",
              "mesh_006",
              "mesh_007",
              "mesh_019"
            ]
          }
        ],
        "tools": [
          "焊机",
          "卷尺"
        ],
        "warnings": [
          "确保矩形管 8 与连接板 2 垂直，且与两侧矩形管平行。"
        ],
        "estimated_time_minutes": 8,
        "welding": {
          "required": true,
          "welding_type": "点焊（临时固定）",
          "welding_method": "CO2气保焊",
          "weld_size": "点焊长度10-15mm，共4点",
          "welding_position": "矩形管 8 与连接板 2 的接触面",
          "quality_requirements": "检查垂直度，确保横向支撑到位。",
          "safety_notes": "清理焊接区域的油污和杂物，防止产生有毒烟雾。"
        },
        "safety_warnings": [
          "焊接前必须彻底清理工件表面的油污、锈迹和杂物，否则焊接时会产生大量有毒烟雾，影响健康。",
          "保持身体与焊枪的安全距离，防止高温灼伤。"
        ]
      },
      {
        "step_number": 5,
        "action": "安装并点焊右挂件",
        "description": "将图纸上标注为4的右挂件虚拟组件 1（01.05.0018）安装在矩形管 6 的一端，根据图纸尺寸定位，并进行点焊固定。",
        "position_description": "右挂件 4 安装在矩形管 6 的右侧端部。",
        "parts_used": [
          {
            "bom_code": "01.05.0018",
            "bom_name": "右挂件虚拟组件 1",
            "quantity": 1,
            "drawing_number": "4",
            "mesh_id": [
              "mesh_008",
              "mesh_011"
            ]
          }
        ],
        "tools": [
          "焊机",
          "定位夹具"
        ],
        "warnings": [
          "挂件的安装方向和角度必须符合图纸要求，确保挂钩朝向正确。"
        ],
        "estimated_time_minutes": 12,
        "welding": {
          "required": true,
          "welding_type": "点焊（临时固定）",
          "welding_method": "CO2气保焊",
          "weld_size": "点焊长度10mm，共2点",
          "welding_position": "右挂件 4 与矩形管 6 的接触面",
          "quality_requirements": "挂件定位准确，不能歪斜。",
          "safety_notes": "使用夹具固定挂件，防止焊接时掉落或移位。"
        },
        "safety_warnings": [
          "使用夹具固定小型零件时，要确保夹紧力足够，防止零件在焊接过程中弹飞伤人。",
          "焊接完成后，不要立即用手触摸工件，防止烫伤。"
        ]
      },
      {
        "step_number": 6,
        "action": "安装并点焊左挂件",
        "description": "将图纸上标注为5的左挂件虚拟组件 1（01.05.0019）安装在矩形管 6 的另一端，与右挂件对称，根据图纸尺寸定位，并进行点焊固定。",
        "position_description": "左挂件 5 安装在矩形管 6 的左侧端部。",
        "parts_used": [
          {
            "bom_code": "01.05.0019",
            "bom_name": "左挂件虚拟组件 1",
            "quantity": 1,
            "drawing_number": "5",
            "mesh_id": [
              "mesh_009",
              "mesh_010",
              "mesh_012",
              "mesh_013"
            ]
          }
        ],
        "tools": [
          "焊机",
          "定位夹具"
        ],
        "warnings": [
          "检查左右挂件的中心距是否符合图纸要求。"
        ],
        "estimated_time_minutes": 12,
        "welding": {
          "required": true,
          "welding_type": "点焊（临时固定）",
          "welding_method": "CO2气保焊",
          "weld_size": "点焊长度10mm，共2点",
          "welding_position": "左挂件 5 与矩形管 6 的接触面",
          "quality_requirements": "确保左右挂件对称，中心距符合要求。",
          "safety_notes": "焊接前检查工件是否稳定，防止倾倒。"
        },
        "safety_warnings": [
          "焊接前务必确认工件在工装上放置平稳，防止在操作过程中倾倒或滑落。",
          "注意焊枪电缆和气管的走向，避免被绊倒或被高温工件烫伤。"
        ]
      },
      {
        "step_number": 7,
        "action": "安装并点焊方形板",
        "description": "将图纸上标注为3的方形板-机加 4（01.01.01.6589）安装在矩形管 1 和 6 的端部，用于封堵和加强，根据图纸定位，并进行点焊固定。",
        "position_description": "方形板 3 安装在矩形管 1 和 6 的四个端面。",
        "parts_used": [
          {
            "bom_code": "01.01.01.6589",
            "bom_name": "方形板-机加 4",
            "quantity": 4,
            "drawing_number": "3",
            "mesh_id": [
              "mesh_014",
              "mesh_015",
              "mesh_016",
              "mesh_017"
            ]
          }
        ],
        "tools": [
          "焊机",
          "磁力夹"
        ],
        "warnings": [
          "方形板需与矩形管端面齐平，确保焊接质量。"
        ],
        "estimated_time_minutes": 15,
        "welding": {
          "required": true,
          "welding_type": "点焊（临时固定）",
          "welding_method": "CO2气保焊",
          "weld_size": "点焊长度10mm，每块板共4点",
          "welding_position": "方形板 3 与矩形管端面的接触面",
          "quality_requirements": "板面与管端面齐平，无错位。",
          "safety_notes": "使用磁力夹固定，防止焊接时板材移动。"
        },
        "safety_warnings": [
          "使用磁力夹时，确保磁力夹牢固吸附，防止零件在焊接过程中脱落。",
          "注意方形板边缘可能锋利，搬运和安装时请佩戴防割手套。"
        ]
      },
      {
        "step_number": 8,
        "action": "安装并点焊封板",
        "description": "将图纸上标注为7的封板 2（01.01.01.16608）安装在组件的顶部，覆盖矩形管 1 和 6 之间的空间，根据图纸尺寸定位，并进行点焊固定。",
        "position_description": "封板 7 位于组件的顶部，覆盖在矩形管 1 和 6 上方。",
        "parts_used": [
          {
            "bom_code": "01.01.01.16608",
            "bom_name": "封板 2",
            "quantity": 2,
            "drawing_number": "7",
            "mesh_id": [
              "mesh_004",
              "mesh_005"
            ]
          }
        ],
        "tools": [
          "焊机",
          "压紧夹具"
        ],
        "warnings": [
          "封板与矩形管的接触面必须紧密贴合，防止虚焊。"
        ],
        "estimated_time_minutes": 10,
        "welding": {
          "required": true,
          "welding_type": "点焊（临时固定）",
          "welding_method": "CO2气保焊",
          "weld_size": "点焊长度10-15mm，每块板共4点",
          "welding_position": "封板 7 与矩形管 1 和 6 的上表面",
          "quality_requirements": "封板与矩形管贴合紧密，无缝隙。",
          "safety_notes": "注意封板边缘可能锋利，操作时戴好手套。"
        },
        "safety_warnings": [
          "封板边缘可能存在毛刺或尖锐，操作时必须佩戴防割手套，防止划伤。",
          "使用压紧夹具时，注意夹具的稳定性，防止工件在焊接时松动。"
        ]
      },
      {
        "step_number": 9,
        "action": "安装并点焊加强筋",
        "description": "将图纸上标注为9的加强筋 2（01.01.01.17678）安装在连接板 2 和矩形管 1/6 之间，用于结构加强，根据图纸定位，并进行点焊固定。",
        "position_description": "加强筋 9 位于连接板 2 和矩形管 1/6 的内侧，呈斜角支撑。",
        "parts_used": [
          {
            "bom_code": "01.01.01.17678",
            "bom_name": "加强筋 2",
            "quantity": 2,
            "drawing_number": "9",
            "mesh_id": [
              "mesh_001",
              "mesh_002"
            ]
          }
        ],
        "tools": [
          "焊机",
          "角度尺"
        ],
        "warnings": [
          "加强筋的安装角度和位置必须准确，确保受力均匀。"
        ],
        "estimated_time_minutes": 10,
        "welding": {
          "required": true,
          "welding_type": "点焊（临时固定）",
          "welding_method": "CO2气保焊",
          "weld_size": "点焊长度10mm，每根筋共4点",
          "welding_position": "加强筋 9 与连接板 2 和矩形管 1/6 的接触边",
          "quality_requirements": "加强筋与两零件贴合紧密，角度正确。",
          "safety_notes": "由于加强筋位置较深，注意焊枪角度，避免烫伤。"
        },
        "safety_warnings": [
          "在狭小空间内焊接时，要特别注意焊枪喷嘴的高温，防止烫伤手部或身体。",
          "确保通风系统能有效排出内部焊接烟雾。"
        ]
      },
      {
        "step_number": 10,
        "action": "满焊固定",
        "description": "对所有已点焊的零件（矩形管 1、6、8，挂件 4、5，方形板 3，封板 7，加强筋 9）与连接板 2 的连接处进行满焊。焊接要求参照图纸技术要求1和2。",
        "position_description": "所有连接面。",
        "parts_used": [],
        "tools": [
          "焊机",
          "焊条/焊丝",
          "焊渣锤"
        ],
        "warnings": [
          "注意焊接顺序，采用对称焊接，减少热变形。焊缝必须饱满、无虚焊、无漏焊。"
        ],
        "estimated_time_minutes": 60,
        "welding": {
          "required": true,
          "welding_type": "角焊/满焊",
          "welding_method": "CO2气保焊",
          "weld_size": "焊脚高度6mm（或按图纸要求），所有连接边满焊",
          "welding_position": "所有零件（1, 6, 8, 3, 4, 5, 7, 9）与连接板 2 的连接处",
          "quality_requirements": "焊缝连续、均匀、饱满，无咬边、气孔、裂纹等缺陷。焊后清理焊渣。",
          "safety_notes": "大面积焊接时，确保工作区域通风良好，防止烟尘中毒。注意控制热输入，防止工件严重变形。"
        },
        "safety_warnings": [
          "进行长时间满焊作业时，必须佩戴专业的呼吸防护设备，防止吸入大量焊接烟尘。",
          "注意控制焊接热量，防止工件因受热不均而发生严重变形，影响后续装配。",
          "清理焊渣时，必须佩戴防护眼镜，防止焊渣飞溅伤眼。"
        ]
      },
      {
        "step_number": 11,
        "action": "焊后清理与校正",
        "description": "清理所有焊渣和飞溅物。检查组件整体尺寸和平面度，如有变形，进行校正。",
        "position_description": "整个组件。",
        "parts_used": [],
        "tools": [
          "角磨机",
          "钢丝刷",
          "校正平台",
          "大锤"
        ],
        "warnings": [
          "校正时注意力度，避免二次损伤。锐边/尖角需倒钝处理。"
        ],
        "estimated_time_minutes": 20,
        "safety_warnings": [
          "使用角磨机清理焊缝时，必须佩戴防护面罩和耳塞，防止火花飞溅和噪音伤害。",
          "角磨机操作时要握紧，防止反弹伤人，并确保磨片安装牢固。",
          "进行校正作业时，注意周围人员安全，防止大锤或校正工具误伤。"
        ]
      }
    ]
  }
}