{
  "agent_name": "Agent6_FAQ",
  "model": "google/gemini-2.5-flash-preview-09-2025",
  "timestamp": "20251005_165145",
  "image_count": 0,
  "temperature": 0.2,
  "system_prompt": "# 角色定位\n\n你是**李师傅**，一位拥有20年安全管理经验的高级安全工程师。\n\n## 教育背景\n\n- **学历**：安全工程专业本科\n- **职业资格**：注册安全工程师、高级安全评价师\n- **专业培训**：\n  - 机械制造安全管理\n  - 职业健康与安全管理体系（ISO 45001）\n  - 事故调查与分析\n  - 应急预案编制与演练\n\n## 职业背景\n\n- **工作经历**：20年机械制造企业安全管理经验，参与过大型装备制造、钢结构加工等项目\n- **专业领域**：\n  - 机械加工安全（车、铣、刨、磨、钻等）\n  - 焊接作业安全（电焊、气焊、氩弧焊等）\n  - 起重吊装安全（行车、叉车、吊索具等）\n  - 高空作业安全（脚手架、安全带、防坠落等）\n  - 个人防护用品管理（安全帽、防护眼镜、手套、安全鞋等）\n\n## 知识结构（详细）\n\n### 1. 机械伤害风险\n- **夹伤/挤伤**：手指、手臂被运动部件夹住\n- **切割伤**：锋利边缘、毛刺、切削工具\n- **碰撞伤**：头部碰撞、身体碰撞\n- **坠落伤**：零件坠落、工具坠落、人员坠落\n\n### 2. 焊接作业风险\n- **电击伤**：焊机漏电、接地不良\n- **弧光伤**：电弧紫外线灼伤眼睛和皮肤\n- **烫伤**：高温熔池、焊渣飞溅\n- **火灾爆炸**：易燃物引燃、气瓶泄漏\n- **有毒气体**：焊接烟尘、一氧化碳中毒\n\n### 3. 起重吊装风险\n- **吊物坠落**：吊索具断裂、捆绑不牢\n- **吊物摆动**：碰撞人员、设备\n- **超载**：超过起重机额定载荷\n- **指挥失误**：信号不清、违章指挥\n\n### 4. 高空作业风险\n- **人员坠落**：未系安全带、脚手架不牢\n- **物体打击**：工具、零件从高处坠落\n- **脚手架坍塌**：搭设不规范、超载\n\n### 5. 个人防护用品\n- **头部防护**：安全帽（防止碰撞、坠物打击）\n- **眼部防护**：防护眼镜、焊接面罩（防止飞溅、弧光）\n- **手部防护**：防护手套（防止切割、烫伤、化学品）\n- **足部防护**：安全鞋（防砸、防刺穿、防滑）\n- **呼吸防护**：防尘口罩、防毒面具（防止粉尘、有毒气体）\n\n### 6. 应急处理\n- **机械伤害**：立即停机、呼救、止血、固定、送医\n- **电击伤**：切断电源、心肺复苏、送医\n- **烫伤**：冷水冲洗、覆盖无菌纱布、送医\n- **火灾**：使用灭火器、疏散人员、报警\n\n## 任务步骤（Chain of Thought）\n\n你的任务是**为每个装配步骤添加安全警告**（如果该步骤有安全风险）。请按照以下5个步骤思考：\n\n### 步骤1：识别风险步骤\n- 分析每个装配步骤的操作内容\n- 判断是否涉及高风险作业（焊接、吊装、高空、重物搬运等）\n- 识别潜在的伤害类型（机械伤害、电击、烫伤、坠落等）\n\n### 步骤2：分析风险源\n- 确定风险的来源（设备、工具、材料、环境、人员操作等）\n- 评估风险的严重程度（轻微、中等、严重、致命）\n- 考虑风险的发生概率\n\n### 步骤3：制定预防措施\n- 针对每个风险源，制定具体的预防措施\n- 强调个人防护用品的使用\n- 强调安全操作规程的遵守\n\n### 步骤4：添加安全警告\n- 为每个有风险的步骤添加safety_warnings字段\n- 每条警告要简洁明了，说明具体的风险和预防措施\n- 使用工人能看懂的语言\n\n### 步骤5：验证完整性\n- 检查所有高风险步骤是否都添加了安全警告\n- 检查安全警告是否具体、可操作\n- 检查是否遗漏了任何潜在风险\n\n## 核心原则\n\n1. **步骤级嵌入**：为每个有风险的步骤添加safety_warnings字段，而不是单独列出安全警告\n2. **工人友好**：使用通俗语言，避免专业术语\n3. **具体可操作**：说明具体的风险和预防措施，而不是泛泛而谈\n4. **不重复显示**：安全警告只在下方\"安全\"标签页中统一显示，不在当前步骤详情中重复显示\n\n## 输出格式\n\n严格按照以下JSON格式输出（返回增强后的装配步骤）：\n\n```json\n{\n  \"enhanced_steps\": [\n    {\n      \"step_number\": 1,\n      \"title\": \"点焊定位\",\n      \"parts_used\": [...],\n      \"tools_required\": [...],\n      \"operation\": \"操作说明\",\n      \"quality_check\": \"质量检查\",\n      \"estimated_time_minutes\": 10,\n      \"welding\": {\n        \"required\": true,\n        \"welding_type\": \"点焊\",\n        \"welding_method\": \"CO2气保焊\",\n        ...\n      },\n      \"safety_warnings\": [\n        \"佩戴焊接面罩和防护手套，防止弧光灼伤眼睛和皮肤\",\n        \"确保工件夹紧牢固，防止点焊时位移造成伤害\",\n        \"焊接区域周围3米内不得有易燃物，配备灭火器\",\n        \"焊机必须接地良好，防止漏电触电\"\n      ]\n    },\n    {\n      \"step_number\": 2,\n      \"title\": \"螺栓连接\",\n      \"parts_used\": [...],\n      \"operation\": \"操作说明\",\n      \"quality_check\": \"质量检查\",\n      \"estimated_time_minutes\": 15,\n      \"safety_warnings\": [\n        \"佩戴安全帽和防护眼镜，防止零件坠落和飞溅\",\n        \"使用扭力扳手时注意力度，防止扳手滑脱伤人\"\n      ]\n    },\n    {\n      \"step_number\": 3,\n      \"title\": \"简单装配\",\n      \"parts_used\": [...],\n      \"operation\": \"操作说明\",\n      \"quality_check\": \"质量检查\",\n      \"estimated_time_minutes\": 5\n      // ⚠️ 如果没有明显安全风险，不添加safety_warnings字段\n    }\n  ]\n}\n```\n\n**⚠️ 关键要求**：\n\n1. **步骤级嵌入**：\n   - 为每个有风险的步骤添加`safety_warnings`字段\n   - 没有明显风险的步骤不添加`safety_warnings`字段\n   - 保持原有步骤的所有字段不变\n\n2. **安全警告要具体**：\n   - ✅ 说\"佩戴焊接面罩和防护手套，防止弧光灼伤眼睛和皮肤\"\n   - ❌ 不说\"注意安全\"\n   - ✅ 说\"焊接区域周围3米内不得有易燃物，配备灭火器\"\n   - ❌ 不说\"注意防火\"\n\n3. **使用通俗语言**：\n   - 工人能看懂的语言\n   - 避免专业术语和英文缩写\n\n4. **警告要全面**：\n   - 涵盖个人防护、设备安全、环境安全、操作安全\n   - 每条警告说明具体的风险和预防措施\n\n## 重要提醒\n\n- **只输出JSON，不要输出其他内容**\n- **保持原有字段不变**：不要修改或删除原有的字段（包括welding字段）\n- **警告要简洁明了**：每条警告一句话，说明风险和预防措施\n- **不要过度警告**：只针对有明显风险的步骤添加警告\n",
  "user_query": "请为以下装配步骤添加安全警告（如果有安全风险）。\n\n## 📸 视觉分析任务\n\n**你会看到工程图纸图片，请仔细观察：**\n\n1. **危险作业标识**：\n   - 图纸上的安全警告标识\n   - 特殊作业要求（如高空作业、吊装作业等）\n   - 危险区域标注\n\n2. **零件特征**：\n   - 重型零件（需要吊装）\n   - 锋利边缘（容易割伤）\n   - 高温部件（容易烫伤）\n\n3. **作业环境**：\n   - 狭窄空间（容易碰撞）\n   - 高空位置（容易坠落）\n   - 密闭空间（通风不良）\n\n## 装配步骤\n\n[\n  {\n    \"step_number\": 1,\n    \"action\": \"放置基准件\",\n    \"description\": \"将图纸上标注为①的左铲板（01.01.01.18598）平稳放置在焊接工作台上，作为装配基准。确保铲板内侧（有安装孔的一侧）朝上。\",\n    \"position_description\": \"铲板内侧朝上，平放于工作台。\",\n    \"parts_used\": [\n      {\n        \"bom_seq\": \"1\",\n        \"bom_name\": \"左铲板 1\",\n        \"quantity\": 1,\n        \"drawing_number\": \"①\",\n        \"node_name\": [\n          \"NAUO1\"\n        ],\n        \"bom_code\": \"01.01.01.18598\"\n      }\n    ],\n    \"tools\": [\n      \"行车/吊具\",\n      \"水平仪\"\n    ],\n    \"warnings\": [\n      \"吊装时注意平衡，防止零件倾倒。\"\n    ]\n  },\n  {\n    \"step_number\": 2,\n    \"action\": \"安装方形板-机加\",\n    \"description\": \"将图纸上标注为②的方形板-机加（01.01.01.18599）放置在①号左铲板的后部边缘，对齐定位孔。该零件用于后续连接，需确保其安装面与铲板垂直。\",\n    \"position_description\": \"安装在①号左铲板的后部边缘，与铲板垂直。\",\n    \"parts_used\": [\n      {\n        \"bom_seq\": \"2\",\n        \"bom_name\": \"方形板-机加 1\",\n        \"quantity\": 1,\n        \"drawing_number\": \"②\",\n        \"node_name\": [\n          \"NAUO2\"\n        ],\n        \"bom_code\": \"01.01.01.18599\"\n      }\n    ],\n    \"tools\": [\n      \"焊机\",\n      \"角尺\"\n    ],\n    \"warnings\": [\n      \"点焊固定前，必须使用角尺检查垂直度。\"\n    ],\n    \"welding\": {\n      \"required\": true,\n      \"welding_type\": \"角焊（定位焊）\",\n      \"welding_method\": \"CO2气保焊\",\n      \"weld_size\": \"点焊，焊点长度10-15mm，高度4mm\",\n      \"welding_position\": \"零件②与零件①的连接处，主要为平焊和横焊位置\",\n      \"quality_requirements\": \"点焊位置应均匀分布，确保零件定位准确，垂直度误差小于1mm。\",\n      \"safety_notes\": \"佩戴焊接面罩和防护手套，确保工作区域通风良好，防止火花飞溅。\"\n    }\n  },\n  {\n    \"step_number\": 3,\n    \"action\": \"安装后加强板和前加强板\",\n    \"description\": \"将图纸上标注为③的后加强板（01.01.01.11519）和④的前加强板（01.01.01.18600）安装在①号左铲板的内侧，按照图纸尺寸定位。先点焊固定。\",\n    \"position_description\": \"③号后加强板和④号前加强板安装在①号左铲板的内侧，沿铲板弧度走向。\",\n    \"parts_used\": [\n      {\n        \"bom_seq\": \"3\",\n        \"bom_name\": \"后加强板 1\",\n        \"quantity\": 1,\n        \"drawing_number\": \"③\",\n        \"node_name\": [\n          \"NAUO3\"\n        ],\n        \"bom_code\": \"01.01.01.11519\"\n      },\n      {\n        \"bom_seq\": \"4\",\n        \"bom_name\": \"前加强板 1\",\n        \"quantity\": 1,\n        \"drawing_number\": \"④\",\n        \"node_name\": [\n          \"NAUO4\"\n        ],\n        \"bom_code\": \"01.01.01.18600\"\n      }\n    ],\n    \"tools\": [\n      \"焊机\",\n      \"卷尺\"\n    ],\n    \"warnings\": [\n      \"确保加强板与铲板贴合紧密，无间隙。\"\n    ],\n    \"welding\": {\n      \"required\": true,\n      \"welding_type\": \"角焊（定位焊）\",\n      \"welding_method\": \"CO2气保焊\",\n      \"weld_size\": \"点焊，焊点长度10mm，高度4mm\",\n      \"welding_position\": \"零件③、④与零件①的连接处，主要为平焊位置\",\n      \"quality_requirements\": \"点焊应在加强板边缘均匀分布，确保零件贴合紧密，防止焊接变形。\",\n      \"safety_notes\": \"清理焊接区域的油污和锈蚀，防止产生气孔。注意焊机接地良好。\"\n    }\n  },\n  {\n    \"step_number\": 4,\n    \"action\": \"安装底部连接板和前油缸固定板\",\n    \"description\": \"将6块图纸上标注为⑤的底部连接板（01.01.01.11521）和2块⑥号前油缸固定板（01.01.01.11522）安装在①号左铲板的底部内侧。⑤号连接板需均匀分布，⑥号固定板安装在指定位置，确保油缸安装孔位对齐。\",\n    \"position_description\": \"安装在①号左铲板的底部内侧，靠近铲板边缘。\",\n    \"parts_used\": [\n      {\n        \"bom_seq\": \"5\",\n        \"bom_name\": \"底部连接板 6\",\n        \"quantity\": 6,\n        \"drawing_number\": \"⑤\",\n        \"node_name\": [\n          \"NAUO15\",\n          \"NAUO14\",\n          \"NAUO13\",\n          \"NAUO12\",\n          \"NAUO6\",\n          \"NAUO5\"\n        ],\n        \"bom_code\": \"01.01.01.11521\"\n      },\n      {\n        \"bom_seq\": \"6\",\n        \"bom_name\": \"前油缸固定板 2\",\n        \"quantity\": 2,\n        \"drawing_number\": \"⑥\",\n        \"node_name\": [\n          \"NAUO8\",\n          \"NAUO7\"\n        ],\n        \"bom_code\": \"01.01.01.11522\"\n      }\n    ],\n    \"tools\": [\n      \"焊机\",\n      \"卡尺\"\n    ],\n    \"warnings\": [\n      \"⑥号前油缸固定板的孔位中心距必须符合图纸要求。\"\n    ],\n    \"welding\": {\n      \"required\": true,\n      \"welding_type\": \"角焊（定位焊）\",\n      \"welding_method\": \"CO2气保焊\",\n      \"weld_size\": \"点焊，焊点长度10mm，高度4mm\",\n      \"welding_position\": \"零件⑤、⑥与零件①的连接处，主要为平焊位置\",\n      \"quality_requirements\": \"⑥号固定板的定位精度要求高，点焊后需复核孔位中心距和垂直度。\",\n      \"safety_notes\": \"注意保护⑥号固定板上的机加工孔，避免焊渣飞溅进入孔内。\"\n    }\n  },\n  {\n    \"step_number\": 5,\n    \"action\": \"安装弹簧固定板\",\n    \"description\": \"安装1块⑦号前弹簧固定板（01.01.01.11523）和2块⑧号后弹簧固定板（01.01.01.11524）。⑦号固定板安装在铲板内侧中部，⑧号固定板安装在后部，确保弹簧安装孔位朝向正确。\",\n    \"position_description\": \"⑦号安装在内侧中部，⑧号安装在内侧后部。\",\n    \"parts_used\": [\n      {\n        \"bom_seq\": \"7\",\n        \"bom_name\": \"前弹簧固定板 1\",\n        \"quantity\": 1,\n        \"drawing_number\": \"⑦\",\n        \"node_name\": [\n          \"NAUO9\"\n        ],\n        \"bom_code\": \"01.01.01.11523\"\n      },\n      {\n        \"bom_seq\": \"8\",\n        \"bom_name\": \"后弹簧固定板 2\",\n        \"quantity\": 2,\n        \"drawing_number\": \"⑧\",\n        \"node_name\": [\n          \"NAUO11\",\n          \"NAUO10\"\n        ],\n        \"bom_code\": \"01.01.01.11524\"\n      }\n    ],\n    \"tools\": [\n      \"焊机\",\n      \"卷尺\"\n    ],\n    \"warnings\": [\n      \"弹簧固定板的安装位置是关键受力点，焊接必须牢固。\"\n    ],\n    \"welding\": {\n      \"required\": true,\n      \"welding_type\": \"角焊（定位焊）\",\n      \"welding_method\": \"CO2气保焊\",\n      \"weld_size\": \"点焊，焊点长度10mm，高度4mm\",\n      \"welding_position\": \"零件⑦、⑧与零件①的连接处，主要为平焊位置\",\n      \"quality_requirements\": \"确保固定板与铲板贴合紧密，点焊牢固，防止后续满焊时发生位移。\",\n      \"safety_notes\": \"焊接时注意调整电流和电压，避免烧穿薄板区域。\"\n    }\n  },\n  {\n    \"step_number\": 6,\n    \"action\": \"安装支撑固定板和轴套加强板\",\n    \"description\": \"安装1块⑨号支撑固定板（01.01.01.11525）和2块⑩号轴套加强板（01.01.01.11526）。⑨号固定板安装在铲板内侧的指定位置，⑩号加强板安装在铲板两侧的轴套安装区域。\",\n    \"position_description\": \"⑨号安装在内侧，⑩号安装在两侧边缘。\",\n    \"parts_used\": [\n      {\n        \"bom_seq\": \"9\",\n        \"bom_name\": \"支撑固定板 1\",\n        \"quantity\": 1,\n        \"drawing_number\": \"⑨\",\n        \"node_name\": [\n          \"NAUO16\"\n        ],\n        \"bom_code\": \"01.01.01.11525\"\n      },\n      {\n        \"bom_seq\": \"10\",\n        \"bom_name\": \"轴套加强板 2\",\n        \"quantity\": 2,\n        \"drawing_number\": \"⑩\",\n        \"node_name\": [\n          \"NAUO18\",\n          \"NAUO17\"\n        ],\n        \"bom_code\": \"01.01.01.11526\"\n      }\n    ],\n    \"tools\": [\n      \"焊机\"\n    ],\n    \"warnings\": [\n      \"⑩号轴套加强板的定位精度影响后续轴套安装。\"\n    ],\n    \"welding\": {\n      \"required\": true,\n      \"welding_type\": \"角焊（定位焊）\",\n      \"welding_method\": \"CO2气保焊\",\n      \"weld_size\": \"点焊，焊点长度10mm，高度4mm\",\n      \"welding_position\": \"零件⑨、⑩与零件①的连接处，主要为平焊位置\",\n      \"quality_requirements\": \"⑩号加强板的定位必须精确，确保与轴套安装孔同心。\",\n      \"safety_notes\": \"焊接前检查焊机电缆和气管是否完好，防止漏电或漏气。\"\n    }\n  },\n  {\n    \"step_number\": 7,\n    \"action\": \"安装反光片安装板\",\n    \"description\": \"安装1块⑪号反光片安装板（01.01.01.11527）。将其焊接到铲板外侧上部，确保安装板的平面朝外，便于后续安装反光片。\",\n    \"position_description\": \"安装在①号左铲板的外侧上部。\",\n    \"parts_used\": [\n      {\n        \"bom_seq\": \"11\",\n        \"bom_name\": \"反光片安装板 1\",\n        \"quantity\": 1,\n        \"drawing_number\": \"⑪\",\n        \"node_name\": [\n          \"NAUO19\"\n        ],\n        \"bom_code\": \"01.01.01.11527\"\n      }\n    ],\n    \"tools\": [\n      \"焊机\"\n    ],\n    \"warnings\": [\n      \"反光片安装板的焊接位置需避开反光片安装孔。\"\n    ],\n    \"welding\": {\n      \"required\": true,\n      \"welding_type\": \"角焊（定位焊）\",\n      \"welding_method\": \"CO2气保焊\",\n      \"weld_size\": \"点焊，焊点长度10mm，高度4mm\",\n      \"welding_position\": \"零件⑪与零件①的连接处，主要为横焊位置\",\n      \"quality_requirements\": \"定位焊后检查安装板的平面度，确保反光片能平整安装。\",\n      \"safety_notes\": \"由于是外侧焊接，注意防止焊渣飞溅到周围已安装的零件上。\"\n    }\n  },\n  {\n    \"step_number\": 8,\n    \"action\": \"安装轴套\",\n    \"description\": \"将2个⑫号轴套（01.01.02.1222）安装到铲板两侧的轴套安装孔位上，并与⑩号轴套加强板对齐。轴套需与铲板和加强板满焊连接。\",\n    \"position_description\": \"安装在铲板两侧的轴承孔位。\",\n    \"parts_used\": [\n      {\n        \"bom_seq\": \"12\",\n        \"bom_name\": \"轴套 2\",\n        \"quantity\": 2,\n        \"drawing_number\": \"⑫\",\n        \"node_name\": [\n          \"NAUO21\",\n          \"NAUO20\"\n        ],\n        \"bom_code\": \"01.01.02.1222\"\n      }\n    ],\n    \"tools\": [\n      \"焊机\",\n      \"塞规\"\n    ],\n    \"warnings\": [\n      \"轴套的内孔不能被焊渣污染，焊接时注意保护。轴套端面需与加强板端面配合，焊缝需饱满。\"\n    ],\n    \"welding\": {\n      \"required\": true,\n      \"welding_type\": \"角焊/环形焊（满焊）\",\n      \"welding_method\": \"CO2气保焊\",\n      \"weld_size\": \"焊脚高度6mm，环形连续焊\",\n      \"welding_position\": \"零件⑫与零件①和⑩的连接处，主要为平焊和横焊位置\",\n      \"quality_requirements\": \"焊缝必须连续、饱满，无未焊透、气孔等缺陷。焊后需清理焊渣，并用塞规检查轴套内孔是否变形。\",\n      \"safety_notes\": \"轴套焊接属于关键受力部位，应采用分段、对称焊接，控制热输入，防止轴套变形。焊接时需使用防火材料遮盖轴套内孔。\"\n    }\n  },\n  {\n    \"step_number\": 9,\n    \"action\": \"安装方形板\",\n    \"description\": \"安装1块⑬号方形板 1（01.01.01.11528）和1块⑭号方形板 3（01.01.01.11529）。这两个方形板安装在铲板内侧的指定位置，用于后续连接，需确保焊接牢固。\",\n    \"position_description\": \"安装在铲板内侧，靠近后部。\",\n    \"parts_used\": [\n      {\n        \"bom_seq\": \"13\",\n        \"bom_name\": \"方形板 1\",\n        \"quantity\": 1,\n        \"drawing_number\": \"⑬\"\n      },\n      {\n        \"bom_seq\": \"14\",\n        \"bom_name\": \"方形板 3\",\n        \"quantity\": 1,\n        \"drawing_number\": \"⑭\",\n        \"node_name\": [\n          \"NAUO24\",\n          \"NAUO23\",\n          \"NAUO22\"\n        ],\n        \"bom_code\": \"01.01.01.11529\"\n      }\n    ],\n    \"tools\": [\n      \"焊机\"\n    ],\n    \"warnings\": [\n      \"确保方形板的安装方向和角度符合图纸要求。\"\n    ],\n    \"welding\": {\n      \"required\": true,\n      \"welding_type\": \"角焊（定位焊）\",\n      \"welding_method\": \"CO2气保焊\",\n      \"weld_size\": \"点焊，焊点长度10mm，高度4mm\",\n      \"welding_position\": \"零件⑬、⑭与零件①的连接处，主要为平焊位置\",\n      \"quality_requirements\": \"定位焊后检查方形板的相对位置和角度，确保符合装配要求。\",\n      \"safety_notes\": \"注意焊接烟尘的排放，确保排风系统正常工作。\"\n    }\n  },\n  {\n    \"step_number\": 10,\n    \"action\": \"安装左铲雪板加强板\",\n    \"description\": \"安装2块⑮号左铲雪板加强板 2（01.02.01.4983）。将它们焊接到铲板内侧的指定加强筋位置，以增强铲板的整体刚度。\",\n    \"position_description\": \"安装在铲板内侧，作为加强筋。\",\n    \"parts_used\": [\n      {\n        \"bom_seq\": \"15\",\n        \"bom_name\": \"左铲雪板加强板 2\",\n        \"quantity\": 2,\n        \"drawing_number\": \"⑮\",\n        \"node_name\": [\n          \"NAUO26\",\n          \"NAUO25\"\n        ],\n        \"bom_code\": \"01.02.01.4983\"\n      }\n    ],\n    \"tools\": [\n      \"焊机\"\n    ],\n    \"warnings\": [\n      \"加强板焊接需连续，确保应力均匀分布。\"\n    ],\n    \"welding\": {\n      \"required\": true,\n      \"welding_type\": \"角焊（定位焊）\",\n      \"welding_method\": \"CO2气保焊\",\n      \"weld_size\": \"点焊，焊点长度10mm，高度4mm\",\n      \"welding_position\": \"零件⑮与零件①的连接处，主要为平焊位置\",\n      \"quality_requirements\": \"加强板与铲板的贴合度要高，点焊时应施加压力，消除间隙。\",\n      \"safety_notes\": \"避免在同一区域连续点焊，防止局部热量集中导致变形。\"\n    }\n  },\n  {\n    \"step_number\": 11,\n    \"action\": \"满焊所有零件\",\n    \"description\": \"对所有已点焊固定的零件（②至⑮）进行满焊。焊接前清理焊缝区域，确保焊缝尺寸和质量符合技术要求。注意图纸上标注的'折弯时内侧焊缝完整'和'此面不焊接'的要求。\",\n    \"position_description\": \"所有连接面。\",\n    \"parts_used\": [],\n    \"tools\": [\n      \"焊机\",\n      \"焊渣锤\",\n      \"钢丝刷\"\n    ],\n    \"warnings\": [\n      \"严格控制焊接变形，必要时采用对称、分段焊接。所有焊缝必须无气孔、夹渣、裂纹等缺陷。\"\n    ],\n    \"welding\": {\n      \"required\": true,\n      \"welding_type\": \"角焊（满焊）\",\n      \"welding_method\": \"CO2气保焊\",\n      \"weld_size\": \"焊脚高度6mm（未标注尺寸按6mm执行），连续焊\",\n      \"welding_position\": \"所有加强板、固定板与铲板的连接处，需进行翻转操作以保证平焊位置\",\n      \"quality_requirements\": \"焊缝外观应均匀、成形良好，焊波平整。焊后进行外观检查，关键受力焊缝（如轴套、油缸固定板）需进行磁粉检测（MT）或渗透检测（PT），确保无表面裂纹。\",\n      \"safety_notes\": \"进行大面积满焊时，必须穿戴全套防护服，防止高温烫伤。采用分段跳焊工艺，控制整体温升，防止结构件产生大的角变形。注意图纸要求'此面不焊接'的区域，严禁施焊。\"\n    }\n  }\n]\n\n## 要求\n\n请按照以下5个步骤思考，为装配步骤添加安全警告：\n\n### 步骤1：识别风险步骤\n- 分析每个装配步骤的操作内容\n- 判断是否涉及高风险作业：\n  * **焊接作业**：电击、弧光、烫伤、火灾\n  * **吊装作业**：吊物坠落、碰撞、超载\n  * **高空作业**：人员坠落、物体打击\n  * **重物搬运**：砸伤、扭伤、夹伤\n  * **机械加工**：切割伤、夹伤、碰撞\n\n### 步骤2：分析风险源\n- 确定风险的来源（设备、工具、材料、环境、人员操作等）\n- 评估风险的严重程度（轻微、中等、严重、致命）\n- 考虑风险的发生概率\n\n### 步骤3：制定预防措施\n- 针对每个风险源，制定具体的预防措施\n- 强调个人防护用品的使用：\n  * **焊接**：焊接面罩、防护手套、防护服\n  * **吊装**：安全帽、安全鞋、手套\n  * **高空**：安全带、安全帽、防滑鞋\n  * **机械**：防护眼镜、手套、安全鞋\n\n### 步骤4：添加安全警告\n- 为每个有风险的步骤添加safety_warnings字段\n- 每条警告要简洁明了，说明具体的风险和预防措施\n- 使用工人能看懂的语言\n\n### 步骤5：验证完整性\n- 检查所有高风险步骤是否都添加了安全警告\n- 检查安全警告是否具体、可操作\n- 检查是否遗漏了任何潜在风险\n\n## ⚠️ 强制自检清单（生成后必须逐项检查）\n\n**在输出JSON之前，你必须完成以下验证：**\n\n1. **风险步骤识别验证**：\n   - [ ] 所有涉及焊接、吊装、高空、重物搬运的步骤都添加了safety_warnings字段\n   - [ ] 没有明显风险的步骤没有添加safety_warnings字段\n\n2. **安全警告完整性验证**：\n   - [ ] 每个safety_warnings字段都是字符串数组\n   - [ ] 每条警告都说明了具体的风险和预防措施\n   - [ ] 涵盖了个人防护、设备安全、环境安全、操作安全\n\n3. **语言通俗性验证**：\n   - [ ] 使用工人能看懂的语言\n   - [ ] 避免专业术语和英文缩写\n   - [ ] 每条警告简洁明了（一句话）\n\n4. **原有字段保持验证**：\n   - [ ] 原有步骤的所有字段都保持不变（包括welding字段）\n   - [ ] 没有修改或删除任何原有字段\n\n**如果自检发现任何问题，必须重新生成！**\n\n现在开始为装配步骤添加安全警告！\n",
  "raw_response": "```json\n{\n  \"enhanced_steps\": [\n    {\n      \"step_number\": 1,\n      \"action\": \"放置基准件\",\n      \"description\": \"将图纸上标注为①的左铲板（01.01.01.18598）平稳放置在焊接工作台上，作为装配基准。确保铲板内侧（有安装孔的一侧）朝上。\",\n      \"position_description\": \"铲板内侧朝上，平放于工作台。\",\n      \"parts_used\": [\n        {\n          \"bom_seq\": \"1\",\n          \"bom_name\": \"左铲板 1\",\n          \"quantity\": 1,\n          \"drawing_number\": \"①\",\n          \"node_name\": [\n            \"NAUO1\"\n          ],\n          \"bom_code\": \"01.01.01.18598\"\n        }\n      ],\n      \"tools\": [\n        \"行车/吊具\",\n        \"水平仪\"\n      ],\n      \"warnings\": [\n        \"吊装时注意平衡，防止零件倾倒。\"\n      ],\n      \"safety_warnings\": [\n        \"吊装前检查吊索具是否完好，捆绑必须牢固，防止重物坠落伤人。\",\n        \"吊装区域内严禁站人，操作人员必须佩戴安全帽和防护手套。\",\n        \"指挥信号必须清晰准确，吊物起升和移动速度要缓慢平稳。\"\n      ]\n    },\n    {\n      \"step_number\": 2,\n      \"action\": \"安装方形板-机加\",\n      \"description\": \"将图纸上标注为②的方形板-机加（01.01.01.18599）放置在①号左铲板的后部边缘，对齐定位孔。该零件用于后续连接，需确保其安装面与铲板垂直。\",\n      \"position_description\": \"安装在①号左铲板的后部边缘，与铲板垂直。\",\n      \"parts_used\": [\n        {\n          \"bom_seq\": \"2\",\n          \"bom_name\": \"方形板-机加 1\",\n          \"quantity\": 1,\n          \"drawing_number\": \"②\",\n          \"node_name\": [\n            \"NAUO2\"\n          ],\n          \"bom_code\": \"01.01.01.18599\"\n        }\n      ],\n      \"tools\": [\n        \"焊机\",\n        \"角尺\"\n      ],\n      \"warnings\": [\n        \"点焊固定前，必须使用角尺检查垂直度。\"\n      ],\n      \"welding\": {\n        \"required\": true,\n        \"welding_type\": \"角焊（定位焊）\",\n        \"welding_method\": \"CO2气保焊\",\n        \"weld_size\": \"点焊，焊点长度10-15mm，高度4mm\",\n        \"welding_position\": \"零件②与零件①的连接处，主要为平焊和横焊位置\",\n        \"quality_requirements\": \"点焊位置应均匀分布，确保零件定位准确，垂直度误差小于1mm。\",\n        \"safety_notes\": \"佩戴焊接面罩和防护手套，确保工作区域通风良好，防止火花飞溅。\"\n      },\n      \"safety_warnings\": [\n        \"佩戴焊接面罩、防护手套和防护服，防止弧光灼伤和焊渣烫伤。\",\n        \"确保焊机接地良好，电缆无破损，防止触电。\",\n        \"焊接区域必须通风良好，防止吸入有害烟尘。\",\n        \"点焊时注意焊渣飞溅，周围不得有易燃易爆物品。\"\n      ]\n    },\n    {\n      \"step_number\": 3,\n      \"action\": \"安装后加强板和前加强板\",\n      \"description\": \"将图纸上标注为③的后加强板（01.01.01.11519）和④的前加强板（01.01.01.18600）安装在①号左铲板的内侧，按照图纸尺寸定位。先点焊固定。\",\n      \"position_description\": \"③号后加强板和④号前加强板安装在①号左铲板的内侧，沿铲板弧度走向。\",\n      \"parts_used\": [\n        {\n          \"bom_seq\": \"3\",\n          \"bom_name\": \"后加强板 1\",\n          \"quantity\": 1,\n          \"drawing_number\": \"③\",\n          \"node_name\": [\n            \"NAUO3\"\n          ],\n          \"bom_code\": \"01.01.01.11519\"\n        },\n        {\n          \"bom_seq\": \"4\",\n          \"bom_name\": \"前加强板 1\",\n          \"quantity\": 1,\n          \"drawing_number\": \"④\",\n          \"node_name\": [\n            \"NAUO4\"\n          ],\n          \"bom_code\": \"01.01.01.18600\"\n        }\n      ],\n      \"tools\": [\n        \"焊机\",\n        \"卷尺\"\n      ],\n      \"warnings\": [\n        \"确保加强板与铲板贴合紧密，无间隙。\"\n      ],\n      \"welding\": {\n        \"required\": true,\n        \"welding_type\": \"角焊（定位焊）\",\n        \"welding_method\": \"CO2气保焊\",\n        \"weld_size\": \"点焊，焊点长度10mm，高度4mm\",\n        \"welding_position\": \"零件③、④与零件①的连接处，主要为平焊位置\",\n        \"quality_requirements\": \"点焊应在加强板边缘均匀分布，确保零件贴合紧密，防止焊接变形。\",\n        \"safety_notes\": \"清理焊接区域的油污和锈蚀，防止产生气孔。注意焊机接地良好。\"\n      },\n      \"safety_warnings\": [\n        \"佩戴焊接面罩和防护手套，防止弧光灼伤。\",\n        \"清理工件边缘的毛刺和飞边，防止装配时割伤手。\",\n        \"点焊时注意工件温度，避免烫伤。\"\n      ]\n    },\n    {\n      \"step_number\": 4,\n      \"action\": \"安装底部连接板和前油缸固定板\",\n      \"description\": \"将6块图纸上标注为⑤的底部连接板（01.01.01.11521）和2块⑥号前油缸固定板（01.01.01.11522）安装在①号左铲板的底部内侧。⑤号连接板需均匀分布，⑥号固定板安装在指定位置，确保油缸安装孔位对齐。\",\n      \"position_description\": \"安装在①号左铲板的底部内侧，靠近铲板边缘。\",\n      \"parts_used\": [\n        {\n          \"bom_seq\": \"5\",\n          \"bom_name\": \"底部连接板 6\",\n          \"quantity\": 6,\n          \"drawing_number\": \"⑤\",\n          \"node_name\": [\n            \"NAUO15\",\n            \"NAUO14\",\n            \"NAUO13\",\n            \"NAUO12\",\n            \"NAUO6\",\n            \"NAUO5\"\n          ],\n          \"bom_code\": \"01.01.01.11521\"\n        },\n        {\n          \"bom_seq\": \"6\",\n          \"bom_name\": \"前油缸固定板 2\",\n          \"quantity\": 2,\n          \"drawing_number\": \"⑥\",\n          \"node_name\": [\n            \"NAUO8\",\n            \"NAUO7\"\n          ],\n          \"bom_code\": \"01.01.01.11522\"\n        }\n      ],\n      \"tools\": [\n        \"焊机\",\n        \"卡尺\"\n      ],\n      \"warnings\": [\n        \"⑥号前油缸固定板的孔位中心距必须符合图纸要求。\"\n      ],\n      \"welding\": {\n        \"required\": true,\n        \"welding_type\": \"角焊（定位焊）\",\n        \"welding_method\": \"CO2气保焊\",\n        \"weld_size\": \"点焊，焊点长度10mm，高度4mm\",\n        \"welding_position\": \"零件⑤、⑥与零件①的连接处，主要为平焊位置\",\n        \"quality_requirements\": \"⑥号固定板的定位精度要求高，点焊后需复核孔位中心距和垂直度。\",\n        \"safety_notes\": \"注意保护⑥号固定板上的机加工孔，避免焊渣飞溅进入孔内。\"\n      },\n      \"safety_warnings\": [\n        \"搬运小零件时，注意边缘锋利，佩戴防护手套防止割伤。\",\n        \"点焊时，使用防火材料或挡板遮盖机加工孔，防止焊渣飞溅损坏孔位精度。\",\n        \"确保焊机电流稳定，防止飞溅过多造成烫伤。\"\n      ]\n    },\n    {\n      \"step_number\": 5,\n      \"action\": \"安装弹簧固定板\",\n      \"description\": \"安装1块⑦号前弹簧固定板（01.01.01.11523）和2块⑧号后弹簧固定板（01.01.01.11524）。⑦号固定板安装在铲板内侧中部，⑧号固定板安装在后部，确保弹簧安装孔位朝向正确。\",\n      \"position_description\": \"⑦号安装在内侧中部，⑧号安装在内侧后部。\",\n      \"parts_used\": [\n        {\n          \"bom_seq\": \"7\",\n          \"bom_name\": \"前弹簧固定板 1\",\n          \"quantity\": 1,\n          \"drawing_number\": \"⑦\",\n          \"node_name\": [\n            \"NAUO9\"\n          ],\n          \"bom_code\": \"01.01.01.11523\"\n        },\n        {\n          \"bom_seq\": \"8\",\n          \"bom_name\": \"后弹簧固定板 2\",\n          \"quantity\": 2,\n          \"drawing_number\": \"⑧\",\n          \"node_name\": [\n            \"NAUO11\",\n            \"NAUO10\"\n          ],\n          \"bom_code\": \"01.01.01.11524\"\n        }\n      ],\n      \"tools\": [\n        \"焊机\",\n        \"卷尺\"\n      ],\n      \"warnings\": [\n        \"弹簧固定板的安装位置是关键受力点，焊接必须牢固。\"\n      ],\n      \"welding\": {\n        \"required\": true,\n        \"welding_type\": \"角焊（定位焊）\",\n        \"welding_method\": \"CO2气保焊\",\n        \"weld_size\": \"点焊，焊点长度10mm，高度4mm\",\n        \"welding_position\": \"零件⑦、⑧与零件①的连接处，主要为平焊位置\",\n        \"quality_requirements\": \"确保固定板与铲板贴合紧密，点焊牢固，防止后续满焊时发生位移。\",\n        \"safety_notes\": \"焊接时注意调整电流和电压，避免烧穿薄板区域。\"\n      },\n      \"safety_warnings\": [\n        \"佩戴焊接面罩和防护手套，防止弧光和高温烫伤。\",\n        \"调整焊机参数时，必须断电操作，防止触电。\",\n        \"焊接时注意观察工件，避免因热量集中导致工件变形或烧穿。\"\n      ]\n    },\n    {\n      \"step_number\": 6,\n      \"action\": \"安装支撑固定板和轴套加强板\",\n      \"description\": \"安装1块⑨号支撑固定板（01.01.01.11525）和2块⑩号轴套加强板（01.01.01.11526）。⑨号固定板安装在铲板内侧的指定位置，⑩号加强板安装在铲板两侧的轴套安装区域。\",\n      \"position_description\": \"⑨号安装在内侧，⑩号安装在两侧边缘。\",\n      \"parts_used\": [\n        {\n          \"bom_seq\": \"9\",\n          \"bom_name\": \"支撑固定板 1\",\n          \"quantity\": 1,\n          \"drawing_number\": \"⑨\",\n          \"node_name\": [\n            \"NAUO16\"\n          ],\n          \"bom_code\": \"01.01.01.11525\"\n        },\n        {\n          \"bom_seq\": \"10\",\n          \"bom_name\": \"轴套加强板 2\",\n          \"quantity\": 2,\n          \"drawing_number\": \"⑩\",\n          \"node_name\": [\n            \"NAUO18\",\n            \"NAUO17\"\n          ],\n          \"bom_code\": \"01.01.01.11526\"\n        }\n      ],\n      \"tools\": [\n        \"焊机\"\n      ],\n      \"warnings\": [\n        \"⑩号轴套加强板的定位精度影响后续轴套安装。\"\n      ],\n      \"welding\": {\n        \"required\": true,\n        \"welding_type\": \"角焊（定位焊）\",\n        \"welding_method\": \"CO2气保焊\",\n        \"weld_size\": \"点焊，焊点长度10mm，高度4mm\",\n        \"welding_position\": \"零件⑨、⑩与零件①的连接处，主要为平焊位置\",\n        \"quality_requirements\": \"⑩号加强板的定位必须精确，确保与轴套安装孔同心。\",\n        \"safety_notes\": \"焊接前检查焊机电缆和气管是否完好，防止漏电或漏气。\"\n      },\n      \"safety_warnings\": [\n        \"焊接前必须检查焊机电缆和气管，确保无破损、无漏电、无漏气。\",\n        \"点焊时，注意保持身体平衡，避免被电缆绊倒。\",\n        \"焊机出现故障应立即停机，由专业电工维修，严禁私自拆修。\"\n      ]\n    },\n    {\n      \"step_number\": 7,\n      \"action\": \"安装反光片安装板\",\n      \"description\": \"安装1块⑪号反光片安装板（01.01.01.11527）。将其焊接到铲板外侧上部，确保安装板的平面朝外，便于后续安装反光片。\",\n      \"position_description\": \"安装在①号左铲板的外侧上部。\",\n      \"parts_used\": [\n        {\n          \"bom_seq\": \"11\",\n          \"bom_name\": \"反光片安装板 1\",\n          \"quantity\": 1,\n          \"drawing_number\": \"⑪\",\n          \"node_name\": [\n            \"NAUO19\"\n          ],\n          \"bom_code\": \"01.01.01.11527\"\n        }\n      ],\n      \"tools\": [\n        \"焊机\"\n      ],\n      \"warnings\": [\n        \"反光片安装板的焊接位置需避开反光片安装孔。\"\n      ],\n      \"welding\": {\n        \"required\": true,\n        \"welding_type\": \"角焊（定位焊）\",\n        \"welding_method\": \"CO2气保焊\",\n        \"weld_size\": \"点焊，焊点长度10mm，高度4mm\",\n        \"welding_position\": \"零件⑪与零件①的连接处，主要为横焊位置\",\n        \"quality_requirements\": \"定位焊后检查安装板的平面度，确保反光片能平整安装。\",\n        \"safety_notes\": \"由于是外侧焊接，注意防止焊渣飞溅到周围已安装的零件上。\"\n      },\n      \"safety_warnings\": [\n        \"焊接时注意焊渣飞溅方向，防止溅到身体或周围人员。\",\n        \"如果需要弯腰或探身焊接，注意保持身体稳定，防止跌倒或碰撞。\",\n        \"焊接完成后，立即清理焊渣，防止他人接触高温焊渣烫伤。\"\n      ]\n    },\n    {\n      \"step_number\": 8,\n      \"action\": \"安装轴套\",\n      \"description\": \"将2个⑫号轴套（01.01.02.1222）安装到铲板两侧的轴套安装孔位上，并与⑩号轴套加强板对齐。轴套需与铲板和加强板满焊连接。\",\n      \"position_description\": \"安装在铲板两侧的轴承孔位。\",\n      \"parts_used\": [\n        {\n          \"bom_seq\": \"12\",\n          \"bom_name\": \"轴套 2\",\n          \"quantity\": 2,\n          \"drawing_number\": \"⑫\",\n          \"node_name\": [\n          \"NAUO21\",\n          \"NAUO20\"\n          ],\n          \"bom_code\": \"01.01.02.1222\"\n        }\n      ],\n      \"tools\": [\n        \"焊机\",\n        \"塞规\"\n      ],\n      \"warnings\": [\n        \"轴套的内孔不能被焊渣污染，焊接时注意保护。轴套端面需与加强板端面配合，焊缝需饱满。\"\n      ],\n      \"welding\": {\n        \"required\": true,\n        \"welding_type\": \"角焊/环形焊（满焊）\",\n        \"welding_method\": \"CO2气保焊\",\n        \"weld_size\": \"焊脚高度6mm，环形连续焊\",\n        \"welding_position\": \"零件⑫与零件①和⑩的连接处，主要为平焊和横焊位置\",\n        \"quality_requirements\": \"焊缝必须连续、饱满，无未焊透、气孔等缺陷。焊后需清理焊渣，并用塞规检查轴套内孔是否变形。\",\n        \"safety_notes\": \"轴套焊接属于关键受力部位，应采用分段、对称焊接，控制热输入，防止轴套变形。焊接时需使用防火材料遮盖轴套内孔。\"\n      },\n      \"safety_warnings\": [\n        \"轴套满焊属于关键受力焊缝，必须严格按照分段、对称焊接工艺，防止应力集中导致结构开裂。\",\n        \"焊接时必须使用防火材料（如湿石棉布）遮盖轴套内孔，防止焊渣飞溅或高温导致轴套变形。\",\n        \"焊后清理焊渣时，佩戴防护眼镜，防止焊渣飞溅伤眼。\",\n        \"清理焊渣和打磨时，确保工作区域通风良好，佩戴防尘口罩。\"\n      ]\n    },\n    {\n      \"step_number\": 9,\n      \"action\": \"安装方形板\",\n      \"description\": \"安装1块⑬号方形板 1（01.01.01.11528）和1块⑭号方形板 3（01.01.01.11529）。这两个方形板安装在铲板内侧的指定位置，用于后续连接，需确保焊接牢固。\",\n      \"position_description\": \"安装在铲板内侧，靠近后部。\",\n      \"parts_used\": [\n        {\n          \"bom_seq\": \"13\",\n          \"bom_name\": \"方形板 1\",\n          \"quantity\": 1,\n          \"drawing_number\": \"⑬\"\n        },\n        {\n          \"bom_seq\": \"14\",\n          \"bom_name\": \"方形板 3\",\n          \"quantity\": 1,\n          \"drawing_number\": \"⑭\",\n          \"node_name\": [\n            \"NAUO24\",\n            \"NAUO23\",\n            \"NAUO22\"\n          ],\n          \"bom_code\": \"01.01.01.11529\"\n        }\n      ],\n      \"tools\": [\n        \"焊机\"\n      ],\n      \"warnings\": [\n        \"确保方形板的安装方向和角度符合图纸要求。\"\n      ],\n      \"welding\": {\n        \"required\": true,\n        \"welding_type\": \"角焊（定位焊）\",\n        \"welding_method\": \"CO2气保焊\",\n        \"weld_size\": \"点焊，焊点长度10mm，高度4mm\",\n        \"welding_position\": \"零件⑬、⑭与零件①的连接处，主要为平焊位置\",\n        \"quality_requirements\": \"定位焊后检查方形板的相对位置和角度，确保符合装配要求。\",\n        \"safety_notes\": \"注意焊接烟尘的排放，确保排风系统正常工作。\"\n      },\n      \"safety_warnings\": [\n        \"确保排风系统（或通风设备）正常工作，防止焊接烟尘浓度过高导致中毒。\",\n        \"佩戴防尘口罩和防护眼镜，防止吸入烟尘和飞溅物。\",\n        \"焊接作业时，工作区域必须保持整洁，避免绊倒。\"\n      ]\n    },\n    {\n      \"step_number\": 10,\n      \"action\": \"安装左铲雪板加强板\",\n      \"description\": \"安装2块⑮号左铲雪板加强板 2（01.02.01.4983）。将它们焊接到铲板内侧的指定加强筋位置，以增强铲板的整体刚度。\",\n      \"position_description\": \"安装在铲板内侧，作为加强筋。\",\n      \"parts_used\": [\n        {\n          \"bom_seq\": \"15\",\n          \"bom_name\": \"左铲雪板加强板 2\",\n          \"quantity\": 2,\n          \"drawing_number\": \"⑮\",\n          \"node_name\": [\n            \"NAUO26\",\n            \"NAUO25\"\n          ],\n          \"bom_code\": \"01.02.01.4983\"\n        }\n      ],\n      \"tools\": [\n        \"焊机\"\n      ],\n      \"warnings\": [\n        \"加强板焊接需连续，确保应力均匀分布。\"\n      ],\n      \"welding\": {\n        \"required\": true,\n        \"welding_type\": \"角焊（定位焊）\",\n        \"welding_method\": \"CO2气保焊\",\n        \"weld_size\": \"点焊，焊点长度10mm，高度4mm\",\n        \"welding_position\": \"零件⑮与零件①的连接处，主要为平焊位置\",\n        \"quality_requirements\": \"加强板与铲板的贴合度要高，点焊时应施加压力，消除间隙。\",\n        \"safety_notes\": \"避免在同一区域连续点焊，防止局部热量集中导致变形。\"\n      },\n      \"safety_warnings\": [\n        \"搬运加强板时，注意板材边缘锋利，必须佩戴防割手套。\",\n        \"点焊时，使用夹具固定加强板，防止因热胀冷缩导致零件位移或弹开伤人。\",\n        \"避免在同一区域连续施焊，防止局部过热导致工件烫伤。\"\n      ]\n    },\n    {\n      \"step_number\": 11,\n      \"action\": \"满焊所有零件\",\n      \"description\": \"对所有已点焊固定的零件（②至⑮）进行满焊。焊接前清理焊缝区域，确保焊缝尺寸和质量符合技术要求。注意图纸上标注的'折弯时内侧焊缝完整'和'此面不焊接'的要求。\",\n      \"position_description\": \"所有连接面。\",\n      \"parts_used\": [],\n      \"tools\": [\n        \"焊机\",\n        \"焊渣锤\",\n        \"钢丝刷\"\n      ],\n      \"warnings\": [\n        \"严格控制焊接变形，必要时采用对称、分段焊接。所有焊缝必须无气孔、夹渣、裂纹等缺陷。\"\n      ],\n      \"welding\": {\n        \"required\": true,\n        \"welding_type\": \"角焊（满焊）\",\n        \"welding_method\": \"CO2气保焊\",\n        \"weld_size\": \"焊脚高度6mm（未标注尺寸按6mm执行），连续焊\",\n        \"welding_position\": \"所有加强板、固定板与铲板的连接处，需进行翻转操作以保证平焊位置\",\n        \"quality_requirements\": \"焊缝外观应均匀、成形良好，焊波平整。焊后进行外观检查，关键受力焊缝（如轴套、油缸固定板）需进行磁粉检测（MT）或渗透检测（PT），确保无表面裂纹。\",\n        \"safety_notes\": \"进行大面积满焊时，必须穿戴全套防护服，防止高温烫伤。采用分段跳焊工艺，控制整体温升，防止结构件产生大的角变形。注意图纸要求'此面不焊接'的区域，严禁施焊。\"\n      },\n      \"safety_warnings\": [\n        \"满焊作业必须穿戴全套焊接防护服、面罩和手套，防止大面积高温烫伤和弧光伤害。\",\n        \"进行翻转操作时，必须使用行车或专用翻转工装，确保吊装平稳，防止工件坠落或倾倒。\",\n        \"使用焊渣锤清理焊渣时，必须佩戴防护眼镜，防止焊渣飞溅伤眼。\",\n        \"满焊过程中产生的热量高，注意工件周围环境，防止引燃易燃物，并确保灭火器材随时可用。\",\n        \"严格遵守'此面不焊接'的要求，避免因误焊造成结构缺陷或安全隐患。\"\n      ]\n    }\n  ]\n}\n```",
  "parsed_result": {
    "enhanced_steps": [
      {
        "step_number": 1,
        "action": "放置基准件",
        "description": "将图纸上标注为①的左铲板（01.01.01.18598）平稳放置在焊接工作台上，作为装配基准。确保铲板内侧（有安装孔的一侧）朝上。",
        "position_description": "铲板内侧朝上，平放于工作台。",
        "parts_used": [
          {
            "bom_seq": "1",
            "bom_name": "左铲板 1",
            "quantity": 1,
            "drawing_number": "①",
            "node_name": [
              "NAUO1"
            ],
            "bom_code": "01.01.01.18598"
          }
        ],
        "tools": [
          "行车/吊具",
          "水平仪"
        ],
        "warnings": [
          "吊装时注意平衡，防止零件倾倒。"
        ],
        "safety_warnings": [
          "吊装前检查吊索具是否完好，捆绑必须牢固，防止重物坠落伤人。",
          "吊装区域内严禁站人，操作人员必须佩戴安全帽和防护手套。",
          "指挥信号必须清晰准确，吊物起升和移动速度要缓慢平稳。"
        ]
      },
      {
        "step_number": 2,
        "action": "安装方形板-机加",
        "description": "将图纸上标注为②的方形板-机加（01.01.01.18599）放置在①号左铲板的后部边缘，对齐定位孔。该零件用于后续连接，需确保其安装面与铲板垂直。",
        "position_description": "安装在①号左铲板的后部边缘，与铲板垂直。",
        "parts_used": [
          {
            "bom_seq": "2",
            "bom_name": "方形板-机加 1",
            "quantity": 1,
            "drawing_number": "②",
            "node_name": [
              "NAUO2"
            ],
            "bom_code": "01.01.01.18599"
          }
        ],
        "tools": [
          "焊机",
          "角尺"
        ],
        "warnings": [
          "点焊固定前，必须使用角尺检查垂直度。"
        ],
        "welding": {
          "required": true,
          "welding_type": "角焊（定位焊）",
          "welding_method": "CO2气保焊",
          "weld_size": "点焊，焊点长度10-15mm，高度4mm",
          "welding_position": "零件②与零件①的连接处，主要为平焊和横焊位置",
          "quality_requirements": "点焊位置应均匀分布，确保零件定位准确，垂直度误差小于1mm。",
          "safety_notes": "佩戴焊接面罩和防护手套，确保工作区域通风良好，防止火花飞溅。"
        },
        "safety_warnings": [
          "佩戴焊接面罩、防护手套和防护服，防止弧光灼伤和焊渣烫伤。",
          "确保焊机接地良好，电缆无破损，防止触电。",
          "焊接区域必须通风良好，防止吸入有害烟尘。",
          "点焊时注意焊渣飞溅，周围不得有易燃易爆物品。"
        ]
      },
      {
        "step_number": 3,
        "action": "安装后加强板和前加强板",
        "description": "将图纸上标注为③的后加强板（01.01.01.11519）和④的前加强板（01.01.01.18600）安装在①号左铲板的内侧，按照图纸尺寸定位。先点焊固定。",
        "position_description": "③号后加强板和④号前加强板安装在①号左铲板的内侧，沿铲板弧度走向。",
        "parts_used": [
          {
            "bom_seq": "3",
            "bom_name": "后加强板 1",
            "quantity": 1,
            "drawing_number": "③",
            "node_name": [
              "NAUO3"
            ],
            "bom_code": "01.01.01.11519"
          },
          {
            "bom_seq": "4",
            "bom_name": "前加强板 1",
            "quantity": 1,
            "drawing_number": "④",
            "node_name": [
              "NAUO4"
            ],
            "bom_code": "01.01.01.18600"
          }
        ],
        "tools": [
          "焊机",
          "卷尺"
        ],
        "warnings": [
          "确保加强板与铲板贴合紧密，无间隙。"
        ],
        "welding": {
          "required": true,
          "welding_type": "角焊（定位焊）",
          "welding_method": "CO2气保焊",
          "weld_size": "点焊，焊点长度10mm，高度4mm",
          "welding_position": "零件③、④与零件①的连接处，主要为平焊位置",
          "quality_requirements": "点焊应在加强板边缘均匀分布，确保零件贴合紧密，防止焊接变形。",
          "safety_notes": "清理焊接区域的油污和锈蚀，防止产生气孔。注意焊机接地良好。"
        },
        "safety_warnings": [
          "佩戴焊接面罩和防护手套，防止弧光灼伤。",
          "清理工件边缘的毛刺和飞边，防止装配时割伤手。",
          "点焊时注意工件温度，避免烫伤。"
        ]
      },
      {
        "step_number": 4,
        "action": "安装底部连接板和前油缸固定板",
        "description": "将6块图纸上标注为⑤的底部连接板（01.01.01.11521）和2块⑥号前油缸固定板（01.01.01.11522）安装在①号左铲板的底部内侧。⑤号连接板需均匀分布，⑥号固定板安装在指定位置，确保油缸安装孔位对齐。",
        "position_description": "安装在①号左铲板的底部内侧，靠近铲板边缘。",
        "parts_used": [
          {
            "bom_seq": "5",
            "bom_name": "底部连接板 6",
            "quantity": 6,
            "drawing_number": "⑤",
            "node_name": [
              "NAUO15",
              "NAUO14",
              "NAUO13",
              "NAUO12",
              "NAUO6",
              "NAUO5"
            ],
            "bom_code": "01.01.01.11521"
          },
          {
            "bom_seq": "6",
            "bom_name": "前油缸固定板 2",
            "quantity": 2,
            "drawing_number": "⑥",
            "node_name": [
              "NAUO8",
              "NAUO7"
            ],
            "bom_code": "01.01.01.11522"
          }
        ],
        "tools": [
          "焊机",
          "卡尺"
        ],
        "warnings": [
          "⑥号前油缸固定板的孔位中心距必须符合图纸要求。"
        ],
        "welding": {
          "required": true,
          "welding_type": "角焊（定位焊）",
          "welding_method": "CO2气保焊",
          "weld_size": "点焊，焊点长度10mm，高度4mm",
          "welding_position": "零件⑤、⑥与零件①的连接处，主要为平焊位置",
          "quality_requirements": "⑥号固定板的定位精度要求高，点焊后需复核孔位中心距和垂直度。",
          "safety_notes": "注意保护⑥号固定板上的机加工孔，避免焊渣飞溅进入孔内。"
        },
        "safety_warnings": [
          "搬运小零件时，注意边缘锋利，佩戴防护手套防止割伤。",
          "点焊时，使用防火材料或挡板遮盖机加工孔，防止焊渣飞溅损坏孔位精度。",
          "确保焊机电流稳定，防止飞溅过多造成烫伤。"
        ]
      },
      {
        "step_number": 5,
        "action": "安装弹簧固定板",
        "description": "安装1块⑦号前弹簧固定板（01.01.01.11523）和2块⑧号后弹簧固定板（01.01.01.11524）。⑦号固定板安装在铲板内侧中部，⑧号固定板安装在后部，确保弹簧安装孔位朝向正确。",
        "position_description": "⑦号安装在内侧中部，⑧号安装在内侧后部。",
        "parts_used": [
          {
            "bom_seq": "7",
            "bom_name": "前弹簧固定板 1",
            "quantity": 1,
            "drawing_number": "⑦",
            "node_name": [
              "NAUO9"
            ],
            "bom_code": "01.01.01.11523"
          },
          {
            "bom_seq": "8",
            "bom_name": "后弹簧固定板 2",
            "quantity": 2,
            "drawing_number": "⑧",
            "node_name": [
              "NAUO11",
              "NAUO10"
            ],
            "bom_code": "01.01.01.11524"
          }
        ],
        "tools": [
          "焊机",
          "卷尺"
        ],
        "warnings": [
          "弹簧固定板的安装位置是关键受力点，焊接必须牢固。"
        ],
        "welding": {
          "required": true,
          "welding_type": "角焊（定位焊）",
          "welding_method": "CO2气保焊",
          "weld_size": "点焊，焊点长度10mm，高度4mm",
          "welding_position": "零件⑦、⑧与零件①的连接处，主要为平焊位置",
          "quality_requirements": "确保固定板与铲板贴合紧密，点焊牢固，防止后续满焊时发生位移。",
          "safety_notes": "焊接时注意调整电流和电压，避免烧穿薄板区域。"
        },
        "safety_warnings": [
          "佩戴焊接面罩和防护手套，防止弧光和高温烫伤。",
          "调整焊机参数时，必须断电操作，防止触电。",
          "焊接时注意观察工件，避免因热量集中导致工件变形或烧穿。"
        ]
      },
      {
        "step_number": 6,
        "action": "安装支撑固定板和轴套加强板",
        "description": "安装1块⑨号支撑固定板（01.01.01.11525）和2块⑩号轴套加强板（01.01.01.11526）。⑨号固定板安装在铲板内侧的指定位置，⑩号加强板安装在铲板两侧的轴套安装区域。",
        "position_description": "⑨号安装在内侧，⑩号安装在两侧边缘。",
        "parts_used": [
          {
            "bom_seq": "9",
            "bom_name": "支撑固定板 1",
            "quantity": 1,
            "drawing_number": "⑨",
            "node_name": [
              "NAUO16"
            ],
            "bom_code": "01.01.01.11525"
          },
          {
            "bom_seq": "10",
            "bom_name": "轴套加强板 2",
            "quantity": 2,
            "drawing_number": "⑩",
            "node_name": [
              "NAUO18",
              "NAUO17"
            ],
            "bom_code": "01.01.01.11526"
          }
        ],
        "tools": [
          "焊机"
        ],
        "warnings": [
          "⑩号轴套加强板的定位精度影响后续轴套安装。"
        ],
        "welding": {
          "required": true,
          "welding_type": "角焊（定位焊）",
          "welding_method": "CO2气保焊",
          "weld_size": "点焊，焊点长度10mm，高度4mm",
          "welding_position": "零件⑨、⑩与零件①的连接处，主要为平焊位置",
          "quality_requirements": "⑩号加强板的定位必须精确，确保与轴套安装孔同心。",
          "safety_notes": "焊接前检查焊机电缆和气管是否完好，防止漏电或漏气。"
        },
        "safety_warnings": [
          "焊接前必须检查焊机电缆和气管，确保无破损、无漏电、无漏气。",
          "点焊时，注意保持身体平衡，避免被电缆绊倒。",
          "焊机出现故障应立即停机，由专业电工维修，严禁私自拆修。"
        ]
      },
      {
        "step_number": 7,
        "action": "安装反光片安装板",
        "description": "安装1块⑪号反光片安装板（01.01.01.11527）。将其焊接到铲板外侧上部，确保安装板的平面朝外，便于后续安装反光片。",
        "position_description": "安装在①号左铲板的外侧上部。",
        "parts_used": [
          {
            "bom_seq": "11",
            "bom_name": "反光片安装板 1",
            "quantity": 1,
            "drawing_number": "⑪",
            "node_name": [
              "NAUO19"
            ],
            "bom_code": "01.01.01.11527"
          }
        ],
        "tools": [
          "焊机"
        ],
        "warnings": [
          "反光片安装板的焊接位置需避开反光片安装孔。"
        ],
        "welding": {
          "required": true,
          "welding_type": "角焊（定位焊）",
          "welding_method": "CO2气保焊",
          "weld_size": "点焊，焊点长度10mm，高度4mm",
          "welding_position": "零件⑪与零件①的连接处，主要为横焊位置",
          "quality_requirements": "定位焊后检查安装板的平面度，确保反光片能平整安装。",
          "safety_notes": "由于是外侧焊接，注意防止焊渣飞溅到周围已安装的零件上。"
        },
        "safety_warnings": [
          "焊接时注意焊渣飞溅方向，防止溅到身体或周围人员。",
          "如果需要弯腰或探身焊接，注意保持身体稳定，防止跌倒或碰撞。",
          "焊接完成后，立即清理焊渣，防止他人接触高温焊渣烫伤。"
        ]
      },
      {
        "step_number": 8,
        "action": "安装轴套",
        "description": "将2个⑫号轴套（01.01.02.1222）安装到铲板两侧的轴套安装孔位上，并与⑩号轴套加强板对齐。轴套需与铲板和加强板满焊连接。",
        "position_description": "安装在铲板两侧的轴承孔位。",
        "parts_used": [
          {
            "bom_seq": "12",
            "bom_name": "轴套 2",
            "quantity": 2,
            "drawing_number": "⑫",
            "node_name": [
              "NAUO21",
              "NAUO20"
            ],
            "bom_code": "01.01.02.1222"
          }
        ],
        "tools": [
          "焊机",
          "塞规"
        ],
        "warnings": [
          "轴套的内孔不能被焊渣污染，焊接时注意保护。轴套端面需与加强板端面配合，焊缝需饱满。"
        ],
        "welding": {
          "required": true,
          "welding_type": "角焊/环形焊（满焊）",
          "welding_method": "CO2气保焊",
          "weld_size": "焊脚高度6mm，环形连续焊",
          "welding_position": "零件⑫与零件①和⑩的连接处，主要为平焊和横焊位置",
          "quality_requirements": "焊缝必须连续、饱满，无未焊透、气孔等缺陷。焊后需清理焊渣，并用塞规检查轴套内孔是否变形。",
          "safety_notes": "轴套焊接属于关键受力部位，应采用分段、对称焊接，控制热输入，防止轴套变形。焊接时需使用防火材料遮盖轴套内孔。"
        },
        "safety_warnings": [
          "轴套满焊属于关键受力焊缝，必须严格按照分段、对称焊接工艺，防止应力集中导致结构开裂。",
          "焊接时必须使用防火材料（如湿石棉布）遮盖轴套内孔，防止焊渣飞溅或高温导致轴套变形。",
          "焊后清理焊渣时，佩戴防护眼镜，防止焊渣飞溅伤眼。",
          "清理焊渣和打磨时，确保工作区域通风良好，佩戴防尘口罩。"
        ]
      },
      {
        "step_number": 9,
        "action": "安装方形板",
        "description": "安装1块⑬号方形板 1（01.01.01.11528）和1块⑭号方形板 3（01.01.01.11529）。这两个方形板安装在铲板内侧的指定位置，用于后续连接，需确保焊接牢固。",
        "position_description": "安装在铲板内侧，靠近后部。",
        "parts_used": [
          {
            "bom_seq": "13",
            "bom_name": "方形板 1",
            "quantity": 1,
            "drawing_number": "⑬"
          },
          {
            "bom_seq": "14",
            "bom_name": "方形板 3",
            "quantity": 1,
            "drawing_number": "⑭",
            "node_name": [
              "NAUO24",
              "NAUO23",
              "NAUO22"
            ],
            "bom_code": "01.01.01.11529"
          }
        ],
        "tools": [
          "焊机"
        ],
        "warnings": [
          "确保方形板的安装方向和角度符合图纸要求。"
        ],
        "welding": {
          "required": true,
          "welding_type": "角焊（定位焊）",
          "welding_method": "CO2气保焊",
          "weld_size": "点焊，焊点长度10mm，高度4mm",
          "welding_position": "零件⑬、⑭与零件①的连接处，主要为平焊位置",
          "quality_requirements": "定位焊后检查方形板的相对位置和角度，确保符合装配要求。",
          "safety_notes": "注意焊接烟尘的排放，确保排风系统正常工作。"
        },
        "safety_warnings": [
          "确保排风系统（或通风设备）正常工作，防止焊接烟尘浓度过高导致中毒。",
          "佩戴防尘口罩和防护眼镜，防止吸入烟尘和飞溅物。",
          "焊接作业时，工作区域必须保持整洁，避免绊倒。"
        ]
      },
      {
        "step_number": 10,
        "action": "安装左铲雪板加强板",
        "description": "安装2块⑮号左铲雪板加强板 2（01.02.01.4983）。将它们焊接到铲板内侧的指定加强筋位置，以增强铲板的整体刚度。",
        "position_description": "安装在铲板内侧，作为加强筋。",
        "parts_used": [
          {
            "bom_seq": "15",
            "bom_name": "左铲雪板加强板 2",
            "quantity": 2,
            "drawing_number": "⑮",
            "node_name": [
              "NAUO26",
              "NAUO25"
            ],
            "bom_code": "01.02.01.4983"
          }
        ],
        "tools": [
          "焊机"
        ],
        "warnings": [
          "加强板焊接需连续，确保应力均匀分布。"
        ],
        "welding": {
          "required": true,
          "welding_type": "角焊（定位焊）",
          "welding_method": "CO2气保焊",
          "weld_size": "点焊，焊点长度10mm，高度4mm",
          "welding_position": "零件⑮与零件①的连接处，主要为平焊位置",
          "quality_requirements": "加强板与铲板的贴合度要高，点焊时应施加压力，消除间隙。",
          "safety_notes": "避免在同一区域连续点焊，防止局部热量集中导致变形。"
        },
        "safety_warnings": [
          "搬运加强板时，注意板材边缘锋利，必须佩戴防割手套。",
          "点焊时，使用夹具固定加强板，防止因热胀冷缩导致零件位移或弹开伤人。",
          "避免在同一区域连续施焊，防止局部过热导致工件烫伤。"
        ]
      },
      {
        "step_number": 11,
        "action": "满焊所有零件",
        "description": "对所有已点焊固定的零件（②至⑮）进行满焊。焊接前清理焊缝区域，确保焊缝尺寸和质量符合技术要求。注意图纸上标注的'折弯时内侧焊缝完整'和'此面不焊接'的要求。",
        "position_description": "所有连接面。",
        "parts_used": [],
        "tools": [
          "焊机",
          "焊渣锤",
          "钢丝刷"
        ],
        "warnings": [
          "严格控制焊接变形，必要时采用对称、分段焊接。所有焊缝必须无气孔、夹渣、裂纹等缺陷。"
        ],
        "welding": {
          "required": true,
          "welding_type": "角焊（满焊）",
          "welding_method": "CO2气保焊",
          "weld_size": "焊脚高度6mm（未标注尺寸按6mm执行），连续焊",
          "welding_position": "所有加强板、固定板与铲板的连接处，需进行翻转操作以保证平焊位置",
          "quality_requirements": "焊缝外观应均匀、成形良好，焊波平整。焊后进行外观检查，关键受力焊缝（如轴套、油缸固定板）需进行磁粉检测（MT）或渗透检测（PT），确保无表面裂纹。",
          "safety_notes": "进行大面积满焊时，必须穿戴全套防护服，防止高温烫伤。采用分段跳焊工艺，控制整体温升，防止结构件产生大的角变形。注意图纸要求'此面不焊接'的区域，严禁施焊。"
        },
        "safety_warnings": [
          "满焊作业必须穿戴全套焊接防护服、面罩和手套，防止大面积高温烫伤和弧光伤害。",
          "进行翻转操作时，必须使用行车或专用翻转工装，确保吊装平稳，防止工件坠落或倾倒。",
          "使用焊渣锤清理焊渣时，必须佩戴防护眼镜，防止焊渣飞溅伤眼。",
          "满焊过程中产生的热量高，注意工件周围环境，防止引燃易燃物，并确保灭火器材随时可用。",
          "严格遵守'此面不焊接'的要求，避免因误焊造成结构缺陷或安全隐患。"
        ]
      }
    ]
  }
}