{
  "agent_name": "Agent6_FAQ",
  "model": "google/gemini-2.5-flash-preview-09-2025",
  "timestamp": "20251005_144917",
  "image_count": 0,
  "temperature": 0.2,
  "system_prompt": "# 角色定位\n\n你是**李师傅**，一位拥有20年安全管理经验的高级安全工程师。\n\n## 教育背景\n\n- **学历**：安全工程专业本科\n- **职业资格**：注册安全工程师、高级安全评价师\n- **专业培训**：\n  - 机械制造安全管理\n  - 职业健康与安全管理体系（ISO 45001）\n  - 事故调查与分析\n  - 应急预案编制与演练\n\n## 职业背景\n\n- **工作经历**：20年机械制造企业安全管理经验，参与过大型装备制造、钢结构加工等项目\n- **专业领域**：\n  - 机械加工安全（车、铣、刨、磨、钻等）\n  - 焊接作业安全（电焊、气焊、氩弧焊等）\n  - 起重吊装安全（行车、叉车、吊索具等）\n  - 高空作业安全（脚手架、安全带、防坠落等）\n  - 个人防护用品管理（安全帽、防护眼镜、手套、安全鞋等）\n\n## 知识结构（详细）\n\n### 1. 机械伤害风险\n- **夹伤/挤伤**：手指、手臂被运动部件夹住\n- **切割伤**：锋利边缘、毛刺、切削工具\n- **碰撞伤**：头部碰撞、身体碰撞\n- **坠落伤**：零件坠落、工具坠落、人员坠落\n\n### 2. 焊接作业风险\n- **电击伤**：焊机漏电、接地不良\n- **弧光伤**：电弧紫外线灼伤眼睛和皮肤\n- **烫伤**：高温熔池、焊渣飞溅\n- **火灾爆炸**：易燃物引燃、气瓶泄漏\n- **有毒气体**：焊接烟尘、一氧化碳中毒\n\n### 3. 起重吊装风险\n- **吊物坠落**：吊索具断裂、捆绑不牢\n- **吊物摆动**：碰撞人员、设备\n- **超载**：超过起重机额定载荷\n- **指挥失误**：信号不清、违章指挥\n\n### 4. 高空作业风险\n- **人员坠落**：未系安全带、脚手架不牢\n- **物体打击**：工具、零件从高处坠落\n- **脚手架坍塌**：搭设不规范、超载\n\n### 5. 个人防护用品\n- **头部防护**：安全帽（防止碰撞、坠物打击）\n- **眼部防护**：防护眼镜、焊接面罩（防止飞溅、弧光）\n- **手部防护**：防护手套（防止切割、烫伤、化学品）\n- **足部防护**：安全鞋（防砸、防刺穿、防滑）\n- **呼吸防护**：防尘口罩、防毒面具（防止粉尘、有毒气体）\n\n### 6. 应急处理\n- **机械伤害**：立即停机、呼救、止血、固定、送医\n- **电击伤**：切断电源、心肺复苏、送医\n- **烫伤**：冷水冲洗、覆盖无菌纱布、送医\n- **火灾**：使用灭火器、疏散人员、报警\n\n## 任务步骤（Chain of Thought）\n\n你的任务是**为每个装配步骤添加安全警告**（如果该步骤有安全风险）。请按照以下5个步骤思考：\n\n### 步骤1：识别风险步骤\n- 分析每个装配步骤的操作内容\n- 判断是否涉及高风险作业（焊接、吊装、高空、重物搬运等）\n- 识别潜在的伤害类型（机械伤害、电击、烫伤、坠落等）\n\n### 步骤2：分析风险源\n- 确定风险的来源（设备、工具、材料、环境、人员操作等）\n- 评估风险的严重程度（轻微、中等、严重、致命）\n- 考虑风险的发生概率\n\n### 步骤3：制定预防措施\n- 针对每个风险源，制定具体的预防措施\n- 强调个人防护用品的使用\n- 强调安全操作规程的遵守\n\n### 步骤4：添加安全警告\n- 为每个有风险的步骤添加safety_warnings字段\n- 每条警告要简洁明了，说明具体的风险和预防措施\n- 使用工人能看懂的语言\n\n### 步骤5：验证完整性\n- 检查所有高风险步骤是否都添加了安全警告\n- 检查安全警告是否具体、可操作\n- 检查是否遗漏了任何潜在风险\n\n## 核心原则\n\n1. **步骤级嵌入**：为每个有风险的步骤添加safety_warnings字段，而不是单独列出安全警告\n2. **工人友好**：使用通俗语言，避免专业术语\n3. **具体可操作**：说明具体的风险和预防措施，而不是泛泛而谈\n4. **不重复显示**：安全警告只在下方\"安全\"标签页中统一显示，不在当前步骤详情中重复显示\n\n## 输出格式\n\n严格按照以下JSON格式输出（返回增强后的装配步骤）：\n\n```json\n{\n  \"enhanced_steps\": [\n    {\n      \"step_number\": 1,\n      \"title\": \"点焊定位\",\n      \"parts_used\": [...],\n      \"tools_required\": [...],\n      \"operation\": \"操作说明\",\n      \"quality_check\": \"质量检查\",\n      \"estimated_time_minutes\": 10,\n      \"welding\": {\n        \"required\": true,\n        \"welding_type\": \"点焊\",\n        \"welding_method\": \"CO2气保焊\",\n        ...\n      },\n      \"safety_warnings\": [\n        \"佩戴焊接面罩和防护手套，防止弧光灼伤眼睛和皮肤\",\n        \"确保工件夹紧牢固，防止点焊时位移造成伤害\",\n        \"焊接区域周围3米内不得有易燃物，配备灭火器\",\n        \"焊机必须接地良好，防止漏电触电\"\n      ]\n    },\n    {\n      \"step_number\": 2,\n      \"title\": \"螺栓连接\",\n      \"parts_used\": [...],\n      \"operation\": \"操作说明\",\n      \"quality_check\": \"质量检查\",\n      \"estimated_time_minutes\": 15,\n      \"safety_warnings\": [\n        \"佩戴安全帽和防护眼镜，防止零件坠落和飞溅\",\n        \"使用扭力扳手时注意力度，防止扳手滑脱伤人\"\n      ]\n    },\n    {\n      \"step_number\": 3,\n      \"title\": \"简单装配\",\n      \"parts_used\": [...],\n      \"operation\": \"操作说明\",\n      \"quality_check\": \"质量检查\",\n      \"estimated_time_minutes\": 5\n      // ⚠️ 如果没有明显安全风险，不添加safety_warnings字段\n    }\n  ]\n}\n```\n\n**⚠️ 关键要求**：\n\n1. **步骤级嵌入**：\n   - 为每个有风险的步骤添加`safety_warnings`字段\n   - 没有明显风险的步骤不添加`safety_warnings`字段\n   - 保持原有步骤的所有字段不变\n\n2. **安全警告要具体**：\n   - ✅ 说\"佩戴焊接面罩和防护手套，防止弧光灼伤眼睛和皮肤\"\n   - ❌ 不说\"注意安全\"\n   - ✅ 说\"焊接区域周围3米内不得有易燃物，配备灭火器\"\n   - ❌ 不说\"注意防火\"\n\n3. **使用通俗语言**：\n   - 工人能看懂的语言\n   - 避免专业术语和英文缩写\n\n4. **警告要全面**：\n   - 涵盖个人防护、设备安全、环境安全、操作安全\n   - 每条警告说明具体的风险和预防措施\n\n## 重要提醒\n\n- **只输出JSON，不要输出其他内容**\n- **保持原有字段不变**：不要修改或删除原有的字段（包括welding字段）\n- **警告要简洁明了**：每条警告一句话，说明风险和预防措施\n- **不要过度警告**：只针对有明显风险的步骤添加警告\n",
  "user_query": "请为以下装配步骤添加安全警告（如果有安全风险）。\n\n## 📸 视觉分析任务\n\n**你会看到工程图纸图片，请仔细观察：**\n\n1. **危险作业标识**：\n   - 图纸上的安全警告标识\n   - 特殊作业要求（如高空作业、吊装作业等）\n   - 危险区域标注\n\n2. **零件特征**：\n   - 重型零件（需要吊装）\n   - 锋利边缘（容易割伤）\n   - 高温部件（容易烫伤）\n\n3. **作业环境**：\n   - 狭窄空间（容易碰撞）\n   - 高空位置（容易坠落）\n   - 密闭空间（通风不良）\n\n## 装配步骤\n\n[\n  {\n    \"step_number\": 1,\n    \"action\": \"放置基准件\",\n    \"description\": \"使用行车将①号左铲板（01.01.01.18598）吊装至焊接工作台上，背面朝上，并调整至水平状态。\",\n    \"position_description\": \"左铲板背面朝上，作为后续所有零件的焊接基准。\",\n    \"parts_used\": [\n      {\n        \"bom_seq\": \"1\",\n        \"bom_name\": \"左铲板 1\",\n        \"quantity\": 1,\n        \"drawing_number\": \"1\",\n        \"node_name\": [\n          \"NAUO1\"\n        ],\n        \"bom_code\": \"01.01.01.18598\"\n      }\n    ],\n    \"tools\": [\n      \"行车\",\n      \"吊具\",\n      \"水平仪\"\n    ],\n    \"warnings\": [\n      \"吊装时注意安全，确保吊具捆绑牢固。\",\n      \"左铲板较重（28.38kg），需两人以上配合操作。\"\n    ]\n  },\n  {\n    \"step_number\": 2,\n    \"action\": \"安装主要加强板\",\n    \"description\": \"将②号方形板-机加（01.01.01.18599）和③号后加强板（01.01.01.11519）放置在①号左铲板的背面指定位置。②号方形板位于铲板中央，③号后加强板位于铲板上部边缘。\",\n    \"position_description\": \"②号方形板位于铲板背面中心区域，③号后加强板位于铲板背面顶部边缘。\",\n    \"parts_used\": [\n      {\n        \"bom_seq\": \"2\",\n        \"bom_name\": \"方形板-机加 1\",\n        \"quantity\": 1,\n        \"drawing_number\": \"2\",\n        \"node_name\": [\n          \"NAUO2\"\n        ],\n        \"bom_code\": \"01.01.01.18599\"\n      },\n      {\n        \"bom_seq\": \"3\",\n        \"bom_name\": \"后加强板 1\",\n        \"quantity\": 1,\n        \"drawing_number\": \"3\",\n        \"node_name\": [\n          \"NAUO3\"\n        ],\n        \"bom_code\": \"01.01.01.11519\"\n      }\n    ],\n    \"tools\": [\n      \"卷尺\",\n      \"划线笔\",\n      \"点焊机\"\n    ],\n    \"warnings\": [\n      \"安装前需清理焊接区域的油污和锈迹。\",\n      \"点焊时确保零件位置准确，特别是②号方形板的孔位需与铲板孔位对齐。\"\n    ],\n    \"welding\": {\n      \"required\": true,\n      \"welding_type\": \"角焊（定位焊）\",\n      \"welding_method\": \"CO2气保焊\",\n      \"weld_size\": \"点焊长度10mm，焊脚高度3mm\",\n      \"welding_position\": \"②号方形板和③号后加强板与①号左铲板的连接处，平焊\",\n      \"quality_requirements\": \"点焊牢固，防止零件在后续满焊过程中移位。点焊位置应避开最终焊缝。\",\n      \"safety_notes\": \"佩戴焊接面罩和防护手套，确保工作区域通风良好，防止点焊飞溅烫伤。\"\n    }\n  },\n  {\n    \"step_number\": 3,\n    \"action\": \"安装前加强板和底部连接板\",\n    \"description\": \"安装④号前加强板（01.01.01.18600）和⑤号底部连接板 6（01.01.01.11521）。④号前加强板位于铲板底部边缘，⑤号底部连接板共6块，均匀分布在铲板底部，与④号前加强板对齐。\",\n    \"position_description\": \"④号前加强板位于铲板底部边缘，⑤号底部连接板沿底部边缘均匀分布。\",\n    \"parts_used\": [\n      {\n        \"bom_seq\": \"4\",\n        \"bom_name\": \"前加强板 1\",\n        \"quantity\": 1,\n        \"drawing_number\": \"4\",\n        \"node_name\": [\n          \"NAUO4\"\n        ],\n        \"bom_code\": \"01.01.01.18600\"\n      },\n      {\n        \"bom_seq\": \"5\",\n        \"bom_name\": \"底部连接板 6\",\n        \"quantity\": 6,\n        \"drawing_number\": \"5\",\n        \"node_name\": [\n          \"NAUO15\",\n          \"NAUO14\",\n          \"NAUO13\",\n          \"NAUO12\",\n          \"NAUO6\",\n          \"NAUO5\"\n        ],\n        \"bom_code\": \"01.01.01.11521\"\n      }\n    ],\n    \"tools\": [\n      \"卷尺\",\n      \"卡尺\",\n      \"点焊机\"\n    ],\n    \"warnings\": [\n      \"⑤号底部连接板需确保与铲板边缘齐平，以便后续安装耐磨板。\",\n      \"点焊牢固，防止后续焊接过程中零件移位。\"\n    ],\n    \"welding\": {\n      \"required\": true,\n      \"welding_type\": \"角焊（定位焊）\",\n      \"welding_method\": \"CO2气保焊\",\n      \"weld_size\": \"点焊长度10mm，焊脚高度3mm\",\n      \"welding_position\": \"④号前加强板和⑤号底部连接板与①号左铲板的连接处，平焊\",\n      \"quality_requirements\": \"定位焊点均匀分布，确保零件贴合紧密，无间隙。\",\n      \"safety_notes\": \"检查焊机接地线是否连接可靠，防止触电。点焊时注意控制热输入，避免零件变形。\"\n    }\n  },\n  {\n    \"step_number\": 4,\n    \"action\": \"安装油缸和弹簧固定板\",\n    \"description\": \"安装⑥号前油缸固定板 2（01.01.01.11522）和⑦号前弹簧固定板 1（01.01.01.11523）。⑥号固定板安装在②号方形板两侧，⑦号固定板安装在②号方形板上方。\",\n    \"position_description\": \"⑥号固定板（2块）对称安装在②号方形板两侧，⑦号固定板安装在②号方形板上部。\",\n    \"parts_used\": [\n      {\n        \"bom_seq\": \"6\",\n        \"bom_name\": \"前油缸固定板 2\",\n        \"quantity\": 2,\n        \"drawing_number\": \"6\",\n        \"node_name\": [\n          \"NAUO8\",\n          \"NAUO7\"\n        ],\n        \"bom_code\": \"01.01.01.11522\"\n      },\n      {\n        \"bom_seq\": \"7\",\n        \"bom_name\": \"前弹簧固定板 1\",\n        \"quantity\": 1,\n        \"drawing_number\": \"7\",\n        \"node_name\": [\n          \"NAUO9\"\n        ],\n        \"bom_code\": \"01.01.01.11523\"\n      }\n    ],\n    \"tools\": [\n      \"点焊机\",\n      \"角尺\"\n    ],\n    \"warnings\": [\n      \"⑥号和⑦号固定板的孔位必须精确对齐，确保后续油缸和弹簧的顺利安装。\",\n      \"检查固定板与铲板的垂直度。\"\n    ],\n    \"welding\": {\n      \"required\": true,\n      \"welding_type\": \"角焊（定位焊）\",\n      \"welding_method\": \"CO2气保焊\",\n      \"weld_size\": \"点焊长度10mm，焊脚高度3mm\",\n      \"welding_position\": \"⑥号和⑦号固定板与①号左铲板及②号方形板的连接处，平焊\",\n      \"quality_requirements\": \"定位焊点应均匀分布在固定板四周，确保定位准确，特别是孔位精度。\",\n      \"safety_notes\": \"使用角尺或夹具固定零件，防止定位焊时零件弹开或移位。\"\n    }\n  },\n  {\n    \"step_number\": 5,\n    \"action\": \"安装后弹簧固定板和支撑固定板\",\n    \"description\": \"安装⑧号后弹簧固定板 2（01.01.01.11524）和⑨号支撑固定板 1（01.01.01.11525）。⑧号固定板安装在③号后加强板下方，⑨号支撑固定板安装在铲板背面中央偏下位置。\",\n    \"position_description\": \"⑧号固定板（2块）对称安装在③号后加强板下方，⑨号固定板位于铲板背面中部。\",\n    \"parts_used\": [\n      {\n        \"bom_seq\": \"8\",\n        \"bom_name\": \"后弹簧固定板 2\",\n        \"quantity\": 2,\n        \"drawing_number\": \"8\",\n        \"node_name\": [\n          \"NAUO11\",\n          \"NAUO10\"\n        ],\n        \"bom_code\": \"01.01.01.11524\"\n      },\n      {\n        \"bom_seq\": \"9\",\n        \"bom_name\": \"支撑固定板 1\",\n        \"quantity\": 1,\n        \"drawing_number\": \"9\",\n        \"node_name\": [\n          \"NAUO16\"\n        ],\n        \"bom_code\": \"01.01.01.11525\"\n      }\n    ],\n    \"tools\": [\n      \"点焊机\",\n      \"卷尺\"\n    ],\n    \"warnings\": [\n      \"⑧号固定板的安装位置需严格按照图纸尺寸，确保弹簧安装角度正确。\",\n      \"⑨号支撑固定板是关键受力件，点焊需牢固。\"\n    ],\n    \"welding\": {\n      \"required\": true,\n      \"welding_type\": \"角焊（定位焊）\",\n      \"welding_method\": \"CO2气保焊\",\n      \"weld_size\": \"点焊长度10mm，焊脚高度3mm\",\n      \"welding_position\": \"⑧号和⑨号固定板与①号左铲板及③号后加强板的连接处，平焊\",\n      \"quality_requirements\": \"⑨号支撑固定板定位焊点需增加至4个，确保受力稳定。\",\n      \"safety_notes\": \"清理焊丝头和导电嘴，确保焊接电流稳定，避免虚焊。\"\n    }\n  },\n  {\n    \"step_number\": 6,\n    \"action\": \"安装轴套加强板和轴套\",\n    \"description\": \"安装⑩号轴套加强板 2（01.01.01.11526）和⑫号轴套 2（01.01.02.1222）。将两块⑩号加强板焊接到铲板边缘，然后将两根⑫号轴套插入加强板的孔中，并焊接固定。注意轴套端面与加强板端面平齐。\",\n    \"position_description\": \"⑩号加强板和⑫号轴套安装在铲板两侧边缘，用于连接铲雪板与转动机构。\",\n    \"parts_used\": [\n      {\n        \"bom_seq\": \"10\",\n        \"bom_name\": \"轴套加强板 2\",\n        \"quantity\": 2,\n        \"drawing_number\": \"10\",\n        \"node_name\": [\n          \"NAUO18\",\n          \"NAUO17\"\n        ],\n        \"bom_code\": \"01.01.01.11526\"\n      },\n      {\n        \"bom_seq\": \"12\",\n        \"bom_name\": \"轴套 2\",\n        \"quantity\": 2,\n        \"drawing_number\": \"12\"\n      }\n    ],\n    \"tools\": [\n      \"点焊机\",\n      \"卡尺\",\n      \"塞尺\"\n    ],\n    \"warnings\": [\n      \"轴套与铲板组件的配合焊接需保证同轴度，焊接时避免轴套变形。\",\n      \"轴套端面需清理干净，确保焊接质量。\"\n    ],\n    \"welding\": {\n      \"required\": true,\n      \"welding_type\": \"角焊和环形焊\",\n      \"welding_method\": \"CO2气保焊\",\n      \"weld_size\": \"轴套加强板角焊焊脚高度6mm；轴套与加强板环焊焊脚高度4mm\",\n      \"welding_position\": \"⑩号加强板与①号左铲板的连接处（平焊）；⑫号轴套与⑩号加强板的连接处（环焊）\",\n      \"quality_requirements\": \"轴套焊接后，检查轴套内孔的同轴度，偏差不得超过0.5mm。焊缝必须连续，无烧穿。\",\n      \"safety_notes\": \"轴套焊接时，使用夹具或定位销固定，防止轴套在焊接热应力作用下移位或倾斜。注意控制焊接电流，避免轴套内孔变形过大。\"\n    }\n  },\n  {\n    \"step_number\": 7,\n    \"action\": \"安装反光片安装板\",\n    \"description\": \"安装⑪号反光片安装板 1（01.01.01.11527）。将⑪号安装板焊接到铲板上部边缘的指定位置。\",\n    \"position_description\": \"⑪号安装板位于铲板上部边缘，靠近轴套加强板。\",\n    \"parts_used\": [\n      {\n        \"bom_seq\": \"11\",\n        \"bom_name\": \"反光片安装板 1\",\n        \"quantity\": 1,\n        \"drawing_number\": \"11\",\n        \"node_name\": [\n          \"NAUO19\"\n        ],\n        \"bom_code\": \"01.01.01.11527\"\n      }\n    ],\n    \"tools\": [\n      \"点焊机\",\n      \"卷尺\"\n    ],\n    \"warnings\": [\n      \"反光片安装板的安装角度需符合图纸要求，确保反光效果。\"\n    ],\n    \"welding\": {\n      \"required\": true,\n      \"welding_type\": \"角焊（定位焊）\",\n      \"welding_method\": \"CO2气保焊\",\n      \"weld_size\": \"点焊长度10mm，焊脚高度3mm\",\n      \"welding_position\": \"⑪号安装板与①号左铲板的连接处，平焊\",\n      \"quality_requirements\": \"定位准确，确保安装板的平面度，便于后续反光片安装。\",\n      \"safety_notes\": \"反光片安装板较薄，定位焊时注意控制焊接时间，防止烧穿。\"\n    }\n  },\n  {\n    \"step_number\": 8,\n    \"action\": \"安装方形板\",\n    \"description\": \"安装⑬号方形板 1（01.01.01.11528）和⑭号方形板 3（01.01.01.11529）。⑬号方形板安装在铲板背面左侧，⑭号方形板安装在铲板背面右侧，靠近轴套加强板。\",\n    \"position_description\": \"⑬号和⑭号方形板分别位于铲板背面两侧，用于加强结构。\",\n    \"parts_used\": [\n      {\n        \"bom_seq\": \"13\",\n        \"bom_name\": \"方形板 1\",\n        \"quantity\": 1,\n        \"drawing_number\": \"13\"\n      },\n      {\n        \"bom_seq\": \"14\",\n        \"bom_name\": \"方形板 3\",\n        \"quantity\": 1,\n        \"drawing_number\": \"14\",\n        \"node_name\": [\n          \"NAUO24\",\n          \"NAUO23\",\n          \"NAUO22\"\n        ],\n        \"bom_code\": \"01.01.01.11529\"\n      }\n    ],\n    \"tools\": [\n      \"点焊机\",\n      \"卷尺\"\n    ],\n    \"warnings\": [\n      \"确保方形板与铲板贴合紧密，焊接时避免产生较大应力。\"\n    ],\n    \"welding\": {\n      \"required\": true,\n      \"welding_type\": \"角焊（定位焊）\",\n      \"welding_method\": \"CO2气保焊\",\n      \"weld_size\": \"点焊长度10mm，焊脚高度3mm\",\n      \"welding_position\": \"⑬号和⑭号方形板与①号左铲板的连接处，平焊\",\n      \"quality_requirements\": \"定位焊点均匀，确保方形板与铲板的贴合度，减少后续满焊时的间隙。\",\n      \"safety_notes\": \"清理焊接区域，确保无油污、锈蚀，防止焊接过程中产生大量烟雾。\"\n    }\n  },\n  {\n    \"step_number\": 9,\n    \"action\": \"安装左铲雪板加强板\",\n    \"description\": \"安装⑮号左铲雪板加强板 2（01.02.01.4983）。将两块⑮号加强板焊接到铲板上部边缘，位于反光片安装板附近。\",\n    \"position_description\": \"⑮号加强板位于铲板上部边缘，用于进一步加强铲板结构。\",\n    \"parts_used\": [\n      {\n        \"bom_seq\": \"15\",\n        \"bom_name\": \"左铲雪板加强板 2\",\n        \"quantity\": 2,\n        \"drawing_number\": \"15\",\n        \"node_name\": [\n          \"NAUO26\",\n          \"NAUO25\"\n        ],\n        \"bom_code\": \"01.02.01.4983\"\n      }\n    ],\n    \"tools\": [\n      \"点焊机\",\n      \"卷尺\"\n    ],\n    \"warnings\": [\n      \"加强板焊接需保证焊缝饱满，符合技术要求。\"\n    ],\n    \"welding\": {\n      \"required\": true,\n      \"welding_type\": \"角焊（定位焊）\",\n      \"welding_method\": \"CO2气保焊\",\n      \"weld_size\": \"点焊长度10mm，焊脚高度3mm\",\n      \"welding_position\": \"⑮号加强板与①号左铲板的连接处，平焊\",\n      \"quality_requirements\": \"定位焊点应位于加强板的四个角，确保定位稳定。\",\n      \"safety_notes\": \"检查焊枪和送丝机构，确保送丝顺畅，避免焊接中断。\"\n    }\n  },\n  {\n    \"step_number\": 10,\n    \"action\": \"满焊所有零件\",\n    \"description\": \"对所有已点焊的零件（②至⑮号）进行满焊。焊接顺序应遵循对称、分散的原则，以减少焊接变形。先焊内部结构件，再焊外部加强件。\",\n    \"position_description\": \"所有零件与①号左铲板的连接处。\",\n    \"parts_used\": [],\n    \"tools\": [\n      \"CO2焊机\",\n      \"焊钳\",\n      \"焊渣锤\"\n    ],\n    \"warnings\": [\n      \"焊接电流和电压需符合工艺要求，确保焊缝熔深和强度。\",\n      \"注意焊缝清理，不允许有夹渣、气孔、裂纹等缺陷。\",\n      \"焊接完成后，检查整体变形情况。\"\n    ],\n    \"welding\": {\n      \"required\": true,\n      \"welding_type\": \"角焊（满焊）\",\n      \"welding_method\": \"CO2气保焊\",\n      \"weld_size\": \"焊脚高度6mm（关键受力部位），焊脚高度4mm（次要部位），具体按图纸要求。\",\n      \"welding_position\": \"所有零件与左铲板的连接焊缝，主要为平焊和横焊\",\n      \"quality_requirements\": \"焊缝必须连续、饱满，外观平整，无咬边、飞溅、气孔、夹渣、裂纹等缺陷。关键焊缝（如轴套、油缸固定板）需进行磁粉检测（MT）。\",\n      \"safety_notes\": \"进行大面积焊接时，必须穿戴全套防护服、防护面罩和手套。确保工作区域通风系统全开，防止烟尘中毒。焊接过程中注意控制温度，避免局部过热导致结构变形。\"\n    }\n  }\n]\n\n## 要求\n\n请按照以下5个步骤思考，为装配步骤添加安全警告：\n\n### 步骤1：识别风险步骤\n- 分析每个装配步骤的操作内容\n- 判断是否涉及高风险作业：\n  * **焊接作业**：电击、弧光、烫伤、火灾\n  * **吊装作业**：吊物坠落、碰撞、超载\n  * **高空作业**：人员坠落、物体打击\n  * **重物搬运**：砸伤、扭伤、夹伤\n  * **机械加工**：切割伤、夹伤、碰撞\n\n### 步骤2：分析风险源\n- 确定风险的来源（设备、工具、材料、环境、人员操作等）\n- 评估风险的严重程度（轻微、中等、严重、致命）\n- 考虑风险的发生概率\n\n### 步骤3：制定预防措施\n- 针对每个风险源，制定具体的预防措施\n- 强调个人防护用品的使用：\n  * **焊接**：焊接面罩、防护手套、防护服\n  * **吊装**：安全帽、安全鞋、手套\n  * **高空**：安全带、安全帽、防滑鞋\n  * **机械**：防护眼镜、手套、安全鞋\n\n### 步骤4：添加安全警告\n- 为每个有风险的步骤添加safety_warnings字段\n- 每条警告要简洁明了，说明具体的风险和预防措施\n- 使用工人能看懂的语言\n\n### 步骤5：验证完整性\n- 检查所有高风险步骤是否都添加了安全警告\n- 检查安全警告是否具体、可操作\n- 检查是否遗漏了任何潜在风险\n\n## ⚠️ 强制自检清单（生成后必须逐项检查）\n\n**在输出JSON之前，你必须完成以下验证：**\n\n1. **风险步骤识别验证**：\n   - [ ] 所有涉及焊接、吊装、高空、重物搬运的步骤都添加了safety_warnings字段\n   - [ ] 没有明显风险的步骤没有添加safety_warnings字段\n\n2. **安全警告完整性验证**：\n   - [ ] 每个safety_warnings字段都是字符串数组\n   - [ ] 每条警告都说明了具体的风险和预防措施\n   - [ ] 涵盖了个人防护、设备安全、环境安全、操作安全\n\n3. **语言通俗性验证**：\n   - [ ] 使用工人能看懂的语言\n   - [ ] 避免专业术语和英文缩写\n   - [ ] 每条警告简洁明了（一句话）\n\n4. **原有字段保持验证**：\n   - [ ] 原有步骤的所有字段都保持不变（包括welding字段）\n   - [ ] 没有修改或删除任何原有字段\n\n**如果自检发现任何问题，必须重新生成！**\n\n现在开始为装配步骤添加安全警告！\n",
  "raw_response": "```json\n{\n  \"enhanced_steps\": [\n    {\n      \"step_number\": 1,\n      \"action\": \"放置基准件\",\n      \"description\": \"使用行车将①号左铲板（01.01.01.18598）吊装至焊接工作台上，背面朝上，并调整至水平状态。\",\n      \"position_description\": \"左铲板背面朝上，作为后续所有零件的焊接基准。\",\n      \"parts_used\": [\n        {\n          \"bom_seq\": \"1\",\n          \"bom_name\": \"左铲板 1\",\n          \"quantity\": 1,\n          \"drawing_number\": \"1\",\n          \"node_name\": [\n            \"NAUO1\"\n          ],\n          \"bom_code\": \"01.01.01.18598\"\n        }\n      ],\n      \"tools\": [\n        \"行车\",\n        \"吊具\",\n        \"水平仪\"\n      ],\n      \"warnings\": [\n        \"吊装前检查行车和吊索具是否完好，防止吊物坠落伤人\",\n        \"吊装时必须佩戴安全帽和安全鞋，并远离吊物下方\",\n        \"指挥人员应使用统一手势，确保吊物平稳起落，防止碰撞\",\n        \"左铲板边缘可能有毛刺，搬运和调整时请佩戴防护手套，防止割伤\"\n      ],\n      \"safety_warnings\": [\n        \"吊装前检查行车和吊索具是否完好，防止吊物坠落伤人\",\n        \"吊装时必须佩戴安全帽和安全鞋，并远离吊物下方\",\n        \"指挥人员应使用统一手势，确保吊物平稳起落，防止碰撞\",\n        \"左铲板边缘可能有毛刺，搬运和调整时请佩戴防护手套，防止割伤\"\n      ]\n    },\n    {\n      \"step_number\": 2,\n      \"action\": \"安装主要加强板\",\n      \"description\": \"将②号方形板-机加（01.01.01.18599）和③号后加强板（01.01.01.11519）放置在①号左铲板的背面指定位置。②号方形板位于铲板中央，③号后加强板位于铲板上部边缘。\",\n      \"position_description\": \"②号方形板位于铲板背面中心区域，③号后加强板位于铲板背面顶部边缘。\",\n      \"parts_used\": [\n        {\n          \"bom_seq\": \"2\",\n          \"bom_name\": \"方形板-机加 1\",\n          \"quantity\": 1,\n          \"drawing_number\": \"2\",\n          \"node_name\": [\n            \"NAUO2\"\n          ],\n          \"bom_code\": \"01.01.01.18599\"\n        },\n        {\n          \"bom_seq\": \"3\",\n          \"bom_name\": \"后加强板 1\",\n          \"quantity\": 1,\n          \"drawing_number\": \"3\",\n          \"node_name\": [\n            \"NAUO3\"\n          ],\n          \"bom_code\": \"01.01.01.11519\"\n        }\n      ],\n      \"tools\": [\n        \"卷尺\",\n        \"划线笔\",\n        \"点焊机\"\n      ],\n      \"warnings\": [\n        \"安装前需清理焊接区域的油污和锈迹。\",\n        \"点焊时确保零件位置准确，特别是②号方形板的孔位需与铲板孔位对齐。\"\n      ],\n      \"welding\": {\n        \"required\": true,\n        \"welding_type\": \"角焊（定位焊）\",\n        \"welding_method\": \"CO2气保焊\",\n        \"weld_size\": \"点焊长度10mm，焊脚高度3mm\",\n        \"welding_position\": \"②号方形板和③号后加强板与①号左铲板的连接处，平焊\",\n        \"quality_requirements\": \"点焊牢固，防止零件在后续满焊过程中移位。点焊位置应避开最终焊缝。\",\n        \"safety_notes\": \"佩戴焊接面罩和防护手套，确保工作区域通风良好，防止点焊飞溅烫伤。\"\n      },\n      \"safety_warnings\": [\n        \"进行点焊作业时，必须佩戴焊接面罩、防护手套和防护服，防止弧光和飞溅烫伤\",\n        \"确保点焊机接地良好，电缆绝缘完好，防止触电事故\",\n        \"点焊区域应保持清洁，清除易燃物，防止火灾\",\n        \"搬运零件时注意边缘锋利，佩戴防护手套，防止割伤\"\n      ]\n    },\n    {\n      \"step_number\": 3,\n      \"action\": \"安装前加强板和底部连接板\",\n      \"description\": \"安装④号前加强板（01.01.01.18600）和⑤号底部连接板 6（01.01.01.11521）。④号前加强板位于铲板底部边缘，⑤号底部连接板共6块，均匀分布在铲板底部，与④号前加强板对齐。\",\n      \"position_description\": \"④号前加强板位于铲板底部边缘，⑤号底部连接板沿底部边缘均匀分布。\",\n      \"parts_used\": [\n        {\n          \"bom_seq\": \"4\",\n          \"bom_name\": \"前加强板 1\",\n          \"quantity\": 1,\n          \"drawing_number\": \"4\",\n          \"node_name\": [\n            \"NAUO4\"\n          ],\n          \"bom_code\": \"01.01.01.18600\"\n        },\n        {\n          \"bom_seq\": \"5\",\n          \"bom_name\": \"底部连接板 6\",\n          \"quantity\": 6,\n          \"drawing_number\": \"5\",\n          \"node_name\": [\n            \"NAUO15\",\n            \"NAUO14\",\n            \"NAUO13\",\n            \"NAUO12\",\n            \"NAUO6\",\n            \"NAUO5\"\n          ],\n          \"bom_code\": \"01.01.01.11521\"\n        }\n      ],\n      \"tools\": [\n        \"卷尺\",\n        \"卡尺\",\n        \"点焊机\"\n      ],\n      \"warnings\": [\n        \"⑤号底部连接板需确保与铲板边缘齐平，以便后续安装耐磨板。\",\n        \"点焊牢固，防止后续焊接过程中零件移位。\"\n      ],\n      \"welding\": {\n        \"required\": true,\n        \"welding_type\": \"角焊（定位焊）\",\n        \"welding_method\": \"CO2气保焊\",\n        \"weld_size\": \"点焊长度10mm，焊脚高度3mm\",\n        \"welding_position\": \"④号前加强板和⑤号底部连接板与①号左铲板的连接处，平焊\",\n        \"quality_requirements\": \"定位焊点均匀分布，确保零件贴合紧密，无间隙。\",\n        \"safety_notes\": \"检查焊机接地线是否连接可靠，防止触电。点焊时注意控制热输入，避免零件变形。\"\n      },\n      \"safety_warnings\": [\n        \"进行点焊作业时，必须佩戴焊接面罩、防护手套和防护服，防止弧光和飞溅烫伤\",\n        \"检查焊机接地线是否连接可靠，防止漏电触电\",\n        \"使用夹具固定零件，防止点焊时零件弹开或移位造成伤害\"\n      ]\n    },\n    {\n      \"step_number\": 4,\n      \"action\": \"安装油缸和弹簧固定板\",\n      \"description\": \"安装⑥号前油缸固定板 2（01.01.01.11522）和⑦号前弹簧固定板 1（01.01.01.11523）。⑥号固定板安装在②号方形板两侧，⑦号固定板安装在②号方形板上方。\",\n      \"position_description\": \"⑥号固定板（2块）对称安装在②号方形板两侧，⑦号固定板安装在②号方形板上部。\",\n      \"parts_used\": [\n        {\n          \"bom_seq\": \"6\",\n          \"bom_name\": \"前油缸固定板 2\",\n          \"quantity\": 2,\n          \"drawing_number\": \"6\",\n          \"node_name\": [\n            \"NAUO8\",\n            \"NAUO7\"\n          ],\n          \"bom_code\": \"01.01.01.11522\"\n        },\n        {\n          \"bom_seq\": \"7\",\n          \"bom_name\": \"前弹簧固定板 1\",\n          \"quantity\": 1,\n          \"drawing_number\": \"7\",\n          \"node_name\": [\n            \"NAUO9\"\n          ],\n          \"bom_code\": \"01.01.01.11523\"\n        }\n      ],\n      \"tools\": [\n        \"点焊机\",\n        \"角尺\"\n      ],\n      \"warnings\": [\n        \"⑥号和⑦号固定板的孔位必须精确对齐，确保后续油缸和弹簧的顺利安装。\",\n        \"检查固定板与铲板的垂直度。\"\n      ],\n      \"welding\": {\n        \"required\": true,\n        \"welding_type\": \"角焊（定位焊）\",\n        \"welding_method\": \"CO2气保焊\",\n        \"weld_size\": \"点焊长度10mm，焊脚高度3mm\",\n        \"welding_position\": \"⑥号和⑦号固定板与①号左铲板及②号方形板的连接处，平焊\",\n        \"quality_requirements\": \"定位焊点应均匀分布在固定板四周，确保定位准确，特别是孔位精度。\",\n        \"safety_notes\": \"使用角尺或夹具固定零件，防止定位焊时零件弹开或移位。\"\n      },\n      \"safety_warnings\": [\n        \"进行点焊作业时，必须佩戴焊接面罩、防护手套和防护服，防止弧光和飞溅烫伤\",\n        \"使用夹具或定位销固定零件，防止定位焊时零件弹开或移位造成伤害\",\n        \"确保工作区域通风良好，防止焊接烟尘吸入\"\n      ]\n    },\n    {\n      \"step_number\": 5,\n      \"action\": \"安装后弹簧固定板和支撑固定板\",\n      \"description\": \"安装⑧号后弹簧固定板 2（01.01.01.11524）和⑨号支撑固定板 1（01.01.01.11525）。⑧号固定板安装在③号后加强板下方，⑨号支撑固定板安装在铲板背面中央偏下位置。\",\n      \"position_description\": \"⑧号固定板（2块）对称安装在③号后加强板下方，⑨号固定板位于铲板背面中部。\",\n      \"parts_used\": [\n        {\n          \"bom_seq\": \"8\",\n          \"bom_name\": \"后弹簧固定板 2\",\n          \"quantity\": 2,\n          \"drawing_number\": \"8\",\n          \"node_name\": [\n            \"NAUO11\",\n            \"NAUO10\"\n          ],\n          \"bom_code\": \"01.01.01.11524\"\n        },\n        {\n          \"bom_seq\": \"9\",\n          \"bom_name\": \"支撑固定板 1\",\n          \"quantity\": 1,\n          \"drawing_number\": \"9\",\n          \"node_name\": [\n            \"NAUO16\"\n          ],\n          \"bom_code\": \"01.01.01.11525\"\n        }\n      ],\n      \"tools\": [\n        \"点焊机\",\n        \"卷尺\"\n      ],\n      \"warnings\": [\n        \"⑧号固定板的安装位置需严格按照图纸尺寸，确保弹簧安装角度正确。\",\n        \"⑨号支撑固定板是关键受力件，点焊需牢固。\"\n      ],\n      \"welding\": {\n        \"required\": true,\n        \"welding_type\": \"角焊（定位焊）\",\n        \"welding_method\": \"CO2气保焊\",\n        \"weld_size\": \"点焊长度10mm，焊脚高度3mm\",\n        \"welding_position\": \"⑧号和⑨号固定板与①号左铲板及③号后加强板的连接处，平焊\",\n        \"quality_requirements\": \"⑨号支撑固定板定位焊点需增加至4个，确保受力稳定。\",\n        \"safety_notes\": \"清理焊丝头和导电嘴，确保焊接电流稳定，避免虚焊。\"\n      },\n      \"safety_warnings\": [\n        \"进行点焊作业时，必须佩戴焊接面罩、防护手套和防护服，防止弧光和飞溅烫伤\",\n        \"清理焊丝头和导电嘴时，确保焊机断电，防止意外触电\",\n        \"注意零件边缘锋利，搬运时佩戴防护手套，防止割伤\"\n      ]\n    },\n    {\n      \"step_number\": 6,\n      \"action\": \"安装轴套加强板和轴套\",\n      \"description\": \"安装⑩号轴套加强板 2（01.01.01.11526）和⑫号轴套 2（01.01.02.1222）。将两块⑩号加强板焊接到铲板边缘，然后将两根⑫号轴套插入加强板的孔中，并焊接固定。注意轴套端面与加强板端面平齐。\",\n      \"position_description\": \"⑩号加强板和⑫号轴套安装在铲板两侧边缘，用于连接铲雪板与转动机构。\",\n      \"parts_used\": [\n        {\n          \"bom_seq\": \"10\",\n          \"bom_name\": \"轴套加强板 2\",\n          \"quantity\": 2,\n          \"drawing_number\": \"10\",\n          \"node_name\": [\n            \"NAUO18\",\n            \"NAUO17\"\n          ],\n          \"bom_code\": \"01.01.01.11526\"\n        },\n        {\n          \"bom_seq\": \"12\",\n          \"bom_name\": \"轴套 2\",\n          \"quantity\": 2,\n          \"drawing_number\": \"12\"\n        }\n      ],\n      \"tools\": [\n        \"点焊机\",\n        \"卡尺\",\n        \"塞尺\"\n      ],\n      \"warnings\": [\n        \"轴套与铲板组件的配合焊接需保证同轴度，焊接时避免轴套变形。\",\n        \"轴套端面需清理干净，确保焊接质量。\"\n      ],\n      \"welding\": {\n        \"required\": true,\n        \"welding_type\": \"角焊和环形焊\",\n        \"welding_method\": \"CO2气保焊\",\n        \"weld_size\": \"轴套加强板角焊焊脚高度6mm；轴套与加强板环焊焊脚高度4mm\",\n        \"welding_position\": \"⑩号加强板与①号左铲板的连接处（平焊）；⑫号轴套与⑩号加强板的连接处（环焊）\",\n        \"quality_requirements\": \"轴套焊接后，检查轴套内孔的同轴度，偏差不得超过0.5mm。焊缝必须连续，无烧穿。\",\n        \"safety_notes\": \"轴套焊接时，使用夹具或定位销固定，防止轴套在焊接热应力作用下移位或倾斜。注意控制焊接电流，避免轴套内孔变形过大。\"\n      },\n      \"safety_warnings\": [\n        \"进行环形焊时，必须佩戴焊接面罩和防护手套，防止弧光和飞溅烫伤\",\n        \"轴套焊接时热量集中，注意控制焊接电流和时间，防止烧穿或烫伤\",\n        \"使用夹具固定轴套，防止焊接过程中轴套移位或倾斜，造成返工或夹伤\"\n      ]\n    },\n    {\n      \"step_number\": 7,\n      \"action\": \"安装反光片安装板\",\n      \"description\": \"安装⑪号反光片安装板 1（01.01.01.11527）。将⑪号安装板焊接到铲板上部边缘的指定位置。\",\n      \"position_description\": \"⑪号安装板位于铲板上部边缘，靠近轴套加强板。\",\n      \"parts_used\": [\n        {\n          \"bom_seq\": \"11\",\n          \"bom_name\": \"反光片安装板 1\",\n          \"quantity\": 1,\n          \"drawing_number\": \"11\",\n          \"node_name\": [\n            \"NAUO19\"\n          ],\n          \"bom_code\": \"01.01.01.11527\"\n        }\n      ],\n      \"tools\": [\n        \"点焊机\",\n        \"卷尺\"\n      ],\n      \"warnings\": [\n        \"反光片安装板的安装角度需符合图纸要求，确保反光效果。\"\n      ],\n      \"welding\": {\n        \"required\": true,\n        \"welding_type\": \"角焊（定位焊）\",\n        \"welding_method\": \"CO2气保焊\",\n        \"weld_size\": \"点焊长度10mm，焊脚高度3mm\",\n        \"welding_position\": \"⑪号安装板与①号左铲板的连接处，平焊\",\n        \"quality_requirements\": \"定位准确，确保安装板的平面度，便于后续反光片安装。\",\n        \"safety_notes\": \"反光片安装板较薄，定位焊时注意控制焊接时间，防止烧穿。\"\n      },\n      \"safety_warnings\": [\n        \"进行点焊作业时，必须佩戴焊接面罩、防护手套和防护服，防止弧光和飞溅烫伤\",\n        \"反光片安装板较薄，定位焊时注意控制焊接时间，防止烧穿或烫伤\"\n      ]\n    },\n    {\n      \"step_number\": 8,\n      \"action\": \"安装方形板\",\n      \"description\": \"安装⑬号方形板 1（01.01.01.11528）和⑭号方形板 3（01.01.01.11529）。⑬号方形板安装在铲板背面左侧，⑭号方形板安装在铲板背面右侧，靠近轴套加强板。\",\n      \"position_description\": \"⑬号和⑭号方形板分别位于铲板背面两侧，用于加强结构。\",\n      \"parts_used\": [\n        {\n          \"bom_seq\": \"13\",\n          \"bom_name\": \"方形板 1\",\n          \"quantity\": 1,\n          \"drawing_number\": \"13\"\n        },\n        {\n          \"bom_seq\": \"14\",\n          \"bom_name\": \"方形板 3\",\n          \"quantity\": 1,\n          \"drawing_number\": \"14\",\n          \"node_name\": [\n            \"NAUO24\",\n            \"NAUO23\",\n            \"NAUO22\"\n          ],\n          \"bom_code\": \"01.01.01.11529\"\n        }\n      ],\n      \"tools\": [\n        \"点焊机\",\n        \"卷尺\"\n      ],\n      \"warnings\": [\n        \"确保方形板与铲板贴合紧密，焊接时避免产生较大应力。\"\n      ],\n      \"welding\": {\n        \"required\": true,\n        \"welding_type\": \"角焊（定位焊）\",\n        \"welding_method\": \"CO2气保焊\",\n        \"weld_size\": \"点焊长度10mm，焊脚高度3mm\",\n        \"welding_position\": \"⑬号和⑭号方形板与①号左铲板的连接处，平焊\",\n        \"quality_requirements\": \"定位焊点均匀，确保方形板与铲板的贴合度，减少后续满焊时的间隙。\",\n        \"safety_notes\": \"清理焊接区域，确保无油污、锈蚀，防止焊接过程中产生大量烟雾。\"\n      },\n      \"safety_warnings\": [\n        \"进行点焊作业时，必须佩戴焊接面罩、防护手套和防护服，防止弧光和飞溅烫伤\",\n        \"清理焊接区域，确保无油污、锈蚀，防止焊接过程中产生大量烟雾，必要时佩戴呼吸防护用品\"\n      ]\n    },\n    {\n      \"step_number\": 9,\n      \"action\": \"安装左铲雪板加强板\",\n      \"description\": \"安装⑮号左铲雪板加强板 2（01.02.01.4983）。将两块⑮号加强板焊接到铲板上部边缘，位于反光片安装板附近。\",\n      \"position_description\": \"⑮号加强板位于铲板上部边缘，用于进一步加强铲板结构。\",\n      \"parts_used\": [\n        {\n          \"bom_seq\": \"15\",\n          \"bom_name\": \"左铲雪板加强板 2\",\n          \"quantity\": 2,\n          \"drawing_number\": \"15\",\n          \"node_name\": [\n            \"NAUO26\",\n            \"NAUO25\"\n          ],\n          \"bom_code\": \"01.02.01.4983\"\n        }\n      ],\n      \"tools\": [\n        \"点焊机\",\n        \"卷尺\"\n      ],\n      \"warnings\": [\n        \"加强板焊接需保证焊缝饱满，符合技术要求。\"\n      ],\n      \"welding\": {\n        \"required\": true,\n        \"welding_type\": \"角焊（定位焊）\",\n        \"welding_method\": \"CO2气保焊\",\n        \"weld_size\": \"点焊长度10mm，焊脚高度3mm\",\n        \"welding_position\": \"⑮号加强板与①号左铲板的连接处，平焊\",\n        \"quality_requirements\": \"定位焊点应位于加强板的四个角，确保定位稳定。\",\n        \"safety_notes\": \"检查焊枪和送丝机构，确保送丝顺畅，避免焊接中断。\"\n      },\n      \"safety_warnings\": [\n        \"进行点焊作业时，必须佩戴焊接面罩、防护手套和防护服，防止弧光和飞溅烫伤\",\n        \"检查焊枪和送丝机构，确保送丝顺畅，避免焊接中断造成飞溅\"\n      ]\n    },\n    {\n      \"step_number\": 10,\n      \"action\": \"满焊所有零件\",\n      \"description\": \"对所有已点焊的零件（②至⑮号）进行满焊。焊接顺序应遵循对称、分散的原则，以减少焊接变形。先焊内部结构件，再焊外部加强件。\",\n      \"position_description\": \"所有零件与①号左铲板的连接处。\",\n      \"parts_used\": [],\n      \"tools\": [\n        \"CO2焊机\",\n        \"焊钳\",\n        \"焊渣锤\"\n      ],\n      \"warnings\": [\n        \"焊接电流和电压需符合工艺要求，确保焊缝熔深和强度。\",\n        \"注意焊缝清理，不允许有夹渣、气孔、裂纹等缺陷。\",\n        \"焊接完成后，检查整体变形情况。\"\n      ],\n      \"welding\": {\n        \"required\": true,\n        \"welding_type\": \"角焊（满焊）\",\n        \"welding_method\": \"CO2气保焊\",\n        \"weld_size\": \"焊脚高度6mm（关键受力部位），焊脚高度4mm（次要部位），具体按图纸要求。\",\n        \"welding_position\": \"所有零件与左铲板的连接焊缝，主要为平焊和横焊\",\n        \"quality_requirements\": \"焊缝必须连续、饱满，外观平整，无咬边、飞溅、气孔、夹渣、裂纹等缺陷。关键焊缝（如轴套、油缸固定板）需进行磁粉检测（MT）。\",\n        \"safety_notes\": \"进行大面积焊接时，必须穿戴全套防护服、防护面罩和手套。确保工作区域通风系统全开，防止烟尘中毒。焊接过程中注意控制温度，避免局部过热导致结构变形。\"\n      },\n      \"safety_warnings\": [\n        \"进行满焊作业时，必须穿戴全套防护服、焊接面罩和防护手套，防止大面积弧光灼伤和烫伤\",\n        \"确保工作区域通风系统全开，或佩戴防尘防毒口罩，防止焊接烟尘中毒\",\n        \"使用焊渣锤清理焊渣时，必须佩戴防护眼镜，防止焊渣飞溅伤眼\",\n        \"焊接完成后，工件温度很高，严禁徒手触摸，防止高温烫伤\"\n      ]\n    }\n  ]\n}\n```",
  "parsed_result": {
    "enhanced_steps": [
      {
        "step_number": 1,
        "action": "放置基准件",
        "description": "使用行车将①号左铲板（01.01.01.18598）吊装至焊接工作台上，背面朝上，并调整至水平状态。",
        "position_description": "左铲板背面朝上，作为后续所有零件的焊接基准。",
        "parts_used": [
          {
            "bom_seq": "1",
            "bom_name": "左铲板 1",
            "quantity": 1,
            "drawing_number": "1",
            "node_name": [
              "NAUO1"
            ],
            "bom_code": "01.01.01.18598"
          }
        ],
        "tools": [
          "行车",
          "吊具",
          "水平仪"
        ],
        "warnings": [
          "吊装前检查行车和吊索具是否完好，防止吊物坠落伤人",
          "吊装时必须佩戴安全帽和安全鞋，并远离吊物下方",
          "指挥人员应使用统一手势，确保吊物平稳起落，防止碰撞",
          "左铲板边缘可能有毛刺，搬运和调整时请佩戴防护手套，防止割伤"
        ],
        "safety_warnings": [
          "吊装前检查行车和吊索具是否完好，防止吊物坠落伤人",
          "吊装时必须佩戴安全帽和安全鞋，并远离吊物下方",
          "指挥人员应使用统一手势，确保吊物平稳起落，防止碰撞",
          "左铲板边缘可能有毛刺，搬运和调整时请佩戴防护手套，防止割伤"
        ]
      },
      {
        "step_number": 2,
        "action": "安装主要加强板",
        "description": "将②号方形板-机加（01.01.01.18599）和③号后加强板（01.01.01.11519）放置在①号左铲板的背面指定位置。②号方形板位于铲板中央，③号后加强板位于铲板上部边缘。",
        "position_description": "②号方形板位于铲板背面中心区域，③号后加强板位于铲板背面顶部边缘。",
        "parts_used": [
          {
            "bom_seq": "2",
            "bom_name": "方形板-机加 1",
            "quantity": 1,
            "drawing_number": "2",
            "node_name": [
              "NAUO2"
            ],
            "bom_code": "01.01.01.18599"
          },
          {
            "bom_seq": "3",
            "bom_name": "后加强板 1",
            "quantity": 1,
            "drawing_number": "3",
            "node_name": [
              "NAUO3"
            ],
            "bom_code": "01.01.01.11519"
          }
        ],
        "tools": [
          "卷尺",
          "划线笔",
          "点焊机"
        ],
        "warnings": [
          "安装前需清理焊接区域的油污和锈迹。",
          "点焊时确保零件位置准确，特别是②号方形板的孔位需与铲板孔位对齐。"
        ],
        "welding": {
          "required": true,
          "welding_type": "角焊（定位焊）",
          "welding_method": "CO2气保焊",
          "weld_size": "点焊长度10mm，焊脚高度3mm",
          "welding_position": "②号方形板和③号后加强板与①号左铲板的连接处，平焊",
          "quality_requirements": "点焊牢固，防止零件在后续满焊过程中移位。点焊位置应避开最终焊缝。",
          "safety_notes": "佩戴焊接面罩和防护手套，确保工作区域通风良好，防止点焊飞溅烫伤。"
        },
        "safety_warnings": [
          "进行点焊作业时，必须佩戴焊接面罩、防护手套和防护服，防止弧光和飞溅烫伤",
          "确保点焊机接地良好，电缆绝缘完好，防止触电事故",
          "点焊区域应保持清洁，清除易燃物，防止火灾",
          "搬运零件时注意边缘锋利，佩戴防护手套，防止割伤"
        ]
      },
      {
        "step_number": 3,
        "action": "安装前加强板和底部连接板",
        "description": "安装④号前加强板（01.01.01.18600）和⑤号底部连接板 6（01.01.01.11521）。④号前加强板位于铲板底部边缘，⑤号底部连接板共6块，均匀分布在铲板底部，与④号前加强板对齐。",
        "position_description": "④号前加强板位于铲板底部边缘，⑤号底部连接板沿底部边缘均匀分布。",
        "parts_used": [
          {
            "bom_seq": "4",
            "bom_name": "前加强板 1",
            "quantity": 1,
            "drawing_number": "4",
            "node_name": [
              "NAUO4"
            ],
            "bom_code": "01.01.01.18600"
          },
          {
            "bom_seq": "5",
            "bom_name": "底部连接板 6",
            "quantity": 6,
            "drawing_number": "5",
            "node_name": [
              "NAUO15",
              "NAUO14",
              "NAUO13",
              "NAUO12",
              "NAUO6",
              "NAUO5"
            ],
            "bom_code": "01.01.01.11521"
          }
        ],
        "tools": [
          "卷尺",
          "卡尺",
          "点焊机"
        ],
        "warnings": [
          "⑤号底部连接板需确保与铲板边缘齐平，以便后续安装耐磨板。",
          "点焊牢固，防止后续焊接过程中零件移位。"
        ],
        "welding": {
          "required": true,
          "welding_type": "角焊（定位焊）",
          "welding_method": "CO2气保焊",
          "weld_size": "点焊长度10mm，焊脚高度3mm",
          "welding_position": "④号前加强板和⑤号底部连接板与①号左铲板的连接处，平焊",
          "quality_requirements": "定位焊点均匀分布，确保零件贴合紧密，无间隙。",
          "safety_notes": "检查焊机接地线是否连接可靠，防止触电。点焊时注意控制热输入，避免零件变形。"
        },
        "safety_warnings": [
          "进行点焊作业时，必须佩戴焊接面罩、防护手套和防护服，防止弧光和飞溅烫伤",
          "检查焊机接地线是否连接可靠，防止漏电触电",
          "使用夹具固定零件，防止点焊时零件弹开或移位造成伤害"
        ]
      },
      {
        "step_number": 4,
        "action": "安装油缸和弹簧固定板",
        "description": "安装⑥号前油缸固定板 2（01.01.01.11522）和⑦号前弹簧固定板 1（01.01.01.11523）。⑥号固定板安装在②号方形板两侧，⑦号固定板安装在②号方形板上方。",
        "position_description": "⑥号固定板（2块）对称安装在②号方形板两侧，⑦号固定板安装在②号方形板上部。",
        "parts_used": [
          {
            "bom_seq": "6",
            "bom_name": "前油缸固定板 2",
            "quantity": 2,
            "drawing_number": "6",
            "node_name": [
              "NAUO8",
              "NAUO7"
            ],
            "bom_code": "01.01.01.11522"
          },
          {
            "bom_seq": "7",
            "bom_name": "前弹簧固定板 1",
            "quantity": 1,
            "drawing_number": "7",
            "node_name": [
              "NAUO9"
            ],
            "bom_code": "01.01.01.11523"
          }
        ],
        "tools": [
          "点焊机",
          "角尺"
        ],
        "warnings": [
          "⑥号和⑦号固定板的孔位必须精确对齐，确保后续油缸和弹簧的顺利安装。",
          "检查固定板与铲板的垂直度。"
        ],
        "welding": {
          "required": true,
          "welding_type": "角焊（定位焊）",
          "welding_method": "CO2气保焊",
          "weld_size": "点焊长度10mm，焊脚高度3mm",
          "welding_position": "⑥号和⑦号固定板与①号左铲板及②号方形板的连接处，平焊",
          "quality_requirements": "定位焊点应均匀分布在固定板四周，确保定位准确，特别是孔位精度。",
          "safety_notes": "使用角尺或夹具固定零件，防止定位焊时零件弹开或移位。"
        },
        "safety_warnings": [
          "进行点焊作业时，必须佩戴焊接面罩、防护手套和防护服，防止弧光和飞溅烫伤",
          "使用夹具或定位销固定零件，防止定位焊时零件弹开或移位造成伤害",
          "确保工作区域通风良好，防止焊接烟尘吸入"
        ]
      },
      {
        "step_number": 5,
        "action": "安装后弹簧固定板和支撑固定板",
        "description": "安装⑧号后弹簧固定板 2（01.01.01.11524）和⑨号支撑固定板 1（01.01.01.11525）。⑧号固定板安装在③号后加强板下方，⑨号支撑固定板安装在铲板背面中央偏下位置。",
        "position_description": "⑧号固定板（2块）对称安装在③号后加强板下方，⑨号固定板位于铲板背面中部。",
        "parts_used": [
          {
            "bom_seq": "8",
            "bom_name": "后弹簧固定板 2",
            "quantity": 2,
            "drawing_number": "8",
            "node_name": [
              "NAUO11",
              "NAUO10"
            ],
            "bom_code": "01.01.01.11524"
          },
          {
            "bom_seq": "9",
            "bom_name": "支撑固定板 1",
            "quantity": 1,
            "drawing_number": "9",
            "node_name": [
              "NAUO16"
            ],
            "bom_code": "01.01.01.11525"
          }
        ],
        "tools": [
          "点焊机",
          "卷尺"
        ],
        "warnings": [
          "⑧号固定板的安装位置需严格按照图纸尺寸，确保弹簧安装角度正确。",
          "⑨号支撑固定板是关键受力件，点焊需牢固。"
        ],
        "welding": {
          "required": true,
          "welding_type": "角焊（定位焊）",
          "welding_method": "CO2气保焊",
          "weld_size": "点焊长度10mm，焊脚高度3mm",
          "welding_position": "⑧号和⑨号固定板与①号左铲板及③号后加强板的连接处，平焊",
          "quality_requirements": "⑨号支撑固定板定位焊点需增加至4个，确保受力稳定。",
          "safety_notes": "清理焊丝头和导电嘴，确保焊接电流稳定，避免虚焊。"
        },
        "safety_warnings": [
          "进行点焊作业时，必须佩戴焊接面罩、防护手套和防护服，防止弧光和飞溅烫伤",
          "清理焊丝头和导电嘴时，确保焊机断电，防止意外触电",
          "注意零件边缘锋利，搬运时佩戴防护手套，防止割伤"
        ]
      },
      {
        "step_number": 6,
        "action": "安装轴套加强板和轴套",
        "description": "安装⑩号轴套加强板 2（01.01.01.11526）和⑫号轴套 2（01.01.02.1222）。将两块⑩号加强板焊接到铲板边缘，然后将两根⑫号轴套插入加强板的孔中，并焊接固定。注意轴套端面与加强板端面平齐。",
        "position_description": "⑩号加强板和⑫号轴套安装在铲板两侧边缘，用于连接铲雪板与转动机构。",
        "parts_used": [
          {
            "bom_seq": "10",
            "bom_name": "轴套加强板 2",
            "quantity": 2,
            "drawing_number": "10",
            "node_name": [
              "NAUO18",
              "NAUO17"
            ],
            "bom_code": "01.01.01.11526"
          },
          {
            "bom_seq": "12",
            "bom_name": "轴套 2",
            "quantity": 2,
            "drawing_number": "12"
          }
        ],
        "tools": [
          "点焊机",
          "卡尺",
          "塞尺"
        ],
        "warnings": [
          "轴套与铲板组件的配合焊接需保证同轴度，焊接时避免轴套变形。",
          "轴套端面需清理干净，确保焊接质量。"
        ],
        "welding": {
          "required": true,
          "welding_type": "角焊和环形焊",
          "welding_method": "CO2气保焊",
          "weld_size": "轴套加强板角焊焊脚高度6mm；轴套与加强板环焊焊脚高度4mm",
          "welding_position": "⑩号加强板与①号左铲板的连接处（平焊）；⑫号轴套与⑩号加强板的连接处（环焊）",
          "quality_requirements": "轴套焊接后，检查轴套内孔的同轴度，偏差不得超过0.5mm。焊缝必须连续，无烧穿。",
          "safety_notes": "轴套焊接时，使用夹具或定位销固定，防止轴套在焊接热应力作用下移位或倾斜。注意控制焊接电流，避免轴套内孔变形过大。"
        },
        "safety_warnings": [
          "进行环形焊时，必须佩戴焊接面罩和防护手套，防止弧光和飞溅烫伤",
          "轴套焊接时热量集中，注意控制焊接电流和时间，防止烧穿或烫伤",
          "使用夹具固定轴套，防止焊接过程中轴套移位或倾斜，造成返工或夹伤"
        ]
      },
      {
        "step_number": 7,
        "action": "安装反光片安装板",
        "description": "安装⑪号反光片安装板 1（01.01.01.11527）。将⑪号安装板焊接到铲板上部边缘的指定位置。",
        "position_description": "⑪号安装板位于铲板上部边缘，靠近轴套加强板。",
        "parts_used": [
          {
            "bom_seq": "11",
            "bom_name": "反光片安装板 1",
            "quantity": 1,
            "drawing_number": "11",
            "node_name": [
              "NAUO19"
            ],
            "bom_code": "01.01.01.11527"
          }
        ],
        "tools": [
          "点焊机",
          "卷尺"
        ],
        "warnings": [
          "反光片安装板的安装角度需符合图纸要求，确保反光效果。"
        ],
        "welding": {
          "required": true,
          "welding_type": "角焊（定位焊）",
          "welding_method": "CO2气保焊",
          "weld_size": "点焊长度10mm，焊脚高度3mm",
          "welding_position": "⑪号安装板与①号左铲板的连接处，平焊",
          "quality_requirements": "定位准确，确保安装板的平面度，便于后续反光片安装。",
          "safety_notes": "反光片安装板较薄，定位焊时注意控制焊接时间，防止烧穿。"
        },
        "safety_warnings": [
          "进行点焊作业时，必须佩戴焊接面罩、防护手套和防护服，防止弧光和飞溅烫伤",
          "反光片安装板较薄，定位焊时注意控制焊接时间，防止烧穿或烫伤"
        ]
      },
      {
        "step_number": 8,
        "action": "安装方形板",
        "description": "安装⑬号方形板 1（01.01.01.11528）和⑭号方形板 3（01.01.01.11529）。⑬号方形板安装在铲板背面左侧，⑭号方形板安装在铲板背面右侧，靠近轴套加强板。",
        "position_description": "⑬号和⑭号方形板分别位于铲板背面两侧，用于加强结构。",
        "parts_used": [
          {
            "bom_seq": "13",
            "bom_name": "方形板 1",
            "quantity": 1,
            "drawing_number": "13"
          },
          {
            "bom_seq": "14",
            "bom_name": "方形板 3",
            "quantity": 1,
            "drawing_number": "14",
            "node_name": [
              "NAUO24",
              "NAUO23",
              "NAUO22"
            ],
            "bom_code": "01.01.01.11529"
          }
        ],
        "tools": [
          "点焊机",
          "卷尺"
        ],
        "warnings": [
          "确保方形板与铲板贴合紧密，焊接时避免产生较大应力。"
        ],
        "welding": {
          "required": true,
          "welding_type": "角焊（定位焊）",
          "welding_method": "CO2气保焊",
          "weld_size": "点焊长度10mm，焊脚高度3mm",
          "welding_position": "⑬号和⑭号方形板与①号左铲板的连接处，平焊",
          "quality_requirements": "定位焊点均匀，确保方形板与铲板的贴合度，减少后续满焊时的间隙。",
          "safety_notes": "清理焊接区域，确保无油污、锈蚀，防止焊接过程中产生大量烟雾。"
        },
        "safety_warnings": [
          "进行点焊作业时，必须佩戴焊接面罩、防护手套和防护服，防止弧光和飞溅烫伤",
          "清理焊接区域，确保无油污、锈蚀，防止焊接过程中产生大量烟雾，必要时佩戴呼吸防护用品"
        ]
      },
      {
        "step_number": 9,
        "action": "安装左铲雪板加强板",
        "description": "安装⑮号左铲雪板加强板 2（01.02.01.4983）。将两块⑮号加强板焊接到铲板上部边缘，位于反光片安装板附近。",
        "position_description": "⑮号加强板位于铲板上部边缘，用于进一步加强铲板结构。",
        "parts_used": [
          {
            "bom_seq": "15",
            "bom_name": "左铲雪板加强板 2",
            "quantity": 2,
            "drawing_number": "15",
            "node_name": [
              "NAUO26",
              "NAUO25"
            ],
            "bom_code": "01.02.01.4983"
          }
        ],
        "tools": [
          "点焊机",
          "卷尺"
        ],
        "warnings": [
          "加强板焊接需保证焊缝饱满，符合技术要求。"
        ],
        "welding": {
          "required": true,
          "welding_type": "角焊（定位焊）",
          "welding_method": "CO2气保焊",
          "weld_size": "点焊长度10mm，焊脚高度3mm",
          "welding_position": "⑮号加强板与①号左铲板的连接处，平焊",
          "quality_requirements": "定位焊点应位于加强板的四个角，确保定位稳定。",
          "safety_notes": "检查焊枪和送丝机构，确保送丝顺畅，避免焊接中断。"
        },
        "safety_warnings": [
          "进行点焊作业时，必须佩戴焊接面罩、防护手套和防护服，防止弧光和飞溅烫伤",
          "检查焊枪和送丝机构，确保送丝顺畅，避免焊接中断造成飞溅"
        ]
      },
      {
        "step_number": 10,
        "action": "满焊所有零件",
        "description": "对所有已点焊的零件（②至⑮号）进行满焊。焊接顺序应遵循对称、分散的原则，以减少焊接变形。先焊内部结构件，再焊外部加强件。",
        "position_description": "所有零件与①号左铲板的连接处。",
        "parts_used": [],
        "tools": [
          "CO2焊机",
          "焊钳",
          "焊渣锤"
        ],
        "warnings": [
          "焊接电流和电压需符合工艺要求，确保焊缝熔深和强度。",
          "注意焊缝清理，不允许有夹渣、气孔、裂纹等缺陷。",
          "焊接完成后，检查整体变形情况。"
        ],
        "welding": {
          "required": true,
          "welding_type": "角焊（满焊）",
          "welding_method": "CO2气保焊",
          "weld_size": "焊脚高度6mm（关键受力部位），焊脚高度4mm（次要部位），具体按图纸要求。",
          "welding_position": "所有零件与左铲板的连接焊缝，主要为平焊和横焊",
          "quality_requirements": "焊缝必须连续、饱满，外观平整，无咬边、飞溅、气孔、夹渣、裂纹等缺陷。关键焊缝（如轴套、油缸固定板）需进行磁粉检测（MT）。",
          "safety_notes": "进行大面积焊接时，必须穿戴全套防护服、防护面罩和手套。确保工作区域通风系统全开，防止烟尘中毒。焊接过程中注意控制温度，避免局部过热导致结构变形。"
        },
        "safety_warnings": [
          "进行满焊作业时，必须穿戴全套防护服、焊接面罩和防护手套，防止大面积弧光灼伤和烫伤",
          "确保工作区域通风系统全开，或佩戴防尘防毒口罩，防止焊接烟尘中毒",
          "使用焊渣锤清理焊渣时，必须佩戴防护眼镜，防止焊渣飞溅伤眼",
          "焊接完成后，工件温度很高，严禁徒手触摸，防止高温烫伤"
        ]
      }
    ]
  }
}