{
  "agent_name": "Agent6_FAQ",
  "model": "google/gemini-2.5-flash-preview-09-2025",
  "timestamp": "20251005_153510",
  "image_count": 0,
  "temperature": 0.2,
  "system_prompt": "# 角色定位\n\n你是**李师傅**，一位拥有20年安全管理经验的高级安全工程师。\n\n## 教育背景\n\n- **学历**：安全工程专业本科\n- **职业资格**：注册安全工程师、高级安全评价师\n- **专业培训**：\n  - 机械制造安全管理\n  - 职业健康与安全管理体系（ISO 45001）\n  - 事故调查与分析\n  - 应急预案编制与演练\n\n## 职业背景\n\n- **工作经历**：20年机械制造企业安全管理经验，参与过大型装备制造、钢结构加工等项目\n- **专业领域**：\n  - 机械加工安全（车、铣、刨、磨、钻等）\n  - 焊接作业安全（电焊、气焊、氩弧焊等）\n  - 起重吊装安全（行车、叉车、吊索具等）\n  - 高空作业安全（脚手架、安全带、防坠落等）\n  - 个人防护用品管理（安全帽、防护眼镜、手套、安全鞋等）\n\n## 知识结构（详细）\n\n### 1. 机械伤害风险\n- **夹伤/挤伤**：手指、手臂被运动部件夹住\n- **切割伤**：锋利边缘、毛刺、切削工具\n- **碰撞伤**：头部碰撞、身体碰撞\n- **坠落伤**：零件坠落、工具坠落、人员坠落\n\n### 2. 焊接作业风险\n- **电击伤**：焊机漏电、接地不良\n- **弧光伤**：电弧紫外线灼伤眼睛和皮肤\n- **烫伤**：高温熔池、焊渣飞溅\n- **火灾爆炸**：易燃物引燃、气瓶泄漏\n- **有毒气体**：焊接烟尘、一氧化碳中毒\n\n### 3. 起重吊装风险\n- **吊物坠落**：吊索具断裂、捆绑不牢\n- **吊物摆动**：碰撞人员、设备\n- **超载**：超过起重机额定载荷\n- **指挥失误**：信号不清、违章指挥\n\n### 4. 高空作业风险\n- **人员坠落**：未系安全带、脚手架不牢\n- **物体打击**：工具、零件从高处坠落\n- **脚手架坍塌**：搭设不规范、超载\n\n### 5. 个人防护用品\n- **头部防护**：安全帽（防止碰撞、坠物打击）\n- **眼部防护**：防护眼镜、焊接面罩（防止飞溅、弧光）\n- **手部防护**：防护手套（防止切割、烫伤、化学品）\n- **足部防护**：安全鞋（防砸、防刺穿、防滑）\n- **呼吸防护**：防尘口罩、防毒面具（防止粉尘、有毒气体）\n\n### 6. 应急处理\n- **机械伤害**：立即停机、呼救、止血、固定、送医\n- **电击伤**：切断电源、心肺复苏、送医\n- **烫伤**：冷水冲洗、覆盖无菌纱布、送医\n- **火灾**：使用灭火器、疏散人员、报警\n\n## 任务步骤（Chain of Thought）\n\n你的任务是**为每个装配步骤添加安全警告**（如果该步骤有安全风险）。请按照以下5个步骤思考：\n\n### 步骤1：识别风险步骤\n- 分析每个装配步骤的操作内容\n- 判断是否涉及高风险作业（焊接、吊装、高空、重物搬运等）\n- 识别潜在的伤害类型（机械伤害、电击、烫伤、坠落等）\n\n### 步骤2：分析风险源\n- 确定风险的来源（设备、工具、材料、环境、人员操作等）\n- 评估风险的严重程度（轻微、中等、严重、致命）\n- 考虑风险的发生概率\n\n### 步骤3：制定预防措施\n- 针对每个风险源，制定具体的预防措施\n- 强调个人防护用品的使用\n- 强调安全操作规程的遵守\n\n### 步骤4：添加安全警告\n- 为每个有风险的步骤添加safety_warnings字段\n- 每条警告要简洁明了，说明具体的风险和预防措施\n- 使用工人能看懂的语言\n\n### 步骤5：验证完整性\n- 检查所有高风险步骤是否都添加了安全警告\n- 检查安全警告是否具体、可操作\n- 检查是否遗漏了任何潜在风险\n\n## 核心原则\n\n1. **步骤级嵌入**：为每个有风险的步骤添加safety_warnings字段，而不是单独列出安全警告\n2. **工人友好**：使用通俗语言，避免专业术语\n3. **具体可操作**：说明具体的风险和预防措施，而不是泛泛而谈\n4. **不重复显示**：安全警告只在下方\"安全\"标签页中统一显示，不在当前步骤详情中重复显示\n\n## 输出格式\n\n严格按照以下JSON格式输出（返回增强后的装配步骤）：\n\n```json\n{\n  \"enhanced_steps\": [\n    {\n      \"step_number\": 1,\n      \"title\": \"点焊定位\",\n      \"parts_used\": [...],\n      \"tools_required\": [...],\n      \"operation\": \"操作说明\",\n      \"quality_check\": \"质量检查\",\n      \"estimated_time_minutes\": 10,\n      \"welding\": {\n        \"required\": true,\n        \"welding_type\": \"点焊\",\n        \"welding_method\": \"CO2气保焊\",\n        ...\n      },\n      \"safety_warnings\": [\n        \"佩戴焊接面罩和防护手套，防止弧光灼伤眼睛和皮肤\",\n        \"确保工件夹紧牢固，防止点焊时位移造成伤害\",\n        \"焊接区域周围3米内不得有易燃物，配备灭火器\",\n        \"焊机必须接地良好，防止漏电触电\"\n      ]\n    },\n    {\n      \"step_number\": 2,\n      \"title\": \"螺栓连接\",\n      \"parts_used\": [...],\n      \"operation\": \"操作说明\",\n      \"quality_check\": \"质量检查\",\n      \"estimated_time_minutes\": 15,\n      \"safety_warnings\": [\n        \"佩戴安全帽和防护眼镜，防止零件坠落和飞溅\",\n        \"使用扭力扳手时注意力度，防止扳手滑脱伤人\"\n      ]\n    },\n    {\n      \"step_number\": 3,\n      \"title\": \"简单装配\",\n      \"parts_used\": [...],\n      \"operation\": \"操作说明\",\n      \"quality_check\": \"质量检查\",\n      \"estimated_time_minutes\": 5\n      // ⚠️ 如果没有明显安全风险，不添加safety_warnings字段\n    }\n  ]\n}\n```\n\n**⚠️ 关键要求**：\n\n1. **步骤级嵌入**：\n   - 为每个有风险的步骤添加`safety_warnings`字段\n   - 没有明显风险的步骤不添加`safety_warnings`字段\n   - 保持原有步骤的所有字段不变\n\n2. **安全警告要具体**：\n   - ✅ 说\"佩戴焊接面罩和防护手套，防止弧光灼伤眼睛和皮肤\"\n   - ❌ 不说\"注意安全\"\n   - ✅ 说\"焊接区域周围3米内不得有易燃物，配备灭火器\"\n   - ❌ 不说\"注意防火\"\n\n3. **使用通俗语言**：\n   - 工人能看懂的语言\n   - 避免专业术语和英文缩写\n\n4. **警告要全面**：\n   - 涵盖个人防护、设备安全、环境安全、操作安全\n   - 每条警告说明具体的风险和预防措施\n\n## 重要提醒\n\n- **只输出JSON，不要输出其他内容**\n- **保持原有字段不变**：不要修改或删除原有的字段（包括welding字段）\n- **警告要简洁明了**：每条警告一句话，说明风险和预防措施\n- **不要过度警告**：只针对有明显风险的步骤添加警告\n",
  "user_query": "请为以下装配步骤添加安全警告（如果有安全风险）。\n\n## 📸 视觉分析任务\n\n**你会看到工程图纸图片，请仔细观察：**\n\n1. **危险作业标识**：\n   - 图纸上的安全警告标识\n   - 特殊作业要求（如高空作业、吊装作业等）\n   - 危险区域标注\n\n2. **零件特征**：\n   - 重型零件（需要吊装）\n   - 锋利边缘（容易割伤）\n   - 高温部件（容易烫伤）\n\n3. **作业环境**：\n   - 狭窄空间（容易碰撞）\n   - 高空位置（容易坠落）\n   - 密闭空间（通风不良）\n\n## 装配步骤\n\n[\n  {\n    \"step_number\": 1,\n    \"action\": \"放置基准件\",\n    \"description\": \"将图纸上标注为1的左铲板（01.01.01.18598）平稳放置在装配工作台上，作为后续所有零件的装配基准。\",\n    \"position_description\": \"左铲板的内侧（有加强筋的一侧）朝上。\",\n    \"parts_used\": [\n      {\n        \"bom_seq\": \"1\",\n        \"bom_name\": \"左铲板 1\",\n        \"quantity\": 1,\n        \"drawing_number\": \"1\"\n      }\n    ],\n    \"tools\": [\n      \"行车\",\n      \"吊具\",\n      \"水平仪\"\n    ],\n    \"warnings\": [\n      \"左铲板较重（28.38kg），吊装时注意安全，确保吊具捆绑牢固。\",\n      \"放置时避免损伤漆面。\"\n    ]\n  },\n  {\n    \"step_number\": 2,\n    \"action\": \"焊接方形板-机加\",\n    \"description\": \"将图纸上标注为2的方形板-机加（01.01.01.18599）放置在1号左铲板的后部中央位置，按照图纸要求进行定位和点焊。\",\n    \"position_description\": \"方形板-机加位于左铲板的后部，与铲板的边缘保持图纸所示的尺寸关系。\",\n    \"parts_used\": [\n      {\n        \"bom_seq\": \"2\",\n        \"bom_name\": \"方形板-机加 1\",\n        \"quantity\": 1,\n        \"drawing_number\": \"2\"\n      }\n    ],\n    \"tools\": [\n      \"焊机\",\n      \"角尺\",\n      \"卷尺\"\n    ],\n    \"warnings\": [\n      \"焊接前必须清理焊接区域的漆面，露出金属光泽。\",\n      \"定位必须准确，确保后续零件的安装精度。\"\n    ],\n    \"welding\": {\n      \"required\": true,\n      \"welding_type\": \"角焊\",\n      \"welding_method\": \"CO2气保焊\",\n      \"weld_size\": \"焊脚高度6mm（图纸未标注尺寸按6mm执行）\",\n      \"welding_position\": \"零件②方形板-机加与零件①左铲板的连接处，平焊为主\",\n      \"quality_requirements\": \"先进行定位点焊，焊点长度不小于20mm，焊缝外观平整，无明显气孔、飞溅\",\n      \"safety_notes\": \"佩戴焊接面罩、防护手套和防护服。确保工作区域通风良好，避免烟尘吸入。\"\n    }\n  },\n  {\n    \"step_number\": 3,\n    \"action\": \"焊接后加强板和前加强板\",\n    \"description\": \"将图纸上标注为3的后加强板（01.01.01.11519）和标注为4的前加强板（01.01.01.18600）分别放置在1号左铲板的内侧，按照图纸所示位置进行定位和焊接。\",\n    \"position_description\": \"3号后加强板位于左铲板的后部，4号前加强板位于左铲板的前部，均位于铲板的内侧。\",\n    \"parts_used\": [\n      {\n        \"bom_seq\": \"3\",\n        \"bom_name\": \"后加强板 1\",\n        \"quantity\": 1,\n        \"drawing_number\": \"3\"\n      },\n      {\n        \"bom_seq\": \"4\",\n        \"bom_name\": \"前加强板 1\",\n        \"quantity\": 1,\n        \"drawing_number\": \"4\"\n      }\n    ],\n    \"tools\": [\n      \"焊机\",\n      \"夹具\"\n    ],\n    \"warnings\": [\n      \"加强板与左铲板的接触面必须紧密贴合，避免虚焊。\",\n      \"注意焊接变形控制。\"\n    ],\n    \"welding\": {\n      \"required\": true,\n      \"welding_type\": \"角焊\",\n      \"welding_method\": \"CO2气保焊\",\n      \"weld_size\": \"焊脚高度6mm\",\n      \"welding_position\": \"零件③后加强板和零件④前加强板与零件①左铲板的连接处，平焊\",\n      \"quality_requirements\": \"加强板与铲板的连接焊缝应连续，焊缝过渡平滑，无咬边、未焊透等缺陷。注意控制焊接电流，防止烧穿。\",\n      \"safety_notes\": \"使用夹具固定零件，防止焊接过程中零件松动或掉落。注意焊机接地良好。\"\n    }\n  },\n  {\n    \"step_number\": 4,\n    \"action\": \"焊接底部连接板\",\n    \"description\": \"将图纸上标注为5的底部连接板（01.01.01.11521）共6件，按照图纸所示的间距和位置，依次焊接到1号左铲板的底部边缘。\",\n    \"position_description\": \"底部连接板均匀分布在左铲板的底部边缘，用于后续连接。\",\n    \"parts_used\": [\n      {\n        \"bom_seq\": \"5\",\n        \"bom_name\": \"底部连接板 6\",\n        \"quantity\": 6,\n        \"drawing_number\": \"5\"\n      }\n    ],\n    \"tools\": [\n      \"焊机\",\n      \"定位尺\"\n    ],\n    \"warnings\": [\n      \"确保6个连接板的中心线在同一直线上，且与铲板边缘垂直。\",\n      \"焊缝要求连续且饱满。\"\n    ],\n    \"welding\": {\n      \"required\": true,\n      \"welding_type\": \"角焊\",\n      \"welding_method\": \"CO2气保焊\",\n      \"weld_size\": \"焊脚高度6mm\",\n      \"welding_position\": \"零件⑤底部连接板与零件①左铲板的连接处，横焊或立焊\",\n      \"quality_requirements\": \"焊缝必须连续且饱满，确保连接板的垂直度和平行度。焊后检查焊缝高度是否均匀。\",\n      \"safety_notes\": \"由于焊接位置可能涉及横焊或立焊，操作时需稳定焊枪，防止熔池下坠。注意防烫伤。\"\n    }\n  },\n  {\n    \"step_number\": 5,\n    \"action\": \"焊接前油缸固定板\",\n    \"description\": \"将图纸上标注为6的前油缸固定板（01.01.01.11522）共2件，焊接到1号左铲板的内侧，靠近前加强板（4号）的位置。\",\n    \"position_description\": \"固定板的安装孔位需与图纸尺寸严格一致，用于安装油缸。\",\n    \"parts_used\": [\n      {\n        \"bom_seq\": \"6\",\n        \"bom_name\": \"前油缸固定板 2\",\n        \"quantity\": 2,\n        \"drawing_number\": \"6\"\n      }\n    ],\n    \"tools\": [\n      \"焊机\",\n      \"定位工装\"\n    ],\n    \"warnings\": [\n      \"油缸固定板的孔位精度要求高，必须使用定位工装辅助焊接，确保孔距和垂直度。\",\n      \"焊接时避免焊渣飞溅到孔内。\"\n    ],\n    \"welding\": {\n      \"required\": true,\n      \"welding_type\": \"角焊\",\n      \"welding_method\": \"CO2气保焊\",\n      \"weld_size\": \"焊脚高度6mm\",\n      \"welding_position\": \"零件⑥前油缸固定板与零件①左铲板的连接处，平焊\",\n      \"quality_requirements\": \"焊缝必须连续，且焊后必须检查固定板的孔位尺寸和垂直度，偏差应在图纸允许范围内。焊缝表面不允许有任何裂纹。\",\n      \"safety_notes\": \"使用定位工装时，确保工装与焊件接触良好。焊接前检查焊机电缆绝缘是否完好，防止漏电。\"\n    }\n  },\n  {\n    \"step_number\": 6,\n    \"action\": \"焊接前弹簧固定板\",\n    \"description\": \"将图纸上标注为7的前弹簧固定板（01.01.01.11523）1件，焊接到1号左铲板的内侧，位于油缸固定板（6号）的上方。\",\n    \"position_description\": \"前弹簧固定板的安装位置应与图纸上的尺寸标注严格对应。\",\n    \"parts_used\": [\n      {\n        \"bom_seq\": \"7\",\n        \"bom_name\": \"前弹簧固定板 1\",\n        \"quantity\": 1,\n        \"drawing_number\": \"7\"\n      }\n    ],\n    \"tools\": [\n      \"焊机\",\n      \"卷尺\"\n    ],\n    \"warnings\": [\n      \"确保固定板的平面度，避免后续弹簧安装困难。\"\n    ],\n    \"welding\": {\n      \"required\": true,\n      \"welding_type\": \"角焊\",\n      \"welding_method\": \"CO2气保焊\",\n      \"weld_size\": \"焊脚高度6mm\",\n      \"welding_position\": \"零件⑦前弹簧固定板与零件①左铲板的连接处，平焊\",\n      \"quality_requirements\": \"焊缝连续，焊缝高度均匀。焊后检查固定板的安装面是否平整，必要时进行轻微打磨。\",\n      \"safety_notes\": \"注意控制焊接热输入，避免固定板因受热不均而产生较大变形。\"\n    }\n  },\n  {\n    \"step_number\": 7,\n    \"action\": \"焊接后弹簧固定板\",\n    \"description\": \"将图纸上标注为8的后弹簧固定板（01.01.01.11524）共2件，焊接到1号左铲板的内侧，靠近后加强板（3号）的位置。\",\n    \"position_description\": \"后弹簧固定板对称分布，用于安装后部的弹簧。\",\n    \"parts_used\": [\n      {\n        \"bom_seq\": \"8\",\n        \"bom_name\": \"后弹簧固定板 2\",\n        \"quantity\": 2,\n        \"drawing_number\": \"8\"\n      }\n    ],\n    \"tools\": [\n      \"焊机\",\n      \"定位工装\"\n    ],\n    \"warnings\": [\n      \"两块固定板的相对位置和角度必须准确，保证弹簧受力均匀。\"\n    ],\n    \"welding\": {\n      \"required\": true,\n      \"welding_type\": \"角焊\",\n      \"welding_method\": \"CO2气保焊\",\n      \"weld_size\": \"焊脚高度6mm\",\n      \"welding_position\": \"零件⑧后弹簧固定板与零件①左铲板的连接处，平焊\",\n      \"quality_requirements\": \"焊缝连续，两块固定板的中心距和相对角度必须符合图纸要求。焊后进行外观检查，确保无未熔合。\",\n      \"safety_notes\": \"使用定位工装确保对称性。焊接时注意防止焊渣飞溅到已安装的零件上。\"\n    }\n  },\n  {\n    \"step_number\": 8,\n    \"action\": \"焊接支撑固定板\",\n    \"description\": \"将图纸上标注为9的支撑固定板（01.01.01.11525）1件，焊接到1号左铲板的内侧，位于中央偏上的位置。\",\n    \"position_description\": \"支撑固定板用于连接外部支撑结构，焊接位置需参照图纸上的尺寸定位。\",\n    \"parts_used\": [\n      {\n        \"bom_seq\": \"9\",\n        \"bom_name\": \"支撑固定板 1\",\n        \"quantity\": 1,\n        \"drawing_number\": \"9\"\n      }\n    ],\n    \"tools\": [\n      \"焊机\",\n      \"角尺\"\n    ],\n    \"warnings\": [\n      \"确保支撑固定板的安装面与铲板表面垂直。\"\n    ],\n    \"welding\": {\n      \"required\": true,\n      \"welding_type\": \"角焊\",\n      \"welding_method\": \"CO2气保焊\",\n      \"weld_size\": \"焊脚高度6mm\",\n      \"welding_position\": \"零件⑨支撑固定板与零件①左铲板的连接处，平焊\",\n      \"quality_requirements\": \"焊缝连续，焊后使用角尺检查固定板与铲板的垂直度，确保偏差小于1度。\",\n      \"safety_notes\": \"焊接前清理坡口和焊接区域，确保无油污和锈蚀，防止产生气孔。\"\n    }\n  },\n  {\n    \"step_number\": 9,\n    \"action\": \"焊接轴套加强板\",\n    \"description\": \"将图纸上标注为10的轴套加强板（01.01.01.11526）共2件，焊接到1号左铲板的后部边缘，靠近2号方形板-机加的位置。\",\n    \"position_description\": \"轴套加强板用于增强轴套安装区域的强度。\",\n    \"parts_used\": [\n      {\n        \"bom_seq\": \"10\",\n        \"bom_name\": \"轴套加强板 2\",\n        \"quantity\": 2,\n        \"drawing_number\": \"10\"\n      }\n    ],\n    \"tools\": [\n      \"焊机\"\n    ],\n    \"warnings\": [\n      \"加强板的焊接位置应避开轴套的安装孔位。\"\n    ],\n    \"welding\": {\n      \"required\": true,\n      \"welding_type\": \"角焊\",\n      \"welding_method\": \"CO2气保焊\",\n      \"weld_size\": \"焊脚高度6mm\",\n      \"welding_position\": \"零件⑩轴套加强板与零件①左铲板的连接处，平焊\",\n      \"quality_requirements\": \"焊缝连续，焊缝外观平整。注意加强板与铲板的贴合度，避免间隙过大导致未焊透。\",\n      \"safety_notes\": \"控制焊接速度，确保熔深足够，达到加强效果。注意防止焊接飞溅物损伤周围零件。\"\n    }\n  },\n  {\n    \"step_number\": 10,\n    \"action\": \"焊接反光片安装板\",\n    \"description\": \"将图纸上标注为11的反光片安装板（01.01.01.11527）1件，焊接到1号左铲板的侧面边缘。\",\n    \"position_description\": \"安装板位于左铲板的侧面，用于安装反光片。\",\n    \"parts_used\": [\n      {\n        \"bom_seq\": \"11\",\n        \"bom_name\": \"反光片安装板 1\",\n        \"quantity\": 1,\n        \"drawing_number\": \"11\"\n      }\n    ],\n    \"tools\": [\n      \"焊机\"\n    ],\n    \"warnings\": [\n      \"确保安装板的安装面平整，便于后续反光片的粘贴或螺栓固定。\"\n    ],\n    \"welding\": {\n      \"required\": true,\n      \"welding_type\": \"角焊\",\n      \"welding_method\": \"CO2气保焊\",\n      \"weld_size\": \"焊脚高度4mm\",\n      \"welding_position\": \"零件⑪反光片安装板与零件①左铲板的连接处，横焊或立焊\",\n      \"quality_requirements\": \"焊缝连续，焊缝尺寸要求较小（4mm），注意控制电流，防止烧穿薄板。焊后清理焊渣，确保安装面平整。\",\n      \"safety_notes\": \"由于安装板较薄，焊接时应采用小电流、快速焊，减少热变形。注意防火，远离易燃材料。\"\n    }\n  },\n  {\n    \"step_number\": 11,\n    \"action\": \"焊接轴套\",\n    \"description\": \"将图纸上标注为12的轴套（01.01.02.1222）共2件，分别焊接到1号左铲板后部的预留孔位上，并与10号轴套加强板配合。\",\n    \"position_description\": \"轴套的中心线必须与铲板的安装面垂直，且两轴套的轴线平行。\",\n    \"parts_used\": [\n      {\n        \"bom_seq\": \"12\",\n        \"bom_name\": \"轴套 2\",\n        \"quantity\": 2,\n        \"drawing_number\": \"12\"\n      }\n    ],\n    \"tools\": [\n      \"焊机\",\n      \"定位销\",\n      \"百分表\"\n    ],\n    \"warnings\": [\n      \"轴套的焊接是关键工序，必须使用定位工装保证同轴度和垂直度。\",\n      \"焊接后检查轴套内孔，确保无焊渣和变形。\"\n    ],\n    \"welding\": {\n      \"required\": true,\n      \"welding_type\": \"角焊/环形焊\",\n      \"welding_method\": \"CO2气保焊\",\n      \"weld_size\": \"焊脚高度6mm，环形连续焊\",\n      \"welding_position\": \"零件⑫轴套与零件①左铲板的连接处，平焊或横焊\",\n      \"quality_requirements\": \"焊缝必须环形连续，焊缝饱满，无气孔、裂纹。焊后必须使用百分表或专用量具检查轴套的垂直度和同轴度，确保满足图纸要求。\",\n      \"safety_notes\": \"轴套焊接属于高精度要求，应分层、分段对称焊接，控制热输入，减少变形。焊接时注意保护轴套内孔，防止焊渣飞溅。\"\n    }\n  },\n  {\n    \"step_number\": 12,\n    \"action\": \"焊接方形板 1\",\n    \"description\": \"将图纸上标注为13的方形板 1（01.01.01.11528）1件，焊接到1号左铲板的后部，位于轴套（12号）的上方。\",\n    \"position_description\": \"方形板用于连接外部结构，焊接位置需参照图纸尺寸。\",\n    \"parts_used\": [\n      {\n        \"bom_seq\": \"13\",\n        \"bom_name\": \"方形板 1\",\n        \"quantity\": 1,\n        \"drawing_number\": \"13\"\n      }\n    ],\n    \"tools\": [\n      \"焊机\"\n    ],\n    \"warnings\": [\n      \"确保方形板的安装面平整，无焊接变形。\"\n    ],\n    \"welding\": {\n      \"required\": true,\n      \"welding_type\": \"角焊\",\n      \"welding_method\": \"CO2气保焊\",\n      \"weld_size\": \"焊脚高度6mm\",\n      \"welding_position\": \"零件⑬方形板 1与零件①左铲板的连接处，平焊\",\n      \"quality_requirements\": \"焊缝连续，焊缝外观平整。注意与周围零件（如轴套）的相对位置精度。\",\n      \"safety_notes\": \"焊接前检查焊丝伸出长度和保护气体流量，确保焊接过程稳定，减少飞溅。\"\n    }\n  },\n  {\n    \"step_number\": 13,\n    \"action\": \"焊接方形板 3\",\n    \"description\": \"将图纸上标注为14的方形板 3（01.01.01.11529）1件，焊接到1号左铲板的后部，位于13号方形板的下方。\",\n    \"position_description\": \"方形板 3与方形板 1（13号）形成一组连接结构。\",\n    \"parts_used\": [\n      {\n        \"bom_seq\": \"14\",\n        \"bom_name\": \"方形板 3\",\n        \"quantity\": 1,\n        \"drawing_number\": \"14\"\n      }\n    ],\n    \"tools\": [\n      \"焊机\"\n    ],\n    \"warnings\": [\n      \"两块方形板的相对位置必须准确，保证连接孔位对齐。\"\n    ],\n    \"welding\": {\n      \"required\": true,\n      \"welding_type\": \"角焊\",\n      \"welding_method\": \"CO2气保焊\",\n      \"weld_size\": \"焊脚高度6mm\",\n      \"welding_position\": \"零件⑭方形板 3与零件①左铲板的连接处，平焊\",\n      \"quality_requirements\": \"焊缝连续，确保两块方形板（13和14）的孔位中心线对齐。焊后进行外观检查，确保无未熔合。\",\n      \"safety_notes\": \"焊接时注意控制热量，避免因局部过热导致零件变形，影响孔位精度。\"\n    }\n  },\n  {\n    \"step_number\": 14,\n    \"action\": \"焊接左铲雪板加强板 2\",\n    \"description\": \"将图纸上标注为15的左铲雪板加强板 2（01.02.01.4983）2件，焊接到1号左铲板的内侧，位于铲板的顶部边缘。\",\n    \"position_description\": \"加强板沿铲板顶部边缘分布，用于增强铲板的刚度。\",\n    \"parts_used\": [\n      {\n        \"bom_seq\": \"15\",\n        \"bom_name\": \"左铲雪板加强板 2\",\n        \"quantity\": 2,\n        \"drawing_number\": \"15\"\n      }\n    ],\n    \"tools\": [\n      \"焊机\"\n    ],\n    \"warnings\": [\n      \"加强板与铲板的焊接必须连续，焊缝高度和宽度符合图纸要求。\"\n    ],\n    \"welding\": {\n      \"required\": true,\n      \"welding_type\": \"角焊\",\n      \"welding_method\": \"CO2气保焊\",\n      \"weld_size\": \"焊脚高度6mm\",\n      \"welding_position\": \"零件⑮左铲雪板加强板 2与零件①左铲板的连接处，平焊\",\n      \"quality_requirements\": \"焊缝必须连续，焊缝外观要求高，确保焊缝饱满、均匀。焊后检查加强板与铲板的贴合度。\",\n      \"safety_notes\": \"进行长焊缝焊接时，应采用分段、跳焊方式，控制焊接应力，防止铲板整体变形。\"\n    }\n  },\n  {\n    \"step_number\": 15,\n    \"action\": \"最终焊接和清理\",\n    \"description\": \"对所有已点焊的零件进行满焊，确保所有焊缝符合技术要求。焊接完成后，进行焊渣清理和打磨，去除飞溅物。\",\n    \"position_description\": \"对所有连接部位进行全面检查。\",\n    \"parts_used\": [],\n    \"tools\": [\n      \"焊机\",\n      \"角磨机\",\n      \"钢丝刷\"\n    ],\n    \"warnings\": [\n      \"所有焊缝必须饱满、连续，无气孔、夹渣等缺陷。\",\n      \"打磨时注意保护非焊接区域的漆面。\"\n    ],\n    \"welding\": {\n      \"required\": true,\n      \"welding_type\": \"所有类型焊缝的最终满焊\",\n      \"welding_method\": \"CO2气保焊为主\",\n      \"weld_size\": \"所有焊缝按图纸要求（未标注按6mm）\",\n      \"welding_position\": \"所有零件连接处，涉及平焊、横焊、立焊\",\n      \"quality_requirements\": \"所有焊缝外观必须达到二级焊缝标准：焊缝成型良好，无裂纹、未熔合、未焊透。焊后进行全面外观检查，关键部位（如轴套、油缸固定板）必要时进行磁粉检测（MT）。\",\n      \"safety_notes\": \"进行大面积焊接时，注意工作环境的通风和排烟。打磨时必须佩戴防护眼镜和防尘口罩，防止金属粉尘和火花伤害。\"\n    }\n  }\n]\n\n## 要求\n\n请按照以下5个步骤思考，为装配步骤添加安全警告：\n\n### 步骤1：识别风险步骤\n- 分析每个装配步骤的操作内容\n- 判断是否涉及高风险作业：\n  * **焊接作业**：电击、弧光、烫伤、火灾\n  * **吊装作业**：吊物坠落、碰撞、超载\n  * **高空作业**：人员坠落、物体打击\n  * **重物搬运**：砸伤、扭伤、夹伤\n  * **机械加工**：切割伤、夹伤、碰撞\n\n### 步骤2：分析风险源\n- 确定风险的来源（设备、工具、材料、环境、人员操作等）\n- 评估风险的严重程度（轻微、中等、严重、致命）\n- 考虑风险的发生概率\n\n### 步骤3：制定预防措施\n- 针对每个风险源，制定具体的预防措施\n- 强调个人防护用品的使用：\n  * **焊接**：焊接面罩、防护手套、防护服\n  * **吊装**：安全帽、安全鞋、手套\n  * **高空**：安全带、安全帽、防滑鞋\n  * **机械**：防护眼镜、手套、安全鞋\n\n### 步骤4：添加安全警告\n- 为每个有风险的步骤添加safety_warnings字段\n- 每条警告要简洁明了，说明具体的风险和预防措施\n- 使用工人能看懂的语言\n\n### 步骤5：验证完整性\n- 检查所有高风险步骤是否都添加了安全警告\n- 检查安全警告是否具体、可操作\n- 检查是否遗漏了任何潜在风险\n\n## ⚠️ 强制自检清单（生成后必须逐项检查）\n\n**在输出JSON之前，你必须完成以下验证：**\n\n1. **风险步骤识别验证**：\n   - [ ] 所有涉及焊接、吊装、高空、重物搬运的步骤都添加了safety_warnings字段\n   - [ ] 没有明显风险的步骤没有添加safety_warnings字段\n\n2. **安全警告完整性验证**：\n   - [ ] 每个safety_warnings字段都是字符串数组\n   - [ ] 每条警告都说明了具体的风险和预防措施\n   - [ ] 涵盖了个人防护、设备安全、环境安全、操作安全\n\n3. **语言通俗性验证**：\n   - [ ] 使用工人能看懂的语言\n   - [ ] 避免专业术语和英文缩写\n   - [ ] 每条警告简洁明了（一句话）\n\n4. **原有字段保持验证**：\n   - [ ] 原有步骤的所有字段都保持不变（包括welding字段）\n   - [ ] 没有修改或删除任何原有字段\n\n**如果自检发现任何问题，必须重新生成！**\n\n现在开始为装配步骤添加安全警告！\n",
  "raw_response": "```json\n{\n  \"enhanced_steps\": [\n    {\n      \"step_number\": 1,\n      \"action\": \"放置基准件\",\n      \"description\": \"将图纸上标注为1的左铲板（01.01.01.18598）平稳放置在装配工作台上，作为后续所有零件的装配基准。\",\n      \"position_description\": \"左铲板的内侧（有加强筋的一侧）朝上。\",\n      \"parts_used\": [\n        {\n          \"bom_seq\": \"1\",\n          \"bom_name\": \"左铲板 1\",\n          \"quantity\": 1,\n          \"drawing_number\": \"1\"\n        }\n      ],\n      \"tools\": [\n        \"行车\",\n        \"吊具\",\n        \"水平仪\"\n      ],\n      \"warnings\": [\n        \"左铲板较重（28.38kg），吊装时注意安全，确保吊具捆绑牢固。\",\n        \"放置时避免损伤漆面。\"\n      ],\n      \"safety_warnings\": [\n        \"吊装前检查行车和吊具是否完好，防止吊物坠落伤人。\",\n        \"操作行车时，人员必须佩戴安全帽和防护手套。\",\n        \"重物搬运时，注意站位，避免被摆动的吊物碰撞或挤压。\"\n      ]\n    },\n    {\n      \"step_number\": 2,\n      \"action\": \"焊接方形板-机加\",\n      \"description\": \"将图纸上标注为2的方形板-机加（01.01.01.18599）放置在1号左铲板的后部中央位置，按照图纸要求进行定位和点焊。\",\n      \"position_description\": \"方形板-机加位于左铲板的后部，与铲板的边缘保持图纸所示的尺寸关系。\",\n      \"parts_used\": [\n        {\n          \"bom_seq\": \"2\",\n          \"bom_name\": \"方形板-机加 1\",\n          \"quantity\": 1,\n          \"drawing_number\": \"2\"\n        }\n      ],\n      \"tools\": [\n        \"焊机\",\n        \"角尺\",\n        \"卷尺\"\n      ],\n      \"warnings\": [\n        \"焊接前必须清理焊接区域的漆面，露出金属光泽。\",\n        \"定位必须准确，确保后续零件的安装精度。\"\n      ],\n      \"welding\": {\n        \"required\": true,\n        \"welding_type\": \"角焊\",\n        \"welding_method\": \"CO2气保焊\",\n        \"weld_size\": \"焊脚高度6mm（图纸未标注尺寸按6mm执行）\",\n        \"welding_position\": \"零件②方形板-机加与零件①左铲板的连接处，平焊为主\",\n        \"quality_requirements\": \"先进行定位点焊，焊点长度不小于20mm，焊缝外观平整，无明显气孔、飞溅\",\n        \"safety_notes\": \"佩戴焊接面罩、防护手套和防护服。确保工作区域通风良好，避免烟尘吸入。\"\n      },\n      \"safety_warnings\": [\n        \"必须佩戴焊接面罩、防护手套和防护服，防止弧光灼伤和烫伤。\",\n        \"确保焊机接地良好，电缆绝缘完好，防止触电。\",\n        \"焊接区域必须保持通风良好，防止吸入有毒烟尘。\",\n        \"清理漆面时，佩戴防护眼镜和防尘口罩，防止粉尘和飞溅物伤害。\"\n      ]\n    },\n    {\n      \"step_number\": 3,\n      \"action\": \"焊接后加强板和前加强板\",\n      \"description\": \"将图纸上标注为3的后加强板（01.01.01.11519）和标注为4的前加强板（01.01.01.18600）分别放置在1号左铲板的内侧，按照图纸所示位置进行定位和焊接。\",\n      \"position_description\": \"3号后加强板位于左铲板的后部，4号前加强板位于左铲板的前部，均位于铲板的内侧。\",\n      \"parts_used\": [\n        {\n          \"bom_seq\": \"3\",\n          \"bom_name\": \"后加强板 1\",\n          \"quantity\": 1,\n          \"drawing_number\": \"3\"\n        },\n        {\n          \"bom_seq\": \"4\",\n          \"bom_name\": \"前加强板 1\",\n          \"quantity\": 1,\n          \"drawing_number\": \"4\"\n        }\n      ],\n      \"tools\": [\n        \"焊机\",\n        \"夹具\"\n      ],\n      \"warnings\": [\n        \"加强板与左铲板的接触面必须紧密贴合，避免虚焊。\",\n        \"注意焊接变形控制。\"\n      ],\n      \"welding\": {\n        \"required\": true,\n        \"welding_type\": \"角焊\",\n        \"welding_method\": \"CO2气保焊\",\n        \"weld_size\": \"焊脚高度6mm\",\n        \"welding_position\": \"零件③后加强板和零件④前加强板与零件①左铲板的连接处，平焊\",\n        \"quality_requirements\": \"加强板与铲板的连接焊缝应连续，焊缝过渡平滑，无咬边、未焊透等缺陷。注意控制焊接电流，防止烧穿。\",\n        \"safety_notes\": \"使用夹具固定零件，防止焊接过程中零件松动或掉落。注意焊机接地良好。\"\n      },\n      \"safety_warnings\": [\n        \"佩戴焊接面罩和防护手套，防止弧光和高温飞溅物伤害。\",\n        \"使用夹具固定零件时，注意防止夹具反弹或松动造成夹伤。\",\n        \"确保焊接区域无易燃易爆物品，防止火灾。\"\n      ]\n    },\n    {\n      \"step_number\": 4,\n      \"action\": \"焊接底部连接板\",\n      \"description\": \"将图纸上标注为5的底部连接板（01.01.01.11521）共6件，按照图纸所示的间距和位置，依次焊接到1号左铲板的底部边缘。\",\n      \"position_description\": \"底部连接板均匀分布在左铲板的底部边缘，用于后续连接。\",\n      \"parts_used\": [\n        {\n          \"bom_seq\": \"5\",\n          \"bom_name\": \"底部连接板 6\",\n          \"quantity\": 6,\n          \"drawing_number\": \"5\"\n        }\n      ],\n      \"tools\": [\n        \"焊机\",\n        \"定位尺\"\n      ],\n      \"warnings\": [\n        \"确保6个连接板的中心线在同一直线上，且与铲板边缘垂直。\",\n        \"焊缝要求连续且饱满。\"\n      ],\n      \"welding\": {\n        \"required\": true,\n        \"welding_type\": \"角焊\",\n        \"welding_method\": \"CO2气保焊\",\n        \"weld_size\": \"焊脚高度6mm\",\n        \"welding_position\": \"零件⑤底部连接板与零件①左铲板的连接处，横焊或立焊\",\n        \"quality_requirements\": \"焊缝必须连续且饱满，确保连接板的垂直度和平行度。焊后检查焊缝高度是否均匀。\",\n        \"safety_notes\": \"由于焊接位置可能涉及横焊或立焊，操作时需稳定焊枪，防止熔池下坠。注意防烫伤。\"\n      },\n      \"safety_warnings\": [\n        \"进行横焊或立焊时，注意熔渣和金属液滴下坠，防止烫伤脚部和身体，必须穿戴安全鞋和防护服。\",\n        \"操作时保持身体稳定，避免因姿势不当造成肌肉拉伤。\",\n        \"焊接完成后，不要立即触摸焊件，防止高温烫伤。\"\n      ]\n    },\n    {\n      \"step_number\": 5,\n      \"action\": \"焊接前油缸固定板\",\n      \"description\": \"将图纸上标注为6的前油缸固定板（01.01.01.11522）共2件，焊接到1号左铲板的内侧，靠近前加强板（4号）的位置。\",\n      \"position_description\": \"固定板的安装孔位需与图纸尺寸严格一致，用于安装油缸。\",\n      \"parts_used\": [\n        {\n          \"bom_seq\": \"6\",\n          \"bom_name\": \"前油缸固定板 2\",\n          \"quantity\": 2,\n          \"drawing_number\": \"6\"\n        }\n      ],\n      \"tools\": [\n        \"焊机\",\n        \"定位工装\"\n      ],\n      \"warnings\": [\n        \"油缸固定板的孔位精度要求高，必须使用定位工装辅助焊接，确保孔距和垂直度。\",\n        \"焊接时避免焊渣飞溅到孔内。\"\n      ],\n      \"welding\": {\n        \"required\": true,\n        \"welding_type\": \"角焊\",\n        \"welding_method\": \"CO2气保焊\",\n        \"weld_size\": \"焊脚高度6mm\",\n        \"welding_position\": \"零件⑥前油缸固定板与零件①左铲板的连接处，平焊\",\n        \"quality_requirements\": \"焊缝必须连续，且焊后必须检查固定板的孔位尺寸和垂直度，偏差应在图纸允许范围内。焊缝表面不允许有任何裂纹。\",\n        \"safety_notes\": \"使用定位工装时，确保工装与焊件接触良好。焊接前检查焊机电缆绝缘是否完好，防止漏电。\"\n      },\n      \"safety_warnings\": [\n        \"使用定位工装时，注意工装的稳固性，防止倾倒或移动造成零件砸伤。\",\n        \"焊接前检查焊机电缆绝缘是否完好，防止漏电触电。\",\n        \"焊接时注意控制飞溅，防止焊渣飞溅到眼睛或皮肤上。\"\n      ]\n    },\n    {\n      \"step_number\": 6,\n      \"action\": \"焊接前弹簧固定板\",\n      \"description\": \"将图纸上标注为7的前弹簧固定板（01.01.01.11523）1件，焊接到1号左铲板的内侧，位于油缸固定板（6号）的上方。\",\n      \"position_description\": \"前弹簧固定板的安装位置应与图纸上的尺寸标注严格对应。\",\n      \"parts_used\": [\n        {\n          \"bom_seq\": \"7\",\n          \"bom_name\": \"前弹簧固定板 1\",\n          \"quantity\": 1,\n          \"drawing_number\": \"7\"\n        }\n      ],\n      \"tools\": [\n        \"焊机\",\n        \"卷尺\"\n      ],\n      \"warnings\": [\n        \"确保固定板的平面度，避免后续弹簧安装困难。\"\n      ],\n      \"welding\": {\n        \"required\": true,\n        \"welding_type\": \"角焊\",\n        \"welding_method\": \"CO2气保焊\",\n        \"weld_size\": \"焊脚高度6mm\",\n        \"welding_position\": \"零件⑦前弹簧固定板与零件①左铲板的连接处，平焊\",\n        \"quality_requirements\": \"焊缝连续，焊缝高度均匀。焊后检查固定板的安装面是否平整，必要时进行轻微打磨。\",\n        \"safety_notes\": \"注意控制焊接热输入，避免固定板因受热不均而产生较大变形。\"\n      },\n      \"safety_warnings\": [\n        \"佩戴焊接面罩和防护手套，防止弧光和高温烫伤。\",\n        \"控制焊接热输入，避免零件因变形而产生内应力，防止后续使用中开裂。\",\n        \"确保工作区域通风良好，避免烟尘滞留。\"\n      ]\n    },\n    {\n      \"step_number\": 7,\n      \"action\": \"焊接后弹簧固定板\",\n      \"description\": \"将图纸上标注为8的后弹簧固定板（01.01.01.11524）共2件，焊接到1号左铲板的内侧，靠近后加强板（3号）的位置。\",\n      \"position_description\": \"后弹簧固定板对称分布，用于安装后部的弹簧。\",\n      \"parts_used\": [\n        {\n          \"bom_seq\": \"8\",\n          \"bom_name\": \"后弹簧固定板 2\",\n          \"quantity\": 2,\n          \"drawing_number\": \"8\"\n        }\n      ],\n      \"tools\": [\n        \"焊机\",\n        \"定位工装\"\n      ],\n      \"warnings\": [\n        \"两块固定板的相对位置和角度必须准确，保证弹簧受力均匀。\"\n      ],\n      \"welding\": {\n        \"required\": true,\n        \"welding_type\": \"角焊\",\n        \"welding_method\": \"CO2气保焊\",\n        \"weld_size\": \"焊脚高度6mm\",\n        \"welding_position\": \"零件⑧后弹簧固定板与零件①左铲板的连接处，平焊\",\n        \"quality_requirements\": \"焊缝连续，两块固定板的中心距和相对角度必须符合图纸要求。焊后进行外观检查，确保无未熔合。\",\n        \"safety_notes\": \"使用定位工装确保对称性。焊接时注意防止焊渣飞溅到已安装的零件上。\"\n      },\n      \"safety_warnings\": [\n        \"使用定位工装时，确保零件固定牢靠，防止焊接过程中零件移动或掉落。\",\n        \"焊接时注意保护已完成的焊缝和零件表面，防止焊渣飞溅损伤。\",\n        \"佩戴防护眼镜和手套，防止清理焊渣时金属飞溅物伤害。\"\n      ]\n    },\n    {\n      \"step_number\": 8,\n      \"action\": \"焊接支撑固定板\",\n      \"description\": \"将图纸上标注为9的支撑固定板（01.01.01.11525）1件，焊接到1号左铲板的内侧，位于中央偏上的位置。\",\n      \"position_description\": \"支撑固定板用于连接外部支撑结构，焊接位置需参照图纸上的尺寸定位。\",\n      \"parts_used\": [\n        {\n          \"bom_seq\": \"9\",\n          \"bom_name\": \"支撑固定板 1\",\n          \"quantity\": 1,\n          \"drawing_number\": \"9\"\n        }\n      ],\n      \"tools\": [\n        \"焊机\",\n        \"角尺\"\n      ],\n      \"warnings\": [\n        \"确保支撑固定板的安装面与铲板表面垂直。\"\n      ],\n      \"welding\": {\n        \"required\": true,\n        \"welding_type\": \"角焊\",\n        \"welding_method\": \"CO2气保焊\",\n        \"weld_size\": \"焊脚高度6mm\",\n        \"welding_position\": \"零件⑨支撑固定板与零件①左铲板的连接处，平焊\",\n        \"quality_requirements\": \"焊缝连续，焊后使用角尺检查固定板与铲板的垂直度，确保偏差小于1度。\",\n        \"safety_notes\": \"焊接前清理坡口和焊接区域，确保无油污和锈蚀，防止产生气孔。\"\n      },\n      \"safety_warnings\": [\n        \"焊接前必须彻底清理油污和锈蚀，防止焊接过程中产生有毒气体或爆炸。\",\n        \"佩戴焊接面罩和防护手套，防止弧光和高温烫伤。\",\n        \"使用角尺检查垂直度时，注意零件边缘锋利，防止割伤。\"\n      ]\n    },\n    {\n      \"step_number\": 9,\n      \"action\": \"焊接轴套加强板\",\n      \"description\": \"将图纸上标注为10的轴套加强板（01.01.01.11526）共2件，焊接到1号左铲板的后部边缘，靠近2号方形板-机加的位置。\",\n      \"position_description\": \"轴套加强板用于增强轴套安装区域的强度。\",\n      \"parts_used\": [\n        {\n          \"bom_seq\": \"10\",\n          \"bom_name\": \"轴套加强板 2\",\n          \"quantity\": 2,\n          \"drawing_number\": \"10\"\n        }\n      ],\n      \"tools\": [\n        \"焊机\"\n      ],\n      \"warnings\": [\n        \"加强板的焊接位置应避开轴套的安装孔位。\"\n      ],\n      \"welding\": {\n        \"required\": true,\n        \"welding_type\": \"角焊\",\n        \"welding_method\": \"CO2气保焊\",\n        \"weld_size\": \"焊脚高度6mm\",\n        \"welding_position\": \"零件⑩轴套加强板与零件①左铲板的连接处，平焊\",\n        \"quality_requirements\": \"焊缝连续，焊缝外观平整。注意加强板与铲板的贴合度，避免间隙过大导致未焊透。\",\n        \"safety_notes\": \"控制焊接速度，确保熔深足够，达到加强效果。注意防止焊接飞溅物损伤周围零件。\"\n      },\n      \"safety_warnings\": [\n        \"控制焊接速度和电流，防止因热输入过大导致零件变形。\",\n        \"焊接时注意防止飞溅物损伤周围零件或烫伤操作人员。\",\n        \"佩戴防护眼镜和手套，防止清理焊渣时金属飞溅物伤害。\"\n      ]\n    },\n    {\n      \"step_number\": 10,\n      \"action\": \"焊接反光片安装板\",\n      \"description\": \"将图纸上标注为11的反光片安装板（01.01.01.11527）1件，焊接到1号左铲板的侧面边缘。\",\n      \"position_description\": \"安装板位于左铲板的侧面，用于安装反光片。\",\n      \"parts_used\": [\n        {\n          \"bom_seq\": \"11\",\n          \"bom_name\": \"反光片安装板 1\",\n          \"quantity\": 1,\n          \"drawing_number\": \"11\"\n        }\n      ],\n      \"tools\": [\n        \"焊机\"\n      ],\n      \"warnings\": [\n        \"确保安装板的安装面平整，便于后续反光片的粘贴或螺栓固定。\"\n      ],\n      \"welding\": {\n        \"required\": true,\n        \"welding_type\": \"角焊\",\n        \"welding_method\": \"CO2气保焊\",\n        \"weld_size\": \"焊脚高度4mm\",\n        \"welding_position\": \"零件⑪反光片安装板与零件①左铲板的连接处，横焊或立焊\",\n        \"quality_requirements\": \"焊缝连续，焊缝尺寸要求较小（4mm），注意控制电流，防止烧穿薄板。焊后清理焊渣，确保安装面平整。\",\n        \"safety_notes\": \"由于安装板较薄，焊接时应采用小电流、快速焊，减少热变形。注意防火，远离易燃材料。\"\n      },\n      \"safety_warnings\": [\n        \"由于零件较薄，焊接时应使用小电流，防止烧穿或过度变形。\",\n        \"进行横焊或立焊时，注意熔渣下坠，穿戴防护鞋和防护服。\",\n        \"焊接完成后，立即清理焊渣，防止焊渣飞溅伤人或引起火灾。\"\n      ]\n    },\n    {\n      \"step_number\": 11,\n      \"action\": \"焊接轴套\",\n      \"description\": \"将图纸上标注为12的轴套（01.01.02.1222）共2件，分别焊接到1号左铲板后部的预留孔位上，并与10号轴套加强板配合。\",\n      \"position_description\": \"轴套的中心线必须与铲板的安装面垂直，且两轴套的轴线平行。\",\n      \"parts_used\": [\n        {\n          \"bom_seq\": \"12\",\n          \"bom_name\": \"轴套 2\",\n          \"quantity\": 2,\n          \"drawing_number\": \"12\"\n        }\n      ],\n      \"tools\": [\n        \"焊机\",\n        \"定位销\",\n        \"百分表\"\n      ],\n      \"warnings\": [\n        \"轴套的焊接是关键工序，必须使用定位工装保证同轴度和垂直度。\",\n        \"焊接后检查轴套内孔，确保无焊渣和变形。\"\n      ],\n      \"welding\": {\n        \"required\": true,\n        \"welding_type\": \"角焊/环形焊\",\n        \"welding_method\": \"CO2气保焊\",\n        \"weld_size\": \"焊脚高度6mm，环形连续焊\",\n        \"welding_position\": \"零件⑫轴套与零件①左铲板的连接处，平焊或横焊\",\n        \"quality_requirements\": \"焊缝必须环形连续，焊缝饱满，无气孔、裂纹。焊后必须使用百分表或专用量具检查轴套的垂直度和同轴度，确保满足图纸要求。\",\n        \"safety_notes\": \"轴套焊接属于高精度要求，应分层、分段对称焊接，控制热输入，减少变形。焊接时注意保护轴套内孔，防止焊渣飞溅。\"\n      },\n      \"safety_warnings\": [\n        \"轴套焊接需分段对称进行，防止因热应力集中导致轴套变形或开裂。\",\n        \"焊接时必须使用定位工装，确保轴套垂直度，防止零件倾倒伤人。\",\n        \"注意保护轴套内孔，防止焊渣飞溅进入，清理时佩戴防护眼镜。\"\n      ]\n    },\n    {\n      \"step_number\": 12,\n      \"action\": \"焊接方形板 1\",\n      \"description\": \"将图纸上标注为13的方形板 1（01.01.01.11528）1件，焊接到1号左铲板的后部，位于轴套（12号）的上方。\",\n      \"position_description\": \"方形板用于连接外部结构，焊接位置需参照图纸尺寸。\",\n      \"parts_used\": [\n        {\n          \"bom_seq\": \"13\",\n          \"bom_name\": \"方形板 1\",\n          \"quantity\": 1,\n          \"drawing_number\": \"13\"\n        }\n      ],\n      \"tools\": [\n        \"焊机\"\n      ],\n      \"warnings\": [\n        \"确保方形板的安装面平整，无焊接变形。\"\n      ],\n      \"welding\": {\n        \"required\": true,\n        \"welding_type\": \"角焊\",\n        \"welding_method\": \"CO2气保焊\",\n        \"weld_size\": \"焊脚高度6mm\",\n        \"welding_position\": \"零件⑬方形板 1与零件①左铲板的连接处，平焊\",\n        \"quality_requirements\": \"焊缝连续，焊缝外观平整。注意与周围零件（如轴套）的相对位置精度。\",\n        \"safety_notes\": \"焊接前检查焊丝伸出长度和保护气体流量，确保焊接过程稳定，减少飞溅。\"\n      },\n      \"safety_warnings\": [\n        \"佩戴焊接面罩和防护手套，防止弧光和高温烫伤。\",\n        \"焊接前检查保护气体流量，防止因气体不足导致焊缝质量下降和烟尘增加。\",\n        \"注意焊枪和电缆的放置，避免绊倒或损坏绝缘层。\"\n      ]\n    },\n    {\n      \"step_number\": 13,\n      \"action\": \"焊接方形板 3\",\n      \"description\": \"将图纸上标注为14的方形板 3（01.01.01.11529）1件，焊接到1号左铲板的后部，位于13号方形板的下方。\",\n      \"position_description\": \"方形板 3与方形板 1（13号）形成一组连接结构。\",\n      \"parts_used\": [\n        {\n          \"bom_seq\": \"14\",\n          \"bom_name\": \"方形板 3\",\n          \"quantity\": 1,\n          \"drawing_number\": \"14\"\n        }\n      ],\n      \"tools\": [\n        \"焊机\"\n      ],\n      \"warnings\": [\n        \"两块方形板的相对位置必须准确，保证连接孔位对齐。\"\n      ],\n      \"welding\": {\n        \"required\": true,\n        \"welding_type\": \"角焊\",\n        \"welding_method\": \"CO2气保焊\",\n        \"weld_size\": \"焊脚高度6mm\",\n        \"welding_position\": \"零件⑭方形板 3与零件①左铲板的连接处，平焊\",\n        \"quality_requirements\": \"焊缝连续，确保两块方形板（13和14）的孔位中心线对齐。焊后进行外观检查，确保无未熔合。\",\n        \"safety_notes\": \"焊接时注意控制热量，避免因局部过热导致零件变形，影响孔位精度。\"\n      },\n      \"safety_warnings\": [\n        \"控制焊接热量，防止零件变形，影响后续装配精度。\",\n        \"焊接时保持身体稳定，避免因操作不当造成烫伤或拉伤。\",\n        \"确保工作区域整洁，避免电缆和工具堆放造成绊倒。\"\n      ]\n    },\n    {\n      \"step_number\": 14,\n      \"action\": \"焊接左铲雪板加强板 2\",\n      \"description\": \"将图纸上标注为15的左铲雪板加强板 2（01.02.01.4983）2件，焊接到1号左铲板的内侧，位于铲板的顶部边缘。\",\n      \"position_description\": \"加强板沿铲板顶部边缘分布，用于增强铲板的刚度。\",\n      \"parts_used\": [\n        {\n          \"bom_seq\": \"15\",\n          \"bom_name\": \"左铲雪板加强板 2\",\n          \"quantity\": 2,\n          \"drawing_number\": \"15\"\n        }\n      ],\n      \"tools\": [\n        \"焊机\"\n      ],\n      \"warnings\": [\n        \"加强板与铲板的焊接必须连续，焊缝高度和宽度符合图纸要求。\"\n      ],\n      \"welding\": {\n        \"required\": true,\n        \"welding_type\": \"角焊\",\n        \"welding_method\": \"CO2气保焊\",\n        \"weld_size\": \"焊脚高度6mm\",\n        \"welding_position\": \"零件⑮左铲雪板加强板 2与零件①左铲板的连接处，平焊\",\n        \"quality_requirements\": \"焊缝必须连续，焊缝外观要求高，确保焊缝饱满、均匀。焊后检查加强板与铲板的贴合度。\",\n        \"safety_notes\": \"进行长焊缝焊接时，应采用分段、跳焊方式，控制焊接应力，防止铲板整体变形。\"\n      },\n      \"safety_warnings\": [\n        \"进行长焊缝焊接时，采用分段跳焊，防止热应力集中导致零件变形或翘曲。\",\n        \"佩戴焊接面罩和防护手套，防止长时间焊接产生的弧光和高温伤害。\",\n        \"确保焊接区域周围无易燃物，防止火花飞溅引发火灾。\"\n      ]\n    },\n    {\n      \"step_number\": 15,\n      \"action\": \"最终焊接和清理\",\n      \"description\": \"对所有已点焊的零件进行满焊，确保所有焊缝符合技术要求。焊接完成后，进行焊渣清理和打磨，去除飞溅物。\",\n      \"position_description\": \"对所有连接部位进行全面检查。\",\n      \"parts_used\": [],\n      \"tools\": [\n        \"焊机\",\n        \"角磨机\",\n        \"钢丝刷\"\n      ],\n      \"warnings\": [\n        \"所有焊缝必须饱满、连续，无气孔、夹渣等缺陷。\",\n        \"打磨时注意保护非焊接区域的漆面。\"\n      ],\n      \"welding\": {\n        \"required\": true,\n        \"welding_type\": \"所有类型焊缝的最终满焊\",\n        \"welding_method\": \"CO2气保焊为主\",\n        \"weld_size\": \"所有焊缝按图纸要求（未标注按6mm）\",\n        \"welding_position\": \"所有零件连接处，涉及平焊、横焊、立焊\",\n        \"quality_requirements\": \"所有焊缝外观必须达到二级焊缝标准：焊缝成型良好，无裂纹、未熔合、未焊透。焊后进行全面外观检查，关键部位（如轴套、油缸固定板）必要时进行磁粉检测（MT）。\",\n        \"safety_notes\": \"进行大面积焊接时，注意工作环境的通风和排烟。打磨时必须佩戴防护眼镜和防尘口罩，防止金属粉尘和火花伤害。\"\n      },\n      \"safety_warnings\": [\n        \"使用角磨机打磨时，必须佩戴防护眼镜、防尘口罩和防护手套，防止飞溅物和金属粉尘伤害。\",\n        \"打磨作业时，注意磨光片是否安装牢固，防止高速旋转的磨片飞出伤人。\",\n        \"清理焊渣时，使用钢丝刷或专用工具，注意防止金属飞溅物反弹伤眼。\",\n        \"进行大面积焊接时，确保通风系统全开，防止烟尘中毒。\"\n      ]\n    }\n  ]\n}\n```",
  "parsed_result": {
    "enhanced_steps": [
      {
        "step_number": 1,
        "action": "放置基准件",
        "description": "将图纸上标注为1的左铲板（01.01.01.18598）平稳放置在装配工作台上，作为后续所有零件的装配基准。",
        "position_description": "左铲板的内侧（有加强筋的一侧）朝上。",
        "parts_used": [
          {
            "bom_seq": "1",
            "bom_name": "左铲板 1",
            "quantity": 1,
            "drawing_number": "1"
          }
        ],
        "tools": [
          "行车",
          "吊具",
          "水平仪"
        ],
        "warnings": [
          "左铲板较重（28.38kg），吊装时注意安全，确保吊具捆绑牢固。",
          "放置时避免损伤漆面。"
        ],
        "safety_warnings": [
          "吊装前检查行车和吊具是否完好，防止吊物坠落伤人。",
          "操作行车时，人员必须佩戴安全帽和防护手套。",
          "重物搬运时，注意站位，避免被摆动的吊物碰撞或挤压。"
        ]
      },
      {
        "step_number": 2,
        "action": "焊接方形板-机加",
        "description": "将图纸上标注为2的方形板-机加（01.01.01.18599）放置在1号左铲板的后部中央位置，按照图纸要求进行定位和点焊。",
        "position_description": "方形板-机加位于左铲板的后部，与铲板的边缘保持图纸所示的尺寸关系。",
        "parts_used": [
          {
            "bom_seq": "2",
            "bom_name": "方形板-机加 1",
            "quantity": 1,
            "drawing_number": "2"
          }
        ],
        "tools": [
          "焊机",
          "角尺",
          "卷尺"
        ],
        "warnings": [
          "焊接前必须清理焊接区域的漆面，露出金属光泽。",
          "定位必须准确，确保后续零件的安装精度。"
        ],
        "welding": {
          "required": true,
          "welding_type": "角焊",
          "welding_method": "CO2气保焊",
          "weld_size": "焊脚高度6mm（图纸未标注尺寸按6mm执行）",
          "welding_position": "零件②方形板-机加与零件①左铲板的连接处，平焊为主",
          "quality_requirements": "先进行定位点焊，焊点长度不小于20mm，焊缝外观平整，无明显气孔、飞溅",
          "safety_notes": "佩戴焊接面罩、防护手套和防护服。确保工作区域通风良好，避免烟尘吸入。"
        },
        "safety_warnings": [
          "必须佩戴焊接面罩、防护手套和防护服，防止弧光灼伤和烫伤。",
          "确保焊机接地良好，电缆绝缘完好，防止触电。",
          "焊接区域必须保持通风良好，防止吸入有毒烟尘。",
          "清理漆面时，佩戴防护眼镜和防尘口罩，防止粉尘和飞溅物伤害。"
        ]
      },
      {
        "step_number": 3,
        "action": "焊接后加强板和前加强板",
        "description": "将图纸上标注为3的后加强板（01.01.01.11519）和标注为4的前加强板（01.01.01.18600）分别放置在1号左铲板的内侧，按照图纸所示位置进行定位和焊接。",
        "position_description": "3号后加强板位于左铲板的后部，4号前加强板位于左铲板的前部，均位于铲板的内侧。",
        "parts_used": [
          {
            "bom_seq": "3",
            "bom_name": "后加强板 1",
            "quantity": 1,
            "drawing_number": "3"
          },
          {
            "bom_seq": "4",
            "bom_name": "前加强板 1",
            "quantity": 1,
            "drawing_number": "4"
          }
        ],
        "tools": [
          "焊机",
          "夹具"
        ],
        "warnings": [
          "加强板与左铲板的接触面必须紧密贴合，避免虚焊。",
          "注意焊接变形控制。"
        ],
        "welding": {
          "required": true,
          "welding_type": "角焊",
          "welding_method": "CO2气保焊",
          "weld_size": "焊脚高度6mm",
          "welding_position": "零件③后加强板和零件④前加强板与零件①左铲板的连接处，平焊",
          "quality_requirements": "加强板与铲板的连接焊缝应连续，焊缝过渡平滑，无咬边、未焊透等缺陷。注意控制焊接电流，防止烧穿。",
          "safety_notes": "使用夹具固定零件，防止焊接过程中零件松动或掉落。注意焊机接地良好。"
        },
        "safety_warnings": [
          "佩戴焊接面罩和防护手套，防止弧光和高温飞溅物伤害。",
          "使用夹具固定零件时，注意防止夹具反弹或松动造成夹伤。",
          "确保焊接区域无易燃易爆物品，防止火灾。"
        ]
      },
      {
        "step_number": 4,
        "action": "焊接底部连接板",
        "description": "将图纸上标注为5的底部连接板（01.01.01.11521）共6件，按照图纸所示的间距和位置，依次焊接到1号左铲板的底部边缘。",
        "position_description": "底部连接板均匀分布在左铲板的底部边缘，用于后续连接。",
        "parts_used": [
          {
            "bom_seq": "5",
            "bom_name": "底部连接板 6",
            "quantity": 6,
            "drawing_number": "5"
          }
        ],
        "tools": [
          "焊机",
          "定位尺"
        ],
        "warnings": [
          "确保6个连接板的中心线在同一直线上，且与铲板边缘垂直。",
          "焊缝要求连续且饱满。"
        ],
        "welding": {
          "required": true,
          "welding_type": "角焊",
          "welding_method": "CO2气保焊",
          "weld_size": "焊脚高度6mm",
          "welding_position": "零件⑤底部连接板与零件①左铲板的连接处，横焊或立焊",
          "quality_requirements": "焊缝必须连续且饱满，确保连接板的垂直度和平行度。焊后检查焊缝高度是否均匀。",
          "safety_notes": "由于焊接位置可能涉及横焊或立焊，操作时需稳定焊枪，防止熔池下坠。注意防烫伤。"
        },
        "safety_warnings": [
          "进行横焊或立焊时，注意熔渣和金属液滴下坠，防止烫伤脚部和身体，必须穿戴安全鞋和防护服。",
          "操作时保持身体稳定，避免因姿势不当造成肌肉拉伤。",
          "焊接完成后，不要立即触摸焊件，防止高温烫伤。"
        ]
      },
      {
        "step_number": 5,
        "action": "焊接前油缸固定板",
        "description": "将图纸上标注为6的前油缸固定板（01.01.01.11522）共2件，焊接到1号左铲板的内侧，靠近前加强板（4号）的位置。",
        "position_description": "固定板的安装孔位需与图纸尺寸严格一致，用于安装油缸。",
        "parts_used": [
          {
            "bom_seq": "6",
            "bom_name": "前油缸固定板 2",
            "quantity": 2,
            "drawing_number": "6"
          }
        ],
        "tools": [
          "焊机",
          "定位工装"
        ],
        "warnings": [
          "油缸固定板的孔位精度要求高，必须使用定位工装辅助焊接，确保孔距和垂直度。",
          "焊接时避免焊渣飞溅到孔内。"
        ],
        "welding": {
          "required": true,
          "welding_type": "角焊",
          "welding_method": "CO2气保焊",
          "weld_size": "焊脚高度6mm",
          "welding_position": "零件⑥前油缸固定板与零件①左铲板的连接处，平焊",
          "quality_requirements": "焊缝必须连续，且焊后必须检查固定板的孔位尺寸和垂直度，偏差应在图纸允许范围内。焊缝表面不允许有任何裂纹。",
          "safety_notes": "使用定位工装时，确保工装与焊件接触良好。焊接前检查焊机电缆绝缘是否完好，防止漏电。"
        },
        "safety_warnings": [
          "使用定位工装时，注意工装的稳固性，防止倾倒或移动造成零件砸伤。",
          "焊接前检查焊机电缆绝缘是否完好，防止漏电触电。",
          "焊接时注意控制飞溅，防止焊渣飞溅到眼睛或皮肤上。"
        ]
      },
      {
        "step_number": 6,
        "action": "焊接前弹簧固定板",
        "description": "将图纸上标注为7的前弹簧固定板（01.01.01.11523）1件，焊接到1号左铲板的内侧，位于油缸固定板（6号）的上方。",
        "position_description": "前弹簧固定板的安装位置应与图纸上的尺寸标注严格对应。",
        "parts_used": [
          {
            "bom_seq": "7",
            "bom_name": "前弹簧固定板 1",
            "quantity": 1,
            "drawing_number": "7"
          }
        ],
        "tools": [
          "焊机",
          "卷尺"
        ],
        "warnings": [
          "确保固定板的平面度，避免后续弹簧安装困难。"
        ],
        "welding": {
          "required": true,
          "welding_type": "角焊",
          "welding_method": "CO2气保焊",
          "weld_size": "焊脚高度6mm",
          "welding_position": "零件⑦前弹簧固定板与零件①左铲板的连接处，平焊",
          "quality_requirements": "焊缝连续，焊缝高度均匀。焊后检查固定板的安装面是否平整，必要时进行轻微打磨。",
          "safety_notes": "注意控制焊接热输入，避免固定板因受热不均而产生较大变形。"
        },
        "safety_warnings": [
          "佩戴焊接面罩和防护手套，防止弧光和高温烫伤。",
          "控制焊接热输入，避免零件因变形而产生内应力，防止后续使用中开裂。",
          "确保工作区域通风良好，避免烟尘滞留。"
        ]
      },
      {
        "step_number": 7,
        "action": "焊接后弹簧固定板",
        "description": "将图纸上标注为8的后弹簧固定板（01.01.01.11524）共2件，焊接到1号左铲板的内侧，靠近后加强板（3号）的位置。",
        "position_description": "后弹簧固定板对称分布，用于安装后部的弹簧。",
        "parts_used": [
          {
            "bom_seq": "8",
            "bom_name": "后弹簧固定板 2",
            "quantity": 2,
            "drawing_number": "8"
          }
        ],
        "tools": [
          "焊机",
          "定位工装"
        ],
        "warnings": [
          "两块固定板的相对位置和角度必须准确，保证弹簧受力均匀。"
        ],
        "welding": {
          "required": true,
          "welding_type": "角焊",
          "welding_method": "CO2气保焊",
          "weld_size": "焊脚高度6mm",
          "welding_position": "零件⑧后弹簧固定板与零件①左铲板的连接处，平焊",
          "quality_requirements": "焊缝连续，两块固定板的中心距和相对角度必须符合图纸要求。焊后进行外观检查，确保无未熔合。",
          "safety_notes": "使用定位工装确保对称性。焊接时注意防止焊渣飞溅到已安装的零件上。"
        },
        "safety_warnings": [
          "使用定位工装时，确保零件固定牢靠，防止焊接过程中零件移动或掉落。",
          "焊接时注意保护已完成的焊缝和零件表面，防止焊渣飞溅损伤。",
          "佩戴防护眼镜和手套，防止清理焊渣时金属飞溅物伤害。"
        ]
      },
      {
        "step_number": 8,
        "action": "焊接支撑固定板",
        "description": "将图纸上标注为9的支撑固定板（01.01.01.11525）1件，焊接到1号左铲板的内侧，位于中央偏上的位置。",
        "position_description": "支撑固定板用于连接外部支撑结构，焊接位置需参照图纸上的尺寸定位。",
        "parts_used": [
          {
            "bom_seq": "9",
            "bom_name": "支撑固定板 1",
            "quantity": 1,
            "drawing_number": "9"
          }
        ],
        "tools": [
          "焊机",
          "角尺"
        ],
        "warnings": [
          "确保支撑固定板的安装面与铲板表面垂直。"
        ],
        "welding": {
          "required": true,
          "welding_type": "角焊",
          "welding_method": "CO2气保焊",
          "weld_size": "焊脚高度6mm",
          "welding_position": "零件⑨支撑固定板与零件①左铲板的连接处，平焊",
          "quality_requirements": "焊缝连续，焊后使用角尺检查固定板与铲板的垂直度，确保偏差小于1度。",
          "safety_notes": "焊接前清理坡口和焊接区域，确保无油污和锈蚀，防止产生气孔。"
        },
        "safety_warnings": [
          "焊接前必须彻底清理油污和锈蚀，防止焊接过程中产生有毒气体或爆炸。",
          "佩戴焊接面罩和防护手套，防止弧光和高温烫伤。",
          "使用角尺检查垂直度时，注意零件边缘锋利，防止割伤。"
        ]
      },
      {
        "step_number": 9,
        "action": "焊接轴套加强板",
        "description": "将图纸上标注为10的轴套加强板（01.01.01.11526）共2件，焊接到1号左铲板的后部边缘，靠近2号方形板-机加的位置。",
        "position_description": "轴套加强板用于增强轴套安装区域的强度。",
        "parts_used": [
          {
            "bom_seq": "10",
            "bom_name": "轴套加强板 2",
            "quantity": 2,
            "drawing_number": "10"
          }
        ],
        "tools": [
          "焊机"
        ],
        "warnings": [
          "加强板的焊接位置应避开轴套的安装孔位。"
        ],
        "welding": {
          "required": true,
          "welding_type": "角焊",
          "welding_method": "CO2气保焊",
          "weld_size": "焊脚高度6mm",
          "welding_position": "零件⑩轴套加强板与零件①左铲板的连接处，平焊",
          "quality_requirements": "焊缝连续，焊缝外观平整。注意加强板与铲板的贴合度，避免间隙过大导致未焊透。",
          "safety_notes": "控制焊接速度，确保熔深足够，达到加强效果。注意防止焊接飞溅物损伤周围零件。"
        },
        "safety_warnings": [
          "控制焊接速度和电流，防止因热输入过大导致零件变形。",
          "焊接时注意防止飞溅物损伤周围零件或烫伤操作人员。",
          "佩戴防护眼镜和手套，防止清理焊渣时金属飞溅物伤害。"
        ]
      },
      {
        "step_number": 10,
        "action": "焊接反光片安装板",
        "description": "将图纸上标注为11的反光片安装板（01.01.01.11527）1件，焊接到1号左铲板的侧面边缘。",
        "position_description": "安装板位于左铲板的侧面，用于安装反光片。",
        "parts_used": [
          {
            "bom_seq": "11",
            "bom_name": "反光片安装板 1",
            "quantity": 1,
            "drawing_number": "11"
          }
        ],
        "tools": [
          "焊机"
        ],
        "warnings": [
          "确保安装板的安装面平整，便于后续反光片的粘贴或螺栓固定。"
        ],
        "welding": {
          "required": true,
          "welding_type": "角焊",
          "welding_method": "CO2气保焊",
          "weld_size": "焊脚高度4mm",
          "welding_position": "零件⑪反光片安装板与零件①左铲板的连接处，横焊或立焊",
          "quality_requirements": "焊缝连续，焊缝尺寸要求较小（4mm），注意控制电流，防止烧穿薄板。焊后清理焊渣，确保安装面平整。",
          "safety_notes": "由于安装板较薄，焊接时应采用小电流、快速焊，减少热变形。注意防火，远离易燃材料。"
        },
        "safety_warnings": [
          "由于零件较薄，焊接时应使用小电流，防止烧穿或过度变形。",
          "进行横焊或立焊时，注意熔渣下坠，穿戴防护鞋和防护服。",
          "焊接完成后，立即清理焊渣，防止焊渣飞溅伤人或引起火灾。"
        ]
      },
      {
        "step_number": 11,
        "action": "焊接轴套",
        "description": "将图纸上标注为12的轴套（01.01.02.1222）共2件，分别焊接到1号左铲板后部的预留孔位上，并与10号轴套加强板配合。",
        "position_description": "轴套的中心线必须与铲板的安装面垂直，且两轴套的轴线平行。",
        "parts_used": [
          {
            "bom_seq": "12",
            "bom_name": "轴套 2",
            "quantity": 2,
            "drawing_number": "12"
          }
        ],
        "tools": [
          "焊机",
          "定位销",
          "百分表"
        ],
        "warnings": [
          "轴套的焊接是关键工序，必须使用定位工装保证同轴度和垂直度。",
          "焊接后检查轴套内孔，确保无焊渣和变形。"
        ],
        "welding": {
          "required": true,
          "welding_type": "角焊/环形焊",
          "welding_method": "CO2气保焊",
          "weld_size": "焊脚高度6mm，环形连续焊",
          "welding_position": "零件⑫轴套与零件①左铲板的连接处，平焊或横焊",
          "quality_requirements": "焊缝必须环形连续，焊缝饱满，无气孔、裂纹。焊后必须使用百分表或专用量具检查轴套的垂直度和同轴度，确保满足图纸要求。",
          "safety_notes": "轴套焊接属于高精度要求，应分层、分段对称焊接，控制热输入，减少变形。焊接时注意保护轴套内孔，防止焊渣飞溅。"
        },
        "safety_warnings": [
          "轴套焊接需分段对称进行，防止因热应力集中导致轴套变形或开裂。",
          "焊接时必须使用定位工装，确保轴套垂直度，防止零件倾倒伤人。",
          "注意保护轴套内孔，防止焊渣飞溅进入，清理时佩戴防护眼镜。"
        ]
      },
      {
        "step_number": 12,
        "action": "焊接方形板 1",
        "description": "将图纸上标注为13的方形板 1（01.01.01.11528）1件，焊接到1号左铲板的后部，位于轴套（12号）的上方。",
        "position_description": "方形板用于连接外部结构，焊接位置需参照图纸尺寸。",
        "parts_used": [
          {
            "bom_seq": "13",
            "bom_name": "方形板 1",
            "quantity": 1,
            "drawing_number": "13"
          }
        ],
        "tools": [
          "焊机"
        ],
        "warnings": [
          "确保方形板的安装面平整，无焊接变形。"
        ],
        "welding": {
          "required": true,
          "welding_type": "角焊",
          "welding_method": "CO2气保焊",
          "weld_size": "焊脚高度6mm",
          "welding_position": "零件⑬方形板 1与零件①左铲板的连接处，平焊",
          "quality_requirements": "焊缝连续，焊缝外观平整。注意与周围零件（如轴套）的相对位置精度。",
          "safety_notes": "焊接前检查焊丝伸出长度和保护气体流量，确保焊接过程稳定，减少飞溅。"
        },
        "safety_warnings": [
          "佩戴焊接面罩和防护手套，防止弧光和高温烫伤。",
          "焊接前检查保护气体流量，防止因气体不足导致焊缝质量下降和烟尘增加。",
          "注意焊枪和电缆的放置，避免绊倒或损坏绝缘层。"
        ]
      },
      {
        "step_number": 13,
        "action": "焊接方形板 3",
        "description": "将图纸上标注为14的方形板 3（01.01.01.11529）1件，焊接到1号左铲板的后部，位于13号方形板的下方。",
        "position_description": "方形板 3与方形板 1（13号）形成一组连接结构。",
        "parts_used": [
          {
            "bom_seq": "14",
            "bom_name": "方形板 3",
            "quantity": 1,
            "drawing_number": "14"
          }
        ],
        "tools": [
          "焊机"
        ],
        "warnings": [
          "两块方形板的相对位置必须准确，保证连接孔位对齐。"
        ],
        "welding": {
          "required": true,
          "welding_type": "角焊",
          "welding_method": "CO2气保焊",
          "weld_size": "焊脚高度6mm",
          "welding_position": "零件⑭方形板 3与零件①左铲板的连接处，平焊",
          "quality_requirements": "焊缝连续，确保两块方形板（13和14）的孔位中心线对齐。焊后进行外观检查，确保无未熔合。",
          "safety_notes": "焊接时注意控制热量，避免因局部过热导致零件变形，影响孔位精度。"
        },
        "safety_warnings": [
          "控制焊接热量，防止零件变形，影响后续装配精度。",
          "焊接时保持身体稳定，避免因操作不当造成烫伤或拉伤。",
          "确保工作区域整洁，避免电缆和工具堆放造成绊倒。"
        ]
      },
      {
        "step_number": 14,
        "action": "焊接左铲雪板加强板 2",
        "description": "将图纸上标注为15的左铲雪板加强板 2（01.02.01.4983）2件，焊接到1号左铲板的内侧，位于铲板的顶部边缘。",
        "position_description": "加强板沿铲板顶部边缘分布，用于增强铲板的刚度。",
        "parts_used": [
          {
            "bom_seq": "15",
            "bom_name": "左铲雪板加强板 2",
            "quantity": 2,
            "drawing_number": "15"
          }
        ],
        "tools": [
          "焊机"
        ],
        "warnings": [
          "加强板与铲板的焊接必须连续，焊缝高度和宽度符合图纸要求。"
        ],
        "welding": {
          "required": true,
          "welding_type": "角焊",
          "welding_method": "CO2气保焊",
          "weld_size": "焊脚高度6mm",
          "welding_position": "零件⑮左铲雪板加强板 2与零件①左铲板的连接处，平焊",
          "quality_requirements": "焊缝必须连续，焊缝外观要求高，确保焊缝饱满、均匀。焊后检查加强板与铲板的贴合度。",
          "safety_notes": "进行长焊缝焊接时，应采用分段、跳焊方式，控制焊接应力，防止铲板整体变形。"
        },
        "safety_warnings": [
          "进行长焊缝焊接时，采用分段跳焊，防止热应力集中导致零件变形或翘曲。",
          "佩戴焊接面罩和防护手套，防止长时间焊接产生的弧光和高温伤害。",
          "确保焊接区域周围无易燃物，防止火花飞溅引发火灾。"
        ]
      },
      {
        "step_number": 15,
        "action": "最终焊接和清理",
        "description": "对所有已点焊的零件进行满焊，确保所有焊缝符合技术要求。焊接完成后，进行焊渣清理和打磨，去除飞溅物。",
        "position_description": "对所有连接部位进行全面检查。",
        "parts_used": [],
        "tools": [
          "焊机",
          "角磨机",
          "钢丝刷"
        ],
        "warnings": [
          "所有焊缝必须饱满、连续，无气孔、夹渣等缺陷。",
          "打磨时注意保护非焊接区域的漆面。"
        ],
        "welding": {
          "required": true,
          "welding_type": "所有类型焊缝的最终满焊",
          "welding_method": "CO2气保焊为主",
          "weld_size": "所有焊缝按图纸要求（未标注按6mm）",
          "welding_position": "所有零件连接处，涉及平焊、横焊、立焊",
          "quality_requirements": "所有焊缝外观必须达到二级焊缝标准：焊缝成型良好，无裂纹、未熔合、未焊透。焊后进行全面外观检查，关键部位（如轴套、油缸固定板）必要时进行磁粉检测（MT）。",
          "safety_notes": "进行大面积焊接时，注意工作环境的通风和排烟。打磨时必须佩戴防护眼镜和防尘口罩，防止金属粉尘和火花伤害。"
        },
        "safety_warnings": [
          "使用角磨机打磨时，必须佩戴防护眼镜、防尘口罩和防护手套，防止飞溅物和金属粉尘伤害。",
          "打磨作业时，注意磨光片是否安装牢固，防止高速旋转的磨片飞出伤人。",
          "清理焊渣时，使用钢丝刷或专用工具，注意防止金属飞溅物反弹伤眼。",
          "进行大面积焊接时，确保通风系统全开，防止烟尘中毒。"
        ]
      }
    ]
  }
}