{
  "agent_name": "Agent6_FAQ",
  "model": "google/gemini-2.5-flash-preview-09-2025",
  "timestamp": "20251005_144829",
  "image_count": 0,
  "temperature": 0.2,
  "system_prompt": "# 角色定位\n\n你是**李师傅**，一位拥有20年安全管理经验的高级安全工程师。\n\n## 教育背景\n\n- **学历**：安全工程专业本科\n- **职业资格**：注册安全工程师、高级安全评价师\n- **专业培训**：\n  - 机械制造安全管理\n  - 职业健康与安全管理体系（ISO 45001）\n  - 事故调查与分析\n  - 应急预案编制与演练\n\n## 职业背景\n\n- **工作经历**：20年机械制造企业安全管理经验，参与过大型装备制造、钢结构加工等项目\n- **专业领域**：\n  - 机械加工安全（车、铣、刨、磨、钻等）\n  - 焊接作业安全（电焊、气焊、氩弧焊等）\n  - 起重吊装安全（行车、叉车、吊索具等）\n  - 高空作业安全（脚手架、安全带、防坠落等）\n  - 个人防护用品管理（安全帽、防护眼镜、手套、安全鞋等）\n\n## 知识结构（详细）\n\n### 1. 机械伤害风险\n- **夹伤/挤伤**：手指、手臂被运动部件夹住\n- **切割伤**：锋利边缘、毛刺、切削工具\n- **碰撞伤**：头部碰撞、身体碰撞\n- **坠落伤**：零件坠落、工具坠落、人员坠落\n\n### 2. 焊接作业风险\n- **电击伤**：焊机漏电、接地不良\n- **弧光伤**：电弧紫外线灼伤眼睛和皮肤\n- **烫伤**：高温熔池、焊渣飞溅\n- **火灾爆炸**：易燃物引燃、气瓶泄漏\n- **有毒气体**：焊接烟尘、一氧化碳中毒\n\n### 3. 起重吊装风险\n- **吊物坠落**：吊索具断裂、捆绑不牢\n- **吊物摆动**：碰撞人员、设备\n- **超载**：超过起重机额定载荷\n- **指挥失误**：信号不清、违章指挥\n\n### 4. 高空作业风险\n- **人员坠落**：未系安全带、脚手架不牢\n- **物体打击**：工具、零件从高处坠落\n- **脚手架坍塌**：搭设不规范、超载\n\n### 5. 个人防护用品\n- **头部防护**：安全帽（防止碰撞、坠物打击）\n- **眼部防护**：防护眼镜、焊接面罩（防止飞溅、弧光）\n- **手部防护**：防护手套（防止切割、烫伤、化学品）\n- **足部防护**：安全鞋（防砸、防刺穿、防滑）\n- **呼吸防护**：防尘口罩、防毒面具（防止粉尘、有毒气体）\n\n### 6. 应急处理\n- **机械伤害**：立即停机、呼救、止血、固定、送医\n- **电击伤**：切断电源、心肺复苏、送医\n- **烫伤**：冷水冲洗、覆盖无菌纱布、送医\n- **火灾**：使用灭火器、疏散人员、报警\n\n## 任务步骤（Chain of Thought）\n\n你的任务是**为每个装配步骤添加安全警告**（如果该步骤有安全风险）。请按照以下5个步骤思考：\n\n### 步骤1：识别风险步骤\n- 分析每个装配步骤的操作内容\n- 判断是否涉及高风险作业（焊接、吊装、高空、重物搬运等）\n- 识别潜在的伤害类型（机械伤害、电击、烫伤、坠落等）\n\n### 步骤2：分析风险源\n- 确定风险的来源（设备、工具、材料、环境、人员操作等）\n- 评估风险的严重程度（轻微、中等、严重、致命）\n- 考虑风险的发生概率\n\n### 步骤3：制定预防措施\n- 针对每个风险源，制定具体的预防措施\n- 强调个人防护用品的使用\n- 强调安全操作规程的遵守\n\n### 步骤4：添加安全警告\n- 为每个有风险的步骤添加safety_warnings字段\n- 每条警告要简洁明了，说明具体的风险和预防措施\n- 使用工人能看懂的语言\n\n### 步骤5：验证完整性\n- 检查所有高风险步骤是否都添加了安全警告\n- 检查安全警告是否具体、可操作\n- 检查是否遗漏了任何潜在风险\n\n## 核心原则\n\n1. **步骤级嵌入**：为每个有风险的步骤添加safety_warnings字段，而不是单独列出安全警告\n2. **工人友好**：使用通俗语言，避免专业术语\n3. **具体可操作**：说明具体的风险和预防措施，而不是泛泛而谈\n4. **不重复显示**：安全警告只在下方\"安全\"标签页中统一显示，不在当前步骤详情中重复显示\n\n## 输出格式\n\n严格按照以下JSON格式输出（返回增强后的装配步骤）：\n\n```json\n{\n  \"enhanced_steps\": [\n    {\n      \"step_number\": 1,\n      \"title\": \"点焊定位\",\n      \"parts_used\": [...],\n      \"tools_required\": [...],\n      \"operation\": \"操作说明\",\n      \"quality_check\": \"质量检查\",\n      \"estimated_time_minutes\": 10,\n      \"welding\": {\n        \"required\": true,\n        \"welding_type\": \"点焊\",\n        \"welding_method\": \"CO2气保焊\",\n        ...\n      },\n      \"safety_warnings\": [\n        \"佩戴焊接面罩和防护手套，防止弧光灼伤眼睛和皮肤\",\n        \"确保工件夹紧牢固，防止点焊时位移造成伤害\",\n        \"焊接区域周围3米内不得有易燃物，配备灭火器\",\n        \"焊机必须接地良好，防止漏电触电\"\n      ]\n    },\n    {\n      \"step_number\": 2,\n      \"title\": \"螺栓连接\",\n      \"parts_used\": [...],\n      \"operation\": \"操作说明\",\n      \"quality_check\": \"质量检查\",\n      \"estimated_time_minutes\": 15,\n      \"safety_warnings\": [\n        \"佩戴安全帽和防护眼镜，防止零件坠落和飞溅\",\n        \"使用扭力扳手时注意力度，防止扳手滑脱伤人\"\n      ]\n    },\n    {\n      \"step_number\": 3,\n      \"title\": \"简单装配\",\n      \"parts_used\": [...],\n      \"operation\": \"操作说明\",\n      \"quality_check\": \"质量检查\",\n      \"estimated_time_minutes\": 5\n      // ⚠️ 如果没有明显安全风险，不添加safety_warnings字段\n    }\n  ]\n}\n```\n\n**⚠️ 关键要求**：\n\n1. **步骤级嵌入**：\n   - 为每个有风险的步骤添加`safety_warnings`字段\n   - 没有明显风险的步骤不添加`safety_warnings`字段\n   - 保持原有步骤的所有字段不变\n\n2. **安全警告要具体**：\n   - ✅ 说\"佩戴焊接面罩和防护手套，防止弧光灼伤眼睛和皮肤\"\n   - ❌ 不说\"注意安全\"\n   - ✅ 说\"焊接区域周围3米内不得有易燃物，配备灭火器\"\n   - ❌ 不说\"注意防火\"\n\n3. **使用通俗语言**：\n   - 工人能看懂的语言\n   - 避免专业术语和英文缩写\n\n4. **警告要全面**：\n   - 涵盖个人防护、设备安全、环境安全、操作安全\n   - 每条警告说明具体的风险和预防措施\n\n## 重要提醒\n\n- **只输出JSON，不要输出其他内容**\n- **保持原有字段不变**：不要修改或删除原有的字段（包括welding字段）\n- **警告要简洁明了**：每条警告一句话，说明风险和预防措施\n- **不要过度警告**：只针对有明显风险的步骤添加警告\n",
  "user_query": "请为以下装配步骤添加安全警告（如果有安全风险）。\n\n## 📸 视觉分析任务\n\n**你会看到工程图纸图片，请仔细观察：**\n\n1. **危险作业标识**：\n   - 图纸上的安全警告标识\n   - 特殊作业要求（如高空作业、吊装作业等）\n   - 危险区域标注\n\n2. **零件特征**：\n   - 重型零件（需要吊装）\n   - 锋利边缘（容易割伤）\n   - 高温部件（容易烫伤）\n\n3. **作业环境**：\n   - 狭窄空间（容易碰撞）\n   - 高空位置（容易坠落）\n   - 密闭空间（通风不良）\n\n## 装配步骤\n\n[\n  {\n    \"step_number\": 1,\n    \"action\": \"放置基准件\",\n    \"description\": \"将图纸上标注为②的连接板（01.01.01.11509，重21.36kg）平稳放置在装配工装或工作台上，作为整个组件的装配基准。\",\n    \"position_description\": \"连接板的平面朝上，确保放置平稳。\",\n    \"parts_used\": [\n      {\n        \"bom_seq\": \"2\",\n        \"bom_name\": \"连接板 1\",\n        \"quantity\": 1,\n        \"drawing_number\": \"2\",\n        \"node_name\": [\n          \"NAUO2\"\n        ],\n        \"bom_code\": \"01.01.01.11509\"\n      }\n    ],\n    \"tools\": [\n      \"行车/吊具\",\n      \"水平仪\"\n    ],\n    \"warnings\": [\n      \"连接板较重，吊装时注意安全，确保吊装平稳。\",\n      \"检查连接板表面无油污和锈蚀。\"\n    ]\n  },\n  {\n    \"step_number\": 2,\n    \"action\": \"焊接底部矩形管\",\n    \"description\": \"将图纸上标注为①的矩形管（01.01.03.2718）放置在②号连接板的底部边缘，按照图纸尺寸和焊接要求进行点焊定位。\",\n    \"position_description\": \"矩形管（1）位于连接板（2）的底部边缘，沿长度方向对齐。\",\n    \"parts_used\": [\n      {\n        \"bom_seq\": \"1\",\n        \"bom_name\": \"矩形管 1\",\n        \"quantity\": 1,\n        \"drawing_number\": \"1\"\n      }\n    ],\n    \"tools\": [\n      \"焊机\",\n      \"角尺\",\n      \"卷尺\"\n    ],\n    \"warnings\": [\n      \"点焊时注意控制变形，确保矩形管与连接板的垂直度。\",\n      \"焊接前检查焊缝位置的清洁度。\"\n    ],\n    \"welding\": {\n      \"required\": true,\n      \"welding_type\": \"角焊（定位焊）\",\n      \"welding_method\": \"CO2气保焊\",\n      \"weld_size\": \"点焊长度10-15mm，焊脚高度4mm\",\n      \"welding_position\": \"矩形管（1）与连接板（2）的连接处，平焊为主\",\n      \"quality_requirements\": \"点焊牢固，定位准确，焊点无明显气孔或裂纹\",\n      \"safety_notes\": \"佩戴焊接面罩和防护手套，确保工作区域通风良好，防止火花飞溅。\"\n    }\n  },\n  {\n    \"step_number\": 3,\n    \"action\": \"焊接侧面矩形管\",\n    \"description\": \"将图纸上标注为⑥的矩形管（01.01.03.2719，共2件）和⑧的矩形管（01.01.03.2720，共1件）安装到②号连接板的上方两侧和中间位置，并进行点焊定位。\",\n    \"position_description\": \"矩形管（6）安装在连接板（2）上方的两侧，矩形管（8）安装在连接板（2）上方的中间位置。\",\n    \"parts_used\": [\n      {\n        \"bom_seq\": \"6\",\n        \"bom_name\": \"矩形管 2\",\n        \"quantity\": 2,\n        \"drawing_number\": \"6\"\n      },\n      {\n        \"bom_seq\": \"8\",\n        \"bom_name\": \"矩形管 1\",\n        \"quantity\": 1,\n        \"drawing_number\": \"8\",\n        \"node_name\": [\n          \"NAUO13\",\n          \"NAUO10\",\n          \"NAUO9\",\n          \"NAUO1\"\n        ],\n        \"bom_code\": \"01.01.03.2720\"\n      }\n    ],\n    \"tools\": [\n      \"焊机\",\n      \"卡具\",\n      \"卷尺\"\n    ],\n    \"warnings\": [\n      \"确保三根矩形管的端面与连接板的安装面齐平。\",\n      \"使用卡具固定，防止焊接过程中移位。\"\n    ],\n    \"welding\": {\n      \"required\": true,\n      \"welding_type\": \"角焊（定位焊）\",\n      \"welding_method\": \"CO2气保焊\",\n      \"weld_size\": \"点焊长度10-15mm，焊脚高度4mm\",\n      \"welding_position\": \"矩形管（6、8）与连接板（2）的连接处，平焊为主\",\n      \"quality_requirements\": \"定位焊点均匀分布，保证矩形管与连接板的垂直度和平行度\",\n      \"safety_notes\": \"检查焊机接地线连接可靠，避免触电风险。操作时注意周围环境，防止烫伤。\"\n    }\n  },\n  {\n    \"step_number\": 4,\n    \"action\": \"安装挂件虚拟组件\",\n    \"description\": \"将图纸上标注为④的右挂件虚拟组件（01.05.0018）和⑤的左挂件虚拟组件（01.05.0019）分别安装到矩形管（6）和矩形管（8）的端部，并进行点焊定位。\",\n    \"position_description\": \"右挂件（4）和左挂件（5）分别安装在组件的两端，挂钩部分朝外。\",\n    \"parts_used\": [\n      {\n        \"bom_seq\": \"4\",\n        \"bom_name\": \"右挂件虚拟组件 1\",\n        \"quantity\": 1,\n        \"drawing_number\": \"4\"\n      },\n      {\n        \"bom_seq\": \"5\",\n        \"bom_name\": \"左挂件虚拟组件 1\",\n        \"quantity\": 1,\n        \"drawing_number\": \"5\"\n      }\n    ],\n    \"tools\": [\n      \"焊机\",\n      \"游标卡尺\"\n    ],\n    \"warnings\": [\n      \"挂件的安装方向和角度必须符合图纸要求，确保挂钩开口方向正确。\",\n      \"检查挂件与矩形管的相对位置尺寸。\"\n    ],\n    \"welding\": {\n      \"required\": true,\n      \"welding_type\": \"角焊（定位焊）\",\n      \"welding_method\": \"CO2气保焊\",\n      \"weld_size\": \"点焊长度10mm，焊脚高度4mm\",\n      \"welding_position\": \"挂件（4、5）与矩形管（6、8）的连接处，平焊或横焊\",\n      \"quality_requirements\": \"定位焊点位置准确，确保挂件安装角度无偏差\",\n      \"safety_notes\": \"注意焊接烟尘，开启排风设备。焊接时避免眼睛直视电弧光。\"\n    }\n  },\n  {\n    \"step_number\": 5,\n    \"action\": \"安装封板\",\n    \"description\": \"将图纸上标注为⑦的封板（01.01.01.16608，共2件）安装到矩形管（6）和矩形管（8）之间的开口处，并进行点焊定位。\",\n    \"position_description\": \"封板（7）位于矩形管（6）和矩形管（8）之间，用于封闭结构侧面。\",\n    \"parts_used\": [\n      {\n        \"bom_seq\": \"7\",\n        \"bom_name\": \"封板 2\",\n        \"quantity\": 2,\n        \"drawing_number\": \"7\",\n        \"node_name\": [\n          \"NAUO12\",\n          \"NAUO11\"\n        ],\n        \"bom_code\": \"01.01.01.16608\"\n      }\n    ],\n    \"tools\": [\n      \"焊机\"\n    ],\n    \"warnings\": [\n      \"封板边缘应与矩形管边缘齐平，确保焊接间隙均匀。\"\n    ],\n    \"welding\": {\n      \"required\": true,\n      \"welding_type\": \"角焊（定位焊）\",\n      \"welding_method\": \"CO2气保焊\",\n      \"weld_size\": \"点焊长度10mm，焊脚高度3mm\",\n      \"welding_position\": \"封板（7）与矩形管（6、8）的连接处，平焊为主\",\n      \"quality_requirements\": \"封板与矩形管贴合紧密，点焊位置均匀，防止后续满焊时变形\",\n      \"safety_notes\": \"检查焊枪和电缆绝缘是否完好，防止漏电。保持工作台面整洁。\"\n    }\n  },\n  {\n    \"step_number\": 6,\n    \"action\": \"安装加强筋\",\n    \"description\": \"将图纸上标注为⑨的加强筋（01.01.01.17678，共2件）安装到矩形管（6）和矩形管（8）的内侧，并进行点焊定位。\",\n    \"position_description\": \"加强筋（9）呈斜角支撑，位于矩形管（6）和矩形管（8）的内侧，用于增强结构刚度。\",\n    \"parts_used\": [\n      {\n        \"bom_seq\": \"9\",\n        \"bom_name\": \"加强筋 2\",\n        \"quantity\": 2,\n        \"drawing_number\": \"9\",\n        \"node_name\": [\n          \"NAUO15\",\n          \"NAUO14\"\n        ],\n        \"bom_code\": \"01.01.01.17678\"\n      }\n    ],\n    \"tools\": [\n      \"焊机\",\n      \"角度尺\"\n    ],\n    \"warnings\": [\n      \"加强筋的安装角度和位置必须准确，确保其支撑作用。\",\n      \"检查加强筋与矩形管的贴合度。\"\n    ],\n    \"welding\": {\n      \"required\": true,\n      \"welding_type\": \"角焊（定位焊）\",\n      \"welding_method\": \"CO2气保焊\",\n      \"weld_size\": \"点焊长度15mm，焊脚高度4mm\",\n      \"welding_position\": \"加强筋（9）与矩形管（6、8）的连接处，立焊或横焊\",\n      \"quality_requirements\": \"加强筋定位焊点应在受力方向上，保证角度准确，防止焊接变形\",\n      \"safety_notes\": \"由于涉及立焊或横焊，需调整焊接参数，防止熔池下坠。注意焊渣飞溅。\"\n    }\n  },\n  {\n    \"step_number\": 7,\n    \"action\": \"安装方形板\",\n    \"description\": \"将图纸上标注为③的方形板-机加（01.01.01.6589，共4件）安装到矩形管（1）和矩形管（6）的端部，并进行点焊定位。\",\n    \"position_description\": \"方形板（3）安装在矩形管（1）和矩形管（6）的四个端面，用于封闭管口。\",\n    \"parts_used\": [\n      {\n        \"bom_seq\": \"3\",\n        \"bom_name\": \"方形板-机加 4\",\n        \"quantity\": 4,\n        \"drawing_number\": \"3\",\n        \"node_name\": [\n          \"NAUO6\",\n          \"NAUO5\",\n          \"NAUO4\",\n          \"NAUO3\"\n        ],\n        \"bom_code\": \"01.01.01.6589\"\n      }\n    ],\n    \"tools\": [\n      \"焊机\"\n    ],\n    \"warnings\": [\n      \"方形板应与矩形管端面齐平，确保焊接后外观平整。\"\n    ],\n    \"welding\": {\n      \"required\": true,\n      \"welding_type\": \"角焊（定位焊）\",\n      \"welding_method\": \"CO2气保焊\",\n      \"weld_size\": \"点焊长度10mm，焊脚高度3mm\",\n      \"welding_position\": \"方形板（3）与矩形管（1、6）的端面连接处，平焊为主\",\n      \"quality_requirements\": \"定位焊点均匀分布在四个角，确保方形板与管口端面齐平，无间隙\",\n      \"safety_notes\": \"焊接小零件时，注意控制电流，防止烧穿。使用夹具固定，避免零件移动。\"\n    }\n  },\n  {\n    \"step_number\": 8,\n    \"action\": \"满焊主体结构\",\n    \"description\": \"按照图纸上的焊接符号和技术要求，对所有已点焊定位的零件（1、6、8、4、5、7、9、3）与基准件（2）的连接处进行满焊。\",\n    \"position_description\": \"所有焊缝应连续、饱满，符合技术要求1和2。\",\n    \"parts_used\": [],\n    \"tools\": [\n      \"焊机\",\n      \"焊渣锤\",\n      \"钢丝刷\"\n    ],\n    \"warnings\": [\n      \"焊接顺序应遵循对称、分散的原则，以减少焊接变形。\",\n      \"焊缝高度和宽度应符合图纸要求，焊后必须清渣。\"\n    ],\n    \"welding\": {\n      \"required\": true,\n      \"welding_type\": \"角焊/对接焊（满焊）\",\n      \"welding_method\": \"CO2气保焊\",\n      \"weld_size\": \"焊脚高度至少6mm（根据图纸符号），焊缝连续\",\n      \"welding_position\": \"所有零件连接处，涉及平焊、横焊、立焊\",\n      \"quality_requirements\": \"焊缝外观成型良好，焊波均匀，无咬边、未焊透、气孔、夹渣等缺陷。焊后进行外观检查和尺寸检验。\",\n      \"safety_notes\": \"进行大面积满焊时，注意焊机持续工作时间，防止过热。必须穿戴全套防护服和面罩，确保身体各部位不受电弧和高温伤害。焊接完成后，对高温部件进行警示。\"\n    }\n  }\n]\n\n## 要求\n\n请按照以下5个步骤思考，为装配步骤添加安全警告：\n\n### 步骤1：识别风险步骤\n- 分析每个装配步骤的操作内容\n- 判断是否涉及高风险作业：\n  * **焊接作业**：电击、弧光、烫伤、火灾\n  * **吊装作业**：吊物坠落、碰撞、超载\n  * **高空作业**：人员坠落、物体打击\n  * **重物搬运**：砸伤、扭伤、夹伤\n  * **机械加工**：切割伤、夹伤、碰撞\n\n### 步骤2：分析风险源\n- 确定风险的来源（设备、工具、材料、环境、人员操作等）\n- 评估风险的严重程度（轻微、中等、严重、致命）\n- 考虑风险的发生概率\n\n### 步骤3：制定预防措施\n- 针对每个风险源，制定具体的预防措施\n- 强调个人防护用品的使用：\n  * **焊接**：焊接面罩、防护手套、防护服\n  * **吊装**：安全帽、安全鞋、手套\n  * **高空**：安全带、安全帽、防滑鞋\n  * **机械**：防护眼镜、手套、安全鞋\n\n### 步骤4：添加安全警告\n- 为每个有风险的步骤添加safety_warnings字段\n- 每条警告要简洁明了，说明具体的风险和预防措施\n- 使用工人能看懂的语言\n\n### 步骤5：验证完整性\n- 检查所有高风险步骤是否都添加了安全警告\n- 检查安全警告是否具体、可操作\n- 检查是否遗漏了任何潜在风险\n\n## ⚠️ 强制自检清单（生成后必须逐项检查）\n\n**在输出JSON之前，你必须完成以下验证：**\n\n1. **风险步骤识别验证**：\n   - [ ] 所有涉及焊接、吊装、高空、重物搬运的步骤都添加了safety_warnings字段\n   - [ ] 没有明显风险的步骤没有添加safety_warnings字段\n\n2. **安全警告完整性验证**：\n   - [ ] 每个safety_warnings字段都是字符串数组\n   - [ ] 每条警告都说明了具体的风险和预防措施\n   - [ ] 涵盖了个人防护、设备安全、环境安全、操作安全\n\n3. **语言通俗性验证**：\n   - [ ] 使用工人能看懂的语言\n   - [ ] 避免专业术语和英文缩写\n   - [ ] 每条警告简洁明了（一句话）\n\n4. **原有字段保持验证**：\n   - [ ] 原有步骤的所有字段都保持不变（包括welding字段）\n   - [ ] 没有修改或删除任何原有字段\n\n**如果自检发现任何问题，必须重新生成！**\n\n现在开始为装配步骤添加安全警告！\n",
  "raw_response": "```json\n{\n  \"enhanced_steps\": [\n    {\n      \"step_number\": 1,\n      \"action\": \"放置基准件\",\n      \"description\": \"将图纸上标注为②的连接板（01.01.01.11509，重21.36kg）平稳放置在装配工装或工作台上，作为整个组件的装配基准。\",\n      \"position_description\": \"连接板的平面朝上，确保放置平稳。\",\n      \"parts_used\": [\n        {\n          \"bom_seq\": \"2\",\n          \"bom_name\": \"连接板 1\",\n          \"quantity\": 1,\n          \"drawing_number\": \"2\",\n          \"node_name\": [\n            \"NAUO2\"\n          ],\n          \"bom_code\": \"01.01.01.11509\"\n        }\n      ],\n      \"tools\": [\n        \"行车/吊具\",\n        \"水平仪\"\n      ],\n      \"warnings\": [\n        \"连接板较重，吊装时注意安全，确保吊装平稳。\",\n        \"检查连接板表面无油污和锈蚀。\"\n      ],\n      \"safety_warnings\": [\n        \"连接板重21.36kg，必须使用行车或吊具吊装，严禁徒手搬运，防止扭伤或砸伤。\",\n        \"吊装前检查吊索具是否完好，捆绑必须牢固，防止吊物坠落。\",\n        \"吊装过程中，人员必须佩戴安全帽和安全鞋，并远离吊物下方。\"\n      ]\n    },\n    {\n      \"step_number\": 2,\n      \"action\": \"焊接底部矩形管\",\n      \"description\": \"将图纸上标注为①的矩形管（01.01.03.2718）放置在②号连接板的底部边缘，按照图纸尺寸和焊接要求进行点焊定位。\",\n      \"position_description\": \"矩形管（1）位于连接板（2）的底部边缘，沿长度方向对齐。\",\n      \"parts_used\": [\n        {\n          \"bom_seq\": \"1\",\n          \"bom_name\": \"矩形管 1\",\n          \"quantity\": 1,\n          \"drawing_number\": \"1\"\n        }\n      ],\n      \"tools\": [\n        \"焊机\",\n        \"角尺\",\n        \"卷尺\"\n      ],\n      \"warnings\": [\n        \"点焊时注意控制变形，确保矩形管与连接板的垂直度。\",\n        \"焊接前检查焊缝位置的清洁度。\"\n      ],\n      \"welding\": {\n        \"required\": true,\n        \"welding_type\": \"角焊（定位焊）\",\n        \"welding_method\": \"CO2气保焊\",\n        \"weld_size\": \"点焊长度10-15mm，焊脚高度4mm\",\n        \"welding_position\": \"矩形管（1）与连接板（2）的连接处，平焊为主\",\n        \"quality_requirements\": \"点焊牢固，定位准确，焊点无明显气孔或裂纹\",\n        \"safety_notes\": \"佩戴焊接面罩和防护手套，确保工作区域通风良好，防止火花飞溅。\"\n      },\n      \"safety_warnings\": [\n        \"必须佩戴焊接面罩、防护手套和防护服，防止弧光灼伤和高温烫伤。\",\n        \"检查焊机接地线连接可靠，防止触电事故。\",\n        \"确保焊接区域通风良好，防止烟尘和有毒气体中毒。\",\n        \"清理焊接区域周围的易燃物，防止火花飞溅引发火灾。\"\n      ]\n    },\n    {\n      \"step_number\": 3,\n      \"action\": \"焊接侧面矩形管\",\n      \"description\": \"将图纸上标注为⑥的矩形管（01.01.03.2719，共2件）和⑧的矩形管（01.01.03.2720，共1件）安装到②号连接板的上方两侧和中间位置，并进行点焊定位。\",\n      \"position_description\": \"矩形管（6）安装在连接板（2）上方的两侧，矩形管（8）安装在连接板（2）上方的中间位置。\",\n      \"parts_used\": [\n        {\n          \"bom_seq\": \"6\",\n          \"bom_name\": \"矩形管 2\",\n          \"quantity\": 2,\n          \"drawing_number\": \"6\"\n        },\n        {\n          \"bom_seq\": \"8\",\n          \"bom_name\": \"矩形管 1\",\n          \"quantity\": 1,\n          \"drawing_number\": \"8\",\n          \"node_name\": [\n            \"NAUO13\",\n            \"NAUO10\",\n            \"NAUO9\",\n            \"NAUO1\"\n          ],\n          \"bom_code\": \"01.01.03.2720\"\n        }\n      ],\n      \"tools\": [\n        \"焊机\",\n        \"卡具\",\n        \"卷尺\"\n      ],\n      \"warnings\": [\n        \"确保三根矩形管的端面与连接板的安装面齐平。\",\n        \"使用卡具固定，防止焊接过程中移位。\"\n      ],\n      \"welding\": {\n        \"required\": true,\n        \"welding_type\": \"角焊（定位焊）\",\n        \"welding_method\": \"CO2气保焊\",\n        \"weld_size\": \"点焊长度10-15mm，焊脚高度4mm\",\n        \"welding_position\": \"矩形管（6、8）与连接板（2）的连接处，平焊为主\",\n        \"quality_requirements\": \"定位焊点均匀分布，保证矩形管与连接板的垂直度和平行度\",\n        \"safety_notes\": \"检查焊机接地线连接可靠，避免触电风险。操作时注意周围环境，防止烫伤。\"\n      },\n      \"safety_warnings\": [\n        \"佩戴焊接面罩和防护手套，防止弧光和飞溅物伤害。\",\n        \"使用卡具固定零件时，注意夹紧力度，防止零件弹出伤人。\",\n        \"焊接时注意周围环境，防止高温焊渣飞溅到身体或易燃物上。\"\n      ]\n    },\n    {\n      \"step_number\": 4,\n      \"action\": \"安装挂件虚拟组件\",\n      \"description\": \"将图纸上标注为④的右挂件虚拟组件（01.05.0018）和⑤的左挂件虚拟组件（01.05.0019）分别安装到矩形管（6）和矩形管（8）的端部，并进行点焊定位。\",\n      \"position_description\": \"右挂件（4）和左挂件（5）分别安装在组件的两端，挂钩部分朝外。\",\n      \"parts_used\": [\n        {\n          \"bom_seq\": \"4\",\n          \"bom_name\": \"右挂件虚拟组件 1\",\n          \"quantity\": 1,\n          \"drawing_number\": \"4\"\n        },\n        {\n          \"bom_seq\": \"5\",\n          \"bom_name\": \"左挂件虚拟组件 1\",\n          \"quantity\": 1,\n          \"drawing_number\": \"5\"\n        }\n      ],\n      \"tools\": [\n        \"焊机\",\n        \"游标卡尺\"\n      ],\n      \"warnings\": [\n        \"挂件的安装方向和角度必须符合图纸要求，确保挂钩开口方向正确。\",\n        \"检查挂件与矩形管的相对位置尺寸。\"\n      ],\n      \"welding\": {\n        \"required\": true,\n        \"welding_type\": \"角焊（定位焊）\",\n        \"welding_method\": \"CO2气保焊\",\n        \"weld_size\": \"点焊长度10mm，焊脚高度4mm\",\n        \"welding_position\": \"挂件（4、5）与矩形管（6、8）的连接处，平焊或横焊\",\n        \"quality_requirements\": \"定位焊点位置准确，确保挂件安装角度无偏差\",\n        \"safety_notes\": \"注意焊接烟尘，开启排风设备。焊接时避免眼睛直视电弧光。\"\n      },\n      \"safety_warnings\": [\n        \"开启局部排风设备，减少焊接烟尘吸入，佩戴防尘口罩。\",\n        \"焊接时必须使用合格的焊接面罩，防止电弧光对眼睛造成永久性伤害。\",\n        \"小零件焊接时，注意控制电流，防止烧穿或飞溅物过多。\"\n      ]\n    },\n    {\n      \"step_number\": 5,\n      \"action\": \"安装封板\",\n      \"description\": \"将图纸上标注为⑦的封板（01.01.01.16608，共2件）安装到矩形管（6）和矩形管（8）之间的开口处，并进行点焊定位。\",\n      \"position_description\": \"封板（7）位于矩形管（6）和矩形管（8）之间，用于封闭结构侧面。\",\n      \"parts_used\": [\n        {\n          \"bom_seq\": \"7\",\n          \"bom_name\": \"封板 2\",\n          \"quantity\": 2,\n          \"drawing_number\": \"7\",\n          \"node_name\": [\n            \"NAUO12\",\n            \"NAUO11\"\n          ],\n          \"bom_code\": \"01.01.01.16608\"\n        }\n      ],\n      \"tools\": [\n        \"焊机\"\n      ],\n      \"warnings\": [\n        \"封板边缘应与矩形管边缘齐平，确保焊接间隙均匀。\"\n      ],\n      \"welding\": {\n        \"required\": true,\n        \"welding_type\": \"角焊（定位焊）\",\n        \"welding_method\": \"CO2气保焊\",\n        \"weld_size\": \"点焊长度10mm，焊脚高度3mm\",\n        \"welding_position\": \"封板（7）与矩形管（6、8）的连接处，平焊为主\",\n        \"quality_requirements\": \"封板与矩形管贴合紧密，点焊位置均匀，防止后续满焊时变形\",\n        \"safety_notes\": \"检查焊枪和电缆绝缘是否完好，防止漏电。保持工作台面整洁。\"\n      },\n      \"safety_warnings\": [\n        \"操作前检查焊枪和电缆绝缘层是否破损，防止接触带电体。\",\n        \"封板边缘可能锋利，搬运和定位时请佩戴防护手套，防止割伤。\"\n      ]\n    },\n    {\n      \"step_number\": 6,\n      \"action\": \"安装加强筋\",\n      \"description\": \"将图纸上标注为⑨的加强筋（01.01.01.17678，共2件）安装到矩形管（6）和矩形管（8）的内侧，并进行点焊定位。\",\n      \"position_description\": \"加强筋（9）呈斜角支撑，位于矩形管（6）和矩形管（8）的内侧，用于增强结构刚度。\",\n      \"parts_used\": [\n        {\n          \"bom_seq\": \"9\",\n          \"bom_name\": \"加强筋 2\",\n          \"quantity\": 2,\n          \"drawing_number\": \"9\",\n          \"node_name\": [\n            \"NAUO15\",\n            \"NAUO14\"\n          ],\n          \"bom_code\": \"01.01.01.17678\"\n        }\n      ],\n      \"tools\": [\n        \"焊机\",\n        \"角度尺\"\n      ],\n      \"warnings\": [\n        \"加强筋的安装角度和位置必须准确，确保其支撑作用。\",\n        \"检查加强筋与矩形管的贴合度。\"\n      ],\n      \"welding\": {\n        \"required\": true,\n        \"welding_type\": \"角焊（定位焊）\",\n        \"welding_method\": \"CO2气保焊\",\n        \"weld_size\": \"点焊长度15mm，焊脚高度4mm\",\n        \"welding_position\": \"加强筋（9）与矩形管（6、8）的连接处，立焊或横焊\",\n        \"quality_requirements\": \"加强筋定位焊点应在受力方向上，保证角度准确，防止焊接变形\",\n        \"safety_notes\": \"由于涉及立焊或横焊，需调整焊接参数，防止熔池下坠。注意焊渣飞溅。\"\n      },\n      \"safety_warnings\": [\n        \"进行立焊或横焊时，注意调整焊接参数，防止熔池下坠造成烫伤。\",\n        \"加强筋边缘可能锋利，操作时佩戴防护手套，防止割伤。\",\n        \"注意焊渣飞溅方向，确保身体和周围人员的安全。\"\n      ]\n    },\n    {\n      \"step_number\": 7,\n      \"action\": \"安装方形板\",\n      \"description\": \"将图纸上标注为③的方形板-机加（01.01.01.6589，共4件）安装到矩形管（1）和矩形管（6）的端部，并进行点焊定位。\",\n      \"position_description\": \"方形板（3）安装在矩形管（1）和矩形管（6）的四个端面，用于封闭管口。\",\n      \"parts_used\": [\n        {\n          \"bom_seq\": \"3\",\n          \"bom_name\": \"方形板-机加 4\",\n          \"quantity\": 4,\n          \"drawing_number\": \"3\",\n          \"node_name\": [\n            \"NAUO6\",\n            \"NAUO5\",\n            \"NAUO4\",\n            \"NAUO3\"\n          ],\n          \"bom_code\": \"01.01.01.6589\"\n        }\n      ],\n      \"tools\": [\n        \"焊机\"\n      ],\n      \"warnings\": [\n        \"方形板应与矩形管端面齐平，确保焊接后外观平整。\"\n      ],\n      \"welding\": {\n        \"required\": true,\n        \"welding_type\": \"角焊（定位焊）\",\n        \"welding_method\": \"CO2气保焊\",\n        \"weld_size\": \"点焊长度10mm，焊脚高度3mm\",\n        \"welding_position\": \"方形板（3）与矩形管（1、6）的端面连接处，平焊为主\",\n        \"quality_requirements\": \"定位焊点均匀分布在四个角，确保方形板与管口端面齐平，无间隙\",\n        \"safety_notes\": \"焊接小零件时，注意控制电流，防止烧穿。使用夹具固定，避免零件移动。\"\n      },\n      \"safety_warnings\": [\n        \"焊接小零件时，必须使用夹具固定，防止零件因受热或电弧力移动。\",\n        \"佩戴防护眼镜，防止焊接飞溅物进入眼睛。\",\n        \"注意控制焊接电流，防止烧穿薄板造成烫伤。\"\n      ]\n    },\n    {\n      \"step_number\": 8,\n      \"action\": \"满焊主体结构\",\n      \"description\": \"按照图纸上的焊接符号和技术要求，对所有已点焊定位的零件（1、6、8、4、5、7、9、3）与基准件（2）的连接处进行满焊。\",\n      \"position_description\": \"所有焊缝应连续、饱满，符合技术要求1和2。\",\n      \"parts_used\": [],\n      \"tools\": [\n        \"焊机\",\n        \"焊渣锤\",\n        \"钢丝刷\"\n      ],\n      \"warnings\": [\n        \"焊接顺序应遵循对称、分散的原则，以减少焊接变形。\",\n        \"焊缝高度和宽度应符合图纸要求，焊后必须清渣。\"\n      ],\n      \"welding\": {\n        \"required\": true,\n        \"welding_type\": \"角焊/对接焊（满焊）\",\n        \"welding_method\": \"CO2气保焊\",\n        \"weld_size\": \"焊脚高度至少6mm（根据图纸符号），焊缝连续\",\n        \"welding_position\": \"所有零件连接处，涉及平焊、横焊、立焊\",\n        \"quality_requirements\": \"焊缝外观成型良好，焊波均匀，无咬边、未焊透、气孔、夹渣等缺陷。焊后进行外观检查和尺寸检验。\",\n        \"safety_notes\": \"进行大面积满焊时，注意焊机持续工作时间，防止过热。必须穿戴全套防护服和面罩，确保身体各部位不受电弧和高温伤害。焊接完成后，对高温部件进行警示。\"\n      },\n      \"safety_warnings\": [\n        \"进行满焊时必须穿戴全套阻燃防护服、焊接面罩和防护手套，防止大面积烧伤和烫伤。\",\n        \"焊机持续工作时间不宜过长，注意设备散热，防止焊机过热引发故障或火灾。\",\n        \"焊后清理焊渣时，必须佩戴防护眼镜，防止焊渣飞溅伤眼。\",\n        \"满焊后工件温度极高，应设置高温警示标识，严禁徒手触摸，防止严重烫伤。\"\n      ]\n    }\n  ]\n}\n```",
  "parsed_result": {
    "enhanced_steps": [
      {
        "step_number": 1,
        "action": "放置基准件",
        "description": "将图纸上标注为②的连接板（01.01.01.11509，重21.36kg）平稳放置在装配工装或工作台上，作为整个组件的装配基准。",
        "position_description": "连接板的平面朝上，确保放置平稳。",
        "parts_used": [
          {
            "bom_seq": "2",
            "bom_name": "连接板 1",
            "quantity": 1,
            "drawing_number": "2",
            "node_name": [
              "NAUO2"
            ],
            "bom_code": "01.01.01.11509"
          }
        ],
        "tools": [
          "行车/吊具",
          "水平仪"
        ],
        "warnings": [
          "连接板较重，吊装时注意安全，确保吊装平稳。",
          "检查连接板表面无油污和锈蚀。"
        ],
        "safety_warnings": [
          "连接板重21.36kg，必须使用行车或吊具吊装，严禁徒手搬运，防止扭伤或砸伤。",
          "吊装前检查吊索具是否完好，捆绑必须牢固，防止吊物坠落。",
          "吊装过程中，人员必须佩戴安全帽和安全鞋，并远离吊物下方。"
        ]
      },
      {
        "step_number": 2,
        "action": "焊接底部矩形管",
        "description": "将图纸上标注为①的矩形管（01.01.03.2718）放置在②号连接板的底部边缘，按照图纸尺寸和焊接要求进行点焊定位。",
        "position_description": "矩形管（1）位于连接板（2）的底部边缘，沿长度方向对齐。",
        "parts_used": [
          {
            "bom_seq": "1",
            "bom_name": "矩形管 1",
            "quantity": 1,
            "drawing_number": "1"
          }
        ],
        "tools": [
          "焊机",
          "角尺",
          "卷尺"
        ],
        "warnings": [
          "点焊时注意控制变形，确保矩形管与连接板的垂直度。",
          "焊接前检查焊缝位置的清洁度。"
        ],
        "welding": {
          "required": true,
          "welding_type": "角焊（定位焊）",
          "welding_method": "CO2气保焊",
          "weld_size": "点焊长度10-15mm，焊脚高度4mm",
          "welding_position": "矩形管（1）与连接板（2）的连接处，平焊为主",
          "quality_requirements": "点焊牢固，定位准确，焊点无明显气孔或裂纹",
          "safety_notes": "佩戴焊接面罩和防护手套，确保工作区域通风良好，防止火花飞溅。"
        },
        "safety_warnings": [
          "必须佩戴焊接面罩、防护手套和防护服，防止弧光灼伤和高温烫伤。",
          "检查焊机接地线连接可靠，防止触电事故。",
          "确保焊接区域通风良好，防止烟尘和有毒气体中毒。",
          "清理焊接区域周围的易燃物，防止火花飞溅引发火灾。"
        ]
      },
      {
        "step_number": 3,
        "action": "焊接侧面矩形管",
        "description": "将图纸上标注为⑥的矩形管（01.01.03.2719，共2件）和⑧的矩形管（01.01.03.2720，共1件）安装到②号连接板的上方两侧和中间位置，并进行点焊定位。",
        "position_description": "矩形管（6）安装在连接板（2）上方的两侧，矩形管（8）安装在连接板（2）上方的中间位置。",
        "parts_used": [
          {
            "bom_seq": "6",
            "bom_name": "矩形管 2",
            "quantity": 2,
            "drawing_number": "6"
          },
          {
            "bom_seq": "8",
            "bom_name": "矩形管 1",
            "quantity": 1,
            "drawing_number": "8",
            "node_name": [
              "NAUO13",
              "NAUO10",
              "NAUO9",
              "NAUO1"
            ],
            "bom_code": "01.01.03.2720"
          }
        ],
        "tools": [
          "焊机",
          "卡具",
          "卷尺"
        ],
        "warnings": [
          "确保三根矩形管的端面与连接板的安装面齐平。",
          "使用卡具固定，防止焊接过程中移位。"
        ],
        "welding": {
          "required": true,
          "welding_type": "角焊（定位焊）",
          "welding_method": "CO2气保焊",
          "weld_size": "点焊长度10-15mm，焊脚高度4mm",
          "welding_position": "矩形管（6、8）与连接板（2）的连接处，平焊为主",
          "quality_requirements": "定位焊点均匀分布，保证矩形管与连接板的垂直度和平行度",
          "safety_notes": "检查焊机接地线连接可靠，避免触电风险。操作时注意周围环境，防止烫伤。"
        },
        "safety_warnings": [
          "佩戴焊接面罩和防护手套，防止弧光和飞溅物伤害。",
          "使用卡具固定零件时，注意夹紧力度，防止零件弹出伤人。",
          "焊接时注意周围环境，防止高温焊渣飞溅到身体或易燃物上。"
        ]
      },
      {
        "step_number": 4,
        "action": "安装挂件虚拟组件",
        "description": "将图纸上标注为④的右挂件虚拟组件（01.05.0018）和⑤的左挂件虚拟组件（01.05.0019）分别安装到矩形管（6）和矩形管（8）的端部，并进行点焊定位。",
        "position_description": "右挂件（4）和左挂件（5）分别安装在组件的两端，挂钩部分朝外。",
        "parts_used": [
          {
            "bom_seq": "4",
            "bom_name": "右挂件虚拟组件 1",
            "quantity": 1,
            "drawing_number": "4"
          },
          {
            "bom_seq": "5",
            "bom_name": "左挂件虚拟组件 1",
            "quantity": 1,
            "drawing_number": "5"
          }
        ],
        "tools": [
          "焊机",
          "游标卡尺"
        ],
        "warnings": [
          "挂件的安装方向和角度必须符合图纸要求，确保挂钩开口方向正确。",
          "检查挂件与矩形管的相对位置尺寸。"
        ],
        "welding": {
          "required": true,
          "welding_type": "角焊（定位焊）",
          "welding_method": "CO2气保焊",
          "weld_size": "点焊长度10mm，焊脚高度4mm",
          "welding_position": "挂件（4、5）与矩形管（6、8）的连接处，平焊或横焊",
          "quality_requirements": "定位焊点位置准确，确保挂件安装角度无偏差",
          "safety_notes": "注意焊接烟尘，开启排风设备。焊接时避免眼睛直视电弧光。"
        },
        "safety_warnings": [
          "开启局部排风设备，减少焊接烟尘吸入，佩戴防尘口罩。",
          "焊接时必须使用合格的焊接面罩，防止电弧光对眼睛造成永久性伤害。",
          "小零件焊接时，注意控制电流，防止烧穿或飞溅物过多。"
        ]
      },
      {
        "step_number": 5,
        "action": "安装封板",
        "description": "将图纸上标注为⑦的封板（01.01.01.16608，共2件）安装到矩形管（6）和矩形管（8）之间的开口处，并进行点焊定位。",
        "position_description": "封板（7）位于矩形管（6）和矩形管（8）之间，用于封闭结构侧面。",
        "parts_used": [
          {
            "bom_seq": "7",
            "bom_name": "封板 2",
            "quantity": 2,
            "drawing_number": "7",
            "node_name": [
              "NAUO12",
              "NAUO11"
            ],
            "bom_code": "01.01.01.16608"
          }
        ],
        "tools": [
          "焊机"
        ],
        "warnings": [
          "封板边缘应与矩形管边缘齐平，确保焊接间隙均匀。"
        ],
        "welding": {
          "required": true,
          "welding_type": "角焊（定位焊）",
          "welding_method": "CO2气保焊",
          "weld_size": "点焊长度10mm，焊脚高度3mm",
          "welding_position": "封板（7）与矩形管（6、8）的连接处，平焊为主",
          "quality_requirements": "封板与矩形管贴合紧密，点焊位置均匀，防止后续满焊时变形",
          "safety_notes": "检查焊枪和电缆绝缘是否完好，防止漏电。保持工作台面整洁。"
        },
        "safety_warnings": [
          "操作前检查焊枪和电缆绝缘层是否破损，防止接触带电体。",
          "封板边缘可能锋利，搬运和定位时请佩戴防护手套，防止割伤。"
        ]
      },
      {
        "step_number": 6,
        "action": "安装加强筋",
        "description": "将图纸上标注为⑨的加强筋（01.01.01.17678，共2件）安装到矩形管（6）和矩形管（8）的内侧，并进行点焊定位。",
        "position_description": "加强筋（9）呈斜角支撑，位于矩形管（6）和矩形管（8）的内侧，用于增强结构刚度。",
        "parts_used": [
          {
            "bom_seq": "9",
            "bom_name": "加强筋 2",
            "quantity": 2,
            "drawing_number": "9",
            "node_name": [
              "NAUO15",
              "NAUO14"
            ],
            "bom_code": "01.01.01.17678"
          }
        ],
        "tools": [
          "焊机",
          "角度尺"
        ],
        "warnings": [
          "加强筋的安装角度和位置必须准确，确保其支撑作用。",
          "检查加强筋与矩形管的贴合度。"
        ],
        "welding": {
          "required": true,
          "welding_type": "角焊（定位焊）",
          "welding_method": "CO2气保焊",
          "weld_size": "点焊长度15mm，焊脚高度4mm",
          "welding_position": "加强筋（9）与矩形管（6、8）的连接处，立焊或横焊",
          "quality_requirements": "加强筋定位焊点应在受力方向上，保证角度准确，防止焊接变形",
          "safety_notes": "由于涉及立焊或横焊，需调整焊接参数，防止熔池下坠。注意焊渣飞溅。"
        },
        "safety_warnings": [
          "进行立焊或横焊时，注意调整焊接参数，防止熔池下坠造成烫伤。",
          "加强筋边缘可能锋利，操作时佩戴防护手套，防止割伤。",
          "注意焊渣飞溅方向，确保身体和周围人员的安全。"
        ]
      },
      {
        "step_number": 7,
        "action": "安装方形板",
        "description": "将图纸上标注为③的方形板-机加（01.01.01.6589，共4件）安装到矩形管（1）和矩形管（6）的端部，并进行点焊定位。",
        "position_description": "方形板（3）安装在矩形管（1）和矩形管（6）的四个端面，用于封闭管口。",
        "parts_used": [
          {
            "bom_seq": "3",
            "bom_name": "方形板-机加 4",
            "quantity": 4,
            "drawing_number": "3",
            "node_name": [
              "NAUO6",
              "NAUO5",
              "NAUO4",
              "NAUO3"
            ],
            "bom_code": "01.01.01.6589"
          }
        ],
        "tools": [
          "焊机"
        ],
        "warnings": [
          "方形板应与矩形管端面齐平，确保焊接后外观平整。"
        ],
        "welding": {
          "required": true,
          "welding_type": "角焊（定位焊）",
          "welding_method": "CO2气保焊",
          "weld_size": "点焊长度10mm，焊脚高度3mm",
          "welding_position": "方形板（3）与矩形管（1、6）的端面连接处，平焊为主",
          "quality_requirements": "定位焊点均匀分布在四个角，确保方形板与管口端面齐平，无间隙",
          "safety_notes": "焊接小零件时，注意控制电流，防止烧穿。使用夹具固定，避免零件移动。"
        },
        "safety_warnings": [
          "焊接小零件时，必须使用夹具固定，防止零件因受热或电弧力移动。",
          "佩戴防护眼镜，防止焊接飞溅物进入眼睛。",
          "注意控制焊接电流，防止烧穿薄板造成烫伤。"
        ]
      },
      {
        "step_number": 8,
        "action": "满焊主体结构",
        "description": "按照图纸上的焊接符号和技术要求，对所有已点焊定位的零件（1、6、8、4、5、7、9、3）与基准件（2）的连接处进行满焊。",
        "position_description": "所有焊缝应连续、饱满，符合技术要求1和2。",
        "parts_used": [],
        "tools": [
          "焊机",
          "焊渣锤",
          "钢丝刷"
        ],
        "warnings": [
          "焊接顺序应遵循对称、分散的原则，以减少焊接变形。",
          "焊缝高度和宽度应符合图纸要求，焊后必须清渣。"
        ],
        "welding": {
          "required": true,
          "welding_type": "角焊/对接焊（满焊）",
          "welding_method": "CO2气保焊",
          "weld_size": "焊脚高度至少6mm（根据图纸符号），焊缝连续",
          "welding_position": "所有零件连接处，涉及平焊、横焊、立焊",
          "quality_requirements": "焊缝外观成型良好，焊波均匀，无咬边、未焊透、气孔、夹渣等缺陷。焊后进行外观检查和尺寸检验。",
          "safety_notes": "进行大面积满焊时，注意焊机持续工作时间，防止过热。必须穿戴全套防护服和面罩，确保身体各部位不受电弧和高温伤害。焊接完成后，对高温部件进行警示。"
        },
        "safety_warnings": [
          "进行满焊时必须穿戴全套阻燃防护服、焊接面罩和防护手套，防止大面积烧伤和烫伤。",
          "焊机持续工作时间不宜过长，注意设备散热，防止焊机过热引发故障或火灾。",
          "焊后清理焊渣时，必须佩戴防护眼镜，防止焊渣飞溅伤眼。",
          "满焊后工件温度极高，应设置高温警示标识，严禁徒手触摸，防止严重烫伤。"
        ]
      }
    ]
  }
}