{
  "agent_name": "Agent6_FAQ",
  "model": "google/gemini-2.5-flash-preview-09-2025",
  "timestamp": "20251007_072046",
  "image_count": 0,
  "temperature": 0.2,
  "system_prompt": "# 角色定位\n\n你是**李师傅**，一位拥有20年安全管理经验的高级安全工程师。\n\n## 教育背景\n\n- **学历**：安全工程专业本科\n- **职业资格**：注册安全工程师、高级安全评价师\n- **专业培训**：\n  - 机械制造安全管理\n  - 职业健康与安全管理体系（ISO 45001）\n  - 事故调查与分析\n  - 应急预案编制与演练\n\n## 职业背景\n\n- **工作经历**：20年机械制造企业安全管理经验，参与过大型装备制造、钢结构加工等项目\n- **专业领域**：\n  - 机械加工安全（车、铣、刨、磨、钻等）\n  - 焊接作业安全（电焊、气焊、氩弧焊等）\n  - 起重吊装安全（行车、叉车、吊索具等）\n  - 高空作业安全（脚手架、安全带、防坠落等）\n  - 个人防护用品管理（安全帽、防护眼镜、手套、安全鞋等）\n\n## 知识结构（详细）\n\n### 1. 机械伤害风险\n- **夹伤/挤伤**：手指、手臂被运动部件夹住\n- **切割伤**：锋利边缘、毛刺、切削工具\n- **碰撞伤**：头部碰撞、身体碰撞\n- **坠落伤**：零件坠落、工具坠落、人员坠落\n\n### 2. 焊接作业风险\n- **电击伤**：焊机漏电、接地不良\n- **弧光伤**：电弧紫外线灼伤眼睛和皮肤\n- **烫伤**：高温熔池、焊渣飞溅\n- **火灾爆炸**：易燃物引燃、气瓶泄漏\n- **有毒气体**：焊接烟尘、一氧化碳中毒\n\n### 3. 起重吊装风险\n- **吊物坠落**：吊索具断裂、捆绑不牢\n- **吊物摆动**：碰撞人员、设备\n- **超载**：超过起重机额定载荷\n- **指挥失误**：信号不清、违章指挥\n\n### 4. 高空作业风险\n- **人员坠落**：未系安全带、脚手架不牢\n- **物体打击**：工具、零件从高处坠落\n- **脚手架坍塌**：搭设不规范、超载\n\n### 5. 个人防护用品\n- **头部防护**：安全帽（防止碰撞、坠物打击）\n- **眼部防护**：防护眼镜、焊接面罩（防止飞溅、弧光）\n- **手部防护**：防护手套（防止切割、烫伤、化学品）\n- **足部防护**：安全鞋（防砸、防刺穿、防滑）\n- **呼吸防护**：防尘口罩、防毒面具（防止粉尘、有毒气体）\n\n### 6. 应急处理\n- **机械伤害**：立即停机、呼救、止血、固定、送医\n- **电击伤**：切断电源、心肺复苏、送医\n- **烫伤**：冷水冲洗、覆盖无菌纱布、送医\n- **火灾**：使用灭火器、疏散人员、报警\n\n## 任务步骤（Chain of Thought）\n\n你的任务是**为每个装配步骤添加安全警告**（如果该步骤有安全风险）。请按照以下5个步骤思考：\n\n### 步骤1：识别风险步骤\n- 分析每个装配步骤的操作内容\n- 判断是否涉及高风险作业（焊接、吊装、高空、重物搬运等）\n- 识别潜在的伤害类型（机械伤害、电击、烫伤、坠落等）\n\n### 步骤2：分析风险源\n- 确定风险的来源（设备、工具、材料、环境、人员操作等）\n- 评估风险的严重程度（轻微、中等、严重、致命）\n- 考虑风险的发生概率\n\n### 步骤3：制定预防措施\n- 针对每个风险源，制定具体的预防措施\n- 强调个人防护用品的使用\n- 强调安全操作规程的遵守\n\n### 步骤4：添加安全警告\n- 为每个有风险的步骤添加safety_warnings字段\n- 每条警告要简洁明了，说明具体的风险和预防措施\n- 使用工人能看懂的语言\n\n### 步骤5：验证完整性\n- 检查所有高风险步骤是否都添加了安全警告\n- 检查安全警告是否具体、可操作\n- 检查是否遗漏了任何潜在风险\n\n## 核心原则\n\n1. **步骤级嵌入**：为每个有风险的步骤添加safety_warnings字段，而不是单独列出安全警告\n2. **工人友好**：使用通俗语言，避免专业术语\n3. **具体可操作**：说明具体的风险和预防措施，而不是泛泛而谈\n4. **不重复显示**：安全警告只在下方\"安全\"标签页中统一显示，不在当前步骤详情中重复显示\n\n## 输出格式\n\n严格按照以下JSON格式输出（返回增强后的装配步骤）：\n\n```json\n{\n  \"enhanced_steps\": [\n    {\n      \"step_number\": 1,\n      \"title\": \"点焊定位\",\n      \"parts_used\": [...],\n      \"tools_required\": [...],\n      \"operation\": \"操作说明\",\n      \"quality_check\": \"质量检查\",\n      \"estimated_time_minutes\": 10,\n      \"welding\": {\n        \"required\": true,\n        \"welding_type\": \"点焊\",\n        \"welding_method\": \"CO2气保焊\",\n        ...\n      },\n      \"safety_warnings\": [\n        \"佩戴焊接面罩和防护手套，防止弧光灼伤眼睛和皮肤\",\n        \"确保工件夹紧牢固，防止点焊时位移造成伤害\",\n        \"焊接区域周围3米内不得有易燃物，配备灭火器\",\n        \"焊机必须接地良好，防止漏电触电\"\n      ]\n    },\n    {\n      \"step_number\": 2,\n      \"title\": \"螺栓连接\",\n      \"parts_used\": [...],\n      \"operation\": \"操作说明\",\n      \"quality_check\": \"质量检查\",\n      \"estimated_time_minutes\": 15,\n      \"safety_warnings\": [\n        \"佩戴安全帽和防护眼镜，防止零件坠落和飞溅\",\n        \"使用扭力扳手时注意力度，防止扳手滑脱伤人\"\n      ]\n    },\n    {\n      \"step_number\": 3,\n      \"title\": \"简单装配\",\n      \"parts_used\": [...],\n      \"operation\": \"操作说明\",\n      \"quality_check\": \"质量检查\",\n      \"estimated_time_minutes\": 5\n      // ⚠️ 如果没有明显安全风险，不添加safety_warnings字段\n    }\n  ]\n}\n```\n\n**⚠️ 关键要求**：\n\n1. **步骤级嵌入**：\n   - 为每个有风险的步骤添加`safety_warnings`字段\n   - 没有明显风险的步骤不添加`safety_warnings`字段\n   - 保持原有步骤的所有字段不变\n\n2. **安全警告要具体**：\n   - ✅ 说\"佩戴焊接面罩和防护手套，防止弧光灼伤眼睛和皮肤\"\n   - ❌ 不说\"注意安全\"\n   - ✅ 说\"焊接区域周围3米内不得有易燃物，配备灭火器\"\n   - ❌ 不说\"注意防火\"\n\n3. **使用通俗语言**：\n   - 工人能看懂的语言\n   - 避免专业术语和英文缩写\n\n4. **警告要全面**：\n   - 涵盖个人防护、设备安全、环境安全、操作安全\n   - 每条警告说明具体的风险和预防措施\n\n## 重要提醒\n\n- **只输出JSON，不要输出其他内容**\n- **保持原有字段不变**：不要修改或删除原有的字段（包括welding字段）\n- **警告要简洁明了**：每条警告一句话，说明风险和预防措施\n- **不要过度警告**：只针对有明显风险的步骤添加警告\n",
  "user_query": "请为以下装配步骤添加安全警告（如果有安全风险）。\n\n## 📸 视觉分析任务\n\n**你会看到工程图纸图片，请仔细观察：**\n\n1. **危险作业标识**：\n   - 图纸上的安全警告标识\n   - 特殊作业要求（如高空作业、吊装作业等）\n   - 危险区域标注\n\n2. **零件特征**：\n   - 重型零件（需要吊装）\n   - 锋利边缘（容易割伤）\n   - 高温部件（容易烫伤）\n\n3. **作业环境**：\n   - 狭窄空间（容易碰撞）\n   - 高空位置（容易坠落）\n   - 密闭空间（通风不良）\n\n## 装配步骤\n\n[\n  {\n    \"step_number\": 1,\n    \"action\": \"放置基准件\",\n    \"description\": \"将图纸上标注为1的左铲板 1（BOM序号1）平稳放置在焊接平台上，作为装配基准。\",\n    \"position_description\": \"平放于焊接平台，确保稳定。\",\n    \"parts_used\": [\n      {\n        \"bom_seq\": \"1\",\n        \"bom_name\": \"左铲板 1\",\n        \"quantity\": 1,\n        \"drawing_number\": \"1\",\n        \"node_name\": [\n          \"NAUO1\"\n        ],\n        \"bom_code\": \"01.01.01.18598\"\n      }\n    ],\n    \"tools\": [\n      \"行车\",\n      \"吊具\",\n      \"焊接平台\"\n    ],\n    \"warnings\": [\n      \"左铲板较重（28.38kg），吊装时注意安全，确保吊具牢固。\"\n    ]\n  },\n  {\n    \"step_number\": 2,\n    \"action\": \"焊接方形板-机加\",\n    \"description\": \"将图纸上标注为2的方形板-机加 1（BOM序号2）焊接到左铲板 1的后侧，注意定位尺寸和角度。\",\n    \"position_description\": \"位于左铲板 1的后部，与铲板边缘对齐。\",\n    \"parts_used\": [\n      {\n        \"bom_seq\": \"2\",\n        \"bom_name\": \"方形板-机加 1\",\n        \"quantity\": 1,\n        \"drawing_number\": \"2\",\n        \"node_name\": [\n          \"NAUO2\"\n        ],\n        \"bom_code\": \"01.01.01.18599\"\n      }\n    ],\n    \"tools\": [\n      \"焊机\",\n      \"角尺\",\n      \"卡具\"\n    ],\n    \"warnings\": [\n      \"焊接前需点焊定位，确保方形板与铲板的垂直度符合图纸要求。\"\n    ],\n    \"welding\": {\n      \"required\": true,\n      \"welding_type\": \"角焊\",\n      \"welding_method\": \"CO2气保焊（MAG）\",\n      \"weld_size\": \"焊缝高度4mm（图纸未明确，按常规结构件要求）\",\n      \"welding_position\": \"零件②（方形板-机加）与零件①（左铲板）的连接处，主要为平焊和横焊\",\n      \"quality_requirements\": \"焊缝连续、饱满，外观平整，不允许有气孔、夹渣、裂纹等缺陷。焊后清理焊渣和飞溅。\",\n      \"safety_notes\": \"佩戴焊接面罩、手套和防护服。确保工作区域通风良好，防止烟尘危害。检查焊机接地线是否完好。\"\n    }\n  },\n  {\n    \"step_number\": 3,\n    \"action\": \"焊接加强板\",\n    \"description\": \"依次将图纸上标注为3的后加强板 1（BOM序号3）和标注为4的前加强板 1（BOM序号4）焊接到左铲板 1的内侧，并与方形板-机加 1（2号件）对齐。\",\n    \"position_description\": \"后加强板（3号件）位于铲板内侧后部，前加强板（4号件）位于铲板内侧前部。\",\n    \"parts_used\": [\n      {\n        \"bom_seq\": \"3\",\n        \"bom_name\": \"后加强板 1\",\n        \"quantity\": 1,\n        \"drawing_number\": \"3\",\n        \"node_name\": [\n          \"NAUO3\"\n        ],\n        \"bom_code\": \"01.01.01.11519\"\n      },\n      {\n        \"bom_seq\": \"4\",\n        \"bom_name\": \"前加强板 1\",\n        \"quantity\": 1,\n        \"drawing_number\": \"4\",\n        \"node_name\": [\n          \"NAUO4\"\n        ],\n        \"bom_code\": \"01.01.01.18600\"\n      }\n    ],\n    \"tools\": [\n      \"焊机\",\n      \"卷尺\"\n    ],\n    \"warnings\": [\n      \"确保加强板与铲板的贴合度，焊缝应连续且饱满。\"\n    ],\n    \"welding\": {\n      \"required\": true,\n      \"welding_type\": \"角焊\",\n      \"welding_method\": \"CO2气保焊（MAG）\",\n      \"weld_size\": \"焊缝高度6mm（根据图纸加强板厚度估算）\",\n      \"welding_position\": \"零件③、零件④与零件①（左铲板）的连接处，主要为平焊和立焊\",\n      \"quality_requirements\": \"焊缝应连续焊接，特别是加强板与铲板的接触面。注意控制焊接变形，可采用分段、跳焊工艺。\",\n      \"safety_notes\": \"焊接过程中注意高温，避免烫伤。使用合适的电流和电压，防止飞溅过多。\"\n    }\n  },\n  {\n    \"step_number\": 4,\n    \"action\": \"焊接底部连接板\",\n    \"description\": \"将图纸上标注为5的底部连接板 6（BOM序号5）共6件，均匀焊接到左铲板 1的底部，位于加强板之间。\",\n    \"position_description\": \"位于铲板底部，用于连接铲板与后连接架，注意图纸上标注的105mm定位尺寸。\",\n    \"parts_used\": [\n      {\n        \"bom_seq\": \"5\",\n        \"bom_name\": \"底部连接板 6\",\n        \"quantity\": 6,\n        \"drawing_number\": \"5\",\n        \"node_name\": [\n          \"NAUO15\",\n          \"NAUO14\",\n          \"NAUO13\",\n          \"NAUO12\",\n          \"NAUO6\",\n          \"NAUO5\"\n        ],\n        \"bom_code\": \"01.01.01.11521\"\n      }\n    ],\n    \"tools\": [\n      \"焊机\",\n      \"卷尺\",\n      \"定位卡具\"\n    ],\n    \"warnings\": [\n      \"底部连接板的定位尺寸（105mm）是关键尺寸，必须精确测量和定位。\"\n    ],\n    \"welding\": {\n      \"required\": true,\n      \"welding_type\": \"角焊\",\n      \"welding_method\": \"CO2气保焊（MAG）\",\n      \"weld_size\": \"焊缝高度5mm\",\n      \"welding_position\": \"零件⑤（底部连接板）与零件①（左铲板）的连接处，主要为仰焊\",\n      \"quality_requirements\": \"由于是仰焊，需要严格控制焊接参数，防止熔池下坠和焊瘤。焊缝应全周连续，确保承载强度。\",\n      \"safety_notes\": \"仰焊时，必须穿戴好全套防护装备，防止熔渣和飞溅物掉落伤人。确保焊枪角度正确，避免保护气体流失。\"\n    }\n  },\n  {\n    \"step_number\": 5,\n    \"action\": \"焊接油缸和弹簧固定板\",\n    \"description\": \"安装并焊接图纸上标注为6的前油缸固定板 2（BOM序号6，共2件）、标注为7的前弹簧固定板 1（BOM序号7，共1件）和标注为8的后弹簧固定板 2（BOM序号8，共2件）。\",\n    \"position_description\": \"前油缸固定板（6号件）位于铲板内侧中部，前弹簧固定板（7号件）位于前加强板（4号件）附近，后弹簧固定板（8号件）位于后加强板（3号件）附近。\",\n    \"parts_used\": [\n      {\n        \"bom_seq\": \"6\",\n        \"bom_name\": \"前油缸固定板 2\",\n        \"quantity\": 2,\n        \"drawing_number\": \"6\",\n        \"node_name\": [\n          \"NAUO8\",\n          \"NAUO7\"\n        ],\n        \"bom_code\": \"01.01.01.11522\"\n      },\n      {\n        \"bom_seq\": \"7\",\n        \"bom_name\": \"前弹簧固定板 1\",\n        \"quantity\": 1,\n        \"drawing_number\": \"7\",\n        \"node_name\": [\n          \"NAUO9\"\n        ],\n        \"bom_code\": \"01.01.01.11523\"\n      },\n      {\n        \"bom_seq\": \"8\",\n        \"bom_name\": \"后弹簧固定板 2\",\n        \"quantity\": 2,\n        \"drawing_number\": \"8\",\n        \"node_name\": [\n          \"NAUO11\",\n          \"NAUO10\"\n        ],\n        \"bom_code\": \"01.01.01.11524\"\n      }\n    ],\n    \"tools\": [\n      \"焊机\",\n      \"定位尺\"\n    ],\n    \"warnings\": [\n      \"油缸固定板和弹簧固定板的孔位必须对齐，确保后续装配的互换性。\"\n    ],\n    \"welding\": {\n      \"required\": true,\n      \"welding_type\": \"角焊\",\n      \"welding_method\": \"CO2气保焊（MAG）\",\n      \"weld_size\": \"焊缝高度5mm\",\n      \"welding_position\": \"零件⑥、⑦、⑧与零件①（左铲板）的连接处，主要为平焊和立焊\",\n      \"quality_requirements\": \"这些固定板是受力关键部位，焊缝必须连续且达到二级焊缝质量要求（外观检查合格，无明显缺陷）。焊接前必须使用定位工装确保孔位精度。\",\n      \"safety_notes\": \"焊接前清理固定板和铲板的接触面，去除油污和锈蚀，防止产生气孔。注意焊枪电缆的保护，避免被重物压损。\"\n    }\n  },\n  {\n    \"step_number\": 6,\n    \"action\": \"焊接支撑固定板\",\n    \"description\": \"将图纸上标注为9的支撑固定板 1（BOM序号9）焊接到左铲板 1的内侧，位于底部连接板（5号件）的上方。\",\n    \"position_description\": \"位于铲板内侧中部，靠近底部连接板。\",\n    \"parts_used\": [\n      {\n        \"bom_seq\": \"9\",\n        \"bom_name\": \"支撑固定板 1\",\n        \"quantity\": 1,\n        \"drawing_number\": \"9\",\n        \"node_name\": [\n          \"NAUO16\"\n        ],\n        \"bom_code\": \"01.01.01.11525\"\n      }\n    ],\n    \"tools\": [\n      \"焊机\"\n    ],\n    \"warnings\": [\n      \"确保支撑固定板的焊接位置不影响其他零件的安装。\"\n    ],\n    \"welding\": {\n      \"required\": true,\n      \"welding_type\": \"角焊\",\n      \"welding_method\": \"CO2气保焊（MAG）\",\n      \"weld_size\": \"焊缝高度4mm\",\n      \"welding_position\": \"零件⑨（支撑固定板）与零件①（左铲板）的连接处，平焊\",\n      \"quality_requirements\": \"焊缝连续，焊脚尺寸均匀。焊后检查定位尺寸，确保不干涉周围零件。\",\n      \"safety_notes\": \"焊接时注意保持身体稳定，避免长时间弯腰或扭曲姿势，防止职业损伤。\"\n    }\n  },\n  {\n    \"step_number\": 7,\n    \"action\": \"焊接轴套加强板和轴套\",\n    \"description\": \"将图纸上标注为10的轴套加强板 2（BOM序号10，共2件）和标注为12的轴套 2（BOM序号12，共2件）焊接到左铲板 1的顶部两侧。\",\n    \"position_description\": \"轴套加强板位于铲板顶部边缘，轴套焊接在加强板的孔位上。注意图纸上标注的'端面有配合，焊高不超过轴套'的要求。\",\n    \"parts_used\": [\n      {\n        \"bom_seq\": \"10\",\n        \"bom_name\": \"轴套加强板 2\",\n        \"quantity\": 2,\n        \"drawing_number\": \"10\",\n        \"node_name\": [\n          \"NAUO18\",\n          \"NAUO17\"\n        ],\n        \"bom_code\": \"01.01.01.11526\"\n      },\n      {\n        \"bom_seq\": \"12\",\n        \"bom_name\": \"轴套 2\",\n        \"quantity\": 2,\n        \"drawing_number\": \"12\",\n        \"node_name\": [\n          \"NAUO21\",\n          \"NAUO20\"\n        ],\n        \"bom_code\": \"01.01.02.1222\"\n      }\n    ],\n    \"tools\": [\n      \"焊机\",\n      \"塞尺\"\n    ],\n    \"warnings\": [\n      \"轴套的焊接高度必须严格控制，焊缝不能高于轴套端面，以保证后续销轴的顺利安装。\"\n    ],\n    \"welding\": {\n      \"required\": true,\n      \"welding_type\": \"角焊/环焊\",\n      \"welding_method\": \"CO2气保焊（MAG）或手工电弧焊（SMAW）\",\n      \"weld_size\": \"焊缝高度4mm，轴套与加强板连接处环焊\",\n      \"welding_position\": \"零件⑩（加强板）与零件①（左铲板）连接处，以及零件⑫（轴套）与零件⑩（加强板）连接处，主要为平焊\",\n      \"quality_requirements\": \"轴套焊接是关键尺寸控制点。焊缝必须光滑，严禁焊瘤或飞溅物高于轴套端面。焊后必须用塞尺或量具检查轴套端面是否平整，必要时进行打磨。\",\n      \"safety_notes\": \"轴套焊接时，由于零件较小，注意控制热输入，防止轴套变形。使用夹具固定，确保轴套垂直度。\"\n    }\n  },\n  {\n    \"step_number\": 8,\n    \"action\": \"焊接反光片安装板\",\n    \"description\": \"将图纸上标注为11的反光片安装板 1（BOM序号11）焊接到左铲板 1的顶部。\",\n    \"position_description\": \"位于铲板顶部中央位置。\",\n    \"parts_used\": [\n      {\n        \"bom_seq\": \"11\",\n        \"bom_name\": \"反光片安装板 1\",\n        \"quantity\": 1,\n        \"drawing_number\": \"11\",\n        \"node_name\": [\n          \"NAUO19\"\n        ],\n        \"bom_code\": \"01.01.01.11527\"\n      }\n    ],\n    \"tools\": [\n      \"焊机\"\n    ],\n    \"warnings\": [\n      \"反光片安装板的焊接位置应居中，确保反光片安装后方向正确。\"\n    ],\n    \"welding\": {\n      \"required\": true,\n      \"welding_type\": \"角焊\",\n      \"welding_method\": \"CO2气保焊（MAG）\",\n      \"weld_size\": \"焊缝高度3mm（轻载结构）\",\n      \"welding_position\": \"零件⑪（反光片安装板）与零件①（左铲板）的连接处，平焊\",\n      \"quality_requirements\": \"焊缝外观整洁，只需保证连接强度。焊后清理飞溅，避免影响反光片安装。\",\n      \"safety_notes\": \"该零件较薄，焊接电流不宜过大，防止烧穿。注意防火，周围无易燃材料。\"\n    }\n  },\n  {\n    \"step_number\": 9,\n    \"action\": \"焊接方形板\",\n    \"description\": \"将图纸上标注为13的方形板 1（BOM序号13）和标注为14的方形板 3（BOM序号14）焊接到左铲板 1的指定位置。\",\n    \"position_description\": \"方形板 1（13号件）和方形板 3（14号件）位于铲板内侧，靠近加强板。\",\n    \"parts_used\": [\n      {\n        \"bom_seq\": \"13\",\n        \"bom_name\": \"方形板 1\",\n        \"quantity\": 1,\n        \"drawing_number\": \"13\"\n      },\n      {\n        \"bom_seq\": \"14\",\n        \"bom_name\": \"方形板 3\",\n        \"quantity\": 1,\n        \"drawing_number\": \"14\",\n        \"node_name\": [\n          \"NAUO24\",\n          \"NAUO23\",\n          \"NAUO22\"\n        ],\n        \"bom_code\": \"01.01.01.11529\"\n      }\n    ],\n    \"tools\": [\n      \"焊机\"\n    ],\n    \"warnings\": [\n      \"确保方形板的焊接位置符合图纸尺寸要求。\"\n    ],\n    \"welding\": {\n      \"required\": true,\n      \"welding_type\": \"角焊\",\n      \"welding_method\": \"CO2气保焊（MAG）\",\n      \"weld_size\": \"焊缝高度5mm\",\n      \"welding_position\": \"零件⑬、⑭与零件①（左铲板）的连接处，平焊/立焊\",\n      \"quality_requirements\": \"焊缝连续，保证结构强度。焊接前需精确测量定位尺寸，防止位置偏差。\",\n      \"safety_notes\": \"焊接时注意保持焊枪稳定，避免虚焊和未熔合。工作结束后，及时关闭焊机电源和气瓶阀门。\"\n    }\n  },\n  {\n    \"step_number\": 10,\n    \"action\": \"焊接左铲雪板加强板\",\n    \"description\": \"将图纸上标注为15的左铲雪板加强板 2（BOM序号15，共2件）焊接到左铲板 1的内侧，位于铲板边缘。\",\n    \"position_description\": \"位于铲板内侧边缘，起到加强作用。\",\n    \"parts_used\": [\n      {\n        \"bom_seq\": \"15\",\n        \"bom_name\": \"左铲雪板加强板 2\",\n        \"quantity\": 2,\n        \"drawing_number\": \"15\",\n        \"node_name\": [\n          \"NAUO26\",\n          \"NAUO25\"\n        ],\n        \"bom_code\": \"01.02.01.4983\"\n      }\n    ],\n    \"tools\": [\n      \"焊机\"\n    ],\n    \"warnings\": [\n      \"加强板的焊接应力较大，注意焊接顺序，防止铲板变形。\"\n    ],\n    \"welding\": {\n      \"required\": true,\n      \"welding_type\": \"角焊\",\n      \"welding_method\": \"CO2气保焊（MAG）\",\n      \"weld_size\": \"焊缝高度6mm\",\n      \"welding_position\": \"零件⑮（加强板）与零件①（左铲板）的连接处，主要为平焊\",\n      \"quality_requirements\": \"由于加强板长度较长，应采用分段、对称焊接，以分散焊接应力，最大限度地控制铲板的翘曲变形。焊缝必须连续。\",\n      \"safety_notes\": \"焊接大长焊缝时，注意焊枪的移动速度和角度，确保熔深足够。焊接完成后，让工件自然冷却，避免强制冷却导致裂纹。\"\n    }\n  }\n]\n\n## 要求\n\n请按照以下5个步骤思考，为装配步骤添加安全警告：\n\n### 步骤1：识别风险步骤\n- 分析每个装配步骤的操作内容\n- 判断是否涉及高风险作业：\n  * **焊接作业**：电击、弧光、烫伤、火灾\n  * **吊装作业**：吊物坠落、碰撞、超载\n  * **高空作业**：人员坠落、物体打击\n  * **重物搬运**：砸伤、扭伤、夹伤\n  * **机械加工**：切割伤、夹伤、碰撞\n\n### 步骤2：分析风险源\n- 确定风险的来源（设备、工具、材料、环境、人员操作等）\n- 评估风险的严重程度（轻微、中等、严重、致命）\n- 考虑风险的发生概率\n\n### 步骤3：制定预防措施\n- 针对每个风险源，制定具体的预防措施\n- 强调个人防护用品的使用：\n  * **焊接**：焊接面罩、防护手套、防护服\n  * **吊装**：安全帽、安全鞋、手套\n  * **高空**：安全带、安全帽、防滑鞋\n  * **机械**：防护眼镜、手套、安全鞋\n\n### 步骤4：添加安全警告\n- 为每个有风险的步骤添加safety_warnings字段\n- 每条警告要简洁明了，说明具体的风险和预防措施\n- 使用工人能看懂的语言\n\n### 步骤5：验证完整性\n- 检查所有高风险步骤是否都添加了安全警告\n- 检查安全警告是否具体、可操作\n- 检查是否遗漏了任何潜在风险\n\n## ⚠️ 强制自检清单（生成后必须逐项检查）\n\n**在输出JSON之前，你必须完成以下验证：**\n\n1. **风险步骤识别验证**：\n   - [ ] 所有涉及焊接、吊装、高空、重物搬运的步骤都添加了safety_warnings字段\n   - [ ] 没有明显风险的步骤没有添加safety_warnings字段\n\n2. **安全警告完整性验证**：\n   - [ ] 每个safety_warnings字段都是字符串数组\n   - [ ] 每条警告都说明了具体的风险和预防措施\n   - [ ] 涵盖了个人防护、设备安全、环境安全、操作安全\n\n3. **语言通俗性验证**：\n   - [ ] 使用工人能看懂的语言\n   - [ ] 避免专业术语和英文缩写\n   - [ ] 每条警告简洁明了（一句话）\n\n4. **原有字段保持验证**：\n   - [ ] 原有步骤的所有字段都保持不变（包括welding字段）\n   - [ ] 没有修改或删除任何原有字段\n\n**如果自检发现任何问题，必须重新生成！**\n\n现在开始为装配步骤添加安全警告！\n",
  "raw_response": "```json\n{\n  \"enhanced_steps\": [\n    {\n      \"step_number\": 1,\n      \"action\": \"放置基准件\",\n      \"description\": \"将图纸上标注为1的左铲板 1（BOM序号1）平稳放置在焊接平台上，作为装配基准。\",\n      \"position_description\": \"平放于焊接平台，确保稳定。\",\n      \"parts_used\": [\n        {\n          \"bom_seq\": \"1\",\n          \"bom_name\": \"左铲板 1\",\n          \"quantity\": 1,\n          \"drawing_number\": \"1\",\n          \"node_name\": [\n            \"NAUO1\"\n          ],\n          \"bom_code\": \"01.01.01.18598\"\n        }\n      ],\n      \"tools\": [\n        \"行车\",\n        \"吊具\",\n        \"焊接平台\"\n      ],\n      \"warnings\": [\n        \"左铲板较重（28.38kg），吊装时注意安全，确保吊具牢固。\"\n      ],\n      \"safety_warnings\": [\n        \"佩戴安全帽和安全鞋，防止重物坠落砸伤脚部和头部\",\n        \"吊装前检查吊索具是否完好，捆绑必须牢固，防止吊物坠落\",\n        \"吊装过程中，吊物下方严禁站人，指挥信号要清晰准确\"\n      ]\n    },\n    {\n      \"step_number\": 2,\n      \"action\": \"焊接方形板-机加\",\n      \"description\": \"将图纸上标注为2的方形板-机加 1（BOM序号2）焊接到左铲板 1的后侧，注意定位尺寸和角度。\",\n      \"position_description\": \"位于左铲板 1的后部，与铲板边缘对齐。\",\n      \"parts_used\": [\n        {\n          \"bom_seq\": \"2\",\n          \"bom_name\": \"方形板-机加 1\",\n          \"quantity\": 1,\n          \"drawing_number\": \"2\",\n          \"node_name\": [\n            \"NAUO2\"\n          ],\n          \"bom_code\": \"01.01.01.18599\"\n        }\n      ],\n      \"tools\": [\n        \"焊机\",\n        \"角尺\",\n        \"卡具\"\n      ],\n      \"warnings\": [\n        \"焊接前需点焊定位，确保方形板与铲板的垂直度符合图纸要求。\"\n      ],\n      \"welding\": {\n        \"required\": true,\n        \"welding_type\": \"角焊\",\n        \"welding_method\": \"CO2气保焊（MAG）\",\n        \"weld_size\": \"焊缝高度4mm（图纸未明确，按常规结构件要求）\",\n        \"welding_position\": \"零件②（方形板-机加）与零件①（左铲板）的连接处，主要为平焊和横焊\",\n        \"quality_requirements\": \"焊缝连续、饱满，外观平整，不允许有气孔、夹渣、裂纹等缺陷。焊后清理焊渣和飞溅。\",\n        \"safety_notes\": \"佩戴焊接面罩、手套和防护服。确保工作区域通风良好，防止烟尘危害。检查焊机接地线是否完好。\"\n      },\n      \"safety_warnings\": [\n        \"必须佩戴焊接面罩、防护手套和防护服，防止弧光灼伤和高温烫伤\",\n        \"确保焊机接地良好，电缆无破损，防止触电事故\",\n        \"焊接区域必须通风良好，防止吸入有毒烟尘\",\n        \"清理焊渣时，佩戴防护眼镜，防止飞溅物伤眼\"\n      ]\n    },\n    {\n      \"step_number\": 3,\n      \"action\": \"焊接加强板\",\n      \"description\": \"依次将图纸上标注为3的后加强板 1（BOM序号3）和标注为4的前加强板 1（BOM序号4）焊接到左铲板 1的内侧，并与方形板-机加 1（2号件）对齐。\",\n      \"position_description\": \"后加强板（3号件）位于铲板内侧后部，前加强板（4号件）位于铲板内侧前部。\",\n      \"parts_used\": [\n        {\n          \"bom_seq\": \"3\",\n          \"bom_name\": \"后加强板 1\",\n          \"quantity\": 1,\n          \"drawing_number\": \"3\",\n          \"node_name\": [\n            \"NAUO3\"\n          ],\n          \"bom_code\": \"01.01.01.11519\"\n        },\n        {\n          \"bom_seq\": \"4\",\n          \"bom_name\": \"前加强板 1\",\n          \"quantity\": 1,\n          \"drawing_number\": \"4\",\n          \"node_name\": [\n            \"NAUO4\"\n          ],\n          \"bom_code\": \"01.01.01.18600\"\n        }\n      ],\n      \"tools\": [\n        \"焊机\",\n        \"卷尺\"\n      ],\n      \"warnings\": [\n        \"确保加强板与铲板的贴合度，焊缝应连续且饱满。\"\n      ],\n      \"welding\": {\n        \"required\": true,\n        \"welding_type\": \"角焊\",\n        \"welding_method\": \"CO2气保焊（MAG）\",\n        \"weld_size\": \"焊缝高度6mm（根据图纸加强板厚度估算）\",\n        \"welding_position\": \"零件③、零件④与零件①（左铲板）的连接处，主要为平焊和立焊\",\n        \"quality_requirements\": \"焊缝应连续焊接，特别是加强板与铲板的接触面。注意控制焊接变形，可采用分段、跳焊工艺。\",\n        \"safety_notes\": \"焊接过程中注意高温，避免烫伤。使用合适的电流和电压，防止飞溅过多。\"\n      },\n      \"safety_warnings\": [\n        \"焊接时必须穿戴好防护用品，防止高温焊渣和飞溅物烫伤\",\n        \"注意工件温度，搬运或触摸焊后零件时，必须戴隔热手套\",\n        \"焊接前检查周围环境，确保无易燃易爆物品，防止火灾\"\n      ]\n    },\n    {\n      \"step_number\": 4,\n      \"action\": \"焊接底部连接板\",\n      \"description\": \"将图纸上标注为5的底部连接板 6（BOM序号5）共6件，均匀焊接到左铲板 1的底部，位于加强板之间。\",\n      \"position_description\": \"位于铲板底部，用于连接铲板与后连接架，注意图纸上标注的105mm定位尺寸。\",\n      \"parts_used\": [\n        {\n          \"bom_seq\": \"5\",\n          \"bom_name\": \"底部连接板 6\",\n          \"quantity\": 6,\n          \"drawing_number\": \"5\",\n          \"node_name\": [\n            \"NAUO15\",\n            \"NAUO14\",\n            \"NAUO13\",\n            \"NAUO12\",\n            \"NAUO6\",\n            \"NAUO5\"\n          ],\n          \"bom_code\": \"01.01.01.11521\"\n        }\n      ],\n      \"tools\": [\n        \"焊机\",\n        \"卷尺\",\n        \"定位卡具\"\n      ],\n      \"warnings\": [\n        \"底部连接板的定位尺寸（105mm）是关键尺寸，必须精确测量和定位。\"\n      ],\n      \"welding\": {\n        \"required\": true,\n        \"welding_type\": \"角焊\",\n        \"welding_method\": \"CO2气保焊（MAG）\",\n        \"weld_size\": \"焊缝高度5mm\",\n        \"welding_position\": \"零件⑤（底部连接板）与零件①（左铲板）的连接处，主要为仰焊\",\n        \"quality_requirements\": \"由于是仰焊，需要严格控制焊接参数，防止熔池下坠和焊瘤。焊缝应全周连续，确保承载强度。\",\n        \"safety_notes\": \"仰焊时，必须穿戴好全套防护装备，防止熔渣和飞溅物掉落伤人。确保焊枪角度正确，避免保护气体流失。\"\n      },\n      \"safety_warnings\": [\n        \"进行仰焊作业时，必须穿戴全套防护装备（包括头罩、皮围裙），防止熔渣和飞溅物掉落烫伤\",\n        \"仰焊时应保持身体平衡，避免仰角过大造成身体扭伤或跌倒\",\n        \"确保焊接区域下方无人员，防止飞溅物伤及他人\"\n      ]\n    },\n    {\n      \"step_number\": 5,\n      \"action\": \"焊接油缸和弹簧固定板\",\n      \"description\": \"安装并焊接图纸上标注为6的前油缸固定板 2（BOM序号6，共2件）、标注为7的前弹簧固定板 1（BOM序号7，共1件）和标注为8的后弹簧固定板 2（BOM序号8，共2件）。\",\n      \"position_description\": \"前油缸固定板（6号件）位于铲板内侧中部，前弹簧固定板（7号件）位于前加强板（4号件）附近，后弹簧固定板（8号件）位于后加强板（3号件）附近。\",\n      \"parts_used\": [\n        {\n          \"bom_seq\": \"6\",\n          \"bom_name\": \"前油缸固定板 2\",\n          \"quantity\": 2,\n          \"drawing_number\": \"6\",\n          \"node_name\": [\n            \"NAUO8\",\n            \"NAUO7\"\n          ],\n          \"bom_code\": \"01.01.01.11522\"\n        },\n        {\n          \"bom_seq\": \"7\",\n          \"bom_name\": \"前弹簧固定板 1\",\n          \"quantity\": 1,\n          \"drawing_number\": \"7\",\n          \"node_name\": [\n            \"NAUO9\"\n          ],\n          \"bom_code\": \"01.01.01.11523\"\n        },\n        {\n          \"bom_seq\": \"8\",\n          \"bom_name\": \"后弹簧固定板 2\",\n          \"quantity\": 2,\n          \"drawing_number\": \"8\",\n          \"node_name\": [\n            \"NAUO11\",\n            \"NAUO10\"\n          ],\n          \"bom_code\": \"01.01.01.11524\"\n        }\n      ],\n      \"tools\": [\n        \"焊机\",\n        \"定位尺\"\n      ],\n      \"warnings\": [\n        \"油缸固定板和弹簧固定板的孔位必须对齐，确保后续装配的互换性。\"\n      ],\n      \"welding\": {\n        \"required\": true,\n        \"welding_type\": \"角焊\",\n        \"welding_method\": \"CO2气保焊（MAG）\",\n        \"weld_size\": \"焊缝高度5mm\",\n        \"welding_position\": \"零件⑥、⑦、⑧与零件①（左铲板）的连接处，主要为平焊和立焊\",\n        \"quality_requirements\": \"这些固定板是受力关键部位，焊缝必须连续且达到二级焊缝质量要求（外观检查合格，无明显缺陷）。焊接前必须使用定位工装确保孔位精度。\",\n        \"safety_notes\": \"焊接前清理固定板和铲板的接触面，去除油污和锈蚀，防止产生气孔。注意焊枪电缆的保护，避免被重物压损。\"\n      },\n      \"safety_warnings\": [\n        \"焊接前必须清理工件表面的油污和锈蚀，防止焊接时产生有毒烟雾或爆炸\",\n        \"注意焊枪电缆和气管的布置，避免被车辆碾压或被利物割伤，造成漏电或漏气\",\n        \"使用定位工装时，注意手部安全，防止夹伤\"\n      ]\n    },\n    {\n      \"step_number\": 6,\n      \"action\": \"焊接支撑固定板\",\n      \"description\": \"将图纸上标注为9的支撑固定板 1（BOM序号9）焊接到左铲板 1的内侧，位于底部连接板（5号件）的上方。\",\n      \"position_description\": \"位于铲板内侧中部，靠近底部连接板。\",\n      \"parts_used\": [\n        {\n          \"bom_seq\": \"9\",\n          \"bom_name\": \"支撑固定板 1\",\n          \"quantity\": 1,\n          \"drawing_number\": \"9\",\n          \"node_name\": [\n            \"NAUO16\"\n          ],\n          \"bom_code\": \"01.01.01.11525\"\n        }\n      ],\n      \"tools\": [\n        \"焊机\"\n      ],\n      \"warnings\": [\n        \"确保支撑固定板的焊接位置不影响其他零件的安装。\"\n      ],\n      \"welding\": {\n        \"required\": true,\n        \"welding_type\": \"角焊\",\n        \"welding_method\": \"CO2气保焊（MAG）\",\n        \"weld_size\": \"焊缝高度4mm\",\n        \"welding_position\": \"零件⑨（支撑固定板）与零件①（左铲板）的连接处，平焊\",\n        \"quality_requirements\": \"焊缝连续，焊脚尺寸均匀。焊后检查定位尺寸，确保不干涉周围零件。\",\n        \"safety_notes\": \"焊接时注意保持身体稳定，避免长时间弯腰或扭曲姿势，防止职业损伤。\"\n      },\n      \"safety_warnings\": [\n        \"长时间进行焊接作业时，应注意休息，避免长时间保持弯腰或扭曲姿势，防止腰部和颈部劳损\",\n        \"确保工作区域光线充足，避免因视线不良导致操作失误\"\n      ]\n    },\n    {\n      \"step_number\": 7,\n      \"action\": \"焊接轴套加强板和轴套\",\n      \"description\": \"将图纸上标注为10的轴套加强板 2（BOM序号10，共2件）和标注为12的轴套 2（BOM序号12，共2件）焊接到左铲板 1的顶部两侧。\",\n      \"position_description\": \"轴套加强板位于铲板顶部边缘，轴套焊接在加强板的孔位上。注意图纸上标注的'端面有配合，焊高不超过轴套'的要求。\",\n      \"parts_used\": [\n        {\n          \"bom_seq\": \"10\",\n          \"bom_name\": \"轴套加强板 2\",\n          \"quantity\": 2,\n          \"drawing_number\": \"10\",\n          \"node_name\": [\n            \"NAUO18\",\n            \"NAUO17\"\n          ],\n          \"bom_code\": \"01.01.01.11526\"\n        },\n        {\n          \"bom_seq\": \"12\",\n          \"bom_name\": \"轴套 2\",\n          \"quantity\": 2,\n          \"drawing_number\": \"12\",\n          \"node_name\": [\n            \"NAUO21\",\n            \"NAUO20\"\n          ],\n          \"bom_code\": \"01.01.02.1222\"\n        }\n      ],\n      \"tools\": [\n        \"焊机\",\n        \"塞尺\"\n      ],\n      \"warnings\": [\n        \"轴套的焊接高度必须严格控制，焊缝不能高于轴套端面，以保证后续销轴的顺利安装。\"\n      ],\n      \"welding\": {\n        \"required\": true,\n        \"welding_type\": \"角焊/环焊\",\n        \"welding_method\": \"CO2气保焊（MAG）或手工电弧焊（SMAW）\",\n        \"weld_size\": \"焊缝高度4mm，轴套与加强板连接处环焊\",\n        \"welding_position\": \"零件⑩（加强板）与零件①（左铲板）连接处，以及零件⑫（轴套）与零件⑩（加强板）连接处，主要为平焊\",\n        \"quality_requirements\": \"轴套焊接是关键尺寸控制点。焊缝必须光滑，严禁焊瘤或飞溅物高于轴套端面。焊后必须用塞尺或量具检查轴套端面是否平整，必要时进行打磨。\",\n        \"safety_notes\": \"轴套焊接时，由于零件较小，注意控制热输入，防止轴套变形。使用夹具固定，确保轴套垂直度。\"\n      },\n      \"safety_warnings\": [\n        \"焊接轴套时，必须使用夹具固定，防止轴套在焊接过程中移动或掉落\",\n        \"轴套焊接后可能需要打磨，打磨时必须佩戴防护眼镜和防尘口罩，防止金属粉尘和飞溅物伤眼\",\n        \"控制焊接热输入，防止轴套过热变形，影响后续装配精度\"\n      ]\n    },\n    {\n      \"step_number\": 8,\n      \"action\": \"焊接反光片安装板\",\n      \"description\": \"将图纸上标注为11的反光片安装板 1（BOM序号11）焊接到左铲板 1的顶部。\",\n      \"position_description\": \"位于铲板顶部中央位置。\",\n      \"parts_used\": [\n        {\n          \"bom_seq\": \"11\",\n          \"bom_name\": \"反光片安装板 1\",\n          \"quantity\": 1,\n          \"drawing_number\": \"11\",\n          \"node_name\": [\n            \"NAUO19\"\n          ],\n          \"bom_code\": \"01.01.01.11527\"\n        }\n      ],\n      \"tools\": [\n        \"焊机\"\n      ],\n      \"warnings\": [\n        \"反光片安装板的焊接位置应居中，确保反光片安装后方向正确。\"\n      ],\n      \"welding\": {\n        \"required\": true,\n        \"welding_type\": \"角焊\",\n        \"welding_method\": \"CO2气保焊（MAG）\",\n        \"weld_size\": \"焊缝高度3mm（轻载结构）\",\n        \"welding_position\": \"零件⑪（反光片安装板）与零件①（左铲板）的连接处，平焊\",\n        \"quality_requirements\": \"焊缝外观整洁，只需保证连接强度。焊后清理飞溅，避免影响反光片安装。\",\n        \"safety_notes\": \"该零件较薄，焊接电流不宜过大，防止烧穿。注意防火，周围无易燃材料。\"\n      },\n      \"safety_warnings\": [\n        \"该零件较薄，焊接时应控制电流，防止烧穿工件或造成大面积变形\",\n        \"焊接完成后，及时清理焊渣和飞溅物，保持工作台面整洁\"\n      ]\n    },\n    {\n      \"step_number\": 9,\n      \"action\": \"焊接方形板\",\n      \"description\": \"将图纸上标注为13的方形板 1（BOM序号13）和标注为14的方形板 3（BOM序号14）焊接到左铲板 1的指定位置。\",\n      \"position_description\": \"方形板 1（13号件）和方形板 3（14号件）位于铲板内侧，靠近加强板。\",\n      \"parts_used\": [\n        {\n          \"bom_seq\": \"13\",\n          \"bom_name\": \"方形板 1\",\n          \"quantity\": 1,\n          \"drawing_number\": \"13\"\n        },\n        {\n          \"bom_seq\": \"14\",\n          \"bom_name\": \"方形板 3\",\n          \"quantity\": 1,\n          \"drawing_number\": \"14\",\n          \"node_name\": [\n            \"NAUO24\",\n            \"NAUO23\",\n            \"NAUO22\"\n          ],\n          \"bom_code\": \"01.01.01.11529\"\n        }\n      ],\n      \"tools\": [\n        \"焊机\"\n      ],\n      \"warnings\": [\n        \"确保方形板的焊接位置符合图纸尺寸要求。\"\n      ],\n      \"welding\": {\n        \"required\": true,\n        \"welding_type\": \"角焊\",\n        \"welding_method\": \"CO2气保焊（MAG）\",\n        \"weld_size\": \"焊缝高度5mm\",\n        \"welding_position\": \"零件⑬、⑭与零件①（左铲板）的连接处，平焊/立焊\",\n        \"quality_requirements\": \"焊缝连续，保证结构强度。焊接前需精确测量定位尺寸，防止位置偏差。\",\n        \"safety_notes\": \"焊接时注意保持焊枪稳定，避免虚焊和未熔合。工作结束后，及时关闭焊机电源和气瓶阀门。\"\n      },\n      \"safety_warnings\": [\n        \"工作结束后，必须立即关闭焊机电源和气瓶阀门，防止漏电或漏气引发火灾爆炸\",\n        \"确保所有焊接设备和工具归位整齐，避免绊倒或碰撞事故\"\n      ]\n    },\n    {\n      \"step_number\": 10,\n      \"action\": \"焊接左铲雪板加强板\",\n      \"description\": \"将图纸上标注为15的左铲雪板加强板 2（BOM序号15，共2件）焊接到左铲板 1的内侧，位于铲板边缘。\",\n      \"position_description\": \"位于铲板内侧边缘，起到加强作用。\",\n      \"parts_used\": [\n        {\n          \"bom_seq\": \"15\",\n          \"bom_name\": \"左铲雪板加强板 2\",\n          \"quantity\": 2,\n          \"drawing_number\": \"15\",\n          \"node_name\": [\n            \"NAUO26\",\n            \"NAUO25\"\n          ],\n          \"bom_code\": \"01.02.01.4983\"\n        }\n      ],\n      \"tools\": [\n        \"焊机\"\n      ],\n      \"warnings\": [\n        \"加强板的焊接应力较大，注意焊接顺序，防止铲板变形。\"\n      ],\n      \"welding\": {\n        \"required\": true,\n        \"welding_type\": \"角焊\",\n        \"welding_method\": \"CO2气保焊（MAG）\",\n        \"weld_size\": \"焊缝高度6mm\",\n        \"welding_position\": \"零件⑮（加强板）与零件①（左铲板）的连接处，主要为平焊\",\n        \"quality_requirements\": \"由于加强板长度较长，应采用分段、对称焊接，以分散焊接应力，最大限度地控制铲板的翘曲变形。焊缝必须连续。\",\n        \"safety_notes\": \"焊接大长焊缝时，注意焊枪的移动速度和角度，确保熔深足够。焊接完成后，让工件自然冷却，避免强制冷却导致裂纹。\"\n      },\n      \"safety_warnings\": [\n        \"焊接长焊缝时，应采用分段、对称焊接工艺，防止工件因热应力集中而严重变形或开裂\",\n        \"焊接完成后，工件温度很高，严禁徒手触摸，应设置警示标识，防止他人误触烫伤\"\n      ]\n    }\n  ]\n}\n```",
  "parsed_result": {
    "enhanced_steps": [
      {
        "step_number": 1,
        "action": "放置基准件",
        "description": "将图纸上标注为1的左铲板 1（BOM序号1）平稳放置在焊接平台上，作为装配基准。",
        "position_description": "平放于焊接平台，确保稳定。",
        "parts_used": [
          {
            "bom_seq": "1",
            "bom_name": "左铲板 1",
            "quantity": 1,
            "drawing_number": "1",
            "node_name": [
              "NAUO1"
            ],
            "bom_code": "01.01.01.18598"
          }
        ],
        "tools": [
          "行车",
          "吊具",
          "焊接平台"
        ],
        "warnings": [
          "左铲板较重（28.38kg），吊装时注意安全，确保吊具牢固。"
        ],
        "safety_warnings": [
          "佩戴安全帽和安全鞋，防止重物坠落砸伤脚部和头部",
          "吊装前检查吊索具是否完好，捆绑必须牢固，防止吊物坠落",
          "吊装过程中，吊物下方严禁站人，指挥信号要清晰准确"
        ]
      },
      {
        "step_number": 2,
        "action": "焊接方形板-机加",
        "description": "将图纸上标注为2的方形板-机加 1（BOM序号2）焊接到左铲板 1的后侧，注意定位尺寸和角度。",
        "position_description": "位于左铲板 1的后部，与铲板边缘对齐。",
        "parts_used": [
          {
            "bom_seq": "2",
            "bom_name": "方形板-机加 1",
            "quantity": 1,
            "drawing_number": "2",
            "node_name": [
              "NAUO2"
            ],
            "bom_code": "01.01.01.18599"
          }
        ],
        "tools": [
          "焊机",
          "角尺",
          "卡具"
        ],
        "warnings": [
          "焊接前需点焊定位，确保方形板与铲板的垂直度符合图纸要求。"
        ],
        "welding": {
          "required": true,
          "welding_type": "角焊",
          "welding_method": "CO2气保焊（MAG）",
          "weld_size": "焊缝高度4mm（图纸未明确，按常规结构件要求）",
          "welding_position": "零件②（方形板-机加）与零件①（左铲板）的连接处，主要为平焊和横焊",
          "quality_requirements": "焊缝连续、饱满，外观平整，不允许有气孔、夹渣、裂纹等缺陷。焊后清理焊渣和飞溅。",
          "safety_notes": "佩戴焊接面罩、手套和防护服。确保工作区域通风良好，防止烟尘危害。检查焊机接地线是否完好。"
        },
        "safety_warnings": [
          "必须佩戴焊接面罩、防护手套和防护服，防止弧光灼伤和高温烫伤",
          "确保焊机接地良好，电缆无破损，防止触电事故",
          "焊接区域必须通风良好，防止吸入有毒烟尘",
          "清理焊渣时，佩戴防护眼镜，防止飞溅物伤眼"
        ]
      },
      {
        "step_number": 3,
        "action": "焊接加强板",
        "description": "依次将图纸上标注为3的后加强板 1（BOM序号3）和标注为4的前加强板 1（BOM序号4）焊接到左铲板 1的内侧，并与方形板-机加 1（2号件）对齐。",
        "position_description": "后加强板（3号件）位于铲板内侧后部，前加强板（4号件）位于铲板内侧前部。",
        "parts_used": [
          {
            "bom_seq": "3",
            "bom_name": "后加强板 1",
            "quantity": 1,
            "drawing_number": "3",
            "node_name": [
              "NAUO3"
            ],
            "bom_code": "01.01.01.11519"
          },
          {
            "bom_seq": "4",
            "bom_name": "前加强板 1",
            "quantity": 1,
            "drawing_number": "4",
            "node_name": [
              "NAUO4"
            ],
            "bom_code": "01.01.01.18600"
          }
        ],
        "tools": [
          "焊机",
          "卷尺"
        ],
        "warnings": [
          "确保加强板与铲板的贴合度，焊缝应连续且饱满。"
        ],
        "welding": {
          "required": true,
          "welding_type": "角焊",
          "welding_method": "CO2气保焊（MAG）",
          "weld_size": "焊缝高度6mm（根据图纸加强板厚度估算）",
          "welding_position": "零件③、零件④与零件①（左铲板）的连接处，主要为平焊和立焊",
          "quality_requirements": "焊缝应连续焊接，特别是加强板与铲板的接触面。注意控制焊接变形，可采用分段、跳焊工艺。",
          "safety_notes": "焊接过程中注意高温，避免烫伤。使用合适的电流和电压，防止飞溅过多。"
        },
        "safety_warnings": [
          "焊接时必须穿戴好防护用品，防止高温焊渣和飞溅物烫伤",
          "注意工件温度，搬运或触摸焊后零件时，必须戴隔热手套",
          "焊接前检查周围环境，确保无易燃易爆物品，防止火灾"
        ]
      },
      {
        "step_number": 4,
        "action": "焊接底部连接板",
        "description": "将图纸上标注为5的底部连接板 6（BOM序号5）共6件，均匀焊接到左铲板 1的底部，位于加强板之间。",
        "position_description": "位于铲板底部，用于连接铲板与后连接架，注意图纸上标注的105mm定位尺寸。",
        "parts_used": [
          {
            "bom_seq": "5",
            "bom_name": "底部连接板 6",
            "quantity": 6,
            "drawing_number": "5",
            "node_name": [
              "NAUO15",
              "NAUO14",
              "NAUO13",
              "NAUO12",
              "NAUO6",
              "NAUO5"
            ],
            "bom_code": "01.01.01.11521"
          }
        ],
        "tools": [
          "焊机",
          "卷尺",
          "定位卡具"
        ],
        "warnings": [
          "底部连接板的定位尺寸（105mm）是关键尺寸，必须精确测量和定位。"
        ],
        "welding": {
          "required": true,
          "welding_type": "角焊",
          "welding_method": "CO2气保焊（MAG）",
          "weld_size": "焊缝高度5mm",
          "welding_position": "零件⑤（底部连接板）与零件①（左铲板）的连接处，主要为仰焊",
          "quality_requirements": "由于是仰焊，需要严格控制焊接参数，防止熔池下坠和焊瘤。焊缝应全周连续，确保承载强度。",
          "safety_notes": "仰焊时，必须穿戴好全套防护装备，防止熔渣和飞溅物掉落伤人。确保焊枪角度正确，避免保护气体流失。"
        },
        "safety_warnings": [
          "进行仰焊作业时，必须穿戴全套防护装备（包括头罩、皮围裙），防止熔渣和飞溅物掉落烫伤",
          "仰焊时应保持身体平衡，避免仰角过大造成身体扭伤或跌倒",
          "确保焊接区域下方无人员，防止飞溅物伤及他人"
        ]
      },
      {
        "step_number": 5,
        "action": "焊接油缸和弹簧固定板",
        "description": "安装并焊接图纸上标注为6的前油缸固定板 2（BOM序号6，共2件）、标注为7的前弹簧固定板 1（BOM序号7，共1件）和标注为8的后弹簧固定板 2（BOM序号8，共2件）。",
        "position_description": "前油缸固定板（6号件）位于铲板内侧中部，前弹簧固定板（7号件）位于前加强板（4号件）附近，后弹簧固定板（8号件）位于后加强板（3号件）附近。",
        "parts_used": [
          {
            "bom_seq": "6",
            "bom_name": "前油缸固定板 2",
            "quantity": 2,
            "drawing_number": "6",
            "node_name": [
              "NAUO8",
              "NAUO7"
            ],
            "bom_code": "01.01.01.11522"
          },
          {
            "bom_seq": "7",
            "bom_name": "前弹簧固定板 1",
            "quantity": 1,
            "drawing_number": "7",
            "node_name": [
              "NAUO9"
            ],
            "bom_code": "01.01.01.11523"
          },
          {
            "bom_seq": "8",
            "bom_name": "后弹簧固定板 2",
            "quantity": 2,
            "drawing_number": "8",
            "node_name": [
              "NAUO11",
              "NAUO10"
            ],
            "bom_code": "01.01.01.11524"
          }
        ],
        "tools": [
          "焊机",
          "定位尺"
        ],
        "warnings": [
          "油缸固定板和弹簧固定板的孔位必须对齐，确保后续装配的互换性。"
        ],
        "welding": {
          "required": true,
          "welding_type": "角焊",
          "welding_method": "CO2气保焊（MAG）",
          "weld_size": "焊缝高度5mm",
          "welding_position": "零件⑥、⑦、⑧与零件①（左铲板）的连接处，主要为平焊和立焊",
          "quality_requirements": "这些固定板是受力关键部位，焊缝必须连续且达到二级焊缝质量要求（外观检查合格，无明显缺陷）。焊接前必须使用定位工装确保孔位精度。",
          "safety_notes": "焊接前清理固定板和铲板的接触面，去除油污和锈蚀，防止产生气孔。注意焊枪电缆的保护，避免被重物压损。"
        },
        "safety_warnings": [
          "焊接前必须清理工件表面的油污和锈蚀，防止焊接时产生有毒烟雾或爆炸",
          "注意焊枪电缆和气管的布置，避免被车辆碾压或被利物割伤，造成漏电或漏气",
          "使用定位工装时，注意手部安全，防止夹伤"
        ]
      },
      {
        "step_number": 6,
        "action": "焊接支撑固定板",
        "description": "将图纸上标注为9的支撑固定板 1（BOM序号9）焊接到左铲板 1的内侧，位于底部连接板（5号件）的上方。",
        "position_description": "位于铲板内侧中部，靠近底部连接板。",
        "parts_used": [
          {
            "bom_seq": "9",
            "bom_name": "支撑固定板 1",
            "quantity": 1,
            "drawing_number": "9",
            "node_name": [
              "NAUO16"
            ],
            "bom_code": "01.01.01.11525"
          }
        ],
        "tools": [
          "焊机"
        ],
        "warnings": [
          "确保支撑固定板的焊接位置不影响其他零件的安装。"
        ],
        "welding": {
          "required": true,
          "welding_type": "角焊",
          "welding_method": "CO2气保焊（MAG）",
          "weld_size": "焊缝高度4mm",
          "welding_position": "零件⑨（支撑固定板）与零件①（左铲板）的连接处，平焊",
          "quality_requirements": "焊缝连续，焊脚尺寸均匀。焊后检查定位尺寸，确保不干涉周围零件。",
          "safety_notes": "焊接时注意保持身体稳定，避免长时间弯腰或扭曲姿势，防止职业损伤。"
        },
        "safety_warnings": [
          "长时间进行焊接作业时，应注意休息，避免长时间保持弯腰或扭曲姿势，防止腰部和颈部劳损",
          "确保工作区域光线充足，避免因视线不良导致操作失误"
        ]
      },
      {
        "step_number": 7,
        "action": "焊接轴套加强板和轴套",
        "description": "将图纸上标注为10的轴套加强板 2（BOM序号10，共2件）和标注为12的轴套 2（BOM序号12，共2件）焊接到左铲板 1的顶部两侧。",
        "position_description": "轴套加强板位于铲板顶部边缘，轴套焊接在加强板的孔位上。注意图纸上标注的'端面有配合，焊高不超过轴套'的要求。",
        "parts_used": [
          {
            "bom_seq": "10",
            "bom_name": "轴套加强板 2",
            "quantity": 2,
            "drawing_number": "10",
            "node_name": [
              "NAUO18",
              "NAUO17"
            ],
            "bom_code": "01.01.01.11526"
          },
          {
            "bom_seq": "12",
            "bom_name": "轴套 2",
            "quantity": 2,
            "drawing_number": "12",
            "node_name": [
              "NAUO21",
              "NAUO20"
            ],
            "bom_code": "01.01.02.1222"
          }
        ],
        "tools": [
          "焊机",
          "塞尺"
        ],
        "warnings": [
          "轴套的焊接高度必须严格控制，焊缝不能高于轴套端面，以保证后续销轴的顺利安装。"
        ],
        "welding": {
          "required": true,
          "welding_type": "角焊/环焊",
          "welding_method": "CO2气保焊（MAG）或手工电弧焊（SMAW）",
          "weld_size": "焊缝高度4mm，轴套与加强板连接处环焊",
          "welding_position": "零件⑩（加强板）与零件①（左铲板）连接处，以及零件⑫（轴套）与零件⑩（加强板）连接处，主要为平焊",
          "quality_requirements": "轴套焊接是关键尺寸控制点。焊缝必须光滑，严禁焊瘤或飞溅物高于轴套端面。焊后必须用塞尺或量具检查轴套端面是否平整，必要时进行打磨。",
          "safety_notes": "轴套焊接时，由于零件较小，注意控制热输入，防止轴套变形。使用夹具固定，确保轴套垂直度。"
        },
        "safety_warnings": [
          "焊接轴套时，必须使用夹具固定，防止轴套在焊接过程中移动或掉落",
          "轴套焊接后可能需要打磨，打磨时必须佩戴防护眼镜和防尘口罩，防止金属粉尘和飞溅物伤眼",
          "控制焊接热输入，防止轴套过热变形，影响后续装配精度"
        ]
      },
      {
        "step_number": 8,
        "action": "焊接反光片安装板",
        "description": "将图纸上标注为11的反光片安装板 1（BOM序号11）焊接到左铲板 1的顶部。",
        "position_description": "位于铲板顶部中央位置。",
        "parts_used": [
          {
            "bom_seq": "11",
            "bom_name": "反光片安装板 1",
            "quantity": 1,
            "drawing_number": "11",
            "node_name": [
              "NAUO19"
            ],
            "bom_code": "01.01.01.11527"
          }
        ],
        "tools": [
          "焊机"
        ],
        "warnings": [
          "反光片安装板的焊接位置应居中，确保反光片安装后方向正确。"
        ],
        "welding": {
          "required": true,
          "welding_type": "角焊",
          "welding_method": "CO2气保焊（MAG）",
          "weld_size": "焊缝高度3mm（轻载结构）",
          "welding_position": "零件⑪（反光片安装板）与零件①（左铲板）的连接处，平焊",
          "quality_requirements": "焊缝外观整洁，只需保证连接强度。焊后清理飞溅，避免影响反光片安装。",
          "safety_notes": "该零件较薄，焊接电流不宜过大，防止烧穿。注意防火，周围无易燃材料。"
        },
        "safety_warnings": [
          "该零件较薄，焊接时应控制电流，防止烧穿工件或造成大面积变形",
          "焊接完成后，及时清理焊渣和飞溅物，保持工作台面整洁"
        ]
      },
      {
        "step_number": 9,
        "action": "焊接方形板",
        "description": "将图纸上标注为13的方形板 1（BOM序号13）和标注为14的方形板 3（BOM序号14）焊接到左铲板 1的指定位置。",
        "position_description": "方形板 1（13号件）和方形板 3（14号件）位于铲板内侧，靠近加强板。",
        "parts_used": [
          {
            "bom_seq": "13",
            "bom_name": "方形板 1",
            "quantity": 1,
            "drawing_number": "13"
          },
          {
            "bom_seq": "14",
            "bom_name": "方形板 3",
            "quantity": 1,
            "drawing_number": "14",
            "node_name": [
              "NAUO24",
              "NAUO23",
              "NAUO22"
            ],
            "bom_code": "01.01.01.11529"
          }
        ],
        "tools": [
          "焊机"
        ],
        "warnings": [
          "确保方形板的焊接位置符合图纸尺寸要求。"
        ],
        "welding": {
          "required": true,
          "welding_type": "角焊",
          "welding_method": "CO2气保焊（MAG）",
          "weld_size": "焊缝高度5mm",
          "welding_position": "零件⑬、⑭与零件①（左铲板）的连接处，平焊/立焊",
          "quality_requirements": "焊缝连续，保证结构强度。焊接前需精确测量定位尺寸，防止位置偏差。",
          "safety_notes": "焊接时注意保持焊枪稳定，避免虚焊和未熔合。工作结束后，及时关闭焊机电源和气瓶阀门。"
        },
        "safety_warnings": [
          "工作结束后，必须立即关闭焊机电源和气瓶阀门，防止漏电或漏气引发火灾爆炸",
          "确保所有焊接设备和工具归位整齐，避免绊倒或碰撞事故"
        ]
      },
      {
        "step_number": 10,
        "action": "焊接左铲雪板加强板",
        "description": "将图纸上标注为15的左铲雪板加强板 2（BOM序号15，共2件）焊接到左铲板 1的内侧，位于铲板边缘。",
        "position_description": "位于铲板内侧边缘，起到加强作用。",
        "parts_used": [
          {
            "bom_seq": "15",
            "bom_name": "左铲雪板加强板 2",
            "quantity": 2,
            "drawing_number": "15",
            "node_name": [
              "NAUO26",
              "NAUO25"
            ],
            "bom_code": "01.02.01.4983"
          }
        ],
        "tools": [
          "焊机"
        ],
        "warnings": [
          "加强板的焊接应力较大，注意焊接顺序，防止铲板变形。"
        ],
        "welding": {
          "required": true,
          "welding_type": "角焊",
          "welding_method": "CO2气保焊（MAG）",
          "weld_size": "焊缝高度6mm",
          "welding_position": "零件⑮（加强板）与零件①（左铲板）的连接处，主要为平焊",
          "quality_requirements": "由于加强板长度较长，应采用分段、对称焊接，以分散焊接应力，最大限度地控制铲板的翘曲变形。焊缝必须连续。",
          "safety_notes": "焊接大长焊缝时，注意焊枪的移动速度和角度，确保熔深足够。焊接完成后，让工件自然冷却，避免强制冷却导致裂纹。"
        },
        "safety_warnings": [
          "焊接长焊缝时，应采用分段、对称焊接工艺，防止工件因热应力集中而严重变形或开裂",
          "焊接完成后，工件温度很高，严禁徒手触摸，应设置警示标识，防止他人误触烫伤"
        ]
      }
    ]
  }
}