{
  "agent_name": "Agent6_FAQ",
  "model": "google/gemini-2.5-flash-preview-09-2025",
  "timestamp": "20251009_161450",
  "image_count": 0,
  "temperature": 0.2,
  "system_prompt": "# 角色定位\n\n你是**李师傅**，一位拥有20年安全管理经验的高级安全工程师。\n\n## 教育背景\n\n- **学历**：安全工程专业本科\n- **职业资格**：注册安全工程师、高级安全评价师\n- **专业培训**：\n  - 机械制造安全管理\n  - 职业健康与安全管理体系（ISO 45001）\n  - 事故调查与分析\n  - 应急预案编制与演练\n\n## 职业背景\n\n- **工作经历**：20年机械制造企业安全管理经验，参与过大型装备制造、钢结构加工等项目\n- **专业领域**：\n  - 机械加工安全（车、铣、刨、磨、钻等）\n  - 焊接作业安全（电焊、气焊、氩弧焊等）\n  - 起重吊装安全（行车、叉车、吊索具等）\n  - 高空作业安全（脚手架、安全带、防坠落等）\n  - 个人防护用品管理（安全帽、防护眼镜、手套、安全鞋等）\n\n## 知识结构（详细）\n\n### 1. 机械伤害风险\n- **夹伤/挤伤**：手指、手臂被运动部件夹住\n- **切割伤**：锋利边缘、毛刺、切削工具\n- **碰撞伤**：头部碰撞、身体碰撞\n- **坠落伤**：零件坠落、工具坠落、人员坠落\n\n### 2. 焊接作业风险\n- **电击伤**：焊机漏电、接地不良\n- **弧光伤**：电弧紫外线灼伤眼睛和皮肤\n- **烫伤**：高温熔池、焊渣飞溅\n- **火灾爆炸**：易燃物引燃、气瓶泄漏\n- **有毒气体**：焊接烟尘、一氧化碳中毒\n\n### 3. 起重吊装风险\n- **吊物坠落**：吊索具断裂、捆绑不牢\n- **吊物摆动**：碰撞人员、设备\n- **超载**：超过起重机额定载荷\n- **指挥失误**：信号不清、违章指挥\n\n### 4. 高空作业风险\n- **人员坠落**：未系安全带、脚手架不牢\n- **物体打击**：工具、零件从高处坠落\n- **脚手架坍塌**：搭设不规范、超载\n\n### 5. 个人防护用品\n- **头部防护**：安全帽（防止碰撞、坠物打击）\n- **眼部防护**：防护眼镜、焊接面罩（防止飞溅、弧光）\n- **手部防护**：防护手套（防止切割、烫伤、化学品）\n- **足部防护**：安全鞋（防砸、防刺穿、防滑）\n- **呼吸防护**：防尘口罩、防毒面具（防止粉尘、有毒气体）\n\n### 6. 应急处理\n- **机械伤害**：立即停机、呼救、止血、固定、送医\n- **电击伤**：切断电源、心肺复苏、送医\n- **烫伤**：冷水冲洗、覆盖无菌纱布、送医\n- **火灾**：使用灭火器、疏散人员、报警\n\n## 任务步骤（Chain of Thought）\n\n你的任务是**为每个装配步骤添加安全警告**（如果该步骤有安全风险）。请按照以下5个步骤思考：\n\n### 步骤1：识别风险步骤\n- 分析每个装配步骤的操作内容\n- 判断是否涉及高风险作业（焊接、吊装、高空、重物搬运等）\n- 识别潜在的伤害类型（机械伤害、电击、烫伤、坠落等）\n\n### 步骤2：分析风险源\n- 确定风险的来源（设备、工具、材料、环境、人员操作等）\n- 评估风险的严重程度（轻微、中等、严重、致命）\n- 考虑风险的发生概率\n\n### 步骤3：制定预防措施\n- 针对每个风险源，制定具体的预防措施\n- 强调个人防护用品的使用\n- 强调安全操作规程的遵守\n\n### 步骤4：添加安全警告\n- 为每个有风险的步骤添加safety_warnings字段\n- 每条警告要简洁明了，说明具体的风险和预防措施\n- 使用工人能看懂的语言\n\n### 步骤5：验证完整性\n- 检查所有高风险步骤是否都添加了安全警告\n- 检查安全警告是否具体、可操作\n- 检查是否遗漏了任何潜在风险\n\n## 核心原则\n\n1. **步骤级嵌入**：为每个有风险的步骤添加safety_warnings字段，而不是单独列出安全警告\n2. **工人友好**：使用通俗语言，避免专业术语\n3. **具体可操作**：说明具体的风险和预防措施，而不是泛泛而谈\n4. **不重复显示**：安全警告只在下方\"安全\"标签页中统一显示，不在当前步骤详情中重复显示\n\n## 输出格式\n\n严格按照以下JSON格式输出（返回增强后的装配步骤）：\n\n```json\n{\n  \"enhanced_steps\": [\n    {\n      \"step_number\": 1,\n      \"title\": \"点焊定位\",\n      \"parts_used\": [...],\n      \"tools_required\": [...],\n      \"operation\": \"操作说明\",\n      \"quality_check\": \"质量检查\",\n      \"estimated_time_minutes\": 10,\n      \"welding\": {\n        \"required\": true,\n        \"welding_type\": \"点焊\",\n        \"welding_method\": \"CO2气保焊\",\n        ...\n      },\n      \"safety_warnings\": [\n        \"佩戴焊接面罩和防护手套，防止弧光灼伤眼睛和皮肤\",\n        \"确保工件夹紧牢固，防止点焊时位移造成伤害\",\n        \"焊接区域周围3米内不得有易燃物，配备灭火器\",\n        \"焊机必须接地良好，防止漏电触电\"\n      ]\n    },\n    {\n      \"step_number\": 2,\n      \"title\": \"螺栓连接\",\n      \"parts_used\": [...],\n      \"operation\": \"操作说明\",\n      \"quality_check\": \"质量检查\",\n      \"estimated_time_minutes\": 15,\n      \"safety_warnings\": [\n        \"佩戴安全帽和防护眼镜，防止零件坠落和飞溅\",\n        \"使用扭力扳手时注意力度，防止扳手滑脱伤人\"\n      ]\n    },\n    {\n      \"step_number\": 3,\n      \"title\": \"简单装配\",\n      \"parts_used\": [...],\n      \"operation\": \"操作说明\",\n      \"quality_check\": \"质量检查\",\n      \"estimated_time_minutes\": 5\n      // ⚠️ 如果没有明显安全风险，不添加safety_warnings字段\n    }\n  ]\n}\n```\n\n**⚠️ 关键要求**：\n\n1. **步骤级嵌入**：\n   - 为每个有风险的步骤添加`safety_warnings`字段\n   - 没有明显风险的步骤不添加`safety_warnings`字段\n   - 保持原有步骤的所有字段不变\n\n2. **安全警告要具体**：\n   - ✅ 说\"佩戴焊接面罩和防护手套，防止弧光灼伤眼睛和皮肤\"\n   - ❌ 不说\"注意安全\"\n   - ✅ 说\"焊接区域周围3米内不得有易燃物，配备灭火器\"\n   - ❌ 不说\"注意防火\"\n\n3. **使用通俗语言**：\n   - 工人能看懂的语言\n   - 避免专业术语和英文缩写\n\n4. **警告要全面**：\n   - 涵盖个人防护、设备安全、环境安全、操作安全\n   - 每条警告说明具体的风险和预防措施\n\n## 重要提醒\n\n- **只输出JSON，不要输出其他内容**\n- **保持原有字段不变**：不要修改或删除原有的字段（包括welding字段）\n- **警告要简洁明了**：每条警告一句话，说明风险和预防措施\n- **不要过度警告**：只针对有明显风险的步骤添加警告\n",
  "user_query": "请为以下装配步骤添加安全警告（如果有安全风险）。\n\n## 📸 视觉分析任务\n\n**你会看到工程图纸图片，请仔细观察：**\n\n1. **危险作业标识**：\n   - 图纸上的安全警告标识\n   - 特殊作业要求（如高空作业、吊装作业等）\n   - 危险区域标注\n\n2. **零件特征**：\n   - 重型零件（需要吊装）\n   - 锋利边缘（容易割伤）\n   - 高温部件（容易烫伤）\n\n3. **作业环境**：\n   - 狭窄空间（容易碰撞）\n   - 高空位置（容易坠落）\n   - 密闭空间（通风不良）\n\n## 装配步骤\n\n[\n  {\n    \"step_number\": 1,\n    \"action\": \"定位基准件\",\n    \"description\": \"将图纸上标注为②的连接板（01.01.01.11509）平放在装配工作台上，作为整个组件的装配基准。\",\n    \"position_description\": \"平放于工作台，确保水平。\",\n    \"parts_used\": [\n      {\n        \"bom_seq\": \"2\",\n        \"bom_name\": \"连接板 1\",\n        \"quantity\": 1,\n        \"drawing_number\": \"2\",\n        \"node_name\": [\n          \"NAUO2\"\n        ],\n        \"bom_code\": \"01.01.01.11509\"\n      }\n    ],\n    \"tools\": [\n      \"行车\",\n      \"水平仪\"\n    ],\n    \"warnings\": [\n      \"连接板较重，吊装时注意安全，确保吊装平稳。\"\n    ]\n  },\n  {\n    \"step_number\": 2,\n    \"action\": \"安装下部矩形管\",\n    \"description\": \"将图纸上标注为①的矩形管（01.01.03.2718）放置在②号连接板的底部边缘，进行点焊定位。矩形管的长度方向应与连接板的长边对齐。\",\n    \"position_description\": \"位于②号连接板的底部边缘，与连接板垂直。\",\n    \"parts_used\": [\n      {\n        \"bom_seq\": \"1\",\n        \"bom_name\": \"矩形管 1\",\n        \"quantity\": 1,\n        \"drawing_number\": \"1\",\n        \"node_name\": [\n          \"NAUO1\"\n        ],\n        \"bom_code\": \"01.01.03.2718\"\n      }\n    ],\n    \"tools\": [\n      \"焊机\",\n      \"角尺\",\n      \"磁力夹具\"\n    ],\n    \"warnings\": [\n      \"点焊时注意焊接位置，确保矩形管与连接板的垂直度。\"\n    ],\n    \"welding\": {\n      \"required\": true,\n      \"welding_type\": \"角焊（定位焊）\",\n      \"welding_method\": \"CO2气保焊\",\n      \"weld_size\": \"点焊，焊点长度约10mm\",\n      \"welding_position\": \"零件①（矩形管）与零件②（连接板）的接触面，平焊\",\n      \"quality_requirements\": \"焊点牢固，用于固定位置，确保垂直度误差小于1mm/100mm\",\n      \"safety_notes\": \"点焊前清理焊点区域的油污和锈蚀。佩戴焊接面罩和手套，确保工作区域通风良好。\"\n    }\n  },\n  {\n    \"step_number\": 3,\n    \"action\": \"安装上部矩形管\",\n    \"description\": \"将图纸上标注为⑧的矩形管（01.01.03.2720）放置在②号连接板的顶部边缘，进行点焊定位。矩形管的长度方向应与连接板的长边对齐。\",\n    \"position_description\": \"位于②号连接板的顶部边缘，与连接板垂直。\",\n    \"parts_used\": [\n      {\n        \"bom_seq\": \"8\",\n        \"bom_name\": \"矩形管 1\",\n        \"quantity\": 1,\n        \"drawing_number\": \"8\",\n        \"node_name\": [\n          \"NAUO13\"\n        ],\n        \"bom_code\": \"01.01.03.2720\"\n      }\n    ],\n    \"tools\": [\n      \"焊机\",\n      \"角尺\",\n      \"磁力夹具\"\n    ],\n    \"warnings\": [\n      \"确保⑧号矩形管与②号连接板的顶部边缘对齐，且与①号矩形管平行。\"\n    ],\n    \"welding\": {\n      \"required\": true,\n      \"welding_type\": \"角焊（定位焊）\",\n      \"welding_method\": \"CO2气保焊\",\n      \"weld_size\": \"点焊，焊点长度约10mm\",\n      \"welding_position\": \"零件⑧（矩形管）与零件②（连接板）的接触面，平焊\",\n      \"quality_requirements\": \"焊点牢固，用于固定位置，确保与①号矩形管的平行度。\",\n      \"safety_notes\": \"点焊时注意防止飞溅，保护眼睛和皮肤。检查焊机接地是否可靠。\"\n    }\n  },\n  {\n    \"step_number\": 4,\n    \"action\": \"安装左挂件虚拟组件\",\n    \"description\": \"将图纸上标注为⑤的左挂件虚拟组件（01.05.0019）焊接到⑧号矩形管的左侧端部，确保挂件的安装孔方向正确。\",\n    \"position_description\": \"位于⑧号矩形管的左侧端部。\",\n    \"parts_used\": [\n      {\n        \"bom_seq\": \"5\",\n        \"bom_name\": \"左挂件虚拟组件 1\",\n        \"quantity\": 1,\n        \"drawing_number\": \"5\",\n        \"node_name\": [\n          \"NAUO17\",\n          \"NAUO16\"\n        ],\n        \"bom_code\": \"01.05.0019\"\n      }\n    ],\n    \"tools\": [\n      \"焊机\",\n      \"卡尺\"\n    ],\n    \"warnings\": [\n      \"焊接前确认挂件的安装位置和角度，避免装反。\"\n    ],\n    \"welding\": {\n      \"required\": true,\n      \"welding_type\": \"角焊\",\n      \"welding_method\": \"CO2气保焊\",\n      \"weld_size\": \"焊脚高度6mm，全焊\",\n      \"welding_position\": \"零件⑤（左挂件）与零件⑧（矩形管）的连接处，可能涉及横焊或立焊\",\n      \"quality_requirements\": \"焊缝连续、饱满，焊后清理焊渣，确保无裂纹、气孔等缺陷。外观检查合格。\",\n      \"safety_notes\": \"由于挂件较厚，可能需要预热。注意调整焊接参数，防止烧穿或未熔合。高空作业时系好安全带。\"\n    }\n  },\n  {\n    \"step_number\": 5,\n    \"action\": \"安装右挂件虚拟组件\",\n    \"description\": \"将图纸上标注为④的右挂件虚拟组件（01.05.0018）焊接到⑧号矩形管的右侧端部，与⑤号挂件对称。\",\n    \"position_description\": \"位于⑧号矩形管的右侧端部。\",\n    \"parts_used\": [\n      {\n        \"bom_seq\": \"4\",\n        \"bom_name\": \"右挂件虚拟组件 1\",\n        \"quantity\": 1,\n        \"drawing_number\": \"4\",\n        \"node_name\": [\n          \"NAUO20\",\n          \"NAUO19\"\n        ],\n        \"bom_code\": \"01.05.0018\"\n      }\n    ],\n    \"tools\": [\n      \"焊机\",\n      \"卡尺\"\n    ],\n    \"warnings\": [\n      \"确保左右挂件的对称性，测量两挂件中心距是否符合图纸要求。\"\n    ],\n    \"welding\": {\n      \"required\": true,\n      \"welding_type\": \"角焊\",\n      \"welding_method\": \"CO2气保焊\",\n      \"weld_size\": \"焊脚高度6mm，全焊\",\n      \"welding_position\": \"零件④（右挂件）与零件⑧（矩形管）的连接处，可能涉及横焊或立焊\",\n      \"quality_requirements\": \"焊缝连续、饱满，与左挂件的焊接质量要求一致。检查挂件的对称度和中心距。\",\n      \"safety_notes\": \"焊接过程中注意控制热输入，避免零件变形。使用防火毯隔离周围易燃物。\"\n    }\n  },\n  {\n    \"step_number\": 6,\n    \"action\": \"安装侧面矩形管\",\n    \"description\": \"将图纸上标注为⑥的矩形管（01.01.03.2719，共2件）分别焊接到②号连接板和⑧号矩形管之间，位于组件的两侧，作为侧向支撑。\",\n    \"position_description\": \"位于组件的左右两侧，连接②号连接板和⑧号矩形管。\",\n    \"parts_used\": [\n      {\n        \"bom_seq\": \"6\",\n        \"bom_name\": \"矩形管 2\",\n        \"quantity\": 2,\n        \"drawing_number\": \"6\",\n        \"node_name\": [\n          \"NAUO10\",\n          \"NAUO9\"\n        ],\n        \"bom_code\": \"01.01.03.2719\"\n      }\n    ],\n    \"tools\": [\n      \"焊机\",\n      \"磁力夹具\"\n    ],\n    \"warnings\": [\n      \"确保⑥号矩形管与连接板和矩形管的接触面紧密贴合，焊接牢固。\"\n    ],\n    \"welding\": {\n      \"required\": true,\n      \"welding_type\": \"角焊\",\n      \"welding_method\": \"CO2气保焊\",\n      \"weld_size\": \"焊脚高度5mm，全焊\",\n      \"welding_position\": \"零件⑥（侧面矩形管）与零件②（连接板）和零件⑧（矩形管）的连接处，主要为平焊和横焊\",\n      \"quality_requirements\": \"焊缝连续，过渡平滑，无咬边、未焊透。焊接时采用分段退焊，控制整体变形。\",\n      \"safety_notes\": \"焊接前检查坡口和装配间隙，确保符合工艺要求。注意焊枪角度，避免焊缝成形不良。\"\n    }\n  },\n  {\n    \"step_number\": 7,\n    \"action\": \"安装封板\",\n    \"description\": \"将图纸上标注为⑦的封板（01.01.01.16608，共2件）分别焊接到组件的左右两侧，覆盖在⑥号矩形管的外部。\",\n    \"position_description\": \"覆盖在组件的左右两侧，与②号连接板和⑧号矩形管形成封闭结构。\",\n    \"parts_used\": [\n      {\n        \"bom_seq\": \"7\",\n        \"bom_name\": \"封板 2\",\n        \"quantity\": 2,\n        \"drawing_number\": \"7\",\n        \"node_name\": [\n          \"NAUO12\",\n          \"NAUO11\"\n        ],\n        \"bom_code\": \"01.01.01.16608\"\n      }\n    ],\n    \"tools\": [\n      \"焊机\",\n      \"压紧钳\"\n    ],\n    \"warnings\": [\n      \"封板焊接时注意焊缝的连续性和美观性，确保无漏焊。\"\n    ],\n    \"welding\": {\n      \"required\": true,\n      \"welding_type\": \"角焊\",\n      \"welding_method\": \"CO2气保焊\",\n      \"weld_size\": \"焊脚高度4mm，全焊\",\n      \"welding_position\": \"零件⑦（封板）与周围零件（②、⑥、⑧）的连接边缘，主要为平焊和横焊\",\n      \"quality_requirements\": \"焊缝要求美观，连续性好，用于密封。焊后打磨飞溅，清理焊渣。\",\n      \"safety_notes\": \"封板较薄，焊接电流不宜过大，防止烧穿。注意佩戴防尘口罩进行焊后清理工作。\"\n    }\n  },\n  {\n    \"step_number\": 8,\n    \"action\": \"安装加强筋\",\n    \"description\": \"将图纸上标注为⑨的加强筋（01.01.01.17678，共2件）分别焊接到组件内部，用于加强②号连接板与⑧号矩形管之间的连接强度。\",\n    \"position_description\": \"位于组件内部，斜向连接②号连接板和⑧号矩形管。\",\n    \"parts_used\": [\n      {\n        \"bom_seq\": \"9\",\n        \"bom_name\": \"加强筋 2\",\n        \"quantity\": 2,\n        \"drawing_number\": \"9\",\n        \"node_name\": [\n          \"NAUO15\",\n          \"NAUO14\"\n        ],\n        \"bom_code\": \"01.01.01.17678\"\n      }\n    ],\n    \"tools\": [\n      \"焊机\",\n      \"角尺\"\n    ],\n    \"warnings\": [\n      \"加强筋的焊接位置和角度必须符合图纸要求，确保受力均匀。\"\n    ],\n    \"welding\": {\n      \"required\": true,\n      \"welding_type\": \"角焊\",\n      \"welding_method\": \"CO2气保焊\",\n      \"weld_size\": \"焊脚高度6mm，全焊\",\n      \"welding_position\": \"零件⑨（加强筋）与零件②（连接板）和零件⑧（矩形管）的连接面，主要为立焊和横焊\",\n      \"quality_requirements\": \"焊缝必须达到二级焊缝标准，要求内部无缺陷。焊缝应力集中处应保证焊透。\",\n      \"safety_notes\": \"加强筋焊接位置空间狭小，操作时注意姿势，防止烫伤。确保焊缝区域清洁，避免产生气孔。\"\n    }\n  },\n  {\n    \"step_number\": 9,\n    \"action\": \"安装方形板\",\n    \"description\": \"将图纸上标注为③的方形板-机加（01.01.01.6589，共4件）分别焊接到组件的四个角部，用于安装定位。\",\n    \"position_description\": \"位于组件的四个角部，与矩形管端部齐平。\",\n    \"parts_used\": [\n      {\n        \"bom_seq\": \"3\",\n        \"bom_name\": \"方形板-机加 4\",\n        \"quantity\": 4,\n        \"drawing_number\": \"3\",\n        \"node_name\": [\n          \"NAUO6\",\n          \"NAUO5\",\n          \"NAUO4\",\n          \"NAUO3\"\n        ],\n        \"bom_code\": \"01.01.01.6589\"\n      }\n    ],\n    \"tools\": [\n      \"焊机\",\n      \"游标卡尺\"\n    ],\n    \"warnings\": [\n      \"方形板为机加件，焊接时注意保护机加面，确保安装面平整度。\"\n    ],\n    \"welding\": {\n      \"required\": true,\n      \"welding_type\": \"角焊\",\n      \"welding_method\": \"CO2气保焊\",\n      \"weld_size\": \"焊脚高度5mm，全焊\",\n      \"welding_position\": \"零件③（方形板）与矩形管端部的连接处，主要为平焊\",\n      \"quality_requirements\": \"焊缝连续，焊后需对机加面附近的焊渣和飞溅进行彻底清理，确保安装面平整度要求。\",\n      \"safety_notes\": \"焊接完成后，应让零件自然冷却，避免强制冷却导致机加件变形或产生裂纹。注意检查焊机电缆绝缘情况。\"\n    }\n  }\n]\n\n## 要求\n\n请按照以下5个步骤思考，为装配步骤添加安全警告：\n\n### 步骤1：识别风险步骤\n- 分析每个装配步骤的操作内容\n- 判断是否涉及高风险作业：\n  * **焊接作业**：电击、弧光、烫伤、火灾\n  * **吊装作业**：吊物坠落、碰撞、超载\n  * **高空作业**：人员坠落、物体打击\n  * **重物搬运**：砸伤、扭伤、夹伤\n  * **机械加工**：切割伤、夹伤、碰撞\n\n### 步骤2：分析风险源\n- 确定风险的来源（设备、工具、材料、环境、人员操作等）\n- 评估风险的严重程度（轻微、中等、严重、致命）\n- 考虑风险的发生概率\n\n### 步骤3：制定预防措施\n- 针对每个风险源，制定具体的预防措施\n- 强调个人防护用品的使用：\n  * **焊接**：焊接面罩、防护手套、防护服\n  * **吊装**：安全帽、安全鞋、手套\n  * **高空**：安全带、安全帽、防滑鞋\n  * **机械**：防护眼镜、手套、安全鞋\n\n### 步骤4：添加安全警告\n- 为每个有风险的步骤添加safety_warnings字段\n- 每条警告要简洁明了，说明具体的风险和预防措施\n- 使用工人能看懂的语言\n\n### 步骤5：验证完整性\n- 检查所有高风险步骤是否都添加了安全警告\n- 检查安全警告是否具体、可操作\n- 检查是否遗漏了任何潜在风险\n\n## ⚠️ 强制自检清单（生成后必须逐项检查）\n\n**在输出JSON之前，你必须完成以下验证：**\n\n1. **风险步骤识别验证**：\n   - [ ] 所有涉及焊接、吊装、高空、重物搬运的步骤都添加了safety_warnings字段\n   - [ ] 没有明显风险的步骤没有添加safety_warnings字段\n\n2. **安全警告完整性验证**：\n   - [ ] 每个safety_warnings字段都是字符串数组\n   - [ ] 每条警告都说明了具体的风险和预防措施\n   - [ ] 涵盖了个人防护、设备安全、环境安全、操作安全\n\n3. **语言通俗性验证**：\n   - [ ] 使用工人能看懂的语言\n   - [ ] 避免专业术语和英文缩写\n   - [ ] 每条警告简洁明了（一句话）\n\n4. **原有字段保持验证**：\n   - [ ] 原有步骤的所有字段都保持不变（包括welding字段）\n   - [ ] 没有修改或删除任何原有字段\n\n**如果自检发现任何问题，必须重新生成！**\n\n现在开始为装配步骤添加安全警告！\n",
  "raw_response": "```json\n{\n  \"enhanced_steps\": [\n    {\n      \"step_number\": 1,\n      \"action\": \"定位基准件\",\n      \"description\": \"将图纸上标注为②的连接板（01.01.01.11509）平放在装配工作台上，作为整个组件的装配基准。\",\n      \"position_description\": \"平放于工作台，确保水平。\",\n      \"parts_used\": [\n        {\n          \"bom_seq\": \"2\",\n          \"bom_name\": \"连接板 1\",\n          \"quantity\": 1,\n          \"drawing_number\": \"2\",\n          \"node_name\": [\n            \"NAUO2\"\n          ],\n          \"bom_code\": \"01.01.01.11509\"\n        }\n      ],\n      \"tools\": [\n        \"行车\",\n        \"水平仪\"\n      ],\n      \"warnings\": [\n        \"连接板较重，吊装时注意安全，确保吊装平稳。\"\n      ],\n      \"safety_warnings\": [\n        \"吊装前检查吊索具是否完好，捆绑是否牢固，防止吊物坠落伤人\",\n        \"吊装过程中，非操作人员必须远离吊物下方和运行路径，防止碰撞\",\n        \"操作行车时，必须由持证司索工和指挥人员配合，严禁超载\"\n      ]\n    },\n    {\n      \"step_number\": 2,\n      \"action\": \"安装下部矩形管\",\n      \"description\": \"将图纸上标注为①的矩形管（01.01.03.2718）放置在②号连接板的底部边缘，进行点焊定位。矩形管的长度方向应与连接板的长边对齐。\",\n      \"position_description\": \"位于②号连接板的底部边缘，与连接板垂直。\",\n      \"parts_used\": [\n        {\n          \"bom_seq\": \"1\",\n          \"bom_name\": \"矩形管 1\",\n          \"quantity\": 1,\n          \"drawing_number\": \"1\",\n          \"node_name\": [\n            \"NAUO1\"\n          ],\n          \"bom_code\": \"01.01.03.2718\"\n        }\n      ],\n      \"tools\": [\n        \"焊机\",\n        \"角尺\",\n        \"磁力夹具\"\n      ],\n      \"warnings\": [\n        \"点焊时注意焊接位置，确保矩形管与连接板的垂直度。\"\n      ],\n      \"welding\": {\n        \"required\": true,\n        \"welding_type\": \"角焊（定位焊）\",\n        \"welding_method\": \"CO2气保焊\",\n        \"weld_size\": \"点焊，焊点长度约10mm\",\n        \"welding_position\": \"零件①（矩形管）与零件②（连接板）的接触面，平焊\",\n        \"quality_requirements\": \"焊点牢固，用于固定位置，确保垂直度误差小于1mm/100mm\",\n        \"safety_notes\": \"点焊前清理焊点区域的油污和锈蚀。佩戴焊接面罩和手套，确保工作区域通风良好。\"\n      },\n      \"safety_warnings\": [\n        \"佩戴焊接面罩、防护手套和防护服，防止弧光灼伤和高温烫伤\",\n        \"确保焊机接地良好，电缆绝缘完好，防止触电事故\",\n        \"焊接区域必须保持通风，防止吸入有害烟尘和气体\",\n        \"清理焊渣时，佩戴防护眼镜，防止焊渣飞溅伤眼\"\n      ]\n    },\n    {\n      \"step_number\": 3,\n      \"action\": \"安装上部矩形管\",\n      \"description\": \"将图纸上标注为⑧的矩形管（01.01.03.2720）放置在②号连接板的顶部边缘，进行点焊定位。矩形管的长度方向应与连接板的长边对齐。\",\n      \"position_description\": \"位于②号连接板的顶部边缘，与连接板垂直。\",\n      \"parts_used\": [\n        {\n          \"bom_seq\": \"8\",\n          \"bom_name\": \"矩形管 1\",\n          \"quantity\": 1,\n          \"drawing_number\": \"8\",\n          \"node_name\": [\n            \"NAUO13\"\n          ],\n          \"bom_code\": \"01.01.03.2720\"\n        }\n      ],\n      \"tools\": [\n        \"焊机\",\n        \"角尺\",\n        \"磁力夹具\"\n      ],\n      \"warnings\": [\n        \"确保⑧号矩形管与②号连接板的顶部边缘对齐，且与①号矩形管平行。\"\n      ],\n      \"welding\": {\n        \"required\": true,\n        \"welding_type\": \"角焊（定位焊）\",\n        \"welding_method\": \"CO2气保焊\",\n        \"weld_size\": \"点焊，焊点长度约10mm\",\n        \"welding_position\": \"零件⑧（矩形管）与零件②（连接板）的接触面，平焊\",\n        \"quality_requirements\": \"焊点牢固，用于固定位置，确保与①号矩形管的平行度。\",\n        \"safety_notes\": \"点焊时注意防止飞溅，保护眼睛和皮肤。检查焊机接地是否可靠。\"\n      },\n      \"safety_warnings\": [\n        \"点焊时使用焊接面罩和手套，防止电弧光和高温飞溅物伤害\",\n        \"检查工作台周围，清除易燃易爆物品，防止火灾\",\n        \"焊接完成后，用专用工具移动或触碰工件，防止高温烫伤\"\n      ]\n    },\n    {\n      \"step_number\": 4,\n      \"action\": \"安装左挂件虚拟组件\",\n      \"description\": \"将图纸上标注为⑤的左挂件虚拟组件（01.05.0019）焊接到⑧号矩形管的左侧端部，确保挂件的安装孔方向正确。\",\n      \"position_description\": \"位于⑧号矩形管的左侧端部。\",\n      \"parts_used\": [\n        {\n          \"bom_seq\": \"5\",\n          \"bom_name\": \"左挂件虚拟组件 1\",\n          \"quantity\": 1,\n          \"drawing_number\": \"5\",\n          \"node_name\": [\n            \"NAUO17\",\n            \"NAUO16\"\n          ],\n          \"bom_code\": \"01.05.0019\"\n        }\n      ],\n      \"tools\": [\n        \"焊机\",\n        \"卡尺\"\n      ],\n      \"warnings\": [\n        \"焊接前确认挂件的安装位置和角度，避免装反。\"\n      ],\n      \"welding\": {\n        \"required\": true,\n        \"welding_type\": \"角焊\",\n        \"welding_method\": \"CO2气保焊\",\n        \"weld_size\": \"焊脚高度6mm，全焊\",\n        \"welding_position\": \"零件⑤（左挂件）与零件⑧（矩形管）的连接处，可能涉及横焊或立焊\",\n        \"quality_requirements\": \"焊缝连续、饱满，焊后清理焊渣，确保无裂纹、气孔等缺陷。外观检查合格。\",\n        \"safety_notes\": \"由于挂件较厚，可能需要预热。注意调整焊接参数，防止烧穿或未熔合。高空作业时系好安全带。\"\n      },\n      \"safety_warnings\": [\n        \"进行全焊作业时，必须佩戴全套焊接防护用品（面罩、手套、防护服）\",\n        \"注意焊接位置可能涉及横焊或立焊，操作时站稳，防止焊渣飞溅烫伤\",\n        \"如果工件较高，需要登高作业，必须使用合格的梯子或平台，并系好安全带\",\n        \"确保焊接区域通风良好，防止有害气体浓度过高\"\n      ]\n    },\n    {\n      \"step_number\": 5,\n      \"action\": \"安装右挂件虚拟组件\",\n      \"description\": \"将图纸上标注为④的右挂件虚拟组件（01.05.0018）焊接到⑧号矩形管的右侧端部，与⑤号挂件对称。\",\n      \"position_description\": \"位于⑧号矩形管的右侧端部。\",\n      \"parts_used\": [\n        {\n          \"bom_seq\": \"4\",\n          \"bom_name\": \"右挂件虚拟组件 1\",\n          \"quantity\": 1,\n          \"drawing_number\": \"4\",\n          \"node_name\": [\n            \"NAUO20\",\n            \"NAUO19\"\n          ],\n          \"bom_code\": \"01.05.0018\"\n        }\n      ],\n      \"tools\": [\n        \"焊机\",\n        \"卡尺\"\n      ],\n      \"warnings\": [\n        \"确保左右挂件的对称性，测量两挂件中心距是否符合图纸要求。\"\n      ],\n      \"welding\": {\n        \"required\": true,\n        \"welding_type\": \"角焊\",\n        \"welding_method\": \"CO2气保焊\",\n        \"weld_size\": \"焊脚高度6mm，全焊\",\n        \"welding_position\": \"零件④（右挂件）与零件⑧（矩形管）的连接处，可能涉及横焊或立焊\",\n        \"quality_requirements\": \"焊缝连续、饱满，与左挂件的焊接质量要求一致。检查挂件的对称度和中心距。\",\n        \"safety_notes\": \"焊接过程中注意控制热输入，避免零件变形。使用防火毯隔离周围易燃物。\"\n      },\n      \"safety_warnings\": [\n        \"使用防火毯或挡板隔离焊接火花和飞溅，防止引燃周围物品\",\n        \"焊接时注意控制热输入，避免零件变形，防止变形后矫正时发生机械伤害\",\n        \"焊接完成后，及时清理焊渣和飞溅物，防止人员滑倒或被尖锐物刺伤\"\n      ]\n    },\n    {\n      \"step_number\": 6,\n      \"action\": \"安装侧面矩形管\",\n      \"description\": \"将图纸上标注为⑥的矩形管（01.01.03.2719，共2件）分别焊接到②号连接板和⑧号矩形管之间，位于组件的两侧，作为侧向支撑。\",\n      \"position_description\": \"位于组件的左右两侧，连接②号连接板和⑧号矩形管。\",\n      \"parts_used\": [\n        {\n          \"bom_seq\": \"6\",\n          \"bom_name\": \"矩形管 2\",\n          \"quantity\": 2,\n          \"drawing_number\": \"6\",\n          \"node_name\": [\n            \"NAUO10\",\n            \"NAUO9\"\n          ],\n          \"bom_code\": \"01.01.03.2719\"\n        }\n      ],\n      \"tools\": [\n        \"焊机\",\n        \"磁力夹具\"\n      ],\n      \"warnings\": [\n        \"确保⑥号矩形管与连接板和矩形管的接触面紧密贴合，焊接牢固。\"\n      ],\n      \"welding\": {\n        \"required\": true,\n        \"welding_type\": \"角焊\",\n        \"welding_method\": \"CO2气保焊\",\n        \"weld_size\": \"焊脚高度5mm，全焊\",\n        \"welding_position\": \"零件⑥（侧面矩形管）与零件②（连接板）和零件⑧（矩形管）的连接处，主要为平焊和横焊\",\n        \"quality_requirements\": \"焊缝连续，过渡平滑，无咬边、未焊透。焊接时采用分段退焊，控制整体变形。\",\n        \"safety_notes\": \"焊接前检查坡口和装配间隙，确保符合工艺要求。注意焊枪角度，避免焊缝成形不良。\"\n      },\n      \"safety_warnings\": [\n        \"使用磁力夹具固定零件时，确保夹具吸力足够，防止零件在焊接过程中脱落或位移伤人\",\n        \"焊接时注意焊枪和电缆的布置，避免绊倒或电缆被高温烫伤绝缘层\",\n        \"佩戴防护眼镜和手套，防止零件边缘毛刺或飞溅物造成切割伤或刺伤\"\n      ]\n    },\n    {\n      \"step_number\": 7,\n      \"action\": \"安装封板\",\n      \"description\": \"将图纸上标注为⑦的封板（01.01.01.16608，共2件）分别焊接到组件的左右两侧，覆盖在⑥号矩形管的外部。\",\n      \"position_description\": \"覆盖在组件的左右两侧，与②号连接板和⑧号矩形管形成封闭结构。\",\n      \"parts_used\": [\n        {\n          \"bom_seq\": \"7\",\n          \"bom_name\": \"封板 2\",\n          \"quantity\": 2,\n          \"drawing_number\": \"7\",\n          \"node_name\": [\n            \"NAUO12\",\n            \"NAUO11\"\n          ],\n          \"bom_code\": \"01.01.01.16608\"\n        }\n      ],\n      \"tools\": [\n        \"焊机\",\n        \"压紧钳\"\n      ],\n      \"warnings\": [\n        \"封板焊接时注意焊缝的连续性和美观性，确保无漏焊。\"\n      ],\n      \"welding\": {\n        \"required\": true,\n        \"welding_type\": \"角焊\",\n        \"welding_method\": \"CO2气保焊\",\n        \"weld_size\": \"焊脚高度4mm，全焊\",\n        \"welding_position\": \"零件⑦（封板）与周围零件（②、⑥、⑧）的连接边缘，主要为平焊和横焊\",\n        \"quality_requirements\": \"焊缝要求美观，连续性好，用于密封。焊后打磨飞溅，清理焊渣。\",\n        \"safety_notes\": \"封板较薄，焊接电流不宜过大，防止烧穿。注意佩戴防尘口罩进行焊后清理工作。\"\n      },\n      \"safety_warnings\": [\n        \"封板较薄，焊接电流过大易烧穿，可能造成烫伤或引燃周围物品\",\n        \"焊后清理焊渣和打磨飞溅时，必须佩戴防尘口罩和防护眼镜，防止粉尘和飞溅物伤害呼吸道和眼睛\",\n        \"使用压紧钳固定时，注意手指位置，防止夹伤\"\n      ]\n    },\n    {\n      \"step_number\": 8,\n      \"action\": \"安装加强筋\",\n      \"description\": \"将图纸上标注为⑨的加强筋（01.01.01.17678，共2件）分别焊接到组件内部，用于加强②号连接板与⑧号矩形管之间的连接强度。\",\n      \"position_description\": \"位于组件内部，斜向连接②号连接板和⑧号矩形管。\",\n      \"parts_used\": [\n        {\n          \"bom_seq\": \"9\",\n          \"bom_name\": \"加强筋 2\",\n          \"quantity\": 2,\n          \"drawing_number\": \"9\",\n          \"node_name\": [\n            \"NAUO15\",\n            \"NAUO14\"\n          ],\n          \"bom_code\": \"01.01.01.17678\"\n        }\n      ],\n      \"tools\": [\n        \"焊机\",\n        \"角尺\"\n      ],\n      \"warnings\": [\n        \"加强筋的焊接位置和角度必须符合图纸要求，确保受力均匀。\"\n      ],\n      \"welding\": {\n        \"required\": true,\n        \"welding_type\": \"角焊\",\n        \"welding_method\": \"CO2气保焊\",\n        \"weld_size\": \"焊脚高度6mm，全焊\",\n        \"welding_position\": \"零件⑨（加强筋）与零件②（连接板）和零件⑧（矩形管）的连接面，主要为立焊和横焊\",\n        \"quality_requirements\": \"焊缝必须达到二级焊缝标准，要求内部无缺陷。焊缝应力集中处应保证焊透。\",\n        \"safety_notes\": \"加强筋焊接位置空间狭小，操作时注意姿势，防止烫伤。确保焊缝区域清洁，避免产生气孔。\"\n      },\n      \"safety_warnings\": [\n        \"加强筋焊接位置空间狭小，操作时注意身体姿势，防止扭伤或碰撞受伤\",\n        \"在狭小空间焊接时，确保通风设备正常运行，防止烟尘聚集\",\n        \"使用长柄工具或夹具定位加强筋，避免手部直接接触高温区域造成烫伤\"\n      ]\n    },\n    {\n      \"step_number\": 9,\n      \"action\": \"安装方形板\",\n      \"description\": \"将图纸上标注为③的方形板-机加（01.01.01.6589，共4件）分别焊接到组件的四个角部，用于安装定位。\",\n      \"position_description\": \"位于组件的四个角部，与矩形管端部齐平。\",\n      \"parts_used\": [\n        {\n          \"bom_seq\": \"3\",\n          \"bom_name\": \"方形板-机加 4\",\n          \"quantity\": 4,\n          \"drawing_number\": \"3\",\n          \"node_name\": [\n            \"NAUO6\",\n            \"NAUO5\",\n            \"NAUO4\",\n            \"NAUO3\"\n          ],\n          \"bom_code\": \"01.01.01.6589\"\n        }\n      ],\n      \"tools\": [\n        \"焊机\",\n        \"游标卡尺\"\n      ],\n      \"warnings\": [\n        \"方形板为机加件，焊接时注意保护机加面，确保安装面平整度。\"\n      ],\n      \"welding\": {\n        \"required\": true,\n        \"welding_type\": \"角焊\",\n        \"welding_method\": \"CO2气保焊\",\n        \"weld_size\": \"焊脚高度5mm，全焊\",\n        \"welding_position\": \"零件③（方形板）与矩形管端部的连接处，主要为平焊\",\n        \"quality_requirements\": \"焊缝连续，焊后需对机加面附近的焊渣和飞溅进行彻底清理，确保安装面平整度要求。\",\n        \"safety_notes\": \"焊接完成后，应让零件自然冷却，避免强制冷却导致机加件变形或产生裂纹。注意检查焊机电缆绝缘情况。\"\n      },\n      \"safety_warnings\": [\n        \"方形板边缘可能锋利，搬运和定位时必须佩戴防割手套，防止割伤\",\n        \"焊接完成后，清理机加面附近的飞溅物时，使用专用工具，并佩戴防护眼镜\",\n        \"焊接设备必须定期检查，确保电缆和焊枪无破损，防止漏电触电\"\n      ]\n    }\n  ]\n}\n```",
  "parsed_result": {
    "enhanced_steps": [
      {
        "step_number": 1,
        "action": "定位基准件",
        "description": "将图纸上标注为②的连接板（01.01.01.11509）平放在装配工作台上，作为整个组件的装配基准。",
        "position_description": "平放于工作台，确保水平。",
        "parts_used": [
          {
            "bom_seq": "2",
            "bom_name": "连接板 1",
            "quantity": 1,
            "drawing_number": "2",
            "node_name": [
              "NAUO2"
            ],
            "bom_code": "01.01.01.11509"
          }
        ],
        "tools": [
          "行车",
          "水平仪"
        ],
        "warnings": [
          "连接板较重，吊装时注意安全，确保吊装平稳。"
        ],
        "safety_warnings": [
          "吊装前检查吊索具是否完好，捆绑是否牢固，防止吊物坠落伤人",
          "吊装过程中，非操作人员必须远离吊物下方和运行路径，防止碰撞",
          "操作行车时，必须由持证司索工和指挥人员配合，严禁超载"
        ]
      },
      {
        "step_number": 2,
        "action": "安装下部矩形管",
        "description": "将图纸上标注为①的矩形管（01.01.03.2718）放置在②号连接板的底部边缘，进行点焊定位。矩形管的长度方向应与连接板的长边对齐。",
        "position_description": "位于②号连接板的底部边缘，与连接板垂直。",
        "parts_used": [
          {
            "bom_seq": "1",
            "bom_name": "矩形管 1",
            "quantity": 1,
            "drawing_number": "1",
            "node_name": [
              "NAUO1"
            ],
            "bom_code": "01.01.03.2718"
          }
        ],
        "tools": [
          "焊机",
          "角尺",
          "磁力夹具"
        ],
        "warnings": [
          "点焊时注意焊接位置，确保矩形管与连接板的垂直度。"
        ],
        "welding": {
          "required": true,
          "welding_type": "角焊（定位焊）",
          "welding_method": "CO2气保焊",
          "weld_size": "点焊，焊点长度约10mm",
          "welding_position": "零件①（矩形管）与零件②（连接板）的接触面，平焊",
          "quality_requirements": "焊点牢固，用于固定位置，确保垂直度误差小于1mm/100mm",
          "safety_notes": "点焊前清理焊点区域的油污和锈蚀。佩戴焊接面罩和手套，确保工作区域通风良好。"
        },
        "safety_warnings": [
          "佩戴焊接面罩、防护手套和防护服，防止弧光灼伤和高温烫伤",
          "确保焊机接地良好，电缆绝缘完好，防止触电事故",
          "焊接区域必须保持通风，防止吸入有害烟尘和气体",
          "清理焊渣时，佩戴防护眼镜，防止焊渣飞溅伤眼"
        ]
      },
      {
        "step_number": 3,
        "action": "安装上部矩形管",
        "description": "将图纸上标注为⑧的矩形管（01.01.03.2720）放置在②号连接板的顶部边缘，进行点焊定位。矩形管的长度方向应与连接板的长边对齐。",
        "position_description": "位于②号连接板的顶部边缘，与连接板垂直。",
        "parts_used": [
          {
            "bom_seq": "8",
            "bom_name": "矩形管 1",
            "quantity": 1,
            "drawing_number": "8",
            "node_name": [
              "NAUO13"
            ],
            "bom_code": "01.01.03.2720"
          }
        ],
        "tools": [
          "焊机",
          "角尺",
          "磁力夹具"
        ],
        "warnings": [
          "确保⑧号矩形管与②号连接板的顶部边缘对齐，且与①号矩形管平行。"
        ],
        "welding": {
          "required": true,
          "welding_type": "角焊（定位焊）",
          "welding_method": "CO2气保焊",
          "weld_size": "点焊，焊点长度约10mm",
          "welding_position": "零件⑧（矩形管）与零件②（连接板）的接触面，平焊",
          "quality_requirements": "焊点牢固，用于固定位置，确保与①号矩形管的平行度。",
          "safety_notes": "点焊时注意防止飞溅，保护眼睛和皮肤。检查焊机接地是否可靠。"
        },
        "safety_warnings": [
          "点焊时使用焊接面罩和手套，防止电弧光和高温飞溅物伤害",
          "检查工作台周围，清除易燃易爆物品，防止火灾",
          "焊接完成后，用专用工具移动或触碰工件，防止高温烫伤"
        ]
      },
      {
        "step_number": 4,
        "action": "安装左挂件虚拟组件",
        "description": "将图纸上标注为⑤的左挂件虚拟组件（01.05.0019）焊接到⑧号矩形管的左侧端部，确保挂件的安装孔方向正确。",
        "position_description": "位于⑧号矩形管的左侧端部。",
        "parts_used": [
          {
            "bom_seq": "5",
            "bom_name": "左挂件虚拟组件 1",
            "quantity": 1,
            "drawing_number": "5",
            "node_name": [
              "NAUO17",
              "NAUO16"
            ],
            "bom_code": "01.05.0019"
          }
        ],
        "tools": [
          "焊机",
          "卡尺"
        ],
        "warnings": [
          "焊接前确认挂件的安装位置和角度，避免装反。"
        ],
        "welding": {
          "required": true,
          "welding_type": "角焊",
          "welding_method": "CO2气保焊",
          "weld_size": "焊脚高度6mm，全焊",
          "welding_position": "零件⑤（左挂件）与零件⑧（矩形管）的连接处，可能涉及横焊或立焊",
          "quality_requirements": "焊缝连续、饱满，焊后清理焊渣，确保无裂纹、气孔等缺陷。外观检查合格。",
          "safety_notes": "由于挂件较厚，可能需要预热。注意调整焊接参数，防止烧穿或未熔合。高空作业时系好安全带。"
        },
        "safety_warnings": [
          "进行全焊作业时，必须佩戴全套焊接防护用品（面罩、手套、防护服）",
          "注意焊接位置可能涉及横焊或立焊，操作时站稳，防止焊渣飞溅烫伤",
          "如果工件较高，需要登高作业，必须使用合格的梯子或平台，并系好安全带",
          "确保焊接区域通风良好，防止有害气体浓度过高"
        ]
      },
      {
        "step_number": 5,
        "action": "安装右挂件虚拟组件",
        "description": "将图纸上标注为④的右挂件虚拟组件（01.05.0018）焊接到⑧号矩形管的右侧端部，与⑤号挂件对称。",
        "position_description": "位于⑧号矩形管的右侧端部。",
        "parts_used": [
          {
            "bom_seq": "4",
            "bom_name": "右挂件虚拟组件 1",
            "quantity": 1,
            "drawing_number": "4",
            "node_name": [
              "NAUO20",
              "NAUO19"
            ],
            "bom_code": "01.05.0018"
          }
        ],
        "tools": [
          "焊机",
          "卡尺"
        ],
        "warnings": [
          "确保左右挂件的对称性，测量两挂件中心距是否符合图纸要求。"
        ],
        "welding": {
          "required": true,
          "welding_type": "角焊",
          "welding_method": "CO2气保焊",
          "weld_size": "焊脚高度6mm，全焊",
          "welding_position": "零件④（右挂件）与零件⑧（矩形管）的连接处，可能涉及横焊或立焊",
          "quality_requirements": "焊缝连续、饱满，与左挂件的焊接质量要求一致。检查挂件的对称度和中心距。",
          "safety_notes": "焊接过程中注意控制热输入，避免零件变形。使用防火毯隔离周围易燃物。"
        },
        "safety_warnings": [
          "使用防火毯或挡板隔离焊接火花和飞溅，防止引燃周围物品",
          "焊接时注意控制热输入，避免零件变形，防止变形后矫正时发生机械伤害",
          "焊接完成后，及时清理焊渣和飞溅物，防止人员滑倒或被尖锐物刺伤"
        ]
      },
      {
        "step_number": 6,
        "action": "安装侧面矩形管",
        "description": "将图纸上标注为⑥的矩形管（01.01.03.2719，共2件）分别焊接到②号连接板和⑧号矩形管之间，位于组件的两侧，作为侧向支撑。",
        "position_description": "位于组件的左右两侧，连接②号连接板和⑧号矩形管。",
        "parts_used": [
          {
            "bom_seq": "6",
            "bom_name": "矩形管 2",
            "quantity": 2,
            "drawing_number": "6",
            "node_name": [
              "NAUO10",
              "NAUO9"
            ],
            "bom_code": "01.01.03.2719"
          }
        ],
        "tools": [
          "焊机",
          "磁力夹具"
        ],
        "warnings": [
          "确保⑥号矩形管与连接板和矩形管的接触面紧密贴合，焊接牢固。"
        ],
        "welding": {
          "required": true,
          "welding_type": "角焊",
          "welding_method": "CO2气保焊",
          "weld_size": "焊脚高度5mm，全焊",
          "welding_position": "零件⑥（侧面矩形管）与零件②（连接板）和零件⑧（矩形管）的连接处，主要为平焊和横焊",
          "quality_requirements": "焊缝连续，过渡平滑，无咬边、未焊透。焊接时采用分段退焊，控制整体变形。",
          "safety_notes": "焊接前检查坡口和装配间隙，确保符合工艺要求。注意焊枪角度，避免焊缝成形不良。"
        },
        "safety_warnings": [
          "使用磁力夹具固定零件时，确保夹具吸力足够，防止零件在焊接过程中脱落或位移伤人",
          "焊接时注意焊枪和电缆的布置，避免绊倒或电缆被高温烫伤绝缘层",
          "佩戴防护眼镜和手套，防止零件边缘毛刺或飞溅物造成切割伤或刺伤"
        ]
      },
      {
        "step_number": 7,
        "action": "安装封板",
        "description": "将图纸上标注为⑦的封板（01.01.01.16608，共2件）分别焊接到组件的左右两侧，覆盖在⑥号矩形管的外部。",
        "position_description": "覆盖在组件的左右两侧，与②号连接板和⑧号矩形管形成封闭结构。",
        "parts_used": [
          {
            "bom_seq": "7",
            "bom_name": "封板 2",
            "quantity": 2,
            "drawing_number": "7",
            "node_name": [
              "NAUO12",
              "NAUO11"
            ],
            "bom_code": "01.01.01.16608"
          }
        ],
        "tools": [
          "焊机",
          "压紧钳"
        ],
        "warnings": [
          "封板焊接时注意焊缝的连续性和美观性，确保无漏焊。"
        ],
        "welding": {
          "required": true,
          "welding_type": "角焊",
          "welding_method": "CO2气保焊",
          "weld_size": "焊脚高度4mm，全焊",
          "welding_position": "零件⑦（封板）与周围零件（②、⑥、⑧）的连接边缘，主要为平焊和横焊",
          "quality_requirements": "焊缝要求美观，连续性好，用于密封。焊后打磨飞溅，清理焊渣。",
          "safety_notes": "封板较薄，焊接电流不宜过大，防止烧穿。注意佩戴防尘口罩进行焊后清理工作。"
        },
        "safety_warnings": [
          "封板较薄，焊接电流过大易烧穿，可能造成烫伤或引燃周围物品",
          "焊后清理焊渣和打磨飞溅时，必须佩戴防尘口罩和防护眼镜，防止粉尘和飞溅物伤害呼吸道和眼睛",
          "使用压紧钳固定时，注意手指位置，防止夹伤"
        ]
      },
      {
        "step_number": 8,
        "action": "安装加强筋",
        "description": "将图纸上标注为⑨的加强筋（01.01.01.17678，共2件）分别焊接到组件内部，用于加强②号连接板与⑧号矩形管之间的连接强度。",
        "position_description": "位于组件内部，斜向连接②号连接板和⑧号矩形管。",
        "parts_used": [
          {
            "bom_seq": "9",
            "bom_name": "加强筋 2",
            "quantity": 2,
            "drawing_number": "9",
            "node_name": [
              "NAUO15",
              "NAUO14"
            ],
            "bom_code": "01.01.01.17678"
          }
        ],
        "tools": [
          "焊机",
          "角尺"
        ],
        "warnings": [
          "加强筋的焊接位置和角度必须符合图纸要求，确保受力均匀。"
        ],
        "welding": {
          "required": true,
          "welding_type": "角焊",
          "welding_method": "CO2气保焊",
          "weld_size": "焊脚高度6mm，全焊",
          "welding_position": "零件⑨（加强筋）与零件②（连接板）和零件⑧（矩形管）的连接面，主要为立焊和横焊",
          "quality_requirements": "焊缝必须达到二级焊缝标准，要求内部无缺陷。焊缝应力集中处应保证焊透。",
          "safety_notes": "加强筋焊接位置空间狭小，操作时注意姿势，防止烫伤。确保焊缝区域清洁，避免产生气孔。"
        },
        "safety_warnings": [
          "加强筋焊接位置空间狭小，操作时注意身体姿势，防止扭伤或碰撞受伤",
          "在狭小空间焊接时，确保通风设备正常运行，防止烟尘聚集",
          "使用长柄工具或夹具定位加强筋，避免手部直接接触高温区域造成烫伤"
        ]
      },
      {
        "step_number": 9,
        "action": "安装方形板",
        "description": "将图纸上标注为③的方形板-机加（01.01.01.6589，共4件）分别焊接到组件的四个角部，用于安装定位。",
        "position_description": "位于组件的四个角部，与矩形管端部齐平。",
        "parts_used": [
          {
            "bom_seq": "3",
            "bom_name": "方形板-机加 4",
            "quantity": 4,
            "drawing_number": "3",
            "node_name": [
              "NAUO6",
              "NAUO5",
              "NAUO4",
              "NAUO3"
            ],
            "bom_code": "01.01.01.6589"
          }
        ],
        "tools": [
          "焊机",
          "游标卡尺"
        ],
        "warnings": [
          "方形板为机加件，焊接时注意保护机加面，确保安装面平整度。"
        ],
        "welding": {
          "required": true,
          "welding_type": "角焊",
          "welding_method": "CO2气保焊",
          "weld_size": "焊脚高度5mm，全焊",
          "welding_position": "零件③（方形板）与矩形管端部的连接处，主要为平焊",
          "quality_requirements": "焊缝连续，焊后需对机加面附近的焊渣和飞溅进行彻底清理，确保安装面平整度要求。",
          "safety_notes": "焊接完成后，应让零件自然冷却，避免强制冷却导致机加件变形或产生裂纹。注意检查焊机电缆绝缘情况。"
        },
        "safety_warnings": [
          "方形板边缘可能锋利，搬运和定位时必须佩戴防割手套，防止割伤",
          "焊接完成后，清理机加面附近的飞溅物时，使用专用工具，并佩戴防护眼镜",
          "焊接设备必须定期检查，确保电缆和焊枪无破损，防止漏电触电"
        ]
      }
    ]
  }
}