{
  "agent_name": "Agent6_FAQ",
  "model": "google/gemini-2.5-flash-preview-09-2025",
  "timestamp": "20251104_143945",
  "image_count": 0,
  "temperature": 0.2,
  "system_prompt": "# 角色定位\n\n你是**李师傅**，一位拥有20年安全管理经验的高级安全工程师。\n\n## 教育背景\n\n- **学历**：安全工程专业本科\n- **职业资格**：注册安全工程师、高级安全评价师\n- **专业培训**：\n  - 机械制造安全管理\n  - 职业健康与安全管理体系（ISO 45001）\n  - 事故调查与分析\n  - 应急预案编制与演练\n\n## 职业背景\n\n- **工作经历**：20年机械制造企业安全管理经验，参与过大型装备制造、钢结构加工等项目\n- **专业领域**：\n  - 机械加工安全（车、铣、刨、磨、钻等）\n  - 焊接作业安全（电焊、气焊、氩弧焊等）\n  - 起重吊装安全（行车、叉车、吊索具等）\n  - 高空作业安全（脚手架、安全带、防坠落等）\n  - 个人防护用品管理（安全帽、防护眼镜、手套、安全鞋等）\n\n## 知识结构（详细）\n\n### 1. 机械伤害风险\n- **夹伤/挤伤**：手指、手臂被运动部件夹住\n- **切割伤**：锋利边缘、毛刺、切削工具\n- **碰撞伤**：头部碰撞、身体碰撞\n- **坠落伤**：零件坠落、工具坠落、人员坠落\n\n### 2. 焊接作业风险\n- **电击伤**：焊机漏电、接地不良\n- **弧光伤**：电弧紫外线灼伤眼睛和皮肤\n- **烫伤**：高温熔池、焊渣飞溅\n- **火灾爆炸**：易燃物引燃、气瓶泄漏\n- **有毒气体**：焊接烟尘、一氧化碳中毒\n\n### 3. 起重吊装风险\n- **吊物坠落**：吊索具断裂、捆绑不牢\n- **吊物摆动**：碰撞人员、设备\n- **超载**：超过起重机额定载荷\n- **指挥失误**：信号不清、违章指挥\n\n### 4. 高空作业风险\n- **人员坠落**：未系安全带、脚手架不牢\n- **物体打击**：工具、零件从高处坠落\n- **脚手架坍塌**：搭设不规范、超载\n\n### 5. 个人防护用品\n- **头部防护**：安全帽（防止碰撞、坠物打击）\n- **眼部防护**：防护眼镜、焊接面罩（防止飞溅、弧光）\n- **手部防护**：防护手套（防止切割、烫伤、化学品）\n- **足部防护**：安全鞋（防砸、防刺穿、防滑）\n- **呼吸防护**：防尘口罩、防毒面具（防止粉尘、有毒气体）\n\n### 6. 应急处理\n- **机械伤害**：立即停机、呼救、止血、固定、送医\n- **电击伤**：切断电源、心肺复苏、送医\n- **烫伤**：冷水冲洗、覆盖无菌纱布、送医\n- **火灾**：使用灭火器、疏散人员、报警\n\n## 任务步骤（Chain of Thought）\n\n你的任务是**为每个装配步骤添加安全警告**（如果该步骤有安全风险）。请按照以下5个步骤思考：\n\n### 步骤1：识别风险步骤\n- 分析每个装配步骤的操作内容\n- 判断是否涉及高风险作业（焊接、吊装、高空、重物搬运等）\n- 识别潜在的伤害类型（机械伤害、电击、烫伤、坠落等）\n\n### 步骤2：分析风险源\n- 确定风险的来源（设备、工具、材料、环境、人员操作等）\n- 评估风险的严重程度（轻微、中等、严重、致命）\n- 考虑风险的发生概率\n\n### 步骤3：制定预防措施\n- 针对每个风险源，制定具体的预防措施\n- 强调个人防护用品的使用\n- 强调安全操作规程的遵守\n\n### 步骤4：添加安全警告\n- 为每个有风险的步骤添加safety_warnings字段\n- 每条警告要简洁明了，说明具体的风险和预防措施\n- 使用工人能看懂的语言\n\n### 步骤5：验证完整性\n- 检查所有高风险步骤是否都添加了安全警告\n- 检查安全警告是否具体、可操作\n- 检查是否遗漏了任何潜在风险\n\n## 核心原则\n\n1. **步骤级嵌入**：为每个有风险的步骤添加safety_warnings字段，而不是单独列出安全警告\n2. **工人友好**：使用通俗语言，避免专业术语\n3. **具体可操作**：说明具体的风险和预防措施，而不是泛泛而谈\n4. **不重复显示**：安全警告只在下方\"安全\"标签页中统一显示，不在当前步骤详情中重复显示\n\n## 输出格式\n\n严格按照以下JSON格式输出（返回增强后的装配步骤）：\n\n```json\n{\n  \"enhanced_steps\": [\n    {\n      \"step_number\": 1,\n      \"title\": \"点焊定位\",\n      \"parts_used\": [...],\n      \"tools_required\": [...],\n      \"operation\": \"操作说明\",\n      \"quality_check\": \"质量检查\",\n      \"estimated_time_minutes\": 10,\n      \"welding\": {\n        \"required\": true,\n        \"welding_type\": \"点焊\",\n        \"welding_method\": \"CO2气保焊\",\n        ...\n      },\n      \"safety_warnings\": [\n        \"佩戴焊接面罩和防护手套，防止弧光灼伤眼睛和皮肤\",\n        \"确保工件夹紧牢固，防止点焊时位移造成伤害\",\n        \"焊接区域周围3米内不得有易燃物，配备灭火器\",\n        \"焊机必须接地良好，防止漏电触电\"\n      ]\n    },\n    {\n      \"step_number\": 2,\n      \"title\": \"螺栓连接\",\n      \"parts_used\": [...],\n      \"operation\": \"操作说明\",\n      \"quality_check\": \"质量检查\",\n      \"estimated_time_minutes\": 15,\n      \"safety_warnings\": [\n        \"佩戴安全帽和防护眼镜，防止零件坠落和飞溅\",\n        \"使用扭力扳手时注意力度，防止扳手滑脱伤人\"\n      ]\n    },\n    {\n      \"step_number\": 3,\n      \"title\": \"简单装配\",\n      \"parts_used\": [...],\n      \"operation\": \"操作说明\",\n      \"quality_check\": \"质量检查\",\n      \"estimated_time_minutes\": 5\n      // ⚠️ 如果没有明显安全风险，不添加safety_warnings字段\n    }\n  ]\n}\n```\n\n**⚠️ 关键要求**：\n\n1. **步骤级嵌入**：\n   - 为每个有风险的步骤添加`safety_warnings`字段\n   - 没有明显风险的步骤不添加`safety_warnings`字段\n   - 保持原有步骤的所有字段不变\n\n2. **安全警告要具体**：\n   - ✅ 说\"佩戴焊接面罩和防护手套，防止弧光灼伤眼睛和皮肤\"\n   - ❌ 不说\"注意安全\"\n   - ✅ 说\"焊接区域周围3米内不得有易燃物，配备灭火器\"\n   - ❌ 不说\"注意防火\"\n\n3. **使用通俗语言**：\n   - 工人能看懂的语言\n   - 避免专业术语和英文缩写\n\n4. **警告要全面**：\n   - 涵盖个人防护、设备安全、环境安全、操作安全\n   - 每条警告说明具体的风险和预防措施\n\n## 重要提醒\n\n- **只输出JSON，不要输出其他内容**\n- **保持原有字段不变**：不要修改或删除原有的字段（包括welding字段）\n- **警告要简洁明了**：每条警告一句话，说明风险和预防措施\n- **不要过度警告**：只针对有明显风险的步骤添加警告\n",
  "user_query": "请为以下装配步骤添加安全警告（如果有安全风险）。\n\n## 📸 视觉分析任务\n\n**你会看到工程图纸图片，请仔细观察：**\n\n1. **危险作业标识**：\n   - 图纸上的安全警告标识\n   - 特殊作业要求（如高空作业、吊装作业等）\n   - 危险区域标注\n\n2. **零件特征**：\n   - 重型零件（需要吊装）\n   - 锋利边缘（容易割伤）\n   - 高温部件（容易烫伤）\n\n3. **作业环境**：\n   - 狭窄空间（容易碰撞）\n   - 高空位置（容易坠落）\n   - 密闭空间（通风不良）\n\n## 装配步骤\n\n[\n  {\n    \"step_number\": 1,\n    \"action\": \"放置基准件并安装悬挂板\",\n    \"description\": \"将图纸上标注为3的方管-机加（01.02.03.0206）平稳放置在装配胎具上作为基准件。然后，将1号右悬挂臂板（01.02.01.3870）和2号左悬挂臂板（01.02.01.3871）分别对齐并放置在3号方管的两端，确保悬挂板的孔位与方管端面齐平。\",\n    \"position_description\": \"1号和2号零件分别位于3号方管的两端，与方管侧面齐平。\",\n    \"parts_used\": [\n      {\n        \"bom_seq\": \"3\",\n        \"bom_name\": \"方管-机加\",\n        \"quantity\": 1,\n        \"drawing_number\": \"3\",\n        \"node_name\": [\n          \"NAUO6\",\n          \"NAUO5\"\n        ],\n        \"bom_code\": \"01.01.4792\"\n      },\n      {\n        \"bom_seq\": \"1\",\n        \"bom_name\": \"右悬挂臂板\",\n        \"quantity\": 1,\n        \"drawing_number\": \"1\",\n        \"node_name\": [\n          \"NAUO2\",\n          \"NAUO1\"\n        ],\n        \"bom_code\": \"01.01.03.0692\"\n      },\n      {\n        \"bom_seq\": \"2\",\n        \"bom_name\": \"左悬挂臂板\",\n        \"quantity\": 1,\n        \"drawing_number\": \"2\",\n        \"node_name\": [\n          \"NAUO4\",\n          \"NAUO3\"\n        ],\n        \"bom_code\": \"01.01.03.0693\"\n      }\n    ],\n    \"tools\": [\n      \"行车/吊具\",\n      \"装配胎具\",\n      \"卡尺\"\n    ],\n    \"warnings\": [\n      \"吊装时注意安全，确保方管放置平稳。\",\n      \"悬挂臂板定位时，确保其垂直度符合图纸要求。\"\n    ]\n  },\n  {\n    \"step_number\": 2,\n    \"action\": \"点焊悬挂板\",\n    \"description\": \"使用CO2保护焊将1号右悬挂臂板和2号左悬挂臂板与3号方管进行点焊固定。点焊位置应均匀分布，确保后续满焊时零件不发生位移。\",\n    \"position_description\": \"焊缝位于1号和2号零件与3号方管的所有接触面上。\",\n    \"parts_used\": [],\n    \"tools\": [\n      \"CO2焊机\",\n      \"焊钳\",\n      \"防护用品\"\n    ],\n    \"warnings\": [\n      \"点焊强度要足够，防止零件在后续操作中松动。\",\n      \"注意焊接变形控制。\"\n    ],\n    \"welding\": {\n      \"required\": true,\n      \"welding_type\": \"角焊（定位焊）\",\n      \"welding_method\": \"CO2气保焊\",\n      \"weld_size\": \"点焊长度10-15mm，焊脚高度约3mm\",\n      \"welding_position\": \"1号、2号悬挂臂板与3号方管的四个接触面，平焊为主\",\n      \"quality_requirements\": \"点焊牢固，定位准确，焊点均匀分布，无明显飞溅\",\n      \"safety_notes\": \"佩戴焊接面罩、防护手套和防护服。确保工作区域通风良好，防止烟尘吸入。\"\n    }\n  },\n  {\n    \"step_number\": 3,\n    \"action\": \"安装内部支撑件\",\n    \"description\": \"将图纸上标注为4的角钢（01.02.04.0084）和5的方管-机加（01.02.03.0207）安装到3号方管的内部。4号角钢（数量5）应按照图纸尺寸定位，5号方管（数量2）应安装在3号方管的内部支撑位置。\",\n    \"position_description\": \"4号角钢和5号方管均安装在3号方管的内部，作为加强筋。\",\n    \"parts_used\": [\n      {\n        \"bom_seq\": \"4\",\n        \"bom_name\": \"角钢\",\n        \"quantity\": 5,\n        \"drawing_number\": \"4\",\n        \"node_name\": [\n          \"NAUO8\",\n          \"NAUO7\"\n        ],\n        \"bom_code\": \"01.02.01.3875\"\n      },\n      {\n        \"bom_seq\": \"5\",\n        \"bom_name\": \"方管-机加\",\n        \"quantity\": 2,\n        \"drawing_number\": \"5\",\n        \"node_name\": [\n          \"NAUO10\"\n        ],\n        \"bom_code\": \"01.02.02.0446\"\n      }\n    ],\n    \"tools\": [\n      \"卷尺\",\n      \"直角尺\",\n      \"CO2焊机\"\n    ],\n    \"warnings\": [\n      \"角钢和方管的定位尺寸必须精确，特别是与外部尺寸的相对位置。\"\n    ],\n    \"welding\": {\n      \"required\": true,\n      \"welding_type\": \"角焊（定位焊）\",\n      \"welding_method\": \"CO2气保焊\",\n      \"weld_size\": \"点焊长度10-15mm\",\n      \"welding_position\": \"4号角钢和5号方管与3号方管内壁的接触面，主要为平焊和横焊\",\n      \"quality_requirements\": \"定位准确，点焊牢固，确保内部支撑件不晃动\",\n      \"safety_notes\": \"由于在方管内部操作，需特别注意通风，防止烟雾聚集。确保焊机接地良好。\"\n    }\n  },\n  {\n    \"step_number\": 4,\n    \"action\": \"安装旋转弧板和固定套\",\n    \"description\": \"将图纸上标注为7的旋转弧板（01.02.01.3872，数量2）安装到3号方管的中部上方，确保其中心孔与方管上的预留孔对齐。然后，将8号固定套（01.02.05.0334，数量1）和9号轴套（01.02.02.0447，数量1）安装到7号旋转弧板的相应孔位上。\",\n    \"position_description\": \"7号旋转弧板安装在3号方管中部上方，8号固定套和9号轴套安装在7号旋转弧板的中心位置。\",\n    \"parts_used\": [\n      {\n        \"bom_seq\": \"7\",\n        \"bom_name\": \"旋转弧板\",\n        \"quantity\": 2,\n        \"drawing_number\": \"7\",\n        \"node_name\": [\n          \"NAUO12\"\n        ],\n        \"bom_code\": \"01.01.01.1590\"\n      },\n      {\n        \"bom_seq\": \"8\",\n        \"bom_name\": \"固定套\",\n        \"quantity\": 1,\n        \"drawing_number\": \"8\",\n        \"node_name\": [\n          \"NAUO15\",\n          \"NAUO13\"\n        ],\n        \"bom_code\": \"01.01.01.1593\"\n      },\n      {\n        \"bom_seq\": \"9\",\n        \"bom_name\": \"轴套\",\n        \"quantity\": 1,\n        \"drawing_number\": \"9\",\n        \"node_name\": [\n          \"NAUO14\"\n        ],\n        \"bom_code\": \"01.01.01.1591\"\n      }\n    ],\n    \"tools\": [\n      \"卡尺\",\n      \"CO2焊机\"\n    ],\n    \"warnings\": [\n      \"旋转弧板的安装位置是关键尺寸，必须严格按照图纸尺寸定位，特别是中心线位置。\"\n    ],\n    \"welding\": {\n      \"required\": true,\n      \"welding_type\": \"角焊和环形焊\",\n      \"welding_method\": \"CO2气保焊\",\n      \"weld_size\": \"7号板与3号方管角焊焊脚高度6mm；8号固定套与7号板环形焊焊脚高度4mm\",\n      \"welding_position\": \"7号板与3号方管连接处（平焊/横焊）；8号固定套与7号板连接处（平焊）\",\n      \"quality_requirements\": \"焊缝连续、饱满，特别是轴套和固定套的环形焊，要求焊透且无气孔，确保同心度。\",\n      \"safety_notes\": \"焊接前检查焊机电缆和气瓶压力。焊接轴套时，注意控制热量，防止轴套变形或烧穿。\"\n    }\n  },\n  {\n    \"step_number\": 5,\n    \"action\": \"安装方形板和中连接板\",\n    \"description\": \"将图纸上标注为6的方形板（01.01.01.4776，数量2）焊接到3号方管的指定位置。然后，将未标注的中连接板（01.02.01.3875，数量1）焊接到3号方管的内部或底部，作为加强连接。\",\n    \"position_description\": \"6号方形板位于3号方管的侧面或顶部。中连接板（BOM序号4）根据图纸未标注位置，应安装在3号方管中部，与7号旋转弧板区域配合。\",\n    \"parts_used\": [\n      {\n        \"bom_seq\": \"6\",\n        \"bom_name\": \"方形板\",\n        \"quantity\": 2,\n        \"drawing_number\": \"6\",\n        \"node_name\": [\n          \"NAUO11\"\n        ],\n        \"bom_code\": \"01.01.01.1589\"\n      },\n      {\n        \"bom_seq\": \"4\",\n        \"bom_name\": \"中连接板\",\n        \"quantity\": 1,\n        \"drawing_number\": \"未标注\",\n        \"node_name\": [\n          \"NAUO8\",\n          \"NAUO7\"\n        ],\n        \"bom_code\": \"01.02.01.3875\"\n      }\n    ],\n    \"tools\": [\n      \"CO2焊机\",\n      \"卷尺\"\n    ],\n    \"warnings\": [\n      \"方形板和中连接板的焊接必须牢固，焊缝高度和长度应符合技术要求。\"\n    ],\n    \"welding\": {\n      \"required\": true,\n      \"welding_type\": \"角焊\",\n      \"welding_method\": \"CO2气保焊\",\n      \"weld_size\": \"焊脚高度6mm，全周连续焊\",\n      \"welding_position\": \"6号方形板与3号方管的连接面，主要为平焊和横焊\",\n      \"quality_requirements\": \"焊缝外观平整，无咬边、未焊透等缺陷。焊后清理焊渣和飞溅。\",\n      \"safety_notes\": \"注意焊接电流和电压匹配，防止飞溅过多。操作时确保周围无油污或易燃物。\"\n    }\n  },\n  {\n    \"step_number\": 6,\n    \"action\": \"安装连接器板和上挂板\",\n    \"description\": \"安装未标注的左连接器板（01.01.01.1589，数量1）和右连接器板（01.01.01.1591，数量1）到组件的相应位置，并将其焊接到位。同时，将上挂板（01.01.01.1590，数量1）焊接到主框架的顶部。\",\n    \"position_description\": \"左连接器板和右连接器板安装在组件的两侧或端部，上挂板安装在组件顶部。\",\n    \"parts_used\": [\n      {\n        \"bom_seq\": \"6\",\n        \"bom_name\": \"左连接器板\",\n        \"quantity\": 1,\n        \"drawing_number\": \"未标注\",\n        \"node_name\": [\n          \"NAUO11\"\n        ],\n        \"bom_code\": \"01.01.01.1589\"\n      },\n      {\n        \"bom_seq\": \"9\",\n        \"bom_name\": \"右连接器板\",\n        \"quantity\": 1,\n        \"drawing_number\": \"未标注\",\n        \"node_name\": [\n          \"NAUO14\"\n        ],\n        \"bom_code\": \"01.01.01.1591\"\n      },\n      {\n        \"bom_seq\": \"7\",\n        \"bom_name\": \"上挂板\",\n        \"quantity\": 1,\n        \"drawing_number\": \"未标注\",\n        \"node_name\": [\n          \"NAUO12\"\n        ],\n        \"bom_code\": \"01.01.01.1590\"\n      }\n    ],\n    \"tools\": [\n      \"CO2焊机\",\n      \"直角尺\"\n    ],\n    \"warnings\": [\n      \"连接器板和上挂板的安装位置和角度必须精确，影响后续总装配。\"\n    ],\n    \"welding\": {\n      \"required\": true,\n      \"welding_type\": \"角焊\",\n      \"welding_method\": \"CO2气保焊\",\n      \"weld_size\": \"焊脚高度6mm，全周连续焊\",\n      \"welding_position\": \"连接器板与主框架的连接处，上挂板与主框架顶部的连接处，主要为平焊和横焊\",\n      \"quality_requirements\": \"焊缝必须连续，承载要求高，焊缝表面光滑，无裂纹。焊后需进行外观检查。\",\n      \"safety_notes\": \"高空或侧面焊接时，注意站稳，防止焊枪或身体接触高温表面。确保焊机处于良好工作状态。\"\n    }\n  },\n  {\n    \"step_number\": 7,\n    \"action\": \"安装加强板和防滑板\",\n    \"description\": \"安装未标注的三角板（01.01.01.1626，数量1）和方形板（01.01.01.3941，数量1）作为加强筋，焊接到主框架的薄弱部位。最后，将两块防滑板（01.01.01.0517，数量2）焊接到主框架的顶部或底部，用于防滑功能。\",\n    \"position_description\": \"三角板和方形板安装在结构连接处。防滑板安装在操作人员可能站立或接触的表面。\",\n    \"parts_used\": [\n      {\n        \"bom_seq\": \"10\",\n        \"bom_name\": \"三角板\",\n        \"quantity\": 1,\n        \"drawing_number\": \"未标注\",\n        \"node_name\": [\n          \"NAUO19\",\n          \"NAUO18\",\n          \"NAUO17\",\n          \"NAUO16\"\n        ],\n        \"bom_code\": \"01.01.01.1626\"\n      },\n      {\n        \"bom_seq\": \"11\",\n        \"bom_name\": \"方形板\",\n        \"quantity\": 1,\n        \"drawing_number\": \"未标注\",\n        \"node_name\": [\n          \"NAUO23\",\n          \"NAUO22\",\n          \"NAUO21\",\n          \"NAUO20\"\n        ],\n        \"bom_code\": \"01.01.01.3941\"\n      },\n      {\n        \"bom_seq\": \"12\",\n        \"bom_name\": \"防滑板\",\n        \"quantity\": 1,\n        \"drawing_number\": \"未标注\",\n        \"node_name\": [\n          \"NAUO25\",\n          \"NAUO24\"\n        ],\n        \"bom_code\": \"01.01.01.0517\"\n      },\n      {\n        \"bom_seq\": \"13\",\n        \"bom_name\": \"防滑板\",\n        \"quantity\": 1,\n        \"drawing_number\": \"未标注\",\n        \"node_name\": [\n          \"NAUO25\",\n          \"NAUO24\"\n        ],\n        \"bom_code\": \"01.01.01.0517\"\n      }\n    ],\n    \"tools\": [\n      \"CO2焊机\"\n    ],\n    \"warnings\": [\n      \"防滑板的焊接应确保表面平整，不影响防滑效果。\"\n    ],\n    \"welding\": {\n      \"required\": true,\n      \"welding_type\": \"角焊\",\n      \"welding_method\": \"CO2气保焊\",\n      \"weld_size\": \"加强板焊脚高度6mm；防滑板焊脚高度4mm（间断焊或连续焊，按图纸要求）\",\n      \"welding_position\": \"所有加强板与主框架的连接处，防滑板与主框架的连接处，位置多样（平焊、横焊）\",\n      \"quality_requirements\": \"加强板焊缝要求强度高，防滑板焊缝要求平整，避免尖锐焊瘤影响使用。\",\n      \"safety_notes\": \"焊接防滑板时，注意板材较薄，控制电流，防止烧穿。清理工作区域，防止绊倒。\"\n    }\n  },\n  {\n    \"step_number\": 8,\n    \"action\": \"满焊所有零件\",\n    \"description\": \"对所有已点焊的零件（包括1、2、4、5、6、7、8、9号零件以及所有加强板和连接板）进行满焊。焊缝尺寸和类型必须严格按照图纸技术要求执行。\",\n    \"position_description\": \"所有零件的接触面均需满焊。\",\n    \"parts_used\": [],\n    \"tools\": [\n      \"CO2焊机\",\n      \"焊渣锤\",\n      \"钢丝刷\"\n    ],\n    \"warnings\": [\n      \"焊接过程中注意控制热输入，防止主框架变形。\",\n      \"焊缝必须连续、饱满，无虚焊、漏焊等缺陷。\"\n    ],\n    \"welding\": {\n      \"required\": true,\n      \"welding_type\": \"角焊、环形焊\",\n      \"welding_method\": \"CO2气保焊\",\n      \"weld_size\": \"主要焊缝焊脚高度6mm，轴套/固定套焊脚高度4mm（具体尺寸参照图纸）\",\n      \"welding_position\": \"所有已定位零件的连接处，涉及平焊、横焊、立焊等多种位置\",\n      \"quality_requirements\": \"焊缝必须连续、饱满，焊后清渣，焊缝表面不得有气孔、夹渣、裂纹、未熔合等缺陷。关键承重焊缝需进行无损检测（如外观检查和磁粉检测）。\",\n      \"safety_notes\": \"进行大面积满焊时，应采取分段、对称焊接顺序，控制热变形。全程佩戴全套防护用品，并确保灭火器材在手边。\"\n    }\n  }\n]\n\n## 要求\n\n请按照以下5个步骤思考，为装配步骤添加安全警告：\n\n### 步骤1：识别风险步骤\n- 分析每个装配步骤的操作内容\n- 判断是否涉及高风险作业：\n  * **焊接作业**：电击、弧光、烫伤、火灾\n  * **吊装作业**：吊物坠落、碰撞、超载\n  * **高空作业**：人员坠落、物体打击\n  * **重物搬运**：砸伤、扭伤、夹伤\n  * **机械加工**：切割伤、夹伤、碰撞\n\n### 步骤2：分析风险源\n- 确定风险的来源（设备、工具、材料、环境、人员操作等）\n- 评估风险的严重程度（轻微、中等、严重、致命）\n- 考虑风险的发生概率\n\n### 步骤3：制定预防措施\n- 针对每个风险源，制定具体的预防措施\n- 强调个人防护用品的使用：\n  * **焊接**：焊接面罩、防护手套、防护服\n  * **吊装**：安全帽、安全鞋、手套\n  * **高空**：安全带、安全帽、防滑鞋\n  * **机械**：防护眼镜、手套、安全鞋\n\n### 步骤4：添加安全警告\n- 为每个有风险的步骤添加safety_warnings字段\n- 每条警告要简洁明了，说明具体的风险和预防措施\n- 使用工人能看懂的语言\n\n### 步骤5：验证完整性\n- 检查所有高风险步骤是否都添加了安全警告\n- 检查安全警告是否具体、可操作\n- 检查是否遗漏了任何潜在风险\n\n## ⚠️ 强制自检清单（生成后必须逐项检查）\n\n**在输出JSON之前，你必须完成以下验证：**\n\n1. **风险步骤识别验证**：\n   - [ ] 所有涉及焊接、吊装、高空、重物搬运的步骤都添加了safety_warnings字段\n   - [ ] 没有明显风险的步骤没有添加safety_warnings字段\n\n2. **安全警告完整性验证**：\n   - [ ] 每个safety_warnings字段都是字符串数组\n   - [ ] 每条警告都说明了具体的风险和预防措施\n   - [ ] 涵盖了个人防护、设备安全、环境安全、操作安全\n\n3. **语言通俗性验证**：\n   - [ ] 使用工人能看懂的语言\n   - [ ] 避免专业术语和英文缩写\n   - [ ] 每条警告简洁明了（一句话）\n\n4. **原有字段保持验证**：\n   - [ ] 原有步骤的所有字段都保持不变（包括welding字段）\n   - [ ] 没有修改或删除任何原有字段\n\n**如果自检发现任何问题，必须重新生成！**\n\n现在开始为装配步骤添加安全警告！\n",
  "raw_response": "```json\n{\n  \"enhanced_steps\": [\n    {\n      \"step_number\": 1,\n      \"action\": \"放置基准件并安装悬挂板\",\n      \"description\": \"将图纸上标注为3的方管-机加（01.02.03.0206）平稳放置在装配胎具上作为基准件。然后，将1号右悬挂臂板（01.02.01.3870）和2号左悬挂臂板（01.02.01.3871）分别对齐并放置在3号方管的两端，确保悬挂板的孔位与方管端面齐平。\",\n      \"position_description\": \"1号和2号零件分别位于3号方管的两端，与方管侧面齐平。\",\n      \"parts_used\": [\n        {\n          \"bom_seq\": \"3\",\n          \"bom_name\": \"方管-机加\",\n          \"quantity\": 1,\n          \"drawing_number\": \"3\",\n          \"node_name\": [\n            \"NAUO6\",\n            \"NAUO5\"\n          ],\n          \"bom_code\": \"01.01.4792\"\n        },\n        {\n          \"bom_seq\": \"1\",\n          \"bom_name\": \"右悬挂臂板\",\n          \"quantity\": 1,\n          \"drawing_number\": \"1\",\n          \"node_name\": [\n            \"NAUO2\",\n            \"NAUO1\"\n          ],\n          \"bom_code\": \"01.01.03.0692\"\n        },\n        {\n          \"bom_seq\": \"2\",\n          \"bom_name\": \"左悬挂臂板\",\n          \"quantity\": 1,\n          \"drawing_number\": \"2\",\n          \"node_name\": [\n            \"NAUO4\",\n            \"NAUO3\"\n          ],\n          \"bom_code\": \"01.01.03.0693\"\n        }\n      ],\n      \"tools\": [\n        \"行车/吊具\",\n        \"装配胎具\",\n        \"卡尺\"\n      ],\n      \"warnings\": [\n        \"吊装前检查吊索具是否完好，防止吊物坠落伤人\",\n        \"吊装重物时，必须佩戴安全帽和防护手套\",\n        \"方管和悬挂板可能有锋利毛刺，搬运时注意戴手套防止割伤\",\n        \"吊物就位时，人员应远离下方，防止挤伤或碰撞\"\n      ],\n      \"safety_warnings\": [\n        \"吊装前检查吊索具是否完好，防止吊物坠落伤人\",\n        \"吊装重物时，必须佩戴安全帽和防护手套\",\n        \"方管和悬挂板可能有锋利毛刺，搬运时注意戴手套防止割伤\",\n        \"吊物就位时，人员应远离下方，防止挤伤或碰撞\"\n      ]\n    },\n    {\n      \"step_number\": 2,\n      \"action\": \"点焊悬挂板\",\n      \"description\": \"使用CO2保护焊将1号右悬挂臂板和2号左悬挂臂板与3号方管进行点焊固定。点焊位置应均匀分布，确保后续满焊时零件不发生位移。\",\n      \"position_description\": \"焊缝位于1号和2号零件与3号方管的所有接触面上。\",\n      \"parts_used\": [],\n      \"tools\": [\n        \"CO2焊机\",\n        \"焊钳\",\n        \"防护用品\"\n      ],\n      \"warnings\": [\n        \"点焊强度要足够，防止零件在后续操作中松动。\",\n        \"注意焊接变形控制。\"\n      ],\n      \"welding\": {\n        \"required\": true,\n        \"welding_type\": \"角焊（定位焊）\",\n        \"welding_method\": \"CO2气保焊\",\n        \"weld_size\": \"点焊长度10-15mm，焊脚高度约3mm\",\n        \"welding_position\": \"1号、2号悬挂臂板与3号方管的四个接触面，平焊为主\",\n        \"quality_requirements\": \"点焊牢固，定位准确，焊点均匀分布，无明显飞溅\",\n        \"safety_notes\": \"佩戴焊接面罩、防护手套和防护服。确保工作区域通风良好，防止烟尘吸入。\"\n      },\n      \"safety_warnings\": [\n        \"必须佩戴焊接面罩、防护手套和防护服，防止弧光灼伤和烫伤\",\n        \"确保焊接区域通风良好，使用排烟设备，防止吸入有毒烟尘\",\n        \"检查焊机接地线是否牢固，防止触电事故\",\n        \"焊接区域周围3米内不得堆放易燃易爆物品，并配备灭火器\"\n      ]\n    },\n    {\n      \"step_number\": 3,\n      \"action\": \"安装内部支撑件\",\n      \"description\": \"将图纸上标注为4的角钢（01.02.04.0084）和5的方管-机加（01.02.03.0207）安装到3号方管的内部。4号角钢（数量5）应按照图纸尺寸定位，5号方管（数量2）应安装在3号方管的内部支撑位置。\",\n      \"position_description\": \"4号角钢和5号方管均安装在3号方管的内部，作为加强筋。\",\n      \"parts_used\": [\n        {\n          \"bom_seq\": \"4\",\n          \"bom_name\": \"角钢\",\n          \"quantity\": 5,\n          \"drawing_number\": \"4\",\n          \"node_name\": [\n            \"NAUO8\",\n            \"NAUO7\"\n          ],\n          \"bom_code\": \"01.02.01.3875\"\n        },\n        {\n          \"bom_seq\": \"5\",\n          \"bom_name\": \"方管-机加\",\n          \"quantity\": 2,\n          \"drawing_number\": \"5\",\n          \"node_name\": [\n            \"NAUO10\"\n          ],\n          \"bom_code\": \"01.02.02.0446\"\n        }\n      ],\n      \"tools\": [\n        \"卷尺\",\n        \"直角尺\",\n        \"CO2焊机\"\n      ],\n      \"warnings\": [\n        \"角钢和方管的定位尺寸必须精确，特别是与外部尺寸的相对位置。\"\n      ],\n      \"welding\": {\n        \"required\": true,\n        \"welding_type\": \"角焊（定位焊）\",\n        \"welding_method\": \"CO2气保焊\",\n        \"weld_size\": \"点焊长度10-15mm\",\n        \"welding_position\": \"4号角钢和5号方管与3号方管内壁的接触面，主要为平焊和横焊\",\n        \"quality_requirements\": \"定位准确，点焊牢固，确保内部支撑件不晃动\",\n        \"safety_notes\": \"由于在方管内部操作，需特别注意通风，防止烟雾聚集。确保焊机接地良好。\"\n      },\n      \"safety_warnings\": [\n        \"在方管内部焊接时，必须使用局部排风设备，防止烟雾聚集和中毒\",\n        \"佩戴防护眼镜和手套，防止搬运角钢和方管时被锋利边缘割伤\",\n        \"在狭窄空间操作时，注意身体姿势，防止扭伤或碰撞\",\n        \"确保焊枪电缆和气管不被挤压或磨损，防止漏电或漏气\"\n      ]\n    },\n    {\n      \"step_number\": 4,\n      \"action\": \"安装旋转弧板和固定套\",\n      \"description\": \"将图纸上标注为7的旋转弧板（01.02.01.3872，数量2）安装到3号方管的中部上方，确保其中心孔与方管上的预留孔对齐。然后，将8号固定套（01.02.05.0334，数量1）和9号轴套（01.02.02.0447，数量1）安装到7号旋转弧板的相应孔位上。\",\n      \"position_description\": \"7号旋转弧板安装在3号方管中部上方，8号固定套和9号轴套安装在7号旋转弧板的中心位置。\",\n      \"parts_used\": [\n        {\n          \"bom_seq\": \"7\",\n          \"bom_name\": \"旋转弧板\",\n          \"quantity\": 2,\n          \"drawing_number\": \"7\",\n          \"node_name\": [\n            \"NAUO12\"\n          ],\n          \"bom_code\": \"01.01.01.1590\"\n        },\n        {\n          \"bom_seq\": \"8\",\n          \"bom_name\": \"固定套\",\n          \"quantity\": 1,\n          \"drawing_number\": \"8\",\n          \"node_name\": [\n            \"NAUO15\",\n            \"NAUO13\"\n          ],\n          \"bom_code\": \"01.01.01.1593\"\n        },\n        {\n          \"bom_seq\": \"9\",\n          \"bom_name\": \"轴套\",\n          \"quantity\": 1,\n          \"drawing_number\": \"9\",\n          \"node_name\": [\n            \"NAUO14\"\n          ],\n          \"bom_code\": \"01.01.01.1591\"\n        }\n      ],\n      \"tools\": [\n        \"卡尺\",\n        \"CO2焊机\"\n      ],\n      \"warnings\": [\n        \"旋转弧板的安装位置是关键尺寸，必须严格按照图纸尺寸定位，特别是中心线位置。\"\n      ],\n      \"welding\": {\n        \"required\": true,\n        \"welding_type\": \"角焊和环形焊\",\n        \"welding_method\": \"CO2气保焊\",\n        \"weld_size\": \"7号板与3号方管角焊焊脚高度6mm；8号固定套与7号板环形焊焊脚高度4mm\",\n        \"welding_position\": \"7号板与3号方管连接处（平焊/横焊）；8号固定套与7号板连接处（平焊）\",\n        \"quality_requirements\": \"焊缝连续、饱满，特别是轴套和固定套的环形焊，要求焊透且无气孔，确保同心度。\",\n        \"safety_notes\": \"焊接前检查焊机电缆和气瓶压力。焊接轴套时，注意控制热量，防止轴套变形或烧穿。\"\n      },\n      \"safety_warnings\": [\n        \"进行环形焊时，注意焊渣飞溅方向，佩戴防护眼镜和面罩\",\n        \"焊接轴套等精密零件时，控制焊接电流，防止烧穿或过热烫伤\",\n        \"确保工件放置平稳，防止焊接过程中零件倾倒或位移\"\n      ]\n    },\n    {\n      \"step_number\": 5,\n      \"action\": \"安装方形板和中连接板\",\n      \"description\": \"将图纸上标注为6的方形板（01.01.01.4776，数量2）焊接到3号方管的指定位置。然后，将未标注的中连接板（01.02.01.3875，数量1）焊接到3号方管的内部或底部，作为加强连接。\",\n      \"position_description\": \"6号方形板位于3号方管的侧面或顶部。中连接板（BOM序号4）根据图纸未标注位置，应安装在3号方管中部，与7号旋转弧板区域配合。\",\n      \"parts_used\": [\n        {\n          \"bom_seq\": \"6\",\n          \"bom_name\": \"方形板\",\n          \"quantity\": 2,\n          \"drawing_number\": \"6\",\n          \"node_name\": [\n            \"NAUO11\"\n          ],\n          \"bom_code\": \"01.01.01.1589\"\n        },\n        {\n          \"bom_seq\": \"4\",\n          \"bom_name\": \"中连接板\",\n          \"quantity\": 1,\n          \"drawing_number\": \"未标注\",\n          \"node_name\": [\n            \"NAUO8\",\n            \"NAUO7\"\n          ],\n          \"bom_code\": \"01.02.01.3875\"\n        }\n      ],\n      \"tools\": [\n        \"CO2焊机\",\n        \"卷尺\"\n      ],\n      \"warnings\": [\n        \"方形板和中连接板的焊接必须牢固，焊缝高度和长度应符合技术要求。\"\n      ],\n      \"welding\": {\n        \"required\": true,\n        \"welding_type\": \"角焊\",\n        \"welding_method\": \"CO2气保焊\",\n        \"weld_size\": \"焊脚高度6mm，全周连续焊\",\n        \"welding_position\": \"6号方形板与3号方管的连接面，主要为平焊和横焊\",\n        \"quality_requirements\": \"焊缝外观平整，无咬边、未焊透等缺陷。焊后清理焊渣和飞溅。\",\n        \"safety_notes\": \"注意焊接电流和电压匹配，防止飞溅过多。操作时确保周围无油污或易燃物。\"\n      },\n      \"safety_warnings\": [\n        \"焊接前清理工件表面的油污和铁锈，防止产生有毒烟雾或影响焊接质量\",\n        \"注意焊接飞溅，佩戴防护面罩和防护服，防止烫伤\",\n        \"焊后清理焊渣时，使用防护眼镜，防止焊渣飞溅伤眼\"\n      ]\n    },\n    {\n      \"step_number\": 6,\n      \"action\": \"安装连接器板和上挂板\",\n      \"description\": \"安装未标注的左连接器板（01.01.01.1589，数量1）和右连接器板（01.01.01.1591，数量1）到组件的相应位置，并将其焊接到位。同时，将上挂板（01.01.01.1590，数量1）焊接到主框架的顶部。\",\n      \"position_description\": \"左连接器板和右连接器板安装在组件的两侧或端部，上挂板安装在组件顶部。\",\n      \"parts_used\": [\n        {\n          \"bom_seq\": \"6\",\n          \"bom_name\": \"左连接器板\",\n          \"quantity\": 1,\n          \"drawing_number\": \"未标注\",\n          \"node_name\": [\n            \"NAUO11\"\n          ],\n          \"bom_code\": \"01.01.01.1589\"\n        },\n        {\n          \"bom_seq\": \"9\",\n          \"bom_name\": \"右连接器板\",\n          \"quantity\": 1,\n          \"drawing_number\": \"未标注\",\n          \"node_name\": [\n            \"NAUO14\"\n          ],\n          \"bom_code\": \"01.01.01.1591\"\n        },\n        {\n          \"bom_seq\": \"7\",\n          \"bom_name\": \"上挂板\",\n          \"quantity\": 1,\n          \"drawing_number\": \"未标注\",\n          \"node_name\": [\n            \"NAUO12\"\n          ],\n          \"bom_code\": \"01.01.01.1590\"\n        }\n      ],\n      \"tools\": [\n        \"CO2焊机\",\n        \"直角尺\"\n      ],\n      \"warnings\": [\n        \"连接器板和上挂板的安装位置和角度必须精确，影响后续总装配。\"\n      ],\n      \"welding\": {\n        \"required\": true,\n        \"welding_type\": \"角焊\",\n        \"welding_method\": \"CO2气保焊\",\n        \"weld_size\": \"焊脚高度6mm，全周连续焊\",\n        \"welding_position\": \"连接器板与主框架的连接处，上挂板与主框架顶部的连接处，主要为平焊和横焊\",\n        \"quality_requirements\": \"焊缝必须连续，承载要求高，焊缝表面光滑，无裂纹。焊后需进行外观检查。\",\n        \"safety_notes\": \"高空或侧面焊接时，注意站稳，防止焊枪或身体接触高温表面。确保焊机处于良好工作状态。\"\n      },\n      \"safety_warnings\": [\n        \"进行侧面和顶部焊接时，注意站稳，防止因操作不稳导致摔倒\",\n        \"确保焊机电缆和气管布置合理，避免被绊倒或被重物压坏\",\n        \"焊接完成后，立即在焊缝处放置警示牌，防止他人接触高温焊缝被烫伤\"\n      ]\n    },\n    {\n      \"step_number\": 7,\n      \"action\": \"安装加强板和防滑板\",\n      \"description\": \"安装未标注的三角板（01.01.01.1626，数量1）和方形板（01.01.01.3941，数量1）作为加强筋，焊接到主框架的薄弱部位。最后，将两块防滑板（01.01.01.0517，数量2）焊接到主框架的顶部或底部，用于防滑功能。\",\n      \"position_description\": \"三角板和方形板安装在结构连接处。防滑板安装在操作人员可能站立或接触的表面。\",\n      \"parts_used\": [\n        {\n          \"bom_seq\": \"10\",\n          \"bom_name\": \"三角板\",\n          \"quantity\": 1,\n          \"drawing_number\": \"未标注\",\n          \"node_name\": [\n            \"NAUO19\",\n            \"NAUO18\",\n            \"NAUO17\",\n            \"NAUO16\"\n          ],\n          \"bom_code\": \"01.01.01.1626\"\n        },\n        {\n          \"bom_seq\": \"11\",\n          \"bom_name\": \"方形板\",\n          \"quantity\": 1,\n          \"drawing_number\": \"未标注\",\n          \"node_name\": [\n            \"NAUO23\",\n            \"NAUO22\",\n            \"NAUO21\",\n            \"NAUO20\"\n          ],\n          \"bom_code\": \"01.01.01.3941\"\n        },\n        {\n          \"bom_seq\": \"12\",\n          \"bom_name\": \"防滑板\",\n          \"quantity\": 1,\n          \"drawing_number\": \"未标注\",\n          \"node_name\": [\n            \"NAUO25\",\n            \"NAUO24\"\n          ],\n          \"bom_code\": \"01.01.01.0517\"\n        },\n        {\n          \"bom_seq\": \"13\",\n          \"bom_name\": \"防滑板\",\n          \"quantity\": 1,\n          \"drawing_number\": \"未标注\",\n          \"node_name\": [\n            \"NAUO25\",\n            \"NAUO24\"\n          ],\n          \"bom_code\": \"01.01.01.0517\"\n        }\n      ],\n      \"tools\": [\n        \"CO2焊机\"\n      ],\n      \"warnings\": [\n        \"防滑板的焊接应确保表面平整，不影响防滑效果。\"\n      ],\n      \"welding\": {\n        \"required\": true,\n        \"welding_type\": \"角焊\",\n        \"welding_method\": \"CO2气保焊\",\n        \"weld_size\": \"加强板焊脚高度6mm；防滑板焊脚高度4mm（间断焊或连续焊，按图纸要求）\",\n        \"welding_position\": \"所有加强板与主框架的连接处，防滑板与主框架的连接处，位置多样（平焊、横焊）\",\n        \"quality_requirements\": \"加强板焊缝要求强度高，防滑板焊缝要求平整，避免尖锐焊瘤影响使用。\",\n        \"safety_notes\": \"焊接防滑板时，注意板材较薄，控制电流，防止烧穿。清理工作区域，防止绊倒。\"\n      },\n      \"safety_warnings\": [\n        \"焊接防滑板时，控制电流防止板材烧穿，造成烫伤或损坏工件\",\n        \"加强板和防滑板边缘可能锋利，搬运和定位时必须戴防护手套\",\n        \"确保工作区域地面整洁，避免焊材、工具和电缆造成绊倒危险\"\n      ]\n    },\n    {\n      \"step_number\": 8,\n      \"action\": \"满焊所有零件\",\n      \"description\": \"对所有已点焊的零件（包括1、2、4、5、6、7、8、9号零件以及所有加强板和连接板）进行满焊。焊缝尺寸和类型必须严格按照图纸技术要求执行。\",\n      \"position_description\": \"所有零件的接触面均需满焊。\",\n      \"parts_used\": [],\n      \"tools\": [\n        \"CO2焊机\",\n        \"焊渣锤\",\n        \"钢丝刷\"\n      ],\n      \"warnings\": [\n        \"焊接过程中注意控制热输入，防止主框架变形。\",\n        \"焊缝必须连续、饱满，无虚焊、漏焊等缺陷。\"\n      ],\n      \"welding\": {\n        \"required\": true,\n        \"welding_type\": \"角焊、环形焊\",\n        \"welding_method\": \"CO2气保焊\",\n        \"weld_size\": \"主要焊缝焊脚高度6mm，轴套/固定套焊脚高度4mm（具体尺寸参照图纸）\",\n        \"welding_position\": \"所有已定位零件的连接处，涉及平焊、横焊、立焊等多种位置\",\n        \"quality_requirements\": \"焊缝必须连续、饱满，焊后清渣，焊缝表面不得有气孔、夹渣、裂纹、未熔合等缺陷。关键承重焊缝需进行无损检测（如外观检查和磁粉检测）。\",\n        \"safety_notes\": \"进行大面积满焊时，应采取分段、对称焊接顺序，控制热变形。全程佩戴全套防护用品，并确保灭火器材在手边。\"\n      },\n      \"safety_warnings\": [\n        \"进行大面积满焊时，必须全程佩戴全套焊接防护用品（面罩、手套、防护服）\",\n        \"采用分段、对称焊接，防止工件因热应力集中而严重变形或开裂\",\n        \"清理焊渣和飞溅时，必须佩戴防护眼镜，防止高速飞溅物伤眼\",\n        \"确保工作区域通风良好，防止长时间焊接产生的烟尘危害健康\",\n        \"检查所有焊机电缆绝缘层，防止因大电流长时间工作导致电缆发热或漏电\"\n      ]\n    }\n  ]\n}\n```",
  "parsed_result": {
    "enhanced_steps": [
      {
        "step_number": 1,
        "action": "放置基准件并安装悬挂板",
        "description": "将图纸上标注为3的方管-机加（01.02.03.0206）平稳放置在装配胎具上作为基准件。然后，将1号右悬挂臂板（01.02.01.3870）和2号左悬挂臂板（01.02.01.3871）分别对齐并放置在3号方管的两端，确保悬挂板的孔位与方管端面齐平。",
        "position_description": "1号和2号零件分别位于3号方管的两端，与方管侧面齐平。",
        "parts_used": [
          {
            "bom_seq": "3",
            "bom_name": "方管-机加",
            "quantity": 1,
            "drawing_number": "3",
            "node_name": [
              "NAUO6",
              "NAUO5"
            ],
            "bom_code": "01.01.4792"
          },
          {
            "bom_seq": "1",
            "bom_name": "右悬挂臂板",
            "quantity": 1,
            "drawing_number": "1",
            "node_name": [
              "NAUO2",
              "NAUO1"
            ],
            "bom_code": "01.01.03.0692"
          },
          {
            "bom_seq": "2",
            "bom_name": "左悬挂臂板",
            "quantity": 1,
            "drawing_number": "2",
            "node_name": [
              "NAUO4",
              "NAUO3"
            ],
            "bom_code": "01.01.03.0693"
          }
        ],
        "tools": [
          "行车/吊具",
          "装配胎具",
          "卡尺"
        ],
        "warnings": [
          "吊装前检查吊索具是否完好，防止吊物坠落伤人",
          "吊装重物时，必须佩戴安全帽和防护手套",
          "方管和悬挂板可能有锋利毛刺，搬运时注意戴手套防止割伤",
          "吊物就位时，人员应远离下方，防止挤伤或碰撞"
        ],
        "safety_warnings": [
          "吊装前检查吊索具是否完好，防止吊物坠落伤人",
          "吊装重物时，必须佩戴安全帽和防护手套",
          "方管和悬挂板可能有锋利毛刺，搬运时注意戴手套防止割伤",
          "吊物就位时，人员应远离下方，防止挤伤或碰撞"
        ]
      },
      {
        "step_number": 2,
        "action": "点焊悬挂板",
        "description": "使用CO2保护焊将1号右悬挂臂板和2号左悬挂臂板与3号方管进行点焊固定。点焊位置应均匀分布，确保后续满焊时零件不发生位移。",
        "position_description": "焊缝位于1号和2号零件与3号方管的所有接触面上。",
        "parts_used": [],
        "tools": [
          "CO2焊机",
          "焊钳",
          "防护用品"
        ],
        "warnings": [
          "点焊强度要足够，防止零件在后续操作中松动。",
          "注意焊接变形控制。"
        ],
        "welding": {
          "required": true,
          "welding_type": "角焊（定位焊）",
          "welding_method": "CO2气保焊",
          "weld_size": "点焊长度10-15mm，焊脚高度约3mm",
          "welding_position": "1号、2号悬挂臂板与3号方管的四个接触面，平焊为主",
          "quality_requirements": "点焊牢固，定位准确，焊点均匀分布，无明显飞溅",
          "safety_notes": "佩戴焊接面罩、防护手套和防护服。确保工作区域通风良好，防止烟尘吸入。"
        },
        "safety_warnings": [
          "必须佩戴焊接面罩、防护手套和防护服，防止弧光灼伤和烫伤",
          "确保焊接区域通风良好，使用排烟设备，防止吸入有毒烟尘",
          "检查焊机接地线是否牢固，防止触电事故",
          "焊接区域周围3米内不得堆放易燃易爆物品，并配备灭火器"
        ]
      },
      {
        "step_number": 3,
        "action": "安装内部支撑件",
        "description": "将图纸上标注为4的角钢（01.02.04.0084）和5的方管-机加（01.02.03.0207）安装到3号方管的内部。4号角钢（数量5）应按照图纸尺寸定位，5号方管（数量2）应安装在3号方管的内部支撑位置。",
        "position_description": "4号角钢和5号方管均安装在3号方管的内部，作为加强筋。",
        "parts_used": [
          {
            "bom_seq": "4",
            "bom_name": "角钢",
            "quantity": 5,
            "drawing_number": "4",
            "node_name": [
              "NAUO8",
              "NAUO7"
            ],
            "bom_code": "01.02.01.3875"
          },
          {
            "bom_seq": "5",
            "bom_name": "方管-机加",
            "quantity": 2,
            "drawing_number": "5",
            "node_name": [
              "NAUO10"
            ],
            "bom_code": "01.02.02.0446"
          }
        ],
        "tools": [
          "卷尺",
          "直角尺",
          "CO2焊机"
        ],
        "warnings": [
          "角钢和方管的定位尺寸必须精确，特别是与外部尺寸的相对位置。"
        ],
        "welding": {
          "required": true,
          "welding_type": "角焊（定位焊）",
          "welding_method": "CO2气保焊",
          "weld_size": "点焊长度10-15mm",
          "welding_position": "4号角钢和5号方管与3号方管内壁的接触面，主要为平焊和横焊",
          "quality_requirements": "定位准确，点焊牢固，确保内部支撑件不晃动",
          "safety_notes": "由于在方管内部操作，需特别注意通风，防止烟雾聚集。确保焊机接地良好。"
        },
        "safety_warnings": [
          "在方管内部焊接时，必须使用局部排风设备，防止烟雾聚集和中毒",
          "佩戴防护眼镜和手套，防止搬运角钢和方管时被锋利边缘割伤",
          "在狭窄空间操作时，注意身体姿势，防止扭伤或碰撞",
          "确保焊枪电缆和气管不被挤压或磨损，防止漏电或漏气"
        ]
      },
      {
        "step_number": 4,
        "action": "安装旋转弧板和固定套",
        "description": "将图纸上标注为7的旋转弧板（01.02.01.3872，数量2）安装到3号方管的中部上方，确保其中心孔与方管上的预留孔对齐。然后，将8号固定套（01.02.05.0334，数量1）和9号轴套（01.02.02.0447，数量1）安装到7号旋转弧板的相应孔位上。",
        "position_description": "7号旋转弧板安装在3号方管中部上方，8号固定套和9号轴套安装在7号旋转弧板的中心位置。",
        "parts_used": [
          {
            "bom_seq": "7",
            "bom_name": "旋转弧板",
            "quantity": 2,
            "drawing_number": "7",
            "node_name": [
              "NAUO12"
            ],
            "bom_code": "01.01.01.1590"
          },
          {
            "bom_seq": "8",
            "bom_name": "固定套",
            "quantity": 1,
            "drawing_number": "8",
            "node_name": [
              "NAUO15",
              "NAUO13"
            ],
            "bom_code": "01.01.01.1593"
          },
          {
            "bom_seq": "9",
            "bom_name": "轴套",
            "quantity": 1,
            "drawing_number": "9",
            "node_name": [
              "NAUO14"
            ],
            "bom_code": "01.01.01.1591"
          }
        ],
        "tools": [
          "卡尺",
          "CO2焊机"
        ],
        "warnings": [
          "旋转弧板的安装位置是关键尺寸，必须严格按照图纸尺寸定位，特别是中心线位置。"
        ],
        "welding": {
          "required": true,
          "welding_type": "角焊和环形焊",
          "welding_method": "CO2气保焊",
          "weld_size": "7号板与3号方管角焊焊脚高度6mm；8号固定套与7号板环形焊焊脚高度4mm",
          "welding_position": "7号板与3号方管连接处（平焊/横焊）；8号固定套与7号板连接处（平焊）",
          "quality_requirements": "焊缝连续、饱满，特别是轴套和固定套的环形焊，要求焊透且无气孔，确保同心度。",
          "safety_notes": "焊接前检查焊机电缆和气瓶压力。焊接轴套时，注意控制热量，防止轴套变形或烧穿。"
        },
        "safety_warnings": [
          "进行环形焊时，注意焊渣飞溅方向，佩戴防护眼镜和面罩",
          "焊接轴套等精密零件时，控制焊接电流，防止烧穿或过热烫伤",
          "确保工件放置平稳，防止焊接过程中零件倾倒或位移"
        ]
      },
      {
        "step_number": 5,
        "action": "安装方形板和中连接板",
        "description": "将图纸上标注为6的方形板（01.01.01.4776，数量2）焊接到3号方管的指定位置。然后，将未标注的中连接板（01.02.01.3875，数量1）焊接到3号方管的内部或底部，作为加强连接。",
        "position_description": "6号方形板位于3号方管的侧面或顶部。中连接板（BOM序号4）根据图纸未标注位置，应安装在3号方管中部，与7号旋转弧板区域配合。",
        "parts_used": [
          {
            "bom_seq": "6",
            "bom_name": "方形板",
            "quantity": 2,
            "drawing_number": "6",
            "node_name": [
              "NAUO11"
            ],
            "bom_code": "01.01.01.1589"
          },
          {
            "bom_seq": "4",
            "bom_name": "中连接板",
            "quantity": 1,
            "drawing_number": "未标注",
            "node_name": [
              "NAUO8",
              "NAUO7"
            ],
            "bom_code": "01.02.01.3875"
          }
        ],
        "tools": [
          "CO2焊机",
          "卷尺"
        ],
        "warnings": [
          "方形板和中连接板的焊接必须牢固，焊缝高度和长度应符合技术要求。"
        ],
        "welding": {
          "required": true,
          "welding_type": "角焊",
          "welding_method": "CO2气保焊",
          "weld_size": "焊脚高度6mm，全周连续焊",
          "welding_position": "6号方形板与3号方管的连接面，主要为平焊和横焊",
          "quality_requirements": "焊缝外观平整，无咬边、未焊透等缺陷。焊后清理焊渣和飞溅。",
          "safety_notes": "注意焊接电流和电压匹配，防止飞溅过多。操作时确保周围无油污或易燃物。"
        },
        "safety_warnings": [
          "焊接前清理工件表面的油污和铁锈，防止产生有毒烟雾或影响焊接质量",
          "注意焊接飞溅，佩戴防护面罩和防护服，防止烫伤",
          "焊后清理焊渣时，使用防护眼镜，防止焊渣飞溅伤眼"
        ]
      },
      {
        "step_number": 6,
        "action": "安装连接器板和上挂板",
        "description": "安装未标注的左连接器板（01.01.01.1589，数量1）和右连接器板（01.01.01.1591，数量1）到组件的相应位置，并将其焊接到位。同时，将上挂板（01.01.01.1590，数量1）焊接到主框架的顶部。",
        "position_description": "左连接器板和右连接器板安装在组件的两侧或端部，上挂板安装在组件顶部。",
        "parts_used": [
          {
            "bom_seq": "6",
            "bom_name": "左连接器板",
            "quantity": 1,
            "drawing_number": "未标注",
            "node_name": [
              "NAUO11"
            ],
            "bom_code": "01.01.01.1589"
          },
          {
            "bom_seq": "9",
            "bom_name": "右连接器板",
            "quantity": 1,
            "drawing_number": "未标注",
            "node_name": [
              "NAUO14"
            ],
            "bom_code": "01.01.01.1591"
          },
          {
            "bom_seq": "7",
            "bom_name": "上挂板",
            "quantity": 1,
            "drawing_number": "未标注",
            "node_name": [
              "NAUO12"
            ],
            "bom_code": "01.01.01.1590"
          }
        ],
        "tools": [
          "CO2焊机",
          "直角尺"
        ],
        "warnings": [
          "连接器板和上挂板的安装位置和角度必须精确，影响后续总装配。"
        ],
        "welding": {
          "required": true,
          "welding_type": "角焊",
          "welding_method": "CO2气保焊",
          "weld_size": "焊脚高度6mm，全周连续焊",
          "welding_position": "连接器板与主框架的连接处，上挂板与主框架顶部的连接处，主要为平焊和横焊",
          "quality_requirements": "焊缝必须连续，承载要求高，焊缝表面光滑，无裂纹。焊后需进行外观检查。",
          "safety_notes": "高空或侧面焊接时，注意站稳，防止焊枪或身体接触高温表面。确保焊机处于良好工作状态。"
        },
        "safety_warnings": [
          "进行侧面和顶部焊接时，注意站稳，防止因操作不稳导致摔倒",
          "确保焊机电缆和气管布置合理，避免被绊倒或被重物压坏",
          "焊接完成后，立即在焊缝处放置警示牌，防止他人接触高温焊缝被烫伤"
        ]
      },
      {
        "step_number": 7,
        "action": "安装加强板和防滑板",
        "description": "安装未标注的三角板（01.01.01.1626，数量1）和方形板（01.01.01.3941，数量1）作为加强筋，焊接到主框架的薄弱部位。最后，将两块防滑板（01.01.01.0517，数量2）焊接到主框架的顶部或底部，用于防滑功能。",
        "position_description": "三角板和方形板安装在结构连接处。防滑板安装在操作人员可能站立或接触的表面。",
        "parts_used": [
          {
            "bom_seq": "10",
            "bom_name": "三角板",
            "quantity": 1,
            "drawing_number": "未标注",
            "node_name": [
              "NAUO19",
              "NAUO18",
              "NAUO17",
              "NAUO16"
            ],
            "bom_code": "01.01.01.1626"
          },
          {
            "bom_seq": "11",
            "bom_name": "方形板",
            "quantity": 1,
            "drawing_number": "未标注",
            "node_name": [
              "NAUO23",
              "NAUO22",
              "NAUO21",
              "NAUO20"
            ],
            "bom_code": "01.01.01.3941"
          },
          {
            "bom_seq": "12",
            "bom_name": "防滑板",
            "quantity": 1,
            "drawing_number": "未标注",
            "node_name": [
              "NAUO25",
              "NAUO24"
            ],
            "bom_code": "01.01.01.0517"
          },
          {
            "bom_seq": "13",
            "bom_name": "防滑板",
            "quantity": 1,
            "drawing_number": "未标注",
            "node_name": [
              "NAUO25",
              "NAUO24"
            ],
            "bom_code": "01.01.01.0517"
          }
        ],
        "tools": [
          "CO2焊机"
        ],
        "warnings": [
          "防滑板的焊接应确保表面平整，不影响防滑效果。"
        ],
        "welding": {
          "required": true,
          "welding_type": "角焊",
          "welding_method": "CO2气保焊",
          "weld_size": "加强板焊脚高度6mm；防滑板焊脚高度4mm（间断焊或连续焊，按图纸要求）",
          "welding_position": "所有加强板与主框架的连接处，防滑板与主框架的连接处，位置多样（平焊、横焊）",
          "quality_requirements": "加强板焊缝要求强度高，防滑板焊缝要求平整，避免尖锐焊瘤影响使用。",
          "safety_notes": "焊接防滑板时，注意板材较薄，控制电流，防止烧穿。清理工作区域，防止绊倒。"
        },
        "safety_warnings": [
          "焊接防滑板时，控制电流防止板材烧穿，造成烫伤或损坏工件",
          "加强板和防滑板边缘可能锋利，搬运和定位时必须戴防护手套",
          "确保工作区域地面整洁，避免焊材、工具和电缆造成绊倒危险"
        ]
      },
      {
        "step_number": 8,
        "action": "满焊所有零件",
        "description": "对所有已点焊的零件（包括1、2、4、5、6、7、8、9号零件以及所有加强板和连接板）进行满焊。焊缝尺寸和类型必须严格按照图纸技术要求执行。",
        "position_description": "所有零件的接触面均需满焊。",
        "parts_used": [],
        "tools": [
          "CO2焊机",
          "焊渣锤",
          "钢丝刷"
        ],
        "warnings": [
          "焊接过程中注意控制热输入，防止主框架变形。",
          "焊缝必须连续、饱满，无虚焊、漏焊等缺陷。"
        ],
        "welding": {
          "required": true,
          "welding_type": "角焊、环形焊",
          "welding_method": "CO2气保焊",
          "weld_size": "主要焊缝焊脚高度6mm，轴套/固定套焊脚高度4mm（具体尺寸参照图纸）",
          "welding_position": "所有已定位零件的连接处，涉及平焊、横焊、立焊等多种位置",
          "quality_requirements": "焊缝必须连续、饱满，焊后清渣，焊缝表面不得有气孔、夹渣、裂纹、未熔合等缺陷。关键承重焊缝需进行无损检测（如外观检查和磁粉检测）。",
          "safety_notes": "进行大面积满焊时，应采取分段、对称焊接顺序，控制热变形。全程佩戴全套防护用品，并确保灭火器材在手边。"
        },
        "safety_warnings": [
          "进行大面积满焊时，必须全程佩戴全套焊接防护用品（面罩、手套、防护服）",
          "采用分段、对称焊接，防止工件因热应力集中而严重变形或开裂",
          "清理焊渣和飞溅时，必须佩戴防护眼镜，防止高速飞溅物伤眼",
          "确保工作区域通风良好，防止长时间焊接产生的烟尘危害健康",
          "检查所有焊机电缆绝缘层，防止因大电流长时间工作导致电缆发热或漏电"
        ]
      }
    ]
  }
}