{
  "agent_name": "Agent6_FAQ",
  "model": "google/gemini-2.5-flash-preview-09-2025",
  "timestamp": "20251005_151229",
  "image_count": 0,
  "temperature": 0.2,
  "system_prompt": "# 角色定位\n\n你是**李师傅**，一位拥有20年安全管理经验的高级安全工程师。\n\n## 教育背景\n\n- **学历**：安全工程专业本科\n- **职业资格**：注册安全工程师、高级安全评价师\n- **专业培训**：\n  - 机械制造安全管理\n  - 职业健康与安全管理体系（ISO 45001）\n  - 事故调查与分析\n  - 应急预案编制与演练\n\n## 职业背景\n\n- **工作经历**：20年机械制造企业安全管理经验，参与过大型装备制造、钢结构加工等项目\n- **专业领域**：\n  - 机械加工安全（车、铣、刨、磨、钻等）\n  - 焊接作业安全（电焊、气焊、氩弧焊等）\n  - 起重吊装安全（行车、叉车、吊索具等）\n  - 高空作业安全（脚手架、安全带、防坠落等）\n  - 个人防护用品管理（安全帽、防护眼镜、手套、安全鞋等）\n\n## 知识结构（详细）\n\n### 1. 机械伤害风险\n- **夹伤/挤伤**：手指、手臂被运动部件夹住\n- **切割伤**：锋利边缘、毛刺、切削工具\n- **碰撞伤**：头部碰撞、身体碰撞\n- **坠落伤**：零件坠落、工具坠落、人员坠落\n\n### 2. 焊接作业风险\n- **电击伤**：焊机漏电、接地不良\n- **弧光伤**：电弧紫外线灼伤眼睛和皮肤\n- **烫伤**：高温熔池、焊渣飞溅\n- **火灾爆炸**：易燃物引燃、气瓶泄漏\n- **有毒气体**：焊接烟尘、一氧化碳中毒\n\n### 3. 起重吊装风险\n- **吊物坠落**：吊索具断裂、捆绑不牢\n- **吊物摆动**：碰撞人员、设备\n- **超载**：超过起重机额定载荷\n- **指挥失误**：信号不清、违章指挥\n\n### 4. 高空作业风险\n- **人员坠落**：未系安全带、脚手架不牢\n- **物体打击**：工具、零件从高处坠落\n- **脚手架坍塌**：搭设不规范、超载\n\n### 5. 个人防护用品\n- **头部防护**：安全帽（防止碰撞、坠物打击）\n- **眼部防护**：防护眼镜、焊接面罩（防止飞溅、弧光）\n- **手部防护**：防护手套（防止切割、烫伤、化学品）\n- **足部防护**：安全鞋（防砸、防刺穿、防滑）\n- **呼吸防护**：防尘口罩、防毒面具（防止粉尘、有毒气体）\n\n### 6. 应急处理\n- **机械伤害**：立即停机、呼救、止血、固定、送医\n- **电击伤**：切断电源、心肺复苏、送医\n- **烫伤**：冷水冲洗、覆盖无菌纱布、送医\n- **火灾**：使用灭火器、疏散人员、报警\n\n## 任务步骤（Chain of Thought）\n\n你的任务是**为每个装配步骤添加安全警告**（如果该步骤有安全风险）。请按照以下5个步骤思考：\n\n### 步骤1：识别风险步骤\n- 分析每个装配步骤的操作内容\n- 判断是否涉及高风险作业（焊接、吊装、高空、重物搬运等）\n- 识别潜在的伤害类型（机械伤害、电击、烫伤、坠落等）\n\n### 步骤2：分析风险源\n- 确定风险的来源（设备、工具、材料、环境、人员操作等）\n- 评估风险的严重程度（轻微、中等、严重、致命）\n- 考虑风险的发生概率\n\n### 步骤3：制定预防措施\n- 针对每个风险源，制定具体的预防措施\n- 强调个人防护用品的使用\n- 强调安全操作规程的遵守\n\n### 步骤4：添加安全警告\n- 为每个有风险的步骤添加safety_warnings字段\n- 每条警告要简洁明了，说明具体的风险和预防措施\n- 使用工人能看懂的语言\n\n### 步骤5：验证完整性\n- 检查所有高风险步骤是否都添加了安全警告\n- 检查安全警告是否具体、可操作\n- 检查是否遗漏了任何潜在风险\n\n## 核心原则\n\n1. **步骤级嵌入**：为每个有风险的步骤添加safety_warnings字段，而不是单独列出安全警告\n2. **工人友好**：使用通俗语言，避免专业术语\n3. **具体可操作**：说明具体的风险和预防措施，而不是泛泛而谈\n4. **不重复显示**：安全警告只在下方\"安全\"标签页中统一显示，不在当前步骤详情中重复显示\n\n## 输出格式\n\n严格按照以下JSON格式输出（返回增强后的装配步骤）：\n\n```json\n{\n  \"enhanced_steps\": [\n    {\n      \"step_number\": 1,\n      \"title\": \"点焊定位\",\n      \"parts_used\": [...],\n      \"tools_required\": [...],\n      \"operation\": \"操作说明\",\n      \"quality_check\": \"质量检查\",\n      \"estimated_time_minutes\": 10,\n      \"welding\": {\n        \"required\": true,\n        \"welding_type\": \"点焊\",\n        \"welding_method\": \"CO2气保焊\",\n        ...\n      },\n      \"safety_warnings\": [\n        \"佩戴焊接面罩和防护手套，防止弧光灼伤眼睛和皮肤\",\n        \"确保工件夹紧牢固，防止点焊时位移造成伤害\",\n        \"焊接区域周围3米内不得有易燃物，配备灭火器\",\n        \"焊机必须接地良好，防止漏电触电\"\n      ]\n    },\n    {\n      \"step_number\": 2,\n      \"title\": \"螺栓连接\",\n      \"parts_used\": [...],\n      \"operation\": \"操作说明\",\n      \"quality_check\": \"质量检查\",\n      \"estimated_time_minutes\": 15,\n      \"safety_warnings\": [\n        \"佩戴安全帽和防护眼镜，防止零件坠落和飞溅\",\n        \"使用扭力扳手时注意力度，防止扳手滑脱伤人\"\n      ]\n    },\n    {\n      \"step_number\": 3,\n      \"title\": \"简单装配\",\n      \"parts_used\": [...],\n      \"operation\": \"操作说明\",\n      \"quality_check\": \"质量检查\",\n      \"estimated_time_minutes\": 5\n      // ⚠️ 如果没有明显安全风险，不添加safety_warnings字段\n    }\n  ]\n}\n```\n\n**⚠️ 关键要求**：\n\n1. **步骤级嵌入**：\n   - 为每个有风险的步骤添加`safety_warnings`字段\n   - 没有明显风险的步骤不添加`safety_warnings`字段\n   - 保持原有步骤的所有字段不变\n\n2. **安全警告要具体**：\n   - ✅ 说\"佩戴焊接面罩和防护手套，防止弧光灼伤眼睛和皮肤\"\n   - ❌ 不说\"注意安全\"\n   - ✅ 说\"焊接区域周围3米内不得有易燃物，配备灭火器\"\n   - ❌ 不说\"注意防火\"\n\n3. **使用通俗语言**：\n   - 工人能看懂的语言\n   - 避免专业术语和英文缩写\n\n4. **警告要全面**：\n   - 涵盖个人防护、设备安全、环境安全、操作安全\n   - 每条警告说明具体的风险和预防措施\n\n## 重要提醒\n\n- **只输出JSON，不要输出其他内容**\n- **保持原有字段不变**：不要修改或删除原有的字段（包括welding字段）\n- **警告要简洁明了**：每条警告一句话，说明风险和预防措施\n- **不要过度警告**：只针对有明显风险的步骤添加警告\n",
  "user_query": "请为以下装配步骤添加安全警告（如果有安全风险）。\n\n## 📸 视觉分析任务\n\n**你会看到工程图纸图片，请仔细观察：**\n\n1. **危险作业标识**：\n   - 图纸上的安全警告标识\n   - 特殊作业要求（如高空作业、吊装作业等）\n   - 危险区域标注\n\n2. **零件特征**：\n   - 重型零件（需要吊装）\n   - 锋利边缘（容易割伤）\n   - 高温部件（容易烫伤）\n\n3. **作业环境**：\n   - 狭窄空间（容易碰撞）\n   - 高空位置（容易坠落）\n   - 密闭空间（通风不良）\n\n## 装配步骤\n\n[\n  {\n    \"step_number\": 1,\n    \"action\": \"放置基准件\",\n    \"description\": \"将图纸上标注为②的连接板（BOM序号2）平稳放置在装配工装或工作台上，作为整个组件的装配基准。\",\n    \"position_description\": \"连接板水平放置，确保后续焊接操作方便。\",\n    \"parts_used\": [\n      {\n        \"bom_seq\": \"2\",\n        \"bom_name\": \"连接板 1\",\n        \"quantity\": 1,\n        \"drawing_number\": \"2\",\n        \"node_name\": [\n          \"NAUO2\"\n        ],\n        \"bom_code\": \"01.01.01.11509\"\n      }\n    ],\n    \"tools\": [\n      \"行车/吊具\",\n      \"水平仪\"\n    ],\n    \"warnings\": [\n      \"吊装时注意安全，确保连接板放置平稳。\"\n    ]\n  },\n  {\n    \"step_number\": 2,\n    \"action\": \"焊接底部矩形管\",\n    \"description\": \"将图纸上标注为⑧的矩形管（BOM序号8）放置在②号连接板的底部，与连接板的边缘对齐。进行点焊定位，确保矩形管与连接板垂直。\",\n    \"position_description\": \"矩形管⑧位于连接板②的下方，沿长度方向居中。\",\n    \"parts_used\": [\n      {\n        \"bom_seq\": \"8\",\n        \"bom_name\": \"矩形管 1\",\n        \"quantity\": 1,\n        \"drawing_number\": \"8\",\n        \"node_name\": [\n          \"NAUO13\"\n        ],\n        \"bom_code\": \"01.01.03.2720\"\n      }\n    ],\n    \"tools\": [\n      \"焊机\",\n      \"角尺\",\n      \"卡具\"\n    ],\n    \"warnings\": [\n      \"点焊时注意焊接电流和电压，防止烧穿。\"\n    ],\n    \"welding\": {\n      \"required\": true,\n      \"welding_type\": \"角焊（定位焊）\",\n      \"welding_method\": \"CO2气保焊\",\n      \"weld_size\": \"点焊长度10-15mm，焊脚高度约4mm\",\n      \"welding_position\": \"矩形管⑧与连接板②的连接处，平焊\",\n      \"quality_requirements\": \"点焊牢固，定位准确，确保矩形管与连接板垂直度误差小于1mm/100mm\",\n      \"safety_notes\": \"佩戴焊接面罩、手套和防护服。确保工作区域通风良好，远离易燃物。\"\n    }\n  },\n  {\n    \"step_number\": 3,\n    \"action\": \"焊接侧面矩形管\",\n    \"description\": \"将图纸上标注为①的矩形管（BOM序号1）放置在②号连接板的另一侧（与⑧号矩形管相对的一侧），同样进行点焊定位。确保①号矩形管与连接板垂直。\",\n    \"position_description\": \"矩形管①位于连接板②的下方，与矩形管⑧平行。\",\n    \"parts_used\": [\n      {\n        \"bom_seq\": \"1\",\n        \"bom_name\": \"矩形管 1\",\n        \"quantity\": 1,\n        \"drawing_number\": \"1\",\n        \"node_name\": [\n          \"NAUO1\"\n        ],\n        \"bom_code\": \"01.01.03.2718\"\n      }\n    ],\n    \"tools\": [\n      \"焊机\",\n      \"角尺\",\n      \"卡具\"\n    ],\n    \"warnings\": [\n      \"检查两个矩形管的平行度，误差应在允许范围内。\"\n    ],\n    \"welding\": {\n      \"required\": true,\n      \"welding_type\": \"角焊（定位焊）\",\n      \"welding_method\": \"CO2气保焊\",\n      \"weld_size\": \"点焊长度10-15mm，焊脚高度约4mm\",\n      \"welding_position\": \"矩形管①与连接板②的连接处，平焊\",\n      \"quality_requirements\": \"点焊牢固，定位准确，确保矩形管①与⑧平行且垂直于连接板②\",\n      \"safety_notes\": \"检查焊机接地线是否完好，防止触电。点焊后及时清理焊渣，避免烫伤。\"\n    }\n  },\n  {\n    \"step_number\": 4,\n    \"action\": \"焊接加强筋\",\n    \"description\": \"将图纸上标注为⑨的加强筋（BOM序号9）安装在②号连接板与①号矩形管的连接处，每侧安装一个，共2个。进行点焊定位。\",\n    \"position_description\": \"加强筋⑨位于连接板②和矩形管①的斜角支撑位置。\",\n    \"parts_used\": [\n      {\n        \"bom_seq\": \"9\",\n        \"bom_name\": \"加强筋 2\",\n        \"quantity\": 2,\n        \"drawing_number\": \"9\",\n        \"node_name\": [\n          \"NAUO15\",\n          \"NAUO14\"\n        ],\n        \"bom_code\": \"01.01.01.17678\"\n      }\n    ],\n    \"tools\": [\n      \"焊机\",\n      \"卡具\"\n    ],\n    \"warnings\": [\n      \"加强筋的定位要准确，确保支撑面贴合。\"\n    ],\n    \"welding\": {\n      \"required\": true,\n      \"welding_type\": \"角焊（定位焊）\",\n      \"welding_method\": \"CO2气保焊\",\n      \"weld_size\": \"点焊长度10mm，焊脚高度约3mm\",\n      \"welding_position\": \"加强筋⑨与连接板②、矩形管①的连接处，主要为平焊和横焊\",\n      \"quality_requirements\": \"加强筋与主体结构贴合紧密，点焊位置应避开最终满焊的起始点\",\n      \"safety_notes\": \"由于加强筋板厚较薄，点焊时注意控制电流，防止烧穿或变形。\"\n    }\n  },\n  {\n    \"step_number\": 5,\n    \"action\": \"安装左挂件虚拟组件\",\n    \"description\": \"将图纸上标注为⑤的左挂件虚拟组件（BOM序号5）安装到①号矩形管的左侧端部，进行点焊定位。\",\n    \"position_description\": \"左挂件⑤安装在矩形管①的左端。\",\n    \"parts_used\": [\n      {\n        \"bom_seq\": \"5\",\n        \"bom_name\": \"左挂件虚拟组件 1\",\n        \"quantity\": 1,\n        \"drawing_number\": \"5\",\n        \"node_name\": [\n          \"NAUO17\",\n          \"NAUO16\",\n          \"NAUO20\",\n          \"NAUO19\"\n        ],\n        \"bom_code\": \"01.05.0019\"\n      }\n    ],\n    \"tools\": [\n      \"焊机\",\n      \"卡具\"\n    ],\n    \"warnings\": [\n      \"注意挂件的方向和角度，确保安装正确。\"\n    ],\n    \"welding\": {\n      \"required\": true,\n      \"welding_type\": \"角焊（定位焊）\",\n      \"welding_method\": \"CO2气保焊\",\n      \"weld_size\": \"点焊长度15mm，焊脚高度约5mm\",\n      \"welding_position\": \"左挂件⑤与矩形管①的端部连接处，主要为平焊\",\n      \"quality_requirements\": \"挂件定位必须准确，确保其与矩形管的轴线垂直度符合要求\",\n      \"safety_notes\": \"挂件组件较重，定位时需使用可靠的卡具固定，防止倾倒或移动。\"\n    }\n  },\n  {\n    \"step_number\": 6,\n    \"action\": \"安装右挂件虚拟组件\",\n    \"description\": \"将图纸上标注为④的右挂件虚拟组件（BOM序号4）安装到①号矩形管的右侧端部，进行点焊定位。\",\n    \"position_description\": \"右挂件④安装在矩形管①的右端。\",\n    \"parts_used\": [\n      {\n        \"bom_seq\": \"4\",\n        \"bom_name\": \"右挂件虚拟组件 1\",\n        \"quantity\": 1,\n        \"drawing_number\": \"4\",\n        \"node_name\": [\n          \"NAUO18\",\n          \"NAUO21\"\n        ],\n        \"bom_code\": \"01.05.0018\"\n      }\n    ],\n    \"tools\": [\n      \"焊机\",\n      \"卡具\"\n    ],\n    \"warnings\": [\n      \"确保左右挂件的安装位置对称。\"\n    ],\n    \"welding\": {\n      \"required\": true,\n      \"welding_type\": \"角焊（定位焊）\",\n      \"welding_method\": \"CO2气保焊\",\n      \"weld_size\": \"点焊长度15mm，焊脚高度约5mm\",\n      \"welding_position\": \"右挂件④与矩形管①的端部连接处，主要为平焊\",\n      \"quality_requirements\": \"挂件定位必须准确，确保左右挂件的相对位置和对称度符合图纸要求\",\n      \"safety_notes\": \"焊接时注意保护挂件上的机加工面，避免飞溅物污染。\"\n    }\n  },\n  {\n    \"step_number\": 7,\n    \"action\": \"焊接中间矩形管\",\n    \"description\": \"将图纸上标注为⑥的矩形管（BOM序号6）安装在②号连接板的上方，位于两个挂件虚拟组件之间，进行点焊定位。\",\n    \"position_description\": \"矩形管⑥位于连接板②的上方，与连接板垂直。\",\n    \"parts_used\": [\n      {\n        \"bom_seq\": \"6\",\n        \"bom_name\": \"矩形管 2\",\n        \"quantity\": 2,\n        \"drawing_number\": \"6\",\n        \"node_name\": [\n          \"NAUO10\",\n          \"NAUO9\"\n        ],\n        \"bom_code\": \"01.01.03.2719\"\n      }\n    ],\n    \"tools\": [\n      \"焊机\",\n      \"卡具\",\n      \"卷尺\"\n    ],\n    \"warnings\": [\n      \"检查矩形管⑥与连接板②的相对位置尺寸，确保符合图纸要求。\"\n    ],\n    \"welding\": {\n      \"required\": true,\n      \"welding_type\": \"角焊（定位焊）\",\n      \"welding_method\": \"CO2气保焊\",\n      \"weld_size\": \"点焊长度10mm，焊脚高度约4mm\",\n      \"welding_position\": \"矩形管⑥与连接板②的连接处，平焊\",\n      \"quality_requirements\": \"定位焊应保证矩形管⑥的间距和垂直度，防止后续满焊时产生过大应力\",\n      \"safety_notes\": \"焊接前检查矩形管内部是否清洁，避免因油污产生气孔。\"\n    }\n  },\n  {\n    \"step_number\": 8,\n    \"action\": \"焊接方形板\",\n    \"description\": \"将图纸上标注为③的方形板-机加（BOM序号3）安装在矩形管⑥的内部，用于支撑和加强。共安装4块，每根矩形管⑥内部安装2块。\",\n    \"position_description\": \"方形板③安装在矩形管⑥的内部，作为加强件。\",\n    \"parts_used\": [\n      {\n        \"bom_seq\": \"3\",\n        \"bom_name\": \"方形板-机加 4\",\n        \"quantity\": 4,\n        \"drawing_number\": \"3\",\n        \"node_name\": [\n          \"NAUO6\",\n          \"NAUO5\",\n          \"NAUO4\",\n          \"NAUO3\"\n        ],\n        \"bom_code\": \"01.01.01.6589\"\n      }\n    ],\n    \"tools\": [\n      \"焊机\",\n      \"卡具\"\n    ],\n    \"warnings\": [\n      \"方形板的安装位置应确保不影响后续装配。\"\n    ],\n    \"welding\": {\n      \"required\": true,\n      \"welding_type\": \"角焊（定位焊）\",\n      \"welding_method\": \"CO2气保焊\",\n      \"weld_size\": \"点焊长度5mm，焊脚高度约3mm\",\n      \"welding_position\": \"方形板③与矩形管⑥内壁的连接处，主要为平焊和立焊\",\n      \"quality_requirements\": \"方形板应紧贴内壁，点焊数量足够，防止在满焊时移位\",\n      \"safety_notes\": \"在管内焊接时，注意烟尘聚集，必须使用局部排风设备，防止吸入有害气体。\"\n    }\n  },\n  {\n    \"step_number\": 9,\n    \"action\": \"焊接封板\",\n    \"description\": \"将图纸上标注为⑦的封板（BOM序号7）安装在组件的顶部，覆盖矩形管⑥和连接板②的连接区域，进行点焊定位。\",\n    \"position_description\": \"封板⑦位于组件的顶部，覆盖结构。\",\n    \"parts_used\": [\n      {\n        \"bom_seq\": \"7\",\n        \"bom_name\": \"封板 2\",\n        \"quantity\": 2,\n        \"drawing_number\": \"7\",\n        \"node_name\": [\n          \"NAUO12\",\n          \"NAUO11\"\n        ],\n        \"bom_code\": \"01.01.01.16608\"\n      }\n    ],\n    \"tools\": [\n      \"焊机\",\n      \"卡具\"\n    ],\n    \"warnings\": [\n      \"封板边缘应与主体结构对齐，确保外观平整。\"\n    ],\n    \"welding\": {\n      \"required\": true,\n      \"welding_type\": \"角焊（定位焊）\",\n      \"welding_method\": \"CO2气保焊\",\n      \"weld_size\": \"点焊长度10mm，焊脚高度约4mm\",\n      \"welding_position\": \"封板⑦与连接板②和矩形管⑥的连接边缘，平焊\",\n      \"quality_requirements\": \"封板定位应保证其平面度，避免后续满焊时产生翘曲\",\n      \"safety_notes\": \"封板边缘可能存在锐角，操作时需戴好防护手套，防止割伤。\"\n    }\n  },\n  {\n    \"step_number\": 10,\n    \"action\": \"满焊及清理\",\n    \"description\": \"对所有已点焊定位的零件（①、②、③、④、⑤、⑥、⑦、⑧、⑨）进行满焊。焊接应按照技术要求进行，确保焊缝饱满、无虚焊、无漏焊。焊接完成后，进行焊渣清理和飞溅物清除。\",\n    \"position_description\": \"所有连接部位。\",\n    \"parts_used\": [],\n    \"tools\": [\n      \"焊机\",\n      \"焊钳\",\n      \"角磨机\",\n      \"钢丝刷\"\n    ],\n    \"warnings\": [\n      \"满焊时注意控制热变形，可采用对称、分段焊接。焊后必须进行清渣和打磨，去除锐边/尖角。\"\n    ],\n    \"welding\": {\n      \"required\": true,\n      \"welding_type\": \"角焊/部分对接焊（满焊）\",\n      \"welding_method\": \"CO2气保焊（MAG）\",\n      \"weld_size\": \"根据板厚确定，主要焊缝焊脚高度6-8mm（图纸未明确标注，按经验值）\",\n      \"welding_position\": \"所有连接缝，涉及平焊、横焊、立焊（需调整工件位置尽量采用平焊）\",\n      \"quality_requirements\": \"焊缝外观成型良好，连续，无咬边、气孔、裂纹等缺陷。重要焊缝（如挂件连接处）需进行磁粉或超声波无损检测（MT/UT）。\",\n      \"safety_notes\": \"满焊时热量大，注意防火，周围10米内不得有易燃物。使用角磨机清理时，必须佩戴防护眼镜和耳塞，防止火花和噪音伤害。\"\n    }\n  }\n]\n\n## 要求\n\n请按照以下5个步骤思考，为装配步骤添加安全警告：\n\n### 步骤1：识别风险步骤\n- 分析每个装配步骤的操作内容\n- 判断是否涉及高风险作业：\n  * **焊接作业**：电击、弧光、烫伤、火灾\n  * **吊装作业**：吊物坠落、碰撞、超载\n  * **高空作业**：人员坠落、物体打击\n  * **重物搬运**：砸伤、扭伤、夹伤\n  * **机械加工**：切割伤、夹伤、碰撞\n\n### 步骤2：分析风险源\n- 确定风险的来源（设备、工具、材料、环境、人员操作等）\n- 评估风险的严重程度（轻微、中等、严重、致命）\n- 考虑风险的发生概率\n\n### 步骤3：制定预防措施\n- 针对每个风险源，制定具体的预防措施\n- 强调个人防护用品的使用：\n  * **焊接**：焊接面罩、防护手套、防护服\n  * **吊装**：安全帽、安全鞋、手套\n  * **高空**：安全带、安全帽、防滑鞋\n  * **机械**：防护眼镜、手套、安全鞋\n\n### 步骤4：添加安全警告\n- 为每个有风险的步骤添加safety_warnings字段\n- 每条警告要简洁明了，说明具体的风险和预防措施\n- 使用工人能看懂的语言\n\n### 步骤5：验证完整性\n- 检查所有高风险步骤是否都添加了安全警告\n- 检查安全警告是否具体、可操作\n- 检查是否遗漏了任何潜在风险\n\n## ⚠️ 强制自检清单（生成后必须逐项检查）\n\n**在输出JSON之前，你必须完成以下验证：**\n\n1. **风险步骤识别验证**：\n   - [ ] 所有涉及焊接、吊装、高空、重物搬运的步骤都添加了safety_warnings字段\n   - [ ] 没有明显风险的步骤没有添加safety_warnings字段\n\n2. **安全警告完整性验证**：\n   - [ ] 每个safety_warnings字段都是字符串数组\n   - [ ] 每条警告都说明了具体的风险和预防措施\n   - [ ] 涵盖了个人防护、设备安全、环境安全、操作安全\n\n3. **语言通俗性验证**：\n   - [ ] 使用工人能看懂的语言\n   - [ ] 避免专业术语和英文缩写\n   - [ ] 每条警告简洁明了（一句话）\n\n4. **原有字段保持验证**：\n   - [ ] 原有步骤的所有字段都保持不变（包括welding字段）\n   - [ ] 没有修改或删除任何原有字段\n\n**如果自检发现任何问题，必须重新生成！**\n\n现在开始为装配步骤添加安全警告！\n",
  "raw_response": "```json\n{\n  \"enhanced_steps\": [\n    {\n      \"step_number\": 1,\n      \"action\": \"放置基准件\",\n      \"description\": \"将图纸上标注为②的连接板（BOM序号2）平稳放置在装配工装或工作台上，作为整个组件的装配基准。\",\n      \"position_description\": \"连接板水平放置，确保后续焊接操作方便。\",\n      \"parts_used\": [\n        {\n          \"bom_seq\": \"2\",\n          \"bom_name\": \"连接板 1\",\n          \"quantity\": 1,\n          \"drawing_number\": \"2\",\n          \"node_name\": [\n            \"NAUO2\"\n          ],\n          \"bom_code\": \"01.01.01.11509\"\n        }\n      ],\n      \"tools\": [\n        \"行车/吊具\",\n        \"水平仪\"\n      ],\n      \"warnings\": [\n        \"吊装时注意安全，确保连接板放置平稳。\"\n      ],\n      \"safety_warnings\": [\n        \"吊装前检查吊具和吊索具是否完好，防止重物坠落伤人。\",\n        \"吊装过程中，人员不得在重物下方停留或通过。\",\n        \"佩戴安全帽和防护手套，防止搬运和吊装过程中发生碰撞或夹伤。\"\n      ]\n    },\n    {\n      \"step_number\": 2,\n      \"action\": \"焊接底部矩形管\",\n      \"description\": \"将图纸上标注为⑧的矩形管（BOM序号8）放置在②号连接板的底部，与连接板的边缘对齐。进行点焊定位，确保矩形管与连接板垂直。\",\n      \"position_description\": \"矩形管⑧位于连接板②的下方，沿长度方向居中。\",\n      \"parts_used\": [\n        {\n          \"bom_seq\": \"8\",\n          \"bom_name\": \"矩形管 1\",\n          \"quantity\": 1,\n          \"drawing_number\": \"8\",\n          \"node_name\": [\n            \"NAUO13\"\n          ],\n          \"bom_code\": \"01.01.03.2720\"\n        }\n      ],\n      \"tools\": [\n        \"焊机\",\n        \"角尺\",\n        \"卡具\"\n      ],\n      \"warnings\": [\n        \"点焊时注意焊接电流和电压，防止烧穿。\"\n      ],\n      \"welding\": {\n        \"required\": true,\n        \"welding_type\": \"角焊（定位焊）\",\n        \"welding_method\": \"CO2气保焊\",\n        \"weld_size\": \"点焊长度10-15mm，焊脚高度约4mm\",\n        \"welding_position\": \"矩形管⑧与连接板②的连接处，平焊\",\n        \"quality_requirements\": \"点焊牢固，定位准确，确保矩形管与连接板垂直度误差小于1mm/100mm\",\n        \"safety_notes\": \"佩戴焊接面罩、手套和防护服。确保工作区域通风良好，远离易燃物。\"\n      },\n      \"safety_warnings\": [\n        \"佩戴焊接面罩、防护手套和防护服，防止弧光灼伤和烫伤。\",\n        \"确保焊机接地良好，电缆绝缘完好，防止触电。\",\n        \"焊接区域必须保持通风，防止烟尘和有毒气体中毒。\",\n        \"点焊时注意飞溅物，周围人员应避开或做好防护。\"\n      ]\n    },\n    {\n      \"step_number\": 3,\n      \"action\": \"焊接侧面矩形管\",\n      \"description\": \"将图纸上标注为①的矩形管（BOM序号1）放置在②号连接板的另一侧（与⑧号矩形管相对的一侧），同样进行点焊定位。确保①号矩形管与连接板垂直。\",\n      \"position_description\": \"矩形管①位于连接板②的下方，与矩形管⑧平行。\",\n      \"parts_used\": [\n        {\n          \"bom_seq\": \"1\",\n          \"bom_name\": \"矩形管 1\",\n          \"quantity\": 1,\n          \"drawing_number\": \"1\",\n          \"node_name\": [\n            \"NAUO1\"\n          ],\n          \"bom_code\": \"01.01.03.2718\"\n        }\n      ],\n      \"tools\": [\n        \"焊机\",\n        \"角尺\",\n        \"卡具\"\n      ],\n      \"warnings\": [\n        \"检查两个矩形管的平行度，误差应在允许范围内。\"\n      ],\n      \"welding\": {\n        \"required\": true,\n        \"welding_type\": \"角焊（定位焊）\",\n        \"welding_method\": \"CO2气保焊\",\n        \"weld_size\": \"点焊长度10-15mm，焊脚高度约4mm\",\n        \"welding_position\": \"矩形管①与连接板②的连接处，平焊\",\n        \"quality_requirements\": \"点焊牢固，定位准确，确保矩形管①与⑧平行且垂直于连接板②\",\n        \"safety_notes\": \"检查焊机接地线是否完好，防止触电。点焊后及时清理焊渣，避免烫伤。\"\n      },\n      \"safety_warnings\": [\n        \"佩戴焊接面罩、防护手套和防护服，防止弧光灼伤和烫伤。\",\n        \"使用卡具固定工件时，注意防止手被夹伤。\",\n        \"点焊后清理焊渣时，佩戴防护眼镜，防止焊渣飞溅伤眼。\"\n      ]\n    },\n    {\n      \"step_number\": 4,\n      \"action\": \"焊接加强筋\",\n      \"description\": \"将图纸上标注为⑨的加强筋（BOM序号9）安装在②号连接板与①号矩形管的连接处，每侧安装一个，共2个。进行点焊定位。\",\n      \"position_description\": \"加强筋⑨位于连接板②和矩形管①的斜角支撑位置。\",\n      \"parts_used\": [\n        {\n          \"bom_seq\": \"9\",\n          \"bom_name\": \"加强筋 2\",\n          \"quantity\": 2,\n          \"drawing_number\": \"9\",\n          \"node_name\": [\n            \"NAUO15\",\n            \"NAUO14\"\n          ],\n          \"bom_code\": \"01.01.01.17678\"\n        }\n      ],\n      \"tools\": [\n        \"焊机\",\n        \"卡具\"\n      ],\n      \"warnings\": [\n        \"加强筋的定位要准确，确保支撑面贴合。\"\n      ],\n      \"welding\": {\n        \"required\": true,\n        \"welding_type\": \"角焊（定位焊）\",\n        \"welding_method\": \"CO2气保焊\",\n        \"weld_size\": \"点焊长度10mm，焊脚高度约3mm\",\n        \"welding_position\": \"加强筋⑨与连接板②、矩形管①的连接处，主要为平焊和横焊\",\n        \"quality_requirements\": \"加强筋与主体结构贴合紧密，点焊位置应避开最终满焊的起始点\",\n        \"safety_notes\": \"由于加强筋板厚较薄，点焊时注意控制电流，防止烧穿或变形。\"\n      },\n      \"safety_warnings\": [\n        \"佩戴防护手套，加强筋边缘可能锋利，防止割伤。\",\n        \"点焊时控制电流，防止因烧穿导致烫伤或火灾。\",\n        \"确保工件稳定，防止加强筋在点焊过程中突然移动造成伤害。\"\n      ]\n    },\n    {\n      \"step_number\": 5,\n      \"action\": \"安装左挂件虚拟组件\",\n      \"description\": \"将图纸上标注为⑤的左挂件虚拟组件（BOM序号5）安装到①号矩形管的左侧端部，进行点焊定位。\",\n      \"position_description\": \"左挂件⑤安装在矩形管①的左端。\",\n      \"parts_used\": [\n        {\n          \"bom_seq\": \"5\",\n          \"bom_name\": \"左挂件虚拟组件 1\",\n          \"quantity\": 1,\n          \"drawing_number\": \"5\",\n          \"node_name\": [\n            \"NAUO17\",\n            \"NAUO16\",\n            \"NAUO20\",\n            \"NAUO19\"\n          ],\n          \"bom_code\": \"01.05.0019\"\n        }\n      ],\n      \"tools\": [\n        \"焊机\",\n        \"卡具\"\n      ],\n      \"warnings\": [\n        \"注意挂件的方向和角度，确保安装正确。\"\n      ],\n      \"welding\": {\n        \"required\": true,\n        \"welding_type\": \"角焊（定位焊）\",\n        \"welding_method\": \"CO2气保焊\",\n        \"weld_size\": \"点焊长度15mm，焊脚高度约5mm\",\n        \"welding_position\": \"左挂件⑤与矩形管①的端部连接处，主要为平焊\",\n        \"quality_requirements\": \"挂件定位必须准确，确保其与矩形管的轴线垂直度符合要求\",\n        \"safety_notes\": \"挂件组件较重，定位时需使用可靠的卡具固定，防止倾倒或移动。\"\n      },\n      \"safety_warnings\": [\n        \"挂件组件可能较重，搬运时注意使用正确的姿势或借助吊具，防止扭伤。\",\n        \"使用可靠的卡具或夹具固定挂件，防止定位焊时组件倾倒或砸伤。\",\n        \"点焊时注意焊枪和电缆的走向，避免绊倒或损坏电缆造成触电。\"\n      ]\n    },\n    {\n      \"step_number\": 6,\n      \"action\": \"安装右挂件虚拟组件\",\n      \"description\": \"将图纸上标注为④的右挂件虚拟组件（BOM序号4）安装到①号矩形管的右侧端部，进行点焊定位。\",\n      \"position_description\": \"右挂件④安装在矩形管①的右端。\",\n      \"parts_used\": [\n        {\n          \"bom_seq\": \"4\",\n          \"bom_name\": \"右挂件虚拟组件 1\",\n          \"quantity\": 1,\n          \"drawing_number\": \"4\",\n          \"node_name\": [\n            \"NAUO18\",\n            \"NAUO21\"\n          ],\n          \"bom_code\": \"01.05.0018\"\n        }\n      ],\n      \"tools\": [\n        \"焊机\",\n        \"卡具\"\n      ],\n      \"warnings\": [\n        \"确保左右挂件的安装位置对称。\"\n      ],\n      \"welding\": {\n        \"required\": true,\n        \"welding_type\": \"角焊（定位焊）\",\n        \"welding_method\": \"CO2气保焊\",\n        \"weld_size\": \"点焊长度15mm，焊脚高度约5mm\",\n        \"welding_position\": \"右挂件④与矩形管①的端部连接处，主要为平焊\",\n        \"quality_requirements\": \"挂件定位必须准确，确保左右挂件的相对位置和对称度符合图纸要求\",\n        \"safety_notes\": \"焊接时注意保护挂件上的机加工面，避免飞溅物污染。\"\n      },\n      \"safety_warnings\": [\n        \"搬运和安装右挂件时，注意防止组件掉落或砸伤脚部，需穿戴安全鞋。\",\n        \"点焊时，确保焊机处于良好工作状态，避免因设备故障引发触电。\",\n        \"焊接飞溅物可能损坏机加工面，注意使用防火毯或挡板进行保护。\"\n      ]\n    },\n    {\n      \"step_number\": 7,\n      \"action\": \"焊接中间矩形管\",\n      \"description\": \"将图纸上标注为⑥的矩形管（BOM序号6）安装在②号连接板的上方，位于两个挂件虚拟组件之间，进行点焊定位。\",\n      \"position_description\": \"矩形管⑥位于连接板②的上方，与连接板垂直。\",\n      \"parts_used\": [\n        {\n          \"bom_seq\": \"6\",\n          \"bom_name\": \"矩形管 2\",\n          \"quantity\": 2,\n          \"drawing_number\": \"6\",\n          \"node_name\": [\n            \"NAUO10\",\n            \"NAUO9\"\n          ],\n          \"bom_code\": \"01.01.03.2719\"\n        }\n      ],\n      \"tools\": [\n        \"焊机\",\n        \"卡具\",\n        \"卷尺\"\n      ],\n      \"warnings\": [\n        \"检查矩形管⑥与连接板②的相对位置尺寸，确保符合图纸要求。\"\n      ],\n      \"welding\": {\n        \"required\": true,\n        \"welding_type\": \"角焊（定位焊）\",\n        \"welding_method\": \"CO2气保焊\",\n        \"weld_size\": \"点焊长度10mm，焊脚高度约4mm\",\n        \"welding_position\": \"矩形管⑥与连接板②的连接处，平焊\",\n        \"quality_requirements\": \"定位焊应保证矩形管⑥的间距和垂直度，防止后续满焊时产生过大应力\",\n        \"safety_notes\": \"焊接前检查矩形管内部是否清洁，避免因油污产生气孔。\"\n      },\n      \"safety_warnings\": [\n        \"佩戴防护手套，矩形管边缘可能存在毛刺，防止割伤。\",\n        \"点焊操作时，注意保持身体稳定，避免因操作不当导致跌倒或烫伤。\",\n        \"确保所有定位尺寸准确，避免因返工造成不必要的焊接风险。\"\n      ]\n    },\n    {\n      \"step_number\": 8,\n      \"action\": \"焊接方形板\",\n      \"description\": \"将图纸上标注为③的方形板-机加（BOM序号3）安装在矩形管⑥的内部，用于支撑和加强。共安装4块，每根矩形管⑥内部安装2块。\",\n      \"position_description\": \"方形板③安装在矩形管⑥的内部，作为加强件。\",\n      \"parts_used\": [\n        {\n          \"bom_seq\": \"3\",\n          \"bom_name\": \"方形板-机加 4\",\n          \"quantity\": 4,\n          \"drawing_number\": \"3\",\n          \"node_name\": [\n            \"NAUO6\",\n            \"NAUO5\",\n            \"NAUO4\",\n            \"NAUO3\"\n          ],\n          \"bom_code\": \"01.01.01.6589\"\n        }\n      ],\n      \"tools\": [\n        \"焊机\",\n        \"卡具\"\n      ],\n      \"warnings\": [\n        \"方形板的安装位置应确保不影响后续装配。\"\n      ],\n      \"welding\": {\n        \"required\": true,\n        \"welding_type\": \"角焊（定位焊）\",\n        \"welding_method\": \"CO2气保焊\",\n        \"weld_size\": \"点焊长度5mm，焊脚高度约3mm\",\n        \"welding_position\": \"方形板③与矩形管⑥内壁的连接处，主要为平焊和立焊\",\n        \"quality_requirements\": \"方形板应紧贴内壁，点焊数量足够，防止在满焊时移位\",\n        \"safety_notes\": \"在管内焊接时，注意烟尘聚集，必须使用局部排风设备，防止吸入有害气体。\"\n      },\n      \"safety_warnings\": [\n        \"在管内焊接时，必须开启局部排风或佩戴有效的呼吸防护用品，防止吸入有毒烟尘。\",\n        \"方形板边缘可能锋利，搬运和安装时必须佩戴防护手套，防止割伤。\",\n        \"管内空间狭小，操作时注意避免头部和身体碰撞，佩戴安全帽。\"\n      ]\n    },\n    {\n      \"step_number\": 9,\n      \"action\": \"焊接封板\",\n      \"description\": \"将图纸上标注为⑦的封板（BOM序号7）安装在组件的顶部，覆盖矩形管⑥和连接板②的连接区域，进行点焊定位。\",\n      \"position_description\": \"封板⑦位于组件的顶部，覆盖结构。\",\n      \"parts_used\": [\n        {\n          \"bom_seq\": \"7\",\n          \"bom_name\": \"封板 2\",\n          \"quantity\": 2,\n          \"drawing_number\": \"7\",\n          \"node_name\": [\n            \"NAUO12\",\n            \"NAUO11\"\n          ],\n          \"bom_code\": \"01.01.01.16608\"\n        }\n      ],\n      \"tools\": [\n        \"焊机\",\n        \"卡具\"\n      ],\n      \"warnings\": [\n        \"封板边缘应与主体结构对齐，确保外观平整。\"\n      ],\n      \"welding\": {\n        \"required\": true,\n        \"welding_type\": \"角焊（定位焊）\",\n        \"welding_method\": \"CO2气保焊\",\n        \"weld_size\": \"点焊长度10mm，焊脚高度约4mm\",\n        \"welding_position\": \"封板⑦与连接板②和矩形管⑥的连接边缘，平焊\",\n        \"quality_requirements\": \"封板定位应保证其平面度，避免后续满焊时产生翘曲\",\n        \"safety_notes\": \"封板边缘可能存在锐角，操作时需戴好防护手套，防止割伤。\"\n      },\n      \"safety_warnings\": [\n        \"封板边缘锋利，操作时必须佩戴防割手套，防止手部割伤。\",\n        \"点焊时注意控制热输入，防止板材变形或烧穿。\",\n        \"确保封板定位牢固，防止在焊接过程中移动或掉落。\"\n      ]\n    },\n    {\n      \"step_number\": 10,\n      \"action\": \"满焊及清理\",\n      \"description\": \"对所有已点焊定位的零件（①、②、③、④、⑤、⑥、⑦、⑧、⑨）进行满焊。焊接应按照技术要求进行，确保焊缝饱满、无虚焊、无漏焊。焊接完成后，进行焊渣清理和飞溅物清除。\",\n      \"position_description\": \"所有连接部位。\",\n      \"parts_used\": [],\n      \"tools\": [\n        \"焊机\",\n        \"焊钳\",\n        \"角磨机\",\n        \"钢丝刷\"\n      ],\n      \"warnings\": [\n        \"满焊时注意控制热变形，可采用对称、分段焊接。焊后必须进行清渣和打磨，去除锐边/尖角。\"\n      ],\n      \"welding\": {\n        \"required\": true,\n        \"welding_type\": \"角焊/部分对接焊（满焊）\",\n        \"welding_method\": \"CO2气保焊（MAG）\",\n        \"weld_size\": \"根据板厚确定，主要焊缝焊脚高度6-8mm（图纸未明确标注，按经验值）\",\n        \"welding_position\": \"所有连接缝，涉及平焊、横焊、立焊（需调整工件位置尽量采用平焊）\",\n        \"quality_requirements\": \"焊缝外观成型良好，连续，无咬边、气孔、裂纹等缺陷。重要焊缝（如挂件连接处）需进行磁粉或超声波无损检测（MT/UT）。\",\n        \"safety_notes\": \"满焊时热量大，注意防火，周围10米内不得有易燃物。使用角磨机清理时，必须佩戴防护眼镜和耳塞，防止火花和噪音伤害。\"\n      },\n      \"safety_warnings\": [\n        \"满焊时热量高，必须确保周围10米内无易燃易爆物品，并配备灭火器材。\",\n        \"使用角磨机打磨焊缝时，必须佩戴防护眼镜、耳塞和防尘口罩，防止飞溅物、噪音和粉尘伤害。\",\n        \"打磨时注意站位，防止磨片破碎伤人，并确保磨机防护罩完好。\",\n        \"清理焊渣和飞溅物时，注意焊件表面温度，防止高温烫伤。\"\n      ]\n    }\n  ]\n}\n```",
  "parsed_result": {
    "enhanced_steps": [
      {
        "step_number": 1,
        "action": "放置基准件",
        "description": "将图纸上标注为②的连接板（BOM序号2）平稳放置在装配工装或工作台上，作为整个组件的装配基准。",
        "position_description": "连接板水平放置，确保后续焊接操作方便。",
        "parts_used": [
          {
            "bom_seq": "2",
            "bom_name": "连接板 1",
            "quantity": 1,
            "drawing_number": "2",
            "node_name": [
              "NAUO2"
            ],
            "bom_code": "01.01.01.11509"
          }
        ],
        "tools": [
          "行车/吊具",
          "水平仪"
        ],
        "warnings": [
          "吊装时注意安全，确保连接板放置平稳。"
        ],
        "safety_warnings": [
          "吊装前检查吊具和吊索具是否完好，防止重物坠落伤人。",
          "吊装过程中，人员不得在重物下方停留或通过。",
          "佩戴安全帽和防护手套，防止搬运和吊装过程中发生碰撞或夹伤。"
        ]
      },
      {
        "step_number": 2,
        "action": "焊接底部矩形管",
        "description": "将图纸上标注为⑧的矩形管（BOM序号8）放置在②号连接板的底部，与连接板的边缘对齐。进行点焊定位，确保矩形管与连接板垂直。",
        "position_description": "矩形管⑧位于连接板②的下方，沿长度方向居中。",
        "parts_used": [
          {
            "bom_seq": "8",
            "bom_name": "矩形管 1",
            "quantity": 1,
            "drawing_number": "8",
            "node_name": [
              "NAUO13"
            ],
            "bom_code": "01.01.03.2720"
          }
        ],
        "tools": [
          "焊机",
          "角尺",
          "卡具"
        ],
        "warnings": [
          "点焊时注意焊接电流和电压，防止烧穿。"
        ],
        "welding": {
          "required": true,
          "welding_type": "角焊（定位焊）",
          "welding_method": "CO2气保焊",
          "weld_size": "点焊长度10-15mm，焊脚高度约4mm",
          "welding_position": "矩形管⑧与连接板②的连接处，平焊",
          "quality_requirements": "点焊牢固，定位准确，确保矩形管与连接板垂直度误差小于1mm/100mm",
          "safety_notes": "佩戴焊接面罩、手套和防护服。确保工作区域通风良好，远离易燃物。"
        },
        "safety_warnings": [
          "佩戴焊接面罩、防护手套和防护服，防止弧光灼伤和烫伤。",
          "确保焊机接地良好，电缆绝缘完好，防止触电。",
          "焊接区域必须保持通风，防止烟尘和有毒气体中毒。",
          "点焊时注意飞溅物，周围人员应避开或做好防护。"
        ]
      },
      {
        "step_number": 3,
        "action": "焊接侧面矩形管",
        "description": "将图纸上标注为①的矩形管（BOM序号1）放置在②号连接板的另一侧（与⑧号矩形管相对的一侧），同样进行点焊定位。确保①号矩形管与连接板垂直。",
        "position_description": "矩形管①位于连接板②的下方，与矩形管⑧平行。",
        "parts_used": [
          {
            "bom_seq": "1",
            "bom_name": "矩形管 1",
            "quantity": 1,
            "drawing_number": "1",
            "node_name": [
              "NAUO1"
            ],
            "bom_code": "01.01.03.2718"
          }
        ],
        "tools": [
          "焊机",
          "角尺",
          "卡具"
        ],
        "warnings": [
          "检查两个矩形管的平行度，误差应在允许范围内。"
        ],
        "welding": {
          "required": true,
          "welding_type": "角焊（定位焊）",
          "welding_method": "CO2气保焊",
          "weld_size": "点焊长度10-15mm，焊脚高度约4mm",
          "welding_position": "矩形管①与连接板②的连接处，平焊",
          "quality_requirements": "点焊牢固，定位准确，确保矩形管①与⑧平行且垂直于连接板②",
          "safety_notes": "检查焊机接地线是否完好，防止触电。点焊后及时清理焊渣，避免烫伤。"
        },
        "safety_warnings": [
          "佩戴焊接面罩、防护手套和防护服，防止弧光灼伤和烫伤。",
          "使用卡具固定工件时，注意防止手被夹伤。",
          "点焊后清理焊渣时，佩戴防护眼镜，防止焊渣飞溅伤眼。"
        ]
      },
      {
        "step_number": 4,
        "action": "焊接加强筋",
        "description": "将图纸上标注为⑨的加强筋（BOM序号9）安装在②号连接板与①号矩形管的连接处，每侧安装一个，共2个。进行点焊定位。",
        "position_description": "加强筋⑨位于连接板②和矩形管①的斜角支撑位置。",
        "parts_used": [
          {
            "bom_seq": "9",
            "bom_name": "加强筋 2",
            "quantity": 2,
            "drawing_number": "9",
            "node_name": [
              "NAUO15",
              "NAUO14"
            ],
            "bom_code": "01.01.01.17678"
          }
        ],
        "tools": [
          "焊机",
          "卡具"
        ],
        "warnings": [
          "加强筋的定位要准确，确保支撑面贴合。"
        ],
        "welding": {
          "required": true,
          "welding_type": "角焊（定位焊）",
          "welding_method": "CO2气保焊",
          "weld_size": "点焊长度10mm，焊脚高度约3mm",
          "welding_position": "加强筋⑨与连接板②、矩形管①的连接处，主要为平焊和横焊",
          "quality_requirements": "加强筋与主体结构贴合紧密，点焊位置应避开最终满焊的起始点",
          "safety_notes": "由于加强筋板厚较薄，点焊时注意控制电流，防止烧穿或变形。"
        },
        "safety_warnings": [
          "佩戴防护手套，加强筋边缘可能锋利，防止割伤。",
          "点焊时控制电流，防止因烧穿导致烫伤或火灾。",
          "确保工件稳定，防止加强筋在点焊过程中突然移动造成伤害。"
        ]
      },
      {
        "step_number": 5,
        "action": "安装左挂件虚拟组件",
        "description": "将图纸上标注为⑤的左挂件虚拟组件（BOM序号5）安装到①号矩形管的左侧端部，进行点焊定位。",
        "position_description": "左挂件⑤安装在矩形管①的左端。",
        "parts_used": [
          {
            "bom_seq": "5",
            "bom_name": "左挂件虚拟组件 1",
            "quantity": 1,
            "drawing_number": "5",
            "node_name": [
              "NAUO17",
              "NAUO16",
              "NAUO20",
              "NAUO19"
            ],
            "bom_code": "01.05.0019"
          }
        ],
        "tools": [
          "焊机",
          "卡具"
        ],
        "warnings": [
          "注意挂件的方向和角度，确保安装正确。"
        ],
        "welding": {
          "required": true,
          "welding_type": "角焊（定位焊）",
          "welding_method": "CO2气保焊",
          "weld_size": "点焊长度15mm，焊脚高度约5mm",
          "welding_position": "左挂件⑤与矩形管①的端部连接处，主要为平焊",
          "quality_requirements": "挂件定位必须准确，确保其与矩形管的轴线垂直度符合要求",
          "safety_notes": "挂件组件较重，定位时需使用可靠的卡具固定，防止倾倒或移动。"
        },
        "safety_warnings": [
          "挂件组件可能较重，搬运时注意使用正确的姿势或借助吊具，防止扭伤。",
          "使用可靠的卡具或夹具固定挂件，防止定位焊时组件倾倒或砸伤。",
          "点焊时注意焊枪和电缆的走向，避免绊倒或损坏电缆造成触电。"
        ]
      },
      {
        "step_number": 6,
        "action": "安装右挂件虚拟组件",
        "description": "将图纸上标注为④的右挂件虚拟组件（BOM序号4）安装到①号矩形管的右侧端部，进行点焊定位。",
        "position_description": "右挂件④安装在矩形管①的右端。",
        "parts_used": [
          {
            "bom_seq": "4",
            "bom_name": "右挂件虚拟组件 1",
            "quantity": 1,
            "drawing_number": "4",
            "node_name": [
              "NAUO18",
              "NAUO21"
            ],
            "bom_code": "01.05.0018"
          }
        ],
        "tools": [
          "焊机",
          "卡具"
        ],
        "warnings": [
          "确保左右挂件的安装位置对称。"
        ],
        "welding": {
          "required": true,
          "welding_type": "角焊（定位焊）",
          "welding_method": "CO2气保焊",
          "weld_size": "点焊长度15mm，焊脚高度约5mm",
          "welding_position": "右挂件④与矩形管①的端部连接处，主要为平焊",
          "quality_requirements": "挂件定位必须准确，确保左右挂件的相对位置和对称度符合图纸要求",
          "safety_notes": "焊接时注意保护挂件上的机加工面，避免飞溅物污染。"
        },
        "safety_warnings": [
          "搬运和安装右挂件时，注意防止组件掉落或砸伤脚部，需穿戴安全鞋。",
          "点焊时，确保焊机处于良好工作状态，避免因设备故障引发触电。",
          "焊接飞溅物可能损坏机加工面，注意使用防火毯或挡板进行保护。"
        ]
      },
      {
        "step_number": 7,
        "action": "焊接中间矩形管",
        "description": "将图纸上标注为⑥的矩形管（BOM序号6）安装在②号连接板的上方，位于两个挂件虚拟组件之间，进行点焊定位。",
        "position_description": "矩形管⑥位于连接板②的上方，与连接板垂直。",
        "parts_used": [
          {
            "bom_seq": "6",
            "bom_name": "矩形管 2",
            "quantity": 2,
            "drawing_number": "6",
            "node_name": [
              "NAUO10",
              "NAUO9"
            ],
            "bom_code": "01.01.03.2719"
          }
        ],
        "tools": [
          "焊机",
          "卡具",
          "卷尺"
        ],
        "warnings": [
          "检查矩形管⑥与连接板②的相对位置尺寸，确保符合图纸要求。"
        ],
        "welding": {
          "required": true,
          "welding_type": "角焊（定位焊）",
          "welding_method": "CO2气保焊",
          "weld_size": "点焊长度10mm，焊脚高度约4mm",
          "welding_position": "矩形管⑥与连接板②的连接处，平焊",
          "quality_requirements": "定位焊应保证矩形管⑥的间距和垂直度，防止后续满焊时产生过大应力",
          "safety_notes": "焊接前检查矩形管内部是否清洁，避免因油污产生气孔。"
        },
        "safety_warnings": [
          "佩戴防护手套，矩形管边缘可能存在毛刺，防止割伤。",
          "点焊操作时，注意保持身体稳定，避免因操作不当导致跌倒或烫伤。",
          "确保所有定位尺寸准确，避免因返工造成不必要的焊接风险。"
        ]
      },
      {
        "step_number": 8,
        "action": "焊接方形板",
        "description": "将图纸上标注为③的方形板-机加（BOM序号3）安装在矩形管⑥的内部，用于支撑和加强。共安装4块，每根矩形管⑥内部安装2块。",
        "position_description": "方形板③安装在矩形管⑥的内部，作为加强件。",
        "parts_used": [
          {
            "bom_seq": "3",
            "bom_name": "方形板-机加 4",
            "quantity": 4,
            "drawing_number": "3",
            "node_name": [
              "NAUO6",
              "NAUO5",
              "NAUO4",
              "NAUO3"
            ],
            "bom_code": "01.01.01.6589"
          }
        ],
        "tools": [
          "焊机",
          "卡具"
        ],
        "warnings": [
          "方形板的安装位置应确保不影响后续装配。"
        ],
        "welding": {
          "required": true,
          "welding_type": "角焊（定位焊）",
          "welding_method": "CO2气保焊",
          "weld_size": "点焊长度5mm，焊脚高度约3mm",
          "welding_position": "方形板③与矩形管⑥内壁的连接处，主要为平焊和立焊",
          "quality_requirements": "方形板应紧贴内壁，点焊数量足够，防止在满焊时移位",
          "safety_notes": "在管内焊接时，注意烟尘聚集，必须使用局部排风设备，防止吸入有害气体。"
        },
        "safety_warnings": [
          "在管内焊接时，必须开启局部排风或佩戴有效的呼吸防护用品，防止吸入有毒烟尘。",
          "方形板边缘可能锋利，搬运和安装时必须佩戴防护手套，防止割伤。",
          "管内空间狭小，操作时注意避免头部和身体碰撞，佩戴安全帽。"
        ]
      },
      {
        "step_number": 9,
        "action": "焊接封板",
        "description": "将图纸上标注为⑦的封板（BOM序号7）安装在组件的顶部，覆盖矩形管⑥和连接板②的连接区域，进行点焊定位。",
        "position_description": "封板⑦位于组件的顶部，覆盖结构。",
        "parts_used": [
          {
            "bom_seq": "7",
            "bom_name": "封板 2",
            "quantity": 2,
            "drawing_number": "7",
            "node_name": [
              "NAUO12",
              "NAUO11"
            ],
            "bom_code": "01.01.01.16608"
          }
        ],
        "tools": [
          "焊机",
          "卡具"
        ],
        "warnings": [
          "封板边缘应与主体结构对齐，确保外观平整。"
        ],
        "welding": {
          "required": true,
          "welding_type": "角焊（定位焊）",
          "welding_method": "CO2气保焊",
          "weld_size": "点焊长度10mm，焊脚高度约4mm",
          "welding_position": "封板⑦与连接板②和矩形管⑥的连接边缘，平焊",
          "quality_requirements": "封板定位应保证其平面度，避免后续满焊时产生翘曲",
          "safety_notes": "封板边缘可能存在锐角，操作时需戴好防护手套，防止割伤。"
        },
        "safety_warnings": [
          "封板边缘锋利，操作时必须佩戴防割手套，防止手部割伤。",
          "点焊时注意控制热输入，防止板材变形或烧穿。",
          "确保封板定位牢固，防止在焊接过程中移动或掉落。"
        ]
      },
      {
        "step_number": 10,
        "action": "满焊及清理",
        "description": "对所有已点焊定位的零件（①、②、③、④、⑤、⑥、⑦、⑧、⑨）进行满焊。焊接应按照技术要求进行，确保焊缝饱满、无虚焊、无漏焊。焊接完成后，进行焊渣清理和飞溅物清除。",
        "position_description": "所有连接部位。",
        "parts_used": [],
        "tools": [
          "焊机",
          "焊钳",
          "角磨机",
          "钢丝刷"
        ],
        "warnings": [
          "满焊时注意控制热变形，可采用对称、分段焊接。焊后必须进行清渣和打磨，去除锐边/尖角。"
        ],
        "welding": {
          "required": true,
          "welding_type": "角焊/部分对接焊（满焊）",
          "welding_method": "CO2气保焊（MAG）",
          "weld_size": "根据板厚确定，主要焊缝焊脚高度6-8mm（图纸未明确标注，按经验值）",
          "welding_position": "所有连接缝，涉及平焊、横焊、立焊（需调整工件位置尽量采用平焊）",
          "quality_requirements": "焊缝外观成型良好，连续，无咬边、气孔、裂纹等缺陷。重要焊缝（如挂件连接处）需进行磁粉或超声波无损检测（MT/UT）。",
          "safety_notes": "满焊时热量大，注意防火，周围10米内不得有易燃物。使用角磨机清理时，必须佩戴防护眼镜和耳塞，防止火花和噪音伤害。"
        },
        "safety_warnings": [
          "满焊时热量高，必须确保周围10米内无易燃易爆物品，并配备灭火器材。",
          "使用角磨机打磨焊缝时，必须佩戴防护眼镜、耳塞和防尘口罩，防止飞溅物、噪音和粉尘伤害。",
          "打磨时注意站位，防止磨片破碎伤人，并确保磨机防护罩完好。",
          "清理焊渣和飞溅物时，注意焊件表面温度，防止高温烫伤。"
        ]
      }
    ]
  }
}