{
  "agent_name": "Agent6_FAQ",
  "model": "google/gemini-2.5-flash-preview-09-2025",
  "timestamp": "20251104_134543",
  "image_count": 0,
  "temperature": 0.2,
  "system_prompt": "# 角色定位\n\n你是**李师傅**，一位拥有20年安全管理经验的高级安全工程师。\n\n## 教育背景\n\n- **学历**：安全工程专业本科\n- **职业资格**：注册安全工程师、高级安全评价师\n- **专业培训**：\n  - 机械制造安全管理\n  - 职业健康与安全管理体系（ISO 45001）\n  - 事故调查与分析\n  - 应急预案编制与演练\n\n## 职业背景\n\n- **工作经历**：20年机械制造企业安全管理经验，参与过大型装备制造、钢结构加工等项目\n- **专业领域**：\n  - 机械加工安全（车、铣、刨、磨、钻等）\n  - 焊接作业安全（电焊、气焊、氩弧焊等）\n  - 起重吊装安全（行车、叉车、吊索具等）\n  - 高空作业安全（脚手架、安全带、防坠落等）\n  - 个人防护用品管理（安全帽、防护眼镜、手套、安全鞋等）\n\n## 知识结构（详细）\n\n### 1. 机械伤害风险\n- **夹伤/挤伤**：手指、手臂被运动部件夹住\n- **切割伤**：锋利边缘、毛刺、切削工具\n- **碰撞伤**：头部碰撞、身体碰撞\n- **坠落伤**：零件坠落、工具坠落、人员坠落\n\n### 2. 焊接作业风险\n- **电击伤**：焊机漏电、接地不良\n- **弧光伤**：电弧紫外线灼伤眼睛和皮肤\n- **烫伤**：高温熔池、焊渣飞溅\n- **火灾爆炸**：易燃物引燃、气瓶泄漏\n- **有毒气体**：焊接烟尘、一氧化碳中毒\n\n### 3. 起重吊装风险\n- **吊物坠落**：吊索具断裂、捆绑不牢\n- **吊物摆动**：碰撞人员、设备\n- **超载**：超过起重机额定载荷\n- **指挥失误**：信号不清、违章指挥\n\n### 4. 高空作业风险\n- **人员坠落**：未系安全带、脚手架不牢\n- **物体打击**：工具、零件从高处坠落\n- **脚手架坍塌**：搭设不规范、超载\n\n### 5. 个人防护用品\n- **头部防护**：安全帽（防止碰撞、坠物打击）\n- **眼部防护**：防护眼镜、焊接面罩（防止飞溅、弧光）\n- **手部防护**：防护手套（防止切割、烫伤、化学品）\n- **足部防护**：安全鞋（防砸、防刺穿、防滑）\n- **呼吸防护**：防尘口罩、防毒面具（防止粉尘、有毒气体）\n\n### 6. 应急处理\n- **机械伤害**：立即停机、呼救、止血、固定、送医\n- **电击伤**：切断电源、心肺复苏、送医\n- **烫伤**：冷水冲洗、覆盖无菌纱布、送医\n- **火灾**：使用灭火器、疏散人员、报警\n\n## 任务步骤（Chain of Thought）\n\n你的任务是**为每个装配步骤添加安全警告**（如果该步骤有安全风险）。请按照以下5个步骤思考：\n\n### 步骤1：识别风险步骤\n- 分析每个装配步骤的操作内容\n- 判断是否涉及高风险作业（焊接、吊装、高空、重物搬运等）\n- 识别潜在的伤害类型（机械伤害、电击、烫伤、坠落等）\n\n### 步骤2：分析风险源\n- 确定风险的来源（设备、工具、材料、环境、人员操作等）\n- 评估风险的严重程度（轻微、中等、严重、致命）\n- 考虑风险的发生概率\n\n### 步骤3：制定预防措施\n- 针对每个风险源，制定具体的预防措施\n- 强调个人防护用品的使用\n- 强调安全操作规程的遵守\n\n### 步骤4：添加安全警告\n- 为每个有风险的步骤添加safety_warnings字段\n- 每条警告要简洁明了，说明具体的风险和预防措施\n- 使用工人能看懂的语言\n\n### 步骤5：验证完整性\n- 检查所有高风险步骤是否都添加了安全警告\n- 检查安全警告是否具体、可操作\n- 检查是否遗漏了任何潜在风险\n\n## 核心原则\n\n1. **步骤级嵌入**：为每个有风险的步骤添加safety_warnings字段，而不是单独列出安全警告\n2. **工人友好**：使用通俗语言，避免专业术语\n3. **具体可操作**：说明具体的风险和预防措施，而不是泛泛而谈\n4. **不重复显示**：安全警告只在下方\"安全\"标签页中统一显示，不在当前步骤详情中重复显示\n\n## 输出格式\n\n严格按照以下JSON格式输出（返回增强后的装配步骤）：\n\n```json\n{\n  \"enhanced_steps\": [\n    {\n      \"step_number\": 1,\n      \"title\": \"点焊定位\",\n      \"parts_used\": [...],\n      \"tools_required\": [...],\n      \"operation\": \"操作说明\",\n      \"quality_check\": \"质量检查\",\n      \"estimated_time_minutes\": 10,\n      \"welding\": {\n        \"required\": true,\n        \"welding_type\": \"点焊\",\n        \"welding_method\": \"CO2气保焊\",\n        ...\n      },\n      \"safety_warnings\": [\n        \"佩戴焊接面罩和防护手套，防止弧光灼伤眼睛和皮肤\",\n        \"确保工件夹紧牢固，防止点焊时位移造成伤害\",\n        \"焊接区域周围3米内不得有易燃物，配备灭火器\",\n        \"焊机必须接地良好，防止漏电触电\"\n      ]\n    },\n    {\n      \"step_number\": 2,\n      \"title\": \"螺栓连接\",\n      \"parts_used\": [...],\n      \"operation\": \"操作说明\",\n      \"quality_check\": \"质量检查\",\n      \"estimated_time_minutes\": 15,\n      \"safety_warnings\": [\n        \"佩戴安全帽和防护眼镜，防止零件坠落和飞溅\",\n        \"使用扭力扳手时注意力度，防止扳手滑脱伤人\"\n      ]\n    },\n    {\n      \"step_number\": 3,\n      \"title\": \"简单装配\",\n      \"parts_used\": [...],\n      \"operation\": \"操作说明\",\n      \"quality_check\": \"质量检查\",\n      \"estimated_time_minutes\": 5\n      // ⚠️ 如果没有明显安全风险，不添加safety_warnings字段\n    }\n  ]\n}\n```\n\n**⚠️ 关键要求**：\n\n1. **步骤级嵌入**：\n   - 为每个有风险的步骤添加`safety_warnings`字段\n   - 没有明显风险的步骤不添加`safety_warnings`字段\n   - 保持原有步骤的所有字段不变\n\n2. **安全警告要具体**：\n   - ✅ 说\"佩戴焊接面罩和防护手套，防止弧光灼伤眼睛和皮肤\"\n   - ❌ 不说\"注意安全\"\n   - ✅ 说\"焊接区域周围3米内不得有易燃物，配备灭火器\"\n   - ❌ 不说\"注意防火\"\n\n3. **使用通俗语言**：\n   - 工人能看懂的语言\n   - 避免专业术语和英文缩写\n\n4. **警告要全面**：\n   - 涵盖个人防护、设备安全、环境安全、操作安全\n   - 每条警告说明具体的风险和预防措施\n\n## 重要提醒\n\n- **只输出JSON，不要输出其他内容**\n- **保持原有字段不变**：不要修改或删除原有的字段（包括welding字段）\n- **警告要简洁明了**：每条警告一句话，说明风险和预防措施\n- **不要过度警告**：只针对有明显风险的步骤添加警告\n",
  "user_query": "请为以下装配步骤添加安全警告（如果有安全风险）。\n\n## 📸 视觉分析任务\n\n**你会看到工程图纸图片，请仔细观察：**\n\n1. **危险作业标识**：\n   - 图纸上的安全警告标识\n   - 特殊作业要求（如高空作业、吊装作业等）\n   - 危险区域标注\n\n2. **零件特征**：\n   - 重型零件（需要吊装）\n   - 锋利边缘（容易割伤）\n   - 高温部件（容易烫伤）\n\n3. **作业环境**：\n   - 狭窄空间（容易碰撞）\n   - 高空位置（容易坠落）\n   - 密闭空间（通风不良）\n\n## 装配步骤\n\n[\n  {\n    \"step_number\": 1,\n    \"action\": \"放置基准件\",\n    \"description\": \"将图纸上标注为1号的方管（FG-T5*80*80-1134-Q345）平稳放置在装配工作台上，作为整个挂架组件的装配基准。\",\n    \"position_description\": \"方管长边水平放置，确保工作台面平整。\",\n    \"parts_used\": [\n      {\n        \"bom_seq\": \"1\",\n        \"bom_name\": \"方管\",\n        \"quantity\": 2,\n        \"drawing_number\": \"1\",\n        \"node_name\": [\n          \"NAUO1\"\n        ],\n        \"bom_code\": \"01.01.01.16586\"\n      }\n    ],\n    \"tools\": [\n      \"行车/吊具\",\n      \"水平仪\"\n    ],\n    \"warnings\": [\n      \"方管较重（13.08kg/根），吊装时注意安全，确保吊具捆绑牢固。\"\n    ]\n  },\n  {\n    \"step_number\": 2,\n    \"action\": \"安装两侧方管\",\n    \"description\": \"将图纸上标注为2号的方管（FG-T5*80*80-318-Q345）垂直放置在1号方管的两端，并进行点焊定位。注意保持两根2号方管与1号方管的端面齐平。\",\n    \"position_description\": \"2号方管垂直于1号方管，位于1号方管的两端。\",\n    \"parts_used\": [\n      {\n        \"bom_seq\": \"2\",\n        \"bom_name\": \"方管\",\n        \"quantity\": 2,\n        \"drawing_number\": \"2\",\n        \"node_name\": [\n          \"NAUO2\"\n        ],\n        \"bom_code\": \"01.02.01.3847\"\n      }\n    ],\n    \"tools\": [\n      \"焊机\",\n      \"角尺\",\n      \"卡具\"\n    ],\n    \"warnings\": [\n      \"点焊时电流不宜过大，防止变形。点焊位置应在后续满焊区域内。\"\n    ],\n    \"welding\": {\n      \"required\": true,\n      \"welding_type\": \"角焊（定位焊）\",\n      \"welding_method\": \"CO2气保焊\",\n      \"weld_size\": \"点焊长度10-15mm，焊脚高度约3mm\",\n      \"welding_position\": \"零件1（长方管）与零件2（短方管）的连接处，平焊\",\n      \"quality_requirements\": \"点焊牢固，定位准确，焊点无明显气孔或裂纹\",\n      \"safety_notes\": \"佩戴焊接面罩和防护手套，确保工作区域通风良好，防止火灾。\"\n    }\n  },\n  {\n    \"step_number\": 3,\n    \"action\": \"安装中侧板\",\n    \"description\": \"将图纸上标注为3号的中侧板（S-RB1830-03-02-Q345）安装在1号方管的内侧，并与2号方管形成矩形框架。根据图纸尺寸（1140mm）进行定位，并进行点焊固定。\",\n    \"position_description\": \"3号中侧板位于1号方管的内侧，垂直于1号方管。\",\n    \"parts_used\": [\n      {\n        \"bom_seq\": \"3\",\n        \"bom_name\": \"中侧板\",\n        \"quantity\": 2,\n        \"drawing_number\": \"3\",\n        \"node_name\": [\n          \"NAUO5\",\n          \"NAUO4\",\n          \"NAUO3\"\n        ],\n        \"bom_code\": \"01.01.03.1453\"\n      }\n    ],\n    \"tools\": [\n      \"焊机\",\n      \"卷尺\",\n      \"磁力夹具\"\n    ],\n    \"warnings\": [\n      \"确保中侧板的安装位置对称，中心线对齐。\"\n    ],\n    \"welding\": {\n      \"required\": true,\n      \"welding_type\": \"角焊（定位焊）\",\n      \"welding_method\": \"CO2气保焊\",\n      \"weld_size\": \"点焊长度10mm，焊脚高度约3mm\",\n      \"welding_position\": \"零件3（中侧板）与零件1（长方管）的连接处，平焊\",\n      \"quality_requirements\": \"定位准确，板材与方管贴合紧密，焊点牢固\",\n      \"safety_notes\": \"注意调整焊接电流，避免薄板烧穿。焊接前清理板材边缘的氧化皮。\"\n    }\n  },\n  {\n    \"step_number\": 4,\n    \"action\": \"安装中连接板\",\n    \"description\": \"将图纸上标注为4号的中连接板（S-RB1830-03-03-Q345）安装在3号中侧板的中间位置，并与1号方管连接。根据图纸尺寸（410mm）进行定位，并进行点焊固定。\",\n    \"position_description\": \"4号中连接板位于3号中侧板之间，垂直于1号方管。\",\n    \"parts_used\": [\n      {\n        \"bom_seq\": \"4\",\n        \"bom_name\": \"中连接板\",\n        \"quantity\": 2,\n        \"drawing_number\": \"4\",\n        \"node_name\": [\n          \"NAUO6\"\n        ],\n        \"bom_code\": \"01.01.02.1869\"\n      }\n    ],\n    \"tools\": [\n      \"焊机\",\n      \"卷尺\"\n    ],\n    \"warnings\": [\n      \"4号连接板的安装孔位必须朝向正确方向，确保后续零件安装顺利。\"\n    ],\n    \"welding\": {\n      \"required\": true,\n      \"welding_type\": \"角焊（定位焊）\",\n      \"welding_method\": \"CO2气保焊\",\n      \"weld_size\": \"点焊长度10mm，焊脚高度约3mm\",\n      \"welding_position\": \"零件4（中连接板）与零件1（长方管）的连接处，平焊\",\n      \"quality_requirements\": \"定位准确，确保连接板垂直于方管，焊点牢固\",\n      \"safety_notes\": \"焊接时注意保护已安装的零件，避免飞溅物损伤。\"\n    }\n  },\n  {\n    \"step_number\": 5,\n    \"action\": \"安装方形板-机加\",\n    \"description\": \"将图纸上标注为5号的方形板-机加（S-RB1830-03-04-Q345）安装在4号中连接板的下方，并与1号方管连接。进行点焊固定。\",\n    \"position_description\": \"5号方形板位于4号连接板下方，与1号方管底部齐平。\",\n    \"parts_used\": [\n      {\n        \"bom_seq\": \"5\",\n        \"bom_name\": \"方形板-机加\",\n        \"quantity\": 1,\n        \"drawing_number\": \"5\"\n      }\n    ],\n    \"tools\": [\n      \"焊机\",\n      \"卡尺\"\n    ],\n    \"warnings\": [\n      \"5号零件为机加件，定位时需保证其安装面平整。\"\n    ],\n    \"welding\": {\n      \"required\": true,\n      \"welding_type\": \"角焊（定位焊）\",\n      \"welding_method\": \"CO2气保焊\",\n      \"weld_size\": \"点焊长度10mm，焊脚高度约3mm\",\n      \"welding_position\": \"零件5（方形板）与零件1（长方管）的连接处，仰焊或平焊（取决于装配姿态）\",\n      \"quality_requirements\": \"定位准确，焊点牢固，确保板材与方管底部齐平\",\n      \"safety_notes\": \"如果需要仰焊，注意防止熔渣滴落烫伤，穿戴好防护服。\"\n    }\n  },\n  {\n    \"step_number\": 6,\n    \"action\": \"安装轴套\",\n    \"description\": \"将图纸上标注为6号的轴套（S-RB1830-03-07-Q235）安装在5号方形板-机加的中心孔位上，并进行焊接固定。\",\n    \"position_description\": \"6号轴套位于5号方形板的中心位置。\",\n    \"parts_used\": [\n      {\n        \"bom_seq\": \"6\",\n        \"bom_name\": \"轴套\",\n        \"quantity\": 1,\n        \"drawing_number\": \"6\"\n      }\n    ],\n    \"tools\": [\n      \"焊机\",\n      \"塞规\"\n    ],\n    \"warnings\": [\n      \"轴套焊接时，注意保护内孔表面，防止焊渣飞溅。\"\n    ],\n    \"welding\": {\n      \"required\": true,\n      \"welding_type\": \"角焊（环形焊）\",\n      \"welding_method\": \"CO2气保焊或手工电弧焊\",\n      \"weld_size\": \"焊脚高度约4mm，环形连续焊\",\n      \"welding_position\": \"零件6（轴套）与零件5（方形板）的连接处，平焊\",\n      \"quality_requirements\": \"焊缝连续、均匀，无咬边、气孔，确保轴套垂直度\",\n      \"safety_notes\": \"焊接前用塞子或耐热胶带保护轴套内孔，防止焊渣进入。注意焊接收弧处的处理。\"\n    }\n  },\n  {\n    \"step_number\": 7,\n    \"action\": \"安装左右连接器板\",\n    \"description\": \"将图纸上标注为7号的左连接器板（S-LP1730(68IN)-MP1140-LT-01-06-Q460）和10号的右连接器板（S-LP1730(68IN)-MP1140-LT-01-08-Q460）分别安装在主体框架的两端，并与1号方管和2号方管连接。进行点焊固定。\",\n    \"position_description\": \"7号和10号连接器板分别位于框架的两侧端面。\",\n    \"parts_used\": [\n      {\n        \"bom_seq\": \"7\",\n        \"bom_name\": \"左连接器板\",\n        \"quantity\": 1,\n        \"drawing_number\": \"7\"\n      },\n      {\n        \"bom_seq\": \"10\",\n        \"bom_name\": \"右连接器板\",\n        \"quantity\": 1,\n        \"drawing_number\": \"10\"\n      }\n    ],\n    \"tools\": [\n      \"焊机\",\n      \"卷尺\"\n    ],\n    \"warnings\": [\n      \"确保连接器板的安装方向正确，孔位朝外。\"\n    ],\n    \"welding\": {\n      \"required\": true,\n      \"welding_type\": \"角焊（定位焊）\",\n      \"welding_method\": \"CO2气保焊\",\n      \"weld_size\": \"点焊长度15mm，焊脚高度约4mm\",\n      \"welding_position\": \"零件7/10（连接器板）与零件1/2（方管）的连接处，平焊/横焊\",\n      \"quality_requirements\": \"定位准确，板材与方管端面齐平，焊点牢固\",\n      \"safety_notes\": \"连接器板较重，定位时需使用夹具固定，防止倾倒。\"\n    }\n  },\n  {\n    \"step_number\": 8,\n    \"action\": \"安装上挂板\",\n    \"description\": \"将图纸上标注为8号的上挂板（S-LP1730(68IN)-MP1140-LT-01-07-Q460）安装在主体框架的顶部，并与1号方管和7号、10号连接器板连接。进行点焊固定。\",\n    \"position_description\": \"8号上挂板位于框架顶部中心位置。\",\n    \"parts_used\": [\n      {\n        \"bom_seq\": \"8\",\n        \"bom_name\": \"上挂板\",\n        \"quantity\": 1,\n        \"drawing_number\": \"8\"\n      }\n    ],\n    \"tools\": [\n      \"焊机\",\n      \"水平仪\"\n    ],\n    \"warnings\": [\n      \"上挂板安装时需保证水平，且与两侧连接器板齐平。\"\n    ],\n    \"welding\": {\n      \"required\": true,\n      \"welding_type\": \"角焊（定位焊）\",\n      \"welding_method\": \"CO2气保焊\",\n      \"weld_size\": \"点焊长度15mm，焊脚高度约4mm\",\n      \"welding_position\": \"零件8（上挂板）与零件1（长方管）和零件7/10（连接器板）的连接处，平焊\",\n      \"quality_requirements\": \"确保上挂板水平度，焊点牢固，为后续满焊做准备\",\n      \"safety_notes\": \"高空作业或吊装定位时，必须系好安全带，确保零件稳定。\"\n    }\n  },\n  {\n    \"step_number\": 9,\n    \"action\": \"安装方形板-机加\",\n    \"description\": \"将图纸上标注为9号的方形板-机加（S-LP1730(68IN)-MP1140-LT-01-10-Q460）安装在8号上挂板的两侧，并进行点焊固定。\",\n    \"position_description\": \"9号方形板位于8号上挂板的两端。\",\n    \"parts_used\": [\n      {\n        \"bom_seq\": \"9\",\n        \"bom_name\": \"方形板-机加\",\n        \"quantity\": 2,\n        \"drawing_number\": \"9\"\n      }\n    ],\n    \"tools\": [\n      \"焊机\",\n      \"卡尺\"\n    ],\n    \"warnings\": [\n      \"9号零件的安装位置需精确，确保后续装配精度。\"\n    ],\n    \"welding\": {\n      \"required\": true,\n      \"welding_type\": \"角焊（定位焊）\",\n      \"welding_method\": \"CO2气保焊\",\n      \"weld_size\": \"点焊长度10mm，焊脚高度约3mm\",\n      \"welding_position\": \"零件9（方形板）与零件8（上挂板）的连接处，平焊\",\n      \"quality_requirements\": \"定位精确，确保两块方形板对称安装\",\n      \"safety_notes\": \"机加件表面可能较光滑，定位时需使用专用夹具，防止滑动。\"\n    }\n  },\n  {\n    \"step_number\": 10,\n    \"action\": \"安装三角板\",\n    \"description\": \"将图纸上标注为11号的三角板（SJB-T8*64*37-Q355B）安装在主体框架的四个角部，用于加强结构强度。根据图纸所示角度（45°/60°）进行定位，并进行点焊固定。\",\n    \"position_description\": \"11号三角板位于1号方管与2号方管的连接处，共4个位置。\",\n    \"parts_used\": [\n      {\n        \"bom_seq\": \"11\",\n        \"bom_name\": \"三角板\",\n        \"quantity\": 4,\n        \"drawing_number\": \"11\"\n      }\n    ],\n    \"tools\": [\n      \"焊机\",\n      \"角度尺\"\n    ],\n    \"warnings\": [\n      \"确保三角板与方管的接触面紧密贴合，角度定位准确。\"\n    ],\n    \"welding\": {\n      \"required\": true,\n      \"welding_type\": \"角焊（定位焊）\",\n      \"welding_method\": \"CO2气保焊\",\n      \"weld_size\": \"点焊长度15mm，焊脚高度约4mm\",\n      \"welding_position\": \"零件11（三角板）与零件1和零件2（方管）的连接处，平焊/横焊\",\n      \"quality_requirements\": \"三角板贴合紧密，焊点牢固，角度定位准确\",\n      \"safety_notes\": \"三角板边缘可能锋利，操作时注意佩戴手套，防止割伤。\"\n    }\n  },\n  {\n    \"step_number\": 11,\n    \"action\": \"安装方形板\",\n    \"description\": \"将图纸上标注为12号的方形板（FXB-T6*75*75-Q235）安装在主体框架的底部，用于支撑和连接。进行点焊固定。\",\n    \"position_description\": \"12号方形板位于框架底部，与1号方管连接。\",\n    \"parts_used\": [\n      {\n        \"bom_seq\": \"12\",\n        \"bom_name\": \"方形板\",\n        \"quantity\": 4,\n        \"drawing_number\": \"12\"\n      }\n    ],\n    \"tools\": [\n      \"焊机\",\n      \"卷尺\"\n    ],\n    \"warnings\": [\n      \"12号方形板为借用件，安装时注意保护其表面。\"\n    ],\n    \"welding\": {\n      \"required\": true,\n      \"welding_type\": \"角焊（定位焊）\",\n      \"welding_method\": \"CO2气保焊\",\n      \"weld_size\": \"点焊长度10mm，焊脚高度约3mm\",\n      \"welding_position\": \"零件12（方形板）与零件1（长方管）的连接处，仰焊\",\n      \"quality_requirements\": \"定位准确，焊点牢固，确保方形板与方管底部齐平\",\n      \"safety_notes\": \"仰焊时，必须穿戴好全套防护装备，防止高温熔渣和飞溅物落入眼睛或衣领。\"\n    }\n  },\n  {\n    \"step_number\": 12,\n    \"action\": \"安装防滑板\",\n    \"description\": \"将图纸上标注为13号的防滑板（S-EDGP1630-DR-01-10-Q235）安装在主体框架的顶部两侧，并进行点焊固定。\",\n    \"position_description\": \"13号防滑板位于框架顶部，与1号方管平行。\",\n    \"parts_used\": [\n      {\n        \"bom_seq\": \"13\",\n        \"bom_name\": \"防滑板\",\n        \"quantity\": 2,\n        \"drawing_number\": \"13\"\n      }\n    ],\n    \"tools\": [\n      \"焊机\"\n    ],\n    \"warnings\": [\n      \"防滑板安装时，确保防滑纹理朝上。\"\n    ],\n    \"welding\": {\n      \"required\": true,\n      \"welding_type\": \"角焊（定位焊）\",\n      \"welding_method\": \"CO2气保焊\",\n      \"weld_size\": \"点焊长度10mm，焊脚高度约3mm\",\n      \"welding_position\": \"零件13（防滑板）与零件1（长方管）的连接处，平焊\",\n      \"quality_requirements\": \"防滑板边缘与方管对齐，焊点牢固\",\n      \"safety_notes\": \"防滑板表面有纹理，焊接时注意清理焊接区域，确保焊缝质量。\"\n    }\n  },\n  {\n    \"step_number\": 13,\n    \"action\": \"满焊与清理\",\n    \"description\": \"对所有已点焊固定的零件连接处进行满焊。焊接完成后，使用角磨机去除所有焊渣和飞溅物，并对锐边、锐角进行倒钝处理，达到图纸技术要求。\",\n    \"position_description\": \"对所有结构连接处进行焊接。\",\n    \"parts_used\": [],\n    \"tools\": [\n      \"焊机\",\n      \"角磨机\",\n      \"钢丝刷\"\n    ],\n    \"warnings\": [\n      \"选择合理的焊接顺序，保证焊接平稳性，防止结构变形。焊接区域需清理干净。\"\n    ],\n    \"welding\": {\n      \"required\": true,\n      \"welding_type\": \"角焊/对接焊（满焊）\",\n      \"welding_method\": \"CO2气保焊（主要）/手工电弧焊（局部）\",\n      \"weld_size\": \"焊脚高度至少5mm（根据板厚确定），所有焊缝连续\",\n      \"welding_position\": \"所有零件连接处，涉及平焊、横焊、立焊、仰焊\",\n      \"quality_requirements\": \"焊缝外观成型良好，焊缝饱满，无裂纹、气孔、夹渣、未熔合等缺陷。重要焊缝需进行无损检测（如磁粉或超声波）。\",\n      \"safety_notes\": \"满焊时会产生大量烟尘和高温，必须开启强力通风设备。焊接顺序要严格按照工艺要求执行，防止焊接应力导致结构变形或开裂。打磨时佩戴护目镜和防尘口罩。\"\n    }\n  }\n]\n\n## 要求\n\n请按照以下5个步骤思考，为装配步骤添加安全警告：\n\n### 步骤1：识别风险步骤\n- 分析每个装配步骤的操作内容\n- 判断是否涉及高风险作业：\n  * **焊接作业**：电击、弧光、烫伤、火灾\n  * **吊装作业**：吊物坠落、碰撞、超载\n  * **高空作业**：人员坠落、物体打击\n  * **重物搬运**：砸伤、扭伤、夹伤\n  * **机械加工**：切割伤、夹伤、碰撞\n\n### 步骤2：分析风险源\n- 确定风险的来源（设备、工具、材料、环境、人员操作等）\n- 评估风险的严重程度（轻微、中等、严重、致命）\n- 考虑风险的发生概率\n\n### 步骤3：制定预防措施\n- 针对每个风险源，制定具体的预防措施\n- 强调个人防护用品的使用：\n  * **焊接**：焊接面罩、防护手套、防护服\n  * **吊装**：安全帽、安全鞋、手套\n  * **高空**：安全带、安全帽、防滑鞋\n  * **机械**：防护眼镜、手套、安全鞋\n\n### 步骤4：添加安全警告\n- 为每个有风险的步骤添加safety_warnings字段\n- 每条警告要简洁明了，说明具体的风险和预防措施\n- 使用工人能看懂的语言\n\n### 步骤5：验证完整性\n- 检查所有高风险步骤是否都添加了安全警告\n- 检查安全警告是否具体、可操作\n- 检查是否遗漏了任何潜在风险\n\n## ⚠️ 强制自检清单（生成后必须逐项检查）\n\n**在输出JSON之前，你必须完成以下验证：**\n\n1. **风险步骤识别验证**：\n   - [ ] 所有涉及焊接、吊装、高空、重物搬运的步骤都添加了safety_warnings字段\n   - [ ] 没有明显风险的步骤没有添加safety_warnings字段\n\n2. **安全警告完整性验证**：\n   - [ ] 每个safety_warnings字段都是字符串数组\n   - [ ] 每条警告都说明了具体的风险和预防措施\n   - [ ] 涵盖了个人防护、设备安全、环境安全、操作安全\n\n3. **语言通俗性验证**：\n   - [ ] 使用工人能看懂的语言\n   - [ ] 避免专业术语和英文缩写\n   - [ ] 每条警告简洁明了（一句话）\n\n4. **原有字段保持验证**：\n   - [ ] 原有步骤的所有字段都保持不变（包括welding字段）\n   - [ ] 没有修改或删除任何原有字段\n\n**如果自检发现任何问题，必须重新生成！**\n\n现在开始为装配步骤添加安全警告！\n",
  "raw_response": "```json\n{\n  \"enhanced_steps\": [\n    {\n      \"step_number\": 1,\n      \"action\": \"放置基准件\",\n      \"description\": \"将图纸上标注为1号的方管（FG-T5*80*80-1134-Q345）平稳放置在装配工作台上，作为整个挂架组件的装配基准。\",\n      \"position_description\": \"方管长边水平放置，确保工作台面平整。\",\n      \"parts_used\": [\n        {\n          \"bom_seq\": \"1\",\n          \"bom_name\": \"方管\",\n          \"quantity\": 2,\n          \"drawing_number\": \"1\",\n          \"node_name\": [\n            \"NAUO1\"\n          ],\n          \"bom_code\": \"01.01.01.16586\"\n        }\n      ],\n      \"tools\": [\n        \"行车/吊具\",\n        \"水平仪\"\n      ],\n      \"warnings\": [\n        \"方管较重（13.08kg/根），吊装时注意安全，确保吊具捆绑牢固。\"\n      ],\n      \"safety_warnings\": [\n        \"吊装前检查行车和吊具是否完好，严禁超载吊装。\",\n        \"吊装时，人员必须佩戴安全帽和防护手套，避免被方管碰撞或砸伤。\",\n        \"方管边缘可能锋利，搬运和放置时注意佩戴防割手套，防止割伤。\"\n      ]\n    },\n    {\n      \"step_number\": 2,\n      \"action\": \"安装两侧方管\",\n      \"description\": \"将图纸上标注为2号的方管（FG-T5*80*80-318-Q345）垂直放置在1号方管的两端，并进行点焊定位。注意保持两根2号方管与1号方管的端面齐平。\",\n      \"position_description\": \"2号方管垂直于1号方管，位于1号方管的两端。\",\n      \"parts_used\": [\n        {\n          \"bom_seq\": \"2\",\n          \"bom_name\": \"方管\",\n          \"quantity\": 2,\n          \"drawing_number\": \"2\",\n          \"node_name\": [\n            \"NAUO2\"\n          ],\n          \"bom_code\": \"01.02.01.3847\"\n        }\n      ],\n      \"tools\": [\n        \"焊机\",\n        \"角尺\",\n        \"卡具\"\n      ],\n      \"warnings\": [\n        \"点焊时电流不宜过大，防止变形。点焊位置应在后续满焊区域内。\"\n      ],\n      \"welding\": {\n        \"required\": true,\n        \"welding_type\": \"角焊（定位焊）\",\n        \"welding_method\": \"CO2气保焊\",\n        \"weld_size\": \"点焊长度10-15mm，焊脚高度约3mm\",\n        \"welding_position\": \"零件1（长方管）与零件2（短方管）的连接处，平焊\",\n        \"quality_requirements\": \"点焊牢固，定位准确，焊点无明显气孔或裂纹\",\n        \"safety_notes\": \"佩戴焊接面罩和防护手套，确保工作区域通风良好，防止火灾。\"\n      },\n      \"safety_warnings\": [\n        \"进行点焊作业时，必须佩戴焊接面罩、防护手套和防护服，防止弧光灼伤和烫伤。\",\n        \"确保焊机接地良好，电缆绝缘完好，防止触电事故。\",\n        \"点焊区域周围应清理干净，不得有易燃易爆物品，防止火灾。\",\n        \"使用卡具固定零件时，注意夹紧力度，防止零件弹出伤人。\"\n      ]\n    },\n    {\n      \"step_number\": 3,\n      \"action\": \"安装中侧板\",\n      \"description\": \"将图纸上标注为3号的中侧板（S-RB1830-03-02-Q345）安装在1号方管的内侧，并与2号方管形成矩形框架。根据图纸尺寸（1140mm）进行定位，并进行点焊固定。\",\n      \"position_description\": \"3号中侧板位于1号方管的内侧，垂直于1号方管。\",\n      \"parts_used\": [\n        {\n          \"bom_seq\": \"3\",\n          \"bom_name\": \"中侧板\",\n          \"quantity\": 2,\n          \"drawing_number\": \"3\",\n          \"node_name\": [\n            \"NAUO5\",\n            \"NAUO4\",\n            \"NAUO3\"\n          ],\n          \"bom_code\": \"01.01.03.1453\"\n        }\n      ],\n      \"tools\": [\n        \"焊机\",\n        \"卷尺\",\n        \"磁力夹具\"\n      ],\n      \"warnings\": [\n        \"确保中侧板的安装位置对称，中心线对齐。\"\n      ],\n      \"welding\": {\n        \"required\": true,\n        \"welding_type\": \"角焊（定位焊）\",\n        \"welding_method\": \"CO2气保焊\",\n        \"weld_size\": \"点焊长度10mm，焊脚高度约3mm\",\n        \"welding_position\": \"零件3（中侧板）与零件1（长方管）的连接处，平焊\",\n        \"quality_requirements\": \"定位准确，板材与方管贴合紧密，焊点牢固\",\n        \"safety_notes\": \"注意调整焊接电流，避免薄板烧穿。焊接前清理板材边缘的氧化皮。\"\n      },\n      \"safety_warnings\": [\n        \"板材边缘可能锋利，操作时必须佩戴防割手套，防止割伤。\",\n        \"点焊时注意控制焊接烟尘，确保通风良好，防止吸入有害气体。\",\n        \"使用磁力夹具时，注意夹具吸力，防止夹具突然脱落或移动造成零件砸伤。\"\n      ]\n    },\n    {\n      \"step_number\": 4,\n      \"action\": \"安装中连接板\",\n      \"description\": \"将图纸上标注为4号的中连接板（S-RB1830-03-03-Q345）安装在3号中侧板的中间位置，并与1号方管连接。根据图纸尺寸（410mm）进行定位，并进行点焊固定。\",\n      \"position_description\": \"4号中连接板位于3号中侧板之间，垂直于1号方管。\",\n      \"parts_used\": [\n        {\n          \"bom_seq\": \"4\",\n          \"bom_name\": \"中连接板\",\n          \"quantity\": 2,\n          \"drawing_number\": \"4\",\n          \"node_name\": [\n            \"NAUO6\"\n          ],\n          \"bom_code\": \"01.01.02.1869\"\n        }\n      ],\n      \"tools\": [\n        \"焊机\",\n        \"卷尺\"\n      ],\n      \"warnings\": [\n        \"4号连接板的安装孔位必须朝向正确方向，确保后续零件安装顺利。\"\n      ],\n      \"welding\": {\n        \"required\": true,\n        \"welding_type\": \"角焊（定位焊）\",\n        \"welding_method\": \"CO2气保焊\",\n        \"weld_size\": \"点焊长度10mm，焊脚高度约3mm\",\n        \"welding_position\": \"零件4（中连接板）与零件1（长方管）的连接处，平焊\",\n        \"quality_requirements\": \"定位准确，确保连接板垂直于方管，焊点牢固\",\n        \"safety_notes\": \"焊接时注意保护已安装的零件，避免飞溅物损伤。\"\n      },\n      \"safety_warnings\": [\n        \"点焊时，注意防止焊渣飞溅到眼睛或皮肤上，必须佩戴防护眼镜和面罩。\",\n        \"焊接完成后，不要立即用手触摸焊点和零件，防止高温烫伤。\"\n      ]\n    },\n    {\n      \"step_number\": 5,\n      \"action\": \"安装方形板-机加\",\n      \"description\": \"将图纸上标注为5号的方形板-机加（S-RB1830-03-04-Q345）安装在4号中连接板的下方，并与1号方管连接。进行点焊固定。\",\n      \"position_description\": \"5号方形板位于4号连接板下方，与1号方管底部齐平。\",\n      \"parts_used\": [\n        {\n          \"bom_seq\": \"5\",\n          \"bom_name\": \"方形板-机加\",\n          \"quantity\": 1,\n          \"drawing_number\": \"5\"\n        }\n      ],\n      \"tools\": [\n        \"焊机\",\n        \"卡尺\"\n      ],\n      \"warnings\": [\n        \"5号零件为机加件，定位时需保证其安装面平整。\"\n      ],\n      \"welding\": {\n        \"required\": true,\n        \"welding_type\": \"角焊（定位焊）\",\n        \"welding_method\": \"CO2气保焊\",\n        \"weld_size\": \"点焊长度10mm，焊脚高度约3mm\",\n        \"welding_position\": \"零件5（方形板）与零件1（长方管）的连接处，仰焊或平焊（取决于装配姿态）\",\n        \"quality_requirements\": \"定位准确，焊点牢固，确保板材与方管底部齐平\",\n        \"safety_notes\": \"如果需要仰焊，注意防止熔渣滴落烫伤，穿戴好防护服。\"\n      },\n      \"safety_warnings\": [\n        \"如果需要仰焊操作，必须穿戴皮质防护服和头罩，防止高温熔渣滴落烫伤。\",\n        \"焊接前检查工作台下方是否有人或易燃物，确保安全。\",\n        \"机加件表面光滑，搬运时注意抓稳，防止滑落砸伤脚部，应穿安全鞋。\"\n      ]\n    },\n    {\n      \"step_number\": 6,\n      \"action\": \"安装轴套\",\n      \"description\": \"将图纸上标注为6号的轴套（S-RB1830-03-07-Q235）安装在5号方形板-机加的中心孔位上，并进行焊接固定。\",\n      \"position_description\": \"6号轴套位于5号方形板的中心位置。\",\n      \"parts_used\": [\n        {\n          \"bom_seq\": \"6\",\n          \"bom_name\": \"轴套\",\n          \"quantity\": 1,\n          \"drawing_number\": \"6\"\n        }\n      ],\n      \"tools\": [\n        \"焊机\",\n        \"塞规\"\n      ],\n      \"warnings\": [\n        \"轴套焊接时，注意保护内孔表面，防止焊渣飞溅。\"\n      ],\n      \"welding\": {\n        \"required\": true,\n        \"welding_type\": \"角焊（环形焊）\",\n        \"welding_method\": \"CO2气保焊或手工电弧焊\",\n        \"weld_size\": \"焊脚高度约4mm，环形连续焊\",\n        \"welding_position\": \"零件6（轴套）与零件5（方形板）的连接处，平焊\",\n        \"quality_requirements\": \"焊缝连续、均匀，无咬边、气孔，确保轴套垂直度\",\n        \"safety_notes\": \"焊接前用塞子或耐热胶带保护轴套内孔，防止焊渣进入。注意焊接收弧处的处理。\"\n      },\n      \"safety_warnings\": [\n        \"进行环形连续焊时，热量集中，注意焊枪或焊钳的温度，防止烫伤。\",\n        \"确保轴套定位稳定，防止焊接过程中轴套倾斜或移动。\",\n        \"焊接烟尘较大，必须开启局部排风装置，保护呼吸道。\"\n      ]\n    },\n    {\n      \"step_number\": 7,\n      \"action\": \"安装左右连接器板\",\n      \"description\": \"将图纸上标注为7号的左连接器板（S-LP1730(68IN)-MP1140-LT-01-06-Q460）和10号的右连接器板（S-LP1730(68IN)-MP1140-LT-01-08-Q460）分别安装在主体框架的两端，并与1号方管和2号方管连接。进行点焊固定。\",\n      \"position_description\": \"7号和10号连接器板分别位于框架的两侧端面。\",\n      \"parts_used\": [\n        {\n          \"bom_seq\": \"7\",\n          \"bom_name\": \"左连接器板\",\n          \"quantity\": 1,\n          \"drawing_number\": \"7\"\n        },\n        {\n          \"bom_seq\": \"10\",\n          \"bom_name\": \"右连接器板\",\n          \"quantity\": 1,\n          \"drawing_number\": \"10\"\n        }\n      ],\n      \"tools\": [\n        \"焊机\",\n        \"卷尺\"\n      ],\n      \"warnings\": [\n        \"确保连接器板的安装方向正确，孔位朝外。\"\n      ],\n      \"welding\": {\n        \"required\": true,\n        \"welding_type\": \"角焊（定位焊）\",\n        \"welding_method\": \"CO2气保焊\",\n        \"weld_size\": \"点焊长度15mm，焊脚高度约4mm\",\n        \"welding_position\": \"零件7/10（连接器板）与零件1/2（方管）的连接处，平焊/横焊\",\n        \"quality_requirements\": \"定位准确，板材与方管端面齐平，焊点牢固\",\n        \"safety_notes\": \"连接器板较重，定位时需使用夹具固定，防止倾倒。\"\n      },\n      \"safety_warnings\": [\n        \"连接器板尺寸较大，搬运时应两人协同操作或使用辅助工具，防止扭伤或砸伤。\",\n        \"定位时必须使用夹具或磁铁牢固固定，防止板材倾倒或滑落。\",\n        \"点焊时注意站位，避免身体部位靠近焊接电弧，防止弧光伤害。\"\n      ]\n    },\n    {\n      \"step_number\": 8,\n      \"action\": \"安装上挂板\",\n      \"description\": \"将图纸上标注为8号的上挂板（S-LP1730(68IN)-MP1140-LT-01-07-Q460）安装在主体框架的顶部，并与1号方管和7号、10号连接器板连接。进行点焊固定。\",\n      \"position_description\": \"8号上挂板位于框架顶部中心位置。\",\n      \"parts_used\": [\n        {\n          \"bom_seq\": \"8\",\n          \"bom_name\": \"上挂板\",\n          \"quantity\": 1,\n          \"drawing_number\": \"8\"\n        }\n      ],\n      \"tools\": [\n        \"焊机\",\n        \"水平仪\"\n      ],\n      \"warnings\": [\n        \"上挂板安装时需保证水平，且与两侧连接器板齐平。\"\n      ],\n      \"welding\": {\n        \"required\": true,\n        \"welding_type\": \"角焊（定位焊）\",\n        \"welding_method\": \"CO2气保焊\",\n        \"weld_size\": \"点焊长度15mm，焊脚高度约4mm\",\n        \"welding_position\": \"零件8（上挂板）与零件1（长方管）和零件7/10（连接器板）的连接处，平焊\",\n        \"quality_requirements\": \"确保上挂板水平度，焊点牢固，为后续满焊做准备\",\n        \"safety_notes\": \"高空作业或吊装定位时，必须系好安全带，确保零件稳定。\"\n      },\n      \"safety_warnings\": [\n        \"如果装配高度超过2米，必须使用稳固的脚手架或升降平台，并系好安全带。\",\n        \"上挂板定位时，应使用吊具或辅助支撑，防止零件从高处坠落伤人。\",\n        \"点焊作业时，注意检查周围环境，防止高处焊渣飞溅伤及下方人员。\"\n      ]\n    },\n    {\n      \"step_number\": 9,\n      \"action\": \"安装方形板-机加\",\n      \"description\": \"将图纸上标注为9号的方形板-机加（S-LP1730(68IN)-MP1140-LT-01-10-Q460）安装在8号上挂板的两侧，并进行点焊固定。\",\n      \"position_description\": \"9号方形板位于8号上挂板的两端。\",\n      \"parts_used\": [\n        {\n          \"bom_seq\": \"9\",\n          \"bom_name\": \"方形板-机加\",\n          \"quantity\": 2,\n          \"drawing_number\": \"9\"\n        }\n      ],\n      \"tools\": [\n        \"焊机\",\n        \"卡尺\"\n      ],\n      \"warnings\": [\n        \"9号零件的安装位置需精确，确保后续装配精度。\"\n      ],\n      \"welding\": {\n        \"required\": true,\n        \"welding_type\": \"角焊（定位焊）\",\n        \"welding_method\": \"CO2气保焊\",\n        \"weld_size\": \"点焊长度10mm，焊脚高度约3mm\",\n        \"welding_position\": \"零件9（方形板）与零件8（上挂板）的连接处，平焊\",\n        \"quality_requirements\": \"定位精确，确保两块方形板对称安装\",\n        \"safety_notes\": \"机加件表面可能较光滑，定位时需使用专用夹具，防止滑动。\"\n      },\n      \"safety_warnings\": [\n        \"机加件边缘可能存在毛刺，操作时佩戴防护手套，防止割伤。\",\n        \"点焊时注意保持身体平衡，避免因焊接动作导致从高处跌落（如果是在高处作业）。\"\n      ]\n    },\n    {\n      \"step_number\": 10,\n      \"action\": \"安装三角板\",\n      \"description\": \"将图纸上标注为11号的三角板（SJB-T8*64*37-Q355B）安装在主体框架的四个角部，用于加强结构强度。根据图纸所示角度（45°/60°）进行定位，并进行点焊固定。\",\n      \"position_description\": \"11号三角板位于1号方管与2号方管的连接处，共4个位置。\",\n      \"parts_used\": [\n        {\n          \"bom_seq\": \"11\",\n          \"bom_name\": \"三角板\",\n          \"quantity\": 4,\n          \"drawing_number\": \"11\"\n        }\n      ],\n      \"tools\": [\n        \"焊机\",\n        \"角度尺\"\n      ],\n      \"warnings\": [\n        \"确保三角板与方管的接触面紧密贴合，角度定位准确。\"\n      ],\n      \"welding\": {\n        \"required\": true,\n        \"welding_type\": \"角焊（定位焊）\",\n        \"welding_method\": \"CO2气保焊\",\n        \"weld_size\": \"点焊长度15mm，焊脚高度约4mm\",\n        \"welding_position\": \"零件11（三角板）与零件1和零件2（方管）的连接处，平焊/横焊\",\n        \"quality_requirements\": \"三角板贴合紧密，焊点牢固，角度定位准确\",\n        \"safety_notes\": \"三角板边缘可能锋利，操作时注意佩戴手套，防止割伤。\"\n      },\n      \"safety_warnings\": [\n        \"三角板边缘锋利，搬运和定位时必须佩戴防割手套，防止手指割伤。\",\n        \"点焊时注意焊枪角度，避免焊渣飞溅到身体或周围设备上。\",\n        \"焊接完成后，及时清理焊渣，防止人员被尖锐焊渣刺伤。\"\n      ]\n    },\n    {\n      \"step_number\": 11,\n      \"action\": \"安装方形板\",\n      \"description\": \"将图纸上标注为12号的方形板（FXB-T6*75*75-Q235）安装在主体框架的底部，用于支撑和连接。进行点焊固定。\",\n      \"position_description\": \"12号方形板位于框架底部，与1号方管连接。\",\n      \"parts_used\": [\n        {\n          \"bom_seq\": \"12\",\n          \"bom_name\": \"方形板\",\n          \"quantity\": 4,\n          \"drawing_number\": \"12\"\n        }\n      ],\n      \"tools\": [\n        \"焊机\",\n        \"卷尺\"\n      ],\n      \"warnings\": [\n        \"12号方形板为借用件，安装时注意保护其表面。\"\n      ],\n      \"welding\": {\n        \"required\": true,\n        \"welding_type\": \"角焊（定位焊）\",\n        \"welding_method\": \"CO2气保焊\",\n        \"weld_size\": \"点焊长度10mm，焊脚高度约3mm\",\n        \"welding_position\": \"零件12（方形板）与零件1（长方管）的连接处，仰焊\",\n        \"quality_requirements\": \"定位准确，焊点牢固，确保方形板与方管底部齐平\",\n        \"safety_notes\": \"仰焊时，必须穿戴好全套防护装备，防止高温熔渣和飞溅物落入眼睛或衣领。\"\n      },\n      \"safety_warnings\": [\n        \"进行仰焊作业时，必须穿戴皮质防护服、头罩和安全鞋，防止高温熔渣和火花烫伤。\",\n        \"仰焊时应保持稳定姿势，避免长时间仰头操作造成颈部疲劳或失衡。\",\n        \"确保工作区域地面干燥，防止潮湿环境下的触电风险。\"\n      ]\n    },\n    {\n      \"step_number\": 12,\n      \"action\": \"安装防滑板\",\n      \"description\": \"将图纸上标注为13号的防滑板（S-EDGP1630-DR-01-10-Q235）安装在主体框架的顶部两侧，并进行点焊固定。\",\n      \"position_description\": \"13号防滑板位于框架顶部，与1号方管平行。\",\n      \"parts_used\": [\n        {\n          \"bom_seq\": \"13\",\n          \"bom_name\": \"防滑板\",\n          \"quantity\": 2,\n          \"drawing_number\": \"13\"\n        }\n      ],\n      \"tools\": [\n        \"焊机\"\n      ],\n      \"warnings\": [\n        \"防滑板安装时，确保防滑纹理朝上。\"\n      ],\n      \"welding\": {\n        \"required\": true,\n        \"welding_type\": \"角焊（定位焊）\",\n        \"welding_method\": \"CO2气保焊\",\n        \"weld_size\": \"点焊长度10mm，焊脚高度约3mm\",\n        \"welding_position\": \"零件13（防滑板）与零件1（长方管）的连接处，平焊\",\n        \"quality_requirements\": \"防滑板边缘与方管对齐，焊点牢固\",\n        \"safety_notes\": \"防滑板表面有纹理，焊接时注意清理焊接区域，确保焊缝质量。\"\n      },\n      \"safety_warnings\": [\n        \"防滑板面积较大，搬运时注意边缘，防止割伤。\",\n        \"焊接前必须清理防滑板表面的油污和杂质，防止焊接过程中产生有毒烟雾。\",\n        \"点焊完成后，检查防滑板是否牢固，防止人员踩踏时发生意外。\"\n      ]\n    },\n    {\n      \"step_number\": 13,\n      \"action\": \"满焊与清理\",\n      \"description\": \"对所有已点焊固定的零件连接处进行满焊。焊接完成后，使用角磨机去除所有焊渣和飞溅物，并对锐边、锐角进行倒钝处理，达到图纸技术要求。\",\n      \"position_description\": \"对所有结构连接处进行焊接。\",\n      \"parts_used\": [],\n      \"tools\": [\n        \"焊机\",\n        \"角磨机\",\n        \"钢丝刷\"\n      ],\n      \"warnings\": [\n        \"选择合理的焊接顺序，保证焊接平稳性，防止结构变形。焊接区域需清理干净。\"\n      ],\n      \"welding\": {\n        \"required\": true,\n        \"welding_type\": \"角焊/对接焊（满焊）\",\n        \"welding_method\": \"CO2气保焊（主要）/手工电弧焊（局部）\",\n        \"weld_size\": \"焊脚高度至少5mm（根据板厚确定），所有焊缝连续\",\n        \"welding_position\": \"所有零件连接处，涉及平焊、横焊、立焊、仰焊\",\n        \"quality_requirements\": \"焊缝外观成型良好，焊缝饱满，无裂纹、气孔、夹渣、未熔合等缺陷。重要焊缝需进行无损检测（如磁粉或超声波）。\",\n        \"safety_notes\": \"满焊时会产生大量烟尘和高温，必须开启强力通风设备。焊接顺序要严格按照工艺要求执行，防止焊接应力导致结构变形或开裂。打磨时佩戴护目镜和防尘口罩。\"\n      },\n      \"safety_warnings\": [\n        \"满焊作业时，必须佩戴全套焊接防护用品，包括呼吸防护，防止吸入大量焊接烟尘。\",\n        \"焊接过程中，注意检查焊机电缆和气瓶连接，防止漏电或气体泄漏。\",\n        \"使用角磨机打磨时，必须佩戴防护眼镜和面罩，防止高速飞溅的火花和金属碎屑伤眼。\",\n        \"打磨作业时，确保磨光机防护罩安装到位，严禁拆除，防止砂轮片破碎伤人。\",\n        \"倒钝处理时，注意锐边和毛刺，佩戴防割手套，防止割伤。\"\n      ]\n    }\n  ]\n}\n```",
  "parsed_result": {
    "enhanced_steps": [
      {
        "step_number": 1,
        "action": "放置基准件",
        "description": "将图纸上标注为1号的方管（FG-T5*80*80-1134-Q345）平稳放置在装配工作台上，作为整个挂架组件的装配基准。",
        "position_description": "方管长边水平放置，确保工作台面平整。",
        "parts_used": [
          {
            "bom_seq": "1",
            "bom_name": "方管",
            "quantity": 2,
            "drawing_number": "1",
            "node_name": [
              "NAUO1"
            ],
            "bom_code": "01.01.01.16586"
          }
        ],
        "tools": [
          "行车/吊具",
          "水平仪"
        ],
        "warnings": [
          "方管较重（13.08kg/根），吊装时注意安全，确保吊具捆绑牢固。"
        ],
        "safety_warnings": [
          "吊装前检查行车和吊具是否完好，严禁超载吊装。",
          "吊装时，人员必须佩戴安全帽和防护手套，避免被方管碰撞或砸伤。",
          "方管边缘可能锋利，搬运和放置时注意佩戴防割手套，防止割伤。"
        ]
      },
      {
        "step_number": 2,
        "action": "安装两侧方管",
        "description": "将图纸上标注为2号的方管（FG-T5*80*80-318-Q345）垂直放置在1号方管的两端，并进行点焊定位。注意保持两根2号方管与1号方管的端面齐平。",
        "position_description": "2号方管垂直于1号方管，位于1号方管的两端。",
        "parts_used": [
          {
            "bom_seq": "2",
            "bom_name": "方管",
            "quantity": 2,
            "drawing_number": "2",
            "node_name": [
              "NAUO2"
            ],
            "bom_code": "01.02.01.3847"
          }
        ],
        "tools": [
          "焊机",
          "角尺",
          "卡具"
        ],
        "warnings": [
          "点焊时电流不宜过大，防止变形。点焊位置应在后续满焊区域内。"
        ],
        "welding": {
          "required": true,
          "welding_type": "角焊（定位焊）",
          "welding_method": "CO2气保焊",
          "weld_size": "点焊长度10-15mm，焊脚高度约3mm",
          "welding_position": "零件1（长方管）与零件2（短方管）的连接处，平焊",
          "quality_requirements": "点焊牢固，定位准确，焊点无明显气孔或裂纹",
          "safety_notes": "佩戴焊接面罩和防护手套，确保工作区域通风良好，防止火灾。"
        },
        "safety_warnings": [
          "进行点焊作业时，必须佩戴焊接面罩、防护手套和防护服，防止弧光灼伤和烫伤。",
          "确保焊机接地良好，电缆绝缘完好，防止触电事故。",
          "点焊区域周围应清理干净，不得有易燃易爆物品，防止火灾。",
          "使用卡具固定零件时，注意夹紧力度，防止零件弹出伤人。"
        ]
      },
      {
        "step_number": 3,
        "action": "安装中侧板",
        "description": "将图纸上标注为3号的中侧板（S-RB1830-03-02-Q345）安装在1号方管的内侧，并与2号方管形成矩形框架。根据图纸尺寸（1140mm）进行定位，并进行点焊固定。",
        "position_description": "3号中侧板位于1号方管的内侧，垂直于1号方管。",
        "parts_used": [
          {
            "bom_seq": "3",
            "bom_name": "中侧板",
            "quantity": 2,
            "drawing_number": "3",
            "node_name": [
              "NAUO5",
              "NAUO4",
              "NAUO3"
            ],
            "bom_code": "01.01.03.1453"
          }
        ],
        "tools": [
          "焊机",
          "卷尺",
          "磁力夹具"
        ],
        "warnings": [
          "确保中侧板的安装位置对称，中心线对齐。"
        ],
        "welding": {
          "required": true,
          "welding_type": "角焊（定位焊）",
          "welding_method": "CO2气保焊",
          "weld_size": "点焊长度10mm，焊脚高度约3mm",
          "welding_position": "零件3（中侧板）与零件1（长方管）的连接处，平焊",
          "quality_requirements": "定位准确，板材与方管贴合紧密，焊点牢固",
          "safety_notes": "注意调整焊接电流，避免薄板烧穿。焊接前清理板材边缘的氧化皮。"
        },
        "safety_warnings": [
          "板材边缘可能锋利，操作时必须佩戴防割手套，防止割伤。",
          "点焊时注意控制焊接烟尘，确保通风良好，防止吸入有害气体。",
          "使用磁力夹具时，注意夹具吸力，防止夹具突然脱落或移动造成零件砸伤。"
        ]
      },
      {
        "step_number": 4,
        "action": "安装中连接板",
        "description": "将图纸上标注为4号的中连接板（S-RB1830-03-03-Q345）安装在3号中侧板的中间位置，并与1号方管连接。根据图纸尺寸（410mm）进行定位，并进行点焊固定。",
        "position_description": "4号中连接板位于3号中侧板之间，垂直于1号方管。",
        "parts_used": [
          {
            "bom_seq": "4",
            "bom_name": "中连接板",
            "quantity": 2,
            "drawing_number": "4",
            "node_name": [
              "NAUO6"
            ],
            "bom_code": "01.01.02.1869"
          }
        ],
        "tools": [
          "焊机",
          "卷尺"
        ],
        "warnings": [
          "4号连接板的安装孔位必须朝向正确方向，确保后续零件安装顺利。"
        ],
        "welding": {
          "required": true,
          "welding_type": "角焊（定位焊）",
          "welding_method": "CO2气保焊",
          "weld_size": "点焊长度10mm，焊脚高度约3mm",
          "welding_position": "零件4（中连接板）与零件1（长方管）的连接处，平焊",
          "quality_requirements": "定位准确，确保连接板垂直于方管，焊点牢固",
          "safety_notes": "焊接时注意保护已安装的零件，避免飞溅物损伤。"
        },
        "safety_warnings": [
          "点焊时，注意防止焊渣飞溅到眼睛或皮肤上，必须佩戴防护眼镜和面罩。",
          "焊接完成后，不要立即用手触摸焊点和零件，防止高温烫伤。"
        ]
      },
      {
        "step_number": 5,
        "action": "安装方形板-机加",
        "description": "将图纸上标注为5号的方形板-机加（S-RB1830-03-04-Q345）安装在4号中连接板的下方，并与1号方管连接。进行点焊固定。",
        "position_description": "5号方形板位于4号连接板下方，与1号方管底部齐平。",
        "parts_used": [
          {
            "bom_seq": "5",
            "bom_name": "方形板-机加",
            "quantity": 1,
            "drawing_number": "5"
          }
        ],
        "tools": [
          "焊机",
          "卡尺"
        ],
        "warnings": [
          "5号零件为机加件，定位时需保证其安装面平整。"
        ],
        "welding": {
          "required": true,
          "welding_type": "角焊（定位焊）",
          "welding_method": "CO2气保焊",
          "weld_size": "点焊长度10mm，焊脚高度约3mm",
          "welding_position": "零件5（方形板）与零件1（长方管）的连接处，仰焊或平焊（取决于装配姿态）",
          "quality_requirements": "定位准确，焊点牢固，确保板材与方管底部齐平",
          "safety_notes": "如果需要仰焊，注意防止熔渣滴落烫伤，穿戴好防护服。"
        },
        "safety_warnings": [
          "如果需要仰焊操作，必须穿戴皮质防护服和头罩，防止高温熔渣滴落烫伤。",
          "焊接前检查工作台下方是否有人或易燃物，确保安全。",
          "机加件表面光滑，搬运时注意抓稳，防止滑落砸伤脚部，应穿安全鞋。"
        ]
      },
      {
        "step_number": 6,
        "action": "安装轴套",
        "description": "将图纸上标注为6号的轴套（S-RB1830-03-07-Q235）安装在5号方形板-机加的中心孔位上，并进行焊接固定。",
        "position_description": "6号轴套位于5号方形板的中心位置。",
        "parts_used": [
          {
            "bom_seq": "6",
            "bom_name": "轴套",
            "quantity": 1,
            "drawing_number": "6"
          }
        ],
        "tools": [
          "焊机",
          "塞规"
        ],
        "warnings": [
          "轴套焊接时，注意保护内孔表面，防止焊渣飞溅。"
        ],
        "welding": {
          "required": true,
          "welding_type": "角焊（环形焊）",
          "welding_method": "CO2气保焊或手工电弧焊",
          "weld_size": "焊脚高度约4mm，环形连续焊",
          "welding_position": "零件6（轴套）与零件5（方形板）的连接处，平焊",
          "quality_requirements": "焊缝连续、均匀，无咬边、气孔，确保轴套垂直度",
          "safety_notes": "焊接前用塞子或耐热胶带保护轴套内孔，防止焊渣进入。注意焊接收弧处的处理。"
        },
        "safety_warnings": [
          "进行环形连续焊时，热量集中，注意焊枪或焊钳的温度，防止烫伤。",
          "确保轴套定位稳定，防止焊接过程中轴套倾斜或移动。",
          "焊接烟尘较大，必须开启局部排风装置，保护呼吸道。"
        ]
      },
      {
        "step_number": 7,
        "action": "安装左右连接器板",
        "description": "将图纸上标注为7号的左连接器板（S-LP1730(68IN)-MP1140-LT-01-06-Q460）和10号的右连接器板（S-LP1730(68IN)-MP1140-LT-01-08-Q460）分别安装在主体框架的两端，并与1号方管和2号方管连接。进行点焊固定。",
        "position_description": "7号和10号连接器板分别位于框架的两侧端面。",
        "parts_used": [
          {
            "bom_seq": "7",
            "bom_name": "左连接器板",
            "quantity": 1,
            "drawing_number": "7"
          },
          {
            "bom_seq": "10",
            "bom_name": "右连接器板",
            "quantity": 1,
            "drawing_number": "10"
          }
        ],
        "tools": [
          "焊机",
          "卷尺"
        ],
        "warnings": [
          "确保连接器板的安装方向正确，孔位朝外。"
        ],
        "welding": {
          "required": true,
          "welding_type": "角焊（定位焊）",
          "welding_method": "CO2气保焊",
          "weld_size": "点焊长度15mm，焊脚高度约4mm",
          "welding_position": "零件7/10（连接器板）与零件1/2（方管）的连接处，平焊/横焊",
          "quality_requirements": "定位准确，板材与方管端面齐平，焊点牢固",
          "safety_notes": "连接器板较重，定位时需使用夹具固定，防止倾倒。"
        },
        "safety_warnings": [
          "连接器板尺寸较大，搬运时应两人协同操作或使用辅助工具，防止扭伤或砸伤。",
          "定位时必须使用夹具或磁铁牢固固定，防止板材倾倒或滑落。",
          "点焊时注意站位，避免身体部位靠近焊接电弧，防止弧光伤害。"
        ]
      },
      {
        "step_number": 8,
        "action": "安装上挂板",
        "description": "将图纸上标注为8号的上挂板（S-LP1730(68IN)-MP1140-LT-01-07-Q460）安装在主体框架的顶部，并与1号方管和7号、10号连接器板连接。进行点焊固定。",
        "position_description": "8号上挂板位于框架顶部中心位置。",
        "parts_used": [
          {
            "bom_seq": "8",
            "bom_name": "上挂板",
            "quantity": 1,
            "drawing_number": "8"
          }
        ],
        "tools": [
          "焊机",
          "水平仪"
        ],
        "warnings": [
          "上挂板安装时需保证水平，且与两侧连接器板齐平。"
        ],
        "welding": {
          "required": true,
          "welding_type": "角焊（定位焊）",
          "welding_method": "CO2气保焊",
          "weld_size": "点焊长度15mm，焊脚高度约4mm",
          "welding_position": "零件8（上挂板）与零件1（长方管）和零件7/10（连接器板）的连接处，平焊",
          "quality_requirements": "确保上挂板水平度，焊点牢固，为后续满焊做准备",
          "safety_notes": "高空作业或吊装定位时，必须系好安全带，确保零件稳定。"
        },
        "safety_warnings": [
          "如果装配高度超过2米，必须使用稳固的脚手架或升降平台，并系好安全带。",
          "上挂板定位时，应使用吊具或辅助支撑，防止零件从高处坠落伤人。",
          "点焊作业时，注意检查周围环境，防止高处焊渣飞溅伤及下方人员。"
        ]
      },
      {
        "step_number": 9,
        "action": "安装方形板-机加",
        "description": "将图纸上标注为9号的方形板-机加（S-LP1730(68IN)-MP1140-LT-01-10-Q460）安装在8号上挂板的两侧，并进行点焊固定。",
        "position_description": "9号方形板位于8号上挂板的两端。",
        "parts_used": [
          {
            "bom_seq": "9",
            "bom_name": "方形板-机加",
            "quantity": 2,
            "drawing_number": "9"
          }
        ],
        "tools": [
          "焊机",
          "卡尺"
        ],
        "warnings": [
          "9号零件的安装位置需精确，确保后续装配精度。"
        ],
        "welding": {
          "required": true,
          "welding_type": "角焊（定位焊）",
          "welding_method": "CO2气保焊",
          "weld_size": "点焊长度10mm，焊脚高度约3mm",
          "welding_position": "零件9（方形板）与零件8（上挂板）的连接处，平焊",
          "quality_requirements": "定位精确，确保两块方形板对称安装",
          "safety_notes": "机加件表面可能较光滑，定位时需使用专用夹具，防止滑动。"
        },
        "safety_warnings": [
          "机加件边缘可能存在毛刺，操作时佩戴防护手套，防止割伤。",
          "点焊时注意保持身体平衡，避免因焊接动作导致从高处跌落（如果是在高处作业）。"
        ]
      },
      {
        "step_number": 10,
        "action": "安装三角板",
        "description": "将图纸上标注为11号的三角板（SJB-T8*64*37-Q355B）安装在主体框架的四个角部，用于加强结构强度。根据图纸所示角度（45°/60°）进行定位，并进行点焊固定。",
        "position_description": "11号三角板位于1号方管与2号方管的连接处，共4个位置。",
        "parts_used": [
          {
            "bom_seq": "11",
            "bom_name": "三角板",
            "quantity": 4,
            "drawing_number": "11"
          }
        ],
        "tools": [
          "焊机",
          "角度尺"
        ],
        "warnings": [
          "确保三角板与方管的接触面紧密贴合，角度定位准确。"
        ],
        "welding": {
          "required": true,
          "welding_type": "角焊（定位焊）",
          "welding_method": "CO2气保焊",
          "weld_size": "点焊长度15mm，焊脚高度约4mm",
          "welding_position": "零件11（三角板）与零件1和零件2（方管）的连接处，平焊/横焊",
          "quality_requirements": "三角板贴合紧密，焊点牢固，角度定位准确",
          "safety_notes": "三角板边缘可能锋利，操作时注意佩戴手套，防止割伤。"
        },
        "safety_warnings": [
          "三角板边缘锋利，搬运和定位时必须佩戴防割手套，防止手指割伤。",
          "点焊时注意焊枪角度，避免焊渣飞溅到身体或周围设备上。",
          "焊接完成后，及时清理焊渣，防止人员被尖锐焊渣刺伤。"
        ]
      },
      {
        "step_number": 11,
        "action": "安装方形板",
        "description": "将图纸上标注为12号的方形板（FXB-T6*75*75-Q235）安装在主体框架的底部，用于支撑和连接。进行点焊固定。",
        "position_description": "12号方形板位于框架底部，与1号方管连接。",
        "parts_used": [
          {
            "bom_seq": "12",
            "bom_name": "方形板",
            "quantity": 4,
            "drawing_number": "12"
          }
        ],
        "tools": [
          "焊机",
          "卷尺"
        ],
        "warnings": [
          "12号方形板为借用件，安装时注意保护其表面。"
        ],
        "welding": {
          "required": true,
          "welding_type": "角焊（定位焊）",
          "welding_method": "CO2气保焊",
          "weld_size": "点焊长度10mm，焊脚高度约3mm",
          "welding_position": "零件12（方形板）与零件1（长方管）的连接处，仰焊",
          "quality_requirements": "定位准确，焊点牢固，确保方形板与方管底部齐平",
          "safety_notes": "仰焊时，必须穿戴好全套防护装备，防止高温熔渣和飞溅物落入眼睛或衣领。"
        },
        "safety_warnings": [
          "进行仰焊作业时，必须穿戴皮质防护服、头罩和安全鞋，防止高温熔渣和火花烫伤。",
          "仰焊时应保持稳定姿势，避免长时间仰头操作造成颈部疲劳或失衡。",
          "确保工作区域地面干燥，防止潮湿环境下的触电风险。"
        ]
      },
      {
        "step_number": 12,
        "action": "安装防滑板",
        "description": "将图纸上标注为13号的防滑板（S-EDGP1630-DR-01-10-Q235）安装在主体框架的顶部两侧，并进行点焊固定。",
        "position_description": "13号防滑板位于框架顶部，与1号方管平行。",
        "parts_used": [
          {
            "bom_seq": "13",
            "bom_name": "防滑板",
            "quantity": 2,
            "drawing_number": "13"
          }
        ],
        "tools": [
          "焊机"
        ],
        "warnings": [
          "防滑板安装时，确保防滑纹理朝上。"
        ],
        "welding": {
          "required": true,
          "welding_type": "角焊（定位焊）",
          "welding_method": "CO2气保焊",
          "weld_size": "点焊长度10mm，焊脚高度约3mm",
          "welding_position": "零件13（防滑板）与零件1（长方管）的连接处，平焊",
          "quality_requirements": "防滑板边缘与方管对齐，焊点牢固",
          "safety_notes": "防滑板表面有纹理，焊接时注意清理焊接区域，确保焊缝质量。"
        },
        "safety_warnings": [
          "防滑板面积较大，搬运时注意边缘，防止割伤。",
          "焊接前必须清理防滑板表面的油污和杂质，防止焊接过程中产生有毒烟雾。",
          "点焊完成后，检查防滑板是否牢固，防止人员踩踏时发生意外。"
        ]
      },
      {
        "step_number": 13,
        "action": "满焊与清理",
        "description": "对所有已点焊固定的零件连接处进行满焊。焊接完成后，使用角磨机去除所有焊渣和飞溅物，并对锐边、锐角进行倒钝处理，达到图纸技术要求。",
        "position_description": "对所有结构连接处进行焊接。",
        "parts_used": [],
        "tools": [
          "焊机",
          "角磨机",
          "钢丝刷"
        ],
        "warnings": [
          "选择合理的焊接顺序，保证焊接平稳性，防止结构变形。焊接区域需清理干净。"
        ],
        "welding": {
          "required": true,
          "welding_type": "角焊/对接焊（满焊）",
          "welding_method": "CO2气保焊（主要）/手工电弧焊（局部）",
          "weld_size": "焊脚高度至少5mm（根据板厚确定），所有焊缝连续",
          "welding_position": "所有零件连接处，涉及平焊、横焊、立焊、仰焊",
          "quality_requirements": "焊缝外观成型良好，焊缝饱满，无裂纹、气孔、夹渣、未熔合等缺陷。重要焊缝需进行无损检测（如磁粉或超声波）。",
          "safety_notes": "满焊时会产生大量烟尘和高温，必须开启强力通风设备。焊接顺序要严格按照工艺要求执行，防止焊接应力导致结构变形或开裂。打磨时佩戴护目镜和防尘口罩。"
        },
        "safety_warnings": [
          "满焊作业时，必须佩戴全套焊接防护用品，包括呼吸防护，防止吸入大量焊接烟尘。",
          "焊接过程中，注意检查焊机电缆和气瓶连接，防止漏电或气体泄漏。",
          "使用角磨机打磨时，必须佩戴防护眼镜和面罩，防止高速飞溅的火花和金属碎屑伤眼。",
          "打磨作业时，确保磨光机防护罩安装到位，严禁拆除，防止砂轮片破碎伤人。",
          "倒钝处理时，注意锐边和毛刺，佩戴防割手套，防止割伤。"
        ]
      }
    ]
  }
}