{
  "agent_name": "Agent6_FAQ",
  "model": "google/gemini-2.5-flash-preview-09-2025",
  "timestamp": "20251007_071958",
  "image_count": 0,
  "temperature": 0.2,
  "system_prompt": "# 角色定位\n\n你是**李师傅**，一位拥有20年安全管理经验的高级安全工程师。\n\n## 教育背景\n\n- **学历**：安全工程专业本科\n- **职业资格**：注册安全工程师、高级安全评价师\n- **专业培训**：\n  - 机械制造安全管理\n  - 职业健康与安全管理体系（ISO 45001）\n  - 事故调查与分析\n  - 应急预案编制与演练\n\n## 职业背景\n\n- **工作经历**：20年机械制造企业安全管理经验，参与过大型装备制造、钢结构加工等项目\n- **专业领域**：\n  - 机械加工安全（车、铣、刨、磨、钻等）\n  - 焊接作业安全（电焊、气焊、氩弧焊等）\n  - 起重吊装安全（行车、叉车、吊索具等）\n  - 高空作业安全（脚手架、安全带、防坠落等）\n  - 个人防护用品管理（安全帽、防护眼镜、手套、安全鞋等）\n\n## 知识结构（详细）\n\n### 1. 机械伤害风险\n- **夹伤/挤伤**：手指、手臂被运动部件夹住\n- **切割伤**：锋利边缘、毛刺、切削工具\n- **碰撞伤**：头部碰撞、身体碰撞\n- **坠落伤**：零件坠落、工具坠落、人员坠落\n\n### 2. 焊接作业风险\n- **电击伤**：焊机漏电、接地不良\n- **弧光伤**：电弧紫外线灼伤眼睛和皮肤\n- **烫伤**：高温熔池、焊渣飞溅\n- **火灾爆炸**：易燃物引燃、气瓶泄漏\n- **有毒气体**：焊接烟尘、一氧化碳中毒\n\n### 3. 起重吊装风险\n- **吊物坠落**：吊索具断裂、捆绑不牢\n- **吊物摆动**：碰撞人员、设备\n- **超载**：超过起重机额定载荷\n- **指挥失误**：信号不清、违章指挥\n\n### 4. 高空作业风险\n- **人员坠落**：未系安全带、脚手架不牢\n- **物体打击**：工具、零件从高处坠落\n- **脚手架坍塌**：搭设不规范、超载\n\n### 5. 个人防护用品\n- **头部防护**：安全帽（防止碰撞、坠物打击）\n- **眼部防护**：防护眼镜、焊接面罩（防止飞溅、弧光）\n- **手部防护**：防护手套（防止切割、烫伤、化学品）\n- **足部防护**：安全鞋（防砸、防刺穿、防滑）\n- **呼吸防护**：防尘口罩、防毒面具（防止粉尘、有毒气体）\n\n### 6. 应急处理\n- **机械伤害**：立即停机、呼救、止血、固定、送医\n- **电击伤**：切断电源、心肺复苏、送医\n- **烫伤**：冷水冲洗、覆盖无菌纱布、送医\n- **火灾**：使用灭火器、疏散人员、报警\n\n## 任务步骤（Chain of Thought）\n\n你的任务是**为每个装配步骤添加安全警告**（如果该步骤有安全风险）。请按照以下5个步骤思考：\n\n### 步骤1：识别风险步骤\n- 分析每个装配步骤的操作内容\n- 判断是否涉及高风险作业（焊接、吊装、高空、重物搬运等）\n- 识别潜在的伤害类型（机械伤害、电击、烫伤、坠落等）\n\n### 步骤2：分析风险源\n- 确定风险的来源（设备、工具、材料、环境、人员操作等）\n- 评估风险的严重程度（轻微、中等、严重、致命）\n- 考虑风险的发生概率\n\n### 步骤3：制定预防措施\n- 针对每个风险源，制定具体的预防措施\n- 强调个人防护用品的使用\n- 强调安全操作规程的遵守\n\n### 步骤4：添加安全警告\n- 为每个有风险的步骤添加safety_warnings字段\n- 每条警告要简洁明了，说明具体的风险和预防措施\n- 使用工人能看懂的语言\n\n### 步骤5：验证完整性\n- 检查所有高风险步骤是否都添加了安全警告\n- 检查安全警告是否具体、可操作\n- 检查是否遗漏了任何潜在风险\n\n## 核心原则\n\n1. **步骤级嵌入**：为每个有风险的步骤添加safety_warnings字段，而不是单独列出安全警告\n2. **工人友好**：使用通俗语言，避免专业术语\n3. **具体可操作**：说明具体的风险和预防措施，而不是泛泛而谈\n4. **不重复显示**：安全警告只在下方\"安全\"标签页中统一显示，不在当前步骤详情中重复显示\n\n## 输出格式\n\n严格按照以下JSON格式输出（返回增强后的装配步骤）：\n\n```json\n{\n  \"enhanced_steps\": [\n    {\n      \"step_number\": 1,\n      \"title\": \"点焊定位\",\n      \"parts_used\": [...],\n      \"tools_required\": [...],\n      \"operation\": \"操作说明\",\n      \"quality_check\": \"质量检查\",\n      \"estimated_time_minutes\": 10,\n      \"welding\": {\n        \"required\": true,\n        \"welding_type\": \"点焊\",\n        \"welding_method\": \"CO2气保焊\",\n        ...\n      },\n      \"safety_warnings\": [\n        \"佩戴焊接面罩和防护手套，防止弧光灼伤眼睛和皮肤\",\n        \"确保工件夹紧牢固，防止点焊时位移造成伤害\",\n        \"焊接区域周围3米内不得有易燃物，配备灭火器\",\n        \"焊机必须接地良好，防止漏电触电\"\n      ]\n    },\n    {\n      \"step_number\": 2,\n      \"title\": \"螺栓连接\",\n      \"parts_used\": [...],\n      \"operation\": \"操作说明\",\n      \"quality_check\": \"质量检查\",\n      \"estimated_time_minutes\": 15,\n      \"safety_warnings\": [\n        \"佩戴安全帽和防护眼镜，防止零件坠落和飞溅\",\n        \"使用扭力扳手时注意力度，防止扳手滑脱伤人\"\n      ]\n    },\n    {\n      \"step_number\": 3,\n      \"title\": \"简单装配\",\n      \"parts_used\": [...],\n      \"operation\": \"操作说明\",\n      \"quality_check\": \"质量检查\",\n      \"estimated_time_minutes\": 5\n      // ⚠️ 如果没有明显安全风险，不添加safety_warnings字段\n    }\n  ]\n}\n```\n\n**⚠️ 关键要求**：\n\n1. **步骤级嵌入**：\n   - 为每个有风险的步骤添加`safety_warnings`字段\n   - 没有明显风险的步骤不添加`safety_warnings`字段\n   - 保持原有步骤的所有字段不变\n\n2. **安全警告要具体**：\n   - ✅ 说\"佩戴焊接面罩和防护手套，防止弧光灼伤眼睛和皮肤\"\n   - ❌ 不说\"注意安全\"\n   - ✅ 说\"焊接区域周围3米内不得有易燃物，配备灭火器\"\n   - ❌ 不说\"注意防火\"\n\n3. **使用通俗语言**：\n   - 工人能看懂的语言\n   - 避免专业术语和英文缩写\n\n4. **警告要全面**：\n   - 涵盖个人防护、设备安全、环境安全、操作安全\n   - 每条警告说明具体的风险和预防措施\n\n## 重要提醒\n\n- **只输出JSON，不要输出其他内容**\n- **保持原有字段不变**：不要修改或删除原有的字段（包括welding字段）\n- **警告要简洁明了**：每条警告一句话，说明风险和预防措施\n- **不要过度警告**：只针对有明显风险的步骤添加警告\n",
  "user_query": "请为以下装配步骤添加安全警告（如果有安全风险）。\n\n## 📸 视觉分析任务\n\n**你会看到工程图纸图片，请仔细观察：**\n\n1. **危险作业标识**：\n   - 图纸上的安全警告标识\n   - 特殊作业要求（如高空作业、吊装作业等）\n   - 危险区域标注\n\n2. **零件特征**：\n   - 重型零件（需要吊装）\n   - 锋利边缘（容易割伤）\n   - 高温部件（容易烫伤）\n\n3. **作业环境**：\n   - 狭窄空间（容易碰撞）\n   - 高空位置（容易坠落）\n   - 密闭空间（通风不良）\n\n## 装配步骤\n\n[\n  {\n    \"step_number\": 1,\n    \"action\": \"放置基准件\",\n    \"description\": \"使用行车或吊具将图纸序号2的连接板（01.01.01.11509）吊装到装配工装或工作台上，作为装配基准。确保连接板放置平稳、水平。\",\n    \"position_description\": \"连接板水平放置在工装上。\",\n    \"parts_used\": [\n      {\n        \"bom_seq\": \"2\",\n        \"bom_name\": \"连接板\",\n        \"quantity\": 1,\n        \"drawing_number\": \"2\",\n        \"node_name\": [\n          \"NAUO2\"\n        ],\n        \"bom_code\": \"01.01.01.11509\"\n      }\n    ],\n    \"tools\": [\n      \"行车/吊具\",\n      \"水平仪\",\n      \"装配工装\"\n    ],\n    \"warnings\": [\n      \"连接板较重（21.36kg），吊装时注意安全，确保吊具牢固。\",\n      \"放置时避免磕碰，保护表面平整度。\"\n    ]\n  },\n  {\n    \"step_number\": 2,\n    \"action\": \"焊接底部矩形管\",\n    \"description\": \"将图纸序号1的矩形管（01.01.03.2718）放置在步骤1的连接板（2）的底部，按照图纸尺寸（如790.5mm）定位。先点焊固定，然后进行满焊。\",\n    \"position_description\": \"矩形管（1）位于连接板（2）的下方，沿长度方向居中对齐。\",\n    \"parts_used\": [\n      {\n        \"bom_seq\": \"1\",\n        \"bom_name\": \"矩形管\",\n        \"quantity\": 1,\n        \"drawing_number\": \"1\",\n        \"node_name\": [\n          \"NAUO1\"\n        ],\n        \"bom_code\": \"01.01.03.2718\"\n      }\n    ],\n    \"tools\": [\n      \"焊机\",\n      \"焊钳\",\n      \"卷尺\",\n      \"角尺\"\n    ],\n    \"warnings\": [\n      \"焊接前确保定位准确，避免尺寸偏差。\",\n      \"焊接时注意通风和防火安全。\"\n    ],\n    \"welding\": {\n      \"required\": true,\n      \"welding_type\": \"角焊\",\n      \"welding_method\": \"CO2气保焊 (MAG)\",\n      \"weld_size\": \"焊缝高度6mm（未注尺寸按图纸要求）\",\n      \"welding_position\": \"矩形管（1）与连接板（2）的接触面，平焊为主\",\n      \"quality_requirements\": \"焊缝连续、饱满，焊后清渣。不允许出现气孔、夹渣、裂纹、未熔合等缺陷。焊缝外观应符合二级标准。\",\n      \"safety_notes\": \"佩戴焊接面罩、防护手套和防护服。确保工作区域通风良好，远离易燃易爆物品。焊机接地必须可靠。\"\n    }\n  },\n  {\n    \"step_number\": 3,\n    \"action\": \"焊接上部矩形管（长）\",\n    \"description\": \"将图纸序号8的矩形管（01.01.03.2720）放置在连接板（2）的上方，靠近组件的后部。使用夹具固定，确保与连接板垂直且位置准确。先点焊，后满焊。\",\n    \"position_description\": \"矩形管（8）位于连接板（2）的上表面，靠近后部。\",\n    \"parts_used\": [\n      {\n        \"bom_seq\": \"8\",\n        \"bom_name\": \"矩形管\",\n        \"quantity\": 1,\n        \"drawing_number\": \"8\",\n        \"node_name\": [\n          \"NAUO13\"\n        ],\n        \"bom_code\": \"01.01.03.2720\"\n      }\n    ],\n    \"tools\": [\n      \"焊机\",\n      \"夹具\",\n      \"角尺\"\n    ],\n    \"warnings\": [\n      \"矩形管（8）较长（970mm），焊接时注意控制热变形，可采用分段对称焊接。\"\n    ],\n    \"welding\": {\n      \"required\": true,\n      \"welding_type\": \"角焊\",\n      \"welding_method\": \"CO2气保焊 (MAG)\",\n      \"weld_size\": \"焊缝高度6mm\",\n      \"welding_position\": \"矩形管（8）与连接板（2）的接触面，平焊\",\n      \"quality_requirements\": \"焊缝连续，保证矩形管与连接板的垂直度。采用分段、跳焊方式，减少热输入，控制焊接变形。\",\n      \"safety_notes\": \"注意控制焊接烟尘，使用局部排风设备。焊接完成后，及时清理焊渣和飞溅物。\"\n    }\n  },\n  {\n    \"step_number\": 4,\n    \"action\": \"焊接上部矩形管（短）\",\n    \"description\": \"将图纸序号6的矩形管（01.01.03.2719）放置在连接板（2）的上方，靠近组件的前部。使用夹具固定，确保与连接板垂直且位置准确。先点焊，后满焊。\",\n    \"position_description\": \"矩形管（6）位于连接板（2）的上表面，靠近前部。\",\n    \"parts_used\": [\n      {\n        \"bom_seq\": \"6\",\n        \"bom_name\": \"矩形管\",\n        \"quantity\": 2,\n        \"drawing_number\": \"6\",\n        \"node_name\": [\n          \"NAUO10\",\n          \"NAUO9\"\n        ],\n        \"bom_code\": \"01.01.03.2719\"\n      }\n    ],\n    \"tools\": [\n      \"焊机\",\n      \"夹具\",\n      \"角尺\"\n    ],\n    \"warnings\": [\n      \"确保两根矩形管（6）与矩形管（8）的相对位置符合图纸要求。\"\n    ],\n    \"welding\": {\n      \"required\": true,\n      \"welding_type\": \"角焊\",\n      \"welding_method\": \"CO2气保焊 (MAG)\",\n      \"weld_size\": \"焊缝高度6mm\",\n      \"welding_position\": \"矩形管（6）与连接板（2）的接触面，平焊\",\n      \"quality_requirements\": \"焊缝连续，保证矩形管与连接板的垂直度。焊接完成后，检查两根矩形管（6）之间的间距和与矩形管（8）的相对位置精度。\",\n      \"safety_notes\": \"焊接过程中，注意防止焊花飞溅到已定位的零件上，必要时使用防火毯遮挡。\"\n    }\n  },\n  {\n    \"step_number\": 5,\n    \"action\": \"安装左右挂件虚拟组件\",\n    \"description\": \"将图纸序号4的右挂件虚拟组件（01.05.0018）和图纸序号5的左挂件虚拟组件（01.05.0019）分别安装到矩形管（8）和矩形管（6）的端部。根据图纸上的定位孔和尺寸进行精确对位，并进行焊接。\",\n    \"position_description\": \"右挂件（4）和左挂件（5）分别安装在组件的两侧端部。\",\n    \"parts_used\": [\n      {\n        \"bom_seq\": \"4\",\n        \"bom_name\": \"右挂件虚拟组件\",\n        \"quantity\": 1,\n        \"drawing_number\": \"4\"\n      },\n      {\n        \"bom_seq\": \"5\",\n        \"bom_name\": \"左挂件虚拟组件\",\n        \"quantity\": 1,\n        \"drawing_number\": \"5\"\n      }\n    ],\n    \"tools\": [\n      \"焊机\",\n      \"定位销\",\n      \"游标卡尺\"\n    ],\n    \"warnings\": [\n      \"挂件组件是关键功能件，焊接时必须保证其安装角度和位置精度，特别是挂钩部分。\"\n    ],\n    \"welding\": {\n      \"required\": true,\n      \"welding_type\": \"角焊\",\n      \"welding_method\": \"CO2气保焊 (MAG)\",\n      \"weld_size\": \"焊缝高度8mm（参考图纸上的焊接符号）\",\n      \"welding_position\": \"挂件（4/5）与矩形管（8/6）的连接处，可能涉及横焊和立焊\",\n      \"quality_requirements\": \"焊缝必须牢固，全焊透。重点检查挂件的平面度和垂直度，确保其功能尺寸精度。焊后进行外观检查，确保无漏焊、虚焊。\",\n      \"safety_notes\": \"由于焊接位置可能涉及横焊和立焊，操作时需稳定焊枪，控制熔池，防止焊瘤和飞溅。注意高处作业安全（如果组件已抬高）。\"\n    }\n  },\n  {\n    \"step_number\": 6,\n    \"action\": \"焊接加强筋\",\n    \"description\": \"将图纸序号9的加强筋（01.01.01.17678）安装在矩形管（8）和连接板（2）之间，用于增强结构强度。按照图纸所示位置进行焊接。\",\n    \"position_description\": \"加强筋（9）位于矩形管（8）和连接板（2）的内侧，呈斜角支撑。\",\n    \"parts_used\": [\n      {\n        \"bom_seq\": \"9\",\n        \"bom_name\": \"加强筋\",\n        \"quantity\": 2,\n        \"drawing_number\": \"9\",\n        \"node_name\": [\n          \"NAUO15\",\n          \"NAUO14\"\n        ],\n        \"bom_code\": \"01.01.01.17678\"\n      }\n    ],\n    \"tools\": [\n      \"焊机\",\n      \"角尺\"\n    ],\n    \"warnings\": [\n      \"加强筋焊接应牢固，焊缝尺寸应符合技术要求。\"\n    ],\n    \"welding\": {\n      \"required\": true,\n      \"welding_type\": \"角焊\",\n      \"welding_method\": \"CO2气保焊 (MAG)\",\n      \"weld_size\": \"焊缝高度6mm\",\n      \"welding_position\": \"加强筋（9）与矩形管（8）和连接板（2）的连接处，主要为平焊和横焊\",\n      \"quality_requirements\": \"焊缝必须连续，保证加强筋与主体结构的紧密贴合。焊缝应平整过渡，避免应力集中。\",\n      \"safety_notes\": \"加强筋焊接位置相对狭窄，操作时注意焊枪角度，避免烫伤。确保焊枪喷嘴清洁，保证保护气体覆盖效果。\"\n    }\n  },\n  {\n    \"step_number\": 7,\n    \"action\": \"焊接封板\",\n    \"description\": \"将图纸序号7的封板（01.01.01.16608）安装在矩形管（8）和矩形管（6）之间的开口处，进行封闭。封板应与矩形管边缘对齐，并进行满焊。\",\n    \"position_description\": \"封板（7）位于矩形管（8）和矩形管（6）围成的框架内部。\",\n    \"parts_used\": [\n      {\n        \"bom_seq\": \"7\",\n        \"bom_name\": \"封板\",\n        \"quantity\": 2,\n        \"drawing_number\": \"7\",\n        \"node_name\": [\n          \"NAUO12\",\n          \"NAUO11\"\n        ],\n        \"bom_code\": \"01.01.01.16608\"\n      }\n    ],\n    \"tools\": [\n      \"焊机\",\n      \"夹具\"\n    ],\n    \"warnings\": [\n      \"封板焊接后应保证表面平整，无明显凹凸。\"\n    ],\n    \"welding\": {\n      \"required\": true,\n      \"welding_type\": \"角焊\",\n      \"welding_method\": \"CO2气保焊 (MAG)\",\n      \"weld_size\": \"焊缝高度4mm（封板板厚较薄，需适当减小焊缝尺寸）\",\n      \"welding_position\": \"封板（7）与周围矩形管的连接边缘，平焊\",\n      \"quality_requirements\": \"满焊，焊缝均匀，防止烧穿薄板。焊后打磨平整，确保表面光滑，为后续喷涂做准备。\",\n      \"safety_notes\": \"由于封板较薄，焊接电流不宜过大，防止热变形和烧穿。操作时注意控制焊接速度。\"\n    }\n  },\n  {\n    \"step_number\": 8,\n    \"action\": \"焊接方形板\",\n    \"description\": \"将图纸序号3的方形板-机加（01.01.01.6589）安装在连接板（2）的侧面和底部，用于支撑和定位。按照图纸上的定位孔和尺寸进行精确焊接。\",\n    \"position_description\": \"方形板（3）安装在连接板（2）的侧面和底部，共4个位置。\",\n    \"parts_used\": [\n      {\n        \"bom_seq\": \"3\",\n        \"bom_name\": \"方形板-机加\",\n        \"quantity\": 4,\n        \"drawing_number\": \"3\",\n        \"node_name\": [\n          \"NAUO6\",\n          \"NAUO5\",\n          \"NAUO4\",\n          \"NAUO3\"\n        ],\n        \"bom_code\": \"01.01.01.6589\"\n      }\n    ],\n    \"tools\": [\n      \"焊机\",\n      \"定位工装\",\n      \"游标卡尺\"\n    ],\n    \"warnings\": [\n      \"方形板（3）带有机加工孔，焊接时注意保护孔位精度，避免焊渣飞溅进入孔内。\"\n    ],\n    \"welding\": {\n      \"required\": true,\n      \"welding_type\": \"角焊\",\n      \"welding_method\": \"CO2气保焊 (MAG)\",\n      \"weld_size\": \"焊缝高度4mm\",\n      \"welding_position\": \"方形板（3）与连接板（2）的接触边缘，可能涉及平焊和立焊\",\n      \"quality_requirements\": \"焊缝必须连续，保证方形板的定位精度。焊接时应在孔周围设置挡板或使用耐高温胶带保护机加工孔，防止焊渣飞溅堵塞或损伤孔壁。\",\n      \"safety_notes\": \"焊接前检查定位工装是否牢固。焊接完成后，立即检查并清理孔内残留物，确保孔位畅通和精度。\"\n    }\n  }\n]\n\n## 要求\n\n请按照以下5个步骤思考，为装配步骤添加安全警告：\n\n### 步骤1：识别风险步骤\n- 分析每个装配步骤的操作内容\n- 判断是否涉及高风险作业：\n  * **焊接作业**：电击、弧光、烫伤、火灾\n  * **吊装作业**：吊物坠落、碰撞、超载\n  * **高空作业**：人员坠落、物体打击\n  * **重物搬运**：砸伤、扭伤、夹伤\n  * **机械加工**：切割伤、夹伤、碰撞\n\n### 步骤2：分析风险源\n- 确定风险的来源（设备、工具、材料、环境、人员操作等）\n- 评估风险的严重程度（轻微、中等、严重、致命）\n- 考虑风险的发生概率\n\n### 步骤3：制定预防措施\n- 针对每个风险源，制定具体的预防措施\n- 强调个人防护用品的使用：\n  * **焊接**：焊接面罩、防护手套、防护服\n  * **吊装**：安全帽、安全鞋、手套\n  * **高空**：安全带、安全帽、防滑鞋\n  * **机械**：防护眼镜、手套、安全鞋\n\n### 步骤4：添加安全警告\n- 为每个有风险的步骤添加safety_warnings字段\n- 每条警告要简洁明了，说明具体的风险和预防措施\n- 使用工人能看懂的语言\n\n### 步骤5：验证完整性\n- 检查所有高风险步骤是否都添加了安全警告\n- 检查安全警告是否具体、可操作\n- 检查是否遗漏了任何潜在风险\n\n## ⚠️ 强制自检清单（生成后必须逐项检查）\n\n**在输出JSON之前，你必须完成以下验证：**\n\n1. **风险步骤识别验证**：\n   - [ ] 所有涉及焊接、吊装、高空、重物搬运的步骤都添加了safety_warnings字段\n   - [ ] 没有明显风险的步骤没有添加safety_warnings字段\n\n2. **安全警告完整性验证**：\n   - [ ] 每个safety_warnings字段都是字符串数组\n   - [ ] 每条警告都说明了具体的风险和预防措施\n   - [ ] 涵盖了个人防护、设备安全、环境安全、操作安全\n\n3. **语言通俗性验证**：\n   - [ ] 使用工人能看懂的语言\n   - [ ] 避免专业术语和英文缩写\n   - [ ] 每条警告简洁明了（一句话）\n\n4. **原有字段保持验证**：\n   - [ ] 原有步骤的所有字段都保持不变（包括welding字段）\n   - [ ] 没有修改或删除任何原有字段\n\n**如果自检发现任何问题，必须重新生成！**\n\n现在开始为装配步骤添加安全警告！\n",
  "raw_response": "```json\n{\n  \"enhanced_steps\": [\n    {\n      \"step_number\": 1,\n      \"action\": \"放置基准件\",\n      \"description\": \"使用行车或吊具将图纸序号2的连接板（01.01.01.11509）吊装到装配工装或工作台上，作为装配基准。确保连接板放置平稳、水平。\",\n      \"position_description\": \"连接板水平放置在工装上。\",\n      \"parts_used\": [\n        {\n          \"bom_seq\": \"2\",\n          \"bom_name\": \"连接板\",\n          \"quantity\": 1,\n          \"drawing_number\": \"2\",\n          \"node_name\": [\n            \"NAUO2\"\n          ],\n          \"bom_code\": \"01.01.01.11509\"\n        }\n      ],\n      \"tools\": [\n        \"行车/吊具\",\n        \"水平仪\",\n        \"装配工装\"\n      ],\n      \"warnings\": [\n        \"连接板较重（21.36kg），吊装时注意安全，确保吊具牢固。\",\n        \"放置时避免磕碰，保护表面平整度。\"\n      ],\n      \"safety_warnings\": [\n        \"吊装作业前，检查吊具和钢丝绳是否完好，防止吊物坠落伤人。\",\n        \"吊装过程中，人员不得在吊物下方停留或穿越，必须佩戴安全帽。\",\n        \"指挥人员必须使用规范手势，确保吊装平稳、缓慢，防止碰撞。\"\n      ]\n    },\n    {\n      \"step_number\": 2,\n      \"action\": \"焊接底部矩形管\",\n      \"description\": \"将图纸序号1的矩形管（01.01.03.2718）放置在步骤1的连接板（2）的底部，按照图纸尺寸（如790.5mm）定位。先点焊固定，然后进行满焊。\",\n      \"position_description\": \"矩形管（1）位于连接板（2）的下方，沿长度方向居中对齐。\",\n      \"parts_used\": [\n        {\n          \"bom_seq\": \"1\",\n          \"bom_name\": \"矩形管\",\n          \"quantity\": 1,\n          \"drawing_number\": \"1\",\n          \"node_name\": [\n            \"NAUO1\"\n          ],\n          \"bom_code\": \"01.01.03.2718\"\n        }\n      ],\n      \"tools\": [\n        \"焊机\",\n        \"焊钳\",\n        \"卷尺\",\n        \"角尺\"\n      ],\n      \"warnings\": [\n        \"焊接前确保定位准确，避免尺寸偏差。\",\n        \"焊接时注意通风和防火安全。\"\n      ],\n      \"welding\": {\n        \"required\": true,\n        \"welding_type\": \"角焊\",\n        \"welding_method\": \"CO2气保焊 (MAG)\",\n        \"weld_size\": \"焊缝高度6mm（未注尺寸按图纸要求）\",\n        \"welding_position\": \"矩形管（1）与连接板（2）的接触面，平焊为主\",\n        \"quality_requirements\": \"焊缝连续、饱满，焊后清渣。不允许出现气孔、夹渣、裂纹、未熔合等缺陷。焊缝外观应符合二级标准。\",\n        \"safety_notes\": \"佩戴焊接面罩、防护手套和防护服。确保工作区域通风良好，远离易燃易爆物品。焊机接地必须可靠。\"\n      },\n      \"safety_warnings\": [\n        \"必须佩戴焊接面罩、防护手套和防护服，防止弧光灼伤和烫伤。\",\n        \"确保焊机外壳接地良好，防止触电事故发生。\",\n        \"焊接区域必须保持通风良好，防止吸入有毒烟尘。\",\n        \"清理焊渣时，佩戴防护眼镜，防止飞溅物伤眼。\"\n      ]\n    },\n    {\n      \"step_number\": 3,\n      \"action\": \"焊接上部矩形管（长）\",\n      \"description\": \"将图纸序号8的矩形管（01.01.03.2720）放置在连接板（2）的上方，靠近组件的后部。使用夹具固定，确保与连接板垂直且位置准确。先点焊，后满焊。\",\n      \"position_description\": \"矩形管（8）位于连接板（2）的上表面，靠近后部。\",\n      \"parts_used\": [\n        {\n          \"bom_seq\": \"8\",\n          \"bom_name\": \"矩形管\",\n          \"quantity\": 1,\n          \"drawing_number\": \"8\",\n          \"node_name\": [\n            \"NAUO13\"\n          ],\n          \"bom_code\": \"01.01.03.2720\"\n        }\n      ],\n      \"tools\": [\n        \"焊机\",\n        \"夹具\",\n        \"角尺\"\n      ],\n      \"warnings\": [\n        \"矩形管（8）较长（970mm），焊接时注意控制热变形，可采用分段对称焊接。\"\n      ],\n      \"welding\": {\n        \"required\": true,\n        \"welding_type\": \"角焊\",\n        \"welding_method\": \"CO2气保焊 (MAG)\",\n        \"weld_size\": \"焊缝高度6mm\",\n        \"welding_position\": \"矩形管（8）与连接板（2）的接触面，平焊\",\n        \"quality_requirements\": \"焊缝连续，保证矩形管与连接板的垂直度。采用分段、跳焊方式，减少热输入，控制焊接变形。\",\n        \"safety_notes\": \"注意控制焊接烟尘，使用局部排风设备。焊接完成后，及时清理焊渣和飞溅物。\"\n      },\n      \"safety_warnings\": [\n        \"必须佩戴焊接面罩和防护手套，防止弧光和高温烫伤。\",\n        \"使用夹具固定时，确保夹具牢固，防止矩形管倾倒或位移造成机械伤害。\",\n        \"使用局部排风设备，确保焊接烟尘得到有效清除，保护呼吸健康。\"\n      ]\n    },\n    {\n      \"step_number\": 4,\n      \"action\": \"焊接上部矩形管（短）\",\n      \"description\": \"将图纸序号6的矩形管（01.01.03.2719）放置在连接板（2）的上方，靠近组件的前部。使用夹具固定，确保与连接板垂直且位置准确。先点焊，后满焊。\",\n      \"position_description\": \"矩形管（6）位于连接板（2）的上表面，靠近前部。\",\n      \"parts_used\": [\n        {\n          \"bom_seq\": \"6\",\n          \"bom_name\": \"矩形管\",\n          \"quantity\": 2,\n          \"drawing_number\": \"6\",\n          \"node_name\": [\n            \"NAUO10\",\n            \"NAUO9\"\n          ],\n          \"bom_code\": \"01.01.03.2719\"\n        }\n      ],\n      \"tools\": [\n        \"焊机\",\n        \"夹具\",\n        \"角尺\"\n      ],\n      \"warnings\": [\n        \"确保两根矩形管（6）与矩形管（8）的相对位置符合图纸要求。\"\n      ],\n      \"welding\": {\n        \"required\": true,\n        \"welding_type\": \"角焊\",\n        \"welding_method\": \"CO2气保焊 (MAG)\",\n        \"weld_size\": \"焊缝高度6mm\",\n        \"welding_position\": \"矩形管（6）与连接板（2）的接触面，平焊\",\n        \"quality_requirements\": \"焊缝连续，保证矩形管与连接板的垂直度。焊接完成后，检查两根矩形管（6）之间的间距和与矩形管（8）的相对位置精度。\",\n        \"safety_notes\": \"焊接过程中，注意防止焊花飞溅到已定位的零件上，必要时使用防火毯遮挡。\"\n      },\n      \"safety_warnings\": [\n        \"佩戴焊接面罩和防护手套，防止弧光和高温烫伤。\",\n        \"使用防火毯或挡板遮挡周围零件，防止焊花飞溅引起火灾或烫伤他人。\",\n        \"焊接完成后，零件温度高，搬运或触摸前必须确认冷却，防止烫伤。\"\n      ]\n    },\n    {\n      \"step_number\": 5,\n      \"action\": \"安装左右挂件虚拟组件\",\n      \"description\": \"将图纸序号4的右挂件虚拟组件（01.05.0018）和图纸序号5的左挂件虚拟组件（01.05.0019）分别安装到矩形管（8）和矩形管（6）的端部。根据图纸上的定位孔和尺寸进行精确对位，并进行焊接。\",\n      \"position_description\": \"右挂件（4）和左挂件（5）分别安装在组件的两侧端部。\",\n      \"parts_used\": [\n        {\n          \"bom_seq\": \"4\",\n          \"bom_name\": \"右挂件虚拟组件\",\n          \"quantity\": 1,\n          \"drawing_number\": \"4\"\n        },\n        {\n          \"bom_seq\": \"5\",\n          \"bom_name\": \"左挂件虚拟组件\",\n          \"quantity\": 1,\n          \"drawing_number\": \"5\"\n        }\n      ],\n      \"tools\": [\n        \"焊机\",\n        \"定位销\",\n        \"游标卡尺\"\n      ],\n      \"warnings\": [\n        \"挂件组件是关键功能件，焊接时必须保证其安装角度和位置精度，特别是挂钩部分。\"\n      ],\n      \"welding\": {\n        \"required\": true,\n        \"welding_type\": \"角焊\",\n        \"welding_method\": \"CO2气保焊 (MAG)\",\n        \"weld_size\": \"焊缝高度8mm（参考图纸上的焊接符号）\",\n        \"welding_position\": \"挂件（4/5）与矩形管（8/6）的连接处，可能涉及横焊和立焊\",\n        \"quality_requirements\": \"焊缝必须牢固，全焊透。重点检查挂件的平面度和垂直度，确保其功能尺寸精度。焊后进行外观检查，确保无漏焊、虚焊。\",\n        \"safety_notes\": \"由于焊接位置可能涉及横焊和立焊，操作时需稳定焊枪，控制熔池，防止焊瘤和飞溅。注意高处作业安全（如果组件已抬高）。\"\n      },\n      \"safety_warnings\": [\n        \"焊接位置涉及横焊和立焊，注意控制熔池，防止焊渣飞溅烫伤身体。\",\n        \"如果组件高度较高，操作人员必须站在稳固的平台上，防止高处坠落。\",\n        \"焊接前检查挂件边缘是否有毛刺或尖锐部分，搬运时佩戴防割手套，防止割伤。\"\n      ]\n    },\n    {\n      \"step_number\": 6,\n      \"action\": \"焊接加强筋\",\n      \"description\": \"将图纸序号9的加强筋（01.01.01.17678）安装在矩形管（8）和连接板（2）之间，用于增强结构强度。按照图纸所示位置进行焊接。\",\n      \"position_description\": \"加强筋（9）位于矩形管（8）和连接板（2）的内侧，呈斜角支撑。\",\n      \"parts_used\": [\n        {\n          \"bom_seq\": \"9\",\n          \"bom_name\": \"加强筋\",\n          \"quantity\": 2,\n          \"drawing_number\": \"9\",\n          \"node_name\": [\n            \"NAUO15\",\n            \"NAUO14\"\n          ],\n          \"bom_code\": \"01.01.01.17678\"\n        }\n      ],\n      \"tools\": [\n        \"焊机\",\n        \"角尺\"\n      ],\n      \"warnings\": [\n        \"加强筋焊接应牢固，焊缝尺寸应符合技术要求。\"\n      ],\n      \"welding\": {\n        \"required\": true,\n        \"welding_type\": \"角焊\",\n        \"welding_method\": \"CO2气保焊 (MAG)\",\n        \"weld_size\": \"焊缝高度6mm\",\n        \"welding_position\": \"加强筋（9）与矩形管（8）和连接板（2）的连接处，主要为平焊和横焊\",\n        \"quality_requirements\": \"焊缝必须连续，保证加强筋与主体结构的紧密贴合。焊缝应平整过渡，避免应力集中。\",\n        \"safety_notes\": \"加强筋焊接位置相对狭窄，操作时注意焊枪角度，避免烫伤。确保焊枪喷嘴清洁，保证保护气体覆盖效果。\"\n      },\n      \"safety_warnings\": [\n        \"加强筋焊接位置狭窄，操作时注意身体姿势，防止焊枪或高温部件接触身体造成烫伤。\",\n        \"确保焊接区域光线充足，避免因视线不良导致焊接缺陷或操作失误。\",\n        \"焊接完成后，使用专用工具夹取加强筋，防止高温烫伤。\"\n      ]\n    },\n    {\n      \"step_number\": 7,\n      \"action\": \"焊接封板\",\n      \"description\": \"将图纸序号7的封板（01.01.01.16608）安装在矩形管（8）和矩形管（6）之间的开口处，进行封闭。封板应与矩形管边缘对齐，并进行满焊。\",\n      \"position_description\": \"封板（7）位于矩形管（8）和矩形管（6）围成的框架内部。\",\n      \"parts_used\": [\n        {\n          \"bom_seq\": \"7\",\n          \"bom_name\": \"封板\",\n          \"quantity\": 2,\n          \"drawing_number\": \"7\",\n          \"node_name\": [\n            \"NAUO12\",\n            \"NAUO11\"\n          ],\n          \"bom_code\": \"01.01.01.16608\"\n        }\n      ],\n      \"tools\": [\n        \"焊机\",\n        \"夹具\"\n      ],\n      \"warnings\": [\n        \"封板焊接后应保证表面平整，无明显凹凸。\"\n      ],\n      \"welding\": {\n        \"required\": true,\n        \"welding_type\": \"角焊\",\n        \"welding_method\": \"CO2气保焊 (MAG)\",\n        \"weld_size\": \"焊缝高度4mm（封板板厚较薄，需适当减小焊缝尺寸）\",\n        \"welding_position\": \"封板（7）与周围矩形管的连接边缘，平焊\",\n        \"quality_requirements\": \"满焊，焊缝均匀，防止烧穿薄板。焊后打磨平整，确保表面光滑，为后续喷涂做准备。\",\n        \"safety_notes\": \"由于封板较薄，焊接电流不宜过大，防止热变形和烧穿。操作时注意控制焊接速度。\"\n      },\n      \"safety_warnings\": [\n        \"封板较薄，焊接时注意控制电流和速度，防止烧穿造成熔融金属飞溅烫伤。\",\n        \"焊接完成后，如果需要打磨，必须佩戴防护眼镜和防尘口罩，防止金属粉尘和飞溅物伤眼和吸入。\",\n        \"打磨工具必须安装防护罩，防止砂轮片破裂伤人。\"\n      ]\n    },\n    {\n      \"step_number\": 8,\n      \"action\": \"焊接方形板\",\n      \"description\": \"将图纸序号3的方形板-机加（01.01.01.6589）安装在连接板（2）的侧面和底部，用于支撑和定位。按照图纸上的定位孔和尺寸进行精确焊接。\",\n      \"position_description\": \"方形板（3）安装在连接板（2）的侧面和底部，共4个位置。\",\n      \"parts_used\": [\n        {\n          \"bom_seq\": \"3\",\n          \"bom_name\": \"方形板-机加\",\n          \"quantity\": 4,\n          \"drawing_number\": \"3\",\n          \"node_name\": [\n            \"NAUO6\",\n            \"NAUO5\",\n            \"NAUO4\",\n            \"NAUO3\"\n          ],\n          \"bom_code\": \"01.01.01.6589\"\n        }\n      ],\n      \"tools\": [\n        \"焊机\",\n        \"定位工装\",\n        \"游标卡尺\"\n      ],\n      \"warnings\": [\n        \"方形板（3）带有机加工孔，焊接时注意保护孔位精度，避免焊渣飞溅进入孔内。\"\n      ],\n      \"welding\": {\n        \"required\": true,\n        \"welding_type\": \"角焊\",\n        \"welding_method\": \"CO2气保焊 (MAG)\",\n        \"weld_size\": \"焊缝高度4mm\",\n        \"welding_position\": \"方形板（3）与连接板（2）的接触边缘，可能涉及平焊和立焊\",\n        \"quality_requirements\": \"焊缝必须连续，保证方形板的定位精度。焊接时应在孔周围设置挡板或使用耐高温胶带保护机加工孔，防止焊渣飞溅堵塞或损伤孔壁。\",\n        \"safety_notes\": \"焊接前检查定位工装是否牢固。焊接完成后，立即检查并清理孔内残留物，确保孔位畅通和精度。\"\n      },\n      \"safety_warnings\": [\n        \"焊接前必须使用耐高温材料或挡板保护机加工孔，防止焊渣飞溅损伤孔壁精度。\",\n        \"方形板边缘可能锋利，搬运和定位时必须佩戴防割手套，防止割伤。\",\n        \"焊接完成后，清理孔内残留物时，佩戴防护眼镜，防止异物飞溅入眼。\"\n      ]\n    }\n  ]\n}\n```",
  "parsed_result": {
    "enhanced_steps": [
      {
        "step_number": 1,
        "action": "放置基准件",
        "description": "使用行车或吊具将图纸序号2的连接板（01.01.01.11509）吊装到装配工装或工作台上，作为装配基准。确保连接板放置平稳、水平。",
        "position_description": "连接板水平放置在工装上。",
        "parts_used": [
          {
            "bom_seq": "2",
            "bom_name": "连接板",
            "quantity": 1,
            "drawing_number": "2",
            "node_name": [
              "NAUO2"
            ],
            "bom_code": "01.01.01.11509"
          }
        ],
        "tools": [
          "行车/吊具",
          "水平仪",
          "装配工装"
        ],
        "warnings": [
          "连接板较重（21.36kg），吊装时注意安全，确保吊具牢固。",
          "放置时避免磕碰，保护表面平整度。"
        ],
        "safety_warnings": [
          "吊装作业前，检查吊具和钢丝绳是否完好，防止吊物坠落伤人。",
          "吊装过程中，人员不得在吊物下方停留或穿越，必须佩戴安全帽。",
          "指挥人员必须使用规范手势，确保吊装平稳、缓慢，防止碰撞。"
        ]
      },
      {
        "step_number": 2,
        "action": "焊接底部矩形管",
        "description": "将图纸序号1的矩形管（01.01.03.2718）放置在步骤1的连接板（2）的底部，按照图纸尺寸（如790.5mm）定位。先点焊固定，然后进行满焊。",
        "position_description": "矩形管（1）位于连接板（2）的下方，沿长度方向居中对齐。",
        "parts_used": [
          {
            "bom_seq": "1",
            "bom_name": "矩形管",
            "quantity": 1,
            "drawing_number": "1",
            "node_name": [
              "NAUO1"
            ],
            "bom_code": "01.01.03.2718"
          }
        ],
        "tools": [
          "焊机",
          "焊钳",
          "卷尺",
          "角尺"
        ],
        "warnings": [
          "焊接前确保定位准确，避免尺寸偏差。",
          "焊接时注意通风和防火安全。"
        ],
        "welding": {
          "required": true,
          "welding_type": "角焊",
          "welding_method": "CO2气保焊 (MAG)",
          "weld_size": "焊缝高度6mm（未注尺寸按图纸要求）",
          "welding_position": "矩形管（1）与连接板（2）的接触面，平焊为主",
          "quality_requirements": "焊缝连续、饱满，焊后清渣。不允许出现气孔、夹渣、裂纹、未熔合等缺陷。焊缝外观应符合二级标准。",
          "safety_notes": "佩戴焊接面罩、防护手套和防护服。确保工作区域通风良好，远离易燃易爆物品。焊机接地必须可靠。"
        },
        "safety_warnings": [
          "必须佩戴焊接面罩、防护手套和防护服，防止弧光灼伤和烫伤。",
          "确保焊机外壳接地良好，防止触电事故发生。",
          "焊接区域必须保持通风良好，防止吸入有毒烟尘。",
          "清理焊渣时，佩戴防护眼镜，防止飞溅物伤眼。"
        ]
      },
      {
        "step_number": 3,
        "action": "焊接上部矩形管（长）",
        "description": "将图纸序号8的矩形管（01.01.03.2720）放置在连接板（2）的上方，靠近组件的后部。使用夹具固定，确保与连接板垂直且位置准确。先点焊，后满焊。",
        "position_description": "矩形管（8）位于连接板（2）的上表面，靠近后部。",
        "parts_used": [
          {
            "bom_seq": "8",
            "bom_name": "矩形管",
            "quantity": 1,
            "drawing_number": "8",
            "node_name": [
              "NAUO13"
            ],
            "bom_code": "01.01.03.2720"
          }
        ],
        "tools": [
          "焊机",
          "夹具",
          "角尺"
        ],
        "warnings": [
          "矩形管（8）较长（970mm），焊接时注意控制热变形，可采用分段对称焊接。"
        ],
        "welding": {
          "required": true,
          "welding_type": "角焊",
          "welding_method": "CO2气保焊 (MAG)",
          "weld_size": "焊缝高度6mm",
          "welding_position": "矩形管（8）与连接板（2）的接触面，平焊",
          "quality_requirements": "焊缝连续，保证矩形管与连接板的垂直度。采用分段、跳焊方式，减少热输入，控制焊接变形。",
          "safety_notes": "注意控制焊接烟尘，使用局部排风设备。焊接完成后，及时清理焊渣和飞溅物。"
        },
        "safety_warnings": [
          "必须佩戴焊接面罩和防护手套，防止弧光和高温烫伤。",
          "使用夹具固定时，确保夹具牢固，防止矩形管倾倒或位移造成机械伤害。",
          "使用局部排风设备，确保焊接烟尘得到有效清除，保护呼吸健康。"
        ]
      },
      {
        "step_number": 4,
        "action": "焊接上部矩形管（短）",
        "description": "将图纸序号6的矩形管（01.01.03.2719）放置在连接板（2）的上方，靠近组件的前部。使用夹具固定，确保与连接板垂直且位置准确。先点焊，后满焊。",
        "position_description": "矩形管（6）位于连接板（2）的上表面，靠近前部。",
        "parts_used": [
          {
            "bom_seq": "6",
            "bom_name": "矩形管",
            "quantity": 2,
            "drawing_number": "6",
            "node_name": [
              "NAUO10",
              "NAUO9"
            ],
            "bom_code": "01.01.03.2719"
          }
        ],
        "tools": [
          "焊机",
          "夹具",
          "角尺"
        ],
        "warnings": [
          "确保两根矩形管（6）与矩形管（8）的相对位置符合图纸要求。"
        ],
        "welding": {
          "required": true,
          "welding_type": "角焊",
          "welding_method": "CO2气保焊 (MAG)",
          "weld_size": "焊缝高度6mm",
          "welding_position": "矩形管（6）与连接板（2）的接触面，平焊",
          "quality_requirements": "焊缝连续，保证矩形管与连接板的垂直度。焊接完成后，检查两根矩形管（6）之间的间距和与矩形管（8）的相对位置精度。",
          "safety_notes": "焊接过程中，注意防止焊花飞溅到已定位的零件上，必要时使用防火毯遮挡。"
        },
        "safety_warnings": [
          "佩戴焊接面罩和防护手套，防止弧光和高温烫伤。",
          "使用防火毯或挡板遮挡周围零件，防止焊花飞溅引起火灾或烫伤他人。",
          "焊接完成后，零件温度高，搬运或触摸前必须确认冷却，防止烫伤。"
        ]
      },
      {
        "step_number": 5,
        "action": "安装左右挂件虚拟组件",
        "description": "将图纸序号4的右挂件虚拟组件（01.05.0018）和图纸序号5的左挂件虚拟组件（01.05.0019）分别安装到矩形管（8）和矩形管（6）的端部。根据图纸上的定位孔和尺寸进行精确对位，并进行焊接。",
        "position_description": "右挂件（4）和左挂件（5）分别安装在组件的两侧端部。",
        "parts_used": [
          {
            "bom_seq": "4",
            "bom_name": "右挂件虚拟组件",
            "quantity": 1,
            "drawing_number": "4"
          },
          {
            "bom_seq": "5",
            "bom_name": "左挂件虚拟组件",
            "quantity": 1,
            "drawing_number": "5"
          }
        ],
        "tools": [
          "焊机",
          "定位销",
          "游标卡尺"
        ],
        "warnings": [
          "挂件组件是关键功能件，焊接时必须保证其安装角度和位置精度，特别是挂钩部分。"
        ],
        "welding": {
          "required": true,
          "welding_type": "角焊",
          "welding_method": "CO2气保焊 (MAG)",
          "weld_size": "焊缝高度8mm（参考图纸上的焊接符号）",
          "welding_position": "挂件（4/5）与矩形管（8/6）的连接处，可能涉及横焊和立焊",
          "quality_requirements": "焊缝必须牢固，全焊透。重点检查挂件的平面度和垂直度，确保其功能尺寸精度。焊后进行外观检查，确保无漏焊、虚焊。",
          "safety_notes": "由于焊接位置可能涉及横焊和立焊，操作时需稳定焊枪，控制熔池，防止焊瘤和飞溅。注意高处作业安全（如果组件已抬高）。"
        },
        "safety_warnings": [
          "焊接位置涉及横焊和立焊，注意控制熔池，防止焊渣飞溅烫伤身体。",
          "如果组件高度较高，操作人员必须站在稳固的平台上，防止高处坠落。",
          "焊接前检查挂件边缘是否有毛刺或尖锐部分，搬运时佩戴防割手套，防止割伤。"
        ]
      },
      {
        "step_number": 6,
        "action": "焊接加强筋",
        "description": "将图纸序号9的加强筋（01.01.01.17678）安装在矩形管（8）和连接板（2）之间，用于增强结构强度。按照图纸所示位置进行焊接。",
        "position_description": "加强筋（9）位于矩形管（8）和连接板（2）的内侧，呈斜角支撑。",
        "parts_used": [
          {
            "bom_seq": "9",
            "bom_name": "加强筋",
            "quantity": 2,
            "drawing_number": "9",
            "node_name": [
              "NAUO15",
              "NAUO14"
            ],
            "bom_code": "01.01.01.17678"
          }
        ],
        "tools": [
          "焊机",
          "角尺"
        ],
        "warnings": [
          "加强筋焊接应牢固，焊缝尺寸应符合技术要求。"
        ],
        "welding": {
          "required": true,
          "welding_type": "角焊",
          "welding_method": "CO2气保焊 (MAG)",
          "weld_size": "焊缝高度6mm",
          "welding_position": "加强筋（9）与矩形管（8）和连接板（2）的连接处，主要为平焊和横焊",
          "quality_requirements": "焊缝必须连续，保证加强筋与主体结构的紧密贴合。焊缝应平整过渡，避免应力集中。",
          "safety_notes": "加强筋焊接位置相对狭窄，操作时注意焊枪角度，避免烫伤。确保焊枪喷嘴清洁，保证保护气体覆盖效果。"
        },
        "safety_warnings": [
          "加强筋焊接位置狭窄，操作时注意身体姿势，防止焊枪或高温部件接触身体造成烫伤。",
          "确保焊接区域光线充足，避免因视线不良导致焊接缺陷或操作失误。",
          "焊接完成后，使用专用工具夹取加强筋，防止高温烫伤。"
        ]
      },
      {
        "step_number": 7,
        "action": "焊接封板",
        "description": "将图纸序号7的封板（01.01.01.16608）安装在矩形管（8）和矩形管（6）之间的开口处，进行封闭。封板应与矩形管边缘对齐，并进行满焊。",
        "position_description": "封板（7）位于矩形管（8）和矩形管（6）围成的框架内部。",
        "parts_used": [
          {
            "bom_seq": "7",
            "bom_name": "封板",
            "quantity": 2,
            "drawing_number": "7",
            "node_name": [
              "NAUO12",
              "NAUO11"
            ],
            "bom_code": "01.01.01.16608"
          }
        ],
        "tools": [
          "焊机",
          "夹具"
        ],
        "warnings": [
          "封板焊接后应保证表面平整，无明显凹凸。"
        ],
        "welding": {
          "required": true,
          "welding_type": "角焊",
          "welding_method": "CO2气保焊 (MAG)",
          "weld_size": "焊缝高度4mm（封板板厚较薄，需适当减小焊缝尺寸）",
          "welding_position": "封板（7）与周围矩形管的连接边缘，平焊",
          "quality_requirements": "满焊，焊缝均匀，防止烧穿薄板。焊后打磨平整，确保表面光滑，为后续喷涂做准备。",
          "safety_notes": "由于封板较薄，焊接电流不宜过大，防止热变形和烧穿。操作时注意控制焊接速度。"
        },
        "safety_warnings": [
          "封板较薄，焊接时注意控制电流和速度，防止烧穿造成熔融金属飞溅烫伤。",
          "焊接完成后，如果需要打磨，必须佩戴防护眼镜和防尘口罩，防止金属粉尘和飞溅物伤眼和吸入。",
          "打磨工具必须安装防护罩，防止砂轮片破裂伤人。"
        ]
      },
      {
        "step_number": 8,
        "action": "焊接方形板",
        "description": "将图纸序号3的方形板-机加（01.01.01.6589）安装在连接板（2）的侧面和底部，用于支撑和定位。按照图纸上的定位孔和尺寸进行精确焊接。",
        "position_description": "方形板（3）安装在连接板（2）的侧面和底部，共4个位置。",
        "parts_used": [
          {
            "bom_seq": "3",
            "bom_name": "方形板-机加",
            "quantity": 4,
            "drawing_number": "3",
            "node_name": [
              "NAUO6",
              "NAUO5",
              "NAUO4",
              "NAUO3"
            ],
            "bom_code": "01.01.01.6589"
          }
        ],
        "tools": [
          "焊机",
          "定位工装",
          "游标卡尺"
        ],
        "warnings": [
          "方形板（3）带有机加工孔，焊接时注意保护孔位精度，避免焊渣飞溅进入孔内。"
        ],
        "welding": {
          "required": true,
          "welding_type": "角焊",
          "welding_method": "CO2气保焊 (MAG)",
          "weld_size": "焊缝高度4mm",
          "welding_position": "方形板（3）与连接板（2）的接触边缘，可能涉及平焊和立焊",
          "quality_requirements": "焊缝必须连续，保证方形板的定位精度。焊接时应在孔周围设置挡板或使用耐高温胶带保护机加工孔，防止焊渣飞溅堵塞或损伤孔壁。",
          "safety_notes": "焊接前检查定位工装是否牢固。焊接完成后，立即检查并清理孔内残留物，确保孔位畅通和精度。"
        },
        "safety_warnings": [
          "焊接前必须使用耐高温材料或挡板保护机加工孔，防止焊渣飞溅损伤孔壁精度。",
          "方形板边缘可能锋利，搬运和定位时必须佩戴防割手套，防止割伤。",
          "焊接完成后，清理孔内残留物时，佩戴防护眼镜，防止异物飞溅入眼。"
        ]
      }
    ]
  }
}