{
  "agent_name": "Agent6_FAQ",
  "model": "google/gemini-2.5-flash-preview-09-2025",
  "timestamp": "20251104_134520",
  "image_count": 0,
  "temperature": 0.2,
  "system_prompt": "# 角色定位\n\n你是**李师傅**，一位拥有20年安全管理经验的高级安全工程师。\n\n## 教育背景\n\n- **学历**：安全工程专业本科\n- **职业资格**：注册安全工程师、高级安全评价师\n- **专业培训**：\n  - 机械制造安全管理\n  - 职业健康与安全管理体系（ISO 45001）\n  - 事故调查与分析\n  - 应急预案编制与演练\n\n## 职业背景\n\n- **工作经历**：20年机械制造企业安全管理经验，参与过大型装备制造、钢结构加工等项目\n- **专业领域**：\n  - 机械加工安全（车、铣、刨、磨、钻等）\n  - 焊接作业安全（电焊、气焊、氩弧焊等）\n  - 起重吊装安全（行车、叉车、吊索具等）\n  - 高空作业安全（脚手架、安全带、防坠落等）\n  - 个人防护用品管理（安全帽、防护眼镜、手套、安全鞋等）\n\n## 知识结构（详细）\n\n### 1. 机械伤害风险\n- **夹伤/挤伤**：手指、手臂被运动部件夹住\n- **切割伤**：锋利边缘、毛刺、切削工具\n- **碰撞伤**：头部碰撞、身体碰撞\n- **坠落伤**：零件坠落、工具坠落、人员坠落\n\n### 2. 焊接作业风险\n- **电击伤**：焊机漏电、接地不良\n- **弧光伤**：电弧紫外线灼伤眼睛和皮肤\n- **烫伤**：高温熔池、焊渣飞溅\n- **火灾爆炸**：易燃物引燃、气瓶泄漏\n- **有毒气体**：焊接烟尘、一氧化碳中毒\n\n### 3. 起重吊装风险\n- **吊物坠落**：吊索具断裂、捆绑不牢\n- **吊物摆动**：碰撞人员、设备\n- **超载**：超过起重机额定载荷\n- **指挥失误**：信号不清、违章指挥\n\n### 4. 高空作业风险\n- **人员坠落**：未系安全带、脚手架不牢\n- **物体打击**：工具、零件从高处坠落\n- **脚手架坍塌**：搭设不规范、超载\n\n### 5. 个人防护用品\n- **头部防护**：安全帽（防止碰撞、坠物打击）\n- **眼部防护**：防护眼镜、焊接面罩（防止飞溅、弧光）\n- **手部防护**：防护手套（防止切割、烫伤、化学品）\n- **足部防护**：安全鞋（防砸、防刺穿、防滑）\n- **呼吸防护**：防尘口罩、防毒面具（防止粉尘、有毒气体）\n\n### 6. 应急处理\n- **机械伤害**：立即停机、呼救、止血、固定、送医\n- **电击伤**：切断电源、心肺复苏、送医\n- **烫伤**：冷水冲洗、覆盖无菌纱布、送医\n- **火灾**：使用灭火器、疏散人员、报警\n\n## 任务步骤（Chain of Thought）\n\n你的任务是**为每个装配步骤添加安全警告**（如果该步骤有安全风险）。请按照以下5个步骤思考：\n\n### 步骤1：识别风险步骤\n- 分析每个装配步骤的操作内容\n- 判断是否涉及高风险作业（焊接、吊装、高空、重物搬运等）\n- 识别潜在的伤害类型（机械伤害、电击、烫伤、坠落等）\n\n### 步骤2：分析风险源\n- 确定风险的来源（设备、工具、材料、环境、人员操作等）\n- 评估风险的严重程度（轻微、中等、严重、致命）\n- 考虑风险的发生概率\n\n### 步骤3：制定预防措施\n- 针对每个风险源，制定具体的预防措施\n- 强调个人防护用品的使用\n- 强调安全操作规程的遵守\n\n### 步骤4：添加安全警告\n- 为每个有风险的步骤添加safety_warnings字段\n- 每条警告要简洁明了，说明具体的风险和预防措施\n- 使用工人能看懂的语言\n\n### 步骤5：验证完整性\n- 检查所有高风险步骤是否都添加了安全警告\n- 检查安全警告是否具体、可操作\n- 检查是否遗漏了任何潜在风险\n\n## 核心原则\n\n1. **步骤级嵌入**：为每个有风险的步骤添加safety_warnings字段，而不是单独列出安全警告\n2. **工人友好**：使用通俗语言，避免专业术语\n3. **具体可操作**：说明具体的风险和预防措施，而不是泛泛而谈\n4. **不重复显示**：安全警告只在下方\"安全\"标签页中统一显示，不在当前步骤详情中重复显示\n\n## 输出格式\n\n严格按照以下JSON格式输出（返回增强后的装配步骤）：\n\n```json\n{\n  \"enhanced_steps\": [\n    {\n      \"step_number\": 1,\n      \"title\": \"点焊定位\",\n      \"parts_used\": [...],\n      \"tools_required\": [...],\n      \"operation\": \"操作说明\",\n      \"quality_check\": \"质量检查\",\n      \"estimated_time_minutes\": 10,\n      \"welding\": {\n        \"required\": true,\n        \"welding_type\": \"点焊\",\n        \"welding_method\": \"CO2气保焊\",\n        ...\n      },\n      \"safety_warnings\": [\n        \"佩戴焊接面罩和防护手套，防止弧光灼伤眼睛和皮肤\",\n        \"确保工件夹紧牢固，防止点焊时位移造成伤害\",\n        \"焊接区域周围3米内不得有易燃物，配备灭火器\",\n        \"焊机必须接地良好，防止漏电触电\"\n      ]\n    },\n    {\n      \"step_number\": 2,\n      \"title\": \"螺栓连接\",\n      \"parts_used\": [...],\n      \"operation\": \"操作说明\",\n      \"quality_check\": \"质量检查\",\n      \"estimated_time_minutes\": 15,\n      \"safety_warnings\": [\n        \"佩戴安全帽和防护眼镜，防止零件坠落和飞溅\",\n        \"使用扭力扳手时注意力度，防止扳手滑脱伤人\"\n      ]\n    },\n    {\n      \"step_number\": 3,\n      \"title\": \"简单装配\",\n      \"parts_used\": [...],\n      \"operation\": \"操作说明\",\n      \"quality_check\": \"质量检查\",\n      \"estimated_time_minutes\": 5\n      // ⚠️ 如果没有明显安全风险，不添加safety_warnings字段\n    }\n  ]\n}\n```\n\n**⚠️ 关键要求**：\n\n1. **步骤级嵌入**：\n   - 为每个有风险的步骤添加`safety_warnings`字段\n   - 没有明显风险的步骤不添加`safety_warnings`字段\n   - 保持原有步骤的所有字段不变\n\n2. **安全警告要具体**：\n   - ✅ 说\"佩戴焊接面罩和防护手套，防止弧光灼伤眼睛和皮肤\"\n   - ❌ 不说\"注意安全\"\n   - ✅ 说\"焊接区域周围3米内不得有易燃物，配备灭火器\"\n   - ❌ 不说\"注意防火\"\n\n3. **使用通俗语言**：\n   - 工人能看懂的语言\n   - 避免专业术语和英文缩写\n\n4. **警告要全面**：\n   - 涵盖个人防护、设备安全、环境安全、操作安全\n   - 每条警告说明具体的风险和预防措施\n\n## 重要提醒\n\n- **只输出JSON，不要输出其他内容**\n- **保持原有字段不变**：不要修改或删除原有的字段（包括welding字段）\n- **警告要简洁明了**：每条警告一句话，说明风险和预防措施\n- **不要过度警告**：只针对有明显风险的步骤添加警告\n",
  "user_query": "请为以下装配步骤添加安全警告（如果有安全风险）。\n\n## 📸 视觉分析任务\n\n**你会看到工程图纸图片，请仔细观察：**\n\n1. **危险作业标识**：\n   - 图纸上的安全警告标识\n   - 特殊作业要求（如高空作业、吊装作业等）\n   - 危险区域标注\n\n2. **零件特征**：\n   - 重型零件（需要吊装）\n   - 锋利边缘（容易割伤）\n   - 高温部件（容易烫伤）\n\n3. **作业环境**：\n   - 狭窄空间（容易碰撞）\n   - 高空位置（容易坠落）\n   - 密闭空间（通风不良）\n\n## 装配步骤\n\n[\n  {\n    \"step_number\": 1,\n    \"action\": \"放置基准件\",\n    \"description\": \"将图纸上标注为3号的方管-机加（01.02.03.0206）放置在焊接工装夹具上，作为装配基准。确保方管水平且定位准确。\",\n    \"position_description\": \"工装夹具中心位置\",\n    \"parts_used\": [\n      {\n        \"bom_seq\": \"3\",\n        \"bom_name\": \"方管-机加\",\n        \"quantity\": 1,\n        \"drawing_number\": \"3\",\n        \"node_name\": [\n          \"NAUO6\",\n          \"NAUO5\"\n        ],\n        \"bom_code\": \"01.01.4792\"\n      }\n    ],\n    \"tools\": [\n      \"行车/吊具\",\n      \"水平仪\",\n      \"焊接工装夹具\"\n    ],\n    \"warnings\": [\n      \"方管较重，吊装时注意安全，确保吊具捆绑牢固。\",\n      \"定位时注意方管的机加工特征方向。\"\n    ]\n  },\n  {\n    \"step_number\": 2,\n    \"action\": \"安装左右悬挂臂板\",\n    \"description\": \"将图纸上标注为1号的右悬挂臂板（01.02.01.3870）和2号的左悬挂臂板（01.02.01.3871）分别安装到3号方管的两端。注意区分左右件，确保悬挂臂板的安装方向和图纸所示一致。\",\n    \"position_description\": \"3号方管的两端，与方管垂直。\",\n    \"parts_used\": [\n      {\n        \"bom_seq\": \"1\",\n        \"bom_name\": \"右悬挂臂板\",\n        \"quantity\": 1,\n        \"drawing_number\": \"1\",\n        \"node_name\": [\n          \"NAUO2\",\n          \"NAUO1\"\n        ],\n        \"bom_code\": \"01.01.03.0692\"\n      },\n      {\n        \"bom_seq\": \"2\",\n        \"bom_name\": \"左悬挂臂板\",\n        \"quantity\": 1,\n        \"drawing_number\": \"2\",\n        \"node_name\": [\n          \"NAUO4\",\n          \"NAUO3\"\n        ],\n        \"bom_code\": \"01.01.03.0693\"\n      }\n    ],\n    \"tools\": [\n      \"角尺\",\n      \"点焊机\"\n    ],\n    \"warnings\": [\n      \"悬挂臂板与方管的垂直度要求高，需使用角尺辅助定位。\",\n      \"先点焊固定，待后续步骤完成后再进行满焊。\"\n    ],\n    \"welding\": {\n      \"required\": true,\n      \"welding_type\": \"角焊（定位焊）\",\n      \"welding_method\": \"CO2气保焊\",\n      \"weld_size\": \"点焊，焊点长度10-15mm\",\n      \"welding_position\": \"零件1/2（悬挂臂板）与零件3（方管）的连接处，主要为平焊和横焊\",\n      \"quality_requirements\": \"焊点牢固，能承受后续装配应力，确保定位准确，无虚焊。\",\n      \"safety_notes\": \"点焊时注意佩戴焊接面罩和手套，确保工件接地良好，防止触电。\"\n    }\n  },\n  {\n    \"step_number\": 3,\n    \"action\": \"安装旋转弧板\",\n    \"description\": \"将图纸上标注为7号的旋转弧板（01.02.01.3872）安装到3号方管的中间位置。旋转弧板为对称件，共2件，分别安装在方管的上下两侧，确保弧板的中心孔与方管上的定位孔对齐。\",\n    \"position_description\": \"3号方管中部，上下两侧。\",\n    \"parts_used\": [\n      {\n        \"bom_seq\": \"7\",\n        \"bom_name\": \"旋转弧板\",\n        \"quantity\": 2,\n        \"drawing_number\": \"7\",\n        \"node_name\": [\n          \"NAUO11\"\n        ],\n        \"bom_code\": \"01.01.11589\"\n      }\n    ],\n    \"tools\": [\n      \"定位销\",\n      \"点焊机\"\n    ],\n    \"warnings\": [\n      \"旋转弧板的定位精度要求高，必须使用定位销确保中心孔对齐。\",\n      \"先点焊固定，防止后续焊接变形。\"\n    ],\n    \"welding\": {\n      \"required\": true,\n      \"welding_type\": \"角焊（定位焊）\",\n      \"welding_method\": \"CO2气保焊\",\n      \"weld_size\": \"点焊，焊点长度10mm，每侧2点\",\n      \"welding_position\": \"零件7（旋转弧板）与零件3（方管）的连接处，主要为平焊\",\n      \"quality_requirements\": \"定位焊牢固，保证弧板与方管的垂直度和同轴度，定位销取出后孔位无变形。\",\n      \"safety_notes\": \"焊接前清理定位区域的油污和锈蚀，防止产生气孔。注意焊枪角度，避免烧伤定位销。\"\n    }\n  },\n  {\n    \"step_number\": 4,\n    \"action\": \"安装固定套和轴套\",\n    \"description\": \"将图纸上标注为8号的固定套（01.02.05.0334）和9号的轴套（01.02.02.0447）安装到7号旋转弧板的连接位置。固定套安装在弧板的内侧，轴套安装在弧板的外部，确保两者同轴。\",\n    \"position_description\": \"7号旋转弧板的连接孔位。\",\n    \"parts_used\": [\n      {\n        \"bom_seq\": \"8\",\n        \"bom_name\": \"固定套\",\n        \"quantity\": 1,\n        \"drawing_number\": \"8\",\n        \"node_name\": [\n          \"NAUO12\"\n        ],\n        \"bom_code\": \"01.01.11590\"\n      },\n      {\n        \"bom_seq\": \"9\",\n        \"bom_name\": \"轴套\",\n        \"quantity\": 1,\n        \"drawing_number\": \"9\",\n        \"node_name\": [\n          \"NAUO15\",\n          \"NAUO13\"\n        ],\n        \"bom_code\": \"01.01.11593\"\n      }\n    ],\n    \"tools\": [\n      \"点焊机\",\n      \"游标卡尺\"\n    ],\n    \"warnings\": [\n      \"固定套和轴套的焊接位置必须准确，确保后续配合精度。\",\n      \"轴套焊接时注意保护内孔，防止焊渣飞溅。\"\n    ],\n    \"welding\": {\n      \"required\": true,\n      \"welding_type\": \"角焊（定位焊）\",\n      \"welding_method\": \"CO2气保焊\",\n      \"weld_size\": \"点焊，焊点长度10mm，环向均匀分布3点\",\n      \"welding_position\": \"零件8（固定套）/零件9（轴套）与零件7（旋转弧板）的连接处，主要为平焊\",\n      \"quality_requirements\": \"确保套筒与弧板垂直，同轴度要求高。定位焊后需用卡尺复核位置。\",\n      \"safety_notes\": \"轴套内孔需用耐热塞堵住，防止焊接飞溅物进入。焊接电流不宜过大，避免烧穿薄壁套筒。\"\n    }\n  },\n  {\n    \"step_number\": 5,\n    \"action\": \"安装角钢和方形板\",\n    \"description\": \"将图纸上标注为4号的角钢（01.02.04.0084）和6号的方形板（01.01.01.4776）安装到3号方管的指定位置。4号角钢共5件，用于加强筋；6号方形板共2件，安装在方管的侧面。\",\n    \"position_description\": \"4号角钢安装在3号方管的顶部和侧面加强位置；6号方形板安装在3号方管的侧面。\",\n    \"parts_used\": [\n      {\n        \"bom_seq\": \"4\",\n        \"bom_name\": \"角钢\",\n        \"quantity\": 5,\n        \"drawing_number\": \"4\",\n        \"node_name\": [\n          \"NAUO9\"\n        ],\n        \"bom_code\": \"01.02.01.3876\"\n      },\n      {\n        \"bom_seq\": \"6\",\n        \"bom_name\": \"方形板\",\n        \"quantity\": 2,\n        \"drawing_number\": \"6\",\n        \"node_name\": [\n          \"NAUO10\"\n        ],\n        \"bom_code\": \"01.02.0446\"\n      }\n    ],\n    \"tools\": [\n      \"点焊机\",\n      \"卷尺\"\n    ],\n    \"warnings\": [\n      \"角钢和方形板的定位尺寸需严格按照图纸要求，使用卷尺进行测量。\",\n      \"先点焊固定，确保所有加强件位置正确。\"\n    ],\n    \"welding\": {\n      \"required\": true,\n      \"welding_type\": \"角焊（定位焊）\",\n      \"welding_method\": \"CO2气保焊\",\n      \"weld_size\": \"点焊，焊点长度10-15mm\",\n      \"welding_position\": \"零件4（角钢）/零件6（方形板）与零件3（方管）的连接处，主要为平焊和横焊\",\n      \"quality_requirements\": \"定位焊位置准确，确保角钢和方形板与方管贴合紧密，无明显间隙。\",\n      \"safety_notes\": \"角钢较小，定位时注意夹紧，防止焊接时移动。注意焊枪角度，保证焊点强度。\"\n    }\n  },\n  {\n    \"step_number\": 6,\n    \"action\": \"安装方管-机加和中连接板\",\n    \"description\": \"将图纸上标注为5号的方管-机加（01.02.03.0207）和10号的中连接板（01.02.01.3876）安装到主框架上。5号方管-机加共2件，安装在3号方管的侧面；10号中连接板共1件，安装在3号方管的底部。\",\n    \"position_description\": \"5号方管-机加安装在3号方管侧面；10号中连接板安装在3号方管底部。\",\n    \"parts_used\": [\n      {\n        \"bom_seq\": \"5\",\n        \"bom_name\": \"方管-机加\",\n        \"quantity\": 2,\n        \"drawing_number\": \"5\"\n      },\n      {\n        \"bom_seq\": \"10\",\n        \"bom_name\": \"中连接板\",\n        \"quantity\": 1,\n        \"drawing_number\": \"10\",\n        \"node_name\": [\n          \"NAUO14\"\n        ],\n        \"bom_code\": \"01.01.11591\"\n      }\n    ],\n    \"tools\": [\n      \"点焊机\",\n      \"卡尺\"\n    ],\n    \"warnings\": [\n      \"5号方管-机加的安装方向需注意，确保机加工孔位朝向正确。\",\n      \"10号中连接板需与3号方管底部贴合紧密。\"\n    ],\n    \"welding\": {\n      \"required\": true,\n      \"welding_type\": \"角焊（定位焊）\",\n      \"welding_method\": \"CO2气保焊\",\n      \"weld_size\": \"点焊，焊点长度15mm，每条边2点\",\n      \"welding_position\": \"零件5（方管-机加）/零件10（中连接板）与零件3（方管）的连接处，主要为平焊和横焊\",\n      \"quality_requirements\": \"定位焊后检查零件5的孔位间距和相对位置，确保符合图纸要求。\",\n      \"safety_notes\": \"焊接时注意保护零件5上的机加工孔，避免飞溅物堵塞或损伤孔壁。\"\n    }\n  },\n  {\n    \"step_number\": 7,\n    \"action\": \"安装剩余加强板\",\n    \"description\": \"安装剩余的加强板：11号三角板（01.01.11626）、12号方形板（01.01.3941）、13号防滑板（01.01.0517）和14号中侧板（01.01.4792）。这些零件主要用于局部加强和功能支撑。\",\n    \"position_description\": \"根据图纸所示，安装在主框架的各个加强位置。\",\n    \"parts_used\": [\n      {\n        \"bom_seq\": \"11\",\n        \"bom_name\": \"三角板\",\n        \"quantity\": 1,\n        \"drawing_number\": \"11\",\n        \"node_name\": [\n          \"NAUO19\",\n          \"NAUO18\",\n          \"NAUO17\",\n          \"NAUO16\"\n        ],\n        \"bom_code\": \"01.01.11626\"\n      },\n      {\n        \"bom_seq\": \"12\",\n        \"bom_name\": \"方形板\",\n        \"quantity\": 1,\n        \"drawing_number\": \"12\",\n        \"node_name\": [\n          \"NAUO23\",\n          \"NAUO22\",\n          \"NAUO21\",\n          \"NAUO20\"\n        ],\n        \"bom_code\": \"01.01.3941\"\n      },\n      {\n        \"bom_seq\": \"13\",\n        \"bom_name\": \"防滑板\",\n        \"quantity\": 1,\n        \"drawing_number\": \"13\",\n        \"node_name\": [\n          \"NAUO25\",\n          \"NAUO24\"\n        ],\n        \"bom_code\": \"01.01.0517\"\n      },\n      {\n        \"bom_seq\": \"14\",\n        \"bom_name\": \"中侧板\",\n        \"quantity\": 1,\n        \"drawing_number\": \"14\"\n      }\n    ],\n    \"tools\": [\n      \"点焊机\"\n    ],\n    \"warnings\": [\n      \"确保所有加强板与主框架贴合紧密，无间隙。\",\n      \"防滑板的安装位置需确保其防滑纹理朝外。\"\n    ],\n    \"welding\": {\n      \"required\": true,\n      \"welding_type\": \"角焊（定位焊）\",\n      \"welding_method\": \"CO2气保焊\",\n      \"weld_size\": \"点焊，焊点长度10mm\",\n      \"welding_position\": \"零件11/12/13/14与主框架（零件3/5）的连接处，涉及平焊、横焊和立焊\",\n      \"quality_requirements\": \"定位焊后检查所有加强板的平面度，防止因定位焊应力导致变形。\",\n      \"safety_notes\": \"由于零件较多，定位焊时需注意焊接顺序，避免局部热量集中。确保工作区域通风良好。\"\n    }\n  },\n  {\n    \"step_number\": 8,\n    \"action\": \"满焊所有零件\",\n    \"description\": \"对所有已点焊固定的零件（1号、2号、4号、5号、6号、7号、8号、9号、10号、11号、12号、13号、14号）进行满焊。焊接时应遵循对称、分段、跳焊的原则，以减少焊接应力，防止结构变形。\",\n    \"position_description\": \"所有零件的连接处。\",\n    \"parts_used\": [],\n    \"tools\": [\n      \"焊机\",\n      \"焊条/焊丝\"\n    ],\n    \"warnings\": [\n      \"严格按照技术要求进行焊接，确保焊缝饱满、无气孔、无夹渣。\",\n      \"焊接过程中需随时检查零件的形变情况，必要时进行反变形处理。\"\n    ],\n    \"welding\": {\n      \"required\": true,\n      \"welding_type\": \"角焊/环缝焊（满焊）\",\n      \"welding_method\": \"CO2气保焊（主要）/手工电弧焊（局部难达区域）\",\n      \"weld_size\": \"焊缝高度4mm-6mm（根据板厚确定，以图纸标注为准）\",\n      \"welding_position\": \"所有连接缝，涉及平焊、横焊、立焊、仰焊\",\n      \"quality_requirements\": \"焊缝必须连续、饱满，外观平整，无咬边、气孔、裂纹、夹渣等缺陷。关键受力焊缝（如悬挂臂板连接处）需进行外观和无损检测（如磁粉或超声波）。\",\n      \"safety_notes\": \"进行大面积满焊时，必须穿戴全套防护服、焊接面罩和手套。确保焊机电缆绝缘良好，防止烫伤和火灾。注意控制焊接变形，采用分段、跳焊工艺，避免应力集中。\"\n    }\n  },\n  {\n    \"step_number\": 9,\n    \"action\": \"清理和打磨\",\n    \"description\": \"焊接完成后，清除所有焊渣、飞溅物。对所有焊缝进行打磨处理，特别是外观面和配合面，确保锐边、尖角倒钝，符合图纸技术要求。\",\n    \"position_description\": \"所有焊缝区域。\",\n    \"parts_used\": [],\n    \"tools\": [\n      \"角磨机\",\n      \"钢丝刷\",\n      \"除渣锤\"\n    ],\n    \"warnings\": [\n      \"打磨时注意佩戴防护眼镜和手套。\",\n      \"配合面打磨需平整，不得影响后续装配。\"\n    ]\n  }\n]\n\n## 要求\n\n请按照以下5个步骤思考，为装配步骤添加安全警告：\n\n### 步骤1：识别风险步骤\n- 分析每个装配步骤的操作内容\n- 判断是否涉及高风险作业：\n  * **焊接作业**：电击、弧光、烫伤、火灾\n  * **吊装作业**：吊物坠落、碰撞、超载\n  * **高空作业**：人员坠落、物体打击\n  * **重物搬运**：砸伤、扭伤、夹伤\n  * **机械加工**：切割伤、夹伤、碰撞\n\n### 步骤2：分析风险源\n- 确定风险的来源（设备、工具、材料、环境、人员操作等）\n- 评估风险的严重程度（轻微、中等、严重、致命）\n- 考虑风险的发生概率\n\n### 步骤3：制定预防措施\n- 针对每个风险源，制定具体的预防措施\n- 强调个人防护用品的使用：\n  * **焊接**：焊接面罩、防护手套、防护服\n  * **吊装**：安全帽、安全鞋、手套\n  * **高空**：安全带、安全帽、防滑鞋\n  * **机械**：防护眼镜、手套、安全鞋\n\n### 步骤4：添加安全警告\n- 为每个有风险的步骤添加safety_warnings字段\n- 每条警告要简洁明了，说明具体的风险和预防措施\n- 使用工人能看懂的语言\n\n### 步骤5：验证完整性\n- 检查所有高风险步骤是否都添加了安全警告\n- 检查安全警告是否具体、可操作\n- 检查是否遗漏了任何潜在风险\n\n## ⚠️ 强制自检清单（生成后必须逐项检查）\n\n**在输出JSON之前，你必须完成以下验证：**\n\n1. **风险步骤识别验证**：\n   - [ ] 所有涉及焊接、吊装、高空、重物搬运的步骤都添加了safety_warnings字段\n   - [ ] 没有明显风险的步骤没有添加safety_warnings字段\n\n2. **安全警告完整性验证**：\n   - [ ] 每个safety_warnings字段都是字符串数组\n   - [ ] 每条警告都说明了具体的风险和预防措施\n   - [ ] 涵盖了个人防护、设备安全、环境安全、操作安全\n\n3. **语言通俗性验证**：\n   - [ ] 使用工人能看懂的语言\n   - [ ] 避免专业术语和英文缩写\n   - [ ] 每条警告简洁明了（一句话）\n\n4. **原有字段保持验证**：\n   - [ ] 原有步骤的所有字段都保持不变（包括welding字段）\n   - [ ] 没有修改或删除任何原有字段\n\n**如果自检发现任何问题，必须重新生成！**\n\n现在开始为装配步骤添加安全警告！\n",
  "raw_response": "```json\n{\n  \"enhanced_steps\": [\n    {\n      \"step_number\": 1,\n      \"action\": \"放置基准件\",\n      \"description\": \"将图纸上标注为3号的方管-机加（01.02.03.0206）放置在焊接工装夹具上，作为装配基准。确保方管水平且定位准确。\",\n      \"position_description\": \"工装夹具中心位置\",\n      \"parts_used\": [\n        {\n          \"bom_seq\": \"3\",\n          \"bom_name\": \"方管-机加\",\n          \"quantity\": 1,\n          \"drawing_number\": \"3\",\n          \"node_name\": [\n            \"NAUO6\",\n            \"NAUO5\"\n          ],\n          \"bom_code\": \"01.01.4792\"\n        }\n      ],\n      \"tools\": [\n        \"行车/吊具\",\n        \"水平仪\",\n        \"焊接工装夹具\"\n      ],\n      \"warnings\": [\n        \"方管较重，吊装时注意安全，确保吊具捆绑牢固。\",\n        \"定位时注意方管的机加工特征方向。\"\n      ],\n      \"safety_warnings\": [\n        \"吊装前检查行车和吊索具是否完好，防止吊物坠落伤人。\",\n        \"吊装区域内非作业人员必须撤离，作业人员佩戴安全帽。\",\n        \"指挥人员必须使用统一手势，确保吊装平稳，避免碰撞。\"\n      ]\n    },\n    {\n      \"step_number\": 2,\n      \"action\": \"安装左右悬挂臂板\",\n      \"description\": \"将图纸上标注为1号的右悬挂臂板（01.02.01.3870）和2号的左悬挂臂板（01.02.01.3871）分别安装到3号方管的两端。注意区分左右件，确保悬挂臂板的安装方向和图纸所示一致。\",\n      \"position_description\": \"3号方管的两端，与方管垂直。\",\n      \"parts_used\": [\n        {\n          \"bom_seq\": \"1\",\n          \"bom_name\": \"右悬挂臂板\",\n          \"quantity\": 1,\n          \"drawing_number\": \"1\",\n          \"node_name\": [\n            \"NAUO2\",\n            \"NAUO1\"\n          ],\n          \"bom_code\": \"01.01.03.0692\"\n        },\n        {\n          \"bom_seq\": \"2\",\n          \"bom_name\": \"左悬挂臂板\",\n          \"quantity\": 1,\n          \"drawing_number\": \"2\",\n          \"node_name\": [\n            \"NAUO4\",\n            \"NAUO3\"\n          ],\n          \"bom_code\": \"01.01.03.0693\"\n        }\n      ],\n      \"tools\": [\n        \"角尺\",\n        \"点焊机\"\n      ],\n      \"warnings\": [\n        \"悬挂臂板与方管的垂直度要求高，需使用角尺辅助定位。\",\n        \"先点焊固定，待后续步骤完成后再进行满焊。\"\n      ],\n      \"welding\": {\n        \"required\": true,\n        \"welding_type\": \"角焊（定位焊）\",\n        \"welding_method\": \"CO2气保焊\",\n        \"weld_size\": \"点焊，焊点长度10-15mm\",\n        \"welding_position\": \"零件1/2（悬挂臂板）与零件3（方管）的连接处，主要为平焊和横焊\",\n        \"quality_requirements\": \"焊点牢固，能承受后续装配应力，确保定位准确，无虚焊。\",\n        \"safety_notes\": \"点焊时注意佩戴焊接面罩和手套，确保工件接地良好，防止触电。\"\n      },\n      \"safety_warnings\": [\n        \"进行点焊作业时，必须佩戴焊接面罩、防护手套和防护服，防止弧光灼伤和烫伤。\",\n        \"确保焊机接地线连接可靠，防止发生触电事故。\",\n        \"定位板材时，注意边缘可能锋利，佩戴防割手套防止割伤。\"\n      ]\n    },\n    {\n      \"step_number\": 3,\n      \"action\": \"安装旋转弧板\",\n      \"description\": \"将图纸上标注为7号的旋转弧板（01.02.01.3872）安装到3号方管的中间位置。旋转弧板为对称件，共2件，分别安装在方管的上下两侧，确保弧板的中心孔与方管上的定位孔对齐。\",\n      \"position_description\": \"3号方管中部，上下两侧。\",\n      \"parts_used\": [\n        {\n          \"bom_seq\": \"7\",\n          \"bom_name\": \"旋转弧板\",\n          \"quantity\": 2,\n          \"drawing_number\": \"7\",\n          \"node_name\": [\n            \"NAUO11\"\n          ],\n          \"bom_code\": \"01.01.11589\"\n        }\n      ],\n      \"tools\": [\n        \"定位销\",\n        \"点焊机\"\n      ],\n      \"warnings\": [\n        \"旋转弧板的定位精度要求高，必须使用定位销确保中心孔对齐。\",\n        \"先点焊固定，防止后续焊接变形。\"\n      ],\n      \"welding\": {\n        \"required\": true,\n        \"welding_type\": \"角焊（定位焊）\",\n        \"welding_method\": \"CO2气保焊\",\n        \"weld_size\": \"点焊，焊点长度10mm，每侧2点\",\n        \"welding_position\": \"零件7（旋转弧板）与零件3（方管）的连接处，主要为平焊\",\n        \"quality_requirements\": \"定位焊牢固，保证弧板与方管的垂直度和同轴度，定位销取出后孔位无变形。\",\n        \"safety_notes\": \"焊接前清理定位区域的油污和锈蚀，防止产生气孔。注意焊枪角度，避免烧伤定位销。\"\n      },\n      \"safety_warnings\": [\n        \"点焊时佩戴焊接面罩和手套，防止弧光和飞溅物烫伤。\",\n        \"确保工作区域通风良好，防止焊接烟尘和有毒气体危害健康。\",\n        \"定位销取出后，注意检查周围是否有毛刺或尖锐边缘，防止割伤。\"\n      ]\n    },\n    {\n      \"step_number\": 4,\n      \"action\": \"安装固定套和轴套\",\n      \"description\": \"将图纸上标注为8号的固定套（01.02.05.0334）和9号的轴套（01.02.02.0447）安装到7号旋转弧板的连接位置。固定套安装在弧板的内侧，轴套安装在弧板的外部，确保两者同轴。\",\n      \"position_description\": \"7号旋转弧板的连接孔位。\",\n      \"parts_used\": [\n        {\n          \"bom_seq\": \"8\",\n          \"bom_name\": \"固定套\",\n          \"quantity\": 1,\n          \"drawing_number\": \"8\",\n          \"node_name\": [\n            \"NAUO12\"\n          ],\n          \"bom_code\": \"01.01.11590\"\n        },\n        {\n          \"bom_seq\": \"9\",\n          \"bom_name\": \"轴套\",\n          \"quantity\": 1,\n          \"drawing_number\": \"9\",\n          \"node_name\": [\n            \"NAUO15\",\n            \"NAUO13\"\n          ],\n          \"bom_code\": \"01.01.11593\"\n        }\n      ],\n      \"tools\": [\n        \"点焊机\",\n        \"游标卡尺\"\n      ],\n      \"warnings\": [\n        \"固定套和轴套的焊接位置必须准确，确保后续配合精度。\",\n        \"轴套焊接时注意保护内孔，防止焊渣飞溅。\"\n      ],\n      \"welding\": {\n        \"required\": true,\n        \"welding_type\": \"角焊（定位焊）\",\n        \"welding_method\": \"CO2气保焊\",\n        \"weld_size\": \"点焊，焊点长度10mm，环向均匀分布3点\",\n        \"welding_position\": \"零件8（固定套）/零件9（轴套）与零件7（旋转弧板）的连接处，主要为平焊\",\n        \"quality_requirements\": \"确保套筒与弧板垂直，同轴度要求高。定位焊后需用卡尺复核位置。\",\n        \"safety_notes\": \"轴套内孔需用耐热塞堵住，防止焊接飞溅物进入。焊接电流不宜过大，避免烧穿薄壁套筒。\"\n      },\n      \"safety_warnings\": [\n        \"焊接时必须佩戴焊接面罩和手套，防止弧光和高温飞溅物烫伤。\",\n        \"轴套内孔使用耐热塞堵住时，确保塞子固定牢固，防止焊接时脱落。\",\n        \"焊接完成后，不要立即触摸套筒，防止高温烫伤。\"\n      ]\n    },\n    {\n      \"step_number\": 5,\n      \"action\": \"安装角钢和方形板\",\n      \"description\": \"将图纸上标注为4号的角钢（01.02.04.0084）和6号的方形板（01.01.01.4776）安装到3号方管的指定位置。4号角钢共5件，用于加强筋；6号方形板共2件，安装在方管的侧面。\",\n      \"position_description\": \"4号角钢安装在3号方管的顶部和侧面加强位置；6号方形板安装在3号方管的侧面。\",\n      \"parts_used\": [\n        {\n          \"bom_seq\": \"4\",\n          \"bom_name\": \"角钢\",\n          \"quantity\": 5,\n          \"drawing_number\": \"4\",\n          \"node_name\": [\n            \"NAUO9\"\n          ],\n          \"bom_code\": \"01.02.01.3876\"\n        },\n        {\n          \"bom_seq\": \"6\",\n          \"bom_name\": \"方形板\",\n          \"quantity\": 2,\n          \"drawing_number\": \"6\",\n          \"node_name\": [\n            \"NAUO10\"\n          ],\n          \"bom_code\": \"01.02.0446\"\n        }\n      ],\n      \"tools\": [\n        \"点焊机\",\n        \"卷尺\"\n      ],\n      \"warnings\": [\n        \"角钢和方形板的定位尺寸需严格按照图纸要求，使用卷尺进行测量。\",\n        \"先点焊固定，确保所有加强件位置正确。\"\n      ],\n      \"welding\": {\n        \"required\": true,\n        \"welding_type\": \"角焊（定位焊）\",\n        \"welding_method\": \"CO2气保焊\",\n        \"weld_size\": \"点焊，焊点长度10-15mm\",\n        \"welding_position\": \"零件4（角钢）/零件6（方形板）与零件3（方管）的连接处，主要为平焊和横焊\",\n        \"quality_requirements\": \"定位焊位置准确，确保角钢和方形板与方管贴合紧密，无明显间隙。\",\n        \"safety_notes\": \"角钢较小，定位时注意夹紧，防止焊接时移动。注意焊枪角度，保证焊点强度。\"\n      },\n      \"safety_warnings\": [\n        \"定位焊时佩戴焊接面罩和手套，防止弧光和飞溅物烫伤。\",\n        \"角钢和方形板边缘可能锋利，搬运时佩戴防割手套。\",\n        \"使用夹具固定小零件时，确保夹紧力适中，防止零件弹出伤人。\"\n      ]\n    },\n    {\n      \"step_number\": 6,\n      \"action\": \"安装方管-机加和中连接板\",\n      \"description\": \"将图纸上标注为5号的方管-机加（01.02.03.0207）和10号的中连接板（01.02.01.3876）安装到主框架上。5号方管-机加共2件，安装在3号方管的侧面；10号中连接板共1件，安装在3号方管的底部。\",\n      \"position_description\": \"5号方管-机加安装在3号方管侧面；10号中连接板安装在3号方管底部。\",\n      \"parts_used\": [\n        {\n          \"bom_seq\": \"5\",\n          \"bom_name\": \"方管-机加\",\n          \"quantity\": 2,\n          \"drawing_number\": \"5\"\n        },\n        {\n          \"bom_seq\": \"10\",\n          \"bom_name\": \"中连接板\",\n          \"quantity\": 1,\n          \"drawing_number\": \"10\",\n          \"node_name\": [\n            \"NAUO14\"\n          ],\n          \"bom_code\": \"01.01.11591\"\n        }\n      ],\n      \"tools\": [\n        \"点焊机\",\n        \"卡尺\"\n      ],\n      \"warnings\": [\n        \"5号方管-机加的安装方向需注意，确保机加工孔位朝向正确。\",\n        \"10号中连接板需与3号方管底部贴合紧密。\"\n      ],\n      \"welding\": {\n        \"required\": true,\n        \"welding_type\": \"角焊（定位焊）\",\n        \"welding_method\": \"CO2气保焊\",\n        \"weld_size\": \"点焊，焊点长度15mm，每条边2点\",\n        \"welding_position\": \"零件5（方管-机加）/零件10（中连接板）与零件3（方管）的连接处，主要为平焊和横焊\",\n        \"quality_requirements\": \"定位焊后检查零件5的孔位间距和相对位置，确保符合图纸要求。\",\n        \"safety_notes\": \"焊接时注意保护零件5上的机加工孔，避免飞溅物堵塞或损伤孔壁。\"\n      },\n      \"safety_warnings\": [\n        \"焊接时必须佩戴焊接面罩和手套，防止弧光和飞溅物烫伤。\",\n        \"保护好机加工孔位，防止焊渣飞溅进入，造成后续装配困难或损伤。\",\n        \"确保焊机电缆远离热源和尖锐物体，防止绝缘层破损导致触电。\"\n      ]\n    },\n    {\n      \"step_number\": 7,\n      \"action\": \"安装剩余加强板\",\n      \"description\": \"安装剩余的加强板：11号三角板（01.01.11626）、12号方形板（01.01.3941）、13号防滑板（01.01.0517）和14号中侧板（01.01.4792）。这些零件主要用于局部加强和功能支撑。\",\n      \"position_description\": \"根据图纸所示，安装在主框架的各个加强位置。\",\n      \"parts_used\": [\n        {\n          \"bom_seq\": \"11\",\n          \"bom_name\": \"三角板\",\n          \"quantity\": 1,\n          \"drawing_number\": \"11\",\n          \"node_name\": [\n            \"NAUO19\",\n            \"NAUO18\",\n            \"NAUO17\",\n            \"NAUO16\"\n          ],\n          \"bom_code\": \"01.01.11626\"\n        },\n        {\n          \"bom_seq\": \"12\",\n          \"bom_name\": \"方形板\",\n          \"quantity\": 1,\n          \"drawing_number\": \"12\",\n          \"node_name\": [\n            \"NAUO23\",\n            \"NAUO22\",\n            \"NAUO21\",\n            \"NAUO20\"\n          ],\n          \"bom_code\": \"01.01.3941\"\n        },\n        {\n          \"bom_seq\": \"13\",\n          \"bom_name\": \"防滑板\",\n          \"quantity\": 1,\n          \"drawing_number\": \"13\",\n          \"node_name\": [\n            \"NAUO25\",\n            \"NAUO24\"\n          ],\n          \"bom_code\": \"01.01.0517\"\n        },\n        {\n          \"bom_seq\": \"14\",\n          \"bom_name\": \"中侧板\",\n          \"quantity\": 1,\n          \"drawing_number\": \"14\"\n        }\n      ],\n      \"tools\": [\n        \"点焊机\"\n      ],\n      \"warnings\": [\n        \"确保所有加强板与主框架贴合紧密，无间隙。\",\n        \"防滑板的安装位置需确保其防滑纹理朝外。\"\n      ],\n      \"welding\": {\n        \"required\": true,\n        \"welding_type\": \"角焊（定位焊）\",\n        \"welding_method\": \"CO2气保焊\",\n        \"weld_size\": \"点焊，焊点长度10mm\",\n        \"welding_position\": \"零件11/12/13/14与主框架（零件3/5）的连接处，涉及平焊、横焊和立焊\",\n        \"quality_requirements\": \"定位焊后检查所有加强板的平面度，防止因定位焊应力导致变形。\",\n        \"safety_notes\": \"由于零件较多，定位焊时需注意焊接顺序，避免局部热量集中。确保工作区域通风良好。\"\n      },\n      \"safety_warnings\": [\n        \"所有板材边缘可能锋利，搬运和定位时必须佩戴防割手套。\",\n        \"进行定位焊时，必须佩戴焊接面罩和手套，防止弧光和飞溅物烫伤。\",\n        \"确保工作区域通风良好，防止焊接烟尘浓度过高。\"\n      ]\n    },\n    {\n      \"step_number\": 8,\n      \"action\": \"满焊所有零件\",\n      \"description\": \"对所有已点焊固定的零件（1号、2号、4号、5号、6号、7号、8号、9号、10号、11号、12号、13号、14号）进行满焊。焊接时应遵循对称、分段、跳焊的原则，以减少焊接应力，防止结构变形。\",\n      \"position_description\": \"所有零件的连接处。\",\n      \"parts_used\": [],\n      \"tools\": [\n        \"焊机\",\n        \"焊条/焊丝\"\n      ],\n      \"warnings\": [\n        \"严格按照技术要求进行焊接，确保焊缝饱满、无气孔、无夹渣。\",\n        \"焊接过程中需随时检查零件的形变情况，必要时进行反变形处理。\"\n      ],\n      \"welding\": {\n        \"required\": true,\n        \"welding_type\": \"角焊/环缝焊（满焊）\",\n        \"welding_method\": \"CO2气保焊（主要）/手工电弧焊（局部难达区域）\",\n        \"weld_size\": \"焊缝高度4mm-6mm（根据板厚确定，以图纸标注为准）\",\n        \"welding_position\": \"所有连接缝，涉及平焊、横焊、立焊、仰焊\",\n        \"quality_requirements\": \"焊缝必须连续、饱满，外观平整，无咬边、气孔、裂纹、夹渣等缺陷。关键受力焊缝（如悬挂臂板连接处）需进行外观和无损检测（如磁粉或超声波）。\",\n        \"safety_notes\": \"进行大面积满焊时，必须穿戴全套防护服、焊接面罩和手套。确保焊机电缆绝缘良好，防止烫伤和火灾。注意控制焊接变形，采用分段、跳焊工艺，避免应力集中。\"\n      },\n      \"safety_warnings\": [\n        \"满焊作业必须穿戴全套阻燃防护服、焊接面罩和手套，防止大面积弧光灼伤和高温烫伤。\",\n        \"确保焊接区域配备灭火器材，并清理周围易燃物，防止火灾。\",\n        \"焊接过程中产生的烟尘和有毒气体较多，必须开启局部排风或佩戴呼吸防护用品。\",\n        \"检查焊机电缆和气瓶管路，确保无破损、无泄漏，防止触电或爆炸。\"\n      ]\n    },\n    {\n      \"step_number\": 9,\n      \"action\": \"清理和打磨\",\n      \"description\": \"焊接完成后，清除所有焊渣、飞溅物。对所有焊缝进行打磨处理，特别是外观面和配合面，确保锐边、尖角倒钝，符合图纸技术要求。\",\n      \"position_description\": \"所有焊缝区域。\",\n      \"parts_used\": [],\n      \"tools\": [\n        \"角磨机\",\n        \"钢丝刷\",\n        \"除渣锤\"\n      ],\n      \"warnings\": [\n        \"打磨时注意佩戴防护眼镜和手套。\",\n        \"配合面打磨需平整，不得影响后续装配。\"\n      ],\n      \"safety_warnings\": [\n        \"使用角磨机时，必须佩戴防护眼镜或面罩，防止高速飞溅的火花和金属碎屑伤眼。\",\n        \"打磨作业时佩戴防尘口罩，防止吸入金属粉尘。\",\n        \"检查角磨机防护罩是否安装到位，防止砂轮片破裂伤人。\",\n        \"打磨后的工件表面温度高，清理时注意佩戴耐热手套，防止烫伤。\"\n      ]\n    }\n  ]\n}\n```",
  "parsed_result": {
    "enhanced_steps": [
      {
        "step_number": 1,
        "action": "放置基准件",
        "description": "将图纸上标注为3号的方管-机加（01.02.03.0206）放置在焊接工装夹具上，作为装配基准。确保方管水平且定位准确。",
        "position_description": "工装夹具中心位置",
        "parts_used": [
          {
            "bom_seq": "3",
            "bom_name": "方管-机加",
            "quantity": 1,
            "drawing_number": "3",
            "node_name": [
              "NAUO6",
              "NAUO5"
            ],
            "bom_code": "01.01.4792"
          }
        ],
        "tools": [
          "行车/吊具",
          "水平仪",
          "焊接工装夹具"
        ],
        "warnings": [
          "方管较重，吊装时注意安全，确保吊具捆绑牢固。",
          "定位时注意方管的机加工特征方向。"
        ],
        "safety_warnings": [
          "吊装前检查行车和吊索具是否完好，防止吊物坠落伤人。",
          "吊装区域内非作业人员必须撤离，作业人员佩戴安全帽。",
          "指挥人员必须使用统一手势，确保吊装平稳，避免碰撞。"
        ]
      },
      {
        "step_number": 2,
        "action": "安装左右悬挂臂板",
        "description": "将图纸上标注为1号的右悬挂臂板（01.02.01.3870）和2号的左悬挂臂板（01.02.01.3871）分别安装到3号方管的两端。注意区分左右件，确保悬挂臂板的安装方向和图纸所示一致。",
        "position_description": "3号方管的两端，与方管垂直。",
        "parts_used": [
          {
            "bom_seq": "1",
            "bom_name": "右悬挂臂板",
            "quantity": 1,
            "drawing_number": "1",
            "node_name": [
              "NAUO2",
              "NAUO1"
            ],
            "bom_code": "01.01.03.0692"
          },
          {
            "bom_seq": "2",
            "bom_name": "左悬挂臂板",
            "quantity": 1,
            "drawing_number": "2",
            "node_name": [
              "NAUO4",
              "NAUO3"
            ],
            "bom_code": "01.01.03.0693"
          }
        ],
        "tools": [
          "角尺",
          "点焊机"
        ],
        "warnings": [
          "悬挂臂板与方管的垂直度要求高，需使用角尺辅助定位。",
          "先点焊固定，待后续步骤完成后再进行满焊。"
        ],
        "welding": {
          "required": true,
          "welding_type": "角焊（定位焊）",
          "welding_method": "CO2气保焊",
          "weld_size": "点焊，焊点长度10-15mm",
          "welding_position": "零件1/2（悬挂臂板）与零件3（方管）的连接处，主要为平焊和横焊",
          "quality_requirements": "焊点牢固，能承受后续装配应力，确保定位准确，无虚焊。",
          "safety_notes": "点焊时注意佩戴焊接面罩和手套，确保工件接地良好，防止触电。"
        },
        "safety_warnings": [
          "进行点焊作业时，必须佩戴焊接面罩、防护手套和防护服，防止弧光灼伤和烫伤。",
          "确保焊机接地线连接可靠，防止发生触电事故。",
          "定位板材时，注意边缘可能锋利，佩戴防割手套防止割伤。"
        ]
      },
      {
        "step_number": 3,
        "action": "安装旋转弧板",
        "description": "将图纸上标注为7号的旋转弧板（01.02.01.3872）安装到3号方管的中间位置。旋转弧板为对称件，共2件，分别安装在方管的上下两侧，确保弧板的中心孔与方管上的定位孔对齐。",
        "position_description": "3号方管中部，上下两侧。",
        "parts_used": [
          {
            "bom_seq": "7",
            "bom_name": "旋转弧板",
            "quantity": 2,
            "drawing_number": "7",
            "node_name": [
              "NAUO11"
            ],
            "bom_code": "01.01.11589"
          }
        ],
        "tools": [
          "定位销",
          "点焊机"
        ],
        "warnings": [
          "旋转弧板的定位精度要求高，必须使用定位销确保中心孔对齐。",
          "先点焊固定，防止后续焊接变形。"
        ],
        "welding": {
          "required": true,
          "welding_type": "角焊（定位焊）",
          "welding_method": "CO2气保焊",
          "weld_size": "点焊，焊点长度10mm，每侧2点",
          "welding_position": "零件7（旋转弧板）与零件3（方管）的连接处，主要为平焊",
          "quality_requirements": "定位焊牢固，保证弧板与方管的垂直度和同轴度，定位销取出后孔位无变形。",
          "safety_notes": "焊接前清理定位区域的油污和锈蚀，防止产生气孔。注意焊枪角度，避免烧伤定位销。"
        },
        "safety_warnings": [
          "点焊时佩戴焊接面罩和手套，防止弧光和飞溅物烫伤。",
          "确保工作区域通风良好，防止焊接烟尘和有毒气体危害健康。",
          "定位销取出后，注意检查周围是否有毛刺或尖锐边缘，防止割伤。"
        ]
      },
      {
        "step_number": 4,
        "action": "安装固定套和轴套",
        "description": "将图纸上标注为8号的固定套（01.02.05.0334）和9号的轴套（01.02.02.0447）安装到7号旋转弧板的连接位置。固定套安装在弧板的内侧，轴套安装在弧板的外部，确保两者同轴。",
        "position_description": "7号旋转弧板的连接孔位。",
        "parts_used": [
          {
            "bom_seq": "8",
            "bom_name": "固定套",
            "quantity": 1,
            "drawing_number": "8",
            "node_name": [
              "NAUO12"
            ],
            "bom_code": "01.01.11590"
          },
          {
            "bom_seq": "9",
            "bom_name": "轴套",
            "quantity": 1,
            "drawing_number": "9",
            "node_name": [
              "NAUO15",
              "NAUO13"
            ],
            "bom_code": "01.01.11593"
          }
        ],
        "tools": [
          "点焊机",
          "游标卡尺"
        ],
        "warnings": [
          "固定套和轴套的焊接位置必须准确，确保后续配合精度。",
          "轴套焊接时注意保护内孔，防止焊渣飞溅。"
        ],
        "welding": {
          "required": true,
          "welding_type": "角焊（定位焊）",
          "welding_method": "CO2气保焊",
          "weld_size": "点焊，焊点长度10mm，环向均匀分布3点",
          "welding_position": "零件8（固定套）/零件9（轴套）与零件7（旋转弧板）的连接处，主要为平焊",
          "quality_requirements": "确保套筒与弧板垂直，同轴度要求高。定位焊后需用卡尺复核位置。",
          "safety_notes": "轴套内孔需用耐热塞堵住，防止焊接飞溅物进入。焊接电流不宜过大，避免烧穿薄壁套筒。"
        },
        "safety_warnings": [
          "焊接时必须佩戴焊接面罩和手套，防止弧光和高温飞溅物烫伤。",
          "轴套内孔使用耐热塞堵住时，确保塞子固定牢固，防止焊接时脱落。",
          "焊接完成后，不要立即触摸套筒，防止高温烫伤。"
        ]
      },
      {
        "step_number": 5,
        "action": "安装角钢和方形板",
        "description": "将图纸上标注为4号的角钢（01.02.04.0084）和6号的方形板（01.01.01.4776）安装到3号方管的指定位置。4号角钢共5件，用于加强筋；6号方形板共2件，安装在方管的侧面。",
        "position_description": "4号角钢安装在3号方管的顶部和侧面加强位置；6号方形板安装在3号方管的侧面。",
        "parts_used": [
          {
            "bom_seq": "4",
            "bom_name": "角钢",
            "quantity": 5,
            "drawing_number": "4",
            "node_name": [
              "NAUO9"
            ],
            "bom_code": "01.02.01.3876"
          },
          {
            "bom_seq": "6",
            "bom_name": "方形板",
            "quantity": 2,
            "drawing_number": "6",
            "node_name": [
              "NAUO10"
            ],
            "bom_code": "01.02.0446"
          }
        ],
        "tools": [
          "点焊机",
          "卷尺"
        ],
        "warnings": [
          "角钢和方形板的定位尺寸需严格按照图纸要求，使用卷尺进行测量。",
          "先点焊固定，确保所有加强件位置正确。"
        ],
        "welding": {
          "required": true,
          "welding_type": "角焊（定位焊）",
          "welding_method": "CO2气保焊",
          "weld_size": "点焊，焊点长度10-15mm",
          "welding_position": "零件4（角钢）/零件6（方形板）与零件3（方管）的连接处，主要为平焊和横焊",
          "quality_requirements": "定位焊位置准确，确保角钢和方形板与方管贴合紧密，无明显间隙。",
          "safety_notes": "角钢较小，定位时注意夹紧，防止焊接时移动。注意焊枪角度，保证焊点强度。"
        },
        "safety_warnings": [
          "定位焊时佩戴焊接面罩和手套，防止弧光和飞溅物烫伤。",
          "角钢和方形板边缘可能锋利，搬运时佩戴防割手套。",
          "使用夹具固定小零件时，确保夹紧力适中，防止零件弹出伤人。"
        ]
      },
      {
        "step_number": 6,
        "action": "安装方管-机加和中连接板",
        "description": "将图纸上标注为5号的方管-机加（01.02.03.0207）和10号的中连接板（01.02.01.3876）安装到主框架上。5号方管-机加共2件，安装在3号方管的侧面；10号中连接板共1件，安装在3号方管的底部。",
        "position_description": "5号方管-机加安装在3号方管侧面；10号中连接板安装在3号方管底部。",
        "parts_used": [
          {
            "bom_seq": "5",
            "bom_name": "方管-机加",
            "quantity": 2,
            "drawing_number": "5"
          },
          {
            "bom_seq": "10",
            "bom_name": "中连接板",
            "quantity": 1,
            "drawing_number": "10",
            "node_name": [
              "NAUO14"
            ],
            "bom_code": "01.01.11591"
          }
        ],
        "tools": [
          "点焊机",
          "卡尺"
        ],
        "warnings": [
          "5号方管-机加的安装方向需注意，确保机加工孔位朝向正确。",
          "10号中连接板需与3号方管底部贴合紧密。"
        ],
        "welding": {
          "required": true,
          "welding_type": "角焊（定位焊）",
          "welding_method": "CO2气保焊",
          "weld_size": "点焊，焊点长度15mm，每条边2点",
          "welding_position": "零件5（方管-机加）/零件10（中连接板）与零件3（方管）的连接处，主要为平焊和横焊",
          "quality_requirements": "定位焊后检查零件5的孔位间距和相对位置，确保符合图纸要求。",
          "safety_notes": "焊接时注意保护零件5上的机加工孔，避免飞溅物堵塞或损伤孔壁。"
        },
        "safety_warnings": [
          "焊接时必须佩戴焊接面罩和手套，防止弧光和飞溅物烫伤。",
          "保护好机加工孔位，防止焊渣飞溅进入，造成后续装配困难或损伤。",
          "确保焊机电缆远离热源和尖锐物体，防止绝缘层破损导致触电。"
        ]
      },
      {
        "step_number": 7,
        "action": "安装剩余加强板",
        "description": "安装剩余的加强板：11号三角板（01.01.11626）、12号方形板（01.01.3941）、13号防滑板（01.01.0517）和14号中侧板（01.01.4792）。这些零件主要用于局部加强和功能支撑。",
        "position_description": "根据图纸所示，安装在主框架的各个加强位置。",
        "parts_used": [
          {
            "bom_seq": "11",
            "bom_name": "三角板",
            "quantity": 1,
            "drawing_number": "11",
            "node_name": [
              "NAUO19",
              "NAUO18",
              "NAUO17",
              "NAUO16"
            ],
            "bom_code": "01.01.11626"
          },
          {
            "bom_seq": "12",
            "bom_name": "方形板",
            "quantity": 1,
            "drawing_number": "12",
            "node_name": [
              "NAUO23",
              "NAUO22",
              "NAUO21",
              "NAUO20"
            ],
            "bom_code": "01.01.3941"
          },
          {
            "bom_seq": "13",
            "bom_name": "防滑板",
            "quantity": 1,
            "drawing_number": "13",
            "node_name": [
              "NAUO25",
              "NAUO24"
            ],
            "bom_code": "01.01.0517"
          },
          {
            "bom_seq": "14",
            "bom_name": "中侧板",
            "quantity": 1,
            "drawing_number": "14"
          }
        ],
        "tools": [
          "点焊机"
        ],
        "warnings": [
          "确保所有加强板与主框架贴合紧密，无间隙。",
          "防滑板的安装位置需确保其防滑纹理朝外。"
        ],
        "welding": {
          "required": true,
          "welding_type": "角焊（定位焊）",
          "welding_method": "CO2气保焊",
          "weld_size": "点焊，焊点长度10mm",
          "welding_position": "零件11/12/13/14与主框架（零件3/5）的连接处，涉及平焊、横焊和立焊",
          "quality_requirements": "定位焊后检查所有加强板的平面度，防止因定位焊应力导致变形。",
          "safety_notes": "由于零件较多，定位焊时需注意焊接顺序，避免局部热量集中。确保工作区域通风良好。"
        },
        "safety_warnings": [
          "所有板材边缘可能锋利，搬运和定位时必须佩戴防割手套。",
          "进行定位焊时，必须佩戴焊接面罩和手套，防止弧光和飞溅物烫伤。",
          "确保工作区域通风良好，防止焊接烟尘浓度过高。"
        ]
      },
      {
        "step_number": 8,
        "action": "满焊所有零件",
        "description": "对所有已点焊固定的零件（1号、2号、4号、5号、6号、7号、8号、9号、10号、11号、12号、13号、14号）进行满焊。焊接时应遵循对称、分段、跳焊的原则，以减少焊接应力，防止结构变形。",
        "position_description": "所有零件的连接处。",
        "parts_used": [],
        "tools": [
          "焊机",
          "焊条/焊丝"
        ],
        "warnings": [
          "严格按照技术要求进行焊接，确保焊缝饱满、无气孔、无夹渣。",
          "焊接过程中需随时检查零件的形变情况，必要时进行反变形处理。"
        ],
        "welding": {
          "required": true,
          "welding_type": "角焊/环缝焊（满焊）",
          "welding_method": "CO2气保焊（主要）/手工电弧焊（局部难达区域）",
          "weld_size": "焊缝高度4mm-6mm（根据板厚确定，以图纸标注为准）",
          "welding_position": "所有连接缝，涉及平焊、横焊、立焊、仰焊",
          "quality_requirements": "焊缝必须连续、饱满，外观平整，无咬边、气孔、裂纹、夹渣等缺陷。关键受力焊缝（如悬挂臂板连接处）需进行外观和无损检测（如磁粉或超声波）。",
          "safety_notes": "进行大面积满焊时，必须穿戴全套防护服、焊接面罩和手套。确保焊机电缆绝缘良好，防止烫伤和火灾。注意控制焊接变形，采用分段、跳焊工艺，避免应力集中。"
        },
        "safety_warnings": [
          "满焊作业必须穿戴全套阻燃防护服、焊接面罩和手套，防止大面积弧光灼伤和高温烫伤。",
          "确保焊接区域配备灭火器材，并清理周围易燃物，防止火灾。",
          "焊接过程中产生的烟尘和有毒气体较多，必须开启局部排风或佩戴呼吸防护用品。",
          "检查焊机电缆和气瓶管路，确保无破损、无泄漏，防止触电或爆炸。"
        ]
      },
      {
        "step_number": 9,
        "action": "清理和打磨",
        "description": "焊接完成后，清除所有焊渣、飞溅物。对所有焊缝进行打磨处理，特别是外观面和配合面，确保锐边、尖角倒钝，符合图纸技术要求。",
        "position_description": "所有焊缝区域。",
        "parts_used": [],
        "tools": [
          "角磨机",
          "钢丝刷",
          "除渣锤"
        ],
        "warnings": [
          "打磨时注意佩戴防护眼镜和手套。",
          "配合面打磨需平整，不得影响后续装配。"
        ],
        "safety_warnings": [
          "使用角磨机时，必须佩戴防护眼镜或面罩，防止高速飞溅的火花和金属碎屑伤眼。",
          "打磨作业时佩戴防尘口罩，防止吸入金属粉尘。",
          "检查角磨机防护罩是否安装到位，防止砂轮片破裂伤人。",
          "打磨后的工件表面温度高，清理时注意佩戴耐热手套，防止烫伤。"
        ]
      }
    ]
  }
}