{
  "agent_name": "Agent6_FAQ",
  "model": "google/gemini-2.5-flash-preview-09-2025",
  "timestamp": "20251104_142122",
  "image_count": 0,
  "temperature": 0.2,
  "system_prompt": "# 角色定位\n\n你是**李师傅**，一位拥有20年安全管理经验的高级安全工程师。\n\n## 教育背景\n\n- **学历**：安全工程专业本科\n- **职业资格**：注册安全工程师、高级安全评价师\n- **专业培训**：\n  - 机械制造安全管理\n  - 职业健康与安全管理体系（ISO 45001）\n  - 事故调查与分析\n  - 应急预案编制与演练\n\n## 职业背景\n\n- **工作经历**：20年机械制造企业安全管理经验，参与过大型装备制造、钢结构加工等项目\n- **专业领域**：\n  - 机械加工安全（车、铣、刨、磨、钻等）\n  - 焊接作业安全（电焊、气焊、氩弧焊等）\n  - 起重吊装安全（行车、叉车、吊索具等）\n  - 高空作业安全（脚手架、安全带、防坠落等）\n  - 个人防护用品管理（安全帽、防护眼镜、手套、安全鞋等）\n\n## 知识结构（详细）\n\n### 1. 机械伤害风险\n- **夹伤/挤伤**：手指、手臂被运动部件夹住\n- **切割伤**：锋利边缘、毛刺、切削工具\n- **碰撞伤**：头部碰撞、身体碰撞\n- **坠落伤**：零件坠落、工具坠落、人员坠落\n\n### 2. 焊接作业风险\n- **电击伤**：焊机漏电、接地不良\n- **弧光伤**：电弧紫外线灼伤眼睛和皮肤\n- **烫伤**：高温熔池、焊渣飞溅\n- **火灾爆炸**：易燃物引燃、气瓶泄漏\n- **有毒气体**：焊接烟尘、一氧化碳中毒\n\n### 3. 起重吊装风险\n- **吊物坠落**：吊索具断裂、捆绑不牢\n- **吊物摆动**：碰撞人员、设备\n- **超载**：超过起重机额定载荷\n- **指挥失误**：信号不清、违章指挥\n\n### 4. 高空作业风险\n- **人员坠落**：未系安全带、脚手架不牢\n- **物体打击**：工具、零件从高处坠落\n- **脚手架坍塌**：搭设不规范、超载\n\n### 5. 个人防护用品\n- **头部防护**：安全帽（防止碰撞、坠物打击）\n- **眼部防护**：防护眼镜、焊接面罩（防止飞溅、弧光）\n- **手部防护**：防护手套（防止切割、烫伤、化学品）\n- **足部防护**：安全鞋（防砸、防刺穿、防滑）\n- **呼吸防护**：防尘口罩、防毒面具（防止粉尘、有毒气体）\n\n### 6. 应急处理\n- **机械伤害**：立即停机、呼救、止血、固定、送医\n- **电击伤**：切断电源、心肺复苏、送医\n- **烫伤**：冷水冲洗、覆盖无菌纱布、送医\n- **火灾**：使用灭火器、疏散人员、报警\n\n## 任务步骤（Chain of Thought）\n\n你的任务是**为每个装配步骤添加安全警告**（如果该步骤有安全风险）。请按照以下5个步骤思考：\n\n### 步骤1：识别风险步骤\n- 分析每个装配步骤的操作内容\n- 判断是否涉及高风险作业（焊接、吊装、高空、重物搬运等）\n- 识别潜在的伤害类型（机械伤害、电击、烫伤、坠落等）\n\n### 步骤2：分析风险源\n- 确定风险的来源（设备、工具、材料、环境、人员操作等）\n- 评估风险的严重程度（轻微、中等、严重、致命）\n- 考虑风险的发生概率\n\n### 步骤3：制定预防措施\n- 针对每个风险源，制定具体的预防措施\n- 强调个人防护用品的使用\n- 强调安全操作规程的遵守\n\n### 步骤4：添加安全警告\n- 为每个有风险的步骤添加safety_warnings字段\n- 每条警告要简洁明了，说明具体的风险和预防措施\n- 使用工人能看懂的语言\n\n### 步骤5：验证完整性\n- 检查所有高风险步骤是否都添加了安全警告\n- 检查安全警告是否具体、可操作\n- 检查是否遗漏了任何潜在风险\n\n## 核心原则\n\n1. **步骤级嵌入**：为每个有风险的步骤添加safety_warnings字段，而不是单独列出安全警告\n2. **工人友好**：使用通俗语言，避免专业术语\n3. **具体可操作**：说明具体的风险和预防措施，而不是泛泛而谈\n4. **不重复显示**：安全警告只在下方\"安全\"标签页中统一显示，不在当前步骤详情中重复显示\n\n## 输出格式\n\n严格按照以下JSON格式输出（返回增强后的装配步骤）：\n\n```json\n{\n  \"enhanced_steps\": [\n    {\n      \"step_number\": 1,\n      \"title\": \"点焊定位\",\n      \"parts_used\": [...],\n      \"tools_required\": [...],\n      \"operation\": \"操作说明\",\n      \"quality_check\": \"质量检查\",\n      \"estimated_time_minutes\": 10,\n      \"welding\": {\n        \"required\": true,\n        \"welding_type\": \"点焊\",\n        \"welding_method\": \"CO2气保焊\",\n        ...\n      },\n      \"safety_warnings\": [\n        \"佩戴焊接面罩和防护手套，防止弧光灼伤眼睛和皮肤\",\n        \"确保工件夹紧牢固，防止点焊时位移造成伤害\",\n        \"焊接区域周围3米内不得有易燃物，配备灭火器\",\n        \"焊机必须接地良好，防止漏电触电\"\n      ]\n    },\n    {\n      \"step_number\": 2,\n      \"title\": \"螺栓连接\",\n      \"parts_used\": [...],\n      \"operation\": \"操作说明\",\n      \"quality_check\": \"质量检查\",\n      \"estimated_time_minutes\": 15,\n      \"safety_warnings\": [\n        \"佩戴安全帽和防护眼镜，防止零件坠落和飞溅\",\n        \"使用扭力扳手时注意力度，防止扳手滑脱伤人\"\n      ]\n    },\n    {\n      \"step_number\": 3,\n      \"title\": \"简单装配\",\n      \"parts_used\": [...],\n      \"operation\": \"操作说明\",\n      \"quality_check\": \"质量检查\",\n      \"estimated_time_minutes\": 5\n      // ⚠️ 如果没有明显安全风险，不添加safety_warnings字段\n    }\n  ]\n}\n```\n\n**⚠️ 关键要求**：\n\n1. **步骤级嵌入**：\n   - 为每个有风险的步骤添加`safety_warnings`字段\n   - 没有明显风险的步骤不添加`safety_warnings`字段\n   - 保持原有步骤的所有字段不变\n\n2. **安全警告要具体**：\n   - ✅ 说\"佩戴焊接面罩和防护手套，防止弧光灼伤眼睛和皮肤\"\n   - ❌ 不说\"注意安全\"\n   - ✅ 说\"焊接区域周围3米内不得有易燃物，配备灭火器\"\n   - ❌ 不说\"注意防火\"\n\n3. **使用通俗语言**：\n   - 工人能看懂的语言\n   - 避免专业术语和英文缩写\n\n4. **警告要全面**：\n   - 涵盖个人防护、设备安全、环境安全、操作安全\n   - 每条警告说明具体的风险和预防措施\n\n## 重要提醒\n\n- **只输出JSON，不要输出其他内容**\n- **保持原有字段不变**：不要修改或删除原有的字段（包括welding字段）\n- **警告要简洁明了**：每条警告一句话，说明风险和预防措施\n- **不要过度警告**：只针对有明显风险的步骤添加警告\n",
  "user_query": "请为以下装配步骤添加安全警告（如果有安全风险）。\n\n## 📸 视觉分析任务\n\n**你会看到工程图纸图片，请仔细观察：**\n\n1. **危险作业标识**：\n   - 图纸上的安全警告标识\n   - 特殊作业要求（如高空作业、吊装作业等）\n   - 危险区域标注\n\n2. **零件特征**：\n   - 重型零件（需要吊装）\n   - 锋利边缘（容易割伤）\n   - 高温部件（容易烫伤）\n\n3. **作业环境**：\n   - 狭窄空间（容易碰撞）\n   - 高空位置（容易坠落）\n   - 密闭空间（通风不良）\n\n## 装配步骤\n\n[\n  {\n    \"step_number\": 1,\n    \"action\": \"放置基准件\",\n    \"description\": \"将图纸序号1的方管（FG-T5*80*80-1134-Q345）平稳放置在装配胎具上，作为整个组件的装配基准。确保方管水平且位置准确。\",\n    \"position_description\": \"平放于装配胎具上\",\n    \"parts_used\": [\n      {\n        \"bom_seq\": \"1\",\n        \"bom_name\": \"方管\",\n        \"quantity\": 2,\n        \"drawing_number\": \"1\",\n        \"node_name\": [\n          \"NAUO1\"\n        ],\n        \"bom_code\": \"01.02.01.3870\"\n      }\n    ],\n    \"tools\": [\n      \"行车/吊具\",\n      \"装配胎具\",\n      \"水平仪\"\n    ],\n    \"warnings\": [\n      \"方管较重（26.16kg），吊装时注意安全，确保吊具捆绑牢固。\",\n      \"检查方管表面无明显划痕或变形。\"\n    ],\n    \"estimated_time_minutes\": 10\n  },\n  {\n    \"step_number\": 2,\n    \"action\": \"安装内部支撑方管\",\n    \"description\": \"将图纸序号2的方管（FG-T5*80*80-318-Q345）放置在两个基准方管（序号1）之间，按照图纸尺寸（1140mm总长，内部318mm）进行定位。使用点焊固定，确保位置准确。\",\n    \"position_description\": \"位于两个序号1方管的内部，两端对齐\",\n    \"parts_used\": [\n      {\n        \"bom_seq\": \"2\",\n        \"bom_name\": \"方管\",\n        \"quantity\": 2,\n        \"drawing_number\": \"2\",\n        \"node_name\": [\n          \"NAUO2\"\n        ],\n        \"bom_code\": \"01.02.01.3871\"\n      }\n    ],\n    \"tools\": [\n      \"卷尺\",\n      \"角尺\",\n      \"点焊机\"\n    ],\n    \"warnings\": [\n      \"点焊前必须精确测量定位尺寸，特别是两端距离。\",\n      \"点焊强度要足够支撑后续装配重量。\"\n    ],\n    \"estimated_time_minutes\": 15,\n    \"welding\": {\n      \"required\": true,\n      \"welding_type\": \"角焊（定位焊）\",\n      \"welding_method\": \"CO2气保焊\",\n      \"weld_size\": \"点焊，焊点长度10-15mm，焊脚高度3mm\",\n      \"welding_position\": \"零件①方管与零件②方管的连接处，平焊\",\n      \"quality_requirements\": \"焊点位置准确，熔深足够，无明显气孔或裂纹，确保结构定位牢固。\",\n      \"safety_notes\": \"佩戴焊接面罩和防护手套，确保工作区域通风良好，防止火花飞溅。\"\n    }\n  },\n  {\n    \"step_number\": 3,\n    \"action\": \"安装中侧板\",\n    \"description\": \"将图纸序号3的中侧板（S-RB1830-03-02-Q345）安装在内部方管（序号2）的两侧，确保中侧板的定位孔与方管上的预留孔位对齐。使用点焊固定。\",\n    \"position_description\": \"位于序号2方管的两侧，垂直安装\",\n    \"parts_used\": [\n      {\n        \"bom_seq\": \"3\",\n        \"bom_name\": \"中侧板\",\n        \"quantity\": 2,\n        \"drawing_number\": \"3\",\n        \"node_name\": [\n          \"NAUO3\"\n        ],\n        \"bom_code\": \"01.02.03.0206\"\n      }\n    ],\n    \"tools\": [\n      \"点焊机\",\n      \"定位销\"\n    ],\n    \"warnings\": [\n      \"中侧板的垂直度对后续装配至关重要，点焊后需检查垂直度。\"\n    ],\n    \"estimated_time_minutes\": 10,\n    \"welding\": {\n      \"required\": true,\n      \"welding_type\": \"角焊（定位焊）\",\n      \"welding_method\": \"CO2气保焊\",\n      \"weld_size\": \"点焊，焊点长度10-15mm，焊脚高度3mm\",\n      \"welding_position\": \"零件②方管与零件③中侧板的连接处，主要为平焊和横焊\",\n      \"quality_requirements\": \"定位准确，垂直度偏差小于1mm，焊点牢固。\",\n      \"safety_notes\": \"检查焊机接地线连接可靠，避免触电风险。点焊时注意板材边缘，防止烧穿。\"\n    }\n  },\n  {\n    \"step_number\": 4,\n    \"action\": \"安装中连接板\",\n    \"description\": \"将图纸序号4的中连接板（S-RB1830-03-03-Q345）安装在中侧板（序号3）的中间位置，确保其与中侧板和内部方管（序号2）的接触面紧密贴合。使用点焊固定。\",\n    \"position_description\": \"位于两个序号3中侧板之间，底部与序号2方管连接\",\n    \"parts_used\": [\n      {\n        \"bom_seq\": \"4\",\n        \"bom_name\": \"中连接板\",\n        \"quantity\": 2,\n        \"drawing_number\": \"4\",\n        \"node_name\": [\n          \"NAUO16\",\n          \"NAUO15\",\n          \"NAUO13\",\n          \"NAUO12\",\n          \"NAUO4\"\n        ],\n        \"bom_code\": \"01.02.04.0084\"\n      }\n    ],\n    \"tools\": [\n      \"点焊机\",\n      \"卡尺\"\n    ],\n    \"warnings\": [\n      \"中连接板的安装位置必须居中，确保两侧对称。\"\n    ],\n    \"estimated_time_minutes\": 10,\n    \"welding\": {\n      \"required\": true,\n      \"welding_type\": \"角焊（定位焊）\",\n      \"welding_method\": \"CO2气保焊\",\n      \"weld_size\": \"点焊，焊点长度10-15mm，焊脚高度3mm\",\n      \"welding_position\": \"零件③中侧板与零件④中连接板的连接处，主要为立焊和横焊\",\n      \"quality_requirements\": \"定位尺寸准确，焊点分布均匀，防止应力集中。\",\n      \"safety_notes\": \"清理焊接区域的油污和锈蚀，确保焊缝质量。注意焊枪角度，避免飞溅物过多。\"\n    }\n  },\n  {\n    \"step_number\": 5,\n    \"action\": \"安装方形板-机加\",\n    \"description\": \"将图纸序号5的方形板-机加（S-RB1830-03-04-Q345）安装在中连接板（序号4）的上方，作为上挂板的支撑。确保方形板的机加面朝向正确，并与中连接板对齐。使用点焊固定。\",\n    \"position_description\": \"位于序号4中连接板的上方\",\n    \"parts_used\": [\n      {\n        \"bom_seq\": \"5\",\n        \"bom_name\": \"方形板-机加\",\n        \"quantity\": 1,\n        \"drawing_number\": \"5\",\n        \"node_name\": [\n          \"NAUO8\",\n          \"NAUO5\"\n        ],\n        \"bom_code\": \"01.02.03.0207\"\n      }\n    ],\n    \"tools\": [\n      \"点焊机\"\n    ],\n    \"warnings\": [\n      \"方形板的机加面是后续装配的基准面，必须保证平整度。\"\n    ],\n    \"estimated_time_minutes\": 8,\n    \"welding\": {\n      \"required\": true,\n      \"welding_type\": \"角焊（定位焊）\",\n      \"welding_method\": \"CO2气保焊\",\n      \"weld_size\": \"点焊，焊点长度10-15mm，焊脚高度3mm\",\n      \"welding_position\": \"零件④中连接板与零件⑤方形板的连接处，平焊\",\n      \"quality_requirements\": \"确保方形板与中连接板贴合紧密，焊点不影响机加面平整度。\",\n      \"safety_notes\": \"注意控制焊接电流，防止热变形影响机加面的精度。\"\n    }\n  },\n  {\n    \"step_number\": 6,\n    \"action\": \"安装轴套\",\n    \"description\": \"将图纸序号6的轴套（S-RB1830-03-07-Q235）安装在方形板-机加（序号5）的下方中心位置。轴套应垂直于方形板，并与预留孔位对齐。使用点焊固定。\",\n    \"position_description\": \"位于序号5方形板的下方中心\",\n    \"parts_used\": [\n      {\n        \"bom_seq\": \"6\",\n        \"bom_name\": \"轴套\",\n        \"quantity\": 1,\n        \"drawing_number\": \"6\",\n        \"node_name\": [\n          \"NAUO7\",\n          \"NAUO6\"\n        ],\n        \"bom_code\": \"01.01.01.4776\"\n      }\n    ],\n    \"tools\": [\n      \"点焊机\",\n      \"垂直度检查工具\"\n    ],\n    \"warnings\": [\n      \"轴套的垂直度要求高，点焊后必须立即检查，防止后续旋转机构卡滞。\"\n    ],\n    \"estimated_time_minutes\": 12,\n    \"welding\": {\n      \"required\": true,\n      \"welding_type\": \"角焊（定位焊）\",\n      \"welding_method\": \"CO2气保焊\",\n      \"weld_size\": \"点焊，焊点长度10-15mm，焊脚高度3mm\",\n      \"welding_position\": \"零件⑤方形板与零件⑥轴套的连接处，仰焊\",\n      \"quality_requirements\": \"轴套垂直度偏差小于0.5mm，焊点均匀分布，确保轴套定位准确。\",\n      \"safety_notes\": \"仰焊操作难度大，注意防止熔渣和飞溅物烫伤。必须使用合适的焊接参数，避免烧穿薄壁轴套。\"\n    }\n  },\n  {\n    \"step_number\": 7,\n    \"action\": \"安装左右连接器板\",\n    \"description\": \"将图纸序号7的左连接器板（S-LP1730(68IN)-MP1140-LT-01-06-Q460）和图纸序号8的右连接器板（S-LP1730(68IN)-MP1140-LT-01-07-Q460）分别安装在组件主体结构的两侧，与基准方管（序号1）和内部结构对齐。使用点焊固定。\",\n    \"position_description\": \"分别位于组件的左侧和右侧，与序号1方管外侧对齐\",\n    \"parts_used\": [\n      {\n        \"bom_seq\": \"7\",\n        \"bom_name\": \"左连接器板\",\n        \"quantity\": 1,\n        \"drawing_number\": \"7\",\n        \"node_name\": [\n          \"NAUO10\",\n          \"NAUO9\"\n        ],\n        \"bom_code\": \"01.02.01.3872\"\n      },\n      {\n        \"bom_seq\": \"8\",\n        \"bom_name\": \"右连接器板\",\n        \"quantity\": 1,\n        \"drawing_number\": \"8\",\n        \"node_name\": [\n          \"NAUO11\"\n        ],\n        \"bom_code\": \"01.02.05.0334\"\n      }\n    ],\n    \"tools\": [\n      \"点焊机\",\n      \"卷尺\"\n    ],\n    \"warnings\": [\n      \"左右连接器板的安装位置必须对称，确保组件整体宽度符合图纸要求。\"\n    ],\n    \"estimated_time_minutes\": 15,\n    \"welding\": {\n      \"required\": true,\n      \"welding_type\": \"角焊（定位焊）\",\n      \"welding_method\": \"CO2气保焊\",\n      \"weld_size\": \"点焊，焊点长度10-15mm，焊脚高度3mm\",\n      \"welding_position\": \"零件①方管与零件⑦/⑧连接器板的连接处，主要为横焊和立焊\",\n      \"quality_requirements\": \"定位尺寸和对称度符合要求，焊点牢固，为后续满焊做准备。\",\n      \"safety_notes\": \"Q460材料强度较高，点焊时注意预热，防止低温裂纹。确保焊丝和保护气体符合材料要求。\"\n    }\n  },\n  {\n    \"step_number\": 8,\n    \"action\": \"安装上挂板和方形板-机加\",\n    \"description\": \"将图纸序号9的上挂板（S-LP1730(68IN)-MP1140-LT-01-07-Q460）安装在组件上方的中心位置，与方形板-机加（序号5）连接。同时，将图纸序号10的方形板-机加（S-LP1730(68IN)-MP1140-LT-01-08-Q460）安装在组件两侧的上方。全部使用点焊固定。\",\n    \"position_description\": \"序号9位于上方中心，序号10位于两侧上方\",\n    \"parts_used\": [\n      {\n        \"bom_seq\": \"9\",\n        \"bom_name\": \"上挂板\",\n        \"quantity\": 1,\n        \"drawing_number\": \"9\",\n        \"node_name\": [\n          \"NAUO14\"\n        ],\n        \"bom_code\": \"01.02.04.0447\"\n      },\n      {\n        \"bom_seq\": \"10\",\n        \"bom_name\": \"方形板-机加\",\n        \"quantity\": 2,\n        \"drawing_number\": \"10\"\n      }\n    ],\n    \"tools\": [\n      \"点焊机\"\n    ],\n    \"warnings\": [\n      \"上挂板（序号9）的安装孔位必须与图纸尺寸严格一致，这是后续连接的关键部位。\"\n    ],\n    \"estimated_time_minutes\": 10,\n    \"welding\": {\n      \"required\": true,\n      \"welding_type\": \"角焊（定位焊）\",\n      \"welding_method\": \"CO2气保焊\",\n      \"weld_size\": \"点焊，焊点长度10-15mm，焊脚高度3mm\",\n      \"welding_position\": \"零件⑤方形板与零件⑨上挂板的连接处，以及零件①方管与零件⑩方形板的连接处，平焊为主\",\n      \"quality_requirements\": \"确保上挂板和方形板的平面度，焊点不影响后续满焊。\",\n      \"safety_notes\": \"注意高空作业安全（如果组件已吊起），确保焊机电缆不缠绕，避免绊倒。\"\n    }\n  },\n  {\n    \"step_number\": 9,\n    \"action\": \"安装三角板和方形板\",\n    \"description\": \"将图纸序号11的三角板（SJB-T8*64*37-Q355B）安装在组件两侧的加强位置，提供斜向支撑。将图纸序号12的方形板（FXB-T6*75*75-Q235）安装在组件底部的加强位置。全部使用点焊固定。\",\n    \"position_description\": \"序号11位于两侧斜角，序号12位于底部加强筋位置\",\n    \"parts_used\": [\n      {\n        \"bom_seq\": \"11\",\n        \"bom_name\": \"三角板\",\n        \"quantity\": 4,\n        \"drawing_number\": \"11\"\n      },\n      {\n        \"bom_seq\": \"12\",\n        \"bom_name\": \"方形板\",\n        \"quantity\": 4,\n        \"drawing_number\": \"12\"\n      }\n    ],\n    \"tools\": [\n      \"点焊机\"\n    ],\n    \"warnings\": [\n      \"三角板和方形板的安装应确保不干涉其他零件，且焊缝位置符合图纸要求。\"\n    ],\n    \"estimated_time_minutes\": 15,\n    \"welding\": {\n      \"required\": true,\n      \"welding_type\": \"角焊（定位焊）\",\n      \"welding_method\": \"CO2气保焊\",\n      \"weld_size\": \"点焊，焊点长度10-15mm，焊脚高度3mm\",\n      \"welding_position\": \"零件①方管与零件⑪三角板、零件⑫方形板的连接处，涉及平焊、横焊、立焊\",\n      \"quality_requirements\": \"加强筋定位准确，角度符合图纸要求，焊点牢固。\",\n      \"safety_notes\": \"三角板和方形板的板厚不同，点焊时注意调整电流，防止薄板烧穿。\"\n    }\n  },\n  {\n    \"step_number\": 10,\n    \"action\": \"安装防滑板并满焊\",\n    \"description\": \"将图纸序号13的防滑板（S-EDGP1630-DR-01-10-Q235）安装在组件的底部，作为防滑支撑。确认所有零件点焊位置无误后，按照技术要求进行满焊（CO2保护焊）。焊接顺序应遵循对称、分段、跳焊原则，以减少焊接变形。\",\n    \"position_description\": \"位于组件底部外侧\",\n    \"parts_used\": [\n      {\n        \"bom_seq\": \"13\",\n        \"bom_name\": \"防滑板\",\n        \"quantity\": 2,\n        \"drawing_number\": \"13\"\n      }\n    ],\n    \"tools\": [\n      \"CO2焊机\",\n      \"焊钳\",\n      \"焊渣锤\"\n    ],\n    \"warnings\": [\n      \"焊接过程中注意控制热输入，防止方管结构产生严重扭曲变形。\",\n      \"所有焊缝必须饱满、连续，无虚焊、漏焊等缺陷。\"\n    ],\n    \"estimated_time_minutes\": 60,\n    \"welding\": {\n      \"required\": true,\n      \"welding_type\": \"角焊（满焊）\",\n      \"welding_method\": \"CO2气保焊\",\n      \"weld_size\": \"焊脚高度6mm（根据图纸未标注焊缝，按板厚T5取0.7倍，约4-6mm）\",\n      \"welding_position\": \"所有定位焊点处进行满焊，以及零件①方管与零件⑬防滑板的连接处，主要为平焊和横焊\",\n      \"quality_requirements\": \"焊缝外观成型良好，焊波均匀，焊缝高度和宽度符合要求。焊后进行外观检查，确保无裂纹、未熔合、夹渣等缺陷。\",\n      \"safety_notes\": \"进行长时间焊接时，必须佩戴全套防护用品（面罩、手套、防护服）。确保工作区域有强制通风设备，防止烟尘中毒。焊接完成后，检查焊机和电缆是否过热。\"\n    }\n  },\n  {\n    \"step_number\": 11,\n    \"action\": \"焊后清理与打磨\",\n    \"description\": \"焊接完成后，使用焊渣锤和钢丝刷清除所有焊渣和飞溅物。对所有焊缝进行打磨处理，特别是外观面和配合面，确保表面平整度符合技术要求。\",\n    \"position_description\": \"所有焊缝区域\",\n    \"parts_used\": [],\n    \"tools\": [\n      \"角磨机\",\n      \"钢丝刷\",\n      \"焊渣锤\"\n    ],\n    \"warnings\": [\n      \"打磨时注意保护非焊接区域，避免损伤基材。\",\n      \"打磨后的表面粗糙度应符合图纸要求。\"\n    ],\n    \"estimated_time_minutes\": 30\n  }\n]\n\n## 要求\n\n请按照以下5个步骤思考，为装配步骤添加安全警告：\n\n### 步骤1：识别风险步骤\n- 分析每个装配步骤的操作内容\n- 判断是否涉及高风险作业：\n  * **焊接作业**：电击、弧光、烫伤、火灾\n  * **吊装作业**：吊物坠落、碰撞、超载\n  * **高空作业**：人员坠落、物体打击\n  * **重物搬运**：砸伤、扭伤、夹伤\n  * **机械加工**：切割伤、夹伤、碰撞\n\n### 步骤2：分析风险源\n- 确定风险的来源（设备、工具、材料、环境、人员操作等）\n- 评估风险的严重程度（轻微、中等、严重、致命）\n- 考虑风险的发生概率\n\n### 步骤3：制定预防措施\n- 针对每个风险源，制定具体的预防措施\n- 强调个人防护用品的使用：\n  * **焊接**：焊接面罩、防护手套、防护服\n  * **吊装**：安全帽、安全鞋、手套\n  * **高空**：安全带、安全帽、防滑鞋\n  * **机械**：防护眼镜、手套、安全鞋\n\n### 步骤4：添加安全警告\n- 为每个有风险的步骤添加safety_warnings字段\n- 每条警告要简洁明了，说明具体的风险和预防措施\n- 使用工人能看懂的语言\n\n### 步骤5：验证完整性\n- 检查所有高风险步骤是否都添加了安全警告\n- 检查安全警告是否具体、可操作\n- 检查是否遗漏了任何潜在风险\n\n## ⚠️ 强制自检清单（生成后必须逐项检查）\n\n**在输出JSON之前，你必须完成以下验证：**\n\n1. **风险步骤识别验证**：\n   - [ ] 所有涉及焊接、吊装、高空、重物搬运的步骤都添加了safety_warnings字段\n   - [ ] 没有明显风险的步骤没有添加safety_warnings字段\n\n2. **安全警告完整性验证**：\n   - [ ] 每个safety_warnings字段都是字符串数组\n   - [ ] 每条警告都说明了具体的风险和预防措施\n   - [ ] 涵盖了个人防护、设备安全、环境安全、操作安全\n\n3. **语言通俗性验证**：\n   - [ ] 使用工人能看懂的语言\n   - [ ] 避免专业术语和英文缩写\n   - [ ] 每条警告简洁明了（一句话）\n\n4. **原有字段保持验证**：\n   - [ ] 原有步骤的所有字段都保持不变（包括welding字段）\n   - [ ] 没有修改或删除任何原有字段\n\n**如果自检发现任何问题，必须重新生成！**\n\n现在开始为装配步骤添加安全警告！\n",
  "raw_response": "```json\n{\n  \"enhanced_steps\": [\n    {\n      \"step_number\": 1,\n      \"action\": \"放置基准件\",\n      \"description\": \"将图纸序号1的方管（FG-T5*80*80-1134-Q345）平稳放置在装配胎具上，作为整个组件的装配基准。确保方管水平且位置准确。\",\n      \"position_description\": \"平放于装配胎具上\",\n      \"parts_used\": [\n        {\n          \"bom_seq\": \"1\",\n          \"bom_name\": \"方管\",\n          \"quantity\": 2,\n          \"drawing_number\": \"1\",\n          \"node_name\": [\n            \"NAUO1\"\n          ],\n          \"bom_code\": \"01.02.01.3870\"\n        }\n      ],\n      \"tools\": [\n        \"行车/吊具\",\n        \"装配胎具\",\n        \"水平仪\"\n      ],\n      \"warnings\": [\n        \"方管较重（26.16kg），吊装时注意安全，确保吊具捆绑牢固。\",\n        \"检查方管表面无明显划痕或变形。\"\n      ],\n      \"estimated_time_minutes\": 10,\n      \"safety_warnings\": [\n        \"佩戴安全帽和安全鞋，防止重物坠落砸伤脚部和头部\",\n        \"使用行车吊装时，必须由专业司索工指挥，确保吊物平稳，防止摆动碰撞\",\n        \"检查吊索具是否完好，不得超载起吊\"\n      ]\n    },\n    {\n      \"step_number\": 2,\n      \"action\": \"安装内部支撑方管\",\n      \"description\": \"将图纸序号2的方管（FG-T5*80*80-318-Q345）放置在两个基准方管（序号1）之间，按照图纸尺寸（1140mm总长，内部318mm）进行定位。使用点焊固定，确保位置准确。\",\n      \"position_description\": \"位于两个序号1方管的内部，两端对齐\",\n      \"parts_used\": [\n        {\n          \"bom_seq\": \"2\",\n          \"bom_name\": \"方管\",\n          \"quantity\": 2,\n          \"drawing_number\": \"2\",\n          \"node_name\": [\n            \"NAUO2\"\n          ],\n          \"bom_code\": \"01.02.01.3871\"\n        }\n      ],\n      \"tools\": [\n        \"卷尺\",\n        \"角尺\",\n        \"点焊机\"\n      ],\n      \"warnings\": [\n        \"点焊前必须精确测量定位尺寸，特别是两端距离。\",\n        \"点焊强度要足够支撑后续装配重量。\"\n      ],\n      \"estimated_time_minutes\": 15,\n      \"welding\": {\n        \"required\": true,\n        \"welding_type\": \"角焊（定位焊）\",\n        \"welding_method\": \"CO2气保焊\",\n        \"weld_size\": \"点焊，焊点长度10-15mm，焊脚高度3mm\",\n        \"welding_position\": \"零件①方管与零件②方管的连接处，平焊\",\n        \"quality_requirements\": \"焊点位置准确，熔深足够，无明显气孔或裂纹，确保结构定位牢固。\",\n        \"safety_notes\": \"佩戴焊接面罩和防护手套，确保工作区域通风良好，防止火花飞溅。\"\n      },\n      \"safety_warnings\": [\n        \"佩戴焊接面罩和防护手套，防止弧光灼伤眼睛和皮肤\",\n        \"确保焊机接地良好，防止漏电触电\",\n        \"清理焊接区域周围的易燃物，防止火灾发生\"\n      ]\n    },\n    {\n      \"step_number\": 3,\n      \"action\": \"安装中侧板\",\n      \"description\": \"将图纸序号3的中侧板（S-RB1830-03-02-Q345）安装在内部方管（序号2）的两侧，确保中侧板的定位孔与方管上的预留孔位对齐。使用点焊固定。\",\n      \"position_description\": \"位于序号2方管的两侧，垂直安装\",\n      \"parts_used\": [\n        {\n          \"bom_seq\": \"3\",\n          \"bom_name\": \"中侧板\",\n          \"quantity\": 2,\n          \"drawing_number\": \"3\",\n          \"node_name\": [\n            \"NAUO3\"\n          ],\n          \"bom_code\": \"01.02.03.0206\"\n        }\n      ],\n      \"tools\": [\n        \"点焊机\",\n        \"定位销\"\n      ],\n      \"warnings\": [\n        \"中侧板的垂直度对后续装配至关重要，点焊后需检查垂直度。\"\n      ],\n      \"estimated_time_minutes\": 10,\n      \"welding\": {\n        \"required\": true,\n        \"welding_type\": \"角焊（定位焊）\",\n        \"welding_method\": \"CO2气保焊\",\n        \"weld_size\": \"点焊，焊点长度10-15mm，焊脚高度3mm\",\n        \"welding_position\": \"零件②方管与零件③中侧板的连接处，主要为平焊和横焊\",\n        \"quality_requirements\": \"定位准确，垂直度偏差小于1mm，焊点牢固。\",\n        \"safety_notes\": \"检查焊机接地线连接可靠，避免触电风险。点焊时注意板材边缘，防止烧穿。\"\n      },\n      \"safety_warnings\": [\n        \"佩戴防护手套，防止板材边缘割伤手指\",\n        \"点焊时使用焊接面罩，防止电弧光灼伤眼睛\",\n        \"确保焊机电缆绝缘良好，避免拖拽造成破损漏电\"\n      ]\n    },\n    {\n      \"step_number\": 4,\n      \"action\": \"安装中连接板\",\n      \"description\": \"将图纸序号4的中连接板（S-RB1830-03-03-Q345）安装在中侧板（序号3）的中间位置，确保其与中侧板和内部方管（序号2）的接触面紧密贴合。使用点焊固定。\",\n      \"position_description\": \"位于两个序号3中侧板之间，底部与序号2方管连接\",\n      \"parts_used\": [\n        {\n          \"bom_seq\": \"4\",\n          \"bom_name\": \"中连接板\",\n          \"quantity\": 2,\n          \"drawing_number\": \"4\",\n          \"node_name\": [\n            \"NAUO16\",\n            \"NAUO15\",\n            \"NAUO13\",\n            \"NAUO12\",\n            \"NAUO4\"\n          ],\n          \"bom_code\": \"01.02.04.0084\"\n        }\n      ],\n      \"tools\": [\n        \"点焊机\",\n        \"卡尺\"\n      ],\n      \"warnings\": [\n        \"中连接板的安装位置必须居中，确保两侧对称。\"\n      ],\n      \"estimated_time_minutes\": 10,\n      \"welding\": {\n        \"required\": true,\n        \"welding_type\": \"角焊（定位焊）\",\n        \"welding_method\": \"CO2气保焊\",\n        \"weld_size\": \"点焊，焊点长度10-15mm，焊脚高度3mm\",\n        \"welding_position\": \"零件③中侧板与零件④中连接板的连接处，主要为立焊和横焊\",\n        \"quality_requirements\": \"定位尺寸准确，焊点分布均匀，防止应力集中。\",\n        \"safety_notes\": \"清理焊接区域的油污和锈蚀，确保焊缝质量。注意焊枪角度，避免飞溅物过多。\"\n      },\n      \"safety_warnings\": [\n        \"立焊和横焊时，注意防止熔渣和火花飞溅烫伤身体\",\n        \"佩戴防护眼镜和防护服，确保身体暴露部位得到保护\",\n        \"保持工作区域通风，避免吸入焊接烟尘\"\n      ]\n    },\n    {\n      \"step_number\": 5,\n      \"action\": \"安装方形板-机加\",\n      \"description\": \"将图纸序号5的方形板-机加（S-RB1830-03-04-Q345）安装在中连接板（序号4）的上方，作为上挂板的支撑。确保方形板的机加面朝向正确，并与中连接板对齐。使用点焊固定。\",\n      \"position_description\": \"位于序号4中连接板的上方\",\n      \"parts_used\": [\n        {\n          \"bom_seq\": \"5\",\n          \"bom_name\": \"方形板-机加\",\n          \"quantity\": 1,\n          \"drawing_number\": \"5\",\n          \"node_name\": [\n            \"NAUO8\",\n            \"NAUO5\"\n          ],\n          \"bom_code\": \"01.02.03.0207\"\n        }\n      ],\n      \"tools\": [\n        \"点焊机\"\n      ],\n      \"warnings\": [\n        \"方形板的机加面是后续装配的基准面，必须保证平整度。\"\n      ],\n      \"estimated_time_minutes\": 8,\n      \"welding\": {\n        \"required\": true,\n        \"welding_type\": \"角焊（定位焊）\",\n        \"welding_method\": \"CO2气保焊\",\n        \"weld_size\": \"点焊，焊点长度10-15mm，焊脚高度3mm\",\n        \"welding_position\": \"零件④中连接板与零件⑤方形板的连接处，平焊\",\n        \"quality_requirements\": \"确保方形板与中连接板贴合紧密，焊点不影响机加面平整度。\",\n        \"safety_notes\": \"注意控制焊接电流，防止热变形影响机加面的精度。\"\n      },\n      \"safety_warnings\": [\n        \"佩戴焊接面罩和防护手套，防止弧光和飞溅物伤害\",\n        \"点焊时注意控制热输入，防止板材变形或烧穿\"\n      ]\n    },\n    {\n      \"step_number\": 6,\n      \"action\": \"安装轴套\",\n      \"description\": \"将图纸序号6的轴套（S-RB1830-03-07-Q235）安装在方形板-机加（序号5）的下方中心位置。轴套应垂直于方形板，并与预留孔位对齐。使用点焊固定。\",\n      \"position_description\": \"位于序号5方形板的下方中心\",\n      \"parts_used\": [\n        {\n          \"bom_seq\": \"6\",\n          \"bom_name\": \"轴套\",\n          \"quantity\": 1,\n          \"drawing_number\": \"6\",\n          \"node_name\": [\n            \"NAUO7\",\n            \"NAUO6\"\n          ],\n          \"bom_code\": \"01.01.01.4776\"\n        }\n      ],\n      \"tools\": [\n        \"点焊机\",\n        \"垂直度检查工具\"\n      ],\n      \"warnings\": [\n        \"轴套的垂直度要求高，点焊后必须立即检查，防止后续旋转机构卡滞。\"\n      ],\n      \"estimated_time_minutes\": 12,\n      \"welding\": {\n        \"required\": true,\n        \"welding_type\": \"角焊（定位焊）\",\n        \"welding_method\": \"CO2气保焊\",\n        \"weld_size\": \"点焊，焊点长度10-15mm，焊脚高度3mm\",\n        \"welding_position\": \"零件⑤方形板与零件⑥轴套的连接处，仰焊\",\n        \"quality_requirements\": \"轴套垂直度偏差小于0.5mm，焊点均匀分布，确保轴套定位准确。\",\n        \"safety_notes\": \"仰焊操作难度大，注意防止熔渣和飞溅物烫伤。必须使用合适的焊接参数，避免烧穿薄壁轴套。\"\n      },\n      \"safety_warnings\": [\n        \"进行仰焊操作时，必须佩戴防护面罩、防护服和防护手套，防止高温熔渣和飞溅物坠落烫伤\",\n        \"确保站立稳固，避免因仰焊姿势不稳造成摔倒\",\n        \"控制焊接电流，防止轴套薄壁被烧穿\"\n      ]\n    },\n    {\n      \"step_number\": 7,\n      \"action\": \"安装左右连接器板\",\n      \"description\": \"将图纸序号7的左连接器板（S-LP1730(68IN)-MP1140-LT-01-06-Q460）和图纸序号8的右连接器板（S-LP1730(68IN)-MP1140-LT-01-07-Q460）分别安装在组件主体结构的两侧，与基准方管（序号1）和内部结构对齐。使用点焊固定。\",\n      \"position_description\": \"分别位于组件的左侧和右侧，与序号1方管外侧对齐\",\n      \"parts_used\": [\n        {\n          \"bom_seq\": \"7\",\n          \"bom_name\": \"左连接器板\",\n          \"quantity\": 1,\n          \"drawing_number\": \"7\",\n          \"node_name\": [\n            \"NAUO10\",\n            \"NAUO9\"\n          ],\n          \"bom_code\": \"01.02.01.3872\"\n        },\n        {\n          \"bom_seq\": \"8\",\n          \"bom_name\": \"右连接器板\",\n          \"quantity\": 1,\n          \"drawing_number\": \"8\",\n          \"node_name\": [\n            \"NAUO11\"\n          ],\n          \"bom_code\": \"01.02.05.0334\"\n        }\n      ],\n      \"tools\": [\n        \"点焊机\",\n        \"卷尺\"\n      ],\n      \"warnings\": [\n        \"左右连接器板的安装位置必须对称，确保组件整体宽度符合图纸要求。\"\n      ],\n      \"estimated_time_minutes\": 15,\n      \"welding\": {\n        \"required\": true,\n        \"welding_type\": \"角焊（定位焊）\",\n        \"welding_method\": \"CO2气保焊\",\n        \"weld_size\": \"点焊，焊点长度10-15mm，焊脚高度3mm\",\n        \"welding_position\": \"零件①方管与零件⑦/⑧连接器板的连接处，主要为横焊和立焊\",\n        \"quality_requirements\": \"定位尺寸和对称度符合要求，焊点牢固，为后续满焊做准备。\",\n        \"safety_notes\": \"Q460材料强度较高，点焊时注意预热，防止低温裂纹。确保焊丝和保护气体符合材料要求。\"\n      },\n      \"safety_warnings\": [\n        \"Q460高强钢焊接时，注意控制预热温度，防止焊缝产生裂纹\",\n        \"佩戴防护手套，防止搬运板材时被锋利边缘割伤\",\n        \"确保焊接区域通风良好，特别是高强钢焊接烟尘可能含有有害物质\"\n      ]\n    },\n    {\n      \"step_number\": 8,\n      \"action\": \"安装上挂板和方形板-机加\",\n      \"description\": \"将图纸序号9的上挂板（S-LP1730(68IN)-MP1140-LT-01-07-Q460）安装在组件上方的中心位置，与方形板-机加（序号5）连接。同时，将图纸序号10的方形板-机加（S-LP1730(68IN)-MP1140-LT-01-08-Q460）安装在组件两侧的上方。全部使用点焊固定。\",\n      \"position_description\": \"序号9位于上方中心，序号10位于两侧上方\",\n      \"parts_used\": [\n        {\n          \"bom_seq\": \"9\",\n          \"bom_name\": \"上挂板\",\n          \"quantity\": 1,\n          \"drawing_number\": \"9\",\n          \"node_name\": [\n            \"NAUO14\"\n          ],\n          \"bom_code\": \"01.02.04.0447\"\n        },\n        {\n          \"bom_seq\": \"10\",\n          \"bom_name\": \"方形板-机加\",\n          \"quantity\": 2,\n          \"drawing_number\": \"10\"\n        }\n      ],\n      \"tools\": [\n        \"点焊机\"\n      ],\n      \"warnings\": [\n        \"上挂板（序号9）的安装孔位必须与图纸尺寸严格一致，这是后续连接的关键部位。\"\n      ],\n      \"estimated_time_minutes\": 10,\n      \"welding\": {\n        \"required\": true,\n        \"welding_type\": \"角焊（定位焊）\",\n        \"welding_method\": \"CO2气保焊\",\n        \"weld_size\": \"点焊，焊点长度10-15mm，焊脚高度3mm\",\n        \"welding_position\": \"零件⑤方形板与零件⑨上挂板的连接处，以及零件①方管与零件⑩方形板的连接处，平焊为主\",\n        \"quality_requirements\": \"确保上挂板和方形板的平面度，焊点不影响后续满焊。\",\n        \"safety_notes\": \"注意高空作业安全（如果组件已吊起），确保焊机电缆不缠绕，避免绊倒。\"\n      },\n      \"safety_warnings\": [\n        \"如果需要在高处进行操作，必须系好安全带，并确保安全带挂在可靠的固定点上\",\n        \"注意焊机电缆和气管的布置，防止人员绊倒或被运动部件夹住\",\n        \"佩戴安全帽，防止上方工具或零件坠落\"\n      ]\n    },\n    {\n      \"step_number\": 9,\n      \"action\": \"安装三角板和方形板\",\n      \"description\": \"将图纸序号11的三角板（SJB-T8*64*37-Q355B）安装在组件两侧的加强位置，提供斜向支撑。将图纸序号12的方形板（FXB-T6*75*75-Q235）安装在组件底部的加强位置。全部使用点焊固定。\",\n      \"position_description\": \"序号11位于两侧斜角，序号12位于底部加强筋位置\",\n      \"parts_used\": [\n        {\n          \"bom_seq\": \"11\",\n          \"bom_name\": \"三角板\",\n          \"quantity\": 4,\n          \"drawing_number\": \"11\"\n        },\n        {\n          \"bom_seq\": \"12\",\n          \"bom_name\": \"方形板\",\n          \"quantity\": 4,\n          \"drawing_number\": \"12\"\n        }\n      ],\n      \"tools\": [\n        \"点焊机\"\n      ],\n      \"warnings\": [\n        \"三角板和方形板的安装应确保不干涉其他零件，且焊缝位置符合图纸要求。\"\n      ],\n      \"estimated_time_minutes\": 15,\n      \"welding\": {\n        \"required\": true,\n        \"welding_type\": \"角焊（定位焊）\",\n        \"welding_method\": \"CO2气保焊\",\n        \"weld_size\": \"点焊，焊点长度10-15mm，焊脚高度3mm\",\n        \"welding_position\": \"零件①方管与零件⑪三角板、零件⑫方形板的连接处，涉及平焊、横焊、立焊\",\n        \"quality_requirements\": \"加强筋定位准确，角度符合图纸要求，焊点牢固。\",\n        \"safety_notes\": \"三角板和方形板的板厚不同，点焊时注意调整电流，防止薄板烧穿。\"\n      },\n      \"safety_warnings\": [\n        \"不同厚度板材焊接时，注意调整焊接参数，防止薄板烧穿或厚板未焊透\",\n        \"佩戴防护眼镜和手套，防止焊接飞溅物伤害\"\n      ]\n    },\n    {\n      \"step_number\": 10,\n      \"action\": \"安装防滑板并满焊\",\n      \"description\": \"将图纸序号13的防滑板（S-EDGP1630-DR-01-10-Q235）安装在组件的底部，作为防滑支撑。确认所有零件点焊位置无误后，按照技术要求进行满焊（CO2保护焊）。焊接顺序应遵循对称、分段、跳焊原则，以减少焊接变形。\",\n      \"position_description\": \"位于组件底部外侧\",\n      \"parts_used\": [\n        {\n          \"bom_seq\": \"13\",\n          \"bom_name\": \"防滑板\",\n          \"quantity\": 2,\n          \"drawing_number\": \"13\"\n        }\n      ],\n      \"tools\": [\n        \"CO2焊机\",\n        \"焊钳\",\n        \"焊渣锤\"\n      ],\n      \"warnings\": [\n        \"焊接过程中注意控制热输入，防止方管结构产生严重扭曲变形。\",\n        \"所有焊缝必须饱满、连续，无虚焊、漏焊等缺陷。\"\n      ],\n      \"estimated_time_minutes\": 60,\n      \"welding\": {\n        \"required\": true,\n        \"welding_type\": \"角焊（满焊）\",\n        \"welding_method\": \"CO2气保焊\",\n        \"weld_size\": \"焊脚高度6mm（根据图纸未标注焊缝，按板厚T5取0.7倍，约4-6mm）\",\n        \"welding_position\": \"所有定位焊点处进行满焊，以及零件①方管与零件⑬防滑板的连接处，主要为平焊和横焊\",\n        \"quality_requirements\": \"焊缝外观成型良好，焊波均匀，焊缝高度和宽度符合要求。焊后进行外观检查，确保无裂纹、未熔合、夹渣等缺陷。\",\n        \"safety_notes\": \"进行长时间焊接时，必须佩戴全套防护用品（面罩、手套、防护服）。确保工作区域有强制通风设备，防止烟尘中毒。焊接完成后，检查焊机和电缆是否过热。\"\n      },\n      \"safety_warnings\": [\n        \"进行满焊作业时，必须佩戴全套焊接防护用品（面罩、防护服、防护手套），防止长时间弧光和高温伤害\",\n        \"确保工作区域通风良好，开启排烟设备，防止吸入大量焊接烟尘导致中毒\",\n        \"焊接完成后，高温焊件和焊渣可能造成烫伤，不得直接用手触摸\",\n        \"检查焊机电缆和气管连接是否牢固，防止漏气或电缆短路\"\n      ]\n    },\n    {\n      \"step_number\": 11,\n      \"action\": \"焊后清理与打磨\",\n      \"description\": \"焊接完成后，使用焊渣锤和钢丝刷清除所有焊渣和飞溅物。对所有焊缝进行打磨处理，特别是外观面和配合面，确保表面平整度符合技术要求。\",\n      \"position_description\": \"所有焊缝区域\",\n      \"parts_used\": [],\n      \"tools\": [\n        \"角磨机\",\n        \"钢丝刷\",\n        \"焊渣锤\"\n      ],\n      \"warnings\": [\n        \"打磨时注意保护非焊接区域，避免损伤基材。\",\n        \"打磨后的表面粗糙度应符合图纸要求。\"\n      ],\n      \"estimated_time_minutes\": 30,\n      \"safety_warnings\": [\n        \"使用角磨机时，必须佩戴防护眼镜和防尘口罩，防止高速飞溅的金属屑和粉尘伤害眼睛和呼吸道\",\n        \"检查角磨机防护罩是否安装到位，防止砂轮片破裂伤人\",\n        \"打磨时双手握紧磨机，站稳脚跟，防止磨机反弹失控伤人\",\n        \"清理焊渣时，注意焊渣锤和钢丝刷的飞溅物，佩戴防护眼镜\"\n      ]\n    }\n  ]\n}\n```",
  "parsed_result": {
    "enhanced_steps": [
      {
        "step_number": 1,
        "action": "放置基准件",
        "description": "将图纸序号1的方管（FG-T5*80*80-1134-Q345）平稳放置在装配胎具上，作为整个组件的装配基准。确保方管水平且位置准确。",
        "position_description": "平放于装配胎具上",
        "parts_used": [
          {
            "bom_seq": "1",
            "bom_name": "方管",
            "quantity": 2,
            "drawing_number": "1",
            "node_name": [
              "NAUO1"
            ],
            "bom_code": "01.02.01.3870"
          }
        ],
        "tools": [
          "行车/吊具",
          "装配胎具",
          "水平仪"
        ],
        "warnings": [
          "方管较重（26.16kg），吊装时注意安全，确保吊具捆绑牢固。",
          "检查方管表面无明显划痕或变形。"
        ],
        "estimated_time_minutes": 10,
        "safety_warnings": [
          "佩戴安全帽和安全鞋，防止重物坠落砸伤脚部和头部",
          "使用行车吊装时，必须由专业司索工指挥，确保吊物平稳，防止摆动碰撞",
          "检查吊索具是否完好，不得超载起吊"
        ]
      },
      {
        "step_number": 2,
        "action": "安装内部支撑方管",
        "description": "将图纸序号2的方管（FG-T5*80*80-318-Q345）放置在两个基准方管（序号1）之间，按照图纸尺寸（1140mm总长，内部318mm）进行定位。使用点焊固定，确保位置准确。",
        "position_description": "位于两个序号1方管的内部，两端对齐",
        "parts_used": [
          {
            "bom_seq": "2",
            "bom_name": "方管",
            "quantity": 2,
            "drawing_number": "2",
            "node_name": [
              "NAUO2"
            ],
            "bom_code": "01.02.01.3871"
          }
        ],
        "tools": [
          "卷尺",
          "角尺",
          "点焊机"
        ],
        "warnings": [
          "点焊前必须精确测量定位尺寸，特别是两端距离。",
          "点焊强度要足够支撑后续装配重量。"
        ],
        "estimated_time_minutes": 15,
        "welding": {
          "required": true,
          "welding_type": "角焊（定位焊）",
          "welding_method": "CO2气保焊",
          "weld_size": "点焊，焊点长度10-15mm，焊脚高度3mm",
          "welding_position": "零件①方管与零件②方管的连接处，平焊",
          "quality_requirements": "焊点位置准确，熔深足够，无明显气孔或裂纹，确保结构定位牢固。",
          "safety_notes": "佩戴焊接面罩和防护手套，确保工作区域通风良好，防止火花飞溅。"
        },
        "safety_warnings": [
          "佩戴焊接面罩和防护手套，防止弧光灼伤眼睛和皮肤",
          "确保焊机接地良好，防止漏电触电",
          "清理焊接区域周围的易燃物，防止火灾发生"
        ]
      },
      {
        "step_number": 3,
        "action": "安装中侧板",
        "description": "将图纸序号3的中侧板（S-RB1830-03-02-Q345）安装在内部方管（序号2）的两侧，确保中侧板的定位孔与方管上的预留孔位对齐。使用点焊固定。",
        "position_description": "位于序号2方管的两侧，垂直安装",
        "parts_used": [
          {
            "bom_seq": "3",
            "bom_name": "中侧板",
            "quantity": 2,
            "drawing_number": "3",
            "node_name": [
              "NAUO3"
            ],
            "bom_code": "01.02.03.0206"
          }
        ],
        "tools": [
          "点焊机",
          "定位销"
        ],
        "warnings": [
          "中侧板的垂直度对后续装配至关重要，点焊后需检查垂直度。"
        ],
        "estimated_time_minutes": 10,
        "welding": {
          "required": true,
          "welding_type": "角焊（定位焊）",
          "welding_method": "CO2气保焊",
          "weld_size": "点焊，焊点长度10-15mm，焊脚高度3mm",
          "welding_position": "零件②方管与零件③中侧板的连接处，主要为平焊和横焊",
          "quality_requirements": "定位准确，垂直度偏差小于1mm，焊点牢固。",
          "safety_notes": "检查焊机接地线连接可靠，避免触电风险。点焊时注意板材边缘，防止烧穿。"
        },
        "safety_warnings": [
          "佩戴防护手套，防止板材边缘割伤手指",
          "点焊时使用焊接面罩，防止电弧光灼伤眼睛",
          "确保焊机电缆绝缘良好，避免拖拽造成破损漏电"
        ]
      },
      {
        "step_number": 4,
        "action": "安装中连接板",
        "description": "将图纸序号4的中连接板（S-RB1830-03-03-Q345）安装在中侧板（序号3）的中间位置，确保其与中侧板和内部方管（序号2）的接触面紧密贴合。使用点焊固定。",
        "position_description": "位于两个序号3中侧板之间，底部与序号2方管连接",
        "parts_used": [
          {
            "bom_seq": "4",
            "bom_name": "中连接板",
            "quantity": 2,
            "drawing_number": "4",
            "node_name": [
              "NAUO16",
              "NAUO15",
              "NAUO13",
              "NAUO12",
              "NAUO4"
            ],
            "bom_code": "01.02.04.0084"
          }
        ],
        "tools": [
          "点焊机",
          "卡尺"
        ],
        "warnings": [
          "中连接板的安装位置必须居中，确保两侧对称。"
        ],
        "estimated_time_minutes": 10,
        "welding": {
          "required": true,
          "welding_type": "角焊（定位焊）",
          "welding_method": "CO2气保焊",
          "weld_size": "点焊，焊点长度10-15mm，焊脚高度3mm",
          "welding_position": "零件③中侧板与零件④中连接板的连接处，主要为立焊和横焊",
          "quality_requirements": "定位尺寸准确，焊点分布均匀，防止应力集中。",
          "safety_notes": "清理焊接区域的油污和锈蚀，确保焊缝质量。注意焊枪角度，避免飞溅物过多。"
        },
        "safety_warnings": [
          "立焊和横焊时，注意防止熔渣和火花飞溅烫伤身体",
          "佩戴防护眼镜和防护服，确保身体暴露部位得到保护",
          "保持工作区域通风，避免吸入焊接烟尘"
        ]
      },
      {
        "step_number": 5,
        "action": "安装方形板-机加",
        "description": "将图纸序号5的方形板-机加（S-RB1830-03-04-Q345）安装在中连接板（序号4）的上方，作为上挂板的支撑。确保方形板的机加面朝向正确，并与中连接板对齐。使用点焊固定。",
        "position_description": "位于序号4中连接板的上方",
        "parts_used": [
          {
            "bom_seq": "5",
            "bom_name": "方形板-机加",
            "quantity": 1,
            "drawing_number": "5",
            "node_name": [
              "NAUO8",
              "NAUO5"
            ],
            "bom_code": "01.02.03.0207"
          }
        ],
        "tools": [
          "点焊机"
        ],
        "warnings": [
          "方形板的机加面是后续装配的基准面，必须保证平整度。"
        ],
        "estimated_time_minutes": 8,
        "welding": {
          "required": true,
          "welding_type": "角焊（定位焊）",
          "welding_method": "CO2气保焊",
          "weld_size": "点焊，焊点长度10-15mm，焊脚高度3mm",
          "welding_position": "零件④中连接板与零件⑤方形板的连接处，平焊",
          "quality_requirements": "确保方形板与中连接板贴合紧密，焊点不影响机加面平整度。",
          "safety_notes": "注意控制焊接电流，防止热变形影响机加面的精度。"
        },
        "safety_warnings": [
          "佩戴焊接面罩和防护手套，防止弧光和飞溅物伤害",
          "点焊时注意控制热输入，防止板材变形或烧穿"
        ]
      },
      {
        "step_number": 6,
        "action": "安装轴套",
        "description": "将图纸序号6的轴套（S-RB1830-03-07-Q235）安装在方形板-机加（序号5）的下方中心位置。轴套应垂直于方形板，并与预留孔位对齐。使用点焊固定。",
        "position_description": "位于序号5方形板的下方中心",
        "parts_used": [
          {
            "bom_seq": "6",
            "bom_name": "轴套",
            "quantity": 1,
            "drawing_number": "6",
            "node_name": [
              "NAUO7",
              "NAUO6"
            ],
            "bom_code": "01.01.01.4776"
          }
        ],
        "tools": [
          "点焊机",
          "垂直度检查工具"
        ],
        "warnings": [
          "轴套的垂直度要求高，点焊后必须立即检查，防止后续旋转机构卡滞。"
        ],
        "estimated_time_minutes": 12,
        "welding": {
          "required": true,
          "welding_type": "角焊（定位焊）",
          "welding_method": "CO2气保焊",
          "weld_size": "点焊，焊点长度10-15mm，焊脚高度3mm",
          "welding_position": "零件⑤方形板与零件⑥轴套的连接处，仰焊",
          "quality_requirements": "轴套垂直度偏差小于0.5mm，焊点均匀分布，确保轴套定位准确。",
          "safety_notes": "仰焊操作难度大，注意防止熔渣和飞溅物烫伤。必须使用合适的焊接参数，避免烧穿薄壁轴套。"
        },
        "safety_warnings": [
          "进行仰焊操作时，必须佩戴防护面罩、防护服和防护手套，防止高温熔渣和飞溅物坠落烫伤",
          "确保站立稳固，避免因仰焊姿势不稳造成摔倒",
          "控制焊接电流，防止轴套薄壁被烧穿"
        ]
      },
      {
        "step_number": 7,
        "action": "安装左右连接器板",
        "description": "将图纸序号7的左连接器板（S-LP1730(68IN)-MP1140-LT-01-06-Q460）和图纸序号8的右连接器板（S-LP1730(68IN)-MP1140-LT-01-07-Q460）分别安装在组件主体结构的两侧，与基准方管（序号1）和内部结构对齐。使用点焊固定。",
        "position_description": "分别位于组件的左侧和右侧，与序号1方管外侧对齐",
        "parts_used": [
          {
            "bom_seq": "7",
            "bom_name": "左连接器板",
            "quantity": 1,
            "drawing_number": "7",
            "node_name": [
              "NAUO10",
              "NAUO9"
            ],
            "bom_code": "01.02.01.3872"
          },
          {
            "bom_seq": "8",
            "bom_name": "右连接器板",
            "quantity": 1,
            "drawing_number": "8",
            "node_name": [
              "NAUO11"
            ],
            "bom_code": "01.02.05.0334"
          }
        ],
        "tools": [
          "点焊机",
          "卷尺"
        ],
        "warnings": [
          "左右连接器板的安装位置必须对称，确保组件整体宽度符合图纸要求。"
        ],
        "estimated_time_minutes": 15,
        "welding": {
          "required": true,
          "welding_type": "角焊（定位焊）",
          "welding_method": "CO2气保焊",
          "weld_size": "点焊，焊点长度10-15mm，焊脚高度3mm",
          "welding_position": "零件①方管与零件⑦/⑧连接器板的连接处，主要为横焊和立焊",
          "quality_requirements": "定位尺寸和对称度符合要求，焊点牢固，为后续满焊做准备。",
          "safety_notes": "Q460材料强度较高，点焊时注意预热，防止低温裂纹。确保焊丝和保护气体符合材料要求。"
        },
        "safety_warnings": [
          "Q460高强钢焊接时，注意控制预热温度，防止焊缝产生裂纹",
          "佩戴防护手套，防止搬运板材时被锋利边缘割伤",
          "确保焊接区域通风良好，特别是高强钢焊接烟尘可能含有有害物质"
        ]
      },
      {
        "step_number": 8,
        "action": "安装上挂板和方形板-机加",
        "description": "将图纸序号9的上挂板（S-LP1730(68IN)-MP1140-LT-01-07-Q460）安装在组件上方的中心位置，与方形板-机加（序号5）连接。同时，将图纸序号10的方形板-机加（S-LP1730(68IN)-MP1140-LT-01-08-Q460）安装在组件两侧的上方。全部使用点焊固定。",
        "position_description": "序号9位于上方中心，序号10位于两侧上方",
        "parts_used": [
          {
            "bom_seq": "9",
            "bom_name": "上挂板",
            "quantity": 1,
            "drawing_number": "9",
            "node_name": [
              "NAUO14"
            ],
            "bom_code": "01.02.04.0447"
          },
          {
            "bom_seq": "10",
            "bom_name": "方形板-机加",
            "quantity": 2,
            "drawing_number": "10"
          }
        ],
        "tools": [
          "点焊机"
        ],
        "warnings": [
          "上挂板（序号9）的安装孔位必须与图纸尺寸严格一致，这是后续连接的关键部位。"
        ],
        "estimated_time_minutes": 10,
        "welding": {
          "required": true,
          "welding_type": "角焊（定位焊）",
          "welding_method": "CO2气保焊",
          "weld_size": "点焊，焊点长度10-15mm，焊脚高度3mm",
          "welding_position": "零件⑤方形板与零件⑨上挂板的连接处，以及零件①方管与零件⑩方形板的连接处，平焊为主",
          "quality_requirements": "确保上挂板和方形板的平面度，焊点不影响后续满焊。",
          "safety_notes": "注意高空作业安全（如果组件已吊起），确保焊机电缆不缠绕，避免绊倒。"
        },
        "safety_warnings": [
          "如果需要在高处进行操作，必须系好安全带，并确保安全带挂在可靠的固定点上",
          "注意焊机电缆和气管的布置，防止人员绊倒或被运动部件夹住",
          "佩戴安全帽，防止上方工具或零件坠落"
        ]
      },
      {
        "step_number": 9,
        "action": "安装三角板和方形板",
        "description": "将图纸序号11的三角板（SJB-T8*64*37-Q355B）安装在组件两侧的加强位置，提供斜向支撑。将图纸序号12的方形板（FXB-T6*75*75-Q235）安装在组件底部的加强位置。全部使用点焊固定。",
        "position_description": "序号11位于两侧斜角，序号12位于底部加强筋位置",
        "parts_used": [
          {
            "bom_seq": "11",
            "bom_name": "三角板",
            "quantity": 4,
            "drawing_number": "11"
          },
          {
            "bom_seq": "12",
            "bom_name": "方形板",
            "quantity": 4,
            "drawing_number": "12"
          }
        ],
        "tools": [
          "点焊机"
        ],
        "warnings": [
          "三角板和方形板的安装应确保不干涉其他零件，且焊缝位置符合图纸要求。"
        ],
        "estimated_time_minutes": 15,
        "welding": {
          "required": true,
          "welding_type": "角焊（定位焊）",
          "welding_method": "CO2气保焊",
          "weld_size": "点焊，焊点长度10-15mm，焊脚高度3mm",
          "welding_position": "零件①方管与零件⑪三角板、零件⑫方形板的连接处，涉及平焊、横焊、立焊",
          "quality_requirements": "加强筋定位准确，角度符合图纸要求，焊点牢固。",
          "safety_notes": "三角板和方形板的板厚不同，点焊时注意调整电流，防止薄板烧穿。"
        },
        "safety_warnings": [
          "不同厚度板材焊接时，注意调整焊接参数，防止薄板烧穿或厚板未焊透",
          "佩戴防护眼镜和手套，防止焊接飞溅物伤害"
        ]
      },
      {
        "step_number": 10,
        "action": "安装防滑板并满焊",
        "description": "将图纸序号13的防滑板（S-EDGP1630-DR-01-10-Q235）安装在组件的底部，作为防滑支撑。确认所有零件点焊位置无误后，按照技术要求进行满焊（CO2保护焊）。焊接顺序应遵循对称、分段、跳焊原则，以减少焊接变形。",
        "position_description": "位于组件底部外侧",
        "parts_used": [
          {
            "bom_seq": "13",
            "bom_name": "防滑板",
            "quantity": 2,
            "drawing_number": "13"
          }
        ],
        "tools": [
          "CO2焊机",
          "焊钳",
          "焊渣锤"
        ],
        "warnings": [
          "焊接过程中注意控制热输入，防止方管结构产生严重扭曲变形。",
          "所有焊缝必须饱满、连续，无虚焊、漏焊等缺陷。"
        ],
        "estimated_time_minutes": 60,
        "welding": {
          "required": true,
          "welding_type": "角焊（满焊）",
          "welding_method": "CO2气保焊",
          "weld_size": "焊脚高度6mm（根据图纸未标注焊缝，按板厚T5取0.7倍，约4-6mm）",
          "welding_position": "所有定位焊点处进行满焊，以及零件①方管与零件⑬防滑板的连接处，主要为平焊和横焊",
          "quality_requirements": "焊缝外观成型良好，焊波均匀，焊缝高度和宽度符合要求。焊后进行外观检查，确保无裂纹、未熔合、夹渣等缺陷。",
          "safety_notes": "进行长时间焊接时，必须佩戴全套防护用品（面罩、手套、防护服）。确保工作区域有强制通风设备，防止烟尘中毒。焊接完成后，检查焊机和电缆是否过热。"
        },
        "safety_warnings": [
          "进行满焊作业时，必须佩戴全套焊接防护用品（面罩、防护服、防护手套），防止长时间弧光和高温伤害",
          "确保工作区域通风良好，开启排烟设备，防止吸入大量焊接烟尘导致中毒",
          "焊接完成后，高温焊件和焊渣可能造成烫伤，不得直接用手触摸",
          "检查焊机电缆和气管连接是否牢固，防止漏气或电缆短路"
        ]
      },
      {
        "step_number": 11,
        "action": "焊后清理与打磨",
        "description": "焊接完成后，使用焊渣锤和钢丝刷清除所有焊渣和飞溅物。对所有焊缝进行打磨处理，特别是外观面和配合面，确保表面平整度符合技术要求。",
        "position_description": "所有焊缝区域",
        "parts_used": [],
        "tools": [
          "角磨机",
          "钢丝刷",
          "焊渣锤"
        ],
        "warnings": [
          "打磨时注意保护非焊接区域，避免损伤基材。",
          "打磨后的表面粗糙度应符合图纸要求。"
        ],
        "estimated_time_minutes": 30,
        "safety_warnings": [
          "使用角磨机时，必须佩戴防护眼镜和防尘口罩，防止高速飞溅的金属屑和粉尘伤害眼睛和呼吸道",
          "检查角磨机防护罩是否安装到位，防止砂轮片破裂伤人",
          "打磨时双手握紧磨机，站稳脚跟，防止磨机反弹失控伤人",
          "清理焊渣时，注意焊渣锤和钢丝刷的飞溅物，佩戴防护眼镜"
        ]
      }
    ]
  }
}