{
  "agent_name": "Agent6_FAQ",
  "model": "google/gemini-2.5-flash-preview-09-2025",
  "timestamp": "20251104_143958",
  "image_count": 0,
  "temperature": 0.2,
  "system_prompt": "# 角色定位\n\n你是**李师傅**，一位拥有20年安全管理经验的高级安全工程师。\n\n## 教育背景\n\n- **学历**：安全工程专业本科\n- **职业资格**：注册安全工程师、高级安全评价师\n- **专业培训**：\n  - 机械制造安全管理\n  - 职业健康与安全管理体系（ISO 45001）\n  - 事故调查与分析\n  - 应急预案编制与演练\n\n## 职业背景\n\n- **工作经历**：20年机械制造企业安全管理经验，参与过大型装备制造、钢结构加工等项目\n- **专业领域**：\n  - 机械加工安全（车、铣、刨、磨、钻等）\n  - 焊接作业安全（电焊、气焊、氩弧焊等）\n  - 起重吊装安全（行车、叉车、吊索具等）\n  - 高空作业安全（脚手架、安全带、防坠落等）\n  - 个人防护用品管理（安全帽、防护眼镜、手套、安全鞋等）\n\n## 知识结构（详细）\n\n### 1. 机械伤害风险\n- **夹伤/挤伤**：手指、手臂被运动部件夹住\n- **切割伤**：锋利边缘、毛刺、切削工具\n- **碰撞伤**：头部碰撞、身体碰撞\n- **坠落伤**：零件坠落、工具坠落、人员坠落\n\n### 2. 焊接作业风险\n- **电击伤**：焊机漏电、接地不良\n- **弧光伤**：电弧紫外线灼伤眼睛和皮肤\n- **烫伤**：高温熔池、焊渣飞溅\n- **火灾爆炸**：易燃物引燃、气瓶泄漏\n- **有毒气体**：焊接烟尘、一氧化碳中毒\n\n### 3. 起重吊装风险\n- **吊物坠落**：吊索具断裂、捆绑不牢\n- **吊物摆动**：碰撞人员、设备\n- **超载**：超过起重机额定载荷\n- **指挥失误**：信号不清、违章指挥\n\n### 4. 高空作业风险\n- **人员坠落**：未系安全带、脚手架不牢\n- **物体打击**：工具、零件从高处坠落\n- **脚手架坍塌**：搭设不规范、超载\n\n### 5. 个人防护用品\n- **头部防护**：安全帽（防止碰撞、坠物打击）\n- **眼部防护**：防护眼镜、焊接面罩（防止飞溅、弧光）\n- **手部防护**：防护手套（防止切割、烫伤、化学品）\n- **足部防护**：安全鞋（防砸、防刺穿、防滑）\n- **呼吸防护**：防尘口罩、防毒面具（防止粉尘、有毒气体）\n\n### 6. 应急处理\n- **机械伤害**：立即停机、呼救、止血、固定、送医\n- **电击伤**：切断电源、心肺复苏、送医\n- **烫伤**：冷水冲洗、覆盖无菌纱布、送医\n- **火灾**：使用灭火器、疏散人员、报警\n\n## 任务步骤（Chain of Thought）\n\n你的任务是**为每个装配步骤添加安全警告**（如果该步骤有安全风险）。请按照以下5个步骤思考：\n\n### 步骤1：识别风险步骤\n- 分析每个装配步骤的操作内容\n- 判断是否涉及高风险作业（焊接、吊装、高空、重物搬运等）\n- 识别潜在的伤害类型（机械伤害、电击、烫伤、坠落等）\n\n### 步骤2：分析风险源\n- 确定风险的来源（设备、工具、材料、环境、人员操作等）\n- 评估风险的严重程度（轻微、中等、严重、致命）\n- 考虑风险的发生概率\n\n### 步骤3：制定预防措施\n- 针对每个风险源，制定具体的预防措施\n- 强调个人防护用品的使用\n- 强调安全操作规程的遵守\n\n### 步骤4：添加安全警告\n- 为每个有风险的步骤添加safety_warnings字段\n- 每条警告要简洁明了，说明具体的风险和预防措施\n- 使用工人能看懂的语言\n\n### 步骤5：验证完整性\n- 检查所有高风险步骤是否都添加了安全警告\n- 检查安全警告是否具体、可操作\n- 检查是否遗漏了任何潜在风险\n\n## 核心原则\n\n1. **步骤级嵌入**：为每个有风险的步骤添加safety_warnings字段，而不是单独列出安全警告\n2. **工人友好**：使用通俗语言，避免专业术语\n3. **具体可操作**：说明具体的风险和预防措施，而不是泛泛而谈\n4. **不重复显示**：安全警告只在下方\"安全\"标签页中统一显示，不在当前步骤详情中重复显示\n\n## 输出格式\n\n严格按照以下JSON格式输出（返回增强后的装配步骤）：\n\n```json\n{\n  \"enhanced_steps\": [\n    {\n      \"step_number\": 1,\n      \"title\": \"点焊定位\",\n      \"parts_used\": [...],\n      \"tools_required\": [...],\n      \"operation\": \"操作说明\",\n      \"quality_check\": \"质量检查\",\n      \"estimated_time_minutes\": 10,\n      \"welding\": {\n        \"required\": true,\n        \"welding_type\": \"点焊\",\n        \"welding_method\": \"CO2气保焊\",\n        ...\n      },\n      \"safety_warnings\": [\n        \"佩戴焊接面罩和防护手套，防止弧光灼伤眼睛和皮肤\",\n        \"确保工件夹紧牢固，防止点焊时位移造成伤害\",\n        \"焊接区域周围3米内不得有易燃物，配备灭火器\",\n        \"焊机必须接地良好，防止漏电触电\"\n      ]\n    },\n    {\n      \"step_number\": 2,\n      \"title\": \"螺栓连接\",\n      \"parts_used\": [...],\n      \"operation\": \"操作说明\",\n      \"quality_check\": \"质量检查\",\n      \"estimated_time_minutes\": 15,\n      \"safety_warnings\": [\n        \"佩戴安全帽和防护眼镜，防止零件坠落和飞溅\",\n        \"使用扭力扳手时注意力度，防止扳手滑脱伤人\"\n      ]\n    },\n    {\n      \"step_number\": 3,\n      \"title\": \"简单装配\",\n      \"parts_used\": [...],\n      \"operation\": \"操作说明\",\n      \"quality_check\": \"质量检查\",\n      \"estimated_time_minutes\": 5\n      // ⚠️ 如果没有明显安全风险，不添加safety_warnings字段\n    }\n  ]\n}\n```\n\n**⚠️ 关键要求**：\n\n1. **步骤级嵌入**：\n   - 为每个有风险的步骤添加`safety_warnings`字段\n   - 没有明显风险的步骤不添加`safety_warnings`字段\n   - 保持原有步骤的所有字段不变\n\n2. **安全警告要具体**：\n   - ✅ 说\"佩戴焊接面罩和防护手套，防止弧光灼伤眼睛和皮肤\"\n   - ❌ 不说\"注意安全\"\n   - ✅ 说\"焊接区域周围3米内不得有易燃物，配备灭火器\"\n   - ❌ 不说\"注意防火\"\n\n3. **使用通俗语言**：\n   - 工人能看懂的语言\n   - 避免专业术语和英文缩写\n\n4. **警告要全面**：\n   - 涵盖个人防护、设备安全、环境安全、操作安全\n   - 每条警告说明具体的风险和预防措施\n\n## 重要提醒\n\n- **只输出JSON，不要输出其他内容**\n- **保持原有字段不变**：不要修改或删除原有的字段（包括welding字段）\n- **警告要简洁明了**：每条警告一句话，说明风险和预防措施\n- **不要过度警告**：只针对有明显风险的步骤添加警告\n",
  "user_query": "请为以下装配步骤添加安全警告（如果有安全风险）。\n\n## 📸 视觉分析任务\n\n**你会看到工程图纸图片，请仔细观察：**\n\n1. **危险作业标识**：\n   - 图纸上的安全警告标识\n   - 特殊作业要求（如高空作业、吊装作业等）\n   - 危险区域标注\n\n2. **零件特征**：\n   - 重型零件（需要吊装）\n   - 锋利边缘（容易割伤）\n   - 高温部件（容易烫伤）\n\n3. **作业环境**：\n   - 狭窄空间（容易碰撞）\n   - 高空位置（容易坠落）\n   - 密闭空间（通风不良）\n\n## 装配步骤\n\n[\n  {\n    \"step_number\": 1,\n    \"action\": \"接收并准备\",\n    \"description\": \"从上一工序（通常是焊接或机加工）接收①号毛刷固定板组，并将其放置在专用的工装夹具上，准备进行表面处理。\",\n    \"position_description\": \"将零件平稳放置在工装夹具上，确保所有表面均可接触。\",\n    \"parts_used\": [\n      {\n        \"bom_seq\": \"1\",\n        \"bom_name\": \"毛刷固定板组\",\n        \"quantity\": 1,\n        \"drawing_number\": \"1\"\n      }\n    ],\n    \"tools\": [\n      \"专用工装夹具\",\n      \"吊具/行车（如果重量超过25kg）\"\n    ],\n    \"warnings\": [\n      \"搬运时注意保护零件表面，避免磕碰和划伤。\",\n      \"确保零件在夹具上固定牢固，防止在后续处理中脱落。\"\n    ]\n  },\n  {\n    \"step_number\": 2,\n    \"action\": \"表面抛丸处理\",\n    \"description\": \"根据工艺路线（序号1：抛丸），将①号毛刷固定板组送入抛丸室，进行表面除锈和粗化处理，以提高漆膜附着力。\",\n    \"position_description\": \"零件在抛丸室内应均匀受力，无死角。\",\n    \"parts_used\": [\n      {\n        \"bom_seq\": \"1\",\n        \"bom_name\": \"毛刷固定板组\",\n        \"quantity\": 1,\n        \"drawing_number\": \"1\"\n      }\n    ],\n    \"tools\": [\n      \"抛丸机\",\n      \"压缩空气枪\"\n    ],\n    \"warnings\": [\n      \"抛丸后必须彻底清理零件表面残留的钢砂和灰尘。\",\n      \"检查表面粗糙度是否达到喷漆要求。\"\n    ]\n  },\n  {\n    \"step_number\": 3,\n    \"action\": \"底漆喷涂\",\n    \"description\": \"根据工艺路线（序号2：底漆），将抛丸后的①号毛刷固定板组送入喷漆房，喷涂第一层防锈底漆。\",\n    \"position_description\": \"喷涂时确保零件悬挂或放置平稳，避免滴流。\",\n    \"parts_used\": [\n      {\n        \"bom_seq\": \"1\",\n        \"bom_name\": \"毛刷固定板组\",\n        \"quantity\": 1,\n        \"drawing_number\": \"1\"\n      }\n    ],\n    \"tools\": [\n      \"喷枪\",\n      \"底漆涂料\"\n    ],\n    \"warnings\": [\n      \"底漆厚度要均匀，不能有漏喷或流挂现象。\",\n      \"底漆喷涂后需按要求进行烘干或自然晾干。\"\n    ]\n  },\n  {\n    \"step_number\": 4,\n    \"action\": \"中间漆喷涂\",\n    \"description\": \"根据工艺路线（序号3：中间漆），在底漆干燥后，喷涂中间漆，以增加漆膜厚度和隔离性。\",\n    \"position_description\": \"确保中间漆覆盖底漆层，无露底现象。\",\n    \"parts_used\": [\n      {\n        \"bom_seq\": \"1\",\n        \"bom_name\": \"毛刷固定板组\",\n        \"quantity\": 1,\n        \"drawing_number\": \"1\"\n      }\n    ],\n    \"tools\": [\n      \"喷枪\",\n      \"中间漆涂料\"\n    ],\n    \"warnings\": [\n      \"严格控制中间漆的粘度和喷涂环境温度。\",\n      \"每层漆膜干燥时间必须满足工艺要求。\"\n    ]\n  },\n  {\n    \"step_number\": 5,\n    \"action\": \"面漆喷涂\",\n    \"description\": \"根据工艺路线（序号4：面漆），喷涂最终的面漆，达到图纸技术要求2（漆面均匀、美观、无露白、划伤等不良）。\",\n    \"position_description\": \"面漆是最终外观层，需特别注意表面质量。\",\n    \"parts_used\": [\n      {\n        \"bom_seq\": \"1\",\n        \"bom_name\": \"毛刷固定板组\",\n        \"quantity\": 1,\n        \"drawing_number\": \"1\"\n      }\n    ],\n    \"tools\": [\n      \"喷枪\",\n      \"面漆涂料\"\n    ],\n    \"warnings\": [\n      \"面漆颜色和光泽度必须符合标准样板。\",\n      \"喷涂完成后，按要求进行充分固化（烘干或晾干）。\"\n    ]\n  },\n  {\n    \"step_number\": 6,\n    \"action\": \"最终检验与入库\",\n    \"description\": \"对完成喷漆固化的①号毛刷固定板组进行最终质量检验，确认合格后，进行包装并送入成品库。\",\n    \"position_description\": \"检验时需在光线充足的环境下进行。\",\n    \"parts_used\": [\n      {\n        \"bom_seq\": \"1\",\n        \"bom_name\": \"毛刷固定板组\",\n        \"quantity\": 1,\n        \"drawing_number\": \"1\"\n      }\n    ],\n    \"tools\": [\n      \"测厚仪\",\n      \"色差仪\",\n      \"卷尺/卡尺\"\n    ],\n    \"warnings\": [\n      \"包装前确保漆面完全干燥，避免包装材料粘连。\",\n      \"包装时注意保护零件的轴颈部分，防止磕碰变形。\"\n    ]\n  }\n]\n\n## 要求\n\n请按照以下5个步骤思考，为装配步骤添加安全警告：\n\n### 步骤1：识别风险步骤\n- 分析每个装配步骤的操作内容\n- 判断是否涉及高风险作业：\n  * **焊接作业**：电击、弧光、烫伤、火灾\n  * **吊装作业**：吊物坠落、碰撞、超载\n  * **高空作业**：人员坠落、物体打击\n  * **重物搬运**：砸伤、扭伤、夹伤\n  * **机械加工**：切割伤、夹伤、碰撞\n\n### 步骤2：分析风险源\n- 确定风险的来源（设备、工具、材料、环境、人员操作等）\n- 评估风险的严重程度（轻微、中等、严重、致命）\n- 考虑风险的发生概率\n\n### 步骤3：制定预防措施\n- 针对每个风险源，制定具体的预防措施\n- 强调个人防护用品的使用：\n  * **焊接**：焊接面罩、防护手套、防护服\n  * **吊装**：安全帽、安全鞋、手套\n  * **高空**：安全带、安全帽、防滑鞋\n  * **机械**：防护眼镜、手套、安全鞋\n\n### 步骤4：添加安全警告\n- 为每个有风险的步骤添加safety_warnings字段\n- 每条警告要简洁明了，说明具体的风险和预防措施\n- 使用工人能看懂的语言\n\n### 步骤5：验证完整性\n- 检查所有高风险步骤是否都添加了安全警告\n- 检查安全警告是否具体、可操作\n- 检查是否遗漏了任何潜在风险\n\n## ⚠️ 强制自检清单（生成后必须逐项检查）\n\n**在输出JSON之前，你必须完成以下验证：**\n\n1. **风险步骤识别验证**：\n   - [ ] 所有涉及焊接、吊装、高空、重物搬运的步骤都添加了safety_warnings字段\n   - [ ] 没有明显风险的步骤没有添加safety_warnings字段\n\n2. **安全警告完整性验证**：\n   - [ ] 每个safety_warnings字段都是字符串数组\n   - [ ] 每条警告都说明了具体的风险和预防措施\n   - [ ] 涵盖了个人防护、设备安全、环境安全、操作安全\n\n3. **语言通俗性验证**：\n   - [ ] 使用工人能看懂的语言\n   - [ ] 避免专业术语和英文缩写\n   - [ ] 每条警告简洁明了（一句话）\n\n4. **原有字段保持验证**：\n   - [ ] 原有步骤的所有字段都保持不变（包括welding字段）\n   - [ ] 没有修改或删除任何原有字段\n\n**如果自检发现任何问题，必须重新生成！**\n\n现在开始为装配步骤添加安全警告！\n",
  "raw_response": "## 角色定位：李师傅（高级安全工程师）\n\n### 步骤1：识别风险步骤 & 步骤2：分析风险源\n\n| 步骤编号 | 操作内容 | 风险类型 | 风险源 | 严重程度 |\n| :---: | :--- | :--- | :--- | :--- |\n| 1 | 接收并准备（涉及吊装/重物搬运） | 吊物坠落、砸伤、扭伤 | 零件重（>25kg）、吊具使用不当、搬运姿势不当 | 中等/严重 |\n| 2 | 表面抛丸处理 | 粉尘吸入、噪音、物体飞溅 | 抛丸机工作环境、高压气枪清理、抛丸粉尘 | 中等 |\n| 3 | 底漆喷涂 | 中毒/窒息、火灾爆炸、皮肤刺激 | 溶剂型涂料（VOCs）、喷漆房通风不良、静电/明火 | 严重 |\n| 4 | 中间漆喷涂 | 中毒/窒息、火灾爆炸、皮肤刺激 | 溶剂型涂料（VOCs）、喷漆房通风不良、静电/明火 | 严重 |\n| 5 | 面漆喷涂 | 中毒/窒息、火灾爆炸、皮肤刺激 | 溶剂型涂料（VOCs）、喷漆房通风不良、静电/明火 | 严重 |\n| 6 | 最终检验与入库 | 无明显高风险 | 检验、包装、入库 | 轻微 |\n\n### 步骤3：制定预防措施 & 步骤4：添加安全警告\n\n- **步骤1（搬运/吊装）**：使用行车吊装时，必须检查吊索具完好；人工搬运时，注意正确姿势，佩戴手套防夹伤。\n- **步骤2（抛丸）**：进入抛丸室必须佩戴防尘口罩和耳塞；清理时使用压缩空气枪要戴防护眼镜，防止钢砂飞溅。\n- **步骤3, 4, 5（喷漆）**：喷漆房内必须保持通风良好，操作人员必须佩戴防毒面具和防护服；喷漆房内严禁明火，防止火灾爆炸。\n\n### 步骤5：验证完整性\n\n所有高风险步骤（1, 2, 3, 4, 5）均已添加安全警告，警告内容具体且可操作。\n\n---\n\n```json\n{\n  \"enhanced_steps\": [\n    {\n      \"step_number\": 1,\n      \"action\": \"接收并准备\",\n      \"description\": \"从上一工序（通常是焊接或机加工）接收①号毛刷固定板组，并将其放置在专用的工装夹具上，准备进行表面处理。\",\n      \"position_description\": \"将零件平稳放置在工装夹具上，确保所有表面均可接触。\",\n      \"parts_used\": [\n        {\n          \"bom_seq\": \"1\",\n          \"bom_name\": \"毛刷固定板组\",\n          \"quantity\": 1,\n          \"drawing_number\": \"1\"\n        }\n      ],\n      \"tools\": [\n        \"专用工装夹具\",\n        \"吊具/行车（如果重量超过25kg）\"\n      ],\n      \"warnings\": [\n        \"搬运时注意保护零件表面，避免磕碰和划伤。\",\n        \"确保零件在夹具上固定牢固，防止在后续处理中脱落。\"\n      ],\n      \"safety_warnings\": [\n        \"如果零件重量超过25公斤，必须使用行车或吊具搬运，严禁单人强行搬运，防止扭伤。\",\n        \"使用吊具前，必须检查吊索具是否完好，捆绑必须牢固，防止吊物坠落砸伤。\",\n        \"佩戴安全帽和防护手套，防止零件边缘割伤或碰撞伤害。\"\n      ]\n    },\n    {\n      \"step_number\": 2,\n      \"action\": \"表面抛丸处理\",\n      \"description\": \"根据工艺路线（序号1：抛丸），将①号毛刷固定板组送入抛丸室，进行表面除锈和粗化处理，以提高漆膜附着力。\",\n      \"position_description\": \"零件在抛丸室内应均匀受力，无死角。\",\n      \"parts_used\": [\n        {\n          \"bom_seq\": \"1\",\n          \"bom_name\": \"毛刷固定板组\",\n          \"quantity\": 1,\n          \"drawing_number\": \"1\"\n        }\n      ],\n      \"tools\": [\n        \"抛丸机\",\n        \"压缩空气枪\"\n      ],\n      \"warnings\": [\n        \"抛丸后必须彻底清理零件表面残留的钢砂和灰尘。\",\n        \"检查表面粗糙度是否达到喷漆要求。\"\n      ],\n      \"safety_warnings\": [\n        \"进入抛丸室或操作抛丸机时，必须佩戴防尘口罩、耳塞和防护眼镜，防止粉尘吸入和噪音伤害。\",\n        \"使用压缩空气枪清理钢砂时，气压不得超过规定值，并佩戴防护眼镜，防止钢砂高速飞溅伤眼。\",\n        \"抛丸机门关闭后方可启动，严禁在设备运行过程中打开观察窗或舱门。\"\n      ]\n    },\n    {\n      \"step_number\": 3,\n      \"action\": \"底漆喷涂\",\n      \"description\": \"根据工艺路线（序号2：底漆），将抛丸后的①号毛刷固定板组送入喷漆房，喷涂第一层防锈底漆。\",\n      \"position_description\": \"喷涂时确保零件悬挂或放置平稳，避免滴流。\",\n      \"parts_used\": [\n        {\n          \"bom_seq\": \"1\",\n          \"bom_name\": \"毛刷固定板组\",\n          \"quantity\": 1,\n          \"drawing_number\": \"1\"\n        }\n      ],\n      \"tools\": [\n        \"喷枪\",\n        \"底漆涂料\"\n      ],\n      \"warnings\": [\n        \"底漆厚度要均匀，不能有漏喷或流挂现象。\",\n        \"底漆喷涂后需按要求进行烘干或自然晾干。\"\n      ],\n      \"safety_warnings\": [\n        \"喷漆作业必须在通风良好的喷漆房内进行，确保排风系统正常运行，防止溶剂蒸汽中毒。\",\n        \"操作人员必须佩戴防毒面具（活性炭滤盒）、防护眼镜和防溶剂手套，防止油漆和稀释剂刺激皮肤和呼吸道。\",\n        \"喷漆房内严禁吸烟、使用明火或产生火花的工具，防止油漆蒸汽引发火灾或爆炸。\"\n      ]\n    },\n    {\n      \"step_number\": 4,\n      \"action\": \"中间漆喷涂\",\n      \"description\": \"根据工艺路线（序号3：中间漆），在底漆干燥后，喷涂中间漆，以增加漆膜厚度和隔离性。\",\n      \"position_description\": \"确保中间漆覆盖底漆层，无露底现象。\",\n      \"parts_used\": [\n        {\n          \"bom_seq\": \"1\",\n          \"bom_name\": \"毛刷固定板组\",\n          \"quantity\": 1,\n          \"drawing_number\": \"1\"\n        }\n      ],\n      \"tools\": [\n        \"喷枪\",\n        \"中间漆涂料\"\n      ],\n      \"warnings\": [\n        \"严格控制中间漆的粘度和喷涂环境温度。\",\n        \"每层漆膜干燥时间必须满足工艺要求。\"\n      ],\n      \"safety_warnings\": [\n        \"继续保持喷漆房通风，操作人员必须佩戴防毒面具和防护服，防止溶剂蒸汽中毒。\",\n        \"喷枪和供漆系统必须接地良好，防止静电积累引发火灾。\",\n        \"油漆和稀释剂应存放在专用防火柜中，严禁在喷漆区域堆放过多易燃品。\"\n      ]\n    },\n    {\n      \"step_number\": 5,\n      \"action\": \"面漆喷涂\",\n      \"description\": \"根据工艺路线（序号4：面漆），喷涂最终的面漆，达到图纸技术要求2（漆面均匀、美观、无露白、划伤等不良）。\",\n      \"position_description\": \"面漆是最终外观层，需特别注意表面质量。\",\n      \"parts_used\": [\n        {\n          \"bom_seq\": \"1\",\n          \"bom_name\": \"毛刷固定板组\",\n          \"quantity\": 1,\n          \"drawing_number\": \"1\"\n        }\n      ],\n      \"tools\": [\n        \"喷枪\",\n        \"面漆涂料\"\n      ],\n      \"warnings\": [\n        \"面漆颜色和光泽度必须符合标准样板。\",\n        \"喷涂完成后，按要求进行充分固化（烘干或晾干）。\"\n      ],\n      \"safety_warnings\": [\n        \"喷涂面漆时，必须严格遵守喷漆房安全操作规程，确保个人防护用品（防毒面具、防护服）穿戴齐全。\",\n        \"烘干作业时，注意烘房温度控制，防止超温引发火灾，并确保烘房通风系统正常运行。\",\n        \"处理废弃油漆和稀释剂时，应倒入专用回收桶，不得随意倾倒，防止污染环境和引发火灾。\"\n      ]\n    },\n    {\n      \"step_number\": 6,\n      \"action\": \"最终检验与入库\",\n      \"description\": \"对完成喷漆固化的①号毛刷固定板组进行最终质量检验，确认合格后，进行包装并送入成品库。\",\n      \"position_description\": \"检验时需在光线充足的环境下进行。\",\n      \"parts_used\": [\n        {\n          \"bom_seq\": \"1\",\n          \"bom_name\": \"毛刷固定板组\",\n          \"quantity\": 1,\n          \"drawing_number\": \"1\"\n        }\n      ],\n      \"tools\": [\n        \"测厚仪\",\n        \"色差仪\",\n        \"卷尺/卡尺\"\n      ],\n      \"warnings\": [\n        \"包装前确保漆面完全干燥，避免包装材料粘连。\",\n        \"包装时注意保护零件的轴颈部分，防止磕碰变形。\"\n      ]\n    }\n  ]\n}\n```",
  "parsed_result": {
    "enhanced_steps": [
      {
        "step_number": 1,
        "action": "接收并准备",
        "description": "从上一工序（通常是焊接或机加工）接收①号毛刷固定板组，并将其放置在专用的工装夹具上，准备进行表面处理。",
        "position_description": "将零件平稳放置在工装夹具上，确保所有表面均可接触。",
        "parts_used": [
          {
            "bom_seq": "1",
            "bom_name": "毛刷固定板组",
            "quantity": 1,
            "drawing_number": "1"
          }
        ],
        "tools": [
          "专用工装夹具",
          "吊具/行车（如果重量超过25kg）"
        ],
        "warnings": [
          "搬运时注意保护零件表面，避免磕碰和划伤。",
          "确保零件在夹具上固定牢固，防止在后续处理中脱落。"
        ],
        "safety_warnings": [
          "如果零件重量超过25公斤，必须使用行车或吊具搬运，严禁单人强行搬运，防止扭伤。",
          "使用吊具前，必须检查吊索具是否完好，捆绑必须牢固，防止吊物坠落砸伤。",
          "佩戴安全帽和防护手套，防止零件边缘割伤或碰撞伤害。"
        ]
      },
      {
        "step_number": 2,
        "action": "表面抛丸处理",
        "description": "根据工艺路线（序号1：抛丸），将①号毛刷固定板组送入抛丸室，进行表面除锈和粗化处理，以提高漆膜附着力。",
        "position_description": "零件在抛丸室内应均匀受力，无死角。",
        "parts_used": [
          {
            "bom_seq": "1",
            "bom_name": "毛刷固定板组",
            "quantity": 1,
            "drawing_number": "1"
          }
        ],
        "tools": [
          "抛丸机",
          "压缩空气枪"
        ],
        "warnings": [
          "抛丸后必须彻底清理零件表面残留的钢砂和灰尘。",
          "检查表面粗糙度是否达到喷漆要求。"
        ],
        "safety_warnings": [
          "进入抛丸室或操作抛丸机时，必须佩戴防尘口罩、耳塞和防护眼镜，防止粉尘吸入和噪音伤害。",
          "使用压缩空气枪清理钢砂时，气压不得超过规定值，并佩戴防护眼镜，防止钢砂高速飞溅伤眼。",
          "抛丸机门关闭后方可启动，严禁在设备运行过程中打开观察窗或舱门。"
        ]
      },
      {
        "step_number": 3,
        "action": "底漆喷涂",
        "description": "根据工艺路线（序号2：底漆），将抛丸后的①号毛刷固定板组送入喷漆房，喷涂第一层防锈底漆。",
        "position_description": "喷涂时确保零件悬挂或放置平稳，避免滴流。",
        "parts_used": [
          {
            "bom_seq": "1",
            "bom_name": "毛刷固定板组",
            "quantity": 1,
            "drawing_number": "1"
          }
        ],
        "tools": [
          "喷枪",
          "底漆涂料"
        ],
        "warnings": [
          "底漆厚度要均匀，不能有漏喷或流挂现象。",
          "底漆喷涂后需按要求进行烘干或自然晾干。"
        ],
        "safety_warnings": [
          "喷漆作业必须在通风良好的喷漆房内进行，确保排风系统正常运行，防止溶剂蒸汽中毒。",
          "操作人员必须佩戴防毒面具（活性炭滤盒）、防护眼镜和防溶剂手套，防止油漆和稀释剂刺激皮肤和呼吸道。",
          "喷漆房内严禁吸烟、使用明火或产生火花的工具，防止油漆蒸汽引发火灾或爆炸。"
        ]
      },
      {
        "step_number": 4,
        "action": "中间漆喷涂",
        "description": "根据工艺路线（序号3：中间漆），在底漆干燥后，喷涂中间漆，以增加漆膜厚度和隔离性。",
        "position_description": "确保中间漆覆盖底漆层，无露底现象。",
        "parts_used": [
          {
            "bom_seq": "1",
            "bom_name": "毛刷固定板组",
            "quantity": 1,
            "drawing_number": "1"
          }
        ],
        "tools": [
          "喷枪",
          "中间漆涂料"
        ],
        "warnings": [
          "严格控制中间漆的粘度和喷涂环境温度。",
          "每层漆膜干燥时间必须满足工艺要求。"
        ],
        "safety_warnings": [
          "继续保持喷漆房通风，操作人员必须佩戴防毒面具和防护服，防止溶剂蒸汽中毒。",
          "喷枪和供漆系统必须接地良好，防止静电积累引发火灾。",
          "油漆和稀释剂应存放在专用防火柜中，严禁在喷漆区域堆放过多易燃品。"
        ]
      },
      {
        "step_number": 5,
        "action": "面漆喷涂",
        "description": "根据工艺路线（序号4：面漆），喷涂最终的面漆，达到图纸技术要求2（漆面均匀、美观、无露白、划伤等不良）。",
        "position_description": "面漆是最终外观层，需特别注意表面质量。",
        "parts_used": [
          {
            "bom_seq": "1",
            "bom_name": "毛刷固定板组",
            "quantity": 1,
            "drawing_number": "1"
          }
        ],
        "tools": [
          "喷枪",
          "面漆涂料"
        ],
        "warnings": [
          "面漆颜色和光泽度必须符合标准样板。",
          "喷涂完成后，按要求进行充分固化（烘干或晾干）。"
        ],
        "safety_warnings": [
          "喷涂面漆时，必须严格遵守喷漆房安全操作规程，确保个人防护用品（防毒面具、防护服）穿戴齐全。",
          "烘干作业时，注意烘房温度控制，防止超温引发火灾，并确保烘房通风系统正常运行。",
          "处理废弃油漆和稀释剂时，应倒入专用回收桶，不得随意倾倒，防止污染环境和引发火灾。"
        ]
      },
      {
        "step_number": 6,
        "action": "最终检验与入库",
        "description": "对完成喷漆固化的①号毛刷固定板组进行最终质量检验，确认合格后，进行包装并送入成品库。",
        "position_description": "检验时需在光线充足的环境下进行。",
        "parts_used": [
          {
            "bom_seq": "1",
            "bom_name": "毛刷固定板组",
            "quantity": 1,
            "drawing_number": "1"
          }
        ],
        "tools": [
          "测厚仪",
          "色差仪",
          "卷尺/卡尺"
        ],
        "warnings": [
          "包装前确保漆面完全干燥，避免包装材料粘连。",
          "包装时注意保护零件的轴颈部分，防止磕碰变形。"
        ]
      }
    ]
  }
}