{
  "agent_name": "Agent6_FAQ",
  "model": "google/gemini-2.5-flash-preview-09-2025",
  "timestamp": "20251104_125815",
  "image_count": 0,
  "temperature": 0.2,
  "system_prompt": "# 角色定位\n\n你是**李师傅**，一位拥有20年安全管理经验的高级安全工程师。\n\n## 教育背景\n\n- **学历**：安全工程专业本科\n- **职业资格**：注册安全工程师、高级安全评价师\n- **专业培训**：\n  - 机械制造安全管理\n  - 职业健康与安全管理体系（ISO 45001）\n  - 事故调查与分析\n  - 应急预案编制与演练\n\n## 职业背景\n\n- **工作经历**：20年机械制造企业安全管理经验，参与过大型装备制造、钢结构加工等项目\n- **专业领域**：\n  - 机械加工安全（车、铣、刨、磨、钻等）\n  - 焊接作业安全（电焊、气焊、氩弧焊等）\n  - 起重吊装安全（行车、叉车、吊索具等）\n  - 高空作业安全（脚手架、安全带、防坠落等）\n  - 个人防护用品管理（安全帽、防护眼镜、手套、安全鞋等）\n\n## 知识结构（详细）\n\n### 1. 机械伤害风险\n- **夹伤/挤伤**：手指、手臂被运动部件夹住\n- **切割伤**：锋利边缘、毛刺、切削工具\n- **碰撞伤**：头部碰撞、身体碰撞\n- **坠落伤**：零件坠落、工具坠落、人员坠落\n\n### 2. 焊接作业风险\n- **电击伤**：焊机漏电、接地不良\n- **弧光伤**：电弧紫外线灼伤眼睛和皮肤\n- **烫伤**：高温熔池、焊渣飞溅\n- **火灾爆炸**：易燃物引燃、气瓶泄漏\n- **有毒气体**：焊接烟尘、一氧化碳中毒\n\n### 3. 起重吊装风险\n- **吊物坠落**：吊索具断裂、捆绑不牢\n- **吊物摆动**：碰撞人员、设备\n- **超载**：超过起重机额定载荷\n- **指挥失误**：信号不清、违章指挥\n\n### 4. 高空作业风险\n- **人员坠落**：未系安全带、脚手架不牢\n- **物体打击**：工具、零件从高处坠落\n- **脚手架坍塌**：搭设不规范、超载\n\n### 5. 个人防护用品\n- **头部防护**：安全帽（防止碰撞、坠物打击）\n- **眼部防护**：防护眼镜、焊接面罩（防止飞溅、弧光）\n- **手部防护**：防护手套（防止切割、烫伤、化学品）\n- **足部防护**：安全鞋（防砸、防刺穿、防滑）\n- **呼吸防护**：防尘口罩、防毒面具（防止粉尘、有毒气体）\n\n### 6. 应急处理\n- **机械伤害**：立即停机、呼救、止血、固定、送医\n- **电击伤**：切断电源、心肺复苏、送医\n- **烫伤**：冷水冲洗、覆盖无菌纱布、送医\n- **火灾**：使用灭火器、疏散人员、报警\n\n## 任务步骤（Chain of Thought）\n\n你的任务是**为每个装配步骤添加安全警告**（如果该步骤有安全风险）。请按照以下5个步骤思考：\n\n### 步骤1：识别风险步骤\n- 分析每个装配步骤的操作内容\n- 判断是否涉及高风险作业（焊接、吊装、高空、重物搬运等）\n- 识别潜在的伤害类型（机械伤害、电击、烫伤、坠落等）\n\n### 步骤2：分析风险源\n- 确定风险的来源（设备、工具、材料、环境、人员操作等）\n- 评估风险的严重程度（轻微、中等、严重、致命）\n- 考虑风险的发生概率\n\n### 步骤3：制定预防措施\n- 针对每个风险源，制定具体的预防措施\n- 强调个人防护用品的使用\n- 强调安全操作规程的遵守\n\n### 步骤4：添加安全警告\n- 为每个有风险的步骤添加safety_warnings字段\n- 每条警告要简洁明了，说明具体的风险和预防措施\n- 使用工人能看懂的语言\n\n### 步骤5：验证完整性\n- 检查所有高风险步骤是否都添加了安全警告\n- 检查安全警告是否具体、可操作\n- 检查是否遗漏了任何潜在风险\n\n## 核心原则\n\n1. **步骤级嵌入**：为每个有风险的步骤添加safety_warnings字段，而不是单独列出安全警告\n2. **工人友好**：使用通俗语言，避免专业术语\n3. **具体可操作**：说明具体的风险和预防措施，而不是泛泛而谈\n4. **不重复显示**：安全警告只在下方\"安全\"标签页中统一显示，不在当前步骤详情中重复显示\n\n## 输出格式\n\n严格按照以下JSON格式输出（返回增强后的装配步骤）：\n\n```json\n{\n  \"enhanced_steps\": [\n    {\n      \"step_number\": 1,\n      \"title\": \"点焊定位\",\n      \"parts_used\": [...],\n      \"tools_required\": [...],\n      \"operation\": \"操作说明\",\n      \"quality_check\": \"质量检查\",\n      \"estimated_time_minutes\": 10,\n      \"welding\": {\n        \"required\": true,\n        \"welding_type\": \"点焊\",\n        \"welding_method\": \"CO2气保焊\",\n        ...\n      },\n      \"safety_warnings\": [\n        \"佩戴焊接面罩和防护手套，防止弧光灼伤眼睛和皮肤\",\n        \"确保工件夹紧牢固，防止点焊时位移造成伤害\",\n        \"焊接区域周围3米内不得有易燃物，配备灭火器\",\n        \"焊机必须接地良好，防止漏电触电\"\n      ]\n    },\n    {\n      \"step_number\": 2,\n      \"title\": \"螺栓连接\",\n      \"parts_used\": [...],\n      \"operation\": \"操作说明\",\n      \"quality_check\": \"质量检查\",\n      \"estimated_time_minutes\": 15,\n      \"safety_warnings\": [\n        \"佩戴安全帽和防护眼镜，防止零件坠落和飞溅\",\n        \"使用扭力扳手时注意力度，防止扳手滑脱伤人\"\n      ]\n    },\n    {\n      \"step_number\": 3,\n      \"title\": \"简单装配\",\n      \"parts_used\": [...],\n      \"operation\": \"操作说明\",\n      \"quality_check\": \"质量检查\",\n      \"estimated_time_minutes\": 5\n      // ⚠️ 如果没有明显安全风险，不添加safety_warnings字段\n    }\n  ]\n}\n```\n\n**⚠️ 关键要求**：\n\n1. **步骤级嵌入**：\n   - 为每个有风险的步骤添加`safety_warnings`字段\n   - 没有明显风险的步骤不添加`safety_warnings`字段\n   - 保持原有步骤的所有字段不变\n\n2. **安全警告要具体**：\n   - ✅ 说\"佩戴焊接面罩和防护手套，防止弧光灼伤眼睛和皮肤\"\n   - ❌ 不说\"注意安全\"\n   - ✅ 说\"焊接区域周围3米内不得有易燃物，配备灭火器\"\n   - ❌ 不说\"注意防火\"\n\n3. **使用通俗语言**：\n   - 工人能看懂的语言\n   - 避免专业术语和英文缩写\n\n4. **警告要全面**：\n   - 涵盖个人防护、设备安全、环境安全、操作安全\n   - 每条警告说明具体的风险和预防措施\n\n## 重要提醒\n\n- **只输出JSON，不要输出其他内容**\n- **保持原有字段不变**：不要修改或删除原有的字段（包括welding字段）\n- **警告要简洁明了**：每条警告一句话，说明风险和预防措施\n- **不要过度警告**：只针对有明显风险的步骤添加警告\n",
  "user_query": "请为以下装配步骤添加安全警告（如果有安全风险）。\n\n## 📸 视觉分析任务\n\n**你会看到工程图纸图片，请仔细观察：**\n\n1. **危险作业标识**：\n   - 图纸上的安全警告标识\n   - 特殊作业要求（如高空作业、吊装作业等）\n   - 危险区域标注\n\n2. **零件特征**：\n   - 重型零件（需要吊装）\n   - 锋利边缘（容易割伤）\n   - 高温部件（容易烫伤）\n\n3. **作业环境**：\n   - 狭窄空间（容易碰撞）\n   - 高空位置（容易坠落）\n   - 密闭空间（通风不良）\n\n## 装配步骤\n\n[\n  {\n    \"step_number\": 1,\n    \"action\": \"放置基准件并定位\",\n    \"description\": \"将图纸上标注为⑩的右连接器板（BOM序号10）平放在装配平台上，作为装配基准。确保板面水平。\",\n    \"position_description\": \"平放在装配平台上\",\n    \"parts_used\": [\n      {\n        \"bom_seq\": \"10\",\n        \"bom_name\": \"右连接器板\",\n        \"quantity\": 1,\n        \"drawing_number\": \"10\"\n      }\n    ],\n    \"tools\": [\n      \"行车\",\n      \"吊具\",\n      \"水平仪\"\n    ],\n    \"warnings\": [\n      \"吊装时注意平衡，防止零件倾倒。\"\n    ]\n  },\n  {\n    \"step_number\": 2,\n    \"action\": \"安装左连接器板\",\n    \"description\": \"将图纸上标注为⑦的左连接器板（BOM序号7）垂直放置在⑩号右连接器板的另一侧，与⑩号板平行对齐。使用夹具或点焊固定，确保两板间距符合图纸尺寸要求（1140mm）。\",\n    \"position_description\": \"与⑩号板平行对齐，位于组件的左侧\",\n    \"parts_used\": [\n      {\n        \"bom_seq\": \"7\",\n        \"bom_name\": \"左连接器板\",\n        \"quantity\": 1,\n        \"drawing_number\": \"7\"\n      }\n    ],\n    \"tools\": [\n      \"卷尺\",\n      \"直角尺\",\n      \"夹具\",\n      \"点焊机\"\n    ],\n    \"warnings\": [\n      \"确保两连接板的相对位置和垂直度准确，这是后续装配的基准。\"\n    ],\n    \"welding\": {\n      \"required\": true,\n      \"welding_type\": \"点焊（定位焊）\",\n      \"welding_method\": \"CO2气保焊\",\n      \"weld_size\": \"点焊长度10-15mm，焊脚高度3mm\",\n      \"welding_position\": \"零件⑦与装配平台（或临时支撑）的连接处，平焊/立焊\",\n      \"quality_requirements\": \"点焊牢固，能承受后续装配应力，焊点均匀分布。\",\n      \"safety_notes\": \"佩戴焊接面罩和防护手套，确保点焊电流适中，防止烧穿薄板。\"\n    }\n  },\n  {\n    \"step_number\": 3,\n    \"action\": \"安装方管（底部）\",\n    \"description\": \"安装两根图纸上标注为①的方管（BOM序号1）。将方管水平放置在⑩号和⑦号连接板的底部内侧，与连接板的底部边缘对齐。先进行点焊固定。\",\n    \"position_description\": \"位于⑩号和⑦号连接板的底部内侧\",\n    \"parts_used\": [\n      {\n        \"bom_seq\": \"1\",\n        \"bom_name\": \"方管\",\n        \"quantity\": 2,\n        \"drawing_number\": \"1\"\n      }\n    ],\n    \"tools\": [\n      \"卷尺\",\n      \"直角尺\",\n      \"点焊机\"\n    ],\n    \"warnings\": [\n      \"方管的长度方向必须与连接板平行，确保焊接位置准确。\"\n    ],\n    \"welding\": {\n      \"required\": true,\n      \"welding_type\": \"角焊（定位焊）\",\n      \"welding_method\": \"CO2气保焊\",\n      \"weld_size\": \"点焊长度15mm，焊脚高度4mm\",\n      \"welding_position\": \"零件①方管与零件⑦/⑩连接板的连接处，平焊\",\n      \"quality_requirements\": \"点焊位置应在方管两端和中间均匀分布，确保方管与连接板垂直度良好。\",\n      \"safety_notes\": \"清理方管和连接板的接触面，去除油污和锈蚀，防止产生气孔。\"\n    }\n  },\n  {\n    \"step_number\": 4,\n    \"action\": \"安装方管（顶部）\",\n    \"description\": \"安装两根图纸上标注为②的方管（BOM序号2）。将方管水平放置在⑩号和⑦号连接板的顶部内侧，与连接板的顶部边缘对齐。先进行点焊固定。\",\n    \"position_description\": \"位于⑩号和⑦号连接板的顶部内侧\",\n    \"parts_used\": [\n      {\n        \"bom_seq\": \"2\",\n        \"bom_name\": \"方管\",\n        \"quantity\": 2,\n        \"drawing_number\": \"2\"\n      }\n    ],\n    \"tools\": [\n      \"卷尺\",\n      \"直角尺\",\n      \"点焊机\"\n    ],\n    \"warnings\": [\n      \"确保方管与连接板的接触面贴合紧密，无间隙。\"\n    ],\n    \"welding\": {\n      \"required\": true,\n      \"welding_type\": \"角焊（定位焊）\",\n      \"welding_method\": \"CO2气保焊\",\n      \"weld_size\": \"点焊长度15mm，焊脚高度4mm\",\n      \"welding_position\": \"零件②方管与零件⑦/⑩连接板的连接处，平焊\",\n      \"quality_requirements\": \"点焊后检查整体框架的对角线尺寸和平面度，确保无明显变形。\",\n      \"safety_notes\": \"注意高空作业安全（如果组件较高），防止焊件坠落。\"\n    }\n  },\n  {\n    \"step_number\": 5,\n    \"action\": \"安装中侧板\",\n    \"description\": \"安装两块图纸上标注为③的中侧板（BOM序号3）。将中侧板垂直放置在底部方管（①号）和顶部方管（②号）之间，并与⑩号和⑦号连接板的内侧面保持一定间距（图纸未标注，需参照装配图确定具体位置）。先进行点焊固定。\",\n    \"position_description\": \"位于①号和②号方管之间，垂直于连接板\",\n    \"parts_used\": [\n      {\n        \"bom_seq\": \"3\",\n        \"bom_name\": \"中侧板\",\n        \"quantity\": 2,\n        \"drawing_number\": \"3\"\n      }\n    ],\n    \"tools\": [\n      \"卷尺\",\n      \"直角尺\",\n      \"点焊机\"\n    ],\n    \"warnings\": [\n      \"中侧板的定位是关键，需确保其中心线与组件中心线对齐。\"\n    ],\n    \"welding\": {\n      \"required\": true,\n      \"welding_type\": \"角焊（定位焊）\",\n      \"welding_method\": \"CO2气保焊\",\n      \"weld_size\": \"点焊长度10mm，焊脚高度3mm\",\n      \"welding_position\": \"零件③中侧板与零件①/②方管的连接处，平焊/横焊\",\n      \"quality_requirements\": \"点焊后检查中侧板的垂直度，确保其与方管紧密贴合。\",\n      \"safety_notes\": \"使用夹具固定中侧板，防止点焊时位置移动。\"\n    }\n  },\n  {\n    \"step_number\": 6,\n    \"action\": \"安装中连接板\",\n    \"description\": \"安装两块图纸上标注为④的中连接板（BOM序号4）。将中连接板垂直放置在两块③号中侧板之间，并与①号和②号方管焊接。先进行点焊固定。\",\n    \"position_description\": \"位于两块③号中侧板之间\",\n    \"parts_used\": [\n      {\n        \"bom_seq\": \"4\",\n        \"bom_name\": \"中连接板\",\n        \"quantity\": 2,\n        \"drawing_number\": \"4\"\n      }\n    ],\n    \"tools\": [\n      \"卷尺\",\n      \"直角尺\",\n      \"点焊机\"\n    ],\n    \"warnings\": [\n      \"确保中连接板的安装孔方向正确，且与方管垂直。\"\n    ],\n    \"welding\": {\n      \"required\": true,\n      \"welding_type\": \"角焊（定位焊）\",\n      \"welding_method\": \"CO2气保焊\",\n      \"weld_size\": \"点焊长度10mm，焊脚高度3mm\",\n      \"welding_position\": \"零件④中连接板与零件①/②方管的连接处，平焊/横焊\",\n      \"quality_requirements\": \"点焊后检查中连接板的中心位置和垂直度，确保与方管的连接牢固。\",\n      \"safety_notes\": \"注意焊接区域狭窄，防止烫伤，确保焊枪操作灵活。\"\n    }\n  },\n  {\n    \"step_number\": 7,\n    \"action\": \"安装方形板-机加\",\n    \"description\": \"安装两块图纸上标注为⑤的方形板-机加（BOM序号5）。将⑤号板安装在④号中连接板的下方，并与①号方管焊接。先进行点焊固定。\",\n    \"position_description\": \"位于④号中连接板下方，与①号方管连接\",\n    \"parts_used\": [\n      {\n        \"bom_seq\": \"5\",\n        \"bom_name\": \"方形板-机加\",\n        \"quantity\": 2,\n        \"drawing_number\": \"5\"\n      }\n    ],\n    \"tools\": [\n      \"点焊机\"\n    ],\n    \"warnings\": [\n      \"⑤号板的安装位置需精确，确保其与后续零件的配合。\"\n    ],\n    \"welding\": {\n      \"required\": true,\n      \"welding_type\": \"角焊（定位焊）\",\n      \"welding_method\": \"CO2气保焊\",\n      \"weld_size\": \"点焊长度10mm，焊脚高度3mm\",\n      \"welding_position\": \"零件⑤方形板与零件①方管的连接处，平焊\",\n      \"quality_requirements\": \"点焊后检查⑤号板的水平度，确保其安装孔位置准确。\",\n      \"safety_notes\": \"由于⑤号板是机加件，焊接时注意控制热输入，防止热变形影响精度。\"\n    }\n  },\n  {\n    \"step_number\": 8,\n    \"action\": \"安装轴套\",\n    \"description\": \"安装图纸上标注为⑥的轴套（BOM序号6）。将轴套焊接在⑤号方形板-机加的中心位置。\",\n    \"position_description\": \"焊接在⑤号方形板-机加的中心\",\n    \"parts_used\": [\n      {\n        \"bom_seq\": \"6\",\n        \"bom_name\": \"轴套\",\n        \"quantity\": 1,\n        \"drawing_number\": \"6\"\n      }\n    ],\n    \"tools\": [\n      \"点焊机\",\n      \"直角尺\"\n    ],\n    \"warnings\": [\n      \"轴套必须垂直于⑤号板，且中心位置准确。\"\n    ],\n    \"welding\": {\n      \"required\": true,\n      \"welding_type\": \"角焊（定位焊）\",\n      \"welding_method\": \"CO2气保焊\",\n      \"weld_size\": \"点焊长度10mm，焊脚高度3mm\",\n      \"welding_position\": \"零件⑥轴套与零件⑤方形板的连接处，平焊\",\n      \"quality_requirements\": \"轴套定位焊后必须检查垂直度，偏差应小于0.5度。\",\n      \"safety_notes\": \"轴套与板材连接处可能需要预热（根据材料厚度），防止焊接裂纹。\"\n    }\n  },\n  {\n    \"step_number\": 9,\n    \"action\": \"安装上挂板\",\n    \"description\": \"安装图纸上标注为⑧的上挂板（BOM序号8）。将⑧号上挂板焊接在②号方管的顶部中心位置，确保其安装孔朝向正确。\",\n    \"position_description\": \"焊接在②号方管的顶部中心\",\n    \"parts_used\": [\n      {\n        \"bom_seq\": \"8\",\n        \"bom_name\": \"上挂板\",\n        \"quantity\": 1,\n        \"drawing_number\": \"8\"\n      }\n    ],\n    \"tools\": [\n      \"点焊机\",\n      \"直角尺\"\n    ],\n    \"warnings\": [\n      \"上挂板的垂直度和中心位置必须精确，影响后续吊装。\"\n    ],\n    \"welding\": {\n      \"required\": true,\n      \"welding_type\": \"角焊（定位焊）\",\n      \"welding_method\": \"CO2气保焊\",\n      \"weld_size\": \"点焊长度15mm，焊脚高度4mm\",\n      \"welding_position\": \"零件⑧上挂板与零件②方管的连接处，平焊\",\n      \"quality_requirements\": \"上挂板定位焊后必须检查垂直度和中心线对齐情况。\",\n      \"safety_notes\": \"上挂板是受力件，定位焊要牢固，防止在后续操作中脱落。\"\n    }\n  },\n  {\n    \"step_number\": 10,\n    \"action\": \"安装方形板-机加（侧面）\",\n    \"description\": \"安装两块图纸上标注为⑨的方形板-机加（BOM序号9）。将⑨号板焊接在⑩号和⑦号连接板的顶部外侧，与②号方管齐平。\",\n    \"position_description\": \"焊接在⑩号和⑦号连接板的顶部外侧\",\n    \"parts_used\": [\n      {\n        \"bom_seq\": \"9\",\n        \"bom_name\": \"方形板-机加\",\n        \"quantity\": 2,\n        \"drawing_number\": \"9\"\n      }\n    ],\n    \"tools\": [\n      \"点焊机\"\n    ],\n    \"warnings\": [\n      \"确保⑨号板与连接板和方管的焊接牢固。\"\n    ],\n    \"welding\": {\n      \"required\": true,\n      \"welding_type\": \"角焊（定位焊）\",\n      \"welding_method\": \"CO2气保焊\",\n      \"weld_size\": \"点焊长度10mm，焊脚高度3mm\",\n      \"welding_position\": \"零件⑨方形板与零件⑦/⑩连接板的连接处，立焊/横焊\",\n      \"quality_requirements\": \"定位焊后检查⑨号板与连接板的齐平度。\",\n      \"safety_notes\": \"注意焊接位置较高，操作时站稳，防止焊渣飞溅。\"\n    }\n  },\n  {\n    \"step_number\": 11,\n    \"action\": \"安装三角板\",\n    \"description\": \"安装四块图纸上标注为⑪的三角板（BOM序号11）。将三角板焊接在⑩号和⑦号连接板的四个角部，用于加强结构。\",\n    \"position_description\": \"焊接在⑩号和⑦号连接板的四个角部\",\n    \"parts_used\": [\n      {\n        \"bom_seq\": \"11\",\n        \"bom_name\": \"三角板\",\n        \"quantity\": 4,\n        \"drawing_number\": \"11\"\n      }\n    ],\n    \"tools\": [\n      \"点焊机\"\n    ],\n    \"warnings\": [\n      \"三角板的焊接应符合图纸上的焊接符号要求。\"\n    ],\n    \"welding\": {\n      \"required\": true,\n      \"welding_type\": \"角焊（定位焊）\",\n      \"welding_method\": \"CO2气保焊\",\n      \"weld_size\": \"点焊长度10mm，焊脚高度3mm\",\n      \"welding_position\": \"零件⑪三角板与零件⑦/⑩连接板的连接处，立焊/横焊\",\n      \"quality_requirements\": \"三角板定位焊后应紧密贴合连接板，无间隙。\",\n      \"safety_notes\": \"三角板边缘尖锐，操作时戴好防护手套，防止割伤。\"\n    }\n  },\n  {\n    \"step_number\": 12,\n    \"action\": \"安装方形板（底部）\",\n    \"description\": \"安装四块图纸上标注为⑫的方形板（BOM序号12）。将方形板焊接在⑩号和⑦号连接板的底部外侧，与①号方管齐平。\",\n    \"position_description\": \"焊接在⑩号和⑦号连接板的底部外侧\",\n    \"parts_used\": [\n      {\n        \"bom_seq\": \"12\",\n        \"bom_name\": \"方形板\",\n        \"quantity\": 4,\n        \"drawing_number\": \"12\"\n      }\n    ],\n    \"tools\": [\n      \"点焊机\"\n    ],\n    \"warnings\": [\n      \"确保方形板与连接板和方管的焊接牢固。\"\n    ],\n    \"welding\": {\n      \"required\": true,\n      \"welding_type\": \"角焊（定位焊）\",\n      \"welding_method\": \"CO2气保焊\",\n      \"weld_size\": \"点焊长度10mm，焊脚高度3mm\",\n      \"welding_position\": \"零件⑫方形板与零件⑦/⑩连接板的连接处，平焊/立焊\",\n      \"quality_requirements\": \"定位焊后检查方形板的安装位置，确保与方管齐平。\",\n      \"safety_notes\": \"焊接底部零件时，注意保持舒适的姿势，避免长时间弯腰操作。\"\n    }\n  },\n  {\n    \"step_number\": 13,\n    \"action\": \"安装防滑板\",\n    \"description\": \"安装两块图纸上标注为⑬的防滑板（BOM序号13）。将防滑板焊接在组件的顶部外侧，覆盖在⑨号方形板-机加和②号方管上。\",\n    \"position_description\": \"焊接在组件的顶部外侧\",\n    \"parts_used\": [\n      {\n        \"bom_seq\": \"13\",\n        \"bom_name\": \"防滑板\",\n        \"quantity\": 2,\n        \"drawing_number\": \"13\"\n      }\n    ],\n    \"tools\": [\n      \"点焊机\"\n    ],\n    \"warnings\": [\n      \"防滑板的焊接应连续，确保表面平整。\"\n    ],\n    \"welding\": {\n      \"required\": true,\n      \"welding_type\": \"角焊（定位焊）\",\n      \"welding_method\": \"CO2气保焊\",\n      \"weld_size\": \"点焊长度15mm，焊脚高度3mm\",\n      \"welding_position\": \"零件⑬防滑板与零件⑨方形板/②方管的连接处，平焊\",\n      \"quality_requirements\": \"防滑板定位焊后应平整，无翘曲。\",\n      \"safety_notes\": \"防滑板面积较大，定位焊点需均匀分布，防止后续满焊时变形过大。\"\n    }\n  },\n  {\n    \"step_number\": 14,\n    \"action\": \"满焊所有零件\",\n    \"description\": \"对所有已点焊固定的零件（①至⑬号）进行满焊。焊接顺序应遵循'选择合理焊接顺序，保证焊接平稳性'的原则，通常采用对称、分段、跳焊等方法，以减少焊接变形。\",\n    \"position_description\": \"所有连接部位\",\n    \"parts_used\": [],\n    \"tools\": [\n      \"焊机（CO2或电弧焊）\",\n      \"焊钳\"\n    ],\n    \"warnings\": [\n      \"焊接过程中注意控制热输入，防止结构变形。焊接完成后，去除焊渣。\"\n    ],\n    \"welding\": {\n      \"required\": true,\n      \"welding_type\": \"角焊/对接焊（满焊）\",\n      \"welding_method\": \"CO2气保焊（推荐）\",\n      \"weld_size\": \"焊脚高度6mm（未注尺寸按图纸要求），焊缝连续\",\n      \"welding_position\": \"所有零件连接处（平焊、横焊、立焊、仰焊均有）\",\n      \"quality_requirements\": \"焊缝外观成型良好，焊波均匀，无咬边、未焊透、气孔、裂纹等缺陷。焊后进行外观检查和必要的无损检测（如磁粉或超声波）。\",\n      \"safety_notes\": \"满焊时热量集中，必须确保工作区域通风良好，配备灭火器材。焊接完成后，注意高温烫伤风险，并及时清理焊渣和飞溅物。\"\n    }\n  }\n]\n\n## 要求\n\n请按照以下5个步骤思考，为装配步骤添加安全警告：\n\n### 步骤1：识别风险步骤\n- 分析每个装配步骤的操作内容\n- 判断是否涉及高风险作业：\n  * **焊接作业**：电击、弧光、烫伤、火灾\n  * **吊装作业**：吊物坠落、碰撞、超载\n  * **高空作业**：人员坠落、物体打击\n  * **重物搬运**：砸伤、扭伤、夹伤\n  * **机械加工**：切割伤、夹伤、碰撞\n\n### 步骤2：分析风险源\n- 确定风险的来源（设备、工具、材料、环境、人员操作等）\n- 评估风险的严重程度（轻微、中等、严重、致命）\n- 考虑风险的发生概率\n\n### 步骤3：制定预防措施\n- 针对每个风险源，制定具体的预防措施\n- 强调个人防护用品的使用：\n  * **焊接**：焊接面罩、防护手套、防护服\n  * **吊装**：安全帽、安全鞋、手套\n  * **高空**：安全带、安全帽、防滑鞋\n  * **机械**：防护眼镜、手套、安全鞋\n\n### 步骤4：添加安全警告\n- 为每个有风险的步骤添加safety_warnings字段\n- 每条警告要简洁明了，说明具体的风险和预防措施\n- 使用工人能看懂的语言\n\n### 步骤5：验证完整性\n- 检查所有高风险步骤是否都添加了安全警告\n- 检查安全警告是否具体、可操作\n- 检查是否遗漏了任何潜在风险\n\n## ⚠️ 强制自检清单（生成后必须逐项检查）\n\n**在输出JSON之前，你必须完成以下验证：**\n\n1. **风险步骤识别验证**：\n   - [ ] 所有涉及焊接、吊装、高空、重物搬运的步骤都添加了safety_warnings字段\n   - [ ] 没有明显风险的步骤没有添加safety_warnings字段\n\n2. **安全警告完整性验证**：\n   - [ ] 每个safety_warnings字段都是字符串数组\n   - [ ] 每条警告都说明了具体的风险和预防措施\n   - [ ] 涵盖了个人防护、设备安全、环境安全、操作安全\n\n3. **语言通俗性验证**：\n   - [ ] 使用工人能看懂的语言\n   - [ ] 避免专业术语和英文缩写\n   - [ ] 每条警告简洁明了（一句话）\n\n4. **原有字段保持验证**：\n   - [ ] 原有步骤的所有字段都保持不变（包括welding字段）\n   - [ ] 没有修改或删除任何原有字段\n\n**如果自检发现任何问题，必须重新生成！**\n\n现在开始为装配步骤添加安全警告！\n",
  "raw_response": "```json\n{\n  \"enhanced_steps\": [\n    {\n      \"step_number\": 1,\n      \"action\": \"放置基准件并定位\",\n      \"description\": \"将图纸上标注为⑩的右连接器板（BOM序号10）平放在装配平台上，作为装配基准。确保板面水平。\",\n      \"position_description\": \"平放在装配平台上\",\n      \"parts_used\": [\n        {\n          \"bom_seq\": \"10\",\n          \"bom_name\": \"右连接器板\",\n          \"quantity\": 1,\n          \"drawing_number\": \"10\"\n        }\n      ],\n      \"tools\": [\n        \"行车\",\n        \"吊具\",\n        \"水平仪\"\n      ],\n      \"warnings\": [\n        \"吊装时注意平衡，防止零件倾倒。\"\n      ],\n      \"safety_warnings\": [\n        \"吊装前检查行车和吊具是否完好，吊索具捆绑必须牢固，防止吊物坠落伤人\",\n        \"吊装区域内非操作人员必须撤离，操作人员佩戴安全帽和安全鞋\",\n        \"指挥人员必须使用统一手势，确保信号清晰，防止碰撞\"\n      ]\n    },\n    {\n      \"step_number\": 2,\n      \"action\": \"安装左连接器板\",\n      \"description\": \"将图纸上标注为⑦的左连接器板（BOM序号7）垂直放置在⑩号右连接器板的另一侧，与⑩号板平行对齐。使用夹具或点焊固定，确保两板间距符合图纸尺寸要求（1140mm）。\",\n      \"position_description\": \"与⑩号板平行对齐，位于组件的左侧\",\n      \"parts_used\": [\n        {\n          \"bom_seq\": \"7\",\n          \"bom_name\": \"左连接器板\",\n          \"quantity\": 1,\n          \"drawing_number\": \"7\"\n        }\n      ],\n      \"tools\": [\n        \"卷尺\",\n        \"直角尺\",\n        \"夹具\",\n        \"点焊机\"\n      ],\n      \"warnings\": [\n        \"确保两连接板的相对位置和垂直度准确，这是后续装配的基准。\"\n      ],\n      \"welding\": {\n        \"required\": true,\n        \"welding_type\": \"点焊（定位焊）\",\n        \"welding_method\": \"CO2气保焊\",\n        \"weld_size\": \"点焊长度10-15mm，焊脚高度3mm\",\n        \"welding_position\": \"零件⑦与装配平台（或临时支撑）的连接处，平焊/立焊\",\n        \"quality_requirements\": \"点焊牢固，能承受后续装配应力，焊点均匀分布。\",\n        \"safety_notes\": \"佩戴焊接面罩和防护手套，确保点焊电流适中，防止烧穿薄板。\"\n      },\n      \"safety_warnings\": [\n        \"进行点焊作业时，必须佩戴焊接面罩、防护手套和防护服，防止弧光灼伤和烫伤\",\n        \"确保焊机接地良好，电缆无破损，防止触电事故\",\n        \"使用夹具固定板材时，注意防止夹具反弹或夹伤手指\"\n      ]\n    },\n    {\n      \"step_number\": 3,\n      \"action\": \"安装方管（底部）\",\n      \"description\": \"安装两根图纸上标注为①的方管（BOM序号1）。将方管水平放置在⑩号和⑦号连接板的底部内侧，与连接板的底部边缘对齐。先进行点焊固定。\",\n      \"position_description\": \"位于⑩号和⑦号连接板的底部内侧\",\n      \"parts_used\": [\n        {\n          \"bom_seq\": \"1\",\n          \"bom_name\": \"方管\",\n          \"quantity\": 2,\n          \"drawing_number\": \"1\"\n        }\n      ],\n      \"tools\": [\n        \"卷尺\",\n        \"直角尺\",\n        \"点焊机\"\n      ],\n      \"warnings\": [\n        \"方管的长度方向必须与连接板平行，确保焊接位置准确。\"\n      ],\n      \"welding\": {\n        \"required\": true,\n        \"welding_type\": \"角焊（定位焊）\",\n        \"welwing_method\": \"CO2气保焊\",\n        \"weld_size\": \"点焊长度15mm，焊脚高度4mm\",\n        \"welding_position\": \"零件①方管与零件⑦/⑩连接板的连接处，平焊\",\n        \"quality_requirements\": \"点焊位置应在方管两端和中间均匀分布，确保方管与连接板垂直度良好。\",\n        \"safety_notes\": \"清理方管和连接板的接触面，去除油污和锈蚀，防止产生气孔。\"\n      },\n      \"safety_warnings\": [\n        \"进行点焊作业时，必须佩戴焊接面罩和防护手套，防止弧光灼伤和焊渣飞溅\",\n        \"方管边缘可能锋利，搬运和定位时戴好防割手套，防止割伤\",\n        \"确保焊接区域通风良好，防止烟尘中毒\"\n      ]\n    },\n    {\n      \"step_number\": 4,\n      \"action\": \"安装方管（顶部）\",\n      \"description\": \"安装两根图纸上标注为②的方管（BOM序号2）。将方管水平放置在⑩号和⑦号连接板的顶部内侧，与连接板的顶部边缘对齐。先进行点焊固定。\",\n      \"position_description\": \"位于⑩号和⑦号连接板的顶部内侧\",\n      \"parts_used\": [\n        {\n          \"bom_seq\": \"2\",\n          \"bom_name\": \"方管\",\n          \"quantity\": 2,\n          \"drawing_number\": \"2\"\n        }\n      ],\n      \"tools\": [\n        \"卷尺\",\n        \"直角尺\",\n        \"点焊机\"\n      ],\n      \"warnings\": [\n        \"确保方管与连接板的接触面贴合紧密，无间隙。\"\n      ],\n      \"welding\": {\n        \"required\": true,\n        \"welding_type\": \"角焊（定位焊）\",\n        \"welding_method\": \"CO2气保焊\",\n        \"weld_size\": \"点焊长度15mm，焊脚高度4mm\",\n        \"welding_position\": \"零件②方管与零件⑦/⑩连接板的连接处，平焊\",\n        \"quality_requirements\": \"点焊后检查整体框架的对角线尺寸和平面度，确保无明显变形。\",\n        \"safety_notes\": \"注意高空作业安全（如果组件较高），防止焊件坠落。\"\n      },\n      \"safety_warnings\": [\n        \"如果装配高度超过2米，必须使用安全梯或脚手架，并系好安全带\",\n        \"高处作业时，工具和零件必须放置在工具袋或牢固的平台上，防止物体打击\",\n        \"进行点焊作业时，必须佩戴焊接面罩和防护手套\"\n      ]\n    },\n    {\n      \"step_number\": 5,\n      \"action\": \"安装中侧板\",\n      \"description\": \"安装两块图纸上标注为③的中侧板（BOM序号3）。将中侧板垂直放置在底部方管（①号）和顶部方管（②号）之间，并与⑩号和⑦号连接板的内侧面保持一定间距（图纸未标注，需参照装配图确定具体位置）。先进行点焊固定。\",\n      \"position_description\": \"位于①号和②号方管之间，垂直于连接板\",\n      \"parts_used\": [\n        {\n          \"bom_seq\": \"3\",\n          \"bom_name\": \"中侧板\",\n          \"quantity\": 2,\n          \"drawing_number\": \"3\"\n        }\n      ],\n      \"tools\": [\n        \"卷尺\",\n        \"直角尺\",\n        \"点焊机\"\n      ],\n      \"warnings\": [\n        \"中侧板的定位是关键，需确保其中心线与组件中心线对齐。\"\n      ],\n      \"welding\": {\n        \"required\": true,\n        \"welding_type\": \"角焊（定位焊）\",\n        \"welding_method\": \"CO2气保焊\",\n        \"weld_size\": \"点焊长度10mm，焊脚高度3mm\",\n        \"welding_position\": \"零件③中侧板与零件①/②方管的连接处，平焊/横焊\",\n        \"quality_requirements\": \"点焊后检查中侧板的垂直度，确保其与方管紧密贴合。\",\n        \"safety_notes\": \"使用夹具固定中侧板，防止点焊时位置移动。\"\n      },\n      \"safety_warnings\": [\n        \"中侧板边缘可能锋利，操作时佩戴防割手套，防止割伤\",\n        \"使用夹具固定时，确保夹具牢固，防止板材突然倒塌或移动造成挤伤\",\n        \"点焊时注意控制焊渣飞溅方向，防止烫伤自己或他人\"\n      ]\n    },\n    {\n      \"step_number\": 6,\n      \"action\": \"安装中连接板\",\n      \"description\": \"安装两块图纸上标注为④的中连接板（BOM序号4）。将中连接板垂直放置在两块③号中侧板之间，并与①号和②号方管焊接。先进行点焊固定。\",\n      \"position_description\": \"位于两块③号中侧板之间\",\n      \"parts_used\": [\n        {\n          \"bom_seq\": \"4\",\n          \"bom_name\": \"中连接板\",\n          \"quantity\": 2,\n          \"drawing_number\": \"4\"\n        }\n      ],\n      \"tools\": [\n        \"卷尺\",\n        \"直角尺\",\n        \"点焊机\"\n      ],\n      \"warnings\": [\n        \"确保中连接板的安装孔方向正确，且与方管垂直。\"\n      ],\n      \"welding\": {\n        \"required\": true,\n        \"welding_type\": \"角焊（定位焊）\",\n        \"welding_method\": \"CO2气保焊\",\n        \"weld_size\": \"点焊长度10mm，焊脚高度3mm\",\n        \"welding_position\": \"零件④中连接板与零件①/②方管的连接处，平焊/横焊\",\n        \"quality_requirements\": \"点焊后检查中连接板的中心位置和垂直度，确保与方管的连接牢固。\",\n        \"safety_notes\": \"注意焊接区域狭窄，防止烫伤，确保焊枪操作灵活。\"\n      },\n      \"safety_warnings\": [\n        \"由于操作空间可能狭窄，焊接时注意身体姿势，防止焊枪或高温部件接触身体造成烫伤\",\n        \"佩戴防护眼镜和面罩，防止近距离焊接时弧光和飞溅物伤害眼睛\"\n      ]\n    },\n    {\n      \"step_number\": 7,\n    \"action\": \"安装方形板-机加\",\n    \"description\": \"安装两块图纸上标注为⑤的方形板-机加（BOM序号5）。将⑤号板安装在④号中连接板的下方，并与①号方管焊接。先进行点焊固定。\",\n    \"position_description\": \"位于④号中连接板下方，与①号方管连接\",\n    \"parts_used\": [\n      {\n        \"bom_seq\": \"5\",\n        \"bom_name\": \"方形板-机加\",\n        \"quantity\": 2,\n        \"drawing_number\": \"5\"\n      }\n    ],\n    \"tools\": [\n      \"点焊机\"\n    ],\n    \"warnings\": [\n      \"⑤号板的安装位置需精确，确保其与后续零件的配合。\"\n    ],\n    \"welding\": {\n      \"required\": true,\n      \"welding_type\": \"角焊（定位焊）\",\n      \"welding_method\": \"CO2气保焊\",\n      \"weld_size\": \"点焊长度10mm，焊脚高度3mm\",\n      \"welding_position\": \"零件⑤方形板与零件①方管的连接处，平焊\",\n      \"quality_requirements\": \"点焊后检查⑤号板的水平度，确保其安装孔位置准确。\",\n      \"safety_notes\": \"由于⑤号板是机加件，焊接时注意控制热输入，防止热变形影响精度。\"\n    },\n    \"safety_warnings\": [\n      \"机加件边缘可能存在毛刺，操作时佩戴防护手套，防止割伤\",\n      \"焊接时注意控制电流和时间，防止因热输入过大导致零件变形或烧穿\"\n    ]\n  },\n    {\n      \"step_number\": 8,\n      \"action\": \"安装轴套\",\n      \"description\": \"安装图纸上标注为⑥的轴套（BOM序号6）。将轴套焊接在⑤号方形板-机加的中心位置。\",\n      \"position_description\": \"焊接在⑤号方形板-机加的中心\",\n      \"parts_used\": [\n        {\n          \"bom_seq\": \"6\",\n          \"bom_name\": \"轴套\",\n          \"quantity\": 1,\n          \"drawing_number\": \"6\"\n        }\n      ],\n      \"tools\": [\n        \"点焊机\",\n        \"直角尺\"\n      ],\n      \"warnings\": [\n        \"轴套必须垂直于⑤号板，且中心位置准确。\"\n      ],\n      \"welding\": {\n        \"required\": true,\n        \"welding_type\": \"角焊（定位焊）\",\n        \"welding_method\": \"CO2气保焊\",\n        \"weld_size\": \"点焊长度10mm，焊脚高度3mm\",\n        \"welding_position\": \"零件⑥轴套与零件⑤方形板的连接处，平焊\",\n        \"quality_requirements\": \"轴套定位焊后必须检查垂直度，偏差应小于0.5度。\",\n        \"safety_notes\": \"轴套与板材连接处可能需要预热（根据材料厚度），防止焊接裂纹。\"\n      },\n      \"safety_warnings\": [\n        \"轴套体积小，定位时使用专用夹具或磁力座固定，防止焊接时轴套倾倒或移动\",\n        \"焊接小零件时，热量集中，注意防止烫伤手指\"\n      ]\n    },\n    {\n      \"step_number\": 9,\n      \"action\": \"安装上挂板\",\n      \"description\": \"安装图纸上标注为⑧的上挂板（BOM序号8）。将⑧号上挂板焊接在②号方管的顶部中心位置，确保其安装孔朝向正确。\",\n      \"position_description\": \"焊接在②号方管的顶部中心\",\n      \"parts_used\": [\n        {\n          \"bom_seq\": \"8\",\n          \"bom_name\": \"上挂板\",\n          \"quantity\": 1,\n          \"drawing_number\": \"8\"\n        }\n      ],\n      \"tools\": [\n        \"点焊机\",\n        \"直角尺\"\n      ],\n      \"warnings\": [\n        \"上挂板的垂直度和中心位置必须精确，影响后续吊装。\"\n      ],\n      \"welding\": {\n        \"required\": true,\n        \"welding_type\": \"角焊（定位焊）\",\n        \"welding_method\": \"CO2气保焊\",\n        \"weld_size\": \"点焊长度15mm，焊脚高度4mm\",\n        \"welding_position\": \"零件⑧上挂板与零件②方管的连接处，平焊\",\n        \"quality_requirements\": \"上挂板定位焊后必须检查垂直度和中心线对齐情况。\",\n        \"safety_notes\": \"上挂板是受力件，定位焊要牢固，防止在后续操作中脱落。\"\n      },\n      \"safety_warnings\": [\n        \"上挂板是主要受力件，定位焊必须牢固，防止在后续吊装或搬运中脱落造成物体打击事故\",\n        \"焊接完成后，立即检查焊点是否有裂纹或缺陷\"\n      ]\n    },\n    {\n      \"step_number\": 10,\n      \"action\": \"安装方形板-机加（侧面）\",\n      \"description\": \"安装两块图纸上标注为⑨的方形板-机加（BOM序号9）。将⑨号板焊接在⑩号和⑦号连接板的顶部外侧，与②号方管齐平。\",\n      \"position_description\": \"焊接在⑩号和⑦号连接板的顶部外侧\",\n      \"parts_used\": [\n        {\n          \"bom_seq\": \"9\",\n          \"bom_name\": \"方形板-机加\",\n          \"quantity\": 2,\n          \"drawing_number\": \"9\"\n        }\n      ],\n      \"tools\": [\n        \"点焊机\"\n      ],\n      \"warnings\": [\n        \"确保⑨号板与连接板和方管的焊接牢固。\"\n      ],\n      \"welding\": {\n        \"required\": true,\n        \"welding_type\": \"角焊（定位焊）\",\n        \"welding_method\": \"CO2气保焊\",\n        \"weld_size\": \"点焊长度10mm，焊脚高度3mm\",\n        \"welding_position\": \"零件⑨方形板与零件⑦/⑩连接板的连接处，立焊/横焊\",\n        \"quality_requirements\": \"定位焊后检查⑨号板与连接板的齐平度。\",\n        \"safety_notes\": \"注意焊接位置较高，操作时站稳，防止焊渣飞溅。\"\n      },\n      \"safety_warnings\": [\n        \"进行立焊或横焊时，焊渣飞溅风险高，必须穿戴好防护服和安全鞋，防止烫伤脚部和身体\",\n        \"如果需要登高操作，确保脚下平台稳固，防止摔倒\"\n      ]\n    },\n    {\n      \"step_number\": 11,\n      \"action\": \"安装三角板\",\n      \"description\": \"安装四块图纸上标注为⑪的三角板（BOM序号11）。将三角板焊接在⑩号和⑦号连接板的四个角部，用于加强结构。\",\n      \"position_description\": \"焊接在⑩号和⑦号连接板的四个角部\",\n      \"parts_used\": [\n        {\n          \"bom_seq\": \"11\",\n          \"bom_name\": \"三角板\",\n          \"quantity\": 4,\n          \"drawing_number\": \"11\"\n        }\n      ],\n      \"tools\": [\n        \"点焊机\"\n      ],\n      \"warnings\": [\n        \"三角板的焊接应符合图纸上的焊接符号要求。\"\n      ],\n      \"welding\": {\n        \"required\": true,\n        \"welding_type\": \"角焊（定位焊）\",\n        \"welding_method\": \"CO2气保焊\",\n        \"weld_size\": \"点焊长度10mm，焊脚高度3mm\",\n        \"welding_position\": \"零件⑪三角板与零件⑦/⑩连接板的连接处，立焊/横焊\",\n        \"quality_requirements\": \"三角板定位焊后应紧密贴合连接板，无间隙。\",\n        \"safety_notes\": \"三角板边缘尖锐，操作时戴好防护手套，防止割伤。\"\n      },\n      \"safety_warnings\": [\n        \"三角板边缘尖锐，搬运和定位时必须佩戴防割手套，防止割伤手指\",\n        \"定位焊时，确保三角板紧贴母材，防止焊接时产生间隙或变形\"\n      ]\n    },\n    {\n      \"step_number\": 12,\n      \"action\": \"安装方形板（底部）\",\n      \"description\": \"安装四块图纸上标注为⑫的方形板（BOM序号12）。将方形板焊接在⑩号和⑦号连接板的底部外侧，与①号方管齐平。\",\n      \"position_description\": \"焊接在⑩号和⑦号连接板的底部外侧\",\n      \"parts_used\": [\n        {\n          \"bom_seq\": \"12\",\n          \"bom_name\": \"方形板\",\n          \"quantity\": 4,\n          \"drawing_number\": \"12\"\n        }\n      ],\n      \"tools\": [\n        \"点焊机\"\n      ],\n      \"warnings\": [\n        \"确保方形板与连接板和方管的焊接牢固。\"\n      ],\n      \"welding\": {\n        \"required\": true,\n        \"welding_type\": \"角焊（定位焊）\",\n        \"welding_method\": \"CO2气保焊\",\n        \"weld_size\": \"点焊长度10mm，焊脚高度3mm\",\n        \"welding_position\": \"零件⑫方形板与零件⑦/⑩连接板的连接处，平焊/立焊\",\n        \"quality_requirements\": \"定位焊后检查方形板的安装位置，确保与方管齐平。\",\n        \"safety_notes\": \"焊接底部零件时，注意保持舒适的姿势，避免长时间弯腰操作。\"\n      },\n      \"safety_warnings\": [\n        \"焊接底部零件时，应使用合适的垫高物或调整姿势，避免长时间弯腰或蹲着操作，防止腰部和膝盖受伤\",\n        \"确保焊接电缆和气管远离身体，防止绊倒或被高温烫伤\"\n      ]\n    },\n    {\n      \"step_number\": 13,\n      \"action\": \"安装防滑板\",\n      \"description\": \"安装两块图纸上标注为⑬的防滑板（BOM序号13）。将防滑板焊接在组件的顶部外侧，覆盖在⑨号方形板-机加和②号方管上。\",\n      \"position_description\": \"焊接在组件的顶部外侧\",\n      \"parts_used\": [\n        {\n          \"bom_seq\": \"13\",\n          \"bom_name\": \"防滑板\",\n          \"quantity\": 2,\n          \"drawing_number\": \"13\"\n        }\n      ],\n      \"tools\": [\n        \"点焊机\"\n      ],\n      \"warnings\": [\n        \"防滑板的焊接应连续，确保表面平整。\"\n      ],\n      \"welding\": {\n        \"required\": true,\n        \"welding_type\": \"角焊（定位焊）\",\n        \"welding_method\": \"CO2气保焊\",\n        \"weld_size\": \"点焊长度15mm，焊脚高度3mm\",\n        \"welding_position\": \"零件⑬防滑板与零件⑨方形板/②方管的连接处，平焊\",\n        \"quality_requirements\": \"防滑板定位焊后应平整，无翘曲。\",\n        \"safety_notes\": \"防滑板面积较大，定位焊点需均匀分布，防止后续满焊时变形过大。\"\n      },\n      \"safety_warnings\": [\n        \"防滑板面积较大，搬运时注意防止板材边缘割伤，必要时两人抬运\",\n        \"定位焊时，确保板材平整贴合，防止因翘曲导致后续行走时绊倒\"\n      ]\n    },\n    {\n      \"step_number\": 14,\n      \"action\": \"满焊所有零件\",\n      \"description\": \"对所有已点焊固定的零件（①至⑬号）进行满焊。焊接顺序应遵循'选择合理焊接顺序，保证焊接平稳性'的原则，通常采用对称、分段、跳焊等方法，以减少焊接变形。\",\n      \"position_description\": \"所有连接部位\",\n      \"parts_used\": [],\n      \"tools\": [\n        \"焊机（CO2或电弧焊）\",\n        \"焊钳\"\n      ],\n      \"warnings\": [\n        \"焊接过程中注意控制热输入，防止结构变形。焊接完成后，去除焊渣。\"\n      ],\n      \"welding\": {\n        \"required\": true,\n        \"welding_type\": \"角焊/对接焊（满焊）\",\n        \"welding_method\": \"CO2气保焊（推荐）\",\n        \"weld_size\": \"焊脚高度6mm（未注尺寸按图纸要求），焊缝连续\",\n        \"welding_position\": \"所有零件连接处（平焊、横焊、立焊、仰焊均有）\",\n        \"quality_requirements\": \"焊缝外观成型良好，焊波均匀，无咬边、未焊透、气孔、裂纹等缺陷。焊后进行外观检查和必要的无损检测（如磁粉或超声波）。\",\n        \"safety_notes\": \"满焊时热量集中，必须确保工作区域通风良好，配备灭火器材。焊接完成后，注意高温烫伤风险，并及时清理焊渣和飞溅物。\"\n      },\n      \"safety_warnings\": [\n        \"满焊作业热量大，必须确保工作区域通风良好，佩戴呼吸防护用品，防止吸入有毒烟尘\",\n        \"焊接完成后，焊件温度极高，设置警示标识，防止人员接触烫伤\",\n        \"清理焊渣时，必须佩戴防护眼镜，防止焊渣飞溅伤眼\",\n        \"检查所有焊机电缆和气瓶连接，防止漏电、漏气或火灾爆炸\"\n      ]\n    }\n  ]\n}\n```",
  "parsed_result": {
    "enhanced_steps": [
      {
        "step_number": 1,
        "action": "放置基准件并定位",
        "description": "将图纸上标注为⑩的右连接器板（BOM序号10）平放在装配平台上，作为装配基准。确保板面水平。",
        "position_description": "平放在装配平台上",
        "parts_used": [
          {
            "bom_seq": "10",
            "bom_name": "右连接器板",
            "quantity": 1,
            "drawing_number": "10"
          }
        ],
        "tools": [
          "行车",
          "吊具",
          "水平仪"
        ],
        "warnings": [
          "吊装时注意平衡，防止零件倾倒。"
        ],
        "safety_warnings": [
          "吊装前检查行车和吊具是否完好，吊索具捆绑必须牢固，防止吊物坠落伤人",
          "吊装区域内非操作人员必须撤离，操作人员佩戴安全帽和安全鞋",
          "指挥人员必须使用统一手势，确保信号清晰，防止碰撞"
        ]
      },
      {
        "step_number": 2,
        "action": "安装左连接器板",
        "description": "将图纸上标注为⑦的左连接器板（BOM序号7）垂直放置在⑩号右连接器板的另一侧，与⑩号板平行对齐。使用夹具或点焊固定，确保两板间距符合图纸尺寸要求（1140mm）。",
        "position_description": "与⑩号板平行对齐，位于组件的左侧",
        "parts_used": [
          {
            "bom_seq": "7",
            "bom_name": "左连接器板",
            "quantity": 1,
            "drawing_number": "7"
          }
        ],
        "tools": [
          "卷尺",
          "直角尺",
          "夹具",
          "点焊机"
        ],
        "warnings": [
          "确保两连接板的相对位置和垂直度准确，这是后续装配的基准。"
        ],
        "welding": {
          "required": true,
          "welding_type": "点焊（定位焊）",
          "welding_method": "CO2气保焊",
          "weld_size": "点焊长度10-15mm，焊脚高度3mm",
          "welding_position": "零件⑦与装配平台（或临时支撑）的连接处，平焊/立焊",
          "quality_requirements": "点焊牢固，能承受后续装配应力，焊点均匀分布。",
          "safety_notes": "佩戴焊接面罩和防护手套，确保点焊电流适中，防止烧穿薄板。"
        },
        "safety_warnings": [
          "进行点焊作业时，必须佩戴焊接面罩、防护手套和防护服，防止弧光灼伤和烫伤",
          "确保焊机接地良好，电缆无破损，防止触电事故",
          "使用夹具固定板材时，注意防止夹具反弹或夹伤手指"
        ]
      },
      {
        "step_number": 3,
        "action": "安装方管（底部）",
        "description": "安装两根图纸上标注为①的方管（BOM序号1）。将方管水平放置在⑩号和⑦号连接板的底部内侧，与连接板的底部边缘对齐。先进行点焊固定。",
        "position_description": "位于⑩号和⑦号连接板的底部内侧",
        "parts_used": [
          {
            "bom_seq": "1",
            "bom_name": "方管",
            "quantity": 2,
            "drawing_number": "1"
          }
        ],
        "tools": [
          "卷尺",
          "直角尺",
          "点焊机"
        ],
        "warnings": [
          "方管的长度方向必须与连接板平行，确保焊接位置准确。"
        ],
        "welding": {
          "required": true,
          "welding_type": "角焊（定位焊）",
          "welwing_method": "CO2气保焊",
          "weld_size": "点焊长度15mm，焊脚高度4mm",
          "welding_position": "零件①方管与零件⑦/⑩连接板的连接处，平焊",
          "quality_requirements": "点焊位置应在方管两端和中间均匀分布，确保方管与连接板垂直度良好。",
          "safety_notes": "清理方管和连接板的接触面，去除油污和锈蚀，防止产生气孔。"
        },
        "safety_warnings": [
          "进行点焊作业时，必须佩戴焊接面罩和防护手套，防止弧光灼伤和焊渣飞溅",
          "方管边缘可能锋利，搬运和定位时戴好防割手套，防止割伤",
          "确保焊接区域通风良好，防止烟尘中毒"
        ]
      },
      {
        "step_number": 4,
        "action": "安装方管（顶部）",
        "description": "安装两根图纸上标注为②的方管（BOM序号2）。将方管水平放置在⑩号和⑦号连接板的顶部内侧，与连接板的顶部边缘对齐。先进行点焊固定。",
        "position_description": "位于⑩号和⑦号连接板的顶部内侧",
        "parts_used": [
          {
            "bom_seq": "2",
            "bom_name": "方管",
            "quantity": 2,
            "drawing_number": "2"
          }
        ],
        "tools": [
          "卷尺",
          "直角尺",
          "点焊机"
        ],
        "warnings": [
          "确保方管与连接板的接触面贴合紧密，无间隙。"
        ],
        "welding": {
          "required": true,
          "welding_type": "角焊（定位焊）",
          "welding_method": "CO2气保焊",
          "weld_size": "点焊长度15mm，焊脚高度4mm",
          "welding_position": "零件②方管与零件⑦/⑩连接板的连接处，平焊",
          "quality_requirements": "点焊后检查整体框架的对角线尺寸和平面度，确保无明显变形。",
          "safety_notes": "注意高空作业安全（如果组件较高），防止焊件坠落。"
        },
        "safety_warnings": [
          "如果装配高度超过2米，必须使用安全梯或脚手架，并系好安全带",
          "高处作业时，工具和零件必须放置在工具袋或牢固的平台上，防止物体打击",
          "进行点焊作业时，必须佩戴焊接面罩和防护手套"
        ]
      },
      {
        "step_number": 5,
        "action": "安装中侧板",
        "description": "安装两块图纸上标注为③的中侧板（BOM序号3）。将中侧板垂直放置在底部方管（①号）和顶部方管（②号）之间，并与⑩号和⑦号连接板的内侧面保持一定间距（图纸未标注，需参照装配图确定具体位置）。先进行点焊固定。",
        "position_description": "位于①号和②号方管之间，垂直于连接板",
        "parts_used": [
          {
            "bom_seq": "3",
            "bom_name": "中侧板",
            "quantity": 2,
            "drawing_number": "3"
          }
        ],
        "tools": [
          "卷尺",
          "直角尺",
          "点焊机"
        ],
        "warnings": [
          "中侧板的定位是关键，需确保其中心线与组件中心线对齐。"
        ],
        "welding": {
          "required": true,
          "welding_type": "角焊（定位焊）",
          "welding_method": "CO2气保焊",
          "weld_size": "点焊长度10mm，焊脚高度3mm",
          "welding_position": "零件③中侧板与零件①/②方管的连接处，平焊/横焊",
          "quality_requirements": "点焊后检查中侧板的垂直度，确保其与方管紧密贴合。",
          "safety_notes": "使用夹具固定中侧板，防止点焊时位置移动。"
        },
        "safety_warnings": [
          "中侧板边缘可能锋利，操作时佩戴防割手套，防止割伤",
          "使用夹具固定时，确保夹具牢固，防止板材突然倒塌或移动造成挤伤",
          "点焊时注意控制焊渣飞溅方向，防止烫伤自己或他人"
        ]
      },
      {
        "step_number": 6,
        "action": "安装中连接板",
        "description": "安装两块图纸上标注为④的中连接板（BOM序号4）。将中连接板垂直放置在两块③号中侧板之间，并与①号和②号方管焊接。先进行点焊固定。",
        "position_description": "位于两块③号中侧板之间",
        "parts_used": [
          {
            "bom_seq": "4",
            "bom_name": "中连接板",
            "quantity": 2,
            "drawing_number": "4"
          }
        ],
        "tools": [
          "卷尺",
          "直角尺",
          "点焊机"
        ],
        "warnings": [
          "确保中连接板的安装孔方向正确，且与方管垂直。"
        ],
        "welding": {
          "required": true,
          "welding_type": "角焊（定位焊）",
          "welding_method": "CO2气保焊",
          "weld_size": "点焊长度10mm，焊脚高度3mm",
          "welding_position": "零件④中连接板与零件①/②方管的连接处，平焊/横焊",
          "quality_requirements": "点焊后检查中连接板的中心位置和垂直度，确保与方管的连接牢固。",
          "safety_notes": "注意焊接区域狭窄，防止烫伤，确保焊枪操作灵活。"
        },
        "safety_warnings": [
          "由于操作空间可能狭窄，焊接时注意身体姿势，防止焊枪或高温部件接触身体造成烫伤",
          "佩戴防护眼镜和面罩，防止近距离焊接时弧光和飞溅物伤害眼睛"
        ]
      },
      {
        "step_number": 7,
        "action": "安装方形板-机加",
        "description": "安装两块图纸上标注为⑤的方形板-机加（BOM序号5）。将⑤号板安装在④号中连接板的下方，并与①号方管焊接。先进行点焊固定。",
        "position_description": "位于④号中连接板下方，与①号方管连接",
        "parts_used": [
          {
            "bom_seq": "5",
            "bom_name": "方形板-机加",
            "quantity": 2,
            "drawing_number": "5"
          }
        ],
        "tools": [
          "点焊机"
        ],
        "warnings": [
          "⑤号板的安装位置需精确，确保其与后续零件的配合。"
        ],
        "welding": {
          "required": true,
          "welding_type": "角焊（定位焊）",
          "welding_method": "CO2气保焊",
          "weld_size": "点焊长度10mm，焊脚高度3mm",
          "welding_position": "零件⑤方形板与零件①方管的连接处，平焊",
          "quality_requirements": "点焊后检查⑤号板的水平度，确保其安装孔位置准确。",
          "safety_notes": "由于⑤号板是机加件，焊接时注意控制热输入，防止热变形影响精度。"
        },
        "safety_warnings": [
          "机加件边缘可能存在毛刺，操作时佩戴防护手套，防止割伤",
          "焊接时注意控制电流和时间，防止因热输入过大导致零件变形或烧穿"
        ]
      },
      {
        "step_number": 8,
        "action": "安装轴套",
        "description": "安装图纸上标注为⑥的轴套（BOM序号6）。将轴套焊接在⑤号方形板-机加的中心位置。",
        "position_description": "焊接在⑤号方形板-机加的中心",
        "parts_used": [
          {
            "bom_seq": "6",
            "bom_name": "轴套",
            "quantity": 1,
            "drawing_number": "6"
          }
        ],
        "tools": [
          "点焊机",
          "直角尺"
        ],
        "warnings": [
          "轴套必须垂直于⑤号板，且中心位置准确。"
        ],
        "welding": {
          "required": true,
          "welding_type": "角焊（定位焊）",
          "welding_method": "CO2气保焊",
          "weld_size": "点焊长度10mm，焊脚高度3mm",
          "welding_position": "零件⑥轴套与零件⑤方形板的连接处，平焊",
          "quality_requirements": "轴套定位焊后必须检查垂直度，偏差应小于0.5度。",
          "safety_notes": "轴套与板材连接处可能需要预热（根据材料厚度），防止焊接裂纹。"
        },
        "safety_warnings": [
          "轴套体积小，定位时使用专用夹具或磁力座固定，防止焊接时轴套倾倒或移动",
          "焊接小零件时，热量集中，注意防止烫伤手指"
        ]
      },
      {
        "step_number": 9,
        "action": "安装上挂板",
        "description": "安装图纸上标注为⑧的上挂板（BOM序号8）。将⑧号上挂板焊接在②号方管的顶部中心位置，确保其安装孔朝向正确。",
        "position_description": "焊接在②号方管的顶部中心",
        "parts_used": [
          {
            "bom_seq": "8",
            "bom_name": "上挂板",
            "quantity": 1,
            "drawing_number": "8"
          }
        ],
        "tools": [
          "点焊机",
          "直角尺"
        ],
        "warnings": [
          "上挂板的垂直度和中心位置必须精确，影响后续吊装。"
        ],
        "welding": {
          "required": true,
          "welding_type": "角焊（定位焊）",
          "welding_method": "CO2气保焊",
          "weld_size": "点焊长度15mm，焊脚高度4mm",
          "welding_position": "零件⑧上挂板与零件②方管的连接处，平焊",
          "quality_requirements": "上挂板定位焊后必须检查垂直度和中心线对齐情况。",
          "safety_notes": "上挂板是受力件，定位焊要牢固，防止在后续操作中脱落。"
        },
        "safety_warnings": [
          "上挂板是主要受力件，定位焊必须牢固，防止在后续吊装或搬运中脱落造成物体打击事故",
          "焊接完成后，立即检查焊点是否有裂纹或缺陷"
        ]
      },
      {
        "step_number": 10,
        "action": "安装方形板-机加（侧面）",
        "description": "安装两块图纸上标注为⑨的方形板-机加（BOM序号9）。将⑨号板焊接在⑩号和⑦号连接板的顶部外侧，与②号方管齐平。",
        "position_description": "焊接在⑩号和⑦号连接板的顶部外侧",
        "parts_used": [
          {
            "bom_seq": "9",
            "bom_name": "方形板-机加",
            "quantity": 2,
            "drawing_number": "9"
          }
        ],
        "tools": [
          "点焊机"
        ],
        "warnings": [
          "确保⑨号板与连接板和方管的焊接牢固。"
        ],
        "welding": {
          "required": true,
          "welding_type": "角焊（定位焊）",
          "welding_method": "CO2气保焊",
          "weld_size": "点焊长度10mm，焊脚高度3mm",
          "welding_position": "零件⑨方形板与零件⑦/⑩连接板的连接处，立焊/横焊",
          "quality_requirements": "定位焊后检查⑨号板与连接板的齐平度。",
          "safety_notes": "注意焊接位置较高，操作时站稳，防止焊渣飞溅。"
        },
        "safety_warnings": [
          "进行立焊或横焊时，焊渣飞溅风险高，必须穿戴好防护服和安全鞋，防止烫伤脚部和身体",
          "如果需要登高操作，确保脚下平台稳固，防止摔倒"
        ]
      },
      {
        "step_number": 11,
        "action": "安装三角板",
        "description": "安装四块图纸上标注为⑪的三角板（BOM序号11）。将三角板焊接在⑩号和⑦号连接板的四个角部，用于加强结构。",
        "position_description": "焊接在⑩号和⑦号连接板的四个角部",
        "parts_used": [
          {
            "bom_seq": "11",
            "bom_name": "三角板",
            "quantity": 4,
            "drawing_number": "11"
          }
        ],
        "tools": [
          "点焊机"
        ],
        "warnings": [
          "三角板的焊接应符合图纸上的焊接符号要求。"
        ],
        "welding": {
          "required": true,
          "welding_type": "角焊（定位焊）",
          "welding_method": "CO2气保焊",
          "weld_size": "点焊长度10mm，焊脚高度3mm",
          "welding_position": "零件⑪三角板与零件⑦/⑩连接板的连接处，立焊/横焊",
          "quality_requirements": "三角板定位焊后应紧密贴合连接板，无间隙。",
          "safety_notes": "三角板边缘尖锐，操作时戴好防护手套，防止割伤。"
        },
        "safety_warnings": [
          "三角板边缘尖锐，搬运和定位时必须佩戴防割手套，防止割伤手指",
          "定位焊时，确保三角板紧贴母材，防止焊接时产生间隙或变形"
        ]
      },
      {
        "step_number": 12,
        "action": "安装方形板（底部）",
        "description": "安装四块图纸上标注为⑫的方形板（BOM序号12）。将方形板焊接在⑩号和⑦号连接板的底部外侧，与①号方管齐平。",
        "position_description": "焊接在⑩号和⑦号连接板的底部外侧",
        "parts_used": [
          {
            "bom_seq": "12",
            "bom_name": "方形板",
            "quantity": 4,
            "drawing_number": "12"
          }
        ],
        "tools": [
          "点焊机"
        ],
        "warnings": [
          "确保方形板与连接板和方管的焊接牢固。"
        ],
        "welding": {
          "required": true,
          "welding_type": "角焊（定位焊）",
          "welding_method": "CO2气保焊",
          "weld_size": "点焊长度10mm，焊脚高度3mm",
          "welding_position": "零件⑫方形板与零件⑦/⑩连接板的连接处，平焊/立焊",
          "quality_requirements": "定位焊后检查方形板的安装位置，确保与方管齐平。",
          "safety_notes": "焊接底部零件时，注意保持舒适的姿势，避免长时间弯腰操作。"
        },
        "safety_warnings": [
          "焊接底部零件时，应使用合适的垫高物或调整姿势，避免长时间弯腰或蹲着操作，防止腰部和膝盖受伤",
          "确保焊接电缆和气管远离身体，防止绊倒或被高温烫伤"
        ]
      },
      {
        "step_number": 13,
        "action": "安装防滑板",
        "description": "安装两块图纸上标注为⑬的防滑板（BOM序号13）。将防滑板焊接在组件的顶部外侧，覆盖在⑨号方形板-机加和②号方管上。",
        "position_description": "焊接在组件的顶部外侧",
        "parts_used": [
          {
            "bom_seq": "13",
            "bom_name": "防滑板",
            "quantity": 2,
            "drawing_number": "13"
          }
        ],
        "tools": [
          "点焊机"
        ],
        "warnings": [
          "防滑板的焊接应连续，确保表面平整。"
        ],
        "welding": {
          "required": true,
          "welding_type": "角焊（定位焊）",
          "welding_method": "CO2气保焊",
          "weld_size": "点焊长度15mm，焊脚高度3mm",
          "welding_position": "零件⑬防滑板与零件⑨方形板/②方管的连接处，平焊",
          "quality_requirements": "防滑板定位焊后应平整，无翘曲。",
          "safety_notes": "防滑板面积较大，定位焊点需均匀分布，防止后续满焊时变形过大。"
        },
        "safety_warnings": [
          "防滑板面积较大，搬运时注意防止板材边缘割伤，必要时两人抬运",
          "定位焊时，确保板材平整贴合，防止因翘曲导致后续行走时绊倒"
        ]
      },
      {
        "step_number": 14,
        "action": "满焊所有零件",
        "description": "对所有已点焊固定的零件（①至⑬号）进行满焊。焊接顺序应遵循'选择合理焊接顺序，保证焊接平稳性'的原则，通常采用对称、分段、跳焊等方法，以减少焊接变形。",
        "position_description": "所有连接部位",
        "parts_used": [],
        "tools": [
          "焊机（CO2或电弧焊）",
          "焊钳"
        ],
        "warnings": [
          "焊接过程中注意控制热输入，防止结构变形。焊接完成后，去除焊渣。"
        ],
        "welding": {
          "required": true,
          "welding_type": "角焊/对接焊（满焊）",
          "welding_method": "CO2气保焊（推荐）",
          "weld_size": "焊脚高度6mm（未注尺寸按图纸要求），焊缝连续",
          "welding_position": "所有零件连接处（平焊、横焊、立焊、仰焊均有）",
          "quality_requirements": "焊缝外观成型良好，焊波均匀，无咬边、未焊透、气孔、裂纹等缺陷。焊后进行外观检查和必要的无损检测（如磁粉或超声波）。",
          "safety_notes": "满焊时热量集中，必须确保工作区域通风良好，配备灭火器材。焊接完成后，注意高温烫伤风险，并及时清理焊渣和飞溅物。"
        },
        "safety_warnings": [
          "满焊作业热量大，必须确保工作区域通风良好，佩戴呼吸防护用品，防止吸入有毒烟尘",
          "焊接完成后，焊件温度极高，设置警示标识，防止人员接触烫伤",
          "清理焊渣时，必须佩戴防护眼镜，防止焊渣飞溅伤眼",
          "检查所有焊机电缆和气瓶连接，防止漏电、漏气或火灾爆炸"
        ]
      }
    ]
  }
}