{
  "agent_name": "Agent6_FAQ",
  "model": "google/gemini-2.5-flash-preview-09-2025",
  "timestamp": "20251104_142056",
  "image_count": 0,
  "temperature": 0.2,
  "system_prompt": "# 角色定位\n\n你是**李师傅**，一位拥有20年安全管理经验的高级安全工程师。\n\n## 教育背景\n\n- **学历**：安全工程专业本科\n- **职业资格**：注册安全工程师、高级安全评价师\n- **专业培训**：\n  - 机械制造安全管理\n  - 职业健康与安全管理体系（ISO 45001）\n  - 事故调查与分析\n  - 应急预案编制与演练\n\n## 职业背景\n\n- **工作经历**：20年机械制造企业安全管理经验，参与过大型装备制造、钢结构加工等项目\n- **专业领域**：\n  - 机械加工安全（车、铣、刨、磨、钻等）\n  - 焊接作业安全（电焊、气焊、氩弧焊等）\n  - 起重吊装安全（行车、叉车、吊索具等）\n  - 高空作业安全（脚手架、安全带、防坠落等）\n  - 个人防护用品管理（安全帽、防护眼镜、手套、安全鞋等）\n\n## 知识结构（详细）\n\n### 1. 机械伤害风险\n- **夹伤/挤伤**：手指、手臂被运动部件夹住\n- **切割伤**：锋利边缘、毛刺、切削工具\n- **碰撞伤**：头部碰撞、身体碰撞\n- **坠落伤**：零件坠落、工具坠落、人员坠落\n\n### 2. 焊接作业风险\n- **电击伤**：焊机漏电、接地不良\n- **弧光伤**：电弧紫外线灼伤眼睛和皮肤\n- **烫伤**：高温熔池、焊渣飞溅\n- **火灾爆炸**：易燃物引燃、气瓶泄漏\n- **有毒气体**：焊接烟尘、一氧化碳中毒\n\n### 3. 起重吊装风险\n- **吊物坠落**：吊索具断裂、捆绑不牢\n- **吊物摆动**：碰撞人员、设备\n- **超载**：超过起重机额定载荷\n- **指挥失误**：信号不清、违章指挥\n\n### 4. 高空作业风险\n- **人员坠落**：未系安全带、脚手架不牢\n- **物体打击**：工具、零件从高处坠落\n- **脚手架坍塌**：搭设不规范、超载\n\n### 5. 个人防护用品\n- **头部防护**：安全帽（防止碰撞、坠物打击）\n- **眼部防护**：防护眼镜、焊接面罩（防止飞溅、弧光）\n- **手部防护**：防护手套（防止切割、烫伤、化学品）\n- **足部防护**：安全鞋（防砸、防刺穿、防滑）\n- **呼吸防护**：防尘口罩、防毒面具（防止粉尘、有毒气体）\n\n### 6. 应急处理\n- **机械伤害**：立即停机、呼救、止血、固定、送医\n- **电击伤**：切断电源、心肺复苏、送医\n- **烫伤**：冷水冲洗、覆盖无菌纱布、送医\n- **火灾**：使用灭火器、疏散人员、报警\n\n## 任务步骤（Chain of Thought）\n\n你的任务是**为每个装配步骤添加安全警告**（如果该步骤有安全风险）。请按照以下5个步骤思考：\n\n### 步骤1：识别风险步骤\n- 分析每个装配步骤的操作内容\n- 判断是否涉及高风险作业（焊接、吊装、高空、重物搬运等）\n- 识别潜在的伤害类型（机械伤害、电击、烫伤、坠落等）\n\n### 步骤2：分析风险源\n- 确定风险的来源（设备、工具、材料、环境、人员操作等）\n- 评估风险的严重程度（轻微、中等、严重、致命）\n- 考虑风险的发生概率\n\n### 步骤3：制定预防措施\n- 针对每个风险源，制定具体的预防措施\n- 强调个人防护用品的使用\n- 强调安全操作规程的遵守\n\n### 步骤4：添加安全警告\n- 为每个有风险的步骤添加safety_warnings字段\n- 每条警告要简洁明了，说明具体的风险和预防措施\n- 使用工人能看懂的语言\n\n### 步骤5：验证完整性\n- 检查所有高风险步骤是否都添加了安全警告\n- 检查安全警告是否具体、可操作\n- 检查是否遗漏了任何潜在风险\n\n## 核心原则\n\n1. **步骤级嵌入**：为每个有风险的步骤添加safety_warnings字段，而不是单独列出安全警告\n2. **工人友好**：使用通俗语言，避免专业术语\n3. **具体可操作**：说明具体的风险和预防措施，而不是泛泛而谈\n4. **不重复显示**：安全警告只在下方\"安全\"标签页中统一显示，不在当前步骤详情中重复显示\n\n## 输出格式\n\n严格按照以下JSON格式输出（返回增强后的装配步骤）：\n\n```json\n{\n  \"enhanced_steps\": [\n    {\n      \"step_number\": 1,\n      \"title\": \"点焊定位\",\n      \"parts_used\": [...],\n      \"tools_required\": [...],\n      \"operation\": \"操作说明\",\n      \"quality_check\": \"质量检查\",\n      \"estimated_time_minutes\": 10,\n      \"welding\": {\n        \"required\": true,\n        \"welding_type\": \"点焊\",\n        \"welding_method\": \"CO2气保焊\",\n        ...\n      },\n      \"safety_warnings\": [\n        \"佩戴焊接面罩和防护手套，防止弧光灼伤眼睛和皮肤\",\n        \"确保工件夹紧牢固，防止点焊时位移造成伤害\",\n        \"焊接区域周围3米内不得有易燃物，配备灭火器\",\n        \"焊机必须接地良好，防止漏电触电\"\n      ]\n    },\n    {\n      \"step_number\": 2,\n      \"title\": \"螺栓连接\",\n      \"parts_used\": [...],\n      \"operation\": \"操作说明\",\n      \"quality_check\": \"质量检查\",\n      \"estimated_time_minutes\": 15,\n      \"safety_warnings\": [\n        \"佩戴安全帽和防护眼镜，防止零件坠落和飞溅\",\n        \"使用扭力扳手时注意力度，防止扳手滑脱伤人\"\n      ]\n    },\n    {\n      \"step_number\": 3,\n      \"title\": \"简单装配\",\n      \"parts_used\": [...],\n      \"operation\": \"操作说明\",\n      \"quality_check\": \"质量检查\",\n      \"estimated_time_minutes\": 5\n      // ⚠️ 如果没有明显安全风险，不添加safety_warnings字段\n    }\n  ]\n}\n```\n\n**⚠️ 关键要求**：\n\n1. **步骤级嵌入**：\n   - 为每个有风险的步骤添加`safety_warnings`字段\n   - 没有明显风险的步骤不添加`safety_warnings`字段\n   - 保持原有步骤的所有字段不变\n\n2. **安全警告要具体**：\n   - ✅ 说\"佩戴焊接面罩和防护手套，防止弧光灼伤眼睛和皮肤\"\n   - ❌ 不说\"注意安全\"\n   - ✅ 说\"焊接区域周围3米内不得有易燃物，配备灭火器\"\n   - ❌ 不说\"注意防火\"\n\n3. **使用通俗语言**：\n   - 工人能看懂的语言\n   - 避免专业术语和英文缩写\n\n4. **警告要全面**：\n   - 涵盖个人防护、设备安全、环境安全、操作安全\n   - 每条警告说明具体的风险和预防措施\n\n## 重要提醒\n\n- **只输出JSON，不要输出其他内容**\n- **保持原有字段不变**：不要修改或删除原有的字段（包括welding字段）\n- **警告要简洁明了**：每条警告一句话，说明风险和预防措施\n- **不要过度警告**：只针对有明显风险的步骤添加警告\n",
  "user_query": "请为以下装配步骤添加安全警告（如果有安全风险）。\n\n## 📸 视觉分析任务\n\n**你会看到工程图纸图片，请仔细观察：**\n\n1. **危险作业标识**：\n   - 图纸上的安全警告标识\n   - 特殊作业要求（如高空作业、吊装作业等）\n   - 危险区域标注\n\n2. **零件特征**：\n   - 重型零件（需要吊装）\n   - 锋利边缘（容易割伤）\n   - 高温部件（容易烫伤）\n\n3. **作业环境**：\n   - 狭窄空间（容易碰撞）\n   - 高空位置（容易坠落）\n   - 密闭空间（通风不良）\n\n## 装配步骤\n\n[\n  {\n    \"step_number\": 1,\n    \"action\": \"放置基准件\",\n    \"description\": \"将图纸上标注为③的方管-机加（01.02.03.0206）平稳放置在装配胎具上，作为整个组件的装配基准。确保方管水平。\",\n    \"position_description\": \"方管水平放置在胎具上，长边方向与胎具主轴对齐。\",\n    \"parts_used\": [\n      {\n        \"bom_seq\": \"3\",\n        \"bom_name\": \"方管-机加\",\n        \"quantity\": 1,\n        \"drawing_number\": \"3\",\n        \"node_name\": [\n          \"NAUO6\",\n          \"NAUO5\"\n        ],\n        \"bom_code\": \"01.01.4792\"\n      }\n    ],\n    \"tools\": [\n      \"行车\",\n      \"吊具\",\n      \"装配胎具\",\n      \"水平仪\"\n    ],\n    \"warnings\": [\n      \"方管较重（21.16kg），吊装时注意安全，确保吊具捆绑牢固。\"\n    ]\n  },\n  {\n    \"step_number\": 2,\n    \"action\": \"焊接悬挂臂板\",\n    \"description\": \"将图纸上标注为①的右悬挂臂板（01.02.01.3870）和②的左悬挂臂板（01.02.01.3871）分别安装到③号方管的两端。使用夹具定位，确保悬挂臂板的安装面与方管端面垂直且对齐。进行点焊固定。\",\n    \"position_description\": \"①号板安装在方管一端，②号板安装在方管另一端，确保方向正确。\",\n    \"parts_used\": [\n      {\n        \"bom_seq\": \"1\",\n        \"bom_name\": \"右悬挂臂板\",\n        \"quantity\": 1,\n        \"drawing_number\": \"1\",\n        \"node_name\": [\n          \"NAUO2\",\n          \"NAUO1\"\n        ],\n        \"bom_code\": \"01.01.03.0692\"\n      },\n      {\n        \"bom_seq\": \"2\",\n        \"bom_name\": \"左悬挂臂板\",\n        \"quantity\": 1,\n        \"drawing_number\": \"2\",\n        \"node_name\": [\n          \"NAUO4\",\n          \"NAUO3\"\n        ],\n        \"bom_code\": \"01.01.03.0693\"\n      }\n    ],\n    \"tools\": [\n      \"CO2焊机\",\n      \"角尺\",\n      \"夹具\"\n    ],\n    \"warnings\": [\n      \"点焊时注意焊接变形，点焊位置应均匀分布。\"\n    ],\n    \"welding\": {\n      \"required\": true,\n      \"welding_type\": \"角焊（定位焊）\",\n      \"welding_method\": \"CO2气保焊\",\n      \"weld_size\": \"点焊长度10-15mm，焊脚高度3mm\",\n      \"welding_position\": \"零件①/②与零件③的连接处，主要为平焊和横焊位置\",\n      \"quality_requirements\": \"点焊牢固，定位准确，焊点无明显气孔或裂纹，确保悬挂臂板与方管的垂直度。\",\n      \"safety_notes\": \"佩戴焊接面罩、防护手套和防护服。确保工作区域通风良好，防止烟尘吸入。\"\n    }\n  },\n  {\n    \"step_number\": 3,\n    \"action\": \"安装旋转弧板\",\n    \"description\": \"将图纸上标注为⑦的旋转弧板（01.02.01.3872）安装到③号方管的中部上方。根据图纸尺寸（617mm和600mm）定位，确保弧板的中心线与方管的中心线对齐。使用夹具固定后进行点焊。\",\n    \"position_description\": \"⑦号板安装在③号方管上表面中部，定位尺寸需精确。\",\n    \"parts_used\": [\n      {\n        \"bom_seq\": \"7\",\n        \"bom_name\": \"旋转弧板\",\n        \"quantity\": 2,\n        \"drawing_number\": \"7\",\n        \"node_name\": [\n          \"NAUO12\"\n        ],\n        \"bom_code\": \"01.01.01.1590\"\n      }\n    ],\n    \"tools\": [\n      \"卷尺\",\n      \"CO2焊机\",\n      \"夹具\"\n    ],\n    \"warnings\": [\n      \"旋转弧板是关键定位件，定位偏差不得超过±0.5mm。\"\n    ],\n    \"welding\": {\n      \"required\": true,\n      \"welding_type\": \"角焊（定位焊）\",\n      \"welding_method\": \"CO2气保焊\",\n      \"weld_size\": \"点焊长度10-15mm，焊脚高度3mm\",\n      \"welding_position\": \"零件⑦与零件③的连接处，平焊位置\",\n      \"quality_requirements\": \"定位焊点均匀分布，确保弧板中心线与方管中心线对齐，垂直度良好。\",\n      \"safety_notes\": \"焊接前清理弧板和方管接触面的油污和锈蚀，防止产生气孔。注意防飞溅。\"\n    }\n  },\n  {\n    \"step_number\": 4,\n    \"action\": \"安装角钢和方管加强件\",\n    \"description\": \"将图纸上标注为④的角钢（01.02.04.0084）和⑤的方管-机加（01.02.03.0207）安装到③号方管上。④号角钢安装在方管上表面，⑤号方管安装在⑦号旋转弧板下方，作为支撑。点焊固定。\",\n    \"position_description\": \"④号角钢安装在方管上表面，⑤号方管安装在⑦号板下方，与方管主体焊接。\",\n    \"parts_used\": [\n      {\n        \"bom_seq\": \"4\",\n        \"bom_name\": \"角钢\",\n        \"quantity\": 5,\n        \"drawing_number\": \"4\",\n        \"node_name\": [\n          \"NAUO8\",\n          \"NAUO7\"\n        ],\n        \"bom_code\": \"01.02.01.3875\"\n      },\n      {\n        \"bom_seq\": \"5\",\n        \"bom_name\": \"方管-机加\",\n        \"quantity\": 2,\n        \"drawing_number\": \"5\",\n        \"node_name\": [\n          \"NAUO10\"\n        ],\n        \"bom_code\": \"01.02.02.0446\"\n      }\n    ],\n    \"tools\": [\n      \"CO2焊机\",\n      \"角尺\"\n    ],\n    \"warnings\": [\n      \"确保所有角钢和方管与主体结构接触面紧密贴合，无间隙。\"\n    ],\n    \"welding\": {\n      \"required\": true,\n      \"welding_type\": \"角焊（定位焊）\",\n      \"welding_method\": \"CO2气保焊\",\n      \"weld_size\": \"点焊长度10mm，焊脚高度3mm\",\n      \"welding_position\": \"零件④/⑤与零件③/⑦的连接处，主要为平焊位置\",\n      \"quality_requirements\": \"定位焊点应能承受后续操作的应力，确保加强件与主体结构贴合紧密。\",\n      \"safety_notes\": \"检查焊机接地线是否牢固，防止触电。焊接时注意周围环境，避免火灾。\"\n    }\n  },\n  {\n    \"step_number\": 5,\n    \"action\": \"安装方形板和固定套\",\n    \"description\": \"将图纸上标注为⑥的方形板（01.01.01.4776）和⑧的固定套（01.02.05.0334）安装到组件的端部。⑥号方形板安装在②号左悬挂臂板的内侧，⑧号固定套安装在⑦号旋转弧板的中心孔位处。点焊固定。\",\n    \"position_description\": \"⑥号板安装在左侧悬挂臂板内侧，⑧号固定套安装在旋转弧板的中心孔。\",\n    \"parts_used\": [\n      {\n        \"bom_seq\": \"6\",\n        \"bom_name\": \"方形板\",\n        \"quantity\": 2,\n        \"drawing_number\": \"6\",\n        \"node_name\": [\n          \"NAUO11\"\n        ],\n        \"bom_code\": \"01.01.01.1589\"\n      },\n      {\n        \"bom_seq\": \"8\",\n        \"bom_name\": \"固定套\",\n        \"quantity\": 1,\n        \"drawing_number\": \"8\",\n        \"node_name\": [\n          \"NAUO15\",\n          \"NAUO13\"\n        ],\n        \"bom_code\": \"01.01.01.1593\"\n      }\n    ],\n    \"tools\": [\n      \"CO2焊机\",\n      \"游标卡尺\"\n    ],\n    \"warnings\": [\n      \"⑧号固定套的安装位置和垂直度要求高，需使用游标卡尺检查定位尺寸。\"\n    ],\n    \"welding\": {\n      \"required\": true,\n      \"welding_type\": \"角焊/环形焊（定位焊）\",\n      \"welding_method\": \"CO2气保焊\",\n      \"weld_size\": \"点焊长度10mm，焊脚高度3mm\",\n      \"welding_position\": \"零件⑥与零件②的连接处（角焊），零件⑧与零件⑦的连接处（环形焊），平焊位置\",\n      \"quality_requirements\": \"固定套⑧的定位焊必须保证其轴线与设计轴线垂直度公差在0.01mm以内。\",\n      \"safety_notes\": \"固定套⑧焊接时，由于是环形焊，需分段点焊，防止热量集中导致变形。注意保护精密加工面。\"\n    }\n  },\n  {\n    \"step_number\": 6,\n    \"action\": \"安装轴套\",\n    \"description\": \"将图纸上标注为⑨的轴套（01.02.02.0447）安装到组件的另一端。轴套安装在①号右悬挂臂板的内侧，与⑥号方形板对称。点焊固定。\",\n    \"position_description\": \"⑨号轴套安装在右侧悬挂臂板内侧。\",\n    \"parts_used\": [\n      {\n        \"bom_seq\": \"9\",\n        \"bom_name\": \"轴套\",\n        \"quantity\": 1,\n        \"drawing_number\": \"9\",\n        \"node_name\": [\n          \"NAUO14\"\n        ],\n        \"bom_code\": \"01.01.01.1591\"\n      }\n    ],\n    \"tools\": [\n      \"CO2焊机\",\n      \"游标卡尺\"\n    ],\n    \"warnings\": [\n      \"轴套的轴线必须与方管主体轴线平行，确保后续装配精度。\"\n    ],\n    \"welding\": {\n      \"required\": true,\n      \"welding_type\": \"角焊（定位焊）\",\n      \"welding_method\": \"CO2气保焊\",\n      \"weld_size\": \"点焊长度10mm，焊脚高度3mm\",\n      \"welding_position\": \"零件⑨与零件①的连接处，平焊位置\",\n      \"quality_requirements\": \"轴套⑨的定位焊必须保证其轴线与方管主体轴线平行度要求。\",\n      \"safety_notes\": \"轴套焊接时，需使用低电流快速点焊，减少热输入，避免轴套变形。\"\n    }\n  },\n  {\n    \"step_number\": 7,\n    \"action\": \"安装加强板（BOM 10, 11）\",\n    \"description\": \"安装BOM中未在3D图上明确标注序号的加强板。将BOM序号10的三角板（01.01.01.1626）和BOM序号11的方形板（01.01.01.3941）焊接到主体结构上，作为内部加强筋。根据总装图纸确定其具体位置（通常在方管内部或连接处）。\",\n    \"position_description\": \"根据总装图纸确定三角板和方形板的内部加强位置，进行点焊。\",\n    \"parts_used\": [\n      {\n        \"bom_seq\": \"10\",\n        \"bom_name\": \"三角板\",\n        \"quantity\": 0,\n        \"drawing_number\": \"无\",\n        \"node_name\": [\n          \"NAUO19\",\n          \"NAUO18\",\n          \"NAUO17\",\n          \"NAUO16\"\n        ],\n        \"bom_code\": \"01.01.01.1626\"\n      },\n      {\n        \"bom_seq\": \"11\",\n        \"bom_name\": \"方形板\",\n        \"quantity\": 0,\n        \"drawing_number\": \"无\",\n        \"node_name\": [\n          \"NAUO23\",\n          \"NAUO22\",\n          \"NAUO21\",\n          \"NAUO20\"\n        ],\n        \"bom_code\": \"01.01.01.3941\"\n      }\n    ],\n    \"tools\": [\n      \"CO2焊机\",\n      \"夹具\"\n    ],\n    \"warnings\": [\n      \"这些零件是内部加强件，焊接时需确保焊缝强度满足要求。\"\n    ],\n    \"welding\": {\n      \"required\": true,\n      \"welding_type\": \"角焊（定位焊）\",\n      \"welding_method\": \"CO2气保焊\",\n      \"weld_size\": \"点焊长度10mm，焊脚高度3mm\",\n      \"welding_position\": \"加强板与方管③的连接处，可能涉及立焊或仰焊位置\",\n      \"quality_requirements\": \"加强板必须紧密贴合，定位焊点应均匀分布，防止加强板在后续满焊中移位。\",\n      \"safety_notes\": \"如果涉及内部焊接，必须确保方管内部有足够的通风，防止有害气体聚集。\"\n    }\n  },\n  {\n    \"step_number\": 8,\n    \"action\": \"安装防滑板（BOM 12, 13）\",\n    \"description\": \"安装BOM序号12和13的防滑板（01.01.01.0517）。这两块防滑板通常安装在组件的顶部或底部，用于增加摩擦力或作为检修平台。根据图纸要求确定其最终焊接位置，进行点焊。\",\n    \"position_description\": \"根据总装图纸确定两块防滑板的安装位置，进行点焊。\",\n    \"parts_used\": [\n      {\n        \"bom_seq\": \"12\",\n        \"bom_name\": \"防滑板\",\n        \"quantity\": 0,\n        \"drawing_number\": \"无\",\n        \"node_name\": [\n          \"NAUO25\",\n          \"NAUO24\"\n        ],\n        \"bom_code\": \"01.01.01.0517\"\n      },\n      {\n        \"bom_seq\": \"13\",\n        \"bom_name\": \"防滑板\",\n        \"quantity\": 0,\n        \"drawing_number\": \"无\",\n        \"node_name\": [\n          \"NAUO25\",\n          \"NAUO24\"\n        ],\n        \"bom_code\": \"01.01.01.0517\"\n      }\n    ],\n    \"tools\": [\n      \"CO2焊机\"\n    ],\n    \"warnings\": [\n      \"防滑板的安装方向和位置必须符合图纸要求，确保功能性。\"\n    ],\n    \"welding\": {\n      \"required\": true,\n      \"welding_type\": \"角焊（定位焊）\",\n      \"welding_method\": \"CO2气保焊\",\n      \"weld_size\": \"点焊长度10mm，焊脚高度3mm\",\n      \"welding_position\": \"防滑板与主体结构的连接处，通常为平焊或仰焊位置\",\n      \"quality_requirements\": \"防滑板表面应平整，定位焊点应均匀分布，防止翘曲。\",\n      \"safety_notes\": \"防滑板板材较薄，点焊时需控制电流，防止烧穿。\"\n    }\n  },\n  {\n    \"step_number\": 9,\n    \"action\": \"满焊与校正\",\n    \"description\": \"完成所有零件的点焊后，按照焊接工艺要求进行满焊。焊接顺序应遵循对称、分散原则，以减少焊接变形。焊接完成后，对整个组件进行校正，确保整体尺寸和形位公差符合图纸要求。\",\n    \"position_description\": \"对所有连接部位进行满焊。\",\n    \"parts_used\": [\n      {\n        \"bom_seq\": \"1\",\n        \"bom_name\": \"右悬挂臂板\",\n        \"quantity\": 0,\n        \"drawing_number\": \"1\",\n        \"node_name\": [\n          \"NAUO2\",\n          \"NAUO1\"\n        ],\n        \"bom_code\": \"01.01.03.0692\"\n      },\n      {\n        \"bom_seq\": \"2\",\n        \"bom_name\": \"左悬挂臂板\",\n        \"quantity\": 0,\n        \"drawing_number\": \"2\",\n        \"node_name\": [\n          \"NAUO4\",\n          \"NAUO3\"\n        ],\n        \"bom_code\": \"01.01.03.0693\"\n      },\n      {\n        \"bom_seq\": \"7\",\n        \"bom_name\": \"旋转弧板\",\n        \"quantity\": 0,\n        \"drawing_number\": \"7\",\n        \"node_name\": [\n          \"NAUO12\"\n        ],\n        \"bom_code\": \"01.01.01.1590\"\n      }\n    ],\n    \"tools\": [\n      \"CO2焊机\",\n      \"焊渣锤\",\n      \"校正平台\",\n      \"液压千斤顶\"\n    ],\n    \"warnings\": [\n      \"焊接后必须清理焊渣，检查焊缝质量。校正时力度要均匀，避免二次变形。\"\n    ],\n    \"welding\": {\n      \"required\": true,\n      \"welding_type\": \"角焊/环形焊（满焊）\",\n      \"welding_method\": \"CO2气保焊\",\n      \"weld_size\": \"焊脚高度6mm（根据图纸未注尺寸要求），环形焊要求连续饱满\",\n      \"welding_position\": \"所有连接部位，涉及平焊、横焊、立焊、仰焊\",\n      \"quality_requirements\": \"焊缝必须连续、饱满，熔深足够，无裂纹、未熔合、严重气孔和夹渣。焊缝外观应均匀，过渡平滑。关键受力焊缝需进行磁粉检测（MT）或超声波检测（UT）。\",\n      \"safety_notes\": \"采用分段、跳焊或对称焊接顺序，严格控制层间温度，防止结构变形和产生裂纹。焊接过程中保持个人防护，并确保灭火器材随时可用。\"\n    }\n  },\n  {\n    \"step_number\": 10,\n    \"action\": \"打磨与清理\",\n    \"description\": \"对所有焊缝进行打磨，去除飞溅、毛刺和锐边/尖角。确保所有外露表面光滑，符合图纸上的表面粗糙度要求。清理整个组件，准备进行后续的防锈和涂装工序。\",\n    \"position_description\": \"所有焊缝和锐边。\",\n    \"parts_used\": [],\n    \"tools\": [\n      \"角磨机\",\n      \"砂轮片\",\n      \"钢丝刷\"\n    ],\n    \"warnings\": [\n      \"打磨时注意佩戴防护眼镜和手套，避免金属粉尘吸入。\"\n    ]\n  }\n]\n\n## 要求\n\n请按照以下5个步骤思考，为装配步骤添加安全警告：\n\n### 步骤1：识别风险步骤\n- 分析每个装配步骤的操作内容\n- 判断是否涉及高风险作业：\n  * **焊接作业**：电击、弧光、烫伤、火灾\n  * **吊装作业**：吊物坠落、碰撞、超载\n  * **高空作业**：人员坠落、物体打击\n  * **重物搬运**：砸伤、扭伤、夹伤\n  * **机械加工**：切割伤、夹伤、碰撞\n\n### 步骤2：分析风险源\n- 确定风险的来源（设备、工具、材料、环境、人员操作等）\n- 评估风险的严重程度（轻微、中等、严重、致命）\n- 考虑风险的发生概率\n\n### 步骤3：制定预防措施\n- 针对每个风险源，制定具体的预防措施\n- 强调个人防护用品的使用：\n  * **焊接**：焊接面罩、防护手套、防护服\n  * **吊装**：安全帽、安全鞋、手套\n  * **高空**：安全带、安全帽、防滑鞋\n  * **机械**：防护眼镜、手套、安全鞋\n\n### 步骤4：添加安全警告\n- 为每个有风险的步骤添加safety_warnings字段\n- 每条警告要简洁明了，说明具体的风险和预防措施\n- 使用工人能看懂的语言\n\n### 步骤5：验证完整性\n- 检查所有高风险步骤是否都添加了安全警告\n- 检查安全警告是否具体、可操作\n- 检查是否遗漏了任何潜在风险\n\n## ⚠️ 强制自检清单（生成后必须逐项检查）\n\n**在输出JSON之前，你必须完成以下验证：**\n\n1. **风险步骤识别验证**：\n   - [ ] 所有涉及焊接、吊装、高空、重物搬运的步骤都添加了safety_warnings字段\n   - [ ] 没有明显风险的步骤没有添加safety_warnings字段\n\n2. **安全警告完整性验证**：\n   - [ ] 每个safety_warnings字段都是字符串数组\n   - [ ] 每条警告都说明了具体的风险和预防措施\n   - [ ] 涵盖了个人防护、设备安全、环境安全、操作安全\n\n3. **语言通俗性验证**：\n   - [ ] 使用工人能看懂的语言\n   - [ ] 避免专业术语和英文缩写\n   - [ ] 每条警告简洁明了（一句话）\n\n4. **原有字段保持验证**：\n   - [ ] 原有步骤的所有字段都保持不变（包括welding字段）\n   - [ ] 没有修改或删除任何原有字段\n\n**如果自检发现任何问题，必须重新生成！**\n\n现在开始为装配步骤添加安全警告！\n",
  "raw_response": "```json\n{\n  \"enhanced_steps\": [\n    {\n      \"step_number\": 1,\n      \"action\": \"放置基准件\",\n      \"description\": \"将图纸上标注为③的方管-机加（01.02.03.0206）平稳放置在装配胎具上，作为整个组件的装配基准。确保方管水平。\",\n      \"position_description\": \"方管水平放置在胎具上，长边方向与胎具主轴对齐。\",\n      \"parts_used\": [\n        {\n          \"bom_seq\": \"3\",\n          \"bom_name\": \"方管-机加\",\n          \"quantity\": 1,\n          \"drawing_number\": \"3\",\n          \"node_name\": [\n            \"NAUO6\",\n            \"NAUO5\"\n          ],\n          \"bom_code\": \"01.01.4792\"\n        }\n      ],\n      \"tools\": [\n        \"行车\",\n        \"吊具\",\n        \"装配胎具\",\n        \"水平仪\"\n      ],\n      \"warnings\": [\n        \"方管较重（21.16kg），吊装时注意安全，确保吊具捆绑牢固。\"\n      ],\n      \"safety_warnings\": [\n        \"吊装前检查行车和吊具是否完好，吊索具不得有断股或磨损\",\n        \"吊装时必须佩戴安全帽和防护手套，防止重物坠落砸伤或夹伤\",\n        \"重物起吊和下降时，指挥人员必须使用清晰的手势或口令，避免碰撞\"\n      ]\n    },\n    {\n      \"step_number\": 2,\n      \"action\": \"焊接悬挂臂板\",\n      \"description\": \"将图纸上标注为①的右悬挂臂板（01.02.01.3870）和②的左悬挂臂板（01.02.01.3871）分别安装到③号方管的两端。使用夹具定位，确保悬挂臂板的安装面与方管端面垂直且对齐。进行点焊固定。\",\n      \"position_description\": \"①号板安装在方管一端，②号板安装在方管另一端，确保方向正确。\",\n      \"parts_used\": [\n        {\n          \"bom_seq\": \"1\",\n          \"bom_name\": \"右悬挂臂板\",\n          \"quantity\": 1,\n          \"drawing_number\": \"1\",\n          \"node_name\": [\n            \"NAUO2\",\n            \"NAUO1\"\n          ],\n          \"bom_code\": \"01.01.03.0692\"\n        },\n        {\n          \"bom_seq\": \"2\",\n          \"bom_name\": \"左悬挂臂板\",\n          \"quantity\": 1,\n          \"drawing_number\": \"2\",\n          \"node_name\": [\n            \"NAUO4\",\n            \"NAUO3\"\n          ],\n          \"bom_code\": \"01.01.03.0693\"\n        }\n      ],\n      \"tools\": [\n        \"CO2焊机\",\n        \"角尺\",\n        \"夹具\"\n      ],\n      \"warnings\": [\n        \"点焊时注意焊接变形，点焊位置应均匀分布。\"\n      ],\n      \"welding\": {\n        \"required\": true,\n        \"welding_type\": \"角焊（定位焊）\",\n        \"welding_method\": \"CO2气保焊\",\n        \"weld_size\": \"点焊长度10-15mm，焊脚高度3mm\",\n        \"welding_position\": \"零件①/②与零件③的连接处，主要为平焊和横焊位置\",\n        \"quality_requirements\": \"点焊牢固，定位准确，焊点无明显气孔或裂纹，确保悬挂臂板与方管的垂直度。\",\n        \"safety_notes\": \"佩戴焊接面罩、防护手套和防护服。确保工作区域通风良好，防止烟尘吸入。\"\n      },\n      \"safety_warnings\": [\n        \"必须佩戴焊接面罩、防护手套和防护服，防止弧光灼伤和高温烫伤\",\n        \"确保焊机接地良好，电缆绝缘完好，防止触电事故\",\n        \"焊接区域必须保持通风，防止焊接烟尘和有害气体吸入\",\n        \"焊接作业前，清理周围易燃物，配备干粉灭火器\"\n      ]\n    },\n    {\n      \"step_number\": 3,\n      \"action\": \"安装旋转弧板\",\n      \"description\": \"将图纸上标注为⑦的旋转弧板（01.02.01.3872）安装到③号方管的中部上方。根据图纸尺寸（617mm和600mm）定位，确保弧板的中心线与方管的中心线对齐。使用夹具固定后进行点焊。\",\n      \"position_description\": \"⑦号板安装在③号方管上表面中部，定位尺寸需精确。\",\n      \"parts_used\": [\n        {\n          \"bom_seq\": \"7\",\n          \"bom_name\": \"旋转弧板\",\n          \"quantity\": 2,\n          \"drawing_number\": \"7\",\n          \"node_name\": [\n            \"NAUO12\"\n          ],\n          \"bom_code\": \"01.01.01.1590\"\n        }\n      ],\n      \"tools\": [\n        \"卷尺\",\n        \"CO2焊机\",\n        \"夹具\"\n      ],\n      \"warnings\": [\n        \"旋转弧板是关键定位件，定位偏差不得超过±0.5mm。\"\n      ],\n      \"welding\": {\n        \"required\": true,\n        \"welding_type\": \"角焊（定位焊）\",\n        \"welding_method\": \"CO2气保焊\",\n        \"weld_size\": \"点焊长度10-15mm，焊脚高度3mm\",\n        \"welding_position\": \"零件⑦与零件③的连接处，平焊位置\",\n        \"quality_requirements\": \"定位焊点均匀分布，确保弧板中心线与方管中心线对齐，垂直度良好。\",\n        \"safety_notes\": \"焊接前清理弧板和方管接触面的油污和锈蚀，防止产生气孔。注意防飞溅。\"\n      },\n      \"safety_warnings\": [\n        \"必须佩戴焊接面罩和防护手套，防止弧光灼伤和高温烫伤\",\n        \"使用夹具固定时，确保夹紧力适中，防止夹具弹开伤人\",\n        \"清理工件表面时，佩戴防护眼镜，防止铁屑飞溅\"\n      ]\n    },\n    {\n      \"step_number\": 4,\n      \"action\": \"安装角钢和方管加强件\",\n      \"description\": \"将图纸上标注为④的角钢（01.02.04.0084）和⑤的方管-机加（01.02.03.0207）安装到③号方管上。④号角钢安装在方管上表面，⑤号方管安装在⑦号旋转弧板下方，作为支撑。点焊固定。\",\n      \"position_description\": \"④号角钢安装在方管上表面，⑤号方管安装在⑦号板下方，与方管主体焊接。\",\n      \"parts_used\": [\n        {\n          \"bom_seq\": \"4\",\n          \"bom_name\": \"角钢\",\n          \"quantity\": 5,\n          \"drawing_number\": \"4\",\n          \"node_name\": [\n            \"NAUO8\",\n            \"NAUO7\"\n          ],\n          \"bom_code\": \"01.02.01.3875\"\n        },\n        {\n          \"bom_seq\": \"5\",\n          \"bom_name\": \"方管-机加\",\n          \"quantity\": 2,\n          \"drawing_number\": \"5\",\n          \"node_name\": [\n            \"NAUO10\"\n          ],\n          \"bom_code\": \"01.02.02.0446\"\n        }\n      ],\n      \"tools\": [\n        \"CO2焊机\",\n        \"角尺\"\n      ],\n      \"warnings\": [\n        \"确保所有角钢和方管与主体结构接触面紧密贴合，无间隙。\"\n      ],\n      \"welding\": {\n        \"required\": true,\n        \"welding_type\": \"角焊（定位焊）\",\n        \"welding_method\": \"CO2气保焊\",\n        \"weld_size\": \"点焊长度10mm，焊脚高度3mm\",\n        \"welding_position\": \"零件④/⑤与零件③/⑦的连接处，主要为平焊位置\",\n        \"quality_requirements\": \"定位焊点应能承受后续操作的应力，确保加强件与主体结构贴合紧密。\",\n        \"safety_notes\": \"检查焊机接地线是否牢固，防止触电。焊接时注意周围环境，避免火灾。\"\n      },\n      \"safety_warnings\": [\n        \"佩戴防护手套，角钢和方管边缘可能锋利，防止割伤\",\n        \"点焊时注意焊渣飞溅，防止烫伤周围人员和设备\",\n        \"确保焊机接地线连接牢固，防止漏电触电\"\n      ]\n    },\n    {\n      \"step_number\": 5,\n      \"action\": \"安装方形板和固定套\",\n      \"description\": \"将图纸上标注为⑥的方形板（01.01.01.4776）和⑧的固定套（01.02.05.0334）安装到组件的端部。⑥号方形板安装在②号左悬挂臂板的内侧，⑧号固定套安装在⑦号旋转弧板的中心孔位处。点焊固定。\",\n      \"position_description\": \"⑥号板安装在左侧悬挂臂板内侧，⑧号固定套安装在旋转弧板的中心孔。\",\n      \"parts_used\": [\n        {\n          \"bom_seq\": \"6\",\n          \"bom_name\": \"方形板\",\n          \"quantity\": 2,\n          \"drawing_number\": \"6\",\n          \"node_name\": [\n            \"NAUO11\"\n          ],\n          \"bom_code\": \"01.01.01.1589\"\n        },\n        {\n          \"bom_seq\": \"8\",\n          \"bom_name\": \"固定套\",\n          \"quantity\": 1,\n          \"drawing_number\": \"8\",\n          \"node_name\": [\n            \"NAUO15\",\n            \"NAUO13\"\n          ],\n          \"bom_code\": \"01.01.01.1593\"\n        }\n      ],\n      \"tools\": [\n        \"CO2焊机\",\n        \"游标卡尺\"\n      ],\n      \"warnings\": [\n        \"⑧号固定套的安装位置和垂直度要求高，需使用游标卡尺检查定位尺寸。\"\n      ],\n      \"welding\": {\n        \"required\": true,\n        \"welding_type\": \"角焊/环形焊（定位焊）\",\n        \"welding_method\": \"CO2气保焊\",\n        \"weld_size\": \"点焊长度10mm，焊脚高度3mm\",\n        \"welding_position\": \"零件⑥与零件②的连接处（角焊），零件⑧与零件⑦的连接处（环形焊），平焊位置\",\n        \"quality_requirements\": \"固定套⑧的定位焊必须保证其轴线与设计轴线垂直度公差在0.01mm以内。\",\n        \"safety_notes\": \"固定套⑧焊接时，由于是环形焊，需分段点焊，防止热量集中导致变形。注意保护精密加工面。\"\n      },\n      \"safety_warnings\": [\n        \"佩戴防护手套，防止搬运方形板时被锐边割伤\",\n        \"固定套焊接时，控制电流和时间，防止热量过高导致烫伤\",\n        \"环形焊时，注意焊枪角度，避免电弧反射灼伤眼睛\"\n      ]\n    },\n    {\n      \"step_number\": 6,\n      \"action\": \"安装轴套\",\n      \"description\": \"将图纸上标注为⑨的轴套（01.02.02.0447）安装到组件的另一端。轴套安装在①号右悬挂臂板的内侧，与⑥号方形板对称。点焊固定。\",\n      \"position_description\": \"⑨号轴套安装在右侧悬挂臂板内侧。\",\n      \"parts_used\": [\n        {\n          \"bom_seq\": \"9\",\n          \"bom_name\": \"轴套\",\n          \"quantity\": 1,\n          \"drawing_number\": \"9\",\n          \"node_name\": [\n            \"NAUO14\"\n          ],\n          \"bom_code\": \"01.01.01.1591\"\n        }\n      ],\n      \"tools\": [\n        \"CO2焊机\",\n        \"游标卡尺\"\n      ],\n      \"warnings\": [\n        \"轴套的轴线必须与方管主体轴线平行，确保后续装配精度。\"\n      ],\n      \"welding\": {\n        \"required\": true,\n        \"welding_type\": \"角焊（定位焊）\",\n        \"welding_method\": \"CO2气保焊\",\n        \"weld_size\": \"点焊长度10mm，焊脚高度3mm\",\n        \"welding_position\": \"零件⑨与零件①的连接处，平焊位置\",\n        \"quality_requirements\": \"轴套⑨的定位焊必须保证其轴线与方管主体轴线平行度要求。\",\n        \"safety_notes\": \"轴套焊接时，需使用低电流快速点焊，减少热输入，避免轴套变形。\"\n      },\n      \"safety_warnings\": [\n        \"轴套焊接时，使用低电流快速点焊，防止热变形和烫伤\",\n        \"确保轴套定位准确后才能点焊，防止因返工造成二次伤害\"\n      ]\n    },\n    {\n      \"step_number\": 7,\n      \"action\": \"安装加强板（BOM 10, 11）\",\n      \"description\": \"安装BOM中未在3D图上明确标注序号的加强板。将BOM序号10的三角板（01.01.01.1626）和BOM序号11的方形板（01.01.01.3941）焊接到主体结构上，作为内部加强筋。根据总装图纸确定其具体位置（通常在方管内部或连接处）。\",\n      \"position_description\": \"根据总装图纸确定三角板和方形板的内部加强位置，进行点焊。\",\n      \"parts_used\": [\n        {\n          \"bom_seq\": \"10\",\n          \"bom_name\": \"三角板\",\n          \"quantity\": 0,\n          \"drawing_number\": \"无\",\n          \"node_name\": [\n            \"NAUO19\",\n            \"NAUO18\",\n            \"NAUO17\",\n            \"NAUO16\"\n          ],\n          \"bom_code\": \"01.01.01.1626\"\n        },\n        {\n          \"bom_seq\": \"11\",\n          \"bom_name\": \"方形板\",\n          \"quantity\": 0,\n          \"drawing_number\": \"无\",\n          \"node_name\": [\n            \"NAUO23\",\n            \"NAUO22\",\n            \"NAUO21\",\n            \"NAUO20\"\n          ],\n          \"bom_code\": \"01.01.01.3941\"\n        }\n      ],\n      \"tools\": [\n        \"CO2焊机\",\n        \"夹具\"\n      ],\n      \"warnings\": [\n        \"这些零件是内部加强件，焊接时需确保焊缝强度满足要求。\"\n      ],\n      \"welding\": {\n        \"required\": true,\n        \"welding_type\": \"角焊（定位焊）\",\n        \"welding_method\": \"CO2气保焊\",\n        \"weld_size\": \"点焊长度10mm，焊脚高度3mm\",\n        \"welding_position\": \"加强板与方管③的连接处，可能涉及立焊或仰焊位置\",\n        \"quality_requirements\": \"加强板必须紧密贴合，定位焊点应均匀分布，防止加强板在后续满焊中移位。\",\n        \"safety_notes\": \"如果涉及内部焊接，必须确保方管内部有足够的通风，防止有害气体聚集。\"\n      },\n      \"safety_warnings\": [\n        \"如果需要在方管内部焊接，必须确保内部通风良好，防止缺氧或有毒气体中毒\",\n        \"涉及立焊或仰焊时，注意焊渣和熔融金属坠落，穿戴好防护服和安全鞋\",\n        \"佩戴防护手套，加强板边缘可能锋利，防止割伤\"\n      ]\n    },\n    {\n      \"step_number\": 8,\n      \"action\": \"安装防滑板（BOM 12, 13）\",\n      \"description\": \"安装BOM序号12和13的防滑板（01.01.01.0517）。这两块防滑板通常安装在组件的顶部或底部，用于增加摩擦力或作为检修平台。根据图纸要求确定其最终焊接位置，进行点焊。\",\n      \"position_description\": \"根据总装图纸确定两块防滑板的安装位置，进行点焊。\",\n      \"parts_used\": [\n        {\n          \"bom_seq\": \"12\",\n          \"bom_name\": \"防滑板\",\n          \"quantity\": 0,\n          \"drawing_number\": \"无\",\n          \"node_name\": [\n            \"NAUO25\",\n            \"NAUO24\"\n          ],\n          \"bom_code\": \"01.01.01.0517\"\n        },\n        {\n          \"bom_seq\": \"13\",\n          \"bom_name\": \"防滑板\",\n          \"quantity\": 0,\n          \"drawing_number\": \"无\",\n          \"node_name\": [\n            \"NAUO25\",\n            \"NAUO24\"\n          ],\n          \"bom_code\": \"01.01.01.0517\"\n        }\n      ],\n      \"tools\": [\n        \"CO2焊机\"\n      ],\n      \"warnings\": [\n        \"防滑板的安装方向和位置必须符合图纸要求，确保功能性。\"\n      ],\n      \"welding\": {\n        \"required\": true,\n        \"welding_type\": \"角焊（定位焊）\",\n        \"welding_method\": \"CO2气保焊\",\n        \"weld_size\": \"点焊长度10mm，焊脚高度3mm\",\n        \"welding_position\": \"防滑板与主体结构的连接处，通常为平焊或仰焊位置\",\n        \"quality_requirements\": \"防滑板表面应平整，定位焊点应均匀分布，防止翘曲。\",\n        \"safety_notes\": \"防滑板板材较薄，点焊时需控制电流，防止烧穿。\"\n      },\n      \"safety_warnings\": [\n        \"防滑板板材较薄，点焊时控制电流，防止烧穿烫伤\",\n        \"佩戴防护手套，防滑板边缘和孔洞可能锋利，防止割伤\"\n      ]\n    },\n    {\n      \"step_number\": 9,\n      \"action\": \"满焊与校正\",\n      \"description\": \"完成所有零件的点焊后，按照焊接工艺要求进行满焊。焊接顺序应遵循对称、分散原则，以减少焊接变形。焊接完成后，对整个组件进行校正，确保整体尺寸和形位公差符合图纸要求。\",\n      \"position_description\": \"对所有连接部位进行满焊。\",\n      \"parts_used\": [\n        {\n          \"bom_seq\": \"1\",\n          \"bom_name\": \"右悬挂臂板\",\n          \"quantity\": 0,\n          \"drawing_number\": \"1\",\n          \"node_name\": [\n            \"NAUO2\",\n            \"NAUO1\"\n          ],\n          \"bom_code\": \"01.01.03.0692\"\n        },\n        {\n          \"bom_seq\": \"2\",\n          \"bom_name\": \"左悬挂臂板\",\n          \"quantity\": 0,\n          \"drawing_number\": \"2\",\n          \"node_name\": [\n            \"NAUO4\",\n            \"NAUO3\"\n          ],\n          \"bom_code\": \"01.01.03.0693\"\n        },\n        {\n          \"bom_seq\": \"7\",\n          \"bom_name\": \"旋转弧板\",\n          \"quantity\": 0,\n          \"drawing_number\": \"7\",\n          \"node_name\": [\n            \"NAUO12\"\n          ],\n          \"bom_code\": \"01.01.01.1590\"\n        }\n      ],\n      \"tools\": [\n        \"CO2焊机\",\n        \"焊渣锤\",\n        \"校正平台\",\n        \"液压千斤顶\"\n      ],\n      \"warnings\": [\n        \"焊接后必须清理焊渣，检查焊缝质量。校正时力度要均匀，避免二次变形。\"\n      ],\n      \"welding\": {\n        \"required\": true,\n        \"welding_type\": \"角焊/环形焊（满焊）\",\n        \"welding_method\": \"CO2气保焊\",\n        \"weld_size\": \"焊脚高度6mm（根据图纸未注尺寸要求），环形焊要求连续饱满\",\n        \"welding_position\": \"所有连接部位，涉及平焊、横焊、立焊、仰焊\",\n        \"quality_requirements\": \"焊缝必须连续、饱满，熔深足够，无裂纹、未熔合、严重气孔和夹渣。焊缝外观应均匀，过渡平滑。关键受力焊缝需进行磁粉检测（MT）或超声波检测（UT）。\",\n        \"safety_notes\": \"采用分段、跳焊或对称焊接顺序，严格控制层间温度，防止结构变形和产生裂纹。焊接过程中保持个人防护，并确保灭火器材随时可用。\"\n      },\n      \"safety_warnings\": [\n        \"满焊时热量大，必须全程佩戴全套防护用品，防止大面积烫伤\",\n        \"清理焊渣时，佩戴防护眼镜，防止焊渣飞溅伤眼\",\n        \"使用液压千斤顶校正时，确保支撑点稳固，防止结构突然移动或坍塌伤人\",\n        \"校正操作时，非操作人员必须远离危险区域\"\n      ]\n    },\n    {\n      \"step_number\": 10,\n      \"action\": \"打磨与清理\",\n      \"description\": \"对所有焊缝进行打磨，去除飞溅、毛刺和锐边/尖角。确保所有外露表面光滑，符合图纸上的表面粗糙度要求。清理整个组件，准备进行后续的防锈和涂装工序。\",\n      \"position_description\": \"所有焊缝和锐边。\",\n      \"parts_used\": [],\n      \"tools\": [\n        \"角磨机\",\n        \"砂轮片\",\n        \"钢丝刷\"\n      ],\n      \"warnings\": [\n        \"打磨时注意佩戴防护眼镜和手套，避免金属粉尘吸入。\"\n      ],\n      \"safety_warnings\": [\n        \"操作角磨机必须佩戴防护眼镜和防尘口罩，防止金属粉尘和火花飞溅伤眼和吸入\",\n        \"打磨时双手握紧角磨机，站稳，防止砂轮片卡住反弹伤人\",\n        \"检查砂轮片是否完好，不得使用有裂纹或缺口的砂轮片\",\n        \"打磨产生的火花和高温金属颗粒可能引燃周围易燃物，注意防火\"\n      ]\n    }\n  ]\n}\n```",
  "parsed_result": {
    "enhanced_steps": [
      {
        "step_number": 1,
        "action": "放置基准件",
        "description": "将图纸上标注为③的方管-机加（01.02.03.0206）平稳放置在装配胎具上，作为整个组件的装配基准。确保方管水平。",
        "position_description": "方管水平放置在胎具上，长边方向与胎具主轴对齐。",
        "parts_used": [
          {
            "bom_seq": "3",
            "bom_name": "方管-机加",
            "quantity": 1,
            "drawing_number": "3",
            "node_name": [
              "NAUO6",
              "NAUO5"
            ],
            "bom_code": "01.01.4792"
          }
        ],
        "tools": [
          "行车",
          "吊具",
          "装配胎具",
          "水平仪"
        ],
        "warnings": [
          "方管较重（21.16kg），吊装时注意安全，确保吊具捆绑牢固。"
        ],
        "safety_warnings": [
          "吊装前检查行车和吊具是否完好，吊索具不得有断股或磨损",
          "吊装时必须佩戴安全帽和防护手套，防止重物坠落砸伤或夹伤",
          "重物起吊和下降时，指挥人员必须使用清晰的手势或口令，避免碰撞"
        ]
      },
      {
        "step_number": 2,
        "action": "焊接悬挂臂板",
        "description": "将图纸上标注为①的右悬挂臂板（01.02.01.3870）和②的左悬挂臂板（01.02.01.3871）分别安装到③号方管的两端。使用夹具定位，确保悬挂臂板的安装面与方管端面垂直且对齐。进行点焊固定。",
        "position_description": "①号板安装在方管一端，②号板安装在方管另一端，确保方向正确。",
        "parts_used": [
          {
            "bom_seq": "1",
            "bom_name": "右悬挂臂板",
            "quantity": 1,
            "drawing_number": "1",
            "node_name": [
              "NAUO2",
              "NAUO1"
            ],
            "bom_code": "01.01.03.0692"
          },
          {
            "bom_seq": "2",
            "bom_name": "左悬挂臂板",
            "quantity": 1,
            "drawing_number": "2",
            "node_name": [
              "NAUO4",
              "NAUO3"
            ],
            "bom_code": "01.01.03.0693"
          }
        ],
        "tools": [
          "CO2焊机",
          "角尺",
          "夹具"
        ],
        "warnings": [
          "点焊时注意焊接变形，点焊位置应均匀分布。"
        ],
        "welding": {
          "required": true,
          "welding_type": "角焊（定位焊）",
          "welding_method": "CO2气保焊",
          "weld_size": "点焊长度10-15mm，焊脚高度3mm",
          "welding_position": "零件①/②与零件③的连接处，主要为平焊和横焊位置",
          "quality_requirements": "点焊牢固，定位准确，焊点无明显气孔或裂纹，确保悬挂臂板与方管的垂直度。",
          "safety_notes": "佩戴焊接面罩、防护手套和防护服。确保工作区域通风良好，防止烟尘吸入。"
        },
        "safety_warnings": [
          "必须佩戴焊接面罩、防护手套和防护服，防止弧光灼伤和高温烫伤",
          "确保焊机接地良好，电缆绝缘完好，防止触电事故",
          "焊接区域必须保持通风，防止焊接烟尘和有害气体吸入",
          "焊接作业前，清理周围易燃物，配备干粉灭火器"
        ]
      },
      {
        "step_number": 3,
        "action": "安装旋转弧板",
        "description": "将图纸上标注为⑦的旋转弧板（01.02.01.3872）安装到③号方管的中部上方。根据图纸尺寸（617mm和600mm）定位，确保弧板的中心线与方管的中心线对齐。使用夹具固定后进行点焊。",
        "position_description": "⑦号板安装在③号方管上表面中部，定位尺寸需精确。",
        "parts_used": [
          {
            "bom_seq": "7",
            "bom_name": "旋转弧板",
            "quantity": 2,
            "drawing_number": "7",
            "node_name": [
              "NAUO12"
            ],
            "bom_code": "01.01.01.1590"
          }
        ],
        "tools": [
          "卷尺",
          "CO2焊机",
          "夹具"
        ],
        "warnings": [
          "旋转弧板是关键定位件，定位偏差不得超过±0.5mm。"
        ],
        "welding": {
          "required": true,
          "welding_type": "角焊（定位焊）",
          "welding_method": "CO2气保焊",
          "weld_size": "点焊长度10-15mm，焊脚高度3mm",
          "welding_position": "零件⑦与零件③的连接处，平焊位置",
          "quality_requirements": "定位焊点均匀分布，确保弧板中心线与方管中心线对齐，垂直度良好。",
          "safety_notes": "焊接前清理弧板和方管接触面的油污和锈蚀，防止产生气孔。注意防飞溅。"
        },
        "safety_warnings": [
          "必须佩戴焊接面罩和防护手套，防止弧光灼伤和高温烫伤",
          "使用夹具固定时，确保夹紧力适中，防止夹具弹开伤人",
          "清理工件表面时，佩戴防护眼镜，防止铁屑飞溅"
        ]
      },
      {
        "step_number": 4,
        "action": "安装角钢和方管加强件",
        "description": "将图纸上标注为④的角钢（01.02.04.0084）和⑤的方管-机加（01.02.03.0207）安装到③号方管上。④号角钢安装在方管上表面，⑤号方管安装在⑦号旋转弧板下方，作为支撑。点焊固定。",
        "position_description": "④号角钢安装在方管上表面，⑤号方管安装在⑦号板下方，与方管主体焊接。",
        "parts_used": [
          {
            "bom_seq": "4",
            "bom_name": "角钢",
            "quantity": 5,
            "drawing_number": "4",
            "node_name": [
              "NAUO8",
              "NAUO7"
            ],
            "bom_code": "01.02.01.3875"
          },
          {
            "bom_seq": "5",
            "bom_name": "方管-机加",
            "quantity": 2,
            "drawing_number": "5",
            "node_name": [
              "NAUO10"
            ],
            "bom_code": "01.02.02.0446"
          }
        ],
        "tools": [
          "CO2焊机",
          "角尺"
        ],
        "warnings": [
          "确保所有角钢和方管与主体结构接触面紧密贴合，无间隙。"
        ],
        "welding": {
          "required": true,
          "welding_type": "角焊（定位焊）",
          "welding_method": "CO2气保焊",
          "weld_size": "点焊长度10mm，焊脚高度3mm",
          "welding_position": "零件④/⑤与零件③/⑦的连接处，主要为平焊位置",
          "quality_requirements": "定位焊点应能承受后续操作的应力，确保加强件与主体结构贴合紧密。",
          "safety_notes": "检查焊机接地线是否牢固，防止触电。焊接时注意周围环境，避免火灾。"
        },
        "safety_warnings": [
          "佩戴防护手套，角钢和方管边缘可能锋利，防止割伤",
          "点焊时注意焊渣飞溅，防止烫伤周围人员和设备",
          "确保焊机接地线连接牢固，防止漏电触电"
        ]
      },
      {
        "step_number": 5,
        "action": "安装方形板和固定套",
        "description": "将图纸上标注为⑥的方形板（01.01.01.4776）和⑧的固定套（01.02.05.0334）安装到组件的端部。⑥号方形板安装在②号左悬挂臂板的内侧，⑧号固定套安装在⑦号旋转弧板的中心孔位处。点焊固定。",
        "position_description": "⑥号板安装在左侧悬挂臂板内侧，⑧号固定套安装在旋转弧板的中心孔。",
        "parts_used": [
          {
            "bom_seq": "6",
            "bom_name": "方形板",
            "quantity": 2,
            "drawing_number": "6",
            "node_name": [
              "NAUO11"
            ],
            "bom_code": "01.01.01.1589"
          },
          {
            "bom_seq": "8",
            "bom_name": "固定套",
            "quantity": 1,
            "drawing_number": "8",
            "node_name": [
              "NAUO15",
              "NAUO13"
            ],
            "bom_code": "01.01.01.1593"
          }
        ],
        "tools": [
          "CO2焊机",
          "游标卡尺"
        ],
        "warnings": [
          "⑧号固定套的安装位置和垂直度要求高，需使用游标卡尺检查定位尺寸。"
        ],
        "welding": {
          "required": true,
          "welding_type": "角焊/环形焊（定位焊）",
          "welding_method": "CO2气保焊",
          "weld_size": "点焊长度10mm，焊脚高度3mm",
          "welding_position": "零件⑥与零件②的连接处（角焊），零件⑧与零件⑦的连接处（环形焊），平焊位置",
          "quality_requirements": "固定套⑧的定位焊必须保证其轴线与设计轴线垂直度公差在0.01mm以内。",
          "safety_notes": "固定套⑧焊接时，由于是环形焊，需分段点焊，防止热量集中导致变形。注意保护精密加工面。"
        },
        "safety_warnings": [
          "佩戴防护手套，防止搬运方形板时被锐边割伤",
          "固定套焊接时，控制电流和时间，防止热量过高导致烫伤",
          "环形焊时，注意焊枪角度，避免电弧反射灼伤眼睛"
        ]
      },
      {
        "step_number": 6,
        "action": "安装轴套",
        "description": "将图纸上标注为⑨的轴套（01.02.02.0447）安装到组件的另一端。轴套安装在①号右悬挂臂板的内侧，与⑥号方形板对称。点焊固定。",
        "position_description": "⑨号轴套安装在右侧悬挂臂板内侧。",
        "parts_used": [
          {
            "bom_seq": "9",
            "bom_name": "轴套",
            "quantity": 1,
            "drawing_number": "9",
            "node_name": [
              "NAUO14"
            ],
            "bom_code": "01.01.01.1591"
          }
        ],
        "tools": [
          "CO2焊机",
          "游标卡尺"
        ],
        "warnings": [
          "轴套的轴线必须与方管主体轴线平行，确保后续装配精度。"
        ],
        "welding": {
          "required": true,
          "welding_type": "角焊（定位焊）",
          "welding_method": "CO2气保焊",
          "weld_size": "点焊长度10mm，焊脚高度3mm",
          "welding_position": "零件⑨与零件①的连接处，平焊位置",
          "quality_requirements": "轴套⑨的定位焊必须保证其轴线与方管主体轴线平行度要求。",
          "safety_notes": "轴套焊接时，需使用低电流快速点焊，减少热输入，避免轴套变形。"
        },
        "safety_warnings": [
          "轴套焊接时，使用低电流快速点焊，防止热变形和烫伤",
          "确保轴套定位准确后才能点焊，防止因返工造成二次伤害"
        ]
      },
      {
        "step_number": 7,
        "action": "安装加强板（BOM 10, 11）",
        "description": "安装BOM中未在3D图上明确标注序号的加强板。将BOM序号10的三角板（01.01.01.1626）和BOM序号11的方形板（01.01.01.3941）焊接到主体结构上，作为内部加强筋。根据总装图纸确定其具体位置（通常在方管内部或连接处）。",
        "position_description": "根据总装图纸确定三角板和方形板的内部加强位置，进行点焊。",
        "parts_used": [
          {
            "bom_seq": "10",
            "bom_name": "三角板",
            "quantity": 0,
            "drawing_number": "无",
            "node_name": [
              "NAUO19",
              "NAUO18",
              "NAUO17",
              "NAUO16"
            ],
            "bom_code": "01.01.01.1626"
          },
          {
            "bom_seq": "11",
            "bom_name": "方形板",
            "quantity": 0,
            "drawing_number": "无",
            "node_name": [
              "NAUO23",
              "NAUO22",
              "NAUO21",
              "NAUO20"
            ],
            "bom_code": "01.01.01.3941"
          }
        ],
        "tools": [
          "CO2焊机",
          "夹具"
        ],
        "warnings": [
          "这些零件是内部加强件，焊接时需确保焊缝强度满足要求。"
        ],
        "welding": {
          "required": true,
          "welding_type": "角焊（定位焊）",
          "welding_method": "CO2气保焊",
          "weld_size": "点焊长度10mm，焊脚高度3mm",
          "welding_position": "加强板与方管③的连接处，可能涉及立焊或仰焊位置",
          "quality_requirements": "加强板必须紧密贴合，定位焊点应均匀分布，防止加强板在后续满焊中移位。",
          "safety_notes": "如果涉及内部焊接，必须确保方管内部有足够的通风，防止有害气体聚集。"
        },
        "safety_warnings": [
          "如果需要在方管内部焊接，必须确保内部通风良好，防止缺氧或有毒气体中毒",
          "涉及立焊或仰焊时，注意焊渣和熔融金属坠落，穿戴好防护服和安全鞋",
          "佩戴防护手套，加强板边缘可能锋利，防止割伤"
        ]
      },
      {
        "step_number": 8,
        "action": "安装防滑板（BOM 12, 13）",
        "description": "安装BOM序号12和13的防滑板（01.01.01.0517）。这两块防滑板通常安装在组件的顶部或底部，用于增加摩擦力或作为检修平台。根据图纸要求确定其最终焊接位置，进行点焊。",
        "position_description": "根据总装图纸确定两块防滑板的安装位置，进行点焊。",
        "parts_used": [
          {
            "bom_seq": "12",
            "bom_name": "防滑板",
            "quantity": 0,
            "drawing_number": "无",
            "node_name": [
              "NAUO25",
              "NAUO24"
            ],
            "bom_code": "01.01.01.0517"
          },
          {
            "bom_seq": "13",
            "bom_name": "防滑板",
            "quantity": 0,
            "drawing_number": "无",
            "node_name": [
              "NAUO25",
              "NAUO24"
            ],
            "bom_code": "01.01.01.0517"
          }
        ],
        "tools": [
          "CO2焊机"
        ],
        "warnings": [
          "防滑板的安装方向和位置必须符合图纸要求，确保功能性。"
        ],
        "welding": {
          "required": true,
          "welding_type": "角焊（定位焊）",
          "welding_method": "CO2气保焊",
          "weld_size": "点焊长度10mm，焊脚高度3mm",
          "welding_position": "防滑板与主体结构的连接处，通常为平焊或仰焊位置",
          "quality_requirements": "防滑板表面应平整，定位焊点应均匀分布，防止翘曲。",
          "safety_notes": "防滑板板材较薄，点焊时需控制电流，防止烧穿。"
        },
        "safety_warnings": [
          "防滑板板材较薄，点焊时控制电流，防止烧穿烫伤",
          "佩戴防护手套，防滑板边缘和孔洞可能锋利，防止割伤"
        ]
      },
      {
        "step_number": 9,
        "action": "满焊与校正",
        "description": "完成所有零件的点焊后，按照焊接工艺要求进行满焊。焊接顺序应遵循对称、分散原则，以减少焊接变形。焊接完成后，对整个组件进行校正，确保整体尺寸和形位公差符合图纸要求。",
        "position_description": "对所有连接部位进行满焊。",
        "parts_used": [
          {
            "bom_seq": "1",
            "bom_name": "右悬挂臂板",
            "quantity": 0,
            "drawing_number": "1",
            "node_name": [
              "NAUO2",
              "NAUO1"
            ],
            "bom_code": "01.01.03.0692"
          },
          {
            "bom_seq": "2",
            "bom_name": "左悬挂臂板",
            "quantity": 0,
            "drawing_number": "2",
            "node_name": [
              "NAUO4",
              "NAUO3"
            ],
            "bom_code": "01.01.03.0693"
          },
          {
            "bom_seq": "7",
            "bom_name": "旋转弧板",
            "quantity": 0,
            "drawing_number": "7",
            "node_name": [
              "NAUO12"
            ],
            "bom_code": "01.01.01.1590"
          }
        ],
        "tools": [
          "CO2焊机",
          "焊渣锤",
          "校正平台",
          "液压千斤顶"
        ],
        "warnings": [
          "焊接后必须清理焊渣，检查焊缝质量。校正时力度要均匀，避免二次变形。"
        ],
        "welding": {
          "required": true,
          "welding_type": "角焊/环形焊（满焊）",
          "welding_method": "CO2气保焊",
          "weld_size": "焊脚高度6mm（根据图纸未注尺寸要求），环形焊要求连续饱满",
          "welding_position": "所有连接部位，涉及平焊、横焊、立焊、仰焊",
          "quality_requirements": "焊缝必须连续、饱满，熔深足够，无裂纹、未熔合、严重气孔和夹渣。焊缝外观应均匀，过渡平滑。关键受力焊缝需进行磁粉检测（MT）或超声波检测（UT）。",
          "safety_notes": "采用分段、跳焊或对称焊接顺序，严格控制层间温度，防止结构变形和产生裂纹。焊接过程中保持个人防护，并确保灭火器材随时可用。"
        },
        "safety_warnings": [
          "满焊时热量大，必须全程佩戴全套防护用品，防止大面积烫伤",
          "清理焊渣时，佩戴防护眼镜，防止焊渣飞溅伤眼",
          "使用液压千斤顶校正时，确保支撑点稳固，防止结构突然移动或坍塌伤人",
          "校正操作时，非操作人员必须远离危险区域"
        ]
      },
      {
        "step_number": 10,
        "action": "打磨与清理",
        "description": "对所有焊缝进行打磨，去除飞溅、毛刺和锐边/尖角。确保所有外露表面光滑，符合图纸上的表面粗糙度要求。清理整个组件，准备进行后续的防锈和涂装工序。",
        "position_description": "所有焊缝和锐边。",
        "parts_used": [],
        "tools": [
          "角磨机",
          "砂轮片",
          "钢丝刷"
        ],
        "warnings": [
          "打磨时注意佩戴防护眼镜和手套，避免金属粉尘吸入。"
        ],
        "safety_warnings": [
          "操作角磨机必须佩戴防护眼镜和防尘口罩，防止金属粉尘和火花飞溅伤眼和吸入",
          "打磨时双手握紧角磨机，站稳，防止砂轮片卡住反弹伤人",
          "检查砂轮片是否完好，不得使用有裂纹或缺口的砂轮片",
          "打磨产生的火花和高温金属颗粒可能引燃周围易燃物，注意防火"
        ]
      }
    ]
  }
}