{
  "agent_name": "Agent6_FAQ",
  "model": "google/gemini-2.5-flash-preview-09-2025",
  "timestamp": "20251009_161522",
  "image_count": 0,
  "temperature": 0.2,
  "system_prompt": "# 角色定位\n\n你是**李师傅**，一位拥有20年安全管理经验的高级安全工程师。\n\n## 教育背景\n\n- **学历**：安全工程专业本科\n- **职业资格**：注册安全工程师、高级安全评价师\n- **专业培训**：\n  - 机械制造安全管理\n  - 职业健康与安全管理体系（ISO 45001）\n  - 事故调查与分析\n  - 应急预案编制与演练\n\n## 职业背景\n\n- **工作经历**：20年机械制造企业安全管理经验，参与过大型装备制造、钢结构加工等项目\n- **专业领域**：\n  - 机械加工安全（车、铣、刨、磨、钻等）\n  - 焊接作业安全（电焊、气焊、氩弧焊等）\n  - 起重吊装安全（行车、叉车、吊索具等）\n  - 高空作业安全（脚手架、安全带、防坠落等）\n  - 个人防护用品管理（安全帽、防护眼镜、手套、安全鞋等）\n\n## 知识结构（详细）\n\n### 1. 机械伤害风险\n- **夹伤/挤伤**：手指、手臂被运动部件夹住\n- **切割伤**：锋利边缘、毛刺、切削工具\n- **碰撞伤**：头部碰撞、身体碰撞\n- **坠落伤**：零件坠落、工具坠落、人员坠落\n\n### 2. 焊接作业风险\n- **电击伤**：焊机漏电、接地不良\n- **弧光伤**：电弧紫外线灼伤眼睛和皮肤\n- **烫伤**：高温熔池、焊渣飞溅\n- **火灾爆炸**：易燃物引燃、气瓶泄漏\n- **有毒气体**：焊接烟尘、一氧化碳中毒\n\n### 3. 起重吊装风险\n- **吊物坠落**：吊索具断裂、捆绑不牢\n- **吊物摆动**：碰撞人员、设备\n- **超载**：超过起重机额定载荷\n- **指挥失误**：信号不清、违章指挥\n\n### 4. 高空作业风险\n- **人员坠落**：未系安全带、脚手架不牢\n- **物体打击**：工具、零件从高处坠落\n- **脚手架坍塌**：搭设不规范、超载\n\n### 5. 个人防护用品\n- **头部防护**：安全帽（防止碰撞、坠物打击）\n- **眼部防护**：防护眼镜、焊接面罩（防止飞溅、弧光）\n- **手部防护**：防护手套（防止切割、烫伤、化学品）\n- **足部防护**：安全鞋（防砸、防刺穿、防滑）\n- **呼吸防护**：防尘口罩、防毒面具（防止粉尘、有毒气体）\n\n### 6. 应急处理\n- **机械伤害**：立即停机、呼救、止血、固定、送医\n- **电击伤**：切断电源、心肺复苏、送医\n- **烫伤**：冷水冲洗、覆盖无菌纱布、送医\n- **火灾**：使用灭火器、疏散人员、报警\n\n## 任务步骤（Chain of Thought）\n\n你的任务是**为每个装配步骤添加安全警告**（如果该步骤有安全风险）。请按照以下5个步骤思考：\n\n### 步骤1：识别风险步骤\n- 分析每个装配步骤的操作内容\n- 判断是否涉及高风险作业（焊接、吊装、高空、重物搬运等）\n- 识别潜在的伤害类型（机械伤害、电击、烫伤、坠落等）\n\n### 步骤2：分析风险源\n- 确定风险的来源（设备、工具、材料、环境、人员操作等）\n- 评估风险的严重程度（轻微、中等、严重、致命）\n- 考虑风险的发生概率\n\n### 步骤3：制定预防措施\n- 针对每个风险源，制定具体的预防措施\n- 强调个人防护用品的使用\n- 强调安全操作规程的遵守\n\n### 步骤4：添加安全警告\n- 为每个有风险的步骤添加safety_warnings字段\n- 每条警告要简洁明了，说明具体的风险和预防措施\n- 使用工人能看懂的语言\n\n### 步骤5：验证完整性\n- 检查所有高风险步骤是否都添加了安全警告\n- 检查安全警告是否具体、可操作\n- 检查是否遗漏了任何潜在风险\n\n## 核心原则\n\n1. **步骤级嵌入**：为每个有风险的步骤添加safety_warnings字段，而不是单独列出安全警告\n2. **工人友好**：使用通俗语言，避免专业术语\n3. **具体可操作**：说明具体的风险和预防措施，而不是泛泛而谈\n4. **不重复显示**：安全警告只在下方\"安全\"标签页中统一显示，不在当前步骤详情中重复显示\n\n## 输出格式\n\n严格按照以下JSON格式输出（返回增强后的装配步骤）：\n\n```json\n{\n  \"enhanced_steps\": [\n    {\n      \"step_number\": 1,\n      \"title\": \"点焊定位\",\n      \"parts_used\": [...],\n      \"tools_required\": [...],\n      \"operation\": \"操作说明\",\n      \"quality_check\": \"质量检查\",\n      \"estimated_time_minutes\": 10,\n      \"welding\": {\n        \"required\": true,\n        \"welding_type\": \"点焊\",\n        \"welding_method\": \"CO2气保焊\",\n        ...\n      },\n      \"safety_warnings\": [\n        \"佩戴焊接面罩和防护手套，防止弧光灼伤眼睛和皮肤\",\n        \"确保工件夹紧牢固，防止点焊时位移造成伤害\",\n        \"焊接区域周围3米内不得有易燃物，配备灭火器\",\n        \"焊机必须接地良好，防止漏电触电\"\n      ]\n    },\n    {\n      \"step_number\": 2,\n      \"title\": \"螺栓连接\",\n      \"parts_used\": [...],\n      \"operation\": \"操作说明\",\n      \"quality_check\": \"质量检查\",\n      \"estimated_time_minutes\": 15,\n      \"safety_warnings\": [\n        \"佩戴安全帽和防护眼镜，防止零件坠落和飞溅\",\n        \"使用扭力扳手时注意力度，防止扳手滑脱伤人\"\n      ]\n    },\n    {\n      \"step_number\": 3,\n      \"title\": \"简单装配\",\n      \"parts_used\": [...],\n      \"operation\": \"操作说明\",\n      \"quality_check\": \"质量检查\",\n      \"estimated_time_minutes\": 5\n      // ⚠️ 如果没有明显安全风险，不添加safety_warnings字段\n    }\n  ]\n}\n```\n\n**⚠️ 关键要求**：\n\n1. **步骤级嵌入**：\n   - 为每个有风险的步骤添加`safety_warnings`字段\n   - 没有明显风险的步骤不添加`safety_warnings`字段\n   - 保持原有步骤的所有字段不变\n\n2. **安全警告要具体**：\n   - ✅ 说\"佩戴焊接面罩和防护手套，防止弧光灼伤眼睛和皮肤\"\n   - ❌ 不说\"注意安全\"\n   - ✅ 说\"焊接区域周围3米内不得有易燃物，配备灭火器\"\n   - ❌ 不说\"注意防火\"\n\n3. **使用通俗语言**：\n   - 工人能看懂的语言\n   - 避免专业术语和英文缩写\n\n4. **警告要全面**：\n   - 涵盖个人防护、设备安全、环境安全、操作安全\n   - 每条警告说明具体的风险和预防措施\n\n## 重要提醒\n\n- **只输出JSON，不要输出其他内容**\n- **保持原有字段不变**：不要修改或删除原有的字段（包括welding字段）\n- **警告要简洁明了**：每条警告一句话，说明风险和预防措施\n- **不要过度警告**：只针对有明显风险的步骤添加警告\n",
  "user_query": "请为以下装配步骤添加安全警告（如果有安全风险）。\n\n## 📸 视觉分析任务\n\n**你会看到工程图纸图片，请仔细观察：**\n\n1. **危险作业标识**：\n   - 图纸上的安全警告标识\n   - 特殊作业要求（如高空作业、吊装作业等）\n   - 危险区域标注\n\n2. **零件特征**：\n   - 重型零件（需要吊装）\n   - 锋利边缘（容易割伤）\n   - 高温部件（容易烫伤）\n\n3. **作业环境**：\n   - 狭窄空间（容易碰撞）\n   - 高空位置（容易坠落）\n   - 密闭空间（通风不良）\n\n## 装配步骤\n\n[\n  {\n    \"step_number\": 1,\n    \"action\": \"放置基准件\",\n    \"description\": \"将图纸上标注为1的左铲板（01.01.01.18598）平稳放置在装配工作台上，作为装配基准。\",\n    \"position_description\": \"平放于工作台，铲板内侧朝上。\",\n    \"parts_used\": [\n      {\n        \"bom_seq\": \"1\",\n        \"bom_name\": \"左铲板 1\",\n        \"quantity\": 1,\n        \"drawing_number\": \"1\",\n        \"node_name\": [\n          \"NAUO1\"\n        ],\n        \"bom_code\": \"01.01.01.18598\"\n      }\n    ],\n    \"tools\": [\n      \"行车\",\n      \"吊具\"\n    ],\n    \"warnings\": [\n      \"注意吊装安全，防止铲板变形。\"\n    ]\n  },\n  {\n    \"step_number\": 2,\n    \"action\": \"安装方形板-机加\",\n    \"description\": \"将图纸上标注为2的方形板-机加（01.01.01.18599）放置在1号左铲板的后部指定位置，进行点焊固定。\",\n    \"position_description\": \"位于1号左铲板后部，与铲板边缘对齐。\",\n    \"parts_used\": [\n      {\n        \"bom_seq\": \"2\",\n        \"bom_name\": \"方形板-机加 1\",\n        \"quantity\": 1,\n        \"drawing_number\": \"2\",\n        \"node_name\": [\n          \"NAUO2\"\n        ],\n        \"bom_code\": \"01.01.01.18599\"\n      }\n    ],\n    \"tools\": [\n      \"焊机\",\n      \"角尺\"\n    ],\n    \"warnings\": [\n      \"点焊时注意定位精度，确保方形板与铲板垂直。\"\n    ],\n    \"welding\": {\n      \"required\": true,\n      \"welding_type\": \"角焊（点焊定位）\",\n      \"welding_method\": \"CO2气保焊\",\n      \"weld_size\": \"点焊长度10-15mm，焊脚高度4mm\",\n      \"welding_position\": \"零件②方形板-机加与零件①左铲板的连接处，主要为平焊和横焊位置\",\n      \"quality_requirements\": \"点焊牢固，定位准确，确保后续满焊时零件不位移\",\n      \"safety_notes\": \"佩戴焊接面罩和防护手套，确保工作区域通风良好，防止火花飞溅。\"\n    }\n  },\n  {\n    \"step_number\": 3,\n    \"action\": \"安装后加强板和前加强板\",\n    \"description\": \"将图纸上标注为3的后加强板（01.01.01.11519）和标注为4的前加强板（01.01.01.18600）分别放置在1号左铲板的内侧指定位置，进行点焊固定。\",\n    \"position_description\": \"3号后加强板位于铲板后部内侧，4号前加强板位于铲板前部内侧。\",\n    \"parts_used\": [\n      {\n        \"bom_seq\": \"3\",\n        \"bom_name\": \"后加强板 1\",\n        \"quantity\": 1,\n        \"drawing_number\": \"3\",\n        \"node_name\": [\n          \"NAUO3\"\n        ],\n        \"bom_code\": \"01.01.01.11519\"\n      },\n      {\n        \"bom_seq\": \"4\",\n        \"bom_name\": \"前加强板 1\",\n        \"quantity\": 1,\n        \"drawing_number\": \"4\",\n        \"node_name\": [\n          \"NAUO4\"\n        ],\n        \"bom_code\": \"01.01.01.18600\"\n      }\n    ],\n    \"tools\": [\n      \"焊机\",\n      \"卷尺\"\n    ],\n    \"warnings\": [\n      \"加强板的定位尺寸必须准确，确保后续零件安装孔位对齐。\"\n    ],\n    \"welding\": {\n      \"required\": true,\n      \"welding_type\": \"角焊（点焊定位）\",\n      \"welding_method\": \"CO2气保焊\",\n      \"weld_size\": \"点焊长度10-15mm，焊脚高度4mm\",\n      \"welding_position\": \"零件③、④加强板与零件①左铲板的连接处，主要为平焊位置\",\n      \"quality_requirements\": \"定位准确，点焊均匀分布，防止焊接应力集中导致变形\",\n      \"safety_notes\": \"检查焊机接地线是否牢固，避免触电风险。工作区域保持干燥。\"\n    }\n  },\n  {\n    \"step_number\": 4,\n    \"action\": \"安装底部连接板和前油缸固定板\",\n    \"description\": \"将图纸上标注为5的底部连接板（01.01.01.11521，共6块）和标注为6的前油缸固定板（01.01.01.11522，共2块）分别焊接到1号左铲板的底部和内侧指定位置。\",\n    \"position_description\": \"5号底部连接板均匀分布在铲板底部，6号前油缸固定板位于铲板内侧中部，注意与图纸尺寸对齐。\",\n    \"parts_used\": [\n      {\n        \"bom_seq\": \"5\",\n        \"bom_name\": \"底部连接板 6\",\n        \"quantity\": 6,\n        \"drawing_number\": \"5\",\n        \"node_name\": [\n          \"NAUO15\",\n          \"NAUO14\",\n          \"NAUO13\",\n          \"NAUO12\",\n          \"NAUO6\",\n          \"NAUO5\"\n        ],\n        \"bom_code\": \"01.01.01.11521\"\n      },\n      {\n        \"bom_seq\": \"6\",\n        \"bom_name\": \"前油缸固定板 2\",\n        \"quantity\": 2,\n        \"drawing_number\": \"6\",\n        \"node_name\": [\n          \"NAUO8\",\n          \"NAUO7\"\n        ],\n        \"bom_code\": \"01.01.01.11522\"\n      }\n    ],\n    \"tools\": [\n      \"焊机\",\n      \"卡尺\"\n    ],\n    \"warnings\": [\n      \"油缸固定板需与铲雪板后座连接架组件配合焊接，确保配合精度。\"\n    ],\n    \"welding\": {\n      \"required\": true,\n      \"welding_type\": \"角焊\",\n      \"welding_method\": \"CO2气保焊\",\n      \"weld_size\": \"焊脚高度6mm（根据图纸未标注尺寸默认），连续焊\",\n      \"welding_position\": \"零件⑤底部连接板和零件⑥前油缸固定板与零件①左铲板的连接处，主要为平焊和横焊位置\",\n      \"quality_requirements\": \"焊缝连续、饱满，无咬边、未焊透等缺陷。油缸固定板（6）的焊接尤其重要，需保证强度。\",\n      \"safety_notes\": \"焊接前清理坡口和焊件表面，去除油污和锈蚀。注意控制焊接电流，防止烧穿薄板区域。\"\n    }\n  },\n  {\n    \"step_number\": 5,\n    \"action\": \"安装弹簧固定板\",\n    \"description\": \"将图纸上标注为7的前弹簧固定板（01.01.01.11523，1块）和标注为8的后弹簧固定板（01.01.01.11524，2块）焊接到1号左铲板内侧的加强板上。\",\n    \"position_description\": \"7号前弹簧固定板位于前加强板（4）上，8号后弹簧固定板位于后加强板（3）上。\",\n    \"parts_used\": [\n      {\n        \"bom_seq\": \"7\",\n        \"bom_name\": \"前弹簧固定板 1\",\n        \"quantity\": 1,\n        \"drawing_number\": \"7\",\n        \"node_name\": [\n          \"NAUO9\"\n        ],\n        \"bom_code\": \"01.01.01.11523\"\n      },\n      {\n        \"bom_seq\": \"8\",\n        \"bom_name\": \"后弹簧固定板 2\",\n        \"quantity\": 2,\n        \"drawing_number\": \"8\",\n        \"node_name\": [\n          \"NAUO11\",\n          \"NAUO10\"\n        ],\n        \"bom_code\": \"01.01.01.11524\"\n      }\n    ],\n    \"tools\": [\n      \"焊机\",\n      \"定位夹具\"\n    ],\n    \"warnings\": [\n      \"弹簧固定板的孔位必须与图纸尺寸严格对齐，确保弹簧安装顺畅。\"\n    ],\n    \"welding\": {\n      \"required\": true,\n      \"welding_type\": \"角焊\",\n      \"welding_method\": \"CO2气保焊\",\n      \"weld_size\": \"焊脚高度6mm，连续焊\",\n      \"welding_position\": \"零件⑦、⑧弹簧固定板与零件③、④加强板的连接处，主要为平焊位置\",\n      \"quality_requirements\": \"焊缝必须连续，保证受力强度。焊后检查孔位尺寸，防止焊接变形影响安装。\",\n      \"safety_notes\": \"使用定位夹具固定零件，防止焊接过程中零件移动。注意焊枪角度，确保焊缝熔深足够。\"\n    }\n  },\n  {\n    \"step_number\": 6,\n    \"action\": \"安装支撑固定板\",\n    \"description\": \"将图纸上标注为9的支撑固定板（01.01.01.11525，1块）焊接到1号左铲板的内侧中部。\",\n    \"position_description\": \"位于铲板内侧，靠近底部连接板（5）区域。\",\n    \"parts_used\": [\n      {\n        \"bom_seq\": \"9\",\n        \"bom_name\": \"支撑固定板 1\",\n        \"quantity\": 1,\n        \"drawing_number\": \"9\",\n        \"node_name\": [\n          \"NAUO16\"\n        ],\n        \"bom_code\": \"01.01.01.11525\"\n      }\n    ],\n    \"tools\": [\n      \"焊机\"\n    ],\n    \"warnings\": [\n      \"确保焊接牢固，支撑固定板是受力件。\"\n    ],\n    \"welding\": {\n      \"required\": true,\n      \"welding_type\": \"角焊\",\n      \"welding_method\": \"CO2气保焊\",\n      \"weld_size\": \"焊脚高度6mm，连续焊\",\n      \"welding_position\": \"零件⑨支撑固定板与零件①左铲板的连接处，主要为平焊位置\",\n      \"quality_requirements\": \"焊缝外观平整，无裂纹、气孔。该板为主要受力结构，焊接质量要求高。\",\n      \"safety_notes\": \"穿戴好防护服和安全鞋，防止高温烫伤。焊接区域保持整洁，避免绊倒。\"\n    }\n  },\n  {\n    \"step_number\": 7,\n    \"action\": \"安装轴套加强板和轴套\",\n    \"description\": \"将图纸上标注为10的轴套加强板（01.01.01.11526，2块）和标注为12的轴套（01.01.02.1222，2块）安装到铲板两侧的耳板上。先将轴套加强板点焊定位，然后将轴套插入孔内，确保轴套两端与加强板端面配合，最后进行满焊。\",\n    \"position_description\": \"位于铲板两侧的耳板上，轴套与耳板孔配合。\",\n    \"parts_used\": [\n      {\n        \"bom_seq\": \"10\",\n        \"bom_name\": \"轴套加强板 2\",\n        \"quantity\": 2,\n        \"drawing_number\": \"10\",\n        \"node_name\": [\n          \"NAUO18\",\n          \"NAUO17\"\n        ],\n        \"bom_code\": \"01.01.01.11526\"\n      },\n      {\n        \"bom_seq\": \"12\",\n        \"bom_name\": \"轴套 2\",\n        \"quantity\": 2,\n        \"drawing_number\": \"12\",\n        \"node_name\": [\n          \"NAUO21\",\n          \"NAUO20\"\n        ],\n        \"bom_code\": \"01.01.02.1222\"\n      }\n    ],\n    \"tools\": [\n      \"焊机\",\n      \"游标卡尺\"\n    ],\n    \"warnings\": [\n      \"轴套端面配合，焊高不可超过轴套端面。轴套与销轴组件配合焊接，需保证同轴度。\"\n    ],\n    \"welding\": {\n      \"required\": true,\n      \"welding_type\": \"角焊和环形焊\",\n      \"welding_method\": \"CO2气保焊或手工电弧焊（根据材料厚度）\",\n      \"weld_size\": \"轴套与加强板环形焊，焊脚高度4mm；加强板与铲板角焊，焊脚高度6mm\",\n      \"welding_position\": \"零件⑩轴套加强板与零件①左铲板的连接处（角焊），零件⑫轴套与加强板的连接处（环焊），可能涉及横焊和立焊\",\n      \"quality_requirements\": \"轴套焊接时，必须保证同轴度，焊缝应均匀，焊高不得超过轴套端面。焊后需进行外观检查和尺寸复核。\",\n      \"safety_notes\": \"轴套焊接时，注意控制热输入，防止轴套孔径变形。使用合适的夹具固定轴套，确保定位精度。\"\n    }\n  },\n  {\n    \"step_number\": 8,\n    \"action\": \"安装反光片安装板\",\n    \"description\": \"将图纸上标注为11的反光片安装板（01.01.01.11527，1块）焊接到铲板上部指定位置。\",\n    \"position_description\": \"位于铲板上部边缘。\",\n    \"parts_used\": [\n      {\n        \"bom_seq\": \"11\",\n        \"bom_name\": \"反光片安装板 1\",\n        \"quantity\": 1,\n        \"drawing_number\": \"11\",\n        \"node_name\": [\n          \"NAUO19\"\n        ],\n        \"bom_code\": \"01.01.01.11527\"\n      }\n    ],\n    \"tools\": [\n      \"焊机\"\n    ],\n    \"warnings\": [\n      \"反光片安装板位置需准确，确保反光片安装后朝向正确。\"\n    ],\n    \"welding\": {\n      \"required\": true,\n      \"welding_type\": \"角焊\",\n      \"welding_method\": \"CO2气保焊\",\n      \"weld_size\": \"焊脚高度4mm，连续焊\",\n      \"welding_position\": \"零件⑪反光片安装板与零件①左铲板的连接处，主要为平焊位置\",\n      \"quality_requirements\": \"焊缝外观整洁，不影响后续反光片安装。注意控制焊接变形。\",\n      \"safety_notes\": \"焊接时注意保护眼睛和皮肤，避免电弧光伤害。确保焊机电缆无破损。\"\n    }\n  },\n  {\n    \"step_number\": 9,\n    \"action\": \"安装方形板\",\n    \"description\": \"将图纸上标注为13的方形板 1（01.01.01.11528，1块）和标注为14的方形板 3（01.01.01.11529，1块）焊接到铲板上部边缘。\",\n    \"position_description\": \"位于铲板上部边缘，靠近反光片安装板（11）区域。\",\n    \"parts_used\": [\n      {\n        \"bom_seq\": \"13\",\n        \"bom_name\": \"方形板 1\",\n        \"quantity\": 1,\n        \"drawing_number\": \"13\"\n      },\n      {\n        \"bom_seq\": \"14\",\n        \"bom_name\": \"方形板 3\",\n        \"quantity\": 1,\n        \"drawing_number\": \"14\",\n        \"node_name\": [\n          \"NAUO24\",\n          \"NAUO23\",\n          \"NAUO22\"\n        ],\n        \"bom_code\": \"01.01.01.11529\"\n      }\n    ],\n    \"tools\": [\n      \"焊机\"\n    ],\n    \"warnings\": [\n      \"确保焊接牢固，焊缝符合技术要求。\"\n    ],\n    \"welding\": {\n      \"required\": true,\n      \"welding_type\": \"角焊\",\n      \"welding_method\": \"CO2气保焊\",\n      \"weld_size\": \"焊脚高度6mm，连续焊\",\n      \"welding_position\": \"零件⑬、⑭方形板与零件①左铲板的连接处，主要为平焊和横焊位置\",\n      \"quality_requirements\": \"焊缝必须连续，保证结构强度。焊缝表面应光滑，无飞溅物。\",\n      \"safety_notes\": \"焊接过程中，注意保持焊枪稳定，避免产生未熔合或夹渣。工作完成后，切断焊机电源。\"\n    }\n  },\n  {\n    \"step_number\": 10,\n    \"action\": \"安装左铲雪板加强板\",\n    \"description\": \"将图纸上标注为15的左铲雪板加强板 2（01.02.01.4983，2块）焊接到铲板内侧的加强筋上。\",\n    \"position_description\": \"位于铲板内侧，靠近前部。\",\n    \"parts_used\": [\n      {\n        \"bom_seq\": \"15\",\n        \"bom_name\": \"左铲雪板加强板 2\",\n        \"quantity\": 2,\n        \"drawing_number\": \"15\",\n        \"node_name\": [\n          \"NAUO26\",\n          \"NAUO25\"\n        ],\n        \"bom_code\": \"01.02.01.4983\"\n      }\n    ],\n    \"tools\": [\n      \"焊机\"\n    ],\n    \"warnings\": [\n      \"加强板需与铲板紧密贴合，确保焊接强度。\"\n    ],\n    \"welding\": {\n      \"required\": true,\n      \"welding_type\": \"角焊\",\n      \"welding_method\": \"CO2气保焊\",\n      \"weld_size\": \"焊脚高度6mm，连续焊\",\n      \"welding_position\": \"零件⑮左铲雪板加强板与零件①左铲板的连接处，主要为平焊位置\",\n      \"quality_requirements\": \"焊缝必须连续，保证结构强度。焊缝应力求均匀，防止应力集中。\",\n      \"safety_notes\": \"确保焊接区域无潮湿，防止产生气孔。注意控制焊接速度，保证熔深。\"\n    }\n  },\n  {\n    \"step_number\": 11,\n    \"action\": \"满焊与清理\",\n    \"description\": \"对所有点焊固定的零件进行满焊。焊接完成后，进行焊渣清理和表面处理。\",\n    \"position_description\": \"所有连接部位。\",\n    \"parts_used\": [],\n    \"tools\": [\n      \"焊机\",\n      \"角磨机\",\n      \"钢丝刷\"\n    ],\n    \"warnings\": [\n      \"焊缝应饱满、均匀，无夹渣、气孔等缺陷。注意折弯焊脚内侧需焊接完整。\"\n    ],\n    \"welding\": {\n      \"required\": true,\n      \"welding_type\": \"所有结构焊缝（角焊、环焊）\",\n      \"welding_method\": \"CO2气保焊为主\",\n      \"weld_size\": \"所有焊缝按图纸要求或默认焊脚高度6mm进行满焊\",\n      \"welding_position\": \"所有已定位零件的连接处，涉及平焊、横焊、立焊等多种位置\",\n      \"quality_requirements\": \"所有焊缝必须达到二级焊缝标准（GB/T 1804-B），焊缝表面平整，无裂纹、未熔合、未焊透、严重咬边。焊后进行外观检查和尺寸复核。\",\n      \"safety_notes\": \"满焊时热输入量大，注意控制整体变形。使用角磨机清理焊渣时，必须佩戴防护眼镜和防尘口罩，防止飞溅物和粉尘伤害。\"\n    }\n  }\n]\n\n## 要求\n\n请按照以下5个步骤思考，为装配步骤添加安全警告：\n\n### 步骤1：识别风险步骤\n- 分析每个装配步骤的操作内容\n- 判断是否涉及高风险作业：\n  * **焊接作业**：电击、弧光、烫伤、火灾\n  * **吊装作业**：吊物坠落、碰撞、超载\n  * **高空作业**：人员坠落、物体打击\n  * **重物搬运**：砸伤、扭伤、夹伤\n  * **机械加工**：切割伤、夹伤、碰撞\n\n### 步骤2：分析风险源\n- 确定风险的来源（设备、工具、材料、环境、人员操作等）\n- 评估风险的严重程度（轻微、中等、严重、致命）\n- 考虑风险的发生概率\n\n### 步骤3：制定预防措施\n- 针对每个风险源，制定具体的预防措施\n- 强调个人防护用品的使用：\n  * **焊接**：焊接面罩、防护手套、防护服\n  * **吊装**：安全帽、安全鞋、手套\n  * **高空**：安全带、安全帽、防滑鞋\n  * **机械**：防护眼镜、手套、安全鞋\n\n### 步骤4：添加安全警告\n- 为每个有风险的步骤添加safety_warnings字段\n- 每条警告要简洁明了，说明具体的风险和预防措施\n- 使用工人能看懂的语言\n\n### 步骤5：验证完整性\n- 检查所有高风险步骤是否都添加了安全警告\n- 检查安全警告是否具体、可操作\n- 检查是否遗漏了任何潜在风险\n\n## ⚠️ 强制自检清单（生成后必须逐项检查）\n\n**在输出JSON之前，你必须完成以下验证：**\n\n1. **风险步骤识别验证**：\n   - [ ] 所有涉及焊接、吊装、高空、重物搬运的步骤都添加了safety_warnings字段\n   - [ ] 没有明显风险的步骤没有添加safety_warnings字段\n\n2. **安全警告完整性验证**：\n   - [ ] 每个safety_warnings字段都是字符串数组\n   - [ ] 每条警告都说明了具体的风险和预防措施\n   - [ ] 涵盖了个人防护、设备安全、环境安全、操作安全\n\n3. **语言通俗性验证**：\n   - [ ] 使用工人能看懂的语言\n   - [ ] 避免专业术语和英文缩写\n   - [ ] 每条警告简洁明了（一句话）\n\n4. **原有字段保持验证**：\n   - [ ] 原有步骤的所有字段都保持不变（包括welding字段）\n   - [ ] 没有修改或删除任何原有字段\n\n**如果自检发现任何问题，必须重新生成！**\n\n现在开始为装配步骤添加安全警告！\n",
  "raw_response": "```json\n{\n  \"enhanced_steps\": [\n    {\n      \"step_number\": 1,\n      \"action\": \"放置基准件\",\n      \"description\": \"将图纸上标注为1的左铲板（01.01.01.18598）平稳放置在装配工作台上，作为装配基准。\",\n      \"position_description\": \"平放于工作台，铲板内侧朝上。\",\n      \"parts_used\": [\n        {\n          \"bom_seq\": \"1\",\n          \"bom_name\": \"左铲板 1\",\n          \"quantity\": 1,\n          \"drawing_number\": \"1\",\n          \"node_name\": [\n            \"NAUO1\"\n          ],\n          \"bom_code\": \"01.01.01.18598\"\n        }\n      ],\n      \"tools\": [\n        \"行车\",\n        \"吊具\"\n      ],\n      \"warnings\": [\n        \"注意吊装安全，防止铲板变形。\"\n      ],\n      \"safety_warnings\": [\n        \"吊装前检查吊具和钢丝绳是否完好，防止吊物坠落伤人。\",\n        \"吊装时必须佩戴安全帽和手套，并由专人指挥。\",\n        \"铲板体积较大，放置时注意周围人员和设备，防止碰撞或挤压。\",\n        \"铲板边缘可能锋利，搬运时佩戴防割手套，防止割伤。\"\n      ]\n    },\n    {\n      \"step_number\": 2,\n      \"action\": \"安装方形板-机加\",\n      \"description\": \"将图纸上标注为2的方形板-机加（01.01.01.18599）放置在1号左铲板的后部指定位置，进行点焊固定。\",\n      \"position_description\": \"位于1号左铲板后部，与铲板边缘对齐。\",\n      \"parts_used\": [\n        {\n          \"bom_seq\": \"2\",\n          \"bom_name\": \"方形板-机加 1\",\n          \"quantity\": 1,\n          \"drawing_number\": \"2\",\n          \"node_name\": [\n            \"NAUO2\"\n          ],\n          \"bom_code\": \"01.01.01.18599\"\n        }\n      ],\n      \"tools\": [\n        \"焊机\",\n        \"角尺\"\n      ],\n      \"warnings\": [\n        \"点焊时注意定位精度，确保方形板与铲板垂直。\"\n      ],\n      \"welding\": {\n        \"required\": true,\n        \"welding_type\": \"角焊（点焊定位）\",\n        \"welding_method\": \"CO2气保焊\",\n        \"weld_size\": \"点焊长度10-15mm，焊脚高度4mm\",\n        \"welding_position\": \"零件②方形板-机加与零件①左铲板的连接处，主要为平焊和横焊位置\",\n        \"quality_requirements\": \"点焊牢固，定位准确，确保后续满焊时零件不位移\",\n        \"safety_notes\": \"佩戴焊接面罩和防护手套，确保工作区域通风良好，防止火花飞溅。\"\n      },\n      \"safety_warnings\": [\n        \"进行点焊作业时，必须佩戴焊接面罩、防护手套和防护服，防止弧光灼伤和烫伤。\",\n        \"确保焊机接地良好，电缆无破损，防止触电。\",\n        \"焊接区域应保持通风良好，防止烟尘和有毒气体中毒。\",\n        \"清理焊接区域周围的易燃物，防止火花飞溅引起火灾。\"\n      ]\n    },\n    {\n      \"step_number\": 3,\n      \"action\": \"安装后加强板和前加强板\",\n      \"description\": \"将图纸上标注为3的后加强板（01.01.01.11519）和标注为4的前加强板（01.01.01.18600）分别放置在1号左铲板的内侧指定位置，进行点焊固定。\",\n      \"position_description\": \"3号后加强板位于铲板后部内侧，4号前加强板位于铲板前部内侧。\",\n      \"parts_used\": [\n        {\n          \"bom_seq\": \"3\",\n          \"bom_name\": \"后加强板 1\",\n          \"quantity\": 1,\n          \"drawing_number\": \"3\",\n          \"node_name\": [\n            \"NAUO3\"\n          ],\n          \"bom_code\": \"01.01.01.11519\"\n        },\n        {\n          \"bom_seq\": \"4\",\n          \"bom_name\": \"前加强板 1\",\n          \"quantity\": 1,\n          \"drawing_number\": \"4\",\n          \"node_name\": [\n            \"NAUO4\"\n          ],\n          \"bom_code\": \"01.01.01.18600\"\n        }\n      ],\n      \"tools\": [\n        \"焊机\",\n        \"卷尺\"\n      ],\n      \"warnings\": [\n        \"加强板的定位尺寸必须准确，确保后续零件安装孔位对齐。\"\n      ],\n      \"welding\": {\n        \"required\": true,\n        \"welding_type\": \"角焊（点焊定位）\",\n        \"welding_method\": \"CO2气保焊\",\n        \"weld_size\": \"点焊长度10-15mm，焊脚高度4mm\",\n        \"welding_position\": \"零件③、④加强板与零件①左铲板的连接处，主要为平焊位置\",\n        \"quality_requirements\": \"定位准确，点焊均匀分布，防止焊接应力集中导致变形\",\n        \"safety_notes\": \"检查焊机接地线是否牢固，避免触电风险。工作区域保持干燥。\"\n      },\n      \"safety_warnings\": [\n        \"点焊时必须佩戴焊接面罩和防护手套，防止电弧光和高温飞溅物伤害。\",\n        \"检查焊机接地线是否牢固，避免触电风险。\",\n        \"加强板边缘可能锋利，搬运和定位时佩戴手套，防止割伤。\",\n        \"确保工作区域干燥，防止潮湿环境引发触电。\"\n      ]\n    },\n    {\n      \"step_number\": 4,\n      \"action\": \"安装底部连接板和前油缸固定板\",\n      \"description\": \"将图纸上标注为5的底部连接板（01.01.01.11521，共6块）和标注为6的前油缸固定板（01.01.01.11522，共2块）分别焊接到1号左铲板的底部和内侧指定位置。\",\n      \"position_description\": \"5号底部连接板均匀分布在铲板底部，6号前油缸固定板位于铲板内侧中部，注意与图纸尺寸对齐。\",\n      \"parts_used\": [\n        {\n          \"bom_seq\": \"5\",\n          \"bom_name\": \"底部连接板 6\",\n          \"quantity\": 6,\n          \"drawing_number\": \"5\",\n          \"node_name\": [\n            \"NAUO15\",\n            \"NAUO14\",\n            \"NAUO13\",\n            \"NAUO12\",\n            \"NAUO6\",\n            \"NAUO5\"\n          ],\n          \"bom_code\": \"01.01.01.11521\"\n        },\n        {\n          \"bom_seq\": \"6\",\n          \"bom_name\": \"前油缸固定板 2\",\n          \"quantity\": 2,\n          \"drawing_number\": \"6\",\n          \"node_name\": [\n            \"NAUO8\",\n            \"NAUO7\"\n          ],\n          \"bom_code\": \"01.01.01.11522\"\n        }\n      ],\n      \"tools\": [\n        \"焊机\",\n        \"卡尺\"\n      ],\n      \"warnings\": [\n        \"油缸固定板需与铲雪板后座连接架组件配合焊接，确保配合精度。\"\n      ],\n      \"welding\": {\n        \"required\": true,\n        \"welding_type\": \"角焊\",\n        \"welding_method\": \"CO2气保焊\",\n        \"weld_size\": \"焊脚高度6mm（根据图纸未标注尺寸默认），连续焊\",\n        \"welding_position\": \"零件⑤底部连接板和零件⑥前油缸固定板与零件①左铲板的连接处，主要为平焊和横焊位置\",\n        \"quality_requirements\": \"焊缝连续、饱满，无咬边、未焊透等缺陷。油缸固定板（6）的焊接尤其重要，需保证强度。\",\n        \"safety_notes\": \"焊接前清理坡口和焊件表面，去除油污和锈蚀。注意控制焊接电流，防止烧穿薄板区域。\"\n      },\n      \"safety_warnings\": [\n        \"进行连续焊时，热量大，必须穿戴好防护服和安全鞋，防止高温烫伤。\",\n        \"焊接前清理坡口和焊件表面时，佩戴防护眼镜和防尘口罩，防止粉尘和飞溅物伤害。\",\n        \"确保焊接区域通风良好，防止焊接烟尘浓度过高。\",\n        \"注意控制焊接电流，防止因烧穿薄板造成火花飞溅伤人。\"\n      ]\n    },\n    {\n      \"step_number\": 5,\n      \"action\": \"安装弹簧固定板\",\n      \"description\": \"将图纸上标注为7的前弹簧固定板（01.01.01.11523，1块）和标注为8的后弹簧固定板（01.01.01.11524，2块）焊接到1号左铲板内侧的加强板上。\",\n      \"position_description\": \"7号前弹簧固定板位于前加强板（4）上，8号后弹簧固定板位于后加强板（3）上。\",\n      \"parts_used\": [\n        {\n          \"bom_seq\": \"7\",\n          \"bom_name\": \"前弹簧固定板 1\",\n          \"quantity\": 1,\n          \"drawing_number\": \"7\",\n          \"node_name\": [\n            \"NAUO9\"\n          ],\n          \"bom_code\": \"01.01.01.11523\"\n        },\n        {\n          \"bom_seq\": \"8\",\n          \"bom_name\": \"后弹簧固定板 2\",\n          \"quantity\": 2,\n          \"drawing_number\": \"8\",\n          \"node_name\": [\n            \"NAUO11\",\n            \"NAUO10\"\n          ],\n          \"bom_code\": \"01.01.01.11524\"\n        }\n      ],\n      \"tools\": [\n        \"焊机\",\n        \"定位夹具\"\n      ],\n      \"warnings\": [\n        \"弹簧固定板的孔位必须与图纸尺寸严格对齐，确保弹簧安装顺畅。\"\n      ],\n      \"welding\": {\n        \"required\": true,\n        \"welding_type\": \"角焊\",\n        \"welding_method\": \"CO2气保焊\",\n        \"weld_size\": \"焊脚高度6mm，连续焊\",\n        \"welding_position\": \"零件⑦、⑧弹簧固定板与零件③、④加强板的连接处，主要为平焊位置\",\n        \"quality_requirements\": \"焊缝必须连续，保证受力强度。焊后检查孔位尺寸，防止焊接变形影响安装。\",\n        \"safety_notes\": \"使用定位夹具固定零件，防止焊接过程中零件移动。注意焊枪角度，确保焊缝熔深足够。\"\n      },\n      \"safety_warnings\": [\n        \"使用定位夹具固定零件时，注意夹具的稳定性，防止零件脱落砸伤。\",\n        \"焊接时注意焊枪角度和位置，防止焊渣飞溅到身体或眼睛。\",\n        \"焊后检查孔位尺寸时，注意零件可能存在高温，避免直接用手触摸造成烫伤。\",\n        \"确保焊接区域无油污，防止焊接时产生有毒烟雾。\"\n      ]\n    },\n    {\n      \"step_number\": 6,\n      \"action\": \"安装支撑固定板\",\n      \"description\": \"将图纸上标注为9的支撑固定板（01.01.01.11525，1块）焊接到1号左铲板的内侧中部。\",\n      \"position_description\": \"位于铲板内侧，靠近底部连接板（5）区域。\",\n      \"parts_used\": [\n        {\n          \"bom_seq\": \"9\",\n          \"bom_name\": \"支撑固定板 1\",\n          \"quantity\": 1,\n          \"drawing_number\": \"9\",\n          \"node_name\": [\n            \"NAUO16\"\n          ],\n          \"bom_code\": \"01.01.01.11525\"\n        }\n      ],\n      \"tools\": [\n        \"焊机\"\n      ],\n      \"warnings\": [\n        \"确保焊接牢固，支撑固定板是受力件。\"\n      ],\n      \"welding\": {\n        \"required\": true,\n        \"welding_type\": \"角焊\",\n        \"welding_method\": \"CO2气保焊\",\n        \"weld_size\": \"焊脚高度6mm，连续焊\",\n        \"welding_position\": \"零件⑨支撑固定板与零件①左铲板的连接处，主要为平焊位置\",\n        \"quality_requirements\": \"焊缝外观平整，无裂纹、气孔。该板为主要受力结构，焊接质量要求高。\",\n        \"safety_notes\": \"穿戴好防护服和安全鞋，防止高温烫伤。焊接区域保持整洁，避免绊倒。\"\n      },\n      \"safety_warnings\": [\n        \"焊接时必须穿戴防护服和安全鞋，防止高温烫伤。\",\n        \"焊接区域地面应保持整洁，避免电缆或工具散落造成绊倒事故。\",\n        \"确保焊枪和电缆绝缘良好，避免漏电。\",\n        \"焊后应立即清理焊渣，防止他人被高温焊渣烫伤。\"\n      ]\n    },\n    {\n      \"step_number\": 7,\n      \"action\": \"安装轴套加强板和轴套\",\n      \"description\": \"将图纸上标注为10的轴套加强板（01.01.01.11526，2块）和标注为12的轴套（01.01.02.1222，2块）安装到铲板两侧的耳板上。先将轴套加强板点焊定位，然后将轴套插入孔内，确保轴套两端与加强板端面配合，最后进行满焊。\",\n      \"position_description\": \"位于铲板两侧的耳板上，轴套与耳板孔配合。\",\n      \"parts_used\": [\n        {\n          \"bom_seq\": \"10\",\n          \"bom_name\": \"轴套加强板 2\",\n          \"quantity\": 2,\n          \"drawing_number\": \"10\",\n          \"node_name\": [\n            \"NAUO18\",\n            \"NAUO17\"\n          ],\n          \"bom_code\": \"01.01.01.11526\"\n        },\n        {\n          \"bom_seq\": \"12\",\n          \"bom_name\": \"轴套 2\",\n          \"quantity\": 2,\n          \"drawing_number\": \"12\",\n          \"node_name\": [\n            \"NAUO21\",\n            \"NAUO20\"\n          ],\n          \"bom_code\": \"01.01.02.1222\"\n        }\n      ],\n      \"tools\": [\n        \"焊机\",\n        \"游标卡尺\"\n      ],\n      \"warnings\": [\n        \"轴套端面配合，焊高不可超过轴套端面。轴套与销轴组件配合焊接，需保证同轴度。\"\n      ],\n      \"welding\": {\n        \"required\": true,\n        \"welding_type\": \"角焊和环形焊\",\n        \"welding_method\": \"CO2气保焊或手工电弧焊（根据材料厚度）\",\n        \"weld_size\": \"轴套与加强板环形焊，焊脚高度4mm；加强板与铲板角焊，焊脚高度6mm\",\n        \"welding_position\": \"零件⑩轴套加强板与零件①左铲板的连接处（角焊），零件⑫轴套与加强板的连接处（环焊），可能涉及横焊和立焊\",\n        \"quality_requirements\": \"轴套焊接时，必须保证同轴度，焊缝应均匀，焊高不得超过轴套端面。焊后需进行外观检查和尺寸复核。\",\n        \"safety_notes\": \"轴套焊接时，注意控制热输入，防止轴套孔径变形。使用合适的夹具固定轴套，确保定位精度。\"\n      },\n      \"safety_warnings\": [\n        \"进行环形焊时，注意焊枪角度和姿势，防止长时间弯腰或扭曲造成肌肉劳损。\",\n        \"轴套焊接时热输入量大，注意控制温度，防止轴套孔径变形影响后续装配。\",\n        \"涉及横焊和立焊时，注意熔渣和金属液滴飞溅，加强面部和颈部防护。\",\n        \"使用游标卡尺复核尺寸时，注意轴套边缘可能存在毛刺，佩戴手套防止割伤。\"\n      ]\n    },\n    {\n      \"step_number\": 8,\n      \"action\": \"安装反光片安装板\",\n      \"description\": \"将图纸上标注为11的反光片安装板（01.01.01.11527，1块）焊接到铲板上部指定位置。\",\n      \"position_description\": \"位于铲板上部边缘。\",\n      \"parts_used\": [\n        {\n          \"bom_seq\": \"11\",\n          \"bom_name\": \"反光片安装板 1\",\n          \"quantity\": 1,\n          \"drawing_number\": \"11\",\n          \"node_name\": [\n            \"NAUO19\"\n          ],\n          \"bom_code\": \"01.01.01.11527\"\n        }\n      ],\n      \"tools\": [\n        \"焊机\"\n      ],\n      \"warnings\": [\n        \"反光片安装板位置需准确，确保反光片安装后朝向正确。\"\n      ],\n      \"welding\": {\n        \"required\": true,\n        \"welding_type\": \"角焊\",\n        \"welding_method\": \"CO2气保焊\",\n        \"weld_size\": \"焊脚高度4mm，连续焊\",\n        \"welding_position\": \"零件⑪反光片安装板与零件①左铲板的连接处，主要为平焊位置\",\n        \"quality_requirements\": \"焊缝外观整洁，不影响后续反光片安装。注意控制焊接变形。\",\n        \"safety_notes\": \"焊接时注意保护眼睛和皮肤，避免电弧光伤害。确保焊机电缆无破损。\"\n      },\n      \"safety_warnings\": [\n        \"焊接时必须佩戴焊接面罩，防止电弧光伤害眼睛。\",\n        \"确保焊机电缆无破损和裸露，防止触电。\",\n        \"焊接完成后，注意检查焊缝周围是否有飞溅物，及时清理，防止烫伤或割伤。\"\n      ]\n    },\n    {\n      \"step_number\": 9,\n      \"action\": \"安装方形板\",\n      \"description\": \"将图纸上标注为13的方形板 1（01.01.01.11528，1块）和标注为14的方形板 3（01.01.01.11529，1块）焊接到铲板上部边缘。\",\n      \"position_description\": \"位于铲板上部边缘，靠近反光片安装板（11）区域。\",\n      \"parts_used\": [\n        {\n          \"bom_seq\": \"13\",\n          \"bom_name\": \"方形板 1\",\n          \"quantity\": 1,\n          \"drawing_number\": \"13\"\n        },\n        {\n          \"bom_seq\": \"14\",\n          \"bom_name\": \"方形板 3\",\n          \"quantity\": 1,\n          \"drawing_number\": \"14\",\n          \"node_name\": [\n            \"NAUO24\",\n            \"NAUO23\",\n            \"NAUO22\"\n          ],\n          \"bom_code\": \"01.01.01.11529\"\n        }\n      ],\n      \"tools\": [\n        \"焊机\"\n      ],\n      \"warnings\": [\n        \"确保焊接牢固，焊缝符合技术要求。\"\n      ],\n      \"welding\": {\n        \"required\": true,\n        \"welding_type\": \"角焊\",\n        \"welding_method\": \"CO2气保焊\",\n        \"weld_size\": \"焊脚高度6mm，连续焊\",\n        \"welding_position\": \"零件⑬、⑭方形板与零件①左铲板的连接处，主要为平焊和横焊位置\",\n        \"quality_requirements\": \"焊缝必须连续，保证结构强度。焊缝表面应光滑，无飞溅物。\",\n        \"safety_notes\": \"焊接过程中，注意保持焊枪稳定，避免产生未熔合或夹渣。工作完成后，切断焊机电源。\"\n      },\n      \"safety_warnings\": [\n        \"焊接完成后，必须切断焊机电源，避免设备空载运行或意外触电。\",\n        \"注意清理焊接飞溅物，防止飞溅物伤人或造成环境污染。\",\n        \"在进行横焊时，注意防止熔融金属滴落烫伤脚部，必须穿戴安全鞋。\"\n      ]\n    },\n    {\n      \"step_number\": 10,\n      \"action\": \"安装左铲雪板加强板\",\n      \"description\": \"将图纸上标注为15的左铲雪板加强板 2（01.02.01.4983，2块）焊接到铲板内侧的加强筋上。\",\n      \"position_description\": \"位于铲板内侧，靠近前部。\",\n      \"parts_used\": [\n        {\n          \"bom_seq\": \"15\",\n          \"bom_name\": \"左铲雪板加强板 2\",\n          \"quantity\": 2,\n          \"drawing_number\": \"15\",\n          \"node_name\": [\n            \"NAUO26\",\n            \"NAUO25\"\n          ],\n          \"bom_code\": \"01.02.01.4983\"\n        }\n      ],\n      \"tools\": [\n        \"焊机\"\n      ],\n      \"warnings\": [\n        \"加强板需与铲板紧密贴合，确保焊接强度。\"\n      ],\n      \"welding\": {\n        \"required\": true,\n        \"welding_type\": \"角焊\",\n        \"welding_method\": \"CO2气保焊\",\n        \"weld_size\": \"焊脚高度6mm，连续焊\",\n        \"welding_position\": \"零件⑮左铲雪板加强板与零件①左铲板的连接处，主要为平焊位置\",\n        \"quality_requirements\": \"焊缝必须连续，保证结构强度。焊缝应力求均匀，防止应力集中。\",\n        \"safety_notes\": \"确保焊接区域无潮湿，防止产生气孔。注意控制焊接速度，保证熔深。\"\n      },\n      \"safety_warnings\": [\n        \"确保焊接区域无潮湿，防止因水汽导致焊接缺陷和触电风险。\",\n        \"焊接时注意控制焊接速度和热输入，防止零件因热应力集中而变形或开裂。\",\n        \"佩戴防护眼镜，防止焊接过程中产生的烟尘和飞溅物进入眼睛。\"\n      ]\n    },\n    {\n      \"step_number\": 11,\n      \"action\": \"满焊与清理\",\n      \"description\": \"对所有点焊固定的零件进行满焊。焊接完成后，进行焊渣清理和表面处理。\",\n      \"position_description\": \"所有连接部位。\",\n      \"parts_used\": [],\n      \"tools\": [\n        \"焊机\",\n        \"角磨机\",\n        \"钢丝刷\"\n      ],\n      \"warnings\": [\n        \"焊缝应饱满、均匀，无夹渣、气孔等缺陷。注意折弯焊脚内侧需焊接完整。\"\n      ],\n      \"welding\": {\n        \"required\": true,\n        \"welding_type\": \"所有结构焊缝（角焊、环焊）\",\n        \"welding_method\": \"CO2气保焊为主\",\n        \"weld_size\": \"所有焊缝按图纸要求或默认焊脚高度6mm进行满焊\",\n        \"welding_position\": \"所有已定位零件的连接处，涉及平焊、横焊、立焊等多种位置\",\n        \"quality_requirements\": \"所有焊缝必须达到二级焊缝标准（GB/T 1804-B），焊缝表面平整，无裂纹、未熔合、未焊透、严重咬边。焊后进行外观检查和尺寸复核。\",\n        \"safety_notes\": \"满焊时热输入量大，注意控制整体变形。使用角磨机清理焊渣时，必须佩戴防护眼镜和防尘口罩，防止飞溅物和粉尘伤害。\"\n      },\n      \"safety_warnings\": [\n        \"使用角磨机清理焊渣时，必须佩戴防护眼镜和防尘口罩，防止金属碎屑和粉尘伤害。\",\n        \"操作角磨机时，双手握紧，站稳，防止磨片破碎或反弹伤人。\",\n        \"满焊时热输入量大，注意控制整体变形，并设置隔离区，防止他人接触高温工件造成烫伤。\",\n        \"清理焊渣时，使用钢丝刷和锤子时，注意周围人员，防止飞溅物伤人。\"\n      ]\n    }\n  ]\n}\n```",
  "parsed_result": {
    "enhanced_steps": [
      {
        "step_number": 1,
        "action": "放置基准件",
        "description": "将图纸上标注为1的左铲板（01.01.01.18598）平稳放置在装配工作台上，作为装配基准。",
        "position_description": "平放于工作台，铲板内侧朝上。",
        "parts_used": [
          {
            "bom_seq": "1",
            "bom_name": "左铲板 1",
            "quantity": 1,
            "drawing_number": "1",
            "node_name": [
              "NAUO1"
            ],
            "bom_code": "01.01.01.18598"
          }
        ],
        "tools": [
          "行车",
          "吊具"
        ],
        "warnings": [
          "注意吊装安全，防止铲板变形。"
        ],
        "safety_warnings": [
          "吊装前检查吊具和钢丝绳是否完好，防止吊物坠落伤人。",
          "吊装时必须佩戴安全帽和手套，并由专人指挥。",
          "铲板体积较大，放置时注意周围人员和设备，防止碰撞或挤压。",
          "铲板边缘可能锋利，搬运时佩戴防割手套，防止割伤。"
        ]
      },
      {
        "step_number": 2,
        "action": "安装方形板-机加",
        "description": "将图纸上标注为2的方形板-机加（01.01.01.18599）放置在1号左铲板的后部指定位置，进行点焊固定。",
        "position_description": "位于1号左铲板后部，与铲板边缘对齐。",
        "parts_used": [
          {
            "bom_seq": "2",
            "bom_name": "方形板-机加 1",
            "quantity": 1,
            "drawing_number": "2",
            "node_name": [
              "NAUO2"
            ],
            "bom_code": "01.01.01.18599"
          }
        ],
        "tools": [
          "焊机",
          "角尺"
        ],
        "warnings": [
          "点焊时注意定位精度，确保方形板与铲板垂直。"
        ],
        "welding": {
          "required": true,
          "welding_type": "角焊（点焊定位）",
          "welding_method": "CO2气保焊",
          "weld_size": "点焊长度10-15mm，焊脚高度4mm",
          "welding_position": "零件②方形板-机加与零件①左铲板的连接处，主要为平焊和横焊位置",
          "quality_requirements": "点焊牢固，定位准确，确保后续满焊时零件不位移",
          "safety_notes": "佩戴焊接面罩和防护手套，确保工作区域通风良好，防止火花飞溅。"
        },
        "safety_warnings": [
          "进行点焊作业时，必须佩戴焊接面罩、防护手套和防护服，防止弧光灼伤和烫伤。",
          "确保焊机接地良好，电缆无破损，防止触电。",
          "焊接区域应保持通风良好，防止烟尘和有毒气体中毒。",
          "清理焊接区域周围的易燃物，防止火花飞溅引起火灾。"
        ]
      },
      {
        "step_number": 3,
        "action": "安装后加强板和前加强板",
        "description": "将图纸上标注为3的后加强板（01.01.01.11519）和标注为4的前加强板（01.01.01.18600）分别放置在1号左铲板的内侧指定位置，进行点焊固定。",
        "position_description": "3号后加强板位于铲板后部内侧，4号前加强板位于铲板前部内侧。",
        "parts_used": [
          {
            "bom_seq": "3",
            "bom_name": "后加强板 1",
            "quantity": 1,
            "drawing_number": "3",
            "node_name": [
              "NAUO3"
            ],
            "bom_code": "01.01.01.11519"
          },
          {
            "bom_seq": "4",
            "bom_name": "前加强板 1",
            "quantity": 1,
            "drawing_number": "4",
            "node_name": [
              "NAUO4"
            ],
            "bom_code": "01.01.01.18600"
          }
        ],
        "tools": [
          "焊机",
          "卷尺"
        ],
        "warnings": [
          "加强板的定位尺寸必须准确，确保后续零件安装孔位对齐。"
        ],
        "welding": {
          "required": true,
          "welding_type": "角焊（点焊定位）",
          "welding_method": "CO2气保焊",
          "weld_size": "点焊长度10-15mm，焊脚高度4mm",
          "welding_position": "零件③、④加强板与零件①左铲板的连接处，主要为平焊位置",
          "quality_requirements": "定位准确，点焊均匀分布，防止焊接应力集中导致变形",
          "safety_notes": "检查焊机接地线是否牢固，避免触电风险。工作区域保持干燥。"
        },
        "safety_warnings": [
          "点焊时必须佩戴焊接面罩和防护手套，防止电弧光和高温飞溅物伤害。",
          "检查焊机接地线是否牢固，避免触电风险。",
          "加强板边缘可能锋利，搬运和定位时佩戴手套，防止割伤。",
          "确保工作区域干燥，防止潮湿环境引发触电。"
        ]
      },
      {
        "step_number": 4,
        "action": "安装底部连接板和前油缸固定板",
        "description": "将图纸上标注为5的底部连接板（01.01.01.11521，共6块）和标注为6的前油缸固定板（01.01.01.11522，共2块）分别焊接到1号左铲板的底部和内侧指定位置。",
        "position_description": "5号底部连接板均匀分布在铲板底部，6号前油缸固定板位于铲板内侧中部，注意与图纸尺寸对齐。",
        "parts_used": [
          {
            "bom_seq": "5",
            "bom_name": "底部连接板 6",
            "quantity": 6,
            "drawing_number": "5",
            "node_name": [
              "NAUO15",
              "NAUO14",
              "NAUO13",
              "NAUO12",
              "NAUO6",
              "NAUO5"
            ],
            "bom_code": "01.01.01.11521"
          },
          {
            "bom_seq": "6",
            "bom_name": "前油缸固定板 2",
            "quantity": 2,
            "drawing_number": "6",
            "node_name": [
              "NAUO8",
              "NAUO7"
            ],
            "bom_code": "01.01.01.11522"
          }
        ],
        "tools": [
          "焊机",
          "卡尺"
        ],
        "warnings": [
          "油缸固定板需与铲雪板后座连接架组件配合焊接，确保配合精度。"
        ],
        "welding": {
          "required": true,
          "welding_type": "角焊",
          "welding_method": "CO2气保焊",
          "weld_size": "焊脚高度6mm（根据图纸未标注尺寸默认），连续焊",
          "welding_position": "零件⑤底部连接板和零件⑥前油缸固定板与零件①左铲板的连接处，主要为平焊和横焊位置",
          "quality_requirements": "焊缝连续、饱满，无咬边、未焊透等缺陷。油缸固定板（6）的焊接尤其重要，需保证强度。",
          "safety_notes": "焊接前清理坡口和焊件表面，去除油污和锈蚀。注意控制焊接电流，防止烧穿薄板区域。"
        },
        "safety_warnings": [
          "进行连续焊时，热量大，必须穿戴好防护服和安全鞋，防止高温烫伤。",
          "焊接前清理坡口和焊件表面时，佩戴防护眼镜和防尘口罩，防止粉尘和飞溅物伤害。",
          "确保焊接区域通风良好，防止焊接烟尘浓度过高。",
          "注意控制焊接电流，防止因烧穿薄板造成火花飞溅伤人。"
        ]
      },
      {
        "step_number": 5,
        "action": "安装弹簧固定板",
        "description": "将图纸上标注为7的前弹簧固定板（01.01.01.11523，1块）和标注为8的后弹簧固定板（01.01.01.11524，2块）焊接到1号左铲板内侧的加强板上。",
        "position_description": "7号前弹簧固定板位于前加强板（4）上，8号后弹簧固定板位于后加强板（3）上。",
        "parts_used": [
          {
            "bom_seq": "7",
            "bom_name": "前弹簧固定板 1",
            "quantity": 1,
            "drawing_number": "7",
            "node_name": [
              "NAUO9"
            ],
            "bom_code": "01.01.01.11523"
          },
          {
            "bom_seq": "8",
            "bom_name": "后弹簧固定板 2",
            "quantity": 2,
            "drawing_number": "8",
            "node_name": [
              "NAUO11",
              "NAUO10"
            ],
            "bom_code": "01.01.01.11524"
          }
        ],
        "tools": [
          "焊机",
          "定位夹具"
        ],
        "warnings": [
          "弹簧固定板的孔位必须与图纸尺寸严格对齐，确保弹簧安装顺畅。"
        ],
        "welding": {
          "required": true,
          "welding_type": "角焊",
          "welding_method": "CO2气保焊",
          "weld_size": "焊脚高度6mm，连续焊",
          "welding_position": "零件⑦、⑧弹簧固定板与零件③、④加强板的连接处，主要为平焊位置",
          "quality_requirements": "焊缝必须连续，保证受力强度。焊后检查孔位尺寸，防止焊接变形影响安装。",
          "safety_notes": "使用定位夹具固定零件，防止焊接过程中零件移动。注意焊枪角度，确保焊缝熔深足够。"
        },
        "safety_warnings": [
          "使用定位夹具固定零件时，注意夹具的稳定性，防止零件脱落砸伤。",
          "焊接时注意焊枪角度和位置，防止焊渣飞溅到身体或眼睛。",
          "焊后检查孔位尺寸时，注意零件可能存在高温，避免直接用手触摸造成烫伤。",
          "确保焊接区域无油污，防止焊接时产生有毒烟雾。"
        ]
      },
      {
        "step_number": 6,
        "action": "安装支撑固定板",
        "description": "将图纸上标注为9的支撑固定板（01.01.01.11525，1块）焊接到1号左铲板的内侧中部。",
        "position_description": "位于铲板内侧，靠近底部连接板（5）区域。",
        "parts_used": [
          {
            "bom_seq": "9",
            "bom_name": "支撑固定板 1",
            "quantity": 1,
            "drawing_number": "9",
            "node_name": [
              "NAUO16"
            ],
            "bom_code": "01.01.01.11525"
          }
        ],
        "tools": [
          "焊机"
        ],
        "warnings": [
          "确保焊接牢固，支撑固定板是受力件。"
        ],
        "welding": {
          "required": true,
          "welding_type": "角焊",
          "welding_method": "CO2气保焊",
          "weld_size": "焊脚高度6mm，连续焊",
          "welding_position": "零件⑨支撑固定板与零件①左铲板的连接处，主要为平焊位置",
          "quality_requirements": "焊缝外观平整，无裂纹、气孔。该板为主要受力结构，焊接质量要求高。",
          "safety_notes": "穿戴好防护服和安全鞋，防止高温烫伤。焊接区域保持整洁，避免绊倒。"
        },
        "safety_warnings": [
          "焊接时必须穿戴防护服和安全鞋，防止高温烫伤。",
          "焊接区域地面应保持整洁，避免电缆或工具散落造成绊倒事故。",
          "确保焊枪和电缆绝缘良好，避免漏电。",
          "焊后应立即清理焊渣，防止他人被高温焊渣烫伤。"
        ]
      },
      {
        "step_number": 7,
        "action": "安装轴套加强板和轴套",
        "description": "将图纸上标注为10的轴套加强板（01.01.01.11526，2块）和标注为12的轴套（01.01.02.1222，2块）安装到铲板两侧的耳板上。先将轴套加强板点焊定位，然后将轴套插入孔内，确保轴套两端与加强板端面配合，最后进行满焊。",
        "position_description": "位于铲板两侧的耳板上，轴套与耳板孔配合。",
        "parts_used": [
          {
            "bom_seq": "10",
            "bom_name": "轴套加强板 2",
            "quantity": 2,
            "drawing_number": "10",
            "node_name": [
              "NAUO18",
              "NAUO17"
            ],
            "bom_code": "01.01.01.11526"
          },
          {
            "bom_seq": "12",
            "bom_name": "轴套 2",
            "quantity": 2,
            "drawing_number": "12",
            "node_name": [
              "NAUO21",
              "NAUO20"
            ],
            "bom_code": "01.01.02.1222"
          }
        ],
        "tools": [
          "焊机",
          "游标卡尺"
        ],
        "warnings": [
          "轴套端面配合，焊高不可超过轴套端面。轴套与销轴组件配合焊接，需保证同轴度。"
        ],
        "welding": {
          "required": true,
          "welding_type": "角焊和环形焊",
          "welding_method": "CO2气保焊或手工电弧焊（根据材料厚度）",
          "weld_size": "轴套与加强板环形焊，焊脚高度4mm；加强板与铲板角焊，焊脚高度6mm",
          "welding_position": "零件⑩轴套加强板与零件①左铲板的连接处（角焊），零件⑫轴套与加强板的连接处（环焊），可能涉及横焊和立焊",
          "quality_requirements": "轴套焊接时，必须保证同轴度，焊缝应均匀，焊高不得超过轴套端面。焊后需进行外观检查和尺寸复核。",
          "safety_notes": "轴套焊接时，注意控制热输入，防止轴套孔径变形。使用合适的夹具固定轴套，确保定位精度。"
        },
        "safety_warnings": [
          "进行环形焊时，注意焊枪角度和姿势，防止长时间弯腰或扭曲造成肌肉劳损。",
          "轴套焊接时热输入量大，注意控制温度，防止轴套孔径变形影响后续装配。",
          "涉及横焊和立焊时，注意熔渣和金属液滴飞溅，加强面部和颈部防护。",
          "使用游标卡尺复核尺寸时，注意轴套边缘可能存在毛刺，佩戴手套防止割伤。"
        ]
      },
      {
        "step_number": 8,
        "action": "安装反光片安装板",
        "description": "将图纸上标注为11的反光片安装板（01.01.01.11527，1块）焊接到铲板上部指定位置。",
        "position_description": "位于铲板上部边缘。",
        "parts_used": [
          {
            "bom_seq": "11",
            "bom_name": "反光片安装板 1",
            "quantity": 1,
            "drawing_number": "11",
            "node_name": [
              "NAUO19"
            ],
            "bom_code": "01.01.01.11527"
          }
        ],
        "tools": [
          "焊机"
        ],
        "warnings": [
          "反光片安装板位置需准确，确保反光片安装后朝向正确。"
        ],
        "welding": {
          "required": true,
          "welding_type": "角焊",
          "welding_method": "CO2气保焊",
          "weld_size": "焊脚高度4mm，连续焊",
          "welding_position": "零件⑪反光片安装板与零件①左铲板的连接处，主要为平焊位置",
          "quality_requirements": "焊缝外观整洁，不影响后续反光片安装。注意控制焊接变形。",
          "safety_notes": "焊接时注意保护眼睛和皮肤，避免电弧光伤害。确保焊机电缆无破损。"
        },
        "safety_warnings": [
          "焊接时必须佩戴焊接面罩，防止电弧光伤害眼睛。",
          "确保焊机电缆无破损和裸露，防止触电。",
          "焊接完成后，注意检查焊缝周围是否有飞溅物，及时清理，防止烫伤或割伤。"
        ]
      },
      {
        "step_number": 9,
        "action": "安装方形板",
        "description": "将图纸上标注为13的方形板 1（01.01.01.11528，1块）和标注为14的方形板 3（01.01.01.11529，1块）焊接到铲板上部边缘。",
        "position_description": "位于铲板上部边缘，靠近反光片安装板（11）区域。",
        "parts_used": [
          {
            "bom_seq": "13",
            "bom_name": "方形板 1",
            "quantity": 1,
            "drawing_number": "13"
          },
          {
            "bom_seq": "14",
            "bom_name": "方形板 3",
            "quantity": 1,
            "drawing_number": "14",
            "node_name": [
              "NAUO24",
              "NAUO23",
              "NAUO22"
            ],
            "bom_code": "01.01.01.11529"
          }
        ],
        "tools": [
          "焊机"
        ],
        "warnings": [
          "确保焊接牢固，焊缝符合技术要求。"
        ],
        "welding": {
          "required": true,
          "welding_type": "角焊",
          "welding_method": "CO2气保焊",
          "weld_size": "焊脚高度6mm，连续焊",
          "welding_position": "零件⑬、⑭方形板与零件①左铲板的连接处，主要为平焊和横焊位置",
          "quality_requirements": "焊缝必须连续，保证结构强度。焊缝表面应光滑，无飞溅物。",
          "safety_notes": "焊接过程中，注意保持焊枪稳定，避免产生未熔合或夹渣。工作完成后，切断焊机电源。"
        },
        "safety_warnings": [
          "焊接完成后，必须切断焊机电源，避免设备空载运行或意外触电。",
          "注意清理焊接飞溅物，防止飞溅物伤人或造成环境污染。",
          "在进行横焊时，注意防止熔融金属滴落烫伤脚部，必须穿戴安全鞋。"
        ]
      },
      {
        "step_number": 10,
        "action": "安装左铲雪板加强板",
        "description": "将图纸上标注为15的左铲雪板加强板 2（01.02.01.4983，2块）焊接到铲板内侧的加强筋上。",
        "position_description": "位于铲板内侧，靠近前部。",
        "parts_used": [
          {
            "bom_seq": "15",
            "bom_name": "左铲雪板加强板 2",
            "quantity": 2,
            "drawing_number": "15",
            "node_name": [
              "NAUO26",
              "NAUO25"
            ],
            "bom_code": "01.02.01.4983"
          }
        ],
        "tools": [
          "焊机"
        ],
        "warnings": [
          "加强板需与铲板紧密贴合，确保焊接强度。"
        ],
        "welding": {
          "required": true,
          "welding_type": "角焊",
          "welding_method": "CO2气保焊",
          "weld_size": "焊脚高度6mm，连续焊",
          "welding_position": "零件⑮左铲雪板加强板与零件①左铲板的连接处，主要为平焊位置",
          "quality_requirements": "焊缝必须连续，保证结构强度。焊缝应力求均匀，防止应力集中。",
          "safety_notes": "确保焊接区域无潮湿，防止产生气孔。注意控制焊接速度，保证熔深。"
        },
        "safety_warnings": [
          "确保焊接区域无潮湿，防止因水汽导致焊接缺陷和触电风险。",
          "焊接时注意控制焊接速度和热输入，防止零件因热应力集中而变形或开裂。",
          "佩戴防护眼镜，防止焊接过程中产生的烟尘和飞溅物进入眼睛。"
        ]
      },
      {
        "step_number": 11,
        "action": "满焊与清理",
        "description": "对所有点焊固定的零件进行满焊。焊接完成后，进行焊渣清理和表面处理。",
        "position_description": "所有连接部位。",
        "parts_used": [],
        "tools": [
          "焊机",
          "角磨机",
          "钢丝刷"
        ],
        "warnings": [
          "焊缝应饱满、均匀，无夹渣、气孔等缺陷。注意折弯焊脚内侧需焊接完整。"
        ],
        "welding": {
          "required": true,
          "welding_type": "所有结构焊缝（角焊、环焊）",
          "welding_method": "CO2气保焊为主",
          "weld_size": "所有焊缝按图纸要求或默认焊脚高度6mm进行满焊",
          "welding_position": "所有已定位零件的连接处，涉及平焊、横焊、立焊等多种位置",
          "quality_requirements": "所有焊缝必须达到二级焊缝标准（GB/T 1804-B），焊缝表面平整，无裂纹、未熔合、未焊透、严重咬边。焊后进行外观检查和尺寸复核。",
          "safety_notes": "满焊时热输入量大，注意控制整体变形。使用角磨机清理焊渣时，必须佩戴防护眼镜和防尘口罩，防止飞溅物和粉尘伤害。"
        },
        "safety_warnings": [
          "使用角磨机清理焊渣时，必须佩戴防护眼镜和防尘口罩，防止金属碎屑和粉尘伤害。",
          "操作角磨机时，双手握紧，站稳，防止磨片破碎或反弹伤人。",
          "满焊时热输入量大，注意控制整体变形，并设置隔离区，防止他人接触高温工件造成烫伤。",
          "清理焊渣时，使用钢丝刷和锤子时，注意周围人员，防止飞溅物伤人。"
        ]
      }
    ]
  }
}