{
  "agent_name": "Agent6_FAQ",
  "model": "google/gemini-2.5-flash-preview-09-2025",
  "timestamp": "20251106_060038",
  "image_count": 0,
  "temperature": 0.2,
  "system_prompt": "# 角色定位\n\n你是**李师傅**，一位拥有20年安全管理经验的高级安全工程师。\n\n## 教育背景\n\n- **学历**：安全工程专业本科\n- **职业资格**：注册安全工程师、高级安全评价师\n- **专业培训**：\n  - 机械制造安全管理\n  - 职业健康与安全管理体系（ISO 45001）\n  - 事故调查与分析\n  - 应急预案编制与演练\n\n## 职业背景\n\n- **工作经历**：20年机械制造企业安全管理经验，参与过大型装备制造、钢结构加工等项目\n- **专业领域**：\n  - 机械加工安全（车、铣、刨、磨、钻等）\n  - 焊接作业安全（电焊、气焊、氩弧焊等）\n  - 起重吊装安全（行车、叉车、吊索具等）\n  - 高空作业安全（脚手架、安全带、防坠落等）\n  - 个人防护用品管理（安全帽、防护眼镜、手套、安全鞋等）\n\n## 知识结构（详细）\n\n### 1. 机械伤害风险\n- **夹伤/挤伤**：手指、手臂被运动部件夹住\n- **切割伤**：锋利边缘、毛刺、切削工具\n- **碰撞伤**：头部碰撞、身体碰撞\n- **坠落伤**：零件坠落、工具坠落、人员坠落\n\n### 2. 焊接作业风险\n- **电击伤**：焊机漏电、接地不良\n- **弧光伤**：电弧紫外线灼伤眼睛和皮肤\n- **烫伤**：高温熔池、焊渣飞溅\n- **火灾爆炸**：易燃物引燃、气瓶泄漏\n- **有毒气体**：焊接烟尘、一氧化碳中毒\n\n### 3. 起重吊装风险\n- **吊物坠落**：吊索具断裂、捆绑不牢\n- **吊物摆动**：碰撞人员、设备\n- **超载**：超过起重机额定载荷\n- **指挥失误**：信号不清、违章指挥\n\n### 4. 高空作业风险\n- **人员坠落**：未系安全带、脚手架不牢\n- **物体打击**：工具、零件从高处坠落\n- **脚手架坍塌**：搭设不规范、超载\n\n### 5. 个人防护用品\n- **头部防护**：安全帽（防止碰撞、坠物打击）\n- **眼部防护**：防护眼镜、焊接面罩（防止飞溅、弧光）\n- **手部防护**：防护手套（防止切割、烫伤、化学品）\n- **足部防护**：安全鞋（防砸、防刺穿、防滑）\n- **呼吸防护**：防尘口罩、防毒面具（防止粉尘、有毒气体）\n\n### 6. 应急处理\n- **机械伤害**：立即停机、呼救、止血、固定、送医\n- **电击伤**：切断电源、心肺复苏、送医\n- **烫伤**：冷水冲洗、覆盖无菌纱布、送医\n- **火灾**：使用灭火器、疏散人员、报警\n\n## 任务步骤（Chain of Thought）\n\n你的任务是**为每个装配步骤添加安全警告**（如果该步骤有安全风险）。请按照以下5个步骤思考：\n\n### 步骤1：识别风险步骤\n- 分析每个装配步骤的操作内容\n- 判断是否涉及高风险作业（焊接、吊装、高空、重物搬运等）\n- 识别潜在的伤害类型（机械伤害、电击、烫伤、坠落等）\n\n### 步骤2：分析风险源\n- 确定风险的来源（设备、工具、材料、环境、人员操作等）\n- 评估风险的严重程度（轻微、中等、严重、致命）\n- 考虑风险的发生概率\n\n### 步骤3：制定预防措施\n- 针对每个风险源，制定具体的预防措施\n- 强调个人防护用品的使用\n- 强调安全操作规程的遵守\n\n### 步骤4：添加安全警告\n- 为每个有风险的步骤添加safety_warnings字段\n- 每条警告要简洁明了，说明具体的风险和预防措施\n- 使用工人能看懂的语言\n\n### 步骤5：验证完整性\n- 检查所有高风险步骤是否都添加了安全警告\n- 检查安全警告是否具体、可操作\n- 检查是否遗漏了任何潜在风险\n\n## 核心原则\n\n1. **步骤级嵌入**：为每个有风险的步骤添加safety_warnings字段，而不是单独列出安全警告\n2. **工人友好**：使用通俗语言，避免专业术语\n3. **具体可操作**：说明具体的风险和预防措施，而不是泛泛而谈\n4. **不重复显示**：安全警告只在下方\"安全\"标签页中统一显示，不在当前步骤详情中重复显示\n\n## 输出格式\n\n严格按照以下JSON格式输出（返回增强后的装配步骤）：\n\n```json\n{\n  \"enhanced_steps\": [\n    {\n      \"step_number\": 1,\n      \"title\": \"点焊定位\",\n      \"parts_used\": [...],\n      \"tools_required\": [...],\n      \"operation\": \"操作说明\",\n      \"quality_check\": \"质量检查\",\n      \"estimated_time_minutes\": 10,\n      \"welding\": {\n        \"required\": true,\n        \"welding_type\": \"点焊\",\n        \"welding_method\": \"CO2气保焊\",\n        ...\n      },\n      \"safety_warnings\": [\n        \"佩戴焊接面罩和防护手套，防止弧光灼伤眼睛和皮肤\",\n        \"确保工件夹紧牢固，防止点焊时位移造成伤害\",\n        \"焊接区域周围3米内不得有易燃物，配备灭火器\",\n        \"焊机必须接地良好，防止漏电触电\"\n      ]\n    },\n    {\n      \"step_number\": 2,\n      \"title\": \"螺栓连接\",\n      \"parts_used\": [...],\n      \"operation\": \"操作说明\",\n      \"quality_check\": \"质量检查\",\n      \"estimated_time_minutes\": 15,\n      \"safety_warnings\": [\n        \"佩戴安全帽和防护眼镜，防止零件坠落和飞溅\",\n        \"使用扭力扳手时注意力度，防止扳手滑脱伤人\"\n      ]\n    },\n    {\n      \"step_number\": 3,\n      \"title\": \"简单装配\",\n      \"parts_used\": [...],\n      \"operation\": \"操作说明\",\n      \"quality_check\": \"质量检查\",\n      \"estimated_time_minutes\": 5\n      // ⚠️ 如果没有明显安全风险，不添加safety_warnings字段\n    }\n  ]\n}\n```\n\n**⚠️ 关键要求**：\n\n1. **步骤级嵌入**：\n   - 为每个有风险的步骤添加`safety_warnings`字段\n   - 没有明显风险的步骤不添加`safety_warnings`字段\n   - 保持原有步骤的所有字段不变\n\n2. **安全警告要具体**：\n   - ✅ 说\"佩戴焊接面罩和防护手套，防止弧光灼伤眼睛和皮肤\"\n   - ❌ 不说\"注意安全\"\n   - ✅ 说\"焊接区域周围3米内不得有易燃物，配备灭火器\"\n   - ❌ 不说\"注意防火\"\n\n3. **使用通俗语言**：\n   - 工人能看懂的语言\n   - 避免专业术语和英文缩写\n\n4. **警告要全面**：\n   - 涵盖个人防护、设备安全、环境安全、操作安全\n   - 每条警告说明具体的风险和预防措施\n\n## 重要提醒\n\n- **只输出JSON，不要输出其他内容**\n- **保持原有字段不变**：不要修改或删除原有的字段（包括welding字段）\n- **警告要简洁明了**：每条警告一句话，说明风险和预防措施\n- **不要过度警告**：只针对有明显风险的步骤添加警告\n",
  "user_query": "请为以下装配步骤添加安全警告（如果有安全风险）。\n\n## 📸 视觉分析任务\n\n**你会看到工程图纸图片，请仔细观察：**\n\n1. **危险作业标识**：\n   - 图纸上的安全警告标识\n   - 特殊作业要求（如高空作业、吊装作业等）\n   - 危险区域标注\n\n2. **零件特征**：\n   - 重型零件（需要吊装）\n   - 锋利边缘（容易割伤）\n   - 高温部件（容易烫伤）\n\n3. **作业环境**：\n   - 狭窄空间（容易碰撞）\n   - 高空位置（容易坠落）\n   - 密闭空间（通风不良）\n\n## 装配步骤\n\n[\n  {\n    \"step_number\": 1,\n    \"action\": \"放置基准件\",\n    \"description\": \"将图纸上标注为①的方管（FG-T5*80*80-1134-Q345）平稳放置在装配工装或工作台上，作为整个挂架组件的装配基准。\",\n    \"position_description\": \"平放于工作台，长边方向与装配线平行。\",\n    \"parts_used\": [\n      {\n        \"bom_seq\": \"1\",\n        \"bom_name\": \"方管\",\n        \"quantity\": 2,\n        \"drawing_number\": \"1\",\n        \"node_name\": [\n          \"NAUO1\"\n        ],\n        \"bom_code\": \"01.02.01.3870\"\n      }\n    ],\n    \"tools\": [\n      \"行车/吊具\",\n      \"水平仪\",\n      \"装配工装\"\n    ],\n    \"warnings\": [\n      \"确保方管放置平稳，避免滚动。\",\n      \"检查方管表面无明显划痕或变形。\"\n    ]\n  },\n  {\n    \"step_number\": 2,\n    \"action\": \"安装中侧板\",\n    \"description\": \"将图纸上标注为③的中侧板（S-RB1830-03-02-Q345）安装到①号方管的内侧。根据图纸尺寸（1140mm总长，250mm和410mm定位尺寸），将两块中侧板定位在方管的中间区域，并进行点焊固定。\",\n    \"position_description\": \"中侧板垂直于方管，位于方管的内侧，按图纸尺寸定位。\",\n    \"parts_used\": [\n      {\n        \"bom_seq\": \"3\",\n        \"bom_name\": \"中侧板\",\n        \"quantity\": 2,\n        \"drawing_number\": \"3\",\n        \"node_name\": [\n          \"NAUO3\"\n        ],\n        \"bom_code\": \"01.02.03.0206\"\n      }\n    ],\n    \"tools\": [\n      \"卷尺\",\n      \"角尺\",\n      \"焊机（CO2）\"\n    ],\n    \"warnings\": [\n      \"定位必须精确，特别是中心距和端部距离。\",\n      \"点焊牢固，防止后续焊接时移位。\"\n    ],\n    \"welding\": {\n      \"required\": true,\n      \"welding_type\": \"角焊（定位焊）\",\n      \"welding_method\": \"CO2气保焊\",\n      \"weld_size\": \"点焊长度10-15mm，焊脚高度3mm\",\n      \"welding_position\": \"零件①方管与零件③中侧板的连接处，平焊\",\n      \"quality_requirements\": \"点焊位置应均匀分布，焊点牢固，无虚焊，确保零件定位准确。\",\n      \"safety_notes\": \"佩戴焊接面罩和防护手套，确保工作区域通风良好，防止火花飞溅。\"\n    }\n  },\n  {\n    \"step_number\": 3,\n    \"action\": \"安装中连接板\",\n    \"description\": \"将图纸上标注为④的中连接板（S-RB1830-03-04-Q345）安装到已定位的③号中侧板之间。中连接板应位于中侧板的上方，并与方管①保持垂直。进行点焊固定。\",\n    \"position_description\": \"位于两块③号中侧板之间，与①号方管垂直。\",\n    \"parts_used\": [\n      {\n        \"bom_seq\": \"4\",\n        \"bom_name\": \"中连接板\",\n        \"quantity\": 2,\n        \"drawing_number\": \"4\",\n        \"node_name\": [\n          \"NAUO16\",\n          \"NAUO15\",\n          \"NAUO13\",\n          \"NAUO12\",\n          \"NAUO4\"\n        ],\n        \"bom_code\": \"01.02.04.0084\"\n      }\n    ],\n    \"tools\": [\n      \"角尺\",\n      \"焊机（CO2）\"\n    ],\n    \"warnings\": [\n      \"确保中连接板与中侧板的接触面贴合紧密，无间隙。\",\n      \"检查中连接板的水平度。\"\n    ],\n    \"welding\": {\n      \"required\": true,\n      \"welding_type\": \"角焊（定位焊）\",\n      \"welding_method\": \"CO2气保焊\",\n      \"weld_size\": \"点焊长度10-15mm，焊脚高度3mm\",\n      \"welding_position\": \"零件④中连接板与零件③中侧板的连接处，平焊/横焊\",\n      \"quality_requirements\": \"点焊应能承受后续装配应力，确保连接板垂直度符合要求。\",\n      \"safety_notes\": \"检查焊机接地线连接可靠，避免触电风险。\"\n    }\n  },\n  {\n    \"step_number\": 4,\n    \"action\": \"安装方形板和三角板\",\n    \"description\": \"将图纸上标注为⑫的方形板（FXB-T6*75*75-Q235）和⑪的三角板（SJB-T8*64*37-Q355B）安装到①号方管的两端。方形板位于方管的端部，三角板位于方形板的内侧，按图纸所示角度和位置进行点焊固定。\",\n    \"position_description\": \"方形板位于①号方管两端，三角板位于方形板内侧。\",\n    \"parts_used\": [\n      {\n        \"bom_seq\": \"12\",\n        \"bom_name\": \"方形板\",\n        \"quantity\": 4,\n        \"drawing_number\": \"12\"\n      },\n      {\n        \"bom_seq\": \"11\",\n        \"bom_name\": \"三角板\",\n        \"quantity\": 4,\n        \"drawing_number\": \"11\"\n      }\n    ],\n    \"tools\": [\n      \"角尺\",\n      \"焊机（CO2）\"\n    ],\n    \"warnings\": [\n      \"三角板的斜边方向必须正确，确保与图纸所示角度一致。\",\n      \"注意焊接变形，采用对称点焊。\"\n    ],\n    \"welding\": {\n      \"required\": true,\n      \"welding_type\": \"角焊（定位焊）\",\n      \"welding_method\": \"CO2气保焊\",\n      \"weld_size\": \"点焊长度10mm，焊脚高度3mm\",\n      \"welding_position\": \"零件⑫方形板与零件①方管的连接处，以及零件⑪三角板与零件⑫方形板的连接处，平焊/横焊\",\n      \"quality_requirements\": \"定位焊应确保端部结构件的几何尺寸和角度精度。\",\n      \"safety_notes\": \"清理焊接区域的油污和锈蚀，防止产生气孔。\"\n    }\n  },\n  {\n    \"step_number\": 5,\n    \"action\": \"安装左右连接器板\",\n    \"description\": \"将图纸上标注为⑥的左连接器板（S-LP1730(68IN)-MP1140-LT-01-06-Q460）和⑩的右连接器板（S-LP1730(68IN)-MP1140-LT-01-08-Q460）安装到①号方管的两侧。连接器板应与方管的侧面齐平，并与已安装的内部结构件对齐。进行点焊固定。\",\n    \"position_description\": \"左连接器板和右连接器板分别位于①号方管的两侧，与方管侧面齐平。\",\n    \"parts_used\": [\n      {\n        \"bom_seq\": \"6\",\n        \"bom_name\": \"左连接器板\",\n        \"quantity\": 1,\n        \"drawing_number\": \"6\",\n        \"node_name\": [\n          \"NAUO7\",\n          \"NAUO6\"\n        ],\n        \"bom_code\": \"01.01.01.4776\"\n      },\n      {\n        \"bom_seq\": \"10\",\n        \"bom_name\": \"右连接器板\",\n        \"quantity\": 1,\n        \"drawing_number\": \"10\"\n      }\n    ],\n    \"tools\": [\n      \"卷尺\",\n      \"角尺\",\n      \"焊机（CO2）\"\n    ],\n    \"warnings\": [\n      \"区分左右连接器板，避免装反。\",\n      \"确保连接器板上的孔位与内部结构件的孔位对齐。\"\n    ],\n    \"welding\": {\n      \"required\": true,\n      \"welding_type\": \"角焊（定位焊）\",\n      \"welding_method\": \"CO2气保焊\",\n      \"weld_size\": \"点焊长度15mm，焊脚高度4mm\",\n      \"welding_position\": \"零件⑥/⑩连接器板与零件①方管的连接面，横焊/平焊\",\n      \"quality_requirements\": \"点焊应均匀分布在连接板的上下边缘，确保连接板与方管齐平，无错位。\",\n      \"safety_notes\": \"注意连接器板较重，安装时需防止砸伤，点焊时注意站位，避免被火花烫伤。\"\n    }\n  },\n  {\n    \"step_number\": 6,\n    \"action\": \"安装上挂板和轴套\",\n    \"description\": \"将图纸上标注为⑧的上挂板（S-LP1730(68IN)-MP1140-LT-01-07-Q460）安装到组件的顶部中间位置，并进行点焊。同时，将图纸上标注为⑤的轴套（S-RB1830-03-07-Q235）安装到上挂板下方的孔位，确保轴套与孔位同心，并进行点焊固定。\",\n    \"position_description\": \"上挂板位于组件顶部中心，轴套位于上挂板下方的安装孔位。\",\n    \"parts_used\": [\n      {\n        \"bom_seq\": \"8\",\n        \"bom_name\": \"上挂板\",\n        \"quantity\": 1,\n        \"drawing_number\": \"8\",\n        \"node_name\": [\n          \"NAUO11\"\n        ],\n        \"bom_code\": \"01.02.05.0334\"\n      },\n      {\n        \"bom_seq\": \"5\",\n        \"bom_name\": \"轴套\",\n        \"quantity\": 1,\n        \"drawing_number\": \"5\",\n        \"node_name\": [\n          \"NAUO8\",\n          \"NAUO5\"\n        ],\n        \"bom_code\": \"01.02.03.0207\"\n      }\n    ],\n    \"tools\": [\n      \"塞尺\",\n      \"焊机（CO2）\"\n    ],\n    \"warnings\": [\n      \"轴套的定位精度要求高，确保其垂直度。\",\n      \"上挂板必须居中安装。\"\n    ],\n    \"welding\": {\n      \"required\": true,\n      \"welding_type\": \"角焊（定位焊）/塞焊（轴套）\",\n      \"welding_method\": \"CO2气保焊\",\n      \"weld_size\": \"点焊长度10mm，轴套环形点焊\",\n      \"welding_position\": \"零件⑧上挂板与零件①方管的连接处（平焊），零件⑤轴套与零件⑧上挂板的连接处（平焊/环形焊）\",\n      \"quality_requirements\": \"轴套定位焊需保证同心度，上挂板定位焊需保证居中和垂直度。\",\n      \"safety_notes\": \"轴套焊接时，注意控制热输入，防止轴套变形影响后续配合。\"\n    }\n  },\n  {\n    \"step_number\": 7,\n    \"action\": \"安装方形板-机加\",\n    \"description\": \"将图纸上标注为⑨的方形板-机加（S-LP1730(68IN)-MP1140-LT-01-10-Q460）安装到组件的顶部两侧，位于上挂板⑧的两侧。方形板-机加应与①号方管的顶面齐平。进行点焊固定。\",\n    \"position_description\": \"位于组件顶部两侧，与①号方管顶面齐平。\",\n    \"parts_used\": [\n      {\n        \"bom_seq\": \"9\",\n        \"bom_name\": \"方形板-机加\",\n        \"quantity\": 2,\n        \"drawing_number\": \"9\",\n        \"node_name\": [\n          \"NAUO14\"\n        ],\n        \"bom_code\": \"01.02.02.0447\"\n      }\n    ],\n    \"tools\": [\n      \"卷尺\",\n      \"焊机（CO2）\"\n    ],\n    \"warnings\": [\n      \"确保两块方形板-机加的端面与组件端面保持一致。\",\n      \"检查焊接间隙，确保后续满焊质量。\"\n    ],\n    \"welding\": {\n      \"required\": true,\n      \"welding_type\": \"角焊（定位焊）\",\n      \"welding_method\": \"CO2气保焊\",\n      \"weld_size\": \"点焊长度10mm，焊脚高度3mm\",\n      \"welding_position\": \"零件⑨方形板-机加与零件①方管的连接处，平焊\",\n      \"quality_requirements\": \"定位焊应确保方形板与方管顶面齐平，无高低差。\",\n      \"safety_notes\": \"焊接前检查焊丝和保护气体，确保焊接过程稳定。\"\n    }\n  },\n  {\n    \"step_number\": 8,\n    \"action\": \"安装防滑板\",\n    \"description\": \"将图纸上标注为⑬的防滑板（S-EDGP1630-DR-01-10-Q235）安装到①号方管的底部两侧。防滑板应与方管底部齐平，并按图纸尺寸定位。进行点焊固定。\",\n    \"position_description\": \"位于①号方管的底部两侧。\",\n    \"parts_used\": [\n      {\n        \"bom_seq\": \"13\",\n        \"bom_name\": \"防滑板\",\n        \"quantity\": 2,\n        \"drawing_number\": \"13\"\n      }\n    ],\n    \"tools\": [\n      \"卷尺\",\n      \"焊机（CO2）\"\n    ],\n    \"warnings\": [\n      \"防滑板的定位要准确，确保其功能性。\",\n      \"点焊牢固，防止后续满焊时脱落。\"\n    ],\n    \"welding\": {\n      \"required\": true,\n      \"welding_type\": \"角焊（定位焊）\",\n      \"welding_method\": \"CO2气保焊\",\n      \"weld_size\": \"点焊长度10mm，焊脚高度3mm\",\n      \"welding_position\": \"零件⑬防滑板与零件①方管的连接处，仰焊（如果组件未翻转）或平焊（如果组件已翻转）\",\n      \"quality_requirements\": \"定位焊应确保防滑板与方管底部齐平，无间隙。\",\n      \"safety_notes\": \"如果进行仰焊，需特别注意熔渣和熔滴下落，加强个人防护，穿戴防火服。\"\n    }\n  },\n  {\n    \"step_number\": 9,\n    \"action\": \"满焊所有结构件\",\n    \"description\": \"对所有已点焊固定的零件（包括②、③、④、⑤、⑥、⑧、⑨、⑩、⑪、⑫、⑬号零件）进行满焊。焊接时应遵循合理的焊接顺序，采用对称、分段、跳焊等方法，以控制焊接变形。焊接要求参照图纸技术要求。\",\n    \"position_description\": \"对所有连接面进行满焊。\",\n    \"parts_used\": [\n      {\n        \"bom_seq\": \"2\",\n        \"bom_name\": \"方管\",\n        \"quantity\": 2,\n        \"drawing_number\": \"2\",\n        \"node_name\": [\n          \"NAUO2\"\n        ],\n        \"bom_code\": \"01.02.01.3871\"\n      }\n    ],\n    \"tools\": [\n      \"焊机（CO2）\",\n      \"焊钳\",\n      \"防护用品\"\n    ],\n    \"warnings\": [\n      \"严格控制焊接电流和速度，确保焊缝成型美观、无气孔、夹渣等缺陷。\",\n      \"焊接完成后，立即去除焊渣。\"\n    ],\n    \"welding\": {\n      \"required\": true,\n      \"welding_type\": \"角焊/对接焊（满焊）\",\n      \"welding_method\": \"CO2气保焊（主要）\",\n      \"weld_size\": \"焊脚高度通常为6mm（根据图纸未注尺寸要求），轴套⑤为环形连续焊\",\n      \"welding_position\": \"所有零件连接处，涉及平焊、横焊、立焊、仰焊（需翻转组件以尽量采用平焊）\",\n      \"quality_requirements\": \"焊缝必须连续、饱满，焊缝表面均匀，无咬边、未焊透、裂纹等缺陷。焊后进行外观检查，关键焊缝可能需要进行无损检测（如磁粉或超声波）。\",\n      \"safety_notes\": \"采用合理的焊接顺序（如对称分段焊）控制变形。焊接过程中保持通风，防止烟尘中毒。高强度钢（Q355B/Q460）焊接时，注意控制层间温度，避免产生冷裂纹。\"\n    }\n  },\n  {\n    \"step_number\": 10,\n    \"action\": \"打磨清理\",\n    \"description\": \"对所有焊缝进行打磨处理，去除飞溅、毛刺和尖锐棱角。特别是轴套⑤和上挂板⑧周围的焊缝，应打磨平整，确保后续配合件的安装顺畅。\",\n    \"position_description\": \"所有焊缝和尖锐棱角。\",\n    \"parts_used\": [],\n    \"tools\": [\n      \"角磨机\",\n      \"砂轮片\",\n      \"钢丝刷\"\n    ],\n    \"warnings\": [\n      \"打磨时注意安全，佩戴防护眼镜。\",\n      \"打磨后的表面应光滑，无明显凹凸不平。\"\n    ]\n  }\n]\n\n## 要求\n\n请按照以下5个步骤思考，为装配步骤添加安全警告：\n\n### 步骤1：识别风险步骤\n- 分析每个装配步骤的操作内容\n- 判断是否涉及高风险作业：\n  * **焊接作业**：电击、弧光、烫伤、火灾\n  * **吊装作业**：吊物坠落、碰撞、超载\n  * **高空作业**：人员坠落、物体打击\n  * **重物搬运**：砸伤、扭伤、夹伤\n  * **机械加工**：切割伤、夹伤、碰撞\n\n### 步骤2：分析风险源\n- 确定风险的来源（设备、工具、材料、环境、人员操作等）\n- 评估风险的严重程度（轻微、中等、严重、致命）\n- 考虑风险的发生概率\n\n### 步骤3：制定预防措施\n- 针对每个风险源，制定具体的预防措施\n- 强调个人防护用品的使用：\n  * **焊接**：焊接面罩、防护手套、防护服\n  * **吊装**：安全帽、安全鞋、手套\n  * **高空**：安全带、安全帽、防滑鞋\n  * **机械**：防护眼镜、手套、安全鞋\n\n### 步骤4：添加安全警告\n- 为每个有风险的步骤添加safety_warnings字段\n- 每条警告要简洁明了，说明具体的风险和预防措施\n- 使用工人能看懂的语言\n\n### 步骤5：验证完整性\n- 检查所有高风险步骤是否都添加了安全警告\n- 检查安全警告是否具体、可操作\n- 检查是否遗漏了任何潜在风险\n\n## ⚠️ 强制自检清单（生成后必须逐项检查）\n\n**在输出JSON之前，你必须完成以下验证：**\n\n1. **风险步骤识别验证**：\n   - [ ] 所有涉及焊接、吊装、高空、重物搬运的步骤都添加了safety_warnings字段\n   - [ ] 没有明显风险的步骤没有添加safety_warnings字段\n\n2. **安全警告完整性验证**：\n   - [ ] 每个safety_warnings字段都是字符串数组\n   - [ ] 每条警告都说明了具体的风险和预防措施\n   - [ ] 涵盖了个人防护、设备安全、环境安全、操作安全\n\n3. **语言通俗性验证**：\n   - [ ] 使用工人能看懂的语言\n   - [ ] 避免专业术语和英文缩写\n   - [ ] 每条警告简洁明了（一句话）\n\n4. **原有字段保持验证**：\n   - [ ] 原有步骤的所有字段都保持不变（包括welding字段）\n   - [ ] 没有修改或删除任何原有字段\n\n**如果自检发现任何问题，必须重新生成！**\n\n现在开始为装配步骤添加安全警告！\n",
  "raw_response": "```json\n{\n  \"enhanced_steps\": [\n    {\n      \"step_number\": 1,\n      \"action\": \"放置基准件\",\n      \"description\": \"将图纸上标注为①的方管（FG-T5*80*80-1134-Q345）平稳放置在装配工装或工作台上，作为整个挂架组件的装配基准。\",\n      \"position_description\": \"平放于工作台，长边方向与装配线平行。\",\n      \"parts_used\": [\n        {\n          \"bom_seq\": \"1\",\n          \"bom_name\": \"方管\",\n          \"quantity\": 2,\n          \"drawing_number\": \"1\",\n          \"node_name\": [\n            \"NAUO1\"\n          ],\n          \"bom_code\": \"01.02.01.3870\"\n        }\n      ],\n      \"tools\": [\n        \"行车/吊具\",\n        \"水平仪\",\n        \"装配工装\"\n      ],\n      \"warnings\": [\n        \"确保方管放置平稳，避免滚动。\",\n        \"检查方管表面无明显划痕或变形。\"\n      ],\n      \"safety_warnings\": [\n        \"使用行车/吊具吊装方管时，必须检查吊索具完好，防止吊物坠落伤人。\",\n        \"吊装过程中，人员不得站在吊物下方或危险区域，佩戴安全帽。\",\n        \"方管边缘可能锋利，搬运和放置时请佩戴防割手套，防止割伤。\"\n      ]\n    },\n    {\n      \"step_number\": 2,\n      \"action\": \"安装中侧板\",\n      \"description\": \"将图纸上标注为③的中侧板（S-RB1830-03-02-Q345）安装到①号方管的内侧。根据图纸尺寸（1140mm总长，250mm和410mm定位尺寸），将两块中侧板定位在方管的中间区域，并进行点焊固定。\",\n      \"position_description\": \"中侧板垂直于方管，位于方管的内侧，按图纸尺寸定位。\",\n      \"parts_used\": [\n        {\n          \"bom_seq\": \"3\",\n          \"bom_name\": \"中侧板\",\n          \"quantity\": 2,\n          \"drawing_number\": \"3\",\n          \"node_name\": [\n            \"NAUO3\"\n          ],\n          \"bom_code\": \"01.02.03.0206\"\n        }\n      ],\n      \"tools\": [\n        \"卷尺\",\n        \"角尺\",\n        \"焊机（CO2）\"\n      ],\n      \"warnings\": [\n        \"定位必须精确，特别是中心距和端部距离。\",\n        \"点焊牢固，防止后续焊接时移位。\"\n      ],\n      \"welding\": {\n        \"required\": true,\n        \"welding_type\": \"角焊（定位焊）\",\n        \"welding_method\": \"CO2气保焊\",\n        \"weld_size\": \"点焊长度10-15mm，焊脚高度3mm\",\n        \"welding_position\": \"零件①方管与零件③中侧板的连接处，平焊\",\n        \"quality_requirements\": \"点焊位置应均匀分布，焊点牢固，无虚焊，确保零件定位准确。\",\n        \"safety_notes\": \"佩戴焊接面罩和防护手套，确保工作区域通风良好，防止火花飞溅。\"\n      },\n      \"safety_warnings\": [\n        \"进行点焊作业时，必须佩戴焊接面罩、防护手套和防护服，防止弧光灼伤和烫伤。\",\n        \"确保焊机接地良好，电缆绝缘完好，防止触电。\",\n        \"清理焊接区域周围的易燃物，配备灭火器，防止火灾。\"\n      ]\n    },\n    {\n      \"step_number\": 3,\n      \"action\": \"安装中连接板\",\n      \"description\": \"将图纸上标注为④的中连接板（S-RB1830-03-04-Q345）安装到已定位的③号中侧板之间。中连接板应位于中侧板的上方，并与方管①保持垂直。进行点焊固定。\",\n      \"position_description\": \"位于两块③号中侧板之间，与①号方管垂直。\",\n      \"parts_used\": [\n        {\n          \"bom_seq\": \"4\",\n          \"bom_name\": \"中连接板\",\n          \"quantity\": 2,\n          \"drawing_number\": \"4\",\n          \"node_name\": [\n            \"NAUO16\",\n            \"NAUO15\",\n            \"NAUO13\",\n            \"NAUO12\",\n            \"NAUO4\"\n          ],\n          \"bom_code\": \"01.02.04.0084\"\n        }\n      ],\n      \"tools\": [\n        \"角尺\",\n        \"焊机（CO2）\"\n      ],\n      \"warnings\": [\n        \"确保中连接板与中侧板的接触面贴合紧密，无间隙。\",\n        \"检查中连接板的水平度。\"\n      ],\n      \"welding\": {\n        \"required\": true,\n        \"welding_type\": \"角焊（定位焊）\",\n        \"welding_method\": \"CO2气保焊\",\n        \"weld_size\": \"点焊长度10-15mm，焊脚高度3mm\",\n        \"welding_position\": \"零件④中连接板与零件③中侧板的连接处，平焊/横焊\",\n        \"quality_requirements\": \"点焊应能承受后续装配应力，确保连接板垂直度符合要求。\",\n        \"safety_notes\": \"检查焊机接地线连接可靠，避免触电风险。\"\n      },\n      \"safety_warnings\": [\n        \"点焊时注意佩戴防护眼镜和面罩，防止焊渣飞溅烫伤。\",\n        \"确保工作区域通风良好，防止焊接烟尘浓度过高导致中毒。\",\n        \"操作焊机时，手套必须干燥，防止触电。\"\n      ]\n    },\n    {\n      \"step_number\": 4,\n      \"action\": \"安装方形板和三角板\",\n      \"description\": \"将图纸上标注为⑫的方形板（FXB-T6*75*75-Q235）和⑪的三角板（SJB-T8*64*37-Q355B）安装到①号方管的两端。方形板位于方管的端部，三角板位于方形板的内侧，按图纸所示角度和位置进行点焊固定。\",\n      \"position_description\": \"方形板位于①号方管两端，三角板位于方形板内侧。\",\n      \"parts_used\": [\n        {\n          \"bom_seq\": \"12\",\n          \"bom_name\": \"方形板\",\n          \"quantity\": 4,\n          \"drawing_number\": \"12\"\n        },\n        {\n          \"bom_seq\": \"11\",\n          \"bom_name\": \"三角板\",\n          \"quantity\": 4,\n          \"drawing_number\": \"11\"\n        }\n      ],\n      \"tools\": [\n        \"角尺\",\n        \"焊机（CO2）\"\n      ],\n      \"warnings\": [\n        \"三角板的斜边方向必须正确，确保与图纸所示角度一致。\",\n        \"注意焊接变形，采用对称点焊。\"\n      ],\n      \"welding\": {\n        \"required\": true,\n        \"welding_type\": \"角焊（定位焊）\",\n        \"welding_method\": \"CO2气保焊\",\n        \"weld_size\": \"点焊长度10mm，焊脚高度3mm\",\n        \"welding_position\": \"零件⑫方形板与零件①方管的连接处，以及零件⑪三角板与零件⑫方形板的连接处，平焊/横焊\",\n        \"quality_requirements\": \"定位焊应确保端部结构件的几何尺寸和角度精度。\",\n        \"safety_notes\": \"清理焊接区域的油污和锈蚀，防止产生气孔。\"\n      },\n      \"safety_warnings\": [\n        \"小零件边缘可能锋利，安装时佩戴防割手套，防止割伤。\",\n        \"点焊时，注意焊枪和工件的高温，避免烫伤。\",\n        \"清理焊渣时，佩戴防护眼镜，防止焊渣飞溅伤眼。\"\n      ]\n    },\n    {\n      \"step_number\": 5,\n      \"action\": \"安装左右连接器板\",\n      \"description\": \"将图纸上标注为⑥的左连接器板（S-LP1730(68IN)-MP1140-LT-01-06-Q460）和⑩的右连接器板（S-LP1730(68IN)-MP1140-LT-01-08-Q460）安装到①号方管的两侧。连接器板应与方管的侧面齐平，并与已安装的内部结构件对齐。进行点焊固定。\",\n      \"position_description\": \"左连接器板和右连接器板分别位于①号方管的两侧，与方管侧面齐平。\",\n      \"parts_used\": [\n        {\n          \"bom_seq\": \"6\",\n          \"bom_name\": \"左连接器板\",\n          \"quantity\": 1,\n          \"drawing_number\": \"6\",\n          \"node_name\": [\n            \"NAUO7\",\n            \"NAUO6\"\n          ],\n          \"bom_code\": \"01.01.01.4776\"\n        },\n        {\n          \"bom_seq\": \"10\",\n          \"bom_name\": \"右连接器板\",\n          \"quantity\": 1,\n          \"drawing_number\": \"10\"\n        }\n      ],\n      \"tools\": [\n        \"卷尺\",\n        \"角尺\",\n        \"焊机（CO2）\"\n      ],\n      \"warnings\": [\n        \"区分左右连接器板，避免装反。\",\n        \"确保连接器板上的孔位与内部结构件的孔位对齐。\"\n      ],\n      \"welding\": {\n        \"required\": true,\n        \"welding_type\": \"角焊（定位焊）\",\n        \"welding_method\": \"CO2气保焊\",\n        \"weld_size\": \"点焊长度15mm，焊脚高度4mm\",\n        \"welding_position\": \"零件⑥/⑩连接器板与零件①方管的连接面，横焊/平焊\",\n        \"quality_requirements\": \"点焊应均匀分布在连接板的上下边缘，确保连接板与方管齐平，无错位。\",\n        \"safety_notes\": \"注意连接器板较重，安装时需防止砸伤，点焊时注意站位，避免被火花烫伤。\"\n      },\n      \"safety_warnings\": [\n        \"连接器板较重，搬运和安装时注意姿势，防止扭伤腰部。\",\n        \"安装时需两人配合或使用辅助工具，防止连接器板掉落砸伤脚部，必须穿戴安全鞋。\",\n        \"点焊时注意站位，避免被焊接火花和飞溅物烫伤。\"\n      ]\n    },\n    {\n      \"step_number\": 6,\n      \"action\": \"安装上挂板和轴套\",\n      \"description\": \"将图纸上标注为⑧的上挂板（S-LP1730(68IN)-MP1140-LT-01-07-Q460）安装到组件的顶部中间位置，并进行点焊。同时，将图纸上标注为⑤的轴套（S-RB1830-03-07-Q235）安装到上挂板下方的孔位，确保轴套与孔位同心，并进行点焊固定。\",\n      \"position_description\": \"上挂板位于组件顶部中心，轴套位于上挂板下方的安装孔位。\",\n      \"parts_used\": [\n        {\n          \"bom_seq\": \"8\",\n          \"bom_name\": \"上挂板\",\n          \"quantity\": 1,\n          \"drawing_number\": \"8\",\n          \"node_name\": [\n            \"NAUO11\"\n          ],\n          \"bom_code\": \"01.02.05.0334\"\n        },\n        {\n          \"bom_seq\": \"5\",\n          \"bom_name\": \"轴套\",\n          \"quantity\": 1,\n          \"drawing_number\": \"5\",\n          \"node_name\": [\n            \"NAUO8\",\n            \"NAUO5\"\n          ],\n          \"bom_code\": \"01.02.03.0207\"\n        }\n      ],\n      \"tools\": [\n        \"塞尺\",\n        \"焊机（CO2）\"\n      ],\n      \"warnings\": [\n        \"轴套的定位精度要求高，确保其垂直度。\",\n        \"上挂板必须居中安装。\"\n      ],\n      \"welding\": {\n        \"required\": true,\n        \"welding_type\": \"角焊（定位焊）/塞焊（轴套）\",\n        \"welding_method\": \"CO2气保焊\",\n        \"weld_size\": \"点焊长度10mm，轴套环形点焊\",\n        \"welding_position\": \"零件⑧上挂板与零件①方管的连接处（平焊），零件⑤轴套与零件⑧上挂板的连接处（平焊/环形焊）\",\n        \"quality_requirements\": \"轴套定位焊需保证同心度，上挂板定位焊需保证居中和垂直度。\",\n        \"safety_notes\": \"轴套焊接时，注意控制热输入，防止轴套变形影响后续配合。\"\n      },\n      \"safety_warnings\": [\n        \"轴套进行塞焊时，注意熔池温度高，防止烫伤。\",\n        \"确保轴套定位牢固，防止在焊接过程中脱落或倾倒。\",\n        \"焊接烟尘可能积聚在组件内部，注意保持局部通风良好。\"\n      ]\n    },\n    {\n      \"step_number\": 7,\n      \"action\": \"安装方形板-机加\",\n      \"description\": \"将图纸上标注为⑨的方形板-机加（S-LP1730(68IN)-MP1140-LT-01-10-Q460）安装到组件的顶部两侧，位于上挂板⑧的两侧。方形板-机加应与①号方管的顶面齐平。进行点焊固定。\",\n      \"position_description\": \"位于组件顶部两侧，与①号方管顶面齐平。\",\n      \"parts_used\": [\n        {\n          \"bom_seq\": \"9\",\n          \"bom_name\": \"方形板-机加\",\n          \"quantity\": 2,\n          \"drawing_number\": \"9\",\n          \"node_name\": [\n            \"NAUO14\"\n          ],\n          \"bom_code\": \"01.02.02.0447\"\n        }\n      ],\n      \"tools\": [\n        \"卷尺\",\n        \"焊机（CO2）\"\n      ],\n      \"warnings\": [\n        \"确保两块方形板-机加的端面与组件端面保持一致。\",\n        \"检查焊接间隙，确保后续满焊质量。\"\n      ],\n      \"welding\": {\n        \"required\": true,\n        \"welding_type\": \"角焊（定位焊）\",\n        \"welding_method\": \"CO2气保焊\",\n        \"weld_size\": \"点焊长度10mm，焊脚高度3mm\",\n        \"welding_position\": \"零件⑨方形板-机加与零件①方管的连接处，平焊\",\n        \"quality_requirements\": \"定位焊应确保方形板与方管顶面齐平，无高低差。\",\n        \"safety_notes\": \"焊接前检查焊丝和保护气体，确保焊接过程稳定。\"\n      },\n      \"safety_warnings\": [\n        \"机加零件边缘可能较锐利，操作时佩戴手套，防止割伤。\",\n        \"点焊时注意控制热量，防止因热变形导致零件错位或翘曲。\"\n      ]\n    },\n    {\n      \"step_number\": 8,\n      \"action\": \"安装防滑板\",\n      \"description\": \"将图纸上标注为⑬的防滑板（S-EDGP1630-DR-01-10-Q235）安装到①号方管的底部两侧。防滑板应与方管底部齐平，并按图纸尺寸定位。进行点焊固定。\",\n      \"position_description\": \"位于①号方管的底部两侧。\",\n      \"parts_used\": [\n        {\n          \"bom_seq\": \"13\",\n          \"bom_name\": \"防滑板\",\n          \"quantity\": 2,\n          \"drawing_number\": \"13\"\n        }\n      ],\n      \"tools\": [\n        \"卷尺\",\n        \"焊机（CO2）\"\n      ],\n      \"warnings\": [\n        \"防滑板的定位要准确，确保其功能性。\",\n        \"点焊牢固，防止后续满焊时脱落。\"\n      ],\n      \"welding\": {\n        \"required\": true,\n        \"welding_type\": \"角焊（定位焊）\",\n        \"welding_method\": \"CO2气保焊\",\n        \"weld_size\": \"点焊长度10mm，焊脚高度3mm\",\n        \"welding_position\": \"零件⑬防滑板与零件①方管的连接处，仰焊（如果组件未翻转）或平焊（如果组件已翻转）\",\n        \"quality_requirements\": \"定位焊应确保防滑板与方管底部齐平，无间隙。\",\n        \"safety_notes\": \"如果进行仰焊，需特别注意熔渣和熔滴下落，加强个人防护，穿戴防火服。\"\n      },\n      \"safety_warnings\": [\n        \"如果需要仰焊（从底部向上焊），必须穿戴防火服和头罩，防止高温熔渣和熔滴溅落烫伤。\",\n        \"仰焊时，确保站位稳固，避免因操作不便导致失误。\",\n        \"防滑板边缘可能粗糙，搬运时佩戴手套。\"\n      ]\n    },\n    {\n      \"step_number\": 9,\n      \"action\": \"满焊所有结构件\",\n      \"description\": \"对所有已点焊固定的零件（包括②、③、④、⑤、⑥、⑧、⑨、⑩、⑪、⑫、⑬号零件）进行满焊。焊接时应遵循合理的焊接顺序，采用对称、分段、跳焊等方法，以控制焊接变形。焊接要求参照图纸技术要求。\",\n      \"position_description\": \"对所有连接面进行满焊。\",\n      \"parts_used\": [\n        {\n          \"bom_seq\": \"2\",\n          \"bom_name\": \"方管\",\n          \"quantity\": 2,\n          \"drawing_number\": \"2\",\n          \"node_name\": [\n            \"NAUO2\"\n          ],\n          \"bom_code\": \"01.02.01.3871\"\n        }\n      ],\n      \"tools\": [\n        \"焊机（CO2）\",\n        \"焊钳\",\n        \"防护用品\"\n      ],\n      \"warnings\": [\n        \"严格控制焊接电流和速度，确保焊缝成型美观、无气孔、夹渣等缺陷。\",\n        \"焊接完成后，立即去除焊渣。\"\n      ],\n      \"welding\": {\n        \"required\": true,\n        \"welding_type\": \"角焊/对接焊（满焊）\",\n        \"welding_method\": \"CO2气保焊（主要）\",\n        \"weld_size\": \"焊脚高度通常为6mm（根据图纸未注尺寸要求），轴套⑤为环形连续焊\",\n        \"welding_position\": \"所有零件连接处，涉及平焊、横焊、立焊、仰焊（需翻转组件以尽量采用平焊）\",\n        \"quality_requirements\": \"焊缝必须连续、饱满，焊缝表面均匀，无咬边、未焊透、裂纹等缺陷。焊后进行外观检查，关键焊缝可能需要进行无损检测（如磁粉或超声波）。\",\n        \"safety_notes\": \"采用合理的焊接顺序（如对称分段焊）控制变形。焊接过程中保持通风，防止烟尘中毒。高强度钢（Q355B/Q460）焊接时，注意控制层间温度，避免产生冷裂纹。\"\n      },\n      \"safety_warnings\": [\n        \"进行满焊时，必须全程佩戴全套焊接防护用品（面罩、手套、防护服），防止长时间暴露于弧光和高温。\",\n        \"确保焊接区域的通风系统全负荷运行，防止大量烟尘和有毒气体（如一氧化碳）积聚。\",\n        \"如果需要翻转组件进行焊接，必须使用行车或吊具，并确保组件捆绑牢固，防止翻转过程中组件滑落或砸伤。\",\n        \"高强度钢焊接时，严格遵守预热和层间温度控制要求，防止焊接裂纹，避免因操作不当引发的结构失效风险。\"\n      ]\n    },\n    {\n      \"step_number\": 10,\n      \"action\": \"打磨清理\",\n      \"description\": \"对所有焊缝进行打磨处理，去除飞溅、毛刺和尖锐棱角。特别是轴套⑤和上挂板⑧周围的焊缝，应打磨平整，确保后续配合件的安装顺畅。\",\n      \"position_description\": \"所有焊缝和尖锐棱角。\",\n      \"parts_used\": [],\n      \"tools\": [\n        \"角磨机\",\n        \"砂轮片\",\n        \"钢丝刷\"\n      ],\n      \"warnings\": [\n        \"打磨时注意安全，佩戴防护眼镜。\",\n        \"打磨后的表面应光滑，无明显凹凸不平。\"\n      ],\n      \"safety_warnings\": [\n        \"操作角磨机时，必须佩戴防护眼镜和面罩，防止高速飞溅的金属碎屑和火花伤眼。\",\n        \"检查角磨机防护罩是否安装到位，砂轮片是否完好无裂纹，防止砂轮片破碎伤人。\",\n        \"打磨时双手握紧机器，站稳，避免反作用力导致机器脱手伤人。\",\n        \"打磨产生的粉尘较大，建议佩戴防尘口罩，保护呼吸道。\"\n      ]\n    }\n  ]\n}\n```",
  "parsed_result": {
    "enhanced_steps": [
      {
        "step_number": 1,
        "action": "放置基准件",
        "description": "将图纸上标注为①的方管（FG-T5*80*80-1134-Q345）平稳放置在装配工装或工作台上，作为整个挂架组件的装配基准。",
        "position_description": "平放于工作台，长边方向与装配线平行。",
        "parts_used": [
          {
            "bom_seq": "1",
            "bom_name": "方管",
            "quantity": 2,
            "drawing_number": "1",
            "node_name": [
              "NAUO1"
            ],
            "bom_code": "01.02.01.3870"
          }
        ],
        "tools": [
          "行车/吊具",
          "水平仪",
          "装配工装"
        ],
        "warnings": [
          "确保方管放置平稳，避免滚动。",
          "检查方管表面无明显划痕或变形。"
        ],
        "safety_warnings": [
          "使用行车/吊具吊装方管时，必须检查吊索具完好，防止吊物坠落伤人。",
          "吊装过程中，人员不得站在吊物下方或危险区域，佩戴安全帽。",
          "方管边缘可能锋利，搬运和放置时请佩戴防割手套，防止割伤。"
        ]
      },
      {
        "step_number": 2,
        "action": "安装中侧板",
        "description": "将图纸上标注为③的中侧板（S-RB1830-03-02-Q345）安装到①号方管的内侧。根据图纸尺寸（1140mm总长，250mm和410mm定位尺寸），将两块中侧板定位在方管的中间区域，并进行点焊固定。",
        "position_description": "中侧板垂直于方管，位于方管的内侧，按图纸尺寸定位。",
        "parts_used": [
          {
            "bom_seq": "3",
            "bom_name": "中侧板",
            "quantity": 2,
            "drawing_number": "3",
            "node_name": [
              "NAUO3"
            ],
            "bom_code": "01.02.03.0206"
          }
        ],
        "tools": [
          "卷尺",
          "角尺",
          "焊机（CO2）"
        ],
        "warnings": [
          "定位必须精确，特别是中心距和端部距离。",
          "点焊牢固，防止后续焊接时移位。"
        ],
        "welding": {
          "required": true,
          "welding_type": "角焊（定位焊）",
          "welding_method": "CO2气保焊",
          "weld_size": "点焊长度10-15mm，焊脚高度3mm",
          "welding_position": "零件①方管与零件③中侧板的连接处，平焊",
          "quality_requirements": "点焊位置应均匀分布，焊点牢固，无虚焊，确保零件定位准确。",
          "safety_notes": "佩戴焊接面罩和防护手套，确保工作区域通风良好，防止火花飞溅。"
        },
        "safety_warnings": [
          "进行点焊作业时，必须佩戴焊接面罩、防护手套和防护服，防止弧光灼伤和烫伤。",
          "确保焊机接地良好，电缆绝缘完好，防止触电。",
          "清理焊接区域周围的易燃物，配备灭火器，防止火灾。"
        ]
      },
      {
        "step_number": 3,
        "action": "安装中连接板",
        "description": "将图纸上标注为④的中连接板（S-RB1830-03-04-Q345）安装到已定位的③号中侧板之间。中连接板应位于中侧板的上方，并与方管①保持垂直。进行点焊固定。",
        "position_description": "位于两块③号中侧板之间，与①号方管垂直。",
        "parts_used": [
          {
            "bom_seq": "4",
            "bom_name": "中连接板",
            "quantity": 2,
            "drawing_number": "4",
            "node_name": [
              "NAUO16",
              "NAUO15",
              "NAUO13",
              "NAUO12",
              "NAUO4"
            ],
            "bom_code": "01.02.04.0084"
          }
        ],
        "tools": [
          "角尺",
          "焊机（CO2）"
        ],
        "warnings": [
          "确保中连接板与中侧板的接触面贴合紧密，无间隙。",
          "检查中连接板的水平度。"
        ],
        "welding": {
          "required": true,
          "welding_type": "角焊（定位焊）",
          "welding_method": "CO2气保焊",
          "weld_size": "点焊长度10-15mm，焊脚高度3mm",
          "welding_position": "零件④中连接板与零件③中侧板的连接处，平焊/横焊",
          "quality_requirements": "点焊应能承受后续装配应力，确保连接板垂直度符合要求。",
          "safety_notes": "检查焊机接地线连接可靠，避免触电风险。"
        },
        "safety_warnings": [
          "点焊时注意佩戴防护眼镜和面罩，防止焊渣飞溅烫伤。",
          "确保工作区域通风良好，防止焊接烟尘浓度过高导致中毒。",
          "操作焊机时，手套必须干燥，防止触电。"
        ]
      },
      {
        "step_number": 4,
        "action": "安装方形板和三角板",
        "description": "将图纸上标注为⑫的方形板（FXB-T6*75*75-Q235）和⑪的三角板（SJB-T8*64*37-Q355B）安装到①号方管的两端。方形板位于方管的端部，三角板位于方形板的内侧，按图纸所示角度和位置进行点焊固定。",
        "position_description": "方形板位于①号方管两端，三角板位于方形板内侧。",
        "parts_used": [
          {
            "bom_seq": "12",
            "bom_name": "方形板",
            "quantity": 4,
            "drawing_number": "12"
          },
          {
            "bom_seq": "11",
            "bom_name": "三角板",
            "quantity": 4,
            "drawing_number": "11"
          }
        ],
        "tools": [
          "角尺",
          "焊机（CO2）"
        ],
        "warnings": [
          "三角板的斜边方向必须正确，确保与图纸所示角度一致。",
          "注意焊接变形，采用对称点焊。"
        ],
        "welding": {
          "required": true,
          "welding_type": "角焊（定位焊）",
          "welding_method": "CO2气保焊",
          "weld_size": "点焊长度10mm，焊脚高度3mm",
          "welding_position": "零件⑫方形板与零件①方管的连接处，以及零件⑪三角板与零件⑫方形板的连接处，平焊/横焊",
          "quality_requirements": "定位焊应确保端部结构件的几何尺寸和角度精度。",
          "safety_notes": "清理焊接区域的油污和锈蚀，防止产生气孔。"
        },
        "safety_warnings": [
          "小零件边缘可能锋利，安装时佩戴防割手套，防止割伤。",
          "点焊时，注意焊枪和工件的高温，避免烫伤。",
          "清理焊渣时，佩戴防护眼镜，防止焊渣飞溅伤眼。"
        ]
      },
      {
        "step_number": 5,
        "action": "安装左右连接器板",
        "description": "将图纸上标注为⑥的左连接器板（S-LP1730(68IN)-MP1140-LT-01-06-Q460）和⑩的右连接器板（S-LP1730(68IN)-MP1140-LT-01-08-Q460）安装到①号方管的两侧。连接器板应与方管的侧面齐平，并与已安装的内部结构件对齐。进行点焊固定。",
        "position_description": "左连接器板和右连接器板分别位于①号方管的两侧，与方管侧面齐平。",
        "parts_used": [
          {
            "bom_seq": "6",
            "bom_name": "左连接器板",
            "quantity": 1,
            "drawing_number": "6",
            "node_name": [
              "NAUO7",
              "NAUO6"
            ],
            "bom_code": "01.01.01.4776"
          },
          {
            "bom_seq": "10",
            "bom_name": "右连接器板",
            "quantity": 1,
            "drawing_number": "10"
          }
        ],
        "tools": [
          "卷尺",
          "角尺",
          "焊机（CO2）"
        ],
        "warnings": [
          "区分左右连接器板，避免装反。",
          "确保连接器板上的孔位与内部结构件的孔位对齐。"
        ],
        "welding": {
          "required": true,
          "welding_type": "角焊（定位焊）",
          "welding_method": "CO2气保焊",
          "weld_size": "点焊长度15mm，焊脚高度4mm",
          "welding_position": "零件⑥/⑩连接器板与零件①方管的连接面，横焊/平焊",
          "quality_requirements": "点焊应均匀分布在连接板的上下边缘，确保连接板与方管齐平，无错位。",
          "safety_notes": "注意连接器板较重，安装时需防止砸伤，点焊时注意站位，避免被火花烫伤。"
        },
        "safety_warnings": [
          "连接器板较重，搬运和安装时注意姿势，防止扭伤腰部。",
          "安装时需两人配合或使用辅助工具，防止连接器板掉落砸伤脚部，必须穿戴安全鞋。",
          "点焊时注意站位，避免被焊接火花和飞溅物烫伤。"
        ]
      },
      {
        "step_number": 6,
        "action": "安装上挂板和轴套",
        "description": "将图纸上标注为⑧的上挂板（S-LP1730(68IN)-MP1140-LT-01-07-Q460）安装到组件的顶部中间位置，并进行点焊。同时，将图纸上标注为⑤的轴套（S-RB1830-03-07-Q235）安装到上挂板下方的孔位，确保轴套与孔位同心，并进行点焊固定。",
        "position_description": "上挂板位于组件顶部中心，轴套位于上挂板下方的安装孔位。",
        "parts_used": [
          {
            "bom_seq": "8",
            "bom_name": "上挂板",
            "quantity": 1,
            "drawing_number": "8",
            "node_name": [
              "NAUO11"
            ],
            "bom_code": "01.02.05.0334"
          },
          {
            "bom_seq": "5",
            "bom_name": "轴套",
            "quantity": 1,
            "drawing_number": "5",
            "node_name": [
              "NAUO8",
              "NAUO5"
            ],
            "bom_code": "01.02.03.0207"
          }
        ],
        "tools": [
          "塞尺",
          "焊机（CO2）"
        ],
        "warnings": [
          "轴套的定位精度要求高，确保其垂直度。",
          "上挂板必须居中安装。"
        ],
        "welding": {
          "required": true,
          "welding_type": "角焊（定位焊）/塞焊（轴套）",
          "welding_method": "CO2气保焊",
          "weld_size": "点焊长度10mm，轴套环形点焊",
          "welding_position": "零件⑧上挂板与零件①方管的连接处（平焊），零件⑤轴套与零件⑧上挂板的连接处（平焊/环形焊）",
          "quality_requirements": "轴套定位焊需保证同心度，上挂板定位焊需保证居中和垂直度。",
          "safety_notes": "轴套焊接时，注意控制热输入，防止轴套变形影响后续配合。"
        },
        "safety_warnings": [
          "轴套进行塞焊时，注意熔池温度高，防止烫伤。",
          "确保轴套定位牢固，防止在焊接过程中脱落或倾倒。",
          "焊接烟尘可能积聚在组件内部，注意保持局部通风良好。"
        ]
      },
      {
        "step_number": 7,
        "action": "安装方形板-机加",
        "description": "将图纸上标注为⑨的方形板-机加（S-LP1730(68IN)-MP1140-LT-01-10-Q460）安装到组件的顶部两侧，位于上挂板⑧的两侧。方形板-机加应与①号方管的顶面齐平。进行点焊固定。",
        "position_description": "位于组件顶部两侧，与①号方管顶面齐平。",
        "parts_used": [
          {
            "bom_seq": "9",
            "bom_name": "方形板-机加",
            "quantity": 2,
            "drawing_number": "9",
            "node_name": [
              "NAUO14"
            ],
            "bom_code": "01.02.02.0447"
          }
        ],
        "tools": [
          "卷尺",
          "焊机（CO2）"
        ],
        "warnings": [
          "确保两块方形板-机加的端面与组件端面保持一致。",
          "检查焊接间隙，确保后续满焊质量。"
        ],
        "welding": {
          "required": true,
          "welding_type": "角焊（定位焊）",
          "welding_method": "CO2气保焊",
          "weld_size": "点焊长度10mm，焊脚高度3mm",
          "welding_position": "零件⑨方形板-机加与零件①方管的连接处，平焊",
          "quality_requirements": "定位焊应确保方形板与方管顶面齐平，无高低差。",
          "safety_notes": "焊接前检查焊丝和保护气体，确保焊接过程稳定。"
        },
        "safety_warnings": [
          "机加零件边缘可能较锐利，操作时佩戴手套，防止割伤。",
          "点焊时注意控制热量，防止因热变形导致零件错位或翘曲。"
        ]
      },
      {
        "step_number": 8,
        "action": "安装防滑板",
        "description": "将图纸上标注为⑬的防滑板（S-EDGP1630-DR-01-10-Q235）安装到①号方管的底部两侧。防滑板应与方管底部齐平，并按图纸尺寸定位。进行点焊固定。",
        "position_description": "位于①号方管的底部两侧。",
        "parts_used": [
          {
            "bom_seq": "13",
            "bom_name": "防滑板",
            "quantity": 2,
            "drawing_number": "13"
          }
        ],
        "tools": [
          "卷尺",
          "焊机（CO2）"
        ],
        "warnings": [
          "防滑板的定位要准确，确保其功能性。",
          "点焊牢固，防止后续满焊时脱落。"
        ],
        "welding": {
          "required": true,
          "welding_type": "角焊（定位焊）",
          "welding_method": "CO2气保焊",
          "weld_size": "点焊长度10mm，焊脚高度3mm",
          "welding_position": "零件⑬防滑板与零件①方管的连接处，仰焊（如果组件未翻转）或平焊（如果组件已翻转）",
          "quality_requirements": "定位焊应确保防滑板与方管底部齐平，无间隙。",
          "safety_notes": "如果进行仰焊，需特别注意熔渣和熔滴下落，加强个人防护，穿戴防火服。"
        },
        "safety_warnings": [
          "如果需要仰焊（从底部向上焊），必须穿戴防火服和头罩，防止高温熔渣和熔滴溅落烫伤。",
          "仰焊时，确保站位稳固，避免因操作不便导致失误。",
          "防滑板边缘可能粗糙，搬运时佩戴手套。"
        ]
      },
      {
        "step_number": 9,
        "action": "满焊所有结构件",
        "description": "对所有已点焊固定的零件（包括②、③、④、⑤、⑥、⑧、⑨、⑩、⑪、⑫、⑬号零件）进行满焊。焊接时应遵循合理的焊接顺序，采用对称、分段、跳焊等方法，以控制焊接变形。焊接要求参照图纸技术要求。",
        "position_description": "对所有连接面进行满焊。",
        "parts_used": [
          {
            "bom_seq": "2",
            "bom_name": "方管",
            "quantity": 2,
            "drawing_number": "2",
            "node_name": [
              "NAUO2"
            ],
            "bom_code": "01.02.01.3871"
          }
        ],
        "tools": [
          "焊机（CO2）",
          "焊钳",
          "防护用品"
        ],
        "warnings": [
          "严格控制焊接电流和速度，确保焊缝成型美观、无气孔、夹渣等缺陷。",
          "焊接完成后，立即去除焊渣。"
        ],
        "welding": {
          "required": true,
          "welding_type": "角焊/对接焊（满焊）",
          "welding_method": "CO2气保焊（主要）",
          "weld_size": "焊脚高度通常为6mm（根据图纸未注尺寸要求），轴套⑤为环形连续焊",
          "welding_position": "所有零件连接处，涉及平焊、横焊、立焊、仰焊（需翻转组件以尽量采用平焊）",
          "quality_requirements": "焊缝必须连续、饱满，焊缝表面均匀，无咬边、未焊透、裂纹等缺陷。焊后进行外观检查，关键焊缝可能需要进行无损检测（如磁粉或超声波）。",
          "safety_notes": "采用合理的焊接顺序（如对称分段焊）控制变形。焊接过程中保持通风，防止烟尘中毒。高强度钢（Q355B/Q460）焊接时，注意控制层间温度，避免产生冷裂纹。"
        },
        "safety_warnings": [
          "进行满焊时，必须全程佩戴全套焊接防护用品（面罩、手套、防护服），防止长时间暴露于弧光和高温。",
          "确保焊接区域的通风系统全负荷运行，防止大量烟尘和有毒气体（如一氧化碳）积聚。",
          "如果需要翻转组件进行焊接，必须使用行车或吊具，并确保组件捆绑牢固，防止翻转过程中组件滑落或砸伤。",
          "高强度钢焊接时，严格遵守预热和层间温度控制要求，防止焊接裂纹，避免因操作不当引发的结构失效风险。"
        ]
      },
      {
        "step_number": 10,
        "action": "打磨清理",
        "description": "对所有焊缝进行打磨处理，去除飞溅、毛刺和尖锐棱角。特别是轴套⑤和上挂板⑧周围的焊缝，应打磨平整，确保后续配合件的安装顺畅。",
        "position_description": "所有焊缝和尖锐棱角。",
        "parts_used": [],
        "tools": [
          "角磨机",
          "砂轮片",
          "钢丝刷"
        ],
        "warnings": [
          "打磨时注意安全，佩戴防护眼镜。",
          "打磨后的表面应光滑，无明显凹凸不平。"
        ],
        "safety_warnings": [
          "操作角磨机时，必须佩戴防护眼镜和面罩，防止高速飞溅的金属碎屑和火花伤眼。",
          "检查角磨机防护罩是否安装到位，砂轮片是否完好无裂纹，防止砂轮片破碎伤人。",
          "打磨时双手握紧机器，站稳，避免反作用力导致机器脱手伤人。",
          "打磨产生的粉尘较大，建议佩戴防尘口罩，保护呼吸道。"
        ]
      }
    ]
  }
}