{
  "agent_name": "Agent6_FAQ",
  "model": "google/gemini-2.5-flash-preview-09-2025",
  "timestamp": "20251106_060100",
  "image_count": 0,
  "temperature": 0.2,
  "system_prompt": "# 角色定位\n\n你是**李师傅**，一位拥有20年安全管理经验的高级安全工程师。\n\n## 教育背景\n\n- **学历**：安全工程专业本科\n- **职业资格**：注册安全工程师、高级安全评价师\n- **专业培训**：\n  - 机械制造安全管理\n  - 职业健康与安全管理体系（ISO 45001）\n  - 事故调查与分析\n  - 应急预案编制与演练\n\n## 职业背景\n\n- **工作经历**：20年机械制造企业安全管理经验，参与过大型装备制造、钢结构加工等项目\n- **专业领域**：\n  - 机械加工安全（车、铣、刨、磨、钻等）\n  - 焊接作业安全（电焊、气焊、氩弧焊等）\n  - 起重吊装安全（行车、叉车、吊索具等）\n  - 高空作业安全（脚手架、安全带、防坠落等）\n  - 个人防护用品管理（安全帽、防护眼镜、手套、安全鞋等）\n\n## 知识结构（详细）\n\n### 1. 机械伤害风险\n- **夹伤/挤伤**：手指、手臂被运动部件夹住\n- **切割伤**：锋利边缘、毛刺、切削工具\n- **碰撞伤**：头部碰撞、身体碰撞\n- **坠落伤**：零件坠落、工具坠落、人员坠落\n\n### 2. 焊接作业风险\n- **电击伤**：焊机漏电、接地不良\n- **弧光伤**：电弧紫外线灼伤眼睛和皮肤\n- **烫伤**：高温熔池、焊渣飞溅\n- **火灾爆炸**：易燃物引燃、气瓶泄漏\n- **有毒气体**：焊接烟尘、一氧化碳中毒\n\n### 3. 起重吊装风险\n- **吊物坠落**：吊索具断裂、捆绑不牢\n- **吊物摆动**：碰撞人员、设备\n- **超载**：超过起重机额定载荷\n- **指挥失误**：信号不清、违章指挥\n\n### 4. 高空作业风险\n- **人员坠落**：未系安全带、脚手架不牢\n- **物体打击**：工具、零件从高处坠落\n- **脚手架坍塌**：搭设不规范、超载\n\n### 5. 个人防护用品\n- **头部防护**：安全帽（防止碰撞、坠物打击）\n- **眼部防护**：防护眼镜、焊接面罩（防止飞溅、弧光）\n- **手部防护**：防护手套（防止切割、烫伤、化学品）\n- **足部防护**：安全鞋（防砸、防刺穿、防滑）\n- **呼吸防护**：防尘口罩、防毒面具（防止粉尘、有毒气体）\n\n### 6. 应急处理\n- **机械伤害**：立即停机、呼救、止血、固定、送医\n- **电击伤**：切断电源、心肺复苏、送医\n- **烫伤**：冷水冲洗、覆盖无菌纱布、送医\n- **火灾**：使用灭火器、疏散人员、报警\n\n## 任务步骤（Chain of Thought）\n\n你的任务是**为每个装配步骤添加安全警告**（如果该步骤有安全风险）。请按照以下5个步骤思考：\n\n### 步骤1：识别风险步骤\n- 分析每个装配步骤的操作内容\n- 判断是否涉及高风险作业（焊接、吊装、高空、重物搬运等）\n- 识别潜在的伤害类型（机械伤害、电击、烫伤、坠落等）\n\n### 步骤2：分析风险源\n- 确定风险的来源（设备、工具、材料、环境、人员操作等）\n- 评估风险的严重程度（轻微、中等、严重、致命）\n- 考虑风险的发生概率\n\n### 步骤3：制定预防措施\n- 针对每个风险源，制定具体的预防措施\n- 强调个人防护用品的使用\n- 强调安全操作规程的遵守\n\n### 步骤4：添加安全警告\n- 为每个有风险的步骤添加safety_warnings字段\n- 每条警告要简洁明了，说明具体的风险和预防措施\n- 使用工人能看懂的语言\n\n### 步骤5：验证完整性\n- 检查所有高风险步骤是否都添加了安全警告\n- 检查安全警告是否具体、可操作\n- 检查是否遗漏了任何潜在风险\n\n## 核心原则\n\n1. **步骤级嵌入**：为每个有风险的步骤添加safety_warnings字段，而不是单独列出安全警告\n2. **工人友好**：使用通俗语言，避免专业术语\n3. **具体可操作**：说明具体的风险和预防措施，而不是泛泛而谈\n4. **不重复显示**：安全警告只在下方\"安全\"标签页中统一显示，不在当前步骤详情中重复显示\n\n## 输出格式\n\n严格按照以下JSON格式输出（返回增强后的装配步骤）：\n\n```json\n{\n  \"enhanced_steps\": [\n    {\n      \"step_number\": 1,\n      \"title\": \"点焊定位\",\n      \"parts_used\": [...],\n      \"tools_required\": [...],\n      \"operation\": \"操作说明\",\n      \"quality_check\": \"质量检查\",\n      \"estimated_time_minutes\": 10,\n      \"welding\": {\n        \"required\": true,\n        \"welding_type\": \"点焊\",\n        \"welding_method\": \"CO2气保焊\",\n        ...\n      },\n      \"safety_warnings\": [\n        \"佩戴焊接面罩和防护手套，防止弧光灼伤眼睛和皮肤\",\n        \"确保工件夹紧牢固，防止点焊时位移造成伤害\",\n        \"焊接区域周围3米内不得有易燃物，配备灭火器\",\n        \"焊机必须接地良好，防止漏电触电\"\n      ]\n    },\n    {\n      \"step_number\": 2,\n      \"title\": \"螺栓连接\",\n      \"parts_used\": [...],\n      \"operation\": \"操作说明\",\n      \"quality_check\": \"质量检查\",\n      \"estimated_time_minutes\": 15,\n      \"safety_warnings\": [\n        \"佩戴安全帽和防护眼镜，防止零件坠落和飞溅\",\n        \"使用扭力扳手时注意力度，防止扳手滑脱伤人\"\n      ]\n    },\n    {\n      \"step_number\": 3,\n      \"title\": \"简单装配\",\n      \"parts_used\": [...],\n      \"operation\": \"操作说明\",\n      \"quality_check\": \"质量检查\",\n      \"estimated_time_minutes\": 5\n      // ⚠️ 如果没有明显安全风险，不添加safety_warnings字段\n    }\n  ]\n}\n```\n\n**⚠️ 关键要求**：\n\n1. **步骤级嵌入**：\n   - 为每个有风险的步骤添加`safety_warnings`字段\n   - 没有明显风险的步骤不添加`safety_warnings`字段\n   - 保持原有步骤的所有字段不变\n\n2. **安全警告要具体**：\n   - ✅ 说\"佩戴焊接面罩和防护手套，防止弧光灼伤眼睛和皮肤\"\n   - ❌ 不说\"注意安全\"\n   - ✅ 说\"焊接区域周围3米内不得有易燃物，配备灭火器\"\n   - ❌ 不说\"注意防火\"\n\n3. **使用通俗语言**：\n   - 工人能看懂的语言\n   - 避免专业术语和英文缩写\n\n4. **警告要全面**：\n   - 涵盖个人防护、设备安全、环境安全、操作安全\n   - 每条警告说明具体的风险和预防措施\n\n## 重要提醒\n\n- **只输出JSON，不要输出其他内容**\n- **保持原有字段不变**：不要修改或删除原有的字段（包括welding字段）\n- **警告要简洁明了**：每条警告一句话，说明风险和预防措施\n- **不要过度警告**：只针对有明显风险的步骤添加警告\n",
  "user_query": "请为以下装配步骤添加安全警告（如果有安全风险）。\n\n## 📸 视觉分析任务\n\n**你会看到工程图纸图片，请仔细观察：**\n\n1. **危险作业标识**：\n   - 图纸上的安全警告标识\n   - 特殊作业要求（如高空作业、吊装作业等）\n   - 危险区域标注\n\n2. **零件特征**：\n   - 重型零件（需要吊装）\n   - 锋利边缘（容易割伤）\n   - 高温部件（容易烫伤）\n\n3. **作业环境**：\n   - 狭窄空间（容易碰撞）\n   - 高空位置（容易坠落）\n   - 密闭空间（通风不良）\n\n## 装配步骤\n\n[\n  {\n    \"step_number\": 1,\n    \"action\": \"放置基准件\",\n    \"description\": \"将图纸上标注为3号的方管-机加（BOM序号3）平稳放置在装配胎具上，作为整个主框架的基准件。确保方管水平且定位准确。\",\n    \"position_description\": \"工作台中心\",\n    \"parts_used\": [\n      {\n        \"bom_seq\": \"3\",\n        \"bom_name\": \"方管-机加\",\n        \"quantity\": 1,\n        \"drawing_number\": \"3\",\n        \"node_name\": [\n          \"NAUO6\",\n          \"NAUO5\"\n        ],\n        \"bom_code\": \"01.01.4792\"\n      }\n    ],\n    \"tools\": [\n      \"行车/吊具\",\n      \"水平仪\",\n      \"装配胎具\"\n    ],\n    \"warnings\": [\n      \"方管较重，吊装时注意安全，确保吊具捆绑牢固。\",\n      \"基准件定位必须准确，否则影响后续所有零件的精度。\"\n    ]\n  },\n  {\n    \"step_number\": 2,\n    \"action\": \"安装左右悬挂板\",\n    \"description\": \"将图纸上标注为1号的右悬挂臂板（BOM序号1）和2号的左悬挂臂板（BOM序号2）分别安装到3号方管的两端。根据图纸尺寸（2068mm总长）进行定位，确保悬挂板与方管端面齐平，且垂直度符合要求。点焊固定。\",\n    \"position_description\": \"3号方管的两端\",\n    \"parts_used\": [\n      {\n        \"bom_seq\": \"1\",\n        \"bom_name\": \"右悬挂臂板\",\n        \"quantity\": 1,\n        \"drawing_number\": \"1\",\n        \"node_name\": [\n          \"NAUO2\",\n          \"NAUO1\"\n        ],\n        \"bom_code\": \"01.01.03.0692\"\n      },\n      {\n        \"bom_seq\": \"2\",\n        \"bom_name\": \"左悬挂臂板\",\n        \"quantity\": 1,\n        \"drawing_number\": \"2\",\n        \"node_name\": [\n          \"NAUO4\",\n          \"NAUO3\"\n        ],\n        \"bom_code\": \"01.01.03.0693\"\n      }\n    ],\n    \"tools\": [\n      \"卷尺\",\n      \"角尺\",\n      \"焊机（CO2）\"\n    ],\n    \"warnings\": [\n      \"悬挂板的安装方向不能反，注意孔位朝向。\",\n      \"点焊前必须检查垂直度，确保90度。\"\n    ],\n    \"welding\": {\n      \"required\": true,\n      \"welding_type\": \"角焊（定位焊）\",\n      \"welding_method\": \"CO2气保焊\",\n      \"weld_size\": \"点焊长度10-15mm，焊脚高度3mm\",\n      \"welding_position\": \"零件1/2（悬挂板）与零件3（方管）的连接处，主要为平焊和横焊位置\",\n      \"quality_requirements\": \"点焊牢固，能承受后续装配应力，焊点位置避开最终满焊区域的起始点\",\n      \"safety_notes\": \"佩戴焊接面罩、防护手套和防护服。确保工作区域通风良好，防止烟尘吸入。\"\n    }\n  },\n  {\n    \"step_number\": 3,\n    \"action\": \"安装旋转弧板\",\n    \"description\": \"将图纸上标注为7号的旋转弧板（BOM序号7）安装到3号方管的中间位置。根据图纸尺寸（505mm、106mm）定位，确保旋转弧板的中心线与方管中心线对齐。点焊固定。\",\n    \"position_description\": \"3号方管中部上方\",\n    \"parts_used\": [\n      {\n        \"bom_seq\": \"7\",\n        \"bom_name\": \"旋转弧板\",\n        \"quantity\": 2,\n        \"drawing_number\": \"7\",\n        \"node_name\": [\n          \"NAUO12\"\n        ],\n        \"bom_code\": \"01.01.01.1590\"\n      }\n    ],\n    \"tools\": [\n      \"卷尺\",\n      \"划线工具\",\n      \"焊机\"\n    ],\n    \"warnings\": [\n      \"旋转弧板是成对安装的，注意两块板之间的间距和对齐度。\",\n      \"定位精度要求高，确保中心线偏差小于0.5mm。\"\n    ],\n    \"welding\": {\n      \"required\": true,\n      \"welding_type\": \"角焊（定位焊）\",\n      \"welding_method\": \"CO2气保焊\",\n      \"weld_size\": \"点焊长度10mm，焊脚高度3mm\",\n      \"welding_position\": \"零件7（旋转弧板）与零件3（方管）的连接处，平焊位置\",\n      \"quality_requirements\": \"定位焊必须保证弧板的垂直度和中心线位置，焊点均匀分布，防止定位过程中产生变形。\",\n      \"safety_notes\": \"检查焊机接地线是否完好，避免触电风险。清理焊接区域的油污和锈蚀，防止产生气孔。\"\n    }\n  },\n  {\n    \"step_number\": 4,\n    \"action\": \"安装内部加强件\",\n    \"description\": \"将图纸上标注为4号的角钢（BOM序号4）和5号的方管-机加（BOM序号5）安装到3号方管的内部。4号角钢用于加强，5号方管用于支撑。根据图纸尺寸定位，确保它们与3号方管内壁紧密贴合。点焊固定。\",\n    \"position_description\": \"3号方管内部\",\n    \"parts_used\": [\n      {\n        \"bom_seq\": \"4\",\n        \"bom_name\": \"角钢\",\n        \"quantity\": 5,\n        \"drawing_number\": \"4\",\n        \"node_name\": [\n          \"NAUO8\",\n          \"NAUO7\"\n        ],\n        \"bom_code\": \"01.02.01.3875\"\n      },\n      {\n        \"bom_seq\": \"5\",\n        \"bom_name\": \"方管-机加\",\n        \"quantity\": 2,\n        \"drawing_number\": \"5\",\n        \"node_name\": [\n          \"NAUO10\"\n        ],\n        \"bom_code\": \"01.02.02.0446\"\n      }\n    ],\n    \"tools\": [\n      \"卷尺\",\n      \"卡尺\",\n      \"焊机\"\n    ],\n    \"warnings\": [\n      \"内部零件安装后不易校正，必须在点焊前确保位置准确。\",\n      \"注意角钢和方管的安装方向，避免干涉。\"\n    ],\n    \"welding\": {\n      \"required\": true,\n      \"welding_type\": \"角焊（定位焊）\",\n      \"welding_method\": \"CO2气保焊\",\n      \"weld_size\": \"点焊长度8mm，焊脚高度3mm\",\n      \"welding_position\": \"零件4/5（加强件）与零件3（方管）的内壁连接处，主要为平焊和横焊位置\",\n      \"quality_requirements\": \"确保加强件与方管内壁贴合紧密，点焊位置应均匀，防止后续满焊时产生大的内应力。\",\n      \"safety_notes\": \"由于在方管内部操作，必须确保良好的局部通风，防止有害气体聚集。注意焊枪角度，避免烧伤内部电缆或管线（如果存在）。\"\n    }\n  },\n  {\n    \"step_number\": 5,\n    \"action\": \"安装轴套和固定套\",\n    \"description\": \"将图纸上标注为8号的固定套（BOM序号8）和9号的轴套（BOM序号9）安装到7号旋转弧板的下方。固定套和轴套应穿过7号旋转弧板的孔位，并与弧板底部齐平。点焊固定。\",\n    \"position_description\": \"7号旋转弧板下方孔位\",\n    \"parts_used\": [\n      {\n        \"bom_seq\": \"8\",\n        \"bom_name\": \"固定套\",\n        \"quantity\": 1,\n        \"drawing_number\": \"8\",\n        \"node_name\": [\n          \"NAUO15\",\n          \"NAUO13\"\n        ],\n        \"bom_code\": \"01.01.01.1593\"\n      },\n      {\n        \"bom_seq\": \"9\",\n        \"bom_name\": \"轴套\",\n        \"quantity\": 1,\n        \"drawing_number\": \"9\",\n        \"node_name\": [\n          \"NAUO14\"\n        ],\n        \"bom_code\": \"01.01.01.1591\"\n      }\n    ],\n    \"tools\": [\n      \"卡尺\",\n      \"焊机\"\n    ],\n    \"warnings\": [\n      \"轴套和固定套的轴线必须与旋转弧板的中心线垂直，确保旋转顺畅。\",\n      \"轴套和固定套的端面应与弧板底部齐平，避免突出或凹陷。\"\n    ],\n    \"welding\": {\n      \"required\": true,\n      \"welding_type\": \"环形角焊（定位焊）\",\n      \"welding_method\": \"CO2气保焊或氩弧焊（如果材料要求高）\",\n      \"weld_size\": \"点焊长度5mm，焊脚高度3mm\",\n      \"welding_position\": \"零件8/9（套件）与零件7（弧板）的连接处，仰焊或横焊位置\",\n      \"quality_requirements\": \"定位焊必须均匀分布在圆周上（至少3点），确保套件的垂直度。轴套内孔严禁有飞溅物。\",\n      \"safety_notes\": \"轴套和固定套是精密配合件，定位焊时应使用小电流，避免热量集中导致变形。焊接后立即检查垂直度。\"\n    }\n  },\n  {\n    \"step_number\": 6,\n    \"action\": \"安装加强板（BOM序号6、10、11）\",\n    \"description\": \"安装图纸上未标注序号的加强板。将BOM序号6的方形板、BOM序号10的三角板和BOM序号11的方形板焊接到主框架的相应加强位置。根据图纸上的尺寸和结构，将这些板件焊接到3号方管和已安装的零件之间，用于结构加强。\",\n    \"position_description\": \"主框架各连接处（需对照详细图纸定位）\",\n    \"parts_used\": [\n      {\n        \"bom_seq\": \"6\",\n        \"bom_name\": \"方形板-机加\",\n        \"quantity\": 2,\n        \"drawing_number\": \"6\",\n        \"node_name\": [\n          \"NAUO11\"\n        ],\n        \"bom_code\": \"01.01.01.1589\"\n      },\n      {\n        \"bom_seq\": \"10\",\n        \"bom_name\": \"三角板\",\n        \"quantity\": 2,\n        \"drawing_number\": \"未标注\",\n        \"node_name\": [\n          \"NAUO19\",\n          \"NAUO18\",\n          \"NAUO17\",\n          \"NAUO16\"\n        ],\n        \"bom_code\": \"01.01.01.1626\"\n      },\n      {\n        \"bom_seq\": \"11\",\n        \"bom_name\": \"方形板\",\n        \"quantity\": 2,\n        \"drawing_number\": \"未标注\",\n        \"node_name\": [\n          \"NAUO23\",\n          \"NAUO22\",\n          \"NAUO21\",\n          \"NAUO20\"\n        ],\n        \"bom_code\": \"01.01.01.3941\"\n      }\n    ],\n    \"tools\": [\n      \"焊机\",\n      \"夹具\"\n    ],\n    \"warnings\": [\n      \"这些加强板的位置和方向必须严格按照详细图纸定位，确保不干涉其他零件。\",\n      \"点焊后检查板件是否贴合紧密，无间隙。\"\n    ],\n    \"welding\": {\n      \"required\": true,\n      \"welding_type\": \"角焊（定位焊）\",\n      \"welding_method\": \"CO2气保焊\",\n      \"weld_size\": \"点焊长度10mm，焊脚高度3mm\",\n      \"welding_position\": \"加强板与主框架的连接处，涉及平焊、横焊和立焊位置\",\n      \"quality_requirements\": \"加强板必须紧密贴合，定位焊应使用夹具固定，防止板件在焊接过程中移动。确保焊点位置不影响后续满焊的连续性。\",\n      \"safety_notes\": \"在立焊位置进行点焊时，注意控制熔池，防止焊瘤和下坠。确保焊枪电缆没有缠绕或被压住。\"\n    }\n  },\n  {\n    \"step_number\": 7,\n    \"action\": \"安装防滑板\",\n    \"description\": \"将BOM序号12和BOM序号13的防滑板焊接到主框架的指定位置。防滑板通常安装在人员可能站立或接触的表面，确保焊接牢固，焊缝连续。\",\n    \"position_description\": \"主框架顶部或侧面（需对照详细图纸定位）\",\n    \"parts_used\": [\n      {\n        \"bom_seq\": \"12\",\n        \"bom_name\": \"防滑板\",\n        \"quantity\": 1,\n        \"drawing_number\": \"未标注\",\n        \"node_name\": [\n          \"NAUO25\",\n          \"NAUO24\"\n        ],\n        \"bom_code\": \"01.01.01.0517\"\n      },\n      {\n        \"bom_seq\": \"13\",\n        \"bom_name\": \"防滑板\",\n        \"quantity\": 1,\n        \"drawing_number\": \"未标注\",\n        \"node_name\": [\n          \"NAUO25\",\n          \"NAUO24\"\n        ],\n        \"bom_code\": \"01.01.01.0517\"\n      }\n    ],\n    \"tools\": [\n      \"焊机\"\n    ],\n    \"warnings\": [\n      \"防滑板的焊接必须保证焊缝连续且平整，避免尖锐毛刺。\",\n      \"确保防滑板的防滑纹理朝上。\"\n    ],\n    \"welding\": {\n      \"required\": true,\n      \"welding_type\": \"角焊\",\n      \"welding_method\": \"CO2气保焊\",\n      \"weld_size\": \"焊脚高度4mm，焊缝连续\",\n      \"welding_position\": \"防滑板与主框架的连接边缘，主要为平焊位置\",\n      \"quality_requirements\": \"焊缝必须连续，保证密封性，焊缝外观平整，不允许有未焊透、气孔等缺陷。焊后必须打磨平整，去除所有尖锐棱角。\",\n      \"safety_notes\": \"防滑板板材较薄，焊接时注意控制电流，避免烧穿。焊接完成后，立即清理焊渣和飞溅物，防止烫伤。\"\n    }\n  },\n  {\n    \"step_number\": 8,\n    \"action\": \"满焊与清理\",\n    \"description\": \"对所有已点焊的零件进行满焊。根据技术要求，选择合适的焊接电流、电压和速度，确保焊缝饱满、无虚焊、无漏焊。焊接完成后，进行焊渣清理和打磨，去除飞溅物和尖锐棱角。\",\n    \"position_description\": \"所有连接部位\",\n    \"parts_used\": [\n      {\n        \"bom_seq\": \"1\",\n        \"bom_name\": \"右悬挂臂板\",\n        \"quantity\": 0,\n        \"drawing_number\": \"1\",\n        \"node_name\": [\n          \"NAUO2\",\n          \"NAUO1\"\n        ],\n        \"bom_code\": \"01.01.03.0692\"\n      },\n      {\n        \"bom_seq\": \"2\",\n        \"bom_name\": \"左悬挂臂板\",\n        \"quantity\": 0,\n        \"drawing_number\": \"2\",\n        \"node_name\": [\n          \"NAUO4\",\n          \"NAUO3\"\n        ],\n        \"bom_code\": \"01.01.03.0693\"\n      },\n      {\n        \"bom_seq\": \"7\",\n        \"bom_name\": \"旋转弧板\",\n        \"quantity\": 0,\n        \"drawing_number\": \"7\",\n        \"node_name\": [\n          \"NAUO12\"\n        ],\n        \"bom_code\": \"01.01.01.1590\"\n      }\n    ],\n    \"tools\": [\n      \"焊机\",\n      \"角磨机\",\n      \"钢丝刷\"\n    ],\n    \"warnings\": [\n      \"焊接过程中注意热变形，必要时采取反变形措施。\",\n      \"打磨时注意保护眼睛和呼吸道，确保焊缝平整度符合要求。\"\n    ],\n    \"welding\": {\n      \"required\": true,\n      \"welding_type\": \"角焊/环形焊\",\n      \"welding_method\": \"CO2气保焊\",\n      \"weld_size\": \"根据图纸要求，主要焊缝焊脚高度6mm（T6），次要焊缝4mm（T4）\",\n      \"welding_position\": \"所有连接部位，涉及平焊、横焊、立焊和仰焊\",\n      \"quality_requirements\": \"焊缝必须连续、饱满，熔深足够，不允许有裂纹、未熔合、严重气孔和夹渣。关键受力部位（如悬挂板连接处）需进行外观检查和磁粉检测（MT）。\",\n      \"safety_notes\": \"采用分段、跳焊或对称焊接顺序，控制整体热输入，减少结构变形。仰焊和立焊时，注意调整焊接参数，确保熔池稳定。打磨时必须佩戴护目镜和防尘口罩。\"\n    }\n  }\n]\n\n## 要求\n\n请按照以下5个步骤思考，为装配步骤添加安全警告：\n\n### 步骤1：识别风险步骤\n- 分析每个装配步骤的操作内容\n- 判断是否涉及高风险作业：\n  * **焊接作业**：电击、弧光、烫伤、火灾\n  * **吊装作业**：吊物坠落、碰撞、超载\n  * **高空作业**：人员坠落、物体打击\n  * **重物搬运**：砸伤、扭伤、夹伤\n  * **机械加工**：切割伤、夹伤、碰撞\n\n### 步骤2：分析风险源\n- 确定风险的来源（设备、工具、材料、环境、人员操作等）\n- 评估风险的严重程度（轻微、中等、严重、致命）\n- 考虑风险的发生概率\n\n### 步骤3：制定预防措施\n- 针对每个风险源，制定具体的预防措施\n- 强调个人防护用品的使用：\n  * **焊接**：焊接面罩、防护手套、防护服\n  * **吊装**：安全帽、安全鞋、手套\n  * **高空**：安全带、安全帽、防滑鞋\n  * **机械**：防护眼镜、手套、安全鞋\n\n### 步骤4：添加安全警告\n- 为每个有风险的步骤添加safety_warnings字段\n- 每条警告要简洁明了，说明具体的风险和预防措施\n- 使用工人能看懂的语言\n\n### 步骤5：验证完整性\n- 检查所有高风险步骤是否都添加了安全警告\n- 检查安全警告是否具体、可操作\n- 检查是否遗漏了任何潜在风险\n\n## ⚠️ 强制自检清单（生成后必须逐项检查）\n\n**在输出JSON之前，你必须完成以下验证：**\n\n1. **风险步骤识别验证**：\n   - [ ] 所有涉及焊接、吊装、高空、重物搬运的步骤都添加了safety_warnings字段\n   - [ ] 没有明显风险的步骤没有添加safety_warnings字段\n\n2. **安全警告完整性验证**：\n   - [ ] 每个safety_warnings字段都是字符串数组\n   - [ ] 每条警告都说明了具体的风险和预防措施\n   - [ ] 涵盖了个人防护、设备安全、环境安全、操作安全\n\n3. **语言通俗性验证**：\n   - [ ] 使用工人能看懂的语言\n   - [ ] 避免专业术语和英文缩写\n   - [ ] 每条警告简洁明了（一句话）\n\n4. **原有字段保持验证**：\n   - [ ] 原有步骤的所有字段都保持不变（包括welding字段）\n   - [ ] 没有修改或删除任何原有字段\n\n**如果自检发现任何问题，必须重新生成！**\n\n现在开始为装配步骤添加安全警告！\n",
  "raw_response": "```json\n{\n  \"enhanced_steps\": [\n    {\n      \"step_number\": 1,\n      \"action\": \"放置基准件\",\n      \"description\": \"将图纸上标注为3号的方管-机加（BOM序号3）平稳放置在装配胎具上，作为整个主框架的基准件。确保方管水平且定位准确。\",\n      \"position_description\": \"工作台中心\",\n      \"parts_used\": [\n        {\n          \"bom_seq\": \"3\",\n          \"bom_name\": \"方管-机加\",\n          \"quantity\": 1,\n          \"drawing_number\": \"3\",\n          \"node_name\": [\n            \"NAUO6\",\n            \"NAUO5\"\n          ],\n          \"bom_code\": \"01.01.4792\"\n        }\n      ],\n      \"tools\": [\n        \"行车/吊具\",\n        \"水平仪\",\n        \"装配胎具\"\n      ],\n      \"warnings\": [\n        \"方管较重，吊装时注意安全，确保吊具捆绑牢固。\",\n        \"基准件定位必须准确，否则影响后续所有零件的精度。\"\n      ],\n      \"safety_warnings\": [\n        \"吊装前检查行车和吊索具是否完好，防止吊物坠落伤人\",\n        \"吊装过程中，人员必须佩戴安全帽，并远离吊物下方\",\n        \"指挥信号要清晰，吊物起升和移动速度要缓慢平稳\",\n        \"搬运零件时，佩戴防护手套，防止被零件边缘割伤\"\n      ]\n    },\n    {\n      \"step_number\": 2,\n      \"action\": \"安装左右悬挂板\",\n      \"description\": \"将图纸上标注为1号的右悬挂臂板（BOM序号1）和2号的左悬挂臂板（BOM序号2）分别安装到3号方管的两端。根据图纸尺寸（2068mm总长）进行定位，确保悬挂板与方管端面齐平，且垂直度符合要求。点焊固定。\",\n      \"position_description\": \"3号方管的两端\",\n      \"parts_used\": [\n        {\n          \"bom_seq\": \"1\",\n          \"bom_name\": \"右悬挂臂板\",\n          \"quantity\": 1,\n          \"drawing_number\": \"1\",\n          \"node_name\": [\n            \"NAUO2\",\n            \"NAUO1\"\n          ],\n          \"bom_code\": \"01.01.03.0692\"\n        },\n        {\n          \"bom_seq\": \"2\",\n          \"bom_name\": \"左悬挂臂板\",\n          \"quantity\": 1,\n          \"drawing_number\": \"2\",\n          \"node_name\": [\n            \"NAUO4\",\n            \"NAUO3\"\n          ],\n          \"bom_code\": \"01.01.03.0693\"\n        }\n      ],\n      \"tools\": [\n        \"卷尺\",\n        \"角尺\",\n        \"焊机（CO2）\"\n      ],\n      \"warnings\": [\n        \"悬挂板的安装方向不能反，注意孔位朝向。\",\n        \"点焊前必须检查垂直度，确保90度。\"\n      ],\n      \"welding\": {\n        \"required\": true,\n        \"welding_type\": \"角焊（定位焊）\",\n        \"welding_method\": \"CO2气保焊\",\n        \"weld_size\": \"点焊长度10-15mm，焊脚高度3mm\",\n        \"welding_position\": \"零件1/2（悬挂板）与零件3（方管）的连接处，主要为平焊和横焊位置\",\n        \"quality_requirements\": \"点焊牢固，能承受后续装配应力，焊点位置避开最终满焊区域的起始点\",\n        \"safety_notes\": \"佩戴焊接面罩、防护手套和防护服。确保工作区域通风良好，防止烟尘吸入。\"\n      },\n      \"safety_warnings\": [\n        \"进行点焊作业时，必须佩戴焊接面罩、防护手套和防护服，防止弧光灼伤和烫伤\",\n        \"检查焊机接地线是否完好，防止触电事故\",\n        \"确保焊接区域周围没有易燃易爆物品，并配备灭火器\",\n        \"操作前清理工件上的油污和锈蚀，防止焊接时产生有毒烟雾\"\n      ]\n    },\n    {\n      \"step_number\": 3,\n      \"action\": \"安装旋转弧板\",\n      \"description\": \"将图纸上标注为7号的旋转弧板（BOM序号7）安装到3号方管的中间位置。根据图纸尺寸（505mm、106mm）定位，确保旋转弧板的中心线与方管中心线对齐。点焊固定。\",\n      \"position_description\": \"3号方管中部上方\",\n      \"parts_used\": [\n        {\n          \"bom_seq\": \"7\",\n          \"bom_name\": \"旋转弧板\",\n          \"quantity\": 2,\n          \"drawing_number\": \"7\",\n          \"node_name\": [\n            \"NAUO12\"\n          ],\n          \"bom_code\": \"01.01.01.1590\"\n        }\n      ],\n      \"tools\": [\n        \"卷尺\",\n        \"划线工具\",\n        \"焊机\"\n      ],\n      \"warnings\": [\n        \"旋转弧板是成对安装的，注意两块板之间的间距和对齐度。\",\n        \"定位精度要求高，确保中心线偏差小于0.5mm。\"\n      ],\n      \"welding\": {\n        \"required\": true,\n        \"welding_type\": \"角焊（定位焊）\",\n        \"welding_method\": \"CO2气保焊\",\n        \"weld_size\": \"点焊长度10mm，焊脚高度3mm\",\n        \"welding_position\": \"零件7（旋转弧板）与零件3（方管）的连接处，平焊位置\",\n        \"quality_requirements\": \"定位焊必须保证弧板的垂直度和中心线位置，焊点均匀分布，防止定位过程中产生变形。\",\n        \"safety_notes\": \"检查焊机接地线是否完好，避免触电风险。清理焊接区域的油污和锈蚀，防止产生气孔。\"\n      },\n      \"safety_warnings\": [\n        \"进行点焊作业时，必须佩戴焊接面罩、防护手套和防护服，防止弧光灼伤和烫伤\",\n        \"确保焊机接地良好，防止漏电触电\",\n        \"保持工作区域通风，避免吸入焊接烟尘\",\n        \"使用夹具固定弧板，防止点焊时弧板移动或倾倒砸伤手脚\"\n      ]\n    },\n    {\n      \"step_number\": 4,\n      \"action\": \"安装内部加强件\",\n      \"description\": \"将图纸上标注为4号的角钢（BOM序号4）和5号的方管-机加（BOM序号5）安装到3号方管的内部。4号角钢用于加强，5号方管用于支撑。根据图纸尺寸定位，确保它们与3号方管内壁紧密贴合。点焊固定。\",\n      \"position_description\": \"3号方管内部\",\n      \"parts_used\": [\n        {\n          \"bom_seq\": \"4\",\n          \"bom_name\": \"角钢\",\n          \"quantity\": 5,\n          \"drawing_number\": \"4\",\n          \"node_name\": [\n            \"NAUO8\",\n            \"NAUO7\"\n          ],\n          \"bom_code\": \"01.02.01.3875\"\n        },\n        {\n          \"bom_seq\": \"5\",\n          \"bom_name\": \"方管-机加\",\n          \"quantity\": 2,\n          \"drawing_number\": \"5\",\n          \"node_name\": [\n            \"NAUO10\"\n          ],\n          \"bom_code\": \"01.02.02.0446\"\n        }\n      ],\n      \"tools\": [\n        \"卷尺\",\n        \"卡尺\",\n        \"焊机\"\n      ],\n      \"warnings\": [\n        \"内部零件安装后不易校正，必须在点焊前确保位置准确。\",\n        \"注意角钢和方管的安装方向，避免干涉。\"\n      ],\n      \"welding\": {\n        \"required\": true,\n        \"welding_type\": \"角焊（定位焊）\",\n        \"welding_method\": \"CO2气保焊\",\n        \"weld_size\": \"点焊长度8mm，焊脚高度3mm\",\n        \"welding_position\": \"零件4/5（加强件）与零件3（方管）的内壁连接处，主要为平焊和横焊位置\",\n        \"quality_requirements\": \"确保加强件与方管内壁贴合紧密，点焊位置应均匀，防止后续满焊时产生大的内应力。\",\n        \"safety_notes\": \"由于在方管内部操作，必须确保良好的局部通风，防止有害气体聚集。注意焊枪角度，避免烧伤内部电缆或管线（如果存在）。\"\n      },\n      \"safety_warnings\": [\n        \"在方管内部进行焊接，必须使用局部排风或佩戴送风式防毒面具，防止有害气体聚集中毒\",\n        \"佩戴焊接面罩和防护手套，防止弧光灼伤和烫伤\",\n        \"注意内部空间狭窄，操作焊枪时防止电缆缠绕或被焊枪烫伤\",\n        \"搬运加强件时，佩戴防护手套，防止被零件边缘割伤或夹伤\"\n      ]\n    },\n    {\n      \"step_number\": 5,\n      \"action\": \"安装轴套和固定套\",\n      \"description\": \"将图纸上标注为8号的固定套（BOM序号8）和9号的轴套（BOM序号9）安装到7号旋转弧板的下方。固定套和轴套应穿过7号旋转弧板的孔位，并与弧板底部齐平。点焊固定。\",\n      \"position_description\": \"7号旋转弧板下方孔位\",\n      \"parts_used\": [\n        {\n          \"bom_seq\": \"8\",\n          \"bom_name\": \"固定套\",\n          \"quantity\": 1,\n          \"drawing_number\": \"8\",\n          \"node_name\": [\n            \"NAUO15\",\n            \"NAUO13\"\n          ],\n          \"bom_code\": \"01.01.01.1593\"\n        },\n        {\n          \"bom_seq\": \"9\",\n          \"bom_name\": \"轴套\",\n          \"quantity\": 1,\n          \"drawing_number\": \"9\",\n          \"node_name\": [\n            \"NAUO14\"\n          ],\n          \"bom_code\": \"01.01.01.1591\"\n        }\n      ],\n      \"tools\": [\n        \"卡尺\",\n        \"焊机\"\n      ],\n      \"warnings\": [\n        \"轴套和固定套的轴线必须与旋转弧板的中心线垂直，确保旋转顺畅。\",\n        \"轴套和固定套的端面应与弧板底部齐平，避免突出或凹陷。\"\n      ],\n      \"welding\": {\n        \"required\": true,\n        \"welding_type\": \"环形角焊（定位焊）\",\n        \"welding_method\": \"CO2气保焊或氩弧焊（如果材料要求高）\",\n        \"weld_size\": \"点焊长度5mm，焊脚高度3mm\",\n        \"welding_position\": \"零件8/9（套件）与零件7（弧板）的连接处，仰焊或横焊位置\",\n        \"quality_requirements\": \"定位焊必须均匀分布在圆周上（至少3点），确保套件的垂直度。轴套内孔严禁有飞溅物。\",\n        \"safety_notes\": \"轴套和固定套是精密配合件，定位焊时应使用小电流，避免热量集中导致变形。焊接后立即检查垂直度。\"\n      },\n      \"safety_warnings\": [\n        \"进行仰焊或横焊时，注意防止焊渣和熔融金属飞溅烫伤身体，必须穿戴好防护服和安全鞋\",\n        \"佩戴焊接面罩和防护手套，防止弧光灼伤和烫伤\",\n        \"轴套内孔严禁有飞溅物，焊接时应采取遮挡措施，防止后续装配困难或损坏零件\"\n      ]\n    },\n    {\n      \"step_number\": 6,\n      \"action\": \"安装加强板（BOM序号6、10、11）\",\n      \"description\": \"安装图纸上未标注序号的加强板。将BOM序号6的方形板、BOM序号10的三角板和BOM序号11的方形板焊接到主框架的相应加强位置。根据图纸上的尺寸和结构，将这些板件焊接到3号方管和已安装的零件之间，用于结构加强。\",\n      \"position_description\": \"主框架各连接处（需对照详细图纸定位）\",\n      \"parts_used\": [\n        {\n          \"bom_seq\": \"6\",\n          \"bom_name\": \"方形板-机加\",\n          \"quantity\": 2,\n          \"drawing_number\": \"6\",\n          \"node_name\": [\n            \"NAUO11\"\n          ],\n          \"bom_code\": \"01.01.01.1589\"\n        },\n        {\n          \"bom_seq\": \"10\",\n          \"bom_name\": \"三角板\",\n          \"quantity\": 2,\n          \"drawing_number\": \"未标注\",\n          \"node_name\": [\n            \"NAUO19\",\n            \"NAUO18\",\n            \"NAUO17\",\n            \"NAUO16\"\n          ],\n          \"bom_code\": \"01.01.01.1626\"\n        },\n        {\n          \"bom_seq\": \"11\",\n          \"bom_name\": \"方形板\",\n          \"quantity\": 2,\n          \"drawing_number\": \"未标注\",\n          \"node_name\": [\n            \"NAUO23\",\n            \"NAUO22\",\n            \"NAUO21\",\n            \"NAUO20\"\n          ],\n          \"bom_code\": \"01.01.01.3941\"\n        }\n      ],\n      \"tools\": [\n        \"焊机\",\n        \"夹具\"\n      ],\n      \"warnings\": [\n        \"这些加强板的位置和方向必须严格按照详细图纸定位，确保不干涉其他零件。\",\n        \"点焊后检查板件是否贴合紧密，无间隙。\"\n      ],\n      \"welding\": {\n        \"required\": true,\n        \"welding_type\": \"角焊（定位焊）\",\n        \"welding_method\": \"CO2气保焊\",\n        \"weld_size\": \"点焊长度10mm，焊脚高度3mm\",\n        \"welding_position\": \"加强板与主框架的连接处，涉及平焊、横焊和立焊位置\",\n        \"quality_requirements\": \"加强板必须紧密贴合，定位焊应使用夹具固定，防止板件在焊接过程中移动。确保焊点位置不影响后续满焊的连续性。\",\n        \"safety_notes\": \"在立焊位置进行点焊时，注意控制熔池，防止焊瘤和下坠。确保焊枪电缆没有缠绕或被压住。\"\n      },\n      \"safety_warnings\": [\n        \"佩戴焊接面罩、防护手套和防护服，防止弧光灼伤和烫伤\",\n        \"进行立焊时，注意防止焊瘤和熔渣飞溅，确保站位安全\",\n        \"使用夹具固定加强板，防止板件在定位过程中掉落或夹伤手指\",\n        \"检查焊枪电缆和气管，防止拖拽或被重物压坏导致漏电或漏气\"\n      ]\n    },\n    {\n      \"step_number\": 7,\n      \"action\": \"安装防滑板\",\n      \"description\": \"将BOM序号12和BOM序号13的防滑板焊接到主框架的指定位置。防滑板通常安装在人员可能站立或接触的表面，确保焊接牢固，焊缝连续。\",\n      \"position_description\": \"主框架顶部或侧面（需对照详细图纸定位）\",\n      \"parts_used\": [\n        {\n          \"bom_seq\": \"12\",\n          \"bom_name\": \"防滑板\",\n          \"quantity\": 1,\n          \"drawing_number\": \"未标注\",\n          \"node_name\": [\n            \"NAUO25\",\n            \"NAUO24\"\n          ],\n          \"bom_code\": \"01.01.01.0517\"\n        },\n        {\n          \"bom_seq\": \"13\",\n          \"bom_name\": \"防滑板\",\n          \"quantity\": 1,\n          \"drawing_number\": \"未标注\",\n          \"node_name\": [\n            \"NAUO25\",\n            \"NAUO24\"\n          ],\n          \"bom_code\": \"01.01.01.0517\"\n        }\n      ],\n      \"tools\": [\n        \"焊机\"\n      ],\n      \"warnings\": [\n        \"防滑板的焊接必须保证焊缝连续且平整，避免尖锐毛刺。\",\n        \"确保防滑板的防滑纹理朝上。\"\n      ],\n      \"welding\": {\n        \"required\": true,\n        \"welding_type\": \"角焊\",\n        \"welding_method\": \"CO2气保焊\",\n        \"weld_size\": \"焊脚高度4mm，焊缝连续\",\n        \"welding_position\": \"防滑板与主框架的连接边缘，主要为平焊位置\",\n        \"quality_requirements\": \"焊缝必须连续，保证密封性，焊缝外观平整，不允许有未焊透、气孔等缺陷。焊后必须打磨平整，去除所有尖锐棱角。\",\n        \"safety_notes\": \"防滑板板材较薄，焊接时注意控制电流，避免烧穿。焊接完成后，立即清理焊渣和飞溅物，防止烫伤。\"\n      },\n      \"safety_warnings\": [\n        \"进行连续焊接时，注意控制热输入，防止板材变形或烧穿，佩戴防护眼镜和手套\",\n        \"焊接完成后，立即清理焊渣和飞溅物，防止被高温焊渣烫伤\",\n        \"防滑板边缘可能锋利，搬运和定位时必须佩戴防割手套\"\n      ]\n    },\n    {\n      \"step_number\": 8,\n      \"action\": \"满焊与清理\",\n      \"description\": \"对所有已点焊的零件进行满焊。根据技术要求，选择合适的焊接电流、电压和速度，确保焊缝饱满、无虚焊、无漏焊。焊接完成后，进行焊渣清理和打磨，去除飞溅物和尖锐棱角。\",\n      \"position_description\": \"所有连接部位\",\n      \"parts_used\": [\n        {\n          \"bom_seq\": \"1\",\n          \"bom_name\": \"右悬挂臂板\",\n          \"quantity\": 0,\n          \"drawing_number\": \"1\",\n          \"node_name\": [\n            \"NAUO2\",\n            \"NAUO1\"\n          ],\n          \"bom_code\": \"01.01.03.0692\"\n        },\n        {\n          \"bom_seq\": \"2\",\n          \"bom_name\": \"左悬挂臂板\",\n          \"quantity\": 0,\n          \"drawing_number\": \"2\",\n          \"node_name\": [\n            \"NAUO4\",\n            \"NAUO3\"\n          ],\n          \"bom_code\": \"01.01.03.0693\"\n        },\n        {\n          \"bom_seq\": \"7\",\n          \"bom_name\": \"旋转弧板\",\n          \"quantity\": 0,\n          \"drawing_number\": \"7\",\n          \"node_name\": [\n            \"NAUO12\"\n          ],\n          \"bom_code\": \"01.01.01.1590\"\n        }\n      ],\n      \"tools\": [\n        \"焊机\",\n        \"角磨机\",\n        \"钢丝刷\"\n      ],\n      \"warnings\": [\n        \"焊接过程中注意热变形，必要时采取反变形措施。\",\n        \"打磨时注意保护眼睛和呼吸道，确保焊缝平整度符合要求。\"\n      ],\n      \"welding\": {\n        \"required\": true,\n        \"welding_type\": \"角焊/环形焊\",\n        \"welding_method\": \"CO2气保焊\",\n        \"weld_size\": \"根据图纸要求，主要焊缝焊脚高度6mm（T6），次要焊缝4mm（T4）\",\n        \"welding_position\": \"所有连接部位，涉及平焊、横焊、立焊和仰焊\",\n        \"quality_requirements\": \"焊缝必须连续、饱满，熔深足够，不允许有裂纹、未熔合、严重气孔和夹渣。关键受力部位（如悬挂板连接处）需进行外观检查和磁粉检测（MT）。\",\n        \"safety_notes\": \"采用分段、跳焊或对称焊接顺序，控制整体热输入，减少结构变形。仰焊和立焊时，注意调整焊接参数，确保熔池稳定。打磨时必须佩戴护目镜和防尘口罩。\"\n      },\n      \"safety_warnings\": [\n        \"满焊作业必须佩戴全套防护用品（焊接面罩、防护服、手套、安全鞋），防止大面积弧光灼伤和烫伤\",\n        \"使用角磨机打磨时，必须佩戴防护眼镜和防尘口罩，防止金属飞屑和粉尘伤害眼睛和呼吸道\",\n        \"打磨作业时，注意磨光片是否安装牢固，防止高速旋转的磨片飞出伤人\",\n        \"清理焊渣时，使用专用工具，并佩戴防护眼镜，防止焊渣飞溅伤眼\"\n      ]\n    }\n  ]\n}\n```",
  "parsed_result": {
    "enhanced_steps": [
      {
        "step_number": 1,
        "action": "放置基准件",
        "description": "将图纸上标注为3号的方管-机加（BOM序号3）平稳放置在装配胎具上，作为整个主框架的基准件。确保方管水平且定位准确。",
        "position_description": "工作台中心",
        "parts_used": [
          {
            "bom_seq": "3",
            "bom_name": "方管-机加",
            "quantity": 1,
            "drawing_number": "3",
            "node_name": [
              "NAUO6",
              "NAUO5"
            ],
            "bom_code": "01.01.4792"
          }
        ],
        "tools": [
          "行车/吊具",
          "水平仪",
          "装配胎具"
        ],
        "warnings": [
          "方管较重，吊装时注意安全，确保吊具捆绑牢固。",
          "基准件定位必须准确，否则影响后续所有零件的精度。"
        ],
        "safety_warnings": [
          "吊装前检查行车和吊索具是否完好，防止吊物坠落伤人",
          "吊装过程中，人员必须佩戴安全帽，并远离吊物下方",
          "指挥信号要清晰，吊物起升和移动速度要缓慢平稳",
          "搬运零件时，佩戴防护手套，防止被零件边缘割伤"
        ]
      },
      {
        "step_number": 2,
        "action": "安装左右悬挂板",
        "description": "将图纸上标注为1号的右悬挂臂板（BOM序号1）和2号的左悬挂臂板（BOM序号2）分别安装到3号方管的两端。根据图纸尺寸（2068mm总长）进行定位，确保悬挂板与方管端面齐平，且垂直度符合要求。点焊固定。",
        "position_description": "3号方管的两端",
        "parts_used": [
          {
            "bom_seq": "1",
            "bom_name": "右悬挂臂板",
            "quantity": 1,
            "drawing_number": "1",
            "node_name": [
              "NAUO2",
              "NAUO1"
            ],
            "bom_code": "01.01.03.0692"
          },
          {
            "bom_seq": "2",
            "bom_name": "左悬挂臂板",
            "quantity": 1,
            "drawing_number": "2",
            "node_name": [
              "NAUO4",
              "NAUO3"
            ],
            "bom_code": "01.01.03.0693"
          }
        ],
        "tools": [
          "卷尺",
          "角尺",
          "焊机（CO2）"
        ],
        "warnings": [
          "悬挂板的安装方向不能反，注意孔位朝向。",
          "点焊前必须检查垂直度，确保90度。"
        ],
        "welding": {
          "required": true,
          "welding_type": "角焊（定位焊）",
          "welding_method": "CO2气保焊",
          "weld_size": "点焊长度10-15mm，焊脚高度3mm",
          "welding_position": "零件1/2（悬挂板）与零件3（方管）的连接处，主要为平焊和横焊位置",
          "quality_requirements": "点焊牢固，能承受后续装配应力，焊点位置避开最终满焊区域的起始点",
          "safety_notes": "佩戴焊接面罩、防护手套和防护服。确保工作区域通风良好，防止烟尘吸入。"
        },
        "safety_warnings": [
          "进行点焊作业时，必须佩戴焊接面罩、防护手套和防护服，防止弧光灼伤和烫伤",
          "检查焊机接地线是否完好，防止触电事故",
          "确保焊接区域周围没有易燃易爆物品，并配备灭火器",
          "操作前清理工件上的油污和锈蚀，防止焊接时产生有毒烟雾"
        ]
      },
      {
        "step_number": 3,
        "action": "安装旋转弧板",
        "description": "将图纸上标注为7号的旋转弧板（BOM序号7）安装到3号方管的中间位置。根据图纸尺寸（505mm、106mm）定位，确保旋转弧板的中心线与方管中心线对齐。点焊固定。",
        "position_description": "3号方管中部上方",
        "parts_used": [
          {
            "bom_seq": "7",
            "bom_name": "旋转弧板",
            "quantity": 2,
            "drawing_number": "7",
            "node_name": [
              "NAUO12"
            ],
            "bom_code": "01.01.01.1590"
          }
        ],
        "tools": [
          "卷尺",
          "划线工具",
          "焊机"
        ],
        "warnings": [
          "旋转弧板是成对安装的，注意两块板之间的间距和对齐度。",
          "定位精度要求高，确保中心线偏差小于0.5mm。"
        ],
        "welding": {
          "required": true,
          "welding_type": "角焊（定位焊）",
          "welding_method": "CO2气保焊",
          "weld_size": "点焊长度10mm，焊脚高度3mm",
          "welding_position": "零件7（旋转弧板）与零件3（方管）的连接处，平焊位置",
          "quality_requirements": "定位焊必须保证弧板的垂直度和中心线位置，焊点均匀分布，防止定位过程中产生变形。",
          "safety_notes": "检查焊机接地线是否完好，避免触电风险。清理焊接区域的油污和锈蚀，防止产生气孔。"
        },
        "safety_warnings": [
          "进行点焊作业时，必须佩戴焊接面罩、防护手套和防护服，防止弧光灼伤和烫伤",
          "确保焊机接地良好，防止漏电触电",
          "保持工作区域通风，避免吸入焊接烟尘",
          "使用夹具固定弧板，防止点焊时弧板移动或倾倒砸伤手脚"
        ]
      },
      {
        "step_number": 4,
        "action": "安装内部加强件",
        "description": "将图纸上标注为4号的角钢（BOM序号4）和5号的方管-机加（BOM序号5）安装到3号方管的内部。4号角钢用于加强，5号方管用于支撑。根据图纸尺寸定位，确保它们与3号方管内壁紧密贴合。点焊固定。",
        "position_description": "3号方管内部",
        "parts_used": [
          {
            "bom_seq": "4",
            "bom_name": "角钢",
            "quantity": 5,
            "drawing_number": "4",
            "node_name": [
              "NAUO8",
              "NAUO7"
            ],
            "bom_code": "01.02.01.3875"
          },
          {
            "bom_seq": "5",
            "bom_name": "方管-机加",
            "quantity": 2,
            "drawing_number": "5",
            "node_name": [
              "NAUO10"
            ],
            "bom_code": "01.02.02.0446"
          }
        ],
        "tools": [
          "卷尺",
          "卡尺",
          "焊机"
        ],
        "warnings": [
          "内部零件安装后不易校正，必须在点焊前确保位置准确。",
          "注意角钢和方管的安装方向，避免干涉。"
        ],
        "welding": {
          "required": true,
          "welding_type": "角焊（定位焊）",
          "welding_method": "CO2气保焊",
          "weld_size": "点焊长度8mm，焊脚高度3mm",
          "welding_position": "零件4/5（加强件）与零件3（方管）的内壁连接处，主要为平焊和横焊位置",
          "quality_requirements": "确保加强件与方管内壁贴合紧密，点焊位置应均匀，防止后续满焊时产生大的内应力。",
          "safety_notes": "由于在方管内部操作，必须确保良好的局部通风，防止有害气体聚集。注意焊枪角度，避免烧伤内部电缆或管线（如果存在）。"
        },
        "safety_warnings": [
          "在方管内部进行焊接，必须使用局部排风或佩戴送风式防毒面具，防止有害气体聚集中毒",
          "佩戴焊接面罩和防护手套，防止弧光灼伤和烫伤",
          "注意内部空间狭窄，操作焊枪时防止电缆缠绕或被焊枪烫伤",
          "搬运加强件时，佩戴防护手套，防止被零件边缘割伤或夹伤"
        ]
      },
      {
        "step_number": 5,
        "action": "安装轴套和固定套",
        "description": "将图纸上标注为8号的固定套（BOM序号8）和9号的轴套（BOM序号9）安装到7号旋转弧板的下方。固定套和轴套应穿过7号旋转弧板的孔位，并与弧板底部齐平。点焊固定。",
        "position_description": "7号旋转弧板下方孔位",
        "parts_used": [
          {
            "bom_seq": "8",
            "bom_name": "固定套",
            "quantity": 1,
            "drawing_number": "8",
            "node_name": [
              "NAUO15",
              "NAUO13"
            ],
            "bom_code": "01.01.01.1593"
          },
          {
            "bom_seq": "9",
            "bom_name": "轴套",
            "quantity": 1,
            "drawing_number": "9",
            "node_name": [
              "NAUO14"
            ],
            "bom_code": "01.01.01.1591"
          }
        ],
        "tools": [
          "卡尺",
          "焊机"
        ],
        "warnings": [
          "轴套和固定套的轴线必须与旋转弧板的中心线垂直，确保旋转顺畅。",
          "轴套和固定套的端面应与弧板底部齐平，避免突出或凹陷。"
        ],
        "welding": {
          "required": true,
          "welding_type": "环形角焊（定位焊）",
          "welding_method": "CO2气保焊或氩弧焊（如果材料要求高）",
          "weld_size": "点焊长度5mm，焊脚高度3mm",
          "welding_position": "零件8/9（套件）与零件7（弧板）的连接处，仰焊或横焊位置",
          "quality_requirements": "定位焊必须均匀分布在圆周上（至少3点），确保套件的垂直度。轴套内孔严禁有飞溅物。",
          "safety_notes": "轴套和固定套是精密配合件，定位焊时应使用小电流，避免热量集中导致变形。焊接后立即检查垂直度。"
        },
        "safety_warnings": [
          "进行仰焊或横焊时，注意防止焊渣和熔融金属飞溅烫伤身体，必须穿戴好防护服和安全鞋",
          "佩戴焊接面罩和防护手套，防止弧光灼伤和烫伤",
          "轴套内孔严禁有飞溅物，焊接时应采取遮挡措施，防止后续装配困难或损坏零件"
        ]
      },
      {
        "step_number": 6,
        "action": "安装加强板（BOM序号6、10、11）",
        "description": "安装图纸上未标注序号的加强板。将BOM序号6的方形板、BOM序号10的三角板和BOM序号11的方形板焊接到主框架的相应加强位置。根据图纸上的尺寸和结构，将这些板件焊接到3号方管和已安装的零件之间，用于结构加强。",
        "position_description": "主框架各连接处（需对照详细图纸定位）",
        "parts_used": [
          {
            "bom_seq": "6",
            "bom_name": "方形板-机加",
            "quantity": 2,
            "drawing_number": "6",
            "node_name": [
              "NAUO11"
            ],
            "bom_code": "01.01.01.1589"
          },
          {
            "bom_seq": "10",
            "bom_name": "三角板",
            "quantity": 2,
            "drawing_number": "未标注",
            "node_name": [
              "NAUO19",
              "NAUO18",
              "NAUO17",
              "NAUO16"
            ],
            "bom_code": "01.01.01.1626"
          },
          {
            "bom_seq": "11",
            "bom_name": "方形板",
            "quantity": 2,
            "drawing_number": "未标注",
            "node_name": [
              "NAUO23",
              "NAUO22",
              "NAUO21",
              "NAUO20"
            ],
            "bom_code": "01.01.01.3941"
          }
        ],
        "tools": [
          "焊机",
          "夹具"
        ],
        "warnings": [
          "这些加强板的位置和方向必须严格按照详细图纸定位，确保不干涉其他零件。",
          "点焊后检查板件是否贴合紧密，无间隙。"
        ],
        "welding": {
          "required": true,
          "welding_type": "角焊（定位焊）",
          "welding_method": "CO2气保焊",
          "weld_size": "点焊长度10mm，焊脚高度3mm",
          "welding_position": "加强板与主框架的连接处，涉及平焊、横焊和立焊位置",
          "quality_requirements": "加强板必须紧密贴合，定位焊应使用夹具固定，防止板件在焊接过程中移动。确保焊点位置不影响后续满焊的连续性。",
          "safety_notes": "在立焊位置进行点焊时，注意控制熔池，防止焊瘤和下坠。确保焊枪电缆没有缠绕或被压住。"
        },
        "safety_warnings": [
          "佩戴焊接面罩、防护手套和防护服，防止弧光灼伤和烫伤",
          "进行立焊时，注意防止焊瘤和熔渣飞溅，确保站位安全",
          "使用夹具固定加强板，防止板件在定位过程中掉落或夹伤手指",
          "检查焊枪电缆和气管，防止拖拽或被重物压坏导致漏电或漏气"
        ]
      },
      {
        "step_number": 7,
        "action": "安装防滑板",
        "description": "将BOM序号12和BOM序号13的防滑板焊接到主框架的指定位置。防滑板通常安装在人员可能站立或接触的表面，确保焊接牢固，焊缝连续。",
        "position_description": "主框架顶部或侧面（需对照详细图纸定位）",
        "parts_used": [
          {
            "bom_seq": "12",
            "bom_name": "防滑板",
            "quantity": 1,
            "drawing_number": "未标注",
            "node_name": [
              "NAUO25",
              "NAUO24"
            ],
            "bom_code": "01.01.01.0517"
          },
          {
            "bom_seq": "13",
            "bom_name": "防滑板",
            "quantity": 1,
            "drawing_number": "未标注",
            "node_name": [
              "NAUO25",
              "NAUO24"
            ],
            "bom_code": "01.01.01.0517"
          }
        ],
        "tools": [
          "焊机"
        ],
        "warnings": [
          "防滑板的焊接必须保证焊缝连续且平整，避免尖锐毛刺。",
          "确保防滑板的防滑纹理朝上。"
        ],
        "welding": {
          "required": true,
          "welding_type": "角焊",
          "welding_method": "CO2气保焊",
          "weld_size": "焊脚高度4mm，焊缝连续",
          "welding_position": "防滑板与主框架的连接边缘，主要为平焊位置",
          "quality_requirements": "焊缝必须连续，保证密封性，焊缝外观平整，不允许有未焊透、气孔等缺陷。焊后必须打磨平整，去除所有尖锐棱角。",
          "safety_notes": "防滑板板材较薄，焊接时注意控制电流，避免烧穿。焊接完成后，立即清理焊渣和飞溅物，防止烫伤。"
        },
        "safety_warnings": [
          "进行连续焊接时，注意控制热输入，防止板材变形或烧穿，佩戴防护眼镜和手套",
          "焊接完成后，立即清理焊渣和飞溅物，防止被高温焊渣烫伤",
          "防滑板边缘可能锋利，搬运和定位时必须佩戴防割手套"
        ]
      },
      {
        "step_number": 8,
        "action": "满焊与清理",
        "description": "对所有已点焊的零件进行满焊。根据技术要求，选择合适的焊接电流、电压和速度，确保焊缝饱满、无虚焊、无漏焊。焊接完成后，进行焊渣清理和打磨，去除飞溅物和尖锐棱角。",
        "position_description": "所有连接部位",
        "parts_used": [
          {
            "bom_seq": "1",
            "bom_name": "右悬挂臂板",
            "quantity": 0,
            "drawing_number": "1",
            "node_name": [
              "NAUO2",
              "NAUO1"
            ],
            "bom_code": "01.01.03.0692"
          },
          {
            "bom_seq": "2",
            "bom_name": "左悬挂臂板",
            "quantity": 0,
            "drawing_number": "2",
            "node_name": [
              "NAUO4",
              "NAUO3"
            ],
            "bom_code": "01.01.03.0693"
          },
          {
            "bom_seq": "7",
            "bom_name": "旋转弧板",
            "quantity": 0,
            "drawing_number": "7",
            "node_name": [
              "NAUO12"
            ],
            "bom_code": "01.01.01.1590"
          }
        ],
        "tools": [
          "焊机",
          "角磨机",
          "钢丝刷"
        ],
        "warnings": [
          "焊接过程中注意热变形，必要时采取反变形措施。",
          "打磨时注意保护眼睛和呼吸道，确保焊缝平整度符合要求。"
        ],
        "welding": {
          "required": true,
          "welding_type": "角焊/环形焊",
          "welding_method": "CO2气保焊",
          "weld_size": "根据图纸要求，主要焊缝焊脚高度6mm（T6），次要焊缝4mm（T4）",
          "welding_position": "所有连接部位，涉及平焊、横焊、立焊和仰焊",
          "quality_requirements": "焊缝必须连续、饱满，熔深足够，不允许有裂纹、未熔合、严重气孔和夹渣。关键受力部位（如悬挂板连接处）需进行外观检查和磁粉检测（MT）。",
          "safety_notes": "采用分段、跳焊或对称焊接顺序，控制整体热输入，减少结构变形。仰焊和立焊时，注意调整焊接参数，确保熔池稳定。打磨时必须佩戴护目镜和防尘口罩。"
        },
        "safety_warnings": [
          "满焊作业必须佩戴全套防护用品（焊接面罩、防护服、手套、安全鞋），防止大面积弧光灼伤和烫伤",
          "使用角磨机打磨时，必须佩戴防护眼镜和防尘口罩，防止金属飞屑和粉尘伤害眼睛和呼吸道",
          "打磨作业时，注意磨光片是否安装牢固，防止高速旋转的磨片飞出伤人",
          "清理焊渣时，使用专用工具，并佩戴防护眼镜，防止焊渣飞溅伤眼"
        ]
      }
    ]
  }
}