{
  "agent_name": "Agent6_FAQ",
  "model": "google/gemini-2.5-flash-preview-09-2025",
  "timestamp": "20251005_151304",
  "image_count": 0,
  "temperature": 0.2,
  "system_prompt": "# 角色定位\n\n你是**李师傅**，一位拥有20年安全管理经验的高级安全工程师。\n\n## 教育背景\n\n- **学历**：安全工程专业本科\n- **职业资格**：注册安全工程师、高级安全评价师\n- **专业培训**：\n  - 机械制造安全管理\n  - 职业健康与安全管理体系（ISO 45001）\n  - 事故调查与分析\n  - 应急预案编制与演练\n\n## 职业背景\n\n- **工作经历**：20年机械制造企业安全管理经验，参与过大型装备制造、钢结构加工等项目\n- **专业领域**：\n  - 机械加工安全（车、铣、刨、磨、钻等）\n  - 焊接作业安全（电焊、气焊、氩弧焊等）\n  - 起重吊装安全（行车、叉车、吊索具等）\n  - 高空作业安全（脚手架、安全带、防坠落等）\n  - 个人防护用品管理（安全帽、防护眼镜、手套、安全鞋等）\n\n## 知识结构（详细）\n\n### 1. 机械伤害风险\n- **夹伤/挤伤**：手指、手臂被运动部件夹住\n- **切割伤**：锋利边缘、毛刺、切削工具\n- **碰撞伤**：头部碰撞、身体碰撞\n- **坠落伤**：零件坠落、工具坠落、人员坠落\n\n### 2. 焊接作业风险\n- **电击伤**：焊机漏电、接地不良\n- **弧光伤**：电弧紫外线灼伤眼睛和皮肤\n- **烫伤**：高温熔池、焊渣飞溅\n- **火灾爆炸**：易燃物引燃、气瓶泄漏\n- **有毒气体**：焊接烟尘、一氧化碳中毒\n\n### 3. 起重吊装风险\n- **吊物坠落**：吊索具断裂、捆绑不牢\n- **吊物摆动**：碰撞人员、设备\n- **超载**：超过起重机额定载荷\n- **指挥失误**：信号不清、违章指挥\n\n### 4. 高空作业风险\n- **人员坠落**：未系安全带、脚手架不牢\n- **物体打击**：工具、零件从高处坠落\n- **脚手架坍塌**：搭设不规范、超载\n\n### 5. 个人防护用品\n- **头部防护**：安全帽（防止碰撞、坠物打击）\n- **眼部防护**：防护眼镜、焊接面罩（防止飞溅、弧光）\n- **手部防护**：防护手套（防止切割、烫伤、化学品）\n- **足部防护**：安全鞋（防砸、防刺穿、防滑）\n- **呼吸防护**：防尘口罩、防毒面具（防止粉尘、有毒气体）\n\n### 6. 应急处理\n- **机械伤害**：立即停机、呼救、止血、固定、送医\n- **电击伤**：切断电源、心肺复苏、送医\n- **烫伤**：冷水冲洗、覆盖无菌纱布、送医\n- **火灾**：使用灭火器、疏散人员、报警\n\n## 任务步骤（Chain of Thought）\n\n你的任务是**为每个装配步骤添加安全警告**（如果该步骤有安全风险）。请按照以下5个步骤思考：\n\n### 步骤1：识别风险步骤\n- 分析每个装配步骤的操作内容\n- 判断是否涉及高风险作业（焊接、吊装、高空、重物搬运等）\n- 识别潜在的伤害类型（机械伤害、电击、烫伤、坠落等）\n\n### 步骤2：分析风险源\n- 确定风险的来源（设备、工具、材料、环境、人员操作等）\n- 评估风险的严重程度（轻微、中等、严重、致命）\n- 考虑风险的发生概率\n\n### 步骤3：制定预防措施\n- 针对每个风险源，制定具体的预防措施\n- 强调个人防护用品的使用\n- 强调安全操作规程的遵守\n\n### 步骤4：添加安全警告\n- 为每个有风险的步骤添加safety_warnings字段\n- 每条警告要简洁明了，说明具体的风险和预防措施\n- 使用工人能看懂的语言\n\n### 步骤5：验证完整性\n- 检查所有高风险步骤是否都添加了安全警告\n- 检查安全警告是否具体、可操作\n- 检查是否遗漏了任何潜在风险\n\n## 核心原则\n\n1. **步骤级嵌入**：为每个有风险的步骤添加safety_warnings字段，而不是单独列出安全警告\n2. **工人友好**：使用通俗语言，避免专业术语\n3. **具体可操作**：说明具体的风险和预防措施，而不是泛泛而谈\n4. **不重复显示**：安全警告只在下方\"安全\"标签页中统一显示，不在当前步骤详情中重复显示\n\n## 输出格式\n\n严格按照以下JSON格式输出（返回增强后的装配步骤）：\n\n```json\n{\n  \"enhanced_steps\": [\n    {\n      \"step_number\": 1,\n      \"title\": \"点焊定位\",\n      \"parts_used\": [...],\n      \"tools_required\": [...],\n      \"operation\": \"操作说明\",\n      \"quality_check\": \"质量检查\",\n      \"estimated_time_minutes\": 10,\n      \"welding\": {\n        \"required\": true,\n        \"welding_type\": \"点焊\",\n        \"welding_method\": \"CO2气保焊\",\n        ...\n      },\n      \"safety_warnings\": [\n        \"佩戴焊接面罩和防护手套，防止弧光灼伤眼睛和皮肤\",\n        \"确保工件夹紧牢固，防止点焊时位移造成伤害\",\n        \"焊接区域周围3米内不得有易燃物，配备灭火器\",\n        \"焊机必须接地良好，防止漏电触电\"\n      ]\n    },\n    {\n      \"step_number\": 2,\n      \"title\": \"螺栓连接\",\n      \"parts_used\": [...],\n      \"operation\": \"操作说明\",\n      \"quality_check\": \"质量检查\",\n      \"estimated_time_minutes\": 15,\n      \"safety_warnings\": [\n        \"佩戴安全帽和防护眼镜，防止零件坠落和飞溅\",\n        \"使用扭力扳手时注意力度，防止扳手滑脱伤人\"\n      ]\n    },\n    {\n      \"step_number\": 3,\n      \"title\": \"简单装配\",\n      \"parts_used\": [...],\n      \"operation\": \"操作说明\",\n      \"quality_check\": \"质量检查\",\n      \"estimated_time_minutes\": 5\n      // ⚠️ 如果没有明显安全风险，不添加safety_warnings字段\n    }\n  ]\n}\n```\n\n**⚠️ 关键要求**：\n\n1. **步骤级嵌入**：\n   - 为每个有风险的步骤添加`safety_warnings`字段\n   - 没有明显风险的步骤不添加`safety_warnings`字段\n   - 保持原有步骤的所有字段不变\n\n2. **安全警告要具体**：\n   - ✅ 说\"佩戴焊接面罩和防护手套，防止弧光灼伤眼睛和皮肤\"\n   - ❌ 不说\"注意安全\"\n   - ✅ 说\"焊接区域周围3米内不得有易燃物，配备灭火器\"\n   - ❌ 不说\"注意防火\"\n\n3. **使用通俗语言**：\n   - 工人能看懂的语言\n   - 避免专业术语和英文缩写\n\n4. **警告要全面**：\n   - 涵盖个人防护、设备安全、环境安全、操作安全\n   - 每条警告说明具体的风险和预防措施\n\n## 重要提醒\n\n- **只输出JSON，不要输出其他内容**\n- **保持原有字段不变**：不要修改或删除原有的字段（包括welding字段）\n- **警告要简洁明了**：每条警告一句话，说明风险和预防措施\n- **不要过度警告**：只针对有明显风险的步骤添加警告\n",
  "user_query": "请为以下装配步骤添加安全警告（如果有安全风险）。\n\n## 📸 视觉分析任务\n\n**你会看到工程图纸图片，请仔细观察：**\n\n1. **危险作业标识**：\n   - 图纸上的安全警告标识\n   - 特殊作业要求（如高空作业、吊装作业等）\n   - 危险区域标注\n\n2. **零件特征**：\n   - 重型零件（需要吊装）\n   - 锋利边缘（容易割伤）\n   - 高温部件（容易烫伤）\n\n3. **作业环境**：\n   - 狭窄空间（容易碰撞）\n   - 高空位置（容易坠落）\n   - 密闭空间（通风不良）\n\n## 装配步骤\n\n[\n  {\n    \"step_number\": 1,\n    \"action\": \"放置基准件\",\n    \"description\": \"将图纸上标注为1的左铲板（01.01.01.18598）平稳放置在焊接工作台上，作为装配基准。\",\n    \"position_description\": \"左铲板的内侧（有加强筋的一侧）朝上。\",\n    \"parts_used\": [\n      {\n        \"bom_seq\": \"1\",\n        \"bom_name\": \"左铲板 1\",\n        \"quantity\": 1,\n        \"drawing_number\": \"1\",\n        \"node_name\": [\n          \"NAUO1\"\n        ],\n        \"bom_code\": \"01.01.01.18598\"\n      }\n    ],\n    \"tools\": [\n      \"行车\",\n      \"吊具\",\n      \"焊接工作台\"\n    ],\n    \"warnings\": [\n      \"注意吊装安全，防止左铲板变形。\"\n    ]\n  },\n  {\n    \"step_number\": 2,\n    \"action\": \"安装并点焊加强板\",\n    \"description\": \"将图纸上标注为3的后加强板（01.01.01.11519）和图纸上标注为4的前加强板（01.01.01.18600）放置在左铲板（1）的内侧，按照图纸尺寸定位。先进行点焊固定。\",\n    \"position_description\": \"后加强板（3）位于左铲板的后部，前加强板（4）位于左铲板的前部，均贴合在铲板内侧。\",\n    \"parts_used\": [\n      {\n        \"bom_seq\": \"3\",\n        \"bom_name\": \"后加强板 1\",\n        \"quantity\": 1,\n        \"drawing_number\": \"3\",\n        \"node_name\": [\n          \"NAUO3\"\n        ],\n        \"bom_code\": \"01.01.01.11519\"\n      },\n      {\n        \"bom_seq\": \"4\",\n        \"bom_name\": \"前加强板 1\",\n        \"quantity\": 1,\n        \"drawing_number\": \"4\",\n        \"node_name\": [\n          \"NAUO4\"\n        ],\n        \"bom_code\": \"01.01.01.18600\"\n      }\n    ],\n    \"tools\": [\n      \"卷尺\",\n      \"角尺\",\n      \"焊机\"\n    ],\n    \"warnings\": [\n      \"点焊时注意定位尺寸，确保加强板与铲板贴合紧密。\"\n    ],\n    \"welding\": {\n      \"required\": true,\n      \"welding_type\": \"角焊（点焊）\",\n      \"welding_method\": \"CO2气保焊\",\n      \"weld_size\": \"点焊长度10-15mm，焊脚高度约4mm\",\n      \"welding_position\": \"零件3、4与零件1（左铲板）的贴合面，平焊\",\n      \"quality_requirements\": \"点焊牢固，能承受后续装配应力，无明显气孔\",\n      \"safety_notes\": \"佩戴焊接面罩和防护手套，确保工作区域通风良好，点焊后及时清理飞溅物\"\n    }\n  },\n  {\n    \"step_number\": 3,\n    \"action\": \"安装并点焊方形板和机加板\",\n    \"description\": \"将图纸上标注为2的方形板-机加（01.01.01.18599）和图纸上标注为13的方形板 1（01.01.01.11528）放置在左铲板（1）的内侧，按照图纸尺寸定位。将图纸上标注为14的方形板 3（01.01.01.11529）放置在左铲板的另一侧，进行点焊固定。\",\n    \"position_description\": \"方形板-机加（2）和方形板 1（13）位于左铲板的顶部边缘，方形板 3（14）位于左铲板的侧面。\",\n    \"parts_used\": [\n      {\n        \"bom_seq\": \"2\",\n        \"bom_name\": \"方形板-机加 1\",\n        \"quantity\": 1,\n        \"drawing_number\": \"2\",\n        \"node_name\": [\n          \"NAUO2\"\n        ],\n        \"bom_code\": \"01.01.01.18599\"\n      },\n      {\n        \"bom_seq\": \"13\",\n        \"bom_name\": \"方形板 1\",\n        \"quantity\": 1,\n        \"drawing_number\": \"13\"\n      },\n      {\n        \"bom_seq\": \"14\",\n        \"bom_name\": \"方形板 3\",\n        \"quantity\": 1,\n        \"drawing_number\": \"14\",\n        \"node_name\": [\n          \"NAUO24\",\n          \"NAUO23\",\n          \"NAUO22\"\n        ],\n        \"bom_code\": \"01.01.01.11529\"\n      }\n    ],\n    \"tools\": [\n      \"卷尺\",\n      \"卡尺\",\n      \"焊机\"\n    ],\n    \"warnings\": [\n      \"方形板-机加（2）的机加面应朝外，确保后续装配精度。\"\n    ],\n    \"welding\": {\n      \"required\": true,\n      \"welding_type\": \"角焊（点焊）\",\n      \"welding_method\": \"CO2气保焊\",\n      \"weld_size\": \"点焊长度10-15mm，焊脚高度约4mm\",\n      \"welding_position\": \"零件2、13、14与零件1（左铲板）的连接处，主要为平焊和横焊\",\n      \"quality_requirements\": \"点焊位置均匀分布，保证零件定位准确，特别是机加板（2）的定位精度\",\n      \"safety_notes\": \"注意焊机接地良好，避免电击。点焊时保持姿势稳定，防止焊枪滑脱。\"\n    }\n  },\n  {\n    \"step_number\": 4,\n    \"action\": \"安装并点焊底部连接板和前油缸固定板\",\n    \"description\": \"将图纸上标注为5的底部连接板 6（01.01.01.11521）和图纸上标注为6的前油缸固定板 2（01.01.01.11522）放置在左铲板（1）的底部和后侧，按照图纸尺寸定位。进行点焊固定。\",\n    \"position_description\": \"底部连接板（5）位于左铲板的底部，前油缸固定板（6）位于左铲板的后部，靠近底部。\",\n    \"parts_used\": [\n      {\n        \"bom_seq\": \"5\",\n        \"bom_name\": \"底部连接板 6\",\n        \"quantity\": 1,\n        \"drawing_number\": \"5\",\n        \"node_name\": [\n          \"NAUO15\",\n          \"NAUO14\",\n          \"NAUO13\",\n          \"NAUO12\",\n          \"NAUO6\",\n          \"NAUO5\"\n        ],\n        \"bom_code\": \"01.01.01.11521\"\n      },\n      {\n        \"bom_seq\": \"6\",\n        \"bom_name\": \"前油缸固定板 2\",\n        \"quantity\": 1,\n        \"drawing_number\": \"6\",\n        \"node_name\": [\n          \"NAUO8\",\n          \"NAUO7\"\n        ],\n        \"bom_code\": \"01.01.01.11522\"\n      }\n    ],\n    \"tools\": [\n      \"卷尺\",\n      \"焊机\"\n    ],\n    \"warnings\": [\n      \"底部连接板（5）的安装位置是后续连接的关键，必须保证尺寸准确。\"\n    ],\n    \"welding\": {\n      \"required\": true,\n      \"welding_type\": \"角焊（点焊）\",\n      \"welding_method\": \"CO2气保焊\",\n      \"weld_size\": \"点焊长度10-15mm，焊脚高度约4mm\",\n      \"welding_position\": \"零件5、6与零件1（左铲板）的连接处，可能涉及仰焊（如果铲板平放）或平焊（如果翻转）\",\n      \"quality_requirements\": \"点焊位置应避开后续满焊区域的起始点，确保定位准确\",\n      \"safety_notes\": \"如果涉及仰焊，注意防止熔渣和飞溅物烫伤，穿戴好防护服和面罩。\"\n    }\n  },\n  {\n    \"step_number\": 5,\n    \"action\": \"安装并点焊弹簧固定板\",\n    \"description\": \"将图纸上标注为7的前弹簧固定板 1（01.01.01.11523）和图纸上标注为8的后弹簧固定板 2（01.01.01.11524）放置在左铲板（1）的内侧，按照图纸尺寸定位。进行点焊固定。\",\n    \"position_description\": \"前弹簧固定板（7）和后弹簧固定板（8）位于左铲板内侧的加强板区域。\",\n    \"parts_used\": [\n      {\n        \"bom_seq\": \"7\",\n        \"bom_name\": \"前弹簧固定板 1\",\n        \"quantity\": 1,\n        \"drawing_number\": \"7\",\n        \"node_name\": [\n          \"NAUO9\"\n        ],\n        \"bom_code\": \"01.01.01.11523\"\n      },\n      {\n        \"bom_seq\": \"8\",\n        \"bom_name\": \"后弹簧固定板 2\",\n        \"quantity\": 1,\n        \"drawing_number\": \"8\",\n        \"node_name\": [\n          \"NAUO11\",\n          \"NAUO10\"\n        ],\n        \"bom_code\": \"01.01.01.11524\"\n      }\n    ],\n    \"tools\": [\n      \"卷尺\",\n      \"焊机\"\n    ],\n    \"warnings\": [\n      \"弹簧固定板的孔位必须与图纸要求对齐，确保后续弹簧安装顺畅。\"\n    ],\n    \"welding\": {\n      \"required\": true,\n      \"welding_type\": \"角焊（点焊）\",\n      \"welding_method\": \"CO2气保焊\",\n      \"weld_size\": \"点焊长度10-15mm，焊脚高度约4mm\",\n      \"welding_position\": \"零件7、8与零件1（左铲板）的连接处，平焊\",\n      \"quality_requirements\": \"点焊时需使用夹具固定，确保固定板的垂直度和平行度满足要求\",\n      \"safety_notes\": \"点焊前检查焊机电缆和连接是否完好，避免虚接导致发热。\"\n    }\n  },\n  {\n    \"step_number\": 6,\n    \"action\": \"安装并点焊支撑固定板\",\n    \"description\": \"将图纸上标注为9的支撑固定板 1（01.01.01.11525）放置在左铲板（1）的内侧，按照图纸尺寸定位。进行点焊固定。\",\n    \"position_description\": \"支撑固定板（9）位于左铲板内侧的中央区域。\",\n    \"parts_used\": [\n      {\n        \"bom_seq\": \"9\",\n        \"bom_name\": \"支撑固定板 1\",\n        \"quantity\": 1,\n        \"drawing_number\": \"9\",\n        \"node_name\": [\n          \"NAUO16\"\n        ],\n        \"bom_code\": \"01.01.01.11525\"\n      }\n    ],\n    \"tools\": [\n      \"卷尺\",\n      \"焊机\"\n    ],\n    \"warnings\": [\n      \"支撑固定板的平面度要求较高，点焊时注意控制变形。\"\n    ],\n    \"welding\": {\n      \"required\": true,\n      \"welding_type\": \"角焊（点焊）\",\n      \"welding_method\": \"CO2气保焊\",\n      \"weld_size\": \"点焊长度10-15mm，焊脚高度约4mm\",\n      \"welding_position\": \"零件9与零件1（左铲板）的连接处，平焊\",\n      \"quality_requirements\": \"点焊时应采用对称点焊，分散热量，防止支撑板翘曲变形\",\n      \"safety_notes\": \"点焊区域周围应保持清洁，无油污、水渍，防止产生气孔。\"\n    }\n  },\n  {\n    \"step_number\": 7,\n    \"action\": \"安装并点焊轴套加强板和轴套\",\n    \"description\": \"将图纸上标注为10的轴套加强板 2（01.01.01.11526）和图纸上标注为12的轴套 2（01.01.02.1222）放置在左铲板（1）的侧面，按照图纸尺寸定位。轴套（12）应穿过轴套加强板（10）的孔位，并与左铲板贴合。进行点焊固定。\",\n    \"position_description\": \"轴套加强板（10）和轴套（12）位于左铲板的侧面，靠近顶部。\",\n    \"parts_used\": [\n      {\n        \"bom_seq\": \"10\",\n        \"bom_name\": \"轴套加强板 2\",\n        \"quantity\": 1,\n        \"drawing_number\": \"10\",\n        \"node_name\": [\n          \"NAUO18\",\n          \"NAUO17\"\n        ],\n        \"bom_code\": \"01.01.01.11526\"\n      },\n      {\n        \"bom_seq\": \"12\",\n        \"bom_name\": \"轴套 2\",\n        \"quantity\": 1,\n        \"drawing_number\": \"12\",\n        \"node_name\": [\n          \"NAUO21\",\n          \"NAUO20\"\n        ],\n        \"bom_code\": \"01.01.02.1222\"\n      }\n    ],\n    \"tools\": [\n      \"卡尺\",\n      \"焊机\"\n    ],\n    \"warnings\": [\n      \"轴套与左铲板配合处要求保证同轴度，点焊时需使用工装夹具辅助定位。\"\n    ],\n    \"welding\": {\n      \"required\": true,\n      \"welding_type\": \"角焊（点焊）和环焊（轴套与板）\",\n      \"welding_method\": \"CO2气保焊\",\n      \"weld_size\": \"点焊长度10-15mm，轴套与板的环焊点焊4处\",\n      \"welding_position\": \"零件10与零件1（左铲板）的连接处，以及零件12（轴套）与零件10的连接处，横焊或平焊\",\n      \"quality_requirements\": \"轴套（12）点焊时必须保证其中心线垂直于左铲板表面，使用专用工装校准\",\n      \"safety_notes\": \"轴套点焊后，立即检查同轴度，防止因热变形导致偏差。\"\n    }\n  },\n  {\n    \"step_number\": 8,\n    \"action\": \"安装并点焊反光片安装板\",\n    \"description\": \"将图纸上标注为11的反光片安装板 1（01.01.01.11527）放置在左铲板（1）的侧面，按照图纸尺寸定位。进行点焊固定。\",\n    \"position_description\": \"反光片安装板（11）位于左铲板的侧面，靠近底部。\",\n    \"parts_used\": [\n      {\n        \"bom_seq\": \"11\",\n        \"bom_name\": \"反光片安装板 1\",\n        \"quantity\": 1,\n        \"drawing_number\": \"11\",\n        \"node_name\": [\n          \"NAUO19\"\n        ],\n        \"bom_code\": \"01.01.01.11527\"\n      }\n    ],\n    \"tools\": [\n      \"卷尺\",\n      \"焊机\"\n    ],\n    \"warnings\": [\n      \"反光片安装板的安装位置应确保后续反光片安装的可见性。\"\n    ],\n    \"welding\": {\n      \"required\": true,\n      \"welding_type\": \"角焊（点焊）\",\n      \"welding_method\": \"CO2气保焊\",\n      \"weld_size\": \"点焊长度10-15mm，焊脚高度约4mm\",\n      \"welding_position\": \"零件11与零件1（左铲板）的连接处，横焊\",\n      \"quality_requirements\": \"点焊牢固，安装板表面平整，无明显变形\",\n      \"safety_notes\": \"注意焊枪角度，确保点焊熔深足够，避免虚焊。\"\n    }\n  },\n  {\n    \"step_number\": 9,\n    \"action\": \"安装并点焊左铲雪板加强板\",\n    \"description\": \"将图纸上标注为15的左铲雪板加强板 2（01.02.01.4983）放置在左铲板（1）的内侧，按照图纸尺寸定位。进行点焊固定。\",\n    \"position_description\": \"左铲雪板加强板（15）位于左铲板内侧的顶部边缘。\",\n    \"parts_used\": [\n      {\n        \"bom_seq\": \"15\",\n        \"bom_name\": \"左铲雪板加强板 2\",\n        \"quantity\": 1,\n        \"drawing_number\": \"15\",\n        \"node_name\": [\n          \"NAUO26\",\n          \"NAUO25\"\n        ],\n        \"bom_code\": \"01.02.01.4983\"\n      }\n    ],\n    \"tools\": [\n      \"卷尺\",\n      \"焊机\"\n    ],\n    \"warnings\": [\n      \"加强板（15）的定位尺寸必须准确，确保与铲板边缘对齐。\"\n    ],\n    \"welding\": {\n      \"required\": true,\n      \"welding_type\": \"角焊（点焊）\",\n      \"welding_method\": \"CO2气保焊\",\n      \"weld_size\": \"点焊长度10-15mm，焊脚高度约4mm\",\n      \"welding_position\": \"零件15与零件1（左铲板）的连接处，平焊\",\n      \"quality_requirements\": \"加强板与铲板贴合紧密，点焊后检查间隙，确保后续满焊质量\",\n      \"safety_notes\": \"点焊前清理加强板边缘的氧化皮和油污，防止焊接过程中产生大量烟尘。\"\n    }\n  },\n  {\n    \"step_number\": 10,\n    \"action\": \"满焊所有零件\",\n    \"description\": \"检查所有零件的点焊位置和尺寸无误后，按照图纸要求对所有已点焊的零件进行满焊。注意焊接顺序，避免因热应力造成铲板变形。\",\n    \"position_description\": \"所有零件与左铲板（1）的连接处。\",\n    \"parts_used\": [],\n    \"tools\": [\n      \"焊机\",\n      \"焊接夹具\"\n    ],\n    \"warnings\": [\n      \"焊接时注意焊缝质量，不允许有气孔、夹渣、裂纹等缺陷。焊接完成后进行清渣处理。\"\n    ],\n    \"welding\": {\n      \"required\": true,\n      \"welding_type\": \"角焊和环焊（轴套）\",\n      \"welding_method\": \"CO2气保焊（MAG）\",\n      \"weld_size\": \"焊脚高度通常为6mm（具体尺寸参照图纸），焊缝连续\",\n      \"welding_position\": \"所有零件与左铲板的连接焊缝，涉及平焊、横焊、立焊\",\n      \"quality_requirements\": \"焊缝外观成型良好，焊缝高度和宽度符合图纸要求。焊后进行外观检查，关键受力部位（如油缸固定板、底部连接板）需进行磁粉检测（MT）或超声波检测（UT）\",\n      \"safety_notes\": \"采用分段、对称、跳焊的焊接顺序，严格控制焊接线能量，防止铲板整体变形。焊接过程中保持通风，防止有害气体聚集。焊后对焊渣和飞溅物进行彻底清理。\"\n    }\n  }\n]\n\n## 要求\n\n请按照以下5个步骤思考，为装配步骤添加安全警告：\n\n### 步骤1：识别风险步骤\n- 分析每个装配步骤的操作内容\n- 判断是否涉及高风险作业：\n  * **焊接作业**：电击、弧光、烫伤、火灾\n  * **吊装作业**：吊物坠落、碰撞、超载\n  * **高空作业**：人员坠落、物体打击\n  * **重物搬运**：砸伤、扭伤、夹伤\n  * **机械加工**：切割伤、夹伤、碰撞\n\n### 步骤2：分析风险源\n- 确定风险的来源（设备、工具、材料、环境、人员操作等）\n- 评估风险的严重程度（轻微、中等、严重、致命）\n- 考虑风险的发生概率\n\n### 步骤3：制定预防措施\n- 针对每个风险源，制定具体的预防措施\n- 强调个人防护用品的使用：\n  * **焊接**：焊接面罩、防护手套、防护服\n  * **吊装**：安全帽、安全鞋、手套\n  * **高空**：安全带、安全帽、防滑鞋\n  * **机械**：防护眼镜、手套、安全鞋\n\n### 步骤4：添加安全警告\n- 为每个有风险的步骤添加safety_warnings字段\n- 每条警告要简洁明了，说明具体的风险和预防措施\n- 使用工人能看懂的语言\n\n### 步骤5：验证完整性\n- 检查所有高风险步骤是否都添加了安全警告\n- 检查安全警告是否具体、可操作\n- 检查是否遗漏了任何潜在风险\n\n## ⚠️ 强制自检清单（生成后必须逐项检查）\n\n**在输出JSON之前，你必须完成以下验证：**\n\n1. **风险步骤识别验证**：\n   - [ ] 所有涉及焊接、吊装、高空、重物搬运的步骤都添加了safety_warnings字段\n   - [ ] 没有明显风险的步骤没有添加safety_warnings字段\n\n2. **安全警告完整性验证**：\n   - [ ] 每个safety_warnings字段都是字符串数组\n   - [ ] 每条警告都说明了具体的风险和预防措施\n   - [ ] 涵盖了个人防护、设备安全、环境安全、操作安全\n\n3. **语言通俗性验证**：\n   - [ ] 使用工人能看懂的语言\n   - [ ] 避免专业术语和英文缩写\n   - [ ] 每条警告简洁明了（一句话）\n\n4. **原有字段保持验证**：\n   - [ ] 原有步骤的所有字段都保持不变（包括welding字段）\n   - [ ] 没有修改或删除任何原有字段\n\n**如果自检发现任何问题，必须重新生成！**\n\n现在开始为装配步骤添加安全警告！\n",
  "raw_response": "```json\n{\n  \"enhanced_steps\": [\n    {\n      \"step_number\": 1,\n      \"action\": \"放置基准件\",\n      \"description\": \"将图纸上标注为1的左铲板（01.01.01.18598）平稳放置在焊接工作台上，作为装配基准。\",\n      \"position_description\": \"左铲板的内侧（有加强筋的一侧）朝上。\",\n      \"parts_used\": [\n        {\n          \"bom_seq\": \"1\",\n          \"bom_name\": \"左铲板 1\",\n          \"quantity\": 1,\n          \"drawing_number\": \"1\",\n          \"node_name\": [\n            \"NAUO1\"\n          ],\n          \"bom_code\": \"01.01.01.18598\"\n        }\n      ],\n      \"tools\": [\n        \"行车\",\n        \"吊具\",\n        \"焊接工作台\"\n      ],\n      \"warnings\": [\n        \"注意吊装安全，防止左铲板变形。\"\n      ],\n      \"safety_warnings\": [\n        \"吊装前检查行车和吊具是否完好，确保吊索具捆绑牢固，防止重物坠落伤人。\",\n        \"吊装过程中，人员必须佩戴安全帽，并远离吊物下方，防止物体打击。\",\n        \"铲板边缘可能锋利，搬运和放置时请佩戴防割手套，防止割伤。\"\n      ]\n    },\n    {\n      \"step_number\": 2,\n      \"action\": \"安装并点焊加强板\",\n      \"description\": \"将图纸上标注为3的后加强板（01.01.01.11519）和图纸上标注为4的前加强板（01.01.01.18600）放置在左铲板（1）的内侧，按照图纸尺寸定位。先进行点焊固定。\",\n      \"position_description\": \"后加强板（3）位于左铲板的后部，前加强板（4）位于左铲板的前部，均贴合在铲板内侧。\",\n      \"parts_used\": [\n        {\n          \"bom_seq\": \"3\",\n          \"bom_name\": \"后加强板 1\",\n          \"quantity\": 1,\n          \"drawing_number\": \"3\",\n          \"node_name\": [\n            \"NAUO3\"\n          ],\n          \"bom_code\": \"01.01.01.11519\"\n        },\n        {\n          \"bom_seq\": \"4\",\n          \"bom_name\": \"前加强板 1\",\n          \"quantity\": 1,\n          \"drawing_number\": \"4\",\n          \"node_name\": [\n            \"NAUO4\"\n          ],\n          \"bom_code\": \"01.01.01.18600\"\n        }\n      ],\n      \"tools\": [\n        \"卷尺\",\n        \"角尺\",\n        \"焊机\"\n      ],\n      \"warnings\": [\n        \"点焊时注意定位尺寸，确保加强板与铲板贴合紧密。\"\n      ],\n      \"welding\": {\n        \"required\": true,\n        \"welding_type\": \"角焊（点焊）\",\n        \"welding_method\": \"CO2气保焊\",\n        \"weld_size\": \"点焊长度10-15mm，焊脚高度约4mm\",\n        \"welding_position\": \"零件3、4与零件1（左铲板）的贴合面，平焊\",\n        \"quality_requirements\": \"点焊牢固，能承受后续装配应力，无明显气孔\",\n        \"safety_notes\": \"佩戴焊接面罩和防护手套，确保工作区域通风良好，点焊后及时清理飞溅物\"\n      },\n      \"safety_warnings\": [\n        \"进行点焊作业时，必须佩戴焊接面罩、防护手套和防护服，防止弧光灼伤和焊渣烫伤。\",\n        \"确保焊机接地良好，电缆绝缘完好，防止发生触电事故。\",\n        \"点焊区域周围3米内应清理干净，不得有易燃易爆物品，防止火灾。\"\n      ]\n    },\n    {\n      \"step_number\": 3,\n      \"action\": \"安装并点焊方形板和机加板\",\n      \"description\": \"将图纸上标注为2的方形板-机加（01.01.01.18599）和图纸上标注为13的方形板 1（01.01.01.11528）放置在左铲板（1）的内侧，按照图纸尺寸定位。将图纸上标注为14的方形板 3（01.01.01.11529）放置在左铲板的另一侧，进行点焊固定。\",\n      \"position_description\": \"方形板-机加（2）和方形板 1（13）位于左铲板的顶部边缘，方形板 3（14）位于左铲板的侧面。\",\n      \"parts_used\": [\n        {\n          \"bom_seq\": \"2\",\n          \"bom_name\": \"方形板-机加 1\",\n          \"quantity\": 1,\n          \"drawing_number\": \"2\",\n          \"node_name\": [\n            \"NAUO2\"\n          ],\n          \"bom_code\": \"01.01.01.18599\"\n        },\n        {\n          \"bom_seq\": \"13\",\n          \"bom_name\": \"方形板 1\",\n          \"quantity\": 1,\n          \"drawing_number\": \"13\"\n        },\n        {\n          \"bom_seq\": \"14\",\n          \"bom_name\": \"方形板 3\",\n          \"quantity\": 1,\n          \"drawing_number\": \"14\",\n          \"node_name\": [\n            \"NAUO24\",\n            \"NAUO23\",\n            \"NAUO22\"\n          ],\n          \"bom_code\": \"01.01.01.11529\"\n        }\n      ],\n      \"tools\": [\n        \"卷尺\",\n        \"卡尺\",\n        \"焊机\"\n      ],\n      \"warnings\": [\n        \"方形板-机加（2）的机加面应朝外，确保后续装配精度。\"\n      ],\n      \"welding\": {\n        \"required\": true,\n        \"welding_type\": \"角焊（点焊）\",\n        \"welding_method\": \"CO2气保焊\",\n        \"weld_size\": \"点焊长度10-15mm，焊脚高度约4mm\",\n        \"welding_position\": \"零件2、13、14与零件1（左铲板）的连接处，主要为平焊和横焊\",\n        \"quality_requirements\": \"点焊位置均匀分布，保证零件定位准确，特别是机加板（2）的定位精度\",\n        \"safety_notes\": \"注意焊机接地良好，避免电击。点焊时保持姿势稳定，防止焊枪滑脱。\"\n      },\n      \"safety_warnings\": [\n        \"点焊时必须佩戴焊接面罩和防护手套，防止弧光和高温飞溅物伤害。\",\n        \"操作焊机前，检查焊枪、电缆和气路连接是否可靠，防止漏电或漏气。\",\n        \"搬运零件时，注意零件边缘可能锋利，佩戴防割手套，防止割伤。\"\n      ]\n    },\n    {\n      \"step_number\": 4,\n      \"action\": \"安装并点焊底部连接板和前油缸固定板\",\n      \"description\": \"将图纸上标注为5的底部连接板 6（01.01.01.11521）和图纸上标注为6的前油缸固定板 2（01.01.01.11522）放置在左铲板（1）的底部和后侧，按照图纸尺寸定位。进行点焊固定。\",\n      \"position_description\": \"底部连接板（5）位于左铲板的底部，前油缸固定板（6）位于左铲板的后部，靠近底部。\",\n      \"parts_used\": [\n        {\n          \"bom_seq\": \"5\",\n          \"bom_name\": \"底部连接板 6\",\n          \"quantity\": 1,\n          \"drawing_number\": \"5\",\n          \"node_name\": [\n            \"NAUO15\",\n            \"NAUO14\",\n            \"NAUO13\",\n            \"NAUO12\",\n            \"NAUO6\",\n            \"NAUO5\"\n          ],\n          \"bom_code\": \"01.01.01.11521\"\n        },\n        {\n          \"bom_seq\": \"6\",\n          \"bom_name\": \"前油缸固定板 2\",\n          \"quantity\": 1,\n          \"drawing_number\": \"6\",\n          \"node_name\": [\n            \"NAUO8\",\n            \"NAUO7\"\n          ],\n          \"bom_code\": \"01.01.01.11522\"\n        }\n      ],\n      \"tools\": [\n        \"卷尺\",\n        \"焊机\"\n      ],\n      \"warnings\": [\n        \"底部连接板（5）的安装位置是后续连接的关键，必须保证尺寸准确。\"\n      ],\n      \"welding\": {\n        \"required\": true,\n        \"welding_type\": \"角焊（点焊）\",\n        \"welding_method\": \"CO2气保焊\",\n        \"weld_size\": \"点焊长度10-15mm，焊脚高度约4mm\",\n        \"welding_position\": \"零件5、6与零件1（左铲板）的连接处，可能涉及仰焊（如果铲板平放）或平焊（如果翻转）\",\n        \"quality_requirements\": \"点焊位置应避开后续满焊区域的起始点，确保定位准确\",\n        \"safety_notes\": \"如果涉及仰焊，注意防止熔渣和飞溅物烫伤，穿戴好防护服和面罩。\"\n      },\n      \"safety_warnings\": [\n        \"如果需要仰焊，必须穿戴防火防护服和头罩，防止焊渣和熔融金属飞溅烫伤身体。\",\n        \"确保工作区域通风良好，特别是仰焊时产生的烟尘和有害气体。\",\n        \"点焊前检查工件是否稳定，防止在焊接过程中零件移动或掉落。\"\n      ]\n    },\n    {\n      \"step_number\": 5,\n      \"action\": \"安装并点焊弹簧固定板\",\n      \"description\": \"将图纸上标注为7的前弹簧固定板 1（01.01.01.11523）和图纸上标注为8的后弹簧固定板 2（01.01.01.11524）放置在左铲板（1）的内侧，按照图纸尺寸定位。进行点焊固定。\",\n      \"position_description\": \"前弹簧固定板（7）和后弹簧固定板（8）位于左铲板内侧的加强板区域。\",\n      \"parts_used\": [\n        {\n          \"bom_seq\": \"7\",\n          \"bom_name\": \"前弹簧固定板 1\",\n          \"quantity\": 1,\n          \"drawing_number\": \"7\",\n          \"node_name\": [\n            \"NAUO9\"\n          ],\n          \"bom_code\": \"01.01.01.11523\"\n        },\n        {\n          \"bom_seq\": \"8\",\n          \"bom_name\": \"后弹簧固定板 2\",\n          \"quantity\": 1,\n          \"drawing_number\": \"8\",\n          \"node_name\": [\n            \"NAUO11\",\n            \"NAUO10\"\n          ],\n          \"bom_code\": \"01.01.01.11524\"\n        }\n      ],\n      \"tools\": [\n        \"卷尺\",\n        \"焊机\"\n      ],\n      \"warnings\": [\n        \"弹簧固定板的孔位必须与图纸要求对齐，确保后续弹簧安装顺畅。\"\n      ],\n      \"welding\": {\n        \"required\": true,\n        \"welding_type\": \"角焊（点焊）\",\n        \"welding_method\": \"CO2气保焊\",\n        \"weld_size\": \"点焊长度10-15mm，焊脚高度约4mm\",\n        \"welding_position\": \"零件7、8与零件1（左铲板）的连接处，平焊\",\n        \"quality_requirements\": \"点焊时需使用夹具固定，确保固定板的垂直度和平行度满足要求\",\n        \"safety_notes\": \"点焊前检查焊机电缆和连接是否完好，避免虚接导致发热。\"\n      },\n      \"safety_warnings\": [\n        \"点焊前务必检查焊机电缆和连接点，确保绝缘良好，防止电击。\",\n        \"使用夹具固定零件时，注意夹具夹紧力度，防止零件弹出或夹伤手指。\",\n        \"点焊时佩戴防护眼镜和面罩，防止电弧光和飞溅物伤害眼睛。\"\n      ]\n    },\n    {\n      \"step_number\": 6,\n      \"action\": \"安装并点焊支撑固定板\",\n      \"description\": \"将图纸上标注为9的支撑固定板 1（01.01.01.11525）放置在左铲板（1）的内侧，按照图纸尺寸定位。进行点焊固定。\",\n      \"position_description\": \"支撑固定板（9）位于左铲板内侧的中央区域。\",\n      \"parts_used\": [\n        {\n          \"bom_seq\": \"9\",\n          \"bom_name\": \"支撑固定板 1\",\n          \"quantity\": 1,\n          \"drawing_number\": \"9\",\n          \"node_name\": [\n            \"NAUO16\"\n          ],\n          \"bom_code\": \"01.01.01.11525\"\n        }\n      ],\n      \"tools\": [\n        \"卷尺\",\n        \"焊机\"\n      ],\n      \"warnings\": [\n        \"支撑固定板的平面度要求较高，点焊时注意控制变形。\"\n      ],\n      \"welding\": {\n        \"required\": true,\n        \"welding_type\": \"角焊（点焊）\",\n        \"welding_method\": \"CO2气保焊\",\n        \"weld_size\": \"点焊长度10-15mm，焊脚高度约4mm\",\n        \"welding_position\": \"零件9与零件1（左铲板）的连接处，平焊\",\n        \"quality_requirements\": \"点焊时应采用对称点焊，分散热量，防止支撑板翘曲变形\",\n        \"safety_notes\": \"点焊区域周围应保持清洁，无油污、水渍，防止产生气孔。\"\n      },\n      \"safety_warnings\": [\n        \"点焊时采用对称跳焊，控制热输入，防止工件因热应力变形而突然弹开伤人。\",\n        \"焊接前清理工件表面的油污和铁锈，防止焊接烟尘过大导致中毒或呼吸道刺激，必要时佩戴防尘面具。\"\n      ]\n    },\n    {\n      \"step_number\": 7,\n      \"action\": \"安装并点焊轴套加强板和轴套\",\n      \"description\": \"将图纸上标注为10的轴套加强板 2（01.01.01.11526）和图纸上标注为12的轴套 2（01.01.02.1222）放置在左铲板（1）的侧面，按照图纸尺寸定位。轴套（12）应穿过轴套加强板（10）的孔位，并与左铲板贴合。进行点焊固定。\",\n      \"position_description\": \"轴套加强板（10）和轴套（12）位于左铲板的侧面，靠近顶部。\",\n      \"parts_used\": [\n        {\n          \"bom_seq\": \"10\",\n          \"bom_name\": \"轴套加强板 2\",\n          \"quantity\": 1,\n          \"drawing_number\": \"10\",\n          \"node_name\": [\n            \"NAUO18\",\n            \"NAUO17\"\n          ],\n          \"bom_code\": \"01.01.01.11526\"\n        },\n        {\n          \"bom_seq\": \"12\",\n          \"bom_name\": \"轴套 2\",\n          \"quantity\": 1,\n          \"drawing_number\": \"12\",\n          \"node_name\": [\n            \"NAUO21\",\n            \"NAUO20\"\n          ],\n          \"bom_code\": \"01.01.02.1222\"\n        }\n      ],\n      \"tools\": [\n        \"卡尺\",\n        \"焊机\"\n      ],\n      \"warnings\": [\n        \"轴套与左铲板配合处要求保证同轴度，点焊时需使用工装夹具辅助定位。\"\n      ],\n      \"welding\": {\n        \"required\": true,\n        \"welding_type\": \"角焊（点焊）和环焊（轴套与板）\",\n        \"welding_method\": \"CO2气保焊\",\n        \"weld_size\": \"点焊长度10-15mm，轴套与板的环焊点焊4处\",\n        \"welding_position\": \"零件10与零件1（左铲板）的连接处，以及零件12（轴套）与零件10的连接处，横焊或平焊\",\n        \"quality_requirements\": \"轴套（12）点焊时必须保证其中心线垂直于左铲板表面，使用专用工装校准\",\n        \"safety_notes\": \"轴套点焊后，立即检查同轴度，防止因热变形导致偏差。\"\n      },\n      \"safety_warnings\": [\n        \"轴套点焊时，注意轴套内部可能积聚热量，避免直接触摸，防止烫伤。\",\n        \"使用工装夹具固定轴套时，确保夹具稳固，防止轴套在焊接过程中松动或飞出。\",\n        \"点焊完成后，清理焊渣时应佩戴防护眼镜，防止焊渣飞溅伤眼。\"\n      ]\n    },\n    {\n      \"step_number\": 8,\n      \"action\": \"安装并点焊反光片安装板\",\n      \"description\": \"将图纸上标注为11的反光片安装板 1（01.01.01.11527）放置在左铲板（1）的侧面，按照图纸尺寸定位。进行点焊固定。\",\n      \"position_description\": \"反光片安装板（11）位于左铲板的侧面，靠近底部。\",\n      \"parts_used\": [\n        {\n          \"bom_seq\": \"11\",\n          \"bom_name\": \"反光片安装板 1\",\n          \"quantity\": 1,\n          \"drawing_number\": \"11\",\n          \"node_name\": [\n            \"NAUO19\"\n          ],\n          \"bom_code\": \"01.01.01.11527\"\n        }\n      ],\n      \"tools\": [\n        \"卷尺\",\n        \"焊机\"\n      ],\n      \"warnings\": [\n        \"反光片安装板的安装位置应确保后续反光片安装的可见性。\"\n      ],\n      \"welding\": {\n        \"required\": true,\n        \"welding_type\": \"角焊（点焊）\",\n        \"welding_method\": \"CO2气保焊\",\n        \"weld_size\": \"点焊长度10-15mm，焊脚高度约4mm\",\n        \"welding_position\": \"零件11与零件1（左铲板）的连接处，横焊\",\n        \"quality_requirements\": \"点焊牢固，安装板表面平整，无明显变形\",\n        \"safety_notes\": \"注意焊枪角度，确保点焊熔深足够，避免虚焊。\"\n      },\n      \"safety_warnings\": [\n        \"点焊时注意保持身体稳定，避免焊枪意外触碰身体或工件，造成烫伤。\",\n        \"焊接作业时，确保工作区域地面干燥，防止潮湿环境引发触电危险。\"\n      ]\n    },\n    {\n      \"step_number\": 9,\n      \"action\": \"安装并点焊左铲雪板加强板\",\n      \"description\": \"将图纸上标注为15的左铲雪板加强板 2（01.02.01.4983）放置在左铲板（1）的内侧，按照图纸尺寸定位。进行点焊固定。\",\n      \"position_description\": \"左铲雪板加强板（15）位于左铲板内侧的顶部边缘。\",\n      \"parts_used\": [\n        {\n          \"bom_seq\": \"15\",\n          \"bom_name\": \"左铲雪板加强板 2\",\n          \"quantity\": 1,\n          \"drawing_number\": \"15\",\n          \"node_name\": [\n            \"NAUO26\",\n            \"NAUO25\"\n          ],\n          \"bom_code\": \"01.02.01.4983\"\n        }\n      ],\n      \"tools\": [\n        \"卷尺\",\n        \"焊机\"\n      ],\n      \"warnings\": [\n        \"加强板（15）的定位尺寸必须准确，确保与铲板边缘对齐。\"\n      ],\n      \"welding\": {\n        \"required\": true,\n        \"welding_type\": \"角焊（点焊）\",\n        \"welding_method\": \"CO2气保焊\",\n        \"weld_size\": \"点焊长度10-15mm，焊脚高度约4mm\",\n        \"welding_position\": \"零件15与零件1（左铲板）的连接处，平焊\",\n        \"quality_requirements\": \"加强板与铲板贴合紧密，点焊后检查间隙，确保后续满焊质量\",\n        \"safety_notes\": \"点焊前清理加强板边缘的氧化皮和油污，防止焊接过程中产生大量烟尘。\"\n      },\n      \"safety_warnings\": [\n        \"点焊前必须清理工件表面，防止油污燃烧产生有毒烟雾，影响身体健康。\",\n        \"点焊完成后，工件温度较高，应设置警示标识，避免他人误触烫伤。\"\n      ]\n    },\n    {\n      \"step_number\": 10,\n      \"action\": \"满焊所有零件\",\n      \"description\": \"检查所有零件的点焊位置和尺寸无误后，按照图纸要求对所有已点焊的零件进行满焊。注意焊接顺序，避免因热应力造成铲板变形。\",\n      \"position_description\": \"所有零件与左铲板（1）的连接处。\",\n      \"parts_used\": [],\n      \"tools\": [\n        \"焊机\",\n        \"焊接夹具\"\n      ],\n      \"warnings\": [\n        \"焊接时注意焊缝质量，不允许有气孔、夹渣、裂纹等缺陷。焊接完成后进行清渣处理。\"\n      ],\n      \"welding\": {\n        \"required\": true,\n        \"welding_type\": \"角焊和环焊（轴套）\",\n        \"welding_method\": \"CO2气保焊（MAG）\",\n        \"weld_size\": \"焊脚高度通常为6mm（具体尺寸参照图纸），焊缝连续\",\n        \"welding_position\": \"所有零件与左铲板的连接焊缝，涉及平焊、横焊、立焊\",\n        \"quality_requirements\": \"焊缝外观成型良好，焊缝高度和宽度符合图纸要求。焊后进行外观检查，关键受力部位（如油缸固定板、底部连接板）需进行磁粉检测（MT）或超声波检测（UT）\",\n        \"safety_notes\": \"采用分段、对称、跳焊的焊接顺序，严格控制焊接线能量，防止铲板整体变形。焊接过程中保持通风，防止有害气体聚集。焊后对焊渣和飞溅物进行彻底清理。\"\n      },\n      \"safety_warnings\": [\n        \"进行满焊作业时，必须全程佩戴全套焊接防护用品（面罩、手套、防护服），防止长时间暴露于弧光和高温。\",\n        \"确保焊接区域通风系统正常运行，防止焊接烟尘和有毒气体（如一氧化碳）浓度过高。\",\n        \"焊接过程中，应注意防止焊渣飞溅到电缆、气瓶或易燃物上，随时准备灭火器材。\",\n        \"焊后清理焊渣时，必须佩戴防护眼镜，使用专用工具，防止焊渣崩溅伤眼。\"\n      ]\n    }\n  ]\n}\n```",
  "parsed_result": {
    "enhanced_steps": [
      {
        "step_number": 1,
        "action": "放置基准件",
        "description": "将图纸上标注为1的左铲板（01.01.01.18598）平稳放置在焊接工作台上，作为装配基准。",
        "position_description": "左铲板的内侧（有加强筋的一侧）朝上。",
        "parts_used": [
          {
            "bom_seq": "1",
            "bom_name": "左铲板 1",
            "quantity": 1,
            "drawing_number": "1",
            "node_name": [
              "NAUO1"
            ],
            "bom_code": "01.01.01.18598"
          }
        ],
        "tools": [
          "行车",
          "吊具",
          "焊接工作台"
        ],
        "warnings": [
          "注意吊装安全，防止左铲板变形。"
        ],
        "safety_warnings": [
          "吊装前检查行车和吊具是否完好，确保吊索具捆绑牢固，防止重物坠落伤人。",
          "吊装过程中，人员必须佩戴安全帽，并远离吊物下方，防止物体打击。",
          "铲板边缘可能锋利，搬运和放置时请佩戴防割手套，防止割伤。"
        ]
      },
      {
        "step_number": 2,
        "action": "安装并点焊加强板",
        "description": "将图纸上标注为3的后加强板（01.01.01.11519）和图纸上标注为4的前加强板（01.01.01.18600）放置在左铲板（1）的内侧，按照图纸尺寸定位。先进行点焊固定。",
        "position_description": "后加强板（3）位于左铲板的后部，前加强板（4）位于左铲板的前部，均贴合在铲板内侧。",
        "parts_used": [
          {
            "bom_seq": "3",
            "bom_name": "后加强板 1",
            "quantity": 1,
            "drawing_number": "3",
            "node_name": [
              "NAUO3"
            ],
            "bom_code": "01.01.01.11519"
          },
          {
            "bom_seq": "4",
            "bom_name": "前加强板 1",
            "quantity": 1,
            "drawing_number": "4",
            "node_name": [
              "NAUO4"
            ],
            "bom_code": "01.01.01.18600"
          }
        ],
        "tools": [
          "卷尺",
          "角尺",
          "焊机"
        ],
        "warnings": [
          "点焊时注意定位尺寸，确保加强板与铲板贴合紧密。"
        ],
        "welding": {
          "required": true,
          "welding_type": "角焊（点焊）",
          "welding_method": "CO2气保焊",
          "weld_size": "点焊长度10-15mm，焊脚高度约4mm",
          "welding_position": "零件3、4与零件1（左铲板）的贴合面，平焊",
          "quality_requirements": "点焊牢固，能承受后续装配应力，无明显气孔",
          "safety_notes": "佩戴焊接面罩和防护手套，确保工作区域通风良好，点焊后及时清理飞溅物"
        },
        "safety_warnings": [
          "进行点焊作业时，必须佩戴焊接面罩、防护手套和防护服，防止弧光灼伤和焊渣烫伤。",
          "确保焊机接地良好，电缆绝缘完好，防止发生触电事故。",
          "点焊区域周围3米内应清理干净，不得有易燃易爆物品，防止火灾。"
        ]
      },
      {
        "step_number": 3,
        "action": "安装并点焊方形板和机加板",
        "description": "将图纸上标注为2的方形板-机加（01.01.01.18599）和图纸上标注为13的方形板 1（01.01.01.11528）放置在左铲板（1）的内侧，按照图纸尺寸定位。将图纸上标注为14的方形板 3（01.01.01.11529）放置在左铲板的另一侧，进行点焊固定。",
        "position_description": "方形板-机加（2）和方形板 1（13）位于左铲板的顶部边缘，方形板 3（14）位于左铲板的侧面。",
        "parts_used": [
          {
            "bom_seq": "2",
            "bom_name": "方形板-机加 1",
            "quantity": 1,
            "drawing_number": "2",
            "node_name": [
              "NAUO2"
            ],
            "bom_code": "01.01.01.18599"
          },
          {
            "bom_seq": "13",
            "bom_name": "方形板 1",
            "quantity": 1,
            "drawing_number": "13"
          },
          {
            "bom_seq": "14",
            "bom_name": "方形板 3",
            "quantity": 1,
            "drawing_number": "14",
            "node_name": [
              "NAUO24",
              "NAUO23",
              "NAUO22"
            ],
            "bom_code": "01.01.01.11529"
          }
        ],
        "tools": [
          "卷尺",
          "卡尺",
          "焊机"
        ],
        "warnings": [
          "方形板-机加（2）的机加面应朝外，确保后续装配精度。"
        ],
        "welding": {
          "required": true,
          "welding_type": "角焊（点焊）",
          "welding_method": "CO2气保焊",
          "weld_size": "点焊长度10-15mm，焊脚高度约4mm",
          "welding_position": "零件2、13、14与零件1（左铲板）的连接处，主要为平焊和横焊",
          "quality_requirements": "点焊位置均匀分布，保证零件定位准确，特别是机加板（2）的定位精度",
          "safety_notes": "注意焊机接地良好，避免电击。点焊时保持姿势稳定，防止焊枪滑脱。"
        },
        "safety_warnings": [
          "点焊时必须佩戴焊接面罩和防护手套，防止弧光和高温飞溅物伤害。",
          "操作焊机前，检查焊枪、电缆和气路连接是否可靠，防止漏电或漏气。",
          "搬运零件时，注意零件边缘可能锋利，佩戴防割手套，防止割伤。"
        ]
      },
      {
        "step_number": 4,
        "action": "安装并点焊底部连接板和前油缸固定板",
        "description": "将图纸上标注为5的底部连接板 6（01.01.01.11521）和图纸上标注为6的前油缸固定板 2（01.01.01.11522）放置在左铲板（1）的底部和后侧，按照图纸尺寸定位。进行点焊固定。",
        "position_description": "底部连接板（5）位于左铲板的底部，前油缸固定板（6）位于左铲板的后部，靠近底部。",
        "parts_used": [
          {
            "bom_seq": "5",
            "bom_name": "底部连接板 6",
            "quantity": 1,
            "drawing_number": "5",
            "node_name": [
              "NAUO15",
              "NAUO14",
              "NAUO13",
              "NAUO12",
              "NAUO6",
              "NAUO5"
            ],
            "bom_code": "01.01.01.11521"
          },
          {
            "bom_seq": "6",
            "bom_name": "前油缸固定板 2",
            "quantity": 1,
            "drawing_number": "6",
            "node_name": [
              "NAUO8",
              "NAUO7"
            ],
            "bom_code": "01.01.01.11522"
          }
        ],
        "tools": [
          "卷尺",
          "焊机"
        ],
        "warnings": [
          "底部连接板（5）的安装位置是后续连接的关键，必须保证尺寸准确。"
        ],
        "welding": {
          "required": true,
          "welding_type": "角焊（点焊）",
          "welding_method": "CO2气保焊",
          "weld_size": "点焊长度10-15mm，焊脚高度约4mm",
          "welding_position": "零件5、6与零件1（左铲板）的连接处，可能涉及仰焊（如果铲板平放）或平焊（如果翻转）",
          "quality_requirements": "点焊位置应避开后续满焊区域的起始点，确保定位准确",
          "safety_notes": "如果涉及仰焊，注意防止熔渣和飞溅物烫伤，穿戴好防护服和面罩。"
        },
        "safety_warnings": [
          "如果需要仰焊，必须穿戴防火防护服和头罩，防止焊渣和熔融金属飞溅烫伤身体。",
          "确保工作区域通风良好，特别是仰焊时产生的烟尘和有害气体。",
          "点焊前检查工件是否稳定，防止在焊接过程中零件移动或掉落。"
        ]
      },
      {
        "step_number": 5,
        "action": "安装并点焊弹簧固定板",
        "description": "将图纸上标注为7的前弹簧固定板 1（01.01.01.11523）和图纸上标注为8的后弹簧固定板 2（01.01.01.11524）放置在左铲板（1）的内侧，按照图纸尺寸定位。进行点焊固定。",
        "position_description": "前弹簧固定板（7）和后弹簧固定板（8）位于左铲板内侧的加强板区域。",
        "parts_used": [
          {
            "bom_seq": "7",
            "bom_name": "前弹簧固定板 1",
            "quantity": 1,
            "drawing_number": "7",
            "node_name": [
              "NAUO9"
            ],
            "bom_code": "01.01.01.11523"
          },
          {
            "bom_seq": "8",
            "bom_name": "后弹簧固定板 2",
            "quantity": 1,
            "drawing_number": "8",
            "node_name": [
              "NAUO11",
              "NAUO10"
            ],
            "bom_code": "01.01.01.11524"
          }
        ],
        "tools": [
          "卷尺",
          "焊机"
        ],
        "warnings": [
          "弹簧固定板的孔位必须与图纸要求对齐，确保后续弹簧安装顺畅。"
        ],
        "welding": {
          "required": true,
          "welding_type": "角焊（点焊）",
          "welding_method": "CO2气保焊",
          "weld_size": "点焊长度10-15mm，焊脚高度约4mm",
          "welding_position": "零件7、8与零件1（左铲板）的连接处，平焊",
          "quality_requirements": "点焊时需使用夹具固定，确保固定板的垂直度和平行度满足要求",
          "safety_notes": "点焊前检查焊机电缆和连接是否完好，避免虚接导致发热。"
        },
        "safety_warnings": [
          "点焊前务必检查焊机电缆和连接点，确保绝缘良好，防止电击。",
          "使用夹具固定零件时，注意夹具夹紧力度，防止零件弹出或夹伤手指。",
          "点焊时佩戴防护眼镜和面罩，防止电弧光和飞溅物伤害眼睛。"
        ]
      },
      {
        "step_number": 6,
        "action": "安装并点焊支撑固定板",
        "description": "将图纸上标注为9的支撑固定板 1（01.01.01.11525）放置在左铲板（1）的内侧，按照图纸尺寸定位。进行点焊固定。",
        "position_description": "支撑固定板（9）位于左铲板内侧的中央区域。",
        "parts_used": [
          {
            "bom_seq": "9",
            "bom_name": "支撑固定板 1",
            "quantity": 1,
            "drawing_number": "9",
            "node_name": [
              "NAUO16"
            ],
            "bom_code": "01.01.01.11525"
          }
        ],
        "tools": [
          "卷尺",
          "焊机"
        ],
        "warnings": [
          "支撑固定板的平面度要求较高，点焊时注意控制变形。"
        ],
        "welding": {
          "required": true,
          "welding_type": "角焊（点焊）",
          "welding_method": "CO2气保焊",
          "weld_size": "点焊长度10-15mm，焊脚高度约4mm",
          "welding_position": "零件9与零件1（左铲板）的连接处，平焊",
          "quality_requirements": "点焊时应采用对称点焊，分散热量，防止支撑板翘曲变形",
          "safety_notes": "点焊区域周围应保持清洁，无油污、水渍，防止产生气孔。"
        },
        "safety_warnings": [
          "点焊时采用对称跳焊，控制热输入，防止工件因热应力变形而突然弹开伤人。",
          "焊接前清理工件表面的油污和铁锈，防止焊接烟尘过大导致中毒或呼吸道刺激，必要时佩戴防尘面具。"
        ]
      },
      {
        "step_number": 7,
        "action": "安装并点焊轴套加强板和轴套",
        "description": "将图纸上标注为10的轴套加强板 2（01.01.01.11526）和图纸上标注为12的轴套 2（01.01.02.1222）放置在左铲板（1）的侧面，按照图纸尺寸定位。轴套（12）应穿过轴套加强板（10）的孔位，并与左铲板贴合。进行点焊固定。",
        "position_description": "轴套加强板（10）和轴套（12）位于左铲板的侧面，靠近顶部。",
        "parts_used": [
          {
            "bom_seq": "10",
            "bom_name": "轴套加强板 2",
            "quantity": 1,
            "drawing_number": "10",
            "node_name": [
              "NAUO18",
              "NAUO17"
            ],
            "bom_code": "01.01.01.11526"
          },
          {
            "bom_seq": "12",
            "bom_name": "轴套 2",
            "quantity": 1,
            "drawing_number": "12",
            "node_name": [
              "NAUO21",
              "NAUO20"
            ],
            "bom_code": "01.01.02.1222"
          }
        ],
        "tools": [
          "卡尺",
          "焊机"
        ],
        "warnings": [
          "轴套与左铲板配合处要求保证同轴度，点焊时需使用工装夹具辅助定位。"
        ],
        "welding": {
          "required": true,
          "welding_type": "角焊（点焊）和环焊（轴套与板）",
          "welding_method": "CO2气保焊",
          "weld_size": "点焊长度10-15mm，轴套与板的环焊点焊4处",
          "welding_position": "零件10与零件1（左铲板）的连接处，以及零件12（轴套）与零件10的连接处，横焊或平焊",
          "quality_requirements": "轴套（12）点焊时必须保证其中心线垂直于左铲板表面，使用专用工装校准",
          "safety_notes": "轴套点焊后，立即检查同轴度，防止因热变形导致偏差。"
        },
        "safety_warnings": [
          "轴套点焊时，注意轴套内部可能积聚热量，避免直接触摸，防止烫伤。",
          "使用工装夹具固定轴套时，确保夹具稳固，防止轴套在焊接过程中松动或飞出。",
          "点焊完成后，清理焊渣时应佩戴防护眼镜，防止焊渣飞溅伤眼。"
        ]
      },
      {
        "step_number": 8,
        "action": "安装并点焊反光片安装板",
        "description": "将图纸上标注为11的反光片安装板 1（01.01.01.11527）放置在左铲板（1）的侧面，按照图纸尺寸定位。进行点焊固定。",
        "position_description": "反光片安装板（11）位于左铲板的侧面，靠近底部。",
        "parts_used": [
          {
            "bom_seq": "11",
            "bom_name": "反光片安装板 1",
            "quantity": 1,
            "drawing_number": "11",
            "node_name": [
              "NAUO19"
            ],
            "bom_code": "01.01.01.11527"
          }
        ],
        "tools": [
          "卷尺",
          "焊机"
        ],
        "warnings": [
          "反光片安装板的安装位置应确保后续反光片安装的可见性。"
        ],
        "welding": {
          "required": true,
          "welding_type": "角焊（点焊）",
          "welding_method": "CO2气保焊",
          "weld_size": "点焊长度10-15mm，焊脚高度约4mm",
          "welding_position": "零件11与零件1（左铲板）的连接处，横焊",
          "quality_requirements": "点焊牢固，安装板表面平整，无明显变形",
          "safety_notes": "注意焊枪角度，确保点焊熔深足够，避免虚焊。"
        },
        "safety_warnings": [
          "点焊时注意保持身体稳定，避免焊枪意外触碰身体或工件，造成烫伤。",
          "焊接作业时，确保工作区域地面干燥，防止潮湿环境引发触电危险。"
        ]
      },
      {
        "step_number": 9,
        "action": "安装并点焊左铲雪板加强板",
        "description": "将图纸上标注为15的左铲雪板加强板 2（01.02.01.4983）放置在左铲板（1）的内侧，按照图纸尺寸定位。进行点焊固定。",
        "position_description": "左铲雪板加强板（15）位于左铲板内侧的顶部边缘。",
        "parts_used": [
          {
            "bom_seq": "15",
            "bom_name": "左铲雪板加强板 2",
            "quantity": 1,
            "drawing_number": "15",
            "node_name": [
              "NAUO26",
              "NAUO25"
            ],
            "bom_code": "01.02.01.4983"
          }
        ],
        "tools": [
          "卷尺",
          "焊机"
        ],
        "warnings": [
          "加强板（15）的定位尺寸必须准确，确保与铲板边缘对齐。"
        ],
        "welding": {
          "required": true,
          "welding_type": "角焊（点焊）",
          "welding_method": "CO2气保焊",
          "weld_size": "点焊长度10-15mm，焊脚高度约4mm",
          "welding_position": "零件15与零件1（左铲板）的连接处，平焊",
          "quality_requirements": "加强板与铲板贴合紧密，点焊后检查间隙，确保后续满焊质量",
          "safety_notes": "点焊前清理加强板边缘的氧化皮和油污，防止焊接过程中产生大量烟尘。"
        },
        "safety_warnings": [
          "点焊前必须清理工件表面，防止油污燃烧产生有毒烟雾，影响身体健康。",
          "点焊完成后，工件温度较高，应设置警示标识，避免他人误触烫伤。"
        ]
      },
      {
        "step_number": 10,
        "action": "满焊所有零件",
        "description": "检查所有零件的点焊位置和尺寸无误后，按照图纸要求对所有已点焊的零件进行满焊。注意焊接顺序，避免因热应力造成铲板变形。",
        "position_description": "所有零件与左铲板（1）的连接处。",
        "parts_used": [],
        "tools": [
          "焊机",
          "焊接夹具"
        ],
        "warnings": [
          "焊接时注意焊缝质量，不允许有气孔、夹渣、裂纹等缺陷。焊接完成后进行清渣处理。"
        ],
        "welding": {
          "required": true,
          "welding_type": "角焊和环焊（轴套）",
          "welding_method": "CO2气保焊（MAG）",
          "weld_size": "焊脚高度通常为6mm（具体尺寸参照图纸），焊缝连续",
          "welding_position": "所有零件与左铲板的连接焊缝，涉及平焊、横焊、立焊",
          "quality_requirements": "焊缝外观成型良好，焊缝高度和宽度符合图纸要求。焊后进行外观检查，关键受力部位（如油缸固定板、底部连接板）需进行磁粉检测（MT）或超声波检测（UT）",
          "safety_notes": "采用分段、对称、跳焊的焊接顺序，严格控制焊接线能量，防止铲板整体变形。焊接过程中保持通风，防止有害气体聚集。焊后对焊渣和飞溅物进行彻底清理。"
        },
        "safety_warnings": [
          "进行满焊作业时，必须全程佩戴全套焊接防护用品（面罩、手套、防护服），防止长时间暴露于弧光和高温。",
          "确保焊接区域通风系统正常运行，防止焊接烟尘和有毒气体（如一氧化碳）浓度过高。",
          "焊接过程中，应注意防止焊渣飞溅到电缆、气瓶或易燃物上，随时准备灭火器材。",
          "焊后清理焊渣时，必须佩戴防护眼镜，使用专用工具，防止焊渣崩溅伤眼。"
        ]
      }
    ]
  }
}