{
  "agent_name": "Agent6_FAQ",
  "model": "google/gemini-2.5-flash-preview-09-2025",
  "timestamp": "20251005_151246",
  "image_count": 0,
  "temperature": 0.2,
  "system_prompt": "# 角色定位\n\n你是**李师傅**，一位拥有20年安全管理经验的高级安全工程师。\n\n## 教育背景\n\n- **学历**：安全工程专业本科\n- **职业资格**：注册安全工程师、高级安全评价师\n- **专业培训**：\n  - 机械制造安全管理\n  - 职业健康与安全管理体系（ISO 45001）\n  - 事故调查与分析\n  - 应急预案编制与演练\n\n## 职业背景\n\n- **工作经历**：20年机械制造企业安全管理经验，参与过大型装备制造、钢结构加工等项目\n- **专业领域**：\n  - 机械加工安全（车、铣、刨、磨、钻等）\n  - 焊接作业安全（电焊、气焊、氩弧焊等）\n  - 起重吊装安全（行车、叉车、吊索具等）\n  - 高空作业安全（脚手架、安全带、防坠落等）\n  - 个人防护用品管理（安全帽、防护眼镜、手套、安全鞋等）\n\n## 知识结构（详细）\n\n### 1. 机械伤害风险\n- **夹伤/挤伤**：手指、手臂被运动部件夹住\n- **切割伤**：锋利边缘、毛刺、切削工具\n- **碰撞伤**：头部碰撞、身体碰撞\n- **坠落伤**：零件坠落、工具坠落、人员坠落\n\n### 2. 焊接作业风险\n- **电击伤**：焊机漏电、接地不良\n- **弧光伤**：电弧紫外线灼伤眼睛和皮肤\n- **烫伤**：高温熔池、焊渣飞溅\n- **火灾爆炸**：易燃物引燃、气瓶泄漏\n- **有毒气体**：焊接烟尘、一氧化碳中毒\n\n### 3. 起重吊装风险\n- **吊物坠落**：吊索具断裂、捆绑不牢\n- **吊物摆动**：碰撞人员、设备\n- **超载**：超过起重机额定载荷\n- **指挥失误**：信号不清、违章指挥\n\n### 4. 高空作业风险\n- **人员坠落**：未系安全带、脚手架不牢\n- **物体打击**：工具、零件从高处坠落\n- **脚手架坍塌**：搭设不规范、超载\n\n### 5. 个人防护用品\n- **头部防护**：安全帽（防止碰撞、坠物打击）\n- **眼部防护**：防护眼镜、焊接面罩（防止飞溅、弧光）\n- **手部防护**：防护手套（防止切割、烫伤、化学品）\n- **足部防护**：安全鞋（防砸、防刺穿、防滑）\n- **呼吸防护**：防尘口罩、防毒面具（防止粉尘、有毒气体）\n\n### 6. 应急处理\n- **机械伤害**：立即停机、呼救、止血、固定、送医\n- **电击伤**：切断电源、心肺复苏、送医\n- **烫伤**：冷水冲洗、覆盖无菌纱布、送医\n- **火灾**：使用灭火器、疏散人员、报警\n\n## 任务步骤（Chain of Thought）\n\n你的任务是**为每个装配步骤添加安全警告**（如果该步骤有安全风险）。请按照以下5个步骤思考：\n\n### 步骤1：识别风险步骤\n- 分析每个装配步骤的操作内容\n- 判断是否涉及高风险作业（焊接、吊装、高空、重物搬运等）\n- 识别潜在的伤害类型（机械伤害、电击、烫伤、坠落等）\n\n### 步骤2：分析风险源\n- 确定风险的来源（设备、工具、材料、环境、人员操作等）\n- 评估风险的严重程度（轻微、中等、严重、致命）\n- 考虑风险的发生概率\n\n### 步骤3：制定预防措施\n- 针对每个风险源，制定具体的预防措施\n- 强调个人防护用品的使用\n- 强调安全操作规程的遵守\n\n### 步骤4：添加安全警告\n- 为每个有风险的步骤添加safety_warnings字段\n- 每条警告要简洁明了，说明具体的风险和预防措施\n- 使用工人能看懂的语言\n\n### 步骤5：验证完整性\n- 检查所有高风险步骤是否都添加了安全警告\n- 检查安全警告是否具体、可操作\n- 检查是否遗漏了任何潜在风险\n\n## 核心原则\n\n1. **步骤级嵌入**：为每个有风险的步骤添加safety_warnings字段，而不是单独列出安全警告\n2. **工人友好**：使用通俗语言，避免专业术语\n3. **具体可操作**：说明具体的风险和预防措施，而不是泛泛而谈\n4. **不重复显示**：安全警告只在下方\"安全\"标签页中统一显示，不在当前步骤详情中重复显示\n\n## 输出格式\n\n严格按照以下JSON格式输出（返回增强后的装配步骤）：\n\n```json\n{\n  \"enhanced_steps\": [\n    {\n      \"step_number\": 1,\n      \"title\": \"点焊定位\",\n      \"parts_used\": [...],\n      \"tools_required\": [...],\n      \"operation\": \"操作说明\",\n      \"quality_check\": \"质量检查\",\n      \"estimated_time_minutes\": 10,\n      \"welding\": {\n        \"required\": true,\n        \"welding_type\": \"点焊\",\n        \"welding_method\": \"CO2气保焊\",\n        ...\n      },\n      \"safety_warnings\": [\n        \"佩戴焊接面罩和防护手套，防止弧光灼伤眼睛和皮肤\",\n        \"确保工件夹紧牢固，防止点焊时位移造成伤害\",\n        \"焊接区域周围3米内不得有易燃物，配备灭火器\",\n        \"焊机必须接地良好，防止漏电触电\"\n      ]\n    },\n    {\n      \"step_number\": 2,\n      \"title\": \"螺栓连接\",\n      \"parts_used\": [...],\n      \"operation\": \"操作说明\",\n      \"quality_check\": \"质量检查\",\n      \"estimated_time_minutes\": 15,\n      \"safety_warnings\": [\n        \"佩戴安全帽和防护眼镜，防止零件坠落和飞溅\",\n        \"使用扭力扳手时注意力度，防止扳手滑脱伤人\"\n      ]\n    },\n    {\n      \"step_number\": 3,\n      \"title\": \"简单装配\",\n      \"parts_used\": [...],\n      \"operation\": \"操作说明\",\n      \"quality_check\": \"质量检查\",\n      \"estimated_time_minutes\": 5\n      // ⚠️ 如果没有明显安全风险，不添加safety_warnings字段\n    }\n  ]\n}\n```\n\n**⚠️ 关键要求**：\n\n1. **步骤级嵌入**：\n   - 为每个有风险的步骤添加`safety_warnings`字段\n   - 没有明显风险的步骤不添加`safety_warnings`字段\n   - 保持原有步骤的所有字段不变\n\n2. **安全警告要具体**：\n   - ✅ 说\"佩戴焊接面罩和防护手套，防止弧光灼伤眼睛和皮肤\"\n   - ❌ 不说\"注意安全\"\n   - ✅ 说\"焊接区域周围3米内不得有易燃物，配备灭火器\"\n   - ❌ 不说\"注意防火\"\n\n3. **使用通俗语言**：\n   - 工人能看懂的语言\n   - 避免专业术语和英文缩写\n\n4. **警告要全面**：\n   - 涵盖个人防护、设备安全、环境安全、操作安全\n   - 每条警告说明具体的风险和预防措施\n\n## 重要提醒\n\n- **只输出JSON，不要输出其他内容**\n- **保持原有字段不变**：不要修改或删除原有的字段（包括welding字段）\n- **警告要简洁明了**：每条警告一句话，说明风险和预防措施\n- **不要过度警告**：只针对有明显风险的步骤添加警告\n",
  "user_query": "请为以下装配步骤添加安全警告（如果有安全风险）。\n\n## 📸 视觉分析任务\n\n**你会看到工程图纸图片，请仔细观察：**\n\n1. **危险作业标识**：\n   - 图纸上的安全警告标识\n   - 特殊作业要求（如高空作业、吊装作业等）\n   - 危险区域标注\n\n2. **零件特征**：\n   - 重型零件（需要吊装）\n   - 锋利边缘（容易割伤）\n   - 高温部件（容易烫伤）\n\n3. **作业环境**：\n   - 狭窄空间（容易碰撞）\n   - 高空位置（容易坠落）\n   - 密闭空间（通风不良）\n\n## 装配步骤\n\n[\n  {\n    \"step_number\": 1,\n    \"action\": \"放置基准件\",\n    \"description\": \"将图纸上标注为1号的方形板-机加（01.01.01.11511）平稳放置在装配工作台上作为基准件，确保放置平稳。\",\n    \"position_description\": \"工作台中心\",\n    \"parts_used\": [\n      {\n        \"bom_seq\": \"1\",\n        \"bom_name\": \"方形板-机加 1\",\n        \"quantity\": 1,\n        \"drawing_number\": \"1\",\n        \"node_name\": [\n          \"NAUO1\"\n        ],\n        \"bom_code\": \"01.01.01.11511\"\n      }\n    ],\n    \"tools\": [\n      \"行车（吊装）\",\n      \"水平仪\"\n    ],\n    \"warnings\": [\n      \"方形板较重，吊装时注意安全，确保吊装平稳。\",\n      \"检查方形板表面无磕碰损伤。\"\n    ]\n  },\n  {\n    \"step_number\": 2,\n    \"action\": \"安装上连接板\",\n    \"description\": \"将图纸上标注为2号的上连接板（01.01.01.11512）放置在1号方形板的顶部边缘，按照图纸尺寸定位。先进行点焊固定。\",\n    \"position_description\": \"1号方形板的顶部边缘，两侧各一块，共2块。\",\n    \"parts_used\": [\n      {\n        \"bom_seq\": \"2\",\n        \"bom_name\": \"上连接板 2\",\n        \"quantity\": 2,\n        \"drawing_number\": \"2\",\n        \"node_name\": [\n          \"NAUO3\",\n          \"NAUO2\"\n        ],\n        \"bom_code\": \"01.01.01.11512\"\n      }\n    ],\n    \"tools\": [\n      \"焊机（CO2保护焊）\",\n      \"卷尺\",\n      \"角尺\"\n    ],\n    \"warnings\": [\n      \"点焊前必须确保2号上连接板与1号方形板的相对位置和角度准确。\",\n      \"注意焊接烟尘防护。\"\n    ],\n    \"welding\": {\n      \"required\": true,\n      \"welding_type\": \"角焊（定位焊）\",\n      \"welding_method\": \"CO2气保焊\",\n      \"weld_size\": \"点焊长度10-15mm，焊脚高度约4mm\",\n      \"welding_position\": \"零件1（方形板）与零件2（上连接板）的连接处，平焊\",\n      \"quality_requirements\": \"点焊牢固，位置准确，焊点无裂纹\",\n      \"safety_notes\": \"佩戴焊接面罩和防护手套，确保工作区域通风良好，防止火灾\"\n    }\n  },\n  {\n    \"step_number\": 3,\n    \"action\": \"安装侧连接板\",\n    \"description\": \"将图纸上标注为3号的侧连接板（01.01.01.11513）分别放置在1号方形板的两侧，并与已点焊的2号上连接板对齐。按照图纸尺寸定位后，进行点焊固定。\",\n    \"position_description\": \"1号方形板的两侧，与2号上连接板形成直角结构。\",\n    \"parts_used\": [\n      {\n        \"bom_seq\": \"3\",\n        \"bom_name\": \"侧连接板 2\",\n        \"quantity\": 2,\n        \"drawing_number\": \"3\",\n        \"node_name\": [\n          \"NAUO5\",\n          \"NAUO4\"\n        ],\n        \"bom_code\": \"01.01.01.11513\"\n      }\n    ],\n    \"tools\": [\n      \"焊机\",\n      \"角尺\",\n      \"定位夹具\"\n    ],\n    \"warnings\": [\n      \"确保3号侧连接板与1号方形板、2号上连接板的垂直度，使用角尺检查。\",\n      \"点焊牢固，防止后续操作中零件移位。\"\n    ],\n    \"welding\": {\n      \"required\": true,\n      \"welding_type\": \"角焊（定位焊）\",\n      \"welding_method\": \"CO2气保焊\",\n      \"weld_size\": \"点焊长度10-15mm，焊脚高度约4mm\",\n      \"welding_position\": \"零件1、2、3的连接处，平焊和横焊\",\n      \"quality_requirements\": \"保证零件3与零件1、2的垂直度，点焊位置均匀分布\",\n      \"safety_notes\": \"使用定位夹具固定零件，防止点焊时零件晃动，注意防弧光\"\n    }\n  },\n  {\n    \"step_number\": 4,\n    \"action\": \"安装折弯板\",\n    \"description\": \"将图纸上标注为4号的折弯板（01.01.01.11514）放置在1号方形板的后部上方，与2号上连接板和3号侧连接板的边缘对齐。定位准确后，进行点焊固定。\",\n    \"position_description\": \"1号方形板后部上方，形成一个斜面结构。\",\n    \"parts_used\": [\n      {\n        \"bom_seq\": \"4\",\n        \"bom_name\": \"折弯板 1\",\n        \"quantity\": 1,\n        \"drawing_number\": \"4\",\n        \"node_name\": [\n          \"NAUO6\"\n        ],\n        \"bom_code\": \"01.01.01.11514\"\n      }\n    ],\n    \"tools\": [\n      \"焊机\",\n      \"卷尺\"\n    ],\n    \"warnings\": [\n      \"折弯板的安装位置是关键尺寸，必须严格按照图纸尺寸定位。\",\n      \"注意折弯板的安装方向，确保孔位朝向正确。\"\n    ],\n    \"welding\": {\n      \"required\": true,\n      \"welding_type\": \"角焊（定位焊）\",\n      \"welding_method\": \"CO2气保焊\",\n      \"weld_size\": \"点焊长度10-15mm，焊脚高度约4mm\",\n      \"welding_position\": \"零件4与零件1、2、3的连接边缘，多为平焊和横焊\",\n      \"quality_requirements\": \"确保折弯板的斜面角度符合图纸要求，定位准确\",\n      \"safety_notes\": \"点焊前检查焊机接地线连接可靠，避免触电风险\"\n    }\n  },\n  {\n    \"step_number\": 5,\n    \"action\": \"安装油缸固定板\",\n    \"description\": \"将图纸上标注为5号的油缸固定板（01.01.01.11515）分别焊接到3号侧连接板的外部指定位置。注意油缸固定板的安装方向和孔位对齐。\",\n    \"position_description\": \"3号侧连接板外部，每块侧连接板上安装2块，共4块。\",\n    \"parts_used\": [\n      {\n        \"bom_seq\": \"5\",\n        \"bom_name\": \"油缸固定板 4\",\n        \"quantity\": 4,\n        \"drawing_number\": \"5\",\n        \"node_name\": [\n          \"NAUO17\",\n          \"NAUO16\",\n          \"NAUO8\",\n          \"NAUO7\"\n        ],\n        \"bom_code\": \"01.01.01.11515\"\n      }\n    ],\n    \"tools\": [\n      \"焊机\",\n      \"定位销\"\n    ],\n    \"warnings\": [\n      \"油缸固定板的孔位必须与图纸上的尺寸要求一致，使用定位销辅助对齐。\",\n      \"焊接时避免热变形影响孔位精度。\"\n    ],\n    \"welding\": {\n      \"required\": true,\n      \"welding_type\": \"角焊（满焊）\",\n      \"welding_method\": \"CO2气保焊\",\n      \"weld_size\": \"焊脚高度5mm（图纸标注），全长连续焊\",\n      \"welding_position\": \"零件5（油缸固定板）与零件3（侧连接板）的连接边缘，多为平焊或横焊\",\n      \"quality_requirements\": \"焊缝连续、饱满，无咬边、气孔等缺陷，焊后检查孔位精度\",\n      \"safety_notes\": \"由于是满焊，注意控制焊接热输入，采用分段焊或跳焊，减少零件3的热变形\"\n    }\n  },\n  {\n    \"step_number\": 6,\n    \"action\": \"安装加强板\",\n    \"description\": \"将图纸上标注为6号的加强板（01.01.01.11516）分别焊接到3号侧连接板的内部指定位置，用于结构加强。注意加强板与侧连接板的贴合度。\",\n    \"position_description\": \"3号侧连接板内部，每块侧连接板上安装2块，共4块。\",\n    \"parts_used\": [\n      {\n        \"bom_seq\": \"6\",\n        \"bom_name\": \"加强板 4\",\n        \"quantity\": 4,\n        \"drawing_number\": \"6\",\n        \"node_name\": [\n          \"NAUO12\",\n          \"NAUO11\",\n          \"NAUO10\",\n          \"NAUO9\"\n        ],\n        \"bom_code\": \"01.01.01.11516\"\n      }\n    ],\n    \"tools\": [\n      \"焊机\",\n      \"压紧夹具\"\n    ],\n    \"warnings\": [\n      \"加强板必须紧密贴合侧连接板，确保焊接强度。\",\n      \"焊接顺序应采用跳焊，减少热应力集中。\"\n    ],\n    \"welding\": {\n      \"required\": true,\n      \"welding_type\": \"角焊（满焊）\",\n      \"welding_method\": \"CO2气保焊\",\n      \"weld_size\": \"焊脚高度5mm（图纸标注），全长连续焊\",\n      \"welding_position\": \"零件6（加强板）与零件3（侧连接板）的连接边缘，多为平焊或横焊\",\n      \"quality_requirements\": \"焊缝连续，保证贴合面无间隙，焊后清理焊渣\",\n      \"safety_notes\": \"使用压紧夹具确保贴合紧密，防止焊接过程中加强板翘曲变形\"\n    }\n  },\n  {\n    \"step_number\": 7,\n    \"action\": \"安装角钢\",\n    \"description\": \"将图纸上标注为7号的角钢-机加（01.01.04.0592）焊接到1号方形板的指定位置，作为额外的支撑结构。\",\n    \"position_description\": \"1号方形板的内部或底部指定位置。\",\n    \"parts_used\": [\n      {\n        \"bom_seq\": \"7\",\n        \"bom_name\": \"角钢-机加 1\",\n        \"quantity\": 1,\n        \"drawing_number\": \"7\",\n        \"node_name\": [\n          \"NAUO13\"\n        ],\n        \"bom_code\": \"01.01.04.0592\"\n      }\n    ],\n    \"tools\": [\n      \"焊机\",\n      \"角尺\"\n    ],\n    \"warnings\": [\n      \"角钢的焊接位置和角度必须符合图纸要求，确保支撑作用。\",\n      \"检查角钢与方形板的接触面是否平整。\"\n    ],\n    \"welding\": {\n      \"required\": true,\n      \"welding_type\": \"角焊（满焊）\",\n      \"welding_method\": \"CO2气保焊\",\n      \"weld_size\": \"焊脚高度5mm（图纸标注），全长连续焊\",\n      \"welding_position\": \"零件7（角钢）与零件1（方形板）的连接边缘，多为平焊\",\n      \"quality_requirements\": \"焊缝均匀，保证角钢与方形板的垂直度或角度要求\",\n      \"safety_notes\": \"焊接前清理角钢表面的油污和锈蚀，避免产生气孔\"\n    }\n  },\n  {\n    \"step_number\": 8,\n    \"action\": \"安装轴套（8号）\",\n    \"description\": \"将图纸上标注为8号的轴套（01.01.02.1221）焊接到4号折弯板的指定孔位上。轴套需与折弯板的孔同轴对齐。\",\n    \"position_description\": \"4号折弯板上的孔位。\",\n    \"parts_used\": [\n      {\n        \"bom_seq\": \"8\",\n        \"bom_name\": \"轴套 1\",\n        \"quantity\": 1,\n        \"drawing_number\": \"8\",\n        \"node_name\": [\n          \"NAUO14\"\n        ],\n        \"bom_code\": \"01.01.02.1221\"\n      }\n    ],\n    \"tools\": [\n      \"焊机\",\n      \"同轴度检测工具\"\n    ],\n    \"warnings\": [\n      \"轴套的焊接是关键工序，必须保证轴套的同轴度和垂直度，避免焊接变形。\",\n      \"焊接前清理轴套和折弯板的接触面。\"\n    ],\n    \"welding\": {\n      \"required\": true,\n      \"welding_type\": \"角焊（满焊）\",\n      \"welding_method\": \"CO2气保焊或手工电弧焊\",\n      \"weld_size\": \"焊脚高度5mm（图纸标注），环形连续焊\",\n      \"welding_position\": \"零件8（轴套）与零件4（折弯板）的连接处，环形平焊或横焊\",\n      \"quality_requirements\": \"焊缝均匀，保证轴套与折弯板的垂直度和同轴度，焊后需进行无损检测（如外观检查和渗透检测）\",\n      \"safety_notes\": \"轴套焊接容易产生热变形，应采用对称、短焊段焊接，并使用定位工装固定，防止轴线偏移\"\n    }\n  },\n  {\n    \"step_number\": 9,\n    \"action\": \"安装轴套（9号）\",\n    \"description\": \"将图纸上标注为9号的后座轴套 1（01.02.02.0490）焊接到3号侧连接板的指定孔位上。轴套需与侧连接板的孔同轴对齐。\",\n    \"position_description\": \"3号侧连接板上的孔位。\",\n    \"parts_used\": [\n      {\n        \"bom_seq\": \"9\",\n        \"bom_name\": \"后座轴套 1\",\n        \"quantity\": 1,\n        \"drawing_number\": \"9\",\n        \"node_name\": [\n          \"NAUO15\"\n        ],\n        \"bom_code\": \"01.02.02.0490\"\n      }\n    ],\n    \"tools\": [\n      \"焊机\",\n      \"同轴度检测工具\"\n    ],\n    \"warnings\": [\n      \"确保轴套的焊接牢固，且轴线方向符合图纸要求。\",\n      \"焊接后检查轴套内径是否有焊渣飞溅。\"\n    ],\n    \"welding\": {\n      \"required\": true,\n      \"welding_type\": \"角焊（满焊）\",\n      \"welding_method\": \"CO2气保焊或手工电弧焊\",\n      \"weld_size\": \"焊脚高度5mm（图纸标注），环形连续焊\",\n      \"welding_position\": \"零件9（轴套）与零件3（侧连接板）的连接处，环形平焊或横焊\",\n      \"quality_requirements\": \"焊缝均匀，保证轴套与侧连接板的垂直度和同轴度，焊后需检查内孔无飞溅\",\n      \"safety_notes\": \"焊接时应在轴套内孔塞入防火材料或使用保护套，防止焊渣飞溅损伤内孔表面\"\n    }\n  },\n  {\n    \"step_number\": 10,\n    \"action\": \"安装轴套（10号）\",\n    \"description\": \"将图纸上标注为10号的后座轴套 1（01.01.02.0337）焊接到3号侧连接板的另一个指定孔位上。轴套需与侧连接板的孔同轴对齐。\",\n    \"position_description\": \"3号侧连接板上的另一个孔位。\",\n    \"parts_used\": [\n      {\n        \"bom_seq\": \"10\",\n        \"bom_name\": \"后座轴套 1\",\n        \"quantity\": 1,\n        \"drawing_number\": \"10\",\n        \"node_name\": [\n          \"NAUO18\"\n        ],\n        \"bom_code\": \"01.01.02.0337\"\n      }\n    ],\n    \"tools\": [\n      \"焊机\",\n      \"同轴度检测工具\"\n    ],\n    \"warnings\": [\n      \"此轴套与9号轴套需满足图纸上的相对位置和同轴度要求。\",\n      \"焊接完成后，对所有焊缝进行满焊处理，并清理焊渣。\"\n    ],\n    \"welding\": {\n      \"required\": true,\n      \"welding_type\": \"角焊（满焊）\",\n      \"welding_method\": \"CO2气保焊或手工电弧焊\",\n      \"weld_size\": \"焊脚高度5mm（图纸标注），环形连续焊\",\n      \"welding_position\": \"零件10（轴套）与零件3（侧连接板）的连接处，环形平焊或横焊\",\n      \"quality_requirements\": \"焊缝均匀，保证轴套与侧连接板的垂直度和同轴度，焊后需检查内孔无飞溅\",\n      \"safety_notes\": \"焊接完成后，应立即对轴套进行冷却处理，但不能骤冷，以减少残余应力\"\n    }\n  },\n  {\n    \"step_number\": 11,\n    \"action\": \"最终焊接与清理\",\n    \"description\": \"对所有已点焊的零件连接处进行满焊处理，焊缝尺寸和质量需符合技术要求。焊接完成后，清理所有焊渣、飞溅物，并打磨尖锐边缘。\",\n    \"position_description\": \"所有零件连接处\",\n    \"parts_used\": [],\n    \"tools\": [\n      \"焊机\",\n      \"角磨机\",\n      \"钢丝刷\"\n    ],\n    \"warnings\": [\n      \"焊缝必须连续、饱满，无气孔、夹渣等缺陷。\",\n      \"打磨时注意保护轴套内孔，避免损伤。\"\n    ],\n    \"welding\": {\n      \"required\": true,\n      \"welding_type\": \"角焊（满焊）\",\n      \"welding_method\": \"CO2气保焊为主\",\n      \"weld_size\": \"焊脚高度5mm（图纸标注），全长连续焊\",\n      \"welding_position\": \"所有零件1、2、3、4、7的连接边缘，涉及平焊、横焊、立焊\",\n      \"quality_requirements\": \"焊缝外观等级达到二级标准，焊缝表面平整，过渡圆滑，无咬边、未焊透等缺陷。关键焊缝需进行磁粉检测（MT）\",\n      \"safety_notes\": \"进行大面积满焊时，必须确保工作区域通风系统全开，防止烟尘中毒。打磨时佩戴护目镜和防尘口罩\"\n    }\n  }\n]\n\n## 要求\n\n请按照以下5个步骤思考，为装配步骤添加安全警告：\n\n### 步骤1：识别风险步骤\n- 分析每个装配步骤的操作内容\n- 判断是否涉及高风险作业：\n  * **焊接作业**：电击、弧光、烫伤、火灾\n  * **吊装作业**：吊物坠落、碰撞、超载\n  * **高空作业**：人员坠落、物体打击\n  * **重物搬运**：砸伤、扭伤、夹伤\n  * **机械加工**：切割伤、夹伤、碰撞\n\n### 步骤2：分析风险源\n- 确定风险的来源（设备、工具、材料、环境、人员操作等）\n- 评估风险的严重程度（轻微、中等、严重、致命）\n- 考虑风险的发生概率\n\n### 步骤3：制定预防措施\n- 针对每个风险源，制定具体的预防措施\n- 强调个人防护用品的使用：\n  * **焊接**：焊接面罩、防护手套、防护服\n  * **吊装**：安全帽、安全鞋、手套\n  * **高空**：安全带、安全帽、防滑鞋\n  * **机械**：防护眼镜、手套、安全鞋\n\n### 步骤4：添加安全警告\n- 为每个有风险的步骤添加safety_warnings字段\n- 每条警告要简洁明了，说明具体的风险和预防措施\n- 使用工人能看懂的语言\n\n### 步骤5：验证完整性\n- 检查所有高风险步骤是否都添加了安全警告\n- 检查安全警告是否具体、可操作\n- 检查是否遗漏了任何潜在风险\n\n## ⚠️ 强制自检清单（生成后必须逐项检查）\n\n**在输出JSON之前，你必须完成以下验证：**\n\n1. **风险步骤识别验证**：\n   - [ ] 所有涉及焊接、吊装、高空、重物搬运的步骤都添加了safety_warnings字段\n   - [ ] 没有明显风险的步骤没有添加safety_warnings字段\n\n2. **安全警告完整性验证**：\n   - [ ] 每个safety_warnings字段都是字符串数组\n   - [ ] 每条警告都说明了具体的风险和预防措施\n   - [ ] 涵盖了个人防护、设备安全、环境安全、操作安全\n\n3. **语言通俗性验证**：\n   - [ ] 使用工人能看懂的语言\n   - [ ] 避免专业术语和英文缩写\n   - [ ] 每条警告简洁明了（一句话）\n\n4. **原有字段保持验证**：\n   - [ ] 原有步骤的所有字段都保持不变（包括welding字段）\n   - [ ] 没有修改或删除任何原有字段\n\n**如果自检发现任何问题，必须重新生成！**\n\n现在开始为装配步骤添加安全警告！\n",
  "raw_response": "```json\n{\n  \"enhanced_steps\": [\n    {\n      \"step_number\": 1,\n      \"action\": \"放置基准件\",\n      \"description\": \"将图纸上标注为1号的方形板-机加（01.01.01.11511）平稳放置在装配工作台上作为基准件，确保放置平稳。\",\n      \"position_description\": \"工作台中心\",\n      \"parts_used\": [\n        {\n          \"bom_seq\": \"1\",\n          \"bom_name\": \"方形板-机加 1\",\n          \"quantity\": 1,\n          \"drawing_number\": \"1\",\n          \"node_name\": [\n            \"NAUO1\"\n          ],\n          \"bom_code\": \"01.01.01.11511\"\n        }\n      ],\n      \"tools\": [\n        \"行车（吊装）\",\n        \"水平仪\"\n      ],\n      \"warnings\": [\n        \"方形板较重，吊装时注意安全，确保吊装平稳。\",\n        \"检查方形板表面无磕碰损伤。\"\n      ],\n      \"safety_warnings\": [\n        \"吊装前检查吊索具是否完好，防止重物坠落砸伤。\",\n        \"吊装区域内无关人员必须撤离，防止碰撞。\",\n        \"指挥人员必须使用统一手势，确保吊装平稳、准确。\"\n      ]\n    },\n    {\n      \"step_number\": 2,\n      \"action\": \"安装上连接板\",\n      \"description\": \"将图纸上标注为2号的上连接板（01.01.01.11512）放置在1号方形板的顶部边缘，按照图纸尺寸定位。先进行点焊固定。\",\n      \"position_description\": \"1号方形板的顶部边缘，两侧各一块，共2块。\",\n      \"parts_used\": [\n        {\n          \"bom_seq\": \"2\",\n          \"bom_name\": \"上连接板 2\",\n          \"quantity\": 2,\n          \"drawing_number\": \"2\",\n          \"node_name\": [\n            \"NAUO3\",\n            \"NAUO2\"\n          ],\n          \"bom_code\": \"01.01.01.11512\"\n        }\n      ],\n      \"tools\": [\n        \"焊机（CO2保护焊）\",\n        \"卷尺\",\n        \"角尺\"\n      ],\n      \"warnings\": [\n        \"点焊前必须确保2号上连接板与1号方形板的相对位置和角度准确。\",\n        \"注意焊接烟尘防护。\"\n      ],\n      \"welding\": {\n        \"required\": true,\n        \"welding_type\": \"角焊（定位焊）\",\n        \"welding_method\": \"CO2气保焊\",\n        \"weld_size\": \"点焊长度10-15mm，焊脚高度约4mm\",\n        \"welding_position\": \"零件1（方形板）与零件2（上连接板）的连接处，平焊\",\n        \"quality_requirements\": \"点焊牢固，位置准确，焊点无裂纹\",\n        \"safety_notes\": \"佩戴焊接面罩和防护手套，确保工作区域通风良好，防止火灾\"\n      },\n      \"safety_warnings\": [\n        \"佩戴焊接面罩和防护手套，防止弧光灼伤眼睛和皮肤。\",\n        \"确保焊机接地良好，防止触电。\",\n        \"点焊区域周围3米内不得有易燃物，防止火灾。\"\n      ]\n    },\n    {\n      \"step_number\": 3,\n      \"action\": \"安装侧连接板\",\n      \"description\": \"将图纸上标注为3号的侧连接板（01.01.01.11513）分别放置在1号方形板的两侧，并与已点焊的2号上连接板对齐。按照图纸尺寸定位后，进行点焊固定。\",\n      \"position_description\": \"1号方形板的两侧，与2号上连接板形成直角结构。\",\n      \"parts_used\": [\n        {\n          \"bom_seq\": \"3\",\n          \"bom_name\": \"侧连接板 2\",\n          \"quantity\": 2,\n          \"drawing_number\": \"3\",\n          \"node_name\": [\n            \"NAUO5\",\n            \"NAUO4\"\n          ],\n          \"bom_code\": \"01.01.01.11513\"\n        }\n      ],\n      \"tools\": [\n        \"焊机\",\n        \"角尺\",\n        \"定位夹具\"\n      ],\n      \"warnings\": [\n        \"确保3号侧连接板与1号方形板、2号上连接板的垂直度，使用角尺检查。\",\n        \"点焊牢固，防止后续操作中零件移位。\"\n      ],\n      \"welding\": {\n        \"required\": true,\n        \"welding_type\": \"角焊（定位焊）\",\n        \"welding_method\": \"CO2气保焊\",\n        \"weld_size\": \"点焊长度10-15mm，焊脚高度约4mm\",\n        \"welding_position\": \"零件1、2、3的连接处，平焊和横焊\",\n        \"quality_requirements\": \"保证零件3与零件1、2的垂直度，点焊位置均匀分布\",\n        \"safety_notes\": \"使用定位夹具固定零件，防止点焊时零件晃动，注意防弧光\"\n      },\n      \"safety_warnings\": [\n        \"佩戴焊接面罩和防护手套，防止弧光和高温飞溅物烫伤。\",\n        \"确保工作区域通风良好，防止焊接烟尘中毒。\",\n        \"使用定位夹具时，注意夹紧力度，防止夹伤手指。\"\n      ]\n    },\n    {\n      \"step_number\": 4,\n      \"action\": \"安装折弯板\",\n      \"description\": \"将图纸上标注为4号的折弯板（01.01.01.11514）放置在1号方形板的后部上方，与2号上连接板和3号侧连接板的边缘对齐。定位准确后，进行点焊固定。\",\n      \"position_description\": \"1号方形板后部上方，形成一个斜面结构。\",\n      \"parts_used\": [\n        {\n          \"bom_seq\": \"4\",\n          \"bom_name\": \"折弯板 1\",\n          \"quantity\": 1,\n          \"drawing_number\": \"4\",\n          \"node_name\": [\n            \"NAUO6\"\n          ],\n          \"bom_code\": \"01.01.01.11514\"\n        }\n      ],\n      \"tools\": [\n        \"焊机\",\n        \"卷尺\"\n      ],\n      \"warnings\": [\n        \"折弯板的安装位置是关键尺寸，必须严格按照图纸尺寸定位。\",\n        \"注意折弯板的安装方向，确保孔位朝向正确。\"\n      ],\n      \"welding\": {\n        \"required\": true,\n        \"welding_type\": \"角焊（定位焊）\",\n        \"welding_method\": \"CO2气保焊\",\n        \"weld_size\": \"点焊长度10-15mm，焊脚高度约4mm\",\n        \"welding_position\": \"零件4与零件1、2、3的连接边缘，多为平焊和横焊\",\n        \"quality_requirements\": \"确保折弯板的斜面角度符合图纸要求，定位准确\",\n        \"safety_notes\": \"点焊前检查焊机接地线连接可靠，避免触电风险\"\n      },\n      \"safety_warnings\": [\n        \"佩戴焊接面罩和防护手套，防止弧光和高温飞溅物烫伤。\",\n        \"点焊前检查焊机接地线连接可靠，避免触电风险。\",\n        \"折弯板边缘可能锋利，搬运时佩戴防割手套，防止割伤。\"\n      ]\n    },\n    {\n      \"step_number\": 5,\n      \"action\": \"安装油缸固定板\",\n      \"description\": \"将图纸上标注为5号的油缸固定板（01.01.01.11515）分别焊接到3号侧连接板的外部指定位置。注意油缸固定板的安装方向和孔位对齐。\",\n      \"position_description\": \"3号侧连接板外部，每块侧连接板上安装2块，共4块。\",\n      \"parts_used\": [\n        {\n          \"bom_seq\": \"5\",\n          \"bom_name\": \"油缸固定板 4\",\n          \"quantity\": 4,\n          \"drawing_number\": \"5\",\n          \"node_name\": [\n            \"NAUO17\",\n            \"NAUO16\",\n            \"NAUO8\",\n            \"NAUO7\"\n          ],\n          \"bom_code\": \"01.01.01.11515\"\n        }\n      ],\n      \"tools\": [\n        \"焊机\",\n        \"定位销\"\n      ],\n      \"warnings\": [\n        \"油缸固定板的孔位必须与图纸上的尺寸要求一致，使用定位销辅助对齐。\",\n        \"焊接时避免热变形影响孔位精度。\"\n      ],\n      \"welding\": {\n        \"required\": true,\n        \"welding_type\": \"角焊（满焊）\",\n        \"welding_method\": \"CO2气保焊\",\n        \"weld_size\": \"焊脚高度5mm（图纸标注），全长连续焊\",\n        \"welding_position\": \"零件5（油缸固定板）与零件3（侧连接板）的连接边缘，多为平焊或横焊\",\n        \"quality_requirements\": \"焊缝连续、饱满，无咬边、气孔等缺陷，焊后检查孔位精度\",\n        \"safety_notes\": \"由于是满焊，注意控制焊接热输入，采用分段焊或跳焊，减少零件3的热变形\"\n      },\n      \"safety_warnings\": [\n        \"进行满焊时，必须佩戴全套焊接防护用品，防止高温烫伤。\",\n        \"注意控制焊接热输入，防止零件因热变形而翘曲或夹伤操作人员。\",\n        \"确保焊接区域通风良好，防止烟尘浓度过高。\"\n      ]\n    },\n    {\n      \"step_number\": 6,\n      \"action\": \"安装加强板\",\n      \"description\": \"将图纸上标注为6号的加强板（01.01.01.11516）分别焊接到3号侧连接板的内部指定位置，用于结构加强。注意加强板与侧连接板的贴合度。\",\n      \"position_description\": \"3号侧连接板内部，每块侧连接板上安装2块，共4块。\",\n      \"parts_used\": [\n        {\n          \"bom_seq\": \"6\",\n          \"bom_name\": \"加强板 4\",\n          \"quantity\": 4,\n          \"drawing_number\": \"6\",\n          \"node_name\": [\n            \"NAUO12\",\n            \"NAUO11\",\n            \"NAUO10\",\n            \"NAUO9\"\n          ],\n          \"bom_code\": \"01.01.01.11516\"\n        }\n      ],\n      \"tools\": [\n        \"焊机\",\n        \"压紧夹具\"\n      ],\n      \"warnings\": [\n        \"加强板必须紧密贴合侧连接板，确保焊接强度。\",\n        \"焊接顺序应采用跳焊，减少热应力集中。\"\n      ],\n      \"welding\": {\n        \"required\": true,\n        \"welding_type\": \"角焊（满焊）\",\n        \"welding_method\": \"CO2气保焊\",\n        \"weld_size\": \"焊脚高度5mm（图纸标注），全长连续焊\",\n        \"welding_position\": \"零件6（加强板）与零件3（侧连接板）的连接边缘，多为平焊或横焊\",\n        \"quality_requirements\": \"焊缝连续，保证贴合面无间隙，焊后清理焊渣\",\n        \"safety_notes\": \"使用压紧夹具确保贴合紧密，防止焊接过程中加强板翘曲变形\"\n      },\n      \"safety_warnings\": [\n        \"使用压紧夹具时，注意防止夹具弹开或夹伤手指。\",\n        \"焊接时注意焊枪和焊丝的高温，防止烫伤。\",\n        \"确保焊接电源线绝缘良好，避免漏电。\"\n      ]\n    },\n    {\n      \"step_number\": 7,\n      \"action\": \"安装角钢\",\n      \"description\": \"将图纸上标注为7号的角钢-机加（01.01.04.0592）焊接到1号方形板的指定位置，作为额外的支撑结构。\",\n      \"position_description\": \"1号方形板的内部或底部指定位置。\",\n      \"parts_used\": [\n        {\n          \"bom_seq\": \"7\",\n          \"bom_name\": \"角钢-机加 1\",\n          \"quantity\": 1,\n          \"drawing_number\": \"7\",\n          \"node_name\": [\n            \"NAUO13\"\n          ],\n          \"bom_code\": \"01.01.04.0592\"\n        }\n      ],\n      \"tools\": [\n        \"焊机\",\n        \"角尺\"\n      ],\n      \"warnings\": [\n        \"角钢的焊接位置和角度必须符合图纸要求，确保支撑作用。\",\n        \"检查角钢与方形板的接触面是否平整。\"\n      ],\n      \"welding\": {\n        \"required\": true,\n        \"welding_type\": \"角焊（满焊）\",\n        \"welding_method\": \"CO2气保焊\",\n        \"weld_size\": \"焊脚高度5mm（图纸标注），全长连续焊\",\n        \"welding_position\": \"零件7（角钢）与零件1（方形板）的连接边缘，多为平焊\",\n        \"quality_requirements\": \"焊缝均匀，保证角钢与方形板的垂直度或角度要求\",\n        \"safety_notes\": \"焊接前清理角钢表面的油污和锈蚀，避免产生气孔\"\n      },\n      \"safety_warnings\": [\n        \"角钢可能存在毛刺或尖锐边缘，搬运时佩戴防割手套。\",\n        \"焊接前必须清理角钢表面的油污和锈蚀，防止焊接时产生有毒烟雾。\",\n        \"确保灭火器材放置在触手可及的位置。\"\n      ]\n    },\n    {\n      \"step_number\": 8,\n      \"action\": \"安装轴套（8号）\",\n      \"description\": \"将图纸上标注为8号的轴套（01.01.02.1221）焊接到4号折弯板的指定孔位上。轴套需与折弯板的孔同轴对齐。\",\n      \"position_description\": \"4号折弯板上的孔位。\",\n      \"parts_used\": [\n        {\n          \"bom_seq\": \"8\",\n          \"bom_name\": \"轴套 1\",\n          \"quantity\": 1,\n          \"drawing_number\": \"8\",\n          \"node_name\": [\n            \"NAUO14\"\n          ],\n          \"bom_code\": \"01.01.02.1221\"\n        }\n      ],\n      \"tools\": [\n        \"焊机\",\n        \"同轴度检测工具\"\n      ],\n      \"warnings\": [\n        \"轴套的焊接是关键工序，必须保证轴套的同轴度和垂直度，避免焊接变形。\",\n        \"焊接前清理轴套和折弯板的接触面。\"\n      ],\n      \"welding\": {\n        \"required\": true,\n        \"welding_type\": \"角焊（满焊）\",\n        \"welding_method\": \"CO2气保焊或手工电弧焊\",\n        \"weld_size\": \"焊脚高度5mm（图纸标注），环形连续焊\",\n        \"welding_position\": \"零件8（轴套）与零件4（折弯板）的连接处，环形平焊或横焊\",\n        \"quality_requirements\": \"焊缝均匀，保证轴套与折弯板的垂直度和同轴度，焊后需进行无损检测（如外观检查和渗透检测）\",\n        \"safety_notes\": \"轴套焊接容易产生热变形，应采用对称、短焊段焊接，并使用定位工装固定，防止轴线偏移\"\n      },\n      \"safety_warnings\": [\n        \"轴套焊接时应采用对称短焊段，防止热变形导致轴线偏移，造成工件报废。\",\n        \"使用定位工装固定轴套，防止焊接过程中轴套倾倒砸伤操作人员。\",\n        \"焊接完成后，轴套温度高，严禁徒手触摸，防止烫伤。\"\n      ]\n    },\n    {\n      \"step_number\": 9,\n      \"action\": \"安装轴套（9号）\",\n      \"description\": \"将图纸上标注为9号的后座轴套 1（01.02.02.0490）焊接到3号侧连接板的指定孔位上。轴套需与侧连接板的孔同轴对齐。\",\n      \"position_description\": \"3号侧连接板上的孔位。\",\n      \"parts_used\": [\n        {\n          \"bom_seq\": \"9\",\n          \"bom_name\": \"后座轴套 1\",\n          \"quantity\": 1,\n          \"drawing_number\": \"9\",\n          \"node_name\": [\n            \"NAUO15\"\n          ],\n          \"bom_code\": \"01.02.02.0490\"\n        }\n      ],\n      \"tools\": [\n        \"焊机\",\n        \"同轴度检测工具\"\n      ],\n      \"warnings\": [\n        \"确保轴套的焊接牢固，且轴线方向符合图纸要求。\",\n        \"焊接后检查轴套内径是否有焊渣飞溅。\"\n      ],\n      \"welding\": {\n        \"required\": true,\n        \"welding_type\": \"角焊（满焊）\",\n        \"welding_method\": \"CO2气保焊或手工电弧焊\",\n        \"weld_size\": \"焊脚高度5mm（图纸标注），环形连续焊\",\n        \"welding_position\": \"零件9（轴套）与零件3（侧连接板）的连接处，环形平焊或横焊\",\n        \"quality_requirements\": \"焊缝均匀，保证轴套与侧连接板的垂直度和同轴度，焊后需检查内孔无飞溅\",\n        \"safety_notes\": \"焊接时应在轴套内孔塞入防火材料或使用保护套，防止焊渣飞溅损伤内孔表面\"\n      },\n      \"safety_warnings\": [\n        \"焊接时应在轴套内孔塞入防火材料或保护套，防止焊渣飞溅烫伤或损伤内孔。\",\n        \"焊接完成后，使用专用工具清理焊渣，严禁使用手直接接触热焊渣。\",\n        \"确保焊接区域无积水，防止触电。\"\n      ]\n    },\n    {\n      \"step_number\": 10,\n      \"action\": \"安装轴套（10号）\",\n      \"description\": \"将图纸上标注为10号的后座轴套 1（01.01.02.0337）焊接到3号侧连接板的另一个指定孔位上。轴套需与侧连接板的孔同轴对齐。\",\n      \"position_description\": \"3号侧连接板上的另一个孔位。\",\n      \"parts_used\": [\n        {\n          \"bom_seq\": \"10\",\n          \"bom_name\": \"后座轴套 1\",\n          \"quantity\": 1,\n          \"drawing_number\": \"10\",\n          \"node_name\": [\n            \"NAUO18\"\n          ],\n          \"bom_code\": \"01.01.02.0337\"\n        }\n      ],\n      \"tools\": [\n        \"焊机\",\n        \"同轴度检测工具\"\n      ],\n      \"warnings\": [\n        \"此轴套与9号轴套需满足图纸上的相对位置和同轴度要求。\",\n        \"焊接完成后，对所有焊缝进行满焊处理，并清理焊渣。\"\n      ],\n      \"welding\": {\n        \"required\": true,\n        \"welding_type\": \"角焊（满焊）\",\n        \"welding_method\": \"CO2气保焊或手工电弧焊\",\n        \"weld_size\": \"焊脚高度5mm（图纸标注），环形连续焊\",\n        \"welding_position\": \"零件10（轴套）与零件3（侧连接板）的连接处，环形平焊或横焊\",\n        \"quality_requirements\": \"焊缝均匀，保证轴套与侧连接板的垂直度和同轴度，焊后需检查内孔无飞溅\",\n        \"safety_notes\": \"焊接完成后，应立即对轴套进行冷却处理，但不能骤冷，以减少残余应力\"\n      },\n      \"safety_warnings\": [\n        \"焊接完成后，轴套温度高，严禁使用水或湿布骤冷，防止产生蒸汽烫伤。\",\n        \"检查焊机电缆绝缘层，防止破损导致触电。\",\n        \"清理焊渣时佩戴防护眼镜，防止焊渣飞溅伤眼。\"\n      ]\n    },\n    {\n      \"step_number\": 11,\n      \"action\": \"最终焊接与清理\",\n      \"description\": \"对所有已点焊的零件连接处进行满焊处理，焊缝尺寸和质量需符合技术要求。焊接完成后，清理所有焊渣、飞溅物，并打磨尖锐边缘。\",\n      \"position_description\": \"所有零件连接处\",\n      \"parts_used\": [],\n      \"tools\": [\n        \"焊机\",\n        \"角磨机\",\n        \"钢丝刷\"\n      ],\n      \"warnings\": [\n        \"焊缝必须连续、饱满，无气孔、夹渣等缺陷。\",\n        \"打磨时注意保护轴套内孔，避免损伤。\"\n      ],\n      \"welding\": {\n        \"required\": true,\n        \"welding_type\": \"角焊（满焊）\",\n        \"welding_method\": \"CO2气保焊为主\",\n        \"weld_size\": \"焊脚高度5mm（图纸标注），全长连续焊\",\n        \"welding_position\": \"所有零件1、2、3、4、7的连接边缘，涉及平焊、横焊、立焊\",\n        \"quality_requirements\": \"焊缝外观等级达到二级标准，焊缝表面平整，过渡圆滑，无咬边、未焊透等缺陷。关键焊缝需进行磁粉检测（MT）\",\n        \"safety_notes\": \"进行大面积满焊时，必须确保工作区域通风系统全开，防止烟尘中毒。打磨时佩戴护目镜和防尘口罩\"\n      },\n      \"safety_warnings\": [\n        \"进行满焊时，必须确保工作区域通风系统全开，防止烟尘中毒。\",\n        \"使用角磨机打磨时，必须佩戴防护眼镜和防尘口罩，防止飞溅物和粉尘伤害。\",\n        \"角磨机操作时，双手握紧，站稳，防止磨片破碎或反弹伤人。\",\n        \"打磨完成后，清理工作台上的金属粉尘和焊渣，防止滑倒或火灾。\"\n      ]\n    }\n  ]\n}\n```",
  "parsed_result": {
    "enhanced_steps": [
      {
        "step_number": 1,
        "action": "放置基准件",
        "description": "将图纸上标注为1号的方形板-机加（01.01.01.11511）平稳放置在装配工作台上作为基准件，确保放置平稳。",
        "position_description": "工作台中心",
        "parts_used": [
          {
            "bom_seq": "1",
            "bom_name": "方形板-机加 1",
            "quantity": 1,
            "drawing_number": "1",
            "node_name": [
              "NAUO1"
            ],
            "bom_code": "01.01.01.11511"
          }
        ],
        "tools": [
          "行车（吊装）",
          "水平仪"
        ],
        "warnings": [
          "方形板较重，吊装时注意安全，确保吊装平稳。",
          "检查方形板表面无磕碰损伤。"
        ],
        "safety_warnings": [
          "吊装前检查吊索具是否完好，防止重物坠落砸伤。",
          "吊装区域内无关人员必须撤离，防止碰撞。",
          "指挥人员必须使用统一手势，确保吊装平稳、准确。"
        ]
      },
      {
        "step_number": 2,
        "action": "安装上连接板",
        "description": "将图纸上标注为2号的上连接板（01.01.01.11512）放置在1号方形板的顶部边缘，按照图纸尺寸定位。先进行点焊固定。",
        "position_description": "1号方形板的顶部边缘，两侧各一块，共2块。",
        "parts_used": [
          {
            "bom_seq": "2",
            "bom_name": "上连接板 2",
            "quantity": 2,
            "drawing_number": "2",
            "node_name": [
              "NAUO3",
              "NAUO2"
            ],
            "bom_code": "01.01.01.11512"
          }
        ],
        "tools": [
          "焊机（CO2保护焊）",
          "卷尺",
          "角尺"
        ],
        "warnings": [
          "点焊前必须确保2号上连接板与1号方形板的相对位置和角度准确。",
          "注意焊接烟尘防护。"
        ],
        "welding": {
          "required": true,
          "welding_type": "角焊（定位焊）",
          "welding_method": "CO2气保焊",
          "weld_size": "点焊长度10-15mm，焊脚高度约4mm",
          "welding_position": "零件1（方形板）与零件2（上连接板）的连接处，平焊",
          "quality_requirements": "点焊牢固，位置准确，焊点无裂纹",
          "safety_notes": "佩戴焊接面罩和防护手套，确保工作区域通风良好，防止火灾"
        },
        "safety_warnings": [
          "佩戴焊接面罩和防护手套，防止弧光灼伤眼睛和皮肤。",
          "确保焊机接地良好，防止触电。",
          "点焊区域周围3米内不得有易燃物，防止火灾。"
        ]
      },
      {
        "step_number": 3,
        "action": "安装侧连接板",
        "description": "将图纸上标注为3号的侧连接板（01.01.01.11513）分别放置在1号方形板的两侧，并与已点焊的2号上连接板对齐。按照图纸尺寸定位后，进行点焊固定。",
        "position_description": "1号方形板的两侧，与2号上连接板形成直角结构。",
        "parts_used": [
          {
            "bom_seq": "3",
            "bom_name": "侧连接板 2",
            "quantity": 2,
            "drawing_number": "3",
            "node_name": [
              "NAUO5",
              "NAUO4"
            ],
            "bom_code": "01.01.01.11513"
          }
        ],
        "tools": [
          "焊机",
          "角尺",
          "定位夹具"
        ],
        "warnings": [
          "确保3号侧连接板与1号方形板、2号上连接板的垂直度，使用角尺检查。",
          "点焊牢固，防止后续操作中零件移位。"
        ],
        "welding": {
          "required": true,
          "welding_type": "角焊（定位焊）",
          "welding_method": "CO2气保焊",
          "weld_size": "点焊长度10-15mm，焊脚高度约4mm",
          "welding_position": "零件1、2、3的连接处，平焊和横焊",
          "quality_requirements": "保证零件3与零件1、2的垂直度，点焊位置均匀分布",
          "safety_notes": "使用定位夹具固定零件，防止点焊时零件晃动，注意防弧光"
        },
        "safety_warnings": [
          "佩戴焊接面罩和防护手套，防止弧光和高温飞溅物烫伤。",
          "确保工作区域通风良好，防止焊接烟尘中毒。",
          "使用定位夹具时，注意夹紧力度，防止夹伤手指。"
        ]
      },
      {
        "step_number": 4,
        "action": "安装折弯板",
        "description": "将图纸上标注为4号的折弯板（01.01.01.11514）放置在1号方形板的后部上方，与2号上连接板和3号侧连接板的边缘对齐。定位准确后，进行点焊固定。",
        "position_description": "1号方形板后部上方，形成一个斜面结构。",
        "parts_used": [
          {
            "bom_seq": "4",
            "bom_name": "折弯板 1",
            "quantity": 1,
            "drawing_number": "4",
            "node_name": [
              "NAUO6"
            ],
            "bom_code": "01.01.01.11514"
          }
        ],
        "tools": [
          "焊机",
          "卷尺"
        ],
        "warnings": [
          "折弯板的安装位置是关键尺寸，必须严格按照图纸尺寸定位。",
          "注意折弯板的安装方向，确保孔位朝向正确。"
        ],
        "welding": {
          "required": true,
          "welding_type": "角焊（定位焊）",
          "welding_method": "CO2气保焊",
          "weld_size": "点焊长度10-15mm，焊脚高度约4mm",
          "welding_position": "零件4与零件1、2、3的连接边缘，多为平焊和横焊",
          "quality_requirements": "确保折弯板的斜面角度符合图纸要求，定位准确",
          "safety_notes": "点焊前检查焊机接地线连接可靠，避免触电风险"
        },
        "safety_warnings": [
          "佩戴焊接面罩和防护手套，防止弧光和高温飞溅物烫伤。",
          "点焊前检查焊机接地线连接可靠，避免触电风险。",
          "折弯板边缘可能锋利，搬运时佩戴防割手套，防止割伤。"
        ]
      },
      {
        "step_number": 5,
        "action": "安装油缸固定板",
        "description": "将图纸上标注为5号的油缸固定板（01.01.01.11515）分别焊接到3号侧连接板的外部指定位置。注意油缸固定板的安装方向和孔位对齐。",
        "position_description": "3号侧连接板外部，每块侧连接板上安装2块，共4块。",
        "parts_used": [
          {
            "bom_seq": "5",
            "bom_name": "油缸固定板 4",
            "quantity": 4,
            "drawing_number": "5",
            "node_name": [
              "NAUO17",
              "NAUO16",
              "NAUO8",
              "NAUO7"
            ],
            "bom_code": "01.01.01.11515"
          }
        ],
        "tools": [
          "焊机",
          "定位销"
        ],
        "warnings": [
          "油缸固定板的孔位必须与图纸上的尺寸要求一致，使用定位销辅助对齐。",
          "焊接时避免热变形影响孔位精度。"
        ],
        "welding": {
          "required": true,
          "welding_type": "角焊（满焊）",
          "welding_method": "CO2气保焊",
          "weld_size": "焊脚高度5mm（图纸标注），全长连续焊",
          "welding_position": "零件5（油缸固定板）与零件3（侧连接板）的连接边缘，多为平焊或横焊",
          "quality_requirements": "焊缝连续、饱满，无咬边、气孔等缺陷，焊后检查孔位精度",
          "safety_notes": "由于是满焊，注意控制焊接热输入，采用分段焊或跳焊，减少零件3的热变形"
        },
        "safety_warnings": [
          "进行满焊时，必须佩戴全套焊接防护用品，防止高温烫伤。",
          "注意控制焊接热输入，防止零件因热变形而翘曲或夹伤操作人员。",
          "确保焊接区域通风良好，防止烟尘浓度过高。"
        ]
      },
      {
        "step_number": 6,
        "action": "安装加强板",
        "description": "将图纸上标注为6号的加强板（01.01.01.11516）分别焊接到3号侧连接板的内部指定位置，用于结构加强。注意加强板与侧连接板的贴合度。",
        "position_description": "3号侧连接板内部，每块侧连接板上安装2块，共4块。",
        "parts_used": [
          {
            "bom_seq": "6",
            "bom_name": "加强板 4",
            "quantity": 4,
            "drawing_number": "6",
            "node_name": [
              "NAUO12",
              "NAUO11",
              "NAUO10",
              "NAUO9"
            ],
            "bom_code": "01.01.01.11516"
          }
        ],
        "tools": [
          "焊机",
          "压紧夹具"
        ],
        "warnings": [
          "加强板必须紧密贴合侧连接板，确保焊接强度。",
          "焊接顺序应采用跳焊，减少热应力集中。"
        ],
        "welding": {
          "required": true,
          "welding_type": "角焊（满焊）",
          "welding_method": "CO2气保焊",
          "weld_size": "焊脚高度5mm（图纸标注），全长连续焊",
          "welding_position": "零件6（加强板）与零件3（侧连接板）的连接边缘，多为平焊或横焊",
          "quality_requirements": "焊缝连续，保证贴合面无间隙，焊后清理焊渣",
          "safety_notes": "使用压紧夹具确保贴合紧密，防止焊接过程中加强板翘曲变形"
        },
        "safety_warnings": [
          "使用压紧夹具时，注意防止夹具弹开或夹伤手指。",
          "焊接时注意焊枪和焊丝的高温，防止烫伤。",
          "确保焊接电源线绝缘良好，避免漏电。"
        ]
      },
      {
        "step_number": 7,
        "action": "安装角钢",
        "description": "将图纸上标注为7号的角钢-机加（01.01.04.0592）焊接到1号方形板的指定位置，作为额外的支撑结构。",
        "position_description": "1号方形板的内部或底部指定位置。",
        "parts_used": [
          {
            "bom_seq": "7",
            "bom_name": "角钢-机加 1",
            "quantity": 1,
            "drawing_number": "7",
            "node_name": [
              "NAUO13"
            ],
            "bom_code": "01.01.04.0592"
          }
        ],
        "tools": [
          "焊机",
          "角尺"
        ],
        "warnings": [
          "角钢的焊接位置和角度必须符合图纸要求，确保支撑作用。",
          "检查角钢与方形板的接触面是否平整。"
        ],
        "welding": {
          "required": true,
          "welding_type": "角焊（满焊）",
          "welding_method": "CO2气保焊",
          "weld_size": "焊脚高度5mm（图纸标注），全长连续焊",
          "welding_position": "零件7（角钢）与零件1（方形板）的连接边缘，多为平焊",
          "quality_requirements": "焊缝均匀，保证角钢与方形板的垂直度或角度要求",
          "safety_notes": "焊接前清理角钢表面的油污和锈蚀，避免产生气孔"
        },
        "safety_warnings": [
          "角钢可能存在毛刺或尖锐边缘，搬运时佩戴防割手套。",
          "焊接前必须清理角钢表面的油污和锈蚀，防止焊接时产生有毒烟雾。",
          "确保灭火器材放置在触手可及的位置。"
        ]
      },
      {
        "step_number": 8,
        "action": "安装轴套（8号）",
        "description": "将图纸上标注为8号的轴套（01.01.02.1221）焊接到4号折弯板的指定孔位上。轴套需与折弯板的孔同轴对齐。",
        "position_description": "4号折弯板上的孔位。",
        "parts_used": [
          {
            "bom_seq": "8",
            "bom_name": "轴套 1",
            "quantity": 1,
            "drawing_number": "8",
            "node_name": [
              "NAUO14"
            ],
            "bom_code": "01.01.02.1221"
          }
        ],
        "tools": [
          "焊机",
          "同轴度检测工具"
        ],
        "warnings": [
          "轴套的焊接是关键工序，必须保证轴套的同轴度和垂直度，避免焊接变形。",
          "焊接前清理轴套和折弯板的接触面。"
        ],
        "welding": {
          "required": true,
          "welding_type": "角焊（满焊）",
          "welding_method": "CO2气保焊或手工电弧焊",
          "weld_size": "焊脚高度5mm（图纸标注），环形连续焊",
          "welding_position": "零件8（轴套）与零件4（折弯板）的连接处，环形平焊或横焊",
          "quality_requirements": "焊缝均匀，保证轴套与折弯板的垂直度和同轴度，焊后需进行无损检测（如外观检查和渗透检测）",
          "safety_notes": "轴套焊接容易产生热变形，应采用对称、短焊段焊接，并使用定位工装固定，防止轴线偏移"
        },
        "safety_warnings": [
          "轴套焊接时应采用对称短焊段，防止热变形导致轴线偏移，造成工件报废。",
          "使用定位工装固定轴套，防止焊接过程中轴套倾倒砸伤操作人员。",
          "焊接完成后，轴套温度高，严禁徒手触摸，防止烫伤。"
        ]
      },
      {
        "step_number": 9,
        "action": "安装轴套（9号）",
        "description": "将图纸上标注为9号的后座轴套 1（01.02.02.0490）焊接到3号侧连接板的指定孔位上。轴套需与侧连接板的孔同轴对齐。",
        "position_description": "3号侧连接板上的孔位。",
        "parts_used": [
          {
            "bom_seq": "9",
            "bom_name": "后座轴套 1",
            "quantity": 1,
            "drawing_number": "9",
            "node_name": [
              "NAUO15"
            ],
            "bom_code": "01.02.02.0490"
          }
        ],
        "tools": [
          "焊机",
          "同轴度检测工具"
        ],
        "warnings": [
          "确保轴套的焊接牢固，且轴线方向符合图纸要求。",
          "焊接后检查轴套内径是否有焊渣飞溅。"
        ],
        "welding": {
          "required": true,
          "welding_type": "角焊（满焊）",
          "welding_method": "CO2气保焊或手工电弧焊",
          "weld_size": "焊脚高度5mm（图纸标注），环形连续焊",
          "welding_position": "零件9（轴套）与零件3（侧连接板）的连接处，环形平焊或横焊",
          "quality_requirements": "焊缝均匀，保证轴套与侧连接板的垂直度和同轴度，焊后需检查内孔无飞溅",
          "safety_notes": "焊接时应在轴套内孔塞入防火材料或使用保护套，防止焊渣飞溅损伤内孔表面"
        },
        "safety_warnings": [
          "焊接时应在轴套内孔塞入防火材料或保护套，防止焊渣飞溅烫伤或损伤内孔。",
          "焊接完成后，使用专用工具清理焊渣，严禁使用手直接接触热焊渣。",
          "确保焊接区域无积水，防止触电。"
        ]
      },
      {
        "step_number": 10,
        "action": "安装轴套（10号）",
        "description": "将图纸上标注为10号的后座轴套 1（01.01.02.0337）焊接到3号侧连接板的另一个指定孔位上。轴套需与侧连接板的孔同轴对齐。",
        "position_description": "3号侧连接板上的另一个孔位。",
        "parts_used": [
          {
            "bom_seq": "10",
            "bom_name": "后座轴套 1",
            "quantity": 1,
            "drawing_number": "10",
            "node_name": [
              "NAUO18"
            ],
            "bom_code": "01.01.02.0337"
          }
        ],
        "tools": [
          "焊机",
          "同轴度检测工具"
        ],
        "warnings": [
          "此轴套与9号轴套需满足图纸上的相对位置和同轴度要求。",
          "焊接完成后，对所有焊缝进行满焊处理，并清理焊渣。"
        ],
        "welding": {
          "required": true,
          "welding_type": "角焊（满焊）",
          "welding_method": "CO2气保焊或手工电弧焊",
          "weld_size": "焊脚高度5mm（图纸标注），环形连续焊",
          "welding_position": "零件10（轴套）与零件3（侧连接板）的连接处，环形平焊或横焊",
          "quality_requirements": "焊缝均匀，保证轴套与侧连接板的垂直度和同轴度，焊后需检查内孔无飞溅",
          "safety_notes": "焊接完成后，应立即对轴套进行冷却处理，但不能骤冷，以减少残余应力"
        },
        "safety_warnings": [
          "焊接完成后，轴套温度高，严禁使用水或湿布骤冷，防止产生蒸汽烫伤。",
          "检查焊机电缆绝缘层，防止破损导致触电。",
          "清理焊渣时佩戴防护眼镜，防止焊渣飞溅伤眼。"
        ]
      },
      {
        "step_number": 11,
        "action": "最终焊接与清理",
        "description": "对所有已点焊的零件连接处进行满焊处理，焊缝尺寸和质量需符合技术要求。焊接完成后，清理所有焊渣、飞溅物，并打磨尖锐边缘。",
        "position_description": "所有零件连接处",
        "parts_used": [],
        "tools": [
          "焊机",
          "角磨机",
          "钢丝刷"
        ],
        "warnings": [
          "焊缝必须连续、饱满，无气孔、夹渣等缺陷。",
          "打磨时注意保护轴套内孔，避免损伤。"
        ],
        "welding": {
          "required": true,
          "welding_type": "角焊（满焊）",
          "welding_method": "CO2气保焊为主",
          "weld_size": "焊脚高度5mm（图纸标注），全长连续焊",
          "welding_position": "所有零件1、2、3、4、7的连接边缘，涉及平焊、横焊、立焊",
          "quality_requirements": "焊缝外观等级达到二级标准，焊缝表面平整，过渡圆滑，无咬边、未焊透等缺陷。关键焊缝需进行磁粉检测（MT）",
          "safety_notes": "进行大面积满焊时，必须确保工作区域通风系统全开，防止烟尘中毒。打磨时佩戴护目镜和防尘口罩"
        },
        "safety_warnings": [
          "进行满焊时，必须确保工作区域通风系统全开，防止烟尘中毒。",
          "使用角磨机打磨时，必须佩戴防护眼镜和防尘口罩，防止飞溅物和粉尘伤害。",
          "角磨机操作时，双手握紧，站稳，防止磨片破碎或反弹伤人。",
          "打磨完成后，清理工作台上的金属粉尘和焊渣，防止滑倒或火灾。"
        ]
      }
    ]
  }
}