{
  "agent_name": "Agent6_FAQ",
  "model": "google/gemini-2.5-flash-preview-09-2025",
  "timestamp": "20251104_142818",
  "image_count": 0,
  "temperature": 0.2,
  "system_prompt": "# 角色定位\n\n你是**李师傅**，一位拥有20年安全管理经验的高级安全工程师。\n\n## 教育背景\n\n- **学历**：安全工程专业本科\n- **职业资格**：注册安全工程师、高级安全评价师\n- **专业培训**：\n  - 机械制造安全管理\n  - 职业健康与安全管理体系（ISO 45001）\n  - 事故调查与分析\n  - 应急预案编制与演练\n\n## 职业背景\n\n- **工作经历**：20年机械制造企业安全管理经验，参与过大型装备制造、钢结构加工等项目\n- **专业领域**：\n  - 机械加工安全（车、铣、刨、磨、钻等）\n  - 焊接作业安全（电焊、气焊、氩弧焊等）\n  - 起重吊装安全（行车、叉车、吊索具等）\n  - 高空作业安全（脚手架、安全带、防坠落等）\n  - 个人防护用品管理（安全帽、防护眼镜、手套、安全鞋等）\n\n## 知识结构（详细）\n\n### 1. 机械伤害风险\n- **夹伤/挤伤**：手指、手臂被运动部件夹住\n- **切割伤**：锋利边缘、毛刺、切削工具\n- **碰撞伤**：头部碰撞、身体碰撞\n- **坠落伤**：零件坠落、工具坠落、人员坠落\n\n### 2. 焊接作业风险\n- **电击伤**：焊机漏电、接地不良\n- **弧光伤**：电弧紫外线灼伤眼睛和皮肤\n- **烫伤**：高温熔池、焊渣飞溅\n- **火灾爆炸**：易燃物引燃、气瓶泄漏\n- **有毒气体**：焊接烟尘、一氧化碳中毒\n\n### 3. 起重吊装风险\n- **吊物坠落**：吊索具断裂、捆绑不牢\n- **吊物摆动**：碰撞人员、设备\n- **超载**：超过起重机额定载荷\n- **指挥失误**：信号不清、违章指挥\n\n### 4. 高空作业风险\n- **人员坠落**：未系安全带、脚手架不牢\n- **物体打击**：工具、零件从高处坠落\n- **脚手架坍塌**：搭设不规范、超载\n\n### 5. 个人防护用品\n- **头部防护**：安全帽（防止碰撞、坠物打击）\n- **眼部防护**：防护眼镜、焊接面罩（防止飞溅、弧光）\n- **手部防护**：防护手套（防止切割、烫伤、化学品）\n- **足部防护**：安全鞋（防砸、防刺穿、防滑）\n- **呼吸防护**：防尘口罩、防毒面具（防止粉尘、有毒气体）\n\n### 6. 应急处理\n- **机械伤害**：立即停机、呼救、止血、固定、送医\n- **电击伤**：切断电源、心肺复苏、送医\n- **烫伤**：冷水冲洗、覆盖无菌纱布、送医\n- **火灾**：使用灭火器、疏散人员、报警\n\n## 任务步骤（Chain of Thought）\n\n你的任务是**为每个装配步骤添加安全警告**（如果该步骤有安全风险）。请按照以下5个步骤思考：\n\n### 步骤1：识别风险步骤\n- 分析每个装配步骤的操作内容\n- 判断是否涉及高风险作业（焊接、吊装、高空、重物搬运等）\n- 识别潜在的伤害类型（机械伤害、电击、烫伤、坠落等）\n\n### 步骤2：分析风险源\n- 确定风险的来源（设备、工具、材料、环境、人员操作等）\n- 评估风险的严重程度（轻微、中等、严重、致命）\n- 考虑风险的发生概率\n\n### 步骤3：制定预防措施\n- 针对每个风险源，制定具体的预防措施\n- 强调个人防护用品的使用\n- 强调安全操作规程的遵守\n\n### 步骤4：添加安全警告\n- 为每个有风险的步骤添加safety_warnings字段\n- 每条警告要简洁明了，说明具体的风险和预防措施\n- 使用工人能看懂的语言\n\n### 步骤5：验证完整性\n- 检查所有高风险步骤是否都添加了安全警告\n- 检查安全警告是否具体、可操作\n- 检查是否遗漏了任何潜在风险\n\n## 核心原则\n\n1. **步骤级嵌入**：为每个有风险的步骤添加safety_warnings字段，而不是单独列出安全警告\n2. **工人友好**：使用通俗语言，避免专业术语\n3. **具体可操作**：说明具体的风险和预防措施，而不是泛泛而谈\n4. **不重复显示**：安全警告只在下方\"安全\"标签页中统一显示，不在当前步骤详情中重复显示\n\n## 输出格式\n\n严格按照以下JSON格式输出（返回增强后的装配步骤）：\n\n```json\n{\n  \"enhanced_steps\": [\n    {\n      \"step_number\": 1,\n      \"title\": \"点焊定位\",\n      \"parts_used\": [...],\n      \"tools_required\": [...],\n      \"operation\": \"操作说明\",\n      \"quality_check\": \"质量检查\",\n      \"estimated_time_minutes\": 10,\n      \"welding\": {\n        \"required\": true,\n        \"welding_type\": \"点焊\",\n        \"welding_method\": \"CO2气保焊\",\n        ...\n      },\n      \"safety_warnings\": [\n        \"佩戴焊接面罩和防护手套，防止弧光灼伤眼睛和皮肤\",\n        \"确保工件夹紧牢固，防止点焊时位移造成伤害\",\n        \"焊接区域周围3米内不得有易燃物，配备灭火器\",\n        \"焊机必须接地良好，防止漏电触电\"\n      ]\n    },\n    {\n      \"step_number\": 2,\n      \"title\": \"螺栓连接\",\n      \"parts_used\": [...],\n      \"operation\": \"操作说明\",\n      \"quality_check\": \"质量检查\",\n      \"estimated_time_minutes\": 15,\n      \"safety_warnings\": [\n        \"佩戴安全帽和防护眼镜，防止零件坠落和飞溅\",\n        \"使用扭力扳手时注意力度，防止扳手滑脱伤人\"\n      ]\n    },\n    {\n      \"step_number\": 3,\n      \"title\": \"简单装配\",\n      \"parts_used\": [...],\n      \"operation\": \"操作说明\",\n      \"quality_check\": \"质量检查\",\n      \"estimated_time_minutes\": 5\n      // ⚠️ 如果没有明显安全风险，不添加safety_warnings字段\n    }\n  ]\n}\n```\n\n**⚠️ 关键要求**：\n\n1. **步骤级嵌入**：\n   - 为每个有风险的步骤添加`safety_warnings`字段\n   - 没有明显风险的步骤不添加`safety_warnings`字段\n   - 保持原有步骤的所有字段不变\n\n2. **安全警告要具体**：\n   - ✅ 说\"佩戴焊接面罩和防护手套，防止弧光灼伤眼睛和皮肤\"\n   - ❌ 不说\"注意安全\"\n   - ✅ 说\"焊接区域周围3米内不得有易燃物，配备灭火器\"\n   - ❌ 不说\"注意防火\"\n\n3. **使用通俗语言**：\n   - 工人能看懂的语言\n   - 避免专业术语和英文缩写\n\n4. **警告要全面**：\n   - 涵盖个人防护、设备安全、环境安全、操作安全\n   - 每条警告说明具体的风险和预防措施\n\n## 重要提醒\n\n- **只输出JSON，不要输出其他内容**\n- **保持原有字段不变**：不要修改或删除原有的字段（包括welding字段）\n- **警告要简洁明了**：每条警告一句话，说明风险和预防措施\n- **不要过度警告**：只针对有明显风险的步骤添加警告\n",
  "user_query": "请为以下装配步骤添加安全警告（如果有安全风险）。\n\n## 📸 视觉分析任务\n\n**你会看到工程图纸图片，请仔细观察：**\n\n1. **危险作业标识**：\n   - 图纸上的安全警告标识\n   - 特殊作业要求（如高空作业、吊装作业等）\n   - 危险区域标注\n\n2. **零件特征**：\n   - 重型零件（需要吊装）\n   - 锋利边缘（容易割伤）\n   - 高温部件（容易烫伤）\n\n3. **作业环境**：\n   - 狭窄空间（容易碰撞）\n   - 高空位置（容易坠落）\n   - 密闭空间（通风不良）\n\n## 装配步骤\n\n[\n  {\n    \"step_number\": 1,\n    \"action\": \"放置基准件并安装悬挂臂板\",\n    \"description\": \"将图纸上标注为3的方管-机加（基准件）平稳放置在装配胎具上。然后，将图纸上标注为1的右悬挂臂板和标注为2的左悬挂臂板分别对齐焊接到3号方管的两端。\",\n    \"position_description\": \"1号板和2号板分别位于3号方管的两端，确保其安装孔位朝向正确。\",\n    \"parts_used\": [\n      {\n        \"bom_seq\": \"3\",\n        \"bom_name\": \"方管-机加\",\n        \"quantity\": 1,\n        \"drawing_number\": \"3\",\n        \"node_name\": [\n          \"NAUO6\",\n          \"NAUO5\"\n        ],\n        \"bom_code\": \"01.01.4792\"\n      },\n      {\n        \"bom_seq\": \"1\",\n        \"bom_name\": \"右悬挂臂板\",\n        \"quantity\": 1,\n        \"drawing_number\": \"1\",\n        \"node_name\": [\n          \"NAUO2\",\n          \"NAUO1\"\n        ],\n        \"bom_code\": \"01.01.03.0692\"\n      },\n      {\n        \"bom_seq\": \"2\",\n        \"bom_name\": \"左悬挂臂板\",\n        \"quantity\": 1,\n        \"drawing_number\": \"2\",\n        \"node_name\": [\n          \"NAUO4\",\n          \"NAUO3\"\n        ],\n        \"bom_code\": \"01.01.03.0693\"\n      }\n    ],\n    \"tools\": [\n      \"行车/吊具\",\n      \"装配胎具\",\n      \"焊机（CO2焊）\",\n      \"角尺\"\n    ],\n    \"warnings\": [\n      \"焊接前必须点焊定位，确保1号和2号板与3号方管的垂直度。\",\n      \"检查1号和2号板的安装面是否在同一平面内。\"\n    ],\n    \"welding\": {\n      \"required\": true,\n      \"welding_type\": \"角焊\",\n      \"welding_method\": \"CO2气保焊\",\n      \"weld_size\": \"焊缝高度6mm，全周连续焊\",\n      \"welding_position\": \"零件1（右悬挂臂板）和零件2（左悬挂臂板）与零件3（方管-机加）的连接处，主要为平焊和横焊\",\n      \"quality_requirements\": \"焊缝外观均匀，无咬边、气孔、夹渣等缺陷。焊后检查垂直度，公差需满足图纸要求。\",\n      \"safety_notes\": \"佩戴焊接面罩、防护手套和防护服。确保工作区域通风良好，防止焊接烟尘吸入。检查焊机接地线是否牢固。\"\n    }\n  },\n  {\n    \"step_number\": 2,\n    \"action\": \"安装旋转弧板\",\n    \"description\": \"将图纸上标注为7的旋转弧板（共2件）对称地焊接到3号方管的中间位置。旋转弧板的安装位置和角度必须严格按照图纸尺寸要求，确保其中心孔与方管中心线对齐。\",\n    \"position_description\": \"7号旋转弧板位于3号方管的中间，两侧各一块，与1号和2号悬挂臂板保持一定间距。\",\n    \"parts_used\": [\n      {\n        \"bom_seq\": \"7\",\n        \"bom_name\": \"旋转弧板\",\n        \"quantity\": 2,\n        \"drawing_number\": \"7\",\n        \"node_name\": [\n          \"NAUO12\"\n        ],\n        \"bom_code\": \"01.01.01.1590\"\n      }\n    ],\n    \"tools\": [\n      \"焊机（CO2焊）\",\n      \"卷尺\",\n      \"卡尺\"\n    ],\n    \"warnings\": [\n      \"旋转弧板的焊接位置是关键尺寸，必须精确测量定位。\",\n      \"焊接时注意防止热变形，采用对称焊接顺序。\"\n    ],\n    \"welding\": {\n      \"required\": true,\n      \"welding_type\": \"角焊\",\n      \"welding_method\": \"CO2气保焊\",\n      \"weld_size\": \"焊缝高度5mm，连续焊\",\n      \"welding_position\": \"零件7（旋转弧板）与零件3（方管-机加）的连接处，主要为平焊和立焊\",\n      \"quality_requirements\": \"焊缝必须连续且饱满，焊后清理焊渣。关键尺寸（如中心距）偏差不得超过0.5mm。\",\n      \"safety_notes\": \"采用对称、分段、跳焊的顺序，以减少热输入和变形。焊接前清理坡口和油污，防止产生气孔。\"\n    }\n  },\n  {\n    \"step_number\": 3,\n    \"action\": \"安装底部加强件\",\n    \"description\": \"将图纸上标注为5的方管-机加（共2件）和标注为6的方形板（共2件）焊接到3号方管的底部。5号方管用于加强结构，6号方形板用于连接。\",\n    \"position_description\": \"5号方管和6号方形板位于3号方管的底部，靠近两侧悬挂臂板的位置。\",\n    \"parts_used\": [\n      {\n        \"bom_seq\": \"5\",\n        \"bom_name\": \"方管-机加\",\n        \"quantity\": 2,\n        \"drawing_number\": \"5\",\n        \"node_name\": [\n          \"NAUO10\"\n        ],\n        \"bom_code\": \"01.02.02.0446\"\n      },\n      {\n        \"bom_seq\": \"6\",\n        \"bom_name\": \"方形板\",\n        \"quantity\": 2,\n        \"drawing_number\": \"6\",\n        \"node_name\": [\n          \"NAUO11\"\n        ],\n        \"bom_code\": \"01.01.01.1589\"\n      }\n    ],\n    \"tools\": [\n      \"焊机（CO2焊）\",\n      \"卡尺\"\n    ],\n    \"warnings\": [\n      \"确保5号方管和6号方形板与3号方管的接触面完全贴合，焊缝饱满。\"\n    ],\n    \"welding\": {\n      \"required\": true,\n      \"welding_type\": \"角焊\",\n      \"welding_method\": \"CO2气保焊\",\n      \"weld_size\": \"焊缝高度4mm，连续焊\",\n      \"welding_position\": \"零件5（方管-机加）和零件6（方形板）与零件3（方管-机加）的连接处，主要为仰焊和横焊\",\n      \"quality_requirements\": \"焊缝必须连续，特别是仰焊位置，要控制熔池，防止焊瘤和烧穿。焊缝表面平整，无未熔合。\",\n      \"safety_notes\": \"仰焊操作时，注意防止高温熔渣和火花溅落，必须穿戴好全套防护装备，包括头罩和加厚手套。\"\n    }\n  },\n  {\n    \"step_number\": 4,\n    \"action\": \"安装轴套和固定套\",\n    \"description\": \"将图纸上标注为9的轴套（共1件）和标注为8的固定套（共1件）分别焊接到1号和2号悬挂臂板的指定孔位上。轴套和固定套的中心线必须与悬挂臂板的孔中心线严格对齐。\",\n    \"position_description\": \"9号轴套和8号固定套安装在1号和2号悬挂臂板的下部，用于后续连接。\",\n    \"parts_used\": [\n      {\n        \"bom_seq\": \"9\",\n        \"bom_name\": \"轴套\",\n        \"quantity\": 1,\n        \"drawing_number\": \"9\",\n        \"node_name\": [\n          \"NAUO14\"\n        ],\n        \"bom_code\": \"01.01.01.1591\"\n      },\n      {\n        \"bom_seq\": \"8\",\n        \"bom_name\": \"固定套\",\n        \"quantity\": 1,\n        \"drawing_number\": \"8\",\n        \"node_name\": [\n          \"NAUO15\",\n          \"NAUO13\"\n        ],\n        \"bom_code\": \"01.01.01.1593\"\n      }\n    ],\n    \"tools\": [\n      \"焊机（CO2焊）\",\n      \"塞尺\",\n      \"卡尺\"\n    ],\n    \"warnings\": [\n      \"轴套和固定套的焊接必须保证同轴度，避免后续装配干涉。\",\n      \"焊接时注意保护轴套内孔，防止焊渣飞溅。\"\n    ],\n    \"welding\": {\n      \"required\": true,\n      \"welding_type\": \"角焊/环形焊\",\n      \"welding_method\": \"CO2气保焊\",\n      \"weld_size\": \"焊缝高度4mm，环形连续焊\",\n      \"welding_position\": \"零件9（轴套）和零件8（固定套）与悬挂臂板（零件1/2）的连接处，主要为平焊或横焊\",\n      \"quality_requirements\": \"焊缝必须环形连续，无漏焊。焊接完成后，使用塞尺或量具检查轴套内孔的变形和同轴度，确保精度。\",\n      \"safety_notes\": \"由于轴套是精密配合件，焊接时应采用小电流、多层焊，并严格控制预热温度，防止热变形过大。焊接前用堵头保护内孔。\"\n    }\n  },\n  {\n    \"step_number\": 5,\n    \"action\": \"安装角钢和剩余方管\",\n    \"description\": \"将BOM序号4的角钢（共5件）和BOM序号11的方形板（共1件）焊接到主框架的加强位置。同时，将BOM序号1的方管（共1件）和BOM序号2的方管（共1件）焊接到主框架的指定位置，用于结构支撑。\",\n    \"position_description\": \"4号角钢、11号方形板、1号方管和2号方管用于加强主框架的整体刚性，具体位置参照图纸未标注的细节视图。\",\n    \"parts_used\": [\n      {\n        \"bom_seq\": \"4\",\n        \"bom_name\": \"角钢\",\n        \"quantity\": 5,\n        \"drawing_number\": \"4\",\n        \"node_name\": [\n          \"NAUO8\",\n          \"NAUO7\"\n        ],\n        \"bom_code\": \"01.02.01.3875\"\n      },\n      {\n        \"bom_seq\": \"11\",\n        \"bom_name\": \"方形板\",\n        \"quantity\": 1,\n        \"drawing_number\": \"未标注\",\n        \"node_name\": [\n          \"NAUO23\",\n          \"NAUO22\",\n          \"NAUO21\",\n          \"NAUO20\"\n        ],\n        \"bom_code\": \"01.01.01.3941\"\n      },\n      {\n        \"bom_seq\": \"1\",\n        \"bom_name\": \"方管\",\n        \"quantity\": 1,\n        \"drawing_number\": \"未标注\",\n        \"node_name\": [\n          \"NAUO2\",\n          \"NAUO1\"\n        ],\n        \"bom_code\": \"01.01.03.0692\"\n      },\n      {\n        \"bom_seq\": \"2\",\n        \"bom_name\": \"方管\",\n        \"quantity\": 1,\n        \"drawing_number\": \"未标注\",\n        \"node_name\": [\n          \"NAUO4\",\n          \"NAUO3\"\n        ],\n        \"bom_code\": \"01.01.03.0693\"\n      }\n    ],\n    \"tools\": [\n      \"焊机（CO2焊）\",\n      \"卷尺\"\n    ],\n    \"warnings\": [\n      \"确保所有加强件的焊接位置准确，焊缝连续且无气孔。\"\n    ],\n    \"welding\": {\n      \"required\": true,\n      \"welding_type\": \"角焊\",\n      \"welding_method\": \"CO2气保焊\",\n      \"weld_size\": \"焊缝高度5mm，间断焊或连续焊（按图纸要求）\",\n      \"welding_position\": \"零件4（角钢）、零件11（方形板）和零件1/2（方管）与主框架（零件3）的连接处，涉及平焊、横焊和立焊\",\n      \"quality_requirements\": \"焊缝应均匀过渡，特别是角钢与方管的连接处，应保证足够的熔深。焊后清理焊渣，检查是否有裂纹。\",\n      \"safety_notes\": \"在进行立焊操作时，应调整好焊接角度和速度，防止焊缝金属下淌。注意周围环境的防火安全。\"\n    }\n  },\n  {\n    \"step_number\": 6,\n    \"action\": \"安装连接板和侧板\",\n    \"description\": \"将BOM序号3的中侧板（共1件）、BOM序号4的中连接板（共1件）、BOM序号6的左连接器板（共1件）、BOM序号9的右连接器板（共1件）和BOM序号10的三角板（共1件）焊接到主框架的相应位置。\",\n    \"position_description\": \"这些板件主要集中在主框架的中间和两侧，用于连接其他组件或提供支撑。\",\n    \"parts_used\": [\n      {\n        \"bom_seq\": \"3\",\n        \"bom_name\": \"中侧板\",\n        \"quantity\": 1,\n        \"drawing_number\": \"未标注\",\n        \"node_name\": [\n          \"NAUO6\",\n          \"NAUO5\"\n        ],\n        \"bom_code\": \"01.01.4792\"\n      },\n      {\n        \"bom_seq\": \"4\",\n        \"bom_name\": \"中连接板\",\n        \"quantity\": 1,\n        \"drawing_number\": \"未标注\",\n        \"node_name\": [\n          \"NAUO8\",\n          \"NAUO7\"\n        ],\n        \"bom_code\": \"01.02.01.3875\"\n      },\n      {\n        \"bom_seq\": \"6\",\n        \"bom_name\": \"左连接器板\",\n        \"quantity\": 1,\n        \"drawing_number\": \"未标注\",\n        \"node_name\": [\n          \"NAUO11\"\n        ],\n        \"bom_code\": \"01.01.01.1589\"\n      },\n      {\n        \"bom_seq\": \"9\",\n        \"bom_name\": \"右连接器板\",\n        \"quantity\": 1,\n        \"drawing_number\": \"未标注\",\n        \"node_name\": [\n          \"NAUO14\"\n        ],\n        \"bom_code\": \"01.01.01.1591\"\n      },\n      {\n        \"bom_seq\": \"10\",\n        \"bom_name\": \"三角板\",\n        \"quantity\": 1,\n        \"drawing_number\": \"未标注\",\n        \"node_name\": [\n          \"NAUO19\",\n          \"NAUO18\",\n          \"NAUO17\",\n          \"NAUO16\"\n        ],\n        \"bom_code\": \"01.01.01.1626\"\n      }\n    ],\n    \"tools\": [\n      \"焊机（CO2焊）\",\n      \"夹具\"\n    ],\n    \"warnings\": [\n      \"连接板的安装位置精度要求高，必须使用夹具固定后焊接。\"\n    ],\n    \"welding\": {\n      \"required\": true,\n      \"welding_type\": \"角焊\",\n      \"welding_method\": \"CO2气保焊\",\n      \"weld_size\": \"焊缝高度4mm，连续焊\",\n      \"welding_position\": \"所有连接板和侧板与主框架的连接面，涉及平焊、横焊和立焊\",\n      \"quality_requirements\": \"所有连接板的焊缝必须连续，保证结构强度。焊缝应平滑，无飞溅残留。焊后需进行外观检查，确保无未焊透。\",\n      \"safety_notes\": \"使用夹具固定板件时，确保夹具与焊接区域保持安全距离，防止夹具被焊住。注意电缆的绝缘保护，避免漏电。\"\n    }\n  },\n  {\n    \"step_number\": 7,\n    \"action\": \"安装上挂板、方形板-机加和防滑板\",\n    \"description\": \"将BOM序号7的上挂板（共1件）、BOM序号8的方形板-机加（共1件）和BOM序号12的防滑板（共1件）焊接到主框架的顶部和底部。\",\n    \"position_description\": \"7号上挂板位于顶部，用于吊装或连接；8号方形板-机加和12号防滑板位于底部或侧面，用于加强或功能性用途。\",\n    \"parts_used\": [\n      {\n        \"bom_seq\": \"7\",\n        \"bom_name\": \"上挂板\",\n        \"quantity\": 1,\n        \"drawing_number\": \"未标注\",\n        \"node_name\": [\n          \"NAUO12\"\n        ],\n        \"bom_code\": \"01.01.01.1590\"\n      },\n      {\n        \"bom_seq\": \"8\",\n        \"bom_name\": \"方形板-机加\",\n        \"quantity\": 1,\n        \"drawing_number\": \"未标注\",\n        \"node_name\": [\n          \"NAUO15\",\n          \"NAUO13\"\n        ],\n        \"bom_code\": \"01.01.01.1593\"\n      },\n      {\n        \"bom_seq\": \"12\",\n        \"bom_name\": \"防滑板\",\n        \"quantity\": 1,\n        \"drawing_number\": \"未标注\",\n        \"node_name\": [\n          \"NAUO25\",\n          \"NAUO24\"\n        ],\n        \"bom_code\": \"01.01.0517\"\n      }\n    ],\n    \"tools\": [\n      \"焊机（CO2焊）\"\n    ],\n    \"warnings\": [\n      \"防滑板的焊接面应平整，确保防滑效果。\"\n    ],\n    \"welding\": {\n      \"required\": true,\n      \"welding_type\": \"角焊\",\n      \"welding_method\": \"CO2气保焊\",\n      \"weld_size\": \"焊缝高度5mm（上挂板），4mm（防滑板），连续焊\",\n      \"welding_position\": \"零件7（上挂板）与主框架顶部连接处，零件12（防滑板）与主框架底部连接处，主要为平焊和仰焊\",\n      \"quality_requirements\": \"上挂板焊缝要求高，必须连续且无缺陷，必要时进行磁粉检测（MT）。防滑板焊缝应均匀，保证贴合度。\",\n      \"safety_notes\": \"上挂板是受力件，焊接完成后应缓慢冷却，避免产生应力裂纹。焊接防滑板时，注意板材较薄，控制电流，防止烧穿。\"\n    }\n  }\n]\n\n## 要求\n\n请按照以下5个步骤思考，为装配步骤添加安全警告：\n\n### 步骤1：识别风险步骤\n- 分析每个装配步骤的操作内容\n- 判断是否涉及高风险作业：\n  * **焊接作业**：电击、弧光、烫伤、火灾\n  * **吊装作业**：吊物坠落、碰撞、超载\n  * **高空作业**：人员坠落、物体打击\n  * **重物搬运**：砸伤、扭伤、夹伤\n  * **机械加工**：切割伤、夹伤、碰撞\n\n### 步骤2：分析风险源\n- 确定风险的来源（设备、工具、材料、环境、人员操作等）\n- 评估风险的严重程度（轻微、中等、严重、致命）\n- 考虑风险的发生概率\n\n### 步骤3：制定预防措施\n- 针对每个风险源，制定具体的预防措施\n- 强调个人防护用品的使用：\n  * **焊接**：焊接面罩、防护手套、防护服\n  * **吊装**：安全帽、安全鞋、手套\n  * **高空**：安全带、安全帽、防滑鞋\n  * **机械**：防护眼镜、手套、安全鞋\n\n### 步骤4：添加安全警告\n- 为每个有风险的步骤添加safety_warnings字段\n- 每条警告要简洁明了，说明具体的风险和预防措施\n- 使用工人能看懂的语言\n\n### 步骤5：验证完整性\n- 检查所有高风险步骤是否都添加了安全警告\n- 检查安全警告是否具体、可操作\n- 检查是否遗漏了任何潜在风险\n\n## ⚠️ 强制自检清单（生成后必须逐项检查）\n\n**在输出JSON之前，你必须完成以下验证：**\n\n1. **风险步骤识别验证**：\n   - [ ] 所有涉及焊接、吊装、高空、重物搬运的步骤都添加了safety_warnings字段\n   - [ ] 没有明显风险的步骤没有添加safety_warnings字段\n\n2. **安全警告完整性验证**：\n   - [ ] 每个safety_warnings字段都是字符串数组\n   - [ ] 每条警告都说明了具体的风险和预防措施\n   - [ ] 涵盖了个人防护、设备安全、环境安全、操作安全\n\n3. **语言通俗性验证**：\n   - [ ] 使用工人能看懂的语言\n   - [ ] 避免专业术语和英文缩写\n   - [ ] 每条警告简洁明了（一句话）\n\n4. **原有字段保持验证**：\n   - [ ] 原有步骤的所有字段都保持不变（包括welding字段）\n   - [ ] 没有修改或删除任何原有字段\n\n**如果自检发现任何问题，必须重新生成！**\n\n现在开始为装配步骤添加安全警告！\n",
  "raw_response": "```json\n{\n  \"enhanced_steps\": [\n    {\n      \"step_number\": 1,\n      \"action\": \"放置基准件并安装悬挂臂板\",\n      \"description\": \"将图纸上标注为3的方管-机加（基准件）平稳放置在装配胎具上。然后，将图纸上标注为1的右悬挂臂板和标注为2的左悬挂臂板分别对齐焊接到3号方管的两端。\",\n      \"position_description\": \"1号板和2号板分别位于3号方管的两端，确保其安装孔位朝向正确。\",\n      \"parts_used\": [\n        {\n          \"bom_seq\": \"3\",\n          \"bom_name\": \"方管-机加\",\n          \"quantity\": 1,\n          \"drawing_number\": \"3\",\n          \"node_name\": [\n            \"NAUO6\",\n            \"NAUO5\"\n          ],\n          \"bom_code\": \"01.01.4792\"\n        },\n        {\n          \"bom_seq\": \"1\",\n          \"bom_name\": \"右悬挂臂板\",\n          \"quantity\": 1,\n          \"drawing_number\": \"1\",\n          \"node_name\": [\n            \"NAUO2\",\n            \"NAUO1\"\n          ],\n          \"bom_code\": \"01.01.03.0692\"\n        },\n        {\n          \"bom_seq\": \"2\",\n          \"bom_name\": \"左悬挂臂板\",\n          \"quantity\": 1,\n          \"drawing_number\": \"2\",\n          \"node_name\": [\n            \"NAUO4\",\n            \"NAUO3\"\n          ],\n          \"bom_code\": \"01.01.03.0693\"\n        }\n      ],\n      \"tools\": [\n        \"行车/吊具\",\n        \"装配胎具\",\n        \"焊机（CO2焊）\",\n        \"角尺\"\n      ],\n      \"warnings\": [\n        \"焊接前必须点焊定位，确保1号和2号板与3号方管的垂直度。\",\n        \"检查1号和2号板的安装面是否在同一平面内。\"\n      ],\n      \"welding\": {\n        \"required\": true,\n        \"welding_type\": \"角焊\",\n        \"welding_method\": \"CO2气保焊\",\n        \"weld_size\": \"焊缝高度6mm，全周连续焊\",\n        \"welding_position\": \"零件1（右悬挂臂板）和零件2（左悬挂臂板）与零件3（方管-机加）的连接处，主要为平焊和横焊\",\n        \"quality_requirements\": \"焊缝外观均匀，无咬边、气孔、夹渣等缺陷。焊后检查垂直度，公差需满足图纸要求。\",\n        \"safety_notes\": \"佩戴焊接面罩、防护手套和防护服。确保工作区域通风良好，防止焊接烟尘吸入。检查焊机接地线是否牢固。\"\n      },\n      \"safety_warnings\": [\n        \"吊装基准件（方管）时，必须使用行车和合格吊具，防止吊物坠落伤人\",\n        \"佩戴安全帽、安全鞋和防护手套，防止重物砸伤和割伤\",\n        \"进行CO2焊接作业时，必须佩戴焊接面罩、防护手套和防护服，防止弧光灼伤和烫伤\",\n        \"确保焊机接地线连接可靠，防止触电事故\",\n        \"焊接区域必须清理干净，周围3米内不得有易燃易爆物品\"\n      ]\n    },\n    {\n      \"step_number\": 2,\n      \"action\": \"安装旋转弧板\",\n      \"description\": \"将图纸上标注为7的旋转弧板（共2件）对称地焊接到3号方管的中间位置。旋转弧板的安装位置和角度必须严格按照图纸尺寸要求，确保其中心孔与方管中心线对齐。\",\n      \"position_description\": \"7号旋转弧板位于3号方管的中间，两侧各一块，与1号和2号悬挂臂板保持一定间距。\",\n      \"parts_used\": [\n        {\n          \"bom_seq\": \"7\",\n          \"bom_name\": \"旋转弧板\",\n          \"quantity\": 2,\n          \"drawing_number\": \"7\",\n          \"node_name\": [\n            \"NAUO12\"\n          ],\n          \"bom_code\": \"01.01.01.1590\"\n        }\n      ],\n      \"tools\": [\n        \"焊机（CO2焊）\",\n        \"卷尺\",\n        \"卡尺\"\n      ],\n      \"warnings\": [\n        \"旋转弧板的焊接位置是关键尺寸，必须精确测量定位。\",\n        \"焊接时注意防止热变形，采用对称焊接顺序。\"\n      ],\n      \"welding\": {\n        \"required\": true,\n        \"welding_type\": \"角焊\",\n        \"welding_method\": \"CO2气保焊\",\n        \"weld_size\": \"焊缝高度5mm，连续焊\",\n        \"welding_position\": \"零件7（旋转弧板）与零件3（方管-机加）的连接处，主要为平焊和立焊\",\n        \"quality_requirements\": \"焊缝必须连续且饱满，焊后清理焊渣。关键尺寸（如中心距）偏差不得超过0.5mm。\",\n        \"safety_notes\": \"采用对称、分段、跳焊的顺序，以减少热输入和变形。焊接前清理坡口和油污，防止产生气孔。\"\n      },\n      \"safety_warnings\": [\n        \"进行CO2焊接作业时，必须佩戴焊接面罩、防护手套和防护服，防止弧光灼伤和烫伤\",\n        \"焊接时注意防止高温焊渣飞溅，确保周围无人员靠近\",\n        \"焊接立焊位置时，注意控制熔池，防止焊瘤和烫伤\"\n      ]\n    },\n    {\n      \"step_number\": 3,\n      \"action\": \"安装底部加强件\",\n      \"description\": \"将图纸上标注为5的方管-机加（共2件）和标注为6的方形板（共2件）焊接到3号方管的底部。5号方管用于加强结构，6号方形板用于连接。\",\n      \"position_description\": \"5号方管和6号方形板位于3号方管的底部，靠近两侧悬挂臂板的位置。\",\n      \"parts_used\": [\n        {\n          \"bom_seq\": \"5\",\n          \"bom_name\": \"方管-机加\",\n          \"quantity\": 2,\n          \"drawing_number\": \"5\",\n          \"node_name\": [\n            \"NAUO10\"\n          ],\n          \"bom_code\": \"01.02.02.0446\"\n        },\n        {\n          \"bom_seq\": \"6\",\n          \"bom_name\": \"方形板\",\n          \"quantity\": 2,\n          \"drawing_number\": \"6\",\n          \"node_name\": [\n            \"NAUO11\"\n          ],\n          \"bom_code\": \"01.01.01.1589\"\n        }\n      ],\n      \"tools\": [\n        \"焊机（CO2焊）\",\n        \"卡尺\"\n      ],\n      \"warnings\": [\n        \"确保5号方管和6号方形板与3号方管的接触面完全贴合，焊缝饱满。\"\n      ],\n      \"welding\": {\n        \"required\": true,\n        \"welding_type\": \"角焊\",\n        \"welding_method\": \"CO2气保焊\",\n        \"weld_size\": \"焊缝高度4mm，连续焊\",\n        \"welding_position\": \"零件5（方管-机加）和零件6（方形板）与零件3（方管-机加）的连接处，主要为仰焊和横焊\",\n        \"quality_requirements\": \"焊缝必须连续，特别是仰焊位置，要控制熔池，防止焊瘤和烧穿。焊缝表面平整，无未熔合。\",\n        \"safety_notes\": \"仰焊操作时，注意防止高温熔渣和火花溅落，必须穿戴好全套防护装备，包括头罩和加厚手套。\"\n      },\n      \"safety_warnings\": [\n        \"进行仰焊操作时，必须穿戴好全套防护装备（头罩、加厚手套、防护服），防止高温熔渣和火花溅落烫伤\",\n        \"操作前检查焊机和电缆绝缘情况，防止在仰焊时因姿势不当造成触电\",\n        \"确保工作区域通风良好，仰焊时烟尘较大，必要时使用局部排风设备\"\n      ]\n    },\n    {\n      \"step_number\": 4,\n      \"action\": \"安装轴套和固定套\",\n      \"description\": \"将图纸上标注为9的轴套（共1件）和标注为8的固定套（共1件）分别焊接到1号和2号悬挂臂板的指定孔位上。轴套和固定套的中心线必须与悬挂臂板的孔中心线严格对齐。\",\n      \"position_description\": \"9号轴套和8号固定套安装在1号和2号悬挂臂板的下部，用于后续连接。\",\n      \"parts_used\": [\n        {\n          \"bom_seq\": \"9\",\n          \"bom_name\": \"轴套\",\n          \"quantity\": 1,\n          \"drawing_number\": \"9\",\n          \"node_name\": [\n            \"NAUO14\"\n          ],\n          \"bom_code\": \"01.01.01.1591\"\n        },\n        {\n          \"bom_seq\": \"8\",\n          \"bom_name\": \"固定套\",\n          \"quantity\": 1,\n          \"drawing_number\": \"8\",\n          \"node_name\": [\n            \"NAUO15\",\n            \"NAUO13\"\n          ],\n          \"bom_code\": \"01.01.01.1593\"\n        }\n      ],\n      \"tools\": [\n        \"焊机（CO2焊）\",\n        \"塞尺\",\n        \"卡尺\"\n      ],\n      \"warnings\": [\n        \"轴套和固定套的焊接必须保证同轴度，避免后续装配干涉。\",\n        \"焊接时注意保护轴套内孔，防止焊渣飞溅。\"\n      ],\n      \"welding\": {\n        \"required\": true,\n        \"welding_type\": \"角焊/环形焊\",\n        \"welding_method\": \"CO2气保焊\",\n        \"weld_size\": \"焊缝高度4mm，环形连续焊\",\n        \"welding_position\": \"零件9（轴套）和零件8（固定套）与悬挂臂板（零件1/2）的连接处，主要为平焊或横焊\",\n        \"quality_requirements\": \"焊缝必须环形连续，无漏焊。焊接完成后，使用塞尺或量具检查轴套内孔的变形和同轴度，确保精度。\",\n        \"safety_notes\": \"由于轴套是精密配合件，焊接时应采用小电流、多层焊，并严格控制预热温度，防止热变形过大。焊接前用堵头保护内孔。\"\n      },\n      \"safety_warnings\": [\n        \"焊接前必须使用堵头或耐热胶带保护轴套内孔，防止焊渣飞溅进入，造成后续装配困难或机械伤害\",\n        \"环形焊接时，注意焊枪移动速度均匀，防止焊缝不连续或烧穿\",\n        \"焊接完成后，轴套温度较高，禁止徒手触摸，防止烫伤\"\n      ]\n    },\n    {\n      \"step_number\": 5,\n      \"action\": \"安装角钢和剩余方管\",\n      \"description\": \"将BOM序号4的角钢（共5件）和BOM序号11的方形板（共1件）焊接到主框架的加强位置。同时，将BOM序号1的方管（共1件）和BOM序号2的方管（共1件）焊接到主框架的指定位置，用于结构支撑。\",\n      \"position_description\": \"4号角钢、11号方形板、1号方管和2号方管用于加强主框架的整体刚性，具体位置参照图纸未标注的细节视图。\",\n      \"parts_used\": [\n        {\n          \"bom_seq\": \"4\",\n          \"bom_name\": \"角钢\",\n          \"quantity\": 5,\n          \"drawing_number\": \"4\",\n          \"node_name\": [\n            \"NAUO8\",\n            \"NAUO7\"\n          ],\n          \"bom_code\": \"01.02.01.3875\"\n        },\n        {\n          \"bom_seq\": \"11\",\n          \"bom_name\": \"方形板\",\n          \"quantity\": 1,\n          \"drawing_number\": \"未标注\",\n          \"node_name\": [\n            \"NAUO23\",\n            \"NAUO22\",\n            \"NAUO21\",\n            \"NAUO20\"\n          ],\n          \"bom_code\": \"01.01.01.3941\"\n        },\n        {\n          \"bom_seq\": \"1\",\n          \"bom_name\": \"方管\",\n          \"quantity\": 1,\n          \"drawing_number\": \"未标注\",\n          \"node_name\": [\n            \"NAUO2\",\n            \"NAUO1\"\n          ],\n          \"bom_code\": \"01.01.03.0692\"\n        },\n        {\n          \"bom_seq\": \"2\",\n          \"bom_name\": \"方管\",\n          \"quantity\": 1,\n          \"drawing_number\": \"未标注\",\n          \"node_name\": [\n            \"NAUO4\",\n            \"NAUO3\"\n          ],\n          \"bom_code\": \"01.01.03.0693\"\n        }\n      ],\n      \"tools\": [\n        \"焊机（CO2焊）\",\n        \"卷尺\"\n      ],\n      \"warnings\": [\n        \"确保所有加强件的焊接位置准确，焊缝连续且无气孔。\"\n      ],\n      \"welding\": {\n        \"required\": true,\n        \"welding_type\": \"角焊\",\n        \"welding_method\": \"CO2气保焊\",\n        \"weld_size\": \"焊缝高度5mm，间断焊或连续焊（按图纸要求）\",\n        \"welding_position\": \"零件4（角钢）、零件11（方形板）和零件1/2（方管）与主框架（零件3）的连接处，涉及平焊、横焊和立焊\",\n        \"quality_requirements\": \"焊缝应均匀过渡，特别是角钢与方管的连接处，应保证足够的熔深。焊后清理焊渣，检查是否有裂纹。\",\n        \"safety_notes\": \"在进行立焊操作时，应调整好焊接角度和速度，防止焊缝金属下淌。注意周围环境的防火安全。\"\n      },\n      \"safety_warnings\": [\n        \"角钢和方形板边缘可能锋利，搬运和定位时必须佩戴防割手套，防止割伤\",\n        \"进行立焊操作时，注意调整焊接参数，防止焊缝金属下淌造成烫伤\",\n        \"焊接完成后，及时清理焊渣和飞溅物，防止人员滑倒或被尖锐物刺伤\"\n      ]\n    },\n    {\n      \"step_number\": 6,\n      \"action\": \"安装连接板和侧板\",\n      \"description\": \"将BOM序号3的中侧板（共1件）、BOM序号4的中连接板（共1件）、BOM序号6的左连接器板（共1件）、BOM序号9的右连接器板（共1件）和BOM序号10的三角板（共1件）焊接到主框架的相应位置。\",\n      \"position_description\": \"这些板件主要集中在主框架的中间和两侧，用于连接其他组件或提供支撑。\",\n      \"parts_used\": [\n        {\n          \"bom_seq\": \"3\",\n          \"bom_name\": \"中侧板\",\n          \"quantity\": 1,\n          \"drawing_number\": \"未标注\",\n          \"node_name\": [\n            \"NAUO6\",\n            \"NAUO5\"\n          ],\n          \"bom_code\": \"01.01.4792\"\n        },\n        {\n          \"bom_seq\": \"4\",\n          \"bom_name\": \"中连接板\",\n          \"quantity\": 1,\n          \"drawing_number\": \"未标注\",\n          \"node_name\": [\n            \"NAUO8\",\n            \"NAUO7\"\n          ],\n          \"bom_code\": \"01.02.01.3875\"\n        },\n        {\n          \"bom_seq\": \"6\",\n          \"bom_name\": \"左连接器板\",\n          \"quantity\": 1,\n          \"drawing_number\": \"未标注\",\n          \"node_name\": [\n            \"NAUO11\"\n          ],\n          \"bom_code\": \"01.01.01.1589\"\n        },\n        {\n          \"bom_seq\": \"9\",\n          \"bom_name\": \"右连接器板\",\n          \"quantity\": 1,\n          \"drawing_number\": \"未标注\",\n          \"node_name\": [\n            \"NAUO14\"\n          ],\n          \"bom_code\": \"01.01.01.1591\"\n        },\n        {\n          \"bom_seq\": \"10\",\n          \"bom_name\": \"三角板\",\n          \"quantity\": 1,\n          \"drawing_number\": \"未标注\",\n          \"node_name\": [\n            \"NAUO19\",\n            \"NAUO18\",\n            \"NAUO17\",\n            \"NAUO16\"\n          ],\n          \"bom_code\": \"01.01.01.1626\"\n        }\n      ],\n      \"tools\": [\n        \"焊机（CO2焊）\",\n        \"夹具\"\n      ],\n      \"warnings\": [\n        \"连接板的安装位置精度要求高，必须使用夹具固定后焊接。\"\n      ],\n      \"welding\": {\n        \"required\": true,\n        \"welding_type\": \"角焊\",\n        \"welding_method\": \"CO2气保焊\",\n        \"weld_size\": \"焊缝高度4mm，连续焊\",\n        \"welding_position\": \"所有连接板和侧板与主框架的连接面，涉及平焊、横焊和立焊\",\n        \"quality_requirements\": \"所有连接板的焊缝必须连续，保证结构强度。焊缝应平滑，无飞溅残留。焊后需进行外观检查，确保无未焊透。\",\n        \"safety_notes\": \"使用夹具固定板件时，确保夹具与焊接区域保持安全距离，防止夹具被焊住。注意电缆的绝缘保护，避免漏电。\"\n      },\n      \"safety_warnings\": [\n        \"使用夹具固定板件时，注意防止夹手或夹伤手指\",\n        \"焊接时，确保焊机电缆和气管没有被重物碾压或被高温烫伤，防止漏电或漏气\",\n        \"板件边缘可能锋利，操作时佩戴防护手套，防止割伤\"\n      ]\n    },\n    {\n      \"step_number\": 7,\n      \"action\": \"安装上挂板、方形板-机加和防滑板\",\n      \"description\": \"将BOM序号7的上挂板（共1件）、BOM序号8的方形板-机加（共1件）和BOM序号12的防滑板（共1件）焊接到主框架的顶部和底部。\",\n      \"position_description\": \"7号上挂板位于顶部，用于吊装或连接；8号方形板-机加和12号防滑板位于底部或侧面，用于加强或功能性用途。\",\n      \"parts_used\": [\n        {\n          \"bom_seq\": \"7\",\n          \"bom_name\": \"上挂板\",\n          \"quantity\": 1,\n          \"drawing_number\": \"未标注\",\n          \"node_name\": [\n            \"NAUO12\"\n          ],\n          \"bom_code\": \"01.01.01.1590\"\n        },\n        {\n          \"bom_seq\": \"8\",\n          \"bom_name\": \"方形板-机加\",\n          \"quantity\": 1,\n          \"drawing_number\": \"未标注\",\n          \"node_name\": [\n            \"NAUO15\",\n            \"NAUO13\"\n          ],\n          \"bom_code\": \"01.01.01.1593\"\n        },\n        {\n          \"bom_seq\": \"12\",\n          \"bom_name\": \"防滑板\",\n          \"quantity\": 1,\n          \"drawing_number\": \"未标注\",\n          \"node_name\": [\n            \"NAUO25\",\n            \"NAUO24\"\n          ],\n          \"bom_code\": \"01.01.0517\"\n        }\n      ],\n      \"tools\": [\n        \"焊机（CO2焊）\"\n      ],\n      \"warnings\": [\n        \"防滑板的焊接面应平整，确保防滑效果。\"\n      ],\n      \"welding\": {\n        \"required\": true,\n        \"welding_type\": \"角焊\",\n        \"welding_method\": \"CO2气保焊\",\n        \"weld_size\": \"焊缝高度5mm（上挂板），4mm（防滑板），连续焊\",\n        \"welding_position\": \"零件7（上挂板）与主框架顶部连接处，零件12（防滑板）与主框架底部连接处，主要为平焊和仰焊\",\n        \"quality_requirements\": \"上挂板焊缝要求高，必须连续且无缺陷，必要时进行磁粉检测（MT）。防滑板焊缝应均匀，保证贴合度。\",\n        \"safety_notes\": \"上挂板是受力件，焊接完成后应缓慢冷却，避免产生应力裂纹。焊接防滑板时，注意板材较薄，控制电流，防止烧穿。\"\n      },\n      \"safety_warnings\": [\n        \"上挂板是吊装受力点，焊接质量要求极高，必须严格按照工艺要求施焊，防止吊装时断裂造成重大事故\",\n        \"焊接防滑板时，板材较薄，应控制电流防止烧穿，同时注意防止高温烫伤\",\n        \"焊接完成后，上挂板和防滑板温度较高，应设置警示标识，防止人员误触烫伤\"\n      ]\n    }\n  ]\n}\n```",
  "parsed_result": {
    "enhanced_steps": [
      {
        "step_number": 1,
        "action": "放置基准件并安装悬挂臂板",
        "description": "将图纸上标注为3的方管-机加（基准件）平稳放置在装配胎具上。然后，将图纸上标注为1的右悬挂臂板和标注为2的左悬挂臂板分别对齐焊接到3号方管的两端。",
        "position_description": "1号板和2号板分别位于3号方管的两端，确保其安装孔位朝向正确。",
        "parts_used": [
          {
            "bom_seq": "3",
            "bom_name": "方管-机加",
            "quantity": 1,
            "drawing_number": "3",
            "node_name": [
              "NAUO6",
              "NAUO5"
            ],
            "bom_code": "01.01.4792"
          },
          {
            "bom_seq": "1",
            "bom_name": "右悬挂臂板",
            "quantity": 1,
            "drawing_number": "1",
            "node_name": [
              "NAUO2",
              "NAUO1"
            ],
            "bom_code": "01.01.03.0692"
          },
          {
            "bom_seq": "2",
            "bom_name": "左悬挂臂板",
            "quantity": 1,
            "drawing_number": "2",
            "node_name": [
              "NAUO4",
              "NAUO3"
            ],
            "bom_code": "01.01.03.0693"
          }
        ],
        "tools": [
          "行车/吊具",
          "装配胎具",
          "焊机（CO2焊）",
          "角尺"
        ],
        "warnings": [
          "焊接前必须点焊定位，确保1号和2号板与3号方管的垂直度。",
          "检查1号和2号板的安装面是否在同一平面内。"
        ],
        "welding": {
          "required": true,
          "welding_type": "角焊",
          "welding_method": "CO2气保焊",
          "weld_size": "焊缝高度6mm，全周连续焊",
          "welding_position": "零件1（右悬挂臂板）和零件2（左悬挂臂板）与零件3（方管-机加）的连接处，主要为平焊和横焊",
          "quality_requirements": "焊缝外观均匀，无咬边、气孔、夹渣等缺陷。焊后检查垂直度，公差需满足图纸要求。",
          "safety_notes": "佩戴焊接面罩、防护手套和防护服。确保工作区域通风良好，防止焊接烟尘吸入。检查焊机接地线是否牢固。"
        },
        "safety_warnings": [
          "吊装基准件（方管）时，必须使用行车和合格吊具，防止吊物坠落伤人",
          "佩戴安全帽、安全鞋和防护手套，防止重物砸伤和割伤",
          "进行CO2焊接作业时，必须佩戴焊接面罩、防护手套和防护服，防止弧光灼伤和烫伤",
          "确保焊机接地线连接可靠，防止触电事故",
          "焊接区域必须清理干净，周围3米内不得有易燃易爆物品"
        ]
      },
      {
        "step_number": 2,
        "action": "安装旋转弧板",
        "description": "将图纸上标注为7的旋转弧板（共2件）对称地焊接到3号方管的中间位置。旋转弧板的安装位置和角度必须严格按照图纸尺寸要求，确保其中心孔与方管中心线对齐。",
        "position_description": "7号旋转弧板位于3号方管的中间，两侧各一块，与1号和2号悬挂臂板保持一定间距。",
        "parts_used": [
          {
            "bom_seq": "7",
            "bom_name": "旋转弧板",
            "quantity": 2,
            "drawing_number": "7",
            "node_name": [
              "NAUO12"
            ],
            "bom_code": "01.01.01.1590"
          }
        ],
        "tools": [
          "焊机（CO2焊）",
          "卷尺",
          "卡尺"
        ],
        "warnings": [
          "旋转弧板的焊接位置是关键尺寸，必须精确测量定位。",
          "焊接时注意防止热变形，采用对称焊接顺序。"
        ],
        "welding": {
          "required": true,
          "welding_type": "角焊",
          "welding_method": "CO2气保焊",
          "weld_size": "焊缝高度5mm，连续焊",
          "welding_position": "零件7（旋转弧板）与零件3（方管-机加）的连接处，主要为平焊和立焊",
          "quality_requirements": "焊缝必须连续且饱满，焊后清理焊渣。关键尺寸（如中心距）偏差不得超过0.5mm。",
          "safety_notes": "采用对称、分段、跳焊的顺序，以减少热输入和变形。焊接前清理坡口和油污，防止产生气孔。"
        },
        "safety_warnings": [
          "进行CO2焊接作业时，必须佩戴焊接面罩、防护手套和防护服，防止弧光灼伤和烫伤",
          "焊接时注意防止高温焊渣飞溅，确保周围无人员靠近",
          "焊接立焊位置时，注意控制熔池，防止焊瘤和烫伤"
        ]
      },
      {
        "step_number": 3,
        "action": "安装底部加强件",
        "description": "将图纸上标注为5的方管-机加（共2件）和标注为6的方形板（共2件）焊接到3号方管的底部。5号方管用于加强结构，6号方形板用于连接。",
        "position_description": "5号方管和6号方形板位于3号方管的底部，靠近两侧悬挂臂板的位置。",
        "parts_used": [
          {
            "bom_seq": "5",
            "bom_name": "方管-机加",
            "quantity": 2,
            "drawing_number": "5",
            "node_name": [
              "NAUO10"
            ],
            "bom_code": "01.02.02.0446"
          },
          {
            "bom_seq": "6",
            "bom_name": "方形板",
            "quantity": 2,
            "drawing_number": "6",
            "node_name": [
              "NAUO11"
            ],
            "bom_code": "01.01.01.1589"
          }
        ],
        "tools": [
          "焊机（CO2焊）",
          "卡尺"
        ],
        "warnings": [
          "确保5号方管和6号方形板与3号方管的接触面完全贴合，焊缝饱满。"
        ],
        "welding": {
          "required": true,
          "welding_type": "角焊",
          "welding_method": "CO2气保焊",
          "weld_size": "焊缝高度4mm，连续焊",
          "welding_position": "零件5（方管-机加）和零件6（方形板）与零件3（方管-机加）的连接处，主要为仰焊和横焊",
          "quality_requirements": "焊缝必须连续，特别是仰焊位置，要控制熔池，防止焊瘤和烧穿。焊缝表面平整，无未熔合。",
          "safety_notes": "仰焊操作时，注意防止高温熔渣和火花溅落，必须穿戴好全套防护装备，包括头罩和加厚手套。"
        },
        "safety_warnings": [
          "进行仰焊操作时，必须穿戴好全套防护装备（头罩、加厚手套、防护服），防止高温熔渣和火花溅落烫伤",
          "操作前检查焊机和电缆绝缘情况，防止在仰焊时因姿势不当造成触电",
          "确保工作区域通风良好，仰焊时烟尘较大，必要时使用局部排风设备"
        ]
      },
      {
        "step_number": 4,
        "action": "安装轴套和固定套",
        "description": "将图纸上标注为9的轴套（共1件）和标注为8的固定套（共1件）分别焊接到1号和2号悬挂臂板的指定孔位上。轴套和固定套的中心线必须与悬挂臂板的孔中心线严格对齐。",
        "position_description": "9号轴套和8号固定套安装在1号和2号悬挂臂板的下部，用于后续连接。",
        "parts_used": [
          {
            "bom_seq": "9",
            "bom_name": "轴套",
            "quantity": 1,
            "drawing_number": "9",
            "node_name": [
              "NAUO14"
            ],
            "bom_code": "01.01.01.1591"
          },
          {
            "bom_seq": "8",
            "bom_name": "固定套",
            "quantity": 1,
            "drawing_number": "8",
            "node_name": [
              "NAUO15",
              "NAUO13"
            ],
            "bom_code": "01.01.01.1593"
          }
        ],
        "tools": [
          "焊机（CO2焊）",
          "塞尺",
          "卡尺"
        ],
        "warnings": [
          "轴套和固定套的焊接必须保证同轴度，避免后续装配干涉。",
          "焊接时注意保护轴套内孔，防止焊渣飞溅。"
        ],
        "welding": {
          "required": true,
          "welding_type": "角焊/环形焊",
          "welding_method": "CO2气保焊",
          "weld_size": "焊缝高度4mm，环形连续焊",
          "welding_position": "零件9（轴套）和零件8（固定套）与悬挂臂板（零件1/2）的连接处，主要为平焊或横焊",
          "quality_requirements": "焊缝必须环形连续，无漏焊。焊接完成后，使用塞尺或量具检查轴套内孔的变形和同轴度，确保精度。",
          "safety_notes": "由于轴套是精密配合件，焊接时应采用小电流、多层焊，并严格控制预热温度，防止热变形过大。焊接前用堵头保护内孔。"
        },
        "safety_warnings": [
          "焊接前必须使用堵头或耐热胶带保护轴套内孔，防止焊渣飞溅进入，造成后续装配困难或机械伤害",
          "环形焊接时，注意焊枪移动速度均匀，防止焊缝不连续或烧穿",
          "焊接完成后，轴套温度较高，禁止徒手触摸，防止烫伤"
        ]
      },
      {
        "step_number": 5,
        "action": "安装角钢和剩余方管",
        "description": "将BOM序号4的角钢（共5件）和BOM序号11的方形板（共1件）焊接到主框架的加强位置。同时，将BOM序号1的方管（共1件）和BOM序号2的方管（共1件）焊接到主框架的指定位置，用于结构支撑。",
        "position_description": "4号角钢、11号方形板、1号方管和2号方管用于加强主框架的整体刚性，具体位置参照图纸未标注的细节视图。",
        "parts_used": [
          {
            "bom_seq": "4",
            "bom_name": "角钢",
            "quantity": 5,
            "drawing_number": "4",
            "node_name": [
              "NAUO8",
              "NAUO7"
            ],
            "bom_code": "01.02.01.3875"
          },
          {
            "bom_seq": "11",
            "bom_name": "方形板",
            "quantity": 1,
            "drawing_number": "未标注",
            "node_name": [
              "NAUO23",
              "NAUO22",
              "NAUO21",
              "NAUO20"
            ],
            "bom_code": "01.01.01.3941"
          },
          {
            "bom_seq": "1",
            "bom_name": "方管",
            "quantity": 1,
            "drawing_number": "未标注",
            "node_name": [
              "NAUO2",
              "NAUO1"
            ],
            "bom_code": "01.01.03.0692"
          },
          {
            "bom_seq": "2",
            "bom_name": "方管",
            "quantity": 1,
            "drawing_number": "未标注",
            "node_name": [
              "NAUO4",
              "NAUO3"
            ],
            "bom_code": "01.01.03.0693"
          }
        ],
        "tools": [
          "焊机（CO2焊）",
          "卷尺"
        ],
        "warnings": [
          "确保所有加强件的焊接位置准确，焊缝连续且无气孔。"
        ],
        "welding": {
          "required": true,
          "welding_type": "角焊",
          "welding_method": "CO2气保焊",
          "weld_size": "焊缝高度5mm，间断焊或连续焊（按图纸要求）",
          "welding_position": "零件4（角钢）、零件11（方形板）和零件1/2（方管）与主框架（零件3）的连接处，涉及平焊、横焊和立焊",
          "quality_requirements": "焊缝应均匀过渡，特别是角钢与方管的连接处，应保证足够的熔深。焊后清理焊渣，检查是否有裂纹。",
          "safety_notes": "在进行立焊操作时，应调整好焊接角度和速度，防止焊缝金属下淌。注意周围环境的防火安全。"
        },
        "safety_warnings": [
          "角钢和方形板边缘可能锋利，搬运和定位时必须佩戴防割手套，防止割伤",
          "进行立焊操作时，注意调整焊接参数，防止焊缝金属下淌造成烫伤",
          "焊接完成后，及时清理焊渣和飞溅物，防止人员滑倒或被尖锐物刺伤"
        ]
      },
      {
        "step_number": 6,
        "action": "安装连接板和侧板",
        "description": "将BOM序号3的中侧板（共1件）、BOM序号4的中连接板（共1件）、BOM序号6的左连接器板（共1件）、BOM序号9的右连接器板（共1件）和BOM序号10的三角板（共1件）焊接到主框架的相应位置。",
        "position_description": "这些板件主要集中在主框架的中间和两侧，用于连接其他组件或提供支撑。",
        "parts_used": [
          {
            "bom_seq": "3",
            "bom_name": "中侧板",
            "quantity": 1,
            "drawing_number": "未标注",
            "node_name": [
              "NAUO6",
              "NAUO5"
            ],
            "bom_code": "01.01.4792"
          },
          {
            "bom_seq": "4",
            "bom_name": "中连接板",
            "quantity": 1,
            "drawing_number": "未标注",
            "node_name": [
              "NAUO8",
              "NAUO7"
            ],
            "bom_code": "01.02.01.3875"
          },
          {
            "bom_seq": "6",
            "bom_name": "左连接器板",
            "quantity": 1,
            "drawing_number": "未标注",
            "node_name": [
              "NAUO11"
            ],
            "bom_code": "01.01.01.1589"
          },
          {
            "bom_seq": "9",
            "bom_name": "右连接器板",
            "quantity": 1,
            "drawing_number": "未标注",
            "node_name": [
              "NAUO14"
            ],
            "bom_code": "01.01.01.1591"
          },
          {
            "bom_seq": "10",
            "bom_name": "三角板",
            "quantity": 1,
            "drawing_number": "未标注",
            "node_name": [
              "NAUO19",
              "NAUO18",
              "NAUO17",
              "NAUO16"
            ],
            "bom_code": "01.01.01.1626"
          }
        ],
        "tools": [
          "焊机（CO2焊）",
          "夹具"
        ],
        "warnings": [
          "连接板的安装位置精度要求高，必须使用夹具固定后焊接。"
        ],
        "welding": {
          "required": true,
          "welding_type": "角焊",
          "welding_method": "CO2气保焊",
          "weld_size": "焊缝高度4mm，连续焊",
          "welding_position": "所有连接板和侧板与主框架的连接面，涉及平焊、横焊和立焊",
          "quality_requirements": "所有连接板的焊缝必须连续，保证结构强度。焊缝应平滑，无飞溅残留。焊后需进行外观检查，确保无未焊透。",
          "safety_notes": "使用夹具固定板件时，确保夹具与焊接区域保持安全距离，防止夹具被焊住。注意电缆的绝缘保护，避免漏电。"
        },
        "safety_warnings": [
          "使用夹具固定板件时，注意防止夹手或夹伤手指",
          "焊接时，确保焊机电缆和气管没有被重物碾压或被高温烫伤，防止漏电或漏气",
          "板件边缘可能锋利，操作时佩戴防护手套，防止割伤"
        ]
      },
      {
        "step_number": 7,
        "action": "安装上挂板、方形板-机加和防滑板",
        "description": "将BOM序号7的上挂板（共1件）、BOM序号8的方形板-机加（共1件）和BOM序号12的防滑板（共1件）焊接到主框架的顶部和底部。",
        "position_description": "7号上挂板位于顶部，用于吊装或连接；8号方形板-机加和12号防滑板位于底部或侧面，用于加强或功能性用途。",
        "parts_used": [
          {
            "bom_seq": "7",
            "bom_name": "上挂板",
            "quantity": 1,
            "drawing_number": "未标注",
            "node_name": [
              "NAUO12"
            ],
            "bom_code": "01.01.01.1590"
          },
          {
            "bom_seq": "8",
            "bom_name": "方形板-机加",
            "quantity": 1,
            "drawing_number": "未标注",
            "node_name": [
              "NAUO15",
              "NAUO13"
            ],
            "bom_code": "01.01.01.1593"
          },
          {
            "bom_seq": "12",
            "bom_name": "防滑板",
            "quantity": 1,
            "drawing_number": "未标注",
            "node_name": [
              "NAUO25",
              "NAUO24"
            ],
            "bom_code": "01.01.0517"
          }
        ],
        "tools": [
          "焊机（CO2焊）"
        ],
        "warnings": [
          "防滑板的焊接面应平整，确保防滑效果。"
        ],
        "welding": {
          "required": true,
          "welding_type": "角焊",
          "welding_method": "CO2气保焊",
          "weld_size": "焊缝高度5mm（上挂板），4mm（防滑板），连续焊",
          "welding_position": "零件7（上挂板）与主框架顶部连接处，零件12（防滑板）与主框架底部连接处，主要为平焊和仰焊",
          "quality_requirements": "上挂板焊缝要求高，必须连续且无缺陷，必要时进行磁粉检测（MT）。防滑板焊缝应均匀，保证贴合度。",
          "safety_notes": "上挂板是受力件，焊接完成后应缓慢冷却，避免产生应力裂纹。焊接防滑板时，注意板材较薄，控制电流，防止烧穿。"
        },
        "safety_warnings": [
          "上挂板是吊装受力点，焊接质量要求极高，必须严格按照工艺要求施焊，防止吊装时断裂造成重大事故",
          "焊接防滑板时，板材较薄，应控制电流防止烧穿，同时注意防止高温烫伤",
          "焊接完成后，上挂板和防滑板温度较高，应设置警示标识，防止人员误触烫伤"
        ]
      }
    ]
  }
}