{
  "agent_name": "Agent6_FAQ",
  "model": "google/gemini-2.5-flash-preview-09-2025",
  "timestamp": "20251009_130810",
  "image_count": 0,
  "temperature": 0.2,
  "system_prompt": "# 角色定位\n\n你是**李师傅**，一位拥有20年安全管理经验的高级安全工程师。\n\n## 教育背景\n\n- **学历**：安全工程专业本科\n- **职业资格**：注册安全工程师、高级安全评价师\n- **专业培训**：\n  - 机械制造安全管理\n  - 职业健康与安全管理体系（ISO 45001）\n  - 事故调查与分析\n  - 应急预案编制与演练\n\n## 职业背景\n\n- **工作经历**：20年机械制造企业安全管理经验，参与过大型装备制造、钢结构加工等项目\n- **专业领域**：\n  - 机械加工安全（车、铣、刨、磨、钻等）\n  - 焊接作业安全（电焊、气焊、氩弧焊等）\n  - 起重吊装安全（行车、叉车、吊索具等）\n  - 高空作业安全（脚手架、安全带、防坠落等）\n  - 个人防护用品管理（安全帽、防护眼镜、手套、安全鞋等）\n\n## 知识结构（详细）\n\n### 1. 机械伤害风险\n- **夹伤/挤伤**：手指、手臂被运动部件夹住\n- **切割伤**：锋利边缘、毛刺、切削工具\n- **碰撞伤**：头部碰撞、身体碰撞\n- **坠落伤**：零件坠落、工具坠落、人员坠落\n\n### 2. 焊接作业风险\n- **电击伤**：焊机漏电、接地不良\n- **弧光伤**：电弧紫外线灼伤眼睛和皮肤\n- **烫伤**：高温熔池、焊渣飞溅\n- **火灾爆炸**：易燃物引燃、气瓶泄漏\n- **有毒气体**：焊接烟尘、一氧化碳中毒\n\n### 3. 起重吊装风险\n- **吊物坠落**：吊索具断裂、捆绑不牢\n- **吊物摆动**：碰撞人员、设备\n- **超载**：超过起重机额定载荷\n- **指挥失误**：信号不清、违章指挥\n\n### 4. 高空作业风险\n- **人员坠落**：未系安全带、脚手架不牢\n- **物体打击**：工具、零件从高处坠落\n- **脚手架坍塌**：搭设不规范、超载\n\n### 5. 个人防护用品\n- **头部防护**：安全帽（防止碰撞、坠物打击）\n- **眼部防护**：防护眼镜、焊接面罩（防止飞溅、弧光）\n- **手部防护**：防护手套（防止切割、烫伤、化学品）\n- **足部防护**：安全鞋（防砸、防刺穿、防滑）\n- **呼吸防护**：防尘口罩、防毒面具（防止粉尘、有毒气体）\n\n### 6. 应急处理\n- **机械伤害**：立即停机、呼救、止血、固定、送医\n- **电击伤**：切断电源、心肺复苏、送医\n- **烫伤**：冷水冲洗、覆盖无菌纱布、送医\n- **火灾**：使用灭火器、疏散人员、报警\n\n## 任务步骤（Chain of Thought）\n\n你的任务是**为每个装配步骤添加安全警告**（如果该步骤有安全风险）。请按照以下5个步骤思考：\n\n### 步骤1：识别风险步骤\n- 分析每个装配步骤的操作内容\n- 判断是否涉及高风险作业（焊接、吊装、高空、重物搬运等）\n- 识别潜在的伤害类型（机械伤害、电击、烫伤、坠落等）\n\n### 步骤2：分析风险源\n- 确定风险的来源（设备、工具、材料、环境、人员操作等）\n- 评估风险的严重程度（轻微、中等、严重、致命）\n- 考虑风险的发生概率\n\n### 步骤3：制定预防措施\n- 针对每个风险源，制定具体的预防措施\n- 强调个人防护用品的使用\n- 强调安全操作规程的遵守\n\n### 步骤4：添加安全警告\n- 为每个有风险的步骤添加safety_warnings字段\n- 每条警告要简洁明了，说明具体的风险和预防措施\n- 使用工人能看懂的语言\n\n### 步骤5：验证完整性\n- 检查所有高风险步骤是否都添加了安全警告\n- 检查安全警告是否具体、可操作\n- 检查是否遗漏了任何潜在风险\n\n## 核心原则\n\n1. **步骤级嵌入**：为每个有风险的步骤添加safety_warnings字段，而不是单独列出安全警告\n2. **工人友好**：使用通俗语言，避免专业术语\n3. **具体可操作**：说明具体的风险和预防措施，而不是泛泛而谈\n4. **不重复显示**：安全警告只在下方\"安全\"标签页中统一显示，不在当前步骤详情中重复显示\n\n## 输出格式\n\n严格按照以下JSON格式输出（返回增强后的装配步骤）：\n\n```json\n{\n  \"enhanced_steps\": [\n    {\n      \"step_number\": 1,\n      \"title\": \"点焊定位\",\n      \"parts_used\": [...],\n      \"tools_required\": [...],\n      \"operation\": \"操作说明\",\n      \"quality_check\": \"质量检查\",\n      \"estimated_time_minutes\": 10,\n      \"welding\": {\n        \"required\": true,\n        \"welding_type\": \"点焊\",\n        \"welding_method\": \"CO2气保焊\",\n        ...\n      },\n      \"safety_warnings\": [\n        \"佩戴焊接面罩和防护手套，防止弧光灼伤眼睛和皮肤\",\n        \"确保工件夹紧牢固，防止点焊时位移造成伤害\",\n        \"焊接区域周围3米内不得有易燃物，配备灭火器\",\n        \"焊机必须接地良好，防止漏电触电\"\n      ]\n    },\n    {\n      \"step_number\": 2,\n      \"title\": \"螺栓连接\",\n      \"parts_used\": [...],\n      \"operation\": \"操作说明\",\n      \"quality_check\": \"质量检查\",\n      \"estimated_time_minutes\": 15,\n      \"safety_warnings\": [\n        \"佩戴安全帽和防护眼镜，防止零件坠落和飞溅\",\n        \"使用扭力扳手时注意力度，防止扳手滑脱伤人\"\n      ]\n    },\n    {\n      \"step_number\": 3,\n      \"title\": \"简单装配\",\n      \"parts_used\": [...],\n      \"operation\": \"操作说明\",\n      \"quality_check\": \"质量检查\",\n      \"estimated_time_minutes\": 5\n      // ⚠️ 如果没有明显安全风险，不添加safety_warnings字段\n    }\n  ]\n}\n```\n\n**⚠️ 关键要求**：\n\n1. **步骤级嵌入**：\n   - 为每个有风险的步骤添加`safety_warnings`字段\n   - 没有明显风险的步骤不添加`safety_warnings`字段\n   - 保持原有步骤的所有字段不变\n\n2. **安全警告要具体**：\n   - ✅ 说\"佩戴焊接面罩和防护手套，防止弧光灼伤眼睛和皮肤\"\n   - ❌ 不说\"注意安全\"\n   - ✅ 说\"焊接区域周围3米内不得有易燃物，配备灭火器\"\n   - ❌ 不说\"注意防火\"\n\n3. **使用通俗语言**：\n   - 工人能看懂的语言\n   - 避免专业术语和英文缩写\n\n4. **警告要全面**：\n   - 涵盖个人防护、设备安全、环境安全、操作安全\n   - 每条警告说明具体的风险和预防措施\n\n## 重要提醒\n\n- **只输出JSON，不要输出其他内容**\n- **保持原有字段不变**：不要修改或删除原有的字段（包括welding字段）\n- **警告要简洁明了**：每条警告一句话，说明风险和预防措施\n- **不要过度警告**：只针对有明显风险的步骤添加警告\n",
  "user_query": "请为以下装配步骤添加安全警告（如果有安全风险）。\n\n## 📸 视觉分析任务\n\n**你会看到工程图纸图片，请仔细观察：**\n\n1. **危险作业标识**：\n   - 图纸上的安全警告标识\n   - 特殊作业要求（如高空作业、吊装作业等）\n   - 危险区域标注\n\n2. **零件特征**：\n   - 重型零件（需要吊装）\n   - 锋利边缘（容易割伤）\n   - 高温部件（容易烫伤）\n\n3. **作业环境**：\n   - 狭窄空间（容易碰撞）\n   - 高空位置（容易坠落）\n   - 密闭空间（通风不良）\n\n## 装配步骤\n\n[\n  {\n    \"step_number\": 1,\n    \"action\": \"定位基准件\",\n    \"description\": \"将图纸上标注为 1 的左铲板 1 (01.01.01.18598) 放置在平整的工作台上作为装配基准件。确保铲板放置稳固，方便后续焊接操作。\",\n    \"position_description\": \"工作台中央\",\n    \"parts_used\": [\n      {\n        \"bom_seq\": \"1\",\n        \"bom_name\": \"左铲板 1\",\n        \"quantity\": 1,\n        \"drawing_number\": \"1\",\n        \"node_name\": [\n          \"NAUO1\"\n        ],\n        \"bom_code\": \"01.01.01.18598\"\n      }\n    ],\n    \"tools\": [\n      \"行车（吊装）\",\n      \"工作台\"\n    ],\n    \"warnings\": [\n      \"吊装时注意安全，防止铲板倾倒或滑落。\"\n    ]\n  },\n  {\n    \"step_number\": 2,\n    \"action\": \"焊接加强板\",\n    \"description\": \"将图纸上标注为 2 的方形板-机加 (01.01.01.18599) 和标注为 3 的后加强板 (01.01.01.11519) 放置在 1 号左铲板的背面（内侧），并进行点焊定位。注意 2 号方形板-机加的机加面朝外。\",\n    \"position_description\": \"2号和3号零件位于1号铲板的内侧，根据图纸尺寸定位。\",\n    \"parts_used\": [\n      {\n        \"bom_seq\": \"2\",\n        \"bom_name\": \"方形板-机加 1\",\n        \"quantity\": 1,\n        \"drawing_number\": \"2\",\n        \"node_name\": [\n          \"NAUO2\"\n        ],\n        \"bom_code\": \"01.01.01.18599\"\n      },\n      {\n        \"bom_seq\": \"3\",\n        \"bom_name\": \"后加强板 1\",\n        \"quantity\": 1,\n        \"drawing_number\": \"3\",\n        \"node_name\": [\n          \"NAUO3\"\n        ],\n        \"bom_code\": \"01.01.01.11519\"\n      }\n    ],\n    \"tools\": [\n      \"焊机\",\n      \"角尺\",\n      \"卷尺\"\n    ],\n    \"warnings\": [\n      \"点焊时注意焊接变形，确保零件位置准确。\"\n    ],\n    \"welding\": {\n      \"required\": true,\n      \"welding_type\": \"角焊（定位焊）\",\n      \"welding_method\": \"CO2气保焊\",\n      \"weld_size\": \"点焊，焊点长度10-15mm\",\n      \"welding_position\": \"零件2和零件3与零件1（左铲板）的连接处，平焊\",\n      \"quality_requirements\": \"焊点均匀分布，定位准确，保证后续满焊的间隙。\",\n      \"safety_notes\": \"佩戴焊接面罩和防护手套，确保工作区域通风良好，防止烟尘吸入。\"\n    }\n  },\n  {\n    \"step_number\": 3,\n    \"action\": \"焊接前加强板和底部连接板\",\n    \"description\": \"将图纸上标注为 4 的前加强板 1 (01.01.01.18600) 放置在 1 号左铲板的底部边缘，并进行点焊定位。同时，将 6 块标注为 5 的底部连接板 6 (01.01.01.11521) 均匀分布并焊接到 1 号铲板的底部，与 4 号前加强板对齐。\",\n    \"position_description\": \"4号零件位于铲板底部边缘，5号零件沿底部边缘均匀分布。\",\n    \"parts_used\": [\n      {\n        \"bom_seq\": \"4\",\n        \"bom_name\": \"前加强板 1\",\n        \"quantity\": 1,\n        \"drawing_number\": \"4\",\n        \"node_name\": [\n          \"NAUO4\"\n        ],\n        \"bom_code\": \"01.01.01.18600\"\n      },\n      {\n        \"bom_seq\": \"5\",\n        \"bom_name\": \"底部连接板 6\",\n        \"quantity\": 6,\n        \"drawing_number\": \"5\",\n        \"node_name\": [\n          \"NAUO15\",\n          \"NAUO14\",\n          \"NAUO13\",\n          \"NAUO12\",\n          \"NAUO6\",\n          \"NAUO5\"\n        ],\n        \"bom_code\": \"01.01.01.11521\"\n      }\n    ],\n    \"tools\": [\n      \"焊机\",\n      \"卷尺\"\n    ],\n    \"warnings\": [\n      \"底部连接板（5号）的间距应均匀，确保后续连接件安装准确。\"\n    ],\n    \"welding\": {\n      \"required\": true,\n      \"welding_type\": \"角焊（定位焊）\",\n      \"welding_method\": \"CO2气保焊\",\n      \"weld_size\": \"点焊，焊点长度10-15mm\",\n      \"welding_position\": \"零件4和零件5与零件1（左铲板）的连接处，平焊\",\n      \"quality_requirements\": \"定位准确，特别是5号连接板的间距要均匀，误差不超过±1mm。\",\n      \"safety_notes\": \"检查焊机接地线是否牢固，防止触电。工作区域保持干燥。\"\n    }\n  },\n  {\n    \"step_number\": 4,\n    \"action\": \"焊接油缸和弹簧固定板\",\n    \"description\": \"将图纸上标注为 6 的前油缸固定板 2 (01.01.01.11522) 焊接到 1 号铲板的内侧指定位置。然后，将标注为 7 的前弹簧固定板 1 (01.01.01.11523) 和标注为 8 的后弹簧固定板 2 (01.01.01.11524) 焊接到铲板内侧的相应位置。\",\n    \"position_description\": \"6号、7号、8号零件均位于铲板内侧，根据图纸上的尺寸和孔位进行精确对位。\",\n    \"parts_used\": [\n      {\n        \"bom_seq\": \"6\",\n        \"bom_name\": \"前油缸固定板 2\",\n        \"quantity\": 2,\n        \"drawing_number\": \"6\",\n        \"node_name\": [\n          \"NAUO8\",\n          \"NAUO7\"\n        ],\n        \"bom_code\": \"01.01.01.11522\"\n      },\n      {\n        \"bom_seq\": \"7\",\n        \"bom_name\": \"前弹簧固定板 1\",\n        \"quantity\": 1,\n        \"drawing_number\": \"7\",\n        \"node_name\": [\n          \"NAUO9\"\n        ],\n        \"bom_code\": \"01.01.01.11523\"\n      },\n      {\n        \"bom_seq\": \"8\",\n        \"bom_name\": \"后弹簧固定板 2\",\n        \"quantity\": 2,\n        \"drawing_number\": \"8\",\n        \"node_name\": [\n          \"NAUO11\",\n          \"NAUO10\"\n        ],\n        \"bom_code\": \"01.01.01.11524\"\n      }\n    ],\n    \"tools\": [\n      \"焊机\",\n      \"卡尺\",\n      \"定位工装（如有）\"\n    ],\n    \"warnings\": [\n      \"这些固定板是关键受力件，必须保证焊接强度和位置精度，特别是孔位中心距。\"\n    ],\n    \"welding\": {\n      \"required\": true,\n      \"welding_type\": \"角焊\",\n      \"welding_method\": \"CO2气保焊\",\n      \"weld_size\": \"焊缝高度6mm（或按图纸要求），连续焊\",\n      \"welding_position\": \"零件6、7、8与零件1（左铲板）的连接处，主要为平焊和横焊\",\n      \"quality_requirements\": \"焊缝必须连续、饱满，无咬边、气孔等缺陷。关键孔位中心距偏差控制在±0.5mm以内。\",\n      \"safety_notes\": \"由于是关键受力件，焊接前必须预热（如果材料厚度大于20mm），防止产生焊接裂纹。使用定位工装确保精度。\"\n    }\n  },\n  {\n    \"step_number\": 5,\n    \"action\": \"焊接支撑固定板\",\n    \"description\": \"将图纸上标注为 9 的支撑固定板 1 (01.01.01.11525) 焊接到 1 号铲板的内侧，位于底部连接板上方，作为支撑结构。\",\n    \"position_description\": \"位于铲板内侧，靠近底部。\",\n    \"parts_used\": [\n      {\n        \"bom_seq\": \"9\",\n        \"bom_name\": \"支撑固定板 1\",\n        \"quantity\": 1,\n        \"drawing_number\": \"9\",\n        \"node_name\": [\n          \"NAUO16\"\n        ],\n        \"bom_code\": \"01.01.01.11525\"\n      }\n    ],\n    \"tools\": [\n      \"焊机\"\n    ],\n    \"warnings\": [\n      \"确保焊缝连续且符合图纸要求。\"\n    ],\n    \"welding\": {\n      \"required\": true,\n      \"welding_type\": \"角焊\",\n      \"welding_method\": \"CO2气保焊\",\n      \"weld_size\": \"焊缝高度6mm，连续焊\",\n      \"welding_position\": \"零件9与零件1（左铲板）的连接处，平焊\",\n      \"quality_requirements\": \"焊缝外观平整，过渡圆滑，焊后清理焊渣。\",\n      \"safety_notes\": \"注意焊接电流和电压的匹配，避免飞溅过多，保护好周围已定位的零件。\"\n    }\n  },\n  {\n    \"step_number\": 6,\n    \"action\": \"焊接轴套加强板和轴套\",\n    \"description\": \"将图纸上标注为 10 的轴套加强板 2 (01.01.01.11526) 焊接到 1 号铲板的侧面。然后，将标注为 12 的轴套 2 (01.01.02.1222) 放置在 10 号加强板的孔位上，并进行焊接。注意轴套的端面应与加强板端面配合，焊缝需饱满。\",\n    \"position_description\": \"位于铲板侧面，靠近后部。\",\n    \"parts_used\": [\n      {\n        \"bom_seq\": \"10\",\n        \"bom_name\": \"轴套加强板 2\",\n        \"quantity\": 2,\n        \"drawing_number\": \"10\",\n        \"node_name\": [\n          \"NAUO18\",\n          \"NAUO17\"\n        ],\n        \"bom_code\": \"01.01.01.11526\"\n      },\n      {\n        \"bom_seq\": \"12\",\n        \"bom_name\": \"轴套 2\",\n        \"quantity\": 2,\n        \"drawing_number\": \"12\",\n        \"node_name\": [\n          \"NAUO21\",\n          \"NAUO20\"\n        ],\n        \"bom_code\": \"01.01.02.1222\"\n      }\n    ],\n    \"tools\": [\n      \"焊机\",\n      \"卡尺\"\n    ],\n    \"warnings\": [\n      \"轴套（12号）的焊接必须保证其轴线与图纸要求平行或垂直，确保后续销轴顺利安装。端面配合，不可焊死。\"\n    ],\n    \"welding\": {\n      \"required\": true,\n      \"welding_type\": \"角焊和环形焊\",\n      \"welding_method\": \"CO2气保焊或手工电弧焊\",\n      \"weld_size\": \"轴套与加强板环形焊，焊缝高度4mm；加强板与铲板角焊，焊缝高度6mm\",\n      \"welding_position\": \"零件10与零件1（左铲板）的连接处，零件12与零件10的连接处，可能涉及横焊\",\n      \"quality_requirements\": \"轴套焊接时，必须使用定位销或工装保证轴线精度。焊缝必须全熔透，无裂纹。轴套端面严禁焊穿或焊死。\",\n      \"safety_notes\": \"轴套焊接时，应采用分段、对称、跳焊方式，控制热输入，防止轴套变形影响精度。\"\n    }\n  },\n  {\n    \"step_number\": 7,\n    \"action\": \"焊接反光片安装板\",\n    \"description\": \"将图纸上标注为 11 的反光片安装板 1 (01.01.01.11527) 焊接到 1 号铲板的侧面指定位置。\",\n    \"position_description\": \"位于铲板侧面，靠近前部。\",\n    \"parts_used\": [\n      {\n        \"bom_seq\": \"11\",\n        \"bom_name\": \"反光片安装板 1\",\n        \"quantity\": 1,\n        \"drawing_number\": \"11\",\n        \"node_name\": [\n          \"NAUO19\"\n        ],\n        \"bom_code\": \"01.01.01.11527\"\n      }\n    ],\n    \"tools\": [\n      \"焊机\"\n    ],\n    \"warnings\": [\n      \"注意安装板的方向，确保反光片安装面朝外。\"\n    ],\n    \"welding\": {\n      \"required\": true,\n      \"welding_type\": \"角焊\",\n      \"welding_method\": \"CO2气保焊\",\n      \"weld_size\": \"焊缝高度4mm，连续焊\",\n      \"welding_position\": \"零件11与零件1（左铲板）的连接处，横焊\",\n      \"quality_requirements\": \"焊缝外观整洁，不影响反光片的安装平面。\",\n      \"safety_notes\": \"焊接前清理零件表面油污和锈蚀，避免产生气孔。\"\n    }\n  },\n  {\n    \"step_number\": 8,\n    \"action\": \"焊接方形板\",\n    \"description\": \"将图纸上标注为 13 的方形板 1 (01.01.01.11528) 和标注为 14 的方形板 3 (01.01.01.11529) 焊接到 1 号铲板的内侧，作为加强和连接点。\",\n    \"position_description\": \"位于铲板内侧，根据图纸尺寸定位。\",\n    \"parts_used\": [\n      {\n        \"bom_seq\": \"13\",\n        \"bom_name\": \"方形板 1\",\n        \"quantity\": 1,\n        \"drawing_number\": \"13\"\n      },\n      {\n        \"bom_seq\": \"14\",\n        \"bom_name\": \"方形板 3\",\n        \"quantity\": 1,\n        \"drawing_number\": \"14\",\n        \"node_name\": [\n          \"NAUO24\",\n          \"NAUO23\",\n          \"NAUO22\"\n        ],\n        \"bom_code\": \"01.01.01.11529\"\n      }\n    ],\n    \"tools\": [\n      \"焊机\"\n    ],\n    \"warnings\": [\n      \"确保焊接牢固，无虚焊。\"\n    ],\n    \"welding\": {\n      \"required\": true,\n      \"welding_type\": \"角焊\",\n      \"welding_method\": \"CO2气保焊\",\n      \"weld_size\": \"焊缝高度6mm，连续焊\",\n      \"welding_position\": \"零件13和零件14与零件1（左铲板）的连接处，平焊\",\n      \"quality_requirements\": \"焊缝强度要求高，确保焊缝连续，无夹渣。\",\n      \"safety_notes\": \"焊接过程中，注意控制焊接速度，避免熔池过大导致烧穿或变形。\"\n    }\n  },\n  {\n    \"step_number\": 9,\n    \"action\": \"焊接左铲雪板加强板\",\n    \"description\": \"将图纸上标注为 15 的左铲雪板加强板 2 (01.02.01.4983) 焊接到 1 号铲板的内侧，作为最终的结构加强。\",\n    \"position_description\": \"位于铲板内侧，靠近顶部边缘。\",\n    \"parts_used\": [\n      {\n        \"bom_seq\": \"15\",\n        \"bom_name\": \"左铲雪板加强板 2\",\n        \"quantity\": 2,\n        \"drawing_number\": \"15\",\n        \"node_name\": [\n          \"NAUO26\",\n          \"NAUO25\"\n        ],\n        \"bom_code\": \"01.02.01.4983\"\n      }\n    ],\n    \"tools\": [\n      \"焊机\"\n    ],\n    \"warnings\": [\n      \"这是最后一块结构件，焊接完成后进行整体检查。\"\n    ],\n    \"welding\": {\n      \"required\": true,\n      \"welding_type\": \"角焊\",\n      \"welding_method\": \"CO2气保焊\",\n      \"weld_size\": \"焊缝高度6mm，连续焊\",\n      \"welding_position\": \"零件15与零件1（左铲板）的连接处，平焊\",\n      \"quality_requirements\": \"焊缝必须达到二级焊缝标准，外观平整，无明显缺陷。\",\n      \"safety_notes\": \"焊接完成后，立即进行焊缝外观检查，发现缺陷及时修补。\"\n    }\n  },\n  {\n    \"step_number\": 10,\n    \"action\": \"满焊及清理\",\n    \"description\": \"对所有已点焊的零件进行满焊，确保所有焊缝符合图纸要求。焊接完成后，对焊渣、飞溅物进行彻底清理，并打磨平整。\",\n    \"position_description\": \"所有焊接部位\",\n    \"parts_used\": [],\n    \"tools\": [\n      \"焊机\",\n      \"角磨机\",\n      \"钢丝刷\"\n    ],\n    \"warnings\": [\n      \"清理时注意保护眼睛和皮肤。确保所有焊缝无裂纹、气孔、夹渣等缺陷。\"\n    ],\n    \"welding\": {\n      \"required\": true,\n      \"welding_type\": \"所有结构焊缝\",\n      \"welding_method\": \"CO2气保焊为主\",\n      \"weld_size\": \"按图纸标注尺寸（主要为6mm焊脚高度）\",\n      \"welding_position\": \"所有零件与铲板的连接处，涉及平焊、横焊、立焊\",\n      \"quality_requirements\": \"所有焊缝必须连续、饱满，焊缝表面不得有裂纹、未熔合、未焊透。焊后进行外观检查，关键受力部位（如油缸固定板）建议进行磁粉检测（MT）。\",\n      \"safety_notes\": \"满焊时热输入量大，注意控制整体变形。打磨清理时，必须佩戴防护眼镜和防尘口罩，防止金属粉尘和火花伤害。\"\n    }\n  }\n]\n\n## 要求\n\n请按照以下5个步骤思考，为装配步骤添加安全警告：\n\n### 步骤1：识别风险步骤\n- 分析每个装配步骤的操作内容\n- 判断是否涉及高风险作业：\n  * **焊接作业**：电击、弧光、烫伤、火灾\n  * **吊装作业**：吊物坠落、碰撞、超载\n  * **高空作业**：人员坠落、物体打击\n  * **重物搬运**：砸伤、扭伤、夹伤\n  * **机械加工**：切割伤、夹伤、碰撞\n\n### 步骤2：分析风险源\n- 确定风险的来源（设备、工具、材料、环境、人员操作等）\n- 评估风险的严重程度（轻微、中等、严重、致命）\n- 考虑风险的发生概率\n\n### 步骤3：制定预防措施\n- 针对每个风险源，制定具体的预防措施\n- 强调个人防护用品的使用：\n  * **焊接**：焊接面罩、防护手套、防护服\n  * **吊装**：安全帽、安全鞋、手套\n  * **高空**：安全带、安全帽、防滑鞋\n  * **机械**：防护眼镜、手套、安全鞋\n\n### 步骤4：添加安全警告\n- 为每个有风险的步骤添加safety_warnings字段\n- 每条警告要简洁明了，说明具体的风险和预防措施\n- 使用工人能看懂的语言\n\n### 步骤5：验证完整性\n- 检查所有高风险步骤是否都添加了安全警告\n- 检查安全警告是否具体、可操作\n- 检查是否遗漏了任何潜在风险\n\n## ⚠️ 强制自检清单（生成后必须逐项检查）\n\n**在输出JSON之前，你必须完成以下验证：**\n\n1. **风险步骤识别验证**：\n   - [ ] 所有涉及焊接、吊装、高空、重物搬运的步骤都添加了safety_warnings字段\n   - [ ] 没有明显风险的步骤没有添加safety_warnings字段\n\n2. **安全警告完整性验证**：\n   - [ ] 每个safety_warnings字段都是字符串数组\n   - [ ] 每条警告都说明了具体的风险和预防措施\n   - [ ] 涵盖了个人防护、设备安全、环境安全、操作安全\n\n3. **语言通俗性验证**：\n   - [ ] 使用工人能看懂的语言\n   - [ ] 避免专业术语和英文缩写\n   - [ ] 每条警告简洁明了（一句话）\n\n4. **原有字段保持验证**：\n   - [ ] 原有步骤的所有字段都保持不变（包括welding字段）\n   - [ ] 没有修改或删除任何原有字段\n\n**如果自检发现任何问题，必须重新生成！**\n\n现在开始为装配步骤添加安全警告！\n",
  "raw_response": "```json\n{\n  \"enhanced_steps\": [\n    {\n      \"step_number\": 1,\n      \"action\": \"定位基准件\",\n      \"description\": \"将图纸上标注为 1 的左铲板 1 (01.01.01.18598) 放置在平整的工作台上作为装配基准件。确保铲板放置稳固，方便后续焊接操作。\",\n      \"position_description\": \"工作台中央\",\n      \"parts_used\": [\n        {\n          \"bom_seq\": \"1\",\n          \"bom_name\": \"左铲板 1\",\n          \"quantity\": 1,\n          \"drawing_number\": \"1\",\n          \"node_name\": [\n            \"NAUO1\"\n          ],\n          \"bom_code\": \"01.01.01.18598\"\n        }\n      ],\n      \"tools\": [\n        \"行车（吊装）\",\n        \"工作台\"\n      ],\n      \"warnings\": [\n        \"吊装时注意安全，防止铲板倾倒或滑落。\"\n      ],\n      \"safety_warnings\": [\n        \"吊装前检查行车和吊索具完好，防止吊物坠落伤人\",\n        \"吊装时必须佩戴安全帽和防护手套，避免碰撞和夹伤\",\n        \"铲板落地后，确保垫稳放牢，防止倾倒砸伤\"\n      ]\n    },\n    {\n      \"step_number\": 2,\n      \"action\": \"焊接加强板\",\n      \"description\": \"将图纸上标注为 2 的方形板-机加 (01.01.01.18599) 和标注为 3 的后加强板 (01.01.01.11519) 放置在 1 号左铲板的背面（内侧），并进行点焊定位。注意 2 号方形板-机加的机加面朝外。\",\n      \"position_description\": \"2号和3号零件位于1号铲板的内侧，根据图纸尺寸定位。\",\n      \"parts_used\": [\n        {\n          \"bom_seq\": \"2\",\n          \"bom_name\": \"方形板-机加 1\",\n          \"quantity\": 1,\n          \"drawing_number\": \"2\",\n          \"node_name\": [\n            \"NAUO2\"\n          ],\n          \"bom_code\": \"01.01.01.18599\"\n        },\n        {\n          \"bom_seq\": \"3\",\n          \"bom_name\": \"后加强板 1\",\n          \"quantity\": 1,\n          \"drawing_number\": \"3\",\n          \"node_name\": [\n            \"NAUO3\"\n          ],\n          \"bom_code\": \"01.01.01.11519\"\n        }\n      ],\n      \"tools\": [\n        \"焊机\",\n        \"角尺\",\n        \"卷尺\"\n      ],\n      \"warnings\": [\n        \"点焊时注意焊接变形，确保零件位置准确。\"\n      ],\n      \"welding\": {\n        \"required\": true,\n        \"welding_type\": \"角焊（定位焊）\",\n        \"welding_method\": \"CO2气保焊\",\n        \"weld_size\": \"点焊，焊点长度10-15mm\",\n        \"welding_position\": \"零件2和零件3与零件1（左铲板）的连接处，平焊\",\n        \"quality_requirements\": \"焊点均匀分布，定位准确，保证后续满焊的间隙。\",\n        \"safety_notes\": \"佩戴焊接面罩和防护手套，确保工作区域通风良好，防止烟尘吸入。\"\n      },\n      \"safety_warnings\": [\n        \"必须佩戴焊接面罩、防护手套和防护服，防止弧光灼伤和高温烫伤\",\n        \"确保焊机接地良好，电缆绝缘完好，防止触电事故\",\n        \"焊接区域必须保持通风，佩戴防尘口罩，防止吸入有毒烟尘\",\n        \"点焊时注意焊渣飞溅，周围不得有易燃易爆物品\"\n      ]\n    },\n    {\n      \"step_number\": 3,\n      \"action\": \"焊接前加强板和底部连接板\",\n      \"description\": \"将图纸上标注为 4 的前加强板 1 (01.01.01.18600) 放置在 1 号左铲板的底部边缘，并进行点焊定位。同时，将 6 块标注为 5 的底部连接板 6 (01.01.01.11521) 均匀分布并焊接到 1 号铲板的底部，与 4 号前加强板对齐。\",\n      \"position_description\": \"4号零件位于铲板底部边缘，5号零件沿底部边缘均匀分布。\",\n      \"parts_used\": [\n        {\n          \"bom_seq\": \"4\",\n          \"bom_name\": \"前加强板 1\",\n          \"quantity\": 1,\n          \"drawing_number\": \"4\",\n          \"node_name\": [\n            \"NAUO4\"\n          ],\n          \"bom_code\": \"01.01.01.18600\"\n        },\n        {\n          \"bom_seq\": \"5\",\n          \"bom_name\": \"底部连接板 6\",\n          \"quantity\": 6,\n          \"drawing_number\": \"5\",\n          \"node_name\": [\n            \"NAUO15\",\n            \"NAUO14\",\n            \"NAUO13\",\n            \"NAUO12\",\n            \"NAUO6\",\n            \"NAUO5\"\n          ],\n          \"bom_code\": \"01.01.01.11521\"\n        }\n      ],\n      \"tools\": [\n        \"焊机\",\n        \"卷尺\"\n      ],\n      \"warnings\": [\n        \"底部连接板（5号）的间距应均匀，确保后续连接件安装准确。\"\n      ],\n      \"welding\": {\n        \"required\": true,\n        \"welding_type\": \"角焊（定位焊）\",\n        \"welding_method\": \"CO2气保焊\",\n        \"weld_size\": \"点焊，焊点长度10-15mm\",\n        \"welding_position\": \"零件4和零件5与零件1（左铲板）的连接处，平焊\",\n        \"quality_requirements\": \"定位准确，特别是5号连接板的间距要均匀，误差不超过±1mm。\",\n        \"safety_notes\": \"检查焊机接地线是否牢固，防止触电。工作区域保持干燥。\"\n      },\n      \"safety_warnings\": [\n        \"佩戴焊接面罩和防护手套，防止弧光和烫伤\",\n        \"操作焊机前，检查接地线和电缆，确保绝缘良好，防止触电\",\n        \"工作区域地面保持干燥，防止潮湿引发触电危险\"\n      ]\n    },\n    {\n      \"step_number\": 4,\n      \"action\": \"焊接油缸和弹簧固定板\",\n      \"description\": \"将图纸上标注为 6 的前油缸固定板 2 (01.01.01.11522) 焊接到 1 号铲板的内侧指定位置。然后，将标注为 7 的前弹簧固定板 1 (01.01.01.11523) 和标注为 8 的后弹簧固定板 2 (01.01.01.11524) 焊接到铲板内侧的相应位置。\",\n      \"position_description\": \"6号、7号、8号零件均位于铲板内侧，根据图纸上的尺寸和孔位进行精确对位。\",\n      \"parts_used\": [\n        {\n          \"bom_seq\": \"6\",\n          \"bom_name\": \"前油缸固定板 2\",\n          \"quantity\": 2,\n          \"drawing_number\": \"6\",\n          \"node_name\": [\n            \"NAUO8\",\n            \"NAUO7\"\n          ],\n          \"bom_code\": \"01.01.01.11522\"\n        },\n        {\n          \"bom_seq\": \"7\",\n          \"bom_name\": \"前弹簧固定板 1\",\n          \"quantity\": 1,\n          \"drawing_number\": \"7\",\n          \"node_name\": [\n            \"NAUO9\"\n          ],\n          \"bom_code\": \"01.01.01.11523\"\n        },\n        {\n          \"bom_seq\": \"8\",\n          \"bom_name\": \"后弹簧固定板 2\",\n          \"quantity\": 2,\n          \"drawing_number\": \"8\",\n          \"node_name\": [\n            \"NAUO11\",\n            \"NAUO10\"\n          ],\n          \"bom_code\": \"01.01.01.11524\"\n        }\n      ],\n      \"tools\": [\n        \"焊机\",\n        \"卡尺\",\n        \"定位工装（如有）\"\n      ],\n      \"warnings\": [\n        \"这些固定板是关键受力件，必须保证焊接强度和位置精度，特别是孔位中心距。\"\n      ],\n      \"welding\": {\n        \"required\": true,\n        \"welding_type\": \"角焊\",\n        \"welding_method\": \"CO2气保焊\",\n        \"weld_size\": \"焊缝高度6mm（或按图纸要求），连续焊\",\n        \"welding_position\": \"零件6、7、8与零件1（左铲板）的连接处，主要为平焊和横焊\",\n        \"quality_requirements\": \"焊缝必须连续、饱满，无咬边、气孔等缺陷。关键孔位中心距偏差控制在±0.5mm以内。\",\n        \"safety_notes\": \"由于是关键受力件，焊接前必须预热（如果材料厚度大于20mm），防止产生焊接裂纹。使用定位工装确保精度。\"\n      },\n      \"safety_warnings\": [\n        \"佩戴焊接面罩、防护手套和防护服，防止弧光和高温烫伤\",\n        \"焊接关键受力件时，注意控制热输入，防止因变形或裂纹导致结构失效\",\n        \"确保工作区域通风良好，避免焊接烟尘聚集\"\n      ]\n    },\n    {\n      \"step_number\": 5,\n      \"action\": \"焊接支撑固定板\",\n      \"description\": \"将图纸上标注为 9 的支撑固定板 1 (01.01.01.11525) 焊接到 1 号铲板的内侧，位于底部连接板上方，作为支撑结构。\",\n      \"position_description\": \"位于铲板内侧，靠近底部。\",\n      \"parts_used\": [\n        {\n          \"bom_seq\": \"9\",\n          \"bom_name\": \"支撑固定板 1\",\n          \"quantity\": 1,\n          \"drawing_number\": \"9\",\n          \"node_name\": [\n            \"NAUO16\"\n          ],\n          \"bom_code\": \"01.01.01.11525\"\n        }\n      ],\n      \"tools\": [\n        \"焊机\"\n      ],\n      \"warnings\": [\n        \"确保焊缝连续且符合图纸要求。\"\n      ],\n      \"welding\": {\n        \"required\": true,\n        \"welding_type\": \"角焊\",\n        \"welding_method\": \"CO2气保焊\",\n        \"weld_size\": \"焊缝高度6mm，连续焊\",\n        \"welding_position\": \"零件9与零件1（左铲板）的连接处，平焊\",\n        \"quality_requirements\": \"焊缝外观平整，过渡圆滑，焊后清理焊渣。\",\n        \"safety_notes\": \"注意焊接电流和电压的匹配，避免飞溅过多，保护好周围已定位的零件。\"\n      },\n      \"safety_warnings\": [\n        \"佩戴焊接面罩和防护手套，防止弧光和烫伤\",\n        \"注意控制焊接飞溅，防止高温飞溅物伤及身体或引燃周围物品\"\n      ]\n    },\n    {\n      \"step_number\": 6,\n      \"action\": \"焊接轴套加强板和轴套\",\n      \"description\": \"将图纸上标注为 10 的轴套加强板 2 (01.01.01.11526) 焊接到 1 号铲板的侧面。然后，将标注为 12 的轴套 2 (01.01.02.1222) 放置在 10 号加强板的孔位上，并进行焊接。注意轴套的端面应与加强板端面配合，焊缝需饱满。\",\n      \"position_description\": \"位于铲板侧面，靠近后部。\",\n      \"parts_used\": [\n        {\n          \"bom_seq\": \"10\",\n          \"bom_name\": \"轴套加强板 2\",\n          \"quantity\": 2,\n          \"drawing_number\": \"10\",\n          \"node_name\": [\n            \"NAUO18\",\n            \"NAUO17\"\n          ],\n          \"bom_code\": \"01.01.01.11526\"\n        },\n        {\n          \"bom_seq\": \"12\",\n          \"bom_name\": \"轴套 2\",\n          \"quantity\": 2,\n          \"drawing_number\": \"12\",\n          \"node_name\": [\n            \"NAUO21\",\n            \"NAUO20\"\n          ],\n          \"bom_code\": \"01.01.02.1222\"\n        }\n      ],\n      \"tools\": [\n        \"焊机\",\n        \"卡尺\"\n      ],\n      \"warnings\": [\n        \"轴套（12号）的焊接必须保证其轴线与图纸要求平行或垂直，确保后续销轴顺利安装。端面配合，不可焊死。\"\n      ],\n      \"welding\": {\n        \"required\": true,\n        \"welding_type\": \"角焊和环形焊\",\n        \"welding_method\": \"CO2气保焊或手工电弧焊\",\n        \"weld_size\": \"轴套与加强板环形焊，焊缝高度4mm；加强板与铲板角焊，焊缝高度6mm\",\n        \"welding_position\": \"零件10与零件1（左铲板）的连接处，零件12与零件10的连接处，可能涉及横焊\",\n        \"quality_requirements\": \"轴套焊接时，必须使用定位销或工装保证轴线精度。焊缝必须全熔透，无裂纹。轴套端面严禁焊穿或焊死。\",\n        \"safety_notes\": \"轴套焊接时，应采用分段、对称、跳焊方式，控制热输入，防止轴套变形影响精度。\"\n      },\n      \"safety_warnings\": [\n        \"佩戴焊接面罩和防护手套，防止弧光和烫伤\",\n        \"进行环形焊时，注意焊枪角度和姿势，防止焊渣飞溅到身体\",\n        \"轴套焊接后温度高，严禁徒手触摸，防止烫伤\"\n      ]\n    },\n    {\n      \"step_number\": 7,\n      \"action\": \"焊接反光片安装板\",\n      \"description\": \"将图纸上标注为 11 的反光片安装板 1 (01.01.01.11527) 焊接到 1 号铲板的侧面指定位置。\",\n      \"position_description\": \"位于铲板侧面，靠近前部。\",\n      \"parts_used\": [\n        {\n          \"bom_seq\": \"11\",\n          \"bom_name\": \"反光片安装板 1\",\n          \"quantity\": 1,\n          \"drawing_number\": \"11\",\n          \"node_name\": [\n            \"NAUO19\"\n          ],\n          \"bom_code\": \"01.01.01.11527\"\n        }\n      ],\n      \"tools\": [\n        \"焊机\"\n      ],\n      \"warnings\": [\n        \"注意安装板的方向，确保反光片安装面朝外。\"\n      ],\n      \"welding\": {\n        \"required\": true,\n        \"welding_type\": \"角焊\",\n        \"welding_method\": \"CO2气保焊\",\n        \"weld_size\": \"焊缝高度4mm，连续焊\",\n        \"welding_position\": \"零件11与零件1（左铲板）的连接处，横焊\",\n        \"quality_requirements\": \"焊缝外观整洁，不影响反光片的安装平面。\",\n        \"safety_notes\": \"焊接前清理零件表面油污和锈蚀，避免产生气孔。\"\n      },\n      \"safety_warnings\": [\n        \"佩戴焊接面罩和防护手套，防止弧光和烫伤\",\n        \"焊接前必须清理零件表面的油污和锈蚀，防止焊接时产生有毒烟雾或飞溅\"\n      ]\n    },\n    {\n      \"step_number\": 8,\n      \"action\": \"焊接方形板\",\n      \"description\": \"将图纸上标注为 13 的方形板 1 (01.01.01.11528) 和标注为 14 的方形板 3 (01.01.01.11529) 焊接到 1 号铲板的内侧，作为加强和连接点。\",\n      \"position_description\": \"位于铲板内侧，根据图纸尺寸定位。\",\n      \"parts_used\": [\n        {\n          \"bom_seq\": \"13\",\n          \"bom_name\": \"方形板 1\",\n          \"quantity\": 1,\n          \"drawing_number\": \"13\"\n        },\n        {\n          \"bom_seq\": \"14\",\n          \"bom_name\": \"方形板 3\",\n          \"quantity\": 1,\n          \"drawing_number\": \"14\",\n          \"node_name\": [\n            \"NAUO24\",\n            \"NAUO23\",\n            \"NAUO22\"\n          ],\n          \"bom_code\": \"01.01.01.11529\"\n        }\n      ],\n      \"tools\": [\n        \"焊机\"\n      ],\n      \"warnings\": [\n        \"确保焊接牢固，无虚焊。\"\n      ],\n      \"welding\": {\n        \"required\": true,\n        \"welding_type\": \"角焊\",\n        \"welding_method\": \"CO2气保焊\",\n        \"weld_size\": \"焊缝高度6mm，连续焊\",\n        \"welding_position\": \"零件13和零件14与零件1（左铲板）的连接处，平焊\",\n        \"quality_requirements\": \"焊缝强度要求高，确保焊缝连续，无夹渣。\",\n        \"safety_notes\": \"焊接过程中，注意控制焊接速度，避免熔池过大导致烧穿或变形。\"\n      },\n      \"safety_warnings\": [\n        \"佩戴焊接面罩和防护手套，防止弧光和烫伤\",\n        \"注意控制焊接速度和电流，防止烧穿薄板或造成大面积变形\"\n      ]\n    },\n    {\n      \"step_number\": 9,\n      \"action\": \"焊接左铲雪板加强板\",\n      \"description\": \"将图纸上标注为 15 的左铲雪板加强板 2 (01.02.01.4983) 焊接到 1 号铲板的内侧，作为最终的结构加强。\",\n      \"position_description\": \"位于铲板内侧，靠近顶部边缘。\",\n      \"parts_used\": [\n        {\n          \"bom_seq\": \"15\",\n          \"bom_name\": \"左铲雪板加强板 2\",\n          \"quantity\": 2,\n          \"drawing_number\": \"15\",\n          \"node_name\": [\n            \"NAUO26\",\n            \"NAUO25\"\n          ],\n          \"bom_code\": \"01.02.01.4983\"\n        }\n      ],\n      \"tools\": [\n        \"焊机\"\n      ],\n      \"warnings\": [\n        \"这是最后一块结构件，焊接完成后进行整体检查。\"\n      ],\n      \"welding\": {\n        \"required\": true,\n        \"welding_type\": \"角焊\",\n        \"welding_method\": \"CO2气保焊\",\n        \"weld_size\": \"焊缝高度6mm，连续焊\",\n        \"welding_position\": \"零件15与零件1（左铲板）的连接处，平焊\",\n        \"quality_requirements\": \"焊缝必须达到二级焊缝标准，外观平整，无明显缺陷。\",\n        \"safety_notes\": \"焊接完成后，立即进行焊缝外观检查，发现缺陷及时修补。\"\n      },\n      \"safety_warnings\": [\n        \"佩戴焊接面罩和防护手套，防止弧光和烫伤\",\n        \"焊接完成后，零件温度较高，设置警示标识，防止他人误触烫伤\"\n      ]\n    },\n    {\n      \"step_number\": 10,\n      \"action\": \"满焊及清理\",\n      \"description\": \"对所有已点焊的零件进行满焊，确保所有焊缝符合图纸要求。焊接完成后，对焊渣、飞溅物进行彻底清理，并打磨平整。\",\n      \"position_description\": \"所有焊接部位\",\n      \"parts_used\": [],\n      \"tools\": [\n        \"焊机\",\n        \"角磨机\",\n        \"钢丝刷\"\n      ],\n      \"warnings\": [\n        \"清理时注意保护眼睛和皮肤。确保所有焊缝无裂纹、气孔、夹渣等缺陷。\"\n      ],\n      \"welding\": {\n        \"required\": true,\n        \"welding_type\": \"所有结构焊缝\",\n        \"welding_method\": \"CO2气保焊为主\",\n        \"weld_size\": \"按图纸标注尺寸（主要为6mm焊脚高度）\",\n        \"welding_position\": \"所有零件与铲板的连接处，涉及平焊、横焊、立焊\",\n        \"quality_requirements\": \"所有焊缝必须连续、饱满，焊缝表面不得有裂纹、未熔合、未焊透。焊后进行外观检查，关键受力部位（如油缸固定板）建议进行磁粉检测（MT）。\",\n        \"safety_notes\": \"满焊时热输入量大，注意控制整体变形。打磨清理时，必须佩戴防护眼镜和防尘口罩，防止金属粉尘和火花伤害。\"\n      },\n      \"safety_warnings\": [\n        \"满焊时热量大，必须穿戴全套防护用品，防止大面积烫伤\",\n        \"使用角磨机清理焊渣和打磨时，必须佩戴防护眼镜和防尘口罩，防止飞溅物和金属粉尘伤害眼睛和呼吸道\",\n        \"使用角磨机时，注意站位和握持姿势，防止砂轮片破碎或机器反弹伤人\",\n        \"清理后的焊渣和废弃物应及时放入指定容器，保持工作区域整洁\"\n      ]\n    }\n  ]\n}\n```",
  "parsed_result": {
    "enhanced_steps": [
      {
        "step_number": 1,
        "action": "定位基准件",
        "description": "将图纸上标注为 1 的左铲板 1 (01.01.01.18598) 放置在平整的工作台上作为装配基准件。确保铲板放置稳固，方便后续焊接操作。",
        "position_description": "工作台中央",
        "parts_used": [
          {
            "bom_seq": "1",
            "bom_name": "左铲板 1",
            "quantity": 1,
            "drawing_number": "1",
            "node_name": [
              "NAUO1"
            ],
            "bom_code": "01.01.01.18598"
          }
        ],
        "tools": [
          "行车（吊装）",
          "工作台"
        ],
        "warnings": [
          "吊装时注意安全，防止铲板倾倒或滑落。"
        ],
        "safety_warnings": [
          "吊装前检查行车和吊索具完好，防止吊物坠落伤人",
          "吊装时必须佩戴安全帽和防护手套，避免碰撞和夹伤",
          "铲板落地后，确保垫稳放牢，防止倾倒砸伤"
        ]
      },
      {
        "step_number": 2,
        "action": "焊接加强板",
        "description": "将图纸上标注为 2 的方形板-机加 (01.01.01.18599) 和标注为 3 的后加强板 (01.01.01.11519) 放置在 1 号左铲板的背面（内侧），并进行点焊定位。注意 2 号方形板-机加的机加面朝外。",
        "position_description": "2号和3号零件位于1号铲板的内侧，根据图纸尺寸定位。",
        "parts_used": [
          {
            "bom_seq": "2",
            "bom_name": "方形板-机加 1",
            "quantity": 1,
            "drawing_number": "2",
            "node_name": [
              "NAUO2"
            ],
            "bom_code": "01.01.01.18599"
          },
          {
            "bom_seq": "3",
            "bom_name": "后加强板 1",
            "quantity": 1,
            "drawing_number": "3",
            "node_name": [
              "NAUO3"
            ],
            "bom_code": "01.01.01.11519"
          }
        ],
        "tools": [
          "焊机",
          "角尺",
          "卷尺"
        ],
        "warnings": [
          "点焊时注意焊接变形，确保零件位置准确。"
        ],
        "welding": {
          "required": true,
          "welding_type": "角焊（定位焊）",
          "welding_method": "CO2气保焊",
          "weld_size": "点焊，焊点长度10-15mm",
          "welding_position": "零件2和零件3与零件1（左铲板）的连接处，平焊",
          "quality_requirements": "焊点均匀分布，定位准确，保证后续满焊的间隙。",
          "safety_notes": "佩戴焊接面罩和防护手套，确保工作区域通风良好，防止烟尘吸入。"
        },
        "safety_warnings": [
          "必须佩戴焊接面罩、防护手套和防护服，防止弧光灼伤和高温烫伤",
          "确保焊机接地良好，电缆绝缘完好，防止触电事故",
          "焊接区域必须保持通风，佩戴防尘口罩，防止吸入有毒烟尘",
          "点焊时注意焊渣飞溅，周围不得有易燃易爆物品"
        ]
      },
      {
        "step_number": 3,
        "action": "焊接前加强板和底部连接板",
        "description": "将图纸上标注为 4 的前加强板 1 (01.01.01.18600) 放置在 1 号左铲板的底部边缘，并进行点焊定位。同时，将 6 块标注为 5 的底部连接板 6 (01.01.01.11521) 均匀分布并焊接到 1 号铲板的底部，与 4 号前加强板对齐。",
        "position_description": "4号零件位于铲板底部边缘，5号零件沿底部边缘均匀分布。",
        "parts_used": [
          {
            "bom_seq": "4",
            "bom_name": "前加强板 1",
            "quantity": 1,
            "drawing_number": "4",
            "node_name": [
              "NAUO4"
            ],
            "bom_code": "01.01.01.18600"
          },
          {
            "bom_seq": "5",
            "bom_name": "底部连接板 6",
            "quantity": 6,
            "drawing_number": "5",
            "node_name": [
              "NAUO15",
              "NAUO14",
              "NAUO13",
              "NAUO12",
              "NAUO6",
              "NAUO5"
            ],
            "bom_code": "01.01.01.11521"
          }
        ],
        "tools": [
          "焊机",
          "卷尺"
        ],
        "warnings": [
          "底部连接板（5号）的间距应均匀，确保后续连接件安装准确。"
        ],
        "welding": {
          "required": true,
          "welding_type": "角焊（定位焊）",
          "welding_method": "CO2气保焊",
          "weld_size": "点焊，焊点长度10-15mm",
          "welding_position": "零件4和零件5与零件1（左铲板）的连接处，平焊",
          "quality_requirements": "定位准确，特别是5号连接板的间距要均匀，误差不超过±1mm。",
          "safety_notes": "检查焊机接地线是否牢固，防止触电。工作区域保持干燥。"
        },
        "safety_warnings": [
          "佩戴焊接面罩和防护手套，防止弧光和烫伤",
          "操作焊机前，检查接地线和电缆，确保绝缘良好，防止触电",
          "工作区域地面保持干燥，防止潮湿引发触电危险"
        ]
      },
      {
        "step_number": 4,
        "action": "焊接油缸和弹簧固定板",
        "description": "将图纸上标注为 6 的前油缸固定板 2 (01.01.01.11522) 焊接到 1 号铲板的内侧指定位置。然后，将标注为 7 的前弹簧固定板 1 (01.01.01.11523) 和标注为 8 的后弹簧固定板 2 (01.01.01.11524) 焊接到铲板内侧的相应位置。",
        "position_description": "6号、7号、8号零件均位于铲板内侧，根据图纸上的尺寸和孔位进行精确对位。",
        "parts_used": [
          {
            "bom_seq": "6",
            "bom_name": "前油缸固定板 2",
            "quantity": 2,
            "drawing_number": "6",
            "node_name": [
              "NAUO8",
              "NAUO7"
            ],
            "bom_code": "01.01.01.11522"
          },
          {
            "bom_seq": "7",
            "bom_name": "前弹簧固定板 1",
            "quantity": 1,
            "drawing_number": "7",
            "node_name": [
              "NAUO9"
            ],
            "bom_code": "01.01.01.11523"
          },
          {
            "bom_seq": "8",
            "bom_name": "后弹簧固定板 2",
            "quantity": 2,
            "drawing_number": "8",
            "node_name": [
              "NAUO11",
              "NAUO10"
            ],
            "bom_code": "01.01.01.11524"
          }
        ],
        "tools": [
          "焊机",
          "卡尺",
          "定位工装（如有）"
        ],
        "warnings": [
          "这些固定板是关键受力件，必须保证焊接强度和位置精度，特别是孔位中心距。"
        ],
        "welding": {
          "required": true,
          "welding_type": "角焊",
          "welding_method": "CO2气保焊",
          "weld_size": "焊缝高度6mm（或按图纸要求），连续焊",
          "welding_position": "零件6、7、8与零件1（左铲板）的连接处，主要为平焊和横焊",
          "quality_requirements": "焊缝必须连续、饱满，无咬边、气孔等缺陷。关键孔位中心距偏差控制在±0.5mm以内。",
          "safety_notes": "由于是关键受力件，焊接前必须预热（如果材料厚度大于20mm），防止产生焊接裂纹。使用定位工装确保精度。"
        },
        "safety_warnings": [
          "佩戴焊接面罩、防护手套和防护服，防止弧光和高温烫伤",
          "焊接关键受力件时，注意控制热输入，防止因变形或裂纹导致结构失效",
          "确保工作区域通风良好，避免焊接烟尘聚集"
        ]
      },
      {
        "step_number": 5,
        "action": "焊接支撑固定板",
        "description": "将图纸上标注为 9 的支撑固定板 1 (01.01.01.11525) 焊接到 1 号铲板的内侧，位于底部连接板上方，作为支撑结构。",
        "position_description": "位于铲板内侧，靠近底部。",
        "parts_used": [
          {
            "bom_seq": "9",
            "bom_name": "支撑固定板 1",
            "quantity": 1,
            "drawing_number": "9",
            "node_name": [
              "NAUO16"
            ],
            "bom_code": "01.01.01.11525"
          }
        ],
        "tools": [
          "焊机"
        ],
        "warnings": [
          "确保焊缝连续且符合图纸要求。"
        ],
        "welding": {
          "required": true,
          "welding_type": "角焊",
          "welding_method": "CO2气保焊",
          "weld_size": "焊缝高度6mm，连续焊",
          "welding_position": "零件9与零件1（左铲板）的连接处，平焊",
          "quality_requirements": "焊缝外观平整，过渡圆滑，焊后清理焊渣。",
          "safety_notes": "注意焊接电流和电压的匹配，避免飞溅过多，保护好周围已定位的零件。"
        },
        "safety_warnings": [
          "佩戴焊接面罩和防护手套，防止弧光和烫伤",
          "注意控制焊接飞溅，防止高温飞溅物伤及身体或引燃周围物品"
        ]
      },
      {
        "step_number": 6,
        "action": "焊接轴套加强板和轴套",
        "description": "将图纸上标注为 10 的轴套加强板 2 (01.01.01.11526) 焊接到 1 号铲板的侧面。然后，将标注为 12 的轴套 2 (01.01.02.1222) 放置在 10 号加强板的孔位上，并进行焊接。注意轴套的端面应与加强板端面配合，焊缝需饱满。",
        "position_description": "位于铲板侧面，靠近后部。",
        "parts_used": [
          {
            "bom_seq": "10",
            "bom_name": "轴套加强板 2",
            "quantity": 2,
            "drawing_number": "10",
            "node_name": [
              "NAUO18",
              "NAUO17"
            ],
            "bom_code": "01.01.01.11526"
          },
          {
            "bom_seq": "12",
            "bom_name": "轴套 2",
            "quantity": 2,
            "drawing_number": "12",
            "node_name": [
              "NAUO21",
              "NAUO20"
            ],
            "bom_code": "01.01.02.1222"
          }
        ],
        "tools": [
          "焊机",
          "卡尺"
        ],
        "warnings": [
          "轴套（12号）的焊接必须保证其轴线与图纸要求平行或垂直，确保后续销轴顺利安装。端面配合，不可焊死。"
        ],
        "welding": {
          "required": true,
          "welding_type": "角焊和环形焊",
          "welding_method": "CO2气保焊或手工电弧焊",
          "weld_size": "轴套与加强板环形焊，焊缝高度4mm；加强板与铲板角焊，焊缝高度6mm",
          "welding_position": "零件10与零件1（左铲板）的连接处，零件12与零件10的连接处，可能涉及横焊",
          "quality_requirements": "轴套焊接时，必须使用定位销或工装保证轴线精度。焊缝必须全熔透，无裂纹。轴套端面严禁焊穿或焊死。",
          "safety_notes": "轴套焊接时，应采用分段、对称、跳焊方式，控制热输入，防止轴套变形影响精度。"
        },
        "safety_warnings": [
          "佩戴焊接面罩和防护手套，防止弧光和烫伤",
          "进行环形焊时，注意焊枪角度和姿势，防止焊渣飞溅到身体",
          "轴套焊接后温度高，严禁徒手触摸，防止烫伤"
        ]
      },
      {
        "step_number": 7,
        "action": "焊接反光片安装板",
        "description": "将图纸上标注为 11 的反光片安装板 1 (01.01.01.11527) 焊接到 1 号铲板的侧面指定位置。",
        "position_description": "位于铲板侧面，靠近前部。",
        "parts_used": [
          {
            "bom_seq": "11",
            "bom_name": "反光片安装板 1",
            "quantity": 1,
            "drawing_number": "11",
            "node_name": [
              "NAUO19"
            ],
            "bom_code": "01.01.01.11527"
          }
        ],
        "tools": [
          "焊机"
        ],
        "warnings": [
          "注意安装板的方向，确保反光片安装面朝外。"
        ],
        "welding": {
          "required": true,
          "welding_type": "角焊",
          "welding_method": "CO2气保焊",
          "weld_size": "焊缝高度4mm，连续焊",
          "welding_position": "零件11与零件1（左铲板）的连接处，横焊",
          "quality_requirements": "焊缝外观整洁，不影响反光片的安装平面。",
          "safety_notes": "焊接前清理零件表面油污和锈蚀，避免产生气孔。"
        },
        "safety_warnings": [
          "佩戴焊接面罩和防护手套，防止弧光和烫伤",
          "焊接前必须清理零件表面的油污和锈蚀，防止焊接时产生有毒烟雾或飞溅"
        ]
      },
      {
        "step_number": 8,
        "action": "焊接方形板",
        "description": "将图纸上标注为 13 的方形板 1 (01.01.01.11528) 和标注为 14 的方形板 3 (01.01.01.11529) 焊接到 1 号铲板的内侧，作为加强和连接点。",
        "position_description": "位于铲板内侧，根据图纸尺寸定位。",
        "parts_used": [
          {
            "bom_seq": "13",
            "bom_name": "方形板 1",
            "quantity": 1,
            "drawing_number": "13"
          },
          {
            "bom_seq": "14",
            "bom_name": "方形板 3",
            "quantity": 1,
            "drawing_number": "14",
            "node_name": [
              "NAUO24",
              "NAUO23",
              "NAUO22"
            ],
            "bom_code": "01.01.01.11529"
          }
        ],
        "tools": [
          "焊机"
        ],
        "warnings": [
          "确保焊接牢固，无虚焊。"
        ],
        "welding": {
          "required": true,
          "welding_type": "角焊",
          "welding_method": "CO2气保焊",
          "weld_size": "焊缝高度6mm，连续焊",
          "welding_position": "零件13和零件14与零件1（左铲板）的连接处，平焊",
          "quality_requirements": "焊缝强度要求高，确保焊缝连续，无夹渣。",
          "safety_notes": "焊接过程中，注意控制焊接速度，避免熔池过大导致烧穿或变形。"
        },
        "safety_warnings": [
          "佩戴焊接面罩和防护手套，防止弧光和烫伤",
          "注意控制焊接速度和电流，防止烧穿薄板或造成大面积变形"
        ]
      },
      {
        "step_number": 9,
        "action": "焊接左铲雪板加强板",
        "description": "将图纸上标注为 15 的左铲雪板加强板 2 (01.02.01.4983) 焊接到 1 号铲板的内侧，作为最终的结构加强。",
        "position_description": "位于铲板内侧，靠近顶部边缘。",
        "parts_used": [
          {
            "bom_seq": "15",
            "bom_name": "左铲雪板加强板 2",
            "quantity": 2,
            "drawing_number": "15",
            "node_name": [
              "NAUO26",
              "NAUO25"
            ],
            "bom_code": "01.02.01.4983"
          }
        ],
        "tools": [
          "焊机"
        ],
        "warnings": [
          "这是最后一块结构件，焊接完成后进行整体检查。"
        ],
        "welding": {
          "required": true,
          "welding_type": "角焊",
          "welding_method": "CO2气保焊",
          "weld_size": "焊缝高度6mm，连续焊",
          "welding_position": "零件15与零件1（左铲板）的连接处，平焊",
          "quality_requirements": "焊缝必须达到二级焊缝标准，外观平整，无明显缺陷。",
          "safety_notes": "焊接完成后，立即进行焊缝外观检查，发现缺陷及时修补。"
        },
        "safety_warnings": [
          "佩戴焊接面罩和防护手套，防止弧光和烫伤",
          "焊接完成后，零件温度较高，设置警示标识，防止他人误触烫伤"
        ]
      },
      {
        "step_number": 10,
        "action": "满焊及清理",
        "description": "对所有已点焊的零件进行满焊，确保所有焊缝符合图纸要求。焊接完成后，对焊渣、飞溅物进行彻底清理，并打磨平整。",
        "position_description": "所有焊接部位",
        "parts_used": [],
        "tools": [
          "焊机",
          "角磨机",
          "钢丝刷"
        ],
        "warnings": [
          "清理时注意保护眼睛和皮肤。确保所有焊缝无裂纹、气孔、夹渣等缺陷。"
        ],
        "welding": {
          "required": true,
          "welding_type": "所有结构焊缝",
          "welding_method": "CO2气保焊为主",
          "weld_size": "按图纸标注尺寸（主要为6mm焊脚高度）",
          "welding_position": "所有零件与铲板的连接处，涉及平焊、横焊、立焊",
          "quality_requirements": "所有焊缝必须连续、饱满，焊缝表面不得有裂纹、未熔合、未焊透。焊后进行外观检查，关键受力部位（如油缸固定板）建议进行磁粉检测（MT）。",
          "safety_notes": "满焊时热输入量大，注意控制整体变形。打磨清理时，必须佩戴防护眼镜和防尘口罩，防止金属粉尘和火花伤害。"
        },
        "safety_warnings": [
          "满焊时热量大，必须穿戴全套防护用品，防止大面积烫伤",
          "使用角磨机清理焊渣和打磨时，必须佩戴防护眼镜和防尘口罩，防止飞溅物和金属粉尘伤害眼睛和呼吸道",
          "使用角磨机时，注意站位和握持姿势，防止砂轮片破碎或机器反弹伤人",
          "清理后的焊渣和废弃物应及时放入指定容器，保持工作区域整洁"
        ]
      }
    ]
  }
}