{
  "agent_name": "Agent6_FAQ",
  "model": "google/gemini-2.5-flash-preview-09-2025",
  "timestamp": "20251007_072022",
  "image_count": 0,
  "temperature": 0.2,
  "system_prompt": "# 角色定位\n\n你是**李师傅**，一位拥有20年安全管理经验的高级安全工程师。\n\n## 教育背景\n\n- **学历**：安全工程专业本科\n- **职业资格**：注册安全工程师、高级安全评价师\n- **专业培训**：\n  - 机械制造安全管理\n  - 职业健康与安全管理体系（ISO 45001）\n  - 事故调查与分析\n  - 应急预案编制与演练\n\n## 职业背景\n\n- **工作经历**：20年机械制造企业安全管理经验，参与过大型装备制造、钢结构加工等项目\n- **专业领域**：\n  - 机械加工安全（车、铣、刨、磨、钻等）\n  - 焊接作业安全（电焊、气焊、氩弧焊等）\n  - 起重吊装安全（行车、叉车、吊索具等）\n  - 高空作业安全（脚手架、安全带、防坠落等）\n  - 个人防护用品管理（安全帽、防护眼镜、手套、安全鞋等）\n\n## 知识结构（详细）\n\n### 1. 机械伤害风险\n- **夹伤/挤伤**：手指、手臂被运动部件夹住\n- **切割伤**：锋利边缘、毛刺、切削工具\n- **碰撞伤**：头部碰撞、身体碰撞\n- **坠落伤**：零件坠落、工具坠落、人员坠落\n\n### 2. 焊接作业风险\n- **电击伤**：焊机漏电、接地不良\n- **弧光伤**：电弧紫外线灼伤眼睛和皮肤\n- **烫伤**：高温熔池、焊渣飞溅\n- **火灾爆炸**：易燃物引燃、气瓶泄漏\n- **有毒气体**：焊接烟尘、一氧化碳中毒\n\n### 3. 起重吊装风险\n- **吊物坠落**：吊索具断裂、捆绑不牢\n- **吊物摆动**：碰撞人员、设备\n- **超载**：超过起重机额定载荷\n- **指挥失误**：信号不清、违章指挥\n\n### 4. 高空作业风险\n- **人员坠落**：未系安全带、脚手架不牢\n- **物体打击**：工具、零件从高处坠落\n- **脚手架坍塌**：搭设不规范、超载\n\n### 5. 个人防护用品\n- **头部防护**：安全帽（防止碰撞、坠物打击）\n- **眼部防护**：防护眼镜、焊接面罩（防止飞溅、弧光）\n- **手部防护**：防护手套（防止切割、烫伤、化学品）\n- **足部防护**：安全鞋（防砸、防刺穿、防滑）\n- **呼吸防护**：防尘口罩、防毒面具（防止粉尘、有毒气体）\n\n### 6. 应急处理\n- **机械伤害**：立即停机、呼救、止血、固定、送医\n- **电击伤**：切断电源、心肺复苏、送医\n- **烫伤**：冷水冲洗、覆盖无菌纱布、送医\n- **火灾**：使用灭火器、疏散人员、报警\n\n## 任务步骤（Chain of Thought）\n\n你的任务是**为每个装配步骤添加安全警告**（如果该步骤有安全风险）。请按照以下5个步骤思考：\n\n### 步骤1：识别风险步骤\n- 分析每个装配步骤的操作内容\n- 判断是否涉及高风险作业（焊接、吊装、高空、重物搬运等）\n- 识别潜在的伤害类型（机械伤害、电击、烫伤、坠落等）\n\n### 步骤2：分析风险源\n- 确定风险的来源（设备、工具、材料、环境、人员操作等）\n- 评估风险的严重程度（轻微、中等、严重、致命）\n- 考虑风险的发生概率\n\n### 步骤3：制定预防措施\n- 针对每个风险源，制定具体的预防措施\n- 强调个人防护用品的使用\n- 强调安全操作规程的遵守\n\n### 步骤4：添加安全警告\n- 为每个有风险的步骤添加safety_warnings字段\n- 每条警告要简洁明了，说明具体的风险和预防措施\n- 使用工人能看懂的语言\n\n### 步骤5：验证完整性\n- 检查所有高风险步骤是否都添加了安全警告\n- 检查安全警告是否具体、可操作\n- 检查是否遗漏了任何潜在风险\n\n## 核心原则\n\n1. **步骤级嵌入**：为每个有风险的步骤添加safety_warnings字段，而不是单独列出安全警告\n2. **工人友好**：使用通俗语言，避免专业术语\n3. **具体可操作**：说明具体的风险和预防措施，而不是泛泛而谈\n4. **不重复显示**：安全警告只在下方\"安全\"标签页中统一显示，不在当前步骤详情中重复显示\n\n## 输出格式\n\n严格按照以下JSON格式输出（返回增强后的装配步骤）：\n\n```json\n{\n  \"enhanced_steps\": [\n    {\n      \"step_number\": 1,\n      \"title\": \"点焊定位\",\n      \"parts_used\": [...],\n      \"tools_required\": [...],\n      \"operation\": \"操作说明\",\n      \"quality_check\": \"质量检查\",\n      \"estimated_time_minutes\": 10,\n      \"welding\": {\n        \"required\": true,\n        \"welding_type\": \"点焊\",\n        \"welding_method\": \"CO2气保焊\",\n        ...\n      },\n      \"safety_warnings\": [\n        \"佩戴焊接面罩和防护手套，防止弧光灼伤眼睛和皮肤\",\n        \"确保工件夹紧牢固，防止点焊时位移造成伤害\",\n        \"焊接区域周围3米内不得有易燃物，配备灭火器\",\n        \"焊机必须接地良好，防止漏电触电\"\n      ]\n    },\n    {\n      \"step_number\": 2,\n      \"title\": \"螺栓连接\",\n      \"parts_used\": [...],\n      \"operation\": \"操作说明\",\n      \"quality_check\": \"质量检查\",\n      \"estimated_time_minutes\": 15,\n      \"safety_warnings\": [\n        \"佩戴安全帽和防护眼镜，防止零件坠落和飞溅\",\n        \"使用扭力扳手时注意力度，防止扳手滑脱伤人\"\n      ]\n    },\n    {\n      \"step_number\": 3,\n      \"title\": \"简单装配\",\n      \"parts_used\": [...],\n      \"operation\": \"操作说明\",\n      \"quality_check\": \"质量检查\",\n      \"estimated_time_minutes\": 5\n      // ⚠️ 如果没有明显安全风险，不添加safety_warnings字段\n    }\n  ]\n}\n```\n\n**⚠️ 关键要求**：\n\n1. **步骤级嵌入**：\n   - 为每个有风险的步骤添加`safety_warnings`字段\n   - 没有明显风险的步骤不添加`safety_warnings`字段\n   - 保持原有步骤的所有字段不变\n\n2. **安全警告要具体**：\n   - ✅ 说\"佩戴焊接面罩和防护手套，防止弧光灼伤眼睛和皮肤\"\n   - ❌ 不说\"注意安全\"\n   - ✅ 说\"焊接区域周围3米内不得有易燃物，配备灭火器\"\n   - ❌ 不说\"注意防火\"\n\n3. **使用通俗语言**：\n   - 工人能看懂的语言\n   - 避免专业术语和英文缩写\n\n4. **警告要全面**：\n   - 涵盖个人防护、设备安全、环境安全、操作安全\n   - 每条警告说明具体的风险和预防措施\n\n## 重要提醒\n\n- **只输出JSON，不要输出其他内容**\n- **保持原有字段不变**：不要修改或删除原有的字段（包括welding字段）\n- **警告要简洁明了**：每条警告一句话，说明风险和预防措施\n- **不要过度警告**：只针对有明显风险的步骤添加警告\n",
  "user_query": "请为以下装配步骤添加安全警告（如果有安全风险）。\n\n## 📸 视觉分析任务\n\n**你会看到工程图纸图片，请仔细观察：**\n\n1. **危险作业标识**：\n   - 图纸上的安全警告标识\n   - 特殊作业要求（如高空作业、吊装作业等）\n   - 危险区域标注\n\n2. **零件特征**：\n   - 重型零件（需要吊装）\n   - 锋利边缘（容易割伤）\n   - 高温部件（容易烫伤）\n\n3. **作业环境**：\n   - 狭窄空间（容易碰撞）\n   - 高空位置（容易坠落）\n   - 密闭空间（通风不良）\n\n## 装配步骤\n\n[\n  {\n    \"step_number\": 1,\n    \"action\": \"放置基准件\",\n    \"description\": \"将图纸上标注为1的方形板（01.01.01.11511）平稳放置在焊接工作台上，作为整个组件的装配基准。\",\n    \"position_description\": \"平放于工作台，确保水平。\",\n    \"parts_used\": [\n      {\n        \"bom_seq\": \"1\",\n        \"bom_name\": \"方形板-机加 1\",\n        \"quantity\": 1,\n        \"drawing_number\": \"1\",\n        \"node_name\": [\n          \"NAUO1\"\n        ],\n        \"bom_code\": \"01.01.01.11511\"\n      }\n    ],\n    \"tools\": [\n      \"行车/吊具\",\n      \"水平仪\"\n    ],\n    \"warnings\": [\n      \"方形板较重（15.79kg），吊装时注意安全，确保吊具捆绑牢固。\",\n      \"检查基准件表面无油污、锈蚀。\"\n    ]\n  },\n  {\n    \"step_number\": 2,\n    \"action\": \"安装上连接板\",\n    \"description\": \"将图纸上标注为2的上连接板（01.01.01.11512）放置在1号方形板的顶部边缘，按照图纸尺寸定位，并进行点焊固定。\",\n    \"position_description\": \"放置在1号方形板的顶部边缘，注意两块上连接板的间距和方向。\",\n    \"parts_used\": [\n      {\n        \"bom_seq\": \"2\",\n        \"bom_name\": \"上连接板 2\",\n        \"quantity\": 2,\n        \"drawing_number\": \"2\",\n        \"node_name\": [\n          \"NAUO3\",\n          \"NAUO2\"\n        ],\n        \"bom_code\": \"01.01.01.11512\"\n      }\n    ],\n    \"tools\": [\n      \"焊机\",\n      \"卷尺\",\n      \"角尺\"\n    ],\n    \"warnings\": [\n      \"点焊前必须确保上连接板与方形板的相对位置和角度准确。\",\n      \"注意焊接变形控制。\"\n    ],\n    \"welding\": {\n      \"required\": true,\n      \"welding_type\": \"角焊（定位焊）\",\n      \"welding_method\": \"CO2气保焊\",\n      \"weld_size\": \"点焊长度10-15mm，焊脚高度4mm\",\n      \"welding_position\": \"零件1（方形板）与零件2（上连接板）的连接处，平焊\",\n      \"quality_requirements\": \"点焊牢固，位置准确，焊点无裂纹，焊渣清理干净。\",\n      \"safety_notes\": \"佩戴焊接面罩和防护手套，确保工作区域通风良好，防止火花飞溅。\"\n    }\n  },\n  {\n    \"step_number\": 3,\n    \"action\": \"安装侧连接板\",\n    \"description\": \"将图纸上标注为3的侧连接板（01.01.01.11513）垂直放置在1号方形板的两侧，并与已点焊的2号上连接板对齐，进行点焊固定。\",\n    \"position_description\": \"垂直于1号方形板，位于两侧，与2号上连接板形成框架。\",\n    \"parts_used\": [\n      {\n        \"bom_seq\": \"3\",\n        \"bom_name\": \"侧连接板 2\",\n        \"quantity\": 2,\n        \"drawing_number\": \"3\",\n        \"node_name\": [\n          \"NAUO5\",\n          \"NAUO4\"\n        ],\n        \"bom_code\": \"01.01.01.11513\"\n      }\n    ],\n    \"tools\": [\n      \"焊机\",\n      \"角尺\",\n      \"夹具\"\n    ],\n    \"warnings\": [\n      \"侧连接板较重（24.97kg），安装时需使用夹具辅助定位。\",\n      \"确保侧连接板与方形板的垂直度。\"\n    ],\n    \"welding\": {\n      \"required\": true,\n      \"welding_type\": \"角焊（定位焊）\",\n      \"welding_method\": \"CO2气保焊\",\n      \"weld_size\": \"点焊长度15-20mm，焊脚高度5mm\",\n      \"welding_position\": \"零件1（方形板）与零件3（侧连接板）的连接处，平焊/横焊\",\n      \"quality_requirements\": \"使用角尺检查垂直度，点焊后尺寸偏差控制在±1mm以内。\",\n      \"safety_notes\": \"使用夹具固定零件，防止定位焊时零件倾倒。注意电缆绝缘完好。\"\n    }\n  },\n  {\n    \"step_number\": 4,\n    \"action\": \"安装折弯板\",\n    \"description\": \"将图纸上标注为4的折弯板（01.01.01.11514）安装在侧连接板（3）的指定位置，进行点焊固定。\",\n    \"position_description\": \"位于侧连接板（3）的下部，按照图纸尺寸定位。\",\n    \"parts_used\": [\n      {\n        \"bom_seq\": \"4\",\n        \"bom_name\": \"折弯板 1\",\n        \"quantity\": 1,\n        \"drawing_number\": \"4\",\n        \"node_name\": [\n          \"NAUO6\"\n        ],\n        \"bom_code\": \"01.01.01.11514\"\n      }\n    ],\n    \"tools\": [\n      \"焊机\",\n      \"卷尺\"\n    ],\n    \"warnings\": [\n      \"折弯板的安装方向必须正确，注意孔位朝向。\"\n    ],\n    \"welding\": {\n      \"required\": true,\n      \"welding_type\": \"角焊（定位焊）\",\n      \"welding_method\": \"CO2气保焊\",\n      \"weld_size\": \"点焊长度10mm，焊脚高度4mm\",\n      \"welding_position\": \"零件3（侧连接板）与零件4（折弯板）的连接处，横焊\",\n      \"quality_requirements\": \"定位焊点均匀分布，确保折弯板与侧连接板贴合紧密。\",\n      \"safety_notes\": \"检查焊机接地线连接可靠，防止触电。\"\n    }\n  },\n  {\n    \"step_number\": 5,\n    \"action\": \"安装油缸固定板\",\n    \"description\": \"将图纸上标注为5的油缸固定板（01.01.01.11515）安装在侧连接板（3）和折弯板（4）的连接处，按照图纸尺寸定位，并进行点焊固定。\",\n    \"position_description\": \"位于侧连接板（3）的外部，共4块，对称安装。\",\n    \"parts_used\": [\n      {\n        \"bom_seq\": \"5\",\n        \"bom_name\": \"油缸固定板 4\",\n        \"quantity\": 4,\n        \"drawing_number\": \"5\",\n        \"node_name\": [\n          \"NAUO17\",\n          \"NAUO16\",\n          \"NAUO8\",\n          \"NAUO7\"\n        ],\n        \"bom_code\": \"01.01.01.11515\"\n      }\n    ],\n    \"tools\": [\n      \"焊机\",\n      \"定位销\"\n    ],\n    \"warnings\": [\n      \"油缸固定板的孔位是关键尺寸，必须使用定位销或样板确保孔位精度。\"\n    ],\n    \"welding\": {\n      \"required\": true,\n      \"welding_type\": \"角焊（定位焊）\",\n      \"welding_method\": \"CO2气保焊\",\n      \"weld_size\": \"点焊长度10mm，焊脚高度4mm\",\n      \"welding_position\": \"零件3（侧连接板）与零件5（油缸固定板）的连接处，横焊/立焊\",\n      \"quality_requirements\": \"定位焊后，检查油缸固定板的孔位尺寸和垂直度，确保符合图纸要求。\",\n      \"safety_notes\": \"定位焊时注意保持姿势稳定，避免焊枪线缆缠绕。\"\n    }\n  },\n  {\n    \"step_number\": 6,\n    \"action\": \"安装加强板\",\n    \"description\": \"将图纸上标注为6的加强板（01.01.01.11516）安装在2号上连接板的内侧，按照图纸尺寸定位，并进行点焊固定。\",\n    \"position_description\": \"位于2号上连接板的内侧，共4块，用于加强结构刚度。\",\n    \"parts_used\": [\n      {\n        \"bom_seq\": \"6\",\n        \"bom_name\": \"加强板 4\",\n        \"quantity\": 4,\n        \"drawing_number\": \"6\",\n        \"node_name\": [\n          \"NAUO12\",\n          \"NAUO11\",\n          \"NAUO10\",\n          \"NAUO9\"\n        ],\n        \"bom_code\": \"01.01.01.11516\"\n      }\n    ],\n    \"tools\": [\n      \"焊机\",\n      \"卷尺\"\n    ],\n    \"warnings\": [\n      \"加强板的安装位置必须准确，避免干涉后续零件安装。\"\n    ],\n    \"welding\": {\n      \"required\": true,\n      \"welding_type\": \"角焊（定位焊）\",\n      \"welding_method\": \"CO2气保焊\",\n      \"weld_size\": \"点焊长度8mm，焊脚高度3mm\",\n      \"welding_position\": \"零件2（上连接板）与零件6（加强板）的连接处，平焊\",\n      \"quality_requirements\": \"加强板与上连接板贴合紧密，定位焊点均匀，防止后续满焊时变形。\",\n      \"safety_notes\": \"清理焊接区域的杂物，确保操作空间足够。\"\n    }\n  },\n  {\n    \"step_number\": 7,\n    \"action\": \"安装角钢\",\n    \"description\": \"将图纸上标注为7的角钢-机加（01.01.04.0592）安装在2号上连接板的顶部，按照图纸尺寸定位，并进行点焊固定。\",\n    \"position_description\": \"位于2号上连接板的顶部，靠近组件中心线。\",\n    \"parts_used\": [\n      {\n        \"bom_seq\": \"7\",\n        \"bom_name\": \"角钢-机加 1\",\n        \"quantity\": 1,\n        \"drawing_number\": \"7\",\n        \"node_name\": [\n          \"NAUO13\"\n        ],\n        \"bom_code\": \"01.01.04.0592\"\n      }\n    ],\n    \"tools\": [\n      \"焊机\",\n      \"角尺\"\n    ],\n    \"warnings\": [\n      \"角钢的安装方向和角度必须符合图纸要求。\"\n    ],\n    \"welding\": {\n      \"required\": true,\n      \"welding_type\": \"角焊（定位焊）\",\n      \"welding_method\": \"CO2气保焊\",\n      \"weld_size\": \"点焊长度10mm，焊脚高度4mm\",\n      \"welding_position\": \"零件2（上连接板）与零件7（角钢）的连接处，平焊\",\n      \"quality_requirements\": \"角钢与上连接板接触面平整，定位焊后检查角度。\",\n      \"safety_notes\": \"注意角钢边缘可能锋利，操作时佩戴防护手套。\"\n    }\n  },\n  {\n    \"step_number\": 8,\n    \"action\": \"安装轴套（8号）\",\n    \"description\": \"将图纸上标注为8的轴套（01.01.02.1221）安装在侧连接板（3）上方的指定孔位，进行点焊固定。\",\n    \"position_description\": \"位于侧连接板（3）上方的圆孔处。\",\n    \"parts_used\": [\n      {\n        \"bom_seq\": \"8\",\n        \"bom_name\": \"轴套 1\",\n        \"quantity\": 1,\n        \"drawing_number\": \"8\",\n        \"node_name\": [\n          \"NAUO14\"\n        ],\n        \"bom_code\": \"01.01.02.1221\"\n      }\n    ],\n    \"tools\": [\n      \"焊机\",\n      \"塞规\"\n    ],\n    \"warnings\": [\n      \"轴套的中心线必须垂直于侧连接板表面，确保焊接时轴套内孔不受污染。\"\n    ],\n    \"welding\": {\n      \"required\": true,\n      \"welding_type\": \"角焊（定位焊）\",\n      \"welding_method\": \"CO2气保焊/手工电弧焊\",\n      \"weld_size\": \"点焊3-4点，焊脚高度4mm\",\n      \"welding_position\": \"零件3（侧连接板）与零件8（轴套）的连接处，横焊/立焊\",\n      \"quality_requirements\": \"轴套定位必须垂直，内孔需用塞规或堵头保护，防止焊渣飞溅进入。\",\n      \"safety_notes\": \"轴套定位时需使用工装或夹具，确保定位准确，防止焊接应力导致轴套倾斜。\"\n    }\n  },\n  {\n    \"step_number\": 9,\n    \"action\": \"安装后座轴套（9号）\",\n    \"description\": \"将图纸上标注为9的后座轴套（01.02.02.0490）安装在侧连接板（3）下方的指定孔位，进行点焊固定。\",\n    \"position_description\": \"位于侧连接板（3）下方的圆孔处。\",\n    \"parts_used\": [\n      {\n        \"bom_seq\": \"9\",\n        \"bom_name\": \"后座轴套 1\",\n        \"quantity\": 1,\n        \"drawing_number\": \"9\",\n        \"node_name\": [\n          \"NAUO15\"\n        ],\n        \"bom_code\": \"01.02.02.0490\"\n      }\n    ],\n    \"tools\": [\n      \"焊机\",\n      \"塞规\"\n    ],\n    \"warnings\": [\n      \"确保9号轴套与8号轴套的同轴度，必要时使用工装夹具定位。\"\n    ],\n    \"welding\": {\n      \"required\": true,\n      \"welding_type\": \"角焊（定位焊）\",\n      \"welding_method\": \"CO2气保焊/手工电弧焊\",\n      \"weld_size\": \"点焊3-4点，焊脚高度4mm\",\n      \"welding_position\": \"零件3（侧连接板）与零件9（后座轴套）的连接处，横焊/立焊\",\n      \"quality_requirements\": \"轴套定位必须垂直，使用工装检查8号和9号轴套的同轴度，偏差应在0.5mm以内。\",\n      \"safety_notes\": \"轴套内孔必须保护，防止焊接热量和飞溅物影响内孔精度。\"\n    }\n  },\n  {\n    \"step_number\": 10,\n    \"action\": \"安装后座轴套（10号）\",\n    \"description\": \"将图纸上标注为10的后座轴套（01.01.02.0337）安装在折弯板（4）的指定孔位，进行点焊固定。\",\n    \"position_description\": \"位于折弯板（4）的圆孔处。\",\n    \"parts_used\": [\n      {\n        \"bom_seq\": \"10\",\n        \"bom_name\": \"后座轴套 1\",\n        \"quantity\": 1,\n        \"drawing_number\": \"10\",\n        \"node_name\": [\n          \"NAUO18\"\n        ],\n        \"bom_code\": \"01.01.02.0337\"\n      }\n    ],\n    \"tools\": [\n      \"焊机\",\n      \"塞规\"\n    ],\n    \"warnings\": [\n      \"10号轴套的安装位置和角度是关键，需严格按照图纸要求定位。\"\n    ],\n    \"welding\": {\n      \"required\": true,\n      \"welding_type\": \"角焊（定位焊）\",\n      \"welding_method\": \"CO2气保焊/手工电弧焊\",\n      \"weld_size\": \"点焊3-4点，焊脚高度4mm\",\n      \"welding_position\": \"零件4（折弯板）与零件10（后座轴套）的连接处，平焊/横焊\",\n      \"quality_requirements\": \"轴套定位必须准确，确保其中心线与折弯板表面垂直。\",\n      \"safety_notes\": \"焊接前检查轴套与板材的间隙，间隙过大需打磨坡口或调整定位。\"\n    }\n  },\n  {\n    \"step_number\": 11,\n    \"action\": \"满焊及清理\",\n    \"description\": \"对所有已点焊的零件连接处进行满焊，焊缝尺寸和质量需符合图纸技术要求。焊接完成后，进行焊渣清理和飞溅物去除。\",\n    \"position_description\": \"所有零件的连接焊缝。\",\n    \"parts_used\": [],\n    \"tools\": [\n      \"焊机\",\n      \"角磨机\",\n      \"焊渣锤\"\n    ],\n    \"warnings\": [\n      \"焊接过程中注意控制热输入，防止组件变形。\",\n      \"焊缝应饱满、连续，不得有裂纹、气孔、夹渣等缺陷。\"\n    ],\n    \"welding\": {\n      \"required\": true,\n      \"welding_type\": \"角焊/对接焊（满焊）\",\n      \"welding_method\": \"CO2气保焊（MAG）\",\n      \"weld_size\": \"焊脚高度5mm（图纸未明确标注时，按板厚较薄者确定），轴套周围焊缝连续饱满。\",\n      \"welding_position\": \"所有零件连接处，涉及平焊、横焊、立焊（如侧连接板与方形板的连接）。\",\n      \"quality_requirements\": \"焊缝外观成型良好，焊波均匀，无咬边、未焊透、未熔合等缺陷。轴套焊缝需进行外观检查，关键承力焊缝（如侧板与底板）建议进行磁粉检测（MT）。\",\n      \"safety_notes\": \"进行满焊时，需穿戴全套防护服，包括防火服、焊接面罩、防护手套。注意采用分段、对称、跳焊等方法控制焊接变形，避免应力集中导致裂纹。焊接完成后，使用角磨机清理飞溅物和焊渣，注意防尘和防火。\"\n    }\n  }\n]\n\n## 要求\n\n请按照以下5个步骤思考，为装配步骤添加安全警告：\n\n### 步骤1：识别风险步骤\n- 分析每个装配步骤的操作内容\n- 判断是否涉及高风险作业：\n  * **焊接作业**：电击、弧光、烫伤、火灾\n  * **吊装作业**：吊物坠落、碰撞、超载\n  * **高空作业**：人员坠落、物体打击\n  * **重物搬运**：砸伤、扭伤、夹伤\n  * **机械加工**：切割伤、夹伤、碰撞\n\n### 步骤2：分析风险源\n- 确定风险的来源（设备、工具、材料、环境、人员操作等）\n- 评估风险的严重程度（轻微、中等、严重、致命）\n- 考虑风险的发生概率\n\n### 步骤3：制定预防措施\n- 针对每个风险源，制定具体的预防措施\n- 强调个人防护用品的使用：\n  * **焊接**：焊接面罩、防护手套、防护服\n  * **吊装**：安全帽、安全鞋、手套\n  * **高空**：安全带、安全帽、防滑鞋\n  * **机械**：防护眼镜、手套、安全鞋\n\n### 步骤4：添加安全警告\n- 为每个有风险的步骤添加safety_warnings字段\n- 每条警告要简洁明了，说明具体的风险和预防措施\n- 使用工人能看懂的语言\n\n### 步骤5：验证完整性\n- 检查所有高风险步骤是否都添加了安全警告\n- 检查安全警告是否具体、可操作\n- 检查是否遗漏了任何潜在风险\n\n## ⚠️ 强制自检清单（生成后必须逐项检查）\n\n**在输出JSON之前，你必须完成以下验证：**\n\n1. **风险步骤识别验证**：\n   - [ ] 所有涉及焊接、吊装、高空、重物搬运的步骤都添加了safety_warnings字段\n   - [ ] 没有明显风险的步骤没有添加safety_warnings字段\n\n2. **安全警告完整性验证**：\n   - [ ] 每个safety_warnings字段都是字符串数组\n   - [ ] 每条警告都说明了具体的风险和预防措施\n   - [ ] 涵盖了个人防护、设备安全、环境安全、操作安全\n\n3. **语言通俗性验证**：\n   - [ ] 使用工人能看懂的语言\n   - [ ] 避免专业术语和英文缩写\n   - [ ] 每条警告简洁明了（一句话）\n\n4. **原有字段保持验证**：\n   - [ ] 原有步骤的所有字段都保持不变（包括welding字段）\n   - [ ] 没有修改或删除任何原有字段\n\n**如果自检发现任何问题，必须重新生成！**\n\n现在开始为装配步骤添加安全警告！\n",
  "raw_response": "```json\n{\n  \"enhanced_steps\": [\n    {\n      \"step_number\": 1,\n      \"action\": \"放置基准件\",\n      \"description\": \"将图纸上标注为1的方形板（01.01.01.11511）平稳放置在焊接工作台上，作为整个组件的装配基准。\",\n      \"position_description\": \"平放于工作台，确保水平。\",\n      \"parts_used\": [\n        {\n          \"bom_seq\": \"1\",\n          \"bom_name\": \"方形板-机加 1\",\n          \"quantity\": 1,\n          \"drawing_number\": \"1\",\n          \"node_name\": [\n            \"NAUO1\"\n          ],\n          \"bom_code\": \"01.01.01.11511\"\n        }\n      ],\n      \"tools\": [\n        \"行车/吊具\",\n        \"水平仪\"\n      ],\n      \"warnings\": [\n        \"方形板较重（15.79kg），吊装时注意安全，确保吊具捆绑牢固。\",\n        \"检查基准件表面无油污、锈蚀。\"\n      ],\n      \"safety_warnings\": [\n        \"佩戴安全帽和防护手套，防止吊装过程中零件坠落或夹伤。\",\n        \"使用行车吊装时，必须由专业司索人员指挥，确认吊具完好无损。\",\n        \"吊装路径上不得站人，确保重物平稳起落，防止碰撞。\"\n      ]\n    },\n    {\n      \"step_number\": 2,\n      \"action\": \"安装上连接板\",\n      \"description\": \"将图纸上标注为2的上连接板（01.01.01.11512）放置在1号方形板的顶部边缘，按照图纸尺寸定位，并进行点焊固定。\",\n      \"position_description\": \"放置在1号方形板的顶部边缘，注意两块上连接板的间距和方向。\",\n      \"parts_used\": [\n        {\n          \"bom_seq\": \"2\",\n          \"bom_name\": \"上连接板 2\",\n          \"quantity\": 2,\n          \"drawing_number\": \"2\",\n          \"node_name\": [\n            \"NAUO3\",\n            \"NAUO2\"\n          ],\n          \"bom_code\": \"01.01.01.11512\"\n        }\n      ],\n      \"tools\": [\n        \"焊机\",\n        \"卷尺\",\n        \"角尺\"\n      ],\n      \"warnings\": [\n        \"点焊前必须确保上连接板与方形板的相对位置和角度准确。\",\n        \"注意焊接变形控制。\"\n      ],\n      \"welding\": {\n        \"required\": true,\n        \"welding_type\": \"角焊（定位焊）\",\n        \"welding_method\": \"CO2气保焊\",\n        \"weld_size\": \"点焊长度10-15mm，焊脚高度4mm\",\n        \"welding_position\": \"零件1（方形板）与零件2（上连接板）的连接处，平焊\",\n        \"quality_requirements\": \"点焊牢固，位置准确，焊点无裂纹，焊渣清理干净。\",\n        \"safety_notes\": \"佩戴焊接面罩和防护手套，确保工作区域通风良好，防止火花飞溅。\"\n      },\n      \"safety_warnings\": [\n        \"佩戴焊接面罩、防护手套和防护服，防止电弧光灼伤和高温烫伤。\",\n        \"确保焊机接地良好，电缆绝缘完好，防止触电事故。\",\n        \"点焊区域周围3米内不得有易燃易爆物品，并准备好灭火器。\",\n        \"使用夹具固定零件，防止定位焊时零件倾倒或位移伤人。\"\n      ]\n    },\n    {\n      \"step_number\": 3,\n      \"action\": \"安装侧连接板\",\n      \"description\": \"将图纸上标注为3的侧连接板（01.01.01.11513）垂直放置在1号方形板的两侧，并与已点焊的2号上连接板对齐，进行点焊固定。\",\n      \"position_description\": \"垂直于1号方形板，位于两侧，与2号上连接板形成框架。\",\n      \"parts_used\": [\n        {\n          \"bom_seq\": \"3\",\n          \"bom_name\": \"侧连接板 2\",\n          \"quantity\": 2,\n          \"drawing_number\": \"3\",\n          \"node_name\": [\n            \"NAUO5\",\n            \"NAUO4\"\n          ],\n          \"bom_code\": \"01.01.01.11513\"\n        }\n      ],\n      \"tools\": [\n        \"焊机\",\n        \"角尺\",\n        \"夹具\"\n      ],\n      \"warnings\": [\n        \"侧连接板较重（24.97kg），安装时需使用夹具辅助定位。\",\n        \"确保侧连接板与方形板的垂直度。\"\n      ],\n      \"welding\": {\n        \"required\": true,\n        \"welding_type\": \"角焊（定位焊）\",\n        \"welding_method\": \"CO2气保焊\",\n        \"weld_size\": \"点焊长度15-20mm，焊脚高度5mm\",\n        \"welding_position\": \"零件1（方形板）与零件3（侧连接板）的连接处，平焊/横焊\",\n        \"quality_requirements\": \"使用角尺检查垂直度，点焊后尺寸偏差控制在±1mm以内。\",\n        \"safety_notes\": \"使用夹具固定零件，防止定位焊时零件倾倒。注意电缆绝缘完好。\"\n      },\n      \"safety_warnings\": [\n        \"侧连接板较重，搬运和安装时注意使用辅助工具或两人操作，防止砸伤或扭伤。\",\n        \"佩戴焊接面罩和防护手套，防止焊接飞溅物烫伤。\",\n        \"使用夹具固定时，确保夹具牢固可靠，防止零件突然倒塌。\",\n        \"检查焊机电源线和地线连接可靠，避免触电。\"\n      ]\n    },\n    {\n      \"step_number\": 4,\n      \"action\": \"安装折弯板\",\n      \"description\": \"将图纸上标注为4的折弯板（01.01.01.11514）安装在侧连接板（3）的指定位置，进行点焊固定。\",\n      \"position_description\": \"位于侧连接板（3）的下部，按照图纸尺寸定位。\",\n      \"parts_used\": [\n        {\n          \"bom_seq\": \"4\",\n          \"bom_name\": \"折弯板 1\",\n          \"quantity\": 1,\n          \"drawing_number\": \"4\",\n          \"node_name\": [\n            \"NAUO6\"\n          ],\n          \"bom_code\": \"01.01.01.11514\"\n        }\n      ],\n      \"tools\": [\n        \"焊机\",\n        \"卷尺\"\n      ],\n      \"warnings\": [\n        \"折弯板的安装方向必须正确，注意孔位朝向。\"\n      ],\n      \"welding\": {\n        \"required\": true,\n        \"welding_type\": \"角焊（定位焊）\",\n        \"welding_method\": \"CO2气保焊\",\n        \"weld_size\": \"点焊长度10mm，焊脚高度4mm\",\n        \"welding_position\": \"零件3（侧连接板）与零件4（折弯板）的连接处，横焊\",\n        \"quality_requirements\": \"定位焊点均匀分布，确保折弯板与侧连接板贴合紧密。\",\n        \"safety_notes\": \"检查焊机接地线连接可靠，防止触电。\"\n      },\n      \"safety_warnings\": [\n        \"佩戴防护手套，防止折弯板边缘或毛刺割伤。\",\n        \"进行点焊时，佩戴焊接面罩，防止弧光灼伤。\",\n        \"确保焊接区域通风良好，避免烟尘浓度过高。\"\n      ]\n    },\n    {\n      \"step_number\": 5,\n      \"action\": \"安装油缸固定板\",\n      \"description\": \"将图纸上标注为5的油缸固定板（01.01.01.11515）安装在侧连接板（3）和折弯板（4）的连接处，按照图纸尺寸定位，并进行点焊固定。\",\n      \"position_description\": \"位于侧连接板（3）的外部，共4块，对称安装。\",\n      \"parts_used\": [\n        {\n          \"bom_seq\": \"5\",\n          \"bom_name\": \"油缸固定板 4\",\n          \"quantity\": 4,\n          \"drawing_number\": \"5\",\n          \"node_name\": [\n            \"NAUO17\",\n            \"NAUO16\",\n            \"NAUO8\",\n            \"NAUO7\"\n          ],\n          \"bom_code\": \"01.01.01.11515\"\n        }\n      ],\n      \"tools\": [\n        \"焊机\",\n        \"定位销\"\n      ],\n      \"warnings\": [\n        \"油缸固定板的孔位是关键尺寸，必须使用定位销或样板确保孔位精度。\"\n      ],\n      \"welding\": {\n        \"required\": true,\n        \"welding_type\": \"角焊（定位焊）\",\n        \"welding_method\": \"CO2气保焊\",\n        \"weld_size\": \"点焊长度10mm，焊脚高度4mm\",\n        \"welding_position\": \"零件3（侧连接板）与零件5（油缸固定板）的连接处，横焊/立焊\",\n        \"quality_requirements\": \"定位焊后，检查油缸固定板的孔位尺寸和垂直度，确保符合图纸要求。\",\n        \"safety_notes\": \"定位焊时注意保持姿势稳定，避免焊枪线缆缠绕。\"\n      },\n      \"safety_warnings\": [\n        \"佩戴焊接面罩和防护手套，防止焊接飞溅物烫伤。\",\n        \"在立焊或横焊位置操作时，注意焊渣下落，防止烫伤脚部和身体。\",\n        \"确保焊枪线缆远离高温区域和运动部件，防止损坏或触电。\"\n      ]\n    },\n    {\n      \"step_number\": 6,\n      \"action\": \"安装加强板\",\n      \"description\": \"将图纸上标注为6的加强板（01.01.01.11516）安装在2号上连接板的内侧，按照图纸尺寸定位，并进行点焊固定。\",\n      \"position_description\": \"位于2号上连接板的内侧，共4块，用于加强结构刚度。\",\n      \"parts_used\": [\n        {\n          \"bom_seq\": \"6\",\n          \"bom_name\": \"加强板 4\",\n          \"quantity\": 4,\n          \"drawing_number\": \"6\",\n          \"node_name\": [\n            \"NAUO12\",\n            \"NAUO11\",\n            \"NAUO10\",\n            \"NAUO9\"\n          ],\n          \"bom_code\": \"01.01.01.11516\"\n        }\n      ],\n      \"tools\": [\n        \"焊机\",\n        \"卷尺\"\n      ],\n      \"warnings\": [\n        \"加强板的安装位置必须准确，避免干涉后续零件安装。\"\n      ],\n      \"welding\": {\n        \"required\": true,\n        \"welding_type\": \"角焊（定位焊）\",\n        \"welding_method\": \"CO2气保焊\",\n        \"weld_size\": \"点焊长度8mm，焊脚高度3mm\",\n        \"welding_position\": \"零件2（上连接板）与零件6（加强板）的连接处，平焊\",\n        \"quality_requirements\": \"加强板与上连接板贴合紧密，定位焊点均匀，防止后续满焊时变形。\",\n        \"safety_notes\": \"清理焊接区域的杂物，确保操作空间足够。\"\n      },\n      \"safety_warnings\": [\n        \"佩戴焊接面罩和防护手套，防止弧光和飞溅物伤害。\",\n        \"操作空间可能受限，注意头部和身体不要碰撞到已安装的零件边缘。\",\n        \"确保通风设备正常运行，及时排出焊接烟尘。\"\n      ]\n    },\n    {\n      \"step_number\": 7,\n      \"action\": \"安装角钢\",\n      \"description\": \"将图纸上标注为7的角钢-机加（01.01.04.0592）安装在2号上连接板的顶部，按照图纸尺寸定位，并进行点焊固定。\",\n      \"position_description\": \"位于2号上连接板的顶部，靠近组件中心线。\",\n      \"parts_used\": [\n        {\n          \"bom_seq\": \"7\",\n          \"bom_name\": \"角钢-机加 1\",\n          \"quantity\": 1,\n          \"drawing_number\": \"7\",\n          \"node_name\": [\n            \"NAUO13\"\n          ],\n          \"bom_code\": \"01.01.04.0592\"\n        }\n      ],\n      \"tools\": [\n        \"焊机\",\n        \"角尺\"\n      ],\n      \"warnings\": [\n        \"角钢的安装方向和角度必须符合图纸要求。\"\n      ],\n      \"welding\": {\n        \"required\": true,\n        \"welding_type\": \"角焊（定位焊）\",\n        \"welding_method\": \"CO2气保焊\",\n        \"weld_size\": \"点焊长度10mm，焊脚高度4mm\",\n        \"welding_position\": \"零件2（上连接板）与零件7（角钢）的连接处，平焊\",\n        \"quality_requirements\": \"角钢与上连接板接触面平整，定位焊后检查角度。\",\n        \"safety_notes\": \"注意角钢边缘可能锋利，操作时佩戴防护手套。\"\n      },\n      \"safety_warnings\": [\n        \"佩戴防护手套，防止角钢的锋利边缘割伤。\",\n        \"点焊时注意保持角钢的稳定，防止其突然移动。\",\n        \"焊接作业时，确保工作台面整洁，避免绊倒或工具掉落。\"\n      ]\n    },\n    {\n      \"step_number\": 8,\n      \"action\": \"安装轴套（8号）\",\n      \"description\": \"将图纸上标注为8的轴套（01.01.02.1221）安装在侧连接板（3）上方的指定孔位，进行点焊固定。\",\n      \"position_description\": \"位于侧连接板（3）上方的圆孔处。\",\n      \"parts_used\": [\n        {\n          \"bom_seq\": \"8\",\n          \"bom_name\": \"轴套 1\",\n          \"quantity\": 1,\n          \"drawing_number\": \"8\",\n          \"node_name\": [\n            \"NAUO14\"\n          ],\n          \"bom_code\": \"01.01.02.1221\"\n        }\n      ],\n      \"tools\": [\n        \"焊机\",\n        \"塞规\"\n      ],\n      \"warnings\": [\n        \"轴套的中心线必须垂直于侧连接板表面，确保焊接时轴套内孔不受污染。\"\n      ],\n      \"welding\": {\n        \"required\": true,\n        \"welding_type\": \"角焊（定位焊）\",\n        \"welding_method\": \"CO2气保焊/手工电弧焊\",\n        \"weld_size\": \"点焊3-4点，焊脚高度4mm\",\n        \"welding_position\": \"零件3（侧连接板）与零件8（轴套）的连接处，横焊/立焊\",\n        \"quality_requirements\": \"轴套定位必须垂直，内孔需用塞规或堵头保护，防止焊渣飞溅进入。\",\n        \"safety_notes\": \"轴套定位时需使用工装或夹具，确保定位准确，防止焊接应力导致轴套倾斜。\"\n      },\n      \"safety_warnings\": [\n        \"轴套内孔必须使用堵头保护，防止焊接飞溅物进入，影响后续使用。\",\n        \"使用工装夹具固定轴套，防止焊接时轴套松动或倾斜。\",\n        \"进行立焊或横焊时，注意调整焊接参数，防止熔渣下淌烫伤。\"\n      ]\n    },\n    {\n      \"step_number\": 9,\n      \"action\": \"安装后座轴套（9号）\",\n      \"description\": \"将图纸上标注为9的后座轴套（01.02.02.0490）安装在侧连接板（3）下方的指定孔位，进行点焊固定。\",\n      \"position_description\": \"位于侧连接板（3）下方的圆孔处。\",\n      \"parts_used\": [\n        {\n          \"bom_seq\": \"9\",\n          \"bom_name\": \"后座轴套 1\",\n          \"quantity\": 1,\n          \"drawing_number\": \"9\",\n          \"node_name\": [\n            \"NAUO15\"\n          ],\n          \"bom_code\": \"01.02.02.0490\"\n        }\n      ],\n      \"tools\": [\n        \"焊机\",\n        \"塞规\"\n      ],\n      \"warnings\": [\n        \"确保9号轴套与8号轴套的同轴度，必要时使用工装夹具定位。\"\n      ],\n      \"welding\": {\n        \"required\": true,\n        \"welding_type\": \"角焊（定位焊）\",\n        \"welding_method\": \"CO2气保焊/手工电弧焊\",\n        \"weld_size\": \"点焊3-4点，焊脚高度4mm\",\n        \"welding_position\": \"零件3（侧连接板）与零件9（后座轴套）的连接处，横焊/立焊\",\n        \"quality_requirements\": \"轴套定位必须垂直，使用工装检查8号和9号轴套的同轴度，偏差应在0.5mm以内。\",\n        \"safety_notes\": \"轴套内孔必须保护，防止焊接热量和飞溅物影响内孔精度。\"\n      },\n      \"safety_warnings\": [\n        \"佩戴焊接面罩和防护手套，防止焊接飞溅物和弧光伤害。\",\n        \"使用工装夹具确保轴套定位准确，防止焊接应力导致轴套变形。\",\n        \"焊接完成后，不要立即用手触摸轴套，防止高温烫伤。\"\n      ]\n    },\n    {\n      \"step_number\": 10,\n      \"action\": \"安装后座轴套（10号）\",\n      \"description\": \"将图纸上标注为10的后座轴套（01.01.02.0337）安装在折弯板（4）的指定孔位，进行点焊固定。\",\n      \"position_description\": \"位于折弯板（4）的圆孔处。\",\n      \"parts_used\": [\n        {\n          \"bom_seq\": \"10\",\n          \"bom_name\": \"后座轴套 1\",\n          \"quantity\": 1,\n          \"drawing_number\": \"10\",\n          \"node_name\": [\n            \"NAUO18\"\n          ],\n          \"bom_code\": \"01.01.02.0337\"\n        }\n      ],\n      \"tools\": [\n        \"焊机\",\n        \"塞规\"\n      ],\n      \"warnings\": [\n        \"10号轴套的安装位置和角度是关键，需严格按照图纸要求定位。\"\n      ],\n      \"welding\": {\n        \"required\": true,\n        \"welding_type\": \"角焊（定位焊）\",\n        \"welding_method\": \"CO2气保焊/手工电弧焊\",\n        \"weld_size\": \"点焊3-4点，焊脚高度4mm\",\n        \"welding_position\": \"零件4（折弯板）与零件10（后座轴套）的连接处，平焊/横焊\",\n        \"quality_requirements\": \"轴套定位必须准确，确保其中心线与折弯板表面垂直。\",\n        \"safety_notes\": \"焊接前检查轴套与板材的间隙，间隙过大需打磨坡口或调整定位。\"\n      },\n      \"safety_warnings\": [\n        \"佩戴焊接面罩和防护手套，防止焊接飞溅物和弧光伤害。\",\n        \"确保轴套内孔保护措施到位，防止焊渣污染内孔精度。\",\n        \"焊接作业时，注意保持身体稳定，避免因操作不当造成扭伤。\"\n      ]\n    },\n    {\n      \"step_number\": 11,\n      \"action\": \"满焊及清理\",\n      \"description\": \"对所有已点焊的零件连接处进行满焊，焊缝尺寸和质量需符合图纸技术要求。焊接完成后，进行焊渣清理和飞溅物去除。\",\n      \"position_description\": \"所有零件的连接焊缝。\",\n      \"parts_used\": [],\n      \"tools\": [\n        \"焊机\",\n        \"角磨机\",\n        \"焊渣锤\"\n      ],\n      \"warnings\": [\n        \"焊接过程中注意控制热输入，防止组件变形。\",\n        \"焊缝应饱满、连续，不得有裂纹、气孔、夹渣等缺陷。\"\n      ],\n      \"welding\": {\n        \"required\": true,\n        \"welding_type\": \"角焊/对接焊（满焊）\",\n        \"welding_method\": \"CO2气保焊（MAG）\",\n        \"weld_size\": \"焊脚高度5mm（图纸未明确标注时，按板厚较薄者确定），轴套周围焊缝连续饱满。\",\n        \"welding_position\": \"所有零件连接处，涉及平焊、横焊、立焊（如侧连接板与底板的连接）。\",\n        \"quality_requirements\": \"焊缝外观成型良好，焊波均匀，无咬边、未焊透、未熔合等缺陷。轴套焊缝需进行外观检查，关键承力焊缝（如侧板与底板）建议进行磁粉检测（MT）。\",\n        \"safety_notes\": \"进行满焊时，需穿戴全套防护服，包括防火服、焊接面罩、防护手套。注意采用分段、对称、跳焊等方法控制焊接变形，避免应力集中导致裂纹。焊接完成后，使用角磨机清理飞溅物和焊渣，注意防尘和防火。\"\n      },\n      \"safety_warnings\": [\n        \"满焊时必须穿戴全套防护用品（焊接面罩、防火服、防护手套、安全鞋），防止大面积灼伤和烫伤。\",\n        \"确保焊接区域通风良好，必要时使用局部排风，防止有毒气体和烟尘中毒。\",\n        \"使用角磨机清理焊渣和飞溅物时，必须佩戴防护眼镜和防尘口罩，防止飞溅物伤眼和吸入粉尘。\",\n        \"清理焊渣时，注意周围人员，防止焊渣飞溅伤人。\",\n        \"焊件温度高，清理和搬运时必须使用工具，防止高温烫伤。\"\n      ]\n    }\n  ]\n}\n```",
  "parsed_result": {
    "enhanced_steps": [
      {
        "step_number": 1,
        "action": "放置基准件",
        "description": "将图纸上标注为1的方形板（01.01.01.11511）平稳放置在焊接工作台上，作为整个组件的装配基准。",
        "position_description": "平放于工作台，确保水平。",
        "parts_used": [
          {
            "bom_seq": "1",
            "bom_name": "方形板-机加 1",
            "quantity": 1,
            "drawing_number": "1",
            "node_name": [
              "NAUO1"
            ],
            "bom_code": "01.01.01.11511"
          }
        ],
        "tools": [
          "行车/吊具",
          "水平仪"
        ],
        "warnings": [
          "方形板较重（15.79kg），吊装时注意安全，确保吊具捆绑牢固。",
          "检查基准件表面无油污、锈蚀。"
        ],
        "safety_warnings": [
          "佩戴安全帽和防护手套，防止吊装过程中零件坠落或夹伤。",
          "使用行车吊装时，必须由专业司索人员指挥，确认吊具完好无损。",
          "吊装路径上不得站人，确保重物平稳起落，防止碰撞。"
        ]
      },
      {
        "step_number": 2,
        "action": "安装上连接板",
        "description": "将图纸上标注为2的上连接板（01.01.01.11512）放置在1号方形板的顶部边缘，按照图纸尺寸定位，并进行点焊固定。",
        "position_description": "放置在1号方形板的顶部边缘，注意两块上连接板的间距和方向。",
        "parts_used": [
          {
            "bom_seq": "2",
            "bom_name": "上连接板 2",
            "quantity": 2,
            "drawing_number": "2",
            "node_name": [
              "NAUO3",
              "NAUO2"
            ],
            "bom_code": "01.01.01.11512"
          }
        ],
        "tools": [
          "焊机",
          "卷尺",
          "角尺"
        ],
        "warnings": [
          "点焊前必须确保上连接板与方形板的相对位置和角度准确。",
          "注意焊接变形控制。"
        ],
        "welding": {
          "required": true,
          "welding_type": "角焊（定位焊）",
          "welding_method": "CO2气保焊",
          "weld_size": "点焊长度10-15mm，焊脚高度4mm",
          "welding_position": "零件1（方形板）与零件2（上连接板）的连接处，平焊",
          "quality_requirements": "点焊牢固，位置准确，焊点无裂纹，焊渣清理干净。",
          "safety_notes": "佩戴焊接面罩和防护手套，确保工作区域通风良好，防止火花飞溅。"
        },
        "safety_warnings": [
          "佩戴焊接面罩、防护手套和防护服，防止电弧光灼伤和高温烫伤。",
          "确保焊机接地良好，电缆绝缘完好，防止触电事故。",
          "点焊区域周围3米内不得有易燃易爆物品，并准备好灭火器。",
          "使用夹具固定零件，防止定位焊时零件倾倒或位移伤人。"
        ]
      },
      {
        "step_number": 3,
        "action": "安装侧连接板",
        "description": "将图纸上标注为3的侧连接板（01.01.01.11513）垂直放置在1号方形板的两侧，并与已点焊的2号上连接板对齐，进行点焊固定。",
        "position_description": "垂直于1号方形板，位于两侧，与2号上连接板形成框架。",
        "parts_used": [
          {
            "bom_seq": "3",
            "bom_name": "侧连接板 2",
            "quantity": 2,
            "drawing_number": "3",
            "node_name": [
              "NAUO5",
              "NAUO4"
            ],
            "bom_code": "01.01.01.11513"
          }
        ],
        "tools": [
          "焊机",
          "角尺",
          "夹具"
        ],
        "warnings": [
          "侧连接板较重（24.97kg），安装时需使用夹具辅助定位。",
          "确保侧连接板与方形板的垂直度。"
        ],
        "welding": {
          "required": true,
          "welding_type": "角焊（定位焊）",
          "welding_method": "CO2气保焊",
          "weld_size": "点焊长度15-20mm，焊脚高度5mm",
          "welding_position": "零件1（方形板）与零件3（侧连接板）的连接处，平焊/横焊",
          "quality_requirements": "使用角尺检查垂直度，点焊后尺寸偏差控制在±1mm以内。",
          "safety_notes": "使用夹具固定零件，防止定位焊时零件倾倒。注意电缆绝缘完好。"
        },
        "safety_warnings": [
          "侧连接板较重，搬运和安装时注意使用辅助工具或两人操作，防止砸伤或扭伤。",
          "佩戴焊接面罩和防护手套，防止焊接飞溅物烫伤。",
          "使用夹具固定时，确保夹具牢固可靠，防止零件突然倒塌。",
          "检查焊机电源线和地线连接可靠，避免触电。"
        ]
      },
      {
        "step_number": 4,
        "action": "安装折弯板",
        "description": "将图纸上标注为4的折弯板（01.01.01.11514）安装在侧连接板（3）的指定位置，进行点焊固定。",
        "position_description": "位于侧连接板（3）的下部，按照图纸尺寸定位。",
        "parts_used": [
          {
            "bom_seq": "4",
            "bom_name": "折弯板 1",
            "quantity": 1,
            "drawing_number": "4",
            "node_name": [
              "NAUO6"
            ],
            "bom_code": "01.01.01.11514"
          }
        ],
        "tools": [
          "焊机",
          "卷尺"
        ],
        "warnings": [
          "折弯板的安装方向必须正确，注意孔位朝向。"
        ],
        "welding": {
          "required": true,
          "welding_type": "角焊（定位焊）",
          "welding_method": "CO2气保焊",
          "weld_size": "点焊长度10mm，焊脚高度4mm",
          "welding_position": "零件3（侧连接板）与零件4（折弯板）的连接处，横焊",
          "quality_requirements": "定位焊点均匀分布，确保折弯板与侧连接板贴合紧密。",
          "safety_notes": "检查焊机接地线连接可靠，防止触电。"
        },
        "safety_warnings": [
          "佩戴防护手套，防止折弯板边缘或毛刺割伤。",
          "进行点焊时，佩戴焊接面罩，防止弧光灼伤。",
          "确保焊接区域通风良好，避免烟尘浓度过高。"
        ]
      },
      {
        "step_number": 5,
        "action": "安装油缸固定板",
        "description": "将图纸上标注为5的油缸固定板（01.01.01.11515）安装在侧连接板（3）和折弯板（4）的连接处，按照图纸尺寸定位，并进行点焊固定。",
        "position_description": "位于侧连接板（3）的外部，共4块，对称安装。",
        "parts_used": [
          {
            "bom_seq": "5",
            "bom_name": "油缸固定板 4",
            "quantity": 4,
            "drawing_number": "5",
            "node_name": [
              "NAUO17",
              "NAUO16",
              "NAUO8",
              "NAUO7"
            ],
            "bom_code": "01.01.01.11515"
          }
        ],
        "tools": [
          "焊机",
          "定位销"
        ],
        "warnings": [
          "油缸固定板的孔位是关键尺寸，必须使用定位销或样板确保孔位精度。"
        ],
        "welding": {
          "required": true,
          "welding_type": "角焊（定位焊）",
          "welding_method": "CO2气保焊",
          "weld_size": "点焊长度10mm，焊脚高度4mm",
          "welding_position": "零件3（侧连接板）与零件5（油缸固定板）的连接处，横焊/立焊",
          "quality_requirements": "定位焊后，检查油缸固定板的孔位尺寸和垂直度，确保符合图纸要求。",
          "safety_notes": "定位焊时注意保持姿势稳定，避免焊枪线缆缠绕。"
        },
        "safety_warnings": [
          "佩戴焊接面罩和防护手套，防止焊接飞溅物烫伤。",
          "在立焊或横焊位置操作时，注意焊渣下落，防止烫伤脚部和身体。",
          "确保焊枪线缆远离高温区域和运动部件，防止损坏或触电。"
        ]
      },
      {
        "step_number": 6,
        "action": "安装加强板",
        "description": "将图纸上标注为6的加强板（01.01.01.11516）安装在2号上连接板的内侧，按照图纸尺寸定位，并进行点焊固定。",
        "position_description": "位于2号上连接板的内侧，共4块，用于加强结构刚度。",
        "parts_used": [
          {
            "bom_seq": "6",
            "bom_name": "加强板 4",
            "quantity": 4,
            "drawing_number": "6",
            "node_name": [
              "NAUO12",
              "NAUO11",
              "NAUO10",
              "NAUO9"
            ],
            "bom_code": "01.01.01.11516"
          }
        ],
        "tools": [
          "焊机",
          "卷尺"
        ],
        "warnings": [
          "加强板的安装位置必须准确，避免干涉后续零件安装。"
        ],
        "welding": {
          "required": true,
          "welding_type": "角焊（定位焊）",
          "welding_method": "CO2气保焊",
          "weld_size": "点焊长度8mm，焊脚高度3mm",
          "welding_position": "零件2（上连接板）与零件6（加强板）的连接处，平焊",
          "quality_requirements": "加强板与上连接板贴合紧密，定位焊点均匀，防止后续满焊时变形。",
          "safety_notes": "清理焊接区域的杂物，确保操作空间足够。"
        },
        "safety_warnings": [
          "佩戴焊接面罩和防护手套，防止弧光和飞溅物伤害。",
          "操作空间可能受限，注意头部和身体不要碰撞到已安装的零件边缘。",
          "确保通风设备正常运行，及时排出焊接烟尘。"
        ]
      },
      {
        "step_number": 7,
        "action": "安装角钢",
        "description": "将图纸上标注为7的角钢-机加（01.01.04.0592）安装在2号上连接板的顶部，按照图纸尺寸定位，并进行点焊固定。",
        "position_description": "位于2号上连接板的顶部，靠近组件中心线。",
        "parts_used": [
          {
            "bom_seq": "7",
            "bom_name": "角钢-机加 1",
            "quantity": 1,
            "drawing_number": "7",
            "node_name": [
              "NAUO13"
            ],
            "bom_code": "01.01.04.0592"
          }
        ],
        "tools": [
          "焊机",
          "角尺"
        ],
        "warnings": [
          "角钢的安装方向和角度必须符合图纸要求。"
        ],
        "welding": {
          "required": true,
          "welding_type": "角焊（定位焊）",
          "welding_method": "CO2气保焊",
          "weld_size": "点焊长度10mm，焊脚高度4mm",
          "welding_position": "零件2（上连接板）与零件7（角钢）的连接处，平焊",
          "quality_requirements": "角钢与上连接板接触面平整，定位焊后检查角度。",
          "safety_notes": "注意角钢边缘可能锋利，操作时佩戴防护手套。"
        },
        "safety_warnings": [
          "佩戴防护手套，防止角钢的锋利边缘割伤。",
          "点焊时注意保持角钢的稳定，防止其突然移动。",
          "焊接作业时，确保工作台面整洁，避免绊倒或工具掉落。"
        ]
      },
      {
        "step_number": 8,
        "action": "安装轴套（8号）",
        "description": "将图纸上标注为8的轴套（01.01.02.1221）安装在侧连接板（3）上方的指定孔位，进行点焊固定。",
        "position_description": "位于侧连接板（3）上方的圆孔处。",
        "parts_used": [
          {
            "bom_seq": "8",
            "bom_name": "轴套 1",
            "quantity": 1,
            "drawing_number": "8",
            "node_name": [
              "NAUO14"
            ],
            "bom_code": "01.01.02.1221"
          }
        ],
        "tools": [
          "焊机",
          "塞规"
        ],
        "warnings": [
          "轴套的中心线必须垂直于侧连接板表面，确保焊接时轴套内孔不受污染。"
        ],
        "welding": {
          "required": true,
          "welding_type": "角焊（定位焊）",
          "welding_method": "CO2气保焊/手工电弧焊",
          "weld_size": "点焊3-4点，焊脚高度4mm",
          "welding_position": "零件3（侧连接板）与零件8（轴套）的连接处，横焊/立焊",
          "quality_requirements": "轴套定位必须垂直，内孔需用塞规或堵头保护，防止焊渣飞溅进入。",
          "safety_notes": "轴套定位时需使用工装或夹具，确保定位准确，防止焊接应力导致轴套倾斜。"
        },
        "safety_warnings": [
          "轴套内孔必须使用堵头保护，防止焊接飞溅物进入，影响后续使用。",
          "使用工装夹具固定轴套，防止焊接时轴套松动或倾斜。",
          "进行立焊或横焊时，注意调整焊接参数，防止熔渣下淌烫伤。"
        ]
      },
      {
        "step_number": 9,
        "action": "安装后座轴套（9号）",
        "description": "将图纸上标注为9的后座轴套（01.02.02.0490）安装在侧连接板（3）下方的指定孔位，进行点焊固定。",
        "position_description": "位于侧连接板（3）下方的圆孔处。",
        "parts_used": [
          {
            "bom_seq": "9",
            "bom_name": "后座轴套 1",
            "quantity": 1,
            "drawing_number": "9",
            "node_name": [
              "NAUO15"
            ],
            "bom_code": "01.02.02.0490"
          }
        ],
        "tools": [
          "焊机",
          "塞规"
        ],
        "warnings": [
          "确保9号轴套与8号轴套的同轴度，必要时使用工装夹具定位。"
        ],
        "welding": {
          "required": true,
          "welding_type": "角焊（定位焊）",
          "welding_method": "CO2气保焊/手工电弧焊",
          "weld_size": "点焊3-4点，焊脚高度4mm",
          "welding_position": "零件3（侧连接板）与零件9（后座轴套）的连接处，横焊/立焊",
          "quality_requirements": "轴套定位必须垂直，使用工装检查8号和9号轴套的同轴度，偏差应在0.5mm以内。",
          "safety_notes": "轴套内孔必须保护，防止焊接热量和飞溅物影响内孔精度。"
        },
        "safety_warnings": [
          "佩戴焊接面罩和防护手套，防止焊接飞溅物和弧光伤害。",
          "使用工装夹具确保轴套定位准确，防止焊接应力导致轴套变形。",
          "焊接完成后，不要立即用手触摸轴套，防止高温烫伤。"
        ]
      },
      {
        "step_number": 10,
        "action": "安装后座轴套（10号）",
        "description": "将图纸上标注为10的后座轴套（01.01.02.0337）安装在折弯板（4）的指定孔位，进行点焊固定。",
        "position_description": "位于折弯板（4）的圆孔处。",
        "parts_used": [
          {
            "bom_seq": "10",
            "bom_name": "后座轴套 1",
            "quantity": 1,
            "drawing_number": "10",
            "node_name": [
              "NAUO18"
            ],
            "bom_code": "01.01.02.0337"
          }
        ],
        "tools": [
          "焊机",
          "塞规"
        ],
        "warnings": [
          "10号轴套的安装位置和角度是关键，需严格按照图纸要求定位。"
        ],
        "welding": {
          "required": true,
          "welding_type": "角焊（定位焊）",
          "welding_method": "CO2气保焊/手工电弧焊",
          "weld_size": "点焊3-4点，焊脚高度4mm",
          "welding_position": "零件4（折弯板）与零件10（后座轴套）的连接处，平焊/横焊",
          "quality_requirements": "轴套定位必须准确，确保其中心线与折弯板表面垂直。",
          "safety_notes": "焊接前检查轴套与板材的间隙，间隙过大需打磨坡口或调整定位。"
        },
        "safety_warnings": [
          "佩戴焊接面罩和防护手套，防止焊接飞溅物和弧光伤害。",
          "确保轴套内孔保护措施到位，防止焊渣污染内孔精度。",
          "焊接作业时，注意保持身体稳定，避免因操作不当造成扭伤。"
        ]
      },
      {
        "step_number": 11,
        "action": "满焊及清理",
        "description": "对所有已点焊的零件连接处进行满焊，焊缝尺寸和质量需符合图纸技术要求。焊接完成后，进行焊渣清理和飞溅物去除。",
        "position_description": "所有零件的连接焊缝。",
        "parts_used": [],
        "tools": [
          "焊机",
          "角磨机",
          "焊渣锤"
        ],
        "warnings": [
          "焊接过程中注意控制热输入，防止组件变形。",
          "焊缝应饱满、连续，不得有裂纹、气孔、夹渣等缺陷。"
        ],
        "welding": {
          "required": true,
          "welding_type": "角焊/对接焊（满焊）",
          "welding_method": "CO2气保焊（MAG）",
          "weld_size": "焊脚高度5mm（图纸未明确标注时，按板厚较薄者确定），轴套周围焊缝连续饱满。",
          "welding_position": "所有零件连接处，涉及平焊、横焊、立焊（如侧连接板与底板的连接）。",
          "quality_requirements": "焊缝外观成型良好，焊波均匀，无咬边、未焊透、未熔合等缺陷。轴套焊缝需进行外观检查，关键承力焊缝（如侧板与底板）建议进行磁粉检测（MT）。",
          "safety_notes": "进行满焊时，需穿戴全套防护服，包括防火服、焊接面罩、防护手套。注意采用分段、对称、跳焊等方法控制焊接变形，避免应力集中导致裂纹。焊接完成后，使用角磨机清理飞溅物和焊渣，注意防尘和防火。"
        },
        "safety_warnings": [
          "满焊时必须穿戴全套防护用品（焊接面罩、防火服、防护手套、安全鞋），防止大面积灼伤和烫伤。",
          "确保焊接区域通风良好，必要时使用局部排风，防止有毒气体和烟尘中毒。",
          "使用角磨机清理焊渣和飞溅物时，必须佩戴防护眼镜和防尘口罩，防止飞溅物伤眼和吸入粉尘。",
          "清理焊渣时，注意周围人员，防止焊渣飞溅伤人。",
          "焊件温度高，清理和搬运时必须使用工具，防止高温烫伤。"
        ]
      }
    ]
  }
}