{
  "agent_name": "Agent6_FAQ",
  "model": "google/gemini-2.5-flash-preview-09-2025",
  "timestamp": "20251009_130727",
  "image_count": 0,
  "temperature": 0.2,
  "system_prompt": "# 角色定位\n\n你是**李师傅**，一位拥有20年安全管理经验的高级安全工程师。\n\n## 教育背景\n\n- **学历**：安全工程专业本科\n- **职业资格**：注册安全工程师、高级安全评价师\n- **专业培训**：\n  - 机械制造安全管理\n  - 职业健康与安全管理体系（ISO 45001）\n  - 事故调查与分析\n  - 应急预案编制与演练\n\n## 职业背景\n\n- **工作经历**：20年机械制造企业安全管理经验，参与过大型装备制造、钢结构加工等项目\n- **专业领域**：\n  - 机械加工安全（车、铣、刨、磨、钻等）\n  - 焊接作业安全（电焊、气焊、氩弧焊等）\n  - 起重吊装安全（行车、叉车、吊索具等）\n  - 高空作业安全（脚手架、安全带、防坠落等）\n  - 个人防护用品管理（安全帽、防护眼镜、手套、安全鞋等）\n\n## 知识结构（详细）\n\n### 1. 机械伤害风险\n- **夹伤/挤伤**：手指、手臂被运动部件夹住\n- **切割伤**：锋利边缘、毛刺、切削工具\n- **碰撞伤**：头部碰撞、身体碰撞\n- **坠落伤**：零件坠落、工具坠落、人员坠落\n\n### 2. 焊接作业风险\n- **电击伤**：焊机漏电、接地不良\n- **弧光伤**：电弧紫外线灼伤眼睛和皮肤\n- **烫伤**：高温熔池、焊渣飞溅\n- **火灾爆炸**：易燃物引燃、气瓶泄漏\n- **有毒气体**：焊接烟尘、一氧化碳中毒\n\n### 3. 起重吊装风险\n- **吊物坠落**：吊索具断裂、捆绑不牢\n- **吊物摆动**：碰撞人员、设备\n- **超载**：超过起重机额定载荷\n- **指挥失误**：信号不清、违章指挥\n\n### 4. 高空作业风险\n- **人员坠落**：未系安全带、脚手架不牢\n- **物体打击**：工具、零件从高处坠落\n- **脚手架坍塌**：搭设不规范、超载\n\n### 5. 个人防护用品\n- **头部防护**：安全帽（防止碰撞、坠物打击）\n- **眼部防护**：防护眼镜、焊接面罩（防止飞溅、弧光）\n- **手部防护**：防护手套（防止切割、烫伤、化学品）\n- **足部防护**：安全鞋（防砸、防刺穿、防滑）\n- **呼吸防护**：防尘口罩、防毒面具（防止粉尘、有毒气体）\n\n### 6. 应急处理\n- **机械伤害**：立即停机、呼救、止血、固定、送医\n- **电击伤**：切断电源、心肺复苏、送医\n- **烫伤**：冷水冲洗、覆盖无菌纱布、送医\n- **火灾**：使用灭火器、疏散人员、报警\n\n## 任务步骤（Chain of Thought）\n\n你的任务是**为每个装配步骤添加安全警告**（如果该步骤有安全风险）。请按照以下5个步骤思考：\n\n### 步骤1：识别风险步骤\n- 分析每个装配步骤的操作内容\n- 判断是否涉及高风险作业（焊接、吊装、高空、重物搬运等）\n- 识别潜在的伤害类型（机械伤害、电击、烫伤、坠落等）\n\n### 步骤2：分析风险源\n- 确定风险的来源（设备、工具、材料、环境、人员操作等）\n- 评估风险的严重程度（轻微、中等、严重、致命）\n- 考虑风险的发生概率\n\n### 步骤3：制定预防措施\n- 针对每个风险源，制定具体的预防措施\n- 强调个人防护用品的使用\n- 强调安全操作规程的遵守\n\n### 步骤4：添加安全警告\n- 为每个有风险的步骤添加safety_warnings字段\n- 每条警告要简洁明了，说明具体的风险和预防措施\n- 使用工人能看懂的语言\n\n### 步骤5：验证完整性\n- 检查所有高风险步骤是否都添加了安全警告\n- 检查安全警告是否具体、可操作\n- 检查是否遗漏了任何潜在风险\n\n## 核心原则\n\n1. **步骤级嵌入**：为每个有风险的步骤添加safety_warnings字段，而不是单独列出安全警告\n2. **工人友好**：使用通俗语言，避免专业术语\n3. **具体可操作**：说明具体的风险和预防措施，而不是泛泛而谈\n4. **不重复显示**：安全警告只在下方\"安全\"标签页中统一显示，不在当前步骤详情中重复显示\n\n## 输出格式\n\n严格按照以下JSON格式输出（返回增强后的装配步骤）：\n\n```json\n{\n  \"enhanced_steps\": [\n    {\n      \"step_number\": 1,\n      \"title\": \"点焊定位\",\n      \"parts_used\": [...],\n      \"tools_required\": [...],\n      \"operation\": \"操作说明\",\n      \"quality_check\": \"质量检查\",\n      \"estimated_time_minutes\": 10,\n      \"welding\": {\n        \"required\": true,\n        \"welding_type\": \"点焊\",\n        \"welding_method\": \"CO2气保焊\",\n        ...\n      },\n      \"safety_warnings\": [\n        \"佩戴焊接面罩和防护手套，防止弧光灼伤眼睛和皮肤\",\n        \"确保工件夹紧牢固，防止点焊时位移造成伤害\",\n        \"焊接区域周围3米内不得有易燃物，配备灭火器\",\n        \"焊机必须接地良好，防止漏电触电\"\n      ]\n    },\n    {\n      \"step_number\": 2,\n      \"title\": \"螺栓连接\",\n      \"parts_used\": [...],\n      \"operation\": \"操作说明\",\n      \"quality_check\": \"质量检查\",\n      \"estimated_time_minutes\": 15,\n      \"safety_warnings\": [\n        \"佩戴安全帽和防护眼镜，防止零件坠落和飞溅\",\n        \"使用扭力扳手时注意力度，防止扳手滑脱伤人\"\n      ]\n    },\n    {\n      \"step_number\": 3,\n      \"title\": \"简单装配\",\n      \"parts_used\": [...],\n      \"operation\": \"操作说明\",\n      \"quality_check\": \"质量检查\",\n      \"estimated_time_minutes\": 5\n      // ⚠️ 如果没有明显安全风险，不添加safety_warnings字段\n    }\n  ]\n}\n```\n\n**⚠️ 关键要求**：\n\n1. **步骤级嵌入**：\n   - 为每个有风险的步骤添加`safety_warnings`字段\n   - 没有明显风险的步骤不添加`safety_warnings`字段\n   - 保持原有步骤的所有字段不变\n\n2. **安全警告要具体**：\n   - ✅ 说\"佩戴焊接面罩和防护手套，防止弧光灼伤眼睛和皮肤\"\n   - ❌ 不说\"注意安全\"\n   - ✅ 说\"焊接区域周围3米内不得有易燃物，配备灭火器\"\n   - ❌ 不说\"注意防火\"\n\n3. **使用通俗语言**：\n   - 工人能看懂的语言\n   - 避免专业术语和英文缩写\n\n4. **警告要全面**：\n   - 涵盖个人防护、设备安全、环境安全、操作安全\n   - 每条警告说明具体的风险和预防措施\n\n## 重要提醒\n\n- **只输出JSON，不要输出其他内容**\n- **保持原有字段不变**：不要修改或删除原有的字段（包括welding字段）\n- **警告要简洁明了**：每条警告一句话，说明风险和预防措施\n- **不要过度警告**：只针对有明显风险的步骤添加警告\n",
  "user_query": "请为以下装配步骤添加安全警告（如果有安全风险）。\n\n## 📸 视觉分析任务\n\n**你会看到工程图纸图片，请仔细观察：**\n\n1. **危险作业标识**：\n   - 图纸上的安全警告标识\n   - 特殊作业要求（如高空作业、吊装作业等）\n   - 危险区域标注\n\n2. **零件特征**：\n   - 重型零件（需要吊装）\n   - 锋利边缘（容易割伤）\n   - 高温部件（容易烫伤）\n\n3. **作业环境**：\n   - 狭窄空间（容易碰撞）\n   - 高空位置（容易坠落）\n   - 密闭空间（通风不良）\n\n## 装配步骤\n\n[\n  {\n    \"step_number\": 1,\n    \"action\": \"放置基准件\",\n    \"description\": \"将图纸上标注为②的连接板（01.01.01.11509）平稳放置在装配工装台上，作为整个组件的装配基准。\",\n    \"position_description\": \"平放于工装台中心，确保水平。\",\n    \"parts_used\": [\n      {\n        \"bom_seq\": \"2\",\n        \"bom_name\": \"连接板\",\n        \"quantity\": 1,\n        \"drawing_number\": \"2\",\n        \"node_name\": [\n          \"NAUO2\"\n        ],\n        \"bom_code\": \"01.01.01.11509\"\n      }\n    ],\n    \"tools\": [\n      \"行车/吊具\",\n      \"水平仪\",\n      \"装配工装台\"\n    ],\n    \"warnings\": [\n      \"连接板较重，吊装时注意安全，防止倾倒。\",\n      \"确保连接板表面清洁，无油污和杂质。\"\n    ]\n  },\n  {\n    \"step_number\": 2,\n    \"action\": \"安装底部矩形管\",\n    \"description\": \"将图纸上标注为①的矩形管（01.01.03.2718）放置在②号连接板的底部边缘，并进行点焊定位。注意矩形管的长度方向与连接板的长边对齐。\",\n    \"position_description\": \"位于②号连接板的底部边缘，与连接板垂直。\",\n    \"parts_used\": [\n      {\n        \"bom_seq\": \"1\",\n        \"bom_name\": \"矩形管\",\n        \"quantity\": 1,\n        \"drawing_number\": \"1\",\n        \"node_name\": [\n          \"NAUO1\"\n        ],\n        \"bom_code\": \"01.01.03.2718\"\n      }\n    ],\n    \"tools\": [\n      \"焊机\",\n      \"角尺\",\n      \"卡具\"\n    ],\n    \"warnings\": [\n      \"点焊时注意焊接电流和时间，防止烧穿。\",\n      \"使用卡具固定，确保矩形管与连接板的垂直度。\"\n    ],\n    \"welding\": {\n      \"required\": true,\n      \"welding_type\": \"角焊（点焊定位）\",\n      \"welding_method\": \"CO2气保焊\",\n      \"weld_size\": \"点焊长度10-15mm，焊脚高度3mm\",\n      \"welding_position\": \"零件①（矩形管）与零件②（连接板）的连接处，平焊\",\n      \"quality_requirements\": \"点焊牢固，定位准确，焊点无裂纹、气孔\",\n      \"safety_notes\": \"佩戴焊接面罩、防护手套和防护服。确保工作区域通风良好，防止烟尘吸入。\"\n    }\n  },\n  {\n    \"step_number\": 3,\n    \"action\": \"安装两侧矩形管\",\n    \"description\": \"将图纸上标注为⑥的矩形管（01.01.03.2719）和标注为⑧的矩形管（01.01.03.2720）分别安装在②号连接板的两侧，并进行点焊定位。\",\n    \"position_description\": \"⑥号矩形管位于②号连接板的一侧，⑧号矩形管位于另一侧，均与连接板垂直。\",\n    \"parts_used\": [\n      {\n        \"bom_seq\": \"6\",\n        \"bom_name\": \"矩形管\",\n        \"quantity\": 2,\n        \"drawing_number\": \"6\",\n        \"node_name\": [\n          \"NAUO10\",\n          \"NAUO9\"\n        ],\n        \"bom_code\": \"01.01.03.2719\"\n      },\n      {\n        \"bom_seq\": \"8\",\n        \"bom_name\": \"矩形管\",\n        \"quantity\": 1,\n        \"drawing_number\": \"8\",\n        \"node_name\": [\n          \"NAUO13\"\n        ],\n        \"bom_code\": \"01.01.03.2720\"\n      }\n    ],\n    \"tools\": [\n      \"焊机\",\n      \"卡具\",\n      \"卷尺\"\n    ],\n    \"warnings\": [\n      \"确保两侧矩形管的安装位置对称，尺寸符合图纸要求。\",\n      \"点焊牢固，防止后续焊接过程中零件移位。\"\n    ],\n    \"welding\": {\n      \"required\": true,\n      \"welding_type\": \"角焊（点焊定位）\",\n      \"welding_method\": \"CO2气保焊\",\n      \"weld_size\": \"点焊长度10-15mm，焊脚高度3mm\",\n      \"welding_position\": \"零件⑥/⑧（矩形管）与零件②（连接板）的连接处，平焊\",\n      \"quality_requirements\": \"点焊位置均匀分布，确保零件垂直度误差小于1mm\",\n      \"safety_notes\": \"检查焊机接地线是否完好，避免触电风险。点焊后及时清理飞溅物。\"\n    }\n  },\n  {\n    \"step_number\": 4,\n    \"action\": \"安装封板\",\n    \"description\": \"将图纸上标注为⑦的封板（01.01.01.16608）安装在矩形管（①、⑥、⑧）形成的框架顶部，并进行点焊定位。\",\n    \"position_description\": \"位于矩形管框架的顶部，覆盖整个开口。\",\n    \"parts_used\": [\n      {\n        \"bom_seq\": \"7\",\n        \"bom_name\": \"封板\",\n        \"quantity\": 2,\n        \"drawing_number\": \"7\",\n        \"node_name\": [\n          \"NAUO12\",\n          \"NAUO11\"\n        ],\n        \"bom_code\": \"01.01.01.16608\"\n      }\n    ],\n    \"tools\": [\n      \"焊机\",\n      \"卡具\"\n    ],\n    \"warnings\": [\n      \"封板与矩形管的边缘必须对齐，确保焊接间隙均匀。\",\n      \"注意封板的安装方向，避免装反。\"\n    ],\n    \"welding\": {\n      \"required\": true,\n      \"welding_type\": \"角焊（点焊定位）\",\n      \"welding_method\": \"CO2气保焊\",\n      \"weld_size\": \"点焊长度10mm，焊脚高度3mm\",\n      \"welding_position\": \"零件⑦（封板）与零件①/⑥/⑧（矩形管）的连接处，平焊\",\n      \"quality_requirements\": \"封板与矩形管边缘对齐，点焊位置均匀，防止后续满焊时变形。\",\n      \"safety_notes\": \"点焊前检查焊枪喷嘴和导电嘴，确保气体保护效果良好。\"\n    }\n  },\n  {\n    \"step_number\": 5,\n    \"action\": \"安装挂件虚拟组件\",\n    \"description\": \"将图纸上标注为④的右挂件虚拟组件（01.05.0018）和标注为⑤的左挂件虚拟组件（01.05.0019）分别安装在②号连接板的两端，并进行点焊定位。\",\n    \"position_description\": \"④号和⑤号挂件分别位于②号连接板的两端，注意区分左右。\",\n    \"parts_used\": [\n      {\n        \"bom_seq\": \"4\",\n        \"bom_name\": \"右挂件虚拟组件\",\n        \"quantity\": 1,\n        \"drawing_number\": \"4\",\n        \"node_name\": [\n          \"NAUO21\",\n          \"NAUO20\",\n          \"NAUO19\"\n        ],\n        \"bom_code\": \"01.05.0018\"\n      },\n      {\n        \"bom_seq\": \"5\",\n        \"bom_name\": \"左挂件虚拟组件\",\n        \"quantity\": 1,\n        \"drawing_number\": \"5\",\n        \"node_name\": [\n          \"NAUO18\",\n          \"NAUO17\",\n          \"NAUO16\"\n        ],\n        \"bom_code\": \"01.05.0019\"\n      }\n    ],\n    \"tools\": [\n      \"焊机\",\n      \"定位销\"\n    ],\n    \"warnings\": [\n      \"挂件的安装位置是关键尺寸，必须使用定位销或专用工装确保精度。\",\n      \"确认挂件的朝向正确。\"\n    ],\n    \"welding\": {\n      \"required\": true,\n      \"welding_type\": \"角焊（点焊定位）\",\n      \"welding_method\": \"CO2气保焊\",\n      \"weld_size\": \"点焊长度15mm，焊脚高度4mm\",\n      \"welding_position\": \"零件④/⑤（挂件）与零件②（连接板）的连接处，平焊/横焊\",\n      \"quality_requirements\": \"定位精度高，焊点牢固，确保挂件与连接板的相对位置准确。\",\n      \"safety_notes\": \"挂件可能存在应力集中，点焊时应避免在关键受力区域过度加热。注意防火，清除周围可燃物。\"\n    }\n  },\n  {\n    \"step_number\": 6,\n    \"action\": \"安装加强筋\",\n    \"description\": \"将图纸上标注为⑨的加强筋（01.01.01.17678）安装在矩形管和连接板的连接处，进行点焊定位。\",\n    \"position_description\": \"位于矩形管和连接板的内侧，起到支撑作用。\",\n    \"parts_used\": [\n      {\n        \"bom_seq\": \"9\",\n        \"bom_name\": \"加强筋\",\n        \"quantity\": 2,\n        \"drawing_number\": \"9\",\n        \"node_name\": [\n          \"NAUO15\",\n          \"NAUO14\"\n        ],\n        \"bom_code\": \"01.01.01.17678\"\n      }\n    ],\n    \"tools\": [\n      \"焊机\",\n      \"卡具\"\n    ],\n    \"warnings\": [\n      \"加强筋的安装角度和位置必须符合图纸要求，确保受力均匀。\",\n      \"加强筋数量为2个，确保全部安装到位。\"\n    ],\n    \"welding\": {\n      \"required\": true,\n      \"welding_type\": \"角焊（点焊定位）\",\n      \"welding_method\": \"CO2气保焊\",\n      \"weld_size\": \"点焊长度10mm，焊脚高度3mm\",\n      \"welding_position\": \"零件⑨（加强筋）与零件②（连接板）和矩形管的连接处，平焊/立焊\",\n      \"quality_requirements\": \"加强筋与主体结构贴合紧密，点焊位置应避开后续满焊的起始点。\",\n      \"safety_notes\": \"立焊位置操作时，注意调整焊接角度，防止熔渣和熔池下坠烫伤。\"\n    }\n  },\n  {\n    \"step_number\": 7,\n    \"action\": \"安装方形板\",\n    \"description\": \"将图纸上标注为③的方形板-机加（01.01.01.6589）安装在②号连接板的指定孔位上，并进行点焊定位。\",\n    \"position_description\": \"安装在②号连接板的四个角或指定位置，用于后续连接。\",\n    \"parts_used\": [\n      {\n        \"bom_seq\": \"3\",\n        \"bom_name\": \"方形板-机加\",\n        \"quantity\": 4,\n        \"drawing_number\": \"3\",\n        \"node_name\": [\n          \"NAUO6\",\n          \"NAUO5\",\n          \"NAUO4\",\n          \"NAUO3\"\n        ],\n        \"bom_code\": \"01.01.01.6589\"\n      }\n    ],\n    \"tools\": [\n      \"焊机\",\n      \"定位工装\"\n    ],\n    \"warnings\": [\n      \"方形板为机加件，安装时注意保护其加工面。\",\n      \"确保方形板的安装平面与连接板平行。\"\n    ],\n    \"welding\": {\n      \"required\": true,\n      \"welding_type\": \"角焊（点焊定位）\",\n      \"welding_method\": \"CO2气保焊\",\n      \"weld_size\": \"点焊长度10mm，焊脚高度3mm\",\n      \"welding_position\": \"零件③（方形板）与零件②（连接板）的连接处，平焊\",\n      \"quality_requirements\": \"方形板定位精度要求高，点焊后需复核其平面度。\",\n      \"safety_notes\": \"点焊时，避免焊点靠近机加孔位，防止热变形影响孔位精度。\"\n    }\n  },\n  {\n    \"step_number\": 8,\n    \"action\": \"满焊所有零件\",\n    \"description\": \"按照图纸上的焊接符号和技术要求，对所有已点焊定位的零件进行满焊。焊接顺序应遵循对称、分散的原则，以减少焊接变形。\",\n    \"position_description\": \"所有零件的连接处。\",\n    \"parts_used\": [],\n    \"tools\": [\n      \"焊机\",\n      \"焊条/焊丝\",\n      \"清渣工具\"\n    ],\n    \"warnings\": [\n      \"严格控制焊接电流、电压和速度，确保焊缝成型美观、牢固。\",\n      \"焊接过程中注意检查和校正变形，必要时进行反变形处理。\",\n      \"焊后必须彻底清渣，确保焊缝无虚焊、漏焊等缺陷。\"\n    ],\n    \"welding\": {\n      \"required\": true,\n      \"welding_type\": \"角焊/对接焊（满焊）\",\n      \"welding_method\": \"CO2气保焊（或根据板厚选择手工电弧焊）\",\n      \"weld_size\": \"焊脚高度8mm（根据图纸标注，如未标注按8mm执行）\",\n      \"welding_position\": \"所有零件连接处，涉及平焊、横焊、立焊\",\n      \"quality_requirements\": \"焊缝连续、饱满，焊波均匀。焊后进行外观检查，确保无气孔、夹渣、裂纹、未熔合等缺陷。关键焊缝需进行超声波或磁粉检测。\",\n      \"safety_notes\": \"进行大面积焊接时，必须佩戴全套防护装备（面罩、手套、防护服）。注意焊机持续工作时间，防止设备过热。焊接完成后，对高温焊件进行隔离警示，防止烫伤。\"\n    }\n  }\n]\n\n## 要求\n\n请按照以下5个步骤思考，为装配步骤添加安全警告：\n\n### 步骤1：识别风险步骤\n- 分析每个装配步骤的操作内容\n- 判断是否涉及高风险作业：\n  * **焊接作业**：电击、弧光、烫伤、火灾\n  * **吊装作业**：吊物坠落、碰撞、超载\n  * **高空作业**：人员坠落、物体打击\n  * **重物搬运**：砸伤、扭伤、夹伤\n  * **机械加工**：切割伤、夹伤、碰撞\n\n### 步骤2：分析风险源\n- 确定风险的来源（设备、工具、材料、环境、人员操作等）\n- 评估风险的严重程度（轻微、中等、严重、致命）\n- 考虑风险的发生概率\n\n### 步骤3：制定预防措施\n- 针对每个风险源，制定具体的预防措施\n- 强调个人防护用品的使用：\n  * **焊接**：焊接面罩、防护手套、防护服\n  * **吊装**：安全帽、安全鞋、手套\n  * **高空**：安全带、安全帽、防滑鞋\n  * **机械**：防护眼镜、手套、安全鞋\n\n### 步骤4：添加安全警告\n- 为每个有风险的步骤添加safety_warnings字段\n- 每条警告要简洁明了，说明具体的风险和预防措施\n- 使用工人能看懂的语言\n\n### 步骤5：验证完整性\n- 检查所有高风险步骤是否都添加了安全警告\n- 检查安全警告是否具体、可操作\n- 检查是否遗漏了任何潜在风险\n\n## ⚠️ 强制自检清单（生成后必须逐项检查）\n\n**在输出JSON之前，你必须完成以下验证：**\n\n1. **风险步骤识别验证**：\n   - [ ] 所有涉及焊接、吊装、高空、重物搬运的步骤都添加了safety_warnings字段\n   - [ ] 没有明显风险的步骤没有添加safety_warnings字段\n\n2. **安全警告完整性验证**：\n   - [ ] 每个safety_warnings字段都是字符串数组\n   - [ ] 每条警告都说明了具体的风险和预防措施\n   - [ ] 涵盖了个人防护、设备安全、环境安全、操作安全\n\n3. **语言通俗性验证**：\n   - [ ] 使用工人能看懂的语言\n   - [ ] 避免专业术语和英文缩写\n   - [ ] 每条警告简洁明了（一句话）\n\n4. **原有字段保持验证**：\n   - [ ] 原有步骤的所有字段都保持不变（包括welding字段）\n   - [ ] 没有修改或删除任何原有字段\n\n**如果自检发现任何问题，必须重新生成！**\n\n现在开始为装配步骤添加安全警告！\n",
  "raw_response": "```json\n{\n  \"enhanced_steps\": [\n    {\n      \"step_number\": 1,\n      \"action\": \"放置基准件\",\n      \"description\": \"将图纸上标注为②的连接板（01.01.01.11509）平稳放置在装配工装台上，作为整个组件的装配基准。\",\n      \"position_description\": \"平放于工装台中心，确保水平。\",\n      \"parts_used\": [\n        {\n          \"bom_seq\": \"2\",\n          \"bom_name\": \"连接板\",\n          \"quantity\": 1,\n          \"drawing_number\": \"2\",\n          \"node_name\": [\n            \"NAUO2\"\n          ],\n          \"bom_code\": \"01.01.01.11509\"\n        }\n      ],\n      \"tools\": [\n        \"行车/吊具\",\n        \"水平仪\",\n        \"装配工装台\"\n      ],\n      \"warnings\": [\n        \"连接板较重，吊装时注意安全，防止倾倒。\",\n        \"确保连接板表面清洁，无油污和杂质。\"\n      ],\n      \"safety_warnings\": [\n        \"吊装前检查吊具和吊索具是否完好，防止吊物坠落伤人。\",\n        \"吊装过程中，人员必须佩戴安全帽，并远离吊物下方。\",\n        \"指挥人员必须使用规范手势，确保吊物平稳起落，防止碰撞。\"\n      ]\n    },\n    {\n      \"step_number\": 2,\n      \"action\": \"安装底部矩形管\",\n      \"description\": \"将图纸上标注为①的矩形管（01.01.03.2718）放置在②号连接板的底部边缘，并进行点焊定位。注意矩形管的长度方向与连接板的长边对齐。\",\n      \"position_description\": \"位于②号连接板的底部边缘，与连接板垂直。\",\n      \"parts_used\": [\n        {\n          \"bom_seq\": \"1\",\n          \"bom_name\": \"矩形管\",\n          \"quantity\": 1,\n          \"drawing_number\": \"1\",\n          \"node_name\": [\n            \"NAUO1\"\n          ],\n          \"bom_code\": \"01.01.03.2718\"\n        }\n      ],\n      \"tools\": [\n        \"焊机\",\n        \"角尺\",\n        \"卡具\"\n      ],\n      \"warnings\": [\n        \"点焊时注意焊接电流和时间，防止烧穿。\",\n        \"使用卡具固定，确保矩形管与连接板的垂直度。\"\n      ],\n      \"welding\": {\n        \"required\": true,\n        \"welding_type\": \"角焊（点焊定位）\",\n        \"welding_method\": \"CO2气保焊\",\n        \"weld_size\": \"点焊长度10-15mm，焊脚高度3mm\",\n        \"welding_position\": \"零件①（矩形管）与零件②（连接板）的连接处，平焊\",\n        \"quality_requirements\": \"点焊牢固，定位准确，焊点无裂纹、气孔\",\n        \"safety_notes\": \"佩戴焊接面罩、防护手套和防护服。确保工作区域通风良好，防止烟尘吸入。\"\n      },\n      \"safety_warnings\": [\n        \"进行点焊作业时，必须佩戴焊接面罩、防护手套和防护服，防止弧光和烫伤。\",\n        \"确保焊机接地良好，电缆绝缘完好，防止触电。\",\n        \"工作区域必须保持通风，防止焊接烟尘和有毒气体中毒。\",\n        \"点焊前检查周围环境，清除易燃易爆物品，防止火灾。\"\n      ]\n    },\n    {\n      \"step_number\": 3,\n      \"action\": \"安装两侧矩形管\",\n      \"description\": \"将图纸上标注为⑥的矩形管（01.01.03.2719）和标注为⑧的矩形管（01.01.03.2720）分别安装在②号连接板的两侧，并进行点焊定位。\",\n      \"position_description\": \"⑥号矩形管位于②号连接板的一侧，⑧号矩形管位于另一侧，均与连接板垂直。\",\n      \"parts_used\": [\n        {\n          \"bom_seq\": \"6\",\n          \"bom_name\": \"矩形管\",\n          \"quantity\": 2,\n          \"drawing_number\": \"6\",\n          \"node_name\": [\n            \"NAUO10\",\n            \"NAUO9\"\n          ],\n          \"bom_code\": \"01.01.03.2719\"\n        },\n        {\n          \"bom_seq\": \"8\",\n          \"bom_name\": \"矩形管\",\n          \"quantity\": 1,\n          \"drawing_number\": \"8\",\n          \"node_name\": [\n            \"NAUO13\"\n          ],\n          \"bom_code\": \"01.01.03.2720\"\n        }\n      ],\n      \"tools\": [\n        \"焊机\",\n        \"卡具\",\n        \"卷尺\"\n      ],\n      \"warnings\": [\n        \"确保两侧矩形管的安装位置对称，尺寸符合图纸要求。\",\n        \"点焊牢固，防止后续焊接过程中零件移位。\"\n      ],\n      \"welding\": {\n        \"required\": true,\n        \"welding_type\": \"角焊（点焊定位）\",\n        \"welding_method\": \"CO2气保焊\",\n        \"weld_size\": \"点焊长度10-15mm，焊脚高度3mm\",\n        \"welding_position\": \"零件⑥/⑧（矩形管）与零件②（连接板）的连接处，平焊\",\n        \"quality_requirements\": \"点焊位置均匀分布，确保零件垂直度误差小于1mm\",\n        \"safety_notes\": \"检查焊机接地线是否完好，避免触电风险。点焊后及时清理飞溅物。\"\n      },\n      \"safety_warnings\": [\n        \"进行点焊作业时，必须佩戴焊接面罩、防护手套，防止弧光和烫伤。\",\n        \"操作前检查焊机接地线是否完好，避免触电风险。\",\n        \"点焊后及时清理焊渣和飞溅物，防止烫伤或滑倒。\"\n      ]\n    },\n    {\n      \"step_number\": 4,\n      \"action\": \"安装封板\",\n      \"description\": \"将图纸上标注为⑦的封板（01.01.01.16608）安装在矩形管（①、⑥、⑧）形成的框架顶部，并进行点焊定位。\",\n      \"position_description\": \"位于矩形管框架的顶部，覆盖整个开口。\",\n      \"parts_used\": [\n        {\n          \"bom_seq\": \"7\",\n          \"bom_name\": \"封板\",\n          \"quantity\": 2,\n          \"drawing_number\": \"7\",\n          \"node_name\": [\n            \"NAUO12\",\n            \"NAUO11\"\n          ],\n          \"bom_code\": \"01.01.01.16608\"\n        }\n      ],\n      \"tools\": [\n        \"焊机\",\n        \"卡具\"\n      ],\n      \"warnings\": [\n        \"封板与矩形管的边缘必须对齐，确保焊接间隙均匀。\",\n        \"注意封板的安装方向，避免装反。\"\n      ],\n      \"welding\": {\n        \"required\": true,\n        \"welding_type\": \"角焊（点焊定位）\",\n        \"welding_method\": \"CO2气保焊\",\n        \"weld_size\": \"点焊长度10mm，焊脚高度3mm\",\n        \"welding_position\": \"零件⑦（封板）与零件①/⑥/⑧（矩形管）的连接处，平焊\",\n        \"quality_requirements\": \"封板与矩形管边缘对齐，点焊位置均匀，防止后续满焊时变形。\",\n        \"safety_notes\": \"点焊前检查焊枪喷嘴和导电嘴，确保气体保护效果良好。\"\n      },\n      \"safety_warnings\": [\n        \"搬运封板时，佩戴防护手套，防止板材边缘割伤。\",\n        \"进行点焊作业时，必须佩戴焊接面罩和防护手套，防止弧光和烫伤。\",\n        \"点焊前检查焊枪喷嘴和导电嘴，确保气体保护效果良好，防止飞溅伤人。\"\n      ]\n    },\n    {\n      \"step_number\": 5,\n      \"action\": \"安装挂件虚拟组件\",\n      \"description\": \"将图纸上标注为④的右挂件虚拟组件（01.05.0018）和标注为⑤的左挂件虚拟组件（01.05.0019）分别安装在②号连接板的两端，并进行点焊定位。\",\n      \"position_description\": \"④号和⑤号挂件分别位于②号连接板的两端，注意区分左右。\",\n      \"parts_used\": [\n        {\n          \"bom_seq\": \"4\",\n          \"bom_name\": \"右挂件虚拟组件\",\n          \"quantity\": 1,\n          \"drawing_number\": \"4\",\n          \"node_name\": [\n            \"NAUO21\",\n            \"NAUO20\",\n            \"NAUO19\"\n          ],\n          \"bom_code\": \"01.05.0018\"\n        },\n        {\n          \"bom_seq\": \"5\",\n          \"bom_name\": \"左挂件虚拟组件\",\n          \"quantity\": 1,\n          \"drawing_number\": \"5\",\n          \"node_name\": [\n            \"NAUO18\",\n            \"NAUO17\",\n            \"NAUO16\"\n          ],\n          \"bom_code\": \"01.05.0019\"\n        }\n      ],\n      \"tools\": [\n        \"焊机\",\n        \"定位销\"\n      ],\n      \"warnings\": [\n        \"挂件的安装位置是关键尺寸，必须使用定位销或专用工装确保精度。\",\n        \"确认挂件的朝向正确。\"\n      ],\n      \"welding\": {\n        \"required\": true,\n        \"welding_type\": \"角焊（点焊定位）\",\n        \"welding_method\": \"CO2气保焊\",\n        \"weld_size\": \"点焊长度15mm，焊脚高度4mm\",\n        \"welding_position\": \"零件④/⑤（挂件）与零件②（连接板）的连接处，平焊/横焊\",\n        \"quality_requirements\": \"定位精度高，焊点牢固，确保挂件与连接板的相对位置准确。\",\n        \"safety_notes\": \"挂件可能存在应力集中，点焊时应避免在关键受力区域过度加热。注意防火，清除周围可燃物。\"\n      },\n      \"safety_warnings\": [\n        \"进行点焊作业时，必须佩戴焊接面罩、防护手套，防止弧光和烫伤。\",\n        \"点焊时应避免在关键受力区域过度加热，防止结构变形或应力集中。\",\n        \"注意防火，清除周围可燃物，防止焊接火花引燃。\"\n      ]\n    },\n    {\n      \"step_number\": 6,\n      \"action\": \"安装加强筋\",\n      \"description\": \"将图纸上标注为⑨的加强筋（01.01.01.17678）安装在矩形管和连接板的连接处，进行点焊定位。\",\n      \"position_description\": \"位于矩形管和连接板的内侧，起到支撑作用。\",\n      \"parts_used\": [\n        {\n          \"bom_seq\": \"9\",\n          \"bom_name\": \"加强筋\",\n          \"quantity\": 2,\n          \"drawing_number\": \"9\",\n          \"node_name\": [\n            \"NAUO15\",\n            \"NAUO14\"\n          ],\n          \"bom_code\": \"01.01.01.17678\"\n        }\n      ],\n      \"tools\": [\n        \"焊机\",\n        \"卡具\"\n      ],\n      \"warnings\": [\n        \"加强筋的安装角度和位置必须符合图纸要求，确保受力均匀。\",\n        \"加强筋数量为2个，确保全部安装到位。\"\n      ],\n      \"welding\": {\n        \"required\": true,\n        \"welding_type\": \"角焊（点焊定位）\",\n        \"welding_method\": \"CO2气保焊\",\n        \"weld_size\": \"点焊长度10mm，焊脚高度3mm\",\n        \"welding_position\": \"零件⑨（加强筋）与零件②（连接板）和矩形管的连接处，平焊/立焊\",\n        \"quality_requirements\": \"加强筋与主体结构贴合紧密，点焊位置应避开后续满焊的起始点。\",\n        \"safety_notes\": \"立焊位置操作时，注意调整焊接角度，防止熔渣和熔池下坠烫伤。\"\n      },\n      \"safety_warnings\": [\n        \"进行点焊作业时，必须佩戴焊接面罩、防护手套，防止弧光和烫伤。\",\n        \"在立焊位置操作时，注意调整焊接角度，防止熔渣和熔池下坠烫伤皮肤。\",\n        \"搬运加强筋时，佩戴防护手套，防止边缘割伤。\"\n      ]\n    },\n    {\n      \"step_number\": 7,\n      \"action\": \"安装方形板\",\n      \"description\": \"将图纸上标注为③的方形板-机加（01.01.01.6589）安装在②号连接板的指定孔位上，并进行点焊定位。\",\n      \"position_description\": \"安装在②号连接板的四个角或指定位置，用于后续连接。\",\n      \"parts_used\": [\n        {\n          \"bom_seq\": \"3\",\n          \"bom_name\": \"方形板-机加\",\n          \"quantity\": 4,\n          \"drawing_number\": \"3\",\n          \"node_name\": [\n            \"NAUO6\",\n            \"NAUO5\",\n            \"NAUO4\",\n            \"NAUO3\"\n          ],\n          \"bom_code\": \"01.01.01.6589\"\n        }\n      ],\n      \"tools\": [\n        \"焊机\",\n        \"定位工装\"\n      ],\n      \"warnings\": [\n        \"方形板为机加件，安装时注意保护其加工面。\",\n        \"确保方形板的安装平面与连接板平行。\"\n      ],\n      \"welding\": {\n        \"required\": true,\n        \"welding_type\": \"角焊（点焊定位）\",\n        \"welding_method\": \"CO2气保焊\",\n        \"weld_size\": \"点焊长度10mm，焊脚高度3mm\",\n        \"welding_position\": \"零件③（方形板）与零件②（连接板）的连接处，平焊\",\n        \"quality_requirements\": \"方形板定位精度要求高，点焊后需复核其平面度。\",\n        \"safety_notes\": \"点焊时，避免焊点靠近机加孔位，防止热变形影响孔位精度。\"\n      },\n      \"safety_warnings\": [\n        \"进行点焊作业时，必须佩戴焊接面罩、防护手套，防止弧光和烫伤。\",\n        \"点焊时，避免焊点靠近机加孔位，防止热变形影响孔位精度和后续装配。\",\n        \"搬运机加件时，轻拿轻放，防止砸伤脚部或手部。\"\n      ]\n    },\n    {\n      \"step_number\": 8,\n      \"action\": \"满焊所有零件\",\n      \"description\": \"按照图纸上的焊接符号和技术要求，对所有已点焊定位的零件进行满焊。焊接顺序应遵循对称、分散的原则，以减少焊接变形。\",\n      \"position_description\": \"所有零件的连接处。\",\n      \"parts_used\": [],\n      \"tools\": [\n        \"焊机\",\n        \"焊条/焊丝\",\n        \"清渣工具\"\n      ],\n      \"warnings\": [\n        \"严格控制焊接电流、电压和速度，确保焊缝成型美观、牢固。\",\n        \"焊接过程中注意检查和校正变形，必要时进行反变形处理。\",\n        \"焊后必须彻底清渣，确保焊缝无虚焊、漏焊等缺陷。\"\n      ],\n      \"welding\": {\n        \"required\": true,\n        \"welding_type\": \"角焊/对接焊（满焊）\",\n        \"welding_method\": \"CO2气保焊（或根据板厚选择手工电弧焊）\",\n        \"weld_size\": \"焊脚高度8mm（根据图纸标注，如未标注按8mm执行）\",\n        \"welding_position\": \"所有零件连接处，涉及平焊、横焊、立焊\",\n        \"quality_requirements\": \"焊缝连续、饱满，焊波均匀。焊后进行外观检查，确保无气孔、夹渣、裂纹、未熔合等缺陷。关键焊缝需进行超声波或磁粉检测。\",\n        \"safety_notes\": \"进行大面积焊接时，必须佩戴全套防护装备（面罩、手套、防护服）。注意焊机持续工作时间，防止设备过热。焊接完成后，对高温焊件进行隔离警示，防止烫伤。\"\n      },\n      \"safety_warnings\": [\n        \"进行满焊作业时，必须佩戴全套防护装备（焊接面罩、防护服、防护手套），防止弧光和高温飞溅物伤害。\",\n        \"确保工作区域通风良好，必要时使用局部排风装置，防止吸入大量焊接烟尘。\",\n        \"焊接完成后，工件温度极高，必须设置隔离警示标志，防止人员接触烫伤。\",\n        \"清理焊渣时，佩戴防护眼镜，使用专用工具，防止焊渣飞溅伤眼。\"\n      ]\n    }\n  ]\n}\n```",
  "parsed_result": {
    "enhanced_steps": [
      {
        "step_number": 1,
        "action": "放置基准件",
        "description": "将图纸上标注为②的连接板（01.01.01.11509）平稳放置在装配工装台上，作为整个组件的装配基准。",
        "position_description": "平放于工装台中心，确保水平。",
        "parts_used": [
          {
            "bom_seq": "2",
            "bom_name": "连接板",
            "quantity": 1,
            "drawing_number": "2",
            "node_name": [
              "NAUO2"
            ],
            "bom_code": "01.01.01.11509"
          }
        ],
        "tools": [
          "行车/吊具",
          "水平仪",
          "装配工装台"
        ],
        "warnings": [
          "连接板较重，吊装时注意安全，防止倾倒。",
          "确保连接板表面清洁，无油污和杂质。"
        ],
        "safety_warnings": [
          "吊装前检查吊具和吊索具是否完好，防止吊物坠落伤人。",
          "吊装过程中，人员必须佩戴安全帽，并远离吊物下方。",
          "指挥人员必须使用规范手势，确保吊物平稳起落，防止碰撞。"
        ]
      },
      {
        "step_number": 2,
        "action": "安装底部矩形管",
        "description": "将图纸上标注为①的矩形管（01.01.03.2718）放置在②号连接板的底部边缘，并进行点焊定位。注意矩形管的长度方向与连接板的长边对齐。",
        "position_description": "位于②号连接板的底部边缘，与连接板垂直。",
        "parts_used": [
          {
            "bom_seq": "1",
            "bom_name": "矩形管",
            "quantity": 1,
            "drawing_number": "1",
            "node_name": [
              "NAUO1"
            ],
            "bom_code": "01.01.03.2718"
          }
        ],
        "tools": [
          "焊机",
          "角尺",
          "卡具"
        ],
        "warnings": [
          "点焊时注意焊接电流和时间，防止烧穿。",
          "使用卡具固定，确保矩形管与连接板的垂直度。"
        ],
        "welding": {
          "required": true,
          "welding_type": "角焊（点焊定位）",
          "welding_method": "CO2气保焊",
          "weld_size": "点焊长度10-15mm，焊脚高度3mm",
          "welding_position": "零件①（矩形管）与零件②（连接板）的连接处，平焊",
          "quality_requirements": "点焊牢固，定位准确，焊点无裂纹、气孔",
          "safety_notes": "佩戴焊接面罩、防护手套和防护服。确保工作区域通风良好，防止烟尘吸入。"
        },
        "safety_warnings": [
          "进行点焊作业时，必须佩戴焊接面罩、防护手套和防护服，防止弧光和烫伤。",
          "确保焊机接地良好，电缆绝缘完好，防止触电。",
          "工作区域必须保持通风，防止焊接烟尘和有毒气体中毒。",
          "点焊前检查周围环境，清除易燃易爆物品，防止火灾。"
        ]
      },
      {
        "step_number": 3,
        "action": "安装两侧矩形管",
        "description": "将图纸上标注为⑥的矩形管（01.01.03.2719）和标注为⑧的矩形管（01.01.03.2720）分别安装在②号连接板的两侧，并进行点焊定位。",
        "position_description": "⑥号矩形管位于②号连接板的一侧，⑧号矩形管位于另一侧，均与连接板垂直。",
        "parts_used": [
          {
            "bom_seq": "6",
            "bom_name": "矩形管",
            "quantity": 2,
            "drawing_number": "6",
            "node_name": [
              "NAUO10",
              "NAUO9"
            ],
            "bom_code": "01.01.03.2719"
          },
          {
            "bom_seq": "8",
            "bom_name": "矩形管",
            "quantity": 1,
            "drawing_number": "8",
            "node_name": [
              "NAUO13"
            ],
            "bom_code": "01.01.03.2720"
          }
        ],
        "tools": [
          "焊机",
          "卡具",
          "卷尺"
        ],
        "warnings": [
          "确保两侧矩形管的安装位置对称，尺寸符合图纸要求。",
          "点焊牢固，防止后续焊接过程中零件移位。"
        ],
        "welding": {
          "required": true,
          "welding_type": "角焊（点焊定位）",
          "welding_method": "CO2气保焊",
          "weld_size": "点焊长度10-15mm，焊脚高度3mm",
          "welding_position": "零件⑥/⑧（矩形管）与零件②（连接板）的连接处，平焊",
          "quality_requirements": "点焊位置均匀分布，确保零件垂直度误差小于1mm",
          "safety_notes": "检查焊机接地线是否完好，避免触电风险。点焊后及时清理飞溅物。"
        },
        "safety_warnings": [
          "进行点焊作业时，必须佩戴焊接面罩、防护手套，防止弧光和烫伤。",
          "操作前检查焊机接地线是否完好，避免触电风险。",
          "点焊后及时清理焊渣和飞溅物，防止烫伤或滑倒。"
        ]
      },
      {
        "step_number": 4,
        "action": "安装封板",
        "description": "将图纸上标注为⑦的封板（01.01.01.16608）安装在矩形管（①、⑥、⑧）形成的框架顶部，并进行点焊定位。",
        "position_description": "位于矩形管框架的顶部，覆盖整个开口。",
        "parts_used": [
          {
            "bom_seq": "7",
            "bom_name": "封板",
            "quantity": 2,
            "drawing_number": "7",
            "node_name": [
              "NAUO12",
              "NAUO11"
            ],
            "bom_code": "01.01.01.16608"
          }
        ],
        "tools": [
          "焊机",
          "卡具"
        ],
        "warnings": [
          "封板与矩形管的边缘必须对齐，确保焊接间隙均匀。",
          "注意封板的安装方向，避免装反。"
        ],
        "welding": {
          "required": true,
          "welding_type": "角焊（点焊定位）",
          "welding_method": "CO2气保焊",
          "weld_size": "点焊长度10mm，焊脚高度3mm",
          "welding_position": "零件⑦（封板）与零件①/⑥/⑧（矩形管）的连接处，平焊",
          "quality_requirements": "封板与矩形管边缘对齐，点焊位置均匀，防止后续满焊时变形。",
          "safety_notes": "点焊前检查焊枪喷嘴和导电嘴，确保气体保护效果良好。"
        },
        "safety_warnings": [
          "搬运封板时，佩戴防护手套，防止板材边缘割伤。",
          "进行点焊作业时，必须佩戴焊接面罩和防护手套，防止弧光和烫伤。",
          "点焊前检查焊枪喷嘴和导电嘴，确保气体保护效果良好，防止飞溅伤人。"
        ]
      },
      {
        "step_number": 5,
        "action": "安装挂件虚拟组件",
        "description": "将图纸上标注为④的右挂件虚拟组件（01.05.0018）和标注为⑤的左挂件虚拟组件（01.05.0019）分别安装在②号连接板的两端，并进行点焊定位。",
        "position_description": "④号和⑤号挂件分别位于②号连接板的两端，注意区分左右。",
        "parts_used": [
          {
            "bom_seq": "4",
            "bom_name": "右挂件虚拟组件",
            "quantity": 1,
            "drawing_number": "4",
            "node_name": [
              "NAUO21",
              "NAUO20",
              "NAUO19"
            ],
            "bom_code": "01.05.0018"
          },
          {
            "bom_seq": "5",
            "bom_name": "左挂件虚拟组件",
            "quantity": 1,
            "drawing_number": "5",
            "node_name": [
              "NAUO18",
              "NAUO17",
              "NAUO16"
            ],
            "bom_code": "01.05.0019"
          }
        ],
        "tools": [
          "焊机",
          "定位销"
        ],
        "warnings": [
          "挂件的安装位置是关键尺寸，必须使用定位销或专用工装确保精度。",
          "确认挂件的朝向正确。"
        ],
        "welding": {
          "required": true,
          "welding_type": "角焊（点焊定位）",
          "welding_method": "CO2气保焊",
          "weld_size": "点焊长度15mm，焊脚高度4mm",
          "welding_position": "零件④/⑤（挂件）与零件②（连接板）的连接处，平焊/横焊",
          "quality_requirements": "定位精度高，焊点牢固，确保挂件与连接板的相对位置准确。",
          "safety_notes": "挂件可能存在应力集中，点焊时应避免在关键受力区域过度加热。注意防火，清除周围可燃物。"
        },
        "safety_warnings": [
          "进行点焊作业时，必须佩戴焊接面罩、防护手套，防止弧光和烫伤。",
          "点焊时应避免在关键受力区域过度加热，防止结构变形或应力集中。",
          "注意防火，清除周围可燃物，防止焊接火花引燃。"
        ]
      },
      {
        "step_number": 6,
        "action": "安装加强筋",
        "description": "将图纸上标注为⑨的加强筋（01.01.01.17678）安装在矩形管和连接板的连接处，进行点焊定位。",
        "position_description": "位于矩形管和连接板的内侧，起到支撑作用。",
        "parts_used": [
          {
            "bom_seq": "9",
            "bom_name": "加强筋",
            "quantity": 2,
            "drawing_number": "9",
            "node_name": [
              "NAUO15",
              "NAUO14"
            ],
            "bom_code": "01.01.01.17678"
          }
        ],
        "tools": [
          "焊机",
          "卡具"
        ],
        "warnings": [
          "加强筋的安装角度和位置必须符合图纸要求，确保受力均匀。",
          "加强筋数量为2个，确保全部安装到位。"
        ],
        "welding": {
          "required": true,
          "welding_type": "角焊（点焊定位）",
          "welding_method": "CO2气保焊",
          "weld_size": "点焊长度10mm，焊脚高度3mm",
          "welding_position": "零件⑨（加强筋）与零件②（连接板）和矩形管的连接处，平焊/立焊",
          "quality_requirements": "加强筋与主体结构贴合紧密，点焊位置应避开后续满焊的起始点。",
          "safety_notes": "立焊位置操作时，注意调整焊接角度，防止熔渣和熔池下坠烫伤。"
        },
        "safety_warnings": [
          "进行点焊作业时，必须佩戴焊接面罩、防护手套，防止弧光和烫伤。",
          "在立焊位置操作时，注意调整焊接角度，防止熔渣和熔池下坠烫伤皮肤。",
          "搬运加强筋时，佩戴防护手套，防止边缘割伤。"
        ]
      },
      {
        "step_number": 7,
        "action": "安装方形板",
        "description": "将图纸上标注为③的方形板-机加（01.01.01.6589）安装在②号连接板的指定孔位上，并进行点焊定位。",
        "position_description": "安装在②号连接板的四个角或指定位置，用于后续连接。",
        "parts_used": [
          {
            "bom_seq": "3",
            "bom_name": "方形板-机加",
            "quantity": 4,
            "drawing_number": "3",
            "node_name": [
              "NAUO6",
              "NAUO5",
              "NAUO4",
              "NAUO3"
            ],
            "bom_code": "01.01.01.6589"
          }
        ],
        "tools": [
          "焊机",
          "定位工装"
        ],
        "warnings": [
          "方形板为机加件，安装时注意保护其加工面。",
          "确保方形板的安装平面与连接板平行。"
        ],
        "welding": {
          "required": true,
          "welding_type": "角焊（点焊定位）",
          "welding_method": "CO2气保焊",
          "weld_size": "点焊长度10mm，焊脚高度3mm",
          "welding_position": "零件③（方形板）与零件②（连接板）的连接处，平焊",
          "quality_requirements": "方形板定位精度要求高，点焊后需复核其平面度。",
          "safety_notes": "点焊时，避免焊点靠近机加孔位，防止热变形影响孔位精度。"
        },
        "safety_warnings": [
          "进行点焊作业时，必须佩戴焊接面罩、防护手套，防止弧光和烫伤。",
          "点焊时，避免焊点靠近机加孔位，防止热变形影响孔位精度和后续装配。",
          "搬运机加件时，轻拿轻放，防止砸伤脚部或手部。"
        ]
      },
      {
        "step_number": 8,
        "action": "满焊所有零件",
        "description": "按照图纸上的焊接符号和技术要求，对所有已点焊定位的零件进行满焊。焊接顺序应遵循对称、分散的原则，以减少焊接变形。",
        "position_description": "所有零件的连接处。",
        "parts_used": [],
        "tools": [
          "焊机",
          "焊条/焊丝",
          "清渣工具"
        ],
        "warnings": [
          "严格控制焊接电流、电压和速度，确保焊缝成型美观、牢固。",
          "焊接过程中注意检查和校正变形，必要时进行反变形处理。",
          "焊后必须彻底清渣，确保焊缝无虚焊、漏焊等缺陷。"
        ],
        "welding": {
          "required": true,
          "welding_type": "角焊/对接焊（满焊）",
          "welding_method": "CO2气保焊（或根据板厚选择手工电弧焊）",
          "weld_size": "焊脚高度8mm（根据图纸标注，如未标注按8mm执行）",
          "welding_position": "所有零件连接处，涉及平焊、横焊、立焊",
          "quality_requirements": "焊缝连续、饱满，焊波均匀。焊后进行外观检查，确保无气孔、夹渣、裂纹、未熔合等缺陷。关键焊缝需进行超声波或磁粉检测。",
          "safety_notes": "进行大面积焊接时，必须佩戴全套防护装备（面罩、手套、防护服）。注意焊机持续工作时间，防止设备过热。焊接完成后，对高温焊件进行隔离警示，防止烫伤。"
        },
        "safety_warnings": [
          "进行满焊作业时，必须佩戴全套防护装备（焊接面罩、防护服、防护手套），防止弧光和高温飞溅物伤害。",
          "确保工作区域通风良好，必要时使用局部排风装置，防止吸入大量焊接烟尘。",
          "焊接完成后，工件温度极高，必须设置隔离警示标志，防止人员接触烫伤。",
          "清理焊渣时，佩戴防护眼镜，使用专用工具，防止焊渣飞溅伤眼。"
        ]
      }
    ]
  }
}