{
  "agent_name": "Agent6_FAQ",
  "model": "google/gemini-2.5-flash-preview-09-2025",
  "timestamp": "20251009_130746",
  "image_count": 0,
  "temperature": 0.2,
  "system_prompt": "# 角色定位\n\n你是**李师傅**，一位拥有20年安全管理经验的高级安全工程师。\n\n## 教育背景\n\n- **学历**：安全工程专业本科\n- **职业资格**：注册安全工程师、高级安全评价师\n- **专业培训**：\n  - 机械制造安全管理\n  - 职业健康与安全管理体系（ISO 45001）\n  - 事故调查与分析\n  - 应急预案编制与演练\n\n## 职业背景\n\n- **工作经历**：20年机械制造企业安全管理经验，参与过大型装备制造、钢结构加工等项目\n- **专业领域**：\n  - 机械加工安全（车、铣、刨、磨、钻等）\n  - 焊接作业安全（电焊、气焊、氩弧焊等）\n  - 起重吊装安全（行车、叉车、吊索具等）\n  - 高空作业安全（脚手架、安全带、防坠落等）\n  - 个人防护用品管理（安全帽、防护眼镜、手套、安全鞋等）\n\n## 知识结构（详细）\n\n### 1. 机械伤害风险\n- **夹伤/挤伤**：手指、手臂被运动部件夹住\n- **切割伤**：锋利边缘、毛刺、切削工具\n- **碰撞伤**：头部碰撞、身体碰撞\n- **坠落伤**：零件坠落、工具坠落、人员坠落\n\n### 2. 焊接作业风险\n- **电击伤**：焊机漏电、接地不良\n- **弧光伤**：电弧紫外线灼伤眼睛和皮肤\n- **烫伤**：高温熔池、焊渣飞溅\n- **火灾爆炸**：易燃物引燃、气瓶泄漏\n- **有毒气体**：焊接烟尘、一氧化碳中毒\n\n### 3. 起重吊装风险\n- **吊物坠落**：吊索具断裂、捆绑不牢\n- **吊物摆动**：碰撞人员、设备\n- **超载**：超过起重机额定载荷\n- **指挥失误**：信号不清、违章指挥\n\n### 4. 高空作业风险\n- **人员坠落**：未系安全带、脚手架不牢\n- **物体打击**：工具、零件从高处坠落\n- **脚手架坍塌**：搭设不规范、超载\n\n### 5. 个人防护用品\n- **头部防护**：安全帽（防止碰撞、坠物打击）\n- **眼部防护**：防护眼镜、焊接面罩（防止飞溅、弧光）\n- **手部防护**：防护手套（防止切割、烫伤、化学品）\n- **足部防护**：安全鞋（防砸、防刺穿、防滑）\n- **呼吸防护**：防尘口罩、防毒面具（防止粉尘、有毒气体）\n\n### 6. 应急处理\n- **机械伤害**：立即停机、呼救、止血、固定、送医\n- **电击伤**：切断电源、心肺复苏、送医\n- **烫伤**：冷水冲洗、覆盖无菌纱布、送医\n- **火灾**：使用灭火器、疏散人员、报警\n\n## 任务步骤（Chain of Thought）\n\n你的任务是**为每个装配步骤添加安全警告**（如果该步骤有安全风险）。请按照以下5个步骤思考：\n\n### 步骤1：识别风险步骤\n- 分析每个装配步骤的操作内容\n- 判断是否涉及高风险作业（焊接、吊装、高空、重物搬运等）\n- 识别潜在的伤害类型（机械伤害、电击、烫伤、坠落等）\n\n### 步骤2：分析风险源\n- 确定风险的来源（设备、工具、材料、环境、人员操作等）\n- 评估风险的严重程度（轻微、中等、严重、致命）\n- 考虑风险的发生概率\n\n### 步骤3：制定预防措施\n- 针对每个风险源，制定具体的预防措施\n- 强调个人防护用品的使用\n- 强调安全操作规程的遵守\n\n### 步骤4：添加安全警告\n- 为每个有风险的步骤添加safety_warnings字段\n- 每条警告要简洁明了，说明具体的风险和预防措施\n- 使用工人能看懂的语言\n\n### 步骤5：验证完整性\n- 检查所有高风险步骤是否都添加了安全警告\n- 检查安全警告是否具体、可操作\n- 检查是否遗漏了任何潜在风险\n\n## 核心原则\n\n1. **步骤级嵌入**：为每个有风险的步骤添加safety_warnings字段，而不是单独列出安全警告\n2. **工人友好**：使用通俗语言，避免专业术语\n3. **具体可操作**：说明具体的风险和预防措施，而不是泛泛而谈\n4. **不重复显示**：安全警告只在下方\"安全\"标签页中统一显示，不在当前步骤详情中重复显示\n\n## 输出格式\n\n严格按照以下JSON格式输出（返回增强后的装配步骤）：\n\n```json\n{\n  \"enhanced_steps\": [\n    {\n      \"step_number\": 1,\n      \"title\": \"点焊定位\",\n      \"parts_used\": [...],\n      \"tools_required\": [...],\n      \"operation\": \"操作说明\",\n      \"quality_check\": \"质量检查\",\n      \"estimated_time_minutes\": 10,\n      \"welding\": {\n        \"required\": true,\n        \"welding_type\": \"点焊\",\n        \"welding_method\": \"CO2气保焊\",\n        ...\n      },\n      \"safety_warnings\": [\n        \"佩戴焊接面罩和防护手套，防止弧光灼伤眼睛和皮肤\",\n        \"确保工件夹紧牢固，防止点焊时位移造成伤害\",\n        \"焊接区域周围3米内不得有易燃物，配备灭火器\",\n        \"焊机必须接地良好，防止漏电触电\"\n      ]\n    },\n    {\n      \"step_number\": 2,\n      \"title\": \"螺栓连接\",\n      \"parts_used\": [...],\n      \"operation\": \"操作说明\",\n      \"quality_check\": \"质量检查\",\n      \"estimated_time_minutes\": 15,\n      \"safety_warnings\": [\n        \"佩戴安全帽和防护眼镜，防止零件坠落和飞溅\",\n        \"使用扭力扳手时注意力度，防止扳手滑脱伤人\"\n      ]\n    },\n    {\n      \"step_number\": 3,\n      \"title\": \"简单装配\",\n      \"parts_used\": [...],\n      \"operation\": \"操作说明\",\n      \"quality_check\": \"质量检查\",\n      \"estimated_time_minutes\": 5\n      // ⚠️ 如果没有明显安全风险，不添加safety_warnings字段\n    }\n  ]\n}\n```\n\n**⚠️ 关键要求**：\n\n1. **步骤级嵌入**：\n   - 为每个有风险的步骤添加`safety_warnings`字段\n   - 没有明显风险的步骤不添加`safety_warnings`字段\n   - 保持原有步骤的所有字段不变\n\n2. **安全警告要具体**：\n   - ✅ 说\"佩戴焊接面罩和防护手套，防止弧光灼伤眼睛和皮肤\"\n   - ❌ 不说\"注意安全\"\n   - ✅ 说\"焊接区域周围3米内不得有易燃物，配备灭火器\"\n   - ❌ 不说\"注意防火\"\n\n3. **使用通俗语言**：\n   - 工人能看懂的语言\n   - 避免专业术语和英文缩写\n\n4. **警告要全面**：\n   - 涵盖个人防护、设备安全、环境安全、操作安全\n   - 每条警告说明具体的风险和预防措施\n\n## 重要提醒\n\n- **只输出JSON，不要输出其他内容**\n- **保持原有字段不变**：不要修改或删除原有的字段（包括welding字段）\n- **警告要简洁明了**：每条警告一句话，说明风险和预防措施\n- **不要过度警告**：只针对有明显风险的步骤添加警告\n",
  "user_query": "请为以下装配步骤添加安全警告（如果有安全风险）。\n\n## 📸 视觉分析任务\n\n**你会看到工程图纸图片，请仔细观察：**\n\n1. **危险作业标识**：\n   - 图纸上的安全警告标识\n   - 特殊作业要求（如高空作业、吊装作业等）\n   - 危险区域标注\n\n2. **零件特征**：\n   - 重型零件（需要吊装）\n   - 锋利边缘（容易割伤）\n   - 高温部件（容易烫伤）\n\n3. **作业环境**：\n   - 狭窄空间（容易碰撞）\n   - 高空位置（容易坠落）\n   - 密闭空间（通风不良）\n\n## 装配步骤\n\n[\n  {\n    \"step_number\": 1,\n    \"action\": \"放置基准件\",\n    \"description\": \"将图纸上标注为1号的方形板-机加（01.01.01.11511）平稳放置在装配工作台上，作为整个组件的装配基准。\",\n    \"position_description\": \"工作台中心，确保水平。\",\n    \"parts_used\": [\n      {\n        \"bom_seq\": \"1\",\n        \"bom_name\": \"方形板-机加\",\n        \"quantity\": 1,\n        \"drawing_number\": \"1\",\n        \"node_name\": [\n          \"NAUO1\"\n        ],\n        \"bom_code\": \"01.01.01.11511\"\n      }\n    ],\n    \"tools\": [\n      \"行车\",\n      \"吊具\",\n      \"水平仪\"\n    ],\n    \"warnings\": [\n      \"注意吊装安全，确保基准件放置平稳。\"\n    ]\n  },\n  {\n    \"step_number\": 2,\n    \"action\": \"安装上连接板\",\n    \"description\": \"将2块图纸上标注为2号的上连接板（01.01.01.11512）分别放置在1号方形板的顶部两侧，按照图纸尺寸（如436mm、355mm等）进行定位，并进行点焊固定。\",\n    \"position_description\": \"位于1号方形板的顶部边缘，两侧对称。\",\n    \"parts_used\": [\n      {\n        \"bom_seq\": \"2\",\n        \"bom_name\": \"上连接板\",\n        \"quantity\": 2,\n        \"drawing_number\": \"2\",\n        \"node_name\": [\n          \"NAUO3\",\n          \"NAUO2\"\n        ],\n        \"bom_code\": \"01.01.01.11512\"\n      }\n    ],\n    \"tools\": [\n      \"卷尺\",\n      \"直角尺\",\n      \"点焊机\"\n    ],\n    \"warnings\": [\n      \"点焊前必须确保定位准确，特别是与1号板的垂直度。\"\n    ],\n    \"welding\": {\n      \"required\": true,\n      \"welding_type\": \"角焊（定位焊）\",\n      \"welding_method\": \"CO2气保焊\",\n      \"weld_size\": \"点焊，焊点长度10-15mm\",\n      \"welding_position\": \"零件1（方形板）与零件2（上连接板）的连接处，平焊/横焊\",\n      \"quality_requirements\": \"焊点牢固，能承受后续装配应力，无裂纹\",\n      \"safety_notes\": \"佩戴焊接面罩和防护手套，确保工作区域通风良好，防止火花飞溅。\"\n    }\n  },\n  {\n    \"step_number\": 3,\n    \"action\": \"安装侧连接板\",\n    \"description\": \"将2块图纸上标注为3号的侧连接板（01.01.01.11513）分别放置在1号方形板的左右两侧，与2号上连接板形成直角结构，并进行点焊固定。\",\n    \"position_description\": \"位于1号方形板的左右两侧，与2号板连接。\",\n    \"parts_used\": [\n      {\n        \"bom_seq\": \"3\",\n        \"bom_name\": \"侧连接板\",\n        \"quantity\": 2,\n        \"drawing_number\": \"3\",\n        \"node_name\": [\n          \"NAUO5\",\n          \"NAUO4\"\n        ],\n        \"bom_code\": \"01.01.01.11513\"\n      }\n    ],\n    \"tools\": [\n      \"直角尺\",\n      \"点焊机\"\n    ],\n    \"warnings\": [\n      \"确保侧连接板与方形板的垂直度，以及与上连接板的对齐。\"\n    ],\n    \"welding\": {\n      \"required\": true,\n      \"welding_type\": \"角焊（定位焊）\",\n      \"welding_method\": \"CO2气保焊\",\n      \"weld_size\": \"点焊，焊点长度10-15mm\",\n      \"welding_position\": \"零件1（方形板）与零件3（侧连接板）的连接处，平焊/横焊\",\n      \"quality_requirements\": \"焊点牢固，保证结构件的垂直度（90度）\",\n      \"safety_notes\": \"点焊时注意保持身体稳定，避免电弧光直接照射皮肤。\"\n    }\n  },\n  {\n    \"step_number\": 4,\n    \"action\": \"安装折弯板\",\n    \"description\": \"将图纸上标注为4号的折弯板（01.01.01.11514）安装在2号上连接板的内侧，按照图纸尺寸进行定位，并进行点焊固定。\",\n    \"position_description\": \"位于组件顶部，连接两块2号上连接板的内部。\",\n    \"parts_used\": [\n      {\n        \"bom_seq\": \"4\",\n        \"bom_name\": \"折弯板\",\n        \"quantity\": 1,\n        \"drawing_number\": \"4\",\n        \"node_name\": [\n          \"NAUO6\"\n        ],\n        \"bom_code\": \"01.01.01.11514\"\n      }\n    ],\n    \"tools\": [\n      \"卷尺\",\n      \"点焊机\"\n    ],\n    \"warnings\": [\n      \"折弯板的定位孔必须与图纸要求对齐。\"\n    ],\n    \"welding\": {\n      \"required\": true,\n      \"welding_type\": \"角焊（定位焊）\",\n      \"welding_method\": \"CO2气保焊\",\n      \"weld_size\": \"点焊，焊点长度10-15mm\",\n      \"welding_position\": \"零件4（折弯板）与零件2（上连接板）的连接处，平焊\",\n      \"quality_requirements\": \"焊点牢固，保证折弯板的水平位置\",\n      \"safety_notes\": \"检查焊机接地线是否连接可靠，防止触电。\"\n    }\n  },\n  {\n    \"step_number\": 5,\n    \"action\": \"安装油缸固定板\",\n    \"description\": \"将4块图纸上标注为5号的油缸固定板（01.01.01.11515）分别安装在2号上连接板和3号侧连接板的指定位置，用于油缸连接，并进行点焊固定。\",\n    \"position_description\": \"分布在组件的四个角，靠近顶部。\",\n    \"parts_used\": [\n      {\n        \"bom_seq\": \"5\",\n        \"bom_name\": \"油缸固定板\",\n        \"quantity\": 4,\n        \"drawing_number\": \"5\",\n        \"node_name\": [\n          \"NAUO17\",\n          \"NAUO16\",\n          \"NAUO8\",\n          \"NAUO7\"\n        ],\n        \"bom_code\": \"01.01.01.11515\"\n      }\n    ],\n    \"tools\": [\n      \"点焊机\",\n      \"定位夹具\"\n    ],\n    \"warnings\": [\n      \"油缸固定板的孔位必须严格对齐，确保后续油缸安装顺畅。\"\n    ],\n    \"welding\": {\n      \"required\": true,\n      \"welding_type\": \"角焊（定位焊）\",\n      \"welding_method\": \"CO2气保焊\",\n      \"weld_size\": \"点焊，焊点长度10-15mm\",\n      \"welding_position\": \"零件5（油缸固定板）与零件2/3的连接处，平焊/横焊\",\n      \"quality_requirements\": \"焊点牢固，保证固定板的孔位精度\",\n      \"safety_notes\": \"使用定位夹具时，确保夹具与焊件接触良好，防止焊接过程中松动。\"\n    }\n  },\n  {\n    \"step_number\": 6,\n    \"action\": \"安装加强板\",\n    \"description\": \"将4块图纸上标注为6号的加强板（01.01.01.11516）安装在组件的内部，用于结构加强，按照图纸上的虚线位置进行定位，并进行点焊固定。\",\n    \"position_description\": \"位于组件内部，连接1号方形板与2号上连接板/3号侧连接板。\",\n    \"parts_used\": [\n      {\n        \"bom_seq\": \"6\",\n        \"bom_name\": \"加强板\",\n        \"quantity\": 4,\n        \"drawing_number\": \"6\",\n        \"node_name\": [\n          \"NAUO12\",\n          \"NAUO11\",\n          \"NAUO10\",\n          \"NAUO9\"\n        ],\n        \"bom_code\": \"01.01.01.11516\"\n      }\n    ],\n    \"tools\": [\n      \"点焊机\"\n    ],\n    \"warnings\": [\n      \"加强板的安装位置应避开后续轴套的焊接区域。\"\n    ],\n    \"welding\": {\n      \"required\": true,\n      \"welding_type\": \"角焊（定位焊）\",\n      \"welding_method\": \"CO2气保焊\",\n      \"weld_size\": \"点焊，焊点长度10-15mm\",\n      \"welding_position\": \"零件6（加强板）与主体结构（零件1/2/3）的连接处，平焊/立焊\",\n      \"quality_requirements\": \"焊点牢固，保证加强板与主体结构紧密贴合\",\n      \"safety_notes\": \"在内部狭小空间进行点焊时，注意保持姿势稳定，避免烫伤。\"\n    }\n  },\n  {\n    \"step_number\": 7,\n    \"action\": \"安装角钢\",\n    \"description\": \"将图纸上标注为7号的角钢-机加（01.01.04.0592）安装在组件的顶部，连接2号上连接板，并进行点焊固定。\",\n    \"position_description\": \"位于组件顶部，靠近折弯板4号。\",\n    \"parts_used\": [\n      {\n        \"bom_seq\": \"7\",\n        \"bom_name\": \"角钢-机加\",\n        \"quantity\": 1,\n        \"drawing_number\": \"7\",\n        \"node_name\": [\n          \"NAUO13\"\n        ],\n        \"bom_code\": \"01.01.04.0592\"\n      }\n    ],\n    \"tools\": [\n      \"点焊机\"\n    ],\n    \"warnings\": [\n      \"确保角钢与上连接板的接触面贴合紧密。\"\n    ],\n    \"welding\": {\n      \"required\": true,\n      \"welding_type\": \"角焊（定位焊）\",\n      \"welding_method\": \"CO2气保焊\",\n      \"weld_size\": \"点焊，焊点长度10-15mm\",\n      \"welding_position\": \"零件7（角钢）与零件2（上连接板）的连接处，平焊\",\n      \"quality_requirements\": \"焊点牢固，保证角钢定位准确\",\n      \"safety_notes\": \"清理角钢表面的油污和锈蚀，避免焊接时产生大量烟雾和气孔。\"\n    }\n  },\n  {\n    \"step_number\": 8,\n    \"action\": \"安装轴套（8号）\",\n    \"description\": \"将图纸上标注为8号的轴套（01.01.02.1221）安装在3号侧连接板的下部孔位，确保轴套中心线与侧连接板垂直，并进行点焊固定。\",\n    \"position_description\": \"位于3号侧连接板的下部，左右各一个。\",\n    \"parts_used\": [\n      {\n        \"bom_seq\": \"8\",\n        \"bom_name\": \"轴套 1\",\n        \"quantity\": 1,\n        \"drawing_number\": \"8\",\n        \"node_name\": [\n          \"NAUO14\"\n        ],\n        \"bom_code\": \"01.01.02.1221\"\n      }\n    ],\n    \"tools\": [\n      \"点焊机\",\n      \"定位销\"\n    ],\n    \"warnings\": [\n      \"轴套的安装方向和伸出长度必须符合图纸要求。\"\n    ],\n    \"welding\": {\n      \"required\": true,\n      \"welding_type\": \"角焊（定位焊）\",\n      \"welding_method\": \"CO2气保焊\",\n      \"weld_size\": \"点焊，焊点长度5-10mm\",\n      \"welding_position\": \"零件8（轴套）与零件3（侧连接板）的连接处，环形角焊（定位），平焊/横焊\",\n      \"quality_requirements\": \"焊点牢固，使用定位销或工装保证轴套的垂直度\",\n      \"safety_notes\": \"轴套为机加工件，点焊时电流不宜过大，防止烧穿或严重变形。\"\n    }\n  },\n  {\n    \"step_number\": 9,\n    \"action\": \"安装后座轴套（9号）\",\n    \"description\": \"将图纸上标注为9号的后座轴套 1（01.02.02.0490）安装在3号侧连接板的上部孔位，确保轴套中心线与侧连接板垂直，并进行点焊固定。\",\n    \"position_description\": \"位于3号侧连接板的上部，左右各一个。\",\n    \"parts_used\": [\n      {\n        \"bom_seq\": \"9\",\n        \"bom_name\": \"后座轴套 1\",\n        \"quantity\": 1,\n        \"drawing_number\": \"9\",\n        \"node_name\": [\n          \"NAUO15\"\n        ],\n        \"bom_code\": \"01.02.02.0490\"\n      }\n    ],\n    \"tools\": [\n      \"点焊机\",\n      \"定位销\"\n    ],\n    \"warnings\": [\n      \"轴套的同轴度要求高，需使用专用工装或定位销辅助。\"\n    ],\n    \"welding\": {\n      \"required\": true,\n      \"welding_type\": \"角焊（定位焊）\",\n      \"welding_method\": \"CO2气保焊\",\n      \"weld_size\": \"点焊，焊点长度5-10mm\",\n      \"welding_position\": \"零件9（后座轴套）与零件3（侧连接板）的连接处，环形角焊（定位），平焊/横焊\",\n      \"quality_requirements\": \"焊点牢固，必须保证轴套与零件8的同轴度要求\",\n      \"safety_notes\": \"定位焊后，立即检查轴套的定位精度，防止因热变形导致偏差。\"\n    }\n  },\n  {\n    \"step_number\": 10,\n    \"action\": \"安装后座轴套（10号）\",\n    \"description\": \"将图纸上标注为10号的后座轴套 1（01.01.02.0337）安装在4号折弯板的顶部孔位，确保轴套中心线与折弯板垂直，并进行点焊固定。\",\n    \"position_description\": \"位于4号折弯板的顶部。\",\n    \"parts_used\": [\n      {\n        \"bom_seq\": \"10\",\n        \"bom_name\": \"后座轴套 1\",\n        \"quantity\": 1,\n        \"drawing_number\": \"10\",\n        \"node_name\": [\n          \"NAUO18\"\n        ],\n        \"bom_code\": \"01.01.02.0337\"\n      }\n    ],\n    \"tools\": [\n      \"点焊机\",\n      \"定位销\"\n    ],\n    \"warnings\": [\n      \"确保轴套与折弯板的焊接牢固，且不影响后续装配。\"\n    ],\n    \"welding\": {\n      \"required\": true,\n      \"welding_type\": \"角焊（定位焊）\",\n      \"welding_method\": \"CO2气保焊\",\n      \"weld_size\": \"点焊，焊点长度5-10mm\",\n      \"welding_position\": \"零件10（后座轴套）与零件4（折弯板）的连接处，环形角焊（定位），平焊\",\n      \"quality_requirements\": \"焊点牢固，保证轴套的垂直度\",\n      \"safety_notes\": \"轴套孔内可能残留油污，点焊前需彻底清理，避免产生气孔。\"\n    }\n  },\n  {\n    \"step_number\": 11,\n    \"action\": \"满焊所有零件\",\n    \"description\": \"在所有零件点焊固定后，按照焊接工艺要求，对所有连接部位进行满焊。焊接顺序应遵循先内后外、先主后次的原则，以减少焊接变形。\",\n    \"position_description\": \"所有连接面。\",\n    \"parts_used\": [],\n    \"tools\": [\n      \"焊机\",\n      \"焊条/焊丝\",\n      \"焊工防护用品\"\n    ],\n    \"warnings\": [\n      \"焊接过程中注意控制热输入，防止结构件变形。轴套焊接需保证同轴度。\"\n    ],\n    \"welding\": {\n      \"required\": true,\n      \"welding_type\": \"角焊/环形角焊\",\n      \"welding_method\": \"CO2气保焊 (MAG)\",\n      \"weld_size\": \"焊脚高度6mm（根据图纸要求），连续满焊\",\n      \"welding_position\": \"所有零件连接处，涉及平焊、横焊、立焊\",\n      \"quality_requirements\": \"焊缝外观成型良好，焊缝饱满、连续，无气孔、夹渣、裂纹等缺陷。轴套焊缝需保证同轴度，并进行外观检查和渗透探伤（PT）或磁粉探伤（MT）。\",\n      \"safety_notes\": \"进行满焊时，需穿戴全套防护服、焊接面罩和手套。确保工作区域有强制通风设备，防止烟尘中毒。注意焊枪电缆和气管的保护，避免磨损和漏气。\"\n    }\n  },\n  {\n    \"step_number\": 12,\n    \"action\": \"清理与打磨\",\n    \"description\": \"焊接完成后，清理所有焊渣、飞溅物，并对焊缝进行打磨，去除尖锐棱角，达到图纸要求的表面粗糙度。\",\n    \"position_description\": \"所有焊缝区域。\",\n    \"parts_used\": [],\n    \"tools\": [\n      \"角磨机\",\n      \"钢丝刷\",\n      \"除渣锤\"\n    ],\n    \"warnings\": [\n      \"打磨时注意保护轴套孔位，避免损伤。\"\n    ]\n  }\n]\n\n## 要求\n\n请按照以下5个步骤思考，为装配步骤添加安全警告：\n\n### 步骤1：识别风险步骤\n- 分析每个装配步骤的操作内容\n- 判断是否涉及高风险作业：\n  * **焊接作业**：电击、弧光、烫伤、火灾\n  * **吊装作业**：吊物坠落、碰撞、超载\n  * **高空作业**：人员坠落、物体打击\n  * **重物搬运**：砸伤、扭伤、夹伤\n  * **机械加工**：切割伤、夹伤、碰撞\n\n### 步骤2：分析风险源\n- 确定风险的来源（设备、工具、材料、环境、人员操作等）\n- 评估风险的严重程度（轻微、中等、严重、致命）\n- 考虑风险的发生概率\n\n### 步骤3：制定预防措施\n- 针对每个风险源，制定具体的预防措施\n- 强调个人防护用品的使用：\n  * **焊接**：焊接面罩、防护手套、防护服\n  * **吊装**：安全帽、安全鞋、手套\n  * **高空**：安全带、安全帽、防滑鞋\n  * **机械**：防护眼镜、手套、安全鞋\n\n### 步骤4：添加安全警告\n- 为每个有风险的步骤添加safety_warnings字段\n- 每条警告要简洁明了，说明具体的风险和预防措施\n- 使用工人能看懂的语言\n\n### 步骤5：验证完整性\n- 检查所有高风险步骤是否都添加了安全警告\n- 检查安全警告是否具体、可操作\n- 检查是否遗漏了任何潜在风险\n\n## ⚠️ 强制自检清单（生成后必须逐项检查）\n\n**在输出JSON之前，你必须完成以下验证：**\n\n1. **风险步骤识别验证**：\n   - [ ] 所有涉及焊接、吊装、高空、重物搬运的步骤都添加了safety_warnings字段\n   - [ ] 没有明显风险的步骤没有添加safety_warnings字段\n\n2. **安全警告完整性验证**：\n   - [ ] 每个safety_warnings字段都是字符串数组\n   - [ ] 每条警告都说明了具体的风险和预防措施\n   - [ ] 涵盖了个人防护、设备安全、环境安全、操作安全\n\n3. **语言通俗性验证**：\n   - [ ] 使用工人能看懂的语言\n   - [ ] 避免专业术语和英文缩写\n   - [ ] 每条警告简洁明了（一句话）\n\n4. **原有字段保持验证**：\n   - [ ] 原有步骤的所有字段都保持不变（包括welding字段）\n   - [ ] 没有修改或删除任何原有字段\n\n**如果自检发现任何问题，必须重新生成！**\n\n现在开始为装配步骤添加安全警告！\n",
  "raw_response": "```json\n{\n  \"enhanced_steps\": [\n    {\n      \"step_number\": 1,\n      \"action\": \"放置基准件\",\n      \"description\": \"将图纸上标注为1号的方形板-机加（01.01.01.11511）平稳放置在装配工作台上，作为整个组件的装配基准。\",\n      \"position_description\": \"工作台中心，确保水平。\",\n      \"parts_used\": [\n        {\n          \"bom_seq\": \"1\",\n          \"bom_name\": \"方形板-机加\",\n          \"quantity\": 1,\n          \"drawing_number\": \"1\",\n          \"node_name\": [\n            \"NAUO1\"\n          ],\n          \"bom_code\": \"01.01.01.11511\"\n        }\n      ],\n      \"tools\": [\n        \"行车\",\n        \"吊具\",\n        \"水平仪\"\n      ],\n      \"warnings\": [\n        \"注意吊装安全，确保基准件放置平稳。\"\n      ],\n      \"safety_warnings\": [\n        \"吊装前检查行车和吊具是否完好，防止吊物坠落伤人。\",\n        \"指挥人员和操作人员必须佩戴安全帽，并使用规范的指挥手势。\",\n        \"重物搬运时，注意身体姿势，防止扭伤或砸伤脚部。\"\n      ]\n    },\n    {\n      \"step_number\": 2,\n      \"action\": \"安装上连接板\",\n      \"description\": \"将2块图纸上标注为2号的上连接板（01.01.01.11512）分别放置在1号方形板的顶部两侧，按照图纸尺寸（如436mm、355mm等）进行定位，并进行点焊固定。\",\n      \"position_description\": \"位于1号方形板的顶部边缘，两侧对称。\",\n      \"parts_used\": [\n        {\n          \"bom_seq\": \"2\",\n          \"bom_name\": \"上连接板\",\n          \"quantity\": 2,\n          \"drawing_number\": \"2\",\n          \"node_name\": [\n            \"NAUO3\",\n            \"NAUO2\"\n          ],\n          \"bom_code\": \"01.01.01.11512\"\n        }\n      ],\n      \"tools\": [\n        \"卷尺\",\n        \"直角尺\",\n        \"点焊机\"\n      ],\n      \"warnings\": [\n        \"点焊前必须确保定位准确，特别是与1号板的垂直度。\"\n      ],\n      \"welding\": {\n        \"required\": true,\n        \"welding_type\": \"角焊（定位焊）\",\n        \"welding_method\": \"CO2气保焊\",\n        \"weld_size\": \"点焊，焊点长度10-15mm\",\n        \"welding_position\": \"零件1（方形板）与零件2（上连接板）的连接处，平焊/横焊\",\n        \"quality_requirements\": \"焊点牢固，能承受后续装配应力，无裂纹\",\n        \"safety_notes\": \"佩戴焊接面罩和防护手套，确保工作区域通风良好，防止火花飞溅。\"\n      },\n      \"safety_warnings\": [\n        \"佩戴焊接面罩和防护手套，防止弧光灼伤眼睛和皮肤。\",\n        \"确保焊机接地良好，防止漏电触电。\",\n        \"点焊时注意焊渣飞溅，周围不得有易燃易爆物品。\"\n      ]\n    },\n    {\n      \"step_number\": 3,\n      \"action\": \"安装侧连接板\",\n      \"description\": \"将2块图纸上标注为3号的侧连接板（01.01.01.11513）分别放置在1号方形板的左右两侧，与2号上连接板形成直角结构，并进行点焊固定。\",\n      \"position_description\": \"位于1号方形板的左右两侧，与2号板连接。\",\n      \"parts_used\": [\n        {\n          \"bom_seq\": \"3\",\n          \"bom_name\": \"侧连接板\",\n          \"quantity\": 2,\n          \"drawing_number\": \"3\",\n          \"node_name\": [\n            \"NAUO5\",\n            \"NAUO4\"\n          ],\n          \"bom_code\": \"01.01.01.11513\"\n        }\n      ],\n      \"tools\": [\n        \"直角尺\",\n        \"点焊机\"\n      ],\n      \"warnings\": [\n        \"确保侧连接板与方形板的垂直度，以及与上连接板的对齐。\"\n      ],\n      \"welding\": {\n        \"required\": true,\n        \"welding_type\": \"角焊（定位焊）\",\n        \"welding_method\": \"CO2气保焊\",\n        \"weld_size\": \"点焊，焊点长度10-15mm\",\n        \"welding_position\": \"零件1（方形板）与零件3（侧连接板）的连接处，平焊/横焊\",\n        \"quality_requirements\": \"焊点牢固，保证结构件的垂直度（90度）\",\n        \"safety_notes\": \"点焊时注意保持身体稳定，避免电弧光直接照射皮肤。\"\n      },\n      \"safety_warnings\": [\n        \"佩戴焊接面罩和防护手套，防止弧光和高温烫伤。\",\n        \"检查焊枪和电缆绝缘层，防止破损导致触电。\",\n        \"确保工件稳定，防止点焊过程中倾倒或位移造成挤伤。\"\n      ]\n    },\n    {\n      \"step_number\": 4,\n      \"action\": \"安装折弯板\",\n      \"description\": \"将图纸上标注为4号的折弯板（01.01.01.11514）安装在2号上连接板的内侧，按照图纸尺寸进行定位，并进行点焊固定。\",\n      \"position_description\": \"位于组件顶部，连接两块2号上连接板的内部。\",\n      \"parts_used\": [\n        {\n          \"bom_seq\": \"4\",\n          \"bom_name\": \"折弯板\",\n          \"quantity\": 1,\n          \"drawing_number\": \"4\",\n          \"node_name\": [\n            \"NAUO6\"\n          ],\n          \"bom_code\": \"01.01.01.11514\"\n        }\n      ],\n      \"tools\": [\n        \"卷尺\",\n        \"点焊机\"\n      ],\n      \"warnings\": [\n        \"折弯板的定位孔必须与图纸要求对齐。\"\n      ],\n      \"welding\": {\n        \"required\": true,\n        \"welding_type\": \"角焊（定位焊）\",\n        \"welding_method\": \"CO2气保焊\",\n        \"weld_size\": \"点焊，焊点长度10-15mm\",\n        \"welding_position\": \"零件4（折弯板）与零件2（上连接板）的连接处，平焊\",\n        \"quality_requirements\": \"焊点牢固，保证折弯板的水平位置\",\n        \"safety_notes\": \"检查焊机接地线是否连接可靠，防止触电。\"\n      },\n      \"safety_warnings\": [\n        \"佩戴防护眼镜和手套，防止零件边缘割伤。\",\n        \"在内部空间点焊时，注意头部和身体姿势，防止碰撞受伤。\",\n        \"确保通风良好，避免焊接烟尘在内部聚集。\"\n      ]\n    },\n    {\n      \"step_number\": 5,\n      \"action\": \"安装油缸固定板\",\n      \"description\": \"将4块图纸上标注为5号的油缸固定板（01.01.01.11515）分别安装在2号上连接板和3号侧连接板的指定位置，用于油缸连接，并进行点焊固定。\",\n      \"position_description\": \"分布在组件的四个角，靠近顶部。\",\n      \"parts_used\": [\n        {\n          \"bom_seq\": \"5\",\n          \"bom_name\": \"油缸固定板\",\n          \"quantity\": 4,\n          \"drawing_number\": \"5\",\n          \"node_name\": [\n            \"NAUO17\",\n            \"NAUO16\",\n            \"NAUO8\",\n            \"NAUO7\"\n          ],\n          \"bom_code\": \"01.01.01.11515\"\n        }\n      ],\n      \"tools\": [\n        \"点焊机\",\n        \"定位夹具\"\n      ],\n      \"warnings\": [\n        \"油缸固定板的孔位必须严格对齐，确保后续油缸安装顺畅。\"\n      ],\n      \"welding\": {\n        \"required\": true,\n        \"welding_type\": \"角焊（定位焊）\",\n        \"welding_method\": \"CO2气保焊\",\n        \"weld_size\": \"点焊，焊点长度10-15mm\",\n        \"welding_position\": \"零件5（油缸固定板）与零件2/3的连接处，平焊/横焊\",\n        \"quality_requirements\": \"焊点牢固，保证固定板的孔位精度\",\n        \"safety_notes\": \"使用定位夹具时，确保夹具与焊件接触良好，防止焊接过程中松动。\"\n      },\n      \"safety_warnings\": [\n        \"佩戴防护手套，防止搬运小零件时被锋利边缘割伤。\",\n        \"使用定位夹具时，注意夹紧力度，防止夹具弹开伤人。\",\n        \"点焊时，确保焊枪喷嘴清洁，防止飞溅物过多。\"\n      ]\n    },\n    {\n      \"step_number\": 6,\n      \"action\": \"安装加强板\",\n      \"description\": \"将4块图纸上标注为6号的加强板（01.01.01.11516）安装在组件的内部，用于结构加强，按照图纸上的虚线位置进行定位，并进行点焊固定。\",\n      \"position_description\": \"位于组件内部，连接1号方形板与2号上连接板/3号侧连接板。\",\n      \"parts_used\": [\n        {\n          \"bom_seq\": \"6\",\n          \"bom_name\": \"加强板\",\n          \"quantity\": 4,\n          \"drawing_number\": \"6\",\n          \"node_name\": [\n            \"NAUO12\",\n            \"NAUO11\",\n            \"NAUO10\",\n            \"NAUO9\"\n          ],\n          \"bom_code\": \"01.01.01.11516\"\n        }\n      ],\n      \"tools\": [\n        \"点焊机\"\n      ],\n      \"warnings\": [\n        \"加强板的安装位置应避开后续轴套的焊接区域。\"\n      ],\n      \"welding\": {\n        \"required\": true,\n        \"welding_type\": \"角焊（定位焊）\",\n        \"welding_method\": \"CO2气保焊\",\n        \"weld_size\": \"点焊，焊点长度10-15mm\",\n        \"welding_position\": \"零件6（加强板）与主体结构（零件1/2/3）的连接处，平焊/立焊\",\n        \"quality_requirements\": \"焊点牢固，保证加强板与主体结构紧密贴合\",\n        \"safety_notes\": \"在内部狭小空间进行点焊时，注意保持姿势稳定，避免烫伤。\"\n      },\n      \"safety_warnings\": [\n        \"在组件内部进行点焊，必须确保有足够的局部排风，防止烟尘中毒。\",\n        \"注意焊枪电缆的走线，防止电缆被高温烫伤或被工件压伤。\",\n        \"佩戴防护眼镜，防止焊渣反弹入眼。\"\n      ]\n    },\n    {\n      \"step_number\": 7,\n      \"action\": \"安装角钢\",\n      \"description\": \"将图纸上标注为7号的角钢-机加（01.01.04.0592）安装在组件的顶部，连接2号上连接板，并进行点焊固定。\",\n      \"position_description\": \"位于组件顶部，靠近折弯板4号。\",\n      \"parts_used\": [\n        {\n          \"bom_seq\": \"7\",\n          \"bom_name\": \"角钢-机加\",\n          \"quantity\": 1,\n          \"drawing_number\": \"7\",\n          \"node_name\": [\n            \"NAUO13\"\n          ],\n          \"bom_code\": \"01.01.04.0592\"\n        }\n      ],\n      \"tools\": [\n        \"点焊机\"\n      ],\n      \"warnings\": [\n        \"确保角钢与上连接板的接触面贴合紧密。\"\n      ],\n      \"welding\": {\n        \"required\": true,\n        \"welding_type\": \"角焊（定位焊）\",\n        \"welding_method\": \"CO2气保焊\",\n        \"weld_size\": \"点焊，焊点长度10-15mm\",\n        \"welding_position\": \"零件7（角钢）与零件2（上连接板）的连接处，平焊\",\n        \"quality_requirements\": \"焊点牢固，保证角钢定位准确\",\n        \"safety_notes\": \"清理角钢表面的油污和锈蚀，避免焊接时产生大量烟雾和气孔。\"\n      },\n      \"safety_warnings\": [\n        \"清理油污时，佩戴防护手套和眼镜，避免接触刺激性溶剂。\",\n        \"点焊时，注意保持身体平衡，防止因操作不当导致跌倒或烫伤。\"\n      ]\n    },\n    {\n      \"step_number\": 8,\n      \"action\": \"安装轴套（8号）\",\n      \"description\": \"将图纸上标注为8号的轴套（01.01.02.1221）安装在3号侧连接板的下部孔位，确保轴套中心线与侧连接板垂直，并进行点焊固定。\",\n      \"position_description\": \"位于3号侧连接板的下部，左右各一个。\",\n      \"parts_used\": [\n        {\n          \"bom_seq\": \"8\",\n          \"bom_name\": \"轴套 1\",\n          \"quantity\": 1,\n          \"drawing_number\": \"8\",\n          \"node_name\": [\n            \"NAUO14\"\n          ],\n          \"bom_code\": \"01.01.02.1221\"\n        }\n      ],\n      \"tools\": [\n        \"点焊机\",\n        \"定位销\"\n      ],\n      \"warnings\": [\n        \"轴套的安装方向和伸出长度必须符合图纸要求。\"\n      ],\n      \"welding\": {\n        \"required\": true,\n        \"welding_type\": \"角焊（定位焊）\",\n        \"welding_method\": \"CO2气保焊\",\n        \"weld_size\": \"点焊，焊点长度5-10mm\",\n        \"welding_position\": \"零件8（轴套）与零件3（侧连接板）的连接处，环形角焊（定位），平焊/横焊\",\n        \"quality_requirements\": \"焊点牢固，使用定位销或工装保证轴套的垂直度\",\n        \"safety_notes\": \"轴套为机加工件，点焊时电流不宜过大，防止烧穿或严重变形。\"\n      },\n      \"safety_warnings\": [\n        \"轴套为精密件，搬运时轻拿轻放，防止砸伤脚部。\",\n        \"点焊时，注意控制热量，防止轴套因热变形导致定位销卡死或弹出伤人。\",\n        \"使用定位销时，确保定位销稳固，防止轴套在焊接过程中松动。\"\n      ]\n    },\n    {\n      \"step_number\": 9,\n      \"action\": \"安装后座轴套（9号）\",\n      \"description\": \"将图纸上标注为9号的后座轴套 1（01.02.02.0490）安装在3号侧连接板的上部孔位，确保轴套中心线与侧连接板垂直，并进行点焊固定。\",\n      \"position_description\": \"位于3号侧连接板的上部，左右各一个。\",\n      \"parts_used\": [\n        {\n          \"bom_seq\": \"9\",\n          \"bom_name\": \"后座轴套 1\",\n          \"quantity\": 1,\n          \"drawing_number\": \"9\",\n          \"node_name\": [\n            \"NAUO15\"\n          ],\n          \"bom_code\": \"01.02.02.0490\"\n        }\n      ],\n      \"tools\": [\n        \"点焊机\",\n        \"定位销\"\n      ],\n      \"warnings\": [\n        \"轴套的同轴度要求高，需使用专用工装或定位销辅助。\"\n      ],\n      \"welding\": {\n        \"required\": true,\n        \"welding_type\": \"角焊（定位焊）\",\n        \"welding_method\": \"CO2气保焊\",\n        \"weld_size\": \"点焊，焊点长度5-10mm\",\n        \"welding_position\": \"零件9（后座轴套）与零件3（侧连接板）的连接处，环形角焊（定位），平焊/横焊\",\n        \"quality_requirements\": \"焊点牢固，必须保证轴套与零件8的同轴度要求\",\n        \"safety_notes\": \"定位焊后，立即检查轴套的定位精度，防止因热变形导致偏差。\"\n      },\n      \"safety_warnings\": [\n        \"轴套定位时，注意手指不要被轴套和孔位夹伤。\",\n        \"点焊后轴套温度较高，清理或检查时必须佩戴隔热手套，防止烫伤。\",\n        \"确保定位销在焊接前已取出，防止定位销被焊死或损坏。\"\n      ]\n    },\n    {\n      \"step_number\": 10,\n      \"action\": \"安装后座轴套（10号）\",\n      \"description\": \"将图纸上标注为10号的后座轴套 1（01.01.02.0337）安装在4号折弯板的顶部孔位，确保轴套中心线与折弯板垂直，并进行点焊固定。\",\n      \"position_description\": \"位于4号折弯板的顶部。\",\n      \"parts_used\": [\n        {\n          \"bom_seq\": \"10\",\n          \"bom_name\": \"后座轴套 1\",\n          \"quantity\": 1,\n          \"drawing_number\": \"10\",\n          \"node_name\": [\n            \"NAUO18\"\n          ],\n          \"bom_code\": \"01.01.02.0337\"\n        }\n      ],\n      \"tools\": [\n        \"点焊机\",\n        \"定位销\"\n      ],\n      \"warnings\": [\n        \"确保轴套与折弯板的焊接牢固，且不影响后续装配。\"\n      ],\n      \"welding\": {\n        \"required\": true,\n        \"welding_type\": \"角焊（定位焊）\",\n        \"welding_method\": \"CO2气保焊\",\n        \"weld_size\": \"点焊，焊点长度5-10mm\",\n        \"welding_position\": \"零件10（后座轴套）与零件4（折弯板）的连接处，环形角焊（定位），平焊\",\n        \"quality_requirements\": \"焊点牢固，保证轴套的垂直度\",\n        \"safety_notes\": \"轴套孔内可能残留油污，点焊前需彻底清理，避免产生气孔。\"\n      },\n      \"safety_warnings\": [\n        \"清理油污时，使用不易燃的清洗剂，并确保通风。\",\n        \"点焊操作时，注意防止焊枪或焊丝意外接触到身体，造成灼伤。\",\n        \"工作区域保持整洁，避免电缆、气管绊倒人员。\"\n      ]\n    },\n    {\n      \"step_number\": 11,\n      \"action\": \"满焊所有零件\",\n      \"description\": \"在所有零件点焊固定后，按照焊接工艺要求，对所有连接部位进行满焊。焊接顺序应遵循先内后外、先主后次的原则，以减少焊接变形。\",\n      \"position_description\": \"所有连接面。\",\n      \"parts_used\": [],\n      \"tools\": [\n        \"焊机\",\n        \"焊条/焊丝\",\n        \"焊工防护用品\"\n      ],\n      \"warnings\": [\n        \"焊接过程中注意控制热输入，防止结构件变形。轴套焊接需保证同轴度。\"\n      ],\n      \"welding\": {\n        \"required\": true,\n        \"welding_type\": \"角焊/环形角焊\",\n        \"welding_method\": \"CO2气保焊 (MAG)\",\n        \"weld_size\": \"焊脚高度6mm（根据图纸要求），连续满焊\",\n        \"welding_position\": \"所有零件连接处，涉及平焊、横焊、立焊\",\n        \"quality_requirements\": \"焊缝外观成型良好，焊缝饱满、连续，无气孔、夹渣、裂纹等缺陷。轴套焊缝需保证同轴度，并进行外观检查和渗透探伤（PT）或磁粉探伤（MT）。\",\n        \"safety_notes\": \"进行满焊时，需穿戴全套防护服、焊接面罩和手套。确保工作区域有强制通风设备，防止烟尘中毒。注意焊枪电缆和气管的保护，避免磨损和漏气。\"\n      },\n      \"safety_warnings\": [\n        \"必须穿戴全套焊接防护用品（面罩、手套、防护服），防止电弧光和高温灼伤。\",\n        \"确保焊接区域通风良好，使用局部排风装置，防止吸入有毒烟尘。\",\n        \"检查气瓶压力和连接，防止气体泄漏或爆炸风险。\",\n        \"焊接过程中，注意防止焊渣飞溅到电缆、气管或易燃物上，引发火灾。\"\n      ]\n    },\n    {\n      \"step_number\": 12,\n      \"action\": \"清理与打磨\",\n      \"description\": \"焊接完成后，清理所有焊渣、飞溅物，并对焊缝进行打磨，去除尖锐棱角，达到图纸要求的表面粗糙度。\",\n      \"position_description\": \"所有焊缝区域。\",\n      \"parts_used\": [],\n      \"tools\": [\n        \"角磨机\",\n        \"钢丝刷\",\n        \"除渣锤\"\n      ],\n      \"warnings\": [\n        \"打磨时注意保护轴套孔位，避免损伤。\"\n      ],\n      \"safety_warnings\": [\n        \"使用角磨机时，必须佩戴防护眼镜和面屏，防止高速飞溅的火花和金属碎屑伤眼。\",\n        \"打磨时双手握紧角磨机，站稳，防止机器反弹失控造成机械伤害。\",\n        \"清理焊渣时，佩戴防护手套，防止被尖锐焊渣或高温焊缝烫伤。\",\n        \"打磨作业产生的粉尘较大，建议佩戴防尘口罩。\"\n      ]\n    }\n  ]\n}\n```",
  "parsed_result": {
    "enhanced_steps": [
      {
        "step_number": 1,
        "action": "放置基准件",
        "description": "将图纸上标注为1号的方形板-机加（01.01.01.11511）平稳放置在装配工作台上，作为整个组件的装配基准。",
        "position_description": "工作台中心，确保水平。",
        "parts_used": [
          {
            "bom_seq": "1",
            "bom_name": "方形板-机加",
            "quantity": 1,
            "drawing_number": "1",
            "node_name": [
              "NAUO1"
            ],
            "bom_code": "01.01.01.11511"
          }
        ],
        "tools": [
          "行车",
          "吊具",
          "水平仪"
        ],
        "warnings": [
          "注意吊装安全，确保基准件放置平稳。"
        ],
        "safety_warnings": [
          "吊装前检查行车和吊具是否完好，防止吊物坠落伤人。",
          "指挥人员和操作人员必须佩戴安全帽，并使用规范的指挥手势。",
          "重物搬运时，注意身体姿势，防止扭伤或砸伤脚部。"
        ]
      },
      {
        "step_number": 2,
        "action": "安装上连接板",
        "description": "将2块图纸上标注为2号的上连接板（01.01.01.11512）分别放置在1号方形板的顶部两侧，按照图纸尺寸（如436mm、355mm等）进行定位，并进行点焊固定。",
        "position_description": "位于1号方形板的顶部边缘，两侧对称。",
        "parts_used": [
          {
            "bom_seq": "2",
            "bom_name": "上连接板",
            "quantity": 2,
            "drawing_number": "2",
            "node_name": [
              "NAUO3",
              "NAUO2"
            ],
            "bom_code": "01.01.01.11512"
          }
        ],
        "tools": [
          "卷尺",
          "直角尺",
          "点焊机"
        ],
        "warnings": [
          "点焊前必须确保定位准确，特别是与1号板的垂直度。"
        ],
        "welding": {
          "required": true,
          "welding_type": "角焊（定位焊）",
          "welding_method": "CO2气保焊",
          "weld_size": "点焊，焊点长度10-15mm",
          "welding_position": "零件1（方形板）与零件2（上连接板）的连接处，平焊/横焊",
          "quality_requirements": "焊点牢固，能承受后续装配应力，无裂纹",
          "safety_notes": "佩戴焊接面罩和防护手套，确保工作区域通风良好，防止火花飞溅。"
        },
        "safety_warnings": [
          "佩戴焊接面罩和防护手套，防止弧光灼伤眼睛和皮肤。",
          "确保焊机接地良好，防止漏电触电。",
          "点焊时注意焊渣飞溅，周围不得有易燃易爆物品。"
        ]
      },
      {
        "step_number": 3,
        "action": "安装侧连接板",
        "description": "将2块图纸上标注为3号的侧连接板（01.01.01.11513）分别放置在1号方形板的左右两侧，与2号上连接板形成直角结构，并进行点焊固定。",
        "position_description": "位于1号方形板的左右两侧，与2号板连接。",
        "parts_used": [
          {
            "bom_seq": "3",
            "bom_name": "侧连接板",
            "quantity": 2,
            "drawing_number": "3",
            "node_name": [
              "NAUO5",
              "NAUO4"
            ],
            "bom_code": "01.01.01.11513"
          }
        ],
        "tools": [
          "直角尺",
          "点焊机"
        ],
        "warnings": [
          "确保侧连接板与方形板的垂直度，以及与上连接板的对齐。"
        ],
        "welding": {
          "required": true,
          "welding_type": "角焊（定位焊）",
          "welding_method": "CO2气保焊",
          "weld_size": "点焊，焊点长度10-15mm",
          "welding_position": "零件1（方形板）与零件3（侧连接板）的连接处，平焊/横焊",
          "quality_requirements": "焊点牢固，保证结构件的垂直度（90度）",
          "safety_notes": "点焊时注意保持身体稳定，避免电弧光直接照射皮肤。"
        },
        "safety_warnings": [
          "佩戴焊接面罩和防护手套，防止弧光和高温烫伤。",
          "检查焊枪和电缆绝缘层，防止破损导致触电。",
          "确保工件稳定，防止点焊过程中倾倒或位移造成挤伤。"
        ]
      },
      {
        "step_number": 4,
        "action": "安装折弯板",
        "description": "将图纸上标注为4号的折弯板（01.01.01.11514）安装在2号上连接板的内侧，按照图纸尺寸进行定位，并进行点焊固定。",
        "position_description": "位于组件顶部，连接两块2号上连接板的内部。",
        "parts_used": [
          {
            "bom_seq": "4",
            "bom_name": "折弯板",
            "quantity": 1,
            "drawing_number": "4",
            "node_name": [
              "NAUO6"
            ],
            "bom_code": "01.01.01.11514"
          }
        ],
        "tools": [
          "卷尺",
          "点焊机"
        ],
        "warnings": [
          "折弯板的定位孔必须与图纸要求对齐。"
        ],
        "welding": {
          "required": true,
          "welding_type": "角焊（定位焊）",
          "welding_method": "CO2气保焊",
          "weld_size": "点焊，焊点长度10-15mm",
          "welding_position": "零件4（折弯板）与零件2（上连接板）的连接处，平焊",
          "quality_requirements": "焊点牢固，保证折弯板的水平位置",
          "safety_notes": "检查焊机接地线是否连接可靠，防止触电。"
        },
        "safety_warnings": [
          "佩戴防护眼镜和手套，防止零件边缘割伤。",
          "在内部空间点焊时，注意头部和身体姿势，防止碰撞受伤。",
          "确保通风良好，避免焊接烟尘在内部聚集。"
        ]
      },
      {
        "step_number": 5,
        "action": "安装油缸固定板",
        "description": "将4块图纸上标注为5号的油缸固定板（01.01.01.11515）分别安装在2号上连接板和3号侧连接板的指定位置，用于油缸连接，并进行点焊固定。",
        "position_description": "分布在组件的四个角，靠近顶部。",
        "parts_used": [
          {
            "bom_seq": "5",
            "bom_name": "油缸固定板",
            "quantity": 4,
            "drawing_number": "5",
            "node_name": [
              "NAUO17",
              "NAUO16",
              "NAUO8",
              "NAUO7"
            ],
            "bom_code": "01.01.01.11515"
          }
        ],
        "tools": [
          "点焊机",
          "定位夹具"
        ],
        "warnings": [
          "油缸固定板的孔位必须严格对齐，确保后续油缸安装顺畅。"
        ],
        "welding": {
          "required": true,
          "welding_type": "角焊（定位焊）",
          "welding_method": "CO2气保焊",
          "weld_size": "点焊，焊点长度10-15mm",
          "welding_position": "零件5（油缸固定板）与零件2/3的连接处，平焊/横焊",
          "quality_requirements": "焊点牢固，保证固定板的孔位精度",
          "safety_notes": "使用定位夹具时，确保夹具与焊件接触良好，防止焊接过程中松动。"
        },
        "safety_warnings": [
          "佩戴防护手套，防止搬运小零件时被锋利边缘割伤。",
          "使用定位夹具时，注意夹紧力度，防止夹具弹开伤人。",
          "点焊时，确保焊枪喷嘴清洁，防止飞溅物过多。"
        ]
      },
      {
        "step_number": 6,
        "action": "安装加强板",
        "description": "将4块图纸上标注为6号的加强板（01.01.01.11516）安装在组件的内部，用于结构加强，按照图纸上的虚线位置进行定位，并进行点焊固定。",
        "position_description": "位于组件内部，连接1号方形板与2号上连接板/3号侧连接板。",
        "parts_used": [
          {
            "bom_seq": "6",
            "bom_name": "加强板",
            "quantity": 4,
            "drawing_number": "6",
            "node_name": [
              "NAUO12",
              "NAUO11",
              "NAUO10",
              "NAUO9"
            ],
            "bom_code": "01.01.01.11516"
          }
        ],
        "tools": [
          "点焊机"
        ],
        "warnings": [
          "加强板的安装位置应避开后续轴套的焊接区域。"
        ],
        "welding": {
          "required": true,
          "welding_type": "角焊（定位焊）",
          "welding_method": "CO2气保焊",
          "weld_size": "点焊，焊点长度10-15mm",
          "welding_position": "零件6（加强板）与主体结构（零件1/2/3）的连接处，平焊/立焊",
          "quality_requirements": "焊点牢固，保证加强板与主体结构紧密贴合",
          "safety_notes": "在内部狭小空间进行点焊时，注意保持姿势稳定，避免烫伤。"
        },
        "safety_warnings": [
          "在组件内部进行点焊，必须确保有足够的局部排风，防止烟尘中毒。",
          "注意焊枪电缆的走线，防止电缆被高温烫伤或被工件压伤。",
          "佩戴防护眼镜，防止焊渣反弹入眼。"
        ]
      },
      {
        "step_number": 7,
        "action": "安装角钢",
        "description": "将图纸上标注为7号的角钢-机加（01.01.04.0592）安装在组件的顶部，连接2号上连接板，并进行点焊固定。",
        "position_description": "位于组件顶部，靠近折弯板4号。",
        "parts_used": [
          {
            "bom_seq": "7",
            "bom_name": "角钢-机加",
            "quantity": 1,
            "drawing_number": "7",
            "node_name": [
              "NAUO13"
            ],
            "bom_code": "01.01.04.0592"
          }
        ],
        "tools": [
          "点焊机"
        ],
        "warnings": [
          "确保角钢与上连接板的接触面贴合紧密。"
        ],
        "welding": {
          "required": true,
          "welding_type": "角焊（定位焊）",
          "welding_method": "CO2气保焊",
          "weld_size": "点焊，焊点长度10-15mm",
          "welding_position": "零件7（角钢）与零件2（上连接板）的连接处，平焊",
          "quality_requirements": "焊点牢固，保证角钢定位准确",
          "safety_notes": "清理角钢表面的油污和锈蚀，避免焊接时产生大量烟雾和气孔。"
        },
        "safety_warnings": [
          "清理油污时，佩戴防护手套和眼镜，避免接触刺激性溶剂。",
          "点焊时，注意保持身体平衡，防止因操作不当导致跌倒或烫伤。"
        ]
      },
      {
        "step_number": 8,
        "action": "安装轴套（8号）",
        "description": "将图纸上标注为8号的轴套（01.01.02.1221）安装在3号侧连接板的下部孔位，确保轴套中心线与侧连接板垂直，并进行点焊固定。",
        "position_description": "位于3号侧连接板的下部，左右各一个。",
        "parts_used": [
          {
            "bom_seq": "8",
            "bom_name": "轴套 1",
            "quantity": 1,
            "drawing_number": "8",
            "node_name": [
              "NAUO14"
            ],
            "bom_code": "01.01.02.1221"
          }
        ],
        "tools": [
          "点焊机",
          "定位销"
        ],
        "warnings": [
          "轴套的安装方向和伸出长度必须符合图纸要求。"
        ],
        "welding": {
          "required": true,
          "welding_type": "角焊（定位焊）",
          "welding_method": "CO2气保焊",
          "weld_size": "点焊，焊点长度5-10mm",
          "welding_position": "零件8（轴套）与零件3（侧连接板）的连接处，环形角焊（定位），平焊/横焊",
          "quality_requirements": "焊点牢固，使用定位销或工装保证轴套的垂直度",
          "safety_notes": "轴套为机加工件，点焊时电流不宜过大，防止烧穿或严重变形。"
        },
        "safety_warnings": [
          "轴套为精密件，搬运时轻拿轻放，防止砸伤脚部。",
          "点焊时，注意控制热量，防止轴套因热变形导致定位销卡死或弹出伤人。",
          "使用定位销时，确保定位销稳固，防止轴套在焊接过程中松动。"
        ]
      },
      {
        "step_number": 9,
        "action": "安装后座轴套（9号）",
        "description": "将图纸上标注为9号的后座轴套 1（01.02.02.0490）安装在3号侧连接板的上部孔位，确保轴套中心线与侧连接板垂直，并进行点焊固定。",
        "position_description": "位于3号侧连接板的上部，左右各一个。",
        "parts_used": [
          {
            "bom_seq": "9",
            "bom_name": "后座轴套 1",
            "quantity": 1,
            "drawing_number": "9",
            "node_name": [
              "NAUO15"
            ],
            "bom_code": "01.02.02.0490"
          }
        ],
        "tools": [
          "点焊机",
          "定位销"
        ],
        "warnings": [
          "轴套的同轴度要求高，需使用专用工装或定位销辅助。"
        ],
        "welding": {
          "required": true,
          "welding_type": "角焊（定位焊）",
          "welding_method": "CO2气保焊",
          "weld_size": "点焊，焊点长度5-10mm",
          "welding_position": "零件9（后座轴套）与零件3（侧连接板）的连接处，环形角焊（定位），平焊/横焊",
          "quality_requirements": "焊点牢固，必须保证轴套与零件8的同轴度要求",
          "safety_notes": "定位焊后，立即检查轴套的定位精度，防止因热变形导致偏差。"
        },
        "safety_warnings": [
          "轴套定位时，注意手指不要被轴套和孔位夹伤。",
          "点焊后轴套温度较高，清理或检查时必须佩戴隔热手套，防止烫伤。",
          "确保定位销在焊接前已取出，防止定位销被焊死或损坏。"
        ]
      },
      {
        "step_number": 10,
        "action": "安装后座轴套（10号）",
        "description": "将图纸上标注为10号的后座轴套 1（01.01.02.0337）安装在4号折弯板的顶部孔位，确保轴套中心线与折弯板垂直，并进行点焊固定。",
        "position_description": "位于4号折弯板的顶部。",
        "parts_used": [
          {
            "bom_seq": "10",
            "bom_name": "后座轴套 1",
            "quantity": 1,
            "drawing_number": "10",
            "node_name": [
              "NAUO18"
            ],
            "bom_code": "01.01.02.0337"
          }
        ],
        "tools": [
          "点焊机",
          "定位销"
        ],
        "warnings": [
          "确保轴套与折弯板的焊接牢固，且不影响后续装配。"
        ],
        "welding": {
          "required": true,
          "welding_type": "角焊（定位焊）",
          "welding_method": "CO2气保焊",
          "weld_size": "点焊，焊点长度5-10mm",
          "welding_position": "零件10（后座轴套）与零件4（折弯板）的连接处，环形角焊（定位），平焊",
          "quality_requirements": "焊点牢固，保证轴套的垂直度",
          "safety_notes": "轴套孔内可能残留油污，点焊前需彻底清理，避免产生气孔。"
        },
        "safety_warnings": [
          "清理油污时，使用不易燃的清洗剂，并确保通风。",
          "点焊操作时，注意防止焊枪或焊丝意外接触到身体，造成灼伤。",
          "工作区域保持整洁，避免电缆、气管绊倒人员。"
        ]
      },
      {
        "step_number": 11,
        "action": "满焊所有零件",
        "description": "在所有零件点焊固定后，按照焊接工艺要求，对所有连接部位进行满焊。焊接顺序应遵循先内后外、先主后次的原则，以减少焊接变形。",
        "position_description": "所有连接面。",
        "parts_used": [],
        "tools": [
          "焊机",
          "焊条/焊丝",
          "焊工防护用品"
        ],
        "warnings": [
          "焊接过程中注意控制热输入，防止结构件变形。轴套焊接需保证同轴度。"
        ],
        "welding": {
          "required": true,
          "welding_type": "角焊/环形角焊",
          "welding_method": "CO2气保焊 (MAG)",
          "weld_size": "焊脚高度6mm（根据图纸要求），连续满焊",
          "welding_position": "所有零件连接处，涉及平焊、横焊、立焊",
          "quality_requirements": "焊缝外观成型良好，焊缝饱满、连续，无气孔、夹渣、裂纹等缺陷。轴套焊缝需保证同轴度，并进行外观检查和渗透探伤（PT）或磁粉探伤（MT）。",
          "safety_notes": "进行满焊时，需穿戴全套防护服、焊接面罩和手套。确保工作区域有强制通风设备，防止烟尘中毒。注意焊枪电缆和气管的保护，避免磨损和漏气。"
        },
        "safety_warnings": [
          "必须穿戴全套焊接防护用品（面罩、手套、防护服），防止电弧光和高温灼伤。",
          "确保焊接区域通风良好，使用局部排风装置，防止吸入有毒烟尘。",
          "检查气瓶压力和连接，防止气体泄漏或爆炸风险。",
          "焊接过程中，注意防止焊渣飞溅到电缆、气管或易燃物上，引发火灾。"
        ]
      },
      {
        "step_number": 12,
        "action": "清理与打磨",
        "description": "焊接完成后，清理所有焊渣、飞溅物，并对焊缝进行打磨，去除尖锐棱角，达到图纸要求的表面粗糙度。",
        "position_description": "所有焊缝区域。",
        "parts_used": [],
        "tools": [
          "角磨机",
          "钢丝刷",
          "除渣锤"
        ],
        "warnings": [
          "打磨时注意保护轴套孔位，避免损伤。"
        ],
        "safety_warnings": [
          "使用角磨机时，必须佩戴防护眼镜和面屏，防止高速飞溅的火花和金属碎屑伤眼。",
          "打磨时双手握紧角磨机，站稳，防止机器反弹失控造成机械伤害。",
          "清理焊渣时，佩戴防护手套，防止被尖锐焊渣或高温焊缝烫伤。",
          "打磨作业产生的粉尘较大，建议佩戴防尘口罩。"
        ]
      }
    ]
  }
}